NZ_JAMQFV010000008.1_1|2|304|-1|ID=1_1;partial=00;start_type=ATG;rbs_motif=AGGAGG;rbs_spacer=5-10bp;gc_cont=0.617	WP_003403581.1 MULTISPECIES: 50S ribosomal protein L23 [Mycobacterium]	100	99.0	1.17e-62
NZ_JAMQFV010000008.1_2|304|975|-1|ID=1_2;partial=00;start_type=ATG;rbs_motif=GGAG/GAGG;rbs_spacer=5-10bp;gc_cont=0.673	WP_003403580.1 MULTISPECIES: 50S ribosomal protein L4 [Mycobacterium]	100	99.6	1.29e-148
NZ_JAMQFV010000008.1_3|975|1628|-1|ID=1_3;partial=00;start_type=ATG;rbs_motif=GGA/GAG/AGG;rbs_spacer=5-10bp;gc_cont=0.641	WP_070896942.1 50S ribosomal protein L3 [Mycobacterium tuberculosis]	96.8	99.5	4.48e-137
NZ_JAMQFV010000008.1_4|1645|1950|-1|ID=1_4;partial=00;start_type=GTG;rbs_motif=GGAG/GAGG;rbs_spacer=5-10bp;gc_cont=0.611	WP_003403578.1 MULTISPECIES: 30S ribosomal protein S10 [Mycobacterium]	100	99.0	7.86e-66
NZ_JAMQFV010000008.1_6|4065|5423|-1|ID=1_6;partial=00;start_type=ATG;rbs_motif=GGA/GAG/AGG;rbs_spacer=5-10bp;gc_cont=0.636	WP_003901900.1 MULTISPECIES: mycofactocin dehydrogenase MftG [Mycobacterium]	100	99.8	0.0
NZ_JAMQFV010000008.1_7|5506|6918|-1|ID=1_7;partial=00;start_type=ATG;rbs_motif=AGGAG/GGAGG;rbs_spacer=11-12bp;gc_cont=0.663	WP_003403501.1 MULTISPECIES: mycofactocin biosynthesis glycosyltransferase MftF [Mycobacterium]	100	99.8	0.0
NZ_JAMQFV010000008.1_8|6967|7632|-1|ID=1_8;partial=00;start_type=GTG;rbs_motif=None;rbs_spacer=None;gc_cont=0.695	WP_003403497.1 MULTISPECIES: mycofactocin biosynthesis peptidyl-dipeptidase MftE [Mycobacterium]	99.5	99.5	7.00e-159
NZ_JAMQFV010000008.1_9|7912|9102|-1|ID=1_9;partial=00;start_type=GTG;rbs_motif=None;rbs_spacer=None;gc_cont=0.655	WP_003898557.1 MULTISPECIES: pre-mycofactocin synthase MftD [Mycobacterium]	100	99.7	1.22e-283
NZ_JAMQFV010000008.1_10|9105|10280|-1|ID=1_10;partial=00;start_type=ATG;rbs_motif=None;rbs_spacer=None;gc_cont=0.660	WP_003403490.1 MULTISPECIES: mycofactocin radical SAM maturase [Mycobacterium]	100	99.7	1.19e-292
NZ_JAMQFV010000008.1_11|10277|10606|-1|ID=1_11;partial=00;start_type=GTG;rbs_motif=None;rbs_spacer=None;gc_cont=0.636	WP_003403486.1 MULTISPECIES: mycofactocin biosynthesis chaperone MftB [Mycobacterium]	100	99.1	1.46e-76
NZ_JAMQFV010000008.1_12|10591|10680|-1|ID=1_12;partial=00;start_type=ATG;rbs_motif=GGA/GAG/AGG;rbs_spacer=5-10bp;gc_cont=0.533	WP_003403483.1 MULTISPECIES: mycofactocin precursor MftA [Mycobacteriaceae]	100	96.7	6.18e-12
NZ_JAMQFV010000008.1_13|10771|11367|1|ID=1_13;partial=00;start_type=ATG;rbs_motif=GGA/GAG/AGG;rbs_spacer=5-10bp;gc_cont=0.603	WP_003905369.1 MULTISPECIES: mycofactocin system transcriptional regulator [Mycobacterium]	100	99.5	8.99e-139
NZ_JAMQFV010000008.1_14|11364|12413|1|ID=1_14;partial=00;start_type=GTG;rbs_motif=GGA/GAG/AGG;rbs_spacer=11-12bp;gc_cont=0.672	WP_003403477.1 MULTISPECIES: DUF2332 domain-containing protein [Mycobacterium]	100	99.7	6.24e-260
NZ_JAMQFV010000008.1_15|13017|13265|-1|ID=1_15;partial=00;start_type=GTG;rbs_motif=GGA/GAG/AGG;rbs_spacer=5-10bp;gc_cont=0.739	WP_178121162.1 MULTISPECIES: hypothetical protein [Mycobacterium]	100	98.8	3.88e-55
NZ_JAMQFV010000008.1_16|13277|14497|-1|ID=1_16;partial=00;start_type=ATG;rbs_motif=None;rbs_spacer=None;gc_cont=0.648	WP_003901000.1 MULTISPECIES: NAD(P)/FAD-dependent oxidoreductase [Mycobacterium]	100	99.8	3.04e-289
NZ_JAMQFV010000008.1_17|14511|15257|-1|ID=1_17;partial=00;start_type=GTG;rbs_motif=AGGA/GGAG/GAGG;rbs_spacer=11-12bp;gc_cont=0.633	WP_234883349.1 Rv0687 family mycofactocin-dependent SDR oxidoreductase, partial [Mycobacterium tuberculosis]	99.6	99.6	2.52e-172
NZ_JAMQFV010000008.1_18|15491|16288|-1|ID=1_18;partial=00;start_type=GTG;rbs_motif=AGGAG;rbs_spacer=5-10bp;gc_cont=0.610	WP_003403465.1 MULTISPECIES: SHOCT domain-containing protein [Mycobacterium]	100	99.6	1.27e-169
NZ_JAMQFV010000008.1_19|16426|17616|-1|ID=1_19;partial=00;start_type=GTG;rbs_motif=AGGAG;rbs_spacer=5-10bp;gc_cont=0.641	WP_003403463.1 MULTISPECIES: elongation factor Tu [Mycobacterium]	100	99.7	1.05e-284
NZ_JAMQFV010000008.1_20|17847|19952|-1|ID=1_20;partial=00;start_type=GTG;rbs_motif=GGA/GAG/AGG;rbs_spacer=5-10bp;gc_cont=0.623	WP_003898554.1 MULTISPECIES: elongation factor G [Mycobacterium]	100	99.9	0.0
NZ_JAMQFV010000008.1_21|20033|20503|-1|ID=1_21;partial=00;start_type=ATG;rbs_motif=AGGAG;rbs_spacer=5-10bp;gc_cont=0.633	WP_003403456.1 MULTISPECIES: 30S ribosomal protein S7 [Mycobacterium]	100	99.4	8.84e-105
NZ_JAMQFV010000008.1_22|20503|20877|-1|ID=1_22;partial=00;start_type=ATG;rbs_motif=None;rbs_spacer=None;gc_cont=0.627	WP_016721176.1 MULTISPECIES: 30S ribosomal protein S12 [Mycobacterium]	100	99.2	1.13e-78
NZ_JAMQFV010000008.1_23|21126|21782|-1|ID=1_23;partial=00;start_type=ATG;rbs_motif=GGA/GAG/AGG;rbs_spacer=5-10bp;gc_cont=0.662	WP_349649744.1 TetR/AcrR family transcriptional regulator [Mycobacterium canetti]	99.1	99.5	7.25e-148
NZ_JAMQFV010000008.1_24|22021|22395|1|ID=1_24;partial=00;start_type=GTG;rbs_motif=AGxAGG/AGGxGG;rbs_spacer=5-10bp;gc_cont=0.632	WP_003403448.1 MULTISPECIES: DUF3060 domain-containing protein [Mycobacterium]	100	99.2	1.49e-83
NZ_JAMQFV010000008.1_25|22412|22894|1|ID=1_25;partial=00;start_type=TTG;rbs_motif=GGA/GAG/AGG;rbs_spacer=5-10bp;gc_cont=0.646	WP_003901898.1 MULTISPECIES: DUF3060 domain-containing protein [Mycobacterium]	99.4	99.4	4.69e-78
NZ_JAMQFV010000008.1_26|22950|23456|-1|ID=1_26;partial=00;start_type=GTG;rbs_motif=GGA/GAG/AGG;rbs_spacer=3-4bp;gc_cont=0.647	WP_003403442.1 MULTISPECIES: siderophore transport transcriptional regulator MmpR5 [Mycobacteriaceae]	99.4	97.6	9.06e-110
NZ_JAMQFV010000008.1_27|23532|23960|1|ID=1_27;partial=00;start_type=ATG;rbs_motif=GGAG/GAGG;rbs_spacer=5-10bp;gc_cont=0.615	WP_003403439.1 MULTISPECIES: siderophore transporter accessory protein MmpS5 [Mycobacterium]	100	99.3	2.52e-95
NZ_JAMQFV010000008.1_28|23957|26851|1|ID=1_28;partial=00;start_type=ATG;rbs_motif=None;rbs_spacer=None;gc_cont=0.635	WP_003905367.1 MULTISPECIES: siderophore RND transporter MmpL5 [Mycobacterium]	100	99.9	0.0
NZ_JAMQFV010000008.1_29|26863|27654|-1|ID=1_29;partial=00;start_type=ATG;rbs_motif=GGAGG;rbs_spacer=3-4bp;gc_cont=0.698	WP_003403433.1 MULTISPECIES: crotonase/enoyl-CoA hydratase family protein [Mycobacterium]	100	99.6	1.15e-180
NZ_JAMQFV010000008.1_30|27651|28373|-1|ID=1_30;partial=00;start_type=ATG;rbs_motif=None;rbs_spacer=None;gc_cont=0.669	WP_003403429.1 MULTISPECIES: PaaX family transcriptional regulator C-terminal domain-containing protein [Mycobacterium]	100	99.6	7.55e-170
NZ_JAMQFV010000008.1_31|28376|29314|-1|ID=1_31;partial=00;start_type=ATG;rbs_motif=GGA/GAG/AGG;rbs_spacer=5-10bp;gc_cont=0.672	WP_003905366.1 MULTISPECIES: crotonase/enoyl-CoA hydratase family protein [Mycobacterium]	100	99.7	3.87e-224
NZ_JAMQFV010000008.1_32|29325|30953|-1|ID=1_32;partial=00;start_type=ATG;rbs_motif=None;rbs_spacer=None;gc_cont=0.669	WP_234777598.1 acyl-CoA dehydrogenase family protein [Mycobacterium tuberculosis]	100	99.8	0.0
NZ_JAMQFV010000008.1_33|31013|31855|-1|ID=1_33;partial=00;start_type=ATG;rbs_motif=None;rbs_spacer=None;gc_cont=0.660	WP_003403421.1 MULTISPECIES: alpha/beta hydrolase family esterase [Mycobacterium]	100	99.6	1.81e-206
NZ_JAMQFV010000008.1_34|31887|32645|-1|ID=1_34;partial=00;start_type=GTG;rbs_motif=None;rbs_spacer=None;gc_cont=0.659	WP_003403419.1 MULTISPECIES: deoxyribonuclease IV [Mycobacterium]	100	99.6	1.47e-182
NZ_JAMQFV010000008.1_35|32840|34753|1|ID=1_35;partial=00;start_type=ATG;rbs_motif=GGAGG;rbs_spacer=5-10bp;gc_cont=0.653	WP_310903331.1 neutral ceramidase [Mycobacterium tuberculosis]	100	99.8	0.0
NZ_JAMQFV010000008.1_36|34896|35009|-1|ID=1_36;partial=00;start_type=ATG;rbs_motif=GGA/GAG/AGG;rbs_spacer=5-10bp;gc_cont=0.693	WP_235632529.1 DNA-directed RNA polymerase subunit beta' [Mycobacterium tuberculosis]	100	97.4	6.24e-15
NZ_JAMQFV010000008.1_37|35117|39067|-1|ID=1_37;partial=00;start_type=GTG;rbs_motif=GGA/GAG/AGG;rbs_spacer=5-10bp;gc_cont=0.651	WP_003403413.1 MULTISPECIES: DNA-directed RNA polymerase subunit beta' [Mycobacterium]	100	99.9	0.0
NZ_JAMQFV010000008.1_38|39112|42630|-1|ID=1_38;partial=00;start_type=TTG;rbs_motif=AGGA;rbs_spacer=5-10bp;gc_cont=0.643	WP_310909777.1 DNA-directed RNA polymerase subunit beta [Mycobacterium tuberculosis]	100	99.9	0.0
NZ_JAMQFV010000008.1_40|43298|43636|-1|ID=1_40;partial=00;start_type=GTG;rbs_motif=None;rbs_spacer=None;gc_cont=0.649	WP_003403405.1 MULTISPECIES: PIN domain-containing protein [Mycobacterium]	100	99.1	2.06e-64
NZ_JAMQFV010000008.1_41|43937|46300|-1|ID=1_41;partial=00;start_type=ATG;rbs_motif=GGAGG;rbs_spacer=3-4bp;gc_cont=0.643	WP_003901895.1 MULTISPECIES: arylsulfatase AtsD [Mycobacterium]	100	99.9	0.0
NZ_JAMQFV010000008.1_42|46414|46668|1|ID=1_42;partial=00;start_type=ATG;rbs_motif=None;rbs_spacer=None;gc_cont=0.722	WP_003911263.1 MULTISPECIES: antitoxin VapB7 [Mycobacterium]	100	98.8	8.11e-49
NZ_JAMQFV010000008.1_43|46665|47102|1|ID=1_43;partial=00;start_type=ATG;rbs_motif=None;rbs_spacer=None;gc_cont=0.683	WP_003403386.1 MULTISPECIES: type II toxin-antitoxin system VapC family toxin [Mycobacterium]	100	99.3	6.13e-93
NZ_JAMQFV010000008.1_44|47206|47457|1|ID=1_44;partial=00;start_type=ATG;rbs_motif=None;rbs_spacer=None;gc_cont=0.710	WP_015287885.1 ribbon-helix-helix protein, CopG family [Mycobacterium canetti]	98.8	98.8	3.31e-52
NZ_JAMQFV010000008.1_45|47519|47752|1|ID=1_45;partial=00;start_type=GTG;rbs_motif=GGA/GAG/AGG;rbs_spacer=5-10bp;gc_cont=0.654	WP_368627467.1 type II toxin-antitoxin system PemK/MazF family toxin [Mycobacterium tuberculosis]	98.7	98.7	4.79e-45
NZ_JAMQFV010000008.1_46|48028|48744|1|ID=1_46;partial=00;start_type=GTG;rbs_motif=None;rbs_spacer=None;gc_cont=0.654	WP_003403371.1 MULTISPECIES: CPBP family intramembrane glutamic endopeptidase [Mycobacterium]	100	99.6	7.16e-158
NZ_JAMQFV010000008.1_47|48820|48975|1|ID=1_47;partial=00;start_type=GTG;rbs_motif=AGGAG;rbs_spacer=5-10bp;gc_cont=0.647	WP_003403368.1 MULTISPECIES: type II toxin-antitoxin system VapB family antitoxin [Mycobacterium]	100	98.1	2.18e-25
NZ_JAMQFV010000008.1_48|49202|49453|1|ID=1_48;partial=00;start_type=ATG;rbs_motif=GGA/GAG/AGG;rbs_spacer=5-10bp;gc_cont=0.647	WP_031727358.1 ribonuclease [Mycobacterium tuberculosis]	100	98.8	1.11e-52
NZ_JAMQFV010000008.1_49|49841|50851|-1|ID=1_49;partial=00;start_type=ATG;rbs_motif=AGxAGG/AGGxGG;rbs_spacer=5-10bp;gc_cont=0.633	WP_003911248.1 MULTISPECIES: ABC transporter ATP-binding protein [Mycobacterium]	100	99.7	2.76e-236
NZ_JAMQFV010000008.1_50|50932|52437|-1|ID=1_50;partial=00;start_type=ATG;rbs_motif=AGGAG;rbs_spacer=5-10bp;gc_cont=0.668	WP_003403360.1 MULTISPECIES: carotenoid cleavage oxygenase [Mycobacterium]	100	99.8	0.0
NZ_JAMQFV010000008.1_51|52508|53203|1|ID=1_51;partial=00;start_type=ATG;rbs_motif=GGA/GAG/AGG;rbs_spacer=11-12bp;gc_cont=0.671	WP_003403355.1 MULTISPECIES: TetR/AcrR family transcriptional regulator [Mycobacterium]	100	99.6	1.25e-159
NZ_JAMQFV010000008.1_52|53196|53588|-1|ID=1_52;partial=00;start_type=ATG;rbs_motif=AGGA;rbs_spacer=5-10bp;gc_cont=0.674	WP_003403353.1 MULTISPECIES: 50S ribosomal protein L7/L12 [Mycobacterium]	100	99.2	8.90e-63
NZ_JAMQFV010000008.1_53|53625|54161|-1|ID=1_53;partial=00;start_type=ATG;rbs_motif=AGGAG;rbs_spacer=5-10bp;gc_cont=0.672	WP_003403341.1 MULTISPECIES: 50S ribosomal protein L10 [Mycobacterium]	100	99.4	3.17e-111
NZ_JAMQFV010000008.1_54|54492|55400|-1|ID=1_54;partial=00;start_type=ATG;rbs_motif=None;rbs_spacer=None;gc_cont=0.751	WP_003403330.1 MULTISPECIES: ROK family protein [Mycobacterium]	100	99.7	6.03e-207
NZ_JAMQFV010000008.1_55|55400|56074|-1|ID=1_55;partial=00;start_type=ATG;rbs_motif=GGA/GAG/AGG;rbs_spacer=5-10bp;gc_cont=0.770	WP_003403326.1 MULTISPECIES: DUF7158 domain-containing protein [Mycobacterium]	100	99.6	3.16e-145
NZ_JAMQFV010000008.1_56|56071|60267|-1|ID=1_56;partial=00;start_type=ATG;rbs_motif=GGA/GAG/AGG;rbs_spacer=5-10bp;gc_cont=0.717	WP_003917325.1 MULTISPECIES: NEW3 domain-containing protein [Mycobacterium]	100	99.9	0.0
NZ_JAMQFV010000008.1_57|60353|61819|1|ID=1_57;partial=00;start_type=ATG;rbs_motif=None;rbs_spacer=None;gc_cont=0.658	WP_003403317.1 ABC1 kinase family protein [Mycobacterium tuberculosis]	100	99.8	0.0
NZ_JAMQFV010000008.1_58|61831|62736|1|ID=1_58;partial=00;start_type=GTG;rbs_motif=GGAG/GAGG;rbs_spacer=5-10bp;gc_cont=0.679	WP_003403314.1 MULTISPECIES: lipase/esterase LipG [Mycobacterium]	100	99.7	6.61e-215
NZ_JAMQFV010000008.1_59|62783|63643|1|ID=1_59;partial=00;start_type=ATG;rbs_motif=GGAGG;rbs_spacer=5-10bp;gc_cont=0.599	WP_003403310.1 MULTISPECIES: mycolic acid methyltransferase MmaA1 [Mycobacterium]	100	99.7	2.04e-206
NZ_JAMQFV010000008.1_60|63810|64673|1|ID=1_60;partial=00;start_type=ATG;rbs_motif=GGA/GAG/AGG;rbs_spacer=11-12bp;gc_cont=0.628	WP_003905358.1 MULTISPECIES: cyclopropane mycolic acid synthase MmaA2 [Mycobacterium]	100	99.7	1.44e-211
NZ_JAMQFV010000008.1_61|64821|65702|1|ID=1_61;partial=00;start_type=ATG;rbs_motif=GGAGG;rbs_spacer=3-4bp;gc_cont=0.592	WP_003403302.1 MULTISPECIES: methoxy mycolic acid synthase MmaA3 [Mycobacterium]	100	99.7	2.40e-213
NZ_JAMQFV010000008.1_62|65776|66672|1|ID=1_62;partial=00;start_type=ATG;rbs_motif=AGGAG/GGAGG;rbs_spacer=11-12bp;gc_cont=0.603	WP_003900195.1 MULTISPECIES: hydroxymycolate synthase MmaA4 [Mycobacterium]	100	99.7	2.41e-223
NZ_JAMQFV010000008.1_63|66746|67453|-1|ID=1_63;partial=00;start_type=ATG;rbs_motif=GGA/GAG/AGG;rbs_spacer=5-10bp;gc_cont=0.645	WP_003403292.1 MULTISPECIES: 50S ribosomal protein L1 [Mycobacterium]	100	99.6	6.64e-157
NZ_JAMQFV010000008.1_64|67520|67948|-1|ID=1_64;partial=00;start_type=ATG;rbs_motif=AGGA/GGAG/GAGG;rbs_spacer=11-12bp;gc_cont=0.634	WP_003403291.1 MULTISPECIES: 50S ribosomal protein L11 [Mycobacterium]	100	99.3	3.45e-93
NZ_JAMQFV010000008.1_65|68000|68716|-1|ID=1_65;partial=00;start_type=GTG;rbs_motif=GGAG/GAGG;rbs_spacer=5-10bp;gc_cont=0.640	WP_003403288.1 MULTISPECIES: transcription termination/antitermination protein NusG [Mycobacterium]	100	99.6	1.29e-160
NZ_JAMQFV010000008.1_66|68748|69233|-1|ID=1_66;partial=00;start_type=GTG;rbs_motif=AGGAG;rbs_spacer=5-10bp;gc_cont=0.646	WP_031654427.1 preprotein translocase subunit SecE [Mycobacterium tuberculosis]	94.4	99.4	5.10e-86
NZ_JAMQFV010000008.1_67|69645|70145|-1|ID=1_67;partial=00;start_type=ATG;rbs_motif=None;rbs_spacer=None;gc_cont=0.601	WP_003403282.1 MULTISPECIES: (3R)-hydroxyacyl-ACP dehydratase subunit HadC [Mycobacterium]	100	99.4	8.68e-119
NZ_JAMQFV010000008.1_68|70149|70577|-1|ID=1_68;partial=00;start_type=ATG;rbs_motif=GGAG/GAGG;rbs_spacer=5-10bp;gc_cont=0.622	WP_003903106.1 MULTISPECIES: (3R)-hydroxyacyl-ACP dehydratase subunit HadB [Mycobacterium]	100	99.3	4.36e-96
NZ_JAMQFV010000008.1_69|70564|71040|-1|ID=1_69;partial=00;start_type=GTG;rbs_motif=GGA/GAG/AGG;rbs_spacer=5-10bp;gc_cont=0.597	WP_003403277.1 MULTISPECIES: (3R)-hydroxyacyl-ACP dehydratase subunit HadA [Mycobacterium]	100	99.4	6.70e-110
NZ_JAMQFV010000008.1_70|71091|71258|-1|ID=1_70;partial=00;start_type=ATG;rbs_motif=GGA/GAG/AGG;rbs_spacer=5-10bp;gc_cont=0.577	WP_003898538.1 MULTISPECIES: 50S ribosomal protein L33 [Mycobacteriaceae]	100	98.2	1.38e-34
NZ_JAMQFV010000008.1_71|71606|71818|-1|ID=1_71;partial=00;start_type=ATG;rbs_motif=3Base/5BMM;rbs_spacer=13-15bp;gc_cont=0.615	WP_003898537.1 MULTISPECIES: type II toxin-antitoxin system VapB family antitoxin [Mycobacterium]	100	98.6	1.56e-42
NZ_JAMQFV010000008.1_72|71937|72650|1|ID=1_72;partial=00;start_type=GTG;rbs_motif=GGA/GAG/AGG;rbs_spacer=5-10bp;gc_cont=0.616	WP_003403266.1 MULTISPECIES: MBL fold metallo-hydrolase [Mycobacterium]	100	99.6	5.79e-177
NZ_JAMQFV010000008.1_73|72816|73643|1|ID=1_73;partial=00;start_type=ATG;rbs_motif=GGA/GAG/AGG;rbs_spacer=11-12bp;gc_cont=0.663	WP_003403262.1 MULTISPECIES: hypothetical protein [Mycobacterium]	100	99.6	6.25e-201
NZ_JAMQFV010000008.1_74|73692|74387|1|ID=1_74;partial=00;start_type=ATG;rbs_motif=None;rbs_spacer=None;gc_cont=0.636	WP_003403259.1 MULTISPECIES: crotonase/enoyl-CoA hydratase family protein [Mycobacterium]	100	99.6	4.68e-155
NZ_JAMQFV010000008.1_75|74664|77957|1|ID=1_75;partial=00;start_type=ATG;rbs_motif=GGA/GAG/AGG;rbs_spacer=5-10bp;gc_cont=0.715	WP_003900193.1 MULTISPECIES: exodeoxyribonuclease V subunit gamma [Mycobacterium]	100	99.9	0.0
NZ_JAMQFV010000008.1_76|77957|81241|1|ID=1_76;partial=00;start_type=ATG;rbs_motif=GGA/GAG/AGG;rbs_spacer=5-10bp;gc_cont=0.702	WP_079012823.1 exodeoxyribonuclease V subunit gamma [Mycobacterium tuberculosis]	100	99.9	0.0
NZ_JAMQFV010000008.1_77|81238|82965|1|ID=1_77;partial=00;start_type=GTG;rbs_motif=GGA/GAG/AGG;rbs_spacer=5-10bp;gc_cont=0.700	WP_003901883.1 MULTISPECIES: exodeoxyribonuclease V subunit alpha [Mycobacterium]	100	99.8	0.0
NZ_JAMQFV010000008.1_78|83058|84209|1|ID=1_78;partial=00;start_type=GTG;rbs_motif=None;rbs_spacer=None;gc_cont=0.722	WP_003403248.1 MULTISPECIES: FIST signal transduction protein [Mycobacterium]	100	99.7	1.40e-271
NZ_JAMQFV010000008.1_79|84281|84688|-1|ID=1_79;partial=00;start_type=GTG;rbs_motif=4Base/6BMM;rbs_spacer=13-15bp;gc_cont=0.691	WP_003403246.1 MULTISPECIES: type II toxin-antitoxin system VapC family toxin [Mycobacterium]	100	99.3	1.61e-81
NZ_JAMQFV010000008.1_80|84685|84945|-1|ID=1_80;partial=00;start_type=ATG;rbs_motif=3Base/5BMM;rbs_spacer=13-15bp;gc_cont=0.701	WP_003403244.1 MULTISPECIES: type II toxin-antitoxin system Phd/YefM family antitoxin [Mycobacterium]	100	98.9	4.11e-52
NZ_JAMQFV010000008.1_81|85077|85817|1|ID=1_81;partial=00;start_type=ATG;rbs_motif=3Base/5BMM;rbs_spacer=13-15bp;gc_cont=0.696	WP_031698461.1 TVP38/TMEM64 family protein [Mycobacterium tuberculosis]	97.6	99.6	4.13e-145
NZ_JAMQFV010000008.1_82|85911|86306|-1|ID=1_82;partial=00;start_type=ATG;rbs_motif=GGA/GAG/AGG;rbs_spacer=11-12bp;gc_cont=0.641	WP_003403236.1 MULTISPECIES: type II toxin-antitoxin system toxin ribonuclease C30 [Mycobacterium]	100	99.2	1.11e-86
NZ_JAMQFV010000008.1_83|86306|86560|-1|ID=1_83;partial=00;start_type=ATG;rbs_motif=None;rbs_spacer=None;gc_cont=0.686	WP_003403235.1 MULTISPECIES: type II toxin-antitoxin system antitoxin VapB30 [Mycobacterium]	100	98.8	2.52e-34
NZ_JAMQFV010000008.1_84|86653|87600|-1|ID=1_84;partial=00;start_type=ATG;rbs_motif=3Base/5BMM;rbs_spacer=13-15bp;gc_cont=0.639	WP_003403232.1 MULTISPECIES: DUF732 domain-containing protein [Mycobacterium]	100	99.7	1.59e-229
NZ_JAMQFV010000008.1_85|87704|88768|-1|ID=1_85;partial=00;start_type=ATG;rbs_motif=GGAG/GAGG;rbs_spacer=5-10bp;gc_cont=0.697	WP_003898532.1 MULTISPECIES: zinc ribbon domain-containing protein [Mycobacterium]	100	99.7	1.02e-247
NZ_JAMQFV010000008.1_86|89163|90254|-1|ID=1_86;partial=00;start_type=ATG;rbs_motif=GGA/GAG/AGG;rbs_spacer=5-10bp;gc_cont=0.727	WP_003900977.1 MULTISPECIES: galactokinase [Mycobacterium]	100	99.7	5.88e-247
NZ_JAMQFV010000008.1_87|90251|90721|-1|ID=1_87;partial=00;start_type=ATG;rbs_motif=None;rbs_spacer=None;gc_cont=0.637	WP_003900190.1 MULTISPECIES: galactose-1-phosphate uridylyltransferase [Mycobacterium]	100	99.4	1.78e-104
NZ_JAMQFV010000008.1_88|90739|91434|-1|ID=1_88;partial=00;start_type=ATG;rbs_motif=4Base/6BMM;rbs_spacer=13-15bp;gc_cont=0.704	WP_015629632.1 MULTISPECIES: galactose-1-phosphate uridylyltransferase galTa [Mycobacterium]	99.5	84.9	2.63e-144
NZ_JAMQFV010000008.1_89|91563|91964|-1|ID=1_89;partial=00;start_type=GTG;rbs_motif=GGAG/GAGG;rbs_spacer=5-10bp;gc_cont=0.647	WP_003403218.1 MULTISPECIES: type II toxin-antitoxin system ribonuclease VapC29 [Mycobacterium]	100	99.3	7.73e-88
NZ_JAMQFV010000008.1_90|91961|92188|-1|ID=1_90;partial=00;start_type=GTG;rbs_motif=AGGA;rbs_spacer=5-10bp;gc_cont=0.640	WP_003403213.1 MULTISPECIES: antitoxin VapB29 [Mycobacterium]	100	98.7	4.65e-44
NZ_JAMQFV010000008.1_91|92383|92622|-1|ID=1_91;partial=00;start_type=ATG;rbs_motif=GGAG/GAGG;rbs_spacer=5-10bp;gc_cont=0.683	WP_003403210.1 MULTISPECIES: hypothetical protein [Mycobacterium]	100	98.8	1.56e-44
NZ_JAMQFV010000008.1_92|92622|93371|-1|ID=1_92;partial=00;start_type=GTG;rbs_motif=GGA/GAG/AGG;rbs_spacer=5-10bp;gc_cont=0.659	WP_310909778.1 hypothetical protein [Mycobacterium tuberculosis]	100	99.6	2.21e-162
NZ_JAMQFV010000008.1_93|93455|96022|1|ID=1_93;partial=00;start_type=GTG;rbs_motif=AGxAGG/AGGxGG;rbs_spacer=5-10bp;gc_cont=0.713	WP_003901879.1 MULTISPECIES: SEC-C metal-binding domain-containing protein [Mycobacterium]	100	99.9	0.0
NZ_JAMQFV010000008.1_94|96041|96589|-1|ID=1_94;partial=00;start_type=ATG;rbs_motif=GGxGG;rbs_spacer=5-10bp;gc_cont=0.703	WP_003911256.1 hypothetical protein [Mycobacterium tuberculosis]	100	99.5	9.11e-122
NZ_JAMQFV010000008.1_95|96788|97009|1|ID=1_95;partial=00;start_type=ATG;rbs_motif=AGGAG;rbs_spacer=5-10bp;gc_cont=0.644	WP_003898525.1 MULTISPECIES: DUF4926 domain-containing protein [Mycobacterium]	100	98.6	8.15e-44
NZ_JAMQFV010000008.1_96|97061|98218|1|ID=1_96;partial=00;start_type=ATG;rbs_motif=None;rbs_spacer=None;gc_cont=0.691	WP_003898524.1 MULTISPECIES: hypothetical protein [Mycobacterium]	100	99.7	4.81e-289
NZ_JAMQFV010000008.1_97|98298|98495|1|ID=1_97;partial=00;start_type=GTG;rbs_motif=GGAGG;rbs_spacer=3-4bp;gc_cont=0.646	WP_003403191.1 hypothetical protein [Mycobacterium tuberculosis]	100	98.5	1.33e-43
NZ_JAMQFV010000008.1_98|99083|99484|-1|ID=1_98;partial=00;start_type=GTG;rbs_motif=GGAG/GAGG;rbs_spacer=5-10bp;gc_cont=0.649	WP_003403187.1 MULTISPECIES: type II toxin-antitoxin system VapC family toxin [Mycobacterium]	100	99.3	1.28e-86
NZ_JAMQFV010000008.1_99|99481|99726|-1|ID=1_99;partial=00;start_type=ATG;rbs_motif=AGxAGG/AGGxGG;rbs_spacer=5-10bp;gc_cont=0.634	WP_003403184.1 MULTISPECIES: type II toxin-antitoxin system VapB family antitoxin [Mycobacterium]	100	98.8	1.81e-46
NZ_JAMQFV010000008.1_100|99771|100241|-1|ID=1_100;partial=00;start_type=ATG;rbs_motif=GGA/GAG/AGG;rbs_spacer=5-10bp;gc_cont=0.656	WP_003898523.1 MULTISPECIES: hypothetical protein [Mycobacterium]	100	99.4	5.99e-112
NZ_JAMQFV010000008.1_101|100211|100954|-1|ID=1_101;partial=00;start_type=ATG;rbs_motif=GGAG/GAGG;rbs_spacer=5-10bp;gc_cont=0.664	WP_235626162.1 IS607 family element RNA-guided endonuclease TnpB [Mycobacterium tuberculosis]	100	96.0	2.02e-169
NZ_JAMQFV010000008.1_102|100956|101540|-1|ID=1_102;partial=00;start_type=ATG;rbs_motif=AGGA;rbs_spacer=5-10bp;gc_cont=0.639	WP_003403171.1 MULTISPECIES: IS607-like element IS1536 family transposase [Mycobacterium]	100	99.5	2.79e-131
NZ_JAMQFV010000008.1_103|101781|102707|-1|ID=1_103;partial=00;start_type=ATG;rbs_motif=GGAG/GAGG;rbs_spacer=5-10bp;gc_cont=0.696	WP_235626370.1 DUF1259 domain-containing protein, partial [Mycobacterium tuberculosis]	100	99.7	9.30e-215
NZ_JAMQFV010000008.1_104|102803|103114|-1|ID=1_104;partial=00;start_type=ATG;rbs_motif=AGGAG;rbs_spacer=5-10bp;gc_cont=0.750	WP_003403164.1 MULTISPECIES: PepSY domain-containing protein [Mycobacterium]	100	99.0	5.07e-54
NZ_JAMQFV010000008.1_105|103237|103932|1|ID=1_105;partial=00;start_type=GTG;rbs_motif=GGA/GAG/AGG;rbs_spacer=5-10bp;gc_cont=0.691	WP_003918099.1 MULTISPECIES: two-component system response regulator TcrA [Mycobacterium]	100	99.6	1.16e-164
NZ_JAMQFV010000008.1_106|103916|104446|1|ID=1_106;partial=00;start_type=ATG;rbs_motif=GGAGG;rbs_spacer=5-10bp;gc_cont=0.695	WP_031733895.1 two component system sensor kinase HK2 [Mycobacterium tuberculosis]	91.5	99.4	3.81e-102
NZ_JAMQFV010000008.1_107|104560|105066|1|ID=1_107;partial=00;start_type=GTG;rbs_motif=None;rbs_spacer=None;gc_cont=0.688	WP_003900973.1 MULTISPECIES: two component system sensor kinase HK1 [Mycobacterium]	100	99.4	1.18e-117
NZ_JAMQFV010000008.1_108|105170|105406|1|ID=1_108;partial=00;start_type=ATG;rbs_motif=None;rbs_spacer=None;gc_cont=0.616	WP_003403139.1 MULTISPECIES: type II toxin-antitoxin system antitoxin VapB27 [Mycobacterium]	100	98.7	8.79e-48
NZ_JAMQFV010000008.1_109|105403|105816|1|ID=1_109;partial=00;start_type=GTG;rbs_motif=None;rbs_spacer=None;gc_cont=0.659	WP_003403137.1 MULTISPECIES: type II toxin-antitoxin system VapC family toxin [Mycobacterium]	100	99.3	1.73e-86
NZ_JAMQFV010000008.1_110|106067|107302|1|ID=1_110;partial=00;start_type=ATG;rbs_motif=GGA/GAG/AGG;rbs_spacer=11-12bp;gc_cont=0.672	WP_003403128.1 MULTISPECIES: ATP-binding protein [Mycobacterium]	100	99.8	9.87e-293
NZ_JAMQFV010000008.1_111|107485|107742|1|ID=1_111;partial=00;start_type=ATG;rbs_motif=None;rbs_spacer=None;gc_cont=0.643	WP_003403125.1 MULTISPECIES: type II toxin-antitoxin system antitoxin VapB4 [Mycobacterium]	100	98.8	9.38e-53
NZ_JAMQFV010000008.1_112|107736|108131|1|ID=1_112;partial=00;start_type=GTG;rbs_motif=GGA/GAG/AGG;rbs_spacer=5-10bp;gc_cont=0.641	WP_003403122.1 MULTISPECIES: type II toxin-antitoxin system toxin ribonuclease C4 [Mycobacterium]	99.2	98.5	1.20e-83
NZ_JAMQFV010000008.1_113|108183|109733|-1|ID=1_113;partial=00;start_type=ATG;rbs_motif=GGA/GAG/AGG;rbs_spacer=5-10bp;gc_cont=0.640	WP_003905349.1 MULTISPECIES: MCE family protein [Mycobacterium]	100	99.8	0.0
NZ_JAMQFV010000008.1_114|109738|110934|-1|ID=1_114;partial=00;start_type=GTG;rbs_motif=GGAG/GAGG;rbs_spacer=5-10bp;gc_cont=0.635	WP_003403114.1 virulence factor Mce family protein [Mycobacterium tuberculosis]	99.7	99.7	2.36e-283
NZ_JAMQFV010000008.1_115|110943|112469|-1|ID=1_115;partial=00;start_type=ATG;rbs_motif=GGAGG;rbs_spacer=5-10bp;gc_cont=0.629	WP_057370144.1 virulence factor Mce family protein [Mycobacterium tuberculosis]	96.3	99.8	0.0
NZ_JAMQFV010000008.1_116|112466|113911|-1|ID=1_116;partial=00;start_type=ATG;rbs_motif=GGA/GAG/AGG;rbs_spacer=11-12bp;gc_cont=0.654	WP_368610049.1 virulence factor Mce family protein [Mycobacterium tuberculosis]	99.8	99.8	1.24e-287
NZ_JAMQFV010000008.1_117|113908|114939|-1|ID=1_117;partial=00;start_type=ATG;rbs_motif=3Base/5BMM;rbs_spacer=13-15bp;gc_cont=0.624	WP_003403107.1 MULTISPECIES: MCE family protein [Mycobacterium]	100	99.7	1.81e-240
NZ_JAMQFV010000008.1_118|114936|116150|-1|ID=1_118;partial=00;start_type=GTG;rbs_motif=None;rbs_spacer=None;gc_cont=0.607	WP_003403104.1 MULTISPECIES: MCE family protein [Mycobacterium]	100	99.8	1.83e-289
NZ_JAMQFV010000008.1_119|116156|117043|-1|ID=1_119;partial=00;start_type=ATG;rbs_motif=GGA/GAG/AGG;rbs_spacer=5-10bp;gc_cont=0.642	WP_003905347.1 MULTISPECIES: ABC transporter permease [Mycobacterium]	100	99.7	5.03e-191
