NZ_JAMQFV010000008.1_120|117045|117842|-1|ID=1_120;partial=00;start_type=ATG;rbs_motif=GGA/GAG/AGG;rbs_spacer=5-10bp;gc_cont=0.647	WP_003403095.1 MULTISPECIES: MlaE family ABC transporter permease [Mycobacterium]	100	99.6	6.85e-174
NZ_JAMQFV010000008.1_121|117839|118561|-1|ID=1_121;partial=00;start_type=ATG;rbs_motif=None;rbs_spacer=None;gc_cont=0.631	WP_003403065.1 MULTISPECIES: FadR family transcriptional regulator Mce2R [Mycobacterium]	100	99.6	5.04e-159
NZ_JAMQFV010000008.1_122|118699|121086|1|ID=1_122;partial=00;start_type=ATG;rbs_motif=3Base/5BMM;rbs_spacer=13-15bp;gc_cont=0.647	WP_003900178.1 MULTISPECIES: lysylphosphatidylglycerol synthase transmembrane domain-containing protein [Mycobacterium]	100	99.9	0.0
NZ_JAMQFV010000008.1_123|121109|122410|-1|ID=1_123;partial=00;start_type=ATG;rbs_motif=None;rbs_spacer=None;gc_cont=0.649	WP_252276611.1 GH92 family glycosyl hydrolase, partial [Mycobacterium tuberculosis]	100	99.8	8.85e-314
NZ_JAMQFV010000008.1_124|122373|123743|-1|ID=1_124;partial=00;start_type=ATG;rbs_motif=GGA/GAG/AGG;rbs_spacer=5-10bp;gc_cont=0.644	WP_193567195.1 GH92 family glycosyl hydrolase, partial [Mycobacterium tuberculosis]	100	76.6	1.55e-254
NZ_JAMQFV010000008.1_125|123897|124583|1|ID=1_125;partial=00;start_type=ATG;rbs_motif=GGAG/GAGG;rbs_spacer=5-10bp;gc_cont=0.639	WP_003909258.1 LpqN/LpqT family lipoprotein [Mycobacterium tuberculosis]	100	99.6	8.28e-143
NZ_JAMQFV010000008.1_126|124643|125050|-1|ID=1_126;partial=00;start_type=GTG;rbs_motif=None;rbs_spacer=None;gc_cont=0.657	WP_003403047.1 MULTISPECIES: type II toxin-antitoxin system toxin ribonuclease C26 [Mycobacterium]	100	99.3	3.52e-85
NZ_JAMQFV010000008.1_127|125269|125847|1|ID=1_127;partial=00;start_type=ATG;rbs_motif=None;rbs_spacer=None;gc_cont=0.634	WP_003403017.1 MULTISPECIES: mycobacterial cell wall protein Rv0580c [Mycobacterium]	100	84.5	6.39e-109
NZ_JAMQFV010000008.1_128|125976|126734|-1|ID=1_128;partial=00;start_type=ATG;rbs_motif=GGAG/GAGG;rbs_spacer=5-10bp;gc_cont=0.652	WP_003898511.1 MULTISPECIES: Mut7-C RNAse domain-containing protein [Mycobacterium]	100	99.6	1.21e-181
NZ_JAMQFV010000008.1_129|127056|127781|1|ID=1_129;partial=01;start_type=ATG;rbs_motif=GGA/GAG/AGG;rbs_spacer=5-10bp;gc_cont=0.720	WP_142755605.1 PE family protein, partial [Mycobacterium tuberculosis]	100	57.4	1.33e-51
