NZ_OGTW02000071.1_1|1|120|-1|ID=1_1;partial=10;start_type=GTG;rbs_motif=GGA/GAG/AGG;rbs_spacer=5-10bp;gc_cont=0.358	WP_148113559.1 S-adenosylmethionine:tRNA ribosyltransferase-isomerase, partial [Lactococcus lactis]	100	100	1.87e-19
NZ_OGTW02000071.1_2|254|1372|-1|ID=1_2;partial=00;start_type=ATG;rbs_motif=AGGAG;rbs_spacer=5-10bp;gc_cont=0.282	WP_021722693.1 tyrosine-type recombinase/integrase [Lactococcus lactis]	100	99.7	6.34e-267
NZ_OGTW02000071.1_3|1457|2692|-1|ID=1_3;partial=00;start_type=ATG;rbs_motif=AGGAG;rbs_spacer=5-10bp;gc_cont=0.269	WP_260604566.1 MULTISPECIES: bacteriophage abortive infection AbiH family protein [Lactococcus]	100	99.8	2.64e-297
NZ_OGTW02000071.1_4|3116|3358|1|ID=1_4;partial=00;start_type=ATG;rbs_motif=GGAG/GAGG;rbs_spacer=5-10bp;gc_cont=0.333	WP_127093946.1 MULTISPECIES: hypothetical protein [Bacillati]	100	98.8	3.13e-51
NZ_OGTW02000071.1_5|3860|4873|1|ID=1_5;partial=00;start_type=ATG;rbs_motif=AGGAG;rbs_spacer=5-10bp;gc_cont=0.268	WP_127093947.1 MULTISPECIES: hypothetical protein [Lactococcus]	100	99.7	1.48e-236
NZ_OGTW02000071.1_6|4892|5035|1|ID=1_6;partial=00;start_type=TTG;rbs_motif=GGAG/GAGG;rbs_spacer=5-10bp;gc_cont=0.250	WP_171052492.1 MULTISPECIES: hypothetical protein [Lactococcus]	100	97.9	9.71e-25
