NZ_OGTW02000083.1_1|1503|3416|1|ID=1_1;partial=00;start_type=ATG;rbs_motif=GGA/GAG/AGG;rbs_spacer=5-10bp;gc_cont=0.339	WP_003130831.1 MULTISPECIES: DNA primase [Lactococcus]	100	99.8	0.0
NZ_OGTW02000083.1_2|3493|4836|1|ID=1_2;partial=00;start_type=TTG;rbs_motif=AGGAG;rbs_spacer=5-10bp;gc_cont=0.380	WP_003130829.1 MULTISPECIES: RNA polymerase sigma factor RpoD [Lactococcus]	100	99.8	3.16e-305
NZ_OGTW02000083.1_3|4951|5694|1|ID=1_3;partial=00;start_type=ATG;rbs_motif=AGGAG;rbs_spacer=3-4bp;gc_cont=0.316	WP_010905438.1 MULTISPECIES: MurR/RpiR family transcriptional regulator [Lactococcus]	100	99.6	4.85e-165
NZ_OGTW02000083.1_4|5859|7226|1|ID=1_4;partial=00;start_type=ATG;rbs_motif=GGA/GAG/AGG;rbs_spacer=5-10bp;gc_cont=0.388	WP_185852417.1 MFS transporter [Lactococcus lactis]	100	99.8	0.0
NZ_OGTW02000083.1_5|7509|7847|1|ID=1_5;partial=00;start_type=ATG;rbs_motif=AGGAG;rbs_spacer=5-10bp;gc_cont=0.339	WP_003130824.1 MULTISPECIES: hypothetical protein [Lactococcus]	100	99.1	1.90e-78
NZ_OGTW02000083.1_6|7898|10144|1|ID=1_6;partial=00;start_type=ATG;rbs_motif=AGGAG;rbs_spacer=5-10bp;gc_cont=0.384	WP_003130823.1 MULTISPECIES: ATP-dependent Clp protease ATP-binding subunit [Lactococcus]	100	99.9	0.0
NZ_OGTW02000083.1_7|10566|11036|-1|ID=1_7;partial=00;start_type=ATG;rbs_motif=AGGAG;rbs_spacer=5-10bp;gc_cont=0.361	WP_010905440.1 Rrf2 family transcriptional regulator [Lactococcus lactis]	100	99.4	7.27e-104
NZ_OGTW02000083.1_8|11209|12222|1|ID=1_8;partial=00;start_type=ATG;rbs_motif=GGAG/GAGG;rbs_spacer=5-10bp;gc_cont=0.396	WP_003130818.1 MULTISPECIES: type I glyceraldehyde-3-phosphate dehydrogenase [Lactococcus]	100	99.7	4.42e-238
NZ_OGTW02000083.1_9|12365|13000|-1|ID=1_9;partial=00;start_type=ATG;rbs_motif=None;rbs_spacer=None;gc_cont=0.382	WP_003130816.1 MULTISPECIES: peptide deformylase [Lactococcus]	100	99.5	1.32e-151
NZ_OGTW02000083.1_10|13154|13609|1|ID=1_10;partial=00;start_type=ATG;rbs_motif=GGAG/GAGG;rbs_spacer=5-10bp;gc_cont=0.329	WP_003130814.1 RNA pyrophosphohydrolase [Lactococcus lactis]	100	99.3	6.30e-107
NZ_OGTW02000083.1_11|13620|15698|1|ID=1_11;partial=00;start_type=ATG;rbs_motif=AGGA;rbs_spacer=5-10bp;gc_cont=0.390	WP_003130812.1 MULTISPECIES: excinuclease ABC subunit UvrB [Lactococcus]	100	99.9	0.0
NZ_OGTW02000083.1_12|15840|16703|1|ID=1_12;partial=00;start_type=ATG;rbs_motif=None;rbs_spacer=None;gc_cont=0.341	WP_327063214.1 ABC transporter substrate-binding protein, partial [Lactococcus lactis]	99.7	99.7	1.03e-193
NZ_OGTW02000083.1_13|16718|17836|1|ID=1_13;partial=00;start_type=ATG;rbs_motif=GGA/GAG/AGG;rbs_spacer=5-10bp;gc_cont=0.366	WP_021214900.1 M20 family metallopeptidase [Lactococcus lactis]	100	99.7	1.49e-265
NZ_OGTW02000083.1_14|17904|18359|-1|ID=1_14;partial=00;start_type=ATG;rbs_motif=AGGA;rbs_spacer=5-10bp;gc_cont=0.346	WP_003130498.1 MULTISPECIES: 3-hydroxyacyl-ACP dehydratase FabZ [Lactococcus]	100	99.3	1.67e-102
NZ_OGTW02000083.1_15|18636|19388|1|ID=1_15;partial=00;start_type=ATG;rbs_motif=AGGA/GGAG/GAGG;rbs_spacer=11-12bp;gc_cont=0.389	WP_012897290.1 MULTISPECIES: enoyl-ACP reductase FabI [Lactococcus]	100	99.6	3.29e-169
NZ_OGTW02000083.1_16|19650|20057|1|ID=1_16;partial=00;start_type=ATG;rbs_motif=GGA/GAG/AGG;rbs_spacer=5-10bp;gc_cont=0.365	WP_003130500.1 MULTISPECIES: hypothetical protein [Lactococcus]	100	99.3	3.13e-88
NZ_OGTW02000083.1_17|20126|20308|1|ID=1_17;partial=00;start_type=ATG;rbs_motif=AGGAG;rbs_spacer=5-10bp;gc_cont=0.328	WP_260604579.1 ATP-binding cassette domain-containing protein [Lactococcus lactis]	100	98.4	2.01e-36
NZ_OGTW02000083.1_18|20259|20768|1|ID=1_18;partial=00;start_type=TTG;rbs_motif=GGA/GAG/AGG;rbs_spacer=11-12bp;gc_cont=0.275	WP_260604580.1 ABC transporter ATP-binding protein [Lactococcus lactis]	100	99.4	4.10e-114
NZ_OGTW02000083.1_19|20749|21669|1|ID=1_19;partial=00;start_type=ATG;rbs_motif=AGGAG(G)/GGAGG;rbs_spacer=13-15bp;gc_cont=0.298	WP_003130505.1 MULTISPECIES: ABC transporter permease [Bacillati]	100	99.7	5.79e-207
NZ_OGTW02000083.1_20|21794|22717|-1|ID=1_20;partial=00;start_type=ATG;rbs_motif=None;rbs_spacer=None;gc_cont=0.380	WP_336270994.1 membrane protein insertase YidC [Lactococcus lactis]	100	99.7	9.46e-212
NZ_OGTW02000083.1_21|22931|23689|-1|ID=1_21;partial=00;start_type=ATG;rbs_motif=AGGAG;rbs_spacer=5-10bp;gc_cont=0.361	WP_003130508.1 MULTISPECIES: HAD-IIB family hydrolase [Lactococcus]	100	99.6	2.97e-182
NZ_OGTW02000083.1_22|23784|24374|-1|ID=1_22;partial=00;start_type=ATG;rbs_motif=GGAG/GAGG;rbs_spacer=5-10bp;gc_cont=0.389	WP_003130510.1 MULTISPECIES: ECF transporter S component [Lactococcus]	100	99.5	3.74e-121
NZ_OGTW02000083.1_23|24391|24927|-1|ID=1_23;partial=00;start_type=ATG;rbs_motif=GGAG/GAGG;rbs_spacer=5-10bp;gc_cont=0.367	WP_003130511.1 MULTISPECIES: phosphopantothenoylcysteine decarboxylase [Lactococcus]	100	99.4	1.25e-117
NZ_OGTW02000083.1_24|24920|25615|-1|ID=1_24;partial=00;start_type=ATG;rbs_motif=None;rbs_spacer=None;gc_cont=0.326	WP_003130512.1 MULTISPECIES: phosphopantothenate--cysteine ligase [Lactococcus]	100	99.6	4.36e-160
NZ_OGTW02000083.1_25|25761|25946|-1|ID=1_25;partial=00;start_type=ATG;rbs_motif=GGA/GAG/AGG;rbs_spacer=5-10bp;gc_cont=0.355	WP_003130513.1 MULTISPECIES: 2-hydroxymuconate tautomerase [Lactococcus]	100	98.4	1.52e-36
NZ_OGTW02000083.1_26|26144|28471|1|ID=1_26;partial=00;start_type=ATG;rbs_motif=GGA/GAG/AGG;rbs_spacer=5-10bp;gc_cont=0.361	WP_127094001.1 cation-translocating P-type ATPase [Lactococcus lactis]	100	99.9	0.0
NZ_OGTW02000083.1_27|28484|28927|1|ID=1_27;partial=00;start_type=ATG;rbs_motif=AGGA;rbs_spacer=5-10bp;gc_cont=0.306	WP_003130515.1 MULTISPECIES: GNAT family N-acetyltransferase [Lactococcus]	100	99.3	3.40e-100
NZ_OGTW02000083.1_28|29034|30059|1|ID=1_28;partial=00;start_type=ATG;rbs_motif=AGGAG;rbs_spacer=5-10bp;gc_cont=0.329	WP_185852419.1 YdcF family protein [Lactococcus lactis]	100	99.7	1.40e-227
NZ_OGTW02000083.1_29|30209|30802|1|ID=1_29;partial=00;start_type=ATG;rbs_motif=AGGA;rbs_spacer=5-10bp;gc_cont=0.295	WP_010905446.1 MULTISPECIES: lipoprotein BA_5634 family protein [Lactococcus]	100	99.5	1.67e-129
NZ_OGTW02000083.1_30|31000|31482|1|ID=1_30;partial=00;start_type=ATG;rbs_motif=GGAG/GAGG;rbs_spacer=5-10bp;gc_cont=0.311	WP_003130518.1 MULTISPECIES: TspO/MBR family protein [Lactococcus]	100	99.4	4.87e-104
NZ_OGTW02000083.1_31|31601|32002|1|ID=1_31;partial=00;start_type=ATG;rbs_motif=GGAG/GAGG;rbs_spacer=5-10bp;gc_cont=0.294	WP_003130519.1 MULTISPECIES: DUF2177 family protein [Lactococcus]	100	99.3	4.48e-87
NZ_OGTW02000083.1_32|32006|33427|1|ID=1_32;partial=00;start_type=ATG;rbs_motif=AGGA;rbs_spacer=5-10bp;gc_cont=0.321	WP_010905447.1 MULTISPECIES: DAK2 domain-containing protein [Lactococcus]	100	99.2	0.0
NZ_OGTW02000083.1_33|33421|33801|1|ID=1_33;partial=00;start_type=GTG;rbs_motif=GGA/GAG/AGG;rbs_spacer=5-10bp;gc_cont=0.328	WP_312257872.1 DAK2 domain-containing protein [Lactococcus sp.]	99.2	99.2	2.87e-71
NZ_OGTW02000083.1_34|33798|34571|1|ID=1_34;partial=00;start_type=ATG;rbs_motif=AGGAG;rbs_spacer=5-10bp;gc_cont=0.328	WP_010905448.1 MULTISPECIES: DUF1295 domain-containing protein [Lactococcus]	100	99.6	3.75e-183
NZ_OGTW02000083.1_35|34718|35101|1|ID=1_35;partial=00;start_type=GTG;rbs_motif=AGGAG;rbs_spacer=5-10bp;gc_cont=0.323	WP_127094002.1 YxeA family protein [Lactococcus lactis]	100	99.2	1.86e-83
