BAAHSR010000002.1_118|145605|146279|1|ID=1_118;partial=00;start_type=ATG;rbs_motif=AGGAG;rbs_spacer=5-10bp;gc_cont=0.327	WP_000608826.1 MULTISPECIES: iron-sulfur cluster repair di-iron protein ScdA [Staphylococcus]	100	99.6	7.29e-160
BAAHSR010000002.1_119|146541|148280|1|ID=1_119;partial=00;start_type=ATG;rbs_motif=None;rbs_spacer=None;gc_cont=0.355	WP_000925394.1 sensor histidine kinase [Staphylococcus aureus]	100	99.8	0.0
BAAHSR010000002.1_120|148283|149023|1|ID=1_120;partial=00;start_type=ATG;rbs_motif=AGGAG;rbs_spacer=5-10bp;gc_cont=0.323	WP_000645452.1 MULTISPECIES: response regulator transcription factor LytR [Staphylococcus]	100	99.6	5.09e-171
BAAHSR010000002.1_121|149136|149579|1|ID=1_121;partial=00;start_type=ATG;rbs_motif=GGA/GAG/AGG;rbs_spacer=5-10bp;gc_cont=0.345	WP_001792906.1 MULTISPECIES: antiholin-like murein hydrolase modulator LrgA [Staphylococcus]	100	99.3	2.67e-88
BAAHSR010000002.1_122|149572|150273|1|ID=1_122;partial=00;start_type=ATG;rbs_motif=AGGAG;rbs_spacer=5-10bp;gc_cont=0.366	WP_000607067.1 MULTISPECIES: antiholin-like protein LrgB [Staphylococcus]	100	99.6	4.81e-149
BAAHSR010000002.1_123|150381|151085|-1|ID=1_123;partial=00;start_type=TTG;rbs_motif=GGAG/GAGG;rbs_spacer=5-10bp;gc_cont=0.333	WP_000922329.1 MULTISPECIES: GntR family transcriptional regulator [Staphylococcus]	100	99.6	1.07e-166
BAAHSR010000002.1_124|151234|152025|1|ID=1_124;partial=00;start_type=ATG;rbs_motif=AGGA/GGAG/GAGG;rbs_spacer=11-12bp;gc_cont=0.348	WP_000066937.1 glucose PTS transporter subunit IIA [Staphylococcus aureus]	100	99.6	1.35e-179
BAAHSR010000002.1_125|152041|153477|1|ID=1_125;partial=00;start_type=ATG;rbs_motif=AGGA/GGAG/GAGG;rbs_spacer=11-12bp;gc_cont=0.368	WP_000163988.1 MULTISPECIES: 6-phospho-beta-glucosidase [Staphylococcus]	100	99.8	0.0
BAAHSR010000002.1_126|153549|153740|1|ID=1_126;partial=00;start_type=ATG;rbs_motif=None;rbs_spacer=None;gc_cont=0.375	WP_000596691.1 hypothetical protein, partial [Staphylococcus aureus]	90.3	96.9	3.27e-32
BAAHSR010000002.1_127|153911|154672|-1|ID=1_127;partial=00;start_type=ATG;rbs_motif=AGGAG;rbs_spacer=5-10bp;gc_cont=0.344	WP_000031268.1 MULTISPECIES: class I SAM-dependent methyltransferase [Staphylococcus]	100	99.6	1.31e-181
BAAHSR010000002.1_128|154923|155837|-1|ID=1_128;partial=00;start_type=ATG;rbs_motif=AGGAG;rbs_spacer=5-10bp;gc_cont=0.377	WP_000182751.1 MULTISPECIES: ribokinase [Staphylococcus]	100	99.7	2.11e-208
BAAHSR010000002.1_129|155865|156269|-1|ID=1_129;partial=00;start_type=ATG;rbs_motif=AGGAG;rbs_spacer=5-10bp;gc_cont=0.321	WP_000747850.1 MULTISPECIES: D-ribose pyranase [Staphylococcus]	100	99.3	5.86e-88
BAAHSR010000002.1_130|156284|157165|-1|ID=1_130;partial=00;start_type=ATG;rbs_motif=GGAG/GAGG;rbs_spacer=5-10bp;gc_cont=0.384	WP_000029211.1 ribose/proton symporter RbsU [Staphylococcus aureus]	100	99.7	7.91e-203
BAAHSR010000002.1_131|157397|158395|-1|ID=1_131;partial=00;start_type=ATG;rbs_motif=AGGA;rbs_spacer=5-10bp;gc_cont=0.372	WP_000757880.1 MULTISPECIES: ribose utilization transcriptional repressor RbsR [Staphylococcus]	100	99.7	1.00e-236
BAAHSR010000002.1_132|158775|159167|1|ID=1_132;partial=00;start_type=ATG;rbs_motif=GGAG/GAGG;rbs_spacer=5-10bp;gc_cont=0.267	WP_001159765.1 MULTISPECIES: hypothetical protein [Staphylococcus]	100	99.2	8.78e-88
BAAHSR010000002.1_133|159395|159799|1|ID=1_133;partial=00;start_type=TTG;rbs_motif=None;rbs_spacer=None;gc_cont=0.304	WP_151180494.1 transposase, partial [Staphylococcus aureus]	99.2	91.1	5.33e-84
BAAHSR010000002.1_134|159840|161216|-1|ID=1_134;partial=00;start_type=GTG;rbs_motif=AGGAG;rbs_spacer=5-10bp;gc_cont=0.375	WP_001066545.1 MULTISPECIES: MFS transporter [Staphylococcus]	100	99.8	1.64e-308
BAAHSR010000002.1_135|161450|162442|1|ID=1_135;partial=00;start_type=ATG;rbs_motif=AGGAG;rbs_spacer=5-10bp;gc_cont=0.353	WP_000337364.1 MULTISPECIES: choloylglycine hydrolase family protein [Staphylococcus]	100	99.7	3.68e-247
BAAHSR010000002.1_136|162750|163718|1|ID=1_136;partial=00;start_type=ATG;rbs_motif=None;rbs_spacer=None;gc_cont=0.397	WP_000736798.1 MULTISPECIES: glycine-glycine endopeptidase LytM [Staphylococcus]	100	97.8	1.21e-226
BAAHSR010000002.1_137|163770|164429|-1|ID=1_137;partial=00;start_type=ATG;rbs_motif=AGGAG;rbs_spacer=5-10bp;gc_cont=0.315	WP_000570071.1 MULTISPECIES: ABC transporter ATP-binding protein [Staphylococcus]	100	99.5	3.22e-156
BAAHSR010000002.1_138|164443|165363|-1|ID=1_138;partial=00;start_type=ATG;rbs_motif=GGAG/GAGG;rbs_spacer=5-10bp;gc_cont=0.316	WP_000806113.1 MULTISPECIES: ABC transporter permease [Staphylococcus]	100	99.7	3.66e-194
BAAHSR010000002.1_139|165360|166526|-1|ID=1_139;partial=00;start_type=ATG;rbs_motif=AGGAG;rbs_spacer=5-10bp;gc_cont=0.319	WP_000848764.1 MULTISPECIES: ABC transporter permease [Staphylococcus]	100	99.7	4.98e-263
BAAHSR010000002.1_140|166594|168117|-1|ID=1_140;partial=00;start_type=ATG;rbs_motif=GGAG/GAGG;rbs_spacer=5-10bp;gc_cont=0.284	WP_103263387.1 DUF6583 family protein [Staphylococcus aureus]	100	99.8	0.0
BAAHSR010000002.1_141|168388|169041|1|ID=1_141;partial=00;start_type=ATG;rbs_motif=AGGA/GGAG/GAGG;rbs_spacer=11-12bp;gc_cont=0.278	WP_000421225.1 MULTISPECIES: DUF5079 family protein [Staphylococcus]	100	99.5	1.46e-142
BAAHSR010000002.1_142|169075|169662|1|ID=1_142;partial=00;start_type=ATG;rbs_motif=AGGAG;rbs_spacer=5-10bp;gc_cont=0.281	WP_000583198.1 MULTISPECIES: DUF5080 family protein [Staphylococcus]	100	99.5	2.09e-122
BAAHSR010000002.1_143|169805|170707|-1|ID=1_143;partial=00;start_type=ATG;rbs_motif=GGA/GAG/AGG;rbs_spacer=5-10bp;gc_cont=0.373	WP_000751207.1 MULTISPECIES: CHAP domain-containing protein [Staphylococcus]	100	98.7	3.96e-208
BAAHSR010000002.1_144|170946|171239|1|ID=1_144;partial=00;start_type=ATG;rbs_motif=AGGAG;rbs_spacer=5-10bp;gc_cont=0.378	WP_001240826.1 MULTISPECIES: WXG100 family type VII secretion effector EsxA [Staphylococcus]	100	99.0	5.04e-58
BAAHSR010000002.1_145|171323|174352|1|ID=1_145;partial=00;start_type=ATG;rbs_motif=AGGA;rbs_spacer=5-10bp;gc_cont=0.309	WP_000728949.1 MULTISPECIES: type VII secretion protein EsaA [Staphylococcus]	100	99.9	0.0
BAAHSR010000002.1_146|174352|174810|1|ID=1_146;partial=00;start_type=ATG;rbs_motif=GGA/GAG/AGG;rbs_spacer=5-10bp;gc_cont=0.327	WP_000928935.1 MULTISPECIES: type VII secretion protein EssA [Staphylococcus]	100	99.3	7.91e-97
BAAHSR010000002.1_147|174782|175024|1|ID=1_147;partial=00;start_type=ATG;rbs_motif=AGGA/GGAG/GAGG;rbs_spacer=11-12bp;gc_cont=0.296	WP_001071606.1 MULTISPECIES: type VII secretion protein EsaB [Staphylococcus]	100	98.8	3.02e-49
BAAHSR010000002.1_148|175037|176371|1|ID=1_148;partial=00;start_type=ATG;rbs_motif=AGGAG;rbs_spacer=5-10bp;gc_cont=0.299	WP_031796234.1 type VII secretion protein EssB, partial [Staphylococcus aureus]	100	87.9	2.16e-276
BAAHSR010000002.1_149|176393|180832|1|ID=1_149;partial=00;start_type=ATG;rbs_motif=GGAG/GAGG;rbs_spacer=5-10bp;gc_cont=0.340	WP_000549278.1 MULTISPECIES: type VII secretion protein EssC [Staphylococcus]	100	99.9	0.0
BAAHSR010000002.1_150|180862|181254|1|ID=1_150;partial=00;start_type=ATG;rbs_motif=AGGAGG;rbs_spacer=5-10bp;gc_cont=0.310	WP_001010289.1 MULTISPECIES: type VII secretion substrate EsaC [Staphylococcus]	100	99.2	7.50e-80
BAAHSR010000002.1_151|181270|181584|1|ID=1_151;partial=00;start_type=ATG;rbs_motif=GGAG/GAGG;rbs_spacer=5-10bp;gc_cont=0.390	WP_000509668.1 MULTISPECIES: WXG100 family type VII secretion effector EsxB [Staphylococcus]	100	99.0	1.98e-65
BAAHSR010000002.1_152|181581|182258|1|ID=1_152;partial=00;start_type=ATG;rbs_motif=GGA/GAG/AGG;rbs_spacer=5-10bp;gc_cont=0.295	WP_000655875.1 MULTISPECIES: DUF5081 family protein [Staphylococcus]	100	99.1	1.79e-158
BAAHSR010000002.1_153|182258|182575|1|ID=1_153;partial=00;start_type=ATG;rbs_motif=GGA/GAG/AGG;rbs_spacer=5-10bp;gc_cont=0.371	WP_000175722.1 MULTISPECIES: type VII secretion system extracellular protein EsxD [Staphylococcus]	100	99.1	3.14e-67
BAAHSR010000002.1_154|182585|184429|1|ID=1_154;partial=00;start_type=ATG;rbs_motif=GGA/GAG/AGG;rbs_spacer=5-10bp;gc_cont=0.357	WP_123090409.1 DNA/RNA non-specific endonuclease [Staphylococcus aureus]	98.9	99.8	0.0
BAAHSR010000002.1_155|184440|184931|1|ID=1_155;partial=00;start_type=ATG;rbs_motif=GGAG/GAGG;rbs_spacer=5-10bp;gc_cont=0.287	WP_000142049.1 MULTISPECIES: TIGR01741 family protein [Staphylococcus]	100	99.4	1.57e-115
BAAHSR010000002.1_156|185139|185822|1|ID=1_156;partial=00;start_type=ATG;rbs_motif=AGGAG;rbs_spacer=5-10bp;gc_cont=0.269	WP_000208414.1 DUF5079 family protein [Staphylococcus aureus]	100	99.6	8.71e-149
BAAHSR010000002.1_157|185969|186580|1|ID=1_157;partial=00;start_type=ATG;rbs_motif=GGAG/GAGG;rbs_spacer=5-10bp;gc_cont=0.281	WP_000394915.1 MULTISPECIES: DUF5080 family protein [Staphylococcus]	100	99.5	5.93e-126
BAAHSR010000002.1_158|186716|186934|1|ID=1_158;partial=00;start_type=ATG;rbs_motif=AGGAG;rbs_spacer=5-10bp;gc_cont=0.269	WP_000431307.1 MULTISPECIES: hypothetical protein [Staphylococcus]	100	98.6	6.03e-41
BAAHSR010000002.1_159|187066|187566|1|ID=1_159;partial=00;start_type=ATG;rbs_motif=GGA/GAG/AGG;rbs_spacer=5-10bp;gc_cont=0.305	WP_000142036.1 MULTISPECIES: TIGR01741 family protein [Staphylococcus]	100	99.4	1.62e-114
BAAHSR010000002.1_160|187577|188077|1|ID=1_160;partial=00;start_type=ATG;rbs_motif=GGAG/GAGG;rbs_spacer=5-10bp;gc_cont=0.283	WP_001008475.1 MULTISPECIES: TIGR01741 family protein [Staphylococcus]	100	99.4	2.90e-108
BAAHSR010000002.1_161|188088|188240|1|ID=1_161;partial=00;start_type=ATG;rbs_motif=GGAG/GAGG;rbs_spacer=5-10bp;gc_cont=0.314	WP_000575670.1 immunity protein YezG family protein [Staphylococcus aureus]	100	98.0	8.91e-29
BAAHSR010000002.1_162|188194|188583|1|ID=1_162;partial=00;start_type=ATG;rbs_motif=None;rbs_spacer=None;gc_cont=0.282	WP_049291434.1 TIGR01741 family protein, partial [Staphylococcus aureus]	94.4	96.9	9.78e-82
BAAHSR010000002.1_163|188594|189094|1|ID=1_163;partial=00;start_type=ATG;rbs_motif=GGA/GAG/AGG;rbs_spacer=5-10bp;gc_cont=0.293	WP_042751956.1 TIGR01741 family protein [Staphylococcus aureus]	100	99.4	6.86e-116
BAAHSR010000002.1_164|189106|189606|1|ID=1_164;partial=00;start_type=ATG;rbs_motif=GGAG/GAGG;rbs_spacer=5-10bp;gc_cont=0.303	WP_000142145.1 MULTISPECIES: TIGR01741 family protein [Staphylococcus]	100	99.4	1.33e-122
BAAHSR010000002.1_165|189617|190117|1|ID=1_165;partial=00;start_type=ATG;rbs_motif=GGAG/GAGG;rbs_spacer=5-10bp;gc_cont=0.311	WP_000142176.1 MULTISPECIES: antitoxin YezG family protein [Staphylococcus]	100	99.4	3.03e-119
BAAHSR010000002.1_166|190128|190628|1|ID=1_166;partial=00;start_type=ATG;rbs_motif=GGAG/GAGG;rbs_spacer=5-10bp;gc_cont=0.297	WP_000141942.1 MULTISPECIES: TIGR01741 family protein [Staphylococcus]	100	99.4	1.01e-117
BAAHSR010000002.1_167|190639|191127|1|ID=1_167;partial=00;start_type=ATG;rbs_motif=GGAG/GAGG;rbs_spacer=5-10bp;gc_cont=0.299	WP_000142094.1 MULTISPECIES: antitoxin YezG family protein [Staphylococcus]	100	99.4	2.61e-118
BAAHSR010000002.1_168|191750|192124|1|ID=1_168;partial=00;start_type=ATG;rbs_motif=AGGAG;rbs_spacer=5-10bp;gc_cont=0.267	WP_248316347.1 DUF4467 domain-containing protein [Staphylococcus aureus]	100	99.2	1.18e-80
BAAHSR010000002.1_169|192277|192675|1|ID=1_169;partial=00;start_type=ATG;rbs_motif=AGGAG;rbs_spacer=5-10bp;gc_cont=0.316	WP_000415675.1 MULTISPECIES: DUF4064 domain-containing protein [Staphylococcus]	100	99.2	1.62e-75
BAAHSR010000002.1_170|192891|193736|-1|ID=1_170;partial=00;start_type=ATG;rbs_motif=None;rbs_spacer=None;gc_cont=0.333	WP_000834168.1 formate/nitrite transporter family protein [Staphylococcus aureus]	100	99.6	3.45e-191
BAAHSR010000002.1_171|193952|195259|-1|ID=1_171;partial=00;start_type=TTG;rbs_motif=AGGA;rbs_spacer=5-10bp;gc_cont=0.359	WP_000745099.1 MULTISPECIES: branched-chain amino acid transport system II carrier protein BrnQ2 [Staphylococcus]	100	99.8	4.82e-303
BAAHSR010000002.1_172|195843|196733|1|ID=1_172;partial=00;start_type=ATG;rbs_motif=GGAG/GAGG;rbs_spacer=5-10bp;gc_cont=0.331	WP_001033876.1 MULTISPECIES: 5'-nucleotidase, lipoprotein e(P4) family [Staphylococcus]	100	99.7	2.19e-206
BAAHSR010000002.1_173|196982|198031|1|ID=1_173;partial=00;start_type=ATG;rbs_motif=GGAG/GAGG;rbs_spacer=5-10bp;gc_cont=0.334	WP_000477934.1 MULTISPECIES: ABC transporter permease [Staphylococcus]	100	99.7	5.11e-234
BAAHSR010000002.1_174|198044|198721|1|ID=1_174;partial=00;start_type=ATG;rbs_motif=AGGAG;rbs_spacer=5-10bp;gc_cont=0.335	WP_000911019.1 MULTISPECIES: ABC transporter ATP-binding protein [Staphylococcus]	100	99.6	8.13e-153
BAAHSR010000002.1_175|198923|199960|1|ID=1_175;partial=00;start_type=ATG;rbs_motif=None;rbs_spacer=None;gc_cont=0.385	WP_223810476.1 PTS sugar transporter subunit IIC [Staphylococcus aureus]	99.7	96.0	8.39e-205
BAAHSR010000002.1_176|200303|201421|1|ID=1_176;partial=00;start_type=ATG;rbs_motif=AGGAG;rbs_spacer=5-10bp;gc_cont=0.340	WP_001283977.1 MULTISPECIES: carbohydrate kinase [Staphylococcus]	100	99.7	1.56e-267
BAAHSR010000002.1_177|201396|202319|1|ID=1_177;partial=00;start_type=ATG;rbs_motif=GGAG/GAGG;rbs_spacer=5-10bp;gc_cont=0.381	WP_000002068.1 MULTISPECIES: pseudouridine-5'-phosphate glycosidase [Staphylococcus]	100	99.7	6.53e-209
BAAHSR010000002.1_178|202330|203550|1|ID=1_178;partial=00;start_type=ATG;rbs_motif=GGA/GAG/AGG;rbs_spacer=5-10bp;gc_cont=0.327	WP_001022961.1 MULTISPECIES: NupC/NupG family nucleoside CNT transporter [Staphylococcus]	100	99.8	4.63e-268
BAAHSR010000002.1_179|203655|205187|-1|ID=1_179;partial=00;start_type=ATG;rbs_motif=GGA/GAG/AGG;rbs_spacer=5-10bp;gc_cont=0.361	WP_000665736.1 MULTISPECIES: sodium:solute symporter [Staphylococcus]	100	99.8	0.0
BAAHSR010000002.1_180|205227|206108|-1|ID=1_180;partial=00;start_type=ATG;rbs_motif=GGAG/GAGG;rbs_spacer=5-10bp;gc_cont=0.350	WP_001030738.1 MULTISPECIES: N-acetylneuraminate lyase [Staphylococcus]	100	99.7	8.61e-207
BAAHSR010000002.1_181|206224|207126|1|ID=1_181;partial=00;start_type=ATG;rbs_motif=None;rbs_spacer=None;gc_cont=0.371	WP_064646651.1 ROK family protein [Staphylococcus aureus]	99.3	99.7	1.50e-215
BAAHSR010000002.1_182|207404|208204|-1|ID=1_182;partial=00;start_type=ATG;rbs_motif=GGA/GAG/AGG;rbs_spacer=5-10bp;gc_cont=0.335	WP_000667382.1 MULTISPECIES: MurR/RpiR family transcriptional regulator [Staphylococcus]	100	99.6	3.72e-183
BAAHSR010000002.1_183|208344|209012|1|ID=1_183;partial=00;start_type=ATG;rbs_motif=GGAG/GAGG;rbs_spacer=5-10bp;gc_cont=0.378	WP_053875763.1 N-acetylmannosamine-6-phosphate 2-epimerase [Staphylococcus aureus]	100	99.6	1.93e-154
BAAHSR010000002.1_184|209139|210500|-1|ID=1_184;partial=00;start_type=ATG;rbs_motif=GGA/GAG/AGG;rbs_spacer=5-10bp;gc_cont=0.360	WP_248316349.1 YjiH family protein [Staphylococcus aureus]	100	96.3	3.99e-298
BAAHSR010000002.1_185|210870|212942|1|ID=1_185;partial=00;start_type=ATG;rbs_motif=GGAG/GAGG;rbs_spacer=5-10bp;gc_cont=0.374	WP_031900642.1 YSIRK domain-containing triacylglycerol lipase Lip2/Geh [Staphylococcus aureus]	96.4	99.9	0.0
BAAHSR010000002.1_186|213184|214011|-1|ID=1_186;partial=00;start_type=GTG;rbs_motif=AGGA/GGAG/GAGG;rbs_spacer=11-12bp;gc_cont=0.342	WP_000136020.1 MULTISPECIES: alpha/beta hydrolase [Staphylococcus]	100	99.6	5.39e-201
BAAHSR010000002.1_187|214084|215283|-1|ID=1_187;partial=00;start_type=ATG;rbs_motif=AGGA;rbs_spacer=5-10bp;gc_cont=0.394	WP_000286484.1 MULTISPECIES: NADH-dependent flavin oxidoreductase [Staphylococcus]	100	99.8	2.72e-293
BAAHSR010000002.1_188|215585|216586|1|ID=1_188;partial=00;start_type=TTG;rbs_motif=GGAG/GAGG;rbs_spacer=5-10bp;gc_cont=0.374	WP_000240058.1 MULTISPECIES: LLM class flavin-dependent oxidoreductase [Staphylococcus]	100	99.7	1.61e-238
BAAHSR010000002.1_189|216620|216952|1|ID=1_189;partial=00;start_type=ATG;rbs_motif=AGGA;rbs_spacer=5-10bp;gc_cont=0.363	WP_000731878.1 MULTISPECIES: glycine cleavage system protein H [Staphylococcus]	100	99.1	9.88e-71
BAAHSR010000002.1_190|216953|217753|1|ID=1_190;partial=00;start_type=ATG;rbs_motif=GGAG/GAGG;rbs_spacer=5-10bp;gc_cont=0.360	WP_000449061.1 protein-ADP-ribose hydrolase [Staphylococcus aureus]	100	99.6	2.18e-191
BAAHSR010000002.1_191|217743|218687|1|ID=1_191;partial=00;start_type=ATG;rbs_motif=AGGAG(G)/GGAGG;rbs_spacer=13-15bp;gc_cont=0.379	WP_001191946.1 MULTISPECIES: SIR2 family NAD-dependent protein deacylase [Staphylococcus]	100	99.7	3.46e-228
BAAHSR010000002.1_192|218665|219687|1|ID=1_192;partial=00;start_type=ATG;rbs_motif=GGAG/GAGG;rbs_spacer=5-10bp;gc_cont=0.344	WP_000280805.1 lipoate--protein ligase [Staphylococcus aureus]	100	99.7	3.28e-246
BAAHSR010000002.1_193|220002|221027|1|ID=1_193;partial=00;start_type=ATG;rbs_motif=AGGAG;rbs_spacer=5-10bp;gc_cont=0.356	WP_001060912.1 SDR family oxidoreductase [Staphylococcus aureus]	100	99.7	4.44e-240
BAAHSR010000002.1_194|221120|222466|-1|ID=1_194;partial=00;start_type=ATG;rbs_motif=AGGAG;rbs_spacer=5-10bp;gc_cont=0.379	WP_001147970.1 MULTISPECIES: PTS ascorbate transporter subunit IIC [Staphylococcus]	100	99.8	2.20e-301
BAAHSR010000002.1_195|222481|222765|-1|ID=1_195;partial=00;start_type=ATG;rbs_motif=AGGAG;rbs_spacer=5-10bp;gc_cont=0.351	WP_000699538.1 MULTISPECIES: PTS sugar transporter subunit IIB [Staphylococcus]	100	98.9	1.65e-57
BAAHSR010000002.1_196|222767|223210|-1|ID=1_196;partial=00;start_type=GTG;rbs_motif=AGGAG;rbs_spacer=5-10bp;gc_cont=0.356	WP_000050762.1 MULTISPECIES: PTS sugar transporter subunit IIA [Staphylococcus]	100	99.3	7.72e-97
BAAHSR010000002.1_197|223215|225170|-1|ID=1_197;partial=00;start_type=TTG;rbs_motif=AGGAG;rbs_spacer=5-10bp;gc_cont=0.344	WP_000954261.1 MULTISPECIES: BglG family transcription antiterminator [Staphylococcus]	100	99.8	0.0
BAAHSR010000002.1_198|225382|225801|1|ID=1_198;partial=00;start_type=ATG;rbs_motif=None;rbs_spacer=None;gc_cont=0.336	WP_000397416.1 MULTISPECIES: multidrug efflux transporter transcriptional repressor MepR [Staphylococcus]	100	99.3	1.47e-88
BAAHSR010000002.1_199|225908|227263|1|ID=1_199;partial=00;start_type=ATG;rbs_motif=AGGAG;rbs_spacer=5-10bp;gc_cont=0.330	WP_000651060.1 MULTISPECIES: multidrug efflux MATE transporter MepA [Staphylococcus]	100	99.8	5.37e-299
BAAHSR010000002.1_200|227367|227807|1|ID=1_200;partial=00;start_type=ATG;rbs_motif=GGA/GAG/AGG;rbs_spacer=5-10bp;gc_cont=0.304	WP_000335332.1 MULTISPECIES: MepB family protein [Staphylococcus]	100	99.3	3.41e-104
BAAHSR010000002.1_201|227890|229248|-1|ID=1_201;partial=00;start_type=ATG;rbs_motif=AGGAG;rbs_spacer=5-10bp;gc_cont=0.371	WP_001010111.1 MULTISPECIES: glycerol-3-phosphate transporter [Staphylococcus]	100	99.8	0.0
BAAHSR010000002.1_202|229493|230482|1|ID=1_202;partial=00;start_type=ATG;rbs_motif=GGA/GAG/AGG;rbs_spacer=5-10bp;gc_cont=0.339	WP_001028221.1 MULTISPECIES: VOC family protein [Staphylococcus]	100	93.3	4.66e-224
BAAHSR010000002.1_203|230496|231557|1|ID=1_203;partial=00;start_type=ATG;rbs_motif=AGGAG;rbs_spacer=5-10bp;gc_cont=0.370	WP_001096116.1 MULTISPECIES: LLM class flavin-dependent oxidoreductase [Staphylococcus]	100	99.7	2.63e-254
BAAHSR010000002.1_204|231571|232137|1|ID=1_204;partial=00;start_type=ATG;rbs_motif=AGGAG;rbs_spacer=5-10bp;gc_cont=0.337	WP_001028431.1 MULTISPECIES: NADPH-dependent FMN reductase [Staphylococcus]	100	99.5	1.90e-126
BAAHSR010000002.1_205|232197|233309|-1|ID=1_205;partial=00;start_type=ATG;rbs_motif=None;rbs_spacer=None;gc_cont=0.347	WP_000157629.1 MULTISPECIES: YeiH family protein [Staphylococcus]	100	89.2	9.10e-213
BAAHSR010000002.1_206|233572|234117|1|ID=1_206;partial=00;start_type=ATG;rbs_motif=GGAG/GAGG;rbs_spacer=5-10bp;gc_cont=0.353	WP_000467652.1 MULTISPECIES: GNAT family N-acetyltransferase [Staphylococcus]	100	99.5	2.00e-129
BAAHSR010000002.1_207|234385|235239|1|ID=1_207;partial=00;start_type=ATG;rbs_motif=GGAG/GAGG;rbs_spacer=5-10bp;gc_cont=0.310	WP_000737193.1 iron uptake system protein EfeO [Staphylococcus aureus]	100	99.6	5.92e-173
BAAHSR010000002.1_208|235236|236465|1|ID=1_208;partial=00;start_type=ATG;rbs_motif=None;rbs_spacer=None;gc_cont=0.374	WP_000186217.1 MULTISPECIES: iron uptake transporter deferrochelatase/peroxidase subunit [Staphylococcus]	100	99.8	4.43e-304
BAAHSR010000002.1_209|236446|238158|1|ID=1_209;partial=00;start_type=GTG;rbs_motif=GGAG/GAGG;rbs_spacer=5-10bp;gc_cont=0.336	WP_248316351.1 FTR1 family iron permease [Staphylococcus aureus]	100	99.8	0.0
BAAHSR010000002.1_210|238250|238855|-1|ID=1_210;partial=00;start_type=ATG;rbs_motif=None;rbs_spacer=None;gc_cont=0.332	WP_001797287.1 twin-arginine translocase subunit TatC [Staphylococcus aureus]	100	99.5	2.43e-137
BAAHSR010000002.1_211|238968|239183|-1|ID=1_211;partial=00;start_type=ATG;rbs_motif=GGAG/GAGG;rbs_spacer=5-10bp;gc_cont=0.370	WP_000632271.1 twin-arginine translocase TatA/TatE family subunit [Staphylococcus aureus]	100	98.6	1.06e-36
BAAHSR010000002.1_212|239292|239681|-1|ID=1_212;partial=00;start_type=ATG;rbs_motif=AGGAG;rbs_spacer=5-10bp;gc_cont=0.349	WP_000886005.1 MULTISPECIES: DUF1398 domain-containing protein [Staphylococcus]	100	99.2	2.84e-88
BAAHSR010000002.1_213|239922|240125|1|ID=1_213;partial=00;start_type=GTG;rbs_motif=AGGAG;rbs_spacer=5-10bp;gc_cont=0.392	WP_001246013.1 MULTISPECIES: helix-turn-helix transcriptional regulator [Staphylococcus]	100	98.5	1.89e-35
BAAHSR010000002.1_214|240122|240835|1|ID=1_214;partial=00;start_type=ATG;rbs_motif=AGGAG;rbs_spacer=5-10bp;gc_cont=0.315	WP_000698752.1 MULTISPECIES: DUF3169 family protein [Staphylococcus]	100	99.6	2.72e-141
BAAHSR010000002.1_215|240860|241702|1|ID=1_215;partial=00;start_type=ATG;rbs_motif=AGGAG;rbs_spacer=5-10bp;gc_cont=0.311	WP_000209565.1 MULTISPECIES: ABC transporter ATP-binding protein [Staphylococcus]	100	99.6	5.76e-194
BAAHSR010000002.1_216|241702|242331|1|ID=1_216;partial=00;start_type=ATG;rbs_motif=GGAG/GAGG;rbs_spacer=5-10bp;gc_cont=0.322	WP_148239928.1 ABC-2 transporter permease [Staphylococcus aureus]	100	99.5	1.04e-122
BAAHSR010000002.1_217|242698|243831|-1|ID=1_217;partial=00;start_type=ATG;rbs_motif=AGGAG;rbs_spacer=5-10bp;gc_cont=0.313	WP_000245685.1 MULTISPECIES: low temperature requirement protein A [Staphylococcus]	100	99.7	7.37e-264
BAAHSR010000002.1_218|244370|245551|1|ID=1_218;partial=00;start_type=ATG;rbs_motif=AGGA/GGAG/GAGG;rbs_spacer=11-12bp;gc_cont=0.382	WP_000199070.1 MULTISPECIES: acetyl-CoA C-acetyltransferase [Staphylococcus]	100	99.7	2.00e-276
BAAHSR010000002.1_219|245634|246386|-1|ID=1_219;partial=00;start_type=ATG;rbs_motif=None;rbs_spacer=None;gc_cont=0.372	WP_000195907.1 MULTISPECIES: cyclase family protein [Staphylococcus]	100	99.6	3.36e-187
BAAHSR010000002.1_220|246429|248657|-1|ID=1_220;partial=00;start_type=ATG;rbs_motif=AGGAG;rbs_spacer=5-10bp;gc_cont=0.341	WP_000207614.1 MULTISPECIES: 5-methyltetrahydropteroyltriglutamate--homocysteine S-methyltransferase [Staphylococcus]	100	99.9	0.0
BAAHSR010000002.1_221|248654|250495|-1|ID=1_221;partial=00;start_type=ATG;rbs_motif=AGGAG;rbs_spacer=5-10bp;gc_cont=0.361	WP_103263388.1 bifunctional homocysteine S-methyltransferase/methylenetetrahydrofolate reductase [Staphylococcus aureus]	100	99.8	0.0
BAAHSR010000002.1_222|250464|251624|-1|ID=1_222;partial=00;start_type=ATG;rbs_motif=GGAG/GAGG;rbs_spacer=5-10bp;gc_cont=0.379	WP_000175846.1 MULTISPECIES: cystathionine beta-lyase MetC [Staphylococcus]	100	99.7	9.53e-276
BAAHSR010000002.1_223|251621|252724|-1|ID=1_223;partial=00;start_type=ATG;rbs_motif=AGGAG;rbs_spacer=5-10bp;gc_cont=0.359	WP_000655692.1 MULTISPECIES: PLP-dependent transferase [Staphylococcus]	100	99.7	3.78e-261
BAAHSR010000002.1_225|253388|254233|1|ID=1_225;partial=00;start_type=GTG;rbs_motif=None;rbs_spacer=None;gc_cont=0.339	WP_001550052.1 MULTISPECIES: ParB/RepB/Spo0J family partition protein [Staphylococcus]	100	99.6	1.57e-187
BAAHSR010000002.1_226|254390|255271|1|ID=1_226;partial=00;start_type=ATG;rbs_motif=AGGA/GGAG/GAGG;rbs_spacer=11-12bp;gc_cont=0.306	WP_001077602.1 MULTISPECIES: mechanosensitive ion channel family protein [Staphylococcus]	100	99.7	4.03e-150
BAAHSR010000002.1_227|255301|255504|1|ID=1_227;partial=00;start_type=ATG;rbs_motif=GGAG/GAGG;rbs_spacer=5-10bp;gc_cont=0.294	WP_000157345.1 MULTISPECIES: DUF951 domain-containing protein [Staphylococcus]	100	98.5	1.48e-41
BAAHSR010000002.1_228|255516|256613|1|ID=1_228;partial=00;start_type=ATG;rbs_motif=AGGAG;rbs_spacer=5-10bp;gc_cont=0.353	WP_001218732.1 MULTISPECIES: redox-regulated ATPase YchF [Staphylococcus]	100	99.7	2.44e-256
BAAHSR010000002.1_229|256699|256890|-1|ID=1_229;partial=00;start_type=ATG;rbs_motif=GGAG/GAGG;rbs_spacer=5-10bp;gc_cont=0.318	WP_001052483.1 MULTISPECIES: hypothetical protein [Staphylococcus]	100	98.4	9.23e-41
BAAHSR010000002.1_230|257134|257430|1|ID=1_230;partial=00;start_type=ATG;rbs_motif=AGGAG(G)/GGAGG;rbs_spacer=13-15bp;gc_cont=0.380	WP_001261460.1 MULTISPECIES: 30S ribosomal protein S6 [Bacteria]	100	99.0	3.52e-63
BAAHSR010000002.1_231|257451|257954|1|ID=1_231;partial=00;start_type=ATG;rbs_motif=GGAG/GAGG;rbs_spacer=5-10bp;gc_cont=0.383	WP_061839556.1 single-stranded DNA-binding protein [Staphylococcus aureus]	91.6	99.4	1.08e-99
BAAHSR010000002.1_232|258006|258248|1|ID=1_232;partial=00;start_type=ATG;rbs_motif=AGGAG;rbs_spacer=5-10bp;gc_cont=0.370	WP_000897044.1 MULTISPECIES: 30S ribosomal protein S18 [Bacteria]	100	98.8	3.02e-49
BAAHSR010000002.1_233|258514|259488|-1|ID=1_233;partial=00;start_type=TTG;rbs_motif=GGAG/GAGG;rbs_spacer=5-10bp;gc_cont=0.279	WP_001822249.1 MULTISPECIES: Abi family protein [Staphylococcus]	100	96.0	1.09e-224
BAAHSR010000002.1_234|259491|259802|-1|ID=1_234;partial=00;start_type=ATG;rbs_motif=None;rbs_spacer=None;gc_cont=0.333	WP_001797636.1 tyrosine-type recombinase/integrase [Staphylococcus aureus]	100	99.0	8.76e-64
BAAHSR010000002.1_235|259880|260038|-1|ID=1_235;partial=00;start_type=ATG;rbs_motif=None;rbs_spacer=None;gc_cont=0.346	WP_000237577.1 integrase [Staphylococcus aureus]	100	98.1	7.16e-29
BAAHSR010000002.1_236|260398|261009|1|ID=1_236;partial=00;start_type=ATG;rbs_motif=AGGAG;rbs_spacer=5-10bp;gc_cont=0.306	WP_000475326.1 MULTISPECIES: staphylococcal enterotoxin-like toxin X [Staphylococcus]	100	99.5	3.94e-140
