BAAHSV010000001.1_356|379647|380117|1|ID=1_356;partial=00;start_type=ATG;rbs_motif=AGGAG;rbs_spacer=5-10bp;gc_cont=0.308	WP_000088431.1 MULTISPECIES: osmotic stress response protein [Staphylococcus]	100	99.4	1.65e-109
BAAHSV010000001.1_357|380272|380706|1|ID=1_357;partial=00;start_type=ATG;rbs_motif=GGAG/GAGG;rbs_spacer=5-10bp;gc_cont=0.347	WP_000491986.1 MULTISPECIES: GNAT family N-acetyltransferase [Staphylococcus]	100	99.3	3.71e-98
BAAHSV010000001.1_358|380913|384704|1|ID=1_358;partial=00;start_type=ATG;rbs_motif=None;rbs_spacer=None;gc_cont=0.349	WP_001074556.1 MULTISPECIES: bifunctional autolysin [Staphylococcus]	100	99.4	0.0
BAAHSV010000001.1_359|384911|385330|-1|ID=1_359;partial=00;start_type=ATG;rbs_motif=GGAG/GAGG;rbs_spacer=5-10bp;gc_cont=0.314	WP_000278010.1 MULTISPECIES: MarR family transcriptional regulator [Staphylococcus]	100	99.3	1.53e-90
BAAHSV010000001.1_360|385483|386493|1|ID=1_360;partial=00;start_type=ATG;rbs_motif=AGGAG;rbs_spacer=5-10bp;gc_cont=0.272	WP_000202439.1 MULTISPECIES: acyltransferase family protein [Staphylococcus]	100	99.7	5.81e-238
BAAHSV010000001.1_361|386689|387843|1|ID=1_361;partial=00;start_type=ATG;rbs_motif=GGAG/GAGG;rbs_spacer=5-10bp;gc_cont=0.319	WP_000777581.1 MULTISPECIES: aminotransferase class I/II-fold pyridoxal phosphate-dependent enzyme [Staphylococcus]	100	99.7	3.09e-280
BAAHSV010000001.1_362|388371|389381|1|ID=1_362;partial=00;start_type=ATG;rbs_motif=GGAG/GAGG;rbs_spacer=5-10bp;gc_cont=0.369	WP_031844680.1 Glu-specific serine endopeptidase SspA [Staphylococcus aureus]	100	99.7	6.59e-196
BAAHSV010000001.1_363|389463|390644|1|ID=1_363;partial=00;start_type=ATG;rbs_motif=GGAG/GAGG;rbs_spacer=5-10bp;gc_cont=0.306	WP_001088780.1 MULTISPECIES: cysteine protease staphopain B [Staphylococcus]	100	99.7	1.32e-281
BAAHSV010000001.1_364|390682|391011|1|ID=1_364;partial=00;start_type=ATG;rbs_motif=GGA/GAG/AGG;rbs_spacer=5-10bp;gc_cont=0.309	WP_000284457.1 MULTISPECIES: staphostatin B [Bacteria]	100	99.1	5.74e-74
BAAHSV010000001.1_365|391250|392071|-1|ID=1_365;partial=00;start_type=ATG;rbs_motif=AGGAG;rbs_spacer=5-10bp;gc_cont=0.386	WP_000184947.1 MULTISPECIES: 1,4-dihydroxy-2-naphthoyl-CoA synthase [Staphylococcus]	100	99.6	7.34e-198
BAAHSV010000001.1_366|392064|392867|-1|ID=1_366;partial=00;start_type=ATG;rbs_motif=GGA/GAG/AGG;rbs_spacer=11-12bp;gc_cont=0.327	WP_000150195.1 MULTISPECIES: 2-succinyl-6-hydroxy-2,4-cyclohexadiene-1-carboxylate synthase [Staphylococcus]	100	99.6	6.75e-191
BAAHSV010000001.1_367|392854|394527|-1|ID=1_367;partial=00;start_type=ATG;rbs_motif=AGGAG;rbs_spacer=5-10bp;gc_cont=0.341	WP_000526687.1 MULTISPECIES: 2-succinyl-5-enolpyruvyl-6-hydroxy-3-cyclohexene-1-carboxylic-acid synthase [Staphylococcus]	100	99.8	0.0
BAAHSV010000001.1_368|394514|395875|-1|ID=1_368;partial=00;start_type=ATG;rbs_motif=AGxAG;rbs_spacer=5-10bp;gc_cont=0.322	WP_000190608.1 isochorismate synthase [Staphylococcus aureus]	99.1	99.8	0.0
BAAHSV010000001.1_369|396057|396995|1|ID=1_369;partial=00;start_type=ATG;rbs_motif=AGGA/GGAG/GAGG;rbs_spacer=11-12bp;gc_cont=0.349	WP_000070966.1 MULTISPECIES: 1,4-dihydroxy-2-naphthoate polyprenyltransferase [Staphylococcus]	100	99.7	3.27e-216
BAAHSV010000001.1_370|397047|397598|-1|ID=1_370;partial=00;start_type=GTG;rbs_motif=GGA/GAG/AGG;rbs_spacer=11-12bp;gc_cont=0.321	WP_000620953.1 MULTISPECIES: GNAT family N-acetyltransferase [Staphylococcus]	100	99.5	1.71e-131
BAAHSV010000001.1_371|397763|397978|1|ID=1_371;partial=00;start_type=ATG;rbs_motif=AGGAG;rbs_spacer=5-10bp;gc_cont=0.269	WP_000867357.1 MULTISPECIES: TM2 domain-containing protein [Staphylococcus]	100	98.6	4.25e-45
BAAHSV010000001.1_372|398057|398173|1|ID=1_372;partial=00;start_type=ATG;rbs_motif=GGAG/GAGG;rbs_spacer=5-10bp;gc_cont=0.274	WP_001248716.1 SAR1012 family small protein [Staphylococcus aureus]	100	97.4	5.79e-18
BAAHSV010000001.1_373|398219|399178|-1|ID=1_373;partial=00;start_type=GTG;rbs_motif=GGAG/GAGG;rbs_spacer=5-10bp;gc_cont=0.341	WP_001081351.1 MULTISPECIES: ABC transporter substrate-binding protein [Staphylococcus]	100	99.7	3.54e-219
BAAHSV010000001.1_374|399634|400011|1|ID=1_374;partial=00;start_type=ATG;rbs_motif=None;rbs_spacer=None;gc_cont=0.325	WP_000766009.1 MULTISPECIES: DoxX family protein [Staphylococcus]	100	93.7	5.61e-78
BAAHSV010000001.1_375|400100|401581|-1|ID=1_375;partial=00;start_type=ATG;rbs_motif=AGGA;rbs_spacer=5-10bp;gc_cont=0.269	WP_000719184.1 MULTISPECIES: glycosyltransferase [Staphylococcus]	100	99.8	0.0
BAAHSV010000001.1_376|401587|401874|-1|ID=1_376;partial=00;start_type=ATG;rbs_motif=GGAG/GAGG;rbs_spacer=5-10bp;gc_cont=0.233	WP_000410720.1 MULTISPECIES: hypothetical protein [Bacillota]	100	99.0	1.58e-60
BAAHSV010000001.1_378|402531|403172|-1|ID=1_378;partial=00;start_type=ATG;rbs_motif=GGAG/GAGG;rbs_spacer=5-10bp;gc_cont=0.279	WP_000571178.1 MULTISPECIES: ABC transporter ATP-binding protein [Staphylococcus]	100	99.5	2.86e-147
BAAHSV010000001.1_379|403169|403489|-1|ID=1_379;partial=00;start_type=ATG;rbs_motif=AGGAG;rbs_spacer=5-10bp;gc_cont=0.305	WP_000668623.1 MULTISPECIES: YxeA family protein [Staphylococcus]	100	99.1	3.38e-67
BAAHSV010000001.1_380|403492|405456|-1|ID=1_380;partial=00;start_type=ATG;rbs_motif=GGAG/GAGG;rbs_spacer=5-10bp;gc_cont=0.269	WP_070598976.1 bacteriocin-associated integral membrane family protein [Staphylococcus aureus]	100	99.8	0.0
BAAHSV010000001.1_382|406800|407402|-1|ID=1_382;partial=00;start_type=ATG;rbs_motif=GGA/GAG/AGG;rbs_spacer=5-10bp;gc_cont=0.272	WP_001033867.1 MULTISPECIES: CPBP family glutamic-type intramembrane protease [Staphylococcus]	100	99.5	2.18e-131
BAAHSV010000001.1_383|407417|407593|-1|ID=1_383;partial=00;start_type=ATG;rbs_motif=AGGAG;rbs_spacer=5-10bp;gc_cont=0.305	WP_000214898.1 MULTISPECIES: YkvS family protein [Bacteria]	100	98.3	8.10e-33
BAAHSV010000001.1_384|407792|408778|1|ID=1_384;partial=00;start_type=ATG;rbs_motif=GGAG/GAGG;rbs_spacer=5-10bp;gc_cont=0.305	WP_000668820.1 MULTISPECIES: lipoate--protein ligase [Staphylococcus]	100	99.7	7.04e-235
BAAHSV010000001.1_385|408859|409077|-1|ID=1_385;partial=00;start_type=ATG;rbs_motif=GGA/GAG/AGG;rbs_spacer=11-12bp;gc_cont=0.338	WP_000876826.1 MULTISPECIES: IDEAL domain-containing protein [Staphylococcus]	100	98.6	3.63e-42
BAAHSV010000001.1_386|409287|409856|1|ID=1_386;partial=00;start_type=ATG;rbs_motif=GGAG/GAGG;rbs_spacer=5-10bp;gc_cont=0.302	WP_000287265.1 MULTISPECIES: competence protein ComK [Staphylococcus]	100	99.5	2.51e-136
BAAHSV010000001.1_387|410343|411857|-1|ID=1_387;partial=00;start_type=ATG;rbs_motif=GGAG/GAGG;rbs_spacer=5-10bp;gc_cont=0.321	WP_103263403.1 bifunctional metallophosphatase/5'-nucleotidase [Staphylococcus aureus]	100	99.6	0.0
BAAHSV010000001.1_388|411993|413351|-1|ID=1_388;partial=00;start_type=GTG;rbs_motif=GGAG/GAGG;rbs_spacer=5-10bp;gc_cont=0.319	WP_000021865.1 MULTISPECIES: TrkH family potassium uptake protein [Staphylococcus]	100	99.8	8.78e-294
BAAHSV010000001.1_389|413368|415692|-1|ID=1_389;partial=00;start_type=ATG;rbs_motif=None;rbs_spacer=None;gc_cont=0.315	WP_076035548.1 S1C family serine protease [Staphylococcus aureus]	100	99.9	0.0
BAAHSV010000001.1_390|415911|416714|-1|ID=1_390;partial=00;start_type=ATG;rbs_motif=AGGAG;rbs_spacer=5-10bp;gc_cont=0.369	WP_000928413.1 MULTISPECIES: TerC family protein [Staphylococcus]	100	99.6	3.59e-186
BAAHSV010000001.1_391|417016|418578|-1|ID=1_391;partial=00;start_type=ATG;rbs_motif=AGGAG;rbs_spacer=5-10bp;gc_cont=0.340	WP_001049959.1 MULTISPECIES: peptide chain release factor 3 [Staphylococcus]	100	99.8	0.0
BAAHSV010000001.1_392|418578|418838|-1|ID=1_392;partial=00;start_type=GTG;rbs_motif=None;rbs_spacer=None;gc_cont=0.314	WP_001795833.1 YueH family protein [Staphylococcus aureus]	100	98.9	8.61e-54
BAAHSV010000001.1_393|418822|420303|-1|ID=1_393;partial=00;start_type=TTG;rbs_motif=AGGAG;rbs_spacer=5-10bp;gc_cont=0.369	WP_000340119.1 MULTISPECIES: UDP-N-acetylmuramoyl-L-alanyl-D-glutamate--L-lysine ligase [Staphylococcus]	100	99.8	0.0
BAAHSV010000001.1_394|420736|421911|1|ID=1_394;partial=00;start_type=ATG;rbs_motif=GGAG/GAGG;rbs_spacer=5-10bp;gc_cont=0.327	WP_000258650.1 MULTISPECIES: diglucosyl diacylglycerol synthase [Staphylococcus]	100	99.7	1.49e-286
BAAHSV010000001.1_395|421889|423079|1|ID=1_395;partial=00;start_type=ATG;rbs_motif=GGA/GAG/AGG;rbs_spacer=5-10bp;gc_cont=0.320	WP_001154222.1 MULTISPECIES: lipoteichoic acid biosynthesis MFS flippase LtaA [Staphylococcus]	100	99.7	2.48e-267
BAAHSV010000001.1_396|423192|423701|-1|ID=1_396;partial=00;start_type=ATG;rbs_motif=AGGAG;rbs_spacer=5-10bp;gc_cont=0.341	WP_000600392.1 MULTISPECIES: YjcG family protein [Staphylococcus]	100	99.4	2.12e-116
BAAHSV010000001.1_397|423895|424653|-1|ID=1_397;partial=00;start_type=ATG;rbs_motif=GGA/GAG/AGG;rbs_spacer=11-12bp;gc_cont=0.315	WP_001288681.1 MULTISPECIES: esterase family protein [Staphylococcus]	100	99.6	7.60e-185
BAAHSV010000001.1_398|424795|426363|-1|ID=1_398;partial=00;start_type=ATG;rbs_motif=GGA/GAG/AGG;rbs_spacer=5-10bp;gc_cont=0.357	WP_000570699.1 MULTISPECIES: alanine/glycine:cation symporter family protein [Staphylococcus]	100	99.8	0.0
BAAHSV010000001.1_399|426705|427790|1|ID=1_399;partial=00;start_type=ATG;rbs_motif=AGGAGG;rbs_spacer=5-10bp;gc_cont=0.310	WP_000933105.1 MULTISPECIES: lipoteichoic acid biosynthesis protein CozEa [Staphylococcus]	100	99.7	6.27e-241
BAAHSV010000001.1_400|427985|428755|-1|ID=1_400;partial=00;start_type=ATG;rbs_motif=AGGAG;rbs_spacer=5-10bp;gc_cont=0.354	WP_000933195.1 MULTISPECIES: enoyl-ACP reductase FabI [Staphylococcus]	100	99.6	1.70e-174
BAAHSV010000001.1_401|429033|430877|-1|ID=1_401;partial=00;start_type=ATG;rbs_motif=AGGAG;rbs_spacer=5-10bp;gc_cont=0.317	WP_000395153.1 MULTISPECIES: monovalent cation:proton antiporter family protein [Staphylococcus]	100	99.8	0.0
BAAHSV010000001.1_402|430887|432272|-1|ID=1_402;partial=00;start_type=ATG;rbs_motif=GGA/GAG/AGG;rbs_spacer=5-10bp;gc_cont=0.334	WP_000062417.1 MULTISPECIES: magnesium transporter [Staphylococcus]	100	99.8	4.05e-315
BAAHSV010000001.1_403|432293|433147|-1|ID=1_403;partial=00;start_type=ATG;rbs_motif=None;rbs_spacer=None;gc_cont=0.310	WP_000669939.1 MULTISPECIES: RluA family pseudouridine synthase [Staphylococcus]	100	99.6	1.09e-209
BAAHSV010000001.1_404|433144|433953|-1|ID=1_404;partial=00;start_type=ATG;rbs_motif=AGGA/GGAG/GAGG;rbs_spacer=11-12bp;gc_cont=0.354	WP_001270834.1 MULTISPECIES: NAD kinase [Staphylococcus]	100	99.6	1.04e-195
BAAHSV010000001.1_405|433970|434605|-1|ID=1_405;partial=00;start_type=ATG;rbs_motif=None;rbs_spacer=None;gc_cont=0.338	WP_001077683.1 MULTISPECIES: GTP pyrophosphokinase [Staphylococcus]	100	99.5	1.00e-146
BAAHSV010000001.1_406|434622|434969|-1|ID=1_406;partial=00;start_type=ATG;rbs_motif=AGGAG;rbs_spacer=5-10bp;gc_cont=0.293	WP_001242102.1 MULTISPECIES: UPF0738 family protein [Staphylococcus]	100	99.1	1.67e-78
BAAHSV010000001.1_407|435155|435748|1|ID=1_407;partial=00;start_type=ATG;rbs_motif=AGGA/GGAG/GAGG;rbs_spacer=11-12bp;gc_cont=0.298	WP_000224622.1 MULTISPECIES: CYTH domain-containing protein [Staphylococcus]	100	99.5	2.68e-135
BAAHSV010000001.1_408|435852|436217|1|ID=1_408;partial=00;start_type=ATG;rbs_motif=None;rbs_spacer=None;gc_cont=0.347	WP_000214075.1 truncated hemoglobin YjbI [Staphylococcus aureus]	100	99.2	1.24e-85
BAAHSV010000001.1_409|436240|437046|1|ID=1_409;partial=00;start_type=ATG;rbs_motif=GGA/GAG/AGG;rbs_spacer=5-10bp;gc_cont=0.305	WP_000896697.1 MULTISPECIES: protease adaptor protein YjbH [Staphylococcus]	100	99.6	1.65e-187
BAAHSV010000001.1_410|437506|439314|-1|ID=1_410;partial=00;start_type=ATG;rbs_motif=AGGAGG;rbs_spacer=5-10bp;gc_cont=0.321	WP_000082731.1 MULTISPECIES: oligoendopeptidase F [Staphylococcus]	100	99.8	0.0
BAAHSV010000001.1_411|439362|440063|-1|ID=1_411;partial=00;start_type=TTG;rbs_motif=None;rbs_spacer=None;gc_cont=0.269	WP_048523697.1 competence protein CoiA family protein, partial [Staphylococcus aureus]	99.6	99.6	2.11e-171
BAAHSV010000001.1_412|440090|440347|-1|ID=1_412;partial=00;start_type=ATG;rbs_motif=GGAG/GAGG;rbs_spacer=5-10bp;gc_cont=0.318	WP_419717248.1 competence protein CoiA family protein, partial [Staphylococcus aureus]	100	98.8	8.47e-55
BAAHSV010000001.1_413|440468|441187|-1|ID=1_413;partial=00;start_type=ATG;rbs_motif=AGGAG;rbs_spacer=5-10bp;gc_cont=0.317	WP_001217730.1 MULTISPECIES: adaptor protein MecA [Staphylococcus]	100	99.6	1.07e-164
BAAHSV010000001.1_414|441558|441953|-1|ID=1_414;partial=00;start_type=ATG;rbs_motif=AGGAG;rbs_spacer=5-10bp;gc_cont=0.326	WP_000258003.1 MULTISPECIES: transcriptional regulator SpxA [Bacteria]	100	99.2	2.71e-87
BAAHSV010000001.1_415|442248|443237|1|ID=1_415;partial=00;start_type=ATG;rbs_motif=GGA/GAG/AGG;rbs_spacer=5-10bp;gc_cont=0.346	WP_000448934.1 MULTISPECIES: tryptophan--tRNA ligase [Staphylococcus]	100	99.7	4.59e-236
BAAHSV010000001.1_416|443279|444160|-1|ID=1_416;partial=00;start_type=ATG;rbs_motif=GGA/GAG/AGG;rbs_spacer=5-10bp;gc_cont=0.313	WP_001180262.1 MULTISPECIES: oligopeptide ABC transporter permease [Staphylococcus]	100	99.7	6.67e-195
BAAHSV010000001.1_417|444172|445134|-1|ID=1_417;partial=00;start_type=ATG;rbs_motif=GGA/GAG/AGG;rbs_spacer=5-10bp;gc_cont=0.287	WP_000593417.1 MULTISPECIES: oligopeptide ABC transporter permease [Staphylococcus]	100	99.7	1.56e-218
BAAHSV010000001.1_418|445127|446107|-1|ID=1_418;partial=00;start_type=ATG;rbs_motif=AGGAG;rbs_spacer=5-10bp;gc_cont=0.310	WP_000427770.1 MULTISPECIES: ABC transporter ATP-binding protein [Staphylococcus]	100	99.7	4.95e-234
BAAHSV010000001.1_419|446110|447096|-1|ID=1_419;partial=00;start_type=ATG;rbs_motif=None;rbs_spacer=None;gc_cont=0.300	WP_001067049.1 ABC transporter ATP-binding protein [Staphylococcus aureus]	100	99.7	3.07e-229
BAAHSV010000001.1_420|447147|448862|-1|ID=1_420;partial=00;start_type=ATG;rbs_motif=AGGAG;rbs_spacer=5-10bp;gc_cont=0.325	WP_000517187.1 MULTISPECIES: oligopeptide ABC transporter substrate-binding protein [Staphylococcus]	100	99.8	0.0
BAAHSV010000001.1_421|449074|450729|-1|ID=1_421;partial=00;start_type=ATG;rbs_motif=GGA/GAG/AGG;rbs_spacer=5-10bp;gc_cont=0.329	WP_252305432.1 peptide ABC transporter substrate-binding protein [Staphylococcus aureus]	100	99.8	0.0
BAAHSV010000001.1_422|450748|451689|-1|ID=1_422;partial=00;start_type=ATG;rbs_motif=GGA/GAG/AGG;rbs_spacer=5-10bp;gc_cont=0.332	WP_000786734.1 MULTISPECIES: ABC transporter ATP-binding protein [Staphylococcus]	100	99.7	9.05e-219
BAAHSV010000001.1_423|451679|452761|-1|ID=1_423;partial=00;start_type=ATG;rbs_motif=AGxAGG/AGGxGG;rbs_spacer=5-10bp;gc_cont=0.357	WP_000140050.1 MULTISPECIES: ABC transporter ATP-binding protein [Staphylococcus]	100	99.7	1.65e-256
BAAHSV010000001.1_424|452778|453848|-1|ID=1_424;partial=00;start_type=ATG;rbs_motif=AGGAG;rbs_spacer=5-10bp;gc_cont=0.338	WP_000829632.1 MULTISPECIES: oligopeptide ABC transporter permease [Staphylococcus]	100	99.7	9.36e-245
BAAHSV010000001.1_425|453848|454774|-1|ID=1_425;partial=00;start_type=ATG;rbs_motif=AGGAG;rbs_spacer=5-10bp;gc_cont=0.328	WP_000521533.1 MULTISPECIES: oligopeptide ABC transporter permease [Staphylococcus]	100	99.7	7.88e-206
BAAHSV010000001.1_426|455017|455388|1|ID=1_426;partial=00;start_type=ATG;rbs_motif=GGAG/GAGG;rbs_spacer=5-10bp;gc_cont=0.269	WP_000915155.1 MULTISPECIES: DUF3899 domain-containing protein [Staphylococcus]	100	99.2	4.63e-73
BAAHSV010000001.1_427|455443|456687|-1|ID=1_427;partial=00;start_type=ATG;rbs_motif=AGGAG;rbs_spacer=5-10bp;gc_cont=0.387	WP_000081237.1 beta-ketoacyl-ACP synthase II [Staphylococcus aureus]	100	99.8	1.36e-296
BAAHSV010000001.1_428|456699|457640|-1|ID=1_428;partial=00;start_type=ATG;rbs_motif=GGA/GAG/AGG;rbs_spacer=5-10bp;gc_cont=0.356	WP_001100525.1 MULTISPECIES: beta-ketoacyl-ACP synthase III [Staphylococcus]	100	99.7	2.42e-223
BAAHSV010000001.1_429|457935|458120|1|ID=1_429;partial=00;start_type=ATG;rbs_motif=GGAG/GAGG;rbs_spacer=5-10bp;gc_cont=0.344	WP_000682089.1 MULTISPECIES: YjzD family protein [Staphylococcus]	100	98.4	6.99e-33
BAAHSV010000001.1_430|458377|458811|-1|ID=1_430;partial=00;start_type=ATG;rbs_motif=AGGAG;rbs_spacer=5-10bp;gc_cont=0.331	WP_000769689.1 MULTISPECIES: MAP domain-containing protein [Staphylococcus]	100	99.3	1.91e-91
BAAHSV010000001.1_431|459122|459637|-1|ID=1_431;partial=00;start_type=ATG;rbs_motif=AGGAG;rbs_spacer=5-10bp;gc_cont=0.320	WP_000695342.1 MULTISPECIES: YbhB/YbcL family Raf kinase inhibitor-like protein [Staphylococcus]	100	99.4	4.80e-123
BAAHSV010000001.1_432|459621|460739|-1|ID=1_432;partial=00;start_type=ATG;rbs_motif=GGA/GAG/AGG;rbs_spacer=5-10bp;gc_cont=0.236	WP_001037436.1 MULTISPECIES: MFS transporter [Staphylococcus]	100	99.7	3.54e-248
BAAHSV010000001.1_433|460732|461373|-1|ID=1_433;partial=00;start_type=ATG;rbs_motif=AGGAG;rbs_spacer=5-10bp;gc_cont=0.257	WP_000404422.1 MULTISPECIES: L-threonylcarbamoyladenylate synthase [Staphylococcus]	100	99.5	1.26e-150
BAAHSV010000001.1_434|461357|462502|-1|ID=1_434;partial=00;start_type=ATG;rbs_motif=AGGA/GGAG/GAGG;rbs_spacer=11-12bp;gc_cont=0.268	WP_000619366.1 LeuA family protein [Staphylococcus aureus]	100	99.7	5.44e-268
BAAHSV010000001.1_435|462612|463481|1|ID=1_435;partial=00;start_type=ATG;rbs_motif=GGAG/GAGG;rbs_spacer=5-10bp;gc_cont=0.272	WP_001047066.1 MULTISPECIES: LysR family transcriptional regulator [Staphylococcus]	100	99.7	1.49e-205
BAAHSV010000001.1_436|463540|466149|-1|ID=1_436;partial=00;start_type=ATG;rbs_motif=GGAG/GAGG;rbs_spacer=5-10bp;gc_cont=0.338	WP_000353949.1 MULTISPECIES: ATP-dependent chaperone ClpB [Staphylococcus]	99.8	99.9	0.0
BAAHSV010000001.1_438|466352|468166|-1|ID=1_438;partial=00;start_type=ATG;rbs_motif=GGA/GAG/AGG;rbs_spacer=11-12bp;gc_cont=0.305	WP_001044214.1 MULTISPECIES: acyltransferase family protein [Staphylococcus]	100	99.8	0.0
BAAHSV010000001.1_439|468713|469021|-1|ID=1_439;partial=00;start_type=ATG;rbs_motif=GGAG/GAGG;rbs_spacer=5-10bp;gc_cont=0.362	WP_000390575.1 MULTISPECIES: metal-sulfur cluster assembly factor [Bacilli]	100	99.0	2.07e-66
BAAHSV010000001.1_440|469135|469959|1|ID=1_440;partial=00;start_type=ATG;rbs_motif=AGGAG;rbs_spacer=5-10bp;gc_cont=0.315	WP_001182436.1 MULTISPECIES: Cof-type HAD-IIB family hydrolase [Staphylococcus]	100	99.6	1.01e-200
BAAHSV010000001.1_441|470011|471327|1|ID=1_441;partial=00;start_type=ATG;rbs_motif=AGGAG;rbs_spacer=5-10bp;gc_cont=0.353	WP_001124525.1 MULTISPECIES: CoA-disulfide reductase [Staphylococcus]	100	99.8	0.0
BAAHSV010000001.1_442|471498|471887|-1|ID=1_442;partial=00;start_type=ATG;rbs_motif=GGA/GAG/AGG;rbs_spacer=5-10bp;gc_cont=0.326	WP_000902817.1 MULTISPECIES: YisL family protein [Staphylococcus]	100	99.2	2.08e-81
BAAHSV010000001.1_443|472216|473118|-1|ID=1_443;partial=00;start_type=ATG;rbs_motif=AGGAG;rbs_spacer=5-10bp;gc_cont=0.330	WP_000670752.1 MULTISPECIES: fumarylacetoacetate hydrolase family protein [Staphylococcus]	100	99.7	1.90e-218
BAAHSV010000001.1_444|473284|476937|-1|ID=1_444;partial=00;start_type=ATG;rbs_motif=GGA/GAG/AGG;rbs_spacer=5-10bp;gc_cont=0.335	WP_000154914.1 helicase-exonuclease AddAB subunit AddA [Staphylococcus aureus]	100	99.9	0.0
BAAHSV010000001.1_445|476938|480414|-1|ID=1_445;partial=00;start_type=ATG;rbs_motif=GGAG/GAGG;rbs_spacer=5-10bp;gc_cont=0.323	WP_000172342.1 MULTISPECIES: helicase-exonuclease AddAB subunit AddB [Staphylococcus]	100	99.9	0.0
BAAHSV010000001.1_446|480574|481149|-1|ID=1_446;partial=00;start_type=TTG;rbs_motif=GGAG/GAGG;rbs_spacer=5-10bp;gc_cont=0.312	WP_000711486.1 MULTISPECIES: signal peptidase I [Staphylococcus]	100	99.5	1.24e-137
BAAHSV010000001.1_447|481165|481689|-1|ID=1_447;partial=00;start_type=GTG;rbs_motif=AGGAG;rbs_spacer=5-10bp;gc_cont=0.316	WP_000758215.1 MULTISPECIES: signal peptidase I [Staphylococcus]	100	99.4	2.27e-118
BAAHSV010000001.1_448|481694|482269|-1|ID=1_448;partial=00;start_type=TTG;rbs_motif=GGA/GAG/AGG;rbs_spacer=5-10bp;gc_cont=0.304	WP_000007967.1 MULTISPECIES: TVP38/TMEM64 family protein [Staphylococcus]	100	99.5	1.01e-127
BAAHSV010000001.1_449|482594|483925|-1|ID=1_449;partial=00;start_type=ATG;rbs_motif=AGGAG;rbs_spacer=5-10bp;gc_cont=0.336	WP_000148855.1 MULTISPECIES: glucose-6-phosphate isomerase [Staphylococcus]	100	99.8	0.0
BAAHSV010000001.1_450|484276|485481|1|ID=1_450;partial=00;start_type=ATG;rbs_motif=GGAG/GAGG;rbs_spacer=5-10bp;gc_cont=0.353	WP_000660045.1 MULTISPECIES: argininosuccinate synthase [Staphylococcus]	100	99.8	2.84e-296
BAAHSV010000001.1_451|485471|486850|1|ID=1_451;partial=00;start_type=ATG;rbs_motif=GGAG/GAGG;rbs_spacer=5-10bp;gc_cont=0.345	WP_000066062.1 argininosuccinate lyase [Staphylococcus aureus]	100	99.8	0.0
BAAHSV010000001.1_452|487092|488021|1|ID=1_452;partial=00;start_type=ATG;rbs_motif=AGGA;rbs_spacer=5-10bp;gc_cont=0.331	WP_000185319.1 MULTISPECIES: glycerophosphodiester phosphodiesterase [Staphylococcus]	100	99.7	7.84e-227
BAAHSV010000001.1_453|488524|489768|-1|ID=1_453;partial=00;start_type=ATG;rbs_motif=AGGA/GGAG/GAGG;rbs_spacer=11-12bp;gc_cont=0.369	WP_000138486.1 Glu/Leu/Phe/Val family dehydrogenase [Staphylococcus aureus]	100	99.8	1.04e-300
BAAHSV010000001.1_454|489877|491067|-1|ID=1_454;partial=00;start_type=ATG;rbs_motif=GGAG/GAGG;rbs_spacer=5-10bp;gc_cont=0.357	WP_000167314.1 MULTISPECIES: ornithine--oxo-acid transaminase [Staphylococcus]	100	99.7	4.33e-293
BAAHSV010000001.1_455|491375|492502|-1|ID=1_455;partial=00;start_type=ATG;rbs_motif=AGGAG;rbs_spacer=5-10bp;gc_cont=0.368	WP_000838037.1 MULTISPECIES: NADH-dependent flavin oxidoreductase [Staphylococcus]	100	99.7	3.31e-275
BAAHSV010000001.1_456|492864|493208|-1|ID=1_456;partial=00;start_type=GTG;rbs_motif=None;rbs_spacer=None;gc_cont=0.330	WP_001788532.1 S1 domain-containing post-transcriptional regulator Ygs [Staphylococcus aureus]	100	99.1	1.01e-74
BAAHSV010000001.1_457|493657|494250|-1|ID=1_457;partial=00;start_type=ATG;rbs_motif=GGAG/GAGG;rbs_spacer=5-10bp;gc_cont=0.354	WP_000035058.1 MULTISPECIES: peptidylprolyl isomerase [Staphylococcus]	100	99.5	3.15e-143
BAAHSV010000001.1_458|494314|494697|1|ID=1_458;partial=00;start_type=ATG;rbs_motif=GGAG/GAGG;rbs_spacer=5-10bp;gc_cont=0.341	WP_000781156.1 MULTISPECIES: kinase-associated lipoprotein B [Staphylococcus]	100	99.2	5.34e-83
BAAHSV010000001.1_459|494828|497233|1|ID=1_459;partial=00;start_type=GTG;rbs_motif=AGGAG;rbs_spacer=5-10bp;gc_cont=0.335	WP_000054609.1 MULTISPECIES: Na+/H+ antiporter Mnh1 subunit A [Staphylococcus]	100	99.9	0.0
BAAHSV010000001.1_460|497226|497654|1|ID=1_460;partial=00;start_type=ATG;rbs_motif=GGAG/GAGG;rbs_spacer=5-10bp;gc_cont=0.336	WP_001081626.1 MULTISPECIES: Na+/H+ antiporter Mnh1 subunit B [Staphylococcus]	100	99.3	4.90e-93
BAAHSV010000001.1_461|497666|497995|1|ID=1_461;partial=00;start_type=ATG;rbs_motif=GGA/GAG/AGG;rbs_spacer=5-10bp;gc_cont=0.348	WP_011443624.1 Na+/H+ antiporter Mnh1 subunit C [Staphylococcus aureus]	100	99.1	1.16e-64
BAAHSV010000001.1_462|497988|499484|1|ID=1_462;partial=00;start_type=ATG;rbs_motif=AGGAG;rbs_spacer=5-10bp;gc_cont=0.337	WP_000573079.1 Na+/H+ antiporter Mnh1 subunit D [Staphylococcus aureus]	100	99.8	0.0
BAAHSV010000001.1_463|499486|499965|1|ID=1_463;partial=00;start_type=ATG;rbs_motif=AGGAG;rbs_spacer=5-10bp;gc_cont=0.296	WP_000290674.1 MULTISPECIES: Na+/H+ antiporter Mnh1 subunit E [Staphylococcus]	100	99.4	1.02e-100
BAAHSV010000001.1_464|499965|500258|1|ID=1_464;partial=00;start_type=ATG;rbs_motif=AGxAGG/AGGxGG;rbs_spacer=5-10bp;gc_cont=0.320	WP_001016306.1 MULTISPECIES: Na+/H+ antiporter Mnh1 subunit F [Staphylococcus]	100	99.0	1.24e-49
BAAHSV010000001.1_465|500236|500592|1|ID=1_465;partial=00;start_type=ATG;rbs_motif=GGA/GAG/AGG;rbs_spacer=5-10bp;gc_cont=0.325	WP_000590451.1 MULTISPECIES: Na+/H+ antiporter Mnh1 subunit G [Staphylococcus]	100	99.2	1.35e-65
BAAHSV010000001.1_466|500841|501995|1|ID=1_466;partial=00;start_type=ATG;rbs_motif=GGAG/GAGG;rbs_spacer=5-10bp;gc_cont=0.348	WP_000558769.1 MULTISPECIES: FAD/NAD(P)-binding protein [Staphylococcus]	100	99.7	1.81e-288
BAAHSV010000001.1_467|502051|502425|-1|ID=1_467;partial=00;start_type=ATG;rbs_motif=GGAG/GAGG;rbs_spacer=5-10bp;gc_cont=0.331	WP_000149295.1 MULTISPECIES: PaaI family thioesterase [Staphylococcus]	100	99.2	1.27e-84
BAAHSV010000001.1_468|502444|503760|-1|ID=1_468;partial=00;start_type=ATG;rbs_motif=AGGA;rbs_spacer=5-10bp;gc_cont=0.326	WP_000606316.1 Na+/H+ antiporter family protein [Staphylococcus aureus]	96.1	99.8	3.37e-284
BAAHSV010000001.1_469|504171|505646|-1|ID=1_469;partial=00;start_type=ATG;rbs_motif=AGGAG;rbs_spacer=5-10bp;gc_cont=0.340	WP_001009697.1 MULTISPECIES: M17 family metallopeptidase [Staphylococcus]	100	99.8	0.0
BAAHSV010000001.1_470|505777|506985|-1|ID=1_470;partial=00;start_type=ATG;rbs_motif=GGA/GAG/AGG;rbs_spacer=5-10bp;gc_cont=0.356	WP_000046076.1 MULTISPECIES: NAD(P)/FAD-dependent oxidoreductase [Staphylococcus]	100	99.8	1.10e-289
BAAHSV010000001.1_471|507439|507798|-1|ID=1_471;partial=00;start_type=ATG;rbs_motif=AGGAG;rbs_spacer=5-10bp;gc_cont=0.369	WP_001143497.1 MULTISPECIES: HesB/IscA family protein [Staphylococcus]	100	99.2	6.95e-82
BAAHSV010000001.1_472|507811|508047|-1|ID=1_472;partial=00;start_type=ATG;rbs_motif=GGA/GAG/AGG;rbs_spacer=5-10bp;gc_cont=0.354	WP_001068337.1 MULTISPECIES: YuzB family protein [Staphylococcus]	100	98.7	4.85e-54
BAAHSV010000001.1_473|508364|509428|1|ID=1_473;partial=00;start_type=ATG;rbs_motif=GGA/GAG/AGG;rbs_spacer=11-12bp;gc_cont=0.368	WP_000794020.1 MULTISPECIES: NAD(P)/FAD-dependent oxidoreductase [Staphylococcus]	100	99.7	1.17e-262
BAAHSV010000001.1_474|509487|509810|-1|ID=1_474;partial=00;start_type=ATG;rbs_motif=GGA/GAG/AGG;rbs_spacer=5-10bp;gc_cont=0.309	WP_000401414.1 MULTISPECIES: YuzD family protein [Staphylococcus]	100	99.1	1.17e-72
BAAHSV010000001.1_475|509911|510153|1|ID=1_475;partial=00;start_type=ATG;rbs_motif=AGGAG;rbs_spacer=5-10bp;gc_cont=0.395	WP_001141883.1 MULTISPECIES: NifU family protein [Staphylococcus]	100	98.8	3.13e-51
BAAHSV010000001.1_476|510416|511591|-1|ID=1_476;partial=00;start_type=ATG;rbs_motif=GGA/GAG/AGG;rbs_spacer=5-10bp;gc_cont=0.322	WP_000769417.1 D-alanyl-lipoteichoic acid biosynthesis protein DltD [Staphylococcus aureus]	100	99.7	2.37e-283
