BAAHTL010000001.1_242|253529|254497|1|ID=1_242;partial=00;start_type=ATG;rbs_motif=None;rbs_spacer=None;gc_cont=0.343	WP_000837105.1 MULTISPECIES: ABC transporter substrate-binding protein [Staphylococcus]	100	99.7	1.93e-229
BAAHTL010000001.1_243|254494|256050|1|ID=1_243;partial=00;start_type=ATG;rbs_motif=GGAG/GAGG;rbs_spacer=5-10bp;gc_cont=0.328	WP_000127997.1 MULTISPECIES: sensor histidine kinase [Staphylococcus]	100	99.8	0.0
BAAHTL010000001.1_244|256043|256801|1|ID=1_244;partial=00;start_type=ATG;rbs_motif=GGA/GAG/AGG;rbs_spacer=5-10bp;gc_cont=0.321	WP_000477521.1 MULTISPECIES: response regulator transcription factor [Staphylococcus]	100	99.6	7.30e-183
BAAHTL010000001.1_245|257160|258557|-1|ID=1_245;partial=00;start_type=ATG;rbs_motif=None;rbs_spacer=None;gc_cont=0.363	WP_001008722.1 MULTISPECIES: hexose-6-phosphate:phosphate antiporter [Staphylococcus]	100	98.5	0.0
BAAHTL010000001.1_246|258772|259266|1|ID=1_246;partial=00;start_type=ATG;rbs_motif=GGAG/GAGG;rbs_spacer=5-10bp;gc_cont=0.265	WP_000603755.1 MULTISPECIES: isoprenylcysteine carboxyl methyltransferase family protein [Staphylococcus]	100	99.4	8.00e-105
BAAHTL010000001.1_247|259627|260595|-1|ID=1_247;partial=00;start_type=ATG;rbs_motif=AGGAG;rbs_spacer=5-10bp;gc_cont=0.359	WP_000690419.1 MULTISPECIES: sugar phosphate isomerase/epimerase family protein [Staphylococcus]	100	99.7	6.59e-246
BAAHTL010000001.1_248|260650|261690|-1|ID=1_248;partial=00;start_type=ATG;rbs_motif=AGGAG;rbs_spacer=5-10bp;gc_cont=0.395	WP_000163809.1 MULTISPECIES: Gfo/Idh/MocA family protein [Staphylococcus]	100	99.7	1.52e-254
BAAHTL010000001.1_249|261715|262794|-1|ID=1_249;partial=00;start_type=ATG;rbs_motif=AGGAG;rbs_spacer=5-10bp;gc_cont=0.389	WP_000153466.1 MULTISPECIES: Gfo/Idh/MocA family protein [Staphylococcus]	100	99.4	4.99e-264
BAAHTL010000001.1_250|262865|263704|-1|ID=1_250;partial=00;start_type=ATG;rbs_motif=GGAG/GAGG;rbs_spacer=5-10bp;gc_cont=0.339	WP_000162661.1 MULTISPECIES: sugar ABC transporter permease [Staphylococcus]	100	99.6	1.91e-187
BAAHTL010000001.1_251|263706|264974|-1|ID=1_251;partial=00;start_type=ATG;rbs_motif=AGGAG;rbs_spacer=5-10bp;gc_cont=0.355	WP_086098788.1 sugar ABC transporter permease [Staphylococcus aureus]	98.8	99.8	5.35e-298
BAAHTL010000001.1_252|264977|266248|-1|ID=1_252;partial=00;start_type=ATG;rbs_motif=GGAG/GAGG;rbs_spacer=5-10bp;gc_cont=0.340	WP_000034961.1 MULTISPECIES: maltodextrin ABC transporter substrate-binding protein [Staphylococcus]	100	99.8	1.29e-310
BAAHTL010000001.1_253|266261|267358|-1|ID=1_253;partial=00;start_type=ATG;rbs_motif=GGAG/GAGG;rbs_spacer=5-10bp;gc_cont=0.351	WP_000818914.1 MULTISPECIES: ABC transporter ATP-binding protein [Staphylococcus]	100	99.7	7.94e-262
BAAHTL010000001.1_254|267741|268319|-1|ID=1_254;partial=00;start_type=ATG;rbs_motif=GGA/GAG/AGG;rbs_spacer=5-10bp;gc_cont=0.361	WP_000166919.1 MULTISPECIES: M23 family metallopeptidase [Staphylococcus]	100	99.5	3.70e-144
BAAHTL010000001.1_255|268528|269154|1|ID=1_255;partial=00;start_type=ATG;rbs_motif=AGGAG;rbs_spacer=5-10bp;gc_cont=0.321	WP_001151450.1 MULTISPECIES: FMN-dependent NADH-azoreductase [Staphylococcus]	100	99.5	1.17e-148
BAAHTL010000001.1_256|269344|270117|1|ID=1_256;partial=00;start_type=ATG;rbs_motif=GGA/GAG/AGG;rbs_spacer=5-10bp;gc_cont=0.297	WP_000643623.1 MULTISPECIES: tandem-type lipoprotein [Staphylococcus]	100	99.6	5.96e-180
BAAHTL010000001.1_257|270430|272436|-1|ID=1_257;partial=00;start_type=ATG;rbs_motif=AGGAG;rbs_spacer=5-10bp;gc_cont=0.379	WP_000236409.1 MULTISPECIES: gamma-glutamyltransferase [Staphylococcus]	100	99.9	0.0
BAAHTL010000001.1_258|272474|274249|-1|ID=1_258;partial=00;start_type=GTG;rbs_motif=GGA/GAG/AGG;rbs_spacer=5-10bp;gc_cont=0.334	WP_000720804.1 MULTISPECIES: ABC transporter substrate-binding protein [Staphylococcus]	100	99.8	0.0
BAAHTL010000001.1_259|274266|275429|-1|ID=1_259;partial=00;start_type=ATG;rbs_motif=AGGA;rbs_spacer=5-10bp;gc_cont=0.345	WP_000240104.1 MULTISPECIES: ABC transporter permease [Staphylococcus]	100	99.7	3.70e-253
BAAHTL010000001.1_260|275435|276868|-1|ID=1_260;partial=00;start_type=ATG;rbs_motif=None;rbs_spacer=None;gc_cont=0.326	WP_001557565.1 ABC transporter permease [Staphylococcus aureus]	100	99.8	3.40e-306
BAAHTL010000001.1_261|276870|277604|1|ID=1_261;partial=00;start_type=ATG;rbs_motif=GGAG/GAGG;rbs_spacer=5-10bp;gc_cont=0.336	WP_142300295.1 ABC transporter ATP-binding protein, partial [Staphylococcus aureus]	99.6	99.6	5.29e-166
BAAHTL010000001.1_262|277561|278463|1|ID=1_262;partial=00;start_type=ATG;rbs_motif=None;rbs_spacer=None;gc_cont=0.371	WP_423143752.1 ATP-binding cassette domain-containing protein, partial [Staphylococcus aureus]	99.7	95.3	6.41e-199
BAAHTL010000001.1_263|278973|279170|-1|ID=1_263;partial=00;start_type=GTG;rbs_motif=GGA/GAG/AGG;rbs_spacer=5-10bp;gc_cont=0.308	WP_000794565.1 MULTISPECIES: helix-turn-helix transcriptional regulator [Staphylococcus]	100	98.5	1.20e-37
BAAHTL010000001.1_264|279160|279348|-1|ID=1_264;partial=00;start_type=ATG;rbs_motif=GGAG/GAGG;rbs_spacer=5-10bp;gc_cont=0.222	WP_368409519.1 hypothetical protein [Staphylococcus aureus]	98.4	98.4	1.29e-33
BAAHTL010000001.1_265|279335|280057|-1|ID=1_265;partial=00;start_type=ATG;rbs_motif=AGGA;rbs_spacer=5-10bp;gc_cont=0.267	WP_000960712.1 MULTISPECIES: ATP-binding cassette domain-containing protein [Staphylococcus]	100	99.6	6.95e-166
BAAHTL010000001.1_266|280069|280533|-1|ID=1_266;partial=00;start_type=GTG;rbs_motif=None;rbs_spacer=None;gc_cont=0.258	WP_001793228.1 MULTISPECIES: stage II sporulation protein M [Staphylococcus]	100	99.4	6.39e-88
BAAHTL010000001.1_267|280571|282256|-1|ID=1_267;partial=00;start_type=ATG;rbs_motif=AGGAG;rbs_spacer=5-10bp;gc_cont=0.234	WP_031899927.1 membrane protein [Staphylococcus aureus]	99.8	99.8	0.0
BAAHTL010000001.1_268|282327|282548|-1|ID=1_268;partial=00;start_type=ATG;rbs_motif=AGGAGG;rbs_spacer=5-10bp;gc_cont=0.410	WP_000915920.1 MULTISPECIES: putative cyclic bacteriocin [Staphylococcus]	100	98.6	3.32e-43
BAAHTL010000001.1_269|282755|283933|-1|ID=1_269;partial=00;start_type=ATG;rbs_motif=GGAG/GAGG;rbs_spacer=5-10bp;gc_cont=0.307	WP_001233397.1 MULTISPECIES: ABC transporter permease [Staphylococcus]	100	99.7	4.99e-265
BAAHTL010000001.1_270|283930|284610|-1|ID=1_270;partial=00;start_type=ATG;rbs_motif=GGA/GAG/AGG;rbs_spacer=5-10bp;gc_cont=0.316	WP_000571407.1 MULTISPECIES: ABC transporter ATP-binding protein [Staphylococcus]	100	99.6	2.34e-157
BAAHTL010000001.1_271|284607|285362|-1|ID=1_271;partial=00;start_type=TTG;rbs_motif=AGGAG;rbs_spacer=5-10bp;gc_cont=0.316	WP_108947512.1 RND transporter [Staphylococcus aureus]	99.6	99.6	5.05e-169
BAAHTL010000001.1_272|285488|286087|1|ID=1_272;partial=00;start_type=ATG;rbs_motif=AGGAG;rbs_spacer=5-10bp;gc_cont=0.293	WP_000059054.1 MULTISPECIES: hypothetical protein [Staphylococcus]	100	99.5	3.03e-117
BAAHTL010000001.1_273|286234|289023|-1|ID=1_273;partial=00;start_type=ATG;rbs_motif=GGA/GAG/AGG;rbs_spacer=5-10bp;gc_cont=0.332	WP_000331353.1 MULTISPECIES: type I restriction endonuclease subunit R [Staphylococcus]	100	99.9	0.0
BAAHTL010000001.1_274|289711|290589|-1|ID=1_274;partial=00;start_type=ATG;rbs_motif=None;rbs_spacer=None;gc_cont=0.344	WP_000181827.1 MurR/RpiR family transcriptional regulator [Staphylococcus aureus]	92.4	99.3	6.81e-185
BAAHTL010000001.1_275|290589|292043|-1|ID=1_275;partial=00;start_type=ATG;rbs_motif=AGGAG;rbs_spacer=5-10bp;gc_cont=0.381	WP_000159750.1 MULTISPECIES: PTS transporter subunit EIIC [Staphylococcus]	100	99.8	0.0
BAAHTL010000001.1_276|292055|292951|-1|ID=1_276;partial=00;start_type=ATG;rbs_motif=AGGA/GGAG/GAGG;rbs_spacer=11-12bp;gc_cont=0.381	WP_117200953.1 N-acetylmuramic acid 6-phosphate etherase [Staphylococcus aureus]	100	99.7	3.48e-204
BAAHTL010000001.1_277|292951|293991|-1|ID=1_277;partial=00;start_type=GTG;rbs_motif=GGA/GAG/AGG;rbs_spacer=5-10bp;gc_cont=0.354	WP_001802887.1 6-phospho-N-acetylmuramidase [Staphylococcus aureus]	99.7	99.7	3.73e-255
BAAHTL010000001.1_278|294591|296636|1|ID=1_278;partial=00;start_type=GTG;rbs_motif=GGAG/GAGG;rbs_spacer=5-10bp;gc_cont=0.377	WP_001227724.1 MULTISPECIES: glucose-specific PTS transporter subunit IIBC [Staphylococcus]	100	99.9	0.0
BAAHTL010000001.1_279|296909|298549|1|ID=1_279;partial=00;start_type=ATG;rbs_motif=GGA/GAG/AGG;rbs_spacer=5-10bp;gc_cont=0.363	WP_117200951.1 alpha-keto acid decarboxylase family protein [Staphylococcus aureus]	99.8	99.8	0.0
BAAHTL010000001.1_280|298616|299173|1|ID=1_280;partial=00;start_type=ATG;rbs_motif=AGGA/GGAG/GAGG;rbs_spacer=11-12bp;gc_cont=0.351	WP_000606890.1 MULTISPECIES: isochorismatase family protein [Staphylococcus]	100	99.5	2.83e-131
BAAHTL010000001.1_281|299449|300804|1|ID=1_281;partial=00;start_type=ATG;rbs_motif=AGGAG(G)/GGAGG;rbs_spacer=13-15bp;gc_cont=0.330	WP_000728180.1 MULTISPECIES: branched-chain amino acid transport system II carrier protein BrnQ1 [Staphylococcus]	100	99.8	6.40e-307
BAAHTL010000001.1_282|301030|302241|1|ID=1_282;partial=00;start_type=ATG;rbs_motif=None;rbs_spacer=None;gc_cont=0.378	WP_001084436.1 MULTISPECIES: ornithine--oxo-acid transaminase [Staphylococcus]	100	97.5	8.12e-288
BAAHTL010000001.1_283|302277|303311|1|ID=1_283;partial=00;start_type=ATG;rbs_motif=AGGAG;rbs_spacer=5-10bp;gc_cont=0.355	WP_000598483.1 MULTISPECIES: N-acetyl-gamma-glutamyl-phosphate reductase [Staphylococcus]	100	99.4	1.91e-249
BAAHTL010000001.1_284|303323|304564|1|ID=1_284;partial=00;start_type=ATG;rbs_motif=GGA/GAG/AGG;rbs_spacer=5-10bp;gc_cont=0.381	WP_000682611.1 MULTISPECIES: bifunctional glutamate N-acetyltransferase/amino-acid acetyltransferase ArgJ [Staphylococcus]	100	99.8	2.08e-295
BAAHTL010000001.1_285|304580|305344|1|ID=1_285;partial=00;start_type=ATG;rbs_motif=AGxAGG/AGGxGG;rbs_spacer=5-10bp;gc_cont=0.346	WP_000668894.1 MULTISPECIES: acetylglutamate kinase [Staphylococcus]	100	99.6	2.85e-181
BAAHTL010000001.1_286|305614|306093|1|ID=1_286;partial=00;start_type=ATG;rbs_motif=None;rbs_spacer=None;gc_cont=0.365	WP_001802886.1 MULTISPECIES: YagU family protein [Staphylococcus]	100	99.4	3.07e-111
BAAHTL010000001.1_287|306421|307065|-1|ID=1_287;partial=00;start_type=ATG;rbs_motif=GGA/GAG/AGG;rbs_spacer=5-10bp;gc_cont=0.336	WP_000215724.1 MULTISPECIES: aureusimine biosynthesis 4'-phosphopantetheinyl transferase AusB [Staphylococcus]	100	99.5	1.88e-157
BAAHTL010000001.1_288|307078|314271|-1|ID=1_288;partial=00;start_type=ATG;rbs_motif=GGA/GAG/AGG;rbs_spacer=5-10bp;gc_cont=0.352	WP_000605278.1 aureusimine non-ribosomal peptide synthetase AusA [Staphylococcus aureus]	100	99.7	0.0
BAAHTL010000001.1_289|314700|315950|-1|ID=1_289;partial=00;start_type=ATG;rbs_motif=None;rbs_spacer=None;gc_cont=0.325	WP_000826862.1 MULTISPECIES: MDR family MFS transporter [Staphylococcus]	100	99.8	1.15e-273
BAAHTL010000001.1_290|316336|317361|-1|ID=1_290;partial=00;start_type=ATG;rbs_motif=AGGAG;rbs_spacer=5-10bp;gc_cont=0.349	WP_117218871.1 NAD-dependent formate dehydrogenase [Staphylococcus aureus]	100	99.7	4.31e-247
BAAHTL010000001.1_291|317534|317893|-1|ID=1_291;partial=00;start_type=GTG;rbs_motif=None;rbs_spacer=None;gc_cont=0.328	WP_001092004.1 MULTISPECIES: DUF2294 domain-containing protein [Staphylococcus]	100	99.2	5.50e-79
BAAHTL010000001.1_292|318110|319141|-1|ID=1_292;partial=00;start_type=ATG;rbs_motif=AGGAG;rbs_spacer=5-10bp;gc_cont=0.351	WP_000171644.1 MULTISPECIES: acyl-CoA/acyl-ACP dehydrogenase [Staphylococcus]	100	99.7	2.05e-246
BAAHTL010000001.1_293|319154|319915|-1|ID=1_293;partial=00;start_type=ATG;rbs_motif=AGGAGG;rbs_spacer=5-10bp;gc_cont=0.354	WP_000197961.1 MULTISPECIES: ABC transporter permease [Staphylococcus]	100	99.6	7.26e-179
BAAHTL010000001.1_294|319912|320886|-1|ID=1_294;partial=00;start_type=ATG;rbs_motif=AGGAG;rbs_spacer=5-10bp;gc_cont=0.369	WP_000826671.1 MULTISPECIES: ABC transporter substrate-binding protein [Staphylococcus]	100	99.7	2.89e-241
BAAHTL010000001.1_295|320900|321640|-1|ID=1_295;partial=00;start_type=ATG;rbs_motif=GGA/GAG/AGG;rbs_spacer=5-10bp;gc_cont=0.356	WP_000590847.1 MULTISPECIES: ABC transporter ATP-binding protein [Staphylococcus]	100	99.6	4.22e-179
BAAHTL010000001.1_296|321982|322494|-1|ID=1_296;partial=00;start_type=ATG;rbs_motif=AGGAG;rbs_spacer=5-10bp;gc_cont=0.341	WP_000171919.1 MULTISPECIES: DUF4242 domain-containing protein [Staphylococcus]	100	99.4	9.30e-116
BAAHTL010000001.1_297|322672|322875|1|ID=1_297;partial=00;start_type=ATG;rbs_motif=AGxAGG/AGGxGG;rbs_spacer=5-10bp;gc_cont=0.309	WP_000356963.1 MULTISPECIES: hypothetical protein [Staphylococcus]	100	98.5	8.29e-39
BAAHTL010000001.1_298|323001|324065|-1|ID=1_298;partial=00;start_type=ATG;rbs_motif=None;rbs_spacer=None;gc_cont=0.315	WP_001013481.1 MULTISPECIES: cation diffusion facilitator family transporter [Staphylococcus]	100	89.9	1.38e-216
BAAHTL010000001.1_299|324369|324479|-1|ID=1_299;partial=00;start_type=ATG;rbs_motif=GGA/GAG/AGG;rbs_spacer=5-10bp;gc_cont=0.297	WP_000161255.1 hypothetical protein [Staphylococcus aureus]	76.5	91.9	1.21e-08
BAAHTL010000001.1_300|324606|326093|-1|ID=1_300;partial=00;start_type=ATG;rbs_motif=AGGAG;rbs_spacer=5-10bp;gc_cont=0.362	WP_000290397.1 MULTISPECIES: aldehyde dehydrogenase family protein [Staphylococcus]	100	99.8	0.0
BAAHTL010000001.1_301|326520|326903|1|ID=1_301;partial=00;start_type=ATG;rbs_motif=GGAG/GAGG;rbs_spacer=5-10bp;gc_cont=0.315	WP_001237002.1 MULTISPECIES: YbaN family protein [Staphylococcus]	100	99.2	2.26e-75
BAAHTL010000001.1_302|326910|327236|1|ID=1_302;partial=00;start_type=ATG;rbs_motif=AGGAG;rbs_spacer=5-10bp;gc_cont=0.303	WP_000480603.1 MULTISPECIES: staphylobilin-forming heme oxygenase IsdI [Staphylococcus]	100	99.1	4.22e-71
BAAHTL010000001.1_303|327301|328446|-1|ID=1_303;partial=00;start_type=ATG;rbs_motif=GGAG/GAGG;rbs_spacer=5-10bp;gc_cont=0.363	WP_000723452.1 MULTISPECIES: type 8 capsular polysaccharide synthesis protein Cap8P [Staphylococcus]	100	99.7	2.25e-276
BAAHTL010000001.1_304|328523|329785|-1|ID=1_304;partial=00;start_type=ATG;rbs_motif=GGAG/GAGG;rbs_spacer=5-10bp;gc_cont=0.344	WP_000779494.1 MULTISPECIES: type 8 capsular polysaccharide synthesis protein Cap8O [Staphylococcus]	100	99.8	1.28e-304
BAAHTL010000001.1_305|329839|330726|-1|ID=1_305;partial=00;start_type=ATG;rbs_motif=AGxAGG/AGGxGG;rbs_spacer=11-12bp;gc_cont=0.338	WP_001230681.1 MULTISPECIES: capsular polysaccharide type 5/8 biosynthesis epimerase CapN [Staphylococcus]	100	99.7	1.09e-210
BAAHTL010000001.1_306|330726|331283|-1|ID=1_306;partial=00;start_type=ATG;rbs_motif=AGGAG;rbs_spacer=5-10bp;gc_cont=0.323	WP_000825101.1 MULTISPECIES: type 8 capsular polysaccharide synthesis protein Cap8M [Staphylococcus]	100	99.5	8.74e-126
BAAHTL010000001.1_307|331294|332499|-1|ID=1_307;partial=00;start_type=ATG;rbs_motif=AGGA;rbs_spacer=5-10bp;gc_cont=0.350	WP_001291010.1 MULTISPECIES: type 8 capsular polysaccharide synthesis protein Cap8L [Staphylococcus]	100	99.8	4.71e-295
BAAHTL010000001.1_308|332533|333771|-1|ID=1_308;partial=00;start_type=ATG;rbs_motif=GGAG/GAGG;rbs_spacer=5-10bp;gc_cont=0.268	WP_117200949.1 type 8 capsular polysaccharide synthesis protein Cap8K [Staphylococcus aureus]	100	99.8	9.58e-264
BAAHTL010000001.1_309|333780|334337|-1|ID=1_309;partial=00;start_type=ATG;rbs_motif=GGA/GAG/AGG;rbs_spacer=5-10bp;gc_cont=0.319	WP_000636149.1 MULTISPECIES: type 8 capsular polysaccharide synthesis protein Cap8J [Staphylococcus]	100	99.5	3.44e-132
BAAHTL010000001.1_310|334334|335728|-1|ID=1_310;partial=00;start_type=ATG;rbs_motif=AGGA;rbs_spacer=5-10bp;gc_cont=0.285	WP_001034053.1 MULTISPECIES: type 8 capsular polysaccharide synthesis protein Cap8I [Staphylococcus]	100	99.8	2.01e-312
BAAHTL010000001.1_311|335721|336800|-1|ID=1_311;partial=00;start_type=ATG;rbs_motif=GGAG/GAGG;rbs_spacer=5-10bp;gc_cont=0.274	WP_001216935.1 MULTISPECIES: type 8 capsular polysaccharide synthesis protein Cap8H [Staphylococcus]	100	99.7	3.12e-265
BAAHTL010000001.1_312|336803|337927|-1|ID=1_312;partial=00;start_type=ATG;rbs_motif=GGAG/GAGG;rbs_spacer=5-10bp;gc_cont=0.338	WP_000413169.1 MULTISPECIES: type 8 capsular polysaccharide synthesis protein Cap8G [Staphylococcus]	100	99.7	2.31e-270
BAAHTL010000001.1_313|337931|339040|-1|ID=1_313;partial=00;start_type=TTG;rbs_motif=AGGAG;rbs_spacer=5-10bp;gc_cont=0.351	WP_001028293.1 MULTISPECIES: type 8 capsular polysaccharide synthesis protein Cap8F [Staphylococcus]	100	99.7	9.83e-274
BAAHTL010000001.1_314|339053|340081|-1|ID=1_314;partial=00;start_type=ATG;rbs_motif=GGAG/GAGG;rbs_spacer=5-10bp;gc_cont=0.338	WP_000459062.1 MULTISPECIES: type 8 capsular polysaccharide synthesis protein Cap8E [Staphylococcus]	100	99.7	4.11e-241
BAAHTL010000001.1_315|340071|341894|-1|ID=1_315;partial=00;start_type=ATG;rbs_motif=GGAG/GAGG;rbs_spacer=5-10bp;gc_cont=0.351	WP_117200947.1 type 8 capsular polysaccharide synthesis protein Cap8D [Staphylococcus aureus]	100	99.8	0.0
BAAHTL010000001.1_316|341914|342678|-1|ID=1_316;partial=00;start_type=ATG;rbs_motif=GGAG/GAGG;rbs_spacer=5-10bp;gc_cont=0.323	WP_000565297.1 MULTISPECIES: type 8 capsular polysaccharide synthesis protein Cap8C [Staphylococcus]	100	99.6	7.29e-184
BAAHTL010000001.1_317|342681|343367|-1|ID=1_317;partial=00;start_type=ATG;rbs_motif=AGGA/GGAG/GAGG;rbs_spacer=11-12bp;gc_cont=0.333	WP_000037328.1 MULTISPECIES: type 8 capsular polysaccharide synthesis protein Cap8B [Staphylococcus]	100	99.6	1.45e-152
BAAHTL010000001.1_318|343383|344075|-1|ID=1_318;partial=00;start_type=ATG;rbs_motif=GGAG/GAGG;rbs_spacer=5-10bp;gc_cont=0.294	WP_117218869.1 capsular polysaccharide type 5/8 biosynthesis protein CapA [Staphylococcus aureus]	100	99.6	2.42e-136
BAAHTL010000001.1_319|344420|347029|-1|ID=1_319;partial=00;start_type=ATG;rbs_motif=AGGAG;rbs_spacer=5-10bp;gc_cont=0.362	WP_000955781.1 MULTISPECIES: bifunctional acetaldehyde-CoA/alcohol dehydrogenase [Staphylococcus]	100	99.9	0.0
BAAHTL010000001.1_320|347479|347700|-1|ID=1_320;partial=00;start_type=ATG;rbs_motif=AGGA/GGAG/GAGG;rbs_spacer=11-12bp;gc_cont=0.266	WP_001550009.1 transposase [Staphylococcus aureus]	100	98.6	5.07e-47
BAAHTL010000001.1_321|348295|348582|-1|ID=1_321;partial=00;start_type=ATG;rbs_motif=AGxAG;rbs_spacer=5-10bp;gc_cont=0.198	WP_000469917.1 MULTISPECIES: hypothetical protein [Staphylococcus]	100	99.0	2.43e-55
BAAHTL010000001.1_322|348771|349061|-1|ID=1_322;partial=00;start_type=GTG;rbs_motif=None;rbs_spacer=None;gc_cont=0.275	WP_267246680.1 replication initiation factor domain-containing protein [Staphylococcus aureus]	95.8	99.0	2.39e-57
BAAHTL010000001.1_323|349046|349591|-1|ID=1_323;partial=00;start_type=ATG;rbs_motif=None;rbs_spacer=None;gc_cont=0.311	WP_001550007.1 replication initiation protein [Staphylococcus aureus]	98.8	88.5	4.85e-112
BAAHTL010000001.1_324|349904|350098|-1|ID=1_324;partial=00;start_type=ATG;rbs_motif=None;rbs_spacer=None;gc_cont=0.221	WP_301557689.1 ImmA/IrrE family metallo-endopeptidase, partial [Staphylococcus aureus]	100	98.5	9.65e-36
BAAHTL010000001.1_325|350185|351720|-1|ID=1_325;partial=00;start_type=ATG;rbs_motif=AGGAG;rbs_spacer=5-10bp;gc_cont=0.366	WP_000065036.1 MULTISPECIES: bifunctional metallophosphatase/5'-nucleotidase [Staphylococcus]	100	99.8	0.0
BAAHTL010000001.1_326|351771|353315|-1|ID=1_326;partial=00;start_type=ATG;rbs_motif=AGGAG;rbs_spacer=5-10bp;gc_cont=0.368	WP_072527587.1 DNA-binding protein [Staphylococcus aureus]	99.8	99.8	0.0
BAAHTL010000001.1_328|353544|354500|1|ID=1_328;partial=00;start_type=ATG;rbs_motif=GGA/GAG/AGG;rbs_spacer=5-10bp;gc_cont=0.311	WP_000713597.1 MULTISPECIES: phosphate/phosphite/phosphonate ABC transporter substrate-binding protein [Staphylococcus]	100	99.7	3.01e-215
BAAHTL010000001.1_329|354714|355487|1|ID=1_329;partial=00;start_type=ATG;rbs_motif=GGA/GAG/AGG;rbs_spacer=5-10bp;gc_cont=0.351	WP_000078092.1 MULTISPECIES: phosphonate ABC transporter ATP-binding protein [Staphylococcus]	100	99.6	6.96e-179
BAAHTL010000001.1_330|355489|356289|1|ID=1_330;partial=00;start_type=ATG;rbs_motif=AGGAG;rbs_spacer=5-10bp;gc_cont=0.345	WP_001127863.1 MULTISPECIES: phosphonate ABC transporter, permease protein PhnE [Staphylococcus]	100	99.6	3.99e-178
BAAHTL010000001.1_331|356286|357101|1|ID=1_331;partial=00;start_type=ATG;rbs_motif=AGGA/GGAG/GAGG;rbs_spacer=11-12bp;gc_cont=0.366	WP_000191089.1 MULTISPECIES: phosphonate ABC transporter, permease protein PhnE [Staphylococcus]	100	99.6	8.33e-178
BAAHTL010000001.1_332|357210|358388|-1|ID=1_332;partial=00;start_type=ATG;rbs_motif=GGAG/GAGG;rbs_spacer=5-10bp;gc_cont=0.369	WP_000197806.1 MULTISPECIES: phosphopentomutase [Staphylococcus]	100	99.7	4.49e-293
BAAHTL010000001.1_333|358416|359078|-1|ID=1_333;partial=00;start_type=ATG;rbs_motif=AGGAG;rbs_spacer=5-10bp;gc_cont=0.398	WP_000667279.1 MULTISPECIES: deoxyribose-phosphate aldolase [Staphylococcus]	100	99.5	8.46e-148
BAAHTL010000001.1_334|359159|360511|-1|ID=1_334;partial=00;start_type=ATG;rbs_motif=None;rbs_spacer=None;gc_cont=0.322	WP_001100294.1 MULTISPECIES: tetracycline efflux MFS transporter Tet(38) [Staphylococcus]	100	99.8	1.30e-294
BAAHTL010000001.1_335|360518|361225|-1|ID=1_335;partial=00;start_type=ATG;rbs_motif=GGAG/GAGG;rbs_spacer=5-10bp;gc_cont=0.374	WP_000843294.1 MULTISPECIES: purine-nucleoside phosphorylase [Staphylococcus]	100	99.6	4.05e-167
BAAHTL010000001.1_336|361461|362216|1|ID=1_336;partial=00;start_type=ATG;rbs_motif=None;rbs_spacer=None;gc_cont=0.357	WP_001789411.1 MULTISPECIES: GntR family transcriptional regulator [Staphylococcus]	100	99.6	3.35e-183
BAAHTL010000001.1_337|362407|363132|-1|ID=1_337;partial=00;start_type=ATG;rbs_motif=GGA/GAG/AGG;rbs_spacer=5-10bp;gc_cont=0.353	WP_061823604.1 LPXTG cell wall anchor domain-containing protein [Staphylococcus aureus]	86.7	99.6	4.53e-123
BAAHTL010000001.1_338|363500|364099|-1|ID=1_338;partial=00;start_type=ATG;rbs_motif=AGGAG;rbs_spacer=5-10bp;gc_cont=0.353	WP_000874681.1 MULTISPECIES: superoxide dismutase [Staphylococcus]	100	99.5	2.49e-150
BAAHTL010000001.1_339|364367|365797|-1|ID=1_339;partial=00;start_type=ATG;rbs_motif=GGA/GAG/AGG;rbs_spacer=5-10bp;gc_cont=0.317	WP_000834090.1 MULTISPECIES: oligosaccharide flippase family protein [Staphylococcus]	100	99.8	3.10e-313
BAAHTL010000001.1_340|365787|367025|-1|ID=1_340;partial=00;start_type=ATG;rbs_motif=GGA/GAG/AGG;rbs_spacer=11-12bp;gc_cont=0.301	WP_117200944.1 O-antigen ligase family protein [Staphylococcus aureus]	100	99.8	3.43e-273
BAAHTL010000001.1_341|367006|368172|-1|ID=1_341;partial=00;start_type=TTG;rbs_motif=GGA/GAG/AGG;rbs_spacer=11-12bp;gc_cont=0.332	WP_000692489.1 MULTISPECIES: glycosyltransferase family 4 protein [Staphylococcus]	100	99.7	1.72e-279
BAAHTL010000001.1_342|368382|369074|-1|ID=1_342;partial=00;start_type=TTG;rbs_motif=GGAG/GAGG;rbs_spacer=5-10bp;gc_cont=0.343	WP_117200942.1 sugar transferase [Staphylococcus aureus]	100	99.6	2.84e-160
BAAHTL010000001.1_343|369037|370008|-1|ID=1_343;partial=00;start_type=TTG;rbs_motif=GGAG/GAGG;rbs_spacer=5-10bp;gc_cont=0.317	WP_000442712.1 NAD-dependent epimerase/dehydratase family protein [Staphylococcus aureus]	100	99.7	1.86e-232
BAAHTL010000001.1_344|370353|371129|-1|ID=1_344;partial=00;start_type=ATG;rbs_motif=AGGAG;rbs_spacer=5-10bp;gc_cont=0.407	WP_117179539.1 (S)-acetoin forming diacetyl reductase [Staphylococcus aureus]	99.2	99.6	3.77e-163
BAAHTL010000001.1_345|371256|371966|-1|ID=1_345;partial=00;start_type=ATG;rbs_motif=GGA/GAG/AGG;rbs_spacer=5-10bp;gc_cont=0.308	WP_123213148.1 MFS transporter [Staphylococcus aureus]	99.5	79.7	5.47e-111
BAAHTL010000001.1_346|372016|372423|-1|ID=1_346;partial=00;start_type=ATG;rbs_motif=GGA/GAG/AGG;rbs_spacer=5-10bp;gc_cont=0.297	WP_000094898.1 MULTISPECIES: hypothetical protein [Staphylococcus]	100	99.3	5.60e-82
BAAHTL010000001.1_347|372619|373383|-1|ID=1_347;partial=00;start_type=TTG;rbs_motif=AGGA;rbs_spacer=5-10bp;gc_cont=0.373	WP_001015549.1 MULTISPECIES: bifunctional transcriptional regulator/O-phospho-L-serine synthase SbnI [Staphylococcus]	100	99.6	8.58e-192
BAAHTL010000001.1_348|373387|374589|-1|ID=1_348;partial=00;start_type=ATG;rbs_motif=GGA/GAG/AGG;rbs_spacer=5-10bp;gc_cont=0.364	WP_001223697.1 MULTISPECIES: staphyloferrin B biosynthesis decarboxylase SbnH [Staphylococcus]	100	99.8	1.47e-302
BAAHTL010000001.1_349|374589|375368|-1|ID=1_349;partial=00;start_type=ATG;rbs_motif=AGGAG;rbs_spacer=5-10bp;gc_cont=0.400	WP_001186804.1 MULTISPECIES: staphyloferrin B biosynthesis citrate synthase SbnG [Staphylococcus]	100	99.2	3.32e-180
BAAHTL010000001.1_350|375340|377118|-1|ID=1_350;partial=00;start_type=GTG;rbs_motif=AGGAG;rbs_spacer=5-10bp;gc_cont=0.360	WP_078368440.1 3-(L-alanin-3-ylcarbamoyl)-2-[(2-aminoethylcarbamoyl)methyl]-2-hydroxypropanoate synthase SbnF [Staphylococcus aureus]	100	99.7	0.0
BAAHTL010000001.1_351|377099|378835|-1|ID=1_351;partial=00;start_type=GTG;rbs_motif=None;rbs_spacer=None;gc_cont=0.366	WP_001179888.1 MULTISPECIES: L-2,3-diaminopropanoate--citrate ligase SbnE [Staphylococcus]	100	99.8	0.0
BAAHTL010000001.1_352|378825|380081|-1|ID=1_352;partial=00;start_type=ATG;rbs_motif=None;rbs_spacer=None;gc_cont=0.391	WP_000610051.1 MULTISPECIES: staphyloferrin B export MFS transporter [Staphylococcus]	100	99.8	4.29e-286
BAAHTL010000001.1_353|380074|381828|-1|ID=1_353;partial=00;start_type=TTG;rbs_motif=GGAG/GAGG;rbs_spacer=5-10bp;gc_cont=0.356	WP_001179388.1 MULTISPECIES: staphyloferrin B biosynthesis protein SbnC [Staphylococcus]	100	99.8	0.0
BAAHTL010000001.1_354|381849|382859|-1|ID=1_354;partial=00;start_type=ATG;rbs_motif=AGGAG;rbs_spacer=5-10bp;gc_cont=0.375	WP_001078456.1 MULTISPECIES: N-[(2S)-2-amino-2-carboxyethyl]-L-glutamate dehydrogenase SbnB [Staphylococcus]	100	99.7	9.37e-244
BAAHTL010000001.1_355|382856|383836|-1|ID=1_355;partial=00;start_type=TTG;rbs_motif=AGGAG;rbs_spacer=5-10bp;gc_cont=0.368	WP_000570808.1 MULTISPECIES: 2,3-diaminopropionate biosynthesis protein SbnA [Staphylococcus]	100	99.7	1.27e-236
BAAHTL010000001.1_356|384067|385059|1|ID=1_356;partial=00;start_type=ATG;rbs_motif=AGGA/GGAG/GAGG;rbs_spacer=11-12bp;gc_cont=0.322	WP_001045111.1 MULTISPECIES: staphyloferrin B ABC transporter substrate-binding protein SirA [Staphylococcus]	100	99.7	1.25e-229
