BAAHSV010000001.1_1|42|1178|-1|ID=1_1;partial=00;start_type=ATG;rbs_motif=GGAG/GAGG;rbs_spacer=5-10bp;gc_cont=0.326	WP_000138413.1 MULTISPECIES: toxic anion resistance protein [Staphylococcus]	100	99.7	2.67e-246
BAAHSV010000001.1_2|1210|1839|-1|ID=1_2;partial=00;start_type=ATG;rbs_motif=None;rbs_spacer=None;gc_cont=0.302	WP_001788788.1 MULTISPECIES: 5-bromo-4-chloroindolyl phosphate hydrolysis family protein [Staphylococcus]	100	99.5	1.47e-138
BAAHSV010000001.1_3|1858|2127|-1|ID=1_3;partial=00;start_type=ATG;rbs_motif=GGAG/GAGG;rbs_spacer=5-10bp;gc_cont=0.356	WP_001215907.1 MULTISPECIES: acylphosphatase [Staphylococcus]	100	98.9	1.35e-56
BAAHSV010000001.1_4|2290|2598|1|ID=1_4;partial=00;start_type=ATG;rbs_motif=GGA/GAG/AGG;rbs_spacer=11-12bp;gc_cont=0.278	WP_000269923.1 MULTISPECIES: regulatory protein MsaA [Bacilli]	100	99.0	1.45e-75
BAAHSV010000001.1_5|2769|2969|1|ID=1_5;partial=00;start_type=ATG;rbs_motif=GGAG/GAGG;rbs_spacer=5-10bp;gc_cont=0.378	WP_000809131.1 MULTISPECIES: cold shock protein CspA [Staphylococcus]	100	98.5	1.14e-40
BAAHSV010000001.1_6|3166|3567|1|ID=1_6;partial=00;start_type=ATG;rbs_motif=GGAG/GAGG;rbs_spacer=5-10bp;gc_cont=0.221	WP_000876201.1 MULTISPECIES: sarA expression modulator MsaC [Staphylococcus]	100	99.3	1.55e-78
BAAHSV010000001.1_7|3807|5072|-1|ID=1_7;partial=00;start_type=ATG;rbs_motif=AGGAG;rbs_spacer=5-10bp;gc_cont=0.336	WP_000216946.1 MULTISPECIES: diaminopimelate decarboxylase [Staphylococcus]	100	99.8	1.09e-301
BAAHSV010000001.1_8|5062|6147|-1|ID=1_8;partial=00;start_type=TTG;rbs_motif=GGAG/GAGG;rbs_spacer=5-10bp;gc_cont=0.336	WP_000127593.1 MULTISPECIES: alanine racemase [Staphylococcus]	100	99.7	5.19e-265
BAAHSV010000001.1_9|6152|7303|-1|ID=1_9;partial=00;start_type=ATG;rbs_motif=AGGA;rbs_spacer=5-10bp;gc_cont=0.346	WP_001003793.1 MULTISPECIES: amidohydrolase [Staphylococcus]	100	99.7	5.16e-283
BAAHSV010000001.1_10|7446|8165|-1|ID=1_10;partial=00;start_type=ATG;rbs_motif=AGGA/GGAG/GAGG;rbs_spacer=11-12bp;gc_cont=0.379	WP_371093623.1 2,3,4,5-tetrahydropyridine-2,6-dicarboxylate N-acetyltransferase [Staphylococcus aureus]	99.2	99.6	9.78e-129
BAAHSV010000001.1_11|8192|8884|-1|ID=1_11;partial=00;start_type=ATG;rbs_motif=None;rbs_spacer=None;gc_cont=0.367	WP_011447012.1 4-hydroxy-tetrahydrodipicolinate reductase [Staphylococcus aureus]	100	99.6	1.26e-163
BAAHSV010000001.1_12|8911|9798|-1|ID=1_12;partial=00;start_type=ATG;rbs_motif=AGGAG;rbs_spacer=5-10bp;gc_cont=0.356	WP_000149257.1 MULTISPECIES: 4-hydroxy-tetrahydrodipicolinate synthase [Staphylococcus]	100	99.7	5.81e-206
BAAHSV010000001.1_13|9800|10789|-1|ID=1_13;partial=00;start_type=ATG;rbs_motif=GGAG/GAGG;rbs_spacer=5-10bp;gc_cont=0.357	WP_000163531.1 MULTISPECIES: aspartate-semialdehyde dehydrogenase [Staphylococcus]	100	99.7	9.26e-236
BAAHSV010000001.1_14|10853|12058|-1|ID=1_14;partial=00;start_type=ATG;rbs_motif=AGGAG;rbs_spacer=5-10bp;gc_cont=0.344	WP_000258711.1 MULTISPECIES: aspartate kinase [Staphylococcus]	100	99.8	1.22e-281
BAAHSV010000001.1_15|12918|14519|-1|ID=1_15;partial=00;start_type=ATG;rbs_motif=AGGAG;rbs_spacer=5-10bp;gc_cont=0.335	WP_000942300.1 MULTISPECIES: ABC-F family ATP-binding cassette domain-containing protein [Staphylococcus]	100	99.8	0.0
BAAHSV010000001.1_16|14666|15568|1|ID=1_16;partial=00;start_type=ATG;rbs_motif=AGGAG;rbs_spacer=5-10bp;gc_cont=0.351	WP_001162359.1 MULTISPECIES: RNA-binding virulence regulatory protein CvfB [Staphylococcus]	100	99.7	1.29e-216
BAAHSV010000001.1_17|15704|16000|-1|ID=1_17;partial=00;start_type=TTG;rbs_motif=None;rbs_spacer=None;gc_cont=0.293	WP_031910281.1 transposase, partial [Staphylococcus aureus]	99.0	99.0	1.22e-61
BAAHSV010000001.1_18|16540|17523|1|ID=1_18;partial=00;start_type=ATG;rbs_motif=GGAG/GAGG;rbs_spacer=5-10bp;gc_cont=0.320	WP_031887943.1 phosphate ABC transporter substrate-binding protein PstS [Staphylococcus aureus]	100	96.3	6.37e-218
BAAHSV010000001.1_19|17714|18640|1|ID=1_19;partial=00;start_type=ATG;rbs_motif=GGAG/GAGG;rbs_spacer=5-10bp;gc_cont=0.357	WP_000204625.1 MULTISPECIES: phosphate ABC transporter permease subunit PstC [Staphylococcus]	100	99.7	1.10e-196
BAAHSV010000001.1_20|18642|19559|1|ID=1_20;partial=00;start_type=ATG;rbs_motif=AGGAG;rbs_spacer=5-10bp;gc_cont=0.354	WP_000450297.1 MULTISPECIES: phosphate ABC transporter permease PstA [Staphylococcus]	100	99.7	2.61e-198
BAAHSV010000001.1_21|19513|20457|1|ID=1_21;partial=00;start_type=ATG;rbs_motif=None;rbs_spacer=None;gc_cont=0.313	WP_000079447.1 MULTISPECIES: phosphate ABC transporter ATP-binding protein PstB [Staphylococcus]	100	89.8	3.65e-202
BAAHSV010000001.1_22|20464|21105|1|ID=1_22;partial=00;start_type=ATG;rbs_motif=None;rbs_spacer=None;gc_cont=0.318	WP_000974847.1 MULTISPECIES: phosphate signaling complex protein PhoU [Staphylococcus]	100	99.5	3.74e-143
BAAHSV010000001.1_23|21245|23059|-1|ID=1_23;partial=00;start_type=ATG;rbs_motif=AGGAG;rbs_spacer=5-10bp;gc_cont=0.334	WP_000077571.1 MULTISPECIES: oligoendopeptidase F [Staphylococcus]	100	99.8	0.0
BAAHSV010000001.1_24|23264|23608|1|ID=1_24;partial=00;start_type=ATG;rbs_motif=AGGAG;rbs_spacer=5-10bp;gc_cont=0.272	WP_000171798.1 MULTISPECIES: hypothetical protein [Staphylococcus]	100	99.1	2.29e-71
BAAHSV010000001.1_25|23912|24898|1|ID=1_25;partial=00;start_type=ATG;rbs_motif=AGGAG;rbs_spacer=5-10bp;gc_cont=0.313	WP_000469949.1 MULTISPECIES: nickel ABC transporter permease [Staphylococcus]	100	99.7	6.81e-217
BAAHSV010000001.1_26|24891|25721|1|ID=1_26;partial=00;start_type=ATG;rbs_motif=AGxAG;rbs_spacer=5-10bp;gc_cont=0.323	WP_000548932.1 MULTISPECIES: nickel transporter permease [Staphylococcus]	100	99.6	1.45e-185
BAAHSV010000001.1_27|25705|26481|1|ID=1_27;partial=00;start_type=ATG;rbs_motif=None;rbs_spacer=None;gc_cont=0.317	WP_000052317.1 MULTISPECIES: ATP-binding cassette domain-containing protein [Staphylococcus]	100	99.2	1.86e-181
BAAHSV010000001.1_28|26474|27175|1|ID=1_28;partial=00;start_type=ATG;rbs_motif=GGAG/GAGG;rbs_spacer=5-10bp;gc_cont=0.330	WP_000571258.1 MULTISPECIES: ABC transporter ATP-binding protein [Staphylococcus]	100	99.6	1.52e-161
BAAHSV010000001.1_29|27299|27772|1|ID=1_29;partial=00;start_type=ATG;rbs_motif=AGGAG;rbs_spacer=5-10bp;gc_cont=0.329	WP_000523665.1 MULTISPECIES: SWIM zinc finger family protein [Staphylococcus]	100	99.4	3.08e-110
BAAHSV010000001.1_30|27820|28587|-1|ID=1_30;partial=00;start_type=ATG;rbs_motif=GGAG/GAGG;rbs_spacer=5-10bp;gc_cont=0.320	WP_001213019.1 MULTISPECIES: Cof-type HAD-IIB family hydrolase [Staphylococcus]	100	99.6	2.26e-183
BAAHSV010000001.1_31|29276|30535|-1|ID=1_31;partial=00;start_type=ATG;rbs_motif=GGA/GAG/AGG;rbs_spacer=11-12bp;gc_cont=0.317	WP_031867127.1 glycine glycyltransferase FemB [Staphylococcus aureus]	99.8	99.8	4.23e-298
BAAHSV010000001.1_32|30554|31855|-1|ID=1_32;partial=00;start_type=ATG;rbs_motif=None;rbs_spacer=None;gc_cont=0.315	WP_078367923.1 aminoacyltransferase [Staphylococcus aureus]	100	99.8	0.0
BAAHSV010000001.1_33|32138|32866|-1|ID=1_33;partial=00;start_type=ATG;rbs_motif=GGAG/GAGG;rbs_spacer=5-10bp;gc_cont=0.342	WP_000163627.1 MULTISPECIES: tryptophan synthase subunit alpha [Staphylococcus]	100	99.6	7.86e-173
BAAHSV010000001.1_34|32859|34073|-1|ID=1_34;partial=00;start_type=ATG;rbs_motif=AGGAG;rbs_spacer=5-10bp;gc_cont=0.377	WP_001041337.1 MULTISPECIES: tryptophan synthase subunit beta [Staphylococcus]	100	99.8	8.11e-293
BAAHSV010000001.1_35|34066|34701|-1|ID=1_35;partial=00;start_type=ATG;rbs_motif=GGA/GAG/AGG;rbs_spacer=5-10bp;gc_cont=0.318	WP_000768192.1 MULTISPECIES: phosphoribosylanthranilate isomerase [Staphylococcus]	100	99.1	4.78e-147
BAAHSV010000001.1_36|34698|35480|-1|ID=1_36;partial=00;start_type=ATG;rbs_motif=GGAG/GAGG;rbs_spacer=5-10bp;gc_cont=0.315	WP_000154116.1 MULTISPECIES: indole-3-glycerol phosphate synthase TrpC [Staphylococcus]	100	99.6	5.92e-177
BAAHSV010000001.1_37|35482|36480|-1|ID=1_37;partial=00;start_type=ATG;rbs_motif=AGGA;rbs_spacer=5-10bp;gc_cont=0.341	WP_000173832.1 MULTISPECIES: anthranilate phosphoribosyltransferase [Staphylococcus]	100	99.7	4.57e-233
BAAHSV010000001.1_38|36486|37052|-1|ID=1_38;partial=00;start_type=ATG;rbs_motif=GGAG/GAGG;rbs_spacer=5-10bp;gc_cont=0.358	WP_000604817.1 MULTISPECIES: anthranilate synthase component II [Staphylococcus]	100	99.5	6.66e-136
BAAHSV010000001.1_39|37049|38455|-1|ID=1_39;partial=00;start_type=ATG;rbs_motif=AGGAG;rbs_spacer=5-10bp;gc_cont=0.318	WP_000350976.1 anthranilate synthase component I [Staphylococcus aureus]	100	99.8	0.0
BAAHSV010000001.1_40|38947|39978|-1|ID=1_40;partial=00;start_type=ATG;rbs_motif=GGAG/GAGG;rbs_spacer=5-10bp;gc_cont=0.333	WP_000433363.1 MULTISPECIES: M42 family metallopeptidase [Staphylococcus]	100	99.7	5.04e-247
BAAHSV010000001.1_41|40143|41234|1|ID=1_41;partial=00;start_type=ATG;rbs_motif=GGA/GAG/AGG;rbs_spacer=5-10bp;gc_cont=0.333	WP_000214266.1 MULTISPECIES: prephenate dehydrogenase [Staphylococcus]	100	99.7	5.13e-257
BAAHSV010000001.1_42|41371|42633|-1|ID=1_42;partial=00;start_type=GTG;rbs_motif=GGAG/GAGG;rbs_spacer=5-10bp;gc_cont=0.339	WP_000283016.1 MULTISPECIES: Y-family DNA polymerase [Staphylococcus]	100	99.8	4.85e-309
BAAHSV010000001.1_43|42778|42966|1|ID=1_43;partial=00;start_type=ATG;rbs_motif=AGGAG;rbs_spacer=5-10bp;gc_cont=0.365	WP_001548680.1 2-hydroxymuconate tautomerase [Escherichia coli]	100	98.4	1.34e-35
BAAHSV010000001.1_44|43054|44037|-1|ID=1_44;partial=00;start_type=ATG;rbs_motif=GGA/GAG/AGG;rbs_spacer=5-10bp;gc_cont=0.332	WP_072470592.1 LCP family protein [Staphylococcus aureus]	99.4	99.7	2.86e-213
BAAHSV010000001.1_45|44174|44683|1|ID=1_45;partial=00;start_type=ATG;rbs_motif=AGGA;rbs_spacer=5-10bp;gc_cont=0.339	WP_001024830.1 MULTISPECIES: peptide-methionine (S)-S-oxide reductase MsrA [Staphylococcus]	100	99.4	2.79e-121
BAAHSV010000001.1_46|44886|47408|-1|ID=1_46;partial=00;start_type=ATG;rbs_motif=None;rbs_spacer=None;gc_cont=0.313	WP_001071135.1 MULTISPECIES: bifunctional lysylphosphatidylglycerol flippase/synthetase MprF [Staphylococcus]	100	99.9	0.0
BAAHSV010000001.1_47|47889|49037|-1|ID=1_47;partial=00;start_type=ATG;rbs_motif=None;rbs_spacer=None;gc_cont=0.312	WP_000673632.1 cell elongation protein CozEb [Staphylococcus aureus]	100	99.7	9.56e-258
BAAHSV010000001.1_48|49232|50083|-1|ID=1_48;partial=00;start_type=ATG;rbs_motif=GGA/GAG/AGG;rbs_spacer=5-10bp;gc_cont=0.275	WP_000505015.1 MULTISPECIES: glucose PTS transporter transcription antiterminator GlcT [Staphylococcus]	100	99.6	1.59e-197
BAAHSV010000001.1_49|50583|52043|-1|ID=1_49;partial=00;start_type=TTG;rbs_motif=GGAG/GAGG;rbs_spacer=5-10bp;gc_cont=0.356	WP_000651160.1 MULTISPECIES: alanine/glycine:cation symporter family protein [Staphylococcus]	100	99.8	0.0
BAAHSV010000001.1_50|52293|54695|-1|ID=1_50;partial=00;start_type=GTG;rbs_motif=AGGAG;rbs_spacer=5-10bp;gc_cont=0.320	WP_001289589.1 DNA topoisomerase IV subunit A [Staphylococcus aureus]	100	99.9	0.0
BAAHSV010000001.1_51|54695|56686|-1|ID=1_51;partial=00;start_type=ATG;rbs_motif=AGGAG(G)/GGAGG;rbs_spacer=13-15bp;gc_cont=0.349	WP_001548666.1 MULTISPECIES: DNA topoisomerase IV subunit B [Staphylococcus]	100	99.8	0.0
BAAHSV010000001.1_52|56892|57500|1|ID=1_52;partial=00;start_type=ATG;rbs_motif=AGGA/GGAG/GAGG;rbs_spacer=11-12bp;gc_cont=0.337	WP_000972781.1 MULTISPECIES: glycerol-3-phosphate 1-O-acyltransferase PlsY [Staphylococcus]	100	99.5	8.50e-130
BAAHSV010000001.1_53|57876|58172|1|ID=1_53;partial=00;start_type=ATG;rbs_motif=AGGAG;rbs_spacer=5-10bp;gc_cont=0.337	WP_001165377.1 MULTISPECIES: HesB/YadR/YfhF family protein [Staphylococcus]	100	99.0	2.12e-64
BAAHSV010000001.1_54|58379|58846|-1|ID=1_54;partial=00;start_type=ATG;rbs_motif=GGA/GAG/AGG;rbs_spacer=5-10bp;gc_cont=0.325	WP_000640487.1 MULTISPECIES: 1,4-dihydroxy-2-naphthoyl-CoA hydrolase MenI [Staphylococcus]	100	99.4	4.39e-109
BAAHSV010000001.1_55|59026|61731|-1|ID=1_55;partial=00;start_type=ATG;rbs_motif=GGA/GAG/AGG;rbs_spacer=5-10bp;gc_cont=0.355	WP_000729744.1 MULTISPECIES: aconitate hydratase AcnA [Staphylococcus]	100	99.9	0.0
BAAHSV010000001.1_56|62623|64269|-1|ID=1_56;partial=00;start_type=ATG;rbs_motif=GGAG/GAGG;rbs_spacer=5-10bp;gc_cont=0.358	WP_001088978.1 MULTISPECIES: BCCT family transporter [Staphylococcus]	100	99.8	0.0
BAAHSV010000001.1_57|64473|64835|1|ID=1_57;partial=00;start_type=ATG;rbs_motif=GGAG/GAGG;rbs_spacer=5-10bp;gc_cont=0.309	WP_000910489.1 MULTISPECIES: large conductance mechanosensitive channel protein MscL [Staphylococcus]	100	99.2	4.33e-72
BAAHSV010000001.1_58|64906|67935|-1|ID=1_58;partial=00;start_type=ATG;rbs_motif=AGGAG;rbs_spacer=5-10bp;gc_cont=0.284	WP_000803164.1 MULTISPECIES: exonuclease subunit SbcC [Staphylococcus]	100	99.9	0.0
BAAHSV010000001.1_59|67939|69081|-1|ID=1_59;partial=00;start_type=ATG;rbs_motif=None;rbs_spacer=None;gc_cont=0.308	WP_000691284.1 MULTISPECIES: exonuclease subunit SbcD [Staphylococcus]	100	97.9	3.31e-269
BAAHSV010000001.1_60|69184|69612|-1|ID=1_60;partial=00;start_type=ATG;rbs_motif=None;rbs_spacer=None;gc_cont=0.319	WP_001788749.1 CcdC family protein [Staphylococcus aureus]	100	99.3	1.40e-92
BAAHSV010000001.1_61|69830|70117|-1|ID=1_61;partial=00;start_type=ATG;rbs_motif=None;rbs_spacer=None;gc_cont=0.312	WP_001548645.1 YneF family protein [Staphylococcus aureus]	100	99.0	3.46e-55
BAAHSV010000001.1_62|70350|72338|-1|ID=1_62;partial=00;start_type=ATG;rbs_motif=GGA/GAG/AGG;rbs_spacer=11-12bp;gc_cont=0.360	WP_000481443.1 MULTISPECIES: transketolase [Staphylococcus]	100	99.8	0.0
BAAHSV010000001.1_63|72459|72698|-1|ID=1_63;partial=00;start_type=TTG;rbs_motif=GGA/GAG/AGG;rbs_spacer=5-10bp;gc_cont=0.275	WP_000071351.1 MULTISPECIES: DUF896 domain-containing protein [Staphylococcus]	100	98.8	1.77e-43
BAAHSV010000001.1_64|72834|73070|-1|ID=1_64;partial=00;start_type=ATG;rbs_motif=AGGAG;rbs_spacer=5-10bp;gc_cont=0.316	WP_000499647.1 MULTISPECIES: DNA damage-induced cell division inhibitor SosA [Staphylococcus]	100	97.5	3.36e-45
BAAHSV010000001.1_65|73210|73833|1|ID=1_65;partial=00;start_type=ATG;rbs_motif=GGAG/GAGG;rbs_spacer=5-10bp;gc_cont=0.362	WP_001208760.1 MULTISPECIES: transcriptional repressor LexA [Staphylococcus]	100	99.5	1.66e-143
BAAHSV010000001.1_66|74213|75076|-1|ID=1_66;partial=00;start_type=TTG;rbs_motif=GGA/GAG/AGG;rbs_spacer=5-10bp;gc_cont=0.286	WP_000380731.1 CAP domain-containing protein [Staphylococcus aureus]	100	99.7	6.31e-206
BAAHSV010000001.1_67|75251|76228|-1|ID=1_67;partial=00;start_type=GTG;rbs_motif=GGA/GAG/AGG;rbs_spacer=11-12bp;gc_cont=0.335	WP_000688126.1 MULTISPECIES: GMP reductase [Staphylococcus]	100	99.7	5.57e-235
BAAHSV010000001.1_68|76385|76654|-1|ID=1_68;partial=00;start_type=ATG;rbs_motif=GGAG/GAGG;rbs_spacer=5-10bp;gc_cont=0.319	WP_001085655.1 MULTISPECIES: 30S ribosomal protein S14 [Staphylococcus]	100	98.9	1.07e-53
BAAHSV010000001.1_69|77108|77257|-1|ID=1_69;partial=00;start_type=GTG;rbs_motif=GGAG/GAGG;rbs_spacer=5-10bp;gc_cont=0.333	WP_001265708.1 MULTISPECIES: 50S ribosomal protein L33 [Bacilli]	100	98.0	2.39e-28
BAAHSV010000001.1_70|77348|78865|-1|ID=1_70;partial=00;start_type=ATG;rbs_motif=GGAG/GAGG;rbs_spacer=5-10bp;gc_cont=0.362	WP_000082539.1 MULTISPECIES: catalase [Staphylococcus]	100	99.8	0.0
BAAHSV010000001.1_71|79069|80523|1|ID=1_71;partial=00;start_type=ATG;rbs_motif=GGAG/GAGG;rbs_spacer=5-10bp;gc_cont=0.332	WP_000389956.1 MULTISPECIES: amino acid permease [Staphylococcus]	100	99.8	0.0
BAAHSV010000001.1_72|80741|81055|1|ID=1_72;partial=00;start_type=ATG;rbs_motif=GGA/GAG/AGG;rbs_spacer=11-12bp;gc_cont=0.302	WP_000580198.1 MULTISPECIES: hypothetical protein [Staphylococcus]	100	99.0	1.06e-69
BAAHSV010000001.1_73|81348|82151|-1|ID=1_73;partial=00;start_type=ATG;rbs_motif=AGGA/GGAG/GAGG;rbs_spacer=11-12bp;gc_cont=0.335	WP_000186313.1 MULTISPECIES: Cof-type HAD-IIB family hydrolase [Staphylococcus]	100	99.6	3.35e-191
BAAHSV010000001.1_74|82209|83123|-1|ID=1_74;partial=00;start_type=ATG;rbs_motif=AGGAG;rbs_spacer=5-10bp;gc_cont=0.361	WP_000073184.1 MULTISPECIES: homoserine kinase [Staphylococcus]	100	99.7	2.05e-215
BAAHSV010000001.1_75|83125|84186|-1|ID=1_75;partial=00;start_type=ATG;rbs_motif=AGGAG;rbs_spacer=5-10bp;gc_cont=0.352	WP_001255460.1 MULTISPECIES: threonine synthase [Staphylococcus]	100	99.7	2.41e-250
BAAHSV010000001.1_76|84192|85472|-1|ID=1_76;partial=00;start_type=ATG;rbs_motif=GGAG/GAGG;rbs_spacer=5-10bp;gc_cont=0.326	WP_000735864.1 MULTISPECIES: homoserine dehydrogenase [Staphylococcus]	100	99.8	1.27e-298
BAAHSV010000001.1_77|85663|87045|1|ID=1_77;partial=00;start_type=ATG;rbs_motif=GGA/GAG/AGG;rbs_spacer=11-12bp;gc_cont=0.314	WP_000868645.1 MULTISPECIES: aspartate kinase [Staphylococcus]	100	99.8	0.0
BAAHSV010000001.1_78|87099|87674|-1|ID=1_78;partial=00;start_type=ATG;rbs_motif=GGA/GAG/AGG;rbs_spacer=5-10bp;gc_cont=0.297	WP_001803470.1 MULTISPECIES: hypothetical protein [Staphylococcus]	100	99.5	3.99e-134
BAAHSV010000001.1_79|88005|88859|1|ID=1_79;partial=00;start_type=ATG;rbs_motif=AGGA/GGAG/GAGG;rbs_spacer=11-12bp;gc_cont=0.297	WP_000011823.1 MULTISPECIES: hypothetical protein [Staphylococcus]	100	99.6	1.16e-195
BAAHSV010000001.1_80|89002|89574|-1|ID=1_80;partial=00;start_type=ATG;rbs_motif=None;rbs_spacer=None;gc_cont=0.319	WP_000841351.1 MULTISPECIES: thermonuclease NucI [Staphylococcus]	100	92.7	3.16e-123
BAAHSV010000001.1_82|89975|90577|-1|ID=1_82;partial=00;start_type=ATG;rbs_motif=AGGAG;rbs_spacer=5-10bp;gc_cont=0.300	WP_000202389.1 response regulator transcription factor [Staphylococcus aureus]	100	99.5	3.51e-137
BAAHSV010000001.1_83|90574|91665|-1|ID=1_83;partial=00;start_type=ATG;rbs_motif=GGA/GAG/AGG;rbs_spacer=5-10bp;gc_cont=0.266	WP_000670313.1 sensor histidine kinase [Staphylococcus aureus]	100	99.7	4.42e-242
BAAHSV010000001.1_84|91669|92400|-1|ID=1_84;partial=00;start_type=ATG;rbs_motif=GGA/GAG/AGG;rbs_spacer=5-10bp;gc_cont=0.279	WP_000603968.1 MULTISPECIES: ABC transporter permease [Staphylococcus]	100	99.6	2.53e-149
BAAHSV010000001.1_85|92369|93268|-1|ID=1_85;partial=00;start_type=TTG;rbs_motif=GGAG/GAGG;rbs_spacer=5-10bp;gc_cont=0.270	WP_000614807.1 ABC transporter ATP-binding protein [Staphylococcus aureus]	100	99.7	2.37e-207
BAAHSV010000001.1_86|93452|94933|-1|ID=1_86;partial=00;start_type=ATG;rbs_motif=AGGAG;rbs_spacer=5-10bp;gc_cont=0.310	WP_001212860.1 MULTISPECIES: cardiolipin synthase [Staphylococcus]	100	99.8	0.0
BAAHSV010000001.1_87|94991|95188|-1|ID=1_87;partial=00;start_type=ATG;rbs_motif=GGAG/GAGG;rbs_spacer=5-10bp;gc_cont=0.222	WP_000435068.1 MULTISPECIES: hypothetical protein [Staphylococcus]	100	98.5	9.54e-35
BAAHSV010000001.1_88|95428|96483|1|ID=1_88;partial=00;start_type=ATG;rbs_motif=None;rbs_spacer=None;gc_cont=0.337	WP_267830412.1 threonine aldolase family protein [Staphylococcus aureus]	98.6	99.7	1.85e-253
BAAHSV010000001.1_89|97032|97223|-1|ID=1_89;partial=00;start_type=ATG;rbs_motif=AGGAG;rbs_spacer=5-10bp;gc_cont=0.219	WP_240004808.1 MULTISPECIES: LSM domain protein [Staphylococcus]	98.4	98.4	2.04e-35
BAAHSV010000001.1_90|97230|97580|-1|ID=1_90;partial=00;start_type=ATG;rbs_motif=None;rbs_spacer=None;gc_cont=0.236	WP_000891995.1 MULTISPECIES: polymorphic toxin type 50 domain-containing protein [Staphylococcus]	100	99.1	2.87e-75
BAAHSV010000001.1_91|97621|97815|-1|ID=1_91;partial=00;start_type=TTG;rbs_motif=GGA/GAG/AGG;rbs_spacer=5-10bp;gc_cont=0.292	WP_001217295.1 MULTISPECIES: hypothetical protein [Staphylococcus]	100	98.5	2.65e-36
BAAHSV010000001.1_92|97826|98116|-1|ID=1_92;partial=00;start_type=ATG;rbs_motif=None;rbs_spacer=None;gc_cont=0.261	WP_000900530.1 polymorphic toxin type 50 domain-containing protein [Staphylococcus aureus]	100	99.0	1.76e-62
BAAHSV010000001.1_93|98208|98342|-1|ID=1_93;partial=00;start_type=ATG;rbs_motif=None;rbs_spacer=None;gc_cont=0.422	WP_192830412.1 minor capsid protein, partial [Staphylococcus aureus]	100	97.8	5.32e-27
BAAHSV010000001.1_94|98545|98682|-1|ID=1_94;partial=00;start_type=ATG;rbs_motif=None;rbs_spacer=None;gc_cont=0.239	WP_000600812.1 MULTISPECIES: hypothetical protein [Staphylococcus]	100	97.8	6.57e-20
BAAHSV010000001.1_95|98679|98945|-1|ID=1_95;partial=00;start_type=ATG;rbs_motif=None;rbs_spacer=None;gc_cont=0.240	WP_000903039.1 hypothetical protein [Staphylococcus aureus]	100	98.9	2.63e-58
BAAHSV010000001.1_96|98991|99092|-1|ID=1_96;partial=00;start_type=ATG;rbs_motif=GGAG/GAGG;rbs_spacer=5-10bp;gc_cont=0.284	WP_258464980.1 minor capsid protein [Staphylococcus aureus]	93.8	94.1	2.51e-10
BAAHSV010000001.1_97|99222|99470|-1|ID=1_97;partial=00;start_type=TTG;rbs_motif=GGAG/GAGG;rbs_spacer=5-10bp;gc_cont=0.249	WP_000906224.1 MULTISPECIES: hypothetical protein [Staphylococcus]	100	98.8	1.26e-51
BAAHSV010000001.1_98|99591|100175|-1|ID=1_98;partial=00;start_type=ATG;rbs_motif=None;rbs_spacer=None;gc_cont=0.289	WP_000899337.1 minor capsid protein [Staphylococcus aureus]	100	99.5	1.14e-139
BAAHSV010000001.1_99|100221|100472|-1|ID=1_99;partial=00;start_type=ATG;rbs_motif=GGA/GAG/AGG;rbs_spacer=5-10bp;gc_cont=0.254	WP_000956747.1 MULTISPECIES: hypothetical protein [Staphylococcus]	100	98.8	1.64e-52
BAAHSV010000001.1_100|100601|100705|-1|ID=1_100;partial=00;start_type=ATG;rbs_motif=AGGAG;rbs_spacer=5-10bp;gc_cont=0.257	WP_000477492.1 MULTISPECIES: hypothetical protein [Staphylococcus]	100	97.1	3.09e-16
BAAHSV010000001.1_101|101217|101402|-1|ID=1_101;partial=00;start_type=ATG;rbs_motif=GGAG/GAGG;rbs_spacer=5-10bp;gc_cont=0.263	WP_054190168.1 XRE family transcriptional regulator [Staphylococcus aureus]	98.4	98.4	2.44e-33
BAAHSV010000001.1_102|102641|102847|-1|ID=1_102;partial=00;start_type=ATG;rbs_motif=GGA/GAG/AGG;rbs_spacer=11-12bp;gc_cont=0.237	WP_001002340.1 MULTISPECIES: hypothetical protein [Staphylococcus]	100	98.6	1.79e-38
BAAHSV010000001.1_103|103141|103353|-1|ID=1_103;partial=00;start_type=ATG;rbs_motif=None;rbs_spacer=None;gc_cont=0.235	WP_001071308.1 hypothetical protein [Staphylococcus aureus]	100	98.6	1.06e-40
BAAHSV010000001.1_104|104054|104251|-1|ID=1_104;partial=00;start_type=ATG;rbs_motif=None;rbs_spacer=None;gc_cont=0.268	WP_001789891.1 MULTISPECIES: hypothetical protein [Staphylococcus]	100	98.5	1.41e-36
BAAHSV010000001.1_105|104744|106084|-1|ID=1_105;partial=00;start_type=ATG;rbs_motif=GGAG/GAGG;rbs_spacer=5-10bp;gc_cont=0.352	WP_001126603.1 MULTISPECIES: type I glutamate--ammonia ligase [Staphylococcus]	100	99.8	0.0
BAAHSV010000001.1_106|106103|106471|-1|ID=1_106;partial=00;start_type=ATG;rbs_motif=AGGAG;rbs_spacer=5-10bp;gc_cont=0.328	WP_000624945.1 MULTISPECIES: MerR family transcriptional regulator [Staphylococcus]	100	99.2	1.62e-77
BAAHSV010000001.1_107|106714|107952|-1|ID=1_107;partial=00;start_type=ATG;rbs_motif=AGGA;rbs_spacer=5-10bp;gc_cont=0.350	WP_000652047.1 MULTISPECIES: methionine gamma-lyase family protein [Staphylococcus]	100	99.8	1.72e-298
BAAHSV010000001.1_108|107971|109209|-1|ID=1_108;partial=00;start_type=ATG;rbs_motif=AGGAG;rbs_spacer=5-10bp;gc_cont=0.316	WP_000068617.1 MULTISPECIES: GTPase HflX [Staphylococcus]	100	99.8	1.69e-289
BAAHSV010000001.1_109|109321|109797|1|ID=1_109;partial=00;start_type=ATG;rbs_motif=AGGA;rbs_spacer=5-10bp;gc_cont=0.335	WP_000448078.1 MULTISPECIES: glutathione peroxidase [Staphylococcus]	100	99.4	2.96e-113
BAAHSV010000001.1_110|110019|110252|-1|ID=1_110;partial=00;start_type=ATG;rbs_motif=AGGAG;rbs_spacer=5-10bp;gc_cont=0.346	WP_000561358.1 MULTISPECIES: RNA chaperone Hfq [Bacteria]	100	98.7	1.36e-46
BAAHSV010000001.1_111|110267|111202|-1|ID=1_111;partial=00;start_type=ATG;rbs_motif=GGA/GAG/AGG;rbs_spacer=5-10bp;gc_cont=0.319	WP_078069100.1 tRNA (adenosine(37)-N6)-dimethylallyltransferase MiaA [Staphylococcus aureus]	100	99.7	1.90e-219
BAAHSV010000001.1_112|111220|112134|-1|ID=1_112;partial=00;start_type=ATG;rbs_motif=GGA/GAG/AGG;rbs_spacer=5-10bp;gc_cont=0.304	WP_000136950.1 MULTISPECIES: alpha/beta fold hydrolase [Staphylococcus]	100	99.7	2.16e-226
BAAHSV010000001.1_113|112284|113957|-1|ID=1_113;partial=00;start_type=ATG;rbs_motif=AGGAG;rbs_spacer=5-10bp;gc_cont=0.342	WP_001218596.1 MULTISPECIES: glycerol-3-phosphate dehydrogenase/oxidase [Staphylococcus]	100	99.8	0.0
BAAHSV010000001.1_114|114115|115707|-1|ID=1_114;partial=00;start_type=ATG;rbs_motif=None;rbs_spacer=None;gc_cont=0.361	WP_407532390.1 glycerol kinase GlpK [Staphylococcus aureus]	98.9	99.8	0.0
BAAHSV010000001.1_115|115740|116558|-1|ID=1_115;partial=00;start_type=ATG;rbs_motif=GGAG/GAGG;rbs_spacer=5-10bp;gc_cont=0.376	WP_001103743.1 MULTISPECIES: MIP/aquaporin family protein [Staphylococcus]	100	99.6	1.00e-158
BAAHSV010000001.1_116|117023|117565|-1|ID=1_116;partial=00;start_type=ATG;rbs_motif=None;rbs_spacer=None;gc_cont=0.291	WP_001077635.1 MULTISPECIES: glycerol-3-phosphate responsive antiterminator [Staphylococcus]	100	99.4	2.73e-122
BAAHSV010000001.1_117|117571|119580|-1|ID=1_117;partial=00;start_type=ATG;rbs_motif=GGAG/GAGG;rbs_spacer=5-10bp;gc_cont=0.313	WP_000516261.1 MULTISPECIES: DNA mismatch repair endonuclease MutL [Staphylococcus]	100	99.9	0.0
BAAHSV010000001.1_118|119593|122211|-1|ID=1_118;partial=00;start_type=ATG;rbs_motif=None;rbs_spacer=None;gc_cont=0.321	WP_000073352.1 MULTISPECIES: DNA mismatch repair protein MutS [Staphylococcus]	100	99.9	0.0
BAAHSV010000001.1_119|122514|123005|-1|ID=1_119;partial=00;start_type=ATG;rbs_motif=AGGAG;rbs_spacer=5-10bp;gc_cont=0.339	WP_000842277.1 MULTISPECIES: energy coupling factor transporter S component ThiW [Staphylococcus]	100	99.4	2.78e-100
BAAHSV010000001.1_120|123032|123397|-1|ID=1_120;partial=00;start_type=ATG;rbs_motif=None;rbs_spacer=None;gc_cont=0.303	WP_000282388.1 MULTISPECIES: RicAFT regulatory complex protein RicA family protein [Staphylococcus]	100	99.2	2.92e-75
BAAHSV010000001.1_121|123398|124942|-1|ID=1_121;partial=00;start_type=GTG;rbs_motif=AGGA;rbs_spacer=5-10bp;gc_cont=0.329	WP_001001523.1 MULTISPECIES: tRNA (N6-isopentenyl adenosine(37)-C2)-methylthiotransferase MiaB [Staphylococcus]	100	99.8	0.0
BAAHSV010000001.1_122|125076|125369|-1|ID=1_122;partial=00;start_type=ATG;rbs_motif=AGGAG;rbs_spacer=5-10bp;gc_cont=0.306	WP_000655666.1 MULTISPECIES: thiamine-binding protein [Staphylococcus]	100	99.0	1.14e-63
