BAAHTU010000006.1_124|113959|115062|1|ID=1_124;partial=00;start_type=ATG;rbs_motif=AGGAG;rbs_spacer=5-10bp;gc_cont=0.359	WP_000655692.1 MULTISPECIES: PLP-dependent transferase [Staphylococcus]	100	99.7	3.78e-261
BAAHTU010000006.1_125|115059|116219|1|ID=1_125;partial=00;start_type=ATG;rbs_motif=GGAG/GAGG;rbs_spacer=5-10bp;gc_cont=0.379	WP_000175846.1 MULTISPECIES: cystathionine beta-lyase MetC [Staphylococcus]	100	99.7	9.53e-276
BAAHTU010000006.1_126|116188|118029|1|ID=1_126;partial=00;start_type=ATG;rbs_motif=AGGAG;rbs_spacer=5-10bp;gc_cont=0.361	WP_000077318.1 MULTISPECIES: bifunctional homocysteine S-methyltransferase/methylenetetrahydrofolate reductase [Staphylococcus]	100	99.8	0.0
BAAHTU010000006.1_127|118026|120254|1|ID=1_127;partial=00;start_type=ATG;rbs_motif=AGGAG;rbs_spacer=5-10bp;gc_cont=0.341	WP_000207614.1 MULTISPECIES: 5-methyltetrahydropteroyltriglutamate--homocysteine S-methyltransferase [Staphylococcus]	100	99.9	0.0
BAAHTU010000006.1_128|120297|121049|1|ID=1_128;partial=00;start_type=ATG;rbs_motif=None;rbs_spacer=None;gc_cont=0.373	WP_000195907.1 MULTISPECIES: cyclase family protein [Staphylococcus]	100	99.6	3.36e-187
BAAHTU010000006.1_129|121132|122313|-1|ID=1_129;partial=00;start_type=ATG;rbs_motif=AGGA/GGAG/GAGG;rbs_spacer=11-12bp;gc_cont=0.384	WP_108932419.1 acetyl-CoA C-acetyltransferase [Staphylococcus aureus]	100	99.7	2.85e-276
BAAHTU010000006.1_130|122852|123985|1|ID=1_130;partial=00;start_type=ATG;rbs_motif=AGGAG;rbs_spacer=5-10bp;gc_cont=0.313	WP_000245685.1 MULTISPECIES: low temperature requirement protein A [Staphylococcus]	100	99.7	7.37e-264
BAAHTU010000006.1_131|124352|124981|-1|ID=1_131;partial=00;start_type=ATG;rbs_motif=GGAG/GAGG;rbs_spacer=5-10bp;gc_cont=0.322	WP_148239928.1 ABC-2 transporter permease [Staphylococcus aureus]	100	99.5	1.04e-122
BAAHTU010000006.1_132|124981|125823|-1|ID=1_132;partial=00;start_type=ATG;rbs_motif=AGGAG;rbs_spacer=5-10bp;gc_cont=0.311	WP_000209565.1 MULTISPECIES: ABC transporter ATP-binding protein [Staphylococcus]	100	99.6	5.76e-194
BAAHTU010000006.1_133|125848|126561|-1|ID=1_133;partial=00;start_type=ATG;rbs_motif=AGGAG;rbs_spacer=5-10bp;gc_cont=0.317	WP_000698752.1 MULTISPECIES: DUF3169 family protein [Staphylococcus]	100	99.6	2.72e-141
BAAHTU010000006.1_134|126558|126761|-1|ID=1_134;partial=00;start_type=GTG;rbs_motif=AGGAG;rbs_spacer=5-10bp;gc_cont=0.387	WP_001246013.1 MULTISPECIES: helix-turn-helix transcriptional regulator [Staphylococcus]	100	98.5	1.89e-35
BAAHTU010000006.1_135|127002|127391|1|ID=1_135;partial=00;start_type=ATG;rbs_motif=AGGAG;rbs_spacer=5-10bp;gc_cont=0.349	WP_000886005.1 MULTISPECIES: DUF1398 domain-containing protein [Staphylococcus]	100	99.2	2.84e-88
BAAHTU010000006.1_136|127500|127715|1|ID=1_136;partial=00;start_type=ATG;rbs_motif=GGAG/GAGG;rbs_spacer=5-10bp;gc_cont=0.366	WP_000632271.1 twin-arginine translocase TatA/TatE family subunit [Staphylococcus aureus]	100	98.6	1.06e-36
BAAHTU010000006.1_137|127828|128433|1|ID=1_137;partial=00;start_type=ATG;rbs_motif=None;rbs_spacer=None;gc_cont=0.327	WP_117192695.1 twin-arginine translocase subunit TatC [Staphylococcus aureus]	100	99.5	1.19e-136
BAAHTU010000006.1_138|128526|130238|-1|ID=1_138;partial=00;start_type=GTG;rbs_motif=GGAG/GAGG;rbs_spacer=5-10bp;gc_cont=0.337	WP_000683699.1 MULTISPECIES: FTR1 family iron permease [Staphylococcus]	100	99.8	0.0
BAAHTU010000006.1_139|130219|131448|-1|ID=1_139;partial=00;start_type=ATG;rbs_motif=None;rbs_spacer=None;gc_cont=0.374	WP_000186217.1 MULTISPECIES: iron uptake transporter deferrochelatase/peroxidase subunit [Staphylococcus]	100	99.8	4.43e-304
BAAHTU010000006.1_140|131445|132299|-1|ID=1_140;partial=00;start_type=ATG;rbs_motif=GGAG/GAGG;rbs_spacer=5-10bp;gc_cont=0.310	WP_000737196.1 MULTISPECIES: iron uptake system protein EfeO [Staphylococcus]	100	99.6	5.92e-173
BAAHTU010000006.1_141|132567|133112|-1|ID=1_141;partial=00;start_type=ATG;rbs_motif=GGAG/GAGG;rbs_spacer=5-10bp;gc_cont=0.353	WP_000467652.1 MULTISPECIES: GNAT family N-acetyltransferase [Staphylococcus]	99.4	99.5	1.16e-128
BAAHTU010000006.1_142|133414|134526|1|ID=1_142;partial=00;start_type=ATG;rbs_motif=None;rbs_spacer=None;gc_cont=0.347	WP_000157629.1 MULTISPECIES: YeiH family protein [Staphylococcus]	100	89.2	9.10e-213
BAAHTU010000006.1_143|134586|135152|-1|ID=1_143;partial=00;start_type=ATG;rbs_motif=AGGAG;rbs_spacer=5-10bp;gc_cont=0.339	WP_001028431.1 MULTISPECIES: NADPH-dependent FMN reductase [Staphylococcus]	100	99.5	1.90e-126
BAAHTU010000006.1_144|135166|136227|-1|ID=1_144;partial=00;start_type=ATG;rbs_motif=AGGAG;rbs_spacer=5-10bp;gc_cont=0.370	WP_001096116.1 MULTISPECIES: LLM class flavin-dependent oxidoreductase [Staphylococcus]	100	99.7	2.63e-254
BAAHTU010000006.1_145|136241|137230|-1|ID=1_145;partial=00;start_type=ATG;rbs_motif=GGA/GAG/AGG;rbs_spacer=5-10bp;gc_cont=0.338	WP_001028221.1 MULTISPECIES: VOC family protein [Staphylococcus]	100	93.3	4.66e-224
BAAHTU010000006.1_146|137475|138833|1|ID=1_146;partial=00;start_type=ATG;rbs_motif=AGGAG;rbs_spacer=5-10bp;gc_cont=0.371	WP_001010111.1 MULTISPECIES: glycerol-3-phosphate transporter [Staphylococcus]	100	99.8	0.0
BAAHTU010000006.1_147|138916|139356|-1|ID=1_147;partial=00;start_type=ATG;rbs_motif=GGA/GAG/AGG;rbs_spacer=5-10bp;gc_cont=0.302	WP_000335332.1 MULTISPECIES: MepB family protein [Staphylococcus]	100	99.3	3.41e-104
BAAHTU010000006.1_148|139460|140815|-1|ID=1_148;partial=00;start_type=ATG;rbs_motif=AGGAG;rbs_spacer=5-10bp;gc_cont=0.330	WP_000651060.1 MULTISPECIES: multidrug efflux MATE transporter MepA [Staphylococcus]	100	99.8	5.37e-299
BAAHTU010000006.1_149|140922|141341|-1|ID=1_149;partial=00;start_type=ATG;rbs_motif=None;rbs_spacer=None;gc_cont=0.336	WP_000397416.1 MULTISPECIES: multidrug efflux transporter transcriptional repressor MepR [Staphylococcus]	100	99.3	1.47e-88
BAAHTU010000006.1_150|141553|143508|1|ID=1_150;partial=00;start_type=TTG;rbs_motif=AGGAG;rbs_spacer=5-10bp;gc_cont=0.344	WP_108932415.1 BglG family transcription antiterminator [Staphylococcus aureus]	100	99.8	0.0
BAAHTU010000006.1_151|143513|143956|1|ID=1_151;partial=00;start_type=GTG;rbs_motif=AGGAG;rbs_spacer=5-10bp;gc_cont=0.354	WP_000050762.1 MULTISPECIES: PTS sugar transporter subunit IIA [Staphylococcus]	100	99.3	7.72e-97
BAAHTU010000006.1_152|143958|144242|1|ID=1_152;partial=00;start_type=ATG;rbs_motif=AGGAG;rbs_spacer=5-10bp;gc_cont=0.351	WP_000699538.1 MULTISPECIES: PTS sugar transporter subunit IIB [Staphylococcus]	100	98.9	1.65e-57
BAAHTU010000006.1_153|144257|145603|1|ID=1_153;partial=00;start_type=ATG;rbs_motif=AGGAG;rbs_spacer=5-10bp;gc_cont=0.379	WP_001147970.1 MULTISPECIES: PTS ascorbate transporter subunit IIC [Staphylococcus]	100	99.8	2.20e-301
BAAHTU010000006.1_154|145696|146721|-1|ID=1_154;partial=00;start_type=ATG;rbs_motif=AGGAG;rbs_spacer=5-10bp;gc_cont=0.356	WP_001060929.1 MULTISPECIES: SDR family oxidoreductase [Staphylococcus]	100	99.7	6.30e-240
BAAHTU010000006.1_155|147036|148058|-1|ID=1_155;partial=00;start_type=ATG;rbs_motif=GGAG/GAGG;rbs_spacer=5-10bp;gc_cont=0.346	WP_000280803.1 MULTISPECIES: lipoate--protein ligase [Staphylococcus]	100	99.7	5.67e-247
BAAHTU010000006.1_156|148036|148980|-1|ID=1_156;partial=00;start_type=ATG;rbs_motif=AGGAG(G)/GGAGG;rbs_spacer=13-15bp;gc_cont=0.380	WP_001191946.1 MULTISPECIES: SIR2 family NAD-dependent protein deacylase [Staphylococcus]	100	99.7	3.46e-228
BAAHTU010000006.1_157|148970|149770|-1|ID=1_157;partial=00;start_type=ATG;rbs_motif=GGAG/GAGG;rbs_spacer=5-10bp;gc_cont=0.360	WP_000449060.1 MULTISPECIES: protein-ADP-ribose hydrolase [Staphylococcus]	100	99.6	7.60e-192
BAAHTU010000006.1_158|149771|150103|-1|ID=1_158;partial=00;start_type=ATG;rbs_motif=AGGA;rbs_spacer=5-10bp;gc_cont=0.363	WP_000731878.1 MULTISPECIES: glycine cleavage system protein H [Staphylococcus]	100	99.1	9.88e-71
BAAHTU010000006.1_159|150137|151138|-1|ID=1_159;partial=00;start_type=TTG;rbs_motif=GGAG/GAGG;rbs_spacer=5-10bp;gc_cont=0.374	WP_000240058.1 MULTISPECIES: LLM class flavin-dependent oxidoreductase [Staphylococcus]	100	99.7	1.61e-238
BAAHTU010000006.1_160|151440|152639|1|ID=1_160;partial=00;start_type=ATG;rbs_motif=AGGA;rbs_spacer=5-10bp;gc_cont=0.394	WP_000286484.1 MULTISPECIES: NADH-dependent flavin oxidoreductase [Staphylococcus]	100	99.8	2.72e-293
BAAHTU010000006.1_161|152712|153539|1|ID=1_161;partial=00;start_type=GTG;rbs_motif=AGGA/GGAG/GAGG;rbs_spacer=11-12bp;gc_cont=0.342	WP_000136020.1 MULTISPECIES: alpha/beta hydrolase [Staphylococcus]	100	99.6	5.39e-201
BAAHTU010000006.1_162|153781|155853|-1|ID=1_162;partial=00;start_type=ATG;rbs_motif=GGAG/GAGG;rbs_spacer=5-10bp;gc_cont=0.375	WP_049304865.1 YSIRK domain-containing triacylglycerol lipase Lip2/Geh [Staphylococcus aureus]	96.7	99.9	0.0
BAAHTU010000006.1_163|156223|157584|1|ID=1_163;partial=00;start_type=ATG;rbs_motif=GGA/GAG/AGG;rbs_spacer=5-10bp;gc_cont=0.360	WP_001077722.1 MULTISPECIES: YjiH family protein [Staphylococcus]	100	96.3	5.67e-298
BAAHTU010000006.1_164|157711|158379|-1|ID=1_164;partial=00;start_type=ATG;rbs_motif=GGAG/GAGG;rbs_spacer=5-10bp;gc_cont=0.377	WP_000936720.1 MULTISPECIES: N-acetylmannosamine-6-phosphate 2-epimerase [Staphylococcus]	100	99.6	1.93e-154
BAAHTU010000006.1_165|158519|159319|1|ID=1_165;partial=00;start_type=ATG;rbs_motif=GGA/GAG/AGG;rbs_spacer=5-10bp;gc_cont=0.333	WP_000667382.1 MULTISPECIES: MurR/RpiR family transcriptional regulator [Staphylococcus]	100	99.6	3.72e-183
BAAHTU010000006.1_166|159597|160499|-1|ID=1_166;partial=00;start_type=ATG;rbs_motif=None;rbs_spacer=None;gc_cont=0.371	WP_064646651.1 ROK family protein [Staphylococcus aureus]	99.3	99.7	1.50e-215
BAAHTU010000006.1_167|160615|161496|1|ID=1_167;partial=00;start_type=ATG;rbs_motif=GGAG/GAGG;rbs_spacer=5-10bp;gc_cont=0.350	WP_001030738.1 MULTISPECIES: N-acetylneuraminate lyase [Staphylococcus]	100	99.7	8.61e-207
BAAHTU010000006.1_168|161536|163068|1|ID=1_168;partial=00;start_type=ATG;rbs_motif=GGA/GAG/AGG;rbs_spacer=5-10bp;gc_cont=0.360	WP_000665736.1 MULTISPECIES: sodium:solute symporter [Staphylococcus]	100	99.8	0.0
BAAHTU010000006.1_169|163173|164393|-1|ID=1_169;partial=00;start_type=ATG;rbs_motif=GGA/GAG/AGG;rbs_spacer=5-10bp;gc_cont=0.326	WP_001022962.1 NupC/NupG family nucleoside CNT transporter [Staphylococcus aureus]	100	99.8	3.26e-268
BAAHTU010000006.1_170|164404|165327|-1|ID=1_170;partial=00;start_type=ATG;rbs_motif=GGAG/GAGG;rbs_spacer=5-10bp;gc_cont=0.380	WP_000002068.1 MULTISPECIES: pseudouridine-5'-phosphate glycosidase [Staphylococcus]	100	99.7	6.53e-209
BAAHTU010000006.1_171|165302|166420|-1|ID=1_171;partial=00;start_type=ATG;rbs_motif=AGGAG;rbs_spacer=5-10bp;gc_cont=0.340	WP_001283977.1 MULTISPECIES: carbohydrate kinase [Staphylococcus]	100	99.7	1.56e-267
BAAHTU010000006.1_172|166763|167800|-1|ID=1_172;partial=00;start_type=ATG;rbs_motif=None;rbs_spacer=None;gc_cont=0.385	WP_223810476.1 PTS sugar transporter subunit IIC [Staphylococcus aureus]	99.7	96.0	8.39e-205
BAAHTU010000006.1_173|168002|168679|-1|ID=1_173;partial=00;start_type=ATG;rbs_motif=AGGAG;rbs_spacer=5-10bp;gc_cont=0.335	WP_000911019.1 MULTISPECIES: ABC transporter ATP-binding protein [Staphylococcus]	100	99.6	8.13e-153
BAAHTU010000006.1_174|168692|169741|-1|ID=1_174;partial=00;start_type=ATG;rbs_motif=GGAG/GAGG;rbs_spacer=5-10bp;gc_cont=0.334	WP_000477934.1 MULTISPECIES: ABC transporter permease [Staphylococcus]	100	99.7	5.11e-234
BAAHTU010000006.1_175|169990|170880|-1|ID=1_175;partial=00;start_type=ATG;rbs_motif=GGAG/GAGG;rbs_spacer=5-10bp;gc_cont=0.332	WP_001033876.1 MULTISPECIES: 5'-nucleotidase, lipoprotein e(P4) family [Staphylococcus]	100	99.7	2.19e-206
BAAHTU010000006.1_176|171464|172771|1|ID=1_176;partial=00;start_type=TTG;rbs_motif=AGGA;rbs_spacer=5-10bp;gc_cont=0.359	WP_000745099.1 MULTISPECIES: branched-chain amino acid transport system II carrier protein BrnQ2 [Staphylococcus]	100	99.8	4.82e-303
BAAHTU010000006.1_177|172987|173832|1|ID=1_177;partial=00;start_type=ATG;rbs_motif=None;rbs_spacer=None;gc_cont=0.332	WP_000834168.1 formate/nitrite transporter family protein [Staphylococcus aureus]	100	99.6	3.45e-191
BAAHTU010000006.1_178|174048|174446|-1|ID=1_178;partial=00;start_type=ATG;rbs_motif=AGGAG;rbs_spacer=5-10bp;gc_cont=0.316	WP_000415675.1 MULTISPECIES: DUF4064 domain-containing protein [Staphylococcus]	100	99.2	1.62e-75
BAAHTU010000006.1_179|174599|174973|-1|ID=1_179;partial=00;start_type=ATG;rbs_motif=AGGAG;rbs_spacer=5-10bp;gc_cont=0.267	WP_000822161.1 MULTISPECIES: DUF4467 domain-containing protein [Staphylococcus]	100	99.2	4.80e-80
BAAHTU010000006.1_180|175595|176083|-1|ID=1_180;partial=00;start_type=ATG;rbs_motif=GGA/GAG/AGG;rbs_spacer=5-10bp;gc_cont=0.299	WP_000142094.1 MULTISPECIES: antitoxin YezG family protein [Staphylococcus]	100	99.4	2.61e-118
BAAHTU010000006.1_181|176094|176594|-1|ID=1_181;partial=00;start_type=ATG;rbs_motif=GGA/GAG/AGG;rbs_spacer=5-10bp;gc_cont=0.301	WP_000142102.1 MULTISPECIES: TIGR01741 family protein [Staphylococcus]	100	99.4	8.35e-117
BAAHTU010000006.1_182|176605|177105|-1|ID=1_182;partial=00;start_type=ATG;rbs_motif=GGAG/GAGG;rbs_spacer=5-10bp;gc_cont=0.301	WP_000141947.1 MULTISPECIES: TIGR01741 family protein [Staphylococcus]	100	99.4	6.61e-123
BAAHTU010000006.1_183|177116|177616|-1|ID=1_183;partial=00;start_type=ATG;rbs_motif=GGAG/GAGG;rbs_spacer=5-10bp;gc_cont=0.301	WP_108932413.1 TIGR01741 family protein [Staphylococcus aureus]	100	99.4	5.03e-118
BAAHTU010000006.1_184|177627|178127|-1|ID=1_184;partial=00;start_type=ATG;rbs_motif=GGAG/GAGG;rbs_spacer=5-10bp;gc_cont=0.305	WP_001606168.1 TIGR01741 family protein [Staphylococcus aureus]	100	99.4	7.14e-118
BAAHTU010000006.1_185|178139|178639|-1|ID=1_185;partial=00;start_type=ATG;rbs_motif=GGA/GAG/AGG;rbs_spacer=5-10bp;gc_cont=0.301	WP_000141982.1 MULTISPECIES: TIGR01741 family protein [Staphylococcus]	100	99.4	2.59e-120
BAAHTU010000006.1_186|179225|179908|-1|ID=1_186;partial=00;start_type=ATG;rbs_motif=AGGAG;rbs_spacer=5-10bp;gc_cont=0.268	WP_000208414.1 DUF5079 family protein [Staphylococcus aureus]	100	99.6	8.71e-149
BAAHTU010000006.1_187|180116|180607|-1|ID=1_187;partial=00;start_type=ATG;rbs_motif=GGAG/GAGG;rbs_spacer=5-10bp;gc_cont=0.289	WP_000142049.1 MULTISPECIES: TIGR01741 family protein [Staphylococcus]	100	99.4	1.57e-115
BAAHTU010000006.1_188|180618|182462|-1|ID=1_188;partial=00;start_type=ATG;rbs_motif=GGA/GAG/AGG;rbs_spacer=5-10bp;gc_cont=0.357	WP_123090409.1 DNA/RNA non-specific endonuclease [Staphylococcus aureus]	98.9	99.8	0.0
BAAHTU010000006.1_189|182472|182789|-1|ID=1_189;partial=00;start_type=ATG;rbs_motif=GGA/GAG/AGG;rbs_spacer=5-10bp;gc_cont=0.368	WP_000175722.1 MULTISPECIES: type VII secretion system extracellular protein EsxD [Staphylococcus]	100	99.1	3.14e-67
BAAHTU010000006.1_190|182789|183466|-1|ID=1_190;partial=00;start_type=ATG;rbs_motif=GGA/GAG/AGG;rbs_spacer=5-10bp;gc_cont=0.296	WP_000655875.1 MULTISPECIES: DUF5081 family protein [Staphylococcus]	100	99.1	1.79e-158
BAAHTU010000006.1_191|183463|183777|-1|ID=1_191;partial=00;start_type=ATG;rbs_motif=GGAG/GAGG;rbs_spacer=5-10bp;gc_cont=0.387	WP_000509668.1 MULTISPECIES: WXG100 family type VII secretion effector EsxB [Staphylococcus]	100	99.0	1.98e-65
BAAHTU010000006.1_192|183793|184185|-1|ID=1_192;partial=00;start_type=ATG;rbs_motif=AGGAGG;rbs_spacer=5-10bp;gc_cont=0.310	WP_001010289.1 MULTISPECIES: type VII secretion substrate EsaC [Staphylococcus]	100	99.2	7.50e-80
BAAHTU010000006.1_193|184215|188654|-1|ID=1_193;partial=00;start_type=ATG;rbs_motif=GGAG/GAGG;rbs_spacer=5-10bp;gc_cont=0.340	WP_000549278.1 MULTISPECIES: type VII secretion protein EssC [Staphylococcus]	99.9	99.9	0.0
BAAHTU010000006.1_194|188676|190010|-1|ID=1_194;partial=00;start_type=ATG;rbs_motif=AGGAG;rbs_spacer=5-10bp;gc_cont=0.300	WP_031796234.1 type VII secretion protein EssB, partial [Staphylococcus aureus]	100	87.9	2.16e-276
BAAHTU010000006.1_195|190023|190265|-1|ID=1_195;partial=00;start_type=ATG;rbs_motif=AGGA/GGAG/GAGG;rbs_spacer=11-12bp;gc_cont=0.296	WP_001071606.1 MULTISPECIES: type VII secretion protein EsaB [Staphylococcus]	100	98.8	3.02e-49
BAAHTU010000006.1_196|190237|190695|-1|ID=1_196;partial=00;start_type=ATG;rbs_motif=GGA/GAG/AGG;rbs_spacer=5-10bp;gc_cont=0.327	WP_000928935.1 MULTISPECIES: type VII secretion protein EssA [Staphylococcus]	100	99.3	7.91e-97
BAAHTU010000006.1_197|190695|193724|-1|ID=1_197;partial=00;start_type=ATG;rbs_motif=AGGA;rbs_spacer=5-10bp;gc_cont=0.309	WP_000728949.1 MULTISPECIES: type VII secretion protein EsaA [Staphylococcus]	100	99.9	0.0
BAAHTU010000006.1_198|193808|194101|-1|ID=1_198;partial=00;start_type=ATG;rbs_motif=AGGAG;rbs_spacer=5-10bp;gc_cont=0.378	WP_001240826.1 MULTISPECIES: WXG100 family type VII secretion effector EsxA [Staphylococcus]	100	99.0	5.04e-58
BAAHTU010000006.1_199|194340|195242|1|ID=1_199;partial=00;start_type=ATG;rbs_motif=GGA/GAG/AGG;rbs_spacer=5-10bp;gc_cont=0.373	WP_000751207.1 MULTISPECIES: CHAP domain-containing protein [Staphylococcus]	100	98.7	3.96e-208
BAAHTU010000006.1_200|195385|195972|-1|ID=1_200;partial=00;start_type=ATG;rbs_motif=AGGAG;rbs_spacer=5-10bp;gc_cont=0.281	WP_000583198.1 MULTISPECIES: DUF5080 family protein [Staphylococcus]	100	99.5	2.09e-122
BAAHTU010000006.1_201|196006|196659|-1|ID=1_201;partial=00;start_type=ATG;rbs_motif=AGGA/GGAG/GAGG;rbs_spacer=11-12bp;gc_cont=0.277	WP_000421225.1 MULTISPECIES: DUF5079 family protein [Staphylococcus]	100	99.5	1.46e-142
BAAHTU010000006.1_202|196930|198453|1|ID=1_202;partial=00;start_type=ATG;rbs_motif=GGAG/GAGG;rbs_spacer=5-10bp;gc_cont=0.284	WP_000038517.1 MULTISPECIES: DUF6583 family protein [Staphylococcus]	100	99.8	0.0
BAAHTU010000006.1_203|198521|199687|1|ID=1_203;partial=00;start_type=ATG;rbs_motif=AGGAG;rbs_spacer=5-10bp;gc_cont=0.319	WP_000848764.1 MULTISPECIES: ABC transporter permease [Staphylococcus]	100	99.7	4.98e-263
BAAHTU010000006.1_204|199684|200604|1|ID=1_204;partial=00;start_type=ATG;rbs_motif=GGAG/GAGG;rbs_spacer=5-10bp;gc_cont=0.316	WP_000806113.1 MULTISPECIES: ABC transporter permease [Staphylococcus]	100	99.7	3.66e-194
BAAHTU010000006.1_205|200618|201277|1|ID=1_205;partial=00;start_type=ATG;rbs_motif=AGGAG;rbs_spacer=5-10bp;gc_cont=0.314	WP_000570071.1 MULTISPECIES: ABC transporter ATP-binding protein [Staphylococcus]	100	99.5	3.22e-156
BAAHTU010000006.1_206|201329|202297|-1|ID=1_206;partial=00;start_type=ATG;rbs_motif=None;rbs_spacer=None;gc_cont=0.396	WP_000736798.1 MULTISPECIES: glycine-glycine endopeptidase LytM [Staphylococcus]	100	97.8	1.21e-226
BAAHTU010000006.1_207|202605|203597|-1|ID=1_207;partial=00;start_type=ATG;rbs_motif=AGGAG;rbs_spacer=5-10bp;gc_cont=0.354	WP_000337364.1 MULTISPECIES: choloylglycine hydrolase family protein [Staphylococcus]	100	99.7	3.68e-247
BAAHTU010000006.1_208|203831|205207|1|ID=1_208;partial=00;start_type=GTG;rbs_motif=AGGAG;rbs_spacer=5-10bp;gc_cont=0.375	WP_001066545.1 MULTISPECIES: MFS transporter [Staphylococcus]	100	99.8	1.64e-308
BAAHTU010000006.1_209|205248|205439|-1|ID=1_209;partial=01;start_type=Edge;rbs_motif=None;rbs_spacer=None;gc_cont=0.292	WP_413926378.1 transposase [Staphylococcus aureus]	100	98.4	1.11e-37
