BAAHSR010000002.1_1|2|310|1|ID=1_1;partial=10;start_type=Edge;rbs_motif=None;rbs_spacer=None;gc_cont=0.408	WP_078153748.1 deoxyribose-phosphate aldolase, partial [Staphylococcus aureus]	100	99.0	1.92e-62
BAAHSR010000002.1_2|338|1516|1|ID=1_2;partial=00;start_type=ATG;rbs_motif=GGAG/GAGG;rbs_spacer=5-10bp;gc_cont=0.368	WP_000197806.1 MULTISPECIES: phosphopentomutase [Staphylococcus]	100	99.7	4.49e-293
BAAHSR010000002.1_3|1647|2462|-1|ID=1_3;partial=00;start_type=ATG;rbs_motif=AGGA/GGAG/GAGG;rbs_spacer=11-12bp;gc_cont=0.373	WP_000191092.1 MULTISPECIES: phosphonate ABC transporter, permease protein PhnE [Staphylococcus]	100	99.6	8.33e-178
BAAHSR010000002.1_4|2459|3259|-1|ID=1_4;partial=00;start_type=ATG;rbs_motif=AGGAG;rbs_spacer=5-10bp;gc_cont=0.343	WP_001127689.1 MULTISPECIES: phosphonate ABC transporter, permease protein PhnE [Staphylococcus]	100	99.6	5.67e-178
BAAHSR010000002.1_5|3261|4034|-1|ID=1_5;partial=00;start_type=ATG;rbs_motif=GGA/GAG/AGG;rbs_spacer=5-10bp;gc_cont=0.349	WP_000078092.1 MULTISPECIES: phosphonate ABC transporter ATP-binding protein [Staphylococcus]	100	99.6	6.96e-179
BAAHSR010000002.1_6|4248|5204|-1|ID=1_6;partial=00;start_type=ATG;rbs_motif=GGA/GAG/AGG;rbs_spacer=5-10bp;gc_cont=0.310	WP_000787672.1 MULTISPECIES: phosphate/phosphite/phosphonate ABC transporter substrate-binding protein [Staphylococcus]	100	99.7	7.39e-216
BAAHSR010000002.1_7|5433|6977|1|ID=1_7;partial=00;start_type=ATG;rbs_motif=AGGAG;rbs_spacer=5-10bp;gc_cont=0.368	WP_409394142.1 DNA-binding protein [Staphylococcus aureus]	99.8	99.8	0.0
BAAHSR010000002.1_8|7028|8563|1|ID=1_8;partial=00;start_type=ATG;rbs_motif=AGGAG;rbs_spacer=5-10bp;gc_cont=0.363	WP_000065035.1 MULTISPECIES: bifunctional metallophosphatase/5'-nucleotidase [Staphylococcus]	100	99.8	0.0
BAAHSR010000002.1_9|8656|8850|1|ID=1_9;partial=00;start_type=ATG;rbs_motif=None;rbs_spacer=None;gc_cont=0.221	WP_301557689.1 ImmA/IrrE family metallo-endopeptidase, partial [Staphylococcus aureus]	100	98.5	9.65e-36
BAAHSR010000002.1_10|9163|9708|1|ID=1_10;partial=00;start_type=ATG;rbs_motif=None;rbs_spacer=None;gc_cont=0.304	WP_001550007.1 replication initiation protein [Staphylococcus aureus]	100	88.5	5.90e-113
BAAHSR010000002.1_11|9693|9983|1|ID=1_11;partial=00;start_type=GTG;rbs_motif=None;rbs_spacer=None;gc_cont=0.271	WP_267246680.1 replication initiation factor domain-containing protein [Staphylococcus aureus]	95.8	99.0	2.39e-57
BAAHSR010000002.1_12|10067|10393|1|ID=1_12;partial=00;start_type=ATG;rbs_motif=AGxAG;rbs_spacer=5-10bp;gc_cont=0.223	WP_000469916.1 hypothetical protein [Staphylococcus aureus]	100	99.1	2.65e-65
BAAHSR010000002.1_13|10960|11181|1|ID=1_13;partial=00;start_type=ATG;rbs_motif=AGGA/GGAG/GAGG;rbs_spacer=11-12bp;gc_cont=0.266	WP_001550009.1 transposase [Staphylococcus aureus]	100	98.6	5.07e-47
BAAHSR010000002.1_14|11631|14240|1|ID=1_14;partial=00;start_type=ATG;rbs_motif=AGGAG;rbs_spacer=5-10bp;gc_cont=0.361	WP_000955777.1 MULTISPECIES: bifunctional acetaldehyde-CoA/alcohol dehydrogenase [Staphylococcus]	100	99.9	0.0
BAAHSR010000002.1_15|14585|15253|1|ID=1_15;partial=00;start_type=ATG;rbs_motif=GGAG/GAGG;rbs_spacer=5-10bp;gc_cont=0.299	WP_000446299.1 MULTISPECIES: capsular polysaccharide type 5/8 biosynthesis protein CapA [Staphylococcus]	100	99.6	2.38e-139
BAAHSR010000002.1_16|15269|15955|1|ID=1_16;partial=00;start_type=ATG;rbs_motif=AGGA/GGAG/GAGG;rbs_spacer=11-12bp;gc_cont=0.336	WP_000037332.1 MULTISPECIES: type 8 capsular polysaccharide synthesis protein Cap8B [Staphylococcus]	100	99.6	3.57e-153
BAAHSR010000002.1_17|15958|16722|1|ID=1_17;partial=00;start_type=ATG;rbs_motif=GGAG/GAGG;rbs_spacer=5-10bp;gc_cont=0.318	WP_000565302.1 MULTISPECIES: type 8 capsular polysaccharide synthesis protein Cap8C [Staphylococcus]	100	99.6	5.13e-184
BAAHSR010000002.1_18|16742|17746|1|ID=1_18;partial=00;start_type=ATG;rbs_motif=GGAG/GAGG;rbs_spacer=5-10bp;gc_cont=0.335	WP_142297501.1 type 8 capsular polysaccharide synthesis protein Cap8D, partial [Staphylococcus aureus]	100	99.1	3.24e-225
BAAHSR010000002.1_19|17712|18566|1|ID=1_19;partial=00;start_type=GTG;rbs_motif=None;rbs_spacer=None;gc_cont=0.368	WP_031888371.1 type 8 capsular polysaccharide synthesis protein Cap8D, partial [Staphylococcus aureus]	99.6	96.8	1.13e-191
BAAHSR010000002.1_20|18556|19584|1|ID=1_20;partial=00;start_type=ATG;rbs_motif=GGAG/GAGG;rbs_spacer=5-10bp;gc_cont=0.339	WP_000459057.1 type 8 capsular polysaccharide synthesis protein Cap8E [Staphylococcus aureus]	100	99.7	2.04e-241
BAAHSR010000002.1_21|19597|20706|1|ID=1_21;partial=00;start_type=TTG;rbs_motif=AGGAG;rbs_spacer=5-10bp;gc_cont=0.348	WP_001028293.1 MULTISPECIES: type 8 capsular polysaccharide synthesis protein Cap8F [Staphylococcus]	100	99.7	9.83e-274
BAAHSR010000002.1_22|20710|21834|1|ID=1_22;partial=00;start_type=ATG;rbs_motif=GGAG/GAGG;rbs_spacer=5-10bp;gc_cont=0.337	WP_000413173.1 type 8 capsular polysaccharide synthesis protein Cap8G [Staphylococcus aureus]	100	99.7	6.63e-270
BAAHSR010000002.1_23|21837|22463|1|ID=1_23;partial=00;start_type=ATG;rbs_motif=GGAG/GAGG;rbs_spacer=5-10bp;gc_cont=0.325	WP_001216898.1 MULTISPECIES: CatB-related O-acetyltransferase [Staphylococcus]	100	99.5	1.37e-147
BAAHSR010000002.1_24|22468|23577|1|ID=1_24;partial=00;start_type=ATG;rbs_motif=AGGA/GGAG/GAGG;rbs_spacer=11-12bp;gc_cont=0.292	WP_001221639.1 MULTISPECIES: glycosyltransferase [Staphylococcus]	100	99.7	7.64e-262
BAAHSR010000002.1_25|23591|24757|1|ID=1_25;partial=00;start_type=ATG;rbs_motif=GGAG/GAGG;rbs_spacer=5-10bp;gc_cont=0.293	WP_000668180.1 MULTISPECIES: O-antigen ligase family protein [Staphylococcus]	100	99.7	9.39e-268
BAAHSR010000002.1_26|24750|25955|1|ID=1_26;partial=00;start_type=ATG;rbs_motif=AGGA;rbs_spacer=5-10bp;gc_cont=0.268	WP_001085819.1 MULTISPECIES: capsular polysaccharide biosynthesis protein [Staphylococcus]	100	99.8	9.19e-261
BAAHSR010000002.1_27|25956|27161|1|ID=1_27;partial=00;start_type=ATG;rbs_motif=AGGA;rbs_spacer=5-10bp;gc_cont=0.351	WP_001291022.1 MULTISPECIES: type 8 capsular polysaccharide synthesis protein Cap8L [Staphylococcus]	100	99.8	3.18e-293
BAAHSR010000002.1_28|27172|27729|1|ID=1_28;partial=00;start_type=ATG;rbs_motif=AGGAG;rbs_spacer=5-10bp;gc_cont=0.326	WP_000825098.1 MULTISPECIES: type 8 capsular polysaccharide synthesis protein Cap8M [Staphylococcus]	100	99.5	8.74e-126
BAAHSR010000002.1_29|27729|28616|1|ID=1_29;partial=00;start_type=ATG;rbs_motif=AGxAGG/AGGxGG;rbs_spacer=11-12bp;gc_cont=0.336	WP_001230670.1 MULTISPECIES: capsular polysaccharide type 5/8 biosynthesis epimerase CapN [Staphylococcus]	100	99.7	2.68e-211
BAAHSR010000002.1_30|28670|29932|1|ID=1_30;partial=00;start_type=ATG;rbs_motif=GGAG/GAGG;rbs_spacer=5-10bp;gc_cont=0.344	WP_000779497.1 MULTISPECIES: type 8 capsular polysaccharide synthesis protein Cap8O [Staphylococcus]	100	99.8	5.20e-304
BAAHSR010000002.1_31|30009|31154|1|ID=1_31;partial=00;start_type=ATG;rbs_motif=GGAG/GAGG;rbs_spacer=5-10bp;gc_cont=0.362	WP_000723454.1 type 8 capsular polysaccharide synthesis protein Cap8P [Staphylococcus aureus]	100	99.7	2.25e-276
BAAHSR010000002.1_32|31219|31545|-1|ID=1_32;partial=00;start_type=ATG;rbs_motif=AGGAG;rbs_spacer=5-10bp;gc_cont=0.309	WP_000480603.1 MULTISPECIES: staphylobilin-forming heme oxygenase IsdI [Staphylococcus]	100	99.1	4.22e-71
BAAHSR010000002.1_33|31552|31935|-1|ID=1_33;partial=00;start_type=ATG;rbs_motif=GGAG/GAGG;rbs_spacer=5-10bp;gc_cont=0.320	WP_001237004.1 MULTISPECIES: YbaN family protein [Staphylococcus]	100	99.2	1.59e-75
BAAHSR010000002.1_34|32362|33849|1|ID=1_34;partial=00;start_type=ATG;rbs_motif=AGGAG;rbs_spacer=5-10bp;gc_cont=0.363	WP_000290400.1 MULTISPECIES: aldehyde dehydrogenase family protein [Staphylococcus]	100	99.8	0.0
BAAHSR010000002.1_35|33976|34086|1|ID=1_35;partial=00;start_type=ATG;rbs_motif=GGA/GAG/AGG;rbs_spacer=5-10bp;gc_cont=0.297	WP_000161255.1 hypothetical protein [Staphylococcus aureus]	76.5	91.9	1.21e-08
BAAHSR010000002.1_36|34390|35454|1|ID=1_36;partial=00;start_type=ATG;rbs_motif=None;rbs_spacer=None;gc_cont=0.317	WP_001013484.1 MULTISPECIES: cation diffusion facilitator family transporter [Staphylococcus]	100	89.9	1.38e-216
BAAHSR010000002.1_37|35516|35719|-1|ID=1_37;partial=00;start_type=ATG;rbs_motif=AGxAGG/AGGxGG;rbs_spacer=5-10bp;gc_cont=0.309	WP_000356963.1 MULTISPECIES: hypothetical protein [Staphylococcus]	100	98.5	8.29e-39
BAAHSR010000002.1_38|35898|36410|1|ID=1_38;partial=00;start_type=ATG;rbs_motif=AGGAG;rbs_spacer=5-10bp;gc_cont=0.341	WP_000171919.1 MULTISPECIES: DUF4242 domain-containing protein [Staphylococcus]	100	99.4	9.30e-116
BAAHSR010000002.1_39|36752|37492|1|ID=1_39;partial=00;start_type=ATG;rbs_motif=GGA/GAG/AGG;rbs_spacer=5-10bp;gc_cont=0.354	WP_000590850.1 ABC transporter ATP-binding protein [Staphylococcus aureus]	100	99.6	2.44e-178
BAAHSR010000002.1_40|37506|38480|1|ID=1_40;partial=00;start_type=ATG;rbs_motif=AGGAG;rbs_spacer=5-10bp;gc_cont=0.368	WP_000826685.1 MULTISPECIES: ABC transporter substrate-binding protein [Staphylococcus]	100	99.7	8.29e-241
BAAHSR010000002.1_41|38477|39238|1|ID=1_41;partial=00;start_type=ATG;rbs_motif=AGGAGG;rbs_spacer=5-10bp;gc_cont=0.353	WP_000197958.1 MULTISPECIES: ABC transporter permease [Staphylococcus]	100	99.6	7.26e-179
BAAHSR010000002.1_42|39251|39985|1|ID=1_42;partial=00;start_type=ATG;rbs_motif=AGGAG;rbs_spacer=5-10bp;gc_cont=0.359	WP_371093205.1 acyl-CoA dehydrogenase, partial [Staphylococcus aureus]	99.6	99.6	3.17e-172
BAAHSR010000002.1_43|40499|40858|1|ID=1_43;partial=00;start_type=GTG;rbs_motif=None;rbs_spacer=None;gc_cont=0.325	WP_001092004.1 MULTISPECIES: DUF2294 domain-containing protein [Staphylococcus]	100	99.2	5.50e-79
BAAHSR010000002.1_44|41031|42056|1|ID=1_44;partial=00;start_type=ATG;rbs_motif=AGGAG;rbs_spacer=5-10bp;gc_cont=0.350	WP_000706137.1 MULTISPECIES: NAD-dependent formate dehydrogenase [Staphylococcus]	100	99.7	4.31e-247
BAAHSR010000002.1_45|42442|43692|1|ID=1_45;partial=00;start_type=ATG;rbs_motif=None;rbs_spacer=None;gc_cont=0.324	WP_000826862.1 MULTISPECIES: MDR family MFS transporter [Staphylococcus]	100	99.8	1.15e-273
BAAHSR010000002.1_46|44121|51314|1|ID=1_46;partial=00;start_type=ATG;rbs_motif=GGA/GAG/AGG;rbs_spacer=5-10bp;gc_cont=0.352	WP_103263382.1 aureusimine non-ribosomal peptide synthetase AusA [Staphylococcus aureus]	100	99.7	0.0
BAAHSR010000002.1_47|51327|51971|1|ID=1_47;partial=00;start_type=ATG;rbs_motif=GGA/GAG/AGG;rbs_spacer=5-10bp;gc_cont=0.336	WP_000215724.1 MULTISPECIES: aureusimine biosynthesis 4'-phosphopantetheinyl transferase AusB [Staphylococcus]	100	99.5	1.88e-157
BAAHSR010000002.1_48|52299|52778|-1|ID=1_48;partial=00;start_type=ATG;rbs_motif=None;rbs_spacer=None;gc_cont=0.365	WP_001802886.1 MULTISPECIES: YagU family protein [Staphylococcus]	100	99.4	3.07e-111
BAAHSR010000002.1_49|53048|53812|-1|ID=1_49;partial=00;start_type=ATG;rbs_motif=AGxAGG/AGGxGG;rbs_spacer=5-10bp;gc_cont=0.346	WP_000668894.1 MULTISPECIES: acetylglutamate kinase [Staphylococcus]	100	99.6	2.85e-181
BAAHSR010000002.1_50|53828|55069|-1|ID=1_50;partial=00;start_type=ATG;rbs_motif=GGA/GAG/AGG;rbs_spacer=5-10bp;gc_cont=0.380	WP_000682611.1 MULTISPECIES: bifunctional glutamate N-acetyltransferase/amino-acid acetyltransferase ArgJ [Staphylococcus]	100	99.8	2.08e-295
BAAHSR010000002.1_51|55081|56115|-1|ID=1_51;partial=00;start_type=ATG;rbs_motif=AGGAG;rbs_spacer=5-10bp;gc_cont=0.355	WP_000598483.1 MULTISPECIES: N-acetyl-gamma-glutamyl-phosphate reductase [Staphylococcus]	100	99.4	1.91e-249
BAAHSR010000002.1_52|56151|57362|-1|ID=1_52;partial=00;start_type=ATG;rbs_motif=None;rbs_spacer=None;gc_cont=0.378	WP_001084436.1 MULTISPECIES: ornithine--oxo-acid transaminase [Staphylococcus]	100	97.5	8.12e-288
BAAHSR010000002.1_53|57588|58943|-1|ID=1_53;partial=00;start_type=ATG;rbs_motif=AGGAG(G)/GGAGG;rbs_spacer=13-15bp;gc_cont=0.330	WP_000728173.1 MULTISPECIES: branched-chain amino acid transport system II carrier protein BrnQ1 [Staphylococcus]	100	99.8	4.51e-307
BAAHSR010000002.1_54|59220|59777|-1|ID=1_54;partial=00;start_type=ATG;rbs_motif=AGGA/GGAG/GAGG;rbs_spacer=11-12bp;gc_cont=0.351	WP_000606890.1 MULTISPECIES: isochorismatase family protein [Staphylococcus]	100	99.5	2.83e-131
BAAHSR010000002.1_55|59844|61484|-1|ID=1_55;partial=00;start_type=ATG;rbs_motif=AGxAGG/AGGxGG;rbs_spacer=5-10bp;gc_cont=0.365	WP_000813555.1 MULTISPECIES: alpha-keto acid decarboxylase family protein [Staphylococcus]	100	99.8	0.0
BAAHSR010000002.1_56|61758|63803|-1|ID=1_56;partial=00;start_type=GTG;rbs_motif=GGAG/GAGG;rbs_spacer=5-10bp;gc_cont=0.378	WP_001227724.1 MULTISPECIES: glucose-specific PTS transporter subunit IIBC [Staphylococcus]	100	99.9	0.0
BAAHSR010000002.1_57|64404|65444|1|ID=1_57;partial=00;start_type=GTG;rbs_motif=GGA/GAG/AGG;rbs_spacer=5-10bp;gc_cont=0.353	WP_001802887.1 6-phospho-N-acetylmuramidase [Staphylococcus aureus]	100	99.7	9.17e-256
BAAHSR010000002.1_58|65444|66340|1|ID=1_58;partial=00;start_type=ATG;rbs_motif=AGGA/GGAG/GAGG;rbs_spacer=11-12bp;gc_cont=0.381	WP_000432017.1 MULTISPECIES: N-acetylmuramic acid 6-phosphate etherase [Staphylococcus]	100	99.7	7.03e-204
BAAHSR010000002.1_59|66352|67806|1|ID=1_59;partial=00;start_type=ATG;rbs_motif=AGGAG;rbs_spacer=5-10bp;gc_cont=0.381	WP_000159750.1 MULTISPECIES: PTS transporter subunit EIIC [Staphylococcus]	100	99.8	0.0
BAAHSR010000002.1_60|67806|68684|1|ID=1_60;partial=00;start_type=ATG;rbs_motif=None;rbs_spacer=None;gc_cont=0.344	WP_000181827.1 MurR/RpiR family transcriptional regulator [Staphylococcus aureus]	92.4	99.3	6.81e-185
BAAHSR010000002.1_61|69372|72161|1|ID=1_61;partial=00;start_type=ATG;rbs_motif=GGA/GAG/AGG;rbs_spacer=5-10bp;gc_cont=0.332	WP_000331347.1 MULTISPECIES: type I restriction endonuclease subunit R [Staphylococcus]	100	99.9	0.0
BAAHSR010000002.1_62|72366|73208|1|ID=1_62;partial=00;start_type=ATG;rbs_motif=AGGAG;rbs_spacer=5-10bp;gc_cont=0.282	WP_000370334.1 MULTISPECIES: sce7726 family protein [Staphylococcus]	100	99.6	4.23e-196
BAAHSR010000002.1_63|73210|74133|1|ID=1_63;partial=00;start_type=ATG;rbs_motif=AGGAG;rbs_spacer=5-10bp;gc_cont=0.298	WP_000291761.1 MULTISPECIES: sce7725 family protein [Staphylococcus]	100	99.7	5.29e-224
BAAHSR010000002.1_64|74120|75232|1|ID=1_64;partial=00;start_type=ATG;rbs_motif=GGAG/GAGG;rbs_spacer=5-10bp;gc_cont=0.274	WP_000686457.1 MULTISPECIES: RES domain-containing protein [Staphylococcus]	100	99.7	1.89e-267
BAAHSR010000002.1_65|75497|77089|-1|ID=1_65;partial=00;start_type=ATG;rbs_motif=GGAG/GAGG;rbs_spacer=5-10bp;gc_cont=0.357	WP_000067349.1 MULTISPECIES: ABC transporter ATP-binding protein [Staphylococcus]	100	99.8	0.0
BAAHSR010000002.1_66|77091|78524|1|ID=1_66;partial=00;start_type=ATG;rbs_motif=None;rbs_spacer=None;gc_cont=0.328	WP_103263383.1 ABC transporter permease [Staphylococcus aureus]	100	99.8	3.54e-314
BAAHSR010000002.1_67|78530|79693|1|ID=1_67;partial=00;start_type=ATG;rbs_motif=AGGA;rbs_spacer=5-10bp;gc_cont=0.346	WP_000057899.1 MULTISPECIES: ABC transporter permease [Staphylococcus]	100	99.7	2.60e-253
BAAHSR010000002.1_68|79710|81485|1|ID=1_68;partial=00;start_type=GTG;rbs_motif=GGA/GAG/AGG;rbs_spacer=5-10bp;gc_cont=0.333	WP_000720804.1 MULTISPECIES: ABC transporter substrate-binding protein [Staphylococcus]	100	99.8	0.0
BAAHSR010000002.1_69|81523|83529|1|ID=1_69;partial=00;start_type=ATG;rbs_motif=AGGAG;rbs_spacer=5-10bp;gc_cont=0.376	WP_000236397.1 gamma-glutamyltransferase [Staphylococcus aureus]	100	99.9	0.0
BAAHSR010000002.1_70|83827|84630|-1|ID=1_70;partial=00;start_type=ATG;rbs_motif=None;rbs_spacer=None;gc_cont=0.297	WP_000643615.1 tandem-type lipoprotein [Staphylococcus aureus]	100	95.9	1.80e-179
BAAHSR010000002.1_71|84790|85416|-1|ID=1_71;partial=00;start_type=ATG;rbs_motif=AGGAG;rbs_spacer=5-10bp;gc_cont=0.322	WP_001151451.1 MULTISPECIES: FMN-dependent NADH-azoreductase [Staphylococcus]	100	99.5	1.17e-148
BAAHSR010000002.1_72|85625|86203|1|ID=1_72;partial=00;start_type=ATG;rbs_motif=GGA/GAG/AGG;rbs_spacer=5-10bp;gc_cont=0.361	WP_000166917.1 MULTISPECIES: M23 family metallopeptidase [Staphylococcus]	100	99.5	2.14e-143
BAAHSR010000002.1_73|86586|87683|1|ID=1_73;partial=00;start_type=ATG;rbs_motif=GGAG/GAGG;rbs_spacer=5-10bp;gc_cont=0.351	WP_000818914.1 MULTISPECIES: ABC transporter ATP-binding protein [Staphylococcus]	100	99.7	7.94e-262
BAAHSR010000002.1_74|87696|88967|1|ID=1_74;partial=00;start_type=ATG;rbs_motif=GGAG/GAGG;rbs_spacer=5-10bp;gc_cont=0.340	WP_000034961.1 MULTISPECIES: maltodextrin ABC transporter substrate-binding protein [Staphylococcus]	100	99.8	1.29e-310
BAAHSR010000002.1_75|88970|90238|1|ID=1_75;partial=00;start_type=ATG;rbs_motif=AGGAG;rbs_spacer=5-10bp;gc_cont=0.355	WP_086098788.1 sugar ABC transporter permease [Staphylococcus aureus]	98.8	99.8	5.35e-298
BAAHSR010000002.1_76|90240|91079|1|ID=1_76;partial=00;start_type=ATG;rbs_motif=GGAG/GAGG;rbs_spacer=5-10bp;gc_cont=0.339	WP_000162661.1 MULTISPECIES: sugar ABC transporter permease [Staphylococcus]	100	99.6	1.91e-187
BAAHSR010000002.1_77|91150|92229|1|ID=1_77;partial=00;start_type=ATG;rbs_motif=AGGAG;rbs_spacer=5-10bp;gc_cont=0.389	WP_000153466.1 MULTISPECIES: Gfo/Idh/MocA family protein [Staphylococcus]	100	99.4	4.99e-264
BAAHSR010000002.1_78|92254|93294|1|ID=1_78;partial=00;start_type=ATG;rbs_motif=AGGAG;rbs_spacer=5-10bp;gc_cont=0.394	WP_000163809.1 MULTISPECIES: Gfo/Idh/MocA family protein [Staphylococcus]	100	99.7	1.52e-254
BAAHSR010000002.1_79|93349|94317|1|ID=1_79;partial=00;start_type=ATG;rbs_motif=AGGAG;rbs_spacer=5-10bp;gc_cont=0.359	WP_000690419.1 MULTISPECIES: sugar phosphate isomerase/epimerase family protein [Staphylococcus]	100	99.7	6.59e-246
BAAHSR010000002.1_80|94679|95173|-1|ID=1_80;partial=00;start_type=ATG;rbs_motif=GGAG/GAGG;rbs_spacer=5-10bp;gc_cont=0.267	WP_000603755.1 MULTISPECIES: isoprenylcysteine carboxyl methyltransferase family protein [Staphylococcus]	100	99.4	8.00e-105
BAAHSR010000002.1_81|95388|96785|1|ID=1_81;partial=00;start_type=ATG;rbs_motif=None;rbs_spacer=None;gc_cont=0.363	WP_001008722.1 MULTISPECIES: hexose-6-phosphate:phosphate antiporter [Staphylococcus]	100	98.5	0.0
BAAHSR010000002.1_82|97144|97902|-1|ID=1_82;partial=00;start_type=ATG;rbs_motif=GGA/GAG/AGG;rbs_spacer=5-10bp;gc_cont=0.328	WP_000477521.1 MULTISPECIES: response regulator transcription factor [Staphylococcus]	100	99.6	7.30e-183
BAAHSR010000002.1_83|97895|99451|-1|ID=1_83;partial=00;start_type=ATG;rbs_motif=GGAG/GAGG;rbs_spacer=5-10bp;gc_cont=0.328	WP_000127982.1 MULTISPECIES: sensor histidine kinase [Staphylococcus]	100	99.8	0.0
BAAHSR010000002.1_84|99448|100416|-1|ID=1_84;partial=00;start_type=ATG;rbs_motif=None;rbs_spacer=None;gc_cont=0.343	WP_000837105.1 MULTISPECIES: ABC transporter substrate-binding protein [Staphylococcus]	100	99.7	1.93e-229
BAAHSR010000002.1_85|101004|103253|1|ID=1_85;partial=00;start_type=ATG;rbs_motif=GGAG/GAGG;rbs_spacer=5-10bp;gc_cont=0.367	WP_000894660.1 MULTISPECIES: formate C-acetyltransferase [Staphylococcus]	100	99.9	0.0
BAAHSR010000002.1_86|103276|104031|1|ID=1_86;partial=00;start_type=ATG;rbs_motif=GGA/GAG/AGG;rbs_spacer=5-10bp;gc_cont=0.361	WP_000911657.1 MULTISPECIES: pyruvate formate-lyase-activating protein [Staphylococcus]	100	99.6	5.37e-189
BAAHSR010000002.1_87|104367|106130|1|ID=1_87;partial=00;start_type=ATG;rbs_motif=GGAG/GAGG;rbs_spacer=5-10bp;gc_cont=0.310	WP_000822608.1 MULTISPECIES: glycerophosphoryl diester phosphodiesterase membrane domain-containing protein [Staphylococcus]	100	99.8	0.0
BAAHSR010000002.1_88|106294|106638|-1|ID=1_88;partial=00;start_type=ATG;rbs_motif=AGGAG;rbs_spacer=5-10bp;gc_cont=0.325	WP_000211597.1 MULTISPECIES: complement inhibitor SCIN family protein [Staphylococcus]	100	99.1	1.61e-71
BAAHSR010000002.1_89|106828|108657|1|ID=1_89;partial=00;start_type=ATG;rbs_motif=AGGA/GGAG/GAGG;rbs_spacer=11-12bp;gc_cont=0.340	WP_398572628.1 staphylocoagulase, partial [Staphylococcus aureus]	100	84.9	0.0
BAAHSR010000002.1_90|109260|110444|-1|ID=1_90;partial=00;start_type=ATG;rbs_motif=GGAG/GAGG;rbs_spacer=5-10bp;gc_cont=0.434	WP_001154618.1 MULTISPECIES: thiolase family protein [Staphylococcus]	100	99.7	3.75e-277
BAAHSR010000002.1_91|110474|112735|-1|ID=1_91;partial=00;start_type=ATG;rbs_motif=GGAG/GAGG;rbs_spacer=5-10bp;gc_cont=0.374	WP_000154514.1 MULTISPECIES: 3-hydroxyacyl-CoA dehydrogenase/crotonase FadB [Staphylococcus]	100	99.9	0.0
BAAHSR010000002.1_92|112921|114132|-1|ID=1_92;partial=00;start_type=ATG;rbs_motif=AGGAG;rbs_spacer=5-10bp;gc_cont=0.394	WP_000142189.1 MULTISPECIES: acyl-CoA dehydrogenase FadE [Staphylococcus]	100	99.8	5.28e-293
BAAHSR010000002.1_93|114244|115749|-1|ID=1_93;partial=00;start_type=ATG;rbs_motif=GGA/GAG/AGG;rbs_spacer=5-10bp;gc_cont=0.373	WP_001008401.1 MULTISPECIES: long-chain-fatty-acid--CoA ligase FadD [Staphylococcus]	100	99.8	0.0
BAAHSR010000002.1_94|115775|117352|-1|ID=1_94;partial=00;start_type=ATG;rbs_motif=None;rbs_spacer=None;gc_cont=0.369	WP_001789452.1 MULTISPECIES: fatty acid degradation protein FadX [Staphylococcus]	100	99.8	0.0
BAAHSR010000002.1_95|117706|118935|1|ID=1_95;partial=00;start_type=ATG;rbs_motif=GGA/GAG/AGG;rbs_spacer=5-10bp;gc_cont=0.342	WP_001789851.1 MULTISPECIES: PrsW family intramembrane metalloprotease [Staphylococcus]	100	92.7	1.92e-259
BAAHSR010000002.1_96|119249|120724|-1|ID=1_96;partial=00;start_type=ATG;rbs_motif=GGA/GAG/AGG;rbs_spacer=5-10bp;gc_cont=0.310	WP_000669653.1 MULTISPECIES: nickel ABC transporter substrate-binding protein [Staphylococcus]	100	99.8	0.0
BAAHSR010000002.1_97|120922|121278|-1|ID=1_97;partial=00;start_type=ATG;rbs_motif=AGGAG;rbs_spacer=5-10bp;gc_cont=0.353	WP_000215216.1 MULTISPECIES: DUF488 domain-containing protein [Staphylococcus]	100	99.2	8.82e-80
BAAHSR010000002.1_98|121435|121608|-1|ID=1_98;partial=00;start_type=ATG;rbs_motif=AGGA/GGAG/GAGG;rbs_spacer=11-12bp;gc_cont=0.259	WP_000773989.1 MULTISPECIES: hypothetical protein [Staphylococcus]	100	98.3	2.46e-29
BAAHSR010000002.1_99|121634|122779|-1|ID=1_99;partial=00;start_type=ATG;rbs_motif=AGGAG;rbs_spacer=5-10bp;gc_cont=0.349	WP_000954810.1 MULTISPECIES: globin domain-containing protein [Staphylococcus]	100	99.7	3.57e-273
BAAHSR010000002.1_100|123352|124305|1|ID=1_100;partial=00;start_type=ATG;rbs_motif=GGAG/GAGG;rbs_spacer=5-10bp;gc_cont=0.372	WP_248316345.1 L-lactate dehydrogenase [Staphylococcus aureus]	100	99.7	2.23e-221
BAAHSR010000002.1_101|124625|126154|-1|ID=1_101;partial=00;start_type=ATG;rbs_motif=AGGAG;rbs_spacer=5-10bp;gc_cont=0.393	WP_000838204.1 MULTISPECIES: PTS transporter subunit EIIC [Staphylococcus]	100	99.8	0.0
BAAHSR010000002.1_102|126516|127451|1|ID=1_102;partial=00;start_type=ATG;rbs_motif=GGA/GAG/AGG;rbs_spacer=5-10bp;gc_cont=0.396	WP_000823215.1 MULTISPECIES: nucleoside hydrolase [Staphylococcus]	100	99.7	2.07e-223
BAAHSR010000002.1_103|127790|129886|1|ID=1_103;partial=00;start_type=ATG;rbs_motif=AGGAG;rbs_spacer=5-10bp;gc_cont=0.331	WP_001012747.1 MULTISPECIES: BglG family transcription antiterminator [Staphylococcus]	100	99.9	0.0
BAAHSR010000002.1_104|129871|130338|1|ID=1_104;partial=00;start_type=ATG;rbs_motif=GGAG/GAGG;rbs_spacer=5-10bp;gc_cont=0.348	WP_000531476.1 MULTISPECIES: PTS sugar transporter subunit IIA [Staphylococcus]	100	99.4	2.64e-101
BAAHSR010000002.1_105|130361|130639|1|ID=1_105;partial=00;start_type=ATG;rbs_motif=GGAG/GAGG;rbs_spacer=5-10bp;gc_cont=0.305	WP_000815795.1 MULTISPECIES: PTS sugar transporter subunit IIB [Bacilli]	100	98.9	5.84e-57
BAAHSR010000002.1_106|130866|132125|1|ID=1_106;partial=00;start_type=ATG;rbs_motif=GGAG/GAGG;rbs_spacer=5-10bp;gc_cont=0.368	WP_103263386.1 PTS galactitol transporter subunit IIC [Staphylococcus aureus]	100	99.8	6.59e-286
BAAHSR010000002.1_107|132140|133198|1|ID=1_107;partial=00;start_type=GTG;rbs_motif=GGAG/GAGG;rbs_spacer=5-10bp;gc_cont=0.365	WP_000646207.1 zinc-binding dehydrogenase [Staphylococcus aureus]	99.7	99.4	6.25e-259
BAAHSR010000002.1_108|133200|133346|1|ID=1_108;partial=00;start_type=ATG;rbs_motif=AGGAG;rbs_spacer=5-10bp;gc_cont=0.299	WP_000230358.1 MULTISPECIES: hypothetical protein [Bacteria]	100	98.0	3.61e-25
BAAHSR010000002.1_109|133370|134413|1|ID=1_109;partial=00;start_type=GTG;rbs_motif=GGAG/GAGG;rbs_spacer=5-10bp;gc_cont=0.380	WP_000645604.1 MULTISPECIES: galactitol-1-phosphate 5-dehydrogenase [Staphylococcus]	100	99.7	1.41e-255
BAAHSR010000002.1_110|134941|135657|1|ID=1_110;partial=00;start_type=ATG;rbs_motif=GGAG/GAGG;rbs_spacer=5-10bp;gc_cont=0.329	WP_000638475.1 MULTISPECIES: 2-C-methyl-D-erythritol 4-phosphate cytidylyltransferase [Staphylococcus]	100	99.6	6.95e-165
BAAHSR010000002.1_111|135650|136675|1|ID=1_111;partial=00;start_type=ATG;rbs_motif=GGA/GAG/AGG;rbs_spacer=11-12bp;gc_cont=0.348	WP_000610189.1 MULTISPECIES: alcohol dehydrogenase catalytic domain-containing protein [Staphylococcus]	100	99.7	1.83e-248
BAAHSR010000002.1_112|136697|138391|1|ID=1_112;partial=00;start_type=ATG;rbs_motif=GGA/GAG/AGG;rbs_spacer=5-10bp;gc_cont=0.329	WP_000167985.1 MULTISPECIES: teichoic acid ribitol-phosphate polymerase TarK [Staphylococcus]	100	99.8	0.0
BAAHSR010000002.1_113|138819|139988|1|ID=1_113;partial=00;start_type=ATG;rbs_motif=GGAG/GAGG;rbs_spacer=5-10bp;gc_cont=0.334	WP_000594815.1 MULTISPECIES: teichoic acid glycerol-phosphate transferase TarF [Staphylococcus]	100	99.7	1.02e-292
BAAHSR010000002.1_114|140264|140980|1|ID=1_114;partial=00;start_type=ATG;rbs_motif=GGAG/GAGG;rbs_spacer=5-10bp;gc_cont=0.322	WP_000872486.1 MULTISPECIES: D-ribitol-5-phosphate cytidylyltransferase [Staphylococcus]	100	99.6	1.71e-165
BAAHSR010000002.1_115|140946|141998|1|ID=1_115;partial=00;start_type=ATG;rbs_motif=None;rbs_spacer=None;gc_cont=0.338	WP_000610203.1 MULTISPECIES: ribitol-5-phosphate dehydrogenase [Staphylococcus]	100	97.2	5.95e-245
BAAHSR010000002.1_116|142020|143708|1|ID=1_116;partial=00;start_type=TTG;rbs_motif=AGGA;rbs_spacer=5-10bp;gc_cont=0.319	WP_000240920.1 MULTISPECIES: teichoic acid ribitol-phosphate polymerase TarL [Staphylococcus]	100	99.8	0.0
BAAHSR010000002.1_117|143741|145465|1|ID=1_117;partial=00;start_type=ATG;rbs_motif=GGAG/GAGG;rbs_spacer=5-10bp;gc_cont=0.319	WP_000975357.1 MULTISPECIES: poly(ribitol-phosphate) beta-N-acetylglucosaminyltransferase [Staphylococcus]	100	99.8	0.0
