BAAHSV010000001.1_123|125463|126329|-1|ID=1_123;partial=00;start_type=ATG;rbs_motif=AGGAG;rbs_spacer=5-10bp;gc_cont=0.341	WP_000190138.1 MULTISPECIES: 2-oxoacid:ferredoxin oxidoreductase subunit beta [Staphylococcus]	100	99.7	6.82e-206
BAAHSV010000001.1_124|126330|128090|-1|ID=1_124;partial=00;start_type=ATG;rbs_motif=AGGAG;rbs_spacer=5-10bp;gc_cont=0.352	WP_000804328.1 MULTISPECIES: 2-oxoacid:acceptor oxidoreductase subunit alpha [Staphylococcus]	100	99.8	0.0
BAAHSV010000001.1_125|128230|129027|-1|ID=1_125;partial=00;start_type=ATG;rbs_motif=AGGA;rbs_spacer=5-10bp;gc_cont=0.346	WP_001222105.1 MULTISPECIES: TIGR00282 family metallophosphoesterase [Staphylococcus]	100	99.6	4.24e-193
BAAHSV010000001.1_126|129201|129416|1|ID=1_126;partial=00;start_type=ATG;rbs_motif=AGGAG(G)/GGAGG;rbs_spacer=13-15bp;gc_cont=0.273	WP_000026308.1 MULTISPECIES: hypothetical protein [Staphylococcus]	100	98.6	1.38e-41
BAAHSV010000001.1_127|129713|131272|-1|ID=1_127;partial=00;start_type=GTG;rbs_motif=AGGAG;rbs_spacer=5-10bp;gc_cont=0.359	WP_001050909.1 ribonuclease Y [Staphylococcus aureus]	100	99.8	7.53e-299
BAAHSV010000001.1_128|131626|132669|-1|ID=1_128;partial=00;start_type=TTG;rbs_motif=AGGAG;rbs_spacer=5-10bp;gc_cont=0.371	WP_000368166.1 MULTISPECIES: recombinase RecA [Staphylococcus]	100	99.7	7.07e-240
BAAHSV010000001.1_129|132834|133985|-1|ID=1_129;partial=00;start_type=ATG;rbs_motif=GGA/GAG/AGG;rbs_spacer=5-10bp;gc_cont=0.307	WP_000020361.1 MULTISPECIES: CinA family nicotinamide mononucleotide deamidase-related protein [Staphylococcus]	100	99.7	1.20e-272
BAAHSV010000001.1_130|134212|134790|-1|ID=1_130;partial=00;start_type=ATG;rbs_motif=GGAG/GAGG;rbs_spacer=5-10bp;gc_cont=0.307	WP_001025093.1 MULTISPECIES: CDP-diacylglycerol--glycerol-3-phosphate 3-phosphatidyltransferase [Staphylococcus]	100	99.5	3.36e-122
BAAHSV010000001.1_131|134824|135216|-1|ID=1_131;partial=00;start_type=TTG;rbs_motif=AGGAG;rbs_spacer=5-10bp;gc_cont=0.305	WP_000859443.1 MULTISPECIES: helix-turn-helix domain-containing protein [Staphylococcus]	100	99.2	1.84e-80
BAAHSV010000001.1_132|135235|136062|-1|ID=1_132;partial=00;start_type=ATG;rbs_motif=GGAG/GAGG;rbs_spacer=5-10bp;gc_cont=0.335	WP_000214890.1 MULTISPECIES: YmfK family protein [Staphylococcus]	100	99.6	1.12e-193
BAAHSV010000001.1_133|136167|136871|-1|ID=1_133;partial=00;start_type=ATG;rbs_motif=AGGA/GGAG/GAGG;rbs_spacer=11-12bp;gc_cont=0.340	WP_000646227.1 MULTISPECIES: elongation factor P 5-aminopentanone reductase [Staphylococcus]	100	99.6	6.97e-163
BAAHSV010000001.1_134|136871|138157|-1|ID=1_134;partial=00;start_type=ATG;rbs_motif=AGGAG;rbs_spacer=5-10bp;gc_cont=0.312	WP_000664764.1 MULTISPECIES: EF-P 5-aminopentanol modification-associated protein YfmH [Staphylococcus]	100	99.8	4.51e-309
BAAHSV010000001.1_135|138157|139422|-1|ID=1_135;partial=00;start_type=TTG;rbs_motif=AGGAG;rbs_spacer=5-10bp;gc_cont=0.297	WP_000089941.1 MULTISPECIES: EF-P 5-aminopentanol modification-associated protein YfmF [Staphylococcus]	100	99.8	8.94e-301
BAAHSV010000001.1_136|139453|140166|-1|ID=1_136;partial=00;start_type=ATG;rbs_motif=GGAG/GAGG;rbs_spacer=5-10bp;gc_cont=0.314	WP_001293307.1 MULTISPECIES: GntR family transcriptional regulator [Staphylococcus]	100	99.6	1.65e-167
BAAHSV010000001.1_137|140171|142540|-1|ID=1_137;partial=00;start_type=TTG;rbs_motif=AGGAG;rbs_spacer=5-10bp;gc_cont=0.336	WP_000035767.1 MULTISPECIES: FtsK/SpoIIIE family DNA translocase [Staphylococcus]	100	99.9	0.0
BAAHSV010000001.1_138|142796|144520|-1|ID=1_138;partial=00;start_type=ATG;rbs_motif=None;rbs_spacer=None;gc_cont=0.334	WP_000052590.1 MULTISPECIES: ribonuclease J2 [Staphylococcus]	99.8	96.9	0.0
BAAHSV010000001.1_139|144705|146801|-1|ID=1_139;partial=00;start_type=ATG;rbs_motif=AGGAG;rbs_spacer=5-10bp;gc_cont=0.369	WP_000076690.1 MULTISPECIES: polyribonucleotide nucleotidyltransferase [Staphylococcus]	100	99.9	0.0
BAAHSV010000001.1_140|147171|147440|-1|ID=1_140;partial=00;start_type=ATG;rbs_motif=AGGAG;rbs_spacer=5-10bp;gc_cont=0.356	WP_001018328.1 MULTISPECIES: 30S ribosomal protein S15 [Bacteria]	100	98.9	7.52e-54
BAAHSV010000001.1_141|147555|148526|-1|ID=1_141;partial=00;start_type=ATG;rbs_motif=AGGAG;rbs_spacer=5-10bp;gc_cont=0.330	WP_000864185.1 MULTISPECIES: riboflavin biosynthesis protein RibF [Staphylococcus]	100	99.7	3.92e-234
BAAHSV010000001.1_142|148541|149458|-1|ID=1_142;partial=00;start_type=ATG;rbs_motif=GGA/GAG/AGG;rbs_spacer=5-10bp;gc_cont=0.324	WP_000282305.1 MULTISPECIES: tRNA pseudouridine(55) synthase TruB [Staphylococcus]	100	99.7	2.21e-215
BAAHSV010000001.1_143|149627|150019|-1|ID=1_143;partial=00;start_type=ATG;rbs_motif=None;rbs_spacer=None;gc_cont=0.300	WP_000097322.1 MULTISPECIES: 30S ribosome-binding factor RbfA [Staphylococcus]	100	88.5	4.90e-73
BAAHSV010000001.1_144|150363|152480|-1|ID=1_144;partial=00;start_type=ATG;rbs_motif=AGGAG;rbs_spacer=5-10bp;gc_cont=0.341	WP_000043634.1 MULTISPECIES: translation initiation factor IF-2 [Staphylococcus]	100	99.9	0.0
BAAHSV010000001.1_145|152485|152802|-1|ID=1_145;partial=00;start_type=ATG;rbs_motif=GGA/GAG/AGG;rbs_spacer=5-10bp;gc_cont=0.321	WP_000020853.1 MULTISPECIES: YlxQ family RNA-binding protein [Staphylococcus]	100	99.1	2.30e-69
BAAHSV010000001.1_146|152799|153083|-1|ID=1_146;partial=00;start_type=ATG;rbs_motif=GGAG/GAGG;rbs_spacer=5-10bp;gc_cont=0.309	WP_000727423.1 MULTISPECIES: RNase P modulator RnpM [Staphylococcus]	100	98.9	5.55e-56
BAAHSV010000001.1_147|153104|154279|-1|ID=1_147;partial=00;start_type=GTG;rbs_motif=AGGAG;rbs_spacer=5-10bp;gc_cont=0.356	WP_000097462.1 MULTISPECIES: transcription termination factor NusA [Staphylococcus]	99.7	99.7	2.79e-266
BAAHSV010000001.1_148|154300|154767|-1|ID=1_148;partial=00;start_type=ATG;rbs_motif=GGAG/GAGG;rbs_spacer=5-10bp;gc_cont=0.327	WP_000036631.1 MULTISPECIES: ribosome maturation factor RimP [Staphylococcus]	100	99.4	3.21e-102
BAAHSV010000001.1_149|155057|159367|-1|ID=1_149;partial=00;start_type=ATG;rbs_motif=None;rbs_spacer=None;gc_cont=0.347	WP_001820550.1 MULTISPECIES: DNA polymerase III subunit alpha [Staphylococcus]	100	99.9	0.0
BAAHSV010000001.1_150|159631|161334|-1|ID=1_150;partial=00;start_type=ATG;rbs_motif=AGGAGG;rbs_spacer=5-10bp;gc_cont=0.348	WP_000814103.1 MULTISPECIES: proline--tRNA ligase [Staphylococcus]	100	99.8	0.0
BAAHSV010000001.1_151|161354|162640|-1|ID=1_151;partial=00;start_type=GTG;rbs_motif=GGAG/GAGG;rbs_spacer=5-10bp;gc_cont=0.333	WP_000121116.1 MULTISPECIES: RIP metalloprotease RseP [Staphylococcus]	100	99.8	1.88e-301
BAAHSV010000001.1_152|162902|163684|-1|ID=1_152;partial=00;start_type=ATG;rbs_motif=AGGAG;rbs_spacer=5-10bp;gc_cont=0.322	WP_000868413.1 MULTISPECIES: phosphatidate cytidylyltransferase [Staphylococcus]	100	99.6	1.90e-173
BAAHSV010000001.1_153|163691|164494|-1|ID=1_153;partial=00;start_type=ATG;rbs_motif=None;rbs_spacer=None;gc_cont=0.308	WP_000473705.1 MULTISPECIES: isoprenyl transferase [Staphylococcus]	100	95.5	1.62e-184
BAAHSV010000001.1_154|164834|165388|-1|ID=1_154;partial=00;start_type=ATG;rbs_motif=GGAG/GAGG;rbs_spacer=5-10bp;gc_cont=0.346	WP_001280006.1 MULTISPECIES: ribosome recycling factor [Staphylococcus]	100	99.5	1.89e-115
BAAHSV010000001.1_155|165407|166129|-1|ID=1_155;partial=00;start_type=ATG;rbs_motif=GGAG/GAGG;rbs_spacer=5-10bp;gc_cont=0.362	WP_000057330.1 MULTISPECIES: UMP kinase [Staphylococcus]	100	99.6	1.15e-164
BAAHSV010000001.1_156|166266|167147|-1|ID=1_156;partial=00;start_type=ATG;rbs_motif=GGAG/GAGG;rbs_spacer=5-10bp;gc_cont=0.368	WP_000201387.1 MULTISPECIES: translation elongation factor Ts [Staphylococcus]	100	99.7	1.03e-198
BAAHSV010000001.1_157|167329|168096|-1|ID=1_157;partial=00;start_type=ATG;rbs_motif=AGGAG;rbs_spacer=5-10bp;gc_cont=0.352	WP_000268484.1 MULTISPECIES: 30S ribosomal protein S2 [Bacilli]	100	99.6	2.14e-172
BAAHSV010000001.1_158|168438|169211|-1|ID=1_158;partial=00;start_type=ATG;rbs_motif=AGGAG;rbs_spacer=5-10bp;gc_cont=0.320	WP_000055337.1 MULTISPECIES: GTP-sensing pleiotropic transcriptional regulator CodY [Staphylococcus]	100	99.6	3.40e-170
BAAHSV010000001.1_159|169236|170639|-1|ID=1_159;partial=00;start_type=ATG;rbs_motif=GGAG/GAGG;rbs_spacer=5-10bp;gc_cont=0.350	WP_000379054.1 MULTISPECIES: ATP-dependent protease ATPase subunit HslU [Staphylococcus]	100	99.8	0.0
BAAHSV010000001.1_160|170705|171250|-1|ID=1_160;partial=00;start_type=ATG;rbs_motif=AGGAG;rbs_spacer=5-10bp;gc_cont=0.397	WP_000072681.1 MULTISPECIES: ATP-dependent protease subunit HslV [Staphylococcus]	100	99.5	6.66e-119
BAAHSV010000001.1_161|171247|172143|-1|ID=1_161;partial=00;start_type=TTG;rbs_motif=GGAG/GAGG;rbs_spacer=5-10bp;gc_cont=0.324	WP_001015597.1 MULTISPECIES: tyrosine recombinase XerC [Staphylococcus]	100	99.7	6.11e-214
BAAHSV010000001.1_162|172560|173867|-1|ID=1_162;partial=00;start_type=ATG;rbs_motif=AGGAG;rbs_spacer=5-10bp;gc_cont=0.358	WP_085061234.1 methylenetetrahydrofolate--tRNA-(uracil(54)-C(5))-methyltransferase (FADH(2)-oxidizing) TrmFO [Staphylococcus aureus]	100	99.8	1.38e-315
BAAHSV010000001.1_163|174023|176098|-1|ID=1_163;partial=00;start_type=ATG;rbs_motif=GGAG/GAGG;rbs_spacer=5-10bp;gc_cont=0.351	WP_001548566.1 MULTISPECIES: type I DNA topoisomerase [Staphylococcus]	100	99.9	0.0
BAAHSV010000001.1_164|176272|177144|-1|ID=1_164;partial=00;start_type=TTG;rbs_motif=AGGAG;rbs_spacer=5-10bp;gc_cont=0.301	WP_000593192.1 MULTISPECIES: DNA-processing protein DprA [Staphylococcus]	100	99.7	4.11e-208
BAAHSV010000001.1_165|177317|178561|-1|ID=1_165;partial=00;start_type=ATG;rbs_motif=AGGA;rbs_spacer=5-10bp;gc_cont=0.258	WP_000672867.1 MULTISPECIES: FemA/FemB family glycyltransferase FmhC [Staphylococcus]	100	99.8	2.99e-300
BAAHSV010000001.1_166|178589|179707|-1|ID=1_166;partial=00;start_type=ATG;rbs_motif=AGGAG;rbs_spacer=5-10bp;gc_cont=0.290	WP_001041662.1 MULTISPECIES: LysM peptidoglycan-binding domain-containing protein [Staphylococcus]	100	99.7	1.08e-258
BAAHSV010000001.1_167|179934|180842|-1|ID=1_167;partial=00;start_type=ATG;rbs_motif=GGAG/GAGG;rbs_spacer=5-10bp;gc_cont=0.383	WP_000110253.1 MULTISPECIES: succinate--CoA ligase subunit alpha [Staphylococcus]	100	99.7	3.39e-213
BAAHSV010000001.1_168|180864|182030|-1|ID=1_168;partial=00;start_type=ATG;rbs_motif=AGGAG;rbs_spacer=5-10bp;gc_cont=0.356	WP_001020801.1 MULTISPECIES: ADP-forming succinate--CoA ligase subunit beta [Staphylococcus]	100	99.7	4.65e-268
BAAHSV010000001.1_169|182139|182906|-1|ID=1_169;partial=00;start_type=ATG;rbs_motif=GGAG/GAGG;rbs_spacer=5-10bp;gc_cont=0.350	WP_000176394.1 MULTISPECIES: ribonuclease HII [Staphylococcus]	100	99.6	2.33e-176
BAAHSV010000001.1_170|182890|183774|-1|ID=1_170;partial=00;start_type=ATG;rbs_motif=GGA/GAG/AGG;rbs_spacer=5-10bp;gc_cont=0.333	WP_000236722.1 MULTISPECIES: ribosome biogenesis GTPase YlqF [Staphylococcus]	100	99.7	4.81e-209
BAAHSV010000001.1_171|184175|186781|1|ID=1_171;partial=00;start_type=GTG;rbs_motif=GGAG/GAGG;rbs_spacer=5-10bp;gc_cont=0.300	WP_000915229.1 MULTISPECIES: lipoteichoic acid-specific glycosyltransferase YfhO [Staphylococcus]	100	99.9	0.0
BAAHSV010000001.1_172|187025|187375|-1|ID=1_172;partial=00;start_type=ATG;rbs_motif=AGGAG;rbs_spacer=5-10bp;gc_cont=0.387	WP_000181404.1 MULTISPECIES: 50S ribosomal protein L19 [Staphylococcus]	100	99.1	2.76e-73
BAAHSV010000001.1_173|187478|188215|-1|ID=1_173;partial=00;start_type=ATG;rbs_motif=AGGA/GGAG/GAGG;rbs_spacer=11-12bp;gc_cont=0.355	WP_000687328.1 MULTISPECIES: tRNA (guanosine(37)-N1)-methyltransferase TrmD [Staphylococcus]	100	99.6	2.02e-181
BAAHSV010000001.1_174|188215|188718|-1|ID=1_174;partial=00;start_type=ATG;rbs_motif=GGAG/GAGG;rbs_spacer=5-10bp;gc_cont=0.319	WP_001261987.1 MULTISPECIES: ribosome maturation factor RimM [Staphylococcus]	100	99.4	1.05e-115
BAAHSV010000001.1_175|188906|189181|-1|ID=1_175;partial=00;start_type=ATG;rbs_motif=AGGAG;rbs_spacer=5-10bp;gc_cont=0.359	WP_000268754.1 MULTISPECIES: 30S ribosomal protein S16 [Staphylococcus]	100	98.9	9.37e-58
BAAHSV010000001.1_176|189616|190983|-1|ID=1_176;partial=00;start_type=ATG;rbs_motif=GGAG/GAGG;rbs_spacer=5-10bp;gc_cont=0.349	WP_000863479.1 MULTISPECIES: signal recognition particle protein [Staphylococcus]	100	99.8	1.72e-313
BAAHSV010000001.1_177|191009|191341|-1|ID=1_177;partial=00;start_type=ATG;rbs_motif=AGGA;rbs_spacer=5-10bp;gc_cont=0.273	WP_000531318.1 putative DNA-binding protein [Staphylococcus aureus]	96.4	99.1	2.15e-56
BAAHSV010000001.1_178|191328|192578|-1|ID=1_178;partial=00;start_type=ATG;rbs_motif=AGGAG;rbs_spacer=5-10bp;gc_cont=0.348	WP_000007683.1 MULTISPECIES: signal recognition particle-docking protein FtsY [Staphylococcus]	100	99.8	2.70e-288
BAAHSV010000001.1_179|192578|196144|-1|ID=1_179;partial=00;start_type=ATG;rbs_motif=AGGAG;rbs_spacer=5-10bp;gc_cont=0.322	WP_148237071.1 chromosome segregation protein SMC [Staphylococcus aureus]	100	99.9	0.0
BAAHSV010000001.1_180|196291|197022|-1|ID=1_180;partial=00;start_type=ATG;rbs_motif=AGGAG;rbs_spacer=5-10bp;gc_cont=0.342	WP_000043237.1 MULTISPECIES: ribonuclease III [Staphylococcus]	100	99.6	3.32e-170
BAAHSV010000001.1_181|197138|197371|-1|ID=1_181;partial=00;start_type=GTG;rbs_motif=AGGAG;rbs_spacer=5-10bp;gc_cont=0.346	WP_000426914.1 MULTISPECIES: acyl carrier protein [Bacilli]	100	98.7	5.35e-44
BAAHSV010000001.1_182|197614|198348|-1|ID=1_182;partial=00;start_type=ATG;rbs_motif=AGGA;rbs_spacer=5-10bp;gc_cont=0.366	WP_000167269.1 MULTISPECIES: 3-oxoacyl-[acyl-carrier-protein] reductase [Staphylococcus]	100	99.6	3.03e-162
BAAHSV010000001.1_183|198341|199267|-1|ID=1_183;partial=00;start_type=ATG;rbs_motif=GGA/GAG/AGG;rbs_spacer=5-10bp;gc_cont=0.337	WP_000047348.1 MULTISPECIES: ACP S-malonyltransferase [Staphylococcus]	100	99.7	2.05e-217
BAAHSV010000001.1_184|199260|200267|-1|ID=1_184;partial=00;start_type=ATG;rbs_motif=None;rbs_spacer=None;gc_cont=0.348	WP_000239744.1 MULTISPECIES: phosphate acyltransferase PlsX [Staphylococcus]	100	97.6	1.52e-224
BAAHSV010000001.1_185|200251|200823|-1|ID=1_185;partial=00;start_type=ATG;rbs_motif=GGA/GAG/AGG;rbs_spacer=5-10bp;gc_cont=0.321	WP_001548538.1 MULTISPECIES: transcription factor FapR [Staphylococcus]	100	99.5	9.38e-128
BAAHSV010000001.1_186|201026|203086|-1|ID=1_186;partial=00;start_type=TTG;rbs_motif=GGA/GAG/AGG;rbs_spacer=5-10bp;gc_cont=0.335	WP_001151499.1 MULTISPECIES: ATP-dependent DNA helicase RecG [Staphylococcus]	100	99.9	0.0
BAAHSV010000001.1_187|203276|204922|-1|ID=1_187;partial=00;start_type=ATG;rbs_motif=AGGAGG;rbs_spacer=5-10bp;gc_cont=0.340	WP_000623903.1 MULTISPECIES: fatty acid kinase catalytic subunit FakA [Staphylococcus]	100	99.8	0.0
BAAHSV010000001.1_188|204937|205311|-1|ID=1_188;partial=00;start_type=ATG;rbs_motif=AGGAG;rbs_spacer=5-10bp;gc_cont=0.325	WP_000171418.1 MULTISPECIES: Asp23/Gls24 family envelope stress response protein [Staphylococcus]	100	99.2	1.13e-78
BAAHSV010000001.1_189|205754|205942|1|ID=1_189;partial=00;start_type=ATG;rbs_motif=AGGAG;rbs_spacer=5-10bp;gc_cont=0.376	WP_000517908.1 MULTISPECIES: 50S ribosomal protein L28 [Staphylococcus]	100	98.4	1.90e-35
BAAHSV010000001.1_190|206323|206964|-1|ID=1_190;partial=00;start_type=ATG;rbs_motif=GGA/GAG/AGG;rbs_spacer=5-10bp;gc_cont=0.329	WP_000547905.1 MULTISPECIES: thiamine diphosphokinase [Staphylococcus]	100	99.5	8.55e-149
BAAHSV010000001.1_191|206971|207615|-1|ID=1_191;partial=00;start_type=ATG;rbs_motif=GGA/GAG/AGG;rbs_spacer=11-12bp;gc_cont=0.330	WP_000164332.1 MULTISPECIES: ribulose-phosphate 3-epimerase [Staphylococcus]	100	99.5	1.17e-151
BAAHSV010000001.1_192|207616|208491|-1|ID=1_192;partial=00;start_type=TTG;rbs_motif=GGAG/GAGG;rbs_spacer=5-10bp;gc_cont=0.314	WP_000847933.1 MULTISPECIES: ribosome small subunit-dependent GTPase A [Staphylococcus]	100	99.7	1.19e-212
BAAHSV010000001.1_193|208719|210713|-1|ID=1_193;partial=00;start_type=ATG;rbs_motif=GGA/GAG/AGG;rbs_spacer=5-10bp;gc_cont=0.337	WP_000579564.1 MULTISPECIES: serine/threonine protein kinase Stk1 [Staphylococcus]	100	99.8	0.0
BAAHSV010000001.1_194|210710|211453|-1|ID=1_194;partial=00;start_type=ATG;rbs_motif=GGAG/GAGG;rbs_spacer=5-10bp;gc_cont=0.324	WP_065211496.1 protein-serine/threonine phosphatase Stp1 [Staphylococcus aureus]	94.7	99.6	2.06e-166
BAAHSV010000001.1_195|211460|212554|-1|ID=1_195;partial=00;start_type=ATG;rbs_motif=AGGA;rbs_spacer=5-10bp;gc_cont=0.339	WP_000626897.1 MULTISPECIES: 23S rRNA (adenine(2503)-C(2))-methyltransferase RlmN [Staphylococcus]	100	99.7	2.87e-259
BAAHSV010000001.1_196|212557|213864|-1|ID=1_196;partial=00;start_type=ATG;rbs_motif=AGxAGG/AGGxGG;rbs_spacer=11-12bp;gc_cont=0.329	WP_000572235.1 MULTISPECIES: 16S rRNA (cytosine(967)-C(5))-methyltransferase RsmB [Staphylococcus]	100	99.8	0.0
BAAHSV010000001.1_197|213861|214796|-1|ID=1_197;partial=00;start_type=ATG;rbs_motif=AGGA/GGAG/GAGG;rbs_spacer=11-12bp;gc_cont=0.350	WP_000161299.1 MULTISPECIES: methionyl-tRNA formyltransferase [Staphylococcus]	100	99.7	1.50e-216
BAAHSV010000001.1_198|214789|215277|-1|ID=1_198;partial=00;start_type=ATG;rbs_motif=AGGAG;rbs_spacer=5-10bp;gc_cont=0.333	WP_000985293.1 MULTISPECIES: peptide deformylase [Staphylococcus]	100	99.4	3.04e-108
BAAHSV010000001.1_199|215501|215779|1|ID=1_199;partial=00;start_type=ATG;rbs_motif=None;rbs_spacer=None;gc_cont=0.308	WP_001548522.1 TM2 domain-containing protein [Staphylococcus aureus]	100	98.9	2.47e-58
BAAHSV010000001.1_200|215942|216895|-1|ID=1_200;partial=00;start_type=ATG;rbs_motif=AGGAG;rbs_spacer=5-10bp;gc_cont=0.309	WP_407819481.1 hypothetical protein [Staphylococcus aureus]	98.1	99.7	1.91e-222
BAAHSV010000001.1_201|217401|219809|-1|ID=1_201;partial=00;start_type=ATG;rbs_motif=GGA/GAG/AGG;rbs_spacer=5-10bp;gc_cont=0.347	WP_000560841.1 MULTISPECIES: primosomal protein N' [Staphylococcus]	100	99.9	0.0
BAAHSV010000001.1_202|219809|221008|-1|ID=1_202;partial=00;start_type=ATG;rbs_motif=GGAG/GAGG;rbs_spacer=5-10bp;gc_cont=0.348	WP_000722165.1 MULTISPECIES: bifunctional phosphopantothenoylcysteine decarboxylase/phosphopantothenate--cysteine ligase CoaBC [Staphylococcus]	100	99.8	1.17e-278
BAAHSV010000001.1_203|221224|221442|-1|ID=1_203;partial=00;start_type=ATG;rbs_motif=GGAG/GAGG;rbs_spacer=5-10bp;gc_cont=0.324	WP_000933956.1 MULTISPECIES: DNA-directed RNA polymerase subunit omega [Staphylococcaceae]	100	98.6	3.76e-44
BAAHSV010000001.1_204|221442|222065|-1|ID=1_204;partial=00;start_type=ATG;rbs_motif=GGAG/GAGG;rbs_spacer=5-10bp;gc_cont=0.338	WP_000368227.1 MULTISPECIES: guanylate kinase [Staphylococcus]	100	99.5	3.22e-141
BAAHSV010000001.1_205|222340|224037|1|ID=1_205;partial=00;start_type=ATG;rbs_motif=GGA/GAG/AGG;rbs_spacer=5-10bp;gc_cont=0.318	WP_000312763.1 MULTISPECIES: Rqc2 family fibronectin-binding protein [Staphylococcus]	100	99.8	0.0
BAAHSV010000001.1_206|224300|224701|-1|ID=1_206;partial=00;start_type=ATG;rbs_motif=AGGAG;rbs_spacer=5-10bp;gc_cont=0.341	WP_000354184.1 MULTISPECIES: VOC family protein [Staphylococcus]	100	99.3	1.44e-92
BAAHSV010000001.1_207|225138|225350|-1|ID=1_207;partial=00;start_type=ATG;rbs_motif=AGGAGG;rbs_spacer=5-10bp;gc_cont=0.254	WP_000998556.1 MULTISPECIES: hypothetical protein [Staphylococcus]	100	98.6	1.83e-41
BAAHSV010000001.1_208|225380|225991|-1|ID=1_208;partial=00;start_type=ATG;rbs_motif=None;rbs_spacer=None;gc_cont=0.328	WP_001040245.1 MULTISPECIES: orotate phosphoribosyltransferase [Staphylococcus]	100	99.5	2.19e-137
BAAHSV010000001.1_209|225991|226686|-1|ID=1_209;partial=00;start_type=ATG;rbs_motif=GGAG/GAGG;rbs_spacer=5-10bp;gc_cont=0.338	WP_000654061.1 MULTISPECIES: orotidine-5'-phosphate decarboxylase [Staphylococcus]	100	99.1	7.27e-161
BAAHSV010000001.1_210|226793|229966|-1|ID=1_210;partial=00;start_type=ATG;rbs_motif=AGGAG;rbs_spacer=5-10bp;gc_cont=0.357	WP_001126264.1 MULTISPECIES: carbamoyl-phosphate synthase large subunit [Staphylococcus]	100	99.9	0.0
BAAHSV010000001.1_211|229959|231059|-1|ID=1_211;partial=00;start_type=ATG;rbs_motif=GGA/GAG/AGG;rbs_spacer=5-10bp;gc_cont=0.353	WP_001190913.1 MULTISPECIES: carbamoyl phosphate synthase small subunit [Staphylococcus]	100	99.7	4.14e-269
BAAHSV010000001.1_212|231061|232338|-1|ID=1_212;partial=00;start_type=ATG;rbs_motif=GGA/GAG/AGG;rbs_spacer=5-10bp;gc_cont=0.360	WP_000767028.1 MULTISPECIES: dihydroorotase [Staphylococcus]	100	99.5	2.20e-314
BAAHSV010000001.1_213|232353|233234|-1|ID=1_213;partial=00;start_type=ATG;rbs_motif=AGGAG;rbs_spacer=5-10bp;gc_cont=0.316	WP_001016166.1 MULTISPECIES: aspartate carbamoyltransferase catalytic subunit [Staphylococcus]	100	99.7	1.89e-210
BAAHSV010000001.1_214|233262|234569|-1|ID=1_214;partial=00;start_type=ATG;rbs_motif=AGGA;rbs_spacer=5-10bp;gc_cont=0.352	WP_311157312.1 uracil-xanthine permease family protein [Staphylococcus aureus]	100	99.8	1.45e-265
BAAHSV010000001.1_215|234787|235314|-1|ID=1_215;partial=00;start_type=ATG;rbs_motif=GGA/GAG/AGG;rbs_spacer=5-10bp;gc_cont=0.345	WP_000003870.1 MULTISPECIES: bifunctional pyr operon transcriptional regulator/uracil phosphoribosyltransferase PyrR [Staphylococcus]	100	99.4	2.74e-115
BAAHSV010000001.1_216|235713|236630|-1|ID=1_216;partial=00;start_type=ATG;rbs_motif=AGGAG;rbs_spacer=5-10bp;gc_cont=0.334	WP_000451295.1 RluA family pseudouridine synthase [Staphylococcus aureus]	100	99.7	1.58e-224
BAAHSV010000001.1_217|236630|237121|-1|ID=1_217;partial=00;start_type=ATG;rbs_motif=GGAG/GAGG;rbs_spacer=5-10bp;gc_cont=0.266	WP_000549207.1 MULTISPECIES: signal peptidase II [Staphylococcus]	100	99.4	2.13e-104
BAAHSV010000001.1_218|237690|237884|1|ID=1_218;partial=00;start_type=ATG;rbs_motif=GGA/GAG/AGG;rbs_spacer=5-10bp;gc_cont=0.303	WP_078152326.1 transposase, partial [Staphylococcus aureus]	100	98.5	3.54e-37
BAAHSV010000001.1_219|237945|238742|-1|ID=1_219;partial=00;start_type=ATG;rbs_motif=AGGAG;rbs_spacer=5-10bp;gc_cont=0.321	WP_103263399.1 VOC family protein [Staphylococcus aureus]	100	99.6	1.04e-193
BAAHSV010000001.1_220|239032|241785|-1|ID=1_220;partial=00;start_type=ATG;rbs_motif=AGGAG;rbs_spacer=5-10bp;gc_cont=0.351	WP_000384691.1 MULTISPECIES: isoleucine--tRNA ligase [Staphylococcus]	100	99.9	0.0
BAAHSV010000001.1_221|242006|242623|-1|ID=1_221;partial=00;start_type=ATG;rbs_motif=AGGAG;rbs_spacer=5-10bp;gc_cont=0.346	WP_001117064.1 MULTISPECIES: DivIVA domain-containing protein [Staphylococcus]	100	99.5	1.45e-127
BAAHSV010000001.1_222|242647|243453|-1|ID=1_222;partial=00;start_type=ATG;rbs_motif=GGA/GAG/AGG;rbs_spacer=5-10bp;gc_cont=0.307	WP_000232509.1 YlmH family RNA-binding protein [Staphylococcus aureus]	100	99.6	1.41e-188
BAAHSV010000001.1_223|243536|243826|-1|ID=1_223;partial=00;start_type=ATG;rbs_motif=AGGAG;rbs_spacer=5-10bp;gc_cont=0.271	WP_000354114.1 MULTISPECIES: YggT family protein [Staphylococcus]	100	99.0	3.86e-57
BAAHSV010000001.1_224|243838|244401|-1|ID=1_224;partial=00;start_type=GTG;rbs_motif=AGGAG;rbs_spacer=5-10bp;gc_cont=0.349	WP_000018608.1 MULTISPECIES: cell division protein SepF [Staphylococcus]	100	99.5	2.21e-120
BAAHSV010000001.1_225|244398|245072|-1|ID=1_225;partial=00;start_type=TTG;rbs_motif=AGGAG;rbs_spacer=5-10bp;gc_cont=0.332	WP_047425035.1 YggS family pyridoxal phosphate-dependent enzyme [Staphylococcus schweitzeri]	99.1	99.6	1.07e-152
BAAHSV010000001.1_226|245090|245881|-1|ID=1_226;partial=00;start_type=GTG;rbs_motif=None;rbs_spacer=None;gc_cont=0.318	WP_000999338.1 MULTISPECIES: peptidoglycan editing factor PgeF [Staphylococcus]	100	99.6	3.78e-195
BAAHSV010000001.1_227|246141|247313|-1|ID=1_227;partial=00;start_type=ATG;rbs_motif=AGGAG;rbs_spacer=5-10bp;gc_cont=0.384	WP_000888997.1 MULTISPECIES: cell division protein FtsZ [Staphylococcus]	100	99.7	1.78e-257
BAAHSV010000001.1_228|247346|248758|-1|ID=1_228;partial=00;start_type=ATG;rbs_motif=AGGAG;rbs_spacer=5-10bp;gc_cont=0.322	WP_001587610.1 cell division protein FtsA [Staphylococcus aureus]	98.3	99.8	0.0
BAAHSV010000001.1_229|248864|250183|-1|ID=1_229;partial=00;start_type=ATG;rbs_motif=GGA/GAG/AGG;rbs_spacer=5-10bp;gc_cont=0.308	WP_000342185.1 MULTISPECIES: cell division protein FtsQ/DivIB [Staphylococcus]	100	99.8	2.81e-265
BAAHSV010000001.1_230|250199|251548|-1|ID=1_230;partial=00;start_type=ATG;rbs_motif=GGAG/GAGG;rbs_spacer=5-10bp;gc_cont=0.327	WP_000935991.1 MULTISPECIES: UDP-N-acetylmuramoyl-L-alanine--D-glutamate ligase [Staphylococcus]	100	99.8	0.0
BAAHSV010000001.1_231|251550|252515|-1|ID=1_231;partial=00;start_type=ATG;rbs_motif=AGGAG;rbs_spacer=5-10bp;gc_cont=0.322	WP_000578458.1 MULTISPECIES: phospho-N-acetylmuramoyl-pentapeptide-transferase [Staphylococcus]	100	99.7	2.19e-214
BAAHSV010000001.1_232|252807|255041|-1|ID=1_232;partial=00;start_type=ATG;rbs_motif=GGA/GAG/AGG;rbs_spacer=11-12bp;gc_cont=0.344	WP_407545533.1 penicillin-binding protein [Staphylococcus aureus]	98.8	99.9	0.0
BAAHSV010000001.1_233|255022|255423|-1|ID=1_233;partial=00;start_type=ATG;rbs_motif=AGGAG;rbs_spacer=5-10bp;gc_cont=0.321	WP_000257598.1 MULTISPECIES: cell division protein FtsL [Staphylococcus]	100	99.3	3.14e-78
BAAHSV010000001.1_234|255437|256372|-1|ID=1_234;partial=00;start_type=GTG;rbs_motif=GGAG/GAGG;rbs_spacer=5-10bp;gc_cont=0.360	WP_000468384.1 MULTISPECIES: 16S rRNA (cytosine(1402)-N(4))-methyltransferase RsmH [Staphylococcus]	100	99.7	6.92e-222
BAAHSV010000001.1_235|256388|256819|-1|ID=1_235;partial=00;start_type=ATG;rbs_motif=GGAG/GAGG;rbs_spacer=5-10bp;gc_cont=0.338	WP_000480800.1 MULTISPECIES: division/cell wall cluster transcriptional repressor MraZ [Staphylococcus]	100	99.3	6.18e-101
BAAHSV010000001.1_236|256963|258576|-1|ID=1_236;partial=00;start_type=ATG;rbs_motif=AGGAG;rbs_spacer=5-10bp;gc_cont=0.323	WP_000340475.1 MULTISPECIES: bacillithiol biosynthesis cysteine-adding enzyme BshC [Staphylococcus]	100	99.8	0.0
BAAHSV010000001.1_237|258771|259211|1|ID=1_237;partial=00;start_type=ATG;rbs_motif=GGA/GAG/AGG;rbs_spacer=11-12bp;gc_cont=0.324	WP_001289711.1 MULTISPECIES: N-acetyltransferase [Staphylococcus]	100	99.3	1.69e-104
BAAHSV010000001.1_238|259320|260015|-1|ID=1_238;partial=00;start_type=ATG;rbs_motif=None;rbs_spacer=None;gc_cont=0.300	WP_001788648.1 MULTISPECIES: YjjG family noncanonical pyrimidine nucleotidase [Staphylococcus]	100	99.6	1.17e-173
