BAAHTI010000001.1_239|260522|261784|-1|ID=1_239;partial=00;start_type=ATG;rbs_motif=GGAG/GAGG;rbs_spacer=5-10bp;gc_cont=0.344	WP_000779504.1 MULTISPECIES: type 8 capsular polysaccharide synthesis protein Cap8O [Staphylococcus]	100	99.8	4.46e-305
BAAHTI010000001.1_240|261838|262725|-1|ID=1_240;partial=00;start_type=ATG;rbs_motif=AGxAGG/AGGxGG;rbs_spacer=11-12bp;gc_cont=0.338	WP_001230679.1 MULTISPECIES: capsular polysaccharide type 5/8 biosynthesis epimerase CapN [Staphylococcus]	100	99.7	1.55e-210
BAAHTI010000001.1_241|262725|263282|-1|ID=1_241;partial=00;start_type=ATG;rbs_motif=AGGAG;rbs_spacer=5-10bp;gc_cont=0.323	WP_000825098.1 MULTISPECIES: type 8 capsular polysaccharide synthesis protein Cap8M [Staphylococcus]	100	99.5	8.74e-126
BAAHTI010000001.1_242|263293|264498|-1|ID=1_242;partial=00;start_type=ATG;rbs_motif=AGGA;rbs_spacer=5-10bp;gc_cont=0.352	WP_001291020.1 MULTISPECIES: type 8 capsular polysaccharide synthesis protein Cap8L [Staphylococcus]	100	99.8	1.92e-294
BAAHTI010000001.1_243|264499|265704|-1|ID=1_243;partial=00;start_type=ATG;rbs_motif=AGGA;rbs_spacer=5-10bp;gc_cont=0.268	WP_000239647.1 MULTISPECIES: capsular polysaccharide biosynthesis protein [Staphylococcus]	100	99.8	2.75e-262
BAAHTI010000001.1_244|265697|266863|-1|ID=1_244;partial=00;start_type=ATG;rbs_motif=GGAG/GAGG;rbs_spacer=5-10bp;gc_cont=0.292	WP_000668175.1 MULTISPECIES: O-antigen ligase family protein [Staphylococcus]	100	99.7	2.31e-268
BAAHTI010000001.1_245|266877|267986|-1|ID=1_245;partial=00;start_type=ATG;rbs_motif=AGGA/GGAG/GAGG;rbs_spacer=11-12bp;gc_cont=0.289	WP_001221646.1 MULTISPECIES: glycosyltransferase [Staphylococcus]	100	99.7	1.54e-261
BAAHTI010000001.1_246|267991|268617|-1|ID=1_246;partial=00;start_type=ATG;rbs_motif=GGAG/GAGG;rbs_spacer=5-10bp;gc_cont=0.329	WP_001216898.1 MULTISPECIES: CatB-related O-acetyltransferase [Staphylococcus]	100	99.5	1.37e-147
BAAHTI010000001.1_247|268620|269744|-1|ID=1_247;partial=00;start_type=ATG;rbs_motif=GGAG/GAGG;rbs_spacer=5-10bp;gc_cont=0.339	WP_000413171.1 MULTISPECIES: type 8 capsular polysaccharide synthesis protein Cap8G [Staphylococcus]	100	99.7	2.31e-270
BAAHTI010000001.1_248|269748|270857|-1|ID=1_248;partial=00;start_type=TTG;rbs_motif=AGGAG;rbs_spacer=5-10bp;gc_cont=0.350	WP_001028283.1 MULTISPECIES: type 8 capsular polysaccharide synthesis protein Cap8F [Staphylococcus]	100	99.7	1.40e-273
BAAHTI010000001.1_249|270870|271898|-1|ID=1_249;partial=00;start_type=ATG;rbs_motif=GGAG/GAGG;rbs_spacer=5-10bp;gc_cont=0.340	WP_000459062.1 MULTISPECIES: type 8 capsular polysaccharide synthesis protein Cap8E [Staphylococcus]	100	99.7	4.11e-241
BAAHTI010000001.1_250|271888|273711|-1|ID=1_250;partial=00;start_type=ATG;rbs_motif=GGAG/GAGG;rbs_spacer=5-10bp;gc_cont=0.349	WP_000940790.1 MULTISPECIES: type 8 capsular polysaccharide synthesis protein Cap8D [Staphylococcus]	100	99.8	0.0
BAAHTI010000001.1_251|273731|274495|-1|ID=1_251;partial=00;start_type=ATG;rbs_motif=GGAG/GAGG;rbs_spacer=5-10bp;gc_cont=0.320	WP_000565304.1 MULTISPECIES: type 8 capsular polysaccharide synthesis protein Cap8C [Staphylococcus]	100	99.6	5.13e-184
BAAHTI010000001.1_252|274498|275184|-1|ID=1_252;partial=00;start_type=ATG;rbs_motif=AGGA/GGAG/GAGG;rbs_spacer=11-12bp;gc_cont=0.336	WP_000037332.1 MULTISPECIES: type 8 capsular polysaccharide synthesis protein Cap8B [Staphylococcus]	100	99.6	3.57e-153
BAAHTI010000001.1_253|275200|275868|-1|ID=1_253;partial=00;start_type=ATG;rbs_motif=GGAG/GAGG;rbs_spacer=5-10bp;gc_cont=0.299	WP_000446299.1 MULTISPECIES: capsular polysaccharide type 5/8 biosynthesis protein CapA [Staphylococcus]	100	99.6	2.38e-139
BAAHTI010000001.1_254|276211|278820|-1|ID=1_254;partial=00;start_type=ATG;rbs_motif=AGGAG;rbs_spacer=5-10bp;gc_cont=0.360	WP_000955781.1 MULTISPECIES: bifunctional acetaldehyde-CoA/alcohol dehydrogenase [Staphylococcus]	99.9	99.9	0.0
BAAHTI010000001.1_255|279205|280380|-1|ID=1_255;partial=00;start_type=ATG;rbs_motif=GGA/GAG/AGG;rbs_spacer=5-10bp;gc_cont=0.287	WP_000469833.1 MULTISPECIES: spr1629 family repressor/antitoxin [Staphylococcus]	100	99.7	4.04e-275
BAAHTI010000001.1_256|280386|281162|-1|ID=1_256;partial=00;start_type=GTG;rbs_motif=None;rbs_spacer=None;gc_cont=0.288	WP_000447776.1 MULTISPECIES: spr1630 family ClpXP-sensitive toxin [Staphylococcus]	99.6	98.5	1.25e-174
BAAHTI010000001.1_257|281310|282845|-1|ID=1_257;partial=00;start_type=ATG;rbs_motif=AGGAG;rbs_spacer=5-10bp;gc_cont=0.367	WP_000065029.1 bifunctional metallophosphatase/5'-nucleotidase [Staphylococcus aureus]	100	99.8	0.0
BAAHTI010000001.1_258|282896|284440|-1|ID=1_258;partial=00;start_type=ATG;rbs_motif=AGGAG;rbs_spacer=5-10bp;gc_cont=0.371	WP_031807514.1 DNA-binding protein [Staphylococcus aureus]	99.6	99.8	0.0
BAAHTI010000001.1_259|284669|285625|1|ID=1_259;partial=00;start_type=ATG;rbs_motif=GGA/GAG/AGG;rbs_spacer=5-10bp;gc_cont=0.308	WP_000787777.1 MULTISPECIES: phosphate/phosphite/phosphonate ABC transporter substrate-binding protein [Staphylococcus]	100	99.7	2.12e-215
BAAHTI010000001.1_260|285820|286593|1|ID=1_260;partial=00;start_type=ATG;rbs_motif=GGA/GAG/AGG;rbs_spacer=5-10bp;gc_cont=0.351	WP_000078092.1 MULTISPECIES: phosphonate ABC transporter ATP-binding protein [Staphylococcus]	100	99.6	6.96e-179
BAAHTI010000001.1_261|286595|287395|1|ID=1_261;partial=00;start_type=ATG;rbs_motif=AGGAG;rbs_spacer=5-10bp;gc_cont=0.343	WP_001127689.1 MULTISPECIES: phosphonate ABC transporter, permease protein PhnE [Staphylococcus]	100	99.6	5.67e-178
BAAHTI010000001.1_262|287392|288207|1|ID=1_262;partial=00;start_type=ATG;rbs_motif=AGGA/GGAG/GAGG;rbs_spacer=11-12bp;gc_cont=0.369	WP_000191092.1 MULTISPECIES: phosphonate ABC transporter, permease protein PhnE [Staphylococcus]	100	99.6	8.33e-178
BAAHTI010000001.1_263|288336|289514|-1|ID=1_263;partial=00;start_type=ATG;rbs_motif=GGAG/GAGG;rbs_spacer=5-10bp;gc_cont=0.369	WP_000197806.1 MULTISPECIES: phosphopentomutase [Staphylococcus]	100	99.7	4.49e-293
BAAHTI010000001.1_264|289542|290204|-1|ID=1_264;partial=00;start_type=ATG;rbs_motif=AGGAG;rbs_spacer=5-10bp;gc_cont=0.403	WP_000667269.1 MULTISPECIES: deoxyribose-phosphate aldolase [Staphylococcus]	100	99.5	1.46e-148
BAAHTI010000001.1_265|290285|291643|-1|ID=1_265;partial=00;start_type=ATG;rbs_motif=None;rbs_spacer=None;gc_cont=0.319	WP_001100299.1 MULTISPECIES: tetracycline efflux MFS transporter Tet(38) [Staphylococcus]	100	99.3	3.46e-295
BAAHTI010000001.1_266|291644|292351|-1|ID=1_266;partial=00;start_type=ATG;rbs_motif=GGAG/GAGG;rbs_spacer=5-10bp;gc_cont=0.374	WP_000843292.1 MULTISPECIES: purine-nucleoside phosphorylase [Staphylococcus]	100	99.6	5.75e-167
BAAHTI010000001.1_267|292587|293342|1|ID=1_267;partial=00;start_type=ATG;rbs_motif=None;rbs_spacer=None;gc_cont=0.358	WP_001795345.1 MULTISPECIES: GntR family transcriptional regulator [Staphylococcus]	100	99.6	4.75e-183
BAAHTI010000001.1_268|293533|294258|-1|ID=1_268;partial=00;start_type=ATG;rbs_motif=GGA/GAG/AGG;rbs_spacer=5-10bp;gc_cont=0.354	WP_031765273.1 LPXTG cell wall anchor domain-containing protein [Staphylococcus aureus]	86.7	99.6	6.73e-125
BAAHTI010000001.1_269|294625|295224|-1|ID=1_269;partial=00;start_type=ATG;rbs_motif=AGGAG;rbs_spacer=5-10bp;gc_cont=0.353	WP_000874681.1 MULTISPECIES: superoxide dismutase [Staphylococcus]	100	99.5	2.49e-150
BAAHTI010000001.1_270|295492|296922|-1|ID=1_270;partial=00;start_type=ATG;rbs_motif=GGA/GAG/AGG;rbs_spacer=5-10bp;gc_cont=0.314	WP_000834089.1 MULTISPECIES: oligosaccharide flippase family protein [Staphylococcus]	100	99.8	7.58e-314
BAAHTI010000001.1_271|296912|298150|-1|ID=1_271;partial=00;start_type=ATG;rbs_motif=GGA/GAG/AGG;rbs_spacer=11-12bp;gc_cont=0.303	WP_000431230.1 MULTISPECIES: O-antigen ligase family protein [Staphylococcus]	100	99.8	2.41e-273
BAAHTI010000001.1_272|298131|299297|-1|ID=1_272;partial=00;start_type=TTG;rbs_motif=GGA/GAG/AGG;rbs_spacer=11-12bp;gc_cont=0.338	WP_000692504.1 MULTISPECIES: glycosyltransferase family 4 protein [Staphylococcus]	100	99.7	1.48e-280
BAAHTI010000001.1_273|299507|300199|-1|ID=1_273;partial=00;start_type=TTG;rbs_motif=GGAG/GAGG;rbs_spacer=5-10bp;gc_cont=0.348	WP_000736082.1 MULTISPECIES: sugar transferase [Staphylococcus]	100	99.6	1.41e-160
BAAHTI010000001.1_274|300162|301133|-1|ID=1_274;partial=00;start_type=TTG;rbs_motif=GGAG/GAGG;rbs_spacer=5-10bp;gc_cont=0.317	WP_000442712.1 NAD-dependent epimerase/dehydratase family protein [Staphylococcus aureus]	100	99.7	1.86e-232
BAAHTI010000001.1_275|301478|302254|-1|ID=1_275;partial=00;start_type=ATG;rbs_motif=AGGAG;rbs_spacer=5-10bp;gc_cont=0.409	WP_117179539.1 (S)-acetoin forming diacetyl reductase [Staphylococcus aureus]	99.6	99.6	1.31e-163
BAAHTI010000001.1_276|302466|303092|-1|ID=1_276;partial=00;start_type=ATG;rbs_motif=GGA/GAG/AGG;rbs_spacer=5-10bp;gc_cont=0.319	WP_000414629.1 MULTISPECIES: MFS transporter [Staphylococcus]	100	99.5	9.04e-128
BAAHTI010000001.1_277|303288|304052|-1|ID=1_277;partial=00;start_type=TTG;rbs_motif=AGGA;rbs_spacer=5-10bp;gc_cont=0.370	WP_155560413.1 bifunctional transcriptional regulator/O-phospho-L-serine synthase SbnI [Staphylococcus aureus]	100	99.6	2.46e-191
BAAHTI010000001.1_278|304056|305258|-1|ID=1_278;partial=00;start_type=ATG;rbs_motif=GGA/GAG/AGG;rbs_spacer=5-10bp;gc_cont=0.363	WP_001223713.1 MULTISPECIES: staphyloferrin B biosynthesis decarboxylase SbnH [Staphylococcus]	100	99.8	2.09e-302
BAAHTI010000001.1_279|305258|306037|-1|ID=1_279;partial=00;start_type=ATG;rbs_motif=AGGAG;rbs_spacer=5-10bp;gc_cont=0.400	WP_001186804.1 MULTISPECIES: staphyloferrin B biosynthesis citrate synthase SbnG [Staphylococcus]	100	99.2	3.32e-180
BAAHTI010000001.1_280|306009|307787|-1|ID=1_280;partial=00;start_type=GTG;rbs_motif=AGGAG;rbs_spacer=5-10bp;gc_cont=0.359	WP_371090471.1 3-(L-alanin-3-ylcarbamoyl)-2-[(2-aminoethylcarbamoyl)methyl]-2-hydroxypropanoate synthase SbnF [Staphylococcus aureus]	100	99.7	0.0
BAAHTI010000001.1_281|307768|309504|-1|ID=1_281;partial=00;start_type=GTG;rbs_motif=None;rbs_spacer=None;gc_cont=0.363	WP_001179886.1 MULTISPECIES: L-2,3-diaminopropanoate--citrate ligase SbnE [Staphylococcus]	100	99.8	0.0
BAAHTI010000001.1_282|309494|310750|-1|ID=1_282;partial=00;start_type=ATG;rbs_motif=None;rbs_spacer=None;gc_cont=0.391	WP_000610051.1 MULTISPECIES: staphyloferrin B export MFS transporter [Staphylococcus]	100	99.8	4.29e-286
BAAHTI010000001.1_283|310743|312497|-1|ID=1_283;partial=00;start_type=TTG;rbs_motif=GGAG/GAGG;rbs_spacer=5-10bp;gc_cont=0.360	WP_001179385.1 MULTISPECIES: staphyloferrin B biosynthesis protein SbnC [Staphylococcus]	100	99.8	0.0
BAAHTI010000001.1_284|312518|313528|-1|ID=1_284;partial=00;start_type=ATG;rbs_motif=AGGAG;rbs_spacer=5-10bp;gc_cont=0.373	WP_001078461.1 MULTISPECIES: N-[(2S)-2-amino-2-carboxyethyl]-L-glutamate dehydrogenase SbnB [Staphylococcus]	100	99.7	6.59e-244
BAAHTI010000001.1_285|313525|314505|-1|ID=1_285;partial=00;start_type=TTG;rbs_motif=AGGAG;rbs_spacer=5-10bp;gc_cont=0.369	WP_000570808.1 MULTISPECIES: 2,3-diaminopropionate biosynthesis protein SbnA [Staphylococcus]	100	99.7	1.27e-236
BAAHTI010000001.1_286|314736|315728|1|ID=1_286;partial=00;start_type=ATG;rbs_motif=AGGA/GGAG/GAGG;rbs_spacer=11-12bp;gc_cont=0.322	WP_001045111.1 MULTISPECIES: staphyloferrin B ABC transporter substrate-binding protein SirA [Staphylococcus]	100	99.7	1.25e-229
BAAHTI010000001.1_287|315744|316739|1|ID=1_287;partial=00;start_type=ATG;rbs_motif=AGGAG;rbs_spacer=5-10bp;gc_cont=0.385	WP_000924990.1 MULTISPECIES: staphyloferrin B ABC transporter permease subunit SirB [Staphylococcus]	100	99.7	5.06e-209
BAAHTI010000001.1_288|316736|317734|1|ID=1_288;partial=00;start_type=ATG;rbs_motif=AGGA/GGAG/GAGG;rbs_spacer=11-12bp;gc_cont=0.367	WP_000136633.1 MULTISPECIES: staphyloferrin B ABC transporter permease subunit SirC [Staphylococcus]	100	99.7	6.97e-212
BAAHTI010000001.1_289|318103|318855|1|ID=1_289;partial=00;start_type=ATG;rbs_motif=AGGAG;rbs_spacer=5-10bp;gc_cont=0.275	WP_000876756.1 MULTISPECIES: HTH-type transcriptional regulator SarS [Staphylococcus]	100	99.6	3.84e-168
BAAHTI010000001.1_290|319240|320460|1|ID=1_290;partial=00;start_type=ATG;rbs_motif=None;rbs_spacer=None;gc_cont=0.376	WP_374703789.1 staphylococcal protein A [Staphylococcus aureus]	96.8	99.8	7.36e-242
BAAHTI010000001.1_291|320789|322381|-1|ID=1_291;partial=00;start_type=ATG;rbs_motif=GGAG/GAGG;rbs_spacer=5-10bp;gc_cont=0.345	WP_182059663.1 L-lactate permease [Staphylococcus aureus]	100	99.8	0.0
BAAHTI010000001.1_292|322643|323116|-1|ID=1_292;partial=00;start_type=ATG;rbs_motif=GGAG/GAGG;rbs_spacer=5-10bp;gc_cont=0.297	WP_000036330.1 MULTISPECIES: DUF1648 domain-containing protein [Staphylococcus]	100	99.4	1.21e-107
BAAHTI010000001.1_293|323306|324634|-1|ID=1_293;partial=00;start_type=ATG;rbs_motif=None;rbs_spacer=None;gc_cont=0.294	WP_078072290.1 MULTISPECIES: aminotransferase-like domain-containing protein [Staphylococcus]	100	99.8	0.0
BAAHTI010000001.1_294|324816|325688|1|ID=1_294;partial=00;start_type=ATG;rbs_motif=AGGA/GGAG/GAGG;rbs_spacer=11-12bp;gc_cont=0.308	WP_001038103.1 MULTISPECIES: DMT family transporter [Staphylococcus]	100	99.7	1.19e-191
BAAHTI010000001.1_295|325862|327637|1|ID=1_295;partial=00;start_type=ATG;rbs_motif=AGGA;rbs_spacer=5-10bp;gc_cont=0.358	WP_000291840.1 MULTISPECIES: oleate hydratase [Staphylococcus]	99.8	99.8	0.0
BAAHTI010000001.1_296|327956|329545|1|ID=1_296;partial=00;start_type=ATG;rbs_motif=GGAG/GAGG;rbs_spacer=5-10bp;gc_cont=0.361	WP_441196674.1 Na/Pi cotransporter family protein, partial [Staphylococcus aureus]	100	99.4	0.0
BAAHTI010000001.1_297|330107|331495|-1|ID=1_297;partial=00;start_type=ATG;rbs_motif=AGGAG;rbs_spacer=5-10bp;gc_cont=0.368	WP_001006439.1 multidrug efflux MFS transporter NorC [Staphylococcus aureus]	100	99.8	9.95e-312
BAAHTI010000001.1_298|331497|332675|-1|ID=1_298;partial=00;start_type=ATG;rbs_motif=AGGAG;rbs_spacer=5-10bp;gc_cont=0.372	WP_001075809.1 MULTISPECIES: M20 family metallopeptidase [Staphylococcus]	100	99.7	5.63e-287
BAAHTI010000001.1_299|332826|335063|-1|ID=1_299;partial=00;start_type=ATG;rbs_motif=GGAG/GAGG;rbs_spacer=5-10bp;gc_cont=0.337	WP_001188472.1 MULTISPECIES: transcriptional regulator AryK [Staphylococcus]	100	99.9	0.0
BAAHTI010000001.1_300|335160|335927|-1|ID=1_300;partial=00;start_type=ATG;rbs_motif=AGGA;rbs_spacer=5-10bp;gc_cont=0.309	WP_000826312.1 tandem-type lipoprotein [Staphylococcus aureus]	100	99.6	4.38e-181
BAAHTI010000001.1_301|335994|336761|-1|ID=1_301;partial=00;start_type=ATG;rbs_motif=GGA/GAG/AGG;rbs_spacer=5-10bp;gc_cont=0.290	WP_000826304.1 tandem-type lipoprotein [Staphylococcus aureus]	100	99.6	3.08e-181
BAAHTI010000001.1_302|336829|337596|-1|ID=1_302;partial=00;start_type=ATG;rbs_motif=AGGA;rbs_spacer=5-10bp;gc_cont=0.299	WP_000826371.1 tandem-type lipoprotein [Staphylococcus aureus]	100	99.6	2.53e-180
BAAHTI010000001.1_303|337664|338434|-1|ID=1_303;partial=00;start_type=ATG;rbs_motif=GGA/GAG/AGG;rbs_spacer=5-10bp;gc_cont=0.294	WP_071009126.1 tandem-type lipoprotein [Staphylococcus aureus]	99.6	99.6	1.36e-180
BAAHTI010000001.1_304|338655|339641|-1|ID=1_304;partial=00;start_type=ATG;rbs_motif=AGxAG;rbs_spacer=5-10bp;gc_cont=0.337	WP_000710555.1 MULTISPECIES: phosphatidylinositol-specific phospholipase C [Staphylococcus]	100	99.7	3.25e-240
BAAHTI010000001.1_305|339847|340329|-1|ID=1_305;partial=00;start_type=ATG;rbs_motif=AGGA/GGAG/GAGG;rbs_spacer=11-12bp;gc_cont=0.319	WP_000410567.1 MULTISPECIES: hypothetical protein [Staphylococcus]	100	99.4	4.67e-102
BAAHTI010000001.1_306|340386|343538|-1|ID=1_306;partial=00;start_type=ATG;rbs_motif=GGA/GAG/AGG;rbs_spacer=5-10bp;gc_cont=0.313	WP_000080564.1 MULTISPECIES: DEAD/DEAH box helicase [Staphylococcus]	100	99.9	0.0
BAAHTI010000001.1_307|343805|344407|-1|ID=1_307;partial=00;start_type=ATG;rbs_motif=GGA/GAG/AGG;rbs_spacer=5-10bp;gc_cont=0.307	WP_000908956.1 MULTISPECIES: hypothetical protein [Staphylococcus]	100	99.5	5.14e-130
BAAHTI010000001.1_308|344615|344911|-1|ID=1_308;partial=00;start_type=ATG;rbs_motif=AGGAG;rbs_spacer=5-10bp;gc_cont=0.303	WP_000201644.1 MULTISPECIES: TfoX/Sxy family protein [Staphylococcus]	100	99.0	2.48e-63
BAAHTI010000001.1_309|344960|345163|-1|ID=1_309;partial=00;start_type=ATG;rbs_motif=GGA/GAG/AGG;rbs_spacer=5-10bp;gc_cont=0.270	WP_000389759.1 MULTISPECIES: DUF6007 family protein [Staphylococcus]	100	98.5	9.70e-38
BAAHTI010000001.1_310|345472|346458|1|ID=1_310;partial=00;start_type=ATG;rbs_motif=None;rbs_spacer=None;gc_cont=0.389	WP_000662022.1 MULTISPECIES: tRNA dihydrouridine synthase [Staphylococcus]	100	99.7	9.31e-240
BAAHTI010000001.1_311|347124|348317|-1|ID=1_311;partial=00;start_type=ATG;rbs_motif=AGGA;rbs_spacer=5-10bp;gc_cont=0.327	WP_001033018.1 MULTISPECIES: type II sulfide:quinone oxidoreductase Sqr [Staphylococcus]	100	99.7	1.78e-297
BAAHTI010000001.1_312|348336|349670|-1|ID=1_312;partial=00;start_type=ATG;rbs_motif=AGGAG;rbs_spacer=5-10bp;gc_cont=0.336	WP_000465472.1 MULTISPECIES: persulfide dioxygenase-sulfurtransferase CstB [Staphylococcus]	100	99.8	0.0
BAAHTI010000001.1_313|349701|350765|-1|ID=1_313;partial=00;start_type=ATG;rbs_motif=GGAG/GAGG;rbs_spacer=5-10bp;gc_cont=0.315	WP_000816133.1 MULTISPECIES: persulfide response sulfurtransferase CstA [Staphylococcus]	100	99.7	4.51e-251
BAAHTI010000001.1_314|350902|351162|1|ID=1_314;partial=00;start_type=ATG;rbs_motif=GGAG/GAGG;rbs_spacer=5-10bp;gc_cont=0.307	WP_001105088.1 MULTISPECIES: persulfide-sensing transcriptional repressor CstR [Staphylococcus]	100	98.9	1.38e-50
BAAHTI010000001.1_315|351162|351917|1|ID=1_315;partial=00;start_type=ATG;rbs_motif=None;rbs_spacer=None;gc_cont=0.315	WP_000355845.1 MULTISPECIES: sulfite exporter TauE/SafE family protein [Staphylococcus]	100	99.6	2.75e-157
BAAHTI010000001.1_316|352861|354606|-1|ID=1_316;partial=00;start_type=ATG;rbs_motif=GGA/GAG/AGG;rbs_spacer=5-10bp;gc_cont=0.256	WP_000700190.1 MULTISPECIES: DUF6119 family protein [Staphylococcus]	100	99.8	0.0
BAAHTI010000001.1_317|355193|356701|-1|ID=1_317;partial=00;start_type=TTG;rbs_motif=GGAG/GAGG;rbs_spacer=5-10bp;gc_cont=0.312	WP_001001347.1 MULTISPECIES: protein kinase domain-containing protein [Staphylococcus]	100	99.8	0.0
BAAHTI010000001.1_318|356816|357442|1|ID=1_318;partial=00;start_type=ATG;rbs_motif=None;rbs_spacer=None;gc_cont=0.297	WP_001176969.1 MULTISPECIES: hypothetical protein [Staphylococcus]	100	99.5	5.59e-147
BAAHTI010000001.1_319|357532|357819|1|ID=1_319;partial=00;start_type=TTG;rbs_motif=None;rbs_spacer=None;gc_cont=0.306	WP_256075313.1 hypothetical protein, partial [Staphylococcus aureus]	100	81.3	1.25e-47
BAAHTI010000001.1_320|357987|358361|1|ID=1_320;partial=00;start_type=ATG;rbs_motif=None;rbs_spacer=None;gc_cont=0.275	WP_078097653.1 hypothetical protein, partial [Staphylococcus aureus]	100	80.8	3.49e-66
BAAHTI010000001.1_321|358561|359457|1|ID=1_321;partial=00;start_type=ATG;rbs_motif=AGxAGG/AGGxGG;rbs_spacer=5-10bp;gc_cont=0.367	WP_000411461.1 MULTISPECIES: DUF927 domain-containing protein [Staphylococcus]	100	99.7	1.01e-212
BAAHTI010000001.1_322|359467|360336|1|ID=1_322;partial=00;start_type=GTG;rbs_motif=AGGA;rbs_spacer=5-10bp;gc_cont=0.336	WP_000626133.1 MULTISPECIES: hypothetical protein [Staphylococcus]	100	99.7	2.08e-196
BAAHTI010000001.1_323|360881|361438|-1|ID=1_323;partial=00;start_type=ATG;rbs_motif=AGGAG;rbs_spacer=5-10bp;gc_cont=0.367	WP_001193482.1 MULTISPECIES: K(+)-transporting ATPase subunit C [Staphylococcus]	100	99.5	1.69e-123
BAAHTI010000001.1_324|361454|363475|-1|ID=1_324;partial=00;start_type=ATG;rbs_motif=AGGAG;rbs_spacer=5-10bp;gc_cont=0.397	WP_000852430.1 MULTISPECIES: K(+)-transporting ATPase subunit B [Staphylococcus]	100	99.9	0.0
BAAHTI010000001.1_325|363494|365170|-1|ID=1_325;partial=00;start_type=ATG;rbs_motif=GGAG/GAGG;rbs_spacer=5-10bp;gc_cont=0.368	WP_000029430.1 MULTISPECIES: potassium-transporting ATPase subunit KdpA [Staphylococcus]	100	99.8	0.0
BAAHTI010000001.1_326|365243|365386|1|ID=1_326;partial=00;start_type=ATG;rbs_motif=None;rbs_spacer=None;gc_cont=0.292	WP_227489965.1 hypothetical protein, partial [Staphylococcus aureus]	97.9	97.9	2.08e-23
BAAHTI010000001.1_327|365438|368107|1|ID=1_327;partial=00;start_type=ATG;rbs_motif=GGAG/GAGG;rbs_spacer=5-10bp;gc_cont=0.366	WP_000446429.1 MULTISPECIES: sensor histidine kinase [Staphylococcus]	100	99.9	0.0
BAAHTI010000001.1_328|368082|368777|1|ID=1_328;partial=00;start_type=ATG;rbs_motif=GGAG/GAGG;rbs_spacer=5-10bp;gc_cont=0.374	WP_000858967.1 MULTISPECIES: response regulator transcription factor [Staphylococcus]	100	99.6	8.80e-160
BAAHTI010000001.1_329|369523|370425|1|ID=1_329;partial=00;start_type=GTG;rbs_motif=None;rbs_spacer=None;gc_cont=0.369	WP_435431814.1 YfcC family protein, partial [Staphylococcus epidermidis]	99.3	99.7	3.09e-207
BAAHTI010000001.1_330|370936|371250|1|ID=1_330;partial=00;start_type=ATG;rbs_motif=GGAG/GAGG;rbs_spacer=5-10bp;gc_cont=0.308	YP_009226739.1 IS3 family transposase [Staphylococcus phage SPbeta-like]	96.2	99.0	9.42e-64
BAAHTI010000001.1_331|371235|371588|1|ID=1_331;partial=00;start_type=GTG;rbs_motif=GGA/GAG/AGG;rbs_spacer=5-10bp;gc_cont=0.302	WP_341612823.1 IS3 family transposase, partial [Staphylococcus epidermidis]	99.1	99.2	2.41e-79
BAAHTI010000001.1_332|371655|372077|1|ID=1_332;partial=00;start_type=ATG;rbs_motif=None;rbs_spacer=None;gc_cont=0.319	WP_031899761.1 DDE-type integrase/transposase/recombinase, partial [Staphylococcus aureus]	100	99.3	1.35e-94
BAAHTI010000001.1_333|372328|373374|1|ID=1_333;partial=00;start_type=ATG;rbs_motif=GGA/GAG/AGG;rbs_spacer=5-10bp;gc_cont=0.251	WP_001060127.1 MULTISPECIES: hypothetical protein [Staphylococcus]	100	99.7	1.38e-242
BAAHTI010000001.1_334|373567|373863|1|ID=1_334;partial=00;start_type=ATG;rbs_motif=AGGAG;rbs_spacer=5-10bp;gc_cont=0.347	WP_000273824.1 MULTISPECIES: cassette chromosome ssDNA-binding protein [Staphylococcus]	100	99.0	7.95e-69
BAAHTI010000001.1_335|373863|375656|1|ID=1_335;partial=00;start_type=ATG;rbs_motif=AGGAG;rbs_spacer=5-10bp;gc_cont=0.344	WP_000195100.1 MULTISPECIES: cassette chromosome replicative helicase [Staphylococcus]	100	99.8	0.0
BAAHTI010000001.1_336|375890|377239|1|ID=1_336;partial=00;start_type=ATG;rbs_motif=AGGAG;rbs_spacer=5-10bp;gc_cont=0.348	WP_000815646.1 MULTISPECIES: cassette chromosome recombinase CcrA [Staphylococcus]	100	99.8	0.0
BAAHTI010000001.1_337|377261|378889|1|ID=1_337;partial=00;start_type=ATG;rbs_motif=AGGA;rbs_spacer=5-10bp;gc_cont=0.351	WP_001186602.1 MULTISPECIES: cassette chromosome recombinase CcrB [Staphylococcus]	100	99.8	0.0
BAAHTI010000001.1_338|379407|379757|1|ID=1_338;partial=00;start_type=ATG;rbs_motif=AGGAG;rbs_spacer=5-10bp;gc_cont=0.348	WP_000859155.1 MULTISPECIES: SAUGI family uracil-DNA glycosylase inhibitor [Staphylococcus]	100	99.1	8.89e-79
BAAHTI010000001.1_339|379844|380155|1|ID=1_339;partial=00;start_type=ATG;rbs_motif=GGAG/GAGG;rbs_spacer=5-10bp;gc_cont=0.321	WP_000700853.1 MULTISPECIES: DUF960 family protein [Staphylococcus]	100	99.0	5.68e-69
BAAHTI010000001.1_340|380173|380679|1|ID=1_340;partial=00;start_type=ATG;rbs_motif=None;rbs_spacer=None;gc_cont=0.363	WP_001092169.1 MULTISPECIES: DUF1643 domain-containing protein [Staphylococcus]	100	99.4	9.72e-117
BAAHTI010000001.1_341|380700|381014|1|ID=1_341;partial=01;start_type=ATG;rbs_motif=GGAG/GAGG;rbs_spacer=5-10bp;gc_cont=0.343	WP_000659050.1 MULTISPECIES: JAB domain-containing protein [Staphylococcus]	100	100	2.12e-67
