BAAHTR010000001.1_1|719|1315|-1|ID=1_1;partial=00;start_type=ATG;rbs_motif=GGA/GAG/AGG;rbs_spacer=11-12bp;gc_cont=0.363	WP_000559156.1 MULTISPECIES: recombination mediator RecR [Staphylococcus]	100	99.5	3.81e-140
BAAHTR010000001.1_2|1322|1639|-1|ID=1_2;partial=00;start_type=ATG;rbs_motif=AGGAG;rbs_spacer=5-10bp;gc_cont=0.393	WP_001213992.1 MULTISPECIES: YbaB/EbfC family nucleoid-associated protein [Staphylococcus]	100	99.1	6.84e-53
BAAHTR010000001.1_3|1729|3426|-1|ID=1_3;partial=00;start_type=TTG;rbs_motif=GGAG/GAGG;rbs_spacer=5-10bp;gc_cont=0.361	WP_001109036.1 MULTISPECIES: DNA polymerase III subunit gamma/tau [Staphylococcus]	100	99.8	0.0
BAAHTR010000001.1_4|3495|4019|-1|ID=1_4;partial=00;start_type=ATG;rbs_motif=GGAG/GAGG;rbs_spacer=5-10bp;gc_cont=0.330	WP_001167822.1 MULTISPECIES: GNAT family N-acetyltransferase [Staphylococcus]	100	99.4	7.33e-124
BAAHTR010000001.1_5|4662|5390|-1|ID=1_5;partial=00;start_type=ATG;rbs_motif=GGA/GAG/AGG;rbs_spacer=5-10bp;gc_cont=0.337	WP_001118675.1 MULTISPECIES: trehalose operon repressor [Staphylococcus]	100	99.6	3.17e-163
BAAHTR010000001.1_6|5415|7055|-1|ID=1_6;partial=00;start_type=GTG;rbs_motif=GGA/GAG/AGG;rbs_spacer=5-10bp;gc_cont=0.363	WP_000031502.1 MULTISPECIES: alpha,alpha-phosphotrehalase [Staphylococcus]	100	99.8	0.0
BAAHTR010000001.1_7|7119|8546|-1|ID=1_7;partial=00;start_type=ATG;rbs_motif=GGAG/GAGG;rbs_spacer=5-10bp;gc_cont=0.375	WP_000279365.1 MULTISPECIES: PTS system trehalose-specific EIIBC component [Staphylococcus]	100	99.8	0.0
BAAHTR010000001.1_8|9377|10840|-1|ID=1_8;partial=00;start_type=ATG;rbs_motif=GGAG/GAGG;rbs_spacer=5-10bp;gc_cont=0.385	WP_000503583.1 MULTISPECIES: glutamate synthase subunit beta [Staphylococcus]	100	99.8	0.0
BAAHTR010000001.1_9|10858|12330|-1|ID=1_9;partial=00;start_type=GTG;rbs_motif=None;rbs_spacer=None;gc_cont=0.372	WP_368545838.1 glutamate synthase large subunit [Staphylococcus aureus]	99.8	99.8	0.0
BAAHTR010000001.1_10|12433|15357|-1|ID=1_10;partial=00;start_type=ATG;rbs_motif=GGA/GAG/AGG;rbs_spacer=5-10bp;gc_cont=0.381	WP_374731230.1 glutamate synthase large subunit [Staphylococcus aureus]	100	99.9	0.0
BAAHTR010000001.1_11|15538|16422|1|ID=1_11;partial=00;start_type=ATG;rbs_motif=AGGAG(G)/GGAGG;rbs_spacer=13-15bp;gc_cont=0.332	WP_000403911.1 MULTISPECIES: glutamate biosynthesis transcriptional regulator GltC [Staphylococcus]	100	99.7	9.70e-209
BAAHTR010000001.1_12|16543|17655|1|ID=1_12;partial=00;start_type=TTG;rbs_motif=None;rbs_spacer=None;gc_cont=0.335	WP_256927382.1 YibE/F family protein, partial [Staphylococcus aureus]	99.7	99.7	2.82e-251
BAAHTR010000001.1_13|17652|18434|1|ID=1_13;partial=00;start_type=ATG;rbs_motif=AGGAG;rbs_spacer=5-10bp;gc_cont=0.328	WP_000994681.1 MULTISPECIES: YibE/F family protein [Staphylococcus]	100	99.6	6.80e-167
BAAHTR010000001.1_14|18603|19100|-1|ID=1_14;partial=00;start_type=ATG;rbs_motif=GGA/GAG/AGG;rbs_spacer=5-10bp;gc_cont=0.363	WP_000183668.1 MULTISPECIES: GNAT family N-acetyltransferase [Staphylococcus]	100	97.0	8.83e-113
BAAHTR010000001.1_15|19078|19473|-1|ID=1_15;partial=00;start_type=ATG;rbs_motif=None;rbs_spacer=None;gc_cont=0.343	WP_000588530.1 MULTISPECIES: NUDIX hydrolase [Staphylococcus]	100	99.2	9.84e-90
BAAHTR010000001.1_16|19622|19891|1|ID=1_16;partial=00;start_type=ATG;rbs_motif=GGA/GAG/AGG;rbs_spacer=5-10bp;gc_cont=0.330	WP_001129473.1 MULTISPECIES: hypothetical protein [Staphylococcus]	100	98.9	9.14e-55
BAAHTR010000001.1_17|20076|21080|-1|ID=1_17;partial=00;start_type=GTG;rbs_motif=AGGAG;rbs_spacer=5-10bp;gc_cont=0.364	WP_001170264.1 MULTISPECIES: autolysin/adhesin Aaa [Staphylococcus]	100	99.7	7.26e-231
BAAHTR010000001.1_18|21412|22254|-1|ID=1_18;partial=00;start_type=ATG;rbs_motif=AGGA;rbs_spacer=5-10bp;gc_cont=0.333	WP_000825528.1 MULTISPECIES: dipeptide ABC transporter glycylmethionine-binding lipoprotein [Staphylococcus]	99.6	99.6	1.45e-187
BAAHTR010000001.1_19|22291|22950|-1|ID=1_19;partial=00;start_type=ATG;rbs_motif=AGGA/GGAG/GAGG;rbs_spacer=11-12bp;gc_cont=0.365	WP_000467991.1 MULTISPECIES: methionine ABC transporter permease [Staphylococcus]	100	99.5	3.92e-132
BAAHTR010000001.1_20|22954|23979|-1|ID=1_20;partial=00;start_type=ATG;rbs_motif=AGGAG;rbs_spacer=5-10bp;gc_cont=0.352	WP_000569289.1 MULTISPECIES: methionine ABC transporter ATP-binding protein [Staphylococcus]	100	99.7	2.46e-237
BAAHTR010000001.1_21|24276|25418|-1|ID=1_21;partial=00;start_type=ATG;rbs_motif=AGGAG;rbs_spacer=5-10bp;gc_cont=0.360	WP_001036667.1 MULTISPECIES: bifunctional cystathionine gamma-lyase/homocysteine desulfhydrase [Staphylococcus]	100	99.7	4.82e-266
BAAHTR010000001.1_22|25411|26367|-1|ID=1_22;partial=00;start_type=ATG;rbs_motif=None;rbs_spacer=None;gc_cont=0.391	WP_078171451.1 PLP-dependent cysteine synthase family protein [Staphylococcus aureus]	99.7	96.6	2.02e-222
BAAHTR010000001.1_23|26533|27873|-1|ID=1_23;partial=00;start_type=ATG;rbs_motif=AGGAG;rbs_spacer=5-10bp;gc_cont=0.348	WP_000828722.1 MULTISPECIES: sodium-dependent transporter [Staphylococcus]	100	99.6	1.98e-305
BAAHTR010000001.1_24|28035|28148|-1|ID=1_24;partial=00;start_type=ATG;rbs_motif=None;rbs_spacer=None;gc_cont=0.439	WP_000510434.1 MULTISPECIES: hypothetical protein [Staphylococcus]	100	97.4	2.30e-19
BAAHTR010000001.1_25|28326|29060|-1|ID=1_25;partial=00;start_type=ATG;rbs_motif=AGGA/GGAG/GAGG;rbs_spacer=11-12bp;gc_cont=0.340	WP_001220807.1 MULTISPECIES: alpha/beta hydrolase [Staphylococcus]	100	99.6	1.04e-178
BAAHTR010000001.1_26|29097|29771|-1|ID=1_26;partial=00;start_type=ATG;rbs_motif=AGGAG;rbs_spacer=5-10bp;gc_cont=0.344	WP_000565820.1 MULTISPECIES: phosphatase PAP2 family protein [Staphylococcus]	100	99.6	9.16e-154
BAAHTR010000001.1_27|29809|30225|1|ID=1_27;partial=00;start_type=ATG;rbs_motif=None;rbs_spacer=None;gc_cont=0.269	WP_001789536.1 MULTISPECIES: hypothetical protein [Staphylococcus]	100	99.3	2.76e-88
BAAHTR010000001.1_28|30454|30816|-1|ID=1_28;partial=00;start_type=ATG;rbs_motif=GGAG/GAGG;rbs_spacer=5-10bp;gc_cont=0.336	WP_000831495.1 MULTISPECIES: DUF2294 domain-containing protein [Staphylococcus]	100	99.2	2.82e-77
BAAHTR010000001.1_29|30978|33683|-1|ID=1_29;partial=00;start_type=ATG;rbs_motif=AGGAG;rbs_spacer=5-10bp;gc_cont=0.387	WP_000211536.1 MULTISPECIES: DUF2309 domain-containing protein [Staphylococcus]	100	99.9	0.0
BAAHTR010000001.1_30|33696|35180|-1|ID=1_30;partial=00;start_type=GTG;rbs_motif=AGGAG;rbs_spacer=5-10bp;gc_cont=0.372	WP_000948299.1 MULTISPECIES: NADH dehydrogenase subunit 5 [Staphylococcus]	99.8	99.8	0.0
BAAHTR010000001.1_31|36765|37967|-1|ID=1_31;partial=00;start_type=ATG;rbs_motif=GGAG/GAGG;rbs_spacer=5-10bp;gc_cont=0.371	WP_001062985.1 MULTISPECIES: GTP-binding protein [Staphylococcus]	100	99.8	5.00e-285
BAAHTR010000001.1_32|38165|38359|1|ID=1_32;partial=00;start_type=ATG;rbs_motif=GGAG/GAGG;rbs_spacer=5-10bp;gc_cont=0.303	WP_072419840.1 MULTISPECIES: hypothetical protein [Staphylococcus]	100	98.5	5.33e-31
BAAHTR010000001.1_33|38643|38957|-1|ID=1_33;partial=00;start_type=ATG;rbs_motif=AGGAG;rbs_spacer=5-10bp;gc_cont=0.324	WP_000172545.1 MULTISPECIES: hypothetical protein [Staphylococcus]	100	99.0	3.41e-66
BAAHTR010000001.1_34|38976|39299|-1|ID=1_34;partial=00;start_type=ATG;rbs_motif=GGA/GAG/AGG;rbs_spacer=5-10bp;gc_cont=0.269	WP_000971498.1 MULTISPECIES: hypothetical protein [Staphylococcus]	100	99.1	2.03e-64
BAAHTR010000001.1_35|39296|40621|-1|ID=1_35;partial=00;start_type=ATG;rbs_motif=GGA/GAG/AGG;rbs_spacer=5-10bp;gc_cont=0.301	WP_000653711.1 MULTISPECIES: membrane protein [Staphylococcus]	100	99.8	1.02e-307
BAAHTR010000001.1_36|40611|41471|-1|ID=1_36;partial=00;start_type=ATG;rbs_motif=None;rbs_spacer=None;gc_cont=0.286	WP_014936986.1 MULTISPECIES: tandem-type lipoprotein [Staphylococcus]	100	94.1	3.28e-190
BAAHTR010000001.1_37|41605|42402|-1|ID=1_37;partial=00;start_type=ATG;rbs_motif=GGA/GAG/AGG;rbs_spacer=5-10bp;gc_cont=0.301	WP_000540315.1 MULTISPECIES: tandem-type lipoprotein [Staphylococcus]	100	99.6	1.20e-183
BAAHTR010000001.1_38|42454|43245|-1|ID=1_38;partial=00;start_type=ATG;rbs_motif=GGA/GAG/AGG;rbs_spacer=5-10bp;gc_cont=0.308	WP_000456136.1 MULTISPECIES: tandem-type lipoprotein [Staphylococcus]	100	99.6	7.56e-186
BAAHTR010000001.1_39|43277|44047|-1|ID=1_39;partial=00;start_type=ATG;rbs_motif=GGA/GAG/AGG;rbs_spacer=5-10bp;gc_cont=0.301	WP_000540916.1 MULTISPECIES: tandem-type lipoprotein Lpl5 [Staphylococcus]	100	99.6	5.35e-187
BAAHTR010000001.1_40|44095|44457|-1|ID=1_40;partial=00;start_type=TTG;rbs_motif=None;rbs_spacer=None;gc_cont=0.256	WP_162674377.1 Csa1 family protein, partial [Staphylococcus aureus]	98.3	99.2	4.03e-69
BAAHTR010000001.1_41|44463|44906|-1|ID=1_41;partial=00;start_type=ATG;rbs_motif=GGA/GAG/AGG;rbs_spacer=5-10bp;gc_cont=0.293	WP_148710352.1 tandem-type lipoprotein, partial [Staphylococcus aureus]	96.3	90.5	1.07e-87
BAAHTR010000001.1_42|45242|45550|1|ID=1_42;partial=00;start_type=ATG;rbs_motif=AGGAG;rbs_spacer=5-10bp;gc_cont=0.333	WP_000669524.1 MULTISPECIES: myeloperoxidase inhibitor SPIN [Staphylococcus]	100	99.0	2.84e-64
BAAHTR010000001.1_43|45657|47159|-1|ID=1_43;partial=00;start_type=ATG;rbs_motif=GGAG/GAGG;rbs_spacer=5-10bp;gc_cont=0.323	WP_001208892.1 MULTISPECIES: FKLRK protein [Staphylococcus]	100	99.8	0.0
BAAHTR010000001.1_44|47181|47873|-1|ID=1_44;partial=00;start_type=ATG;rbs_motif=GGAG/GAGG;rbs_spacer=5-10bp;gc_cont=0.302	WP_000769141.1 MULTISPECIES: superantigen-like protein SSL11 [Staphylococcus]	100	99.6	3.72e-156
BAAHTR010000001.1_45|48279|49538|-1|ID=1_45;partial=00;start_type=ATG;rbs_motif=None;rbs_spacer=None;gc_cont=0.289	WP_117218904.1 restriction endonuclease subunit S [Staphylococcus aureus]	100	99.8	4.94e-297
BAAHTR010000001.1_46|49531|51087|-1|ID=1_46;partial=00;start_type=ATG;rbs_motif=GGAG/GAGG;rbs_spacer=5-10bp;gc_cont=0.380	WP_000028602.1 type I restriction-modification system subunit M [Staphylococcus aureus]	100	99.8	0.0
BAAHTR010000001.1_47|51349|52032|-1|ID=1_47;partial=00;start_type=ATG;rbs_motif=GGAG/GAGG;rbs_spacer=5-10bp;gc_cont=0.294	WP_000778477.1 MULTISPECIES: superantigen-like protein SSL10 [Staphylococcus]	100	99.6	2.83e-154
BAAHTR010000001.1_48|52391|53089|-1|ID=1_48;partial=00;start_type=ATG;rbs_motif=GGAG/GAGG;rbs_spacer=5-10bp;gc_cont=0.289	WP_000673059.1 MULTISPECIES: superantigen-like protein SSL9 [Staphylococcus]	100	99.6	1.30e-157
BAAHTR010000001.1_49|53468|54166|-1|ID=1_49;partial=00;start_type=ATG;rbs_motif=GGAG/GAGG;rbs_spacer=5-10bp;gc_cont=0.285	WP_000673035.1 MULTISPECIES: superantigen-like protein SSL8 [Staphylococcus]	100	99.6	1.84e-157
BAAHTR010000001.1_50|54505|55200|-1|ID=1_50;partial=00;start_type=GTG;rbs_motif=GGAG/GAGG;rbs_spacer=5-10bp;gc_cont=0.305	WP_000769837.1 MULTISPECIES: superantigen-like protein SSL7 [Staphylococcus]	100	99.6	2.42e-157
BAAHTR010000001.1_51|55622|56320|-1|ID=1_51;partial=00;start_type=ATG;rbs_motif=GGAG/GAGG;rbs_spacer=5-10bp;gc_cont=0.296	WP_000767929.1 MULTISPECIES: superantigen-like protein SSL6 [Staphylococcus]	100	99.6	3.71e-157
BAAHTR010000001.1_52|56766|57470|-1|ID=1_52;partial=00;start_type=ATG;rbs_motif=GGAG/GAGG;rbs_spacer=5-10bp;gc_cont=0.319	WP_000781345.1 MULTISPECIES: superantigen-like protein SSL5 [Staphylococcus]	100	99.6	6.22e-166
BAAHTR010000001.1_53|57834|58904|-1|ID=1_53;partial=00;start_type=ATG;rbs_motif=GGAG/GAGG;rbs_spacer=5-10bp;gc_cont=0.340	WP_001837402.1 superantigen-like protein SSL3 [Staphylococcus aureus]	100	99.7	2.74e-184
BAAHTR010000001.1_54|59195|59890|-1|ID=1_54;partial=00;start_type=ATG;rbs_motif=GGAG/GAGG;rbs_spacer=5-10bp;gc_cont=0.295	WP_000782839.1 MULTISPECIES: superantigen-like protein SSL2 [Staphylococcus]	100	99.6	1.07e-160
BAAHTR010000001.1_55|60176|60856|-1|ID=1_55;partial=00;start_type=ATG;rbs_motif=None;rbs_spacer=None;gc_cont=0.298	WP_000669009.1 MULTISPECIES: superantigen-like protein SSL1 [Staphylococcus]	100	99.6	7.84e-156
BAAHTR010000001.1_56|61328|62173|1|ID=1_56;partial=00;start_type=ATG;rbs_motif=AGGAG;rbs_spacer=5-10bp;gc_cont=0.355	WP_001024374.1 MULTISPECIES: SDR family oxidoreductase [Staphylococcus]	100	99.6	1.32e-204
BAAHTR010000001.1_57|62192|62551|1|ID=1_57;partial=00;start_type=GTG;rbs_motif=AGGAG;rbs_spacer=5-10bp;gc_cont=0.322	WP_001021621.1 MULTISPECIES: DUF1304 domain-containing protein [Staphylococcus]	100	99.2	8.13e-72
BAAHTR010000001.1_58|62810|63499|-1|ID=1_58;partial=00;start_type=ATG;rbs_motif=AGGAG;rbs_spacer=5-10bp;gc_cont=0.284	WP_000416469.1 MULTISPECIES: NYN domain-containing protein [Staphylococcus]	100	99.6	5.53e-162
BAAHTR010000001.1_59|63699|64181|-1|ID=1_59;partial=00;start_type=ATG;rbs_motif=GGA/GAG/AGG;rbs_spacer=5-10bp;gc_cont=0.323	WP_000600865.1 MULTISPECIES: DUF523 domain-containing protein [Staphylococcus]	100	99.4	8.44e-114
BAAHTR010000001.1_60|64228|64635|-1|ID=1_60;partial=00;start_type=ATG;rbs_motif=AGGAG;rbs_spacer=5-10bp;gc_cont=0.294	WP_117222506.1 DUF2992 family protein [Staphylococcus aureus]	95.6	99.3	2.02e-59
BAAHTR010000001.1_61|64998|65150|1|ID=1_61;partial=00;start_type=ATG;rbs_motif=AGGAG;rbs_spacer=5-10bp;gc_cont=0.261	WP_000248840.1 MULTISPECIES: hypothetical protein [Staphylococcus]	100	98.0	2.11e-27
BAAHTR010000001.1_62|65131|65679|1|ID=1_62;partial=00;start_type=ATG;rbs_motif=None;rbs_spacer=None;gc_cont=0.281	WP_410202676.1 hypothetical protein, partial [Staphylococcus aureus]	100	54.1	5.01e-62
BAAHTR010000001.1_63|66004|66426|1|ID=1_63;partial=00;start_type=ATG;rbs_motif=GGA/GAG/AGG;rbs_spacer=11-12bp;gc_cont=0.255	WP_000843946.1 MULTISPECIES: hypothetical protein [Staphylococcus]	100	99.3	2.44e-92
BAAHTR010000001.1_64|66728|67096|1|ID=1_64;partial=00;start_type=GTG;rbs_motif=None;rbs_spacer=None;gc_cont=0.257	WP_144531591.1 transposase, partial [Bacillus subtilis]	83.3	29.3	4.05e-10
BAAHTR010000001.1_65|66964|68790|-1|ID=1_65;partial=00;start_type=ATG;rbs_motif=AGGAG;rbs_spacer=5-10bp;gc_cont=0.270	WP_117201018.1 DUF262 domain-containing protein [Staphylococcus aureus]	100	99.8	0.0
BAAHTR010000001.1_66|69016|69294|1|ID=1_66;partial=00;start_type=ATG;rbs_motif=None;rbs_spacer=None;gc_cont=0.305	WP_233146474.1 hypothetical protein, partial [Staphylococcus aureus]	100	79.6	5.50e-45
BAAHTR010000001.1_67|69676|69876|-1|ID=1_67;partial=00;start_type=ATG;rbs_motif=AGGAG;rbs_spacer=5-10bp;gc_cont=0.239	WP_259339051.1 DegT/DnrJ/EryC1/StrS family aminotransferase [Staphylococcus arlettae]	58.5	61.2	4.72e-05
BAAHTR010000001.1_68|69895|70227|-1|ID=1_68;partial=00;start_type=GTG;rbs_motif=AGGAG;rbs_spacer=5-10bp;gc_cont=0.423	WP_000212549.1 hypothetical protein [Staphylococcus aureus]	100	99.1	5.67e-52
BAAHTR010000001.1_70|71153|71632|1|ID=1_70;partial=00;start_type=ATG;rbs_motif=AGGA/GGAG/GAGG;rbs_spacer=11-12bp;gc_cont=0.352	WP_000704946.1 MULTISPECIES: hypothetical protein [Staphylococcus]	100	99.4	1.51e-102
BAAHTR010000001.1_71|71654|72046|1|ID=1_71;partial=00;start_type=ATG;rbs_motif=AGGAG;rbs_spacer=5-10bp;gc_cont=0.270	WP_000888757.1 MULTISPECIES: hypothetical protein [Staphylococcus]	100	99.2	1.99e-84
BAAHTR010000001.1_72|72672|73826|-1|ID=1_72;partial=00;start_type=ATG;rbs_motif=None;rbs_spacer=None;gc_cont=0.249	WP_001793186.1 Abi family protein [Staphylococcus aureus]	100	99.7	2.65e-281
BAAHTR010000001.1_73|74290|75831|-1|ID=1_73;partial=00;start_type=ATG;rbs_motif=AGGAG;rbs_spacer=5-10bp;gc_cont=0.372	WP_000424968.1 MULTISPECIES: glutamine-hydrolyzing GMP synthase [Staphylococcus]	100	99.8	0.0
BAAHTR010000001.1_74|75856|77322|-1|ID=1_74;partial=00;start_type=ATG;rbs_motif=GGAG/GAGG;rbs_spacer=5-10bp;gc_cont=0.377	WP_000264071.1 MULTISPECIES: IMP dehydrogenase [Staphylococcus]	100	99.8	0.0
BAAHTR010000001.1_75|77360|78628|-1|ID=1_75;partial=00;start_type=ATG;rbs_motif=GGAG/GAGG;rbs_spacer=5-10bp;gc_cont=0.356	WP_000793023.1 MULTISPECIES: xanthine permease PbuX [Staphylococcus]	100	99.8	5.49e-291
BAAHTR010000001.1_76|78628|79206|-1|ID=1_76;partial=00;start_type=GTG;rbs_motif=AGGAG;rbs_spacer=5-10bp;gc_cont=0.359	WP_000421410.1 MULTISPECIES: xanthine phosphoribosyltransferase [Staphylococcus]	100	99.5	5.64e-130
BAAHTR010000001.1_77|79719|80126|1|ID=1_77;partial=00;start_type=ATG;rbs_motif=GGA/GAG/AGG;rbs_spacer=5-10bp;gc_cont=0.328	WP_000763768.1 MULTISPECIES: general stress protein [Staphylococcus]	100	99.3	1.81e-87
BAAHTR010000001.1_78|80269|80931|1|ID=1_78;partial=00;start_type=ATG;rbs_motif=GGAG/GAGG;rbs_spacer=5-10bp;gc_cont=0.302	WP_000394698.1 MULTISPECIES: hypothetical protein [Staphylococcus]	100	99.5	8.20e-155
BAAHTR010000001.1_79|81049|82005|1|ID=1_79;partial=00;start_type=ATG;rbs_motif=AGGA;rbs_spacer=5-10bp;gc_cont=0.375	WP_368410550.1 hypothetical protein [Staphylococcus aureus]	100	99.7	1.18e-133
BAAHTR010000001.1_80|83179|84567|1|ID=1_80;partial=00;start_type=ATG;rbs_motif=AGGAG;rbs_spacer=5-10bp;gc_cont=0.393	WP_000991017.1 MULTISPECIES: L-cystine transporter [Staphylococcus]	100	99.8	3.71e-307
BAAHTR010000001.1_81|84648|85454|-1|ID=1_81;partial=00;start_type=TTG;rbs_motif=GGA/GAG/AGG;rbs_spacer=5-10bp;gc_cont=0.371	WP_001797637.1 oxygen-insensitive NADPH nitroreductase [Staphylococcus aureus]	98.8	94.4	4.62e-177
BAAHTR010000001.1_82|85895|86464|1|ID=1_82;partial=00;start_type=ATG;rbs_motif=AGGAG;rbs_spacer=5-10bp;gc_cont=0.372	WP_000052781.1 MULTISPECIES: alkyl hydroperoxide reductase subunit C [Staphylococcus]	100	99.5	3.05e-137
BAAHTR010000001.1_83|86480|88003|1|ID=1_83;partial=00;start_type=ATG;rbs_motif=AGGAGG;rbs_spacer=5-10bp;gc_cont=0.379	WP_000930514.1 MULTISPECIES: alkyl hydroperoxide reductase subunit F [Staphylococcus]	100	99.8	0.0
BAAHTR010000001.1_84|88118|89728|1|ID=1_84;partial=00;start_type=ATG;rbs_motif=GGAG/GAGG;rbs_spacer=5-10bp;gc_cont=0.299	WP_000887776.1 MULTISPECIES: hypothetical protein [Staphylococcus]	100	99.8	0.0
BAAHTR010000001.1_85|89801|90427|1|ID=1_85;partial=00;start_type=ATG;rbs_motif=AGGA/GGAG/GAGG;rbs_spacer=11-12bp;gc_cont=0.306	WP_000746680.1 MULTISPECIES: NDxxF motif lipoprotein [Staphylococcus]	100	99.5	1.07e-135
BAAHTR010000001.1_86|90679|91065|1|ID=1_86;partial=00;start_type=ATG;rbs_motif=AGGA;rbs_spacer=5-10bp;gc_cont=0.310	WP_000868260.1 MULTISPECIES: hypothetical protein [Staphylococcus]	100	98.4	4.75e-75
BAAHTR010000001.1_87|91131|91712|-1|ID=1_87;partial=00;start_type=ATG;rbs_motif=AGGAG;rbs_spacer=5-10bp;gc_cont=0.321	WP_000158375.1 MULTISPECIES: histidine phosphatase family protein [Staphylococcus]	100	99.5	1.50e-139
BAAHTR010000001.1_88|91890|92099|1|ID=1_88;partial=00;start_type=ATG;rbs_motif=None;rbs_spacer=None;gc_cont=0.276	WP_000211676.1 MULTISPECIES: hypothetical protein [Staphylococcus]	100	98.6	5.93e-42
BAAHTR010000001.1_89|92138|92389|-1|ID=1_89;partial=00;start_type=ATG;rbs_motif=AGGAG;rbs_spacer=5-10bp;gc_cont=0.365	WP_000466739.1 MULTISPECIES: GlsB/YeaQ/YmgE family stress response membrane protein [Staphylococcus]	100	98.8	3.61e-38
BAAHTR010000001.1_90|92683|92946|1|ID=1_90;partial=00;start_type=ATG;rbs_motif=GGAG/GAGG;rbs_spacer=5-10bp;gc_cont=0.292	WP_001055897.1 MULTISPECIES: helix-turn-helix domain-containing protein [Staphylococcus]	100	98.9	1.21e-58
BAAHTR010000001.1_91|93084|93689|-1|ID=1_91;partial=00;start_type=ATG;rbs_motif=None;rbs_spacer=None;gc_cont=0.309	WP_000769722.1 MULTISPECIES: PepSY domain-containing protein [Staphylococcus]	100	94.1	9.10e-122
BAAHTR010000001.1_92|93804|94205|-1|ID=1_92;partial=00;start_type=TTG;rbs_motif=GGAG/GAGG;rbs_spacer=5-10bp;gc_cont=0.316	WP_000849170.1 MULTISPECIES: YxeA family protein [unclassified Staphylococcus]	100	99.3	1.82e-86
BAAHTR010000001.1_94|94574|95185|-1|ID=1_94;partial=00;start_type=ATG;rbs_motif=AGGAG;rbs_spacer=5-10bp;gc_cont=0.304	WP_249741449.1 exotoxin beta-grasp domain-containing protein [Staphylococcus aureus]	99.5	99.5	1.60e-139
BAAHTR010000001.1_95|95545|95685|1|ID=1_95;partial=00;start_type=ATG;rbs_motif=None;rbs_spacer=None;gc_cont=0.326	WP_000237577.1 integrase [Staphylococcus aureus]	100	97.9	1.48e-24
BAAHTR010000001.1_96|95682|95810|1|ID=1_96;partial=00;start_type=ATG;rbs_motif=GGA/GAG/AGG;rbs_spacer=5-10bp;gc_cont=0.380	WP_326024596.1 tyrosine-type recombinase/integrase [Staphylococcus saprophyticus]	79.4	79.1	5.24e-06
BAAHTR010000001.1_97|96090|97082|1|ID=1_97;partial=00;start_type=ATG;rbs_motif=None;rbs_spacer=None;gc_cont=0.283	WP_072419886.1 MULTISPECIES: Abi family protein [Staphylococcus]	100	94.3	9.74e-225
BAAHTR010000001.1_98|97348|97590|-1|ID=1_98;partial=00;start_type=ATG;rbs_motif=AGGAG;rbs_spacer=5-10bp;gc_cont=0.374	WP_000897044.1 MULTISPECIES: 30S ribosomal protein S18 [Bacteria]	100	98.8	3.02e-49
BAAHTR010000001.1_99|97642|98145|-1|ID=1_99;partial=00;start_type=ATG;rbs_motif=GGAG/GAGG;rbs_spacer=5-10bp;gc_cont=0.379	WP_061839556.1 single-stranded DNA-binding protein [Staphylococcus aureus]	91.6	99.4	1.08e-99
BAAHTR010000001.1_100|98166|98462|-1|ID=1_100;partial=00;start_type=ATG;rbs_motif=AGGAG(G)/GGAGG;rbs_spacer=13-15bp;gc_cont=0.380	WP_001261460.1 MULTISPECIES: 30S ribosomal protein S6 [Bacteria]	100	99.0	3.52e-63
BAAHTR010000001.1_101|98706|98897|1|ID=1_101;partial=00;start_type=ATG;rbs_motif=GGAG/GAGG;rbs_spacer=5-10bp;gc_cont=0.318	WP_001052483.1 MULTISPECIES: hypothetical protein [Staphylococcus]	100	98.4	9.23e-41
BAAHTR010000001.1_102|98983|100080|-1|ID=1_102;partial=00;start_type=ATG;rbs_motif=AGGAG;rbs_spacer=5-10bp;gc_cont=0.353	WP_374738957.1 redox-regulated ATPase YchF [Staphylococcus aureus]	99.7	99.7	5.74e-255
BAAHTR010000001.1_103|100092|100295|-1|ID=1_103;partial=00;start_type=ATG;rbs_motif=GGAG/GAGG;rbs_spacer=5-10bp;gc_cont=0.289	WP_000157345.1 MULTISPECIES: DUF951 domain-containing protein [Staphylococcus]	100	98.5	1.48e-41
BAAHTR010000001.1_104|100325|101206|-1|ID=1_104;partial=00;start_type=ATG;rbs_motif=AGGA/GGAG/GAGG;rbs_spacer=11-12bp;gc_cont=0.307	WP_001077602.1 MULTISPECIES: mechanosensitive ion channel family protein [Staphylococcus]	100	99.7	4.03e-150
BAAHTR010000001.1_105|101363|102208|-1|ID=1_105;partial=00;start_type=GTG;rbs_motif=None;rbs_spacer=None;gc_cont=0.337	WP_001566903.1 MULTISPECIES: ParB/RepB/Spo0J family partition protein [Staphylococcus]	100	99.6	1.57e-187
BAAHTR010000001.1_107|102872|103975|1|ID=1_107;partial=00;start_type=ATG;rbs_motif=AGGAG;rbs_spacer=5-10bp;gc_cont=0.359	WP_000655703.1 MULTISPECIES: aminotransferase class I/II-fold pyridoxal phosphate-dependent enzyme [Staphylococcus]	100	99.7	2.66e-261
BAAHTR010000001.1_108|103972|105132|1|ID=1_108;partial=00;start_type=ATG;rbs_motif=GGAG/GAGG;rbs_spacer=5-10bp;gc_cont=0.380	WP_000175854.1 MULTISPECIES: cystathionine beta-lyase MetC [Staphylococcus]	100	99.7	1.35e-275
BAAHTR010000001.1_109|105101|106942|1|ID=1_109;partial=00;start_type=ATG;rbs_motif=AGGAG;rbs_spacer=5-10bp;gc_cont=0.363	WP_000077320.1 MULTISPECIES: bifunctional homocysteine S-methyltransferase/methylenetetrahydrofolate reductase [Staphylococcus]	100	99.8	0.0
BAAHTR010000001.1_110|106939|109167|1|ID=1_110;partial=00;start_type=ATG;rbs_motif=AGGAG;rbs_spacer=5-10bp;gc_cont=0.343	WP_000207619.1 MULTISPECIES: 5-methyltetrahydropteroyltriglutamate--homocysteine S-methyltransferase [Staphylococcus]	99.9	99.9	0.0
BAAHTR010000001.1_111|109210|109962|1|ID=1_111;partial=00;start_type=ATG;rbs_motif=None;rbs_spacer=None;gc_cont=0.372	WP_000195907.1 MULTISPECIES: cyclase family protein [Staphylococcus]	100	99.6	3.36e-187
BAAHTR010000001.1_112|110045|111226|-1|ID=1_112;partial=00;start_type=ATG;rbs_motif=AGGA/GGAG/GAGG;rbs_spacer=11-12bp;gc_cont=0.387	WP_000199069.1 MULTISPECIES: acetyl-CoA C-acetyltransferase [Staphylococcus]	100	99.7	2.00e-276
BAAHTR010000001.1_113|111765|112898|1|ID=1_113;partial=00;start_type=ATG;rbs_motif=AGGAG;rbs_spacer=5-10bp;gc_cont=0.318	WP_000245682.1 MULTISPECIES: low temperature requirement protein A [Staphylococcus]	100	99.7	8.60e-263
BAAHTR010000001.1_114|113288|113917|-1|ID=1_114;partial=00;start_type=ATG;rbs_motif=GGAG/GAGG;rbs_spacer=5-10bp;gc_cont=0.327	WP_000677725.1 MULTISPECIES: ABC-2 transporter permease [Staphylococcus]	100	99.5	8.56e-122
BAAHTR010000001.1_115|113917|114759|-1|ID=1_115;partial=00;start_type=ATG;rbs_motif=AGGAG;rbs_spacer=5-10bp;gc_cont=0.320	WP_000209553.1 MULTISPECIES: ABC transporter ATP-binding protein [Staphylococcus]	100	99.6	5.76e-194
BAAHTR010000001.1_116|114784|115497|-1|ID=1_116;partial=00;start_type=ATG;rbs_motif=AGGAG;rbs_spacer=5-10bp;gc_cont=0.317	WP_000698768.1 MULTISPECIES: DUF3169 family protein [Staphylococcus]	100	99.6	2.72e-141
BAAHTR010000001.1_117|115494|115697|-1|ID=1_117;partial=00;start_type=GTG;rbs_motif=AGGAG;rbs_spacer=5-10bp;gc_cont=0.397	WP_001246009.1 MULTISPECIES: helix-turn-helix transcriptional regulator [Staphylococcus]	100	98.5	1.89e-35
BAAHTR010000001.1_118|115937|116326|1|ID=1_118;partial=00;start_type=ATG;rbs_motif=AGGAG;rbs_spacer=5-10bp;gc_cont=0.346	WP_000886013.1 MULTISPECIES: DUF1398 domain-containing protein [Staphylococcus]	100	99.2	6.70e-87
BAAHTR010000001.1_119|116434|116649|1|ID=1_119;partial=00;start_type=ATG;rbs_motif=GGAG/GAGG;rbs_spacer=5-10bp;gc_cont=0.356	WP_000632271.1 twin-arginine translocase TatA/TatE family subunit [Staphylococcus aureus]	100	98.6	1.06e-36
BAAHTR010000001.1_120|116666|117367|1|ID=1_120;partial=00;start_type=ATG;rbs_motif=None;rbs_spacer=None;gc_cont=0.336	WP_001566900.1 MULTISPECIES: twin-arginine translocase subunit TatC [Staphylococcus]	100	99.6	3.03e-152
BAAHTR010000001.1_121|117459|119171|-1|ID=1_121;partial=00;start_type=GTG;rbs_motif=GGAG/GAGG;rbs_spacer=5-10bp;gc_cont=0.339	WP_172576657.1 FTR1 family iron permease [Staphylococcus aureus]	100	99.8	0.0
BAAHTR010000001.1_122|119152|120381|-1|ID=1_122;partial=00;start_type=ATG;rbs_motif=None;rbs_spacer=None;gc_cont=0.372	WP_000186214.1 MULTISPECIES: iron uptake transporter deferrochelatase/peroxidase subunit [Staphylococcus]	100	99.8	3.64e-303
BAAHTR010000001.1_123|120378|121232|-1|ID=1_123;partial=00;start_type=ATG;rbs_motif=GGAG/GAGG;rbs_spacer=5-10bp;gc_cont=0.305	WP_000737194.1 MULTISPECIES: iron uptake system protein EfeO [Staphylococcus]	100	99.6	2.94e-173
BAAHTR010000001.1_124|121499|122044|-1|ID=1_124;partial=00;start_type=ATG;rbs_motif=GGAG/GAGG;rbs_spacer=5-10bp;gc_cont=0.352	WP_000467634.1 MULTISPECIES: GNAT family N-acetyltransferase [Staphylococcus]	100	99.5	4.04e-129
