BAAHSY010000001.1_359|359263|361872|1|ID=1_359;partial=00;start_type=ATG;rbs_motif=GGAG/GAGG;rbs_spacer=5-10bp;gc_cont=0.338	WP_000353949.1 MULTISPECIES: ATP-dependent chaperone ClpB [Staphylococcus]	99.8	99.9	0.0
BAAHSY010000001.1_360|361931|362800|-1|ID=1_360;partial=00;start_type=ATG;rbs_motif=GGAG/GAGG;rbs_spacer=5-10bp;gc_cont=0.274	WP_001047066.1 MULTISPECIES: LysR family transcriptional regulator [Staphylococcus]	100	99.7	1.49e-205
BAAHSY010000001.1_361|362910|364055|1|ID=1_361;partial=00;start_type=ATG;rbs_motif=AGGA/GGAG/GAGG;rbs_spacer=11-12bp;gc_cont=0.268	WP_000619366.1 LeuA family protein [Staphylococcus aureus]	100	99.7	5.44e-268
BAAHSY010000001.1_362|364039|364680|1|ID=1_362;partial=00;start_type=ATG;rbs_motif=AGGAG;rbs_spacer=5-10bp;gc_cont=0.255	WP_000404422.1 MULTISPECIES: L-threonylcarbamoyladenylate synthase [Staphylococcus]	100	99.5	1.26e-150
BAAHSY010000001.1_363|364673|365791|1|ID=1_363;partial=00;start_type=ATG;rbs_motif=GGA/GAG/AGG;rbs_spacer=5-10bp;gc_cont=0.237	WP_001037436.1 MULTISPECIES: MFS transporter [Staphylococcus]	100	99.7	3.54e-248
BAAHSY010000001.1_364|365775|366290|1|ID=1_364;partial=00;start_type=ATG;rbs_motif=AGGAG;rbs_spacer=5-10bp;gc_cont=0.318	WP_000695342.1 MULTISPECIES: YbhB/YbcL family Raf kinase inhibitor-like protein [Staphylococcus]	100	99.4	4.80e-123
BAAHSY010000001.1_365|366601|367035|1|ID=1_365;partial=00;start_type=ATG;rbs_motif=AGGAG;rbs_spacer=5-10bp;gc_cont=0.331	WP_000769689.1 MULTISPECIES: MAP domain-containing protein [Staphylococcus]	100	99.3	1.91e-91
BAAHSY010000001.1_366|367292|367477|-1|ID=1_366;partial=00;start_type=ATG;rbs_motif=GGAG/GAGG;rbs_spacer=5-10bp;gc_cont=0.349	WP_000682089.1 MULTISPECIES: YjzD family protein [Staphylococcus]	100	98.4	6.99e-33
BAAHSY010000001.1_367|367772|368713|1|ID=1_367;partial=00;start_type=ATG;rbs_motif=GGA/GAG/AGG;rbs_spacer=5-10bp;gc_cont=0.355	WP_001100525.1 MULTISPECIES: beta-ketoacyl-ACP synthase III [Staphylococcus]	100	99.7	2.42e-223
BAAHSY010000001.1_368|368725|369969|1|ID=1_368;partial=00;start_type=ATG;rbs_motif=AGGAG;rbs_spacer=5-10bp;gc_cont=0.387	WP_000081237.1 beta-ketoacyl-ACP synthase II [Staphylococcus aureus]	100	99.8	1.36e-296
BAAHSY010000001.1_369|370024|370395|-1|ID=1_369;partial=00;start_type=ATG;rbs_motif=GGAG/GAGG;rbs_spacer=5-10bp;gc_cont=0.269	WP_000915155.1 MULTISPECIES: DUF3899 domain-containing protein [Staphylococcus]	100	99.2	4.63e-73
BAAHSY010000001.1_370|370638|371564|1|ID=1_370;partial=00;start_type=ATG;rbs_motif=AGGAG;rbs_spacer=5-10bp;gc_cont=0.327	WP_000521533.1 MULTISPECIES: oligopeptide ABC transporter permease [Staphylococcus]	100	99.7	7.88e-206
BAAHSY010000001.1_371|371564|372634|1|ID=1_371;partial=00;start_type=ATG;rbs_motif=AGGAG;rbs_spacer=5-10bp;gc_cont=0.338	WP_000829632.1 MULTISPECIES: oligopeptide ABC transporter permease [Staphylococcus]	100	99.7	9.36e-245
BAAHSY010000001.1_372|372651|373733|1|ID=1_372;partial=00;start_type=ATG;rbs_motif=AGxAGG/AGGxGG;rbs_spacer=5-10bp;gc_cont=0.357	WP_000140050.1 MULTISPECIES: ABC transporter ATP-binding protein [Staphylococcus]	100	99.7	1.65e-256
BAAHSY010000001.1_373|373723|374664|1|ID=1_373;partial=00;start_type=ATG;rbs_motif=GGA/GAG/AGG;rbs_spacer=5-10bp;gc_cont=0.331	WP_000786734.1 MULTISPECIES: ABC transporter ATP-binding protein [Staphylococcus]	100	99.7	9.05e-219
BAAHSY010000001.1_374|374683|376338|1|ID=1_374;partial=00;start_type=ATG;rbs_motif=GGA/GAG/AGG;rbs_spacer=5-10bp;gc_cont=0.328	WP_252305432.1 peptide ABC transporter substrate-binding protein [Staphylococcus aureus]	100	99.8	0.0
BAAHSY010000001.1_375|376550|378265|1|ID=1_375;partial=00;start_type=ATG;rbs_motif=AGGAG;rbs_spacer=5-10bp;gc_cont=0.325	WP_000517187.1 MULTISPECIES: oligopeptide ABC transporter substrate-binding protein [Staphylococcus]	100	99.8	0.0
BAAHSY010000001.1_376|378316|379302|1|ID=1_376;partial=00;start_type=ATG;rbs_motif=None;rbs_spacer=None;gc_cont=0.300	WP_001067049.1 ABC transporter ATP-binding protein [Staphylococcus aureus]	100	99.7	3.07e-229
BAAHSY010000001.1_377|379305|380285|1|ID=1_377;partial=00;start_type=ATG;rbs_motif=AGGAG;rbs_spacer=5-10bp;gc_cont=0.309	WP_000427770.1 MULTISPECIES: ABC transporter ATP-binding protein [Staphylococcus]	100	99.7	4.95e-234
BAAHSY010000001.1_378|380278|381240|1|ID=1_378;partial=00;start_type=ATG;rbs_motif=GGA/GAG/AGG;rbs_spacer=5-10bp;gc_cont=0.288	WP_000593417.1 MULTISPECIES: oligopeptide ABC transporter permease [Staphylococcus]	100	99.7	1.56e-218
BAAHSY010000001.1_379|381252|382133|1|ID=1_379;partial=00;start_type=ATG;rbs_motif=GGA/GAG/AGG;rbs_spacer=5-10bp;gc_cont=0.313	WP_001180262.1 MULTISPECIES: oligopeptide ABC transporter permease [Staphylococcus]	100	99.7	6.67e-195
BAAHSY010000001.1_380|382175|383164|-1|ID=1_380;partial=00;start_type=ATG;rbs_motif=GGA/GAG/AGG;rbs_spacer=5-10bp;gc_cont=0.345	WP_000448934.1 MULTISPECIES: tryptophan--tRNA ligase [Staphylococcus]	100	99.7	4.59e-236
BAAHSY010000001.1_381|383459|383854|1|ID=1_381;partial=00;start_type=ATG;rbs_motif=AGGAG;rbs_spacer=5-10bp;gc_cont=0.326	WP_000258003.1 MULTISPECIES: transcriptional regulator SpxA [Bacteria]	100	99.2	2.71e-87
BAAHSY010000001.1_382|384225|384944|1|ID=1_382;partial=00;start_type=ATG;rbs_motif=AGGAG;rbs_spacer=5-10bp;gc_cont=0.317	WP_001217730.1 MULTISPECIES: adaptor protein MecA [Staphylococcus]	100	99.6	1.07e-164
BAAHSY010000001.1_383|385065|385322|1|ID=1_383;partial=00;start_type=ATG;rbs_motif=GGAG/GAGG;rbs_spacer=5-10bp;gc_cont=0.318	WP_419717248.1 competence protein CoiA family protein, partial [Staphylococcus aureus]	100	98.8	8.47e-55
BAAHSY010000001.1_384|385349|386050|1|ID=1_384;partial=00;start_type=TTG;rbs_motif=None;rbs_spacer=None;gc_cont=0.271	WP_048523697.1 competence protein CoiA family protein, partial [Staphylococcus aureus]	99.6	99.6	2.11e-171
BAAHSY010000001.1_385|386098|387906|1|ID=1_385;partial=00;start_type=ATG;rbs_motif=AGGAGG;rbs_spacer=5-10bp;gc_cont=0.321	WP_000082731.1 MULTISPECIES: oligoendopeptidase F [Staphylococcus]	100	99.8	0.0
BAAHSY010000001.1_386|388366|389172|-1|ID=1_386;partial=00;start_type=ATG;rbs_motif=GGA/GAG/AGG;rbs_spacer=5-10bp;gc_cont=0.306	WP_000896697.1 MULTISPECIES: protease adaptor protein YjbH [Staphylococcus]	100	99.6	1.65e-187
BAAHSY010000001.1_387|389195|389560|-1|ID=1_387;partial=00;start_type=ATG;rbs_motif=None;rbs_spacer=None;gc_cont=0.342	WP_000214075.1 truncated hemoglobin YjbI [Staphylococcus aureus]	100	99.2	1.24e-85
BAAHSY010000001.1_388|389664|390257|-1|ID=1_388;partial=00;start_type=ATG;rbs_motif=AGGA/GGAG/GAGG;rbs_spacer=11-12bp;gc_cont=0.300	WP_000224622.1 MULTISPECIES: CYTH domain-containing protein [Staphylococcus]	100	99.5	2.68e-135
BAAHSY010000001.1_389|390443|390790|1|ID=1_389;partial=00;start_type=ATG;rbs_motif=AGGAG;rbs_spacer=5-10bp;gc_cont=0.287	WP_001242102.1 MULTISPECIES: UPF0738 family protein [Staphylococcus]	100	99.1	1.67e-78
BAAHSY010000001.1_390|390807|391442|1|ID=1_390;partial=00;start_type=ATG;rbs_motif=None;rbs_spacer=None;gc_cont=0.336	WP_001077683.1 MULTISPECIES: GTP pyrophosphokinase [Staphylococcus]	100	99.5	1.00e-146
BAAHSY010000001.1_391|391459|392268|1|ID=1_391;partial=00;start_type=ATG;rbs_motif=AGGA/GGAG/GAGG;rbs_spacer=11-12bp;gc_cont=0.354	WP_001270834.1 MULTISPECIES: NAD kinase [Staphylococcus]	100	99.6	1.04e-195
BAAHSY010000001.1_392|392265|393119|1|ID=1_392;partial=00;start_type=ATG;rbs_motif=None;rbs_spacer=None;gc_cont=0.309	WP_000669939.1 MULTISPECIES: RluA family pseudouridine synthase [Staphylococcus]	100	99.6	1.09e-209
BAAHSY010000001.1_393|393140|394525|1|ID=1_393;partial=00;start_type=ATG;rbs_motif=GGA/GAG/AGG;rbs_spacer=5-10bp;gc_cont=0.333	WP_000062417.1 MULTISPECIES: magnesium transporter [Staphylococcus]	100	99.8	4.05e-315
BAAHSY010000001.1_394|394535|396379|1|ID=1_394;partial=00;start_type=ATG;rbs_motif=AGGAG;rbs_spacer=5-10bp;gc_cont=0.317	WP_000395153.1 MULTISPECIES: monovalent cation:proton antiporter family protein [Staphylococcus]	100	99.8	0.0
BAAHSY010000001.1_395|396657|397427|1|ID=1_395;partial=00;start_type=ATG;rbs_motif=AGGAG;rbs_spacer=5-10bp;gc_cont=0.353	WP_000933195.1 MULTISPECIES: enoyl-ACP reductase FabI [Staphylococcus]	100	99.6	1.70e-174
BAAHSY010000001.1_396|397622|398707|-1|ID=1_396;partial=00;start_type=ATG;rbs_motif=AGGAGG;rbs_spacer=5-10bp;gc_cont=0.309	WP_000933105.1 MULTISPECIES: lipoteichoic acid biosynthesis protein CozEa [Staphylococcus]	100	99.7	6.27e-241
BAAHSY010000001.1_397|399049|400617|1|ID=1_397;partial=00;start_type=ATG;rbs_motif=GGA/GAG/AGG;rbs_spacer=5-10bp;gc_cont=0.358	WP_000570699.1 MULTISPECIES: alanine/glycine:cation symporter family protein [Staphylococcus]	100	99.8	0.0
BAAHSY010000001.1_398|400759|401517|1|ID=1_398;partial=00;start_type=ATG;rbs_motif=GGA/GAG/AGG;rbs_spacer=11-12bp;gc_cont=0.315	WP_001288681.1 MULTISPECIES: esterase family protein [Staphylococcus]	100	99.6	7.60e-185
BAAHSY010000001.1_399|401711|402220|1|ID=1_399;partial=00;start_type=ATG;rbs_motif=AGGAG;rbs_spacer=5-10bp;gc_cont=0.341	WP_000600392.1 MULTISPECIES: YjcG family protein [Staphylococcus]	100	99.4	2.12e-116
BAAHSY010000001.1_400|402333|403523|-1|ID=1_400;partial=00;start_type=ATG;rbs_motif=GGA/GAG/AGG;rbs_spacer=5-10bp;gc_cont=0.319	WP_001154222.1 MULTISPECIES: lipoteichoic acid biosynthesis MFS flippase LtaA [Staphylococcus]	100	99.7	2.48e-267
BAAHSY010000001.1_401|403501|404676|-1|ID=1_401;partial=00;start_type=ATG;rbs_motif=GGAG/GAGG;rbs_spacer=5-10bp;gc_cont=0.327	WP_000258650.1 MULTISPECIES: diglucosyl diacylglycerol synthase [Staphylococcus]	100	99.7	1.49e-286
BAAHSY010000001.1_402|405109|406590|1|ID=1_402;partial=00;start_type=TTG;rbs_motif=AGGAG;rbs_spacer=5-10bp;gc_cont=0.368	WP_000340119.1 MULTISPECIES: UDP-N-acetylmuramoyl-L-alanyl-D-glutamate--L-lysine ligase [Staphylococcus]	100	99.8	0.0
BAAHSY010000001.1_403|406574|406834|1|ID=1_403;partial=00;start_type=GTG;rbs_motif=None;rbs_spacer=None;gc_cont=0.314	WP_001795833.1 YueH family protein [Staphylococcus aureus]	100	98.9	8.61e-54
BAAHSY010000001.1_404|406834|408396|1|ID=1_404;partial=00;start_type=ATG;rbs_motif=AGGAG;rbs_spacer=5-10bp;gc_cont=0.340	WP_001049959.1 MULTISPECIES: peptide chain release factor 3 [Staphylococcus]	100	99.8	0.0
BAAHSY010000001.1_405|408698|409501|1|ID=1_405;partial=00;start_type=ATG;rbs_motif=AGGAG;rbs_spacer=5-10bp;gc_cont=0.368	WP_000928413.1 MULTISPECIES: TerC family protein [Staphylococcus]	100	99.6	3.59e-186
BAAHSY010000001.1_406|409720|412044|1|ID=1_406;partial=00;start_type=ATG;rbs_motif=None;rbs_spacer=None;gc_cont=0.314	WP_076035548.1 S1C family serine protease [Staphylococcus aureus]	100	99.9	0.0
BAAHSY010000001.1_407|412061|413419|1|ID=1_407;partial=00;start_type=GTG;rbs_motif=GGAG/GAGG;rbs_spacer=5-10bp;gc_cont=0.319	WP_000021865.1 MULTISPECIES: TrkH family potassium uptake protein [Staphylococcus]	100	99.8	8.78e-294
BAAHSY010000001.1_408|413555|415069|1|ID=1_408;partial=00;start_type=ATG;rbs_motif=GGAG/GAGG;rbs_spacer=5-10bp;gc_cont=0.321	WP_103263403.1 bifunctional metallophosphatase/5'-nucleotidase [Staphylococcus aureus]	100	99.6	0.0
BAAHSY010000001.1_409|415556|416125|-1|ID=1_409;partial=00;start_type=ATG;rbs_motif=GGAG/GAGG;rbs_spacer=5-10bp;gc_cont=0.302	WP_000287265.1 MULTISPECIES: competence protein ComK [Staphylococcus]	100	99.5	2.51e-136
BAAHSY010000001.1_410|416335|416553|1|ID=1_410;partial=00;start_type=ATG;rbs_motif=GGA/GAG/AGG;rbs_spacer=11-12bp;gc_cont=0.333	WP_000876826.1 MULTISPECIES: IDEAL domain-containing protein [Staphylococcus]	100	98.6	3.63e-42
BAAHSY010000001.1_411|416634|417620|-1|ID=1_411;partial=00;start_type=ATG;rbs_motif=GGAG/GAGG;rbs_spacer=5-10bp;gc_cont=0.304	WP_000668820.1 MULTISPECIES: lipoate--protein ligase [Staphylococcus]	100	99.7	7.04e-235
BAAHSY010000001.1_412|417819|417995|1|ID=1_412;partial=00;start_type=ATG;rbs_motif=AGGAG;rbs_spacer=5-10bp;gc_cont=0.305	WP_000214898.1 MULTISPECIES: YkvS family protein [Bacteria]	100	98.3	8.10e-33
BAAHSY010000001.1_413|418010|418612|1|ID=1_413;partial=00;start_type=ATG;rbs_motif=GGA/GAG/AGG;rbs_spacer=5-10bp;gc_cont=0.274	WP_001033867.1 MULTISPECIES: CPBP family glutamic-type intramembrane protease [Staphylococcus]	100	99.5	2.18e-131
BAAHSY010000001.1_414|419956|421920|1|ID=1_414;partial=00;start_type=ATG;rbs_motif=GGAG/GAGG;rbs_spacer=5-10bp;gc_cont=0.268	WP_070598976.1 bacteriocin-associated integral membrane family protein [Staphylococcus aureus]	100	99.8	0.0
BAAHSY010000001.1_415|421923|422243|1|ID=1_415;partial=00;start_type=ATG;rbs_motif=AGGAG;rbs_spacer=5-10bp;gc_cont=0.302	WP_000668623.1 MULTISPECIES: YxeA family protein [Staphylococcus]	100	99.1	3.38e-67
BAAHSY010000001.1_416|422240|422881|1|ID=1_416;partial=00;start_type=ATG;rbs_motif=GGAG/GAGG;rbs_spacer=5-10bp;gc_cont=0.279	WP_000571178.1 MULTISPECIES: ABC transporter ATP-binding protein [Staphylococcus]	100	99.5	2.86e-147
BAAHSY010000001.1_417|423538|423825|1|ID=1_417;partial=00;start_type=ATG;rbs_motif=GGAG/GAGG;rbs_spacer=5-10bp;gc_cont=0.229	WP_000410720.1 MULTISPECIES: hypothetical protein [Bacillota]	100	99.0	1.58e-60
BAAHSY010000001.1_418|423831|425312|1|ID=1_418;partial=00;start_type=ATG;rbs_motif=AGGA;rbs_spacer=5-10bp;gc_cont=0.271	WP_000719184.1 MULTISPECIES: glycosyltransferase [Staphylococcus]	100	99.8	0.0
BAAHSY010000001.1_419|425401|425778|-1|ID=1_419;partial=00;start_type=ATG;rbs_motif=None;rbs_spacer=None;gc_cont=0.325	WP_000766009.1 MULTISPECIES: DoxX family protein [Staphylococcus]	100	93.7	5.61e-78
BAAHSY010000001.1_420|426234|427193|1|ID=1_420;partial=00;start_type=GTG;rbs_motif=GGAG/GAGG;rbs_spacer=5-10bp;gc_cont=0.340	WP_001081351.1 MULTISPECIES: ABC transporter substrate-binding protein [Staphylococcus]	100	99.7	3.54e-219
BAAHSY010000001.1_421|427239|427355|-1|ID=1_421;partial=00;start_type=ATG;rbs_motif=GGAG/GAGG;rbs_spacer=5-10bp;gc_cont=0.291	WP_001248716.1 SAR1012 family small protein [Staphylococcus aureus]	100	97.4	5.79e-18
BAAHSY010000001.1_422|427434|427649|-1|ID=1_422;partial=00;start_type=ATG;rbs_motif=AGGAG;rbs_spacer=5-10bp;gc_cont=0.269	WP_000867357.1 MULTISPECIES: TM2 domain-containing protein [Staphylococcus]	100	98.6	4.25e-45
BAAHSY010000001.1_423|427814|428365|1|ID=1_423;partial=00;start_type=GTG;rbs_motif=GGA/GAG/AGG;rbs_spacer=11-12bp;gc_cont=0.321	WP_000620953.1 MULTISPECIES: GNAT family N-acetyltransferase [Staphylococcus]	100	99.5	1.71e-131
BAAHSY010000001.1_424|428417|429355|-1|ID=1_424;partial=00;start_type=ATG;rbs_motif=AGGA/GGAG/GAGG;rbs_spacer=11-12bp;gc_cont=0.350	WP_000070966.1 MULTISPECIES: 1,4-dihydroxy-2-naphthoate polyprenyltransferase [Staphylococcus]	100	99.7	3.27e-216
BAAHSY010000001.1_425|429537|430898|1|ID=1_425;partial=00;start_type=ATG;rbs_motif=AGxAG;rbs_spacer=5-10bp;gc_cont=0.322	WP_000190608.1 isochorismate synthase [Staphylococcus aureus]	99.1	99.8	0.0
BAAHSY010000001.1_426|430885|432558|1|ID=1_426;partial=00;start_type=ATG;rbs_motif=AGGAG;rbs_spacer=5-10bp;gc_cont=0.340	WP_000526687.1 MULTISPECIES: 2-succinyl-5-enolpyruvyl-6-hydroxy-3-cyclohexene-1-carboxylic-acid synthase [Staphylococcus]	100	99.8	0.0
BAAHSY010000001.1_427|432545|433348|1|ID=1_427;partial=00;start_type=ATG;rbs_motif=GGA/GAG/AGG;rbs_spacer=11-12bp;gc_cont=0.327	WP_000150195.1 MULTISPECIES: 2-succinyl-6-hydroxy-2,4-cyclohexadiene-1-carboxylate synthase [Staphylococcus]	100	99.6	6.75e-191
BAAHSY010000001.1_428|433341|434162|1|ID=1_428;partial=00;start_type=ATG;rbs_motif=AGGAG;rbs_spacer=5-10bp;gc_cont=0.387	WP_000184947.1 MULTISPECIES: 1,4-dihydroxy-2-naphthoyl-CoA synthase [Staphylococcus]	100	99.6	7.34e-198
BAAHSY010000001.1_429|434401|434730|-1|ID=1_429;partial=00;start_type=ATG;rbs_motif=GGA/GAG/AGG;rbs_spacer=5-10bp;gc_cont=0.312	WP_000284457.1 MULTISPECIES: staphostatin B [Bacteria]	100	99.1	5.74e-74
BAAHSY010000001.1_430|434768|435949|-1|ID=1_430;partial=00;start_type=ATG;rbs_motif=GGAG/GAGG;rbs_spacer=5-10bp;gc_cont=0.305	WP_001088780.1 MULTISPECIES: cysteine protease staphopain B [Staphylococcus]	100	99.7	1.32e-281
BAAHSY010000001.1_431|436031|437041|-1|ID=1_431;partial=00;start_type=ATG;rbs_motif=GGAG/GAGG;rbs_spacer=5-10bp;gc_cont=0.369	WP_031844680.1 Glu-specific serine endopeptidase SspA [Staphylococcus aureus]	100	99.7	6.59e-196
BAAHSY010000001.1_432|437569|438723|-1|ID=1_432;partial=00;start_type=ATG;rbs_motif=GGAG/GAGG;rbs_spacer=5-10bp;gc_cont=0.319	WP_000777581.1 MULTISPECIES: aminotransferase class I/II-fold pyridoxal phosphate-dependent enzyme [Staphylococcus]	100	99.7	3.09e-280
BAAHSY010000001.1_433|438919|439929|-1|ID=1_433;partial=00;start_type=ATG;rbs_motif=AGGAG;rbs_spacer=5-10bp;gc_cont=0.271	WP_000202439.1 MULTISPECIES: acyltransferase family protein [Staphylococcus]	100	99.7	5.81e-238
BAAHSY010000001.1_434|440082|440501|1|ID=1_434;partial=00;start_type=ATG;rbs_motif=GGAG/GAGG;rbs_spacer=5-10bp;gc_cont=0.314	WP_000278010.1 MULTISPECIES: MarR family transcriptional regulator [Staphylococcus]	100	99.3	1.53e-90
BAAHSY010000001.1_435|440708|444499|-1|ID=1_435;partial=00;start_type=ATG;rbs_motif=None;rbs_spacer=None;gc_cont=0.349	WP_001074556.1 MULTISPECIES: bifunctional autolysin [Staphylococcus]	100	99.4	0.0
BAAHSY010000001.1_436|444706|445140|-1|ID=1_436;partial=00;start_type=ATG;rbs_motif=GGAG/GAGG;rbs_spacer=5-10bp;gc_cont=0.347	WP_000491986.1 MULTISPECIES: GNAT family N-acetyltransferase [Staphylococcus]	100	99.3	3.71e-98
BAAHSY010000001.1_437|445295|445765|-1|ID=1_437;partial=00;start_type=ATG;rbs_motif=AGGAG;rbs_spacer=5-10bp;gc_cont=0.310	WP_000088431.1 MULTISPECIES: osmotic stress response protein [Staphylococcus]	100	99.4	1.65e-109
BAAHSY010000001.1_438|445813|447030|-1|ID=1_438;partial=00;start_type=ATG;rbs_motif=AGGAG;rbs_spacer=5-10bp;gc_cont=0.326	WP_044124709.1 polyisoprenyl-teichoic acid--peptidoglycan teichoic acid transferase [Staphylococcus aureus]	97.3	99.8	1.25e-260
BAAHSY010000001.1_439|447481|448674|1|ID=1_439;partial=00;start_type=ATG;rbs_motif=GGAG/GAGG;rbs_spacer=5-10bp;gc_cont=0.283	WP_000671243.1 MULTISPECIES: teichoic acid D-Ala esterase FmtA [Staphylococcus]	100	99.7	3.85e-292
BAAHSY010000001.1_440|449211|449501|-1|ID=1_440;partial=00;start_type=ATG;rbs_motif=None;rbs_spacer=None;gc_cont=0.361	WP_103686395.1 cytochrome aa3 quinol oxidase subunit IV [Salmonella enterica]	99.0	99.0	3.30e-58
BAAHSY010000001.1_441|449498|450103|-1|ID=1_441;partial=00;start_type=ATG;rbs_motif=GGAG/GAGG;rbs_spacer=5-10bp;gc_cont=0.360	WP_000017736.1 MULTISPECIES: cytochrome aa3 quinol oxidase subunit III [Staphylococcus]	100	99.5	1.49e-143
BAAHSY010000001.1_442|450093|452081|-1|ID=1_442;partial=00;start_type=ATG;rbs_motif=GGAG/GAGG;rbs_spacer=5-10bp;gc_cont=0.368	WP_251355023.1 cytochrome aa3 quinol oxidase subunit I [Staphylococcus aureus]	100	99.8	0.0
BAAHSY010000001.1_443|452081|453181|-1|ID=1_443;partial=00;start_type=GTG;rbs_motif=AGGAG;rbs_spacer=5-10bp;gc_cont=0.342	WP_000032836.1 MULTISPECIES: cytochrome aa3 quinol oxidase subunit II [Staphylococcus]	100	99.7	2.11e-262
BAAHSY010000001.1_444|453753|454070|-1|ID=1_444;partial=00;start_type=ATG;rbs_motif=GGAG/GAGG;rbs_spacer=5-10bp;gc_cont=0.324	WP_001037831.1 MULTISPECIES: DUF5011 domain-containing protein [Staphylococcus]	100	99.1	4.29e-65
BAAHSY010000001.1_445|454875|455735|-1|ID=1_445;partial=00;start_type=ATG;rbs_motif=AGGAGG;rbs_spacer=5-10bp;gc_cont=0.341	WP_000225837.1 MULTISPECIES: bifunctional methylenetetrahydrofolate dehydrogenase/methenyltetrahydrofolate cyclohydrolase FolD [Staphylococcus]	100	99.7	9.96e-198
BAAHSY010000001.1_446|455936|456418|1|ID=1_446;partial=00;start_type=GTG;rbs_motif=GGA/GAG/AGG;rbs_spacer=5-10bp;gc_cont=0.383	WP_000861572.1 MULTISPECIES: 5-(carboxyamino)imidazole ribonucleotide mutase [Staphylococcus]	100	99.4	5.68e-103
BAAHSY010000001.1_447|456405|457529|1|ID=1_447;partial=00;start_type=ATG;rbs_motif=GGAG/GAGG;rbs_spacer=5-10bp;gc_cont=0.326	WP_001010412.1 MULTISPECIES: 5-(carboxyamino)imidazole ribonucleotide synthase [Staphylococcus]	100	99.7	2.81e-271
BAAHSY010000001.1_448|457533|458237|1|ID=1_448;partial=00;start_type=ATG;rbs_motif=GGAG/GAGG;rbs_spacer=5-10bp;gc_cont=0.289	WP_000174053.1 MULTISPECIES: phosphoribosylaminoimidazolesuccinocarboxamide synthase [Staphylococcus]	100	99.6	1.35e-160
BAAHSY010000001.1_449|458237|458500|1|ID=1_449;partial=00;start_type=ATG;rbs_motif=GGAG/GAGG;rbs_spacer=5-10bp;gc_cont=0.326	WP_000848350.1 MULTISPECIES: phosphoribosylformylglycinamidine synthase subunit PurS [Staphylococcus]	100	98.9	1.32e-53
BAAHSY010000001.1_450|458502|459173|1|ID=1_450;partial=00;start_type=ATG;rbs_motif=AGGAG;rbs_spacer=5-10bp;gc_cont=0.348	WP_000666799.1 MULTISPECIES: phosphoribosylformylglycinamidine synthase I [Staphylococcus]	100	99.6	6.75e-160
BAAHSY010000001.1_451|459166|461355|1|ID=1_451;partial=00;start_type=ATG;rbs_motif=GGAG/GAGG;rbs_spacer=5-10bp;gc_cont=0.352	WP_000032727.1 MULTISPECIES: phosphoribosylformylglycinamidine synthase subunit PurL [Staphylococcus]	100	99.9	0.0
BAAHSY010000001.1_452|461334|462818|1|ID=1_452;partial=00;start_type=ATG;rbs_motif=GGA/GAG/AGG;rbs_spacer=11-12bp;gc_cont=0.360	WP_000483713.1 MULTISPECIES: amidophosphoribosyltransferase [Staphylococcus]	100	99.8	0.0
BAAHSY010000001.1_453|462811|463839|1|ID=1_453;partial=00;start_type=ATG;rbs_motif=GGAG/GAGG;rbs_spacer=5-10bp;gc_cont=0.356	WP_000030812.1 MULTISPECIES: phosphoribosylformylglycinamidine cyclo-ligase [Staphylococcus]	100	99.7	2.59e-244
BAAHSY010000001.1_454|463842|464408|1|ID=1_454;partial=00;start_type=ATG;rbs_motif=None;rbs_spacer=None;gc_cont=0.325	WP_000238664.1 MULTISPECIES: phosphoribosylglycinamide formyltransferase [Staphylococcus]	100	99.5	1.02e-130
BAAHSY010000001.1_455|464423|465901|1|ID=1_455;partial=00;start_type=ATG;rbs_motif=AGGAG;rbs_spacer=5-10bp;gc_cont=0.346	WP_000709291.1 bifunctional phosphoribosylaminoimidazolecarboxamide formyltransferase/IMP cyclohydrolase [Staphylococcus aureus]	100	99.8	0.0
BAAHSY010000001.1_456|465923|467170|1|ID=1_456;partial=00;start_type=ATG;rbs_motif=GGA/GAG/AGG;rbs_spacer=11-12bp;gc_cont=0.357	WP_001101908.1 MULTISPECIES: phosphoribosylamine--glycine ligase [Staphylococcus]	100	99.8	4.10e-303
BAAHSY010000001.1_457|467435|468241|-1|ID=1_457;partial=00;start_type=ATG;rbs_motif=None;rbs_spacer=None;gc_cont=0.311	WP_000273253.1 MULTISPECIES: energy-coupling factor transporter transmembrane component T family protein [Staphylococcus]	100	99.6	4.09e-172
BAAHSY010000001.1_458|468234|469634|-1|ID=1_458;partial=00;start_type=GTG;rbs_motif=AGGAG;rbs_spacer=5-10bp;gc_cont=0.333	WP_000921968.1 MULTISPECIES: ABC transporter ATP-binding protein [Staphylococcus]	100	99.8	0.0
BAAHSY010000001.1_459|469649|470224|-1|ID=1_459;partial=00;start_type=ATG;rbs_motif=AGGAG;rbs_spacer=5-10bp;gc_cont=0.372	WP_000033477.1 MULTISPECIES: ECF transporter S component [Staphylococcus]	100	99.5	5.23e-130
BAAHSY010000001.1_460|470808|470942|-1|ID=1_460;partial=00;start_type=ATG;rbs_motif=GGAG/GAGG;rbs_spacer=5-10bp;gc_cont=0.230	WP_000064214.1 MULTISPECIES: glycopeptide resistance-associated protein GraF [Staphylococcus]	100	97.8	6.09e-09
BAAHSY010000001.1_461|471094|472389|1|ID=1_461;partial=00;start_type=ATG;rbs_motif=GGAG/GAGG;rbs_spacer=5-10bp;gc_cont=0.288	WP_103263402.1 lipoteichoic acid stability factor AuxA [Staphylococcus aureus]	100	99.8	8.14e-293
BAAHSY010000001.1_462|472814|473986|1|ID=1_462;partial=00;start_type=ATG;rbs_motif=AGGA;rbs_spacer=5-10bp;gc_cont=0.315	WP_000685079.1 MULTISPECIES: class I SAM-dependent rRNA methyltransferase [Staphylococcus]	100	99.7	1.13e-285
BAAHSY010000001.1_463|474040|474582|1|ID=1_463;partial=00;start_type=ATG;rbs_motif=AGxAGG/AGGxGG;rbs_spacer=11-12bp;gc_cont=0.306	WP_331369803.1 DUF697 domain-containing protein [Staphylococcus aureus]	99.4	99.4	5.29e-120
BAAHSY010000001.1_464|474736|475002|1|ID=1_464;partial=00;start_type=ATG;rbs_motif=AGGAG;rbs_spacer=5-10bp;gc_cont=0.348	WP_000437472.1 MULTISPECIES: phosphocarrier protein HPr [Staphylococcus]	100	98.9	2.01e-53
BAAHSY010000001.1_465|475005|476723|1|ID=1_465;partial=00;start_type=ATG;rbs_motif=None;rbs_spacer=None;gc_cont=0.353	WP_000040054.1 MULTISPECIES: phosphoenolpyruvate--protein phosphotransferase [Staphylococcus]	100	99.8	0.0
BAAHSY010000001.1_466|476960|477193|-1|ID=1_466;partial=00;start_type=ATG;rbs_motif=AGGAG;rbs_spacer=5-10bp;gc_cont=0.295	WP_001289614.1 MULTISPECIES: glutaredoxin-like protein NrdH [Staphylococcus]	100	98.7	3.59e-51
BAAHSY010000001.1_467|477391|478752|1|ID=1_467;partial=00;start_type=ATG;rbs_motif=GGA/GAG/AGG;rbs_spacer=11-12bp;gc_cont=0.340	WP_000381849.1 MULTISPECIES: cytochrome ubiquinol oxidase subunit I [Staphylococcus]	100	99.8	0.0
BAAHSY010000001.1_468|478749|479768|1|ID=1_468;partial=00;start_type=ATG;rbs_motif=AGGAG;rbs_spacer=5-10bp;gc_cont=0.305	WP_251355047.1 cytochrome d ubiquinol oxidase subunit II [Staphylococcus aureus]	100	99.7	1.73e-236
BAAHSY010000001.1_469|479901|480563|1|ID=1_469;partial=00;start_type=ATG;rbs_motif=GGAG/GAGG;rbs_spacer=5-10bp;gc_cont=0.351	WP_000514290.1 MULTISPECIES: potassium channel family protein [Staphylococcus]	100	99.5	4.37e-150
BAAHSY010000001.1_470|480912|482609|-1|ID=1_470;partial=00;start_type=ATG;rbs_motif=AGGA/GGAG/GAGG;rbs_spacer=11-12bp;gc_cont=0.337	WP_000811375.1 MULTISPECIES: ribonuclease J1 [Staphylococcus]	100	99.8	0.0
BAAHSY010000001.1_471|482609|482827|-1|ID=1_471;partial=00;start_type=ATG;rbs_motif=AGGAGG;rbs_spacer=5-10bp;gc_cont=0.320	WP_000257888.1 MULTISPECIES: DNA-dependent RNA polymerase subunit epsilon [Staphylococcus]	100	98.6	5.34e-44
BAAHSY010000001.1_472|483308|483859|-1|ID=1_472;partial=00;start_type=ATG;rbs_motif=GGA/GAG/AGG;rbs_spacer=5-10bp;gc_cont=0.351	WP_000957036.1 MULTISPECIES: peptide deformylase [Staphylococcus]	100	99.5	7.82e-128
BAAHSY010000001.1_473|484224|484850|1|ID=1_473;partial=00;start_type=ATG;rbs_motif=GGAG/GAGG;rbs_spacer=5-10bp;gc_cont=0.289	WP_000668339.1 MULTISPECIES: YkyA family protein [Staphylococcus]	100	99.5	5.94e-133
BAAHSY010000001.1_474|485021|486133|1|ID=1_474;partial=00;start_type=ATG;rbs_motif=None;rbs_spacer=None;gc_cont=0.373	WP_000035320.1 MULTISPECIES: pyruvate dehydrogenase (acetyl-transferring) E1 component subunit alpha [Staphylococcus]	100	99.7	4.78e-261
