BAAHSV010000001.1_239|260139|260273|-1|ID=1_239;partial=00;start_type=ATG;rbs_motif=GGAG/GAGG;rbs_spacer=5-10bp;gc_cont=0.393	WP_000147103.1 MULTISPECIES: beta-class phenol-soluble modulin [Staphylococcus]	100	97.8	7.47e-21
BAAHSV010000001.1_240|260330|260464|-1|ID=1_240;partial=00;start_type=ATG;rbs_motif=AGGAG;rbs_spacer=5-10bp;gc_cont=0.348	WP_000398672.1 MULTISPECIES: beta-class phenol-soluble modulin [Bacteria]	100	97.8	9.06e-22
BAAHSV010000001.1_241|261376|261564|-1|ID=1_241;partial=00;start_type=ATG;rbs_motif=AGxAGG/AGGxGG;rbs_spacer=5-10bp;gc_cont=0.280	WP_103254468.1 DNA-binding protein [Staphylococcus aureus]	98.4	98.4	2.61e-33
BAAHSV010000001.1_242|261813|262760|1|ID=1_242;partial=00;start_type=ATG;rbs_motif=GGA/GAG/AGG;rbs_spacer=5-10bp;gc_cont=0.315	WP_001239288.1 MULTISPECIES: TDT family transporter [Staphylococcus]	100	99.7	5.38e-212
BAAHSV010000001.1_243|263065|263292|-1|ID=1_243;partial=00;start_type=ATG;rbs_motif=AGGA;rbs_spacer=5-10bp;gc_cont=0.289	WP_000149423.1 MULTISPECIES: epilancin biosynthesis-related protein ElxI1 [Staphylococcus]	100	98.7	4.12e-47
BAAHSV010000001.1_244|263600|265156|-1|ID=1_244;partial=00;start_type=GTG;rbs_motif=AGGAG;rbs_spacer=5-10bp;gc_cont=0.359	WP_000432077.1 MULTISPECIES: YfcC family protein [Staphylococcus]	100	99.8	0.0
BAAHSV010000001.1_245|265328|266263|-1|ID=1_245;partial=00;start_type=ATG;rbs_motif=AGGA;rbs_spacer=5-10bp;gc_cont=0.334	WP_001074342.1 MULTISPECIES: carbamate kinase [Staphylococcus]	100	99.4	1.06e-218
BAAHSV010000001.1_246|266283|267284|-1|ID=1_246;partial=00;start_type=ATG;rbs_motif=AGGAG;rbs_spacer=5-10bp;gc_cont=0.337	WP_000793605.1 MULTISPECIES: ornithine carbamoyltransferase [Staphylococcus]	100	99.7	1.75e-242
BAAHSV010000001.1_247|267722|268447|1|ID=1_247;partial=00;start_type=ATG;rbs_motif=AGGAG;rbs_spacer=5-10bp;gc_cont=0.306	WP_000739523.1 MULTISPECIES: superantigen-like protein SSL14 [Staphylococcus]	100	99.6	1.79e-173
BAAHSV010000001.1_248|268542|269267|1|ID=1_248;partial=00;start_type=ATG;rbs_motif=AGGAG;rbs_spacer=5-10bp;gc_cont=0.293	WP_001063559.1 MULTISPECIES: superantigen-like protein SSL13 [Staphylococcus]	100	99.6	1.16e-169
BAAHSV010000001.1_249|269276|270091|1|ID=1_249;partial=00;start_type=ATG;rbs_motif=None;rbs_spacer=None;gc_cont=0.306	WP_000041896.1 MULTISPECIES: superantigen-like protein SSL12 [Staphylococcus]	100	87.5	2.67e-173
BAAHSV010000001.1_250|270223|270504|1|ID=1_250;partial=00;start_type=GTG;rbs_motif=GGAG/GAGG;rbs_spacer=5-10bp;gc_cont=0.358	WP_000136273.1 hypothetical protein [Staphylococcus aureus]	100	98.9	5.99e-64
BAAHSV010000001.1_251|270536|270733|-1|ID=1_251;partial=00;start_type=ATG;rbs_motif=GGA/GAG/AGG;rbs_spacer=5-10bp;gc_cont=0.278	WP_000137801.1 MULTISPECIES: hypothetical protein [Staphylococcus]	100	98.5	1.71e-37
BAAHSV010000001.1_252|270717|270863|-1|ID=1_252;partial=00;start_type=ATG;rbs_motif=GGA/GAG/AGG;rbs_spacer=5-10bp;gc_cont=0.238	WP_000765708.1 MULTISPECIES: hypothetical protein [Staphylococcus]	100	98.0	2.88e-22
BAAHSV010000001.1_253|271536|272495|1|ID=1_253;partial=00;start_type=ATG;rbs_motif=AGGA;rbs_spacer=5-10bp;gc_cont=0.341	WP_000857483.1 MULTISPECIES: alpha-hemolysin [Staphylococcus]	100	99.7	7.88e-232
BAAHSV010000001.1_254|272972|273205|1|ID=1_254;partial=00;start_type=ATG;rbs_motif=AGGAG;rbs_spacer=5-10bp;gc_cont=0.299	WP_000231632.1 MULTISPECIES: hypothetical protein [Staphylococcus]	100	98.7	2.44e-49
BAAHSV010000001.1_255|273827|274012|1|ID=1_255;partial=00;start_type=ATG;rbs_motif=AGGAG;rbs_spacer=5-10bp;gc_cont=0.280	WP_001032814.1 MULTISPECIES: hypothetical protein [Staphylococcus]	100	98.4	4.06e-32
BAAHSV010000001.1_256|274726|275076|-1|ID=1_256;partial=00;start_type=ATG;rbs_motif=AGGAG;rbs_spacer=5-10bp;gc_cont=0.285	WP_000669537.1 MULTISPECIES: complement inhibitor SCIN-B [Staphylococcus]	100	99.1	5.57e-73
BAAHSV010000001.1_257|275230|275727|-1|ID=1_257;partial=00;start_type=ATG;rbs_motif=GGAG/GAGG;rbs_spacer=5-10bp;gc_cont=0.313	WP_182079840.1 complement convertase inhibitor Efb [Staphylococcus aureus]	100	99.4	3.71e-90
BAAHSV010000001.1_258|275986|276492|-1|ID=1_258;partial=00;start_type=ATG;rbs_motif=GGAG/GAGG;rbs_spacer=5-10bp;gc_cont=0.270	WP_000584398.1 MULTISPECIES: SA1002 family membrane protein [Staphylococcus]	100	99.4	2.09e-102
BAAHSV010000001.1_259|277164|277565|1|ID=1_259;partial=00;start_type=ATG;rbs_motif=GGAG/GAGG;rbs_spacer=5-10bp;gc_cont=0.311	WP_000739563.1 MULTISPECIES: FPRL1 inhibitory protein FLIPr [Staphylococcus]	100	99.3	1.90e-88
BAAHSV010000001.1_260|277934|278263|-1|ID=1_260;partial=00;start_type=ATG;rbs_motif=GGA/GAG/AGG;rbs_spacer=11-12bp;gc_cont=0.285	WP_000739209.1 MULTISPECIES: complement convertase inhibitor Ecb [Staphylococcus]	100	99.1	1.65e-64
BAAHSV010000001.1_261|278457|278624|-1|ID=1_261;partial=00;start_type=ATG;rbs_motif=None;rbs_spacer=None;gc_cont=0.232	WP_001791787.1 MULTISPECIES: hypothetical protein [Staphylococcus]	100	98.2	2.52e-28
BAAHSV010000001.1_262|278752|279255|-1|ID=1_262;partial=00;start_type=ATG;rbs_motif=GGA/GAG/AGG;rbs_spacer=5-10bp;gc_cont=0.313	WP_000049484.1 MULTISPECIES: YfcE family phosphodiesterase [Staphylococcus]	100	99.4	4.13e-122
BAAHSV010000001.1_263|279248|279835|-1|ID=1_263;partial=00;start_type=ATG;rbs_motif=AGGAG;rbs_spacer=5-10bp;gc_cont=0.328	WP_000659317.1 MULTISPECIES: XTP/dITP diphosphatase [Staphylococcus]	100	99.5	5.64e-136
BAAHSV010000001.1_264|279847|280647|-1|ID=1_264;partial=00;start_type=ATG;rbs_motif=AGGA;rbs_spacer=5-10bp;gc_cont=0.365	WP_001039659.1 MULTISPECIES: glutamate racemase [Staphylococcus]	100	99.6	1.87e-192
BAAHSV010000001.1_265|280883|281698|-1|ID=1_265;partial=00;start_type=ATG;rbs_motif=AGxAGG/AGGxGG;rbs_spacer=5-10bp;gc_cont=0.353	WP_000139712.1 MULTISPECIES: succinate dehydrogenase iron-sulfur subunit [Staphylococcus]	100	99.6	6.55e-200
BAAHSV010000001.1_266|281698|283464|-1|ID=1_266;partial=00;start_type=ATG;rbs_motif=GGAG/GAGG;rbs_spacer=5-10bp;gc_cont=0.385	WP_000818278.1 MULTISPECIES: succinate dehydrogenase flavoprotein subunit [Staphylococcus]	100	99.8	0.0
BAAHSV010000001.1_267|283516|284130|-1|ID=1_267;partial=00;start_type=TTG;rbs_motif=GGA/GAG/AGG;rbs_spacer=5-10bp;gc_cont=0.319	WP_000079317.1 MULTISPECIES: succinate dehydrogenase cytochrome b558 subunit [Staphylococcus]	100	99.5	7.65e-143
BAAHSV010000001.1_268|284454|286235|-1|ID=1_268;partial=00;start_type=TTG;rbs_motif=GGA/GAG/AGG;rbs_spacer=5-10bp;gc_cont=0.332	WP_000390529.1 MULTISPECIES: excinuclease ABC subunit UvrC [Staphylococcus]	100	99.8	0.0
BAAHSV010000001.1_269|286559|286873|-1|ID=1_269;partial=00;start_type=ATG;rbs_motif=AGGAGG;rbs_spacer=5-10bp;gc_cont=0.340	WP_001018928.1 MULTISPECIES: thioredoxin [Bacteria]	100	99.0	3.68e-70
BAAHSV010000001.1_270|287046|289394|-1|ID=1_270;partial=00;start_type=ATG;rbs_motif=GGAG/GAGG;rbs_spacer=5-10bp;gc_cont=0.330	WP_001249285.1 MULTISPECIES: endonuclease MutS2 [Staphylococcus]	100	99.9	0.0
BAAHSV010000001.1_271|289404|291116|-1|ID=1_271;partial=00;start_type=ATG;rbs_motif=GGAG/GAGG;rbs_spacer=5-10bp;gc_cont=0.326	WP_000161942.1 MULTISPECIES: DNA polymerase/3'-5' exonuclease PolX [Staphylococcus]	100	99.8	0.0
BAAHSV010000001.1_272|291189|291710|-1|ID=1_272;partial=00;start_type=ATG;rbs_motif=GGA/GAG/AGG;rbs_spacer=5-10bp;gc_cont=0.285	WP_000234068.1 MULTISPECIES: CvpA family protein [Staphylococcus]	100	99.4	2.96e-109
BAAHSV010000001.1_273|291711|291977|-1|ID=1_273;partial=00;start_type=ATG;rbs_motif=AGGAG;rbs_spacer=5-10bp;gc_cont=0.322	WP_000046704.1 cell division protein ZapA [Enterobacter hormaechei]	98.9	98.9	1.93e-51
BAAHSV010000001.1_274|292347|293285|1|ID=1_274;partial=00;start_type=ATG;rbs_motif=AGGA;rbs_spacer=5-10bp;gc_cont=0.334	WP_001284258.1 MULTISPECIES: ribonuclease HIII [Staphylococcus]	100	99.7	9.77e-218
BAAHSV010000001.1_275|293456|295858|-1|ID=1_275;partial=00;start_type=ATG;rbs_motif=GGAG/GAGG;rbs_spacer=5-10bp;gc_cont=0.348	WP_000908981.1 phenylalanine--tRNA ligase subunit beta [Staphylococcus aureus]	100	99.9	0.0
BAAHSV010000001.1_276|295858|296916|-1|ID=1_276;partial=00;start_type=ATG;rbs_motif=GGAG/GAGG;rbs_spacer=5-10bp;gc_cont=0.345	WP_000003559.1 MULTISPECIES: phenylalanine--tRNA ligase subunit alpha [Staphylococcus]	100	99.7	2.53e-256
BAAHSV010000001.1_277|297297|298037|-1|ID=1_277;partial=00;start_type=ATG;rbs_motif=AGGAG;rbs_spacer=5-10bp;gc_cont=0.352	WP_000435374.1 MULTISPECIES: TrmH family RNA methyltransferase [Staphylococcus]	100	99.6	8.09e-168
BAAHSV010000001.1_278|298421|298744|-1|ID=1_278;partial=00;start_type=ATG;rbs_motif=GGAG/GAGG;rbs_spacer=5-10bp;gc_cont=0.306	WP_000670950.1 MULTISPECIES: staphylobilin-forming heme oxygenase IsdG [Staphylococcus]	100	99.1	6.77e-72
BAAHSV010000001.1_279|298763|299497|-1|ID=1_279;partial=00;start_type=ATG;rbs_motif=GGAG/GAGG;rbs_spacer=5-10bp;gc_cont=0.271	WP_001242429.1 MULTISPECIES: class B sortase [Staphylococcus]	100	99.6	4.01e-167
BAAHSV010000001.1_280|299559|300527|-1|ID=1_280;partial=00;start_type=ATG;rbs_motif=GGA/GAG/AGG;rbs_spacer=5-10bp;gc_cont=0.326	WP_000594530.1 MULTISPECIES: hemin ABC transporter permease protein IsdF [Staphylococcus]	100	99.4	6.69e-207
BAAHSV010000001.1_281|300537|301415|-1|ID=1_281;partial=00;start_type=TTG;rbs_motif=GGAG/GAGG;rbs_spacer=5-10bp;gc_cont=0.311	WP_001220199.1 MULTISPECIES: heme ABC transporter substrate-binding protein IsdE [Staphylococcus]	100	99.7	5.16e-203
BAAHSV010000001.1_282|301412|302488|-1|ID=1_282;partial=00;start_type=ATG;rbs_motif=GGA/GAG/AGG;rbs_spacer=11-12bp;gc_cont=0.286	WP_001246698.1 MULTISPECIES: iron-regulated surface determinant protein IsdD [Staphylococcus]	100	99.7	6.74e-223
BAAHSV010000001.1_283|302488|303171|-1|ID=1_283;partial=00;start_type=TTG;rbs_motif=AGGAG;rbs_spacer=5-10bp;gc_cont=0.320	WP_000789821.1 MULTISPECIES: heme uptake protein IsdC [Staphylococcus]	100	99.6	3.40e-146
BAAHSV010000001.1_284|303380|304432|1|ID=1_284;partial=00;start_type=ATG;rbs_motif=AGGAG;rbs_spacer=5-10bp;gc_cont=0.335	WP_047212354.1 LPXTG-anchored heme-scavenging protein IsdA [Staphylococcus aureus]	93.4	99.7	2.20e-201
BAAHSV010000001.1_285|304635|306572|1|ID=1_285;partial=00;start_type=ATG;rbs_motif=AGGAG(G)/GGAGG;rbs_spacer=13-15bp;gc_cont=0.326	WP_368409452.1 heme uptake protein IsdB [Staphylococcus aureus]	99.7	99.8	0.0
BAAHSV010000001.1_286|306726|306899|-1|ID=1_286;partial=00;start_type=ATG;rbs_motif=AGGAG;rbs_spacer=5-10bp;gc_cont=0.374	WP_000290472.1 MULTISPECIES: 50S ribosomal protein L32 [Bacilli]	100	98.3	9.49e-36
BAAHSV010000001.1_287|306979|307536|-1|ID=1_287;partial=00;start_type=ATG;rbs_motif=GGAG/GAGG;rbs_spacer=5-10bp;gc_cont=0.339	WP_000872158.1 MULTISPECIES: YceD family protein [Staphylococcus]	100	99.5	1.76e-125
BAAHSV010000001.1_288|307663|308802|1|ID=1_288;partial=00;start_type=ATG;rbs_motif=AGGA;rbs_spacer=5-10bp;gc_cont=0.322	WP_000843611.1 MULTISPECIES: nucleotidyltransferase [Staphylococcus]	100	99.7	1.19e-270
BAAHSV010000001.1_289|308864|309346|-1|ID=1_289;partial=00;start_type=ATG;rbs_motif=GGAG/GAGG;rbs_spacer=5-10bp;gc_cont=0.311	WP_000401377.1 MULTISPECIES: pantetheine-phosphate adenylyltransferase [Staphylococcus]	100	99.4	1.84e-108
BAAHSV010000001.1_290|309348|309890|-1|ID=1_290;partial=00;start_type=ATG;rbs_motif=GGA/GAG/AGG;rbs_spacer=11-12bp;gc_cont=0.317	WP_001263796.1 MULTISPECIES: 16S rRNA (guanine(966)-N(2))-methyltransferase RsmD [Staphylococcus]	100	99.4	8.15e-124
BAAHSV010000001.1_291|309960|310349|1|ID=1_291;partial=00;start_type=ATG;rbs_motif=AGGA/GGAG/GAGG;rbs_spacer=11-12bp;gc_cont=0.297	WP_000814565.1 MULTISPECIES: DUF7147 family protein [Staphylococcus]	100	99.2	1.25e-91
BAAHSV010000001.1_292|310352|310606|-1|ID=1_292;partial=00;start_type=ATG;rbs_motif=GGAG/GAGG;rbs_spacer=5-10bp;gc_cont=0.271	WP_001049150.1 MULTISPECIES: YlbG family protein [Staphylococcus]	100	98.8	1.51e-53
BAAHSV010000001.1_293|310845|311771|1|ID=1_293;partial=00;start_type=ATG;rbs_motif=AGGAG;rbs_spacer=5-10bp;gc_cont=0.358	WP_251355038.1 glycerophosphodiester phosphodiesterase [Staphylococcus aureus]	100	99.7	1.35e-222
BAAHSV010000001.1_294|311834|312268|-1|ID=1_294;partial=00;start_type=ATG;rbs_motif=GGAG/GAGG;rbs_spacer=5-10bp;gc_cont=0.347	WP_000606480.1 MULTISPECIES: YlbF family regulator [Staphylococcus]	100	99.3	8.41e-95
BAAHSV010000001.1_295|312284|313321|-1|ID=1_295;partial=00;start_type=ATG;rbs_motif=GGA/GAG/AGG;rbs_spacer=5-10bp;gc_cont=0.303	WP_000733409.1 MULTISPECIES: CAP-associated domain-containing protein [Staphylococcus]	100	99.7	2.80e-245
BAAHSV010000001.1_296|313648|314109|-1|ID=1_296;partial=00;start_type=ATG;rbs_motif=AGGA;rbs_spacer=5-10bp;gc_cont=0.325	WP_000538766.1 MULTISPECIES: DUF420 domain-containing protein [Staphylococcus]	100	99.4	3.49e-105
BAAHSV010000001.1_297|314134|315045|-1|ID=1_297;partial=00;start_type=ATG;rbs_motif=AGGAG;rbs_spacer=5-10bp;gc_cont=0.321	WP_000031401.1 MULTISPECIES: heme o synthase [Staphylococcus]	100	99.7	1.29e-197
BAAHSV010000001.1_298|315326|316396|1|ID=1_298;partial=00;start_type=ATG;rbs_motif=None;rbs_spacer=None;gc_cont=0.335	WP_001548380.1 COX15/CtaA family protein [Staphylococcus aureus]	100	99.7	3.71e-251
BAAHSV010000001.1_299|316536|319988|-1|ID=1_299;partial=00;start_type=TTG;rbs_motif=AGGAG;rbs_spacer=5-10bp;gc_cont=0.354	WP_000809526.1 MULTISPECIES: pyruvate carboxylase [Staphylococcus]	100	99.9	0.0
BAAHSV010000001.1_300|320542|321768|-1|ID=1_300;partial=00;start_type=ATG;rbs_motif=GGA/GAG/AGG;rbs_spacer=11-12bp;gc_cont=0.313	WP_000787940.1 MULTISPECIES: cell division peptidoglycan polymerase FtsW [Staphylococcus]	100	99.8	8.77e-274
BAAHSV010000001.1_301|322082|322357|-1|ID=1_301;partial=00;start_type=ATG;rbs_motif=GGAG/GAGG;rbs_spacer=5-10bp;gc_cont=0.319	WP_001118417.1 MULTISPECIES: YlaN family protein [Staphylococcus]	100	98.9	1.82e-55
BAAHSV010000001.1_302|322498|322980|1|ID=1_302;partial=00;start_type=ATG;rbs_motif=GGAG/GAGG;rbs_spacer=5-10bp;gc_cont=0.319	WP_000614712.1 MULTISPECIES: hypothetical protein [Staphylococcus]	100	99.4	7.22e-115
BAAHSV010000001.1_303|323289|325136|-1|ID=1_303;partial=00;start_type=ATG;rbs_motif=AGGA;rbs_spacer=5-10bp;gc_cont=0.352	WP_000182654.1 MULTISPECIES: translational GTPase TypA [Staphylococcus]	100	99.8	0.0
BAAHSV010000001.1_304|325238|325429|1|ID=1_304;partial=00;start_type=ATG;rbs_motif=GGA/GAG/AGG;rbs_spacer=5-10bp;gc_cont=0.266	WP_000810620.1 MULTISPECIES: DUF5325 family protein [Staphylococcus]	100	98.4	4.12e-35
BAAHSV010000001.1_305|325583|326428|-1|ID=1_305;partial=00;start_type=ATG;rbs_motif=None;rbs_spacer=None;gc_cont=0.348	WP_001240311.1 MULTISPECIES: inositol monophosphatase family protein [Staphylococcus]	100	97.5	1.62e-199
BAAHSV010000001.1_306|326567|327181|1|ID=1_306;partial=00;start_type=ATG;rbs_motif=AGGAG;rbs_spacer=5-10bp;gc_cont=0.330	WP_000170610.1 MULTISPECIES: YktB family protein [Staphylococcus]	100	99.5	2.04e-147
BAAHSV010000001.1_307|327365|328717|1|ID=1_307;partial=00;start_type=ATG;rbs_motif=GGAG/GAGG;rbs_spacer=5-10bp;gc_cont=0.319	WP_103263401.1 Nramp family divalent metal transporter [Staphylococcus aureus]	100	99.8	1.62e-304
BAAHSV010000001.1_308|328799|329218|-1|ID=1_308;partial=00;start_type=ATG;rbs_motif=AGGA;rbs_spacer=5-10bp;gc_cont=0.295	WP_001080462.1 MULTISPECIES: DUF4064 domain-containing protein [Staphylococcus]	100	99.3	7.54e-82
BAAHSV010000001.1_309|329501|330520|-1|ID=1_309;partial=00;start_type=ATG;rbs_motif=AGGAG;rbs_spacer=5-10bp;gc_cont=0.318	WP_000145497.1 MULTISPECIES: lipoteichoic acid stability factor AuxB [Staphylococcus]	95.9	99.7	3.43e-174
BAAHSV010000001.1_310|330594|331667|-1|ID=1_310;partial=00;start_type=ATG;rbs_motif=GGAG/GAGG;rbs_spacer=5-10bp;gc_cont=0.316	WP_000819690.1 MULTISPECIES: ABC transporter substrate-binding protein [Staphylococcus]	100	99.7	3.64e-263
BAAHSV010000001.1_311|331667|332476|-1|ID=1_311;partial=00;start_type=ATG;rbs_motif=GGAG/GAGG;rbs_spacer=5-10bp;gc_cont=0.302	WP_000872390.1 MULTISPECIES: ABC transporter permease [Staphylococcus]	100	99.6	3.39e-176
BAAHSV010000001.1_312|332482|333279|-1|ID=1_312;partial=00;start_type=ATG;rbs_motif=GGAG/GAGG;rbs_spacer=5-10bp;gc_cont=0.272	WP_001246561.1 MULTISPECIES: ABC transporter permease [Staphylococcus]	100	99.6	1.06e-177
BAAHSV010000001.1_313|333272|334366|-1|ID=1_313;partial=00;start_type=TTG;rbs_motif=GGA/GAG/AGG;rbs_spacer=5-10bp;gc_cont=0.310	WP_000433551.1 MULTISPECIES: ABC transporter ATP-binding protein [Staphylococcus]	100	99.7	2.99e-261
BAAHSV010000001.1_314|334379|334918|-1|ID=1_314;partial=00;start_type=ATG;rbs_motif=GGA/GAG/AGG;rbs_spacer=5-10bp;gc_cont=0.298	WP_001020625.1 MULTISPECIES: helix-turn-helix domain-containing protein [Staphylococcus]	100	99.4	2.96e-121
BAAHSV010000001.1_315|335062|335337|-1|ID=1_315;partial=00;start_type=ATG;rbs_motif=GGAG/GAGG;rbs_spacer=5-10bp;gc_cont=0.326	WP_000455597.1 MULTISPECIES: UPF0223 family protein [Staphylococcus]	100	98.9	1.96e-59
BAAHSV010000001.1_316|335505|336911|-1|ID=1_316;partial=00;start_type=ATG;rbs_motif=GGAG/GAGG;rbs_spacer=5-10bp;gc_cont=0.370	WP_000260118.1 dihydrolipoyl dehydrogenase [Staphylococcus aureus]	100	99.8	0.0
BAAHSV010000001.1_317|336915|338207|-1|ID=1_317;partial=00;start_type=GTG;rbs_motif=AGGAG;rbs_spacer=5-10bp;gc_cont=0.378	WP_000863440.1 MULTISPECIES: dihydrolipoamide acetyltransferase family protein [Staphylococcus]	100	99.8	3.49e-298
BAAHSV010000001.1_318|338298|339275|-1|ID=1_318;partial=00;start_type=ATG;rbs_motif=AGGA/GGAG/GAGG;rbs_spacer=11-12bp;gc_cont=0.387	WP_000068176.1 MULTISPECIES: alpha-ketoacid dehydrogenase subunit beta [Staphylococcus]	100	99.7	5.26e-224
BAAHSV010000001.1_319|339279|340391|-1|ID=1_319;partial=00;start_type=ATG;rbs_motif=None;rbs_spacer=None;gc_cont=0.373	WP_000035320.1 MULTISPECIES: pyruvate dehydrogenase (acetyl-transferring) E1 component subunit alpha [Staphylococcus]	100	99.7	4.78e-261
BAAHSV010000001.1_320|340562|341188|-1|ID=1_320;partial=00;start_type=ATG;rbs_motif=GGAG/GAGG;rbs_spacer=5-10bp;gc_cont=0.289	WP_000668339.1 MULTISPECIES: YkyA family protein [Staphylococcus]	100	99.5	5.94e-133
BAAHSV010000001.1_321|341553|342104|1|ID=1_321;partial=00;start_type=ATG;rbs_motif=GGA/GAG/AGG;rbs_spacer=5-10bp;gc_cont=0.351	WP_000957036.1 MULTISPECIES: peptide deformylase [Staphylococcus]	100	99.5	7.82e-128
BAAHSV010000001.1_322|342585|342803|1|ID=1_322;partial=00;start_type=ATG;rbs_motif=AGGAGG;rbs_spacer=5-10bp;gc_cont=0.315	WP_000257888.1 MULTISPECIES: DNA-dependent RNA polymerase subunit epsilon [Staphylococcus]	100	98.6	5.34e-44
BAAHSV010000001.1_323|342803|344500|1|ID=1_323;partial=00;start_type=ATG;rbs_motif=AGGA/GGAG/GAGG;rbs_spacer=11-12bp;gc_cont=0.337	WP_000811375.1 MULTISPECIES: ribonuclease J1 [Staphylococcus]	100	99.8	0.0
BAAHSV010000001.1_324|344849|345511|-1|ID=1_324;partial=00;start_type=ATG;rbs_motif=GGAG/GAGG;rbs_spacer=5-10bp;gc_cont=0.351	WP_000514290.1 MULTISPECIES: potassium channel family protein [Staphylococcus]	100	99.5	4.37e-150
BAAHSV010000001.1_325|345644|346663|-1|ID=1_325;partial=00;start_type=ATG;rbs_motif=AGGAG;rbs_spacer=5-10bp;gc_cont=0.304	WP_251355047.1 cytochrome d ubiquinol oxidase subunit II [Staphylococcus aureus]	100	99.7	1.73e-236
BAAHSV010000001.1_326|346660|348021|-1|ID=1_326;partial=00;start_type=ATG;rbs_motif=GGA/GAG/AGG;rbs_spacer=11-12bp;gc_cont=0.340	WP_000381849.1 MULTISPECIES: cytochrome ubiquinol oxidase subunit I [Staphylococcus]	100	99.8	0.0
BAAHSV010000001.1_327|348219|348452|1|ID=1_327;partial=00;start_type=ATG;rbs_motif=AGGAG;rbs_spacer=5-10bp;gc_cont=0.291	WP_001289614.1 MULTISPECIES: glutaredoxin-like protein NrdH [Staphylococcus]	100	98.7	3.59e-51
BAAHSV010000001.1_328|348689|350407|-1|ID=1_328;partial=00;start_type=ATG;rbs_motif=None;rbs_spacer=None;gc_cont=0.354	WP_000040054.1 MULTISPECIES: phosphoenolpyruvate--protein phosphotransferase [Staphylococcus]	100	99.8	0.0
BAAHSV010000001.1_329|350410|350676|-1|ID=1_329;partial=00;start_type=ATG;rbs_motif=AGGAG;rbs_spacer=5-10bp;gc_cont=0.348	WP_000437472.1 MULTISPECIES: phosphocarrier protein HPr [Staphylococcus]	100	98.9	2.01e-53
BAAHSV010000001.1_330|350830|351372|-1|ID=1_330;partial=00;start_type=ATG;rbs_motif=AGxAGG/AGGxGG;rbs_spacer=11-12bp;gc_cont=0.304	WP_331369803.1 DUF697 domain-containing protein [Staphylococcus aureus]	99.4	99.4	5.29e-120
BAAHSV010000001.1_331|351426|352598|-1|ID=1_331;partial=00;start_type=ATG;rbs_motif=AGGA;rbs_spacer=5-10bp;gc_cont=0.315	WP_000685079.1 MULTISPECIES: class I SAM-dependent rRNA methyltransferase [Staphylococcus]	100	99.7	1.13e-285
BAAHSV010000001.1_332|353023|354318|-1|ID=1_332;partial=00;start_type=ATG;rbs_motif=GGAG/GAGG;rbs_spacer=5-10bp;gc_cont=0.287	WP_103263402.1 lipoteichoic acid stability factor AuxA [Staphylococcus aureus]	100	99.8	8.14e-293
BAAHSV010000001.1_333|354470|354604|1|ID=1_333;partial=00;start_type=ATG;rbs_motif=GGAG/GAGG;rbs_spacer=5-10bp;gc_cont=0.222	WP_000064214.1 MULTISPECIES: glycopeptide resistance-associated protein GraF [Staphylococcus]	100	97.8	6.09e-09
BAAHSV010000001.1_334|355188|355763|1|ID=1_334;partial=00;start_type=ATG;rbs_motif=AGGAG;rbs_spacer=5-10bp;gc_cont=0.372	WP_000033477.1 MULTISPECIES: ECF transporter S component [Staphylococcus]	100	99.5	5.23e-130
BAAHSV010000001.1_335|355778|357178|1|ID=1_335;partial=00;start_type=GTG;rbs_motif=AGGAG;rbs_spacer=5-10bp;gc_cont=0.333	WP_000921968.1 MULTISPECIES: ABC transporter ATP-binding protein [Staphylococcus]	100	99.8	0.0
BAAHSV010000001.1_336|357171|357977|1|ID=1_336;partial=00;start_type=ATG;rbs_motif=None;rbs_spacer=None;gc_cont=0.311	WP_000273253.1 MULTISPECIES: energy-coupling factor transporter transmembrane component T family protein [Staphylococcus]	100	99.6	4.09e-172
BAAHSV010000001.1_337|358242|359489|-1|ID=1_337;partial=00;start_type=ATG;rbs_motif=GGA/GAG/AGG;rbs_spacer=11-12bp;gc_cont=0.357	WP_001101908.1 MULTISPECIES: phosphoribosylamine--glycine ligase [Staphylococcus]	100	99.8	4.10e-303
BAAHSV010000001.1_338|359511|360989|-1|ID=1_338;partial=00;start_type=ATG;rbs_motif=AGGAG;rbs_spacer=5-10bp;gc_cont=0.346	WP_000709291.1 bifunctional phosphoribosylaminoimidazolecarboxamide formyltransferase/IMP cyclohydrolase [Staphylococcus aureus]	100	99.8	0.0
BAAHSV010000001.1_339|361004|361570|-1|ID=1_339;partial=00;start_type=ATG;rbs_motif=None;rbs_spacer=None;gc_cont=0.326	WP_000238664.1 MULTISPECIES: phosphoribosylglycinamide formyltransferase [Staphylococcus]	100	99.5	1.02e-130
BAAHSV010000001.1_340|361573|362601|-1|ID=1_340;partial=00;start_type=ATG;rbs_motif=GGAG/GAGG;rbs_spacer=5-10bp;gc_cont=0.356	WP_000030812.1 MULTISPECIES: phosphoribosylformylglycinamidine cyclo-ligase [Staphylococcus]	100	99.7	2.59e-244
BAAHSV010000001.1_341|362594|364078|-1|ID=1_341;partial=00;start_type=ATG;rbs_motif=GGA/GAG/AGG;rbs_spacer=11-12bp;gc_cont=0.360	WP_000483713.1 MULTISPECIES: amidophosphoribosyltransferase [Staphylococcus]	100	99.8	0.0
BAAHSV010000001.1_342|364057|366246|-1|ID=1_342;partial=00;start_type=ATG;rbs_motif=GGAG/GAGG;rbs_spacer=5-10bp;gc_cont=0.352	WP_000032727.1 MULTISPECIES: phosphoribosylformylglycinamidine synthase subunit PurL [Staphylococcus]	100	99.9	0.0
BAAHSV010000001.1_343|366239|366910|-1|ID=1_343;partial=00;start_type=ATG;rbs_motif=AGGAG;rbs_spacer=5-10bp;gc_cont=0.347	WP_000666799.1 MULTISPECIES: phosphoribosylformylglycinamidine synthase I [Staphylococcus]	100	99.6	6.75e-160
BAAHSV010000001.1_344|366912|367175|-1|ID=1_344;partial=00;start_type=ATG;rbs_motif=GGAG/GAGG;rbs_spacer=5-10bp;gc_cont=0.322	WP_000848350.1 MULTISPECIES: phosphoribosylformylglycinamidine synthase subunit PurS [Staphylococcus]	100	98.9	1.32e-53
BAAHSV010000001.1_345|367175|367879|-1|ID=1_345;partial=00;start_type=ATG;rbs_motif=GGAG/GAGG;rbs_spacer=5-10bp;gc_cont=0.292	WP_000174053.1 MULTISPECIES: phosphoribosylaminoimidazolesuccinocarboxamide synthase [Staphylococcus]	100	99.6	1.35e-160
BAAHSV010000001.1_346|367883|369007|-1|ID=1_346;partial=00;start_type=ATG;rbs_motif=GGAG/GAGG;rbs_spacer=5-10bp;gc_cont=0.326	WP_001010412.1 MULTISPECIES: 5-(carboxyamino)imidazole ribonucleotide synthase [Staphylococcus]	100	99.7	2.81e-271
BAAHSV010000001.1_347|368994|369476|-1|ID=1_347;partial=00;start_type=GTG;rbs_motif=GGA/GAG/AGG;rbs_spacer=5-10bp;gc_cont=0.383	WP_000861572.1 MULTISPECIES: 5-(carboxyamino)imidazole ribonucleotide mutase [Staphylococcus]	100	99.4	5.68e-103
BAAHSV010000001.1_348|369677|370537|1|ID=1_348;partial=00;start_type=ATG;rbs_motif=AGGAGG;rbs_spacer=5-10bp;gc_cont=0.344	WP_000225837.1 MULTISPECIES: bifunctional methylenetetrahydrofolate dehydrogenase/methenyltetrahydrofolate cyclohydrolase FolD [Staphylococcus]	100	99.7	9.96e-198
BAAHSV010000001.1_349|371342|371659|1|ID=1_349;partial=00;start_type=ATG;rbs_motif=GGAG/GAGG;rbs_spacer=5-10bp;gc_cont=0.324	WP_001037831.1 MULTISPECIES: DUF5011 domain-containing protein [Staphylococcus]	100	99.1	4.29e-65
BAAHSV010000001.1_350|372231|373331|1|ID=1_350;partial=00;start_type=GTG;rbs_motif=AGGAG;rbs_spacer=5-10bp;gc_cont=0.342	WP_000032836.1 MULTISPECIES: cytochrome aa3 quinol oxidase subunit II [Staphylococcus]	100	99.7	2.11e-262
BAAHSV010000001.1_351|373331|375319|1|ID=1_351;partial=00;start_type=ATG;rbs_motif=GGAG/GAGG;rbs_spacer=5-10bp;gc_cont=0.369	WP_251355023.1 cytochrome aa3 quinol oxidase subunit I [Staphylococcus aureus]	100	99.8	0.0
BAAHSV010000001.1_352|375309|375914|1|ID=1_352;partial=00;start_type=ATG;rbs_motif=GGAG/GAGG;rbs_spacer=5-10bp;gc_cont=0.360	WP_000017736.1 MULTISPECIES: cytochrome aa3 quinol oxidase subunit III [Staphylococcus]	100	99.5	1.49e-143
BAAHSV010000001.1_353|375911|376201|1|ID=1_353;partial=00;start_type=ATG;rbs_motif=None;rbs_spacer=None;gc_cont=0.354	WP_103686395.1 cytochrome aa3 quinol oxidase subunit IV [Salmonella enterica]	99.0	99.0	3.30e-58
BAAHSV010000001.1_354|376738|377931|-1|ID=1_354;partial=00;start_type=ATG;rbs_motif=GGAG/GAGG;rbs_spacer=5-10bp;gc_cont=0.283	WP_000671243.1 MULTISPECIES: teichoic acid D-Ala esterase FmtA [Staphylococcus]	100	99.7	3.85e-292
BAAHSV010000001.1_355|378382|379599|1|ID=1_355;partial=00;start_type=ATG;rbs_motif=AGGAG;rbs_spacer=5-10bp;gc_cont=0.325	WP_044124709.1 polyisoprenyl-teichoic acid--peptidoglycan teichoic acid transferase [Staphylococcus aureus]	97.3	99.8	1.25e-260
