BAAHTI010000001.1_123|116810|117712|1|ID=1_123;partial=00;start_type=ATG;rbs_motif=GGA/GAG/AGG;rbs_spacer=5-10bp;gc_cont=0.372	WP_000751215.1 MULTISPECIES: CHAP domain-containing protein [Staphylococcus]	100	98.7	6.85e-209
BAAHTI010000001.1_124|118043|119566|1|ID=1_124;partial=00;start_type=ATG;rbs_motif=GGAG/GAGG;rbs_spacer=5-10bp;gc_cont=0.290	WP_000038527.1 MULTISPECIES: DUF6583 family protein [Staphylococcus]	100	99.8	0.0
BAAHTI010000001.1_125|119634|120800|1|ID=1_125;partial=00;start_type=ATG;rbs_motif=AGGAG;rbs_spacer=5-10bp;gc_cont=0.322	WP_000848761.1 MULTISPECIES: ABC transporter permease [Staphylococcus]	100	99.7	3.50e-263
BAAHTI010000001.1_126|120797|121717|1|ID=1_126;partial=00;start_type=ATG;rbs_motif=GGAG/GAGG;rbs_spacer=5-10bp;gc_cont=0.314	WP_000806102.1 MULTISPECIES: ABC transporter permease [Staphylococcus]	100	99.7	5.20e-194
BAAHTI010000001.1_127|121731|122390|1|ID=1_127;partial=00;start_type=ATG;rbs_motif=AGGAG;rbs_spacer=5-10bp;gc_cont=0.314	WP_000570070.1 MULTISPECIES: ABC transporter ATP-binding protein [Staphylococcus]	100	99.5	4.57e-156
BAAHTI010000001.1_128|122442|123410|-1|ID=1_128;partial=00;start_type=ATG;rbs_motif=None;rbs_spacer=None;gc_cont=0.395	WP_000736784.1 MULTISPECIES: glycine-glycine endopeptidase LytM [Staphylococcus]	100	97.8	2.10e-227
BAAHTI010000001.1_129|123718|124710|-1|ID=1_129;partial=00;start_type=ATG;rbs_motif=AGGAG;rbs_spacer=5-10bp;gc_cont=0.361	WP_000337368.1 MULTISPECIES: choloylglycine hydrolase family protein [Staphylococcus]	100	99.7	3.68e-247
BAAHTI010000001.1_130|124944|126320|1|ID=1_130;partial=00;start_type=GTG;rbs_motif=AGGAG;rbs_spacer=5-10bp;gc_cont=0.376	WP_001066548.1 MULTISPECIES: MFS transporter [Staphylococcus]	100	99.8	3.31e-308
BAAHTI010000001.1_131|126448|126840|-1|ID=1_131;partial=00;start_type=ATG;rbs_motif=GGAG/GAGG;rbs_spacer=5-10bp;gc_cont=0.265	WP_001159765.1 MULTISPECIES: hypothetical protein [Staphylococcus]	100	99.2	8.78e-88
BAAHTI010000001.1_132|127220|128218|1|ID=1_132;partial=00;start_type=ATG;rbs_motif=AGGA;rbs_spacer=5-10bp;gc_cont=0.372	WP_000757880.1 MULTISPECIES: ribose utilization transcriptional repressor RbsR [Staphylococcus]	100	99.7	1.00e-236
BAAHTI010000001.1_133|128450|129331|1|ID=1_133;partial=00;start_type=ATG;rbs_motif=GGAG/GAGG;rbs_spacer=5-10bp;gc_cont=0.380	WP_000029196.1 MULTISPECIES: ribose/proton symporter RbsU [Staphylococcus]	100	99.7	1.37e-203
BAAHTI010000001.1_134|129346|129750|1|ID=1_134;partial=00;start_type=ATG;rbs_motif=AGGAG;rbs_spacer=5-10bp;gc_cont=0.326	WP_000747873.1 MULTISPECIES: D-ribose pyranase [Staphylococcus]	100	99.3	5.86e-88
BAAHTI010000001.1_135|129778|130692|1|ID=1_135;partial=00;start_type=ATG;rbs_motif=AGGAG;rbs_spacer=5-10bp;gc_cont=0.377	WP_000182746.1 MULTISPECIES: ribokinase [Staphylococcus]	100	99.7	2.11e-208
BAAHTI010000001.1_136|130943|131704|1|ID=1_136;partial=00;start_type=ATG;rbs_motif=AGGAG;rbs_spacer=5-10bp;gc_cont=0.341	WP_000031262.1 MULTISPECIES: class I SAM-dependent methyltransferase [Staphylococcus]	100	99.6	2.64e-181
BAAHTI010000001.1_137|132081|133517|-1|ID=1_137;partial=00;start_type=ATG;rbs_motif=AGGA/GGAG/GAGG;rbs_spacer=11-12bp;gc_cont=0.367	WP_000164003.1 MULTISPECIES: 6-phospho-beta-glucosidase [Staphylococcus]	100	99.8	0.0
BAAHTI010000001.1_138|133533|134324|-1|ID=1_138;partial=00;start_type=ATG;rbs_motif=AGGA/GGAG/GAGG;rbs_spacer=11-12bp;gc_cont=0.351	WP_000066931.1 MULTISPECIES: glucose PTS transporter subunit IIA [Staphylococcus]	100	99.6	2.72e-179
BAAHTI010000001.1_139|134473|135177|1|ID=1_139;partial=00;start_type=TTG;rbs_motif=GGAG/GAGG;rbs_spacer=5-10bp;gc_cont=0.330	WP_000922320.1 MULTISPECIES: GntR family transcriptional regulator [Staphylococcus]	100	99.6	2.64e-167
BAAHTI010000001.1_140|135285|135986|-1|ID=1_140;partial=00;start_type=ATG;rbs_motif=AGGAG;rbs_spacer=5-10bp;gc_cont=0.366	WP_000607067.1 MULTISPECIES: antiholin-like protein LrgB [Staphylococcus]	100	99.6	4.81e-149
BAAHTI010000001.1_141|135979|136422|-1|ID=1_141;partial=00;start_type=ATG;rbs_motif=GGA/GAG/AGG;rbs_spacer=5-10bp;gc_cont=0.347	WP_001792906.1 MULTISPECIES: antiholin-like murein hydrolase modulator LrgA [Staphylococcus]	100	99.3	2.67e-88
BAAHTI010000001.1_142|136535|137275|-1|ID=1_142;partial=00;start_type=ATG;rbs_motif=AGGAG;rbs_spacer=5-10bp;gc_cont=0.323	WP_000645451.1 response regulator transcription factor LytR [Staphylococcus aureus]	100	99.6	1.46e-170
BAAHTI010000001.1_143|137278|139017|-1|ID=1_143;partial=00;start_type=ATG;rbs_motif=None;rbs_spacer=None;gc_cont=0.355	WP_000925394.1 sensor histidine kinase [Staphylococcus aureus]	100	99.8	0.0
BAAHTI010000001.1_144|139277|139951|-1|ID=1_144;partial=00;start_type=ATG;rbs_motif=AGGAG;rbs_spacer=5-10bp;gc_cont=0.321	WP_000608818.1 MULTISPECIES: iron-sulfur cluster repair di-iron protein ScdA [Staphylococcus]	100	99.6	2.97e-159
BAAHTI010000001.1_145|140095|141816|-1|ID=1_145;partial=00;start_type=ATG;rbs_motif=GGAG/GAGG;rbs_spacer=5-10bp;gc_cont=0.321	WP_000975351.1 MULTISPECIES: poly(ribitol-phosphate) beta-N-acetylglucosaminyltransferase [Staphylococcus]	100	99.8	0.0
BAAHTI010000001.1_146|141849|143537|-1|ID=1_146;partial=00;start_type=TTG;rbs_motif=AGGA;rbs_spacer=5-10bp;gc_cont=0.320	WP_000240920.1 MULTISPECIES: teichoic acid ribitol-phosphate polymerase TarL [Staphylococcus]	100	99.8	0.0
BAAHTI010000001.1_147|143559|144611|-1|ID=1_147;partial=00;start_type=ATG;rbs_motif=None;rbs_spacer=None;gc_cont=0.336	WP_000610204.1 MULTISPECIES: ribitol-5-phosphate dehydrogenase [Staphylococcus]	100	97.2	4.19e-245
BAAHTI010000001.1_148|144577|145293|-1|ID=1_148;partial=00;start_type=ATG;rbs_motif=GGAG/GAGG;rbs_spacer=5-10bp;gc_cont=0.322	WP_000872486.1 MULTISPECIES: D-ribitol-5-phosphate cytidylyltransferase [Staphylococcus]	100	99.6	1.71e-165
BAAHTI010000001.1_149|145569|146738|-1|ID=1_149;partial=00;start_type=ATG;rbs_motif=GGAG/GAGG;rbs_spacer=5-10bp;gc_cont=0.334	WP_000594817.1 MULTISPECIES: teichoic acid glycerol-phosphate transferase TarF [Staphylococcus]	100	99.7	1.45e-292
BAAHTI010000001.1_150|147166|148860|-1|ID=1_150;partial=00;start_type=ATG;rbs_motif=GGA/GAG/AGG;rbs_spacer=5-10bp;gc_cont=0.328	WP_000167979.1 MULTISPECIES: teichoic acid ribitol-phosphate polymerase TarK [Staphylococcus]	100	99.8	0.0
BAAHTI010000001.1_151|148882|149907|-1|ID=1_151;partial=00;start_type=ATG;rbs_motif=GGA/GAG/AGG;rbs_spacer=11-12bp;gc_cont=0.353	WP_000610178.1 alcohol dehydrogenase catalytic domain-containing protein [Staphylococcus aureus]	100	99.7	2.60e-248
BAAHTI010000001.1_152|149900|150616|-1|ID=1_152;partial=00;start_type=ATG;rbs_motif=GGAG/GAGG;rbs_spacer=5-10bp;gc_cont=0.329	WP_000638472.1 2-C-methyl-D-erythritol 4-phosphate cytidylyltransferase [Staphylococcus aureus]	100	99.6	6.95e-165
BAAHTI010000001.1_153|151144|152187|-1|ID=1_153;partial=00;start_type=GTG;rbs_motif=GGAG/GAGG;rbs_spacer=5-10bp;gc_cont=0.381	WP_000645608.1 MULTISPECIES: galactitol-1-phosphate 5-dehydrogenase [Staphylococcus]	100	99.7	2.00e-255
BAAHTI010000001.1_154|152211|152357|-1|ID=1_154;partial=00;start_type=ATG;rbs_motif=AGGAG;rbs_spacer=5-10bp;gc_cont=0.306	WP_000230358.1 MULTISPECIES: hypothetical protein [Bacteria]	100	98.0	3.61e-25
BAAHTI010000001.1_155|152359|153417|-1|ID=1_155;partial=00;start_type=GTG;rbs_motif=GGAG/GAGG;rbs_spacer=5-10bp;gc_cont=0.368	WP_000646211.1 zinc-binding dehydrogenase [Staphylococcus aureus]	99.7	99.4	1.79e-258
BAAHTI010000001.1_156|153432|154691|-1|ID=1_156;partial=00;start_type=ATG;rbs_motif=GGAG/GAGG;rbs_spacer=5-10bp;gc_cont=0.370	WP_000120109.1 MULTISPECIES: PTS galactitol transporter subunit IIC [Staphylococcus]	100	99.8	6.59e-286
BAAHTI010000001.1_157|154918|155196|-1|ID=1_157;partial=00;start_type=ATG;rbs_motif=GGAG/GAGG;rbs_spacer=5-10bp;gc_cont=0.312	WP_000815795.1 MULTISPECIES: PTS sugar transporter subunit IIB [Bacilli]	100	98.9	5.84e-57
BAAHTI010000001.1_158|155219|155686|-1|ID=1_158;partial=00;start_type=ATG;rbs_motif=GGAG/GAGG;rbs_spacer=5-10bp;gc_cont=0.355	WP_000531476.1 MULTISPECIES: PTS sugar transporter subunit IIA [Staphylococcus]	100	99.4	2.64e-101
BAAHTI010000001.1_159|155671|157767|-1|ID=1_159;partial=00;start_type=ATG;rbs_motif=AGGAG;rbs_spacer=5-10bp;gc_cont=0.331	WP_001012737.1 MULTISPECIES: BglG family transcription antiterminator [Staphylococcus]	100	99.9	0.0
BAAHTI010000001.1_160|158105|159040|-1|ID=1_160;partial=00;start_type=ATG;rbs_motif=GGA/GAG/AGG;rbs_spacer=5-10bp;gc_cont=0.395	WP_000823221.1 MULTISPECIES: nucleoside hydrolase [Staphylococcus]	100	99.7	2.07e-223
BAAHTI010000001.1_161|159402|160931|1|ID=1_161;partial=00;start_type=ATG;rbs_motif=AGGAG;rbs_spacer=5-10bp;gc_cont=0.392	WP_000838205.1 MULTISPECIES: glucose-specific PTS transporter subunit IIBC [Staphylococcus]	100	99.8	0.0
BAAHTI010000001.1_162|161251|162204|-1|ID=1_162;partial=00;start_type=ATG;rbs_motif=GGAG/GAGG;rbs_spacer=5-10bp;gc_cont=0.372	WP_001031880.1 MULTISPECIES: L-lactate dehydrogenase [Staphylococcus]	100	99.7	5.47e-222
BAAHTI010000001.1_163|162777|163922|1|ID=1_163;partial=00;start_type=ATG;rbs_motif=AGGAG;rbs_spacer=5-10bp;gc_cont=0.349	WP_000954799.1 MULTISPECIES: globin domain-containing protein [Staphylococcus]	100	99.7	3.06e-274
BAAHTI010000001.1_164|163948|164121|1|ID=1_164;partial=00;start_type=ATG;rbs_motif=AGGA/GGAG/GAGG;rbs_spacer=11-12bp;gc_cont=0.259	WP_000773989.1 MULTISPECIES: hypothetical protein [Staphylococcus]	100	98.3	2.46e-29
BAAHTI010000001.1_165|164278|164634|1|ID=1_165;partial=00;start_type=ATG;rbs_motif=AGGAG;rbs_spacer=5-10bp;gc_cont=0.353	WP_000215216.1 MULTISPECIES: DUF488 domain-containing protein [Staphylococcus]	100	99.2	8.82e-80
BAAHTI010000001.1_166|164832|166307|1|ID=1_166;partial=00;start_type=ATG;rbs_motif=GGA/GAG/AGG;rbs_spacer=5-10bp;gc_cont=0.312	WP_000669656.1 MULTISPECIES: nickel ABC transporter substrate-binding protein [Staphylococcus]	100	99.8	0.0
BAAHTI010000001.1_167|166621|167850|-1|ID=1_167;partial=00;start_type=ATG;rbs_motif=GGA/GAG/AGG;rbs_spacer=5-10bp;gc_cont=0.346	WP_010922818.1 MULTISPECIES: PrsW family intramembrane metalloprotease [Staphylococcus]	100	92.7	5.75e-261
BAAHTI010000001.1_168|168204|169781|1|ID=1_168;partial=00;start_type=ATG;rbs_motif=None;rbs_spacer=None;gc_cont=0.370	WP_001795358.1 MULTISPECIES: fatty acid degradation protein FadX [Staphylococcus]	100	99.8	0.0
BAAHTI010000001.1_169|169807|171312|1|ID=1_169;partial=00;start_type=ATG;rbs_motif=GGA/GAG/AGG;rbs_spacer=5-10bp;gc_cont=0.374	WP_001008400.1 MULTISPECIES: long-chain-fatty-acid--CoA ligase FadD [Staphylococcus]	100	99.8	0.0
BAAHTI010000001.1_170|171424|172635|1|ID=1_170;partial=00;start_type=ATG;rbs_motif=AGGAG;rbs_spacer=5-10bp;gc_cont=0.391	WP_000142199.1 acyl-CoA dehydrogenase FadE [Staphylococcus aureus]	100	99.8	3.72e-293
BAAHTI010000001.1_171|172821|175082|1|ID=1_171;partial=00;start_type=ATG;rbs_motif=GGAG/GAGG;rbs_spacer=5-10bp;gc_cont=0.375	WP_000154537.1 MULTISPECIES: 3-hydroxyacyl-CoA dehydrogenase/crotonase FadB [Staphylococcus]	100	99.9	0.0
BAAHTI010000001.1_172|175112|176296|1|ID=1_172;partial=00;start_type=ATG;rbs_motif=GGAG/GAGG;rbs_spacer=5-10bp;gc_cont=0.435	WP_001154619.1 MULTISPECIES: thiolase family protein [Staphylococcus]	100	99.7	5.32e-277
BAAHTI010000001.1_173|176883|178697|-1|ID=1_173;partial=00;start_type=ATG;rbs_motif=AGGA/GGAG/GAGG;rbs_spacer=11-12bp;gc_cont=0.340	WP_075339631.1 staphylocoagulase, partial [Staphylococcus aureus]	100	84.5	2.41e-314
BAAHTI010000001.1_174|178887|179231|1|ID=1_174;partial=00;start_type=ATG;rbs_motif=AGGAG;rbs_spacer=5-10bp;gc_cont=0.319	WP_000211597.1 MULTISPECIES: complement inhibitor SCIN family protein [Staphylococcus]	100	99.1	1.61e-71
BAAHTI010000001.1_175|179395|181158|-1|ID=1_175;partial=00;start_type=ATG;rbs_motif=GGAG/GAGG;rbs_spacer=5-10bp;gc_cont=0.310	WP_000822589.1 glycerophosphoryl diester phosphodiesterase membrane domain-containing protein [Staphylococcus aureus]	100	99.8	0.0
BAAHTI010000001.1_176|181480|182235|-1|ID=1_176;partial=00;start_type=ATG;rbs_motif=GGA/GAG/AGG;rbs_spacer=5-10bp;gc_cont=0.365	WP_000911657.1 MULTISPECIES: pyruvate formate-lyase-activating protein [Staphylococcus]	100	99.6	5.37e-189
BAAHTI010000001.1_177|182258|184507|-1|ID=1_177;partial=00;start_type=ATG;rbs_motif=GGAG/GAGG;rbs_spacer=5-10bp;gc_cont=0.368	WP_000894660.1 MULTISPECIES: formate C-acetyltransferase [Staphylococcus]	100	99.9	0.0
BAAHTI010000001.1_178|185095|186063|1|ID=1_178;partial=00;start_type=ATG;rbs_motif=None;rbs_spacer=None;gc_cont=0.342	WP_000837116.1 MULTISPECIES: ABC transporter substrate-binding protein [Staphylococcus]	100	99.7	2.74e-229
BAAHTI010000001.1_179|186060|187616|1|ID=1_179;partial=00;start_type=ATG;rbs_motif=GGAG/GAGG;rbs_spacer=5-10bp;gc_cont=0.329	WP_000127990.1 MULTISPECIES: sensor histidine kinase [Staphylococcus]	100	99.8	0.0
BAAHTI010000001.1_180|187609|188367|1|ID=1_180;partial=00;start_type=ATG;rbs_motif=GGA/GAG/AGG;rbs_spacer=5-10bp;gc_cont=0.324	WP_000477526.1 MULTISPECIES: response regulator transcription factor [Staphylococcus]	100	99.6	2.09e-182
BAAHTI010000001.1_181|188726|190123|-1|ID=1_181;partial=00;start_type=ATG;rbs_motif=None;rbs_spacer=None;gc_cont=0.363	WP_269671339.1 hexose-6-phosphate:phosphate antiporter [Staphylococcus aureus]	100	98.5	0.0
BAAHTI010000001.1_182|190338|190832|1|ID=1_182;partial=00;start_type=ATG;rbs_motif=GGAG/GAGG;rbs_spacer=5-10bp;gc_cont=0.265	WP_000603755.1 MULTISPECIES: isoprenylcysteine carboxyl methyltransferase family protein [Staphylococcus]	100	99.4	8.00e-105
BAAHTI010000001.1_183|191193|192161|-1|ID=1_183;partial=00;start_type=ATG;rbs_motif=AGGAG;rbs_spacer=5-10bp;gc_cont=0.356	WP_000690405.1 MULTISPECIES: sugar phosphate isomerase/epimerase family protein [Staphylococcus]	100	99.7	9.37e-246
BAAHTI010000001.1_184|192216|193256|-1|ID=1_184;partial=00;start_type=ATG;rbs_motif=AGGAG;rbs_spacer=5-10bp;gc_cont=0.399	WP_000163820.1 MULTISPECIES: Gfo/Idh/MocA family protein [Staphylococcus]	100	99.7	4.36e-254
BAAHTI010000001.1_185|193281|194360|-1|ID=1_185;partial=00;start_type=ATG;rbs_motif=AGGAG;rbs_spacer=5-10bp;gc_cont=0.396	WP_000153479.1 MULTISPECIES: Gfo/Idh/MocA family protein [Staphylococcus]	100	99.4	1.74e-264
BAAHTI010000001.1_186|194431|195270|-1|ID=1_186;partial=00;start_type=ATG;rbs_motif=GGAG/GAGG;rbs_spacer=5-10bp;gc_cont=0.338	WP_000162661.1 MULTISPECIES: sugar ABC transporter permease [Staphylococcus]	100	99.6	1.91e-187
BAAHTI010000001.1_187|195272|196540|-1|ID=1_187;partial=00;start_type=ATG;rbs_motif=AGGAG;rbs_spacer=5-10bp;gc_cont=0.357	WP_224083619.1 sugar ABC transporter permease [Staphylococcus aureus]	98.8	99.8	5.35e-298
BAAHTI010000001.1_188|196543|197814|-1|ID=1_188;partial=00;start_type=ATG;rbs_motif=GGAG/GAGG;rbs_spacer=5-10bp;gc_cont=0.343	WP_000034961.1 MULTISPECIES: maltodextrin ABC transporter substrate-binding protein [Staphylococcus]	100	99.8	1.29e-310
BAAHTI010000001.1_189|197827|198924|-1|ID=1_189;partial=00;start_type=ATG;rbs_motif=GGAG/GAGG;rbs_spacer=5-10bp;gc_cont=0.350	WP_000818915.1 MULTISPECIES: ABC transporter ATP-binding protein [Staphylococcus]	100	99.7	3.94e-262
BAAHTI010000001.1_190|199308|199886|-1|ID=1_190;partial=00;start_type=ATG;rbs_motif=GGA/GAG/AGG;rbs_spacer=5-10bp;gc_cont=0.359	WP_000166920.1 MULTISPECIES: M23 family metallopeptidase [Staphylococcus]	100	99.5	5.26e-144
BAAHTI010000001.1_191|200095|200721|1|ID=1_191;partial=00;start_type=ATG;rbs_motif=AGGAG;rbs_spacer=5-10bp;gc_cont=0.324	WP_001151451.1 MULTISPECIES: FMN-dependent NADH-azoreductase [Staphylococcus]	100	99.5	1.17e-148
BAAHTI010000001.1_192|200880|201683|1|ID=1_192;partial=00;start_type=ATG;rbs_motif=None;rbs_spacer=None;gc_cont=0.300	WP_000643619.1 MULTISPECIES: tandem-type lipoprotein [Staphylococcus]	100	95.9	1.27e-179
BAAHTI010000001.1_193|201996|204002|-1|ID=1_193;partial=00;start_type=ATG;rbs_motif=AGGAG;rbs_spacer=5-10bp;gc_cont=0.378	WP_000236427.1 MULTISPECIES: gamma-glutamyltransferase [Staphylococcus]	100	99.9	0.0
BAAHTI010000001.1_194|204040|205815|-1|ID=1_194;partial=00;start_type=GTG;rbs_motif=GGA/GAG/AGG;rbs_spacer=5-10bp;gc_cont=0.332	WP_000720816.1 MULTISPECIES: ABC transporter substrate-binding protein [Staphylococcus]	100	99.8	0.0
BAAHTI010000001.1_195|205832|206995|-1|ID=1_195;partial=00;start_type=ATG;rbs_motif=AGGA;rbs_spacer=5-10bp;gc_cont=0.346	WP_000240113.1 MULTISPECIES: ABC transporter permease [Staphylococcus]	100	99.7	7.46e-253
BAAHTI010000001.1_196|207001|208434|-1|ID=1_196;partial=00;start_type=ATG;rbs_motif=None;rbs_spacer=None;gc_cont=0.326	WP_001557565.1 ABC transporter permease [Staphylococcus aureus]	100	99.8	3.40e-306
BAAHTI010000001.1_197|208436|210028|1|ID=1_197;partial=00;start_type=ATG;rbs_motif=GGAG/GAGG;rbs_spacer=5-10bp;gc_cont=0.355	WP_000067352.1 MULTISPECIES: ABC transporter ATP-binding protein [Staphylococcus]	100	99.8	0.0
BAAHTI010000001.1_198|210538|210735|-1|ID=1_198;partial=00;start_type=GTG;rbs_motif=GGA/GAG/AGG;rbs_spacer=5-10bp;gc_cont=0.308	WP_000794565.1 MULTISPECIES: helix-turn-helix transcriptional regulator [Staphylococcus]	100	98.5	1.20e-37
BAAHTI010000001.1_199|210725|210913|-1|ID=1_199;partial=00;start_type=ATG;rbs_motif=GGAG/GAGG;rbs_spacer=5-10bp;gc_cont=0.222	WP_368409519.1 hypothetical protein [Staphylococcus aureus]	98.4	98.4	1.29e-33
BAAHTI010000001.1_200|210900|211622|-1|ID=1_200;partial=00;start_type=ATG;rbs_motif=AGGA;rbs_spacer=5-10bp;gc_cont=0.267	WP_000960712.1 MULTISPECIES: ATP-binding cassette domain-containing protein [Staphylococcus]	100	99.6	6.95e-166
BAAHTI010000001.1_201|211634|212098|-1|ID=1_201;partial=00;start_type=GTG;rbs_motif=None;rbs_spacer=None;gc_cont=0.258	WP_001793228.1 MULTISPECIES: stage II sporulation protein M [Staphylococcus]	100	99.4	6.39e-88
BAAHTI010000001.1_202|212136|213821|-1|ID=1_202;partial=00;start_type=ATG;rbs_motif=AGGAG;rbs_spacer=5-10bp;gc_cont=0.234	WP_031899927.1 membrane protein [Staphylococcus aureus]	99.8	99.8	0.0
BAAHTI010000001.1_203|213892|214113|-1|ID=1_203;partial=00;start_type=ATG;rbs_motif=AGGAGG;rbs_spacer=5-10bp;gc_cont=0.410	WP_000915920.1 MULTISPECIES: putative cyclic bacteriocin [Staphylococcus]	100	98.6	3.32e-43
BAAHTI010000001.1_204|214320|215498|-1|ID=1_204;partial=00;start_type=ATG;rbs_motif=GGAG/GAGG;rbs_spacer=5-10bp;gc_cont=0.307	WP_001233397.1 MULTISPECIES: ABC transporter permease [Staphylococcus]	100	99.7	4.99e-265
BAAHTI010000001.1_205|215495|216175|-1|ID=1_205;partial=00;start_type=ATG;rbs_motif=GGA/GAG/AGG;rbs_spacer=5-10bp;gc_cont=0.316	WP_000571407.1 MULTISPECIES: ABC transporter ATP-binding protein [Staphylococcus]	100	99.6	2.34e-157
BAAHTI010000001.1_206|216172|217284|-1|ID=1_206;partial=00;start_type=TTG;rbs_motif=AGGAG;rbs_spacer=5-10bp;gc_cont=0.304	WP_001253190.1 MULTISPECIES: efflux RND transporter periplasmic adaptor subunit [Staphylococcus]	100	99.7	5.97e-255
BAAHTI010000001.1_207|217410|218009|1|ID=1_207;partial=00;start_type=ATG;rbs_motif=AGGAG;rbs_spacer=5-10bp;gc_cont=0.292	WP_000059051.1 MULTISPECIES: hypothetical protein [Staphylococcus]	100	99.5	1.50e-117
BAAHTI010000001.1_208|218156|220945|-1|ID=1_208;partial=00;start_type=ATG;rbs_motif=GGA/GAG/AGG;rbs_spacer=5-10bp;gc_cont=0.332	WP_000331330.1 MULTISPECIES: type I restriction endonuclease subunit R [Staphylococcus]	100	99.9	0.0
BAAHTI010000001.1_209|221633|222511|-1|ID=1_209;partial=00;start_type=ATG;rbs_motif=None;rbs_spacer=None;gc_cont=0.344	WP_000181827.1 MurR/RpiR family transcriptional regulator [Staphylococcus aureus]	92.4	99.3	6.81e-185
BAAHTI010000001.1_210|222511|223965|-1|ID=1_210;partial=00;start_type=ATG;rbs_motif=AGGAG;rbs_spacer=5-10bp;gc_cont=0.379	WP_000159750.1 MULTISPECIES: PTS transporter subunit EIIC [Staphylococcus]	100	99.8	0.0
BAAHTI010000001.1_211|223977|224873|-1|ID=1_211;partial=00;start_type=ATG;rbs_motif=AGGA/GGAG/GAGG;rbs_spacer=11-12bp;gc_cont=0.381	WP_000432017.1 MULTISPECIES: N-acetylmuramic acid 6-phosphate etherase [Staphylococcus]	100	99.7	7.03e-204
BAAHTI010000001.1_212|224873|225913|-1|ID=1_212;partial=00;start_type=GTG;rbs_motif=GGA/GAG/AGG;rbs_spacer=5-10bp;gc_cont=0.353	WP_000145577.1 MULTISPECIES: 6-phospho-N-acetylmuramidase [Staphylococcus]	99.7	99.7	1.84e-254
BAAHTI010000001.1_213|226513|228558|1|ID=1_213;partial=00;start_type=GTG;rbs_motif=GGAG/GAGG;rbs_spacer=5-10bp;gc_cont=0.376	WP_001227709.1 MULTISPECIES: glucose-specific PTS transporter subunit IIBC [Staphylococcus]	100	99.9	0.0
BAAHTI010000001.1_214|228831|230471|1|ID=1_214;partial=00;start_type=ATG;rbs_motif=GGA/GAG/AGG;rbs_spacer=5-10bp;gc_cont=0.366	WP_000813525.1 MULTISPECIES: alpha-keto acid decarboxylase family protein [Staphylococcus]	100	99.8	0.0
BAAHTI010000001.1_215|230538|231095|1|ID=1_215;partial=00;start_type=ATG;rbs_motif=AGGA/GGAG/GAGG;rbs_spacer=11-12bp;gc_cont=0.353	WP_001557561.1 MULTISPECIES: isochorismatase family protein [Staphylococcus]	100	99.5	2.83e-131
BAAHTI010000001.1_216|231374|232723|1|ID=1_216;partial=00;start_type=ATG;rbs_motif=AGGAG(G)/GGAGG;rbs_spacer=13-15bp;gc_cont=0.330	WP_000728170.1 MULTISPECIES: branched-chain amino acid transport system II carrier protein BrnQ1 [Staphylococcus]	100	99.8	1.29e-305
BAAHTI010000001.1_217|232982|234166|1|ID=1_217;partial=00;start_type=ATG;rbs_motif=AGGAG;rbs_spacer=5-10bp;gc_cont=0.376	WP_001084442.1 MULTISPECIES: ornithine--oxo-acid transaminase [Staphylococcus]	100	99.7	2.30e-287
BAAHTI010000001.1_218|234202|235236|1|ID=1_218;partial=00;start_type=ATG;rbs_motif=AGGAG;rbs_spacer=5-10bp;gc_cont=0.350	WP_000598482.1 MULTISPECIES: N-acetyl-gamma-glutamyl-phosphate reductase [Staphylococcus]	100	99.4	1.34e-249
BAAHTI010000001.1_219|235248|236489|1|ID=1_219;partial=00;start_type=ATG;rbs_motif=GGA/GAG/AGG;rbs_spacer=5-10bp;gc_cont=0.378	WP_000682619.1 MULTISPECIES: bifunctional glutamate N-acetyltransferase/amino-acid acetyltransferase ArgJ [Staphylococcus]	100	99.8	7.27e-296
BAAHTI010000001.1_220|236505|237269|1|ID=1_220;partial=00;start_type=ATG;rbs_motif=AGxAGG/AGGxGG;rbs_spacer=5-10bp;gc_cont=0.346	WP_000668894.1 MULTISPECIES: acetylglutamate kinase [Staphylococcus]	100	99.6	2.85e-181
BAAHTI010000001.1_221|237539|238018|1|ID=1_221;partial=00;start_type=ATG;rbs_motif=None;rbs_spacer=None;gc_cont=0.362	WP_001822554.1 MULTISPECIES: YagU family protein [Staphylococcus]	100	99.4	2.16e-111
BAAHTI010000001.1_222|238346|238990|-1|ID=1_222;partial=00;start_type=ATG;rbs_motif=GGA/GAG/AGG;rbs_spacer=5-10bp;gc_cont=0.335	WP_000215722.1 MULTISPECIES: aureusimine biosynthesis 4'-phosphopantetheinyl transferase AusB [Staphylococcus]	100	99.5	1.88e-157
BAAHTI010000001.1_223|239003|246196|-1|ID=1_223;partial=00;start_type=ATG;rbs_motif=GGA/GAG/AGG;rbs_spacer=5-10bp;gc_cont=0.353	WP_000605281.1 MULTISPECIES: aureusimine non-ribosomal peptide synthetase AusA [Staphylococcus]	100	99.7	0.0
BAAHTI010000001.1_224|246625|247875|-1|ID=1_224;partial=00;start_type=ATG;rbs_motif=None;rbs_spacer=None;gc_cont=0.326	WP_000826862.1 MULTISPECIES: MDR family MFS transporter [Staphylococcus]	100	99.8	1.15e-273
BAAHTI010000001.1_225|248261|249436|-1|ID=1_225;partial=00;start_type=GTG;rbs_motif=GGA/GAG/AGG;rbs_spacer=5-10bp;gc_cont=0.352	WP_000706135.1 MULTISPECIES: NAD-dependent formate dehydrogenase [Staphylococcus]	100	87.0	9.20e-246
BAAHTI010000001.1_226|249460|249819|-1|ID=1_226;partial=00;start_type=GTG;rbs_motif=None;rbs_spacer=None;gc_cont=0.325	WP_001092004.1 MULTISPECIES: DUF2294 domain-containing protein [Staphylococcus]	100	99.2	5.50e-79
BAAHTI010000001.1_227|250036|251067|-1|ID=1_227;partial=00;start_type=ATG;rbs_motif=AGGAG;rbs_spacer=5-10bp;gc_cont=0.359	WP_000171645.1 MULTISPECIES: acyl-CoA/acyl-ACP dehydrogenase [Staphylococcus]	100	99.7	4.14e-246
BAAHTI010000001.1_228|251080|251841|-1|ID=1_228;partial=00;start_type=ATG;rbs_motif=AGGAGG;rbs_spacer=5-10bp;gc_cont=0.353	WP_000197961.1 MULTISPECIES: ABC transporter permease [Staphylococcus]	100	99.6	7.26e-179
BAAHTI010000001.1_229|251838|252809|-1|ID=1_229;partial=00;start_type=ATG;rbs_motif=AGGAG;rbs_spacer=5-10bp;gc_cont=0.370	WP_000826669.1 MULTISPECIES: ABC transporter substrate-binding protein [Staphylococcus]	100	99.7	3.12e-240
BAAHTI010000001.1_230|252823|253563|-1|ID=1_230;partial=00;start_type=ATG;rbs_motif=GGA/GAG/AGG;rbs_spacer=5-10bp;gc_cont=0.355	WP_000590854.1 MULTISPECIES: ABC transporter ATP-binding protein [Staphylococcus]	100	99.6	8.53e-179
BAAHTI010000001.1_231|253905|254417|-1|ID=1_231;partial=00;start_type=ATG;rbs_motif=AGGAG;rbs_spacer=5-10bp;gc_cont=0.339	WP_000171919.1 MULTISPECIES: DUF4242 domain-containing protein [Staphylococcus]	100	99.4	9.30e-116
BAAHTI010000001.1_232|254596|254799|1|ID=1_232;partial=00;start_type=ATG;rbs_motif=AGxAGG/AGGxGG;rbs_spacer=5-10bp;gc_cont=0.309	WP_000356963.1 MULTISPECIES: hypothetical protein [Staphylococcus]	100	98.5	8.29e-39
BAAHTI010000001.1_233|254999|256063|-1|ID=1_233;partial=00;start_type=ATG;rbs_motif=None;rbs_spacer=None;gc_cont=0.313	WP_001013485.1 MULTISPECIES: cation diffusion facilitator family transporter [Staphylococcus]	100	89.9	9.69e-217
BAAHTI010000001.1_234|256359|256478|-1|ID=1_234;partial=00;start_type=ATG;rbs_motif=GGA/GAG/AGG;rbs_spacer=5-10bp;gc_cont=0.292	WP_000161255.1 hypothetical protein [Staphylococcus aureus]	76.5	85.0	2.38e-09
BAAHTI010000001.1_235|256605|258092|-1|ID=1_235;partial=00;start_type=ATG;rbs_motif=AGGAG;rbs_spacer=5-10bp;gc_cont=0.362	WP_000290397.1 MULTISPECIES: aldehyde dehydrogenase family protein [Staphylococcus]	100	99.8	0.0
BAAHTI010000001.1_236|258519|258902|1|ID=1_236;partial=00;start_type=ATG;rbs_motif=GGAG/GAGG;rbs_spacer=5-10bp;gc_cont=0.318	WP_001237004.1 MULTISPECIES: YbaN family protein [Staphylococcus]	100	99.2	1.59e-75
BAAHTI010000001.1_237|258909|259235|1|ID=1_237;partial=00;start_type=ATG;rbs_motif=AGGAG;rbs_spacer=5-10bp;gc_cont=0.306	WP_000480603.1 MULTISPECIES: staphylobilin-forming heme oxygenase IsdI [Staphylococcus]	100	99.1	4.22e-71
BAAHTI010000001.1_238|259300|260445|-1|ID=1_238;partial=00;start_type=ATG;rbs_motif=GGAG/GAGG;rbs_spacer=5-10bp;gc_cont=0.364	WP_000723436.1 MULTISPECIES: type 8 capsular polysaccharide synthesis protein Cap8P [Staphylococcus]	100	99.7	3.73e-275
