BAAHTU010000006.1_1|709|1305|-1|ID=1_1;partial=00;start_type=ATG;rbs_motif=GGA/GAG/AGG;rbs_spacer=11-12bp;gc_cont=0.363	WP_000559156.1 MULTISPECIES: recombination mediator RecR [Staphylococcus]	100	99.5	3.81e-140
BAAHTU010000006.1_2|1312|1629|-1|ID=1_2;partial=00;start_type=ATG;rbs_motif=AGGAG;rbs_spacer=5-10bp;gc_cont=0.396	WP_001213992.1 MULTISPECIES: YbaB/EbfC family nucleoid-associated protein [Staphylococcus]	100	99.1	6.84e-53
BAAHTU010000006.1_3|1719|3416|-1|ID=1_3;partial=00;start_type=TTG;rbs_motif=GGAG/GAGG;rbs_spacer=5-10bp;gc_cont=0.361	WP_001109047.1 MULTISPECIES: DNA polymerase III subunit gamma/tau [Staphylococcus]	100	99.8	0.0
BAAHTU010000006.1_4|3485|4009|-1|ID=1_4;partial=00;start_type=ATG;rbs_motif=GGAG/GAGG;rbs_spacer=5-10bp;gc_cont=0.333	WP_001167827.1 GNAT family N-acetyltransferase [Staphylococcus aureus]	100	99.4	7.33e-124
BAAHTU010000006.1_5|4648|5376|-1|ID=1_5;partial=00;start_type=ATG;rbs_motif=GGA/GAG/AGG;rbs_spacer=5-10bp;gc_cont=0.333	WP_001118675.1 MULTISPECIES: trehalose operon repressor [Staphylococcus]	100	99.6	3.17e-163
BAAHTU010000006.1_6|5401|7041|-1|ID=1_6;partial=00;start_type=GTG;rbs_motif=GGA/GAG/AGG;rbs_spacer=5-10bp;gc_cont=0.363	WP_108932424.1 alpha,alpha-phosphotrehalase [Staphylococcus aureus]	100	99.8	0.0
BAAHTU010000006.1_7|7105|8532|-1|ID=1_7;partial=00;start_type=ATG;rbs_motif=GGAG/GAGG;rbs_spacer=5-10bp;gc_cont=0.375	WP_000279367.1 MULTISPECIES: PTS system trehalose-specific EIIBC component [Staphylococcus]	100	99.8	0.0
BAAHTU010000006.1_8|8848|9042|1|ID=1_8;partial=00;start_type=ATG;rbs_motif=None;rbs_spacer=None;gc_cont=0.344	WP_190259680.1 hypothetical protein [Staphylococcus aureus]	100	98.5	3.33e-39
BAAHTU010000006.1_9|9364|10827|-1|ID=1_9;partial=00;start_type=ATG;rbs_motif=GGAG/GAGG;rbs_spacer=5-10bp;gc_cont=0.384	WP_000503583.1 MULTISPECIES: glutamate synthase subunit beta [Staphylococcus]	100	99.8	0.0
BAAHTU010000006.1_10|10845|15344|-1|ID=1_10;partial=00;start_type=ATG;rbs_motif=GGA/GAG/AGG;rbs_spacer=5-10bp;gc_cont=0.376	WP_000551362.1 MULTISPECIES: glutamate synthase large subunit [Staphylococcus]	100	99.9	0.0
BAAHTU010000006.1_11|15526|16410|1|ID=1_11;partial=00;start_type=ATG;rbs_motif=AGGAG(G)/GGAGG;rbs_spacer=13-15bp;gc_cont=0.330	WP_000403916.1 MULTISPECIES: glutamate biosynthesis transcriptional regulator GltC [Staphylococcus]	100	99.7	1.38e-208
BAAHTU010000006.1_12|16531|17643|1|ID=1_12;partial=00;start_type=TTG;rbs_motif=None;rbs_spacer=None;gc_cont=0.333	WP_256927382.1 YibE/F family protein, partial [Staphylococcus aureus]	99.7	99.7	2.82e-251
BAAHTU010000006.1_13|17640|18422|1|ID=1_13;partial=00;start_type=ATG;rbs_motif=AGGAG;rbs_spacer=5-10bp;gc_cont=0.327	WP_000994678.1 MULTISPECIES: YibE/F family protein [Staphylococcus]	100	99.6	6.80e-167
BAAHTU010000006.1_14|18591|19088|-1|ID=1_14;partial=00;start_type=ATG;rbs_motif=GGA/GAG/AGG;rbs_spacer=5-10bp;gc_cont=0.363	WP_000183669.1 MULTISPECIES: GNAT family N-acetyltransferase [Staphylococcus]	100	97.0	1.25e-112
BAAHTU010000006.1_15|19066|19461|-1|ID=1_15;partial=00;start_type=ATG;rbs_motif=None;rbs_spacer=None;gc_cont=0.351	WP_108932423.1 NUDIX hydrolase [Staphylococcus aureus]	100	99.2	4.87e-90
BAAHTU010000006.1_16|19610|19879|1|ID=1_16;partial=00;start_type=ATG;rbs_motif=GGA/GAG/AGG;rbs_spacer=5-10bp;gc_cont=0.326	WP_001129473.1 MULTISPECIES: hypothetical protein [Staphylococcus]	100	98.9	9.14e-55
BAAHTU010000006.1_17|20064|21068|-1|ID=1_17;partial=00;start_type=GTG;rbs_motif=AGGAG;rbs_spacer=5-10bp;gc_cont=0.364	WP_001170264.1 MULTISPECIES: autolysin/adhesin Aaa [Staphylococcus]	100	99.7	7.26e-231
BAAHTU010000006.1_18|21400|22242|-1|ID=1_18;partial=00;start_type=ATG;rbs_motif=AGGA;rbs_spacer=5-10bp;gc_cont=0.330	WP_000825521.1 MULTISPECIES: dipeptide ABC transporter glycylmethionine-binding lipoprotein [Staphylococcus]	100	99.6	5.29e-190
BAAHTU010000006.1_19|22279|22938|-1|ID=1_19;partial=00;start_type=ATG;rbs_motif=AGGA/GGAG/GAGG;rbs_spacer=11-12bp;gc_cont=0.367	WP_000467994.1 MULTISPECIES: methionine ABC transporter permease [Staphylococcus]	100	99.5	3.92e-132
BAAHTU010000006.1_20|22942|23970|-1|ID=1_20;partial=00;start_type=ATG;rbs_motif=AGGAG;rbs_spacer=5-10bp;gc_cont=0.352	WP_000569286.1 MULTISPECIES: methionine ABC transporter ATP-binding protein [Staphylococcus]	100	99.4	4.43e-238
BAAHTU010000006.1_21|24261|25403|-1|ID=1_21;partial=00;start_type=ATG;rbs_motif=AGGAG;rbs_spacer=5-10bp;gc_cont=0.356	WP_001036663.1 MULTISPECIES: bifunctional cystathionine gamma-lyase/homocysteine desulfhydrase [Staphylococcus]	100	99.7	4.82e-266
BAAHTU010000006.1_22|25387|26352|-1|ID=1_22;partial=00;start_type=ATG;rbs_motif=None;rbs_spacer=None;gc_cont=0.388	WP_000634105.1 MULTISPECIES: PLP-dependent cysteine synthase family protein [Staphylococcus]	100	94.4	8.94e-219
BAAHTU010000006.1_23|26517|27854|-1|ID=1_23;partial=00;start_type=ATG;rbs_motif=AGGAG;rbs_spacer=5-10bp;gc_cont=0.348	WP_000828726.1 MULTISPECIES: sodium-dependent transporter [Staphylococcus]	100	99.8	3.84e-305
BAAHTU010000006.1_24|28019|28132|-1|ID=1_24;partial=00;start_type=ATG;rbs_motif=GGA/GAG/AGG;rbs_spacer=5-10bp;gc_cont=0.430	WP_000510433.1 MULTISPECIES: hypothetical protein [Staphylococcus]	100	97.4	1.62e-19
BAAHTU010000006.1_25|28310|29044|-1|ID=1_25;partial=00;start_type=ATG;rbs_motif=AGGA/GGAG/GAGG;rbs_spacer=11-12bp;gc_cont=0.337	WP_001220813.1 MULTISPECIES: alpha/beta hydrolase [Staphylococcus]	100	99.6	5.14e-179
BAAHTU010000006.1_26|29081|29755|-1|ID=1_26;partial=00;start_type=ATG;rbs_motif=AGGAG;rbs_spacer=5-10bp;gc_cont=0.347	WP_000565820.1 MULTISPECIES: phosphatase PAP2 family protein [Staphylococcus]	100	99.6	9.16e-154
BAAHTU010000006.1_27|29793|30209|1|ID=1_27;partial=00;start_type=ATG;rbs_motif=None;rbs_spacer=None;gc_cont=0.264	WP_001789536.1 MULTISPECIES: hypothetical protein [Staphylococcus]	100	99.3	2.76e-88
BAAHTU010000006.1_28|30438|30800|-1|ID=1_28;partial=00;start_type=ATG;rbs_motif=GGAG/GAGG;rbs_spacer=5-10bp;gc_cont=0.331	WP_000831495.1 MULTISPECIES: DUF2294 domain-containing protein [Staphylococcus]	100	99.2	2.82e-77
BAAHTU010000006.1_29|30962|33667|-1|ID=1_29;partial=00;start_type=ATG;rbs_motif=AGGAG;rbs_spacer=5-10bp;gc_cont=0.388	WP_000211540.1 MULTISPECIES: DUF2309 domain-containing protein [Staphylococcus]	100	99.9	0.0
BAAHTU010000006.1_30|33680|35164|-1|ID=1_30;partial=00;start_type=GTG;rbs_motif=AGGAG;rbs_spacer=5-10bp;gc_cont=0.374	WP_000948279.1 MULTISPECIES: NADH dehydrogenase subunit 5 [Staphylococcus]	100	99.8	0.0
BAAHTU010000006.1_31|36752|37954|-1|ID=1_31;partial=00;start_type=ATG;rbs_motif=GGAG/GAGG;rbs_spacer=5-10bp;gc_cont=0.370	WP_001062982.1 MULTISPECIES: GTP-binding protein [Staphylococcus]	100	99.8	3.52e-285
BAAHTU010000006.1_32|38139|38333|1|ID=1_32;partial=00;start_type=ATG;rbs_motif=GGAG/GAGG;rbs_spacer=5-10bp;gc_cont=0.308	WP_237761095.1 hypothetical protein, partial [Staphylococcus aureus]	100	98.5	4.24e-31
BAAHTU010000006.1_33|38623|38937|-1|ID=1_33;partial=00;start_type=ATG;rbs_motif=AGGAG;rbs_spacer=5-10bp;gc_cont=0.324	WP_000172543.1 MULTISPECIES: hypothetical protein [Staphylococcus]	100	99.0	9.79e-66
BAAHTU010000006.1_34|38956|39279|-1|ID=1_34;partial=00;start_type=ATG;rbs_motif=GGA/GAG/AGG;rbs_spacer=5-10bp;gc_cont=0.278	WP_000971498.1 MULTISPECIES: hypothetical protein [Staphylococcus]	100	99.1	2.03e-64
BAAHTU010000006.1_35|39276|40604|-1|ID=1_35;partial=00;start_type=ATG;rbs_motif=GGA/GAG/AGG;rbs_spacer=5-10bp;gc_cont=0.304	WP_000952537.1 MULTISPECIES: hypothetical protein [Staphylococcus]	100	99.8	5.03e-304
BAAHTU010000006.1_36|40594|41454|-1|ID=1_36;partial=00;start_type=ATG;rbs_motif=None;rbs_spacer=None;gc_cont=0.265	WP_343219438.1 tandem-type lipoprotein [Staphylococcus aureus]	99.3	99.3	1.15e-193
BAAHTU010000006.1_37|41589|42374|-1|ID=1_37;partial=00;start_type=ATG;rbs_motif=AGGA/GGAG/GAGG;rbs_spacer=11-12bp;gc_cont=0.308	WP_000835976.1 MULTISPECIES: tandem-type lipoprotein Lpl9 [Staphylococcus]	100	99.6	1.53e-184
BAAHTU010000006.1_38|42393|43208|-1|ID=1_38;partial=00;start_type=ATG;rbs_motif=GGA/GAG/AGG;rbs_spacer=5-10bp;gc_cont=0.294	WP_001797296.1 MULTISPECIES: tandem-type lipoprotein Lpl8 [Staphylococcus]	100	99.3	1.79e-190
BAAHTU010000006.1_39|43384|44160|-1|ID=1_39;partial=00;start_type=ATG;rbs_motif=GGA/GAG/AGG;rbs_spacer=5-10bp;gc_cont=0.300	WP_000649608.1 MULTISPECIES: tandem-type lipoprotein Lpl7 [Staphylococcus]	100	99.6	1.07e-178
BAAHTU010000006.1_40|44230|45021|-1|ID=1_40;partial=00;start_type=ATG;rbs_motif=GGA/GAG/AGG;rbs_spacer=5-10bp;gc_cont=0.290	WP_000456138.1 MULTISPECIES: tandem-type lipoprotein Lpl6 [Staphylococcus]	100	99.6	3.59e-184
BAAHTU010000006.1_41|45053|45823|-1|ID=1_41;partial=00;start_type=ATG;rbs_motif=AGGA/GGAG/GAGG;rbs_spacer=11-12bp;gc_cont=0.297	WP_341270957.1 tandem-type lipoprotein Lpl5 [Staphylococcus aureus]	100	99.6	3.61e-185
BAAHTU010000006.1_42|45842|46645|-1|ID=1_42;partial=00;start_type=ATG;rbs_motif=GGA/GAG/AGG;rbs_spacer=5-10bp;gc_cont=0.299	WP_000971990.1 MULTISPECIES: tandem-type lipoprotein Lpl4 [Staphylococcus]	100	99.6	2.95e-185
BAAHTU010000006.1_43|46691|47497|-1|ID=1_43;partial=00;start_type=ATG;rbs_motif=GGAG/GAGG;rbs_spacer=5-10bp;gc_cont=0.295	WP_031864746.1 tandem-type lipoprotein [Staphylococcus aureus]	100	99.6	1.39e-179
BAAHTU010000006.1_44|47516|48316|-1|ID=1_44;partial=00;start_type=ATG;rbs_motif=GGA/GAG/AGG;rbs_spacer=5-10bp;gc_cont=0.298	WP_001269761.1 MULTISPECIES: tandem-type lipoprotein Lpl2 [Staphylococcus]	100	99.6	5.75e-187
BAAHTU010000006.1_45|48347|49150|-1|ID=1_45;partial=00;start_type=ATG;rbs_motif=GGA/GAG/AGG;rbs_spacer=5-10bp;gc_cont=0.297	WP_108932426.1 tandem-type lipoprotein Lpl1 [Staphylococcus aureus]	100	95.9	4.43e-180
BAAHTU010000006.1_46|49479|49796|1|ID=1_46;partial=00;start_type=GTG;rbs_motif=None;rbs_spacer=None;gc_cont=0.330	WP_108932422.1 myeloperoxidase inhibitor SPIN [Staphylococcus aureus]	100	95.3	2.26e-64
BAAHTU010000006.1_47|49900|51408|-1|ID=1_47;partial=00;start_type=ATG;rbs_motif=GGAG/GAGG;rbs_spacer=5-10bp;gc_cont=0.322	WP_428949711.1 FKLRK protein [Staphylococcus aureus]	98.0	99.8	0.0
BAAHTU010000006.1_48|51430|52107|-1|ID=1_48;partial=00;start_type=ATG;rbs_motif=GGAG/GAGG;rbs_spacer=5-10bp;gc_cont=0.283	WP_000769163.1 MULTISPECIES: superantigen-like protein SSL11 [Staphylococcus]	100	99.6	1.11e-150
BAAHTU010000006.1_49|52490|53701|-1|ID=1_49;partial=00;start_type=ATG;rbs_motif=None;rbs_spacer=None;gc_cont=0.292	WP_000072584.1 MULTISPECIES: restriction endonuclease subunit S [Staphylococcus]	100	99.8	4.45e-285
BAAHTU010000006.1_50|53694|55250|-1|ID=1_50;partial=00;start_type=ATG;rbs_motif=GGAG/GAGG;rbs_spacer=5-10bp;gc_cont=0.384	WP_000028628.1 MULTISPECIES: type I restriction-modification system subunit M [Staphylococcus]	100	99.8	0.0
BAAHTU010000006.1_51|55514|56197|-1|ID=1_51;partial=00;start_type=ATG;rbs_motif=GGAG/GAGG;rbs_spacer=5-10bp;gc_cont=0.289	WP_000673051.1 MULTISPECIES: superantigen-like protein SSL10 [Staphylococcus]	100	99.6	3.45e-155
BAAHTU010000006.1_52|56563|57261|-1|ID=1_52;partial=00;start_type=ATG;rbs_motif=GGAG/GAGG;rbs_spacer=5-10bp;gc_cont=0.293	WP_000779446.1 MULTISPECIES: superantigen-like protein SSL9 [Staphylococcus]	100	99.6	2.15e-156
BAAHTU010000006.1_53|57641|58339|-1|ID=1_53;partial=00;start_type=ATG;rbs_motif=GGAG/GAGG;rbs_spacer=5-10bp;gc_cont=0.280	WP_000673479.1 MULTISPECIES: superantigen-like protein SSL8 [Staphylococcus]	100	99.6	4.33e-156
BAAHTU010000006.1_54|58683|59378|-1|ID=1_54;partial=00;start_type=GTG;rbs_motif=GGAG/GAGG;rbs_spacer=5-10bp;gc_cont=0.300	WP_000769836.1 MULTISPECIES: superantigen-like protein SSL7 [Bacteria]	100	99.6	1.40e-156
BAAHTU010000006.1_55|59799|60494|-1|ID=1_55;partial=00;start_type=ATG;rbs_motif=GGAG/GAGG;rbs_spacer=5-10bp;gc_cont=0.300	WP_000769845.1 MULTISPECIES: superantigen-like protein SSL6 [Staphylococcus]	100	99.6	3.30e-155
BAAHTU010000006.1_56|60940|61644|-1|ID=1_56;partial=00;start_type=ATG;rbs_motif=GGAG/GAGG;rbs_spacer=5-10bp;gc_cont=0.315	WP_000784244.1 MULTISPECIES: superantigen-like protein SSL5 [Staphylococcus]	100	99.6	1.03e-164
BAAHTU010000006.1_57|62008|62847|-1|ID=1_57;partial=00;start_type=ATG;rbs_motif=GGAG/GAGG;rbs_spacer=5-10bp;gc_cont=0.326	WP_055350566.1 superantigen-like protein SSL4 [Staphylococcus aureus]	100	99.6	3.28e-156
BAAHTU010000006.1_58|63212|64282|-1|ID=1_58;partial=00;start_type=ATG;rbs_motif=GGAG/GAGG;rbs_spacer=5-10bp;gc_cont=0.345	WP_411907945.1 superantigen-like protein SSL3 [Staphylococcus aureus]	95.5	99.7	3.69e-189
BAAHTU010000006.1_59|64573|65268|-1|ID=1_59;partial=00;start_type=ATG;rbs_motif=GGAG/GAGG;rbs_spacer=5-10bp;gc_cont=0.286	WP_000782618.1 MULTISPECIES: superantigen-like protein SSL2 [Staphylococcus]	100	99.6	1.07e-160
BAAHTU010000006.1_60|65554|66234|-1|ID=1_60;partial=00;start_type=ATG;rbs_motif=None;rbs_spacer=None;gc_cont=0.313	WP_000669005.1 MULTISPECIES: superantigen-like protein SSL1 [Staphylococcus]	100	99.6	5.29e-154
BAAHTU010000006.1_61|66706|67551|1|ID=1_61;partial=00;start_type=ATG;rbs_motif=AGGAG;rbs_spacer=5-10bp;gc_cont=0.357	WP_001024377.1 MULTISPECIES: SDR family oxidoreductase [Staphylococcus]	100	99.6	1.88e-204
BAAHTU010000006.1_62|67570|67929|1|ID=1_62;partial=00;start_type=GTG;rbs_motif=AGGAG;rbs_spacer=5-10bp;gc_cont=0.322	WP_001021618.1 DUF1304 domain-containing protein [Staphylococcus aureus]	99.2	99.2	6.69e-71
BAAHTU010000006.1_63|68453|68605|1|ID=1_63;partial=00;start_type=ATG;rbs_motif=AGGAG;rbs_spacer=5-10bp;gc_cont=0.261	WP_000248839.1 MULTISPECIES: hypothetical protein [Staphylococcus]	100	98.0	1.22e-26
BAAHTU010000006.1_64|68586|68825|1|ID=1_64;partial=00;start_type=ATG;rbs_motif=None;rbs_spacer=None;gc_cont=0.300	WP_000850683.1 hypothetical protein [Staphylococcus aureus]	100	81.3	9.00e-37
BAAHTU010000006.1_65|68866|69138|1|ID=1_65;partial=00;start_type=ATG;rbs_motif=None;rbs_spacer=None;gc_cont=0.253	WP_000159787.1 MULTISPECIES: transposase [Staphylococcus]	100	98.9	4.68e-53
BAAHTU010000006.1_66|69537|70241|1|ID=1_66;partial=00;start_type=ATG;rbs_motif=AGGA/GGAG/GAGG;rbs_spacer=11-12bp;gc_cont=0.281	WP_000041883.1 MULTISPECIES: type II toxin-antitoxin system PemK/MazF family toxin [Staphylococcus]	100	99.6	2.15e-157
BAAHTU010000006.1_67|70634|71170|1|ID=1_67;partial=00;start_type=ATG;rbs_motif=AGGA;rbs_spacer=5-10bp;gc_cont=0.279	WP_000551776.1 MULTISPECIES: hypothetical protein [Staphylococcus]	100	99.4	5.99e-125
BAAHTU010000006.1_68|71283|72824|-1|ID=1_68;partial=00;start_type=ATG;rbs_motif=AGGAG;rbs_spacer=5-10bp;gc_cont=0.372	WP_000424966.1 MULTISPECIES: glutamine-hydrolyzing GMP synthase [Staphylococcus]	100	99.8	0.0
BAAHTU010000006.1_69|72849|74315|-1|ID=1_69;partial=00;start_type=ATG;rbs_motif=GGAG/GAGG;rbs_spacer=5-10bp;gc_cont=0.374	WP_000264071.1 MULTISPECIES: IMP dehydrogenase [Staphylococcus]	100	99.8	0.0
BAAHTU010000006.1_70|74353|75621|-1|ID=1_70;partial=00;start_type=ATG;rbs_motif=GGAG/GAGG;rbs_spacer=5-10bp;gc_cont=0.359	WP_000793011.1 MULTISPECIES: xanthine permease PbuX [Staphylococcus]	100	99.8	2.23e-290
BAAHTU010000006.1_71|75621|76199|-1|ID=1_71;partial=00;start_type=GTG;rbs_motif=AGGAG;rbs_spacer=5-10bp;gc_cont=0.359	WP_000421410.1 MULTISPECIES: xanthine phosphoribosyltransferase [Staphylococcus]	100	99.5	5.64e-130
BAAHTU010000006.1_72|76712|77119|1|ID=1_72;partial=00;start_type=ATG;rbs_motif=GGA/GAG/AGG;rbs_spacer=5-10bp;gc_cont=0.331	WP_000763768.1 MULTISPECIES: general stress protein [Staphylococcus]	100	99.3	1.81e-87
BAAHTU010000006.1_73|77262|77924|1|ID=1_73;partial=00;start_type=ATG;rbs_motif=GGAG/GAGG;rbs_spacer=5-10bp;gc_cont=0.306	WP_000394698.1 MULTISPECIES: hypothetical protein [Staphylococcus]	100	99.5	8.20e-155
BAAHTU010000006.1_74|78042|78998|1|ID=1_74;partial=00;start_type=ATG;rbs_motif=AGGA;rbs_spacer=5-10bp;gc_cont=0.377	WP_372430064.1 hypothetical protein [Staphylococcus aureus]	99.7	99.7	1.94e-132
BAAHTU010000006.1_75|79975|81363|1|ID=1_75;partial=00;start_type=ATG;rbs_motif=AGGAG;rbs_spacer=5-10bp;gc_cont=0.392	WP_000991007.1 MULTISPECIES: L-cystine transporter [Staphylococcus]	100	99.8	2.61e-307
BAAHTU010000006.1_76|81444|82250|-1|ID=1_76;partial=00;start_type=TTG;rbs_motif=GGA/GAG/AGG;rbs_spacer=5-10bp;gc_cont=0.374	WP_001797637.1 oxygen-insensitive NADPH nitroreductase [Staphylococcus aureus]	99.6	94.4	6.85e-179
BAAHTU010000006.1_77|82691|83260|1|ID=1_77;partial=00;start_type=ATG;rbs_motif=AGGAG;rbs_spacer=5-10bp;gc_cont=0.370	WP_000052781.1 MULTISPECIES: alkyl hydroperoxide reductase subunit C [Staphylococcus]	99.5	99.5	1.77e-136
BAAHTU010000006.1_78|83276|84799|1|ID=1_78;partial=00;start_type=ATG;rbs_motif=AGGAGG;rbs_spacer=5-10bp;gc_cont=0.379	WP_000930486.1 MULTISPECIES: alkyl hydroperoxide reductase subunit F [Staphylococcus]	100	99.8	0.0
BAAHTU010000006.1_79|84914|85171|1|ID=1_79;partial=00;start_type=ATG;rbs_motif=GGA/GAG/AGG;rbs_spacer=5-10bp;gc_cont=0.318	WP_001795623.1 hypothetical protein [Staphylococcus aureus]	100	98.8	9.52e-53
BAAHTU010000006.1_80|85244|85870|1|ID=1_80;partial=00;start_type=ATG;rbs_motif=AGGA/GGAG/GAGG;rbs_spacer=11-12bp;gc_cont=0.303	WP_000746687.1 MULTISPECIES: NDxxF motif lipoprotein [Staphylococcus]	100	99.5	7.54e-136
BAAHTU010000006.1_81|86122|86508|1|ID=1_81;partial=00;start_type=ATG;rbs_motif=AGGA;rbs_spacer=5-10bp;gc_cont=0.315	WP_000868248.1 MULTISPECIES: hypothetical protein [Staphylococcus]	100	98.4	3.90e-74
BAAHTU010000006.1_82|86574|87155|-1|ID=1_82;partial=00;start_type=ATG;rbs_motif=AGGAG;rbs_spacer=5-10bp;gc_cont=0.321	WP_000158374.1 MULTISPECIES: histidine phosphatase family protein [Staphylococcus]	100	99.5	1.06e-139
BAAHTU010000006.1_83|87333|87542|1|ID=1_83;partial=00;start_type=ATG;rbs_motif=None;rbs_spacer=None;gc_cont=0.276	WP_000211676.1 MULTISPECIES: hypothetical protein [Staphylococcus]	100	98.6	5.93e-42
BAAHTU010000006.1_84|87581|87832|-1|ID=1_84;partial=00;start_type=ATG;rbs_motif=AGGAG;rbs_spacer=5-10bp;gc_cont=0.369	WP_050963020.1 GlsB/YeaQ/YmgE family stress response membrane protein [Staphylococcus aureus]	84.3	98.8	1.47e-37
BAAHTU010000006.1_85|88132|88395|1|ID=1_85;partial=00;start_type=ATG;rbs_motif=GGAG/GAGG;rbs_spacer=5-10bp;gc_cont=0.295	WP_001055897.1 MULTISPECIES: helix-turn-helix domain-containing protein [Staphylococcus]	100	98.9	1.21e-58
BAAHTU010000006.1_86|88533|89105|-1|ID=1_86;partial=00;start_type=ATG;rbs_motif=GGA/GAG/AGG;rbs_spacer=5-10bp;gc_cont=0.305	WP_000769720.1 MULTISPECIES: PepSY domain-containing protein [Staphylococcus]	100	99.5	8.29e-122
BAAHTU010000006.1_87|89286|89654|-1|ID=1_87;partial=00;start_type=TTG;rbs_motif=GGAG/GAGG;rbs_spacer=5-10bp;gc_cont=0.309	WP_108932421.1 YxeA family protein [Staphylococcus aureus]	100	99.2	1.62e-77
BAAHTU010000006.1_89|90023|90634|-1|ID=1_89;partial=00;start_type=ATG;rbs_motif=AGGAG;rbs_spacer=5-10bp;gc_cont=0.306	WP_000475326.1 MULTISPECIES: staphylococcal enterotoxin-like toxin X [Staphylococcus]	100	99.5	3.94e-140
BAAHTU010000006.1_90|90994|91152|1|ID=1_90;partial=00;start_type=ATG;rbs_motif=None;rbs_spacer=None;gc_cont=0.352	WP_000237577.1 integrase [Staphylococcus aureus]	100	98.1	7.16e-29
BAAHTU010000006.1_91|91230|91541|1|ID=1_91;partial=00;start_type=ATG;rbs_motif=None;rbs_spacer=None;gc_cont=0.337	WP_001797636.1 tyrosine-type recombinase/integrase [Staphylococcus aureus]	100	99.0	8.76e-64
BAAHTU010000006.1_92|91544|92518|1|ID=1_92;partial=00;start_type=TTG;rbs_motif=GGAG/GAGG;rbs_spacer=5-10bp;gc_cont=0.279	WP_001822249.1 MULTISPECIES: Abi family protein [Staphylococcus]	100	96.0	1.09e-224
BAAHTU010000006.1_93|93657|93842|-1|ID=1_93;partial=00;start_type=ATG;rbs_motif=GGA/GAG/AGG;rbs_spacer=5-10bp;gc_cont=0.301	YP_009218449.1 transcriptional regulator [Staphylococcus phage SA97]	100	98.4	2.96e-34
BAAHTU010000006.1_94|95025|95993|-1|ID=1_94;partial=00;start_type=ATG;rbs_motif=GGA/GAG/AGG;rbs_spacer=5-10bp;gc_cont=0.264	WP_000801979.1 MULTISPECIES: Abi family protein [Staphylococcus]	100	99.7	8.53e-233
BAAHTU010000006.1_95|96270|96839|-1|ID=1_95;partial=00;start_type=ATG;rbs_motif=GGAG/GAGG;rbs_spacer=5-10bp;gc_cont=0.382	WP_001293080.1 terminase small subunit [Staphylococcus aureus]	100	99.5	3.16e-130
BAAHTU010000006.1_96|96836|97177|-1|ID=1_96;partial=00;start_type=ATG;rbs_motif=None;rbs_spacer=None;gc_cont=0.298	WP_217151841.1 pathogenicity island protein [Staphylococcus aureus]	99.1	99.1	3.27e-75
BAAHTU010000006.1_97|97180|97707|-1|ID=1_97;partial=00;start_type=ATG;rbs_motif=GGA/GAG/AGG;rbs_spacer=5-10bp;gc_cont=0.309	WP_000771356.1 spore coat protein [Staphylococcus aureus]	100	99.4	5.77e-117
BAAHTU010000006.1_98|97758|97976|-1|ID=1_98;partial=00;start_type=ATG;rbs_motif=GGA/GAG/AGG;rbs_spacer=5-10bp;gc_cont=0.288	WP_000448775.1 MULTISPECIES: capsid morphogenesis B protein [Bacilli]	100	98.6	6.81e-38
BAAHTU010000006.1_99|97994|98572|-1|ID=1_99;partial=00;start_type=ATG;rbs_motif=GGA/GAG/AGG;rbs_spacer=5-10bp;gc_cont=0.299	WP_286209886.1 pathogenicity island protein [Staphylococcus aureus]	100	99.5	8.70e-109
BAAHTU010000006.1_100|98584|98925|-1|ID=1_100;partial=00;start_type=ATG;rbs_motif=GGAG/GAGG;rbs_spacer=5-10bp;gc_cont=0.316	WP_117217112.1 pathogenicity island protein [Staphylococcus aureus]	99.1	99.1	4.64e-75
BAAHTU010000006.1_101|99272|99913|-1|ID=1_101;partial=00;start_type=ATG;rbs_motif=AGGAG;rbs_spacer=5-10bp;gc_cont=0.341	WP_031385342.1 pathogenicity island protein [Staphylococcus aureus]	99.5	99.5	3.78e-152
BAAHTU010000006.1_102|99910|100194|-1|ID=1_102;partial=00;start_type=ATG;rbs_motif=GGAG/GAGG;rbs_spacer=5-10bp;gc_cont=0.337	WP_437248130.1 pathogenicity island protein [Staphylococcus aureus]	98.9	98.9	3.19e-64
BAAHTU010000006.1_103|100196|100558|-1|ID=1_103;partial=00;start_type=ATG;rbs_motif=AGGAG;rbs_spacer=5-10bp;gc_cont=0.331	WP_108932420.1 pathogenicity island protein [Staphylococcus aureus]	100	99.2	3.29e-85
BAAHTU010000006.1_104|100844|102313|-1|ID=1_104;partial=00;start_type=TTG;rbs_motif=GGAG/GAGG;rbs_spacer=5-10bp;gc_cont=0.348	WP_001795628.1 virulence-associated E family protein [Staphylococcus aureus]	100	99.8	0.0
BAAHTU010000006.1_105|102330|103199|-1|ID=1_105;partial=00;start_type=ATG;rbs_motif=GGAG/GAGG;rbs_spacer=5-10bp;gc_cont=0.345	WP_001002700.1 primase alpha helix C-terminal domain-containing protein [Staphylococcus aureus]	100	99.7	4.83e-211
BAAHTU010000006.1_106|103263|103580|-1|ID=1_106;partial=00;start_type=ATG;rbs_motif=AGGAG;rbs_spacer=5-10bp;gc_cont=0.286	WP_001103936.1 type II toxin-antitoxin system toxin TscT [Staphylococcus aureus]	100	99.1	9.01e-67
BAAHTU010000006.1_107|103583|103792|-1|ID=1_107;partial=00;start_type=ATG;rbs_motif=AGGAG;rbs_spacer=5-10bp;gc_cont=0.295	WP_001058486.1 MULTISPECIES: type II toxin-antitoxin system antitoxin TscA [Staphylococcus]	100	98.6	2.83e-40
BAAHTU010000006.1_108|103785|103952|-1|ID=1_108;partial=00;start_type=ATG;rbs_motif=None;rbs_spacer=None;gc_cont=0.280	WP_148121253.1 pathogenicity island protein [Staphylococcus aureus]	97.9	85.7	1.35e-22
BAAHTU010000006.1_109|103943|104215|-1|ID=1_109;partial=00;start_type=ATG;rbs_motif=AGGA/GGAG/GAGG;rbs_spacer=11-12bp;gc_cont=0.341	WP_000091734.1 helix-turn-helix domain-containing protein [Staphylococcus aureus]	100	98.9	6.13e-58
BAAHTU010000006.1_110|104216|104428|-1|ID=1_110;partial=00;start_type=ATG;rbs_motif=GGAG/GAGG;rbs_spacer=5-10bp;gc_cont=0.310	WP_000794656.1 helix-turn-helix domain-containing protein [Staphylococcus aureus]	100	98.6	9.04e-42
BAAHTU010000006.1_111|104572|105267|1|ID=1_111;partial=00;start_type=ATG;rbs_motif=GGAG/GAGG;rbs_spacer=5-10bp;gc_cont=0.228	WP_000668212.1 helix-turn-helix domain-containing protein [Staphylococcus aureus]	100	99.6	6.33e-121
BAAHTU010000006.1_112|105723|106940|1|ID=1_112;partial=00;start_type=ATG;rbs_motif=AGGAG;rbs_spacer=5-10bp;gc_cont=0.336	WP_000270130.1 tyrosine-type recombinase/integrase [Staphylococcus aureus]	100	99.8	6.34e-286
BAAHTU010000006.1_113|106937|107404|1|ID=1_113;partial=00;start_type=ATG;rbs_motif=AGGAGG;rbs_spacer=5-10bp;gc_cont=0.299	WP_326033815.1 hypothetical protein [Staphylococcus xylosus]	70.3	99.4	4.83e-72
BAAHTU010000006.1_114|107423|108253|1|ID=1_114;partial=00;start_type=ATG;rbs_motif=GGA/GAG/AGG;rbs_spacer=5-10bp;gc_cont=0.304	WP_000357934.1 KilA-N domain-containing protein [Staphylococcus aureus]	100	99.6	5.36e-197
BAAHTU010000006.1_115|108435|108677|-1|ID=1_115;partial=00;start_type=ATG;rbs_motif=AGGAG;rbs_spacer=5-10bp;gc_cont=0.374	WP_000897044.1 MULTISPECIES: 30S ribosomal protein S18 [Bacteria]	100	98.8	3.02e-49
BAAHTU010000006.1_116|108729|109232|-1|ID=1_116;partial=00;start_type=ATG;rbs_motif=GGAG/GAGG;rbs_spacer=5-10bp;gc_cont=0.381	WP_061839556.1 single-stranded DNA-binding protein [Staphylococcus aureus]	91.6	99.4	1.08e-99
BAAHTU010000006.1_117|109253|109549|-1|ID=1_117;partial=00;start_type=ATG;rbs_motif=AGGAG(G)/GGAGG;rbs_spacer=13-15bp;gc_cont=0.377	WP_001261460.1 MULTISPECIES: 30S ribosomal protein S6 [Bacteria]	100	99.0	3.52e-63
BAAHTU010000006.1_118|109793|109984|1|ID=1_118;partial=00;start_type=ATG;rbs_motif=GGAG/GAGG;rbs_spacer=5-10bp;gc_cont=0.312	WP_001052483.1 MULTISPECIES: hypothetical protein [Staphylococcus]	100	98.4	9.23e-41
BAAHTU010000006.1_119|110070|111167|-1|ID=1_119;partial=00;start_type=ATG;rbs_motif=AGGAG;rbs_spacer=5-10bp;gc_cont=0.353	WP_001218732.1 MULTISPECIES: redox-regulated ATPase YchF [Staphylococcus]	100	99.7	2.44e-256
BAAHTU010000006.1_120|111179|111382|-1|ID=1_120;partial=00;start_type=ATG;rbs_motif=GGAG/GAGG;rbs_spacer=5-10bp;gc_cont=0.289	WP_000157345.1 MULTISPECIES: DUF951 domain-containing protein [Staphylococcus]	100	98.5	1.48e-41
BAAHTU010000006.1_121|111412|112293|-1|ID=1_121;partial=00;start_type=ATG;rbs_motif=AGGA/GGAG/GAGG;rbs_spacer=11-12bp;gc_cont=0.307	WP_001077602.1 MULTISPECIES: mechanosensitive ion channel family protein [Staphylococcus]	100	99.7	4.03e-150
BAAHTU010000006.1_122|112450|113295|-1|ID=1_122;partial=00;start_type=GTG;rbs_motif=None;rbs_spacer=None;gc_cont=0.339	WP_001550052.1 MULTISPECIES: ParB/RepB/Spo0J family partition protein [Staphylococcus]	100	99.6	1.57e-187
