BAAHTL010000001.1_357|385075|386070|1|ID=1_357;partial=00;start_type=ATG;rbs_motif=AGGAG;rbs_spacer=5-10bp;gc_cont=0.385	WP_000924993.1 MULTISPECIES: staphyloferrin B ABC transporter permease subunit SirB [Staphylococcus]	100	99.7	7.19e-209
BAAHTL010000001.1_358|386067|387065|1|ID=1_358;partial=00;start_type=ATG;rbs_motif=AGGA/GGAG/GAGG;rbs_spacer=11-12bp;gc_cont=0.371	WP_000136643.1 MULTISPECIES: staphyloferrin B ABC transporter permease subunit SirC [Staphylococcus]	100	99.7	2.43e-212
BAAHTL010000001.1_359|387434|388186|1|ID=1_359;partial=00;start_type=ATG;rbs_motif=AGGAG;rbs_spacer=5-10bp;gc_cont=0.275	WP_000876756.1 MULTISPECIES: HTH-type transcriptional regulator SarS [Staphylococcus]	100	99.6	3.84e-168
BAAHTL010000001.1_360|388571|389989|1|ID=1_360;partial=00;start_type=ATG;rbs_motif=None;rbs_spacer=None;gc_cont=0.372	WP_049882064.1 staphylococcal protein A [Staphylococcus aureus]	99.8	99.8	6.92e-285
BAAHTL010000001.1_361|390318|391910|-1|ID=1_361;partial=00;start_type=ATG;rbs_motif=GGAG/GAGG;rbs_spacer=5-10bp;gc_cont=0.345	WP_000173904.1 MULTISPECIES: L-lactate permease [Staphylococcus]	100	99.8	0.0
BAAHTL010000001.1_362|392172|392645|-1|ID=1_362;partial=00;start_type=ATG;rbs_motif=GGAG/GAGG;rbs_spacer=5-10bp;gc_cont=0.300	WP_000036329.1 MULTISPECIES: DUF1648 domain-containing protein [Staphylococcus]	100	99.4	8.49e-108
BAAHTL010000001.1_363|392996|394771|1|ID=1_363;partial=00;start_type=ATG;rbs_motif=AGGA;rbs_spacer=5-10bp;gc_cont=0.358	WP_000291838.1 MULTISPECIES: oleate hydratase [Staphylococcus]	100	99.8	0.0
BAAHTL010000001.1_364|395089|396756|1|ID=1_364;partial=00;start_type=ATG;rbs_motif=GGAG/GAGG;rbs_spacer=5-10bp;gc_cont=0.358	WP_001800966.1 MULTISPECIES: Na/Pi cotransporter family protein [Staphylococcus]	100	99.5	0.0
BAAHTL010000001.1_365|397243|398631|-1|ID=1_365;partial=00;start_type=ATG;rbs_motif=AGGAG;rbs_spacer=5-10bp;gc_cont=0.371	WP_001006425.1 MULTISPECIES: multidrug efflux MFS transporter NorC [Staphylococcus]	100	99.8	4.05e-311
BAAHTL010000001.1_366|398633|399811|-1|ID=1_366;partial=00;start_type=ATG;rbs_motif=AGGAG;rbs_spacer=5-10bp;gc_cont=0.369	WP_001075820.1 MULTISPECIES: M20 family metallopeptidase [Staphylococcus]	100	99.7	3.96e-287
BAAHTL010000001.1_367|399962|402199|-1|ID=1_367;partial=00;start_type=ATG;rbs_motif=GGAG/GAGG;rbs_spacer=5-10bp;gc_cont=0.336	WP_001188468.1 MULTISPECIES: transcriptional regulator AryK [Staphylococcus]	100	99.9	0.0
BAAHTL010000001.1_369|402451|402762|-1|ID=1_369;partial=00;start_type=ATG;rbs_motif=AGGA/GGAG/GAGG;rbs_spacer=11-12bp;gc_cont=0.321	WP_000512631.1 MULTISPECIES: hypothetical protein [Staphylococcus]	100	99.0	1.91e-67
BAAHTL010000001.1_370|402766|403095|-1|ID=1_370;partial=00;start_type=ATG;rbs_motif=GGA/GAG/AGG;rbs_spacer=5-10bp;gc_cont=0.273	WP_001804823.1 MULTISPECIES: hypothetical protein [Staphylococcus]	100	98.2	4.58e-64
BAAHTL010000001.1_371|403092|404468|-1|ID=1_371;partial=00;start_type=ATG;rbs_motif=GGAG/GAGG;rbs_spacer=5-10bp;gc_cont=0.339	WP_001029555.1 MULTISPECIES: hypothetical protein [Staphylococcus]	100	99.8	0.0
BAAHTL010000001.1_372|404471|405235|-1|ID=1_372;partial=00;start_type=GTG;rbs_motif=GGA/GAG/AGG;rbs_spacer=5-10bp;gc_cont=0.277	WP_001793247.1 MULTISPECIES: tandem-type lipoprotein [Staphylococcus]	100	99.6	1.72e-182
BAAHTL010000001.1_373|405514|406317|-1|ID=1_373;partial=00;start_type=ATG;rbs_motif=None;rbs_spacer=None;gc_cont=0.284	WP_000597213.1 MULTISPECIES: tandem-type lipoprotein [Staphylococcus]	100	95.5	1.01e-178
BAAHTL010000001.1_374|406336|407106|-1|ID=1_374;partial=00;start_type=ATG;rbs_motif=GGA/GAG/AGG;rbs_spacer=5-10bp;gc_cont=0.296	WP_000977768.1 tandem-type lipoprotein [Staphylococcus aureus]	100	99.6	1.65e-181
BAAHTL010000001.1_375|407327|408313|-1|ID=1_375;partial=00;start_type=ATG;rbs_motif=AGxAG;rbs_spacer=5-10bp;gc_cont=0.332	WP_000710575.1 MULTISPECIES: phosphatidylinositol-specific phospholipase C [Staphylococcus]	100	99.7	2.67e-239
BAAHTL010000001.1_376|408518|409000|-1|ID=1_376;partial=00;start_type=ATG;rbs_motif=None;rbs_spacer=None;gc_cont=0.319	WP_000410568.1 MULTISPECIES: hypothetical protein [Staphylococcus]	100	99.4	4.67e-102
BAAHTL010000001.1_377|409057|412209|-1|ID=1_377;partial=00;start_type=ATG;rbs_motif=GGA/GAG/AGG;rbs_spacer=5-10bp;gc_cont=0.314	WP_000080559.1 MULTISPECIES: DEAD/DEAH box helicase [Staphylococcus]	100	99.9	0.0
BAAHTL010000001.1_378|412476|413078|-1|ID=1_378;partial=00;start_type=ATG;rbs_motif=GGA/GAG/AGG;rbs_spacer=5-10bp;gc_cont=0.297	WP_000908953.1 MULTISPECIES: hypothetical protein [Staphylococcus]	100	99.5	4.40e-131
BAAHTL010000001.1_379|413512|414255|-1|ID=1_379;partial=00;start_type=GTG;rbs_motif=None;rbs_spacer=None;gc_cont=0.263	WP_001793250.1 MULTISPECIES: LysR family transcriptional regulator [Staphylococcus]	100	99.6	3.56e-167
BAAHTL010000001.1_380|414346|414879|1|ID=1_380;partial=00;start_type=ATG;rbs_motif=AGxAGG/AGGxGG;rbs_spacer=5-10bp;gc_cont=0.262	WP_000543163.1 MULTISPECIES: DUF4865 family protein [Staphylococcus]	100	99.4	2.35e-126
BAAHTL010000001.1_381|415234|416094|-1|ID=1_381;partial=00;start_type=TTG;rbs_motif=AGGAG;rbs_spacer=5-10bp;gc_cont=0.278	WP_001052510.1 MULTISPECIES: LysR family transcriptional regulator [Staphylococcus]	100	99.7	2.35e-196
BAAHTL010000001.1_382|416207|416758|1|ID=1_382;partial=00;start_type=ATG;rbs_motif=AGGAG;rbs_spacer=5-10bp;gc_cont=0.312	WP_000627024.1 MULTISPECIES: flavodoxin family protein [Staphylococcus]	100	99.5	9.51e-129
BAAHTL010000001.1_383|416751|417971|1|ID=1_383;partial=00;start_type=ATG;rbs_motif=GGA/GAG/AGG;rbs_spacer=5-10bp;gc_cont=0.291	WP_000130763.1 MULTISPECIES: MFS transporter [Staphylococcus]	100	99.8	6.16e-273
BAAHTL010000001.1_384|418043|418339|-1|ID=1_384;partial=00;start_type=ATG;rbs_motif=AGGAG;rbs_spacer=5-10bp;gc_cont=0.316	WP_000201640.1 MULTISPECIES: TfoX/Sxy family protein [Staphylococcus]	100	99.0	3.52e-63
BAAHTL010000001.1_385|418388|418591|-1|ID=1_385;partial=00;start_type=ATG;rbs_motif=GGA/GAG/AGG;rbs_spacer=5-10bp;gc_cont=0.265	WP_000398679.1 MULTISPECIES: DUF6007 family protein [Staphylococcus]	100	98.5	4.80e-38
BAAHTL010000001.1_386|418900|419886|1|ID=1_386;partial=00;start_type=ATG;rbs_motif=None;rbs_spacer=None;gc_cont=0.389	WP_000662031.1 MULTISPECIES: tRNA dihydrouridine synthase [Staphylococcus]	100	99.7	1.88e-239
BAAHTL010000001.1_387|420553|421746|-1|ID=1_387;partial=00;start_type=ATG;rbs_motif=AGGA;rbs_spacer=5-10bp;gc_cont=0.326	WP_001033018.1 MULTISPECIES: type II sulfide:quinone oxidoreductase Sqr [Staphylococcus]	100	99.7	1.78e-297
BAAHTL010000001.1_388|421765|423099|-1|ID=1_388;partial=00;start_type=ATG;rbs_motif=AGGAG;rbs_spacer=5-10bp;gc_cont=0.336	WP_000465472.1 MULTISPECIES: persulfide dioxygenase-sulfurtransferase CstB [Staphylococcus]	100	99.8	0.0
BAAHTL010000001.1_389|423130|424197|-1|ID=1_389;partial=00;start_type=ATG;rbs_motif=GGAG/GAGG;rbs_spacer=5-10bp;gc_cont=0.317	WP_000816129.1 MULTISPECIES: persulfide response sulfurtransferase CstA [Staphylococcus]	100	99.7	4.88e-251
BAAHTL010000001.1_390|424334|424594|1|ID=1_390;partial=00;start_type=ATG;rbs_motif=GGAG/GAGG;rbs_spacer=5-10bp;gc_cont=0.310	WP_001105087.1 MULTISPECIES: persulfide-sensing transcriptional repressor CstR [Staphylococcus]	100	98.9	1.96e-50
BAAHTL010000001.1_391|424594|425349|1|ID=1_391;partial=00;start_type=ATG;rbs_motif=None;rbs_spacer=None;gc_cont=0.315	WP_000355844.1 MULTISPECIES: sulfite exporter TauE/SafE family protein [Staphylococcus]	100	99.6	2.75e-157
BAAHTL010000001.1_392|425700|425795|1|ID=1_392;partial=00;start_type=ATG;rbs_motif=None;rbs_spacer=None;gc_cont=0.375	WP_078071968.1 tRNA-dihydrouridine synthase, partial [Staphylococcus aureus]	100	90.6	9.45e-09
BAAHTL010000001.1_393|425900|426373|-1|ID=1_393;partial=00;start_type=TTG;rbs_motif=AGxAG;rbs_spacer=5-10bp;gc_cont=0.278	WP_000455974.1 MULTISPECIES: GNAT family N-acetyltransferase [Staphylococcus]	100	99.4	1.65e-105
BAAHTL010000001.1_394|426514|426702|-1|ID=1_394;partial=00;start_type=ATG;rbs_motif=None;rbs_spacer=None;gc_cont=0.233	WP_411393032.1 exotoxin beta-grasp domain-containing protein [Staphylococcus aureus]	100	98.4	2.49e-37
BAAHTL010000001.1_395|427269|427994|-1|ID=1_395;partial=00;start_type=ATG;rbs_motif=AGGAG;rbs_spacer=5-10bp;gc_cont=0.260	WP_000608674.1 MULTISPECIES: staphylococcal enterotoxin type H [Staphylococcus]	100	99.6	3.19e-167
BAAHTL010000001.1_396|428370|428480|1|ID=1_396;partial=00;start_type=ATG;rbs_motif=None;rbs_spacer=None;gc_cont=0.351	WP_000251972.1 helix-turn-helix domain-containing protein [Staphylococcus aureus]	100	97.3	1.07e-19
BAAHTL010000001.1_397|428648|429277|1|ID=1_397;partial=00;start_type=ATG;rbs_motif=None;rbs_spacer=None;gc_cont=0.297	WP_216805812.1 DDE-type integrase/transposase/recombinase, partial [Staphylococcus aureus]	100	99.5	9.35e-144
BAAHTL010000001.1_398|429749|431005|-1|ID=1_398;partial=00;start_type=ATG;rbs_motif=AGGAG;rbs_spacer=5-10bp;gc_cont=0.278	WP_000566666.1 MULTISPECIES: MrcB family domain-containing protein [Staphylococcus]	100	99.8	3.50e-301
BAAHTL010000001.1_399|431544|432164|-1|ID=1_399;partial=00;start_type=ATG;rbs_motif=GGA/GAG/AGG;rbs_spacer=5-10bp;gc_cont=0.303	WP_000673114.1 MULTISPECIES: hypothetical protein [Staphylococcus]	100	99.5	2.03e-148
BAAHTL010000001.1_400|432293|432664|-1|ID=1_400;partial=00;start_type=TTG;rbs_motif=None;rbs_spacer=None;gc_cont=0.258	WP_001549968.1 MULTISPECIES: HNH endonuclease [Staphylococcus]	100	99.2	1.01e-85
BAAHTL010000001.1_401|432661|432798|-1|ID=1_401;partial=00;start_type=ATG;rbs_motif=None;rbs_spacer=None;gc_cont=0.261	WP_325967054.1 MULTISPECIES: HNH endonuclease [Staphylococcus]	100	95.7	7.99e-22
BAAHTL010000001.1_402|432917|433921|1|ID=1_402;partial=00;start_type=ATG;rbs_motif=GGAG/GAGG;rbs_spacer=5-10bp;gc_cont=0.337	WP_331240474.1 persulfide dioxygenase-sulfurtransferase CstB [Staphylococcus aureus]	98.7	91.0	6.68e-222
BAAHTL010000001.1_403|434545|436035|-1|ID=1_403;partial=00;start_type=TTG;rbs_motif=GGAG/GAGG;rbs_spacer=5-10bp;gc_cont=0.286	WP_000554504.1 MULTISPECIES: RNA-binding domain-containing protein [Staphylococcus]	100	99.8	0.0
