BAAHSY010000001.1_239|247220|247453|1|ID=1_239;partial=00;start_type=ATG;rbs_motif=GGAG/GAGG;rbs_spacer=5-10bp;gc_cont=0.303	WP_000556760.1 MULTISPECIES: preprotein translocase subunit SecG [Staphylococcus]	100	98.7	2.46e-40
BAAHSY010000001.1_240|247569|248309|1|ID=1_240;partial=00;start_type=ATG;rbs_motif=GGAG/GAGG;rbs_spacer=5-10bp;gc_cont=0.337	WP_001165952.1 MULTISPECIES: alpha/beta hydrolase [Staphylococcus]	100	99.6	2.85e-177
BAAHSY010000001.1_241|248343|250715|1|ID=1_241;partial=00;start_type=ATG;rbs_motif=AGGAG;rbs_spacer=5-10bp;gc_cont=0.348	WP_001050064.1 MULTISPECIES: ribonuclease R [Staphylococcus]	100	99.9	0.0
BAAHSY010000001.1_242|250737|251201|1|ID=1_242;partial=00;start_type=ATG;rbs_motif=GGAG/GAGG;rbs_spacer=5-10bp;gc_cont=0.363	WP_001085185.1 MULTISPECIES: SsrA-binding protein SmpB [Staphylococcus]	100	99.4	1.53e-104
BAAHSY010000001.1_243|251975|252256|1|ID=1_243;partial=00;start_type=ATG;rbs_motif=None;rbs_spacer=None;gc_cont=0.294	WP_001788408.1 MULTISPECIES: hypothetical protein [Staphylococcus]	100	98.9	1.73e-54
BAAHSY010000001.1_244|252523|252846|-1|ID=1_244;partial=00;start_type=ATG;rbs_motif=GGA/GAG/AGG;rbs_spacer=5-10bp;gc_cont=0.241	WP_001058299.1 MULTISPECIES: hypothetical protein [Staphylococcus]	100	99.1	5.81e-64
BAAHSY010000001.1_245|253200|253928|-1|ID=1_245;partial=00;start_type=ATG;rbs_motif=AGGAG;rbs_spacer=5-10bp;gc_cont=0.273	WP_000757405.1 DUF5067 domain-containing protein [Staphylococcus aureus]	100	99.6	5.89e-143
BAAHSY010000001.1_246|254527|254970|1|ID=1_246;partial=00;start_type=ATG;rbs_motif=AGGA/GGAG/GAGG;rbs_spacer=11-12bp;gc_cont=0.300	WP_191972620.1 hypothetical protein, partial [Staphylococcus aureus]	100	99.3	2.27e-96
BAAHSY010000001.1_247|255187|255717|1|ID=1_247;partial=00;start_type=ATG;rbs_motif=AGGAG;rbs_spacer=5-10bp;gc_cont=0.348	WP_001167175.1 MULTISPECIES: GNAT family N-acetyltransferase [Staphylococcus]	100	99.4	6.75e-121
BAAHSY010000001.1_248|255980|258439|1|ID=1_248;partial=00;start_type=ATG;rbs_motif=GGAG/GAGG;rbs_spacer=5-10bp;gc_cont=0.385	WP_031901475.1 MSCRAMM family adhesin clumping factor ClfA [Staphylococcus aureus]	97.8	99.9	0.0
BAAHSY010000001.1_249|258660|260186|1|ID=1_249;partial=00;start_type=TTG;rbs_motif=AGGAG;rbs_spacer=5-10bp;gc_cont=0.297	WP_000791729.1 von Willebrand factor binding protein Vwb [Staphylococcus aureus]	100	99.8	0.0
BAAHSY010000001.1_250|260537|261559|1|ID=1_250;partial=00;start_type=ATG;rbs_motif=AGGAG;rbs_spacer=5-10bp;gc_cont=0.318	WP_000728056.1 MULTISPECIES: extracellular matrix protein-binding adhesin Emp [Staphylococcus]	100	99.7	2.58e-243
BAAHSY010000001.1_251|261894|262364|1|ID=1_251;partial=00;start_type=ATG;rbs_motif=GGAG/GAGG;rbs_spacer=5-10bp;gc_cont=0.335	WP_000824472.1 MULTISPECIES: hypothetical protein [Staphylococcus]	100	99.4	4.21e-103
BAAHSY010000001.1_252|262705|263391|1|ID=1_252;partial=00;start_type=ATG;rbs_motif=GGAG/GAGG;rbs_spacer=5-10bp;gc_cont=0.341	WP_001548082.1 MULTISPECIES: thermonuclease family protein [Staphylococcus]	100	99.6	5.92e-152
BAAHSY010000001.1_253|263748|263948|1|ID=1_253;partial=00;start_type=ATG;rbs_motif=GGAG/GAGG;rbs_spacer=5-10bp;gc_cont=0.398	WP_001059082.1 MULTISPECIES: cold-shock protein [Staphylococcus]	100	98.5	5.63e-41
BAAHSY010000001.1_254|264444|264662|-1|ID=1_254;partial=00;start_type=ATG;rbs_motif=AGGA/GGAG/GAGG;rbs_spacer=11-12bp;gc_cont=0.315	WP_000005886.1 MULTISPECIES: hypothetical protein [Staphylococcus]	100	98.6	1.53e-43
BAAHSY010000001.1_255|264724|265008|-1|ID=1_255;partial=00;start_type=TTG;rbs_motif=AGGAG;rbs_spacer=5-10bp;gc_cont=0.277	WP_001004395.1 MULTISPECIES: hypothetical protein [Staphylococcus]	100	98.9	1.07e-62
BAAHSY010000001.1_256|265096|265665|-1|ID=1_256;partial=00;start_type=GTG;rbs_motif=AGGAG;rbs_spacer=5-10bp;gc_cont=0.312	WP_001106654.1 MULTISPECIES: lipoprotein N-acylation protein LnsA [Staphylococcus]	100	99.5	2.51e-136
BAAHSY010000001.1_257|265853|266041|-1|ID=1_257;partial=00;start_type=ATG;rbs_motif=AGGAG;rbs_spacer=5-10bp;gc_cont=0.286	WP_000052078.1 MULTISPECIES: type II toxin-antitoxin system toxin TsaT [Staphylococcus]	100	98.4	4.91e-29
BAAHSY010000001.1_258|266070|266330|-1|ID=1_258;partial=00;start_type=ATG;rbs_motif=GGA/GAG/AGG;rbs_spacer=5-10bp;gc_cont=0.249	WP_001059690.1 MULTISPECIES: type II toxin-antitoxin system antitoxin TsaA [Staphylococcaceae]	100	98.9	1.14e-49
BAAHSY010000001.1_259|266653|266874|1|ID=1_259;partial=00;start_type=ATG;rbs_motif=None;rbs_spacer=None;gc_cont=0.333	WP_000145163.1 MULTISPECIES: sterile alpha motif-like domain-containing protein [Staphylococcus]	100	90.5	1.34e-41
BAAHSY010000001.1_260|266871|267107|-1|ID=1_260;partial=00;start_type=ATG;rbs_motif=AGGAG;rbs_spacer=5-10bp;gc_cont=0.270	WP_000368687.1 MULTISPECIES: hypothetical protein [Staphylococcus]	100	98.7	4.14e-55
BAAHSY010000001.1_261|267329|267913|1|ID=1_261;partial=00;start_type=TTG;rbs_motif=GGAG/GAGG;rbs_spacer=5-10bp;gc_cont=0.349	WP_001140686.1 histidine phosphatase family protein [Staphylococcus aureus]	99.5	99.0	3.16e-139
BAAHSY010000001.1_262|267986|268603|-1|ID=1_262;partial=00;start_type=ATG;rbs_motif=None;rbs_spacer=None;gc_cont=0.303	WP_000255561.1 MULTISPECIES: LysE/ArgO family amino acid transporter [Staphylococcus]	100	99.5	1.45e-127
BAAHSY010000001.1_263|268758|269252|-1|ID=1_263;partial=00;start_type=ATG;rbs_motif=AGGAG;rbs_spacer=5-10bp;gc_cont=0.293	WP_000569884.1 MULTISPECIES: GNAT family N-acetyltransferase [Staphylococcus]	100	99.4	3.28e-113
BAAHSY010000001.1_264|269651|270073|-1|ID=1_264;partial=00;start_type=ATG;rbs_motif=AGGAG;rbs_spacer=5-10bp;gc_cont=0.359	WP_000974460.1 MULTISPECIES: organic hydroperoxide resistance protein [Staphylococcus]	100	99.3	4.38e-95
BAAHSY010000001.1_265|270221|270937|1|ID=1_265;partial=00;start_type=ATG;rbs_motif=GGAG/GAGG;rbs_spacer=5-10bp;gc_cont=0.328	WP_000150017.1 MULTISPECIES: type I 3-dehydroquinate dehydratase [Staphylococcus]	100	99.6	5.72e-164
BAAHSY010000001.1_266|271020|271559|1|ID=1_266;partial=00;start_type=ATG;rbs_motif=AGGAG;rbs_spacer=5-10bp;gc_cont=0.330	WP_000422909.1 MULTISPECIES: nitroreductase family protein [Staphylococcus]	100	99.4	4.93e-129
BAAHSY010000001.1_267|271709|272029|-1|ID=1_267;partial=00;start_type=ATG;rbs_motif=AGGAG;rbs_spacer=5-10bp;gc_cont=0.336	WP_001190695.1 MULTISPECIES: thioredoxin family protein [Staphylococcus]	100	99.1	1.87e-73
BAAHSY010000001.1_268|272173|272529|1|ID=1_268;partial=00;start_type=ATG;rbs_motif=AGGAGG;rbs_spacer=5-10bp;gc_cont=0.297	WP_000589549.1 MULTISPECIES: arsenate reductase family protein [Staphylococcus]	100	99.2	2.16e-80
BAAHSY010000001.1_269|272687|273067|1|ID=1_269;partial=00;start_type=TTG;rbs_motif=AGGAG;rbs_spacer=5-10bp;gc_cont=0.333	WP_000290485.1 MULTISPECIES: glycine cleavage system protein GcvH [Staphylococcus]	100	99.2	2.76e-80
BAAHSY010000001.1_270|273131|273244|1|ID=1_270;partial=00;start_type=ATG;rbs_motif=GGA/GAG/AGG;rbs_spacer=11-12bp;gc_cont=0.219	WP_000660172.1 hypothetical protein [Staphylococcus aureus]	100	97.4	6.38e-17
BAAHSY010000001.1_271|273246|274124|1|ID=1_271;partial=00;start_type=ATG;rbs_motif=GGA/GAG/AGG;rbs_spacer=5-10bp;gc_cont=0.333	WP_000932219.1 YwqG family protein [Staphylococcus aureus]	100	99.7	2.31e-215
BAAHSY010000001.1_272|274866|275252|1|ID=1_272;partial=00;start_type=ATG;rbs_motif=GGA/GAG/AGG;rbs_spacer=5-10bp;gc_cont=0.305	WP_001018962.1 MULTISPECIES: toprim domain-containing protein [Staphylococcus]	100	99.2	3.08e-87
BAAHSY010000001.1_273|275245|275541|1|ID=1_273;partial=00;start_type=ATG;rbs_motif=None;rbs_spacer=None;gc_cont=0.276	WP_001065801.1 MULTISPECIES: thioredoxin family protein [Staphylococcus]	100	99.0	5.19e-65
BAAHSY010000001.1_274|275791|276816|1|ID=1_274;partial=00;start_type=GTG;rbs_motif=GGAG/GAGG;rbs_spacer=5-10bp;gc_cont=0.348	WP_000571218.1 MULTISPECIES: methionine ABC transporter ATP-binding protein [Staphylococcus]	100	99.7	2.87e-236
BAAHSY010000001.1_275|276809|277504|1|ID=1_275;partial=00;start_type=ATG;rbs_motif=GGAG/GAGG;rbs_spacer=5-10bp;gc_cont=0.349	WP_428701096.1 methionine ABC transporter permease [Staphylococcus aureus]	99.6	99.6	5.36e-129
BAAHSY010000001.1_276|277522|278343|1|ID=1_276;partial=00;start_type=ATG;rbs_motif=None;rbs_spacer=None;gc_cont=0.299	WP_000732326.1 MULTISPECIES: MetQ/NlpA family ABC transporter substrate-binding protein [Staphylococcus]	100	99.6	8.83e-190
BAAHSY010000001.1_277|278486|279706|-1|ID=1_277;partial=00;start_type=ATG;rbs_motif=AGGAGG;rbs_spacer=5-10bp;gc_cont=0.318	WP_000266158.1 MULTISPECIES: tyrosine-type recombinase/integrase [Staphylococcus]	100	99.8	3.04e-289
BAAHSY010000001.1_278|279794|280522|-1|ID=1_278;partial=00;start_type=ATG;rbs_motif=AGGAG;rbs_spacer=5-10bp;gc_cont=0.267	WP_000734020.1 staphylococcal enterotoxin type K [Staphylococcus aureus]	100	99.6	2.63e-171
BAAHSY010000001.1_279|280546|281274|-1|ID=1_279;partial=00;start_type=ATG;rbs_motif=AGGAG;rbs_spacer=5-10bp;gc_cont=0.284	WP_001033321.1 MULTISPECIES: staphylococcal enterotoxin type Q [Staphylococcus]	100	99.6	4.55e-172
BAAHSY010000001.1_280|281291|281749|-1|ID=1_280;partial=00;start_type=ATG;rbs_motif=GGA/GAG/AGG;rbs_spacer=5-10bp;gc_cont=0.331	WP_000281658.1 MULTISPECIES: ImmA/IrrE family metallo-endopeptidase [Staphylococcus]	100	99.3	3.93e-106
BAAHSY010000001.1_281|281761|282093|-1|ID=1_281;partial=00;start_type=ATG;rbs_motif=AGGAG;rbs_spacer=5-10bp;gc_cont=0.321	WP_001260004.1 MULTISPECIES: helix-turn-helix domain-containing protein [Staphylococcus]	100	99.1	1.92e-68
BAAHSY010000001.1_282|282286|282549|1|ID=1_282;partial=00;start_type=GTG;rbs_motif=AGGAG;rbs_spacer=5-10bp;gc_cont=0.330	WP_000243849.1 MULTISPECIES: helix-turn-helix domain-containing protein [Staphylococcus]	100	98.9	5.77e-57
BAAHSY010000001.1_283|282542|282814|1|ID=1_283;partial=00;start_type=ATG;rbs_motif=AGGAG;rbs_spacer=5-10bp;gc_cont=0.348	WP_000091732.1 helix-turn-helix domain-containing protein [Staphylococcus aureus]	100	98.9	1.24e-57
BAAHSY010000001.1_284|282805|282999|1|ID=1_284;partial=00;start_type=ATG;rbs_motif=None;rbs_spacer=None;gc_cont=0.318	WP_141060246.1 pathogenicity island protein [Staphylococcus aureus]	100	87.7	2.71e-29
BAAHSY010000001.1_285|282966|283169|1|ID=1_285;partial=00;start_type=GTG;rbs_motif=AGGAG;rbs_spacer=5-10bp;gc_cont=0.275	WP_164071220.1 pathogenicity island protein [Staphylococcus aureus]	98.5	98.5	6.04e-41
BAAHSY010000001.1_286|283171|283554|1|ID=1_286;partial=00;start_type=ATG;rbs_motif=GGA/GAG/AGG;rbs_spacer=5-10bp;gc_cont=0.307	WP_303751621.1 pathogenicity island protein [Staphylococcus aureus]	98.4	99.2	4.39e-82
BAAHSY010000001.1_287|283555|283803|1|ID=1_287;partial=00;start_type=ATG;rbs_motif=GGAG/GAGG;rbs_spacer=5-10bp;gc_cont=0.309	WP_001103959.1 type II toxin-antitoxin system toxin TscT [Staphylococcus aureus]	100	98.8	5.32e-53
BAAHSY010000001.1_288|283895|286267|1|ID=1_288;partial=00;start_type=GTG;rbs_motif=AGGAG;rbs_spacer=5-10bp;gc_cont=0.306	WP_000985235.1 phage/plasmid primase, P4 family [Staphylococcus aureus]	100	99.9	0.0
BAAHSY010000001.1_289|286938|287282|1|ID=1_289;partial=00;start_type=ATG;rbs_motif=AGGA;rbs_spacer=5-10bp;gc_cont=0.313	WP_123073285.1 pathogenicity island protein [Staphylococcus aureus]	99.1	99.1	1.61e-80
BAAHSY010000001.1_290|287320|287526|1|ID=1_290;partial=00;start_type=ATG;rbs_motif=None;rbs_spacer=None;gc_cont=0.309	WP_326515163.1 hypothetical protein [Staphylococcus hominis]	56.9	73.9	3.42e-12
BAAHSY010000001.1_291|287507|287713|1|ID=1_291;partial=00;start_type=GTG;rbs_motif=GGAG/GAGG;rbs_spacer=5-10bp;gc_cont=0.271	WP_000884055.1 MULTISPECIES: hypothetical protein [Staphylococcus]	100	98.6	1.12e-41
BAAHSY010000001.1_292|287700|288758|1|ID=1_292;partial=00;start_type=ATG;rbs_motif=AGGAG;rbs_spacer=5-10bp;gc_cont=0.313	WP_000657538.1 phage capsid protein [Staphylococcus aureus]	100	99.7	1.11e-250
BAAHSY010000001.1_293|288942|289433|1|ID=1_293;partial=00;start_type=TTG;rbs_motif=GGA/GAG/AGG;rbs_spacer=5-10bp;gc_cont=0.295	WP_234694358.1 pathogenicity island protein, partial [Staphylococcus aureus]	99.4	99.4	1.89e-105
BAAHSY010000001.1_294|289862|290830|1|ID=1_294;partial=00;start_type=ATG;rbs_motif=GGA/GAG/AGG;rbs_spacer=5-10bp;gc_cont=0.264	WP_000801979.1 MULTISPECIES: Abi family protein [Staphylococcus]	100	99.7	8.53e-233
BAAHSY010000001.1_295|291065|291619|-1|ID=1_295;partial=00;start_type=ATG;rbs_motif=AGGAG;rbs_spacer=5-10bp;gc_cont=0.303	WP_001035618.1 DUF4888 domain-containing protein [Staphylococcus aureus]	100	99.5	7.17e-120
BAAHSY010000001.1_296|292653|292847|1|ID=1_296;partial=00;start_type=ATG;rbs_motif=AGGAG;rbs_spacer=5-10bp;gc_cont=0.297	WP_000752917.1 MULTISPECIES: CsbD family protein [Bacillati]	100	98.5	3.63e-34
BAAHSY010000001.1_297|293080|293931|-1|ID=1_297;partial=00;start_type=ATG;rbs_motif=AGGAG;rbs_spacer=5-10bp;gc_cont=0.332	WP_141065376.1 DUF368 domain-containing protein [Staphylococcus aureus]	95.8	99.6	4.04e-175
BAAHSY010000001.1_298|294259|295020|1|ID=1_298;partial=00;start_type=ATG;rbs_motif=GGAG/GAGG;rbs_spacer=5-10bp;gc_cont=0.339	WP_000168845.1 MULTISPECIES: Fe-S cluster assembly ATPase SufC [Staphylococcus]	100	99.6	8.13e-176
BAAHSY010000001.1_299|295118|296425|1|ID=1_299;partial=00;start_type=ATG;rbs_motif=AGGAG;rbs_spacer=5-10bp;gc_cont=0.343	WP_000205572.1 MULTISPECIES: Fe-S cluster assembly protein SufD [Staphylococcus]	100	99.8	1.06e-306
BAAHSY010000001.1_300|296540|297781|1|ID=1_300;partial=00;start_type=GTG;rbs_motif=GGA/GAG/AGG;rbs_spacer=11-12bp;gc_cont=0.373	WP_411907791.1 cysteine desulfurase [Staphylococcus aureus]	99.8	99.8	6.14e-291
BAAHSY010000001.1_301|297771|298235|1|ID=1_301;partial=00;start_type=ATG;rbs_motif=AGGAG;rbs_spacer=5-10bp;gc_cont=0.361	WP_001010508.1 MULTISPECIES: Fe-S cluster assembly sulfur transfer protein SufU [Staphylococcus]	100	99.4	1.26e-103
BAAHSY010000001.1_302|298386|299783|1|ID=1_302;partial=00;start_type=ATG;rbs_motif=AGGAG;rbs_spacer=5-10bp;gc_cont=0.344	WP_001074405.1 MULTISPECIES: Fe-S cluster assembly protein SufB [Staphylococcus]	100	99.8	0.0
BAAHSY010000001.1_303|300113|300427|-1|ID=1_303;partial=00;start_type=ATG;rbs_motif=AGGA;rbs_spacer=5-10bp;gc_cont=0.270	WP_000274029.1 MULTISPECIES: hypothetical protein [Staphylococcus]	100	99.0	1.19e-57
BAAHSY010000001.1_304|300792|301832|1|ID=1_304;partial=00;start_type=GTG;rbs_motif=AGGAG;rbs_spacer=5-10bp;gc_cont=0.328	WP_337118670.1 hemolysin family protein [Staphylococcus aureus]	97.4	99.7	1.33e-223
BAAHSY010000001.1_305|301846|302913|1|ID=1_305;partial=00;start_type=ATG;rbs_motif=AGGAG;rbs_spacer=5-10bp;gc_cont=0.379	WP_000267247.1 MULTISPECIES: NAD(P)H-dependent flavin oxidoreductase [Staphylococcus]	100	99.7	1.34e-248
BAAHSY010000001.1_306|303108|303974|1|ID=1_306;partial=00;start_type=ATG;rbs_motif=None;rbs_spacer=None;gc_cont=0.333	WP_000608129.1 MULTISPECIES: DUF72 domain-containing protein [Staphylococcus]	100	97.6	7.21e-211
BAAHSY010000001.1_307|303987|304814|1|ID=1_307;partial=00;start_type=ATG;rbs_motif=GGAG/GAGG;rbs_spacer=5-10bp;gc_cont=0.322	WP_000927632.1 MULTISPECIES: sulfite exporter TauE/SafE family protein [Staphylococcus]	100	99.6	1.96e-178
BAAHSY010000001.1_308|304841|306160|1|ID=1_308;partial=00;start_type=TTG;rbs_motif=AGGAG;rbs_spacer=5-10bp;gc_cont=0.335	WP_001241217.1 MULTISPECIES: bifunctional metallophosphatase/5'-nucleotidase [Staphylococcus]	100	99.8	0.0
BAAHSY010000001.1_309|306190|307161|1|ID=1_309;partial=00;start_type=ATG;rbs_motif=GGA/GAG/AGG;rbs_spacer=11-12bp;gc_cont=0.359	WP_000201875.1 MULTISPECIES: lipoyl synthase [Staphylococcus]	100	94.1	1.67e-217
BAAHSY010000001.1_310|307282|307674|1|ID=1_310;partial=00;start_type=GTG;rbs_motif=None;rbs_spacer=None;gc_cont=0.277	WP_000598444.1 MULTISPECIES: YutD family protein [Bacilli]	99.2	96.9	6.79e-89
BAAHSY010000001.1_311|307753|308019|-1|ID=1_311;partial=00;start_type=ATG;rbs_motif=AGGAG;rbs_spacer=5-10bp;gc_cont=0.318	WP_000566649.1 MULTISPECIES: DUF3055 domain-containing protein [Staphylococcus]	100	98.9	1.52e-57
BAAHSY010000001.1_312|308117|308551|1|ID=1_312;partial=00;start_type=ATG;rbs_motif=GGAG/GAGG;rbs_spacer=5-10bp;gc_cont=0.299	WP_000273981.1 MULTISPECIES: DUF86 domain-containing protein [Staphylococcus]	100	99.3	6.41e-99
BAAHSY010000001.1_313|308551|309330|1|ID=1_313;partial=00;start_type=ATG;rbs_motif=AGGAG;rbs_spacer=5-10bp;gc_cont=0.349	WP_000816184.1 MULTISPECIES: TIGR01457 family HAD-type hydrolase [Staphylococcus]	100	99.6	8.47e-181
BAAHSY010000001.1_314|309363|310322|1|ID=1_314;partial=00;start_type=TTG;rbs_motif=GGA/GAG/AGG;rbs_spacer=5-10bp;gc_cont=0.343	WP_000239131.1 MULTISPECIES: 2-hydroxyacid dehydrogenase [Staphylococcus]	100	99.7	1.07e-229
BAAHSY010000001.1_315|310734|310886|1|ID=1_315;partial=00;start_type=ATG;rbs_motif=GGAG/GAGG;rbs_spacer=5-10bp;gc_cont=0.261	WP_000837752.1 MULTISPECIES: teichoic acid D-Ala incorporation-associated protein DltX [Staphylococcus]	100	98.0	1.80e-28
BAAHSY010000001.1_316|310902|312359|1|ID=1_316;partial=00;start_type=ATG;rbs_motif=GGAG/GAGG;rbs_spacer=5-10bp;gc_cont=0.342	WP_000129653.1 MULTISPECIES: D-alanine--poly(phosphoribitol) ligase subunit DltA [Staphylococcus]	100	99.8	0.0
BAAHSY010000001.1_317|312356|313570|1|ID=1_317;partial=00;start_type=ATG;rbs_motif=GGAG/GAGG;rbs_spacer=5-10bp;gc_cont=0.300	WP_000613541.1 MULTISPECIES: PG:teichoic acid D-alanyltransferase DltB [Staphylococcus]	100	99.8	7.77e-291
BAAHSY010000001.1_318|313588|313824|1|ID=1_318;partial=00;start_type=ATG;rbs_motif=AGGAG;rbs_spacer=5-10bp;gc_cont=0.291	WP_000395692.1 MULTISPECIES: D-alanine--poly(phosphoribitol) ligase subunit 2 [Staphylococcus]	100	98.7	4.19e-46
BAAHSY010000001.1_319|313821|314996|1|ID=1_319;partial=00;start_type=ATG;rbs_motif=GGA/GAG/AGG;rbs_spacer=5-10bp;gc_cont=0.321	WP_000769417.1 D-alanyl-lipoteichoic acid biosynthesis protein DltD [Staphylococcus aureus]	100	99.7	2.37e-283
BAAHSY010000001.1_320|315259|315501|-1|ID=1_320;partial=00;start_type=ATG;rbs_motif=AGGAG;rbs_spacer=5-10bp;gc_cont=0.395	WP_001141883.1 MULTISPECIES: NifU family protein [Staphylococcus]	100	98.8	3.13e-51
BAAHSY010000001.1_321|315602|315925|1|ID=1_321;partial=00;start_type=ATG;rbs_motif=GGA/GAG/AGG;rbs_spacer=5-10bp;gc_cont=0.309	WP_000401414.1 MULTISPECIES: YuzD family protein [Staphylococcus]	100	99.1	1.17e-72
BAAHSY010000001.1_322|315984|317048|-1|ID=1_322;partial=00;start_type=ATG;rbs_motif=GGA/GAG/AGG;rbs_spacer=11-12bp;gc_cont=0.367	WP_000794020.1 MULTISPECIES: NAD(P)/FAD-dependent oxidoreductase [Staphylococcus]	100	99.7	1.17e-262
BAAHSY010000001.1_323|317365|317601|1|ID=1_323;partial=00;start_type=ATG;rbs_motif=GGA/GAG/AGG;rbs_spacer=5-10bp;gc_cont=0.350	WP_001068337.1 MULTISPECIES: YuzB family protein [Staphylococcus]	100	98.7	4.85e-54
BAAHSY010000001.1_324|317614|317973|1|ID=1_324;partial=00;start_type=ATG;rbs_motif=AGGAG;rbs_spacer=5-10bp;gc_cont=0.372	WP_001143497.1 MULTISPECIES: HesB/IscA family protein [Staphylococcus]	100	99.2	6.95e-82
BAAHSY010000001.1_325|318427|319635|1|ID=1_325;partial=00;start_type=ATG;rbs_motif=GGA/GAG/AGG;rbs_spacer=5-10bp;gc_cont=0.357	WP_000046076.1 MULTISPECIES: NAD(P)/FAD-dependent oxidoreductase [Staphylococcus]	100	99.8	1.10e-289
BAAHSY010000001.1_326|319766|321241|1|ID=1_326;partial=00;start_type=ATG;rbs_motif=AGGAG;rbs_spacer=5-10bp;gc_cont=0.340	WP_001009697.1 MULTISPECIES: M17 family metallopeptidase [Staphylococcus]	100	99.8	0.0
BAAHSY010000001.1_327|321652|322968|1|ID=1_327;partial=00;start_type=ATG;rbs_motif=AGGA;rbs_spacer=5-10bp;gc_cont=0.326	WP_000606316.1 Na+/H+ antiporter family protein [Staphylococcus aureus]	96.1	99.8	3.37e-284
BAAHSY010000001.1_328|322987|323361|1|ID=1_328;partial=00;start_type=ATG;rbs_motif=GGAG/GAGG;rbs_spacer=5-10bp;gc_cont=0.331	WP_000149295.1 MULTISPECIES: PaaI family thioesterase [Staphylococcus]	100	99.2	1.27e-84
BAAHSY010000001.1_329|323417|324571|-1|ID=1_329;partial=00;start_type=ATG;rbs_motif=GGAG/GAGG;rbs_spacer=5-10bp;gc_cont=0.347	WP_000558769.1 MULTISPECIES: FAD/NAD(P)-binding protein [Staphylococcus]	100	99.7	1.81e-288
BAAHSY010000001.1_330|324820|325176|-1|ID=1_330;partial=00;start_type=ATG;rbs_motif=GGA/GAG/AGG;rbs_spacer=5-10bp;gc_cont=0.325	WP_000590451.1 MULTISPECIES: Na+/H+ antiporter Mnh1 subunit G [Staphylococcus]	100	99.2	1.35e-65
BAAHSY010000001.1_331|325154|325447|-1|ID=1_331;partial=00;start_type=ATG;rbs_motif=AGxAGG/AGGxGG;rbs_spacer=5-10bp;gc_cont=0.320	WP_001016306.1 MULTISPECIES: Na+/H+ antiporter Mnh1 subunit F [Staphylococcus]	100	99.0	1.24e-49
BAAHSY010000001.1_332|325447|325926|-1|ID=1_332;partial=00;start_type=ATG;rbs_motif=AGGAG;rbs_spacer=5-10bp;gc_cont=0.298	WP_000290674.1 MULTISPECIES: Na+/H+ antiporter Mnh1 subunit E [Staphylococcus]	100	99.4	1.02e-100
BAAHSY010000001.1_333|325928|327424|-1|ID=1_333;partial=00;start_type=ATG;rbs_motif=AGGAG;rbs_spacer=5-10bp;gc_cont=0.337	WP_000573079.1 Na+/H+ antiporter Mnh1 subunit D [Staphylococcus aureus]	100	99.8	0.0
BAAHSY010000001.1_334|327417|327746|-1|ID=1_334;partial=00;start_type=ATG;rbs_motif=GGA/GAG/AGG;rbs_spacer=5-10bp;gc_cont=0.348	WP_011443624.1 Na+/H+ antiporter Mnh1 subunit C [Staphylococcus aureus]	100	99.1	1.16e-64
BAAHSY010000001.1_335|327758|328186|-1|ID=1_335;partial=00;start_type=ATG;rbs_motif=GGAG/GAGG;rbs_spacer=5-10bp;gc_cont=0.338	WP_001081626.1 MULTISPECIES: Na+/H+ antiporter Mnh1 subunit B [Staphylococcus]	100	99.3	4.90e-93
BAAHSY010000001.1_336|328179|330584|-1|ID=1_336;partial=00;start_type=GTG;rbs_motif=AGGAG;rbs_spacer=5-10bp;gc_cont=0.335	WP_000054609.1 MULTISPECIES: Na+/H+ antiporter Mnh1 subunit A [Staphylococcus]	100	99.9	0.0
BAAHSY010000001.1_337|330715|331098|-1|ID=1_337;partial=00;start_type=ATG;rbs_motif=GGAG/GAGG;rbs_spacer=5-10bp;gc_cont=0.346	WP_000781156.1 MULTISPECIES: kinase-associated lipoprotein B [Staphylococcus]	100	99.2	5.34e-83
BAAHSY010000001.1_338|331162|331755|1|ID=1_338;partial=00;start_type=ATG;rbs_motif=GGAG/GAGG;rbs_spacer=5-10bp;gc_cont=0.354	WP_000035058.1 MULTISPECIES: peptidylprolyl isomerase [Staphylococcus]	100	99.5	3.15e-143
BAAHSY010000001.1_339|332204|332548|1|ID=1_339;partial=00;start_type=GTG;rbs_motif=None;rbs_spacer=None;gc_cont=0.330	WP_001788532.1 S1 domain-containing post-transcriptional regulator Ygs [Staphylococcus aureus]	100	99.1	1.01e-74
BAAHSY010000001.1_340|332910|334037|1|ID=1_340;partial=00;start_type=ATG;rbs_motif=AGGAG;rbs_spacer=5-10bp;gc_cont=0.368	WP_000838037.1 MULTISPECIES: NADH-dependent flavin oxidoreductase [Staphylococcus]	100	99.7	3.31e-275
BAAHSY010000001.1_341|334345|335535|1|ID=1_341;partial=00;start_type=ATG;rbs_motif=GGAG/GAGG;rbs_spacer=5-10bp;gc_cont=0.356	WP_000167314.1 MULTISPECIES: ornithine--oxo-acid transaminase [Staphylococcus]	100	99.7	4.33e-293
BAAHSY010000001.1_342|335644|336888|1|ID=1_342;partial=00;start_type=ATG;rbs_motif=AGGA/GGAG/GAGG;rbs_spacer=11-12bp;gc_cont=0.369	WP_000138486.1 Glu/Leu/Phe/Val family dehydrogenase [Staphylococcus aureus]	100	99.8	1.04e-300
BAAHSY010000001.1_343|337391|338320|-1|ID=1_343;partial=00;start_type=ATG;rbs_motif=AGGA;rbs_spacer=5-10bp;gc_cont=0.331	WP_000185319.1 MULTISPECIES: glycerophosphodiester phosphodiesterase [Staphylococcus]	100	99.7	7.84e-227
BAAHSY010000001.1_344|338562|339941|-1|ID=1_344;partial=00;start_type=ATG;rbs_motif=GGAG/GAGG;rbs_spacer=5-10bp;gc_cont=0.346	WP_000066062.1 argininosuccinate lyase [Staphylococcus aureus]	100	99.8	0.0
BAAHSY010000001.1_345|339931|341136|-1|ID=1_345;partial=00;start_type=ATG;rbs_motif=GGAG/GAGG;rbs_spacer=5-10bp;gc_cont=0.353	WP_000660045.1 MULTISPECIES: argininosuccinate synthase [Staphylococcus]	100	99.8	2.84e-296
BAAHSY010000001.1_346|341487|342818|1|ID=1_346;partial=00;start_type=ATG;rbs_motif=AGGAG;rbs_spacer=5-10bp;gc_cont=0.335	WP_000148855.1 MULTISPECIES: glucose-6-phosphate isomerase [Staphylococcus]	100	99.8	0.0
BAAHSY010000001.1_347|343143|343718|1|ID=1_347;partial=00;start_type=TTG;rbs_motif=GGA/GAG/AGG;rbs_spacer=5-10bp;gc_cont=0.306	WP_000007967.1 MULTISPECIES: TVP38/TMEM64 family protein [Staphylococcus]	100	99.5	1.01e-127
BAAHSY010000001.1_348|343723|344247|1|ID=1_348;partial=00;start_type=GTG;rbs_motif=AGGAG;rbs_spacer=5-10bp;gc_cont=0.316	WP_000758215.1 MULTISPECIES: signal peptidase I [Staphylococcus]	100	99.4	2.27e-118
BAAHSY010000001.1_349|344263|344838|1|ID=1_349;partial=00;start_type=TTG;rbs_motif=GGAG/GAGG;rbs_spacer=5-10bp;gc_cont=0.312	WP_000711486.1 MULTISPECIES: signal peptidase I [Staphylococcus]	100	99.5	1.24e-137
BAAHSY010000001.1_350|344998|348474|1|ID=1_350;partial=00;start_type=ATG;rbs_motif=GGAG/GAGG;rbs_spacer=5-10bp;gc_cont=0.323	WP_000172342.1 MULTISPECIES: helicase-exonuclease AddAB subunit AddB [Staphylococcus]	100	99.9	0.0
BAAHSY010000001.1_351|348475|352128|1|ID=1_351;partial=00;start_type=ATG;rbs_motif=GGA/GAG/AGG;rbs_spacer=5-10bp;gc_cont=0.335	WP_000154914.1 helicase-exonuclease AddAB subunit AddA [Staphylococcus aureus]	100	99.9	0.0
BAAHSY010000001.1_352|352294|353196|1|ID=1_352;partial=00;start_type=ATG;rbs_motif=AGGAG;rbs_spacer=5-10bp;gc_cont=0.329	WP_000670752.1 MULTISPECIES: fumarylacetoacetate hydrolase family protein [Staphylococcus]	100	99.7	1.90e-218
BAAHSY010000001.1_353|353525|353914|1|ID=1_353;partial=00;start_type=ATG;rbs_motif=GGA/GAG/AGG;rbs_spacer=5-10bp;gc_cont=0.328	WP_000902817.1 MULTISPECIES: YisL family protein [Staphylococcus]	100	99.2	2.08e-81
BAAHSY010000001.1_354|354085|355401|-1|ID=1_354;partial=00;start_type=ATG;rbs_motif=AGGAG;rbs_spacer=5-10bp;gc_cont=0.355	WP_001124525.1 MULTISPECIES: CoA-disulfide reductase [Staphylococcus]	100	99.8	0.0
BAAHSY010000001.1_355|355453|356277|-1|ID=1_355;partial=00;start_type=ATG;rbs_motif=AGGAG;rbs_spacer=5-10bp;gc_cont=0.314	WP_001182436.1 MULTISPECIES: Cof-type HAD-IIB family hydrolase [Staphylococcus]	100	99.6	1.01e-200
BAAHSY010000001.1_356|356391|356699|1|ID=1_356;partial=00;start_type=ATG;rbs_motif=GGAG/GAGG;rbs_spacer=5-10bp;gc_cont=0.362	WP_000390575.1 MULTISPECIES: metal-sulfur cluster assembly factor [Bacilli]	100	99.0	2.07e-66
BAAHSY010000001.1_357|357246|359060|1|ID=1_357;partial=00;start_type=ATG;rbs_motif=GGA/GAG/AGG;rbs_spacer=11-12bp;gc_cont=0.305	WP_001044214.1 MULTISPECIES: acyltransferase family protein [Staphylococcus]	100	99.8	0.0
