BAAHSR010000002.1_238|261378|261746|1|ID=1_238;partial=00;start_type=TTG;rbs_motif=GGAG/GAGG;rbs_spacer=5-10bp;gc_cont=0.314	WP_000849177.1 MULTISPECIES: YxeA family protein [Staphylococcus]	100	99.2	1.62e-77
BAAHSR010000002.1_239|261927|262499|1|ID=1_239;partial=00;start_type=ATG;rbs_motif=GGA/GAG/AGG;rbs_spacer=5-10bp;gc_cont=0.307	WP_000769720.1 MULTISPECIES: PepSY domain-containing protein [Staphylococcus]	100	99.5	8.29e-122
BAAHSR010000002.1_240|262637|262900|-1|ID=1_240;partial=00;start_type=ATG;rbs_motif=GGAG/GAGG;rbs_spacer=5-10bp;gc_cont=0.299	WP_001055897.1 MULTISPECIES: helix-turn-helix domain-containing protein [Staphylococcus]	100	98.9	1.21e-58
BAAHSR010000002.1_241|263200|263451|1|ID=1_241;partial=00;start_type=ATG;rbs_motif=AGGAG;rbs_spacer=5-10bp;gc_cont=0.369	WP_050963020.1 GlsB/YeaQ/YmgE family stress response membrane protein [Staphylococcus aureus]	84.3	98.8	1.47e-37
BAAHSR010000002.1_242|263490|263699|-1|ID=1_242;partial=00;start_type=ATG;rbs_motif=None;rbs_spacer=None;gc_cont=0.271	WP_000211676.1 MULTISPECIES: hypothetical protein [Staphylococcus]	100	98.6	5.93e-42
BAAHSR010000002.1_243|263877|264458|1|ID=1_243;partial=00;start_type=ATG;rbs_motif=AGGAG;rbs_spacer=5-10bp;gc_cont=0.321	WP_000158371.1 histidine phosphatase family protein [Staphylococcus aureus]	100	99.5	5.25e-140
BAAHSR010000002.1_244|264524|264910|-1|ID=1_244;partial=00;start_type=ATG;rbs_motif=AGGA;rbs_spacer=5-10bp;gc_cont=0.315	WP_000868248.1 MULTISPECIES: hypothetical protein [Staphylococcus]	100	98.4	3.90e-74
BAAHSR010000002.1_245|265162|265788|-1|ID=1_245;partial=00;start_type=ATG;rbs_motif=AGGA/GGAG/GAGG;rbs_spacer=11-12bp;gc_cont=0.303	WP_000746687.1 MULTISPECIES: NDxxF motif lipoprotein [Staphylococcus]	100	99.5	7.54e-136
BAAHSR010000002.1_246|265861|266118|-1|ID=1_246;partial=00;start_type=ATG;rbs_motif=GGA/GAG/AGG;rbs_spacer=5-10bp;gc_cont=0.314	WP_001795623.1 hypothetical protein [Staphylococcus aureus]	100	98.8	9.52e-53
BAAHSR010000002.1_247|266233|267756|-1|ID=1_247;partial=00;start_type=ATG;rbs_motif=AGGAGG;rbs_spacer=5-10bp;gc_cont=0.380	WP_000930486.1 MULTISPECIES: alkyl hydroperoxide reductase subunit F [Staphylococcus]	100	99.8	0.0
BAAHSR010000002.1_248|267772|268341|-1|ID=1_248;partial=00;start_type=ATG;rbs_motif=AGGAG;rbs_spacer=5-10bp;gc_cont=0.370	WP_000052781.1 MULTISPECIES: alkyl hydroperoxide reductase subunit C [Staphylococcus]	100	99.5	3.05e-137
BAAHSR010000002.1_249|268782|269588|1|ID=1_249;partial=00;start_type=TTG;rbs_motif=GGA/GAG/AGG;rbs_spacer=5-10bp;gc_cont=0.375	WP_001797637.1 oxygen-insensitive NADPH nitroreductase [Staphylococcus aureus]	99.6	94.4	6.85e-179
BAAHSR010000002.1_250|269669|271057|-1|ID=1_250;partial=00;start_type=ATG;rbs_motif=AGGAG;rbs_spacer=5-10bp;gc_cont=0.392	WP_000991007.1 MULTISPECIES: L-cystine transporter [Staphylococcus]	100	99.8	2.61e-307
BAAHSR010000002.1_251|272034|272990|-1|ID=1_251;partial=00;start_type=ATG;rbs_motif=AGGA;rbs_spacer=5-10bp;gc_cont=0.377	WP_372430064.1 hypothetical protein [Staphylococcus aureus]	99.7	99.7	1.94e-132
BAAHSR010000002.1_252|273108|273770|-1|ID=1_252;partial=00;start_type=ATG;rbs_motif=GGAG/GAGG;rbs_spacer=5-10bp;gc_cont=0.306	WP_000394698.1 MULTISPECIES: hypothetical protein [Staphylococcus]	100	99.5	8.20e-155
BAAHSR010000002.1_253|273913|274320|-1|ID=1_253;partial=00;start_type=ATG;rbs_motif=GGA/GAG/AGG;rbs_spacer=5-10bp;gc_cont=0.331	WP_000763768.1 MULTISPECIES: general stress protein [Staphylococcus]	100	99.3	1.81e-87
BAAHSR010000002.1_254|274833|275411|1|ID=1_254;partial=00;start_type=GTG;rbs_motif=AGGAG;rbs_spacer=5-10bp;gc_cont=0.358	WP_000421410.1 MULTISPECIES: xanthine phosphoribosyltransferase [Staphylococcus]	100	99.5	5.64e-130
BAAHSR010000002.1_255|275411|276679|1|ID=1_255;partial=00;start_type=ATG;rbs_motif=GGAG/GAGG;rbs_spacer=5-10bp;gc_cont=0.358	WP_000793009.1 MULTISPECIES: xanthine permease PbuX [Staphylococcus]	100	99.8	7.79e-291
BAAHSR010000002.1_256|276717|278183|1|ID=1_256;partial=00;start_type=ATG;rbs_motif=GGAG/GAGG;rbs_spacer=5-10bp;gc_cont=0.374	WP_000264071.1 MULTISPECIES: IMP dehydrogenase [Staphylococcus]	100	99.8	0.0
BAAHSR010000002.1_257|278208|279749|1|ID=1_257;partial=00;start_type=ATG;rbs_motif=AGGAG;rbs_spacer=5-10bp;gc_cont=0.372	WP_000424966.1 MULTISPECIES: glutamine-hydrolyzing GMP synthase [Staphylococcus]	100	99.8	0.0
BAAHSR010000002.1_258|279862|280398|-1|ID=1_258;partial=00;start_type=ATG;rbs_motif=AGGA;rbs_spacer=5-10bp;gc_cont=0.279	WP_000551776.1 MULTISPECIES: hypothetical protein [Staphylococcus]	100	99.4	5.99e-125
BAAHSR010000002.1_259|280791|281495|-1|ID=1_259;partial=00;start_type=ATG;rbs_motif=AGGA/GGAG/GAGG;rbs_spacer=11-12bp;gc_cont=0.281	WP_000041883.1 MULTISPECIES: type II toxin-antitoxin system PemK/MazF family toxin [Staphylococcus]	100	99.6	2.15e-157
BAAHSR010000002.1_260|281894|282166|-1|ID=1_260;partial=00;start_type=ATG;rbs_motif=None;rbs_spacer=None;gc_cont=0.253	WP_000159787.1 MULTISPECIES: transposase [Staphylococcus]	100	98.9	4.68e-53
BAAHSR010000002.1_261|282207|282446|-1|ID=1_261;partial=00;start_type=ATG;rbs_motif=None;rbs_spacer=None;gc_cont=0.308	WP_000850683.1 hypothetical protein [Staphylococcus aureus]	98.5	81.3	2.58e-36
BAAHSR010000002.1_262|282427|282579|-1|ID=1_262;partial=00;start_type=ATG;rbs_motif=AGGAG;rbs_spacer=5-10bp;gc_cont=0.268	WP_000248839.1 MULTISPECIES: hypothetical protein [Staphylococcus]	100	98.0	1.22e-26
BAAHSR010000002.1_263|283103|283462|-1|ID=1_263;partial=00;start_type=GTG;rbs_motif=AGGAG;rbs_spacer=5-10bp;gc_cont=0.322	WP_001021622.1 MULTISPECIES: DUF1304 domain-containing protein [Staphylococcus]	100	99.2	5.72e-72
BAAHSR010000002.1_264|283481|284326|-1|ID=1_264;partial=00;start_type=ATG;rbs_motif=AGGAG;rbs_spacer=5-10bp;gc_cont=0.358	WP_001024377.1 MULTISPECIES: SDR family oxidoreductase [Staphylococcus]	100	99.6	1.88e-204
BAAHSR010000002.1_265|284798|285478|1|ID=1_265;partial=00;start_type=ATG;rbs_motif=None;rbs_spacer=None;gc_cont=0.313	WP_000669005.1 MULTISPECIES: superantigen-like protein SSL1 [Staphylococcus]	100	99.6	5.29e-154
BAAHSR010000002.1_266|285764|286459|1|ID=1_266;partial=00;start_type=ATG;rbs_motif=GGAG/GAGG;rbs_spacer=5-10bp;gc_cont=0.286	WP_000782618.1 MULTISPECIES: superantigen-like protein SSL2 [Staphylococcus]	100	99.6	1.07e-160
BAAHSR010000002.1_267|286750|287808|1|ID=1_267;partial=00;start_type=ATG;rbs_motif=GGAG/GAGG;rbs_spacer=5-10bp;gc_cont=0.344	WP_043854262.1 superantigen-like protein SSL3 [Staphylococcus aureus]	98.0	99.7	2.13e-186
BAAHSR010000002.1_268|288173|289099|1|ID=1_268;partial=00;start_type=ATG;rbs_motif=GGAG/GAGG;rbs_spacer=5-10bp;gc_cont=0.338	WP_000705649.1 superantigen-like protein SSL4 [Staphylococcus aureus]	100	99.7	2.04e-155
BAAHSR010000002.1_269|289463|290167|1|ID=1_269;partial=00;start_type=ATG;rbs_motif=GGAG/GAGG;rbs_spacer=5-10bp;gc_cont=0.315	WP_000784244.1 MULTISPECIES: superantigen-like protein SSL5 [Staphylococcus]	100	99.6	1.03e-164
BAAHSR010000002.1_270|290612|291307|1|ID=1_270;partial=00;start_type=GTG;rbs_motif=GGAG/GAGG;rbs_spacer=5-10bp;gc_cont=0.299	WP_000769836.1 MULTISPECIES: superantigen-like protein SSL7 [Bacteria]	100	99.6	1.40e-156
BAAHSR010000002.1_271|291651|292349|1|ID=1_271;partial=00;start_type=ATG;rbs_motif=GGAG/GAGG;rbs_spacer=5-10bp;gc_cont=0.280	WP_000673479.1 MULTISPECIES: superantigen-like protein SSL8 [Staphylococcus]	100	99.6	4.33e-156
BAAHSR010000002.1_272|292729|293427|1|ID=1_272;partial=00;start_type=ATG;rbs_motif=GGAG/GAGG;rbs_spacer=5-10bp;gc_cont=0.293	WP_000779446.1 MULTISPECIES: superantigen-like protein SSL9 [Staphylococcus]	100	99.6	2.15e-156
BAAHSR010000002.1_273|293793|294476|1|ID=1_273;partial=00;start_type=ATG;rbs_motif=GGAG/GAGG;rbs_spacer=5-10bp;gc_cont=0.291	WP_000673051.1 MULTISPECIES: superantigen-like protein SSL10 [Staphylococcus]	100	99.6	3.45e-155
BAAHSR010000002.1_274|294740|295324|1|ID=1_274;partial=01;start_type=ATG;rbs_motif=GGAG/GAGG;rbs_spacer=5-10bp;gc_cont=0.386	WP_048517549.1 type I restriction-modification system subunit M N-terminal domain-containing protein, partial [Staphylococcus aureus]	100	100	5.83e-131
