BAAHSY010000001.1_121|116458|117498|1|ID=1_121;partial=00;start_type=ATG;rbs_motif=AGGA;rbs_spacer=5-10bp;gc_cont=0.303	WP_001061252.1 MULTISPECIES: histidine kinase GraS/ApsS [Staphylococcus]	100	99.7	1.23e-244
BAAHSY010000001.1_122|117591|118403|1|ID=1_122;partial=00;start_type=GTG;rbs_motif=None;rbs_spacer=None;gc_cont=0.315	WP_000985996.1 MULTISPECIES: ABC transporter ATP-binding protein VraF [Staphylococcus]	99.6	93.4	1.88e-174
BAAHSY010000001.1_123|118393|120282|1|ID=1_123;partial=00;start_type=ATG;rbs_motif=AGxAGG/AGGxGG;rbs_spacer=5-10bp;gc_cont=0.287	WP_000143623.1 MULTISPECIES: ABC transporter permease VraG [Staphylococcus]	100	99.8	0.0
BAAHSY010000001.1_124|121007|121624|1|ID=1_124;partial=00;start_type=ATG;rbs_motif=GGAG/GAGG;rbs_spacer=5-10bp;gc_cont=0.283	WP_000491755.1 MULTISPECIES: DUF47 domain-containing protein [Staphylococcus]	100	99.5	5.58e-141
BAAHSY010000001.1_125|121640|122647|1|ID=1_125;partial=00;start_type=ATG;rbs_motif=GGAG/GAGG;rbs_spacer=5-10bp;gc_cont=0.370	WP_000120368.1 MULTISPECIES: inorganic phosphate transporter [Staphylococcus]	100	99.7	1.14e-207
BAAHSY010000001.1_126|123235|124032|-1|ID=1_126;partial=00;start_type=TTG;rbs_motif=AGGAG;rbs_spacer=5-10bp;gc_cont=0.381	WP_000731644.1 MULTISPECIES: LysM peptidoglycan-binding domain-containing protein [Staphylococcus]	100	99.6	7.25e-185
BAAHSY010000001.1_127|124471|125037|1|ID=1_127;partial=00;start_type=ATG;rbs_motif=None;rbs_spacer=None;gc_cont=0.291	WP_179134665.1 Bax inhibitor-1/YccA family protein, partial [Staphylococcus aureus]	100	99.5	7.03e-123
BAAHSY010000001.1_128|125734|127713|1|ID=1_128;partial=00;start_type=ATG;rbs_motif=GGAG/GAGG;rbs_spacer=5-10bp;gc_cont=0.271	WP_001129754.1 MULTISPECIES: helix-turn-helix transcriptional regulator [Staphylococcus]	99.8	98.8	0.0
BAAHSY010000001.1_129|127963|128388|1|ID=1_129;partial=00;start_type=ATG;rbs_motif=GGA/GAG/AGG;rbs_spacer=5-10bp;gc_cont=0.246	WP_000818255.1 SarA family transcriptional regulator [Staphylococcus aureus]	100	99.3	1.25e-90
BAAHSY010000001.1_130|128578|129294|1|ID=1_130;partial=00;start_type=ATG;rbs_motif=GGA/GAG/AGG;rbs_spacer=5-10bp;gc_cont=0.361	WP_000532966.1 MULTISPECIES: YebC/PmpR family DNA-binding transcriptional regulator [Staphylococcus]	100	99.6	5.48e-162
BAAHSY010000001.1_131|129294|129767|1|ID=1_131;partial=00;start_type=ATG;rbs_motif=GGA/GAG/AGG;rbs_spacer=5-10bp;gc_cont=0.340	WP_000833483.1 MULTISPECIES: cupin domain-containing protein [Staphylococcus]	100	99.4	3.20e-112
BAAHSY010000001.1_132|130120|130764|1|ID=1_132;partial=00;start_type=GTG;rbs_motif=AGGAG;rbs_spacer=5-10bp;gc_cont=0.295	WP_000865624.1 MULTISPECIES: DUF402 domain-containing protein [Staphylococcus]	100	99.5	1.26e-146
BAAHSY010000001.1_133|130880|131746|1|ID=1_133;partial=00;start_type=ATG;rbs_motif=None;rbs_spacer=None;gc_cont=0.321	WP_000687411.1 MULTISPECIES: LysR family transcriptional regulator [Staphylococcus]	100	99.7	2.78e-205
BAAHSY010000001.1_134|132016|133236|1|ID=1_134;partial=00;start_type=ATG;rbs_motif=AGxAG;rbs_spacer=5-10bp;gc_cont=0.324	WP_000367064.1 MULTISPECIES: sugar efflux transporter [Staphylococcus]	100	99.8	4.94e-279
BAAHSY010000001.1_135|133233|133721|1|ID=1_135;partial=00;start_type=ATG;rbs_motif=AGGA/GGAG/GAGG;rbs_spacer=11-12bp;gc_cont=0.303	WP_000152582.1 MULTISPECIES: DUF456 domain-containing protein [Staphylococcus]	100	99.4	1.82e-100
BAAHSY010000001.1_136|133820|134509|-1|ID=1_136;partial=00;start_type=ATG;rbs_motif=AGGAG(G)/GGAGG;rbs_spacer=13-15bp;gc_cont=0.281	WP_000842860.1 MULTISPECIES: DUF1129 family protein [Staphylococcus]	100	99.6	2.16e-159
BAAHSY010000001.1_137|134636|135079|1|ID=1_137;partial=00;start_type=ATG;rbs_motif=GGAG/GAGG;rbs_spacer=5-10bp;gc_cont=0.293	WP_001259678.1 MULTISPECIES: GNAT family N-acetyltransferase [Staphylococcus]	100	99.3	7.15e-102
BAAHSY010000001.1_138|135146|135541|1|ID=1_138;partial=00;start_type=ATG;rbs_motif=AGGAG;rbs_spacer=5-10bp;gc_cont=0.293	WP_000733431.1 MULTISPECIES: SA0632 family lipoprotein [Staphylococcus]	100	99.2	9.59e-30
BAAHSY010000001.1_139|135679|135978|1|ID=1_139;partial=00;start_type=ATG;rbs_motif=AGGAG;rbs_spacer=5-10bp;gc_cont=0.320	WP_000545115.1 MULTISPECIES: hypothetical protein [Staphylococcus]	100	99.0	2.67e-63
BAAHSY010000001.1_140|136058|136600|1|ID=1_140;partial=00;start_type=ATG;rbs_motif=AGGAG;rbs_spacer=5-10bp;gc_cont=0.337	WP_000638613.1 MULTISPECIES: GNAT family N-acetyltransferase [Staphylococcus]	100	99.4	3.33e-132
BAAHSY010000001.1_141|136696|137262|-1|ID=1_141;partial=00;start_type=ATG;rbs_motif=AGGAG;rbs_spacer=5-10bp;gc_cont=0.365	WP_000820892.1 MULTISPECIES: LOG family protein [Staphylococcus]	100	99.5	4.51e-134
BAAHSY010000001.1_142|137264|137722|-1|ID=1_142;partial=00;start_type=GTG;rbs_motif=GGAG/GAGG;rbs_spacer=5-10bp;gc_cont=0.338	WP_000148828.1 MULTISPECIES: YaiI/YqxD family protein [Staphylococcus]	100	99.3	1.08e-103
BAAHSY010000001.1_143|137725|138459|-1|ID=1_143;partial=00;start_type=ATG;rbs_motif=None;rbs_spacer=None;gc_cont=0.305	WP_371905305.1 hypothetical protein [Staphylococcus aureus]	100	92.7	2.57e-49
BAAHSY010000001.1_144|138580|139455|-1|ID=1_144;partial=00;start_type=ATG;rbs_motif=None;rbs_spacer=None;gc_cont=0.333	WP_000469890.1 MULTISPECIES: undecaprenyl-diphosphate phosphatase [Staphylococcus]	100	99.7	1.53e-199
BAAHSY010000001.1_145|139719|141299|1|ID=1_145;partial=00;start_type=ATG;rbs_motif=None;rbs_spacer=None;gc_cont=0.326	WP_251354977.1 ABC transporter ATP-binding protein/permease [Staphylococcus aureus]	100	99.8	0.0
BAAHSY010000001.1_146|141296|142969|1|ID=1_146;partial=00;start_type=ATG;rbs_motif=None;rbs_spacer=None;gc_cont=0.324	WP_000857602.1 MULTISPECIES: amino acid ABC transporter ATP-binding/permease protein [Staphylococcus]	100	99.8	0.0
BAAHSY010000001.1_147|143096|143539|-1|ID=1_147;partial=00;start_type=ATG;rbs_motif=AGGAG;rbs_spacer=5-10bp;gc_cont=0.331	WP_001283444.1 MULTISPECIES: HTH-type transcriptional regulator MgrA [Staphylococcus]	100	99.3	8.66e-94
BAAHSY010000001.1_148|143766|144692|1|ID=1_148;partial=00;start_type=ATG;rbs_motif=GGA/GAG/AGG;rbs_spacer=5-10bp;gc_cont=0.311	WP_000794407.1 MULTISPECIES: CobW family GTP-binding protein [Staphylococcus]	100	99.7	8.36e-217
BAAHSY010000001.1_149|144795|145703|1|ID=1_149;partial=00;start_type=ATG;rbs_motif=GGAG/GAGG;rbs_spacer=5-10bp;gc_cont=0.337	WP_000435108.1 aldo/keto reductase [Staphylococcus aureus]	100	99.7	1.63e-220
BAAHSY010000001.1_150|145738|146025|1|ID=1_150;partial=00;start_type=ATG;rbs_motif=AGGAG;rbs_spacer=5-10bp;gc_cont=0.271	WP_000180419.1 MULTISPECIES: hypothetical protein [Staphylococcus]	100	99.0	1.71e-55
BAAHSY010000001.1_151|146308|147861|1|ID=1_151;partial=00;start_type=ATG;rbs_motif=GGA/GAG/AGG;rbs_spacer=5-10bp;gc_cont=0.355	WP_001288049.1 MULTISPECIES: SLC13 family permease [Staphylococcus]	100	99.8	0.0
BAAHSY010000001.1_152|147947|149320|1|ID=1_152;partial=00;start_type=ATG;rbs_motif=GGA/GAG/AGG;rbs_spacer=11-12bp;gc_cont=0.339	WP_000952048.1 MULTISPECIES: cryptochrome/photolyase family protein [Staphylococcus]	100	99.8	0.0
BAAHSY010000001.1_153|149756|150373|-1|ID=1_153;partial=00;start_type=ATG;rbs_motif=None;rbs_spacer=None;gc_cont=0.294	WP_001191874.1 MULTISPECIES: DUF1361 domain-containing protein [Staphylococcus]	100	99.5	6.00e-136
BAAHSY010000001.1_154|150559|150981|-1|ID=1_154;partial=00;start_type=ATG;rbs_motif=GGA/GAG/AGG;rbs_spacer=5-10bp;gc_cont=0.345	WP_000776018.1 MULTISPECIES: PPC domain-containing DNA-binding protein [Staphylococcus]	100	99.3	1.26e-94
BAAHSY010000001.1_155|151190|152356|1|ID=1_155;partial=00;start_type=ATG;rbs_motif=GGAG/GAGG;rbs_spacer=5-10bp;gc_cont=0.334	WP_001041272.1 MULTISPECIES: multidrug efflux MFS transporter NorA [Staphylococcus]	100	99.7	2.21e-266
BAAHSY010000001.1_156|152649|153101|1|ID=1_156;partial=00;start_type=ATG;rbs_motif=None;rbs_spacer=None;gc_cont=0.276	WP_000216727.1 MULTISPECIES: hypothetical protein [Staphylococcus]	100	99.3	9.67e-97
BAAHSY010000001.1_157|153275|153757|1|ID=1_157;partial=00;start_type=ATG;rbs_motif=GGAG/GAGG;rbs_spacer=5-10bp;gc_cont=0.358	WP_001107241.1 MULTISPECIES: Cys-tRNA(Pro) deacylase [Staphylococcus]	100	99.4	4.34e-107
BAAHSY010000001.1_158|154007|154771|1|ID=1_158;partial=00;start_type=ATG;rbs_motif=GGA/GAG/AGG;rbs_spacer=5-10bp;gc_cont=0.319	WP_000972699.1 MULTISPECIES: DeoR/GlpR family DNA-binding transcription regulator [Staphylococcus]	100	99.6	4.87e-173
BAAHSY010000001.1_159|154768|155688|1|ID=1_159;partial=00;start_type=ATG;rbs_motif=AGGAG;rbs_spacer=5-10bp;gc_cont=0.369	WP_000640743.1 MULTISPECIES: 1-phosphofructokinase [Staphylococcus]	100	99.7	2.99e-209
BAAHSY010000001.1_160|155694|157652|1|ID=1_160;partial=00;start_type=ATG;rbs_motif=GGAG/GAGG;rbs_spacer=5-10bp;gc_cont=0.377	WP_001266541.1 MULTISPECIES: PTS fructose transporter subunit IIABC [Staphylococcus]	100	99.8	0.0
BAAHSY010000001.1_161|157960|159141|1|ID=1_161;partial=00;start_type=GTG;rbs_motif=GGA/GAG/AGG;rbs_spacer=5-10bp;gc_cont=0.360	WP_001292247.1 MULTISPECIES: N-acetylglucosamine-6-phosphate deacetylase [Staphylococcus]	100	99.7	6.81e-284
BAAHSY010000001.1_162|159362|160711|1|ID=1_162;partial=00;start_type=TTG;rbs_motif=GGA/GAG/AGG;rbs_spacer=5-10bp;gc_cont=0.323	WP_000450257.1 MULTISPECIES: hemolysin family protein [Staphylococcus]	100	99.8	0.0
BAAHSY010000001.1_163|160933|161772|1|ID=1_163;partial=00;start_type=ATG;rbs_motif=GGAG/GAGG;rbs_spacer=5-10bp;gc_cont=0.318	WP_000931237.1 MULTISPECIES: aldo/keto reductase [Staphylococcus]	100	99.6	2.38e-206
BAAHSY010000001.1_164|161904|162887|1|ID=1_164;partial=00;start_type=ATG;rbs_motif=AGGA;rbs_spacer=5-10bp;gc_cont=0.313	WP_000702782.1 MULTISPECIES: lipoteichoic acid-specific glycosylation protein CsbB [Staphylococcus]	100	99.7	6.24e-233
BAAHSY010000001.1_165|162959|164014|-1|ID=1_165;partial=00;start_type=ATG;rbs_motif=AGGAG;rbs_spacer=5-10bp;gc_cont=0.304	WP_000244412.1 MULTISPECIES: two-component system sensor histidine kinase SaeS [Staphylococcus]	100	99.7	5.34e-237
BAAHSY010000001.1_166|164014|164700|-1|ID=1_166;partial=00;start_type=ATG;rbs_motif=AGGA/GGAG/GAGG;rbs_spacer=11-12bp;gc_cont=0.328	WP_000149344.1 MULTISPECIES: response regulator transcription factor SaeR [Staphylococcus]	100	99.6	5.34e-164
BAAHSY010000001.1_167|164675|165148|-1|ID=1_167;partial=00;start_type=ATG;rbs_motif=None;rbs_spacer=None;gc_cont=0.340	WP_001037807.1 MULTISPECIES: DoxX family membrane protein [Staphylococcus]	100	99.4	4.53e-103
BAAHSY010000001.1_168|165490|165930|-1|ID=1_168;partial=00;start_type=ATG;rbs_motif=AGGAG;rbs_spacer=5-10bp;gc_cont=0.315	WP_001093553.1 MULTISPECIES: DM13 domain-containing protein [Bacteria]	100	99.3	1.39e-94
BAAHSY010000001.1_169|166210|166794|-1|ID=1_169;partial=00;start_type=ATG;rbs_motif=AGGAG;rbs_spacer=5-10bp;gc_cont=0.262	WP_000637687.1 MULTISPECIES: hypothetical protein [Staphylococcus]	100	99.5	3.75e-120
BAAHSY010000001.1_170|166893|167606|-1|ID=1_170;partial=00;start_type=ATG;rbs_motif=GGA/GAG/AGG;rbs_spacer=5-10bp;gc_cont=0.361	WP_001062972.1 MULTISPECIES: 7-carboxy-7-deazaguanine synthase QueE [Staphylococcus]	100	99.6	2.76e-175
BAAHSY010000001.1_171|167610|168029|-1|ID=1_171;partial=00;start_type=ATG;rbs_motif=AGGAG;rbs_spacer=5-10bp;gc_cont=0.326	WP_000941336.1 MULTISPECIES: 6-carboxytetrahydropterin synthase QueD [Staphylococcus]	100	99.3	2.18e-99
BAAHSY010000001.1_172|168031|168699|-1|ID=1_172;partial=00;start_type=ATG;rbs_motif=AGGAG;rbs_spacer=5-10bp;gc_cont=0.345	WP_000446724.1 MULTISPECIES: 7-cyano-7-deazaguanine synthase QueC [Staphylococcus]	100	99.6	6.51e-162
BAAHSY010000001.1_173|169050|169643|1|ID=1_173;partial=00;start_type=ATG;rbs_motif=GGAG/GAGG;rbs_spacer=5-10bp;gc_cont=0.338	WP_000604514.1 MULTISPECIES: anthranilate synthase component II [Staphylococcus]	100	99.5	1.56e-143
BAAHSY010000001.1_174|169627|170778|1|ID=1_174;partial=00;start_type=GTG;rbs_motif=GGA/GAG/AGG;rbs_spacer=5-10bp;gc_cont=0.323	WP_001217785.1 MULTISPECIES: chorismate-binding protein [Staphylococcus]	100	99.7	8.43e-273
BAAHSY010000001.1_175|170778|171386|1|ID=1_175;partial=00;start_type=ATG;rbs_motif=GGAG/GAGG;rbs_spacer=5-10bp;gc_cont=0.309	WP_001175781.1 MULTISPECIES: aminotransferase class IV [Bacillati]	100	99.5	7.11e-147
BAAHSY010000001.1_176|171746|172456|1|ID=1_176;partial=00;start_type=ATG;rbs_motif=GGAG/GAGG;rbs_spacer=5-10bp;gc_cont=0.300	WP_000708692.1 MULTISPECIES: allophanate hydrolase subunit 1 [Bacillati]	100	99.6	6.47e-169
BAAHSY010000001.1_177|172440|173444|1|ID=1_177;partial=00;start_type=ATG;rbs_motif=AGGAG;rbs_spacer=5-10bp;gc_cont=0.344	WP_000022323.1 MULTISPECIES: biotin-dependent carboxyltransferase family protein [Bacillati]	100	99.7	2.91e-246
BAAHSY010000001.1_178|173918|175858|1|ID=1_178;partial=00;start_type=ATG;rbs_motif=GGA/GAG/AGG;rbs_spacer=5-10bp;gc_cont=0.311	WP_000098285.1 MULTISPECIES: polyglycerol-phosphate lipoteichoic acid synthase LtaS [Staphylococcus]	100	99.8	0.0
BAAHSY010000001.1_179|176135|178012|1|ID=1_179;partial=00;start_type=ATG;rbs_motif=AGGA;rbs_spacer=5-10bp;gc_cont=0.331	WP_000525112.1 ABC-F family ATP-binding cassette domain-containing protein [Staphylococcus aureus]	100	99.8	0.0
BAAHSY010000001.1_180|178024|179805|1|ID=1_180;partial=00;start_type=ATG;rbs_motif=GGA/GAG/AGG;rbs_spacer=5-10bp;gc_cont=0.320	WP_000983677.1 MULTISPECIES: DNA helicase RecQ [Staphylococcus]	100	99.8	0.0
BAAHSY010000001.1_181|180027|181004|1|ID=1_181;partial=00;start_type=GTG;rbs_motif=GGAG/GAGG;rbs_spacer=5-10bp;gc_cont=0.336	WP_000589260.1 MULTISPECIES: ABC transporter ATP-binding protein [Staphylococcus]	100	99.7	2.27e-234
BAAHSY010000001.1_182|180997|182511|1|ID=1_182;partial=00;start_type=ATG;rbs_motif=AGGAG;rbs_spacer=5-10bp;gc_cont=0.315	WP_000180991.1 MULTISPECIES: ABC transporter permease/substrate-binding protein [Staphylococcus]	100	99.8	0.0
BAAHSY010000001.1_183|182655|183809|1|ID=1_183;partial=00;start_type=GTG;rbs_motif=None;rbs_spacer=None;gc_cont=0.330	WP_000663030.1 MULTISPECIES: histidinol-phosphate transaminase [Staphylococcus]	100	91.4	6.48e-256
BAAHSY010000001.1_184|184160|184702|1|ID=1_184;partial=00;start_type=ATG;rbs_motif=AGGAG;rbs_spacer=5-10bp;gc_cont=0.320	WP_000197273.1 5' nucleotidase, NT5C type [Staphylococcus aureus]	100	99.4	2.64e-129
BAAHSY010000001.1_185|185326|186243|-1|ID=1_185;partial=00;start_type=ATG;rbs_motif=GGA/GAG/AGG;rbs_spacer=5-10bp;gc_cont=0.319	WP_000429014.1 MULTISPECIES: diacylglycerol/lipid kinase family protein [Staphylococcus]	100	99.7	4.16e-220
BAAHSY010000001.1_186|186513|188018|-1|ID=1_186;partial=00;start_type=ATG;rbs_motif=GGA/GAG/AGG;rbs_spacer=5-10bp;gc_cont=0.343	WP_000193752.1 peptide MFS transporter [Staphylococcus aureus]	100	99.8	0.0
BAAHSY010000001.1_187|188359|188859|-1|ID=1_187;partial=00;start_type=ATG;rbs_motif=AGGAG;rbs_spacer=5-10bp;gc_cont=0.313	WP_000930014.1 MULTISPECIES: preQ(1) synthase [Staphylococcus]	100	99.4	4.84e-125
BAAHSY010000001.1_188|188879|189745|-1|ID=1_188;partial=00;start_type=TTG;rbs_motif=GGAG/GAGG;rbs_spacer=5-10bp;gc_cont=0.330	WP_001068497.1 MULTISPECIES: DMT family transporter [Staphylococcus]	100	99.7	4.86e-190
BAAHSY010000001.1_189|190139|190396|1|ID=1_189;partial=00;start_type=ATG;rbs_motif=None;rbs_spacer=None;gc_cont=0.236	WP_078104061.1 ribonucleoside-diphosphate reductase, partial [Staphylococcus aureus]	98.4	74.4	1.62e-38
BAAHSY010000001.1_190|190546|190944|1|ID=1_190;partial=00;start_type=ATG;rbs_motif=GGA/GAG/AGG;rbs_spacer=5-10bp;gc_cont=0.341	WP_000692521.1 MULTISPECIES: class Ib ribonucleoside-diphosphate reductase assembly flavoprotein NrdI [Staphylococcus]	100	99.2	1.10e-91
BAAHSY010000001.1_191|190907|193012|1|ID=1_191;partial=00;start_type=ATG;rbs_motif=AGxAGG/AGGxGG;rbs_spacer=5-10bp;gc_cont=0.329	WP_000855505.1 MULTISPECIES: class 1b ribonucleoside-diphosphate reductase subunit alpha [Staphylococcus]	100	99.9	0.0
BAAHSY010000001.1_192|193130|194101|1|ID=1_192;partial=00;start_type=ATG;rbs_motif=AGGA;rbs_spacer=5-10bp;gc_cont=0.326	WP_000562498.1 MULTISPECIES: class 1b ribonucleoside-diphosphate reductase subunit beta [Staphylococcus]	100	99.7	6.77e-235
BAAHSY010000001.1_193|194767|195780|1|ID=1_193;partial=00;start_type=ATG;rbs_motif=GGA/GAG/AGG;rbs_spacer=11-12bp;gc_cont=0.317	WP_410229962.1 ABC transporter permease [Staphylococcus aureus]	96.7	99.7	6.47e-215
BAAHSY010000001.1_194|195767|196723|1|ID=1_194;partial=00;start_type=ATG;rbs_motif=AGGA;rbs_spacer=5-10bp;gc_cont=0.297	WP_001245577.1 MULTISPECIES: iron chelate uptake ABC transporter family permease subunit [Staphylococcus]	100	99.7	7.74e-202
BAAHSY010000001.1_195|196720|197481|1|ID=1_195;partial=00;start_type=ATG;rbs_motif=AGGAG;rbs_spacer=5-10bp;gc_cont=0.304	WP_000616842.1 MULTISPECIES: iron ABC transporter ATP-binding protein [Staphylococcus]	100	99.6	1.11e-173
BAAHSY010000001.1_196|197600|198628|1|ID=1_196;partial=00;start_type=ATG;rbs_motif=AGGA/GGAG/GAGG;rbs_spacer=11-12bp;gc_cont=0.295	WP_000754443.1 MULTISPECIES: ferrated catecholamine ABC transporter substrate-binding lipoprotein SstD [Staphylococcus]	100	99.7	3.46e-233
BAAHSY010000001.1_197|198945|199259|-1|ID=1_197;partial=00;start_type=ATG;rbs_motif=AGGAG;rbs_spacer=5-10bp;gc_cont=0.327	WP_001127269.1 MULTISPECIES: CHY zinc finger protein [Staphylococcus]	100	99.0	1.81e-79
BAAHSY010000001.1_198|199277|200200|-1|ID=1_198;partial=00;start_type=GTG;rbs_motif=AGGA/GGAG/GAGG;rbs_spacer=11-12bp;gc_cont=0.354	WP_000608440.1 MULTISPECIES: UDP-N-acetylmuramate dehydrogenase [Staphylococcus]	100	99.7	8.41e-221
BAAHSY010000001.1_199|200327|200845|-1|ID=1_199;partial=00;start_type=ATG;rbs_motif=AGGAG;rbs_spacer=5-10bp;gc_cont=0.281	WP_000287207.1 MULTISPECIES: GrpB family protein [Staphylococcus]	100	99.4	4.09e-120
BAAHSY010000001.1_200|200965|201843|1|ID=1_200;partial=00;start_type=ATG;rbs_motif=AGGAG;rbs_spacer=5-10bp;gc_cont=0.274	WP_000724887.1 MULTISPECIES: EMYY motif lipoprotein [Staphylococcus]	100	99.7	2.16e-195
BAAHSY010000001.1_201|201997|202317|1|ID=1_201;partial=00;start_type=GTG;rbs_motif=GGAG/GAGG;rbs_spacer=5-10bp;gc_cont=0.324	WP_000985617.1 MULTISPECIES: bacillithiol system redox-active protein YtxJ [Bacilli]	100	99.1	1.81e-71
BAAHSY010000001.1_202|202742|203866|1|ID=1_202;partial=00;start_type=ATG;rbs_motif=AGxAGG/AGGxGG;rbs_spacer=5-10bp;gc_cont=0.344	WP_000866747.1 glycerate kinase [Staphylococcus aureus]	100	99.7	4.47e-268
BAAHSY010000001.1_203|204055|205281|-1|ID=1_203;partial=00;start_type=ATG;rbs_motif=GGA/GAG/AGG;rbs_spacer=11-12bp;gc_cont=0.353	WP_000795826.1 MULTISPECIES: peptidase T [Staphylococcus]	100	99.8	1.37e-302
BAAHSY010000001.1_204|205295|205789|-1|ID=1_204;partial=00;start_type=ATG;rbs_motif=AGGA;rbs_spacer=5-10bp;gc_cont=0.337	WP_000899890.1 MULTISPECIES: threonine/serine exporter family protein [Staphylococcus]	100	99.4	2.49e-108
BAAHSY010000001.1_205|205807|206568|-1|ID=1_205;partial=00;start_type=ATG;rbs_motif=GGAG/GAGG;rbs_spacer=5-10bp;gc_cont=0.357	WP_001113406.1 MULTISPECIES: threonine/serine exporter family protein [Staphylococcus]	100	99.6	3.00e-162
BAAHSY010000001.1_206|206764|207834|-1|ID=1_206;partial=00;start_type=ATG;rbs_motif=AGGA/GGAG/GAGG;rbs_spacer=11-12bp;gc_cont=0.306	WP_000460983.1 MULTISPECIES: GGDEF domain-containing protein GdpS [Staphylococcus]	100	99.7	2.36e-238
BAAHSY010000001.1_207|208152|209207|1|ID=1_207;partial=00;start_type=ATG;rbs_motif=GGA/GAG/AGG;rbs_spacer=5-10bp;gc_cont=0.315	WP_000258151.1 MULTISPECIES: glycosyltransferase family 4 protein [Staphylococcus]	100	99.7	1.29e-228
BAAHSY010000001.1_208|209377|210018|-1|ID=1_208;partial=00;start_type=ATG;rbs_motif=AGGAG;rbs_spacer=5-10bp;gc_cont=0.340	WP_000192947.1 MULTISPECIES: YigZ family protein [Staphylococcus]	100	99.5	1.08e-151
BAAHSY010000001.1_209|210162|211028|1|ID=1_209;partial=00;start_type=ATG;rbs_motif=AGGAG;rbs_spacer=5-10bp;gc_cont=0.340	WP_000686342.1 MULTISPECIES: fatty acid kinase binding subunit FakB1 [Staphylococcus]	100	99.7	2.66e-203
BAAHSY010000001.1_210|211392|212474|1|ID=1_210;partial=00;start_type=ATG;rbs_motif=None;rbs_spacer=None;gc_cont=0.323	WP_001548033.1 MULTISPECIES: DEAD/DEAH box helicase [Staphylococcus]	100	99.7	9.15e-254
BAAHSY010000001.1_211|212467|213141|1|ID=1_211;partial=00;start_type=ATG;rbs_motif=GGAG/GAGG;rbs_spacer=5-10bp;gc_cont=0.308	WP_001057965.1 MULTISPECIES: ComF family protein [Staphylococcus]	100	99.6	3.92e-164
BAAHSY010000001.1_212|213202|213774|1|ID=1_212;partial=00;start_type=ATG;rbs_motif=AGGAG;rbs_spacer=5-10bp;gc_cont=0.332	WP_000617735.1 MULTISPECIES: ribosome hibernation-promoting factor, HPF/YfiA family [Staphylococcus]	100	99.5	8.03e-129
BAAHSY010000001.1_213|214188|216719|1|ID=1_213;partial=00;start_type=ATG;rbs_motif=AGGAG;rbs_spacer=5-10bp;gc_cont=0.350	WP_000506531.1 MULTISPECIES: preprotein translocase subunit SecA [Staphylococcus]	100	99.9	0.0
BAAHSY010000001.1_214|217149|218144|1|ID=1_214;partial=00;start_type=ATG;rbs_motif=None;rbs_spacer=None;gc_cont=0.366	WP_147715358.1 peptide chain release factor 2, partial [Staphylococcus aureus]	100	99.7	5.36e-239
BAAHSY010000001.1_215|218552|219391|1|ID=1_215;partial=00;start_type=ATG;rbs_motif=AGGA/GGAG/GAGG;rbs_spacer=11-12bp;gc_cont=0.352	WP_000749382.1 COG3942 and LysM peptidoglycan-binding domain-containing protein [Staphylococcus aureus]	100	99.6	3.03e-168
BAAHSY010000001.1_216|219547|220215|1|ID=1_216;partial=00;start_type=ATG;rbs_motif=None;rbs_spacer=None;gc_cont=0.287	WP_123090125.1 YfbR-like 5'-deoxynucleotidase [Staphylococcus aureus]	99.5	99.6	1.25e-150
BAAHSY010000001.1_217|220212|220448|1|ID=1_217;partial=00;start_type=ATG;rbs_motif=GGAG/GAGG;rbs_spacer=5-10bp;gc_cont=0.304	WP_000638419.1 MULTISPECIES: CsbA family protein [Staphylococcus]	100	98.7	3.06e-48
BAAHSY010000001.1_218|220717|222702|1|ID=1_218;partial=00;start_type=ATG;rbs_motif=AGGA/GGAG/GAGG;rbs_spacer=11-12bp;gc_cont=0.350	WP_000229253.1 MULTISPECIES: excinuclease ABC subunit UvrB [Staphylococcus]	100	99.8	0.0
BAAHSY010000001.1_219|222710|225556|1|ID=1_219;partial=00;start_type=ATG;rbs_motif=AGxAGG/AGGxGG;rbs_spacer=11-12bp;gc_cont=0.354	WP_000662675.1 excinuclease ABC subunit UvrA [Staphylococcus aureus]	100	99.9	0.0
BAAHSY010000001.1_220|226218|227150|1|ID=1_220;partial=00;start_type=ATG;rbs_motif=GGAG/GAGG;rbs_spacer=5-10bp;gc_cont=0.356	WP_000958224.1 MULTISPECIES: HPr(Ser) kinase/phosphatase [Staphylococcus]	100	99.7	4.44e-213
BAAHSY010000001.1_221|227156|227995|1|ID=1_221;partial=00;start_type=ATG;rbs_motif=AGGAG;rbs_spacer=5-10bp;gc_cont=0.327	WP_000513308.1 MULTISPECIES: prolipoprotein diacylglyceryl transferase [Staphylococcus]	100	99.6	1.27e-201
BAAHSY010000001.1_222|228003|228488|1|ID=1_222;partial=00;start_type=TTG;rbs_motif=AGxAG;rbs_spacer=5-10bp;gc_cont=0.317	WP_001224795.1 acyltransferase [Staphylococcus aureus]	98.1	99.4	4.38e-87
BAAHSY010000001.1_223|228496|229935|1|ID=1_223;partial=00;start_type=ATG;rbs_motif=AGGAGG;rbs_spacer=5-10bp;gc_cont=0.294	WP_000057551.1 tetratricopeptide repeat protein [Staphylococcus aureus]	100	99.8	0.0
BAAHSY010000001.1_224|230002|230937|1|ID=1_224;partial=00;start_type=ATG;rbs_motif=AGGAGG;rbs_spacer=5-10bp;gc_cont=0.372	WP_000134963.1 MULTISPECIES: thioredoxin-disulfide reductase [Staphylococcus]	100	99.7	4.18e-223
BAAHSY010000001.1_225|231817|232728|1|ID=1_225;partial=00;start_type=ATG;rbs_motif=None;rbs_spacer=None;gc_cont=0.318	WP_000369722.1 MULTISPECIES: RNase adapter RapZ [Staphylococcus]	100	99.7	2.69e-215
BAAHSY010000001.1_226|232725|233720|1|ID=1_226;partial=00;start_type=ATG;rbs_motif=GGA/GAG/AGG;rbs_spacer=5-10bp;gc_cont=0.334	WP_001248939.1 MULTISPECIES: YvcK family protein [Staphylococcus]	100	99.7	5.75e-231
BAAHSY010000001.1_227|233830|234774|1|ID=1_227;partial=00;start_type=ATG;rbs_motif=AGGA/GGAG/GAGG;rbs_spacer=11-12bp;gc_cont=0.331	WP_000006556.1 DNA-binding protein WhiA [Staphylococcus aureus]	100	99.7	2.57e-214
BAAHSY010000001.1_228|235348|235935|1|ID=1_228;partial=00;start_type=ATG;rbs_motif=AGGAG;rbs_spacer=5-10bp;gc_cont=0.344	WP_001049165.1 MULTISPECIES: ATP-dependent Clp endopeptidase proteolytic subunit ClpP [Staphylococcus]	100	99.5	6.07e-131
BAAHSY010000001.1_230|236178|237080|-1|ID=1_230;partial=00;start_type=ATG;rbs_motif=None;rbs_spacer=None;gc_cont=0.332	WP_000816295.1 MULTISPECIES: TIGR01777 family oxidoreductase [Staphylococcus]	100	99.7	1.34e-218
BAAHSY010000001.1_231|237782|238411|1|ID=1_231;partial=00;start_type=ATG;rbs_motif=GGAG/GAGG;rbs_spacer=5-10bp;gc_cont=0.354	WP_124781530.1 DUF4887 domain-containing protein [Staphylococcus aureus]	100	99.5	2.17e-63
BAAHSY010000001.1_232|239113|240126|1|ID=1_232;partial=00;start_type=GTG;rbs_motif=AGGAG;rbs_spacer=5-10bp;gc_cont=0.374	WP_000654030.1 MULTISPECIES: sugar-binding transcriptional regulator [Staphylococcus]	100	99.7	8.20e-234
BAAHSY010000001.1_233|240179|241189|1|ID=1_233;partial=00;start_type=ATG;rbs_motif=AGGAG;rbs_spacer=5-10bp;gc_cont=0.379	WP_000279414.1 MULTISPECIES: type I glyceraldehyde-3-phosphate dehydrogenase [Staphylococcus]	100	99.7	1.94e-236
BAAHSY010000001.1_234|241328|242518|1|ID=1_234;partial=00;start_type=ATG;rbs_motif=AGGAG;rbs_spacer=5-10bp;gc_cont=0.348	WP_001074749.1 MULTISPECIES: phosphoglycerate kinase [Staphylococcus]	100	99.7	2.27e-279
BAAHSY010000001.1_235|242640|243401|1|ID=1_235;partial=00;start_type=ATG;rbs_motif=AGGAG;rbs_spacer=5-10bp;gc_cont=0.366	WP_001260091.1 triose-phosphate isomerase [Staphylococcus aureus]	100	99.6	4.20e-178
BAAHSY010000001.1_236|243404|244921|1|ID=1_236;partial=00;start_type=ATG;rbs_motif=AGxAGG/AGGxGG;rbs_spacer=11-12bp;gc_cont=0.366	WP_001085505.1 MULTISPECIES: 2,3-bisphosphoglycerate-independent phosphoglycerate mutase [Staphylococcus]	100	99.8	0.0
BAAHSY010000001.1_237|245051|246355|1|ID=1_237;partial=00;start_type=ATG;rbs_motif=AGGAG;rbs_spacer=5-10bp;gc_cont=0.369	WP_001121760.1 MULTISPECIES: surface-displayed alpha-enolase [Staphylococcus]	100	99.8	3.20e-312
BAAHSY010000001.1_238|246695|247153|1|ID=1_238;partial=00;start_type=ATG;rbs_motif=AGGAG;rbs_spacer=5-10bp;gc_cont=0.316	WP_000785252.1 MULTISPECIES: hypothetical protein [Staphylococcus]	100	99.3	5.57e-97
