CP007027.1_1952|2173488|2174570|1|ID=1_1952;partial=00;start_type=ATG;rbs_motif=None;rbs_spacer=None;gc_cont=0.639	WP_003409667.1 MULTISPECIES: serine hydrolase domain-containing protein [Mycobacterium]	100	99.7	7.16e-256
CP007027.1_1953|2174621|2175901|1|ID=1_1953;partial=00;start_type=ATG;rbs_motif=None;rbs_spacer=None;gc_cont=0.631	WP_003911710.1 MULTISPECIES: lipase LipD [Mycobacterium]	100	99.8	1.32e-314
CP007027.1_1954|2175938|2176318|-1|ID=1_1954;partial=00;start_type=ATG;rbs_motif=AGGAG;rbs_spacer=5-10bp;gc_cont=0.659	WP_003900434.1 MULTISPECIES: hypothetical protein [Mycobacterium]	100	99.2	8.89e-77
CP007027.1_1955|2176475|2178337|1|ID=1_1955;partial=00;start_type=ATG;rbs_motif=None;rbs_spacer=None;gc_cont=0.649	WP_003409680.1 MULTISPECIES: fatty-acid--AMP ligase FAAL31/FadD31 [Mycobacterium]	100	99.8	0.0
CP007027.1_1956|2178345|2178824|-1|ID=1_1956;partial=00;start_type=ATG;rbs_motif=GGAGG;rbs_spacer=5-10bp;gc_cont=0.617	WP_003409684.1 MULTISPECIES: immunoprotective protein Mpt63 [Mycobacterium]	100	99.4	4.51e-104
CP007027.1_1957|2179061|2179834|1|ID=1_1957;partial=00;start_type=GTG;rbs_motif=AGGA;rbs_spacer=5-10bp;gc_cont=0.655	WP_003409685.1 MULTISPECIES: YqjF family protein [Mycobacterium]	100	99.6	2.66e-192
CP007027.1_1958|2179838|2180605|-1|ID=1_1958;partial=00;start_type=ATG;rbs_motif=GGA/GAG/AGG;rbs_spacer=5-10bp;gc_cont=0.594	WP_003409686.1 MULTISPECIES: SDR family oxidoreductase [Mycobacterium]	100	99.6	6.96e-178
CP007027.1_1959|2181306|2181830|-1|ID=1_1959;partial=00;start_type=ATG;rbs_motif=GGAG/GAGG;rbs_spacer=5-10bp;gc_cont=0.703	WP_083028095.1 glutamine amidotransferase [Mycobacterium tuberculosis]	99.4	99.4	2.97e-114
CP007027.1_1960|2181848|2182078|-1|ID=1_1960;partial=00;start_type=ATG;rbs_motif=None;rbs_spacer=None;gc_cont=0.667	WP_003916914.1 helix-turn-helix domain-containing protein [Mycobacterium tuberculosis]	100	98.7	1.27e-46
CP007027.1_1961|2182075|2182353|-1|ID=1_1961;partial=00;start_type=ATG;rbs_motif=None;rbs_spacer=None;gc_cont=0.695	WP_234887192.1 DJ-1/PfpI family protein [Mycobacterium tuberculosis]	100	98.9	1.53e-58
CP007027.1_1962|2182760|2183257|1|ID=1_1962;partial=00;start_type=ATG;rbs_motif=None;rbs_spacer=None;gc_cont=0.655	WP_003409700.1 MULTISPECIES: thiol peroxidase [Mycobacterium]	100	99.4	1.97e-110
CP007027.1_1963|2183254|2184345|-1|ID=1_1963;partial=00;start_type=GTG;rbs_motif=None;rbs_spacer=None;gc_cont=0.689	WP_003900437.1 MULTISPECIES: acyl-CoA dehydrogenase family protein [Mycobacterium]	100	99.7	3.18e-251
CP007027.1_1964|2184347|2185576|-1|ID=1_1964;partial=00;start_type=GTG;rbs_motif=AGGA/GGAG/GAGG;rbs_spacer=11-12bp;gc_cont=0.698	WP_003900438.1 MULTISPECIES: acyl-CoA dehydrogenase [Mycobacterium]	100	99.8	2.29e-306
CP007027.1_1965|2185591|2186547|-1|ID=1_1965;partial=00;start_type=ATG;rbs_motif=AGGAG;rbs_spacer=5-10bp;gc_cont=0.669	WP_003409707.1 MULTISPECIES: enoyl-CoA hydratase [Mycobacterium]	100	99.7	9.64e-237
CP007027.1_1966|2186772|2187881|1|ID=1_1966;partial=00;start_type=ATG;rbs_motif=AGGA;rbs_spacer=5-10bp;gc_cont=0.657	WP_003904740.1 MULTISPECIES: LLM class flavin-dependent oxidoreductase [Mycobacterium]	100	99.7	2.01e-282
CP007027.1_1967|2187884|2190403|1|ID=1_1967;partial=00;start_type=ATG;rbs_motif=GGxGG;rbs_spacer=5-10bp;gc_cont=0.659	WP_003409714.1 MULTISPECIES: FAD-binding oxidoreductase [Mycobacterium]	100	99.9	0.0
CP007027.1_1968|2190415|2191485|1|ID=1_1968;partial=00;start_type=GTG;rbs_motif=AGGAG;rbs_spacer=5-10bp;gc_cont=0.665	WP_003899091.1 MULTISPECIES: epoxide hydrolase EphB [Mycobacterium]	100	99.7	2.60e-276
CP007027.1_1969|2191482|2191997|1|ID=1_1969;partial=00;start_type=GTG;rbs_motif=AGxAGG/AGGxGG;rbs_spacer=5-10bp;gc_cont=0.674	WP_003409718.1 MULTISPECIES: flavin reductase family protein [Mycobacterium]	100	99.4	4.99e-125
CP007027.1_1970|2191994|2193055|1|ID=1_1970;partial=00;start_type=ATG;rbs_motif=GGAG/GAGG;rbs_spacer=5-10bp;gc_cont=0.690	WP_003899092.1 MULTISPECIES: 3,4-dihydroxy-2-butanone-4-phosphate synthase [Mycobacterium]	100	99.7	1.03e-251
CP007027.1_1971|2193052|2193822|1|ID=1_1971;partial=00;start_type=TTG;rbs_motif=GGxGG;rbs_spacer=5-10bp;gc_cont=0.673	WP_003409775.1 MULTISPECIES: SDR family oxidoreductase [Mycobacterium]	100	99.6	3.15e-170
CP007027.1_1972|2194358|2194594|-1|ID=1_1972;partial=00;start_type=ATG;rbs_motif=AGxAG;rbs_spacer=3-4bp;gc_cont=0.633	WP_250578107.1 type II toxin-antitoxin system antitoxin MazE5, partial [Mycobacterium tuberculosis]	100	98.7	1.23e-44
CP007027.1_1973|2194732|2195217|-1|ID=1_1973;partial=00;start_type=ATG;rbs_motif=AGGA;rbs_spacer=5-10bp;gc_cont=0.677	WP_003911711.1 SEC-C domain-containing protein [Mycobacterium tuberculosis]	100	99.4	1.70e-118
CP007027.1_1974|2195377|2196741|1|ID=1_1974;partial=00;start_type=ATG;rbs_motif=None;rbs_spacer=None;gc_cont=0.649	WP_003903691.1 MULTISPECIES: HNH endonuclease signature motif containing protein [Mycobacterium tuberculosis complex]	100	99.8	0.0
CP007027.1_1976|2197019|2197237|1|ID=1_1976;partial=00;start_type=ATG;rbs_motif=None;rbs_spacer=None;gc_cont=0.626	WP_234811457.1 AAA family ATPase [Mycolicibacterium elephantis]	73.6	72.6	3.03e-17
CP007027.1_1977|2197412|2197813|1|ID=1_1977;partial=00;start_type=GTG;rbs_motif=None;rbs_spacer=None;gc_cont=0.669	WP_003409869.1 MULTISPECIES: hypothetical protein [Mycobacterium]	100	99.3	6.12e-94
CP007027.1_1978|2198102|2198452|-1|ID=1_1978;partial=00;start_type=ATG;rbs_motif=GGA/GAG/AGG;rbs_spacer=5-10bp;gc_cont=0.513	WP_003899096.1 MULTISPECIES: hypothetical protein [Mycobacterium]	100	99.1	3.62e-78
CP007027.1_1979|2198463|2199365|-1|ID=1_1979;partial=00;start_type=TTG;rbs_motif=None;rbs_spacer=None;gc_cont=0.629	WP_055366429.1 hypothetical protein [Mycobacterium tuberculosis]	98.0	99.7	1.22e-205
CP007027.1_1980|2199386|2199577|-1|ID=1_1980;partial=00;start_type=TTG;rbs_motif=GGAG/GAGG;rbs_spacer=5-10bp;gc_cont=0.599	WP_003409876.1 MULTISPECIES: hypothetical protein [Mycobacterium]	100	98.4	1.16e-43
CP007027.1_1981|2199578|2199874|-1|ID=1_1981;partial=00;start_type=ATG;rbs_motif=None;rbs_spacer=None;gc_cont=0.687	WP_003409877.1 MULTISPECIES: hypothetical protein [Mycobacterium]	100	99.0	1.18e-52
CP007027.1_1982|2200114|2200329|1|ID=1_1982;partial=00;start_type=GTG;rbs_motif=GGAG/GAGG;rbs_spacer=5-10bp;gc_cont=0.657	WP_003409878.1 MULTISPECIES: FitA-like ribbon-helix-helix domain-containing protein [Mycobacterium]	100	98.6	2.79e-41
CP007027.1_1983|2200326|2200637|1|ID=1_1983;partial=00;start_type=GTG;rbs_motif=None;rbs_spacer=None;gc_cont=0.615	WP_003409881.1 MULTISPECIES: type II toxin-antitoxin system VapC family toxin [Mycobacterium]	100	99.0	7.78e-67
CP007027.1_1984|2200791|2200967|1|ID=1_1984;partial=00;start_type=ATG;rbs_motif=AGGAG;rbs_spacer=5-10bp;gc_cont=0.650	WP_051442221.1 Lsr2 family DNA-binding protein [Arthrobacter sp. H14]	74.1	94.9	2.54e-19
CP007027.1_1985|2201131|2201484|1|ID=1_1985;partial=00;start_type=ATG;rbs_motif=None;rbs_spacer=None;gc_cont=0.588	WP_003905702.1 type II toxin-antitoxin system toxin HigB [Mycobacterium tuberculosis]	100	99.2	1.78e-83
CP007027.1_1986|2201526|2201975|1|ID=1_1986;partial=00;start_type=ATG;rbs_motif=AGGAG;rbs_spacer=5-10bp;gc_cont=0.618	WP_003409886.1 MULTISPECIES: type II toxin-antitoxin system antitoxin HigA [Mycobacterium]	100	99.3	3.26e-99
CP007027.1_1987|2201972|2202517|1|ID=1_1987;partial=00;start_type=ATG;rbs_motif=GGA/GAG/AGG;rbs_spacer=5-10bp;gc_cont=0.617	WP_003409891.1 MULTISPECIES: SecB-like chaperone SecBL [Mycobacterium]	100	99.5	2.07e-122
CP007027.1_1988|2202406|2203020|-1|ID=1_1988;partial=00;start_type=ATG;rbs_motif=None;rbs_spacer=None;gc_cont=0.631	WP_003901296.1 MULTISPECIES: hypothetical protein [Mycobacterium]	100	99.5	2.67e-143
CP007027.1_1989|2203069|2203365|-1|ID=1_1989;partial=00;start_type=GTG;rbs_motif=None;rbs_spacer=None;gc_cont=0.623	WP_003409896.1 MULTISPECIES: type II toxin-antitoxin system RelE/ParE family toxin [Mycobacterium]	100	99.0	3.79e-67
CP007027.1_1990|2203362|2203613|-1|ID=1_1990;partial=00;start_type=GTG;rbs_motif=None;rbs_spacer=None;gc_cont=0.663	WP_003409899.1 MULTISPECIES: type II toxin-antitoxin system ParD family antitoxin [Mycobacterium]	100	98.8	9.16e-50
CP007027.1_1991|2203753|2204094|1|ID=1_1991;partial=00;start_type=ATG;rbs_motif=GGAG/GAGG;rbs_spacer=5-10bp;gc_cont=0.702	WP_031677693.1 hypothetical protein, partial [Mycobacterium tuberculosis]	100	99.1	1.61e-70
CP007027.1_1992|2204094|2204201|1|ID=1_1992;partial=00;start_type=ATG;rbs_motif=AGxAGG/AGGxGG;rbs_spacer=5-10bp;gc_cont=0.565	WP_151488262.1 DISARM system helicase DrmA [Micromonospora sp. ALFpr18c]	82.9	97.2	2.31e-10
CP007027.1_1993|2204254|2204661|-1|ID=1_1993;partial=00;start_type=GTG;rbs_motif=AGGAG/GGAGG;rbs_spacer=11-12bp;gc_cont=0.618	WP_003409913.1 MULTISPECIES: type II toxin-antitoxin system VapC family toxin [Mycobacterium]	100	99.3	1.38e-82
CP007027.1_1994|2204665|2204937|-1|ID=1_1994;partial=00;start_type=GTG;rbs_motif=3Base/5BMM;rbs_spacer=13-15bp;gc_cont=0.637	WP_003899100.1 MULTISPECIES: type II toxin-antitoxin system Phd/YefM family antitoxin [Mycobacterium]	100	98.9	9.82e-55
CP007027.1_1995|2204970|2206190|-1|ID=1_1995;partial=00;start_type=ATG;rbs_motif=AGxAGG/AGGxGG;rbs_spacer=5-10bp;gc_cont=0.664	WP_003409919.1 MULTISPECIES: TetR family transcriptional regulator Mce3R [Mycobacterium]	100	99.8	1.48e-280
CP007027.1_1996|2206338|2206595|1|ID=1_1996;partial=00;start_type=GTG;rbs_motif=None;rbs_spacer=None;gc_cont=0.539	WP_116388570.1 hypothetical protein, partial [Mycobacterium tuberculosis]	100	87.2	2.46e-44
CP007027.1_1997|2207089|2207886|1|ID=1_1997;partial=00;start_type=ATG;rbs_motif=None;rbs_spacer=None;gc_cont=0.640	WP_003899101.1 MULTISPECIES: MlaE family ABC transporter permease [Mycobacterium]	100	99.6	2.60e-178
CP007027.1_1998|2207896|2208711|1|ID=1_1998;partial=00;start_type=ATG;rbs_motif=GGAG/GAGG;rbs_spacer=5-10bp;gc_cont=0.657	WP_003899102.1 MULTISPECIES: ABC transporter permease [Mycobacterium]	100	99.6	5.03e-179
CP007027.1_1999|2208716|2209993|1|ID=1_1999;partial=00;start_type=ATG;rbs_motif=None;rbs_spacer=None;gc_cont=0.660	WP_003900443.1 MULTISPECIES: MCE family protein [Mycobacterium]	100	99.8	2.15e-310
CP007027.1_2000|2209990|2211018|1|ID=1_2000;partial=00;start_type=ATG;rbs_motif=GGAG/GAGG;rbs_spacer=5-10bp;gc_cont=0.660	WP_003899104.1 MULTISPECIES: virulence factor Mce family protein [Mycobacterium]	100	99.7	1.54e-220
CP007027.1_2001|2211003|2212247|1|ID=1_2001;partial=00;start_type=GTG;rbs_motif=AGGA;rbs_spacer=5-10bp;gc_cont=0.682	WP_368627178.1 virulence factor Mce family protein [Mycobacterium tuberculosis]	99.8	98.8	9.77e-220
CP007027.1_2002|2212244|2213515|1|ID=1_2002;partial=00;start_type=GTG;rbs_motif=GGAG/GAGG;rbs_spacer=5-10bp;gc_cont=0.667	WP_015290290.1 virulence factor Mce family protein [Mycobacterium canetti]	99.8	99.8	3.71e-262
CP007027.1_2003|2213512|2214645|1|ID=1_2003;partial=00;start_type=GTG;rbs_motif=GGxGG;rbs_spacer=5-10bp;gc_cont=0.665	WP_003899107.1 MULTISPECIES: Mce family lipoprotein LprM [Mycobacterium]	100	99.7	5.90e-270
CP007027.1_2004|2214646|2215959|1|ID=1_2004;partial=00;start_type=ATG;rbs_motif=GGA/GAG/AGG;rbs_spacer=5-10bp;gc_cont=0.659	WP_003911732.1 MCE family protein [Mycobacterium tuberculosis]	100	99.8	2.44e-313
CP007027.1_2005|2215981|2216556|1|ID=1_2005;partial=00;start_type=ATG;rbs_motif=GGAGG;rbs_spacer=5-10bp;gc_cont=0.674	WP_003899109.1 MULTISPECIES: Mce associated membrane protein [Mycobacterium]	100	99.5	5.86e-127
CP007027.1_2006|2216568|2217035|1|ID=1_2006;partial=00;start_type=GTG;rbs_motif=GGA/GAG/AGG;rbs_spacer=5-10bp;gc_cont=0.688	WP_003899110.1 MULTISPECIES: Mce associated membrane protein [Mycobacterium]	99.4	99.4	1.18e-96
CP007027.1_2007|2217066|2217425|1|ID=1_2007;partial=00;start_type=ATG;rbs_motif=None;rbs_spacer=None;gc_cont=0.644	WP_262251577.1 DUF732 domain-containing protein [Mycobacterium tuberculosis]	100	99.2	3.32e-79
CP007027.1_2008|2217441|2218106|1|ID=1_2008;partial=00;start_type=ATG;rbs_motif=GGA/GAG/AGG;rbs_spacer=5-10bp;gc_cont=0.644	WP_003899112.1 MULTISPECIES: CAP domain-containing protein [Mycobacterium]	100	99.5	3.22e-157
CP007027.1_2009|2218233|2218619|-1|ID=1_2009;partial=00;start_type=ATG;rbs_motif=GGA/GAG/AGG;rbs_spacer=11-12bp;gc_cont=0.672	WP_009936972.1 NYN domain-containing protein [Mycobacterium tuberculosis]	100	99.2	1.72e-84
CP007027.1_2010|2219143|2220189|1|ID=1_2010;partial=00;start_type=ATG;rbs_motif=GGAG/GAGG;rbs_spacer=5-10bp;gc_cont=0.653	WP_003899114.1 MULTISPECIES: M48 family metallopeptidase [Mycobacterium]	100	99.7	1.34e-249
CP007027.1_2011|2220297|2221145|1|ID=1_2011;partial=00;start_type=ATG;rbs_motif=GGA/GAG/AGG;rbs_spacer=5-10bp;gc_cont=0.625	WP_003409942.1 MULTISPECIES: class I SAM-dependent methyltransferase [Mycobacterium]	100	99.6	2.85e-195
CP007027.1_2012|2221108|2222553|-1|ID=1_2012;partial=00;start_type=GTG;rbs_motif=None;rbs_spacer=None;gc_cont=0.598	WP_003899115.1 MULTISPECIES: APC family permease [Mycobacterium]	100	99.8	0.0
CP007027.1_2013|2222732|2223418|-1|ID=1_2013;partial=00;start_type=GTG;rbs_motif=GGAGG;rbs_spacer=5-10bp;gc_cont=0.592	WP_003409954.1 MULTISPECIES: immunoprotective protein Mpt64 [Mycobacterium]	100	99.6	1.47e-161
CP007027.1_2014|2223609|2224577|-1|ID=1_2014;partial=00;start_type=ATG;rbs_motif=AGGA;rbs_spacer=5-10bp;gc_cont=0.592	WP_003899116.1 MULTISPECIES: class 1b ribonucleoside-diphosphate reductase subunit beta [Mycobacterium]	100	99.7	5.83e-240
CP007027.1_2016|2224802|2225221|-1|ID=1_2016;partial=00;start_type=ATG;rbs_motif=GGA/GAG/AGG;rbs_spacer=5-10bp;gc_cont=0.662	WP_003409958.1 MULTISPECIES: type II toxin-antitoxin system VapC family toxin [Mycobacterium]	100	99.3	3.22e-92
CP007027.1_2017|2225230|2225517|-1|ID=1_2017;partial=00;start_type=GTG;rbs_motif=GGA/GAG/AGG;rbs_spacer=5-10bp;gc_cont=0.611	WP_057350473.1 type II toxin-antitoxin system VapB family antitoxin [Mycobacterium tuberculosis]	97.8	96.9	4.10e-58
CP007027.1_2018|2225633|2227309|1|ID=1_2018;partial=00;start_type=GTG;rbs_motif=GGAGG;rbs_spacer=5-10bp;gc_cont=0.649	WP_003899118.1 MULTISPECIES: PecA family PE domain-processing aspartic protease [Mycobacterium]	100	99.8	1.71e-296
CP007027.1_2019|2227297|2227950|-1|ID=1_2019;partial=00;start_type=ATG;rbs_motif=None;rbs_spacer=None;gc_cont=0.622	WP_003409976.1 MULTISPECIES: cutinase Cfp21 [Mycobacterium]	100	99.5	4.54e-146
CP007027.1_2020|2228065|2228295|1|ID=1_2020;partial=00;start_type=ATG;rbs_motif=None;rbs_spacer=None;gc_cont=0.597	WP_003409980.1 MULTISPECIES: DUF167 domain-containing protein [Bacteria]	100	98.7	8.60e-45
CP007027.1_2021|2228380|2229291|-1|ID=1_2021;partial=00;start_type=ATG;rbs_motif=None;rbs_spacer=None;gc_cont=0.650	WP_003409986.1 MULTISPECIES: ArgP/LysG family DNA-binding transcriptional regulator [Mycobacterium]	100	99.7	1.28e-213
CP007027.1_2022|2229400|2229999|1|ID=1_2022;partial=00;start_type=GTG;rbs_motif=None;rbs_spacer=None;gc_cont=0.662	WP_003409989.1 MULTISPECIES: L-lysine exporter [Mycobacterium]	100	99.5	6.30e-135
CP007027.1_2024|2230924|2231514|-1|ID=1_2024;partial=00;start_type=ATG;rbs_motif=None;rbs_spacer=None;gc_cont=0.682	WP_422323914.1 class I SAM-dependent methyltransferase [Trebonia sp.]	73.5	24.9	3.74e-08
CP007027.1_2025|2232128|2232688|-1|ID=1_2025;partial=00;start_type=GTG;rbs_motif=GGAGG;rbs_spacer=5-10bp;gc_cont=0.627	WP_003410001.1 MULTISPECIES: RES family NAD+ phosphorylase [Mycobacterium]	100	99.5	2.51e-130
CP007027.1_2026|2232685|2233026|-1|ID=1_2026;partial=00;start_type=ATG;rbs_motif=GGA/GAG/AGG;rbs_spacer=5-10bp;gc_cont=0.626	WP_003410003.1 MULTISPECIES: antitoxin Xre/MbcA/ParS toxin-binding domain-containing protein [Mycobacterium]	100	99.1	4.47e-73
CP007027.1_2027|2233112|2233369|1|ID=1_2027;partial=00;start_type=ATG;rbs_motif=AGGA/GGAG/GAGG;rbs_spacer=11-12bp;gc_cont=0.663	WP_003410006.1 MULTISPECIES: hypothetical protein [Mycobacterium]	100	98.8	6.85e-55
CP007027.1_2028|2233270|2233605|-1|ID=1_2028;partial=00;start_type=GTG;rbs_motif=GGAGG;rbs_spacer=5-10bp;gc_cont=0.673	WP_003410009.1 MULTISPECIES: dehydrogenase [unclassified Mycobacterium tuberculosis complex]	100	99.1	2.61e-71
CP007027.1_2029|2233694|2234038|-1|ID=1_2029;partial=00;start_type=GTG;rbs_motif=GGA/GAG/AGG;rbs_spacer=5-10bp;gc_cont=0.620	WP_003410010.1 MULTISPECIES: type II toxin-antitoxin system toxin endoribonuclease MazF6 [Mycobacterium]	100	99.1	2.68e-70
CP007027.1_2030|2234032|2234211|-1|ID=1_2030;partial=00;start_type=ATG;rbs_motif=GGA/GAG/AGG;rbs_spacer=5-10bp;gc_cont=0.617	WP_003410014.1 MULTISPECIES: ribbon-helix-helix protein, CopG family [Mycobacterium]	100	98.3	1.39e-33
CP007027.1_2031|2234380|2236695|-1|ID=1_2031;partial=00;start_type=GTG;rbs_motif=GGA/GAG/AGG;rbs_spacer=5-10bp;gc_cont=0.672	WP_031682100.1 cation transporter ATPase CptG [Mycobacterium tuberculosis]	99.9	99.9	0.0
CP007027.1_2032|2236692|2236964|-1|ID=1_2032;partial=00;start_type=GTG;rbs_motif=AGGAG;rbs_spacer=5-10bp;gc_cont=0.729	WP_003410017.1 MULTISPECIES: DUF1490 family protein [Mycobacterium]	100	98.9	1.84e-50
CP007027.1_2033|2237017|2237292|-1|ID=1_2033;partial=00;start_type=GTG;rbs_motif=GGA/GAG/AGG;rbs_spacer=5-10bp;gc_cont=0.649	WP_003410018.1 MULTISPECIES: Cd(II)/Pb(II)-sensing metalloregulatory transcriptional regulator CmtR [Mycobacterium]	98.9	98.9	8.92e-57
CP007027.1_2034|2237569|2238297|1|ID=1_2034;partial=00;start_type=ATG;rbs_motif=GGA/GAG/AGG;rbs_spacer=5-10bp;gc_cont=0.627	WP_003915234.1 hemerythrin domain-containing protein [Mycobacterium tuberculosis]	100	99.6	1.91e-164
CP007027.1_2035|2238393|2239346|1|ID=1_2035;partial=00;start_type=ATG;rbs_motif=GGAG/GAGG;rbs_spacer=5-10bp;gc_cont=0.651	WP_003899121.1 MULTISPECIES: universal stress protein [Mycobacterium]	100	99.7	3.30e-223
CP007027.1_2036|2239602|2242265|1|ID=1_2036;partial=00;start_type=GTG;rbs_motif=None;rbs_spacer=None;gc_cont=0.651	WP_003410027.1 MULTISPECIES: cation-transporting P-type ATPase [Mycobacterium]	99.9	99.9	0.0
CP007027.1_2037|2242334|2243110|-1|ID=1_2037;partial=00;start_type=ATG;rbs_motif=GGAGG;rbs_spacer=5-10bp;gc_cont=0.634	WP_003899122.1 MULTISPECIES: isocitrate lyase/PEP mutase family protein [Mycobacterium]	100	99.6	4.53e-180
CP007027.1_2038|2243205|2244527|-1|ID=1_2038;partial=00;start_type=ATG;rbs_motif=None;rbs_spacer=None;gc_cont=0.687	WP_003410039.1 MULTISPECIES: APC family permease [Mycobacterium]	100	99.8	4.11e-286
CP007027.1_2039|2244769|2246211|1|ID=1_2039;partial=00;start_type=ATG;rbs_motif=AGGAG;rbs_spacer=5-10bp;gc_cont=0.626	WP_003410042.1 MULTISPECIES: NAD(P)-binding protein [Mycobacterium]	100	99.8	0.0
CP007027.1_2040|2246221|2246973|1|ID=1_2040;partial=00;start_type=GTG;rbs_motif=AGGA;rbs_spacer=5-10bp;gc_cont=0.612	WP_003900448.1 MULTISPECIES: acyl-[acyl-carrier-protein] thioesterase [Mycobacterium]	100	99.6	2.56e-191
CP007027.1_2041|2247049|2247831|1|ID=1_2041;partial=00;start_type=ATG;rbs_motif=AGGAG;rbs_spacer=5-10bp;gc_cont=0.633	WP_003410047.1 MULTISPECIES: SDR family oxidoreductase [Mycobacterium]	100	99.6	5.07e-178
CP007027.1_2042|2247952|2248659|-1|ID=1_2042;partial=00;start_type=GTG;rbs_motif=GGA/GAG/AGG;rbs_spacer=11-12bp;gc_cont=0.688	WP_003410049.1 class I SAM-dependent methyltransferase [Mycobacterium tuberculosis]	99.6	99.6	2.91e-165
CP007027.1_2043|2248649|2248846|-1|ID=1_2043;partial=00;start_type=ATG;rbs_motif=AGGA;rbs_spacer=5-10bp;gc_cont=0.631	WP_003410051.1 MULTISPECIES: phosphoenolpyruvate synthase [Mycobacterium]	100	98.5	1.59e-33
CP007027.1_2044|2248867|2250363|-1|ID=1_2044;partial=00;start_type=ATG;rbs_motif=None;rbs_spacer=None;gc_cont=0.648	WP_003410057.1 MULTISPECIES: bifunctional aminoglycoside phosphotransferase/ATP-binding protein [Mycobacterium]	100	99.8	0.0
CP007027.1_2045|2250385|2251272|-1|ID=1_2045;partial=00;start_type=ATG;rbs_motif=GGAG/GAGG;rbs_spacer=5-10bp;gc_cont=0.641	WP_003410060.1 MULTISPECIES: universal stress protein [Mycobacterium]	100	99.7	3.22e-203
CP007027.1_2046|2251391|2255374|1|ID=1_2046;partial=00;start_type=GTG;rbs_motif=None;rbs_spacer=None;gc_cont=0.638	WP_003410063.1 MULTISPECIES: trehalose-phosphatase [Mycobacterium]	100	99.9	0.0
CP007027.1_2047|2255473|2255817|-1|ID=1_2047;partial=00;start_type=GTG;rbs_motif=None;rbs_spacer=None;gc_cont=0.626	WP_003410065.1 MULTISPECIES: ferredoxin [Mycobacterium]	100	99.1	8.26e-83
CP007027.1_2048|2256006|2257331|-1|ID=1_2048;partial=00;start_type=ATG;rbs_motif=GGAG/GAGG;rbs_spacer=5-10bp;gc_cont=0.630	WP_003410070.1 ATP-binding protein [Mycobacterium tuberculosis]	100	99.8	1.41e-315
CP007027.1_2049|2257419|2257661|1|ID=1_2049;partial=00;start_type=GTG;rbs_motif=None;rbs_spacer=None;gc_cont=0.613	WP_003899127.1 type II toxin-antitoxin system VapB family antitoxin [Mycobacterium tuberculosis]	100	98.8	8.34e-47
CP007027.1_2050|2257662|2258060|1|ID=1_2050;partial=00;start_type=ATG;rbs_motif=GGA/GAG/AGG;rbs_spacer=5-10bp;gc_cont=0.649	WP_003410075.1 MULTISPECIES: type II toxin-antitoxin system VapC family toxin [Mycobacterium]	100	99.2	3.55e-88
CP007027.1_2051|2258243|2258674|-1|ID=1_2051;partial=00;start_type=ATG;rbs_motif=GGAGG;rbs_spacer=3-4bp;gc_cont=0.650	WP_003410078.1 MULTISPECIES: MarR family winged helix-turn-helix transcriptional regulator [Mycobacterium]	100	99.3	1.02e-90
CP007027.1_2052|2258775|2259209|1|ID=1_2052;partial=00;start_type=ATG;rbs_motif=GGAG/GAGG;rbs_spacer=5-10bp;gc_cont=0.637	WP_003914358.1 MULTISPECIES: DUF1398 domain-containing protein [Mycobacterium]	100	99.3	9.47e-101
CP007027.1_2053|2260054|2260533|1|ID=1_2053;partial=00;start_type=GTG;rbs_motif=GGA/GAG/AGG;rbs_spacer=5-10bp;gc_cont=0.700	WP_234715470.1 IS110 family transposase [Mycobacterium tuberculosis]	99.4	99.4	4.22e-110
CP007027.1_2054|2260487|2261077|1|ID=1_2054;partial=00;start_type=GTG;rbs_motif=None;rbs_spacer=None;gc_cont=0.704	WP_003899131.1 MULTISPECIES: IS110 family transposase [Mycobacterium]	100	99.5	9.38e-140
CP007027.1_2055|2261205|2262461|-1|ID=1_2055;partial=00;start_type=ATG;rbs_motif=None;rbs_spacer=None;gc_cont=0.658	WP_003410095.1 MULTISPECIES: HNH endonuclease signature motif containing protein [Mycobacterium]	100	99.8	5.26e-312
CP007027.1_2056|2262779|2263390|1|ID=1_2056;partial=00;start_type=ATG;rbs_motif=None;rbs_spacer=None;gc_cont=0.608	WP_003410100.1 MULTISPECIES: hypothetical protein [Mycobacterium]	100	93.6	2.19e-141
CP007027.1_2057|2263387|2264427|1|ID=1_2057;partial=00;start_type=ATG;rbs_motif=GGxGG;rbs_spacer=3-4bp;gc_cont=0.639	WP_003911735.1 helix-turn-helix domain-containing protein [Mycobacterium tuberculosis]	100	99.7	1.15e-249
CP007027.1_2058|2264669|2265388|1|ID=1_2058;partial=00;start_type=ATG;rbs_motif=GGAGG;rbs_spacer=5-10bp;gc_cont=0.649	WP_003410108.1 MULTISPECIES: Rv2018 family toxin-antitoxin system antitoxin [Mycobacterium]	100	99.6	1.47e-171
CP007027.1_2059|2265444|2265794|1|ID=1_2059;partial=00;start_type=GTG;rbs_motif=GGAG/GAGG;rbs_spacer=5-10bp;gc_cont=0.621	WP_031729615.1 Rv2019 family toxin-antitoxin system toxin ribonuclease, partial [Mycobacterium tuberculosis]	99.1	99.1	4.83e-77
CP007027.1_2060|2265810|2266097|-1|ID=1_2060;partial=00;start_type=ATG;rbs_motif=GGxGG;rbs_spacer=5-10bp;gc_cont=0.635	WP_003410120.1 MULTISPECIES: type ISP restriction/modification enzyme [Mycobacterium]	100	99.0	1.59e-63
CP007027.1_2061|2266194|2266499|-1|ID=1_2061;partial=00;start_type=ATG;rbs_motif=GGA/GAG/AGG;rbs_spacer=11-12bp;gc_cont=0.637	WP_003410124.1 MULTISPECIES: helix-turn-helix domain-containing protein [Mycobacterium]	100	99.0	1.42e-59
CP007027.1_2062|2266508|2267113|-1|ID=1_2062;partial=00;start_type=GTG;rbs_motif=GGA/GAG/AGG;rbs_spacer=3-4bp;gc_cont=0.619	WP_003900449.1 MULTISPECIES: type II toxin-antitoxin system RelE/ParE family toxin [Mycobacterium]	100	99.5	5.87e-150
CP007027.1_2063|2267138|2267446|-1|ID=1_2063;partial=00;start_type=ATG;rbs_motif=3Base/5BMM;rbs_spacer=13-15bp;gc_cont=0.676	WP_425461857.1 IS1380 family transposase, partial [Mycobacterium helveticum]	91.4	34.0	3.35e-09
CP007027.1_2064|2268082|2269629|-1|ID=1_2064;partial=00;start_type=ATG;rbs_motif=None;rbs_spacer=None;gc_cont=0.657	WP_003916920.1 restriction endonuclease [Mycobacterium tuberculosis]	100	99.8	0.0
CP007027.1_2065|2270139|2271098|-1|ID=1_2065;partial=00;start_type=ATG;rbs_motif=GGAG/GAGG;rbs_spacer=5-10bp;gc_cont=0.664	WP_003410146.1 MULTISPECIES: cation diffusion facilitator family transporter [Mycobacterium]	100	99.7	6.69e-218
CP007027.1_2066|2271252|2272136|-1|ID=1_2066;partial=00;start_type=ATG;rbs_motif=AGGAG;rbs_spacer=5-10bp;gc_cont=0.628	WP_003410150.1 MULTISPECIES: universal stress protein [Mycobacterium]	100	99.7	1.48e-203
CP007027.1_2067|2272176|2273897|-1|ID=1_2067;partial=00;start_type=GTG;rbs_motif=None;rbs_spacer=None;gc_cont=0.653	WP_003899138.1 MULTISPECIES: two-component system sensor histidine kinase DosT [Mycobacterium]	100	99.8	0.0
CP007027.1_2068|2273958|2274797|-1|ID=1_2068;partial=00;start_type=ATG;rbs_motif=GGA/GAG/AGG;rbs_spacer=5-10bp;gc_cont=0.680	WP_003410171.1 MULTISPECIES: universal stress protein [Mycobacterium]	100	99.6	1.53e-193
CP007027.1_2069|2274794|2275813|-1|ID=1_2069;partial=00;start_type=ATG;rbs_motif=GGA/GAG/AGG;rbs_spacer=5-10bp;gc_cont=0.649	WP_003899139.1 MULTISPECIES: 1-phosphofructokinase family hexose kinase [Mycobacterium]	100	99.7	3.49e-236
CP007027.1_2070|2275830|2277869|-1|ID=1_2070;partial=00;start_type=ATG;rbs_motif=None;rbs_spacer=None;gc_cont=0.669	WP_003410178.1 MULTISPECIES: erythromycin esterase family protein [Mycobacterium]	100	99.9	0.0
CP007027.1_2071|2277887|2278321|-1|ID=1_2071;partial=00;start_type=ATG;rbs_motif=AGGAG;rbs_spacer=5-10bp;gc_cont=0.614	WP_003410189.1 MULTISPECIES: alpha-crystallin HspX [Mycobacterium]	100	99.3	3.05e-97
CP007027.1_2072|2278518|2279513|1|ID=1_2072;partial=00;start_type=ATG;rbs_motif=GGAGG;rbs_spacer=5-10bp;gc_cont=0.638	WP_003410193.1 MULTISPECIES: FMN-binding protein Acg [Mycobacterium]	100	99.7	1.43e-240
CP007027.1_2073|2279629|2280387|-1|ID=1_2073;partial=00;start_type=ATG;rbs_motif=GGA/GAG/AGG;rbs_spacer=5-10bp;gc_cont=0.698	WP_252159526.1 DUF3097 family protein, partial [Mycobacterium tuberculosis]	100	99.6	5.33e-183
