CP007027.1_2917|3194933|3195520|-1|ID=1_2917;partial=00;start_type=ATG;rbs_motif=AGGA;rbs_spacer=5-10bp;gc_cont=0.658	WP_003414668.1 MULTISPECIES: IS607-like element IS1539 family transposase [Mycobacterium]	100	99.5	6.07e-131
CP007027.1_2918|3195819|3196238|1|ID=1_2918;partial=00;start_type=ATG;rbs_motif=None;rbs_spacer=None;gc_cont=0.667	WP_003899525.1 MULTISPECIES: MarR family winged helix-turn-helix transcriptional regulator [Mycobacterium]	100	99.3	2.35e-85
CP007027.1_2919|3196252|3197673|-1|ID=1_2919;partial=00;start_type=ATG;rbs_motif=GGA/GAG/AGG;rbs_spacer=11-12bp;gc_cont=0.669	WP_003414672.1 MULTISPECIES: amidase [Mycobacterium]	100	99.8	0.0
CP007027.1_2920|3197680|3198495|-1|ID=1_2920;partial=00;start_type=ATG;rbs_motif=AGGA;rbs_spacer=5-10bp;gc_cont=0.669	WP_003899527.1 MULTISPECIES: translation elongation factor Ts [Mycobacterium]	100	99.6	1.38e-176
CP007027.1_2921|3198507|3199370|-1|ID=1_2921;partial=00;start_type=ATG;rbs_motif=GGA/GAG/AGG;rbs_spacer=5-10bp;gc_cont=0.637	WP_003899528.1 MULTISPECIES: 30S ribosomal protein S2 [Mycobacterium]	100	99.7	8.32e-186
CP007027.1_2923|3200182|3201339|-1|ID=1_2923;partial=00;start_type=ATG;rbs_motif=GGA/GAG/AGG;rbs_spacer=5-10bp;gc_cont=0.682	WP_057333862.1 PPE family protein [Mycobacterium tuberculosis]	100	99.7	4.16e-258
CP007027.1_2924|3201422|3201565|-1|ID=1_2924;partial=00;start_type=ATG;rbs_motif=GGAG/GAGG;rbs_spacer=5-10bp;gc_cont=0.639	WP_003414682.1 MULTISPECIES: hypothetical protein [Mycobacterium tuberculosis complex]	100	97.9	1.18e-25
CP007027.1_2925|3201868|3202785|1|ID=1_2925;partial=00;start_type=TTG;rbs_motif=GGxGG;rbs_spacer=5-10bp;gc_cont=0.698	WP_031726149.1 LLM class F420-dependent oxidoreductase [Mycobacterium tuberculosis]	99.7	99.7	4.27e-211
CP007027.1_2926|3202782|3203729|-1|ID=1_2926;partial=00;start_type=GTG;rbs_motif=GGA/GAG/AGG;rbs_spacer=3-4bp;gc_cont=0.708	WP_003414689.1 MULTISPECIES: tyrosine recombinase XerC [Mycobacterium]	99.7	94.3	1.89e-201
CP007027.1_2927|3203769|3204620|-1|ID=1_2927;partial=00;start_type=GTG;rbs_motif=AGGAG;rbs_spacer=5-10bp;gc_cont=0.675	WP_003900590.1 MULTISPECIES: siderophore-interacting protein [Mycobacterium]	100	99.6	7.99e-207
CP007027.1_2928|3204653|3205822|-1|ID=1_2928;partial=00;start_type=ATG;rbs_motif=GGAG/GAGG;rbs_spacer=5-10bp;gc_cont=0.719	WP_003414694.1 MULTISPECIES: DNA-processing protein DprA [Mycobacterium]	100	99.7	1.01e-267
CP007027.1_2929|3205819|3207330|-1|ID=1_2929;partial=00;start_type=ATG;rbs_motif=GGA/GAG/AGG;rbs_spacer=5-10bp;gc_cont=0.690	WP_003414700.1 MULTISPECIES: YifB family Mg chelatase-like AAA ATPase [Mycobacterium]	100	99.8	0.0
CP007027.1_2930|3207330|3207716|-1|ID=1_2930;partial=00;start_type=ATG;rbs_motif=GGA/GAG/AGG;rbs_spacer=5-10bp;gc_cont=0.674	WP_003414702.1 MULTISPECIES: YraN family protein [Mycobacterium]	100	99.2	7.27e-86
CP007027.1_2931|3207964|3208794|-1|ID=1_2931;partial=00;start_type=GTG;rbs_motif=AGGA/GGAG/GAGG;rbs_spacer=11-12bp;gc_cont=0.647	WP_003414705.1 MULTISPECIES: formate dehydrogenase accessory sulfurtransferase FdhD [Mycobacterium]	100	99.6	7.84e-190
CP007027.1_2932|3208794|3211133|-1|ID=1_2932;partial=00;start_type=ATG;rbs_motif=None;rbs_spacer=None;gc_cont=0.655	WP_003899532.1 MULTISPECIES: FdhF/YdeP family oxidoreductase [Mycobacterium]	100	99.9	0.0
CP007027.1_2933|3211191|3211496|-1|ID=1_2933;partial=00;start_type=ATG;rbs_motif=AGGA/GGAG/GAGG;rbs_spacer=11-12bp;gc_cont=0.565	WP_003414710.1 MULTISPECIES: DUF2469 domain-containing protein [Mycobacterium]	100	99.0	3.20e-65
CP007027.1_2934|3211550|3212287|-1|ID=1_2934;partial=00;start_type=ATG;rbs_motif=GGxGG;rbs_spacer=5-10bp;gc_cont=0.687	WP_057369015.1 ribonuclease HII [Mycobacterium tuberculosis]	100	99.6	6.64e-171
CP007027.1_2935|3212358|3213242|-1|ID=1_2935;partial=00;start_type=GTG;rbs_motif=None;rbs_spacer=None;gc_cont=0.650	WP_003414715.1 MULTISPECIES: signal peptidase I [Mycobacterium]	100	99.7	9.03e-214
CP007027.1_2936|3213300|3213641|-1|ID=1_2936;partial=00;start_type=ATG;rbs_motif=AGGA/GGAG/GAGG;rbs_spacer=11-12bp;gc_cont=0.632	WP_003414717.1 MULTISPECIES: 50S ribosomal protein L19 [Mycobacterium]	100	99.1	7.71e-74
CP007027.1_2937|3214016|3214960|1|ID=1_2937;partial=00;start_type=ATG;rbs_motif=GGAG/GAGG;rbs_spacer=5-10bp;gc_cont=0.661	WP_140030263.1 serine hydrolase [Mycobacterium tuberculosis]	99.7	99.7	8.98e-215
CP007027.1_2938|3215053|3215745|-1|ID=1_2938;partial=00;start_type=GTG;rbs_motif=GGAG/GAGG;rbs_spacer=5-10bp;gc_cont=0.659	WP_003414722.1 MULTISPECIES: tRNA (guanosine(37)-N1)-methyltransferase TrmD [Mycobacterium]	100	99.6	2.75e-167
CP007027.1_2939|3215749|3216279|-1|ID=1_2939;partial=00;start_type=ATG;rbs_motif=GGAG/GAGG;rbs_spacer=5-10bp;gc_cont=0.629	WP_003414726.1 MULTISPECIES: ribosome maturation factor RimM [Mycobacterium]	100	99.4	3.75e-118
CP007027.1_2940|3216293|3216535|-1|ID=1_2940;partial=00;start_type=ATG;rbs_motif=3Base/5BMM;rbs_spacer=13-15bp;gc_cont=0.630	WP_003414728.1 MULTISPECIES: RNA-binding protein [Mycobacterium]	100	98.8	7.13e-48
CP007027.1_2941|3216543|3217031|-1|ID=1_2941;partial=00;start_type=ATG;rbs_motif=AGGAG;rbs_spacer=5-10bp;gc_cont=0.652	WP_031701222.1 30S ribosomal protein S16 [Mycobacterium tuberculosis]	98.1	99.4	5.60e-95
CP007027.1_2942|3217215|3217634|-1|ID=1_2942;partial=00;start_type=ATG;rbs_motif=GGA/GAG/AGG;rbs_spacer=5-10bp;gc_cont=0.588	WP_003912031.1 MULTISPECIES: nuclear transport factor 2 family protein [Mycobacterium]	100	99.3	6.25e-99
CP007027.1_2943|3217727|3218602|1|ID=1_2943;partial=00;start_type=ATG;rbs_motif=None;rbs_spacer=None;gc_cont=0.691	WP_075861290.1 D-alanyl-D-alanine carboxypeptidase DacB2 [Mycobacterium tuberculosis]	100	99.7	5.48e-193
CP007027.1_2944|3218662|3219249|-1|ID=1_2944;partial=00;start_type=ATG;rbs_motif=3Base/5BMM;rbs_spacer=13-15bp;gc_cont=0.646	WP_003414739.1 MULTISPECIES: TetR/AcrR family transcriptional regulator [Mycobacterium]	100	99.5	2.77e-127
CP007027.1_2945|3219251|3221086|-1|ID=1_2945;partial=00;start_type=ATG;rbs_motif=GGA/GAG/AGG;rbs_spacer=11-12bp;gc_cont=0.648	WP_003899536.1 MULTISPECIES: N-acyl-D-amino-acid deacylase family protein [Mycobacterium]	100	99.8	0.0
CP007027.1_2946|3221155|3222912|-1|ID=1_2946;partial=00;start_type=ATG;rbs_motif=None;rbs_spacer=None;gc_cont=0.672	WP_003900593.1 MULTISPECIES: serine/threonine protein kinase PknI [Mycobacterium]	100	99.8	0.0
CP007027.1_2947|3222956|3224068|-1|ID=1_2947;partial=00;start_type=GTG;rbs_motif=GGA/GAG/AGG;rbs_spacer=5-10bp;gc_cont=0.682	WP_003899537.1 MULTISPECIES: metal-dependent hydrolase family protein [Mycobacterium]	100	99.7	4.51e-275
CP007027.1_2948|3224096|3225673|-1|ID=1_2948;partial=00;start_type=GTG;rbs_motif=GGA/GAG/AGG;rbs_spacer=5-10bp;gc_cont=0.663	WP_003414748.1 MULTISPECIES: signal recognition particle protein [Mycobacterium]	100	99.8	0.0
CP007027.1_2949|3225823|3227631|1|ID=1_2949;partial=00;start_type=ATG;rbs_motif=None;rbs_spacer=None;gc_cont=0.677	WP_009936545.1 DEAD/DEAH box helicase [Mycobacterium tuberculosis]	100	99.8	0.0
CP007027.1_2950|3227642|3230068|-1|ID=1_2950;partial=00;start_type=ATG;rbs_motif=GGA/GAG/AGG;rbs_spacer=3-4bp;gc_cont=0.667	WP_003899539.1 MULTISPECIES: [protein-PII] uridylyltransferase [Mycobacterium]	100	99.9	0.0
CP007027.1_2951|3230126|3230464|-1|ID=1_2951;partial=00;start_type=ATG;rbs_motif=GGAGG;rbs_spacer=5-10bp;gc_cont=0.611	WP_003414756.1 MULTISPECIES: nitrogen regulatory protein P-II [Mycobacteriales]	100	99.1	4.85e-72
CP007027.1_2952|3230461|3231894|-1|ID=1_2952;partial=00;start_type=GTG;rbs_motif=GGAGG;rbs_spacer=5-10bp;gc_cont=0.632	WP_003899540.1 MULTISPECIES: ammonium transporter [Mycobacterium]	100	99.8	0.0
CP007027.1_2953|3232259|3233527|-1|ID=1_2953;partial=00;start_type=GTG;rbs_motif=AGGA;rbs_spacer=5-10bp;gc_cont=0.685	WP_003899541.1 MULTISPECIES: signal recognition particle-docking protein FtsY [Mycobacterium]	100	99.8	2.49e-287
CP007027.1_2954|3233577|3237194|-1|ID=1_2954;partial=00;start_type=GTG;rbs_motif=None;rbs_spacer=None;gc_cont=0.672	WP_019250174.1 chromosome segregation protein SMC [Mycobacterium tuberculosis]	99.6	99.9	0.0
CP007027.1_2955|3237206|3237487|-1|ID=1_2955;partial=00;start_type=ATG;rbs_motif=GGAGG;rbs_spacer=5-10bp;gc_cont=0.706	WP_003414811.1 MULTISPECIES: acylphosphatase [Mycobacterium]	100	98.9	4.22e-64
CP007027.1_2956|3237474|3237887|-1|ID=1_2956;partial=00;start_type=ATG;rbs_motif=None;rbs_spacer=None;gc_cont=0.679	WP_003414812.1 MULTISPECIES: OsmC family protein [Mycobacterium]	100	99.3	2.19e-89
CP007027.1_2957|3237989|3238858|-1|ID=1_2957;partial=00;start_type=ATG;rbs_motif=None;rbs_spacer=None;gc_cont=0.672	WP_003414814.1 MULTISPECIES: DNA-formamidopyrimidine glycosylase [Mycobacterium]	100	99.7	1.62e-209
CP007027.1_2958|3239217|3239939|-1|ID=1_2958;partial=00;start_type=ATG;rbs_motif=GGAG/GAGG;rbs_spacer=5-10bp;gc_cont=0.642	WP_003414820.1 MULTISPECIES: ribonuclease III [Mycobacterium]	100	99.6	1.15e-164
CP007027.1_2959|3239936|3240523|-1|ID=1_2959;partial=00;start_type=ATG;rbs_motif=AGGA;rbs_spacer=5-10bp;gc_cont=0.658	WP_003912009.1 MULTISPECIES: YceD family protein [Mycobacterium]	100	99.5	2.91e-138
CP007027.1_2960|3240610|3241347|-1|ID=1_2960;partial=00;start_type=GTG;rbs_motif=AGGAG;rbs_spacer=5-10bp;gc_cont=0.638	WP_023643726.1 cell division protein SepIVA [Mycobacterium tuberculosis]	100	99.6	1.28e-42
CP007027.1_2961|3241586|3242371|1|ID=1_2961;partial=00;start_type=ATG;rbs_motif=GGA/GAG/AGG;rbs_spacer=5-10bp;gc_cont=0.545	WP_003414828.1 MULTISPECIES: thioesterase TesA [Mycobacterium]	100	99.6	5.60e-196
CP007027.1_2962|3243085|3244836|1|ID=1_2962;partial=00;start_type=ATG;rbs_motif=GGAG/GAGG;rbs_spacer=5-10bp;gc_cont=0.609	WP_003900597.1 MULTISPECIES: long-chain-fatty-acid--AMP ligase FAAL26/FadD26 [Mycobacterium]	100	99.8	0.0
CP007027.1_2963|3244833|3245726|1|ID=1_2963;partial=00;start_type=ATG;rbs_motif=GGA/GAG/AGG;rbs_spacer=5-10bp;gc_cont=0.643	WP_233368737.1 type I polyketide synthase, partial [Mycobacterium tuberculosis]	100	97.7	1.19e-207
CP007027.1_2964|3245723|3250456|1|ID=1_2964;partial=00;start_type=GTG;rbs_motif=None;rbs_spacer=None;gc_cont=0.656	WP_010886158.1 phthiocerol type I polyketide synthase PpsA [Mycobacterium tuberculosis]	99.9	99.9	0.0
CP007027.1_2965|3250456|3255069|1|ID=1_2965;partial=00;start_type=ATG;rbs_motif=GGAG/GAGG;rbs_spacer=5-10bp;gc_cont=0.654	WP_003899547.1 MULTISPECIES: phthiocerol type I polyketide synthase PpsB [Mycobacterium]	100	99.9	0.0
CP007027.1_2966|3255066|3261632|1|ID=1_2966;partial=00;start_type=ATG;rbs_motif=GGAG/GAGG;rbs_spacer=5-10bp;gc_cont=0.661	WP_057333534.1 phthiocerol type I polyketide synthase PpsC [Mycobacterium tuberculosis]	99.4	100.0	0.0
CP007027.1_2967|3261629|3267112|1|ID=1_2967;partial=00;start_type=ATG;rbs_motif=GGAG/GAGG;rbs_spacer=5-10bp;gc_cont=0.669	WP_003899549.1 MULTISPECIES: phthiocerol type I polyketide synthase PpsD [Mycobacterium]	100	99.9	0.0
CP007027.1_2968|3267118|3271584|1|ID=1_2968;partial=00;start_type=GTG;rbs_motif=GGAGG;rbs_spacer=5-10bp;gc_cont=0.656	WP_003900602.1 MULTISPECIES: phthiocerol type I polyketide synthase PpsE [Mycobacterium]	100	99.9	0.0
CP007027.1_2969|3271595|3272590|1|ID=1_2969;partial=00;start_type=ATG;rbs_motif=AGGAG;rbs_spacer=5-10bp;gc_cont=0.629	WP_003901496.1 MULTISPECIES: daunorubicin ABC transporter ATP-binding protein DrrA [Mycobacterium]	100	99.7	7.00e-232
CP007027.1_2970|3272587|3273456|1|ID=1_2970;partial=00;start_type=ATG;rbs_motif=None;rbs_spacer=None;gc_cont=0.594	WP_003414848.1 MULTISPECIES: daunorubicin ABC transporter permease DrrB [Mycobacterium]	100	99.7	1.32e-183
CP007027.1_2971|3273453|3274283|1|ID=1_2971;partial=00;start_type=ATG;rbs_motif=GGA/GAG/AGG;rbs_spacer=5-10bp;gc_cont=0.575	WP_003414851.1 MULTISPECIES: ABC transporter permease [Mycobacterium]	100	99.6	2.81e-183
CP007027.1_2972|3274330|3275598|1|ID=1_2972;partial=00;start_type=ATG;rbs_motif=GGAG/GAGG;rbs_spacer=5-10bp;gc_cont=0.604	WP_003414853.1 MULTISPECIES: phthiocerol/phthiodiolone dimycocerosyl transferase [Mycobacterium]	100	99.8	2.31e-308
CP007027.1_2973|3275761|3282096|-1|ID=1_2973;partial=00;start_type=ATG;rbs_motif=GGAG/GAGG;rbs_spacer=5-10bp;gc_cont=0.665	WP_003899551.1 MULTISPECIES: mycocerosate synthase [Mycobacterium]	100	100.0	0.0
CP007027.1_2974|3282596|3284458|1|ID=1_2974;partial=00;start_type=ATG;rbs_motif=GGxGG;rbs_spacer=3-4bp;gc_cont=0.599	WP_003414857.1 MULTISPECIES: fatty-acid--AMP ligase FAAL28/FadD28 [Mycobacterium]	100	93.4	0.0
CP007027.1_2975|3284412|3287213|1|ID=1_2975;partial=00;start_type=GTG;rbs_motif=AGGAG;rbs_spacer=5-10bp;gc_cont=0.658	WP_031723942.1 phthiocerol dimycocerosate RND transporter MmpL7 [Mycobacterium tuberculosis]	99.8	98.5	0.0
CP007027.1_2976|3287845|3289086|1|ID=1_2976;partial=00;start_type=ATG;rbs_motif=AGGAGG;rbs_spacer=5-10bp;gc_cont=0.673	WP_003414864.1 MULTISPECIES: IS21-like element ISMbo1 family transposase [Mycobacterium]	100	99.8	5.20e-305
CP007027.1_2977|3289504|3289887|1|ID=1_2977;partial=00;start_type=GTG;rbs_motif=GGA/GAG/AGG;rbs_spacer=11-12bp;gc_cont=0.648	WP_003414867.1 ATP-binding protein [Mycobacterium tuberculosis]	99.2	99.2	4.00e-84
CP007027.1_2978|3290005|3290706|-1|ID=1_2978;partial=00;start_type=ATG;rbs_motif=GGA/GAG/AGG;rbs_spacer=5-10bp;gc_cont=0.598	WP_003414872.1 MULTISPECIES: LppX_LprAFG lipoprotein [Mycobacterium]	100	99.6	6.19e-161
CP007027.1_2979|3290884|3295683|-1|ID=1_2979;partial=00;start_type=ATG;rbs_motif=AGxAGG/AGGxGG;rbs_spacer=5-10bp;gc_cont=0.684	WP_003910947.1 MULTISPECIES: type I polyketide synthase [Mycobacterium]	100	99.9	0.0
CP007027.1_2980|3295731|3297200|-1|ID=1_2980;partial=00;start_type=ATG;rbs_motif=AGGAG;rbs_spacer=5-10bp;gc_cont=0.659	WP_009936729.1 type I polyketide synthase [Mycobacterium tuberculosis]	100	99.8	0.0
CP007027.1_2981|3297218|3299335|-1|ID=1_2981;partial=00;start_type=ATG;rbs_motif=3Base/5BMM;rbs_spacer=13-15bp;gc_cont=0.614	WP_003414884.1 MULTISPECIES: p-hydroxybenzoic acid--AMP ligase FadD22 [Mycobacterium]	100	99.9	0.0
CP007027.1_2982|3299352|3299951|-1|ID=1_2982;partial=00;start_type=ATG;rbs_motif=GGA/GAG/AGG;rbs_spacer=5-10bp;gc_cont=0.522	WP_003414887.1 MULTISPECIES: chorismate--pyruvate lyase family protein [Mycobacterium]	100	99.5	7.98e-138
CP007027.1_2983|3299977|3301836|-1|ID=1_2983;partial=00;start_type=ATG;rbs_motif=AGGA;rbs_spacer=5-10bp;gc_cont=0.601	WP_003899553.1 4-hydroxyphenylalkanoate adenylyltransferase FadD29 [Mycobacterium tuberculosis]	100	99.8	0.0
CP007027.1_2984|3302484|3303551|-1|ID=1_2984;partial=00;start_type=ATG;rbs_motif=None;rbs_spacer=None;gc_cont=0.611	WP_072515660.1 phthiodiolone/phenolphthiodiolone dimycocerosates ketoreductase [Mycobacterium tuberculosis]	100	99.7	1.26e-257
CP007027.1_2985|3303822|3304634|1|ID=1_2985;partial=00;start_type=ATG;rbs_motif=None;rbs_spacer=None;gc_cont=0.620	WP_003414900.1 MULTISPECIES: phthiotriol/phenolphthiotriol dimycocerosates methyltransferase [Mycobacterium]	100	99.6	2.57e-201
CP007027.1_2986|3304660|3305916|1|ID=1_2986;partial=00;start_type=ATG;rbs_motif=None;rbs_spacer=None;gc_cont=0.648	WP_003414903.1 MULTISPECIES: trans-acting enoyl reductase [Mycobacterium]	100	99.8	2.26e-297
CP007027.1_2987|3306047|3306757|-1|ID=1_2987;partial=00;start_type=ATG;rbs_motif=None;rbs_spacer=None;gc_cont=0.626	WP_003899554.1 [2,4-di-O-methyl-alpha-L-fucopyranosyl-(1->3)-alpha-L-rhamnopyranosyl-(1->3)-2-O-methyl-alpha-L-rhamnopyranosyl] dimycocerosyl phenol-phthiocerol 3'''-O-methyltransferase [Mycobacterium tuberculosis]	100	99.6	5.15e-175
CP007027.1_2988|3306961|3307752|-1|ID=1_2988;partial=00;start_type=ATG;rbs_motif=GGA/GAG/AGG;rbs_spacer=5-10bp;gc_cont=0.686	WP_193566313.1 [2-O-methyl-alpha-L-fucopyranosyl-(1->3)-alpha-L-rhamnopyranosyl-(1->3)-2-O-methyl-alpha-L-rhamnopyranosyl] dimycocerosyl phenol-phthiocerol 4'''-O-methyltransferase [Mycobacterium tuberculosis]	100	99.6	1.04e-188
CP007027.1_2989|3308406|3308780|1|ID=1_2989;partial=00;start_type=ATG;rbs_motif=3Base/5BMM;rbs_spacer=13-15bp;gc_cont=0.515	WP_042757453.1 [alpha-L-fucopyranosyl-(1->3)-alpha-L-rhamnopyranosyl-(1->3)-2-O-methyl-alpha-L-rhamnopyranosyl] dimycocerosyl phenol-phthiocerol 2'''-O-methyltransferase, partial [Mycobacterium tuberculosis]	100	99.2	2.31e-84
CP007027.1_2990|3308851|3309678|1|ID=1_2990;partial=00;start_type=ATG;rbs_motif=None;rbs_spacer=None;gc_cont=0.600	WP_003414909.1 MULTISPECIES: PGL/p-HBAD biosynthesis glycosyltransferase [Mycobacterium]	100	99.6	1.00e-196
CP007027.1_2991|3310095|3311381|-1|ID=1_2991;partial=00;start_type=ATG;rbs_motif=AGxAGG/AGGxGG;rbs_spacer=5-10bp;gc_cont=0.647	WP_003899557.1 MULTISPECIES: PGL/p-HBAD biosynthesis glycosyltransferase [Mycobacterium]	100	99.8	2.43e-313
CP007027.1_2992|3311482|3312219|-1|ID=1_2992;partial=00;start_type=ATG;rbs_motif=AGGAG;rbs_spacer=5-10bp;gc_cont=0.537	WP_003414919.1 MULTISPECIES: rhamnosyl O-methyltransferase [Mycobacterium]	100	99.6	9.21e-178
CP007027.1_2993|3312664|3313053|1|ID=1_2993;partial=00;start_type=GTG;rbs_motif=GGA/GAG/AGG;rbs_spacer=5-10bp;gc_cont=0.656	WP_003414921.1 ISNCY family transposase [Mycobacterium tuberculosis]	100	99.2	1.46e-90
CP007027.1_2994|3313154|3314503|-1|ID=1_2994;partial=00;start_type=GTG;rbs_motif=GGAG/GAGG;rbs_spacer=5-10bp;gc_cont=0.656	WP_003414922.1 MULTISPECIES: PGL/p-HBAD biosynthesis rhamnosyltransferase [Mycobacterium]	100	99.8	0.0
CP007027.1_2995|3314617|3315837|1|ID=1_2995;partial=00;start_type=GTG;rbs_motif=GGAGG;rbs_spacer=5-10bp;gc_cont=0.615	WP_024456342.1 permease [Mycobacterium tuberculosis]	94.6	99.8	2.82e-246
CP007027.1_2996|3316048|3316842|1|ID=1_2996;partial=00;start_type=GTG;rbs_motif=GGA/GAG/AGG;rbs_spacer=11-12bp;gc_cont=0.613	WP_003899559.1 MULTISPECIES: formyltetrahydrofolate deformylase [Mycobacterium]	99.6	99.6	3.39e-189
CP007027.1_2997|3317482|3317667|1|ID=1_2997;partial=00;start_type=ATG;rbs_motif=GGAG/GAGG;rbs_spacer=5-10bp;gc_cont=0.656	WP_003414994.1 MULTISPECIES: hypothetical protein [Mycobacterium]	100	98.4	2.52e-35
CP007027.1_2998|3317711|3318196|-1|ID=1_2998;partial=00;start_type=ATG;rbs_motif=AGGAGG;rbs_spacer=5-10bp;gc_cont=0.609	WP_003414998.1 MULTISPECIES: pantetheine-phosphate adenylyltransferase [Mycobacterium]	100	99.4	4.17e-110
CP007027.1_2999|3318282|3318848|-1|ID=1_2999;partial=00;start_type=TTG;rbs_motif=GGAG/GAGG;rbs_spacer=5-10bp;gc_cont=0.698	WP_003415001.1 MULTISPECIES: 16S rRNA (guanine(966)-N(2))-methyltransferase RsmD [Mycobacterium]	100	99.5	7.73e-126
CP007027.1_3000|3319044|3322427|-1|ID=1_3000;partial=00;start_type=GTG;rbs_motif=GGAG/GAGG;rbs_spacer=5-10bp;gc_cont=0.652	WP_003415003.1 MULTISPECIES: pyruvate carboxylase [Mycobacterium]	100	99.9	0.0
CP007027.1_3001|3322452|3323039|-1|ID=1_3001;partial=00;start_type=GTG;rbs_motif=None;rbs_spacer=None;gc_cont=0.619	WP_049958754.1 vitamin K epoxide reductase family protein [Mycobacterium tuberculosis]	99.5	99.5	4.58e-134
CP007027.1_3002|3323090|3323857|-1|ID=1_3002;partial=00;start_type=GTG;rbs_motif=AGGA/GGAG/GAGG;rbs_spacer=11-12bp;gc_cont=0.632	WP_003415010.1 MULTISPECIES: mycothiol-dependent reductase [Mycobacterium]	100	99.6	3.31e-176
CP007027.1_3003|3323954|3325084|-1|ID=1_3003;partial=00;start_type=ATG;rbs_motif=GGAG/GAGG;rbs_spacer=5-10bp;gc_cont=0.655	WP_003415015.1 MULTISPECIES: lipase/esterase LipN [Mycobacterium]	100	99.7	3.58e-275
CP007027.1_3004|3325482|3326330|1|ID=1_3004;partial=00;start_type=GTG;rbs_motif=GGA/GAG/AGG;rbs_spacer=5-10bp;gc_cont=0.637	WP_003899563.1 MULTISPECIES: aldo/keto reductase [Mycobacterium]	100	99.6	2.66e-200
CP007027.1_3005|3326404|3327117|-1|ID=1_3005;partial=00;start_type=ATG;rbs_motif=None;rbs_spacer=None;gc_cont=0.653	WP_003415024.1 MULTISPECIES: HNH endonuclease family protein [Mycobacterium]	100	99.6	4.39e-172
CP007027.1_3006|3327114|3329327|-1|ID=1_3006;partial=00;start_type=GTG;rbs_motif=GGA/GAG/AGG;rbs_spacer=5-10bp;gc_cont=0.646	WP_003415026.1 MULTISPECIES: ATP-dependent DNA helicase RecG [Mycobacterium]	100	99.9	0.0
CP007027.1_3007|3329330|3330742|-1|ID=1_3007;partial=00;start_type=TTG;rbs_motif=None;rbs_spacer=None;gc_cont=0.708	WP_003415028.1 DAK2 domain-containing protein [Mycobacterium tuberculosis]	100	99.8	6.75e-314
CP007027.1_3008|3330739|3330993|-1|ID=1_3008;partial=00;start_type=GTG;rbs_motif=AGGAG;rbs_spacer=5-10bp;gc_cont=0.655	WP_152316405.1 DAK2 domain-containing protein, partial [Mycobacterium tuberculosis]	100	97.6	7.25e-48
CP007027.1_3009|3331235|3331429|1|ID=1_3009;partial=00;start_type=ATG;rbs_motif=AGGAG;rbs_spacer=5-10bp;gc_cont=0.651	WP_003415030.1 MULTISPECIES: 50S ribosomal protein L28 [Mycobacterium]	100	98.5	7.21e-43
CP007027.1_3010|3331452|3332135|-1|ID=1_3010;partial=00;start_type=GTG;rbs_motif=GGA/GAG/AGG;rbs_spacer=5-10bp;gc_cont=0.670	WP_003899565.1 MULTISPECIES: uracil-DNA glycosylase [Mycobacterium]	100	99.6	1.65e-162
CP007027.1_3011|3332168|3333169|-1|ID=1_3011;partial=00;start_type=GTG;rbs_motif=None;rbs_spacer=None;gc_cont=0.696	WP_003415034.1 MULTISPECIES: thiamine-phosphate kinase [Mycobacterium]	100	99.7	1.04e-234
CP007027.1_3012|3333166|3334545|-1|ID=1_3012;partial=00;start_type=ATG;rbs_motif=GGAG/GAGG;rbs_spacer=5-10bp;gc_cont=0.658	WP_003415037.1 MULTISPECIES: IS607 family element RNA-guided endonuclease TnpB [Mycobacterium]	100	99.8	0.0
CP007027.1_3013|3334545|3335129|-1|ID=1_3013;partial=00;start_type=ATG;rbs_motif=AGGA;rbs_spacer=5-10bp;gc_cont=0.650	WP_003899566.1 MULTISPECIES: IS607 family transposase [Mycobacterium]	100	99.5	1.14e-130
CP007027.1_3014|3335311|3335886|1|ID=1_3014;partial=00;start_type=GTG;rbs_motif=GGA/GAG/AGG;rbs_spacer=5-10bp;gc_cont=0.701	WP_003899567.1 DUF3515 domain-containing protein [Mycobacterium tuberculosis]	100	99.5	1.59e-115
CP007027.1_3015|3336177|3337253|-1|ID=1_3015;partial=00;start_type=GTG;rbs_motif=None;rbs_spacer=None;gc_cont=0.675	WP_003912011.1 MULTISPECIES: D-alanine--D-alanine ligase DdlA [Mycobacterium]	99.7	99.7	4.12e-255
CP007027.1_3016|3337376|3338380|-1|ID=1_3016;partial=00;start_type=ATG;rbs_motif=None;rbs_spacer=None;gc_cont=0.676	WP_003917087.1 NAD(P)H-dependent glycerol-3-phosphate dehydrogenase [Mycobacterium tuberculosis]	100	99.7	6.66e-227
CP007027.1_3017|3338499|3339143|1|ID=1_3017;partial=00;start_type=ATG;rbs_motif=AGGA;rbs_spacer=5-10bp;gc_cont=0.696	WP_003415094.1 MULTISPECIES: 2-phospho-L-lactate guanylyltransferase [Mycobacterium]	100	99.5	7.82e-141
CP007027.1_3018|3339235|3341463|1|ID=1_3018;partial=00;start_type=ATG;rbs_motif=None;rbs_spacer=None;gc_cont=0.634	WP_003415097.1 MULTISPECIES: RNA degradosome polyphosphate kinase [Mycobacterium]	100	99.9	0.0
CP007027.1_3019|3341546|3342499|1|ID=1_3019;partial=00;start_type=GTG;rbs_motif=AGGAG;rbs_spacer=5-10bp;gc_cont=0.654	WP_003899569.1 MULTISPECIES: NUDIX hydrolase [Mycobacterium]	100	99.7	7.33e-236
CP007027.1_3020|3342557|3343201|-1|ID=1_3020;partial=00;start_type=ATG;rbs_motif=GGAGG;rbs_spacer=5-10bp;gc_cont=0.650	WP_415263751.1 DNA-binding protein HupB [Mycobacterium tuberculosis]	100	99.5	1.21e-72
CP007027.1_3021|3343414|3344010|-1|ID=1_3021;partial=00;start_type=ATG;rbs_motif=GGA/GAG/AGG;rbs_spacer=5-10bp;gc_cont=0.600	WP_003415110.1 MULTISPECIES: 3-isopropylmalate dehydratase small subunit [Mycobacterium]	100	99.5	5.64e-142
CP007027.1_3022|3344035|3345456|-1|ID=1_3022;partial=00;start_type=ATG;rbs_motif=GGAG/GAGG;rbs_spacer=5-10bp;gc_cont=0.667	WP_003899570.1 MULTISPECIES: 3-isopropylmalate dehydratase large subunit [Mycobacterium]	100	99.8	0.0
CP007027.1_3023|3345528|3346229|1|ID=1_3023;partial=00;start_type=GTG;rbs_motif=None;rbs_spacer=None;gc_cont=0.719	WP_003415115.1 MULTISPECIES: IclR family transcriptional regulator [Mycobacterium]	100	99.6	2.94e-159
CP007027.1_3024|3346240|3347100|-1|ID=1_3024;partial=00;start_type=ATG;rbs_motif=GGA/GAG/AGG;rbs_spacer=5-10bp;gc_cont=0.626	WP_003415118.1 MULTISPECIES: class I SAM-dependent methyltransferase [Mycobacterium]	100	99.7	3.82e-211
CP007027.1_3025|3347363|3347854|1|ID=1_3025;partial=00;start_type=ATG;rbs_motif=None;rbs_spacer=None;gc_cont=0.654	WP_003899572.1 MULTISPECIES: PPOX class F420-dependent oxidoreductase [Mycobacterium]	100	99.4	5.47e-116
CP007027.1_3026|3348186|3349658|-1|ID=1_3026;partial=00;start_type=GTG;rbs_motif=AGGA;rbs_spacer=5-10bp;gc_cont=0.667	WP_003415122.1 MULTISPECIES: glutamate--tRNA ligase [Mycobacterium]	100	99.8	0.0
CP007027.1_3027|3349655|3350452|-1|ID=1_3027;partial=00;start_type=ATG;rbs_motif=None;rbs_spacer=None;gc_cont=0.640	WP_003415138.1 MULTISPECIES: fumarylacetoacetate hydrolase family protein [Mycobacterium]	100	99.6	1.80e-194
CP007027.1_3028|3350692|3351987|1|ID=1_3028;partial=00;start_type=ATG;rbs_motif=None;rbs_spacer=None;gc_cont=0.667	WP_003415142.1 MFS transporter [Mycobacterium tuberculosis]	100	99.8	1.32e-290
CP007027.1_3029|3351839|3352849|-1|ID=1_3029;partial=00;start_type=ATG;rbs_motif=3Base/5BMM;rbs_spacer=13-15bp;gc_cont=0.674	WP_003899576.1 MULTISPECIES: 3-isopropylmalate dehydrogenase [Mycobacterium]	100	99.7	6.50e-235
CP007027.1_3030|3352864|3354435|-1|ID=1_3030;partial=00;start_type=GTG;rbs_motif=GGA/GAG/AGG;rbs_spacer=5-10bp;gc_cont=0.687	WP_015575266.1 MULTISPECIES: phosphoglycerate dehydrogenase [Mycobacterium]	99.8	99.8	0.0
CP007027.1_3031|3354480|3355922|1|ID=1_3031;partial=00;start_type=GTG;rbs_motif=None;rbs_spacer=None;gc_cont=0.698	WP_003415150.1 MULTISPECIES: phytoene desaturase family protein [Mycobacterium]	100	99.8	0.0
CP007027.1_3032|3356196|3356657|1|ID=1_3032;partial=00;start_type=GTG;rbs_motif=GGA/GAG/AGG;rbs_spacer=5-10bp;gc_cont=0.656	WP_003899579.1 hypothetical protein [Mycobacterium tuberculosis]	100	99.4	1.87e-100
CP007027.1_3033|3356633|3356935|1|ID=1_3033;partial=00;start_type=GTG;rbs_motif=AGxAGG/AGGxGG;rbs_spacer=5-10bp;gc_cont=0.624	WP_003900611.1 hypothetical protein [Mycobacterium tuberculosis]	100	99.0	4.91e-73
CP007027.1_3034|3356983|3357948|1|ID=1_3034;partial=00;start_type=ATG;rbs_motif=GGAGG;rbs_spacer=5-10bp;gc_cont=0.646	WP_003917088.1 DUF1259 domain-containing protein [Mycobacterium tuberculosis]	100	99.7	7.57e-231
CP007027.1_3035|3357993|3358652|1|ID=1_3035;partial=00;start_type=ATG;rbs_motif=None;rbs_spacer=None;gc_cont=0.662	WP_003415160.1 MULTISPECIES: ABC transporter permease [Mycobacterium]	100	99.5	2.41e-142
