CP007027.1_982|1074444|1075118|-1|ID=1_982;partial=00;start_type=ATG;rbs_motif=None;rbs_spacer=None;gc_cont=0.643	WP_003916736.1 LppA family lipoprotein [Mycobacterium tuberculosis]	100	99.6	1.00e-166
CP007027.1_983|1075301|1076263|-1|ID=1_983;partial=00;start_type=ATG;rbs_motif=None;rbs_spacer=None;gc_cont=0.629	WP_003898663.1 alpha/beta hydrolase family protein [Mycobacterium tuberculosis]	100	99.7	9.26e-236
CP007027.1_984|1077237|1077839|-1|ID=1_984;partial=00;start_type=ATG;rbs_motif=GGA/GAG/AGG;rbs_spacer=5-10bp;gc_cont=0.672	WP_010886096.1 DUF1707 SHOCT-like domain-containing protein [Mycobacterium tuberculosis]	100	99.5	6.06e-138
CP007027.1_985|1077979|1078338|1|ID=1_985;partial=00;start_type=ATG;rbs_motif=GGA/GAG/AGG;rbs_spacer=5-10bp;gc_cont=0.628	WP_003404935.1 MULTISPECIES: copper-sensing transcriptional repressor CsoR [Mycobacterium]	100	99.2	1.07e-76
CP007027.1_986|1078395|1078691|1|ID=1_986;partial=00;start_type=ATG;rbs_motif=AGGAG;rbs_spacer=5-10bp;gc_cont=0.673	WP_003404939.1 MULTISPECIES: DUF1490 family protein [Mycobacterium]	100	99.0	1.28e-56
CP007027.1_987|1078681|1081059|1|ID=1_987;partial=00;start_type=ATG;rbs_motif=GGA/GAG/AGG;rbs_spacer=5-10bp;gc_cont=0.689	WP_009935691.1 MULTISPECIES: copper-translocating P-type ATPase [Mycobacterium]	100	97.1	0.0
CP007027.1_988|1081056|1081688|1|ID=1_988;partial=00;start_type=ATG;rbs_motif=None;rbs_spacer=None;gc_cont=0.619	WP_003898666.1 MULTISPECIES: DUF5134 domain-containing protein [Mycobacterium]	100	99.5	4.09e-150
CP007027.1_989|1081779|1082588|-1|ID=1_989;partial=00;start_type=ATG;rbs_motif=None;rbs_spacer=None;gc_cont=0.715	WP_003404949.1 MULTISPECIES: enoyl-CoA hydratase family protein [Mycobacterium]	100	99.6	1.29e-180
CP007027.1_990|1082588|1083754|-1|ID=1_990;partial=00;start_type=GTG;rbs_motif=AGGAG;rbs_spacer=5-10bp;gc_cont=0.645	WP_003898667.1 MULTISPECIES: acyl-CoA dehydrogenase family protein [Mycobacterium]	100	99.7	4.35e-273
CP007027.1_991|1083751|1085754|-1|ID=1_991;partial=00;start_type=ATG;rbs_motif=GGA/GAG/AGG;rbs_spacer=5-10bp;gc_cont=0.678	WP_003900244.1 MULTISPECIES: acetyl/propionyl/methylcrotonyl-CoA carboxylase subunit alpha [Mycobacterium]	100	99.9	0.0
CP007027.1_992|1085760|1087355|-1|ID=1_992;partial=00;start_type=GTG;rbs_motif=None;rbs_spacer=None;gc_cont=0.661	WP_010886097.1 MULTISPECIES: acyl-CoA carboxylase subunit beta [Mycobacterium]	99.8	99.4	0.0
CP007027.1_993|1087352|1088500|-1|ID=1_993;partial=00;start_type=GTG;rbs_motif=GGAG/GAGG;rbs_spacer=5-10bp;gc_cont=0.676	WP_003898670.1 MULTISPECIES: acyl-CoA dehydrogenase family protein [Mycobacterium]	100	99.7	6.68e-274
CP007027.1_994|1088497|1090179|-1|ID=1_994;partial=00;start_type=GTG;rbs_motif=None;rbs_spacer=None;gc_cont=0.701	WP_003404960.1 MULTISPECIES: acyclic terpene utilization AtuA family protein [Mycobacterium]	100	99.8	0.0
CP007027.1_995|1090377|1093148|1|ID=1_995;partial=00;start_type=ATG;rbs_motif=AGGAG;rbs_spacer=5-10bp;gc_cont=0.726	WP_010886098.1 MULTISPECIES: PecA family PE domain-processing aspartic protease [Mycobacterium tuberculosis complex]	100	99.9	8.82e-236
CP007027.1_996|1093365|1094360|-1|ID=1_996;partial=00;start_type=ATG;rbs_motif=AGGAG;rbs_spacer=5-10bp;gc_cont=0.710	WP_010886099.1 PE domain-containing protein [Mycobacterium tuberculosis]	100	82.2	1.98e-114
CP007027.1_997|1094890|1095063|1|ID=1_997;partial=00;start_type=ATG;rbs_motif=GGAG/GAGG;rbs_spacer=5-10bp;gc_cont=0.661	WP_003405053.1 MULTISPECIES: 50S ribosomal protein L32 [Mycobacterium]	100	98.3	7.31e-31
CP007027.1_998|1095082|1096455|-1|ID=1_998;partial=00;start_type=ATG;rbs_motif=AGGAG;rbs_spacer=5-10bp;gc_cont=0.714	WP_075911254.1 PE domain-containing protein [Mycobacterium tuberculosis]	100	99.8	9.36e-141
CP007027.1_999|1096859|1097512|1|ID=1_999;partial=00;start_type=GTG;rbs_motif=None;rbs_spacer=None;gc_cont=0.661	WP_003916757.1 MULTISPECIES: two-component system response regulator MprA [Mycobacterium]	99.5	99.5	1.48e-149
CP007027.1_1000|1097584|1099026|1|ID=1_1000;partial=00;start_type=ATG;rbs_motif=GGxGG;rbs_spacer=5-10bp;gc_cont=0.647	WP_031665981.1 two-component system sensor histidine kinase MprB [Mycobacterium tuberculosis]	100	99.8	0.0
CP007027.1_1001|1099370|1100464|1|ID=1_1001;partial=00;start_type=ATG;rbs_motif=None;rbs_spacer=None;gc_cont=0.674	WP_181912724.1 serine protease PepD, partial [Mycobacterium tuberculosis]	99.7	99.7	3.42e-222
CP007027.1_1002|1100464|1101009|1|ID=1_1002;partial=00;start_type=ATG;rbs_motif=GGAG/GAGG;rbs_spacer=5-10bp;gc_cont=0.663	WP_003405127.1 MULTISPECIES: MogA/MoaB family molybdenum cofactor biosynthesis protein [Mycobacterium]	100	99.5	1.51e-115
CP007027.1_1003|1101029|1101484|-1|ID=1_1003;partial=00;start_type=ATG;rbs_motif=AGGA;rbs_spacer=5-10bp;gc_cont=0.605	WP_003405128.1 MULTISPECIES: large-conductance mechanosensitive channel protein MscL [Mycobacterium]	100	99.3	3.63e-97
CP007027.1_1004|1101807|1102553|1|ID=1_1004;partial=00;start_type=ATG;rbs_motif=AGGA;rbs_spacer=5-10bp;gc_cont=0.534	WP_003900248.1 MULTISPECIES: ABC transporter ATP-binding protein [Mycobacterium]	100	99.6	2.07e-171
CP007027.1_1006|1102663|1105113|1|ID=1_1006;partial=00;start_type=ATG;rbs_motif=GGA/GAG/AGG;rbs_spacer=5-10bp;gc_cont=0.539	WP_003915882.1 MULTISPECIES: ABC transporter permease [Mycobacterium]	100	99.9	0.0
CP007027.1_1007|1105120|1106280|1|ID=1_1007;partial=00;start_type=ATG;rbs_motif=AGGA;rbs_spacer=5-10bp;gc_cont=0.534	WP_003898675.1 MULTISPECIES: lipocalin-like domain-containing protein [Mycobacterium]	100	99.7	1.82e-289
CP007027.1_1008|1106409|1107404|-1|ID=1_1008;partial=00;start_type=ATG;rbs_motif=None;rbs_spacer=None;gc_cont=0.648	WP_010886102.1 MULTISPECIES: polyprenyl-diphosphate synthase GrcC [Mycobacterium]	100	97.9	1.04e-227
CP007027.1_1009|1107447|1108028|-1|ID=1_1009;partial=00;start_type=GTG;rbs_motif=GGA/GAG/AGG;rbs_spacer=5-10bp;gc_cont=0.692	WP_058011252.1 SAF domain-containing protein, partial [Mycobacterium tuberculosis]	99.5	99.5	2.40e-119
CP007027.1_1010|1108176|1108508|-1|ID=1_1010;partial=00;start_type=GTG;rbs_motif=GGAGG;rbs_spacer=5-10bp;gc_cont=0.625	WP_116271132.1 FmdB family zinc ribbon protein, partial [Mycobacterium tuberculosis]	100	64.0	2.10e-44
CP007027.1_1011|1108582|1109169|-1|ID=1_1011;partial=00;start_type=ATG;rbs_motif=GGAG/GAGG;rbs_spacer=5-10bp;gc_cont=0.718	WP_003901063.1 MULTISPECIES: 5-formyltetrahydrofolate cyclo-ligase [Mycobacterium]	100	99.5	4.09e-134
CP007027.1_1012|1109276|1110196|1|ID=1_1012;partial=00;start_type=ATG;rbs_motif=None;rbs_spacer=None;gc_cont=0.661	WP_003911320.1 UTP--glucose-1-phosphate uridylyltransferase [Mycobacterium tuberculosis]	100	99.7	5.40e-212
CP007027.1_1013|1110366|1111553|1|ID=1_1013;partial=00;start_type=ATG;rbs_motif=GGA/GAG/AGG;rbs_spacer=5-10bp;gc_cont=0.682	WP_003898680.1 MULTISPECIES: molybdotransferase-like divisome protein Glp [Mycobacterium]	100	99.7	5.07e-274
CP007027.1_1014|1111616|1112227|1|ID=1_1014;partial=00;start_type=ATG;rbs_motif=GGA/GAG/AGG;rbs_spacer=5-10bp;gc_cont=0.680	WP_003405148.1 GNAT family N-acetyltransferase [Mycobacterium tuberculosis]	100	99.5	3.81e-147
CP007027.1_1015|1112388|1113464|1|ID=1_1015;partial=00;start_type=ATG;rbs_motif=AGxAGG/AGGxGG;rbs_spacer=5-10bp;gc_cont=0.673	WP_003901065.1 MULTISPECIES: divisome protein SepX/GlpR [Mycobacterium]	100	99.7	4.07e-224
CP007027.1_1016|1113865|1114116|1|ID=1_1016;partial=00;start_type=ATG;rbs_motif=GGA/GAG/AGG;rbs_spacer=5-10bp;gc_cont=0.591	WP_003405150.1 MULTISPECIES: hypothetical protein [Mycobacterium]	100	98.8	1.70e-54
CP007027.1_1017|1114177|1114386|-1|ID=1_1017;partial=00;start_type=ATG;rbs_motif=None;rbs_spacer=None;gc_cont=0.667	WP_229302542.1 methyltransferase [Mycobacterium tuberculosis]	98.6	98.6	8.43e-42
CP007027.1_1018|1114770|1115753|1|ID=1_1018;partial=00;start_type=TTG;rbs_motif=GGA/GAG/AGG;rbs_spacer=5-10bp;gc_cont=0.657	WP_368626821.1 GNAT family N-acetyltransferase [Mycobacterium tuberculosis]	99.7	99.7	3.56e-229
CP007027.1_1019|1115870|1116529|1|ID=1_1019;partial=00;start_type=ATG;rbs_motif=None;rbs_spacer=None;gc_cont=0.667	WP_003911352.1 MULTISPECIES: DUF5642 family protein [Mycobacterium]	100	99.5	1.16e-149
CP007027.1_1020|1116535|1117152|-1|ID=1_1020;partial=00;start_type=ATG;rbs_motif=3Base/5BMM;rbs_spacer=13-15bp;gc_cont=0.663	WP_003898684.1 alpha-ketoglutarate-dependent dioxygenase AlkB family protein [Mycobacterium tuberculosis]	100	99.5	1.61e-149
CP007027.1_1021|1117234|1118397|1|ID=1_1021;partial=00;start_type=GTG;rbs_motif=4Base/6BMM;rbs_spacer=13-15bp;gc_cont=0.660	WP_031665827.1 arginine deiminase [Mycobacterium tuberculosis]	99.7	99.7	1.05e-274
CP007027.1_1022|1118432|1120000|-1|ID=1_1022;partial=00;start_type=ATG;rbs_motif=None;rbs_spacer=None;gc_cont=0.665	WP_003898685.1 dolichyl-phosphate-mannose--protein mannosyltransferase [Mycobacterium tuberculosis]	100	99.8	0.0
CP007027.1_1023|1120026|1120883|1|ID=1_1023;partial=00;start_type=ATG;rbs_motif=GGA/GAG/AGG;rbs_spacer=5-10bp;gc_cont=0.692	WP_003405173.1 MULTISPECIES: 16S rRNA (cytidine(1402)-2'-O)-methyltransferase [Mycobacterium]	100	99.7	2.83e-192
CP007027.1_1024|1120893|1122116|-1|ID=1_1024;partial=00;start_type=ATG;rbs_motif=GGAG/GAGG;rbs_spacer=5-10bp;gc_cont=0.752	WP_003910253.1 MULTISPECIES: hypothetical protein [Mycobacterium]	100	99.8	1.37e-125
CP007027.1_1025|1122226|1123470|-1|ID=1_1025;partial=00;start_type=GTG;rbs_motif=GGAG/GAGG;rbs_spacer=5-10bp;gc_cont=0.700	WP_031726001.1 aminodeoxychorismate synthase component I, partial [Mycobacterium tuberculosis]	99.8	99.8	1.72e-298
CP007027.1_1026|1123718|1125421|1|ID=1_1026;partial=00;start_type=ATG;rbs_motif=None;rbs_spacer=None;gc_cont=0.650	WP_003405180.1 MULTISPECIES: hypothetical protein [Mycobacterium]	100	99.8	0.0
CP007027.1_1027|1125448|1127007|-1|ID=1_1027;partial=00;start_type=ATG;rbs_motif=GGA/GAG/AGG;rbs_spacer=11-12bp;gc_cont=0.640	WP_003911321.1 methionine--tRNA ligase [Mycobacterium tuberculosis]	100	99.8	0.0
CP007027.1_1028|1127147|1127887|1|ID=1_1028;partial=00;start_type=GTG;rbs_motif=GGA/GAG/AGG;rbs_spacer=11-12bp;gc_cont=0.684	WP_010886103.1 TatD family hydrolase [Mycobacterium tuberculosis]	99.6	99.6	1.25e-173
CP007027.1_1029|1128095|1129183|1|ID=1_1029;partial=00;start_type=ATG;rbs_motif=None;rbs_spacer=None;gc_cont=0.682	WP_003405187.1 resuscitation-promoting factor protein RpfB [Mycobacterium tuberculosis]	100	99.7	6.62e-248
CP007027.1_1030|1129156|1130109|1|ID=1_1030;partial=00;start_type=ATG;rbs_motif=None;rbs_spacer=None;gc_cont=0.670	WP_003405191.1 MULTISPECIES: 16S rRNA (adenine(1518)-N(6)/adenine(1519)-N(6))-dimethyltransferase RsmA [Mycobacterium]	100	99.7	7.14e-218
CP007027.1_1031|1130159|1131115|1|ID=1_1031;partial=00;start_type=GTG;rbs_motif=None;rbs_spacer=None;gc_cont=0.681	WP_003898690.1 MULTISPECIES: 4-(cytidine 5'-diphospho)-2-C-methyl-D-erythritol kinase [Mycobacterium]	100	99.7	1.10e-217
CP007027.1_1032|1131629|1133263|1|ID=1_1032;partial=00;start_type=TTG;rbs_motif=AGGAG;rbs_spacer=5-10bp;gc_cont=0.662	WP_003405202.1 MULTISPECIES: fatty acyl-AMP ligase [Mycobacterium]	100	99.8	0.0
CP007027.1_1033|1133337|1133912|-1|ID=1_1033;partial=00;start_type=ATG;rbs_motif=3Base/5BMM;rbs_spacer=13-15bp;gc_cont=0.667	WP_003405251.1 MULTISPECIES: aminoacyl-tRNA hydrolase [Mycobacterium]	100	99.5	2.70e-132
CP007027.1_1034|1133925|1134572|-1|ID=1_1034;partial=00;start_type=ATG;rbs_motif=AGGAG;rbs_spacer=5-10bp;gc_cont=0.664	WP_003405254.1 MULTISPECIES: 50S ribosomal protein L25/general stress protein Ctc [Mycobacterium]	100	99.5	2.13e-134
CP007027.1_1035|1134789|1135430|-1|ID=1_1035;partial=00;start_type=TTG;rbs_motif=GGA/GAG/AGG;rbs_spacer=3-4bp;gc_cont=0.620	WP_003898691.1 LpqN/LpqT family lipoprotein [Mycobacterium tuberculosis]	99.5	99.5	2.08e-143
CP007027.1_1036|1135505|1136485|-1|ID=1_1036;partial=00;start_type=TTG;rbs_motif=GGAG/GAGG;rbs_spacer=5-10bp;gc_cont=0.641	WP_003405263.1 MULTISPECIES: ribose-phosphate diphosphokinase [Mycobacterium]	100	99.7	5.16e-236
CP007027.1_1037|1136577|1138064|-1|ID=1_1037;partial=00;start_type=ATG;rbs_motif=AGGAG;rbs_spacer=5-10bp;gc_cont=0.674	WP_003405267.1 MULTISPECIES: bifunctional UDP-N-acetylglucosamine diphosphorylase/glucosamine-1-phosphate N-acetyltransferase GlmU [Mycobacterium]	100	99.8	0.0
CP007027.1_1038|1138319|1138912|1|ID=1_1038;partial=00;start_type=ATG;rbs_motif=None;rbs_spacer=None;gc_cont=0.650	WP_003405271.1 MULTISPECIES: TetR/AcrR family transcriptional regulator [Mycobacterium]	100	99.5	1.27e-133
CP007027.1_1039|1138971|1142675|1|ID=1_1039;partial=00;start_type=ATG;rbs_motif=None;rbs_spacer=None;gc_cont=0.688	WP_003405273.1 MULTISPECIES: transcription-repair coupling factor [Mycobacterium]	100	99.9	0.0
CP007027.1_1040|1142672|1143652|1|ID=1_1040;partial=00;start_type=GTG;rbs_motif=AGGAG;rbs_spacer=5-10bp;gc_cont=0.622	WP_003405276.1 MULTISPECIES: nucleoside triphosphate pyrophosphohydrolase [Mycobacterium]	100	99.4	1.91e-224
CP007027.1_1041|1143791|1144471|1|ID=1_1041;partial=00;start_type=ATG;rbs_motif=GGA/GAG/AGG;rbs_spacer=5-10bp;gc_cont=0.670	WP_003917393.1 lytic transglycosylase domain-containing protein [Mycobacterium tuberculosis]	100	99.6	1.94e-165
CP007027.1_1042|1144568|1145857|1|ID=1_1042;partial=00;start_type=GTG;rbs_motif=AGGAG;rbs_spacer=5-10bp;gc_cont=0.667	WP_003898693.1 MULTISPECIES: phosphopyruvate hydratase [Mycobacterium]	100	99.8	3.52e-302
CP007027.1_1043|1145862|1146548|1|ID=1_1043;partial=00;start_type=ATG;rbs_motif=3Base/5BMM;rbs_spacer=13-15bp;gc_cont=0.689	WP_003405293.1 MULTISPECIES: FtsB family cell division protein [Mycobacterium]	99.6	99.6	3.15e-147
CP007027.1_1044|1146541|1147032|1|ID=1_1044;partial=00;start_type=GTG;rbs_motif=GGA/GAG/AGG;rbs_spacer=5-10bp;gc_cont=0.683	WP_003405296.1 MULTISPECIES: DUF501 domain-containing protein [Mycobacterium]	100	99.4	8.38e-111
CP007027.1_1045|1147023|1147982|1|ID=1_1045;partial=00;start_type=GTG;rbs_motif=GGxGG;rbs_spacer=5-10bp;gc_cont=0.690	WP_003405299.1 MULTISPECIES: exopolyphosphatase Ppx2 [Mycobacterium]	100	99.7	7.98e-216
CP007027.1_1046|1148431|1149111|-1|ID=1_1046;partial=00;start_type=ATG;rbs_motif=GGAG/GAGG;rbs_spacer=5-10bp;gc_cont=0.633	WP_003405305.1 MULTISPECIES: two-component system response regulator KdpE [Mycobacterium]	100	99.6	1.41e-158
CP007027.1_1047|1149108|1151690|-1|ID=1_1047;partial=00;start_type=GTG;rbs_motif=AGGA;rbs_spacer=5-10bp;gc_cont=0.673	WP_003915886.1 sensor histidine kinase KdpD [Mycobacterium tuberculosis]	100	99.9	0.0
CP007027.1_1048|1151781|1151927|1|ID=1_1048;partial=00;start_type=ATG;rbs_motif=GGAG/GAGG;rbs_spacer=5-10bp;gc_cont=0.605	WP_078455097.1 potassium transporter Trk [Mycobacterium tuberculosis]	100	98.0	6.52e-25
CP007027.1_1049|1151918|1152016|1|ID=1_1049;partial=00;start_type=ATG;rbs_motif=GGA/GAG/AGG;rbs_spacer=5-10bp;gc_cont=0.576	WP_003405316.1 MULTISPECIES: K(+)-transporting ATPase subunit F [Mycobacterium]	100	90.9	1.99e-09
CP007027.1_1050|1152016|1153731|1|ID=1_1050;partial=00;start_type=ATG;rbs_motif=GGAG/GAGG;rbs_spacer=5-10bp;gc_cont=0.635	WP_003405318.1 MULTISPECIES: potassium-transporting ATPase subunit KdpA [Mycobacterium]	100	99.8	0.0
CP007027.1_1051|1153731|1155857|1|ID=1_1051;partial=00;start_type=ATG;rbs_motif=3Base/5BMM;rbs_spacer=13-15bp;gc_cont=0.656	WP_003405320.1 MULTISPECIES: potassium-transporting ATPase subunit KdpB [Mycobacterium]	100	99.9	0.0
CP007027.1_1052|1155857|1156426|1|ID=1_1052;partial=00;start_type=ATG;rbs_motif=None;rbs_spacer=None;gc_cont=0.663	WP_003405322.1 MULTISPECIES: K(+)-transporting ATPase subunit C [Mycobacterium]	100	99.5	1.62e-123
CP007027.1_1053|1156430|1157959|-1|ID=1_1053;partial=00;start_type=ATG;rbs_motif=GGA/GAG/AGG;rbs_spacer=5-10bp;gc_cont=0.650	WP_003405324.1 MULTISPECIES: sensor histidine kinase [Mycobacterium]	100	99.8	0.0
CP007027.1_1054|1157967|1158740|-1|ID=1_1054;partial=00;start_type=ATG;rbs_motif=GGAG/GAGG;rbs_spacer=5-10bp;gc_cont=0.623	WP_003405328.1 MULTISPECIES: two-component system response regulator TrcR [Mycobacterium]	100	99.6	8.83e-182
CP007027.1_1055|1158922|1159413|-1|ID=1_1055;partial=00;start_type=ATG;rbs_motif=None;rbs_spacer=None;gc_cont=0.667	WP_214399205.1 transposase, partial [Mycolicibacterium goodii]	100	79.3	8.58e-90
CP007027.1_1056|1159379|1160065|-1|ID=1_1056;partial=00;start_type=GTG;rbs_motif=GGA/GAG/AGG;rbs_spacer=5-10bp;gc_cont=0.709	WP_349651409.1 ISNCY family transposase, partial [Mycobacterium canetti]	69.2	96.5	5.24e-77
CP007027.1_1057|1160099|1160422|-1|ID=1_1057;partial=00;start_type=ATG;rbs_motif=None;rbs_spacer=None;gc_cont=0.614	WP_349651409.1 ISNCY family transposase, partial [Mycobacterium canetti]	95.4	80.6	2.65e-51
CP007027.1_1058|1160548|1160832|-1|ID=1_1058;partial=00;start_type=ATG;rbs_motif=AGGAG;rbs_spacer=5-10bp;gc_cont=0.628	WP_003898699.1 MULTISPECIES: type VII secretion system protein EsxV [Mycobacterium]	100	98.9	2.96e-60
CP007027.1_1059|1160859|1161155|-1|ID=1_1059;partial=00;start_type=ATG;rbs_motif=AGGAG;rbs_spacer=5-10bp;gc_cont=0.633	WP_003405345.1 MULTISPECIES: type VII secretion system ESX-5 protein EsxJ [Mycobacterium]	100	99.0	1.44e-62
CP007027.1_1060|1161301|1162476|-1|ID=1_1060;partial=00;start_type=ATG;rbs_motif=GGA/GAG/AGG;rbs_spacer=5-10bp;gc_cont=0.690	WP_003405368.1 MULTISPECIES: PPE family protein [Mycobacterium]	100	99.7	9.89e-244
CP007027.1_1061|1162553|1163380|-1|ID=1_1061;partial=00;start_type=ATG;rbs_motif=AGGAG;rbs_spacer=5-10bp;gc_cont=0.691	WP_057134559.1 PPE family protein, SVP subgroup [Mycobacterium tuberculosis]	97.5	99.6	1.68e-163
CP007027.1_1062|1164168|1164407|-1|ID=1_1062;partial=00;start_type=TTG;rbs_motif=AGxAG;rbs_spacer=3-4bp;gc_cont=0.646	WP_009936438.1 hypothetical protein [Mycobacterium tuberculosis]	100	98.8	5.21e-54
CP007027.1_1063|1164576|1165001|-1|ID=1_1063;partial=00;start_type=TTG;rbs_motif=GGA/GAG/AGG;rbs_spacer=5-10bp;gc_cont=0.643	WP_003898701.1 IS5 family transposase [Mycobacterium tuberculosis]	99.3	99.3	6.02e-96
CP007027.1_1064|1165096|1165503|-1|ID=1_1064;partial=00;start_type=GTG;rbs_motif=GGAG/GAGG;rbs_spacer=5-10bp;gc_cont=0.647	WP_003422389.1 IS5 family transposase [Mycobacterium tuberculosis]	100	99.3	1.33e-98
CP007027.1_1065|1165785|1166810|-1|ID=1_1065;partial=00;start_type=ATG;rbs_motif=None;rbs_spacer=None;gc_cont=0.644	WP_003405514.1 MULTISPECIES: S1 family peptidase [Mycobacterium]	100	99.7	2.32e-251
CP007027.1_1066|1167791|1168558|1|ID=1_1066;partial=00;start_type=ATG;rbs_motif=None;rbs_spacer=None;gc_cont=0.624	WP_031707680.1 nucleotidyl transferase AbiEii/AbiGii toxin family protein [Mycobacterium tuberculosis]	100	99.6	1.19e-178
CP007027.1_1067|1169428|1170675|1|ID=1_1067;partial=00;start_type=ATG;rbs_motif=AGGA;rbs_spacer=5-10bp;gc_cont=0.666	WP_003901078.1 MULTISPECIES: IS256-like element IS1081 family transposase [Mycobacterium tuberculosis complex]	100	99.8	6.41e-291
CP007027.1_1068|1171043|1172077|-1|ID=1_1068;partial=00;start_type=GTG;rbs_motif=GGA/GAG/AGG;rbs_spacer=11-12bp;gc_cont=0.629	WP_003901982.1 MULTISPECIES: hypothetical protein [Mycobacterium]	99.7	99.7	1.38e-242
CP007027.1_1069|1172115|1172318|-1|ID=1_1069;partial=00;start_type=GTG;rbs_motif=GGA/GAG/AGG;rbs_spacer=5-10bp;gc_cont=0.662	WP_003405585.1 MULTISPECIES: hypothetical protein [Mycobacterium]	100	98.5	8.59e-41
CP007027.1_1070|1172391|1172837|1|ID=1_1070;partial=00;start_type=ATG;rbs_motif=GGA/GAG/AGG;rbs_spacer=5-10bp;gc_cont=0.694	WP_003405595.1 MULTISPECIES: oxidation-sensing regulator MosR [Mycobacterium]	100	99.3	8.32e-97
CP007027.1_1071|1172886|1173791|1|ID=1_1071;partial=00;start_type=ATG;rbs_motif=AGGAG;rbs_spacer=5-10bp;gc_cont=0.674	WP_003405600.1 MULTISPECIES: SDR family oxidoreductase [Mycobacterium]	100	99.7	1.03e-202
CP007027.1_1072|1173950|1174705|-1|ID=1_1072;partial=00;start_type=ATG;rbs_motif=None;rbs_spacer=None;gc_cont=0.660	WP_003405603.1 nucleotidyl transferase AbiEii/AbiGii toxin family protein [Mycobacterium tuberculosis]	100	99.6	2.75e-182
CP007027.1_1074|1175728|1176117|1|ID=1_1074;partial=00;start_type=ATG;rbs_motif=AGxAGG/AGGxGG;rbs_spacer=5-10bp;gc_cont=0.605	WP_003405605.1 hypothetical protein [Mycobacterium tuberculosis]	100	99.2	2.08e-90
CP007027.1_1075|1177633|1178397|1|ID=1_1075;partial=00;start_type=ATG;rbs_motif=AGGAG;rbs_spacer=5-10bp;gc_cont=0.644	WP_003900263.1 MULTISPECIES: DUF427 domain-containing protein [Mycobacterium]	100	99.6	5.17e-193
CP007027.1_1076|1178609|1178755|-1|ID=1_1076;partial=00;start_type=ATG;rbs_motif=GGA/GAG/AGG;rbs_spacer=5-10bp;gc_cont=0.653	WP_003898712.1 MULTISPECIES: DUF222 domain-containing protein [Mycobacterium]	100	98.0	1.50e-27
CP007027.1_1077|1179350|1180582|1|ID=1_1077;partial=00;start_type=ATG;rbs_motif=AGGAG;rbs_spacer=5-10bp;gc_cont=0.670	WP_003405622.1 MULTISPECIES: YncE family protein [Mycobacterium]	100	95.6	1.11e-250
CP007027.1_1078|1180689|1182320|1|ID=1_1078;partial=00;start_type=ATG;rbs_motif=AGxAGG/AGGxGG;rbs_spacer=5-10bp;gc_cont=0.632	WP_003405625.1 MULTISPECIES: long-chain fatty acid--CoA ligase [Mycobacterium]	100	99.8	0.0
CP007027.1_1079|1182402|1183460|1|ID=1_1079;partial=00;start_type=ATG;rbs_motif=GGA/GAG/AGG;rbs_spacer=5-10bp;gc_cont=0.649	WP_003898714.1 NAD(P)H-dependent amine dehydrogenase family protein [Mycobacterium tuberculosis]	100	99.7	1.20e-254
CP007027.1_1080|1183513|1183986|1|ID=1_1080;partial=00;start_type=ATG;rbs_motif=GGA/GAG/AGG;rbs_spacer=11-12bp;gc_cont=0.654	WP_003405633.1 MULTISPECIES: SRPBCC family protein [Mycobacterium]	100	99.4	2.17e-110
CP007027.1_1081|1184020|1184883|1|ID=1_1081;partial=00;start_type=ATG;rbs_motif=None;rbs_spacer=None;gc_cont=0.635	WP_003405636.1 MULTISPECIES: class II glutamine amidotransferase [Mycobacterium]	100	99.7	1.38e-209
CP007027.1_1082|1184861|1185745|1|ID=1_1082;partial=00;start_type=ATG;rbs_motif=GGA/GAG/AGG;rbs_spacer=5-10bp;gc_cont=0.679	WP_003405640.1 MULTISPECIES: patatin-like phospholipase family protein [Mycobacterium]	99.6	96.6	4.96e-193
CP007027.1_1083|1185746|1186828|-1|ID=1_1083;partial=00;start_type=ATG;rbs_motif=GGA/GAG/AGG;rbs_spacer=11-12bp;gc_cont=0.688	WP_003405642.1 MULTISPECIES: patatin family protein [Mycobacterium]	100	99.7	2.94e-234
CP007027.1_1084|1186909|1187292|-1|ID=1_1084;partial=00;start_type=ATG;rbs_motif=None;rbs_spacer=None;gc_cont=0.695	WP_003898716.1 lipoprotein LpqV [Mycobacterium tuberculosis]	100	99.2	4.94e-79
CP007027.1_1085|1187446|1188006|1|ID=1_1085;partial=00;start_type=ATG;rbs_motif=4Base/6BMM;rbs_spacer=13-15bp;gc_cont=0.676	WP_003405649.1 MULTISPECIES: cysteine dioxygenase [Mycobacterium]	100	99.5	9.08e-138
CP007027.1_1086|1188003|1188398|1|ID=1_1086;partial=00;start_type=ATG;rbs_motif=GGA/GAG/AGG;rbs_spacer=5-10bp;gc_cont=0.732	WP_003405651.1 MULTISPECIES: rhodanese-like domain-containing protein [Mycobacterium]	100	99.2	1.02e-82
CP007027.1_1087|1188426|1190429|-1|ID=1_1087;partial=00;start_type=GTG;rbs_motif=GGAG/GAGG;rbs_spacer=5-10bp;gc_cont=0.785	WP_031707113.1 PE family protein, partial [Mycobacterium tuberculosis]	100	22.6	3.74e-78
CP007027.1_1088|1190762|1192153|-1|ID=1_1088;partial=00;start_type=ATG;rbs_motif=GGAG/GAGG;rbs_spacer=5-10bp;gc_cont=0.753	WP_078446457.1 PE family protein, partial [Mycobacterium tuberculosis]	100	32.5	1.57e-85
CP007027.1_1089|1192515|1194278|-1|ID=1_1089;partial=00;start_type=ATG;rbs_motif=None;rbs_spacer=None;gc_cont=0.649	WP_003405708.1 MULTISPECIES: alpha/beta hydrolase [Mycobacterium]	100	99.8	0.0
CP007027.1_1090|1194275|1195048|-1|ID=1_1090;partial=00;start_type=ATG;rbs_motif=GGAG/GAGG;rbs_spacer=5-10bp;gc_cont=0.647	WP_003405712.1 MULTISPECIES: enoyl-CoA hydratase [Mycobacterium]	100	99.6	9.75e-170
CP007027.1_1091|1195060|1196097|-1|ID=1_1091;partial=00;start_type=GTG;rbs_motif=GGAGG;rbs_spacer=5-10bp;gc_cont=0.656	WP_003405716.1 MULTISPECIES: enoyl-CoA hydratase/isomerase family protein [Mycobacterium]	100	99.7	2.68e-243
CP007027.1_1092|1196284|1197120|1|ID=1_1092;partial=00;start_type=GTG;rbs_motif=GGAG/GAGG;rbs_spacer=5-10bp;gc_cont=0.628	WP_003405719.1 MULTISPECIES: Bax inhibitor-1/YccA family protein [Mycobacterium]	100	99.6	5.67e-184
CP007027.1_1093|1197236|1198087|1|ID=1_1093;partial=00;start_type=ATG;rbs_motif=None;rbs_spacer=None;gc_cont=0.623	WP_003405722.1 MULTISPECIES: hypothetical protein [Mycobacterium]	100	99.6	9.72e-208
CP007027.1_1094|1198161|1199378|-1|ID=1_1094;partial=00;start_type=ATG;rbs_motif=GGAG/GAGG;rbs_spacer=5-10bp;gc_cont=0.653	WP_003405724.1 MULTISPECIES: acetyl-CoA C-acetyltransferase [Mycobacterium]	100	99.8	1.39e-289
CP007027.1_1095|1199431|1200381|-1|ID=1_1095;partial=00;start_type=ATG;rbs_motif=None;rbs_spacer=None;gc_cont=0.687	WP_003405726.1 MULTISPECIES: SGNH/GDSL hydrolase family protein [Mycobacterium]	99.7	99.1	3.17e-220
CP007027.1_1096|1200598|1201665|1|ID=1_1096;partial=00;start_type=ATG;rbs_motif=AGGA;rbs_spacer=5-10bp;gc_cont=0.644	WP_003405728.1 MULTISPECIES: lipase LipU [Mycobacterium]	100	99.7	5.23e-246
CP007027.1_1097|1201722|1203116|1|ID=1_1097;partial=00;start_type=ATG;rbs_motif=GGA/GAG/AGG;rbs_spacer=11-12bp;gc_cont=0.664	WP_003405730.1 MULTISPECIES: cystathionine beta-synthase [Mycobacterium]	100	99.8	0.0
CP007027.1_1098|1203564|1204040|1|ID=1_1098;partial=00;start_type=ATG;rbs_motif=3Base/5BMM;rbs_spacer=13-15bp;gc_cont=0.595	WP_003900269.1 RDD family protein [Mycobacterium tuberculosis]	100	99.4	4.91e-112
CP007027.1_1099|1204072|1205238|1|ID=1_1099;partial=00;start_type=ATG;rbs_motif=None;rbs_spacer=None;gc_cont=0.648	WP_003405736.1 MULTISPECIES: cystathionine gamma-synthase [Mycobacterium]	100	99.7	1.58e-275
CP007027.1_1100|1205309|1205803|-1|ID=1_1100;partial=00;start_type=ATG;rbs_motif=AGGAG;rbs_spacer=5-10bp;gc_cont=0.632	WP_003405742.1 MULTISPECIES: transcription elongation factor GreA [Mycobacterium]	100	99.4	1.50e-109
CP007027.1_1101|1205989|1206423|-1|ID=1_1101;partial=00;start_type=ATG;rbs_motif=None;rbs_spacer=None;gc_cont=0.678	WP_003405744.1 MULTISPECIES: DUF4307 domain-containing protein [Mycobacterium]	100	99.3	6.38e-90
CP007027.1_1102|1206525|1207391|1|ID=1_1102;partial=00;start_type=GTG;rbs_motif=GGA/GAG/AGG;rbs_spacer=5-10bp;gc_cont=0.660	WP_003405746.1 MULTISPECIES: mycothiol conjugate amidase Mca [Mycobacterium]	100	99.7	2.61e-219
