CP064772.1_1|1|1362|1|ID=1_1;partial=10;start_type=Edge;rbs_motif=None;rbs_spacer=None;gc_cont=0.334	WP_374273756.1 terminase large subunit [Staphylococcus aureus]	100	99.8	0.0
CP064772.1_2|1367|2605|1|ID=1_2;partial=00;start_type=GTG;rbs_motif=None;rbs_spacer=None;gc_cont=0.321	WP_001100660.1 MULTISPECIES: phage portal protein [Staphylococcus]	100	99.8	9.96e-298
CP064772.1_3|2589|3362|1|ID=1_3;partial=00;start_type=ATG;rbs_motif=AGxAGG/AGGxGG;rbs_spacer=5-10bp;gc_cont=0.315	WP_000061872.1 MULTISPECIES: head maturation protease, ClpP-related [Bacillati]	100	99.6	8.72e-173
CP064772.1_4|3329|4537|1|ID=1_4;partial=00;start_type=ATG;rbs_motif=None;rbs_spacer=None;gc_cont=0.324	YP_010083315.1 major capsid protein [Staphylococcus phage LH1]	100	99.8	1.01e-285
CP064772.1_5|4606|4884|1|ID=1_5;partial=00;start_type=ATG;rbs_motif=GGA/GAG/AGG;rbs_spacer=5-10bp;gc_cont=0.312	WP_000050973.1 MULTISPECIES: head-tail connector protein [Bacteria]	100	98.9	1.80e-60
CP064772.1_6|4896|5228|1|ID=1_6;partial=00;start_type=ATG;rbs_motif=GGA/GAG/AGG;rbs_spacer=5-10bp;gc_cont=0.276	YP_239941.1 ORF036 [Staphylococcus phage 3A]	100	99.1	1.07e-74
CP064772.1_7|5225|5626|1|ID=1_7;partial=00;start_type=ATG;rbs_motif=None;rbs_spacer=None;gc_cont=0.328	YP_010083318.1 minor structural protein [Staphylococcus phage LH1]	100	99.3	7.43e-86
CP064772.1_8|5627|6022|1|ID=1_8;partial=00;start_type=ATG;rbs_motif=AGGA/GGAG/GAGG;rbs_spacer=11-12bp;gc_cont=0.265	WP_001023802.1 MULTISPECIES: DUF3168 domain-containing protein [Bacteria]	100	99.2	1.29e-85
CP064772.1_9|6057|6698|1|ID=1_9;partial=00;start_type=ATG;rbs_motif=AGGAG;rbs_spacer=5-10bp;gc_cont=0.363	WP_000807536.1 MULTISPECIES: major tail protein [Bacteria]	100	99.5	2.77e-154
CP064772.1_10|6790|7245|1|ID=1_10;partial=00;start_type=ATG;rbs_motif=AGGAG;rbs_spacer=5-10bp;gc_cont=0.366	WP_244777070.1 Ig-like domain-containing protein [Staphylococcus aureus]	100	99.3	1.32e-99
CP064772.1_11|7303|7653|1|ID=1_11;partial=00;start_type=ATG;rbs_motif=AGGAG;rbs_spacer=5-10bp;gc_cont=0.313	WP_000589165.1 MULTISPECIES: phage tail assembly chaperone G [Bacillati]	100	99.1	7.62e-71
CP064772.1_12|7695|7853|1|ID=1_12;partial=00;start_type=ATG;rbs_motif=None;rbs_spacer=None;gc_cont=0.321	WP_000438833.1 MULTISPECIES: hypothetical protein [Bacteria]	100	98.1	2.41e-27
CP064772.1_13|7867|14067|1|ID=1_13;partial=00;start_type=ATG;rbs_motif=AGGAG;rbs_spacer=5-10bp;gc_cont=0.363	WP_031836516.1 phage tail tape measure protein [Staphylococcus aureus]	100	100.0	0.0
CP064772.1_14|14067|14891|1|ID=1_14;partial=00;start_type=ATG;rbs_motif=AGGA/GGAG/GAGG;rbs_spacer=11-12bp;gc_cont=0.307	WP_001190533.1 MULTISPECIES: phage tail family protein [Bacteria]	100	99.6	6.06e-202
CP064772.1_15|14900|16483|1|ID=1_15;partial=00;start_type=ATG;rbs_motif=GGA/GAG/AGG;rbs_spacer=5-10bp;gc_cont=0.304	WP_000384474.1 MULTISPECIES: prophage endopeptidase tail family protein [Bacteria]	100	99.8	0.0
CP064772.1_16|16483|16773|1|ID=1_16;partial=00;start_type=ATG;rbs_motif=AGGA/GGAG/GAGG;rbs_spacer=11-12bp;gc_cont=0.351	WP_000179858.1 MULTISPECIES: hypothetical protein [Bacteria]	100	99.0	1.24e-62
CP064772.1_17|16789|18699|1|ID=1_17;partial=00;start_type=ATG;rbs_motif=AGGA;rbs_spacer=5-10bp;gc_cont=0.357	WP_000429558.1 MULTISPECIES: phage baseplate protein [Bacteria]	100	99.8	0.0
CP064772.1_18|18666|20165|1|ID=1_18;partial=00;start_type=ATG;rbs_motif=None;rbs_spacer=None;gc_cont=0.332	YP_002268022.1 BppU family baseplate upper protein [Staphylococcus phage phi2958PVL]	99.8	99.8	0.0
CP064772.1_19|20165|20554|1|ID=1_19;partial=00;start_type=ATG;rbs_motif=AGGAG;rbs_spacer=5-10bp;gc_cont=0.315	WP_001166599.1 MULTISPECIES: DUF2977 domain-containing protein [Bacteria]	100	99.2	1.41e-79
CP064772.1_20|20547|20711|1|ID=1_20;partial=00;start_type=ATG;rbs_motif=AGGAG;rbs_spacer=5-10bp;gc_cont=0.285	WP_000916020.1 MULTISPECIES: XkdX family protein [Bacteria]	100	98.2	4.19e-31
CP064772.1_21|20757|21056|1|ID=1_21;partial=00;start_type=ATG;rbs_motif=GGxGG;rbs_spacer=3-4bp;gc_cont=0.310	WP_061841742.1 DUF2951 family protein [Staphylococcus aureus]	93.9	99.0	1.43e-49
CP064772.1_22|21192|21494|1|ID=1_22;partial=00;start_type=ATG;rbs_motif=AGGAG;rbs_spacer=5-10bp;gc_cont=0.337	WP_000339141.1 MULTISPECIES: phage holin [Bacillati]	100	99.0	1.66e-62
CP064772.1_23|21505|22959|1|ID=1_23;partial=00;start_type=ATG;rbs_motif=GGA/GAG/AGG;rbs_spacer=5-10bp;gc_cont=0.347	WP_001649077.1 N-acetylmuramoyl-L-alanine amidase [Staphylococcus aureus]	100	99.8	0.0
CP064772.1_24|23681|23896|1|ID=1_24;partial=00;start_type=ATG;rbs_motif=None;rbs_spacer=None;gc_cont=0.338	WP_000209712.1 MULTISPECIES: hypothetical protein [Bacillati]	100	98.6	9.70e-42
CP064772.1_25|23986|24891|1|ID=1_25;partial=00;start_type=ATG;rbs_motif=None;rbs_spacer=None;gc_cont=0.312	WP_000476865.1 MULTISPECIES: DUF1672 domain-containing protein [Staphylococcus]	100	99.7	1.60e-206
CP064772.1_26|24949|25845|1|ID=1_26;partial=00;start_type=ATG;rbs_motif=GGAG/GAGG;rbs_spacer=5-10bp;gc_cont=0.301	WP_000476345.1 DUF1672 domain-containing protein [Staphylococcus aureus]	100	99.7	2.67e-208
CP064772.1_27|25921|26175|1|ID=1_27;partial=00;start_type=ATG;rbs_motif=None;rbs_spacer=None;gc_cont=0.275	WP_001557351.1 hypothetical protein [Staphylococcus aureus]	100	98.8	2.22e-55
CP064772.1_28|26316|27272|1|ID=1_28;partial=00;start_type=ATG;rbs_motif=None;rbs_spacer=None;gc_cont=0.308	WP_000913227.1 MULTISPECIES: DUF1672 domain-containing protein [Staphylococcus]	100	99.7	1.39e-220
CP064772.1_29|27674|28219|1|ID=1_29;partial=00;start_type=ATG;rbs_motif=AGGAG;rbs_spacer=5-10bp;gc_cont=0.326	WP_001186912.1 MULTISPECIES: ECF transporter S component [Staphylococcus]	100	99.5	1.14e-110
CP064772.1_30|28325|28573|-1|ID=1_30;partial=00;start_type=TTG;rbs_motif=AGGAG;rbs_spacer=5-10bp;gc_cont=0.390	WP_001151997.1 MULTISPECIES: ferredoxin [Staphylococcus]	100	98.8	3.74e-53
CP064772.1_31|28681|29634|1|ID=1_31;partial=00;start_type=TTG;rbs_motif=GGAG/GAGG;rbs_spacer=5-10bp;gc_cont=0.281	WP_001163801.1 MULTISPECIES: helix-turn-helix domain-containing protein [Staphylococcus]	100	99.7	2.08e-226
CP064772.1_32|29624|31003|1|ID=1_32;partial=00;start_type=ATG;rbs_motif=GGAG/GAGG;rbs_spacer=5-10bp;gc_cont=0.338	WP_000902099.1 MULTISPECIES: RecQ family ATP-dependent DNA helicase [Staphylococcus]	100	99.8	0.0
CP064772.1_33|31156|32616|1|ID=1_33;partial=00;start_type=ATG;rbs_motif=AGGA;rbs_spacer=5-10bp;gc_cont=0.367	WP_371092994.1 elastin-binding protein EbpS [Staphylococcus aureus]	97.1	99.8	5.22e-219
CP064772.1_35|33018|34004|1|ID=1_35;partial=00;start_type=ATG;rbs_motif=AGGAG;rbs_spacer=5-10bp;gc_cont=0.331	WP_001174258.1 MULTISPECIES: bacillithiol disulfide reductase YpdA [Staphylococcus]	100	99.7	2.67e-239
CP064772.1_36|34119|35087|-1|ID=1_36;partial=00;start_type=ATG;rbs_motif=AGGAG;rbs_spacer=5-10bp;gc_cont=0.348	WP_000681757.1 MULTISPECIES: asparaginase [Staphylococcus]	100	99.7	8.18e-231
CP064772.1_37|35164|35823|1|ID=1_37;partial=00;start_type=ATG;rbs_motif=GGA/GAG/AGG;rbs_spacer=5-10bp;gc_cont=0.347	WP_000644391.1 MULTISPECIES: (d)CMP kinase [Staphylococcus]	100	99.5	1.07e-145
CP064772.1_38|36535|37710|1|ID=1_38;partial=00;start_type=ATG;rbs_motif=AGGAG;rbs_spacer=5-10bp;gc_cont=0.338	WP_000133961.1 MULTISPECIES: 30S ribosomal protein S1 [Staphylococcus]	100	99.7	2.61e-271
CP064772.1_39|37932|39242|1|ID=1_39;partial=00;start_type=ATG;rbs_motif=GGAG/GAGG;rbs_spacer=5-10bp;gc_cont=0.352	WP_000165530.1 MULTISPECIES: ribosome biogenesis GTPase Der [Staphylococcus]	100	99.8	1.46e-309
CP064772.1_40|39259|40257|1|ID=1_40;partial=00;start_type=ATG;rbs_motif=GGA/GAG/AGG;rbs_spacer=5-10bp;gc_cont=0.343	WP_000161745.1 MULTISPECIES: NAD(P)H-dependent glycerol-3-phosphate dehydrogenase [Staphylococcus]	100	99.7	4.57e-233
CP064772.1_41|40428|40700|1|ID=1_41;partial=00;start_type=ATG;rbs_motif=AGGAGG;rbs_spacer=5-10bp;gc_cont=0.366	WP_001043863.1 MULTISPECIES: HU family DNA-binding protein [Staphylococcus]	100	98.9	6.91e-55
CP064772.1_42|41131|41703|1|ID=1_42;partial=00;start_type=ATG;rbs_motif=GGAG/GAGG;rbs_spacer=5-10bp;gc_cont=0.276	WP_000450555.1 MULTISPECIES: heptaprenyl diphosphate synthase component 1 [Staphylococcus]	100	99.5	3.41e-130
CP064772.1_43|41706|42431|1|ID=1_43;partial=00;start_type=ATG;rbs_motif=GGAG/GAGG;rbs_spacer=5-10bp;gc_cont=0.342	WP_000774684.1 MULTISPECIES: demethylmenaquinone methyltransferase [Staphylococcus]	100	99.6	2.54e-173
CP064772.1_44|42448|43392|1|ID=1_44;partial=00;start_type=ATG;rbs_motif=None;rbs_spacer=None;gc_cont=0.346	WP_001817755.1 polyprenyl synthetase family protein [Staphylococcus aureus]	100	99.7	3.66e-214
CP064772.1_45|43484|43933|1|ID=1_45;partial=00;start_type=GTG;rbs_motif=GGA/GAG/AGG;rbs_spacer=5-10bp;gc_cont=0.347	WP_000442480.1 MULTISPECIES: nucleoside-diphosphate kinase [Staphylococcus]	100	99.3	7.11e-103
CP064772.1_46|44142|44342|1|ID=1_46;partial=00;start_type=ATG;rbs_motif=GGA/GAG/AGG;rbs_spacer=5-10bp;gc_cont=0.209	WP_000789522.1 MULTISPECIES: hypothetical protein [Staphylococcus]	100	98.5	6.94e-33
CP064772.1_47|44728|45894|1|ID=1_47;partial=00;start_type=ATG;rbs_motif=AGGAG;rbs_spacer=5-10bp;gc_cont=0.353	WP_001269921.1 MULTISPECIES: chorismate synthase [Staphylococcus]	100	99.7	2.35e-277
CP064772.1_48|45920|46984|1|ID=1_48;partial=00;start_type=ATG;rbs_motif=GGAG/GAGG;rbs_spacer=5-10bp;gc_cont=0.326	WP_000776312.1 MULTISPECIES: 3-dehydroquinate synthase [Staphylococcus]	100	99.7	2.54e-257
CP064772.1_49|46994|48292|1|ID=1_49;partial=00;start_type=ATG;rbs_motif=GGA/GAG/AGG;rbs_spacer=5-10bp;gc_cont=0.343	WP_000253232.1 MULTISPECIES: 3-phosphoshikimate 1-carboxyvinyltransferase [Staphylococcus]	100	99.8	1.39e-305
CP064772.1_50|48299|49543|1|ID=1_50;partial=00;start_type=ATG;rbs_motif=GGA/GAG/AGG;rbs_spacer=5-10bp;gc_cont=0.309	WP_000389524.1 MULTISPECIES: tetratricopeptide repeat protein [Staphylococcus]	100	99.8	1.93e-296
CP064772.1_51|49545|50132|1|ID=1_51;partial=00;start_type=ATG;rbs_motif=None;rbs_spacer=None;gc_cont=0.306	WP_000005212.1 MULTISPECIES: YpiB family protein [Staphylococcus]	100	97.4	4.51e-132
CP064772.1_52|50122|50709|1|ID=1_52;partial=00;start_type=ATG;rbs_motif=GGAG/GAGG;rbs_spacer=5-10bp;gc_cont=0.289	WP_000154683.1 MULTISPECIES: DUF1405 domain-containing protein [Staphylococcus]	100	99.5	2.39e-137
CP064772.1_53|50763|51461|1|ID=1_53;partial=00;start_type=TTG;rbs_motif=AGGAG;rbs_spacer=5-10bp;gc_cont=0.366	WP_181427572.1 zinc metallopeptidase [Staphylococcus aureus]	99.6	99.6	3.27e-151
CP064772.1_54|51797|52114|1|ID=1_54;partial=00;start_type=ATG;rbs_motif=AGGAG;rbs_spacer=5-10bp;gc_cont=0.314	WP_000839926.1 MULTISPECIES: nucleotide pyrophosphohydrolase [Staphylococcus]	100	99.1	6.34e-67
CP064772.1_55|52358|53500|1|ID=1_55;partial=00;start_type=ATG;rbs_motif=AGGA/GGAG/GAGG;rbs_spacer=11-12bp;gc_cont=0.329	WP_000690025.1 MULTISPECIES: N-acetyl-alpha-D-glucosaminyl L-malate synthase BshA [Staphylococcus]	100	99.7	5.71e-274
CP064772.1_56|53505|54707|1|ID=1_56;partial=00;start_type=ATG;rbs_motif=GGA/GAG/AGG;rbs_spacer=5-10bp;gc_cont=0.318	WP_000361540.1 MULTISPECIES: CCA tRNA nucleotidyltransferase [Staphylococcus]	100	99.8	4.47e-288
CP064772.1_57|54694|55665|1|ID=1_57;partial=00;start_type=ATG;rbs_motif=GGA/GAG/AGG;rbs_spacer=5-10bp;gc_cont=0.305	WP_000049921.1 MULTISPECIES: biotin--[acetyl-CoA-carboxylase] ligase [Staphylococcus]	100	99.7	3.22e-233
CP064772.1_58|55689|58382|1|ID=1_58;partial=00;start_type=ATG;rbs_motif=AGGAG;rbs_spacer=5-10bp;gc_cont=0.300	WP_000525078.1 MULTISPECIES: ATP-dependent DNA helicase DinG [Staphylococcus]	100	99.9	0.0
CP064772.1_59|58704|59996|1|ID=1_59;partial=00;start_type=ATG;rbs_motif=AGGAG;rbs_spacer=5-10bp;gc_cont=0.357	WP_000858779.1 MULTISPECIES: asparagine--tRNA ligase [Staphylococcus]	100	99.8	0.0
CP064772.1_60|60324|61010|1|ID=1_60;partial=00;start_type=ATG;rbs_motif=GGA/GAG/AGG;rbs_spacer=5-10bp;gc_cont=0.306	WP_000362218.1 MULTISPECIES: DnaD domain-containing protein [Staphylococcus]	100	99.6	7.83e-157
CP064772.1_61|61000|61659|1|ID=1_61;partial=00;start_type=ATG;rbs_motif=GGAG/GAGG;rbs_spacer=5-10bp;gc_cont=0.344	WP_000253765.1 MULTISPECIES: endonuclease III [Staphylococcus]	100	99.5	4.08e-159
CP064772.1_62|61664|62005|1|ID=1_62;partial=00;start_type=ATG;rbs_motif=AGxAG;rbs_spacer=5-10bp;gc_cont=0.275	WP_000182021.1 MULTISPECIES: YpoC family protein [Staphylococcus]	100	99.1	1.33e-74
CP064772.1_63|62571|64754|-1|ID=1_63;partial=00;start_type=ATG;rbs_motif=GGAG/GAGG;rbs_spacer=5-10bp;gc_cont=0.355	WP_000138350.1 MULTISPECIES: transglycosylase domain-containing protein [Staphylococcus]	100	99.9	0.0
CP064772.1_64|64751|65428|-1|ID=1_64;partial=00;start_type=ATG;rbs_motif=None;rbs_spacer=None;gc_cont=0.319	WP_001795446.1 Holliday junction resolvase RecU [Staphylococcus aureus]	100	99.6	8.90e-166
CP064772.1_65|65866|66267|1|ID=1_65;partial=00;start_type=ATG;rbs_motif=GGA/GAG/AGG;rbs_spacer=5-10bp;gc_cont=0.299	WP_001000806.1 MULTISPECIES: YppE family protein [Staphylococcus]	100	86.6	4.05e-75
CP064772.1_66|66260|66823|1|ID=1_66;partial=00;start_type=ATG;rbs_motif=GGAG/GAGG;rbs_spacer=5-10bp;gc_cont=0.317	WP_000241308.1 MULTISPECIES: DUF1273 domain-containing protein [Staphylococcus]	100	99.5	7.21e-135
CP064772.1_67|66789|67181|1|ID=1_67;partial=00;start_type=ATG;rbs_motif=None;rbs_spacer=None;gc_cont=0.282	WP_001286320.1 MULTISPECIES: cell division regulator GpsB [Bacteria]	100	87.0	1.65e-66
CP064772.1_69|67832|68977|1|ID=1_69;partial=00;start_type=ATG;rbs_motif=AGGAG;rbs_spacer=5-10bp;gc_cont=0.357	WP_000487154.1 MULTISPECIES: THUMP domain-containing class I SAM-dependent RNA methyltransferase [Staphylococcus]	100	99.7	3.89e-277
CP064772.1_70|69061|69393|1|ID=1_70;partial=00;start_type=ATG;rbs_motif=AGGAG;rbs_spacer=5-10bp;gc_cont=0.294	WP_000516798.1 MULTISPECIES: DUF4889 domain-containing protein [Staphylococcus]	100	99.1	5.72e-70
CP064772.1_71|69599|70939|-1|ID=1_71;partial=00;start_type=ATG;rbs_motif=GGAG/GAGG;rbs_spacer=5-10bp;gc_cont=0.326	WP_000798987.1 MULTISPECIES: PepSY-associated TM helix domain-containing protein [Staphylococcus]	100	99.8	0.0
CP064772.1_72|71243|74683|1|ID=1_72;partial=00;start_type=ATG;rbs_motif=GGA/GAG/AGG;rbs_spacer=5-10bp;gc_cont=0.304	WP_000608509.1 MULTISPECIES: dynamin family protein [Staphylococcus]	100	99.9	0.0
CP064772.1_73|74703|75581|1|ID=1_73;partial=00;start_type=ATG;rbs_motif=AGGA;rbs_spacer=5-10bp;gc_cont=0.323	WP_001133021.1 MULTISPECIES: 5'-3' exonuclease [Staphylococcus]	100	99.7	1.56e-213
CP064772.1_74|76057|77175|1|ID=1_74;partial=00;start_type=ATG;rbs_motif=AGGAG;rbs_spacer=5-10bp;gc_cont=0.355	WP_000959424.1 MULTISPECIES: alanine dehydrogenase [Staphylococcus]	100	99.7	2.89e-263
CP064772.1_75|77270|78310|1|ID=1_75;partial=00;start_type=ATG;rbs_motif=AGGA;rbs_spacer=5-10bp;gc_cont=0.351	WP_000210817.1 MULTISPECIES: bifunctional threonine ammonia-lyase/L-serine ammonia-lyase TdcB [Staphylococcus]	100	99.7	1.18e-242
CP064772.1_76|78341|79663|1|ID=1_76;partial=00;start_type=ATG;rbs_motif=GGAG/GAGG;rbs_spacer=5-10bp;gc_cont=0.342	WP_000064778.1 MULTISPECIES: APC family permease [Staphylococcus]	100	99.8	2.90e-302
CP064772.1_77|79690|81210|1|ID=1_77;partial=00;start_type=ATG;rbs_motif=GGA/GAG/AGG;rbs_spacer=5-10bp;gc_cont=0.325	WP_000414695.1 MULTISPECIES: multidrug efflux MFS transporter NorB [Staphylococcus]	100	91.3	2.21e-306
CP064772.1_78|81608|84871|1|ID=1_78;partial=00;start_type=GTG;rbs_motif=AGGA/GGAG/GAGG;rbs_spacer=11-12bp;gc_cont=0.350	WP_031770895.1 hyperosmolarity resistance protein Ebh [Staphylococcus aureus]	100	99.8	0.0
CP064772.1_79|84868|112719|1|ID=1_79;partial=00;start_type=ATG;rbs_motif=None;rbs_spacer=None;gc_cont=0.361	WP_031865373.1 hyperosmolarity resistance protein Ebh [Staphylococcus aureus]	100.0	100.0	0.0
CP064772.1_80|112846|113466|1|ID=1_80;partial=00;start_type=ATG;rbs_motif=None;rbs_spacer=None;gc_cont=0.325	WP_142386228.1 DUF1542 domain-containing protein, partial [Staphylococcus aureus]	100	83.6	1.18e-54
CP064772.1_81|113525|113926|-1|ID=1_81;partial=00;start_type=ATG;rbs_motif=GGA/GAG/AGG;rbs_spacer=5-10bp;gc_cont=0.323	WP_001062946.1 MULTISPECIES: ribonuclease HI family protein [Staphylococcus]	100	99.3	7.15e-93
CP064772.1_82|114525|115229|-1|ID=1_82;partial=00;start_type=ATG;rbs_motif=AGGAGG;rbs_spacer=5-10bp;gc_cont=0.304	WP_000282171.1 MULTISPECIES: queuosine precursor transporter [Staphylococcus]	100	99.6	2.80e-153
CP064772.1_83|115680|115931|1|ID=1_83;partial=00;start_type=ATG;rbs_motif=AGGAG;rbs_spacer=5-10bp;gc_cont=0.329	WP_000691942.1 MULTISPECIES: NifU N-terminal domain-containing protein [Staphylococcus]	100	98.8	3.19e-50
CP064772.1_84|115969|117093|1|ID=1_84;partial=00;start_type=ATG;rbs_motif=GGA/GAG/AGG;rbs_spacer=5-10bp;gc_cont=0.348	WP_122008540.1 virulence factor [Staphylococcus aureus]	99.5	99.7	4.27e-211
CP064772.1_85|117109|117546|1|ID=1_85;partial=00;start_type=ATG;rbs_motif=GGAG/GAGG;rbs_spacer=5-10bp;gc_cont=0.370	WP_000995287.1 MULTISPECIES: bacilliredoxin BrxA [Staphylococcus]	100	99.3	1.63e-97
CP064772.1_86|117970|118926|1|ID=1_86;partial=00;start_type=ATG;rbs_motif=AGGA/GGAG/GAGG;rbs_spacer=11-12bp;gc_cont=0.336	WP_000934894.1 MULTISPECIES: thymidylate synthase [Staphylococcus]	100	99.7	3.50e-239
CP064772.1_87|119126|119605|1|ID=1_87;partial=00;start_type=ATG;rbs_motif=AGGAG;rbs_spacer=5-10bp;gc_cont=0.344	WP_000175746.1 MULTISPECIES: dihydrofolate reductase [Staphylococcus]	100	99.4	2.33e-115
CP064772.1_88|119620|120459|1|ID=1_88;partial=00;start_type=ATG;rbs_motif=GGA/GAG/AGG;rbs_spacer=5-10bp;gc_cont=0.317	WP_000166059.1 MULTISPECIES: fatty acid kinase binding subunit FakB2 [Staphylococcus]	100	99.6	2.08e-191
CP064772.1_89|120545|121078|1|ID=1_89;partial=00;start_type=ATG;rbs_motif=AGGAG;rbs_spacer=5-10bp;gc_cont=0.356	WP_000159900.1 MULTISPECIES: peptide-methionine (S)-S-oxide reductase MsrA [Staphylococcus]	100	99.4	1.08e-131
CP064772.1_90|121071|121499|1|ID=1_90;partial=00;start_type=ATG;rbs_motif=GGA/GAG/AGG;rbs_spacer=5-10bp;gc_cont=0.322	WP_000913317.1 MULTISPECIES: peptide-methionine (R)-S-oxide reductase MsrB [Staphylococcus]	100	99.3	8.46e-103
CP064772.1_91|121511|122011|1|ID=1_91;partial=00;start_type=ATG;rbs_motif=AGGAG;rbs_spacer=5-10bp;gc_cont=0.339	WP_000473653.1 MULTISPECIES: PTS sugar transporter subunit IIA [Staphylococcus]	100	99.4	7.71e-113
CP064772.1_92|122011|122232|1|ID=1_92;partial=00;start_type=ATG;rbs_motif=None;rbs_spacer=None;gc_cont=0.338	WP_000801007.1 MULTISPECIES: YozE family protein [Staphylococcus]	100	98.6	1.51e-48
CP064772.1_93|122424|123914|1|ID=1_93;partial=00;start_type=ATG;rbs_motif=AGGA;rbs_spacer=5-10bp;gc_cont=0.313	WP_000342132.1 MULTISPECIES: S41 family peptidase [Staphylococcus]	100	99.8	0.0
CP064772.1_94|124314|124823|1|ID=1_94;partial=00;start_type=ATG;rbs_motif=AGGAG;rbs_spacer=5-10bp;gc_cont=0.337	WP_000620194.1 MULTISPECIES: GNAT family N-acetyltransferase [Staphylococcus]	100	99.4	4.63e-120
CP064772.1_95|124835|125905|1|ID=1_95;partial=00;start_type=ATG;rbs_motif=GGAG/GAGG;rbs_spacer=5-10bp;gc_cont=0.298	WP_000160906.1 MULTISPECIES: undecaprenyldiphospho-muramoylpentapeptide beta-N-acetylglucosaminyltransferase [Staphylococcus]	100	99.7	2.40e-247
CP064772.1_96|125922|126536|1|ID=1_96;partial=00;start_type=ATG;rbs_motif=None;rbs_spacer=None;gc_cont=0.324	WP_000084769.1 MULTISPECIES: phosphatase PAP2 family protein [Staphylococcus]	100	99.5	6.77e-137
CP064772.1_97|126681|126854|1|ID=1_97;partial=00;start_type=GTG;rbs_motif=None;rbs_spacer=None;gc_cont=0.253	WP_086039606.1 hypothetical protein, partial [Staphylococcus aureus]	100	96.6	7.83e-35
CP064772.1_98|127325|127984|1|ID=1_98;partial=00;start_type=ATG;rbs_motif=GGAG/GAGG;rbs_spacer=5-10bp;gc_cont=0.332	WP_000192137.1 MULTISPECIES: response regulator transcription factor ArlR [Staphylococcus]	100	99.5	4.39e-154
CP064772.1_99|127981|129336|1|ID=1_99;partial=00;start_type=ATG;rbs_motif=None;rbs_spacer=None;gc_cont=0.292	WP_000166801.1 MULTISPECIES: sensor histidine kinase ArlS [Staphylococcus]	100	99.8	2.09e-312
CP064772.1_100|129620|132418|1|ID=1_100;partial=00;start_type=ATG;rbs_motif=GGAG/GAGG;rbs_spacer=5-10bp;gc_cont=0.359	WP_000180673.1 MULTISPECIES: 2-oxoglutarate dehydrogenase E1 component [Staphylococcus]	100	99.9	0.0
CP064772.1_101|132432|133700|1|ID=1_101;partial=00;start_type=ATG;rbs_motif=GGA/GAG/AGG;rbs_spacer=5-10bp;gc_cont=0.342	WP_374751230.1 dihydrolipoyllysine-residue succinyltransferase [Staphylococcus aureus]	99.8	99.8	3.64e-257
CP064772.1_102|134226|135089|1|ID=1_102;partial=00;start_type=ATG;rbs_motif=None;rbs_spacer=None;gc_cont=0.340	WP_164784540.1 VOC family protein [Staphylococcus aureus]	100	93.4	6.75e-193
CP064772.1_103|135118|135321|1|ID=1_103;partial=00;start_type=ATG;rbs_motif=GGAG/GAGG;rbs_spacer=5-10bp;gc_cont=0.294	WP_000902175.1 MULTISPECIES: DUF6501 family protein [Bacillales]	100	98.5	4.25e-41
CP064772.1_104|135502|136293|1|ID=1_104;partial=00;start_type=ATG;rbs_motif=AGGA/GGAG/GAGG;rbs_spacer=11-12bp;gc_cont=0.318	WP_001185421.1 MULTISPECIES: ATP-binding protein [Staphylococcus]	100	99.6	1.20e-182
CP064772.1_105|136307|138193|1|ID=1_105;partial=00;start_type=ATG;rbs_motif=GGAG/GAGG;rbs_spacer=5-10bp;gc_cont=0.317	WP_117625283.1 nitric oxide reductase activation protein NorD [Staphylococcus aureus]	99.8	99.8	0.0
CP064772.1_106|138418|139761|1|ID=1_106;partial=00;start_type=ATG;rbs_motif=AGGAG;rbs_spacer=5-10bp;gc_cont=0.322	WP_001039273.1 MULTISPECIES: branched-chain amino acid-like transporter carrier protein BrnQ3 [Staphylococcus]	100	99.8	1.43e-301
CP064772.1_107|139834|140970|-1|ID=1_107;partial=00;start_type=ATG;rbs_motif=GGAG/GAGG;rbs_spacer=5-10bp;gc_cont=0.326	WP_000138413.1 MULTISPECIES: toxic anion resistance protein [Staphylococcus]	100	99.7	2.67e-246
CP064772.1_108|141002|141631|-1|ID=1_108;partial=00;start_type=ATG;rbs_motif=None;rbs_spacer=None;gc_cont=0.302	WP_001788788.1 MULTISPECIES: 5-bromo-4-chloroindolyl phosphate hydrolysis family protein [Staphylococcus]	100	99.5	1.47e-138
CP064772.1_109|141650|141919|-1|ID=1_109;partial=00;start_type=ATG;rbs_motif=GGAG/GAGG;rbs_spacer=5-10bp;gc_cont=0.356	WP_001215907.1 MULTISPECIES: acylphosphatase [Staphylococcus]	100	98.9	1.35e-56
CP064772.1_110|142082|142390|1|ID=1_110;partial=00;start_type=ATG;rbs_motif=GGA/GAG/AGG;rbs_spacer=11-12bp;gc_cont=0.275	WP_000269923.1 MULTISPECIES: regulatory protein MsaA [Bacilli]	100	99.0	1.45e-75
CP064772.1_111|142561|142761|1|ID=1_111;partial=00;start_type=ATG;rbs_motif=GGAG/GAGG;rbs_spacer=5-10bp;gc_cont=0.378	WP_000809131.1 MULTISPECIES: cold shock protein CspA [Staphylococcus]	100	98.5	1.14e-40
CP064772.1_112|142958|143359|1|ID=1_112;partial=00;start_type=ATG;rbs_motif=GGAG/GAGG;rbs_spacer=5-10bp;gc_cont=0.221	WP_000876201.1 MULTISPECIES: sarA expression modulator MsaC [Staphylococcus]	100	99.3	1.55e-78
CP064772.1_113|143599|144864|-1|ID=1_113;partial=00;start_type=ATG;rbs_motif=AGGAG;rbs_spacer=5-10bp;gc_cont=0.336	WP_000216946.1 MULTISPECIES: diaminopimelate decarboxylase [Staphylococcus]	100	99.8	1.09e-301
CP064772.1_114|144854|145939|-1|ID=1_114;partial=00;start_type=TTG;rbs_motif=GGAG/GAGG;rbs_spacer=5-10bp;gc_cont=0.338	WP_000127595.1 MULTISPECIES: alanine racemase [Staphylococcus]	100	99.7	5.19e-265
CP064772.1_115|145944|147095|-1|ID=1_115;partial=00;start_type=ATG;rbs_motif=AGGA;rbs_spacer=5-10bp;gc_cont=0.347	WP_001003789.1 MULTISPECIES: amidohydrolase [Staphylococcus]	100	99.7	2.10e-282
CP064772.1_116|147238|147957|-1|ID=1_116;partial=00;start_type=ATG;rbs_motif=AGGA/GGAG/GAGG;rbs_spacer=11-12bp;gc_cont=0.381	WP_371093623.1 2,3,4,5-tetrahydropyridine-2,6-dicarboxylate N-acetyltransferase [Staphylococcus aureus]	99.2	99.6	9.78e-129
CP064772.1_117|147984|148706|-1|ID=1_117;partial=00;start_type=GTG;rbs_motif=None;rbs_spacer=None;gc_cont=0.361	WP_000698228.1 MULTISPECIES: 4-hydroxy-tetrahydrodipicolinate reductase [Staphylococcus]	100	99.6	1.85e-170
CP064772.1_118|148703|149590|-1|ID=1_118;partial=00;start_type=ATG;rbs_motif=AGGAG;rbs_spacer=5-10bp;gc_cont=0.356	WP_000149278.1 MULTISPECIES: 4-hydroxy-tetrahydrodipicolinate synthase [Staphylococcus]	100	99.7	5.81e-206
CP064772.1_119|149592|150581|-1|ID=1_119;partial=00;start_type=ATG;rbs_motif=GGAG/GAGG;rbs_spacer=5-10bp;gc_cont=0.360	WP_000163523.1 MULTISPECIES: aspartate-semialdehyde dehydrogenase [Staphylococcus]	100	99.7	3.77e-235
CP064772.1_120|150645|151850|-1|ID=1_120;partial=00;start_type=ATG;rbs_motif=AGGAG;rbs_spacer=5-10bp;gc_cont=0.347	WP_000258718.1 MULTISPECIES: aspartate kinase [Staphylococcus]	100	99.8	1.22e-281
CP064772.1_121|152911|154512|-1|ID=1_121;partial=00;start_type=ATG;rbs_motif=AGGAG;rbs_spacer=5-10bp;gc_cont=0.333	WP_000942303.1 MULTISPECIES: ABC-F family ATP-binding cassette domain-containing protein [Staphylococcus]	100	99.8	0.0
CP064772.1_122|154659|155561|1|ID=1_122;partial=00;start_type=ATG;rbs_motif=AGGAG;rbs_spacer=5-10bp;gc_cont=0.350	WP_001162352.1 MULTISPECIES: RNA-binding virulence regulatory protein CvfB [Staphylococcus]	100	99.7	9.05e-217
CP064772.1_123|155697|155993|-1|ID=1_123;partial=00;start_type=TTG;rbs_motif=None;rbs_spacer=None;gc_cont=0.286	WP_142997157.1 transposase, partial [Staphylococcus aureus]	99.0	99.0	3.73e-61
CP064772.1_124|156536|157519|1|ID=1_124;partial=00;start_type=ATG;rbs_motif=GGAG/GAGG;rbs_spacer=5-10bp;gc_cont=0.320	WP_031887943.1 phosphate ABC transporter substrate-binding protein PstS [Staphylococcus aureus]	100	96.3	6.37e-218
CP064772.1_125|157710|158636|1|ID=1_125;partial=00;start_type=ATG;rbs_motif=GGAG/GAGG;rbs_spacer=5-10bp;gc_cont=0.357	WP_000204619.1 MULTISPECIES: phosphate ABC transporter permease subunit PstC [Staphylococcus]	100	99.7	1.56e-196
CP064772.1_126|158638|159555|1|ID=1_126;partial=00;start_type=ATG;rbs_motif=AGGAG;rbs_spacer=5-10bp;gc_cont=0.354	WP_000450297.1 MULTISPECIES: phosphate ABC transporter permease PstA [Staphylococcus]	100	99.7	2.61e-198
CP064772.1_127|159509|160453|1|ID=1_127;partial=00;start_type=ATG;rbs_motif=None;rbs_spacer=None;gc_cont=0.313	WP_000079447.1 MULTISPECIES: phosphate ABC transporter ATP-binding protein PstB [Staphylococcus]	100	89.8	3.65e-202
