CP064772.1_616|685711|686094|-1|ID=1_616;partial=00;start_type=ATG;rbs_motif=AGGAG;rbs_spacer=5-10bp;gc_cont=0.328	WP_000188643.1 MULTISPECIES: hypothetical protein [Bacteria]	100	99.2	1.42e-87
CP064772.1_617|686106|686453|-1|ID=1_617;partial=00;start_type=ATG;rbs_motif=GGAG/GAGG;rbs_spacer=5-10bp;gc_cont=0.348	WP_001017815.1 MULTISPECIES: HK97-gp10 family putative phage morphogenesis protein [Bacteria]	100	99.1	5.59e-77
CP064772.1_618|686453|686755|-1|ID=1_618;partial=00;start_type=TTG;rbs_motif=GGA/GAG/AGG;rbs_spacer=11-12bp;gc_cont=0.337	YP_010079461.1 Holliday junction branch migration helicase [Staphylococcus phage Baq_Sau1]	100	99.0	2.98e-65
CP064772.1_619|686752|687084|-1|ID=1_619;partial=00;start_type=ATG;rbs_motif=GGA/GAG/AGG;rbs_spacer=5-10bp;gc_cont=0.354	WP_000208960.1 MULTISPECIES: phage head-tail connector protein [Bacteria]	100	99.1	3.32e-69
CP064772.1_620|687093|687380|-1|ID=1_620;partial=00;start_type=ATG;rbs_motif=AGGAG;rbs_spacer=5-10bp;gc_cont=0.340	WP_001114086.1 MULTISPECIES: hypothetical protein [Bacteria]	100	99.0	1.85e-59
CP064772.1_621|687402|688376|-1|ID=1_621;partial=00;start_type=ATG;rbs_motif=GGAG/GAGG;rbs_spacer=5-10bp;gc_cont=0.348	WP_000438511.1 MULTISPECIES: phage major capsid protein [Bacteria]	100	99.7	1.16e-231
CP064772.1_622|688390|689010|-1|ID=1_622;partial=00;start_type=ATG;rbs_motif=GGAG/GAGG;rbs_spacer=5-10bp;gc_cont=0.348	WP_000392151.1 MULTISPECIES: DUF4355 domain-containing protein [Staphylococcus]	100	99.5	1.47e-116
CP064772.1_623|689119|689289|-1|ID=1_623;partial=00;start_type=ATG;rbs_motif=GGAG/GAGG;rbs_spacer=5-10bp;gc_cont=0.351	WP_000072208.1 MULTISPECIES: hypothetical protein [Bacteria]	100	98.2	2.79e-30
CP064772.1_624|689362|690357|-1|ID=1_624;partial=00;start_type=TTG;rbs_motif=AGGA;rbs_spacer=5-10bp;gc_cont=0.346	WP_001133044.1 MULTISPECIES: minor capsid protein [Bacteria]	100	99.7	1.72e-232
CP064772.1_625|690364|691902|-1|ID=1_625;partial=00;start_type=ATG;rbs_motif=AGGAG;rbs_spacer=5-10bp;gc_cont=0.333	WP_000909970.1 MULTISPECIES: phage portal protein [Bacteria]	100	99.8	0.0
CP064772.1_626|691913|693208|-1|ID=1_626;partial=00;start_type=ATG;rbs_motif=GGA/GAG/AGG;rbs_spacer=11-12bp;gc_cont=0.337	WP_000273011.1 MULTISPECIES: PBSX family phage terminase large subunit [Bacteria]	100	99.8	0.0
CP064772.1_627|693211|693780|-1|ID=1_627;partial=00;start_type=GTG;rbs_motif=AGGA;rbs_spacer=5-10bp;gc_cont=0.368	YP_001949839.1 putative terminase small subunit [Staphylococcus phage phiMR25]	100	99.5	1.63e-132
CP064772.1_628|693893|694315|-1|ID=1_628;partial=00;start_type=ATG;rbs_motif=GGAG/GAGG;rbs_spacer=5-10bp;gc_cont=0.324	WP_000162701.1 MULTISPECIES: RinA family phage transcriptional activator [Staphylococcus]	100	99.3	3.75e-96
CP064772.1_629|694486|694662|-1|ID=1_629;partial=00;start_type=ATG;rbs_motif=GGAG/GAGG;rbs_spacer=5-10bp;gc_cont=0.395	WP_000595257.1 MULTISPECIES: transcriptional activator RinB [Bacteria]	100	96.6	7.36e-29
CP064772.1_630|694652|694888|-1|ID=1_630;partial=00;start_type=ATG;rbs_motif=AGGAG;rbs_spacer=5-10bp;gc_cont=0.274	WP_000608278.1 MULTISPECIES: DUF7366 family protein [Bacteria]	100	98.7	7.24e-47
CP064772.1_631|694881|695084|-1|ID=1_631;partial=00;start_type=ATG;rbs_motif=AGGAG;rbs_spacer=5-10bp;gc_cont=0.299	YP_239635.1 ORF071 [Staphylococcus phage 69]	100	98.5	1.22e-40
CP064772.1_632|695081|695275|-1|ID=1_632;partial=00;start_type=ATG;rbs_motif=GGAG/GAGG;rbs_spacer=5-10bp;gc_cont=0.292	WP_000132921.1 MULTISPECIES: hypothetical protein [Bacteria]	100	98.5	3.90e-38
CP064772.1_633|695272|695478|-1|ID=1_633;partial=00;start_type=ATG;rbs_motif=AGGAGG;rbs_spacer=5-10bp;gc_cont=0.372	WP_000617154.1 MULTISPECIES: DUF1381 domain-containing protein [Bacteria]	100	98.6	1.79e-38
CP064772.1_634|695515|696048|-1|ID=1_634;partial=00;start_type=ATG;rbs_motif=GGAG/GAGG;rbs_spacer=5-10bp;gc_cont=0.395	WP_000185647.1 MULTISPECIES: dUTP diphosphatase [Staphylococcus]	100	99.4	9.21e-124
CP064772.1_635|696041|696211|-1|ID=1_635;partial=00;start_type=ATG;rbs_motif=AGGAG;rbs_spacer=5-10bp;gc_cont=0.363	WP_000714412.1 MULTISPECIES: hypothetical protein [Staphylococcus]	100	98.2	4.80e-31
CP064772.1_636|696198|696452|-1|ID=1_636;partial=00;start_type=ATG;rbs_motif=GGAG/GAGG;rbs_spacer=5-10bp;gc_cont=0.376	WP_001065060.1 MULTISPECIES: type II toxin-antitoxin system toxin HigB [Staphylococcus]	100	98.8	2.33e-48
CP064772.1_637|696445|696816|-1|ID=1_637;partial=00;start_type=ATG;rbs_motif=GGAG/GAGG;rbs_spacer=5-10bp;gc_cont=0.395	YP_010083230.1 acetyltransferase [Staphylococcus phage vB_SauS_fPfSau02]	100	99.2	1.05e-78
CP064772.1_638|696825|697067|-1|ID=1_638;partial=00;start_type=ATG;rbs_motif=AGxAG;rbs_spacer=5-10bp;gc_cont=0.362	WP_000131376.1 MULTISPECIES: SAV1978 family virulence-associated passenger protein [Staphylococcus]	100	98.8	1.32e-52
CP064772.1_639|697071|697427|-1|ID=1_639;partial=00;start_type=ATG;rbs_motif=GGAG/GAGG;rbs_spacer=5-10bp;gc_cont=0.395	WP_000029376.1 MULTISPECIES: SA1788 family PVL leukocidin-associated protein [Bacteria]	100	99.2	5.97e-78
CP064772.1_640|697555|697860|-1|ID=1_640;partial=00;start_type=ATG;rbs_motif=GGAG/GAGG;rbs_spacer=5-10bp;gc_cont=0.386	YP_239626.1 ORF047 [Staphylococcus phage 69]	100	99.0	2.17e-63
CP064772.1_641|697861|698046|-1|ID=1_641;partial=00;start_type=ATG;rbs_motif=None;rbs_spacer=None;gc_cont=0.306	WP_001187243.1 MULTISPECIES: DUF3113 family protein [Staphylococcus]	100	98.4	3.59e-35
CP064772.1_642|698051|698455|-1|ID=1_642;partial=00;start_type=ATG;rbs_motif=GGAG/GAGG;rbs_spacer=5-10bp;gc_cont=0.351	WP_000049794.1 MULTISPECIES: DUF1064 domain-containing protein [Bacteria]	100	99.3	1.56e-92
CP064772.1_643|698465|698686|-1|ID=1_643;partial=00;start_type=ATG;rbs_motif=AGGAG;rbs_spacer=5-10bp;gc_cont=0.365	WP_001123695.1 MULTISPECIES: DUF3269 family protein [Bacteria]	100	98.6	1.20e-45
CP064772.1_644|698699|698857|-1|ID=1_644;partial=00;start_type=ATG;rbs_motif=GGAG/GAGG;rbs_spacer=5-10bp;gc_cont=0.384	YP_008320219.1 transcriptional regulator [Staphylococcus phage SA13]	100	98.1	2.49e-29
CP064772.1_645|698851|699630|-1|ID=1_645;partial=00;start_type=ATG;rbs_motif=GGA/GAG/AGG;rbs_spacer=5-10bp;gc_cont=0.354	WP_000803062.1 MULTISPECIES: ATP-binding protein [Bacillales]	100	99.6	3.34e-187
CP064772.1_646|699640|700410|-1|ID=1_646;partial=00;start_type=ATG;rbs_motif=AGGAG;rbs_spacer=5-10bp;gc_cont=0.335	WP_000190254.1 MULTISPECIES: conserved phage C-terminal domain-containing protein [Staphylococcus]	100	99.6	5.98e-159
CP064772.1_647|700491|700757|1|ID=1_647;partial=00;start_type=ATG;rbs_motif=GGA/GAG/AGG;rbs_spacer=5-10bp;gc_cont=0.285	WP_001817995.1 hypothetical protein [Staphylococcus aureus]	100	98.9	5.50e-60
CP064772.1_648|700750|700899|-1|ID=1_648;partial=00;start_type=ATG;rbs_motif=AGGAG;rbs_spacer=5-10bp;gc_cont=0.300	WP_001081076.1 MULTISPECIES: hypothetical protein [Bacilli]	100	98.0	1.52e-22
CP064772.1_649|700896|701570|-1|ID=1_649;partial=00;start_type=ATG;rbs_motif=GGA/GAG/AGG;rbs_spacer=5-10bp;gc_cont=0.384	WP_001124438.1 MULTISPECIES: putative HNHc nuclease [Staphylococcus]	100	99.6	3.92e-164
CP064772.1_650|701584|702012|-1|ID=1_650;partial=00;start_type=ATG;rbs_motif=AGGAG;rbs_spacer=5-10bp;gc_cont=0.394	WP_000934385.1 MULTISPECIES: single-stranded DNA-binding protein [Staphylococcus]	100	99.3	1.45e-85
CP064772.1_651|702012|702635|-1|ID=1_651;partial=00;start_type=ATG;rbs_motif=AGGAG;rbs_spacer=5-10bp;gc_cont=0.356	WP_000139720.1 MULTISPECIES: Sak single strand annealing protein [Bacteria]	100	99.5	4.97e-145
CP064772.1_652|702628|702849|-1|ID=1_652;partial=00;start_type=ATG;rbs_motif=AGGAG;rbs_spacer=5-10bp;gc_cont=0.351	WP_000815401.1 MULTISPECIES: DUF2483 family protein [Bacteria]	100	98.6	2.84e-44
CP064772.1_653|702859|703119|-1|ID=1_653;partial=00;start_type=ATG;rbs_motif=AGGAG;rbs_spacer=5-10bp;gc_cont=0.330	WP_000291090.1 MULTISPECIES: DUF1108 family protein [Bacteria]	100	98.9	6.29e-56
CP064772.1_654|703124|703426|-1|ID=1_654;partial=00;start_type=ATG;rbs_motif=AGGAG;rbs_spacer=5-10bp;gc_cont=0.323	WP_000165363.1 MULTISPECIES: DUF2482 family protein [Staphylococcus]	100	99.0	3.35e-62
CP064772.1_655|703674|703895|-1|ID=1_655;partial=00;start_type=ATG;rbs_motif=AGGAG;rbs_spacer=5-10bp;gc_cont=0.338	NP_803263.1 phi PV83 orf 12-like protein [Staphylococcus phage phi 11]	100	98.6	1.31e-40
CP064772.1_656|703909|704358|-1|ID=1_656;partial=00;start_type=ATG;rbs_motif=AGGAG;rbs_spacer=5-10bp;gc_cont=0.369	WP_001094943.1 MULTISPECIES: hypothetical protein [Staphylococcus]	100	99.3	4.81e-101
CP064772.1_657|704398|704622|-1|ID=1_657;partial=00;start_type=ATG;rbs_motif=GGAG/GAGG;rbs_spacer=5-10bp;gc_cont=0.356	WP_000187184.1 MULTISPECIES: type II toxin-antitoxin system antitoxin TscA [Bacteria]	100	98.7	1.06e-44
CP064772.1_658|704623|705390|-1|ID=1_658;partial=00;start_type=ATG;rbs_motif=GGAG/GAGG;rbs_spacer=5-10bp;gc_cont=0.353	WP_001002757.1 MULTISPECIES: phage antirepressor Ant [Staphylococcus]	100	99.6	7.56e-182
CP064772.1_659|705390|705704|-1|ID=1_659;partial=00;start_type=ATG;rbs_motif=None;rbs_spacer=None;gc_cont=0.314	WP_000108122.1 MULTISPECIES: helix-turn-helix domain-containing protein [Staphylococcus]	100	61.0	7.53e-33
CP064772.1_660|705847|706179|1|ID=1_660;partial=00;start_type=ATG;rbs_motif=AGGAG;rbs_spacer=5-10bp;gc_cont=0.348	WP_001055143.1 MULTISPECIES: helix-turn-helix domain-containing protein [Staphylococcus]	100	99.1	1.25e-73
CP064772.1_661|706196|706870|1|ID=1_661;partial=00;start_type=TTG;rbs_motif=GGA/GAG/AGG;rbs_spacer=5-10bp;gc_cont=0.270	WP_000775187.1 MULTISPECIES: ImmA/IrrE family metallo-endopeptidase [Staphylococcus]	100	99.6	2.97e-159
CP064772.1_662|706898|707623|1|ID=1_662;partial=00;start_type=ATG;rbs_motif=AGGAG;rbs_spacer=5-10bp;gc_cont=0.282	WP_000661437.1 MULTISPECIES: PH domain-containing protein [Staphylococcus]	100	99.6	3.14e-158
CP064772.1_663|707655|708587|1|ID=1_663;partial=00;start_type=ATG;rbs_motif=AGGAG;rbs_spacer=5-10bp;gc_cont=0.290	WP_000392186.1 MULTISPECIES: hypothetical protein [Staphylococcus]	100	99.7	4.32e-220
CP064772.1_664|708567|708746|-1|ID=1_664;partial=00;start_type=ATG;rbs_motif=GGA/GAG/AGG;rbs_spacer=5-10bp;gc_cont=0.250	YP_010079482.1 excisionase [Staphylococcus phage Baq_Sau1]	100	98.3	1.75e-32
CP064772.1_665|708859|709908|1|ID=1_665;partial=00;start_type=ATG;rbs_motif=AGGAGG;rbs_spacer=5-10bp;gc_cont=0.325	WP_001145726.1 MULTISPECIES: site-specific integrase [Staphylococcus]	100	99.7	4.05e-256
CP064772.1_666|709976|711373|-1|ID=1_666;partial=00;start_type=ATG;rbs_motif=AGGAG;rbs_spacer=5-10bp;gc_cont=0.343	WP_001074405.1 MULTISPECIES: Fe-S cluster assembly protein SufB [Staphylococcus]	100	99.8	0.0
CP064772.1_667|711524|711988|-1|ID=1_667;partial=00;start_type=ATG;rbs_motif=AGGAG;rbs_spacer=5-10bp;gc_cont=0.361	WP_001010508.1 MULTISPECIES: Fe-S cluster assembly sulfur transfer protein SufU [Staphylococcus]	100	99.4	1.26e-103
CP064772.1_668|711978|713219|-1|ID=1_668;partial=00;start_type=GTG;rbs_motif=GGA/GAG/AGG;rbs_spacer=11-12bp;gc_cont=0.372	WP_279526569.1 cysteine desulfurase [Staphylococcus aureus]	99.8	99.8	3.04e-291
CP064772.1_669|713334|714641|-1|ID=1_669;partial=00;start_type=ATG;rbs_motif=AGGAG;rbs_spacer=5-10bp;gc_cont=0.341	WP_000205567.1 MULTISPECIES: Fe-S cluster assembly protein SufD [Staphylococcus]	100	99.8	5.26e-307
CP064772.1_670|714739|715500|-1|ID=1_670;partial=00;start_type=ATG;rbs_motif=GGAG/GAGG;rbs_spacer=5-10bp;gc_cont=0.339	WP_000168845.1 MULTISPECIES: Fe-S cluster assembly ATPase SufC [Staphylococcus]	100	99.6	8.13e-176
CP064772.1_671|715828|716679|1|ID=1_671;partial=00;start_type=ATG;rbs_motif=AGGAG;rbs_spacer=5-10bp;gc_cont=0.336	WP_001183854.1 MULTISPECIES: DUF368 domain-containing protein [Staphylococcus]	100	99.6	7.63e-180
CP064772.1_672|716913|717107|-1|ID=1_672;partial=00;start_type=ATG;rbs_motif=AGGAG;rbs_spacer=5-10bp;gc_cont=0.292	WP_000752917.1 MULTISPECIES: CsbD family protein [Bacillati]	100	98.5	3.63e-34
CP064772.1_673|717461|718282|-1|ID=1_673;partial=00;start_type=ATG;rbs_motif=None;rbs_spacer=None;gc_cont=0.302	WP_000732324.1 MULTISPECIES: MetQ/NlpA family ABC transporter substrate-binding protein [Staphylococcus]	100	99.6	1.53e-190
CP064772.1_674|718300|718995|-1|ID=1_674;partial=00;start_type=ATG;rbs_motif=GGAG/GAGG;rbs_spacer=5-10bp;gc_cont=0.352	WP_372496628.1 methionine ABC transporter permease [Staphylococcus aureus]	96.1	99.6	2.18e-128
CP064772.1_675|718988|720013|-1|ID=1_675;partial=00;start_type=GTG;rbs_motif=GGAG/GAGG;rbs_spacer=5-10bp;gc_cont=0.346	WP_000571213.1 MULTISPECIES: methionine ABC transporter ATP-binding protein [Staphylococcus]	100	99.7	1.00e-236
CP064772.1_676|720263|720559|-1|ID=1_676;partial=00;start_type=ATG;rbs_motif=None;rbs_spacer=None;gc_cont=0.276	WP_001065801.1 MULTISPECIES: thioredoxin family protein [Staphylococcus]	100	99.0	5.19e-65
CP064772.1_677|720552|720938|-1|ID=1_677;partial=00;start_type=ATG;rbs_motif=GGA/GAG/AGG;rbs_spacer=5-10bp;gc_cont=0.307	WP_001018962.1 MULTISPECIES: toprim domain-containing protein [Staphylococcus]	100	99.2	3.08e-87
CP064772.1_678|721735|722613|-1|ID=1_678;partial=00;start_type=ATG;rbs_motif=GGA/GAG/AGG;rbs_spacer=5-10bp;gc_cont=0.330	WP_000932225.1 MULTISPECIES: YwqG family protein [Staphylococcus]	100	99.7	1.34e-214
CP064772.1_679|722615|722728|-1|ID=1_679;partial=00;start_type=ATG;rbs_motif=AGGA;rbs_spacer=5-10bp;gc_cont=0.211	WP_000660172.1 hypothetical protein [Staphylococcus aureus]	94.6	97.4	5.27e-16
CP064772.1_680|722792|723172|-1|ID=1_680;partial=00;start_type=TTG;rbs_motif=AGGAG;rbs_spacer=5-10bp;gc_cont=0.341	WP_000290491.1 MULTISPECIES: glycine cleavage system protein GcvH [Staphylococcus]	100	99.2	1.37e-80
CP064772.1_681|723330|723686|-1|ID=1_681;partial=00;start_type=ATG;rbs_motif=AGGAGG;rbs_spacer=5-10bp;gc_cont=0.294	WP_000589549.1 MULTISPECIES: arsenate reductase family protein [Staphylococcus]	100	99.2	2.16e-80
CP064772.1_682|723830|724150|1|ID=1_682;partial=00;start_type=ATG;rbs_motif=AGGAG;rbs_spacer=5-10bp;gc_cont=0.336	WP_001147952.1 MULTISPECIES: thioredoxin family protein [Staphylococcus]	100	99.1	9.28e-74
CP064772.1_683|724301|724840|-1|ID=1_683;partial=00;start_type=ATG;rbs_motif=AGGAG;rbs_spacer=5-10bp;gc_cont=0.331	WP_000422908.1 MULTISPECIES: nitroreductase family protein [Staphylococcus]	100	99.4	4.93e-129
CP064772.1_684|724923|725639|-1|ID=1_684;partial=00;start_type=ATG;rbs_motif=GGAG/GAGG;rbs_spacer=5-10bp;gc_cont=0.324	WP_000150011.1 MULTISPECIES: type I 3-dehydroquinate dehydratase [Staphylococcus]	100	99.6	8.12e-164
CP064772.1_685|725787|726209|1|ID=1_685;partial=00;start_type=ATG;rbs_motif=AGGAG;rbs_spacer=5-10bp;gc_cont=0.359	WP_000974460.1 MULTISPECIES: organic hydroperoxide resistance protein [Staphylococcus]	100	99.3	4.38e-95
CP064772.1_686|726608|727102|1|ID=1_686;partial=00;start_type=ATG;rbs_motif=AGGAG;rbs_spacer=5-10bp;gc_cont=0.297	WP_000569883.1 MULTISPECIES: GNAT family N-acetyltransferase [Staphylococcus]	100	99.4	4.66e-113
CP064772.1_687|727257|727874|1|ID=1_687;partial=00;start_type=ATG;rbs_motif=None;rbs_spacer=None;gc_cont=0.301	WP_000255551.1 MULTISPECIES: LysE/ArgO family amino acid transporter [Staphylococcus]	100	99.5	2.06e-127
CP064772.1_688|727947|728531|-1|ID=1_688;partial=00;start_type=TTG;rbs_motif=GGAG/GAGG;rbs_spacer=5-10bp;gc_cont=0.349	WP_001140693.1 MULTISPECIES: histidine phosphatase family protein [Staphylococcus]	99.5	99.0	3.16e-139
CP064772.1_689|728753|728989|1|ID=1_689;partial=00;start_type=ATG;rbs_motif=AGGAG;rbs_spacer=5-10bp;gc_cont=0.274	WP_000349581.1 MULTISPECIES: hypothetical protein [Staphylococcus]	100	98.7	2.05e-55
CP064772.1_690|728986|729207|-1|ID=1_690;partial=00;start_type=ATG;rbs_motif=None;rbs_spacer=None;gc_cont=0.333	WP_000145163.1 MULTISPECIES: sterile alpha motif-like domain-containing protein [Staphylococcus]	100	90.5	1.34e-41
CP064772.1_691|729530|729790|1|ID=1_691;partial=00;start_type=ATG;rbs_motif=GGA/GAG/AGG;rbs_spacer=5-10bp;gc_cont=0.249	WP_001059690.1 MULTISPECIES: type II toxin-antitoxin system antitoxin TsaA [Staphylococcaceae]	100	98.9	1.14e-49
CP064772.1_692|729819|730007|1|ID=1_692;partial=00;start_type=ATG;rbs_motif=AGGAG;rbs_spacer=5-10bp;gc_cont=0.286	WP_000052076.1 MULTISPECIES: type II toxin-antitoxin system toxin TsaT [Staphylococcus]	100	98.4	8.47e-30
CP064772.1_693|730195|730764|1|ID=1_693;partial=00;start_type=GTG;rbs_motif=AGGAG;rbs_spacer=5-10bp;gc_cont=0.309	WP_001106658.1 MULTISPECIES: lipoprotein N-acylation protein LnsA [Staphylococcus]	100	99.5	1.77e-136
CP064772.1_694|730852|731121|1|ID=1_694;partial=00;start_type=TTG;rbs_motif=AGGAG;rbs_spacer=5-10bp;gc_cont=0.270	WP_001004398.1 MULTISPECIES: hypothetical protein [Staphylococcus]	100	98.9	1.40e-58
CP064772.1_695|731198|731416|1|ID=1_695;partial=00;start_type=ATG;rbs_motif=AGGA/GGAG/GAGG;rbs_spacer=11-12bp;gc_cont=0.306	WP_000005886.1 MULTISPECIES: hypothetical protein [Staphylococcus]	100	98.6	1.53e-43
CP064772.1_696|731908|732108|-1|ID=1_696;partial=00;start_type=ATG;rbs_motif=GGAG/GAGG;rbs_spacer=5-10bp;gc_cont=0.393	WP_001059082.1 MULTISPECIES: cold-shock protein [Staphylococcus]	100	98.5	5.63e-41
CP064772.1_697|732465|733151|-1|ID=1_697;partial=00;start_type=ATG;rbs_motif=GGAG/GAGG;rbs_spacer=5-10bp;gc_cont=0.342	WP_000141557.1 MULTISPECIES: thermonuclease family protein [Staphylococcus]	100	99.6	8.41e-152
CP064772.1_698|733492|734013|-1|ID=1_698;partial=00;start_type=ATG;rbs_motif=GGAG/GAGG;rbs_spacer=5-10bp;gc_cont=0.291	WP_244777081.1 hypothetical protein [Staphylococcus aureus]	100	99.4	1.17e-115
CP064772.1_699|734348|735370|-1|ID=1_699;partial=00;start_type=ATG;rbs_motif=AGGAG;rbs_spacer=5-10bp;gc_cont=0.319	WP_000728068.1 MULTISPECIES: extracellular matrix protein-binding adhesin Emp [Staphylococcus]	100	99.7	1.37e-238
CP064772.1_700|735723|737225|-1|ID=1_700;partial=00;start_type=TTG;rbs_motif=AGGAG;rbs_spacer=5-10bp;gc_cont=0.297	WP_406848755.1 von Willebrand factor binding protein Vwb [Staphylococcus aureus]	96.0	99.8	1.15e-311
CP064772.1_701|737446|740163|-1|ID=1_701;partial=00;start_type=ATG;rbs_motif=GGAG/GAGG;rbs_spacer=5-10bp;gc_cont=0.389	WP_308052317.1 MSCRAMM family adhesin clumping factor ClfA, partial [Staphylococcus aureus]	100	62.8	2.73e-312
CP064772.1_702|740426|740956|-1|ID=1_702;partial=00;start_type=ATG;rbs_motif=AGGAG;rbs_spacer=5-10bp;gc_cont=0.348	WP_001167158.1 MULTISPECIES: GNAT family N-acetyltransferase [Staphylococcus]	100	99.4	3.34e-121
CP064772.1_703|741095|741616|-1|ID=1_703;partial=00;start_type=ATG;rbs_motif=GGA/GAG/AGG;rbs_spacer=11-12bp;gc_cont=0.276	WP_000608192.1 MULTISPECIES: hypothetical protein [Staphylococcus]	100	99.4	4.95e-117
CP064772.1_704|742214|742942|1|ID=1_704;partial=00;start_type=ATG;rbs_motif=AGGAG;rbs_spacer=5-10bp;gc_cont=0.273	WP_001665113.1 DUF5067 domain-containing protein [Staphylococcus aureus]	99.2	99.6	1.97e-141
CP064772.1_705|743296|743619|1|ID=1_705;partial=00;start_type=ATG;rbs_motif=GGA/GAG/AGG;rbs_spacer=5-10bp;gc_cont=0.241	WP_001058299.1 MULTISPECIES: hypothetical protein [Staphylococcus]	100	99.1	5.81e-64
CP064772.1_706|743886|744167|-1|ID=1_706;partial=00;start_type=ATG;rbs_motif=None;rbs_spacer=None;gc_cont=0.291	WP_001788408.1 MULTISPECIES: hypothetical protein [Staphylococcus]	100	98.9	1.73e-54
CP064772.1_707|744941|745405|-1|ID=1_707;partial=00;start_type=ATG;rbs_motif=GGAG/GAGG;rbs_spacer=5-10bp;gc_cont=0.357	WP_001085183.1 MULTISPECIES: SsrA-binding protein SmpB [Staphylococcus]	100	99.4	1.08e-104
CP064772.1_708|745427|747799|-1|ID=1_708;partial=00;start_type=ATG;rbs_motif=AGGAG;rbs_spacer=5-10bp;gc_cont=0.342	WP_001050048.1 MULTISPECIES: ribonuclease R [Staphylococcus]	100	99.9	0.0
CP064772.1_709|747833|748573|-1|ID=1_709;partial=00;start_type=ATG;rbs_motif=GGAG/GAGG;rbs_spacer=5-10bp;gc_cont=0.332	WP_001165959.1 MULTISPECIES: alpha/beta hydrolase [Staphylococcus]	100	99.6	9.96e-178
CP064772.1_710|748689|748922|-1|ID=1_710;partial=00;start_type=ATG;rbs_motif=GGAG/GAGG;rbs_spacer=5-10bp;gc_cont=0.299	WP_000556760.1 MULTISPECIES: preprotein translocase subunit SecG [Staphylococcus]	100	98.7	2.46e-40
CP064772.1_711|748989|749447|-1|ID=1_711;partial=00;start_type=ATG;rbs_motif=AGGAG;rbs_spacer=5-10bp;gc_cont=0.314	WP_000785252.1 MULTISPECIES: hypothetical protein [Staphylococcus]	100	99.3	5.57e-97
CP064772.1_712|749786|751090|-1|ID=1_712;partial=00;start_type=ATG;rbs_motif=AGGAG;rbs_spacer=5-10bp;gc_cont=0.370	WP_001121760.1 MULTISPECIES: surface-displayed alpha-enolase [Staphylococcus]	100	99.8	3.20e-312
CP064772.1_713|751220|752737|-1|ID=1_713;partial=00;start_type=ATG;rbs_motif=AGxAGG/AGGxGG;rbs_spacer=11-12bp;gc_cont=0.366	WP_001085505.1 MULTISPECIES: 2,3-bisphosphoglycerate-independent phosphoglycerate mutase [Staphylococcus]	100	99.8	0.0
CP064772.1_714|752740|753501|-1|ID=1_714;partial=00;start_type=ATG;rbs_motif=AGGAG;rbs_spacer=5-10bp;gc_cont=0.369	WP_001260089.1 MULTISPECIES: triose-phosphate isomerase [Staphylococcus]	100	99.6	4.20e-178
CP064772.1_715|753623|754813|-1|ID=1_715;partial=00;start_type=ATG;rbs_motif=AGGAG;rbs_spacer=5-10bp;gc_cont=0.348	WP_001074749.1 MULTISPECIES: phosphoglycerate kinase [Staphylococcus]	100	99.7	2.27e-279
CP064772.1_716|754952|755962|-1|ID=1_716;partial=00;start_type=ATG;rbs_motif=AGGAG;rbs_spacer=5-10bp;gc_cont=0.380	WP_000279414.1 MULTISPECIES: type I glyceraldehyde-3-phosphate dehydrogenase [Staphylococcus]	100	99.7	1.94e-236
CP064772.1_717|756015|757028|-1|ID=1_717;partial=00;start_type=GTG;rbs_motif=AGGAG;rbs_spacer=5-10bp;gc_cont=0.375	WP_000654030.1 MULTISPECIES: sugar-binding transcriptional regulator [Staphylococcus]	100	99.7	8.20e-234
CP064772.1_718|757841|758470|-1|ID=1_718;partial=00;start_type=ATG;rbs_motif=GGAG/GAGG;rbs_spacer=5-10bp;gc_cont=0.352	WP_000070831.1 MULTISPECIES: DUF4887 domain-containing protein [Staphylococcus]	100	99.5	7.05e-67
CP064772.1_719|759173|760075|1|ID=1_719;partial=00;start_type=ATG;rbs_motif=None;rbs_spacer=None;gc_cont=0.338	WP_000816304.1 MULTISPECIES: TIGR01777 family oxidoreductase [Staphylococcus]	100	99.7	1.90e-218
CP064772.1_720|760318|760905|-1|ID=1_720;partial=00;start_type=ATG;rbs_motif=AGGAG;rbs_spacer=5-10bp;gc_cont=0.345	WP_001049165.1 MULTISPECIES: ATP-dependent Clp endopeptidase proteolytic subunit ClpP [Staphylococcus]	100	99.5	6.07e-131
CP064772.1_721|761469|762413|-1|ID=1_721;partial=00;start_type=ATG;rbs_motif=AGGA/GGAG/GAGG;rbs_spacer=11-12bp;gc_cont=0.331	WP_000006551.1 MULTISPECIES: DNA-binding protein WhiA [Staphylococcus]	100	99.7	1.81e-214
CP064772.1_722|762524|763519|-1|ID=1_722;partial=00;start_type=ATG;rbs_motif=GGA/GAG/AGG;rbs_spacer=5-10bp;gc_cont=0.333	WP_001248939.1 MULTISPECIES: YvcK family protein [Staphylococcus]	100	99.7	5.75e-231
CP064772.1_723|763516|764427|-1|ID=1_723;partial=00;start_type=ATG;rbs_motif=None;rbs_spacer=None;gc_cont=0.312	WP_000369722.1 MULTISPECIES: RNase adapter RapZ [Staphylococcus]	100	99.7	2.69e-215
CP064772.1_724|765312|766247|-1|ID=1_724;partial=00;start_type=ATG;rbs_motif=AGGAGG;rbs_spacer=5-10bp;gc_cont=0.374	WP_000134963.1 MULTISPECIES: thioredoxin-disulfide reductase [Staphylococcus]	100	99.7	4.18e-223
CP064772.1_725|766314|767753|-1|ID=1_725;partial=00;start_type=ATG;rbs_motif=AGGAGG;rbs_spacer=5-10bp;gc_cont=0.297	WP_000057543.1 MULTISPECIES: tetratricopeptide repeat protein [Staphylococcus]	100	99.8	0.0
CP064772.1_726|767761|768246|-1|ID=1_726;partial=00;start_type=TTG;rbs_motif=AGxAG;rbs_spacer=5-10bp;gc_cont=0.309	WP_001224795.1 acyltransferase [Staphylococcus aureus]	98.1	99.4	4.38e-87
CP064772.1_727|768254|769093|-1|ID=1_727;partial=00;start_type=ATG;rbs_motif=AGGAG;rbs_spacer=5-10bp;gc_cont=0.329	WP_000513305.1 MULTISPECIES: prolipoprotein diacylglyceryl transferase [Staphylococcus]	100	99.6	3.12e-202
CP064772.1_728|769099|770031|-1|ID=1_728;partial=00;start_type=ATG;rbs_motif=GGAG/GAGG;rbs_spacer=5-10bp;gc_cont=0.355	WP_000958224.1 MULTISPECIES: HPr(Ser) kinase/phosphatase [Staphylococcus]	100	99.7	4.44e-213
CP064772.1_729|770695|773541|-1|ID=1_729;partial=00;start_type=ATG;rbs_motif=AGxAGG/AGGxGG;rbs_spacer=11-12bp;gc_cont=0.355	WP_000662677.1 MULTISPECIES: excinuclease ABC subunit UvrA [Staphylococcus]	100	99.9	0.0
CP064772.1_730|773549|775534|-1|ID=1_730;partial=00;start_type=ATG;rbs_motif=AGGA/GGAG/GAGG;rbs_spacer=11-12bp;gc_cont=0.349	WP_000229241.1 MULTISPECIES: excinuclease ABC subunit UvrB [Staphylococcus]	100	99.8	0.0
CP064772.1_731|775803|776039|-1|ID=1_731;partial=00;start_type=ATG;rbs_motif=GGAG/GAGG;rbs_spacer=5-10bp;gc_cont=0.300	WP_000638419.1 MULTISPECIES: CsbA family protein [Staphylococcus]	100	98.7	3.06e-48
CP064772.1_732|776036|776704|-1|ID=1_732;partial=00;start_type=ATG;rbs_motif=None;rbs_spacer=None;gc_cont=0.286	WP_123090125.1 YfbR-like 5'-deoxynucleotidase [Staphylococcus aureus]	99.5	99.6	1.25e-150
CP064772.1_733|776860|777699|-1|ID=1_733;partial=00;start_type=ATG;rbs_motif=AGGA/GGAG/GAGG;rbs_spacer=11-12bp;gc_cont=0.358	WP_000753317.1 COG3942 and LysM peptidoglycan-binding domain-containing protein [Staphylococcus aureus]	100	99.6	4.31e-168
CP064772.1_734|778108|779103|-1|ID=1_734;partial=00;start_type=ATG;rbs_motif=None;rbs_spacer=None;gc_cont=0.366	WP_147715358.1 peptide chain release factor 2, partial [Staphylococcus aureus]	100	99.7	5.36e-239
CP064772.1_735|779533|782064|-1|ID=1_735;partial=00;start_type=ATG;rbs_motif=AGGAG;rbs_spacer=5-10bp;gc_cont=0.351	WP_000506531.1 MULTISPECIES: preprotein translocase subunit SecA [Staphylococcus]	100	99.9	0.0
CP064772.1_736|782478|783050|-1|ID=1_736;partial=00;start_type=ATG;rbs_motif=AGGAG;rbs_spacer=5-10bp;gc_cont=0.332	WP_000617735.1 MULTISPECIES: ribosome hibernation-promoting factor, HPF/YfiA family [Staphylococcus]	100	99.5	8.03e-129
CP064772.1_737|783111|783785|-1|ID=1_737;partial=00;start_type=ATG;rbs_motif=GGAG/GAGG;rbs_spacer=5-10bp;gc_cont=0.310	WP_001057965.1 MULTISPECIES: ComF family protein [Staphylococcus]	100	99.6	3.92e-164
CP064772.1_738|783778|784860|-1|ID=1_738;partial=00;start_type=ATG;rbs_motif=None;rbs_spacer=None;gc_cont=0.327	WP_001557172.1 MULTISPECIES: DEAD/DEAH box helicase [Staphylococcus]	100	99.7	1.85e-253
