CP064772.1_1221|1300361|1302457|-1|ID=1_1221;partial=00;start_type=ATG;rbs_motif=AGGAG;rbs_spacer=5-10bp;gc_cont=0.331	WP_001012737.1 MULTISPECIES: BglG family transcription antiterminator [Staphylococcus]	100	99.9	0.0
CP064772.1_1222|1302795|1303730|-1|ID=1_1222;partial=00;start_type=ATG;rbs_motif=GGA/GAG/AGG;rbs_spacer=5-10bp;gc_cont=0.395	WP_000823221.1 MULTISPECIES: nucleoside hydrolase [Staphylococcus]	100	99.7	2.07e-223
CP064772.1_1223|1304092|1305621|1|ID=1_1223;partial=00;start_type=ATG;rbs_motif=AGGAG;rbs_spacer=5-10bp;gc_cont=0.392	WP_000838205.1 MULTISPECIES: glucose-specific PTS transporter subunit IIBC [Staphylococcus]	100	99.8	0.0
CP064772.1_1224|1305941|1306894|-1|ID=1_1224;partial=00;start_type=ATG;rbs_motif=GGAG/GAGG;rbs_spacer=5-10bp;gc_cont=0.372	WP_001031880.1 MULTISPECIES: L-lactate dehydrogenase [Staphylococcus]	100	99.7	5.47e-222
CP064772.1_1225|1307467|1308612|1|ID=1_1225;partial=00;start_type=ATG;rbs_motif=AGGAG;rbs_spacer=5-10bp;gc_cont=0.349	WP_000954799.1 MULTISPECIES: globin domain-containing protein [Staphylococcus]	100	99.7	3.06e-274
CP064772.1_1226|1308638|1308811|1|ID=1_1226;partial=00;start_type=ATG;rbs_motif=AGGA/GGAG/GAGG;rbs_spacer=11-12bp;gc_cont=0.259	WP_000773989.1 MULTISPECIES: hypothetical protein [Staphylococcus]	100	98.3	2.46e-29
CP064772.1_1227|1308968|1309324|1|ID=1_1227;partial=00;start_type=ATG;rbs_motif=AGGAG;rbs_spacer=5-10bp;gc_cont=0.353	WP_000215216.1 MULTISPECIES: DUF488 domain-containing protein [Staphylococcus]	100	99.2	8.82e-80
CP064772.1_1228|1309522|1310997|1|ID=1_1228;partial=00;start_type=ATG;rbs_motif=GGA/GAG/AGG;rbs_spacer=5-10bp;gc_cont=0.312	WP_000669656.1 MULTISPECIES: nickel ABC transporter substrate-binding protein [Staphylococcus]	100	99.8	0.0
CP064772.1_1229|1311311|1312540|-1|ID=1_1229;partial=00;start_type=ATG;rbs_motif=GGA/GAG/AGG;rbs_spacer=5-10bp;gc_cont=0.346	WP_010922818.1 MULTISPECIES: PrsW family intramembrane metalloprotease [Staphylococcus]	100	92.7	5.75e-261
CP064772.1_1230|1312894|1314471|1|ID=1_1230;partial=00;start_type=ATG;rbs_motif=None;rbs_spacer=None;gc_cont=0.371	WP_001795358.1 MULTISPECIES: fatty acid degradation protein FadX [Staphylococcus]	100	99.8	0.0
CP064772.1_1231|1314497|1316002|1|ID=1_1231;partial=00;start_type=ATG;rbs_motif=GGA/GAG/AGG;rbs_spacer=5-10bp;gc_cont=0.374	WP_001008400.1 MULTISPECIES: long-chain-fatty-acid--CoA ligase FadD [Staphylococcus]	100	99.8	0.0
CP064772.1_1232|1316114|1317325|1|ID=1_1232;partial=00;start_type=ATG;rbs_motif=AGGAG;rbs_spacer=5-10bp;gc_cont=0.392	WP_000142195.1 MULTISPECIES: acyl-CoA dehydrogenase FadE [Staphylococcus]	100	99.8	5.28e-293
CP064772.1_1233|1317511|1319772|1|ID=1_1233;partial=00;start_type=ATG;rbs_motif=GGAG/GAGG;rbs_spacer=5-10bp;gc_cont=0.375	WP_000154537.1 MULTISPECIES: 3-hydroxyacyl-CoA dehydrogenase/crotonase FadB [Staphylococcus]	100	99.9	0.0
CP064772.1_1234|1319802|1320986|1|ID=1_1234;partial=00;start_type=ATG;rbs_motif=GGAG/GAGG;rbs_spacer=5-10bp;gc_cont=0.437	WP_001154614.1 MULTISPECIES: thiolase family protein [Staphylococcus]	100	99.7	3.75e-277
CP064772.1_1235|1321573|1323549|-1|ID=1_1235;partial=00;start_type=ATG;rbs_motif=AGGA/GGAG/GAGG;rbs_spacer=11-12bp;gc_cont=0.346	WP_075339631.1 staphylocoagulase, partial [Staphylococcus aureus]	100	77.5	1.93e-313
CP064772.1_1236|1323739|1324083|1|ID=1_1236;partial=00;start_type=ATG;rbs_motif=AGGAG;rbs_spacer=5-10bp;gc_cont=0.319	WP_000211597.1 MULTISPECIES: complement inhibitor SCIN family protein [Staphylococcus]	100	99.1	1.61e-71
CP064772.1_1237|1324247|1326010|-1|ID=1_1237;partial=00;start_type=ATG;rbs_motif=GGAG/GAGG;rbs_spacer=5-10bp;gc_cont=0.310	WP_000822587.1 MULTISPECIES: glycerophosphoryl diester phosphodiesterase membrane domain-containing protein [Staphylococcus]	100	99.8	0.0
CP064772.1_1238|1326332|1327087|-1|ID=1_1238;partial=00;start_type=ATG;rbs_motif=GGA/GAG/AGG;rbs_spacer=5-10bp;gc_cont=0.365	WP_000911657.1 MULTISPECIES: pyruvate formate-lyase-activating protein [Staphylococcus]	100	99.6	5.37e-189
CP064772.1_1239|1327110|1329359|-1|ID=1_1239;partial=00;start_type=ATG;rbs_motif=GGAG/GAGG;rbs_spacer=5-10bp;gc_cont=0.368	WP_000894660.1 MULTISPECIES: formate C-acetyltransferase [Staphylococcus]	100	99.9	0.0
CP064772.1_1240|1329947|1330915|1|ID=1_1240;partial=00;start_type=ATG;rbs_motif=None;rbs_spacer=None;gc_cont=0.342	WP_000837116.1 MULTISPECIES: ABC transporter substrate-binding protein [Staphylococcus]	100	99.7	2.74e-229
CP064772.1_1241|1330912|1332468|1|ID=1_1241;partial=00;start_type=ATG;rbs_motif=GGAG/GAGG;rbs_spacer=5-10bp;gc_cont=0.328	WP_191675392.1 sensor histidine kinase [Staphylococcus aureus]	100	99.8	0.0
CP064772.1_1242|1332461|1333219|1|ID=1_1242;partial=00;start_type=ATG;rbs_motif=GGA/GAG/AGG;rbs_spacer=5-10bp;gc_cont=0.324	WP_000477526.1 MULTISPECIES: response regulator transcription factor [Staphylococcus]	100	99.6	2.09e-182
CP064772.1_1243|1333578|1334975|-1|ID=1_1243;partial=00;start_type=ATG;rbs_motif=None;rbs_spacer=None;gc_cont=0.363	WP_001008722.1 MULTISPECIES: hexose-6-phosphate:phosphate antiporter [Staphylococcus]	100	98.5	0.0
CP064772.1_1244|1335190|1335684|1|ID=1_1244;partial=00;start_type=ATG;rbs_motif=GGAG/GAGG;rbs_spacer=5-10bp;gc_cont=0.265	WP_000603755.1 MULTISPECIES: isoprenylcysteine carboxyl methyltransferase family protein [Staphylococcus]	100	99.4	8.00e-105
CP064772.1_1245|1336045|1337013|-1|ID=1_1245;partial=00;start_type=ATG;rbs_motif=AGGAG;rbs_spacer=5-10bp;gc_cont=0.357	WP_244777089.1 sugar phosphate isomerase/epimerase family protein [Staphylococcus aureus]	100	99.7	4.64e-246
CP064772.1_1246|1337068|1338108|-1|ID=1_1246;partial=00;start_type=ATG;rbs_motif=AGGAG;rbs_spacer=5-10bp;gc_cont=0.399	WP_000163820.1 MULTISPECIES: Gfo/Idh/MocA family protein [Staphylococcus]	100	99.7	4.36e-254
CP064772.1_1247|1338133|1339212|-1|ID=1_1247;partial=00;start_type=ATG;rbs_motif=AGGAG;rbs_spacer=5-10bp;gc_cont=0.396	WP_000153479.1 MULTISPECIES: Gfo/Idh/MocA family protein [Staphylococcus]	100	99.4	1.74e-264
CP064772.1_1248|1339283|1340122|-1|ID=1_1248;partial=00;start_type=ATG;rbs_motif=GGAG/GAGG;rbs_spacer=5-10bp;gc_cont=0.338	WP_000162661.1 MULTISPECIES: sugar ABC transporter permease [Staphylococcus]	100	99.6	1.91e-187
CP064772.1_1249|1340124|1341392|-1|ID=1_1249;partial=00;start_type=ATG;rbs_motif=AGGAG;rbs_spacer=5-10bp;gc_cont=0.357	WP_224083619.1 sugar ABC transporter permease [Staphylococcus aureus]	98.8	99.8	5.35e-298
CP064772.1_1250|1341395|1342666|-1|ID=1_1250;partial=00;start_type=ATG;rbs_motif=GGAG/GAGG;rbs_spacer=5-10bp;gc_cont=0.342	WP_244777090.1 maltodextrin ABC transporter substrate-binding protein [Staphylococcus aureus]	100	99.8	9.10e-311
CP064772.1_1251|1342679|1343776|-1|ID=1_1251;partial=00;start_type=ATG;rbs_motif=GGAG/GAGG;rbs_spacer=5-10bp;gc_cont=0.349	WP_000818915.1 MULTISPECIES: ABC transporter ATP-binding protein [Staphylococcus]	100	99.7	3.94e-262
CP064772.1_1252|1344160|1344738|-1|ID=1_1252;partial=00;start_type=ATG;rbs_motif=GGA/GAG/AGG;rbs_spacer=5-10bp;gc_cont=0.359	WP_000166920.1 MULTISPECIES: M23 family metallopeptidase [Staphylococcus]	100	99.5	5.26e-144
CP064772.1_1253|1344947|1345573|1|ID=1_1253;partial=00;start_type=ATG;rbs_motif=AGGAG;rbs_spacer=5-10bp;gc_cont=0.324	WP_001151451.1 MULTISPECIES: FMN-dependent NADH-azoreductase [Staphylococcus]	100	99.5	1.17e-148
CP064772.1_1254|1345732|1346535|1|ID=1_1254;partial=00;start_type=ATG;rbs_motif=None;rbs_spacer=None;gc_cont=0.300	WP_000643619.1 MULTISPECIES: tandem-type lipoprotein [Staphylococcus]	100	95.9	1.27e-179
CP064772.1_1255|1346848|1348854|-1|ID=1_1255;partial=00;start_type=ATG;rbs_motif=AGGAG;rbs_spacer=5-10bp;gc_cont=0.378	WP_000236427.1 MULTISPECIES: gamma-glutamyltransferase [Staphylococcus]	100	99.9	0.0
CP064772.1_1256|1348892|1350667|-1|ID=1_1256;partial=00;start_type=GTG;rbs_motif=GGA/GAG/AGG;rbs_spacer=5-10bp;gc_cont=0.332	WP_000720816.1 MULTISPECIES: ABC transporter substrate-binding protein [Staphylococcus]	100	99.8	0.0
CP064772.1_1257|1350684|1351847|-1|ID=1_1257;partial=00;start_type=ATG;rbs_motif=AGGA;rbs_spacer=5-10bp;gc_cont=0.346	WP_000240113.1 MULTISPECIES: ABC transporter permease [Staphylococcus]	100	99.7	7.46e-253
CP064772.1_1258|1351853|1353286|-1|ID=1_1258;partial=00;start_type=ATG;rbs_motif=None;rbs_spacer=None;gc_cont=0.325	WP_001557565.1 ABC transporter permease [Staphylococcus aureus]	100	99.8	3.40e-306
CP064772.1_1259|1353288|1354880|1|ID=1_1259;partial=00;start_type=ATG;rbs_motif=GGAG/GAGG;rbs_spacer=5-10bp;gc_cont=0.355	WP_000067352.1 MULTISPECIES: ABC transporter ATP-binding protein [Staphylococcus]	100	99.8	0.0
CP064772.1_1260|1355390|1355587|-1|ID=1_1260;partial=00;start_type=GTG;rbs_motif=GGA/GAG/AGG;rbs_spacer=5-10bp;gc_cont=0.308	WP_000794565.1 MULTISPECIES: helix-turn-helix transcriptional regulator [Staphylococcus]	100	98.5	1.20e-37
CP064772.1_1261|1355590|1355766|-1|ID=1_1261;partial=00;start_type=ATG;rbs_motif=GGAG/GAGG;rbs_spacer=5-10bp;gc_cont=0.226	WP_144078305.1 hypothetical protein [Staphylococcus aureus]	96.4	94.9	8.37e-29
CP064772.1_1262|1355753|1356475|-1|ID=1_1262;partial=00;start_type=ATG;rbs_motif=AGGA;rbs_spacer=5-10bp;gc_cont=0.267	WP_000960712.1 MULTISPECIES: ATP-binding cassette domain-containing protein [Staphylococcus]	100	99.6	6.95e-166
CP064772.1_1263|1356487|1356951|-1|ID=1_1263;partial=00;start_type=GTG;rbs_motif=None;rbs_spacer=None;gc_cont=0.258	WP_001793228.1 MULTISPECIES: stage II sporulation protein M [Staphylococcus]	100	99.4	6.39e-88
CP064772.1_1264|1356989|1358674|-1|ID=1_1264;partial=00;start_type=ATG;rbs_motif=AGGAG;rbs_spacer=5-10bp;gc_cont=0.234	WP_031899927.1 membrane protein [Staphylococcus aureus]	99.8	99.8	0.0
CP064772.1_1265|1358745|1358966|-1|ID=1_1265;partial=00;start_type=ATG;rbs_motif=AGGAGG;rbs_spacer=5-10bp;gc_cont=0.410	WP_000915920.1 MULTISPECIES: putative cyclic bacteriocin [Staphylococcus]	100	98.6	3.32e-43
CP064772.1_1266|1359173|1360351|-1|ID=1_1266;partial=00;start_type=ATG;rbs_motif=GGAG/GAGG;rbs_spacer=5-10bp;gc_cont=0.306	WP_191675391.1 ABC transporter permease [Staphylococcus aureus]	100	99.7	1.01e-264
CP064772.1_1267|1360348|1361028|-1|ID=1_1267;partial=00;start_type=ATG;rbs_motif=GGA/GAG/AGG;rbs_spacer=5-10bp;gc_cont=0.316	WP_000571407.1 MULTISPECIES: ABC transporter ATP-binding protein [Staphylococcus]	100	99.6	2.34e-157
CP064772.1_1268|1361025|1362137|-1|ID=1_1268;partial=00;start_type=TTG;rbs_motif=AGGAG;rbs_spacer=5-10bp;gc_cont=0.304	WP_001253190.1 MULTISPECIES: efflux RND transporter periplasmic adaptor subunit [Staphylococcus]	100	99.7	5.97e-255
CP064772.1_1269|1362262|1362861|1|ID=1_1269;partial=00;start_type=ATG;rbs_motif=AGGAG;rbs_spacer=5-10bp;gc_cont=0.292	WP_000059051.1 MULTISPECIES: hypothetical protein [Staphylococcus]	100	99.5	1.50e-117
CP064772.1_1270|1363008|1365797|-1|ID=1_1270;partial=00;start_type=ATG;rbs_motif=GGA/GAG/AGG;rbs_spacer=5-10bp;gc_cont=0.332	WP_000331330.1 MULTISPECIES: type I restriction endonuclease subunit R [Staphylococcus]	100	99.9	0.0
CP064772.1_1271|1366485|1367363|-1|ID=1_1271;partial=00;start_type=ATG;rbs_motif=None;rbs_spacer=None;gc_cont=0.344	WP_000181827.1 MurR/RpiR family transcriptional regulator [Staphylococcus aureus]	92.4	99.3	6.81e-185
CP064772.1_1272|1367363|1368817|-1|ID=1_1272;partial=00;start_type=ATG;rbs_motif=AGGAG;rbs_spacer=5-10bp;gc_cont=0.379	WP_000159750.1 MULTISPECIES: PTS transporter subunit EIIC [Staphylococcus]	100	99.8	0.0
CP064772.1_1273|1368829|1369725|-1|ID=1_1273;partial=00;start_type=ATG;rbs_motif=AGGA/GGAG/GAGG;rbs_spacer=11-12bp;gc_cont=0.381	WP_000432017.1 MULTISPECIES: N-acetylmuramic acid 6-phosphate etherase [Staphylococcus]	100	99.7	7.03e-204
CP064772.1_1274|1369725|1370765|-1|ID=1_1274;partial=00;start_type=GTG;rbs_motif=GGA/GAG/AGG;rbs_spacer=5-10bp;gc_cont=0.353	WP_000145577.1 MULTISPECIES: 6-phospho-N-acetylmuramidase [Staphylococcus]	99.7	99.7	1.84e-254
CP064772.1_1275|1371365|1373410|1|ID=1_1275;partial=00;start_type=GTG;rbs_motif=GGAG/GAGG;rbs_spacer=5-10bp;gc_cont=0.376	WP_001227709.1 MULTISPECIES: glucose-specific PTS transporter subunit IIBC [Staphylococcus]	100	99.9	0.0
CP064772.1_1276|1373683|1375323|1|ID=1_1276;partial=00;start_type=ATG;rbs_motif=GGA/GAG/AGG;rbs_spacer=5-10bp;gc_cont=0.367	WP_000813526.1 MULTISPECIES: alpha-keto acid decarboxylase family protein [Staphylococcus]	100	99.8	0.0
CP064772.1_1277|1375390|1375947|1|ID=1_1277;partial=00;start_type=ATG;rbs_motif=AGGA/GGAG/GAGG;rbs_spacer=11-12bp;gc_cont=0.353	WP_001557561.1 MULTISPECIES: isochorismatase family protein [Staphylococcus]	100	99.5	2.83e-131
CP064772.1_1278|1376226|1377575|1|ID=1_1278;partial=00;start_type=ATG;rbs_motif=AGGAG(G)/GGAGG;rbs_spacer=13-15bp;gc_cont=0.330	WP_000728170.1 MULTISPECIES: branched-chain amino acid transport system II carrier protein BrnQ1 [Staphylococcus]	100	99.8	1.29e-305
CP064772.1_1279|1377834|1379018|1|ID=1_1279;partial=00;start_type=ATG;rbs_motif=AGGAG;rbs_spacer=5-10bp;gc_cont=0.376	WP_001084442.1 MULTISPECIES: ornithine--oxo-acid transaminase [Staphylococcus]	100	99.7	2.30e-287
CP064772.1_1280|1379054|1380088|1|ID=1_1280;partial=00;start_type=ATG;rbs_motif=AGGAG;rbs_spacer=5-10bp;gc_cont=0.351	WP_000633732.1 MULTISPECIES: N-acetyl-gamma-glutamyl-phosphate reductase [Staphylococcus]	100	99.4	1.91e-249
CP064772.1_1281|1380100|1381341|1|ID=1_1281;partial=00;start_type=ATG;rbs_motif=GGA/GAG/AGG;rbs_spacer=5-10bp;gc_cont=0.378	WP_000682619.1 MULTISPECIES: bifunctional glutamate N-acetyltransferase/amino-acid acetyltransferase ArgJ [Staphylococcus]	100	99.8	7.27e-296
CP064772.1_1282|1381357|1382121|1|ID=1_1282;partial=00;start_type=ATG;rbs_motif=AGxAGG/AGGxGG;rbs_spacer=5-10bp;gc_cont=0.346	WP_000668894.1 MULTISPECIES: acetylglutamate kinase [Staphylococcus]	100	99.6	2.85e-181
CP064772.1_1283|1382391|1382870|1|ID=1_1283;partial=00;start_type=ATG;rbs_motif=None;rbs_spacer=None;gc_cont=0.362	WP_001822554.1 MULTISPECIES: YagU family protein [Staphylococcus]	100	99.4	2.16e-111
CP064772.1_1284|1383198|1383842|-1|ID=1_1284;partial=00;start_type=ATG;rbs_motif=GGA/GAG/AGG;rbs_spacer=5-10bp;gc_cont=0.335	WP_000215722.1 MULTISPECIES: aureusimine biosynthesis 4'-phosphopantetheinyl transferase AusB [Staphylococcus]	100	99.5	1.88e-157
CP064772.1_1285|1383855|1391048|-1|ID=1_1285;partial=00;start_type=ATG;rbs_motif=GGA/GAG/AGG;rbs_spacer=5-10bp;gc_cont=0.352	WP_000605281.1 MULTISPECIES: aureusimine non-ribosomal peptide synthetase AusA [Staphylococcus]	100	99.7	0.0
CP064772.1_1286|1391477|1392727|-1|ID=1_1286;partial=00;start_type=ATG;rbs_motif=None;rbs_spacer=None;gc_cont=0.325	WP_000826861.1 MULTISPECIES: MDR family MFS transporter [Staphylococcus]	100	99.8	1.63e-273
CP064772.1_1287|1393113|1394138|-1|ID=1_1287;partial=00;start_type=ATG;rbs_motif=AGGAG;rbs_spacer=5-10bp;gc_cont=0.351	WP_000706135.1 MULTISPECIES: NAD-dependent formate dehydrogenase [Staphylococcus]	100	99.7	8.70e-247
CP064772.1_1288|1394311|1394670|-1|ID=1_1288;partial=00;start_type=GTG;rbs_motif=None;rbs_spacer=None;gc_cont=0.325	WP_001092004.1 MULTISPECIES: DUF2294 domain-containing protein [Staphylococcus]	100	99.2	5.50e-79
CP064772.1_1289|1394887|1395918|-1|ID=1_1289;partial=00;start_type=ATG;rbs_motif=AGGAG;rbs_spacer=5-10bp;gc_cont=0.359	WP_000171650.1 MULTISPECIES: acyl-CoA/acyl-ACP dehydrogenase [Staphylococcus]	100	99.7	5.88e-246
CP064772.1_1290|1395931|1396692|-1|ID=1_1290;partial=00;start_type=ATG;rbs_motif=AGGAGG;rbs_spacer=5-10bp;gc_cont=0.353	WP_000197961.1 MULTISPECIES: ABC transporter permease [Staphylococcus]	100	99.6	7.26e-179
CP064772.1_1291|1396689|1397660|-1|ID=1_1291;partial=00;start_type=ATG;rbs_motif=AGGAG;rbs_spacer=5-10bp;gc_cont=0.370	WP_000826669.1 MULTISPECIES: ABC transporter substrate-binding protein [Staphylococcus]	100	99.7	3.12e-240
CP064772.1_1292|1397674|1398414|-1|ID=1_1292;partial=00;start_type=ATG;rbs_motif=GGA/GAG/AGG;rbs_spacer=5-10bp;gc_cont=0.355	WP_000590854.1 MULTISPECIES: ABC transporter ATP-binding protein [Staphylococcus]	100	99.6	8.53e-179
CP064772.1_1293|1398756|1399268|-1|ID=1_1293;partial=00;start_type=ATG;rbs_motif=AGGAG;rbs_spacer=5-10bp;gc_cont=0.339	WP_000171919.1 MULTISPECIES: DUF4242 domain-containing protein [Staphylococcus]	100	99.4	9.30e-116
CP064772.1_1294|1399447|1399650|1|ID=1_1294;partial=00;start_type=ATG;rbs_motif=AGxAGG/AGGxGG;rbs_spacer=5-10bp;gc_cont=0.309	WP_000356963.1 MULTISPECIES: hypothetical protein [Staphylococcus]	100	98.5	8.29e-39
CP064772.1_1295|1399886|1400950|-1|ID=1_1295;partial=00;start_type=ATG;rbs_motif=None;rbs_spacer=None;gc_cont=0.313	WP_001013485.1 MULTISPECIES: cation diffusion facilitator family transporter [Staphylococcus]	100	89.9	9.69e-217
CP064772.1_1296|1401246|1401365|-1|ID=1_1296;partial=00;start_type=ATG;rbs_motif=GGA/GAG/AGG;rbs_spacer=5-10bp;gc_cont=0.292	WP_000161255.1 hypothetical protein [Staphylococcus aureus]	76.5	85.0	2.38e-09
CP064772.1_1297|1401492|1402979|-1|ID=1_1297;partial=00;start_type=ATG;rbs_motif=AGGAG;rbs_spacer=5-10bp;gc_cont=0.362	WP_000290397.1 MULTISPECIES: aldehyde dehydrogenase family protein [Staphylococcus]	100	99.8	0.0
CP064772.1_1298|1403406|1403789|1|ID=1_1298;partial=00;start_type=ATG;rbs_motif=GGAG/GAGG;rbs_spacer=5-10bp;gc_cont=0.318	WP_001237004.1 MULTISPECIES: YbaN family protein [Staphylococcus]	100	99.2	1.59e-75
CP064772.1_1299|1403796|1404122|1|ID=1_1299;partial=00;start_type=ATG;rbs_motif=AGGAG;rbs_spacer=5-10bp;gc_cont=0.306	WP_000480603.1 MULTISPECIES: staphylobilin-forming heme oxygenase IsdI [Staphylococcus]	100	99.1	4.22e-71
CP064772.1_1300|1404187|1405332|-1|ID=1_1300;partial=00;start_type=ATG;rbs_motif=GGAG/GAGG;rbs_spacer=5-10bp;gc_cont=0.363	WP_000723436.1 MULTISPECIES: type 8 capsular polysaccharide synthesis protein Cap8P [Staphylococcus]	100	99.7	3.73e-275
CP064772.1_1301|1405409|1406671|-1|ID=1_1301;partial=00;start_type=ATG;rbs_motif=GGAG/GAGG;rbs_spacer=5-10bp;gc_cont=0.344	WP_000779504.1 MULTISPECIES: type 8 capsular polysaccharide synthesis protein Cap8O [Staphylococcus]	100	99.8	4.46e-305
CP064772.1_1302|1406725|1407612|-1|ID=1_1302;partial=00;start_type=ATG;rbs_motif=AGxAGG/AGGxGG;rbs_spacer=11-12bp;gc_cont=0.338	WP_001230679.1 MULTISPECIES: capsular polysaccharide type 5/8 biosynthesis epimerase CapN [Staphylococcus]	100	99.7	1.55e-210
CP064772.1_1303|1407612|1408169|-1|ID=1_1303;partial=00;start_type=ATG;rbs_motif=AGGAG;rbs_spacer=5-10bp;gc_cont=0.323	WP_000825098.1 MULTISPECIES: type 8 capsular polysaccharide synthesis protein Cap8M [Staphylococcus]	100	99.5	8.74e-126
CP064772.1_1304|1408180|1409385|-1|ID=1_1304;partial=00;start_type=ATG;rbs_motif=AGGA;rbs_spacer=5-10bp;gc_cont=0.352	WP_001291020.1 MULTISPECIES: type 8 capsular polysaccharide synthesis protein Cap8L [Staphylococcus]	100	99.8	1.92e-294
CP064772.1_1305|1409386|1410591|-1|ID=1_1305;partial=00;start_type=ATG;rbs_motif=AGGA;rbs_spacer=5-10bp;gc_cont=0.268	WP_000239647.1 MULTISPECIES: capsular polysaccharide biosynthesis protein [Staphylococcus]	100	99.8	2.75e-262
CP064772.1_1306|1410584|1411750|-1|ID=1_1306;partial=00;start_type=ATG;rbs_motif=GGAG/GAGG;rbs_spacer=5-10bp;gc_cont=0.292	WP_000668175.1 MULTISPECIES: O-antigen ligase family protein [Staphylococcus]	100	99.7	2.31e-268
CP064772.1_1307|1411764|1412873|-1|ID=1_1307;partial=00;start_type=ATG;rbs_motif=AGGA/GGAG/GAGG;rbs_spacer=11-12bp;gc_cont=0.290	WP_001221646.1 MULTISPECIES: glycosyltransferase [Staphylococcus]	100	99.7	1.54e-261
CP064772.1_1308|1412878|1413504|-1|ID=1_1308;partial=00;start_type=ATG;rbs_motif=GGAG/GAGG;rbs_spacer=5-10bp;gc_cont=0.329	WP_001216898.1 MULTISPECIES: CatB-related O-acetyltransferase [Staphylococcus]	100	99.5	1.37e-147
CP064772.1_1309|1413507|1414631|-1|ID=1_1309;partial=00;start_type=ATG;rbs_motif=GGAG/GAGG;rbs_spacer=5-10bp;gc_cont=0.339	WP_000413171.1 MULTISPECIES: type 8 capsular polysaccharide synthesis protein Cap8G [Staphylococcus]	100	99.7	2.31e-270
CP064772.1_1310|1414635|1415744|-1|ID=1_1310;partial=00;start_type=TTG;rbs_motif=AGGAG;rbs_spacer=5-10bp;gc_cont=0.350	WP_001028283.1 MULTISPECIES: type 8 capsular polysaccharide synthesis protein Cap8F [Staphylococcus]	100	99.7	1.40e-273
CP064772.1_1311|1415757|1416785|-1|ID=1_1311;partial=00;start_type=ATG;rbs_motif=GGAG/GAGG;rbs_spacer=5-10bp;gc_cont=0.340	WP_000459062.1 MULTISPECIES: type 8 capsular polysaccharide synthesis protein Cap8E [Staphylococcus]	100	99.7	4.11e-241
CP064772.1_1312|1416775|1418598|-1|ID=1_1312;partial=00;start_type=ATG;rbs_motif=GGAG/GAGG;rbs_spacer=5-10bp;gc_cont=0.349	WP_000940790.1 MULTISPECIES: type 8 capsular polysaccharide synthesis protein Cap8D [Staphylococcus]	100	99.8	0.0
CP064772.1_1313|1418618|1419382|-1|ID=1_1313;partial=00;start_type=ATG;rbs_motif=GGAG/GAGG;rbs_spacer=5-10bp;gc_cont=0.320	WP_000565304.1 MULTISPECIES: type 8 capsular polysaccharide synthesis protein Cap8C [Staphylococcus]	100	99.6	5.13e-184
CP064772.1_1314|1419385|1420071|-1|ID=1_1314;partial=00;start_type=ATG;rbs_motif=AGGA/GGAG/GAGG;rbs_spacer=11-12bp;gc_cont=0.336	WP_000037332.1 MULTISPECIES: type 8 capsular polysaccharide synthesis protein Cap8B [Staphylococcus]	100	99.6	3.57e-153
CP064772.1_1315|1420087|1420755|-1|ID=1_1315;partial=00;start_type=ATG;rbs_motif=GGAG/GAGG;rbs_spacer=5-10bp;gc_cont=0.299	WP_000446299.1 MULTISPECIES: capsular polysaccharide type 5/8 biosynthesis protein CapA [Staphylococcus]	100	99.6	2.38e-139
CP064772.1_1316|1421098|1423707|-1|ID=1_1316;partial=00;start_type=ATG;rbs_motif=AGGAG;rbs_spacer=5-10bp;gc_cont=0.361	WP_000955781.1 MULTISPECIES: bifunctional acetaldehyde-CoA/alcohol dehydrogenase [Staphylococcus]	100	99.9	0.0
CP064772.1_1317|1424092|1425267|-1|ID=1_1317;partial=00;start_type=ATG;rbs_motif=GGA/GAG/AGG;rbs_spacer=5-10bp;gc_cont=0.287	WP_000469833.1 MULTISPECIES: spr1629 family repressor/antitoxin [Staphylococcus]	100	99.7	4.04e-275
CP064772.1_1318|1425273|1426049|-1|ID=1_1318;partial=00;start_type=GTG;rbs_motif=None;rbs_spacer=None;gc_cont=0.288	WP_000447776.1 MULTISPECIES: spr1630 family ClpXP-sensitive toxin [Staphylococcus]	99.6	98.5	1.25e-174
CP064772.1_1319|1426197|1427732|-1|ID=1_1319;partial=00;start_type=ATG;rbs_motif=AGGAG;rbs_spacer=5-10bp;gc_cont=0.367	WP_000065030.1 MULTISPECIES: bifunctional metallophosphatase/5'-nucleotidase [Staphylococcus]	100	99.8	0.0
CP064772.1_1320|1427783|1429327|-1|ID=1_1320;partial=00;start_type=ATG;rbs_motif=AGGAG;rbs_spacer=5-10bp;gc_cont=0.370	WP_031807514.1 DNA-binding protein [Staphylococcus aureus]	99.8	99.8	0.0
CP064772.1_1321|1429556|1430512|1|ID=1_1321;partial=00;start_type=ATG;rbs_motif=GGA/GAG/AGG;rbs_spacer=5-10bp;gc_cont=0.308	WP_000787777.1 MULTISPECIES: phosphate/phosphite/phosphonate ABC transporter substrate-binding protein [Staphylococcus]	100	99.7	2.12e-215
CP064772.1_1322|1430707|1431480|1|ID=1_1322;partial=00;start_type=ATG;rbs_motif=GGA/GAG/AGG;rbs_spacer=5-10bp;gc_cont=0.351	WP_000078092.1 MULTISPECIES: phosphonate ABC transporter ATP-binding protein [Staphylococcus]	100	99.6	6.96e-179
CP064772.1_1323|1431482|1432282|1|ID=1_1323;partial=00;start_type=ATG;rbs_motif=AGGAG;rbs_spacer=5-10bp;gc_cont=0.343	WP_001127689.1 MULTISPECIES: phosphonate ABC transporter, permease protein PhnE [Staphylococcus]	100	99.6	5.67e-178
CP064772.1_1324|1432279|1433094|1|ID=1_1324;partial=00;start_type=ATG;rbs_motif=AGGA/GGAG/GAGG;rbs_spacer=11-12bp;gc_cont=0.369	WP_000191092.1 MULTISPECIES: phosphonate ABC transporter, permease protein PhnE [Staphylococcus]	100	99.6	8.33e-178
CP064772.1_1325|1433223|1434401|-1|ID=1_1325;partial=00;start_type=ATG;rbs_motif=GGAG/GAGG;rbs_spacer=5-10bp;gc_cont=0.369	WP_000197806.1 MULTISPECIES: phosphopentomutase [Staphylococcus]	100	99.7	4.49e-293
CP064772.1_1326|1434429|1435091|-1|ID=1_1326;partial=00;start_type=ATG;rbs_motif=AGGAG;rbs_spacer=5-10bp;gc_cont=0.403	WP_000667269.1 MULTISPECIES: deoxyribose-phosphate aldolase [Staphylococcus]	100	99.5	1.46e-148
CP064772.1_1327|1435172|1436530|-1|ID=1_1327;partial=00;start_type=ATG;rbs_motif=None;rbs_spacer=None;gc_cont=0.319	WP_001100299.1 MULTISPECIES: tetracycline efflux MFS transporter Tet(38) [Staphylococcus]	100	99.3	3.46e-295
CP064772.1_1328|1436531|1437238|-1|ID=1_1328;partial=00;start_type=ATG;rbs_motif=GGAG/GAGG;rbs_spacer=5-10bp;gc_cont=0.374	WP_000843292.1 MULTISPECIES: purine-nucleoside phosphorylase [Staphylococcus]	100	99.6	5.75e-167
CP064772.1_1329|1437474|1438229|1|ID=1_1329;partial=00;start_type=ATG;rbs_motif=None;rbs_spacer=None;gc_cont=0.358	WP_001795345.1 MULTISPECIES: GntR family transcriptional regulator [Staphylococcus]	100	99.6	4.75e-183
CP064772.1_1330|1438420|1439145|-1|ID=1_1330;partial=00;start_type=ATG;rbs_motif=GGA/GAG/AGG;rbs_spacer=5-10bp;gc_cont=0.354	WP_031765273.1 LPXTG cell wall anchor domain-containing protein [Staphylococcus aureus]	86.7	99.6	6.73e-125
CP064772.1_1331|1439512|1440111|-1|ID=1_1331;partial=00;start_type=ATG;rbs_motif=AGGAG;rbs_spacer=5-10bp;gc_cont=0.353	WP_000874681.1 MULTISPECIES: superoxide dismutase [Staphylococcus]	100	99.5	2.49e-150
CP064772.1_1332|1440379|1441641|-1|ID=1_1332;partial=00;start_type=GTG;rbs_motif=None;rbs_spacer=None;gc_cont=0.310	WP_001813523.1 oligosaccharide flippase family protein [Staphylococcus aureus]	100	98.3	2.27e-270
CP064772.1_1333|1441613|1441837|-1|ID=1_1333;partial=00;start_type=ATG;rbs_motif=None;rbs_spacer=None;gc_cont=0.333	WP_431450977.1 oligosaccharide flippase family protein, partial [Enterococcus faecalis]	98.6	96.0	1.94e-40
CP064772.1_1334|1441803|1443041|-1|ID=1_1334;partial=00;start_type=ATG;rbs_motif=GGA/GAG/AGG;rbs_spacer=11-12bp;gc_cont=0.303	WP_000431230.1 MULTISPECIES: O-antigen ligase family protein [Staphylococcus]	100	99.8	2.41e-273
CP064772.1_1335|1443022|1444188|-1|ID=1_1335;partial=00;start_type=TTG;rbs_motif=GGA/GAG/AGG;rbs_spacer=11-12bp;gc_cont=0.338	WP_000692504.1 MULTISPECIES: glycosyltransferase family 4 protein [Staphylococcus]	100	99.7	1.48e-280
CP064772.1_1336|1444398|1445090|-1|ID=1_1336;partial=00;start_type=TTG;rbs_motif=GGAG/GAGG;rbs_spacer=5-10bp;gc_cont=0.348	WP_000736082.1 MULTISPECIES: sugar transferase [Staphylococcus]	100	99.6	1.41e-160
