NZ_CP160832.1_2868|3166808|3167755|-1|ID=1_2868;partial=00;start_type=ATG;rbs_motif=3Base/5BMM;rbs_spacer=13-15bp;gc_cont=0.639	WP_003403232.1 MULTISPECIES: DUF732 domain-containing protein [Mycobacterium]	100	99.7	1.59e-229
NZ_CP160832.1_2869|3167766|3168923|-1|ID=1_2869;partial=00;start_type=ATG;rbs_motif=GGAG/GAGG;rbs_spacer=5-10bp;gc_cont=0.692	WP_003903091.1 MULTISPECIES: hypothetical protein [Mycobacterium tuberculosis complex]	100	99.7	4.88e-273
NZ_CP160832.1_2870|3169318|3170409|-1|ID=1_2870;partial=00;start_type=ATG;rbs_motif=GGA/GAG/AGG;rbs_spacer=5-10bp;gc_cont=0.726	WP_003403225.1 MULTISPECIES: galactokinase [Mycobacterium tuberculosis complex]	100	99.7	1.44e-247
NZ_CP160832.1_2871|3170406|3171590|-1|ID=1_2871;partial=00;start_type=ATG;rbs_motif=4Base/6BMM;rbs_spacer=13-15bp;gc_cont=0.679	WP_031652152.1 MULTISPECIES: galactose-1-phosphate uridylyltransferase [unclassified Mycobacterium tuberculosis complex]	99.4	91.1	3.81e-264
NZ_CP160832.1_2872|3171719|3172120|-1|ID=1_2872;partial=00;start_type=GTG;rbs_motif=GGAG/GAGG;rbs_spacer=5-10bp;gc_cont=0.647	WP_003403218.1 MULTISPECIES: type II toxin-antitoxin system ribonuclease VapC29 [Mycobacterium]	100	99.3	7.73e-88
NZ_CP160832.1_2873|3172117|3172344|-1|ID=1_2873;partial=00;start_type=GTG;rbs_motif=AGGA;rbs_spacer=5-10bp;gc_cont=0.640	WP_003403213.1 MULTISPECIES: antitoxin VapB29 [Mycobacterium]	100	98.7	4.65e-44
NZ_CP160832.1_2874|3172539|3172778|-1|ID=1_2874;partial=00;start_type=ATG;rbs_motif=GGAG/GAGG;rbs_spacer=5-10bp;gc_cont=0.683	WP_003403210.1 MULTISPECIES: hypothetical protein [Mycobacterium]	100	98.8	1.56e-44
NZ_CP160832.1_2875|3172778|3173527|-1|ID=1_2875;partial=00;start_type=GTG;rbs_motif=GGA/GAG/AGG;rbs_spacer=5-10bp;gc_cont=0.659	WP_031682045.1 hypothetical protein [Mycobacterium tuberculosis]	95.2	99.6	8.98e-162
NZ_CP160832.1_2876|3173611|3176178|1|ID=1_2876;partial=00;start_type=GTG;rbs_motif=AGxAGG/AGGxGG;rbs_spacer=5-10bp;gc_cont=0.713	WP_003900188.1 MULTISPECIES: SEC-C metal-binding domain-containing protein [Mycobacterium]	100	99.9	0.0
NZ_CP160832.1_2877|3176197|3176745|-1|ID=1_2877;partial=00;start_type=ATG;rbs_motif=GGxGG;rbs_spacer=5-10bp;gc_cont=0.703	WP_003911256.1 hypothetical protein [Mycobacterium tuberculosis]	100	99.5	9.11e-122
NZ_CP160832.1_2878|3176944|3177165|1|ID=1_2878;partial=00;start_type=ATG;rbs_motif=AGGAG;rbs_spacer=5-10bp;gc_cont=0.644	WP_003898525.1 MULTISPECIES: DUF4926 domain-containing protein [Mycobacterium]	100	98.6	8.15e-44
NZ_CP160832.1_2879|3177217|3178374|1|ID=1_2879;partial=00;start_type=ATG;rbs_motif=None;rbs_spacer=None;gc_cont=0.692	WP_003403193.1 MULTISPECIES: hypothetical protein [Mycobacterium tuberculosis complex]	100	99.7	1.38e-288
NZ_CP160832.1_2880|3178454|3178651|1|ID=1_2880;partial=00;start_type=GTG;rbs_motif=GGAGG;rbs_spacer=3-4bp;gc_cont=0.646	WP_003403191.1 hypothetical protein [Mycobacterium tuberculosis]	100	98.5	1.33e-43
NZ_CP160832.1_2881|3179239|3179640|-1|ID=1_2881;partial=00;start_type=GTG;rbs_motif=GGAG/GAGG;rbs_spacer=5-10bp;gc_cont=0.649	WP_003403187.1 MULTISPECIES: type II toxin-antitoxin system VapC family toxin [Mycobacterium]	100	99.3	1.28e-86
NZ_CP160832.1_2882|3179637|3179882|-1|ID=1_2882;partial=00;start_type=ATG;rbs_motif=AGxAGG/AGGxGG;rbs_spacer=5-10bp;gc_cont=0.634	WP_003403184.1 MULTISPECIES: type II toxin-antitoxin system VapB family antitoxin [Mycobacterium]	100	98.8	1.81e-46
NZ_CP160832.1_2883|3179927|3180397|-1|ID=1_2883;partial=00;start_type=ATG;rbs_motif=GGA/GAG/AGG;rbs_spacer=5-10bp;gc_cont=0.656	WP_003898523.1 MULTISPECIES: hypothetical protein [Mycobacterium]	100	99.4	5.99e-112
NZ_CP160832.1_2884|3180367|3181110|-1|ID=1_2884;partial=00;start_type=ATG;rbs_motif=GGAG/GAGG;rbs_spacer=5-10bp;gc_cont=0.664	WP_235626162.1 IS607 family element RNA-guided endonuclease TnpB [Mycobacterium tuberculosis]	100	96.0	2.02e-169
NZ_CP160832.1_2885|3181112|3181696|-1|ID=1_2885;partial=00;start_type=ATG;rbs_motif=AGGA;rbs_spacer=5-10bp;gc_cont=0.639	WP_003403171.1 MULTISPECIES: IS607-like element IS1536 family transposase [Mycobacterium]	100	99.5	2.79e-131
NZ_CP160832.1_2886|3181937|3182863|-1|ID=1_2886;partial=00;start_type=ATG;rbs_motif=GGAG/GAGG;rbs_spacer=5-10bp;gc_cont=0.697	WP_003907436.1 MULTISPECIES: DUF1259 domain-containing protein [Mycobacterium tuberculosis complex]	100	99.7	1.31e-215
NZ_CP160832.1_2887|3182959|3183270|-1|ID=1_2887;partial=00;start_type=ATG;rbs_motif=AGGAG;rbs_spacer=5-10bp;gc_cont=0.750	WP_003403164.1 MULTISPECIES: PepSY domain-containing protein [Mycobacterium]	100	99.0	5.07e-54
NZ_CP160832.1_2888|3183393|3184088|1|ID=1_2888;partial=00;start_type=GTG;rbs_motif=GGA/GAG/AGG;rbs_spacer=5-10bp;gc_cont=0.690	WP_197044064.1 two-component system response regulator TcrA [Mycobacterium tuberculosis]	100	99.6	1.16e-164
NZ_CP160832.1_2889|3184072|3184602|1|ID=1_2889;partial=00;start_type=ATG;rbs_motif=GGAGG;rbs_spacer=5-10bp;gc_cont=0.695	WP_031733895.1 two component system sensor kinase HK2 [Mycobacterium tuberculosis]	91.5	99.4	3.81e-102
NZ_CP160832.1_2890|3184716|3185222|1|ID=1_2890;partial=00;start_type=GTG;rbs_motif=None;rbs_spacer=None;gc_cont=0.688	WP_003900973.1 MULTISPECIES: two component system sensor kinase HK1 [Mycobacterium]	100	99.4	1.18e-117
NZ_CP160832.1_2891|3185326|3185562|1|ID=1_2891;partial=00;start_type=ATG;rbs_motif=None;rbs_spacer=None;gc_cont=0.616	WP_003403139.1 MULTISPECIES: type II toxin-antitoxin system antitoxin VapB27 [Mycobacterium]	100	98.7	8.79e-48
NZ_CP160832.1_2892|3185559|3185972|1|ID=1_2892;partial=00;start_type=GTG;rbs_motif=None;rbs_spacer=None;gc_cont=0.659	WP_003403137.1 MULTISPECIES: type II toxin-antitoxin system VapC family toxin [Mycobacterium]	100	99.3	1.73e-86
NZ_CP160832.1_2893|3186223|3187458|1|ID=1_2893;partial=00;start_type=ATG;rbs_motif=None;rbs_spacer=None;gc_cont=0.672	WP_003403128.1 MULTISPECIES: ATP-binding protein [Mycobacterium]	100	99.8	9.87e-293
NZ_CP160832.1_2894|3187641|3187898|1|ID=1_2894;partial=00;start_type=ATG;rbs_motif=None;rbs_spacer=None;gc_cont=0.643	WP_003403125.1 MULTISPECIES: type II toxin-antitoxin system antitoxin VapB4 [Mycobacterium]	100	98.8	9.38e-53
NZ_CP160832.1_2895|3187892|3188287|1|ID=1_2895;partial=00;start_type=GTG;rbs_motif=GGA/GAG/AGG;rbs_spacer=5-10bp;gc_cont=0.641	WP_003403122.1 MULTISPECIES: type II toxin-antitoxin system toxin ribonuclease C4 [Mycobacterium]	99.2	98.5	1.20e-83
NZ_CP160832.1_2896|3188339|3189889|-1|ID=1_2896;partial=00;start_type=ATG;rbs_motif=GGA/GAG/AGG;rbs_spacer=5-10bp;gc_cont=0.639	WP_003403119.1 MULTISPECIES: MCE family protein [Mycobacterium]	100	99.8	0.0
NZ_CP160832.1_2897|3189894|3190361|-1|ID=1_2897;partial=00;start_type=GTG;rbs_motif=GGA/GAG/AGG;rbs_spacer=3-4bp;gc_cont=0.639	WP_419199258.1 MCE family protein [Mycobacterium tuberculosis]	99.4	99.4	2.26e-103
NZ_CP160832.1_2898|3190536|3191090|-1|ID=1_2898;partial=00;start_type=GTG;rbs_motif=GGAG/GAGG;rbs_spacer=5-10bp;gc_cont=0.649	WP_003403114.1 virulence factor Mce family protein [Mycobacterium tuberculosis]	99.5	99.5	7.36e-123
NZ_CP160832.1_2899|3191077|3192627|-1|ID=1_2899;partial=00;start_type=ATG;rbs_motif=GGAGG;rbs_spacer=5-10bp;gc_cont=0.631	WP_211700879.1 virulence factor Mce family protein, partial [Mycobacterium tuberculosis]	100	89.9	4.59e-293
NZ_CP160832.1_2900|3192624|3194069|-1|ID=1_2900;partial=00;start_type=ATG;rbs_motif=GGA/GAG/AGG;rbs_spacer=11-12bp;gc_cont=0.653	WP_003403109.1 MULTISPECIES: virulence factor Mce family protein [Mycobacterium tuberculosis complex]	100	99.8	1.30e-289
NZ_CP160832.1_2901|3194066|3195097|-1|ID=1_2901;partial=00;start_type=ATG;rbs_motif=3Base/5BMM;rbs_spacer=13-15bp;gc_cont=0.624	WP_003403107.1 MULTISPECIES: MCE family protein [Mycobacterium]	100	99.7	1.81e-240
NZ_CP160832.1_2902|3195094|3196308|-1|ID=1_2902;partial=00;start_type=GTG;rbs_motif=None;rbs_spacer=None;gc_cont=0.608	WP_010950418.1 MCE family protein [Mycobacterium tuberculosis]	100	99.8	3.16e-290
NZ_CP160832.1_2903|3196314|3197201|-1|ID=1_2903;partial=00;start_type=ATG;rbs_motif=GGA/GAG/AGG;rbs_spacer=5-10bp;gc_cont=0.643	WP_003403101.1 MULTISPECIES: ABC transporter permease [Mycobacterium]	100	99.7	1.01e-190
NZ_CP160832.1_2904|3197203|3198000|-1|ID=1_2904;partial=00;start_type=ATG;rbs_motif=GGA/GAG/AGG;rbs_spacer=5-10bp;gc_cont=0.647	WP_003403095.1 MULTISPECIES: MlaE family ABC transporter permease [Mycobacterium]	100	99.6	6.85e-174
NZ_CP160832.1_2905|3197997|3198719|-1|ID=1_2905;partial=00;start_type=ATG;rbs_motif=None;rbs_spacer=None;gc_cont=0.631	WP_003403065.1 MULTISPECIES: FadR family transcriptional regulator Mce2R [Mycobacterium]	100	99.6	5.04e-159
NZ_CP160832.1_2906|3198857|3201244|1|ID=1_2906;partial=00;start_type=ATG;rbs_motif=3Base/5BMM;rbs_spacer=13-15bp;gc_cont=0.647	WP_003900178.1 MULTISPECIES: lysylphosphatidylglycerol synthase transmembrane domain-containing protein [Mycobacterium]	100	99.9	0.0
NZ_CP160832.1_2907|3201267|3203900|-1|ID=1_2907;partial=00;start_type=ATG;rbs_motif=GGA/GAG/AGG;rbs_spacer=5-10bp;gc_cont=0.647	WP_010950416.1 GH92 family glycosyl hydrolase [Mycobacterium tuberculosis]	100	99.9	0.0
NZ_CP160832.1_2908|3204054|3204740|1|ID=1_2908;partial=00;start_type=ATG;rbs_motif=GGAG/GAGG;rbs_spacer=5-10bp;gc_cont=0.639	WP_003909258.1 LpqN/LpqT family lipoprotein [Mycobacterium tuberculosis]	100	99.6	8.28e-143
NZ_CP160832.1_2909|3204800|3205207|-1|ID=1_2909;partial=00;start_type=GTG;rbs_motif=None;rbs_spacer=None;gc_cont=0.657	WP_003403047.1 MULTISPECIES: type II toxin-antitoxin system toxin ribonuclease C26 [Mycobacterium]	100	99.3	3.52e-85
NZ_CP160832.1_2910|3205426|3206004|1|ID=1_2910;partial=00;start_type=ATG;rbs_motif=None;rbs_spacer=None;gc_cont=0.634	WP_003403017.1 MULTISPECIES: mycobacterial cell wall protein Rv0580c [Mycobacterium]	100	84.5	6.39e-109
NZ_CP160832.1_2911|3206133|3206891|-1|ID=1_2911;partial=00;start_type=ATG;rbs_motif=GGAG/GAGG;rbs_spacer=5-10bp;gc_cont=0.652	WP_003898511.1 MULTISPECIES: Mut7-C RNAse domain-containing protein [Mycobacterium]	100	99.6	1.21e-181
NZ_CP160832.1_2913|3211151|3211936|-1|ID=1_2913;partial=00;start_type=ATG;rbs_motif=AGGA;rbs_spacer=5-10bp;gc_cont=0.649	WP_003403012.1 MULTISPECIES: VOC family protein [Mycobacterium]	100	99.6	2.10e-191
NZ_CP160832.1_2914|3211950|3213254|-1|ID=1_2914;partial=00;start_type=ATG;rbs_motif=None;rbs_spacer=None;gc_cont=0.680	WP_003403011.1 MULTISPECIES: TIGR03086 family metal-binding protein [Mycobacterium]	100	99.8	3.20e-312
NZ_CP160832.1_2915|3213357|3214493|1|ID=1_2915;partial=00;start_type=GTG;rbs_motif=GGA/GAG/AGG;rbs_spacer=11-12bp;gc_cont=0.673	WP_003403010.1 MULTISPECIES: FAD-binding domain [Mycobacterium tuberculosis complex]	100	99.7	1.07e-277
NZ_CP160832.1_2916|3214709|3215851|1|ID=1_2916;partial=00;start_type=GTG;rbs_motif=AGxAGG/AGGxGG;rbs_spacer=11-12bp;gc_cont=0.650	WP_010950414.1 CapA family protein [Mycobacterium tuberculosis]	100	99.7	7.57e-279
NZ_CP160832.1_2917|3215861|3217252|1|ID=1_2917;partial=00;start_type=ATG;rbs_motif=AGGAG/GGAGG;rbs_spacer=11-12bp;gc_cont=0.663	WP_003403007.1 MULTISPECIES: nicotinate phosphoribosyltransferase [Mycobacterium]	100	99.8	0.0
NZ_CP160832.1_2918|3217720|3218061|1|ID=1_2918;partial=00;start_type=ATG;rbs_motif=AGGA/GGAG/GAGG;rbs_spacer=11-12bp;gc_cont=0.596	WP_003898507.1 MULTISPECIES: hypothetical protein [Mycobacterium]	100	99.1	7.71e-74
NZ_CP160832.1_2920|3218285|3219616|1|ID=1_2920;partial=00;start_type=ATG;rbs_motif=None;rbs_spacer=None;gc_cont=0.665	WP_003403001.1 MULTISPECIES: phosphoribosyltransferase family protein [Mycobacterium]	100	99.8	2.75e-313
NZ_CP160832.1_2921|3219675|3221759|-1|ID=1_2921;partial=00;start_type=GTG;rbs_motif=GGA/GAG/AGG;rbs_spacer=5-10bp;gc_cont=0.671	WP_003402998.1 MULTISPECIES: adenosylcobalamin-dependent ribonucleoside-diphosphate reductase [Mycobacterium]	99.8	88.5	0.0
NZ_CP160832.1_2922|3221833|3222099|-1|ID=1_2922;partial=00;start_type=ATG;rbs_motif=AGGA;rbs_spacer=5-10bp;gc_cont=0.629	WP_003402995.1 MULTISPECIES: DUF1918 domain-containing protein [Mycobacterium]	100	98.9	8.82e-57
NZ_CP160832.1_2923|3222234|3223583|-1|ID=1_2923;partial=00;start_type=ATG;rbs_motif=GGA/GAG/AGG;rbs_spacer=5-10bp;gc_cont=0.686	WP_078728894.1 cytochrome P450 [Mycobacterium tuberculosis]	100	99.8	2.58e-313
NZ_CP160832.1_2924|3223762|3224781|-1|ID=1_2924;partial=00;start_type=GTG;rbs_motif=GGAGG;rbs_spacer=5-10bp;gc_cont=0.638	WP_003402990.1 MULTISPECIES: methyltransferase [Mycobacterium tuberculosis complex]	100	99.7	1.44e-244
NZ_CP160832.1_2925|3225063|3225554|1|ID=1_2925;partial=00;start_type=ATG;rbs_motif=AGGAGG;rbs_spacer=5-10bp;gc_cont=0.624	WP_003402987.1 MULTISPECIES: YajQ family cyclic di-GMP-binding protein [Mycobacterium]	100	99.4	1.05e-104
NZ_CP160832.1_2926|3225632|3227092|1|ID=1_2926;partial=00;start_type=ATG;rbs_motif=GGAG/GAGG;rbs_spacer=5-10bp;gc_cont=0.626	WP_003402981.1 MULTISPECIES: flavin-containing monooxygenase [Mycobacterium]	100	99.8	0.0
NZ_CP160832.1_2927|3227123|3228178|1|ID=1_2927;partial=00;start_type=ATG;rbs_motif=None;rbs_spacer=None;gc_cont=0.655	WP_003900965.1 MULTISPECIES: NAD(P)H-dependent glycerol-3-phosphate dehydrogenase [Mycobacterium]	100	96.9	6.93e-242
NZ_CP160832.1_2928|3228363|3229223|-1|ID=1_2928;partial=00;start_type=ATG;rbs_motif=AGGAGG;rbs_spacer=5-10bp;gc_cont=0.661	WP_003402959.1 MULTISPECIES: zinc metalloprotease HtpX [Mycobacterium]	100	99.7	1.93e-195
NZ_CP160832.1_2929|3229324|3230235|-1|ID=1_2929;partial=00;start_type=ATG;rbs_motif=GGA/GAG/AGG;rbs_spacer=5-10bp;gc_cont=0.673	WP_368571678.1 polyprenyl-diphosphate synthase GrcC [Mycobacterium tuberculosis]	100	99.7	3.16e-208
NZ_CP160832.1_2930|3230239|3231573|1|ID=1_2930;partial=00;start_type=TTG;rbs_motif=None;rbs_spacer=None;gc_cont=0.686	WP_003402939.1 MULTISPECIES: menaquinone reductase [Mycobacterium]	99.8	91.7	7.61e-298
NZ_CP160832.1_2931|3231598|3232323|1|ID=1_2931;partial=00;start_type=ATG;rbs_motif=GGA/GAG/AGG;rbs_spacer=5-10bp;gc_cont=0.649	WP_003402938.1 benzoquinone methyltransferase [Mycobacterium tuberculosis]	100	99.6	5.74e-170
NZ_CP160832.1_2932|3232357|3232695|1|ID=1_2932;partial=00;start_type=ATG;rbs_motif=None;rbs_spacer=None;gc_cont=0.625	WP_003402937.1 MULTISPECIES: DUF732 domain-containing protein [Mycobacterium]	100	99.1	1.28e-76
NZ_CP160832.1_2933|3232709|3233413|-1|ID=1_2933;partial=00;start_type=ATG;rbs_motif=None;rbs_spacer=None;gc_cont=0.668	WP_003402936.1 MULTISPECIES: demethylmenaquinone methyltransferase [Mycobacterium]	100	99.6	8.48e-164
NZ_CP160832.1_2934|3233430|3234656|-1|ID=1_2934;partial=00;start_type=GTG;rbs_motif=GGA/GAG/AGG;rbs_spacer=5-10bp;gc_cont=0.664	WP_003900963.1 GDP-mannose-dependent alpha-mannosyltransferase [Mycobacterium tuberculosis]	99.7	92.4	4.19e-276
NZ_CP160832.1_2935|3234628|3235065|-1|ID=1_2935;partial=00;start_type=GTG;rbs_motif=GGAG/GAGG;rbs_spacer=5-10bp;gc_cont=0.614	WP_003911225.1 DUF3592 domain-containing protein [Mycobacterium tuberculosis]	100	98.6	1.17e-89
NZ_CP160832.1_2936|3235140|3236804|-1|ID=1_2936;partial=00;start_type=GTG;rbs_motif=None;rbs_spacer=None;gc_cont=0.697	WP_003402927.1 MULTISPECIES: 2-succinyl-5-enolpyruvyl-6-hydroxy-3-cyclohexene-1-carboxylic-acid synthase [Mycobacterium]	100	99.8	0.0
NZ_CP160832.1_2937|3236847|3237635|-1|ID=1_2937;partial=00;start_type=GTG;rbs_motif=None;rbs_spacer=None;gc_cont=0.646	WP_003402925.1 MULTISPECIES: alpha/beta fold hydrolase [Mycobacterium]	100	99.6	1.21e-186
NZ_CP160832.1_2938|3237632|3238612|-1|ID=1_2938;partial=00;start_type=GTG;rbs_motif=GGA/GAG/AGG;rbs_spacer=5-10bp;gc_cont=0.702	WP_003402923.1 MULTISPECIES: o-succinylbenzoate synthase [Mycobacterium]	100	99.7	8.65e-219
NZ_CP160832.1_2939|3238609|3240213|-1|ID=1_2939;partial=00;start_type=ATG;rbs_motif=GGA/GAG/AGG;rbs_spacer=3-4bp;gc_cont=0.673	WP_003402920.1 MULTISPECIES: amidohydrolase [Mycobacterium]	100	99.8	0.0
NZ_CP160832.1_2940|3240390|3242006|1|ID=1_2940;partial=00;start_type=ATG;rbs_motif=GGAG/GAGG;rbs_spacer=5-10bp;gc_cont=0.652	WP_078443023.1 fatty-acid--CoA ligase FadD8 [Mycobacterium tuberculosis]	100	99.8	0.0
NZ_CP160832.1_2941|3242246|3242464|1|ID=1_2941;partial=00;start_type=ATG;rbs_motif=None;rbs_spacer=None;gc_cont=0.639	WP_003898501.1 type II toxin-antitoxin system CcdA family antitoxin [Mycobacterium tuberculosis]	100	98.6	2.10e-41
NZ_CP160832.1_2942|3242584|3242769|1|ID=1_2942;partial=00;start_type=ATG;rbs_motif=GGA/GAG/AGG;rbs_spacer=5-10bp;gc_cont=0.683	WP_368608659.1 type II toxin-antitoxin system VapC family toxin [Mycobacterium tuberculosis]	100	82.3	1.73e-24
NZ_CP160832.1_2943|3243187|3244089|1|ID=1_2943;partial=00;start_type=TTG;rbs_motif=GGAG/GAGG;rbs_spacer=5-10bp;gc_cont=0.657	WP_003915439.1 MULTISPECIES: 1,4-dihydroxy-2-naphthoyl-CoA synthase [Mycobacterium]	100	99.7	4.87e-221
NZ_CP160832.1_2944|3244281|3245069|1|ID=1_2944;partial=00;start_type=ATG;rbs_motif=None;rbs_spacer=None;gc_cont=0.670	WP_014000282.1 SDR family oxidoreductase [Mycobacterium canetti]	100	99.6	9.87e-180
NZ_CP160832.1_2945|3245132|3245518|1|ID=1_2945;partial=00;start_type=ATG;rbs_motif=None;rbs_spacer=None;gc_cont=0.656	WP_003402907.1 MULTISPECIES: VOC family protein [Mycobacterium]	100	99.2	4.55e-89
NZ_CP160832.1_2946|3245638|3246891|1|ID=1_2946;partial=00;start_type=GTG;rbs_motif=GGA/GAG/AGG;rbs_spacer=3-4bp;gc_cont=0.671	WP_003402904.1 MULTISPECIES: inorganic phosphate transporter [Mycobacterium]	100	99.8	2.35e-278
NZ_CP160832.1_2947|3246888|3247166|1|ID=1_2947;partial=00;start_type=GTG;rbs_motif=GGAG/GAGG;rbs_spacer=5-10bp;gc_cont=0.667	WP_003402901.1 MULTISPECIES: hypothetical protein [Mycobacterium]	100	98.9	1.13e-54
NZ_CP160832.1_2948|3247226|3247528|1|ID=1_2948;partial=00;start_type=GTG;rbs_motif=GGA/GAG/AGG;rbs_spacer=11-12bp;gc_cont=0.647	WP_003402896.1 MULTISPECIES: DUF3349 domain-containing protein [Mycobacterium]	100	99.0	8.87e-67
NZ_CP160832.1_2949|3247597|3248685|1|ID=1_2949;partial=00;start_type=GTG;rbs_motif=None;rbs_spacer=None;gc_cont=0.691	WP_003402892.1 MULTISPECIES: o-succinylbenzoate--CoA ligase [Mycobacterium]	100	99.7	1.20e-250
NZ_CP160832.1_2950|3248697|3250046|1|ID=1_2950;partial=00;start_type=GTG;rbs_motif=GGA/GAG/AGG;rbs_spacer=5-10bp;gc_cont=0.687	WP_003402890.1 MULTISPECIES: integral membrane protein [Mycobacterium]	99.8	99.8	0.0
NZ_CP160832.1_2951|3250067|3250729|-1|ID=1_2951;partial=00;start_type=GTG;rbs_motif=GGA/GAG/AGG;rbs_spacer=5-10bp;gc_cont=0.694	WP_003402886.1 MULTISPECIES: TIGR04282 family arsenosugar biosynthesis glycosyltransferase [Mycobacterium]	100	99.5	2.83e-146
NZ_CP160832.1_2952|3250726|3251382|-1|ID=1_2952;partial=00;start_type=ATG;rbs_motif=GGA/GAG/AGG;rbs_spacer=3-4bp;gc_cont=0.705	WP_003898499.1 MULTISPECIES: glycosyltransferase family 2 protein [Mycobacterium]	100	99.5	2.64e-150
NZ_CP160832.1_2953|3251415|3253061|-1|ID=1_2953;partial=00;start_type=ATG;rbs_motif=AGGAG;rbs_spacer=5-10bp;gc_cont=0.710	WP_347952128.1 hypothetical protein [Mycobacterium tuberculosis]	99.1	99.8	1.57e-268
NZ_CP160832.1_2954|3253370|3254803|1|ID=1_2954;partial=00;start_type=GTG;rbs_motif=GGxGG;rbs_spacer=5-10bp;gc_cont=0.668	WP_003402870.1 MULTISPECIES: DUF7937 domain-containing protein [Mycobacterium]	100	99.8	0.0
NZ_CP160832.1_2955|3254813|3255853|-1|ID=1_2955;partial=00;start_type=ATG;rbs_motif=GGA/GAG/AGG;rbs_spacer=5-10bp;gc_cont=0.703	WP_003402868.1 MULTISPECIES: NAD-dependent epimerase/dehydratase family protein [Mycobacterium]	100	99.7	2.42e-251
NZ_CP160832.1_2956|3255850|3256644|-1|ID=1_2956;partial=00;start_type=ATG;rbs_motif=GGA/GAG/AGG;rbs_spacer=11-12bp;gc_cont=0.667	WP_003402867.1 S-methyl-5'-thioadenosine phosphorylase [Mycobacterium tuberculosis]	100	99.6	1.17e-194
NZ_CP160832.1_2957|3256661|3257539|1|ID=1_2957;partial=00;start_type=GTG;rbs_motif=AGGA;rbs_spacer=5-10bp;gc_cont=0.697	WP_003402865.1 MULTISPECIES: 1,4-dihydroxy-2-naphthoate polyprenyltransferase [Mycobacterium]	100	99.7	1.07e-195
NZ_CP160832.1_2958|3257621|3258628|1|ID=1_2958;partial=00;start_type=ATG;rbs_motif=AGGA;rbs_spacer=5-10bp;gc_cont=0.660	WP_003402861.1 MULTISPECIES: beta-ketoacyl-ACP synthase III [Mycobacterium]	100	99.7	3.63e-236
NZ_CP160832.1_2959|3258657|3260354|-1|ID=1_2959;partial=00;start_type=ATG;rbs_motif=GGA/GAG/AGG;rbs_spacer=5-10bp;gc_cont=0.777	WP_142749193.1 PE family protein, partial [Mycobacterium tuberculosis]	100	21.4	1.58e-40
NZ_CP160832.1_2960|3260501|3260818|-1|ID=1_2960;partial=00;start_type=GTG;rbs_motif=GGA/GAG/AGG;rbs_spacer=5-10bp;gc_cont=0.679	WP_003402853.1 MULTISPECIES: DUF4229 domain-containing protein [Mycobacterium]	100	99.1	9.01e-58
NZ_CP160832.1_2961|3260865|3261026|1|ID=1_2961;partial=00;start_type=GTG;rbs_motif=AGGAG;rbs_spacer=5-10bp;gc_cont=0.630	WP_003402851.1 MULTISPECIES: hypothetical protein [Mycobacterium]	100	98.1	5.39e-29
NZ_CP160832.1_2962|3261023|3262234|-1|ID=1_2962;partial=00;start_type=GTG;rbs_motif=GGAG/GAGG;rbs_spacer=5-10bp;gc_cont=0.695	WP_003898495.1 MULTISPECIES: MinD/ParA family ATP-binding protein [Mycobacterium]	99.8	99.8	1.56e-290
NZ_CP160832.1_2963|3262282|3263256|-1|ID=1_2963;partial=00;start_type=TTG;rbs_motif=GGA/GAG/AGG;rbs_spacer=5-10bp;gc_cont=0.680	WP_003402849.1 MULTISPECIES: c-type cytochrome biogenesis protein CcsB [Mycobacterium]	100	99.7	3.48e-233
NZ_CP160832.1_2964|3263253|3264842|-1|ID=1_2964;partial=00;start_type=ATG;rbs_motif=GGA/GAG/AGG;rbs_spacer=5-10bp;gc_cont=0.701	WP_003402848.1 MULTISPECIES: cytochrome c biogenesis protein ResB [Mycobacterium]	100	99.8	0.0
NZ_CP160832.1_2965|3264875|3265654|-1|ID=1_2965;partial=00;start_type=ATG;rbs_motif=GGxGG;rbs_spacer=5-10bp;gc_cont=0.694	WP_003402847.1 MULTISPECIES: cytochrome c biogenesis CcdA family protein [Mycobacterium]	100	99.6	9.74e-171
NZ_CP160832.1_2966|3265651|3266262|-1|ID=1_2966;partial=00;start_type=ATG;rbs_motif=AGGAG(G)/GGAGG;rbs_spacer=13-15bp;gc_cont=0.685	WP_003911234.1 MULTISPECIES: TlpA disulfide reductase family protein [Mycobacterium]	100	99.5	4.99e-143
NZ_CP160832.1_2967|3266316|3266924|-1|ID=1_2967;partial=00;start_type=ATG;rbs_motif=GGA/GAG/AGG;rbs_spacer=5-10bp;gc_cont=0.693	WP_003402845.1 MULTISPECIES: histidine phosphatase family protein [Mycobacterium]	100	99.5	9.71e-145
NZ_CP160832.1_2968|3266924|3268312|-1|ID=1_2968;partial=00;start_type=ATG;rbs_motif=GGA/GAG/AGG;rbs_spacer=11-12bp;gc_cont=0.696	WP_003402844.1 MULTISPECIES: glutamate-1-semialdehyde 2,1-aminomutase [Mycobacterium]	100	99.8	0.0
NZ_CP160832.1_2969|3268426|3268821|1|ID=1_2969;partial=00;start_type=ATG;rbs_motif=GGA/GAG/AGG;rbs_spacer=5-10bp;gc_cont=0.659	WP_003402842.1 MULTISPECIES: nitroreductase family deazaflavin-dependent oxidoreductase [Mycobacterium]	100	99.2	6.15e-93
NZ_CP160832.1_2970|3268805|3270109|-1|ID=1_2970;partial=00;start_type=ATG;rbs_motif=None;rbs_spacer=None;gc_cont=0.621	WP_003900165.1 amino acid permease [Mycobacterium tuberculosis]	100	99.8	3.21e-296
NZ_CP160832.1_2971|3270244|3270549|-1|ID=1_2971;partial=00;start_type=ATG;rbs_motif=None;rbs_spacer=None;gc_cont=0.621	WP_070902468.1 methyltransferase [Mycobacterium tuberculosis]	99.0	99.0	7.86e-66
NZ_CP160832.1_2972|3270542|3270892|-1|ID=1_2972;partial=00;start_type=ATG;rbs_motif=None;rbs_spacer=None;gc_cont=0.615	WP_003402827.1 MULTISPECIES: class I SAM-dependent methyltransferase [Mycobacterium]	100	99.1	1.31e-80
NZ_CP160832.1_2973|3271118|3271975|1|ID=1_2973;partial=00;start_type=ATG;rbs_motif=None;rbs_spacer=None;gc_cont=0.688	WP_003912593.1 MULTISPECIES: alpha/beta hydrolase [Mycobacterium]	100	99.7	3.12e-205
NZ_CP160832.1_2974|3272096|3272212|1|ID=1_2974;partial=00;start_type=ATG;rbs_motif=GGAGG;rbs_spacer=5-10bp;gc_cont=0.650	WP_204081942.1 hypothetical protein [Mycobacterium riyadhense]	92.1	97.4	8.45e-16
NZ_CP160832.1_2975|3272263|3272958|-1|ID=1_2975;partial=00;start_type=GTG;rbs_motif=GGAG/GAGG;rbs_spacer=5-10bp;gc_cont=0.657	WP_003402818.1 MULTISPECIES: Rv0518 family GDSL lipase [Mycobacterium]	100	99.6	1.04e-167
NZ_CP160832.1_2976|3273090|3274322|-1|ID=1_2976;partial=00;start_type=GTG;rbs_motif=GGA/GAG/AGG;rbs_spacer=5-10bp;gc_cont=0.647	WP_003916685.1 MULTISPECIES: acyltransferase family protein [Mycobacterium]	100	99.8	1.79e-299
NZ_CP160832.1_2977|3274611|3275087|1|ID=1_2977;partial=00;start_type=ATG;rbs_motif=GGAG/GAGG;rbs_spacer=5-10bp;gc_cont=0.625	WP_003402807.1 MULTISPECIES: osmosensory protein OprA [Mycobacterium]	100	99.4	1.07e-106
NZ_CP160832.1_2978|3275084|3276391|-1|ID=1_2978;partial=00;start_type=ATG;rbs_motif=AGGAG;rbs_spacer=5-10bp;gc_cont=0.677	WP_050168384.1 HNH endonuclease signature motif containing protein, partial [Mycobacterium tuberculosis]	99.3	99.8	9.79e-309
NZ_CP160832.1_2979|3276698|3276997|-1|ID=1_2979;partial=00;start_type=GTG;rbs_motif=None;rbs_spacer=None;gc_cont=0.710	WP_003402715.1 MULTISPECIES: hypothetical protein [Mycobacterium]	100	99.0	1.27e-61
NZ_CP160832.1_2980|3276994|3277542|-1|ID=1_2980;partial=00;start_type=ATG;rbs_motif=GGAGG;rbs_spacer=5-10bp;gc_cont=0.663	WP_151068888.1 DUF3093 domain-containing protein [Mycobacterium tuberculosis]	99.5	99.5	6.41e-122
NZ_CP160832.1_2981|3277555|3278433|-1|ID=1_2981;partial=00;start_type=ATG;rbs_motif=3Base/5BMM;rbs_spacer=13-15bp;gc_cont=0.675	WP_010950410.1 porphobilinogen synthase [Mycobacterium tuberculosis]	100	99.7	9.18e-199
NZ_CP160832.1_2982|3278630|3280327|-1|ID=1_2982;partial=00;start_type=ATG;rbs_motif=GGAG/GAGG;rbs_spacer=5-10bp;gc_cont=0.700	WP_003900163.1 MULTISPECIES: uroporphyrinogen-III synthase [Mycobacterium]	100	99.8	0.0
NZ_CP160832.1_2983|3280360|3281163|-1|ID=1_2983;partial=00;start_type=ATG;rbs_motif=AGGA/GGAG/GAGG;rbs_spacer=11-12bp;gc_cont=0.687	WP_057389612.1 hydroxymethylbilane synthase [Mycobacterium tuberculosis]	100	99.6	9.47e-176
NZ_CP160832.1_2984|3281299|3282705|-1|ID=1_2984;partial=00;start_type=GTG;rbs_motif=AGxAGG/AGGxGG;rbs_spacer=5-10bp;gc_cont=0.668	WP_003402699.1 MULTISPECIES: glutamyl-tRNA reductase [Mycobacterium]	100	99.8	8.78e-309
NZ_CP160832.1_2985|3282755|3283033|-1|ID=1_2985;partial=00;start_type=GTG;rbs_motif=AGxAGG/AGGxGG;rbs_spacer=5-10bp;gc_cont=0.634	WP_072473549.1 glutaredoxin family protein [Mycobacterium tuberculosis]	98.9	98.9	2.11e-60
