NZ_CP160832.1_1925|2128229|2128633|-1|ID=1_1925;partial=00;start_type=ATG;rbs_motif=None;rbs_spacer=None;gc_cont=0.607	WP_003407786.1 MULTISPECIES: type II toxin-antitoxin system toxin ribonuclease VapC11 [Mycobacterium]	100	99.3	8.01e-86
NZ_CP160832.1_1926|2128639|2128842|-1|ID=1_1926;partial=00;start_type=ATG;rbs_motif=None;rbs_spacer=None;gc_cont=0.632	WP_009935474.1 MULTISPECIES: type II toxin-antitoxin system VapB family antitoxin [Mycobacterium]	100	98.5	4.98e-40
NZ_CP160832.1_1927|2128895|2130184|-1|ID=1_1927;partial=00;start_type=GTG;rbs_motif=None;rbs_spacer=None;gc_cont=0.667	WP_003407781.1 MULTISPECIES: threonine ammonia-lyase [Mycobacterium]	100	99.8	1.74e-302
NZ_CP160832.1_1928|2130219|2130665|-1|ID=1_1928;partial=00;start_type=ATG;rbs_motif=AGxAGG/AGGxGG;rbs_spacer=3-4bp;gc_cont=0.664	WP_003407780.1 MULTISPECIES: F420H(2)-dependent quinone reductase [Mycobacterium]	100	99.3	3.53e-107
NZ_CP160832.1_1929|2130675|2133578|-1|ID=1_1929;partial=00;start_type=ATG;rbs_motif=None;rbs_spacer=None;gc_cont=0.608	WP_003407779.1 MULTISPECIES: MMPL/RND family transporter [Mycobacterium tuberculosis complex]	100	99.9	0.0
NZ_CP160832.1_1930|2133575|2134006|-1|ID=1_1930;partial=00;start_type=GTG;rbs_motif=GGA/GAG/AGG;rbs_spacer=5-10bp;gc_cont=0.606	WP_017351284.1 MULTISPECIES: MmpS family transport accessory protein [Mycobacterium tuberculosis complex]	100	99.3	4.70e-96
NZ_CP160832.1_1931|2134160|2134687|-1|ID=1_1931;partial=00;start_type=GTG;rbs_motif=GGA/GAG/AGG;rbs_spacer=5-10bp;gc_cont=0.650	WP_003407773.1 MULTISPECIES: TetR/AcrR family transcriptional regulator [Mycobacterium]	99.4	99.4	1.81e-117
NZ_CP160832.1_1932|2134836|2136332|-1|ID=1_1932;partial=00;start_type=ATG;rbs_motif=GGAGG;rbs_spacer=5-10bp;gc_cont=0.635	WP_003407767.1 MULTISPECIES: succinate dehydrogenase iron-sulfur subunit [Mycobacterium]	100	49.3	1.94e-179
NZ_CP160832.1_1933|2136335|2138086|-1|ID=1_1933;partial=00;start_type=ATG;rbs_motif=None;rbs_spacer=None;gc_cont=0.634	WP_003898925.1 MULTISPECIES: fumarate reductase (quinol) flavoprotein subunit [Mycobacterium]	100	99.8	0.0
NZ_CP160832.1_1934|2138096|2138329|-1|ID=1_1934;partial=00;start_type=ATG;rbs_motif=GGAGG;rbs_spacer=5-10bp;gc_cont=0.598	WP_003407763.1 MULTISPECIES: hypothetical protein [Mycobacterium]	100	98.7	1.57e-54
NZ_CP160832.1_1935|2138457|2140322|-1|ID=1_1935;partial=00;start_type=GTG;rbs_motif=GGxGG;rbs_spacer=5-10bp;gc_cont=0.641	WP_003407762.1 MULTISPECIES: lysophospholipid acyltransferase [Mycobacterium]	100	99.8	0.0
NZ_CP160832.1_1936|2140336|2142162|-1|ID=1_1936;partial=00;start_type=ATG;rbs_motif=AGGAG;rbs_spacer=5-10bp;gc_cont=0.646	WP_024456068.1 fatty acid--CoA ligase FadD11 [Mycobacterium tuberculosis]	100	99.8	0.0
NZ_CP160832.1_1937|2142436|2144472|1|ID=1_1937;partial=00;start_type=ATG;rbs_motif=GGA/GAG/AGG;rbs_spacer=5-10bp;gc_cont=0.622	WP_142745762.1 PPE family protein, partial [Mycobacterium tuberculosis]	99.0	30.6	4.07e-118
NZ_CP160832.1_1938|2144521|2148075|-1|ID=1_1938;partial=00;start_type=ATG;rbs_motif=None;rbs_spacer=None;gc_cont=0.641	WP_003407751.1 MULTISPECIES: DNA polymerase III subunit alpha [Mycobacterium]	100	99.9	0.0
NZ_CP160832.1_1939|2148143|2148574|-1|ID=1_1939;partial=00;start_type=ATG;rbs_motif=None;rbs_spacer=None;gc_cont=0.660	WP_003407748.1 MULTISPECIES: type II toxin-antitoxin system Rv0910 family toxin [Mycobacterium]	100	99.3	8.44e-99
NZ_CP160832.1_1941|2148872|2149675|-1|ID=1_1941;partial=00;start_type=ATG;rbs_motif=3Base/5BMM;rbs_spacer=13-15bp;gc_cont=0.653	WP_003407737.1 MULTISPECIES: SDR family NAD(P)-dependent oxidoreductase [Mycobacterium]	100	99.6	2.43e-184
NZ_CP160832.1_1942|2149680|2150705|-1|ID=1_1942;partial=00;start_type=ATG;rbs_motif=AGGAG;rbs_spacer=5-10bp;gc_cont=0.615	WP_003407734.1 MULTISPECIES: SDR family NAD(P)-dependent oxidoreductase [Mycobacterium]	100	99.7	8.58e-238
NZ_CP160832.1_1943|2150951|2151343|1|ID=1_1943;partial=00;start_type=TTG;rbs_motif=GGA/GAG/AGG;rbs_spacer=11-12bp;gc_cont=0.626	WP_078451477.1 group 1 truncated hemoglobin GlbN [Mycobacterium tuberculosis]	99.2	99.2	4.45e-84
NZ_CP160832.1_1944|2151398|2151991|1|ID=1_1944;partial=00;start_type=ATG;rbs_motif=None;rbs_spacer=None;gc_cont=0.635	WP_003407725.1 MULTISPECIES: lysozyme inhibitor LprI family protein [Mycobacterium]	100	99.5	2.39e-138
NZ_CP160832.1_1945|2151998|2152882|-1|ID=1_1945;partial=00;start_type=ATG;rbs_motif=GGA/GAG/AGG;rbs_spacer=5-10bp;gc_cont=0.655	WP_003407723.1 MULTISPECIES: RluA family pseudouridine synthase [Mycobacterium]	100	99.7	2.94e-211
NZ_CP160832.1_1946|2152917|2153423|-1|ID=1_1946;partial=00;start_type=ATG;rbs_motif=None;rbs_spacer=None;gc_cont=0.629	WP_116266697.1 signal peptidase II, partial [Mycobacterium tuberculosis]	100	93.5	2.30e-107
NZ_CP160832.1_1947|2153592|2154557|1|ID=1_1947;partial=00;start_type=GTG;rbs_motif=GGAG/GAGG;rbs_spacer=5-10bp;gc_cont=0.699	WP_003407720.1 MULTISPECIES: asparaginase [Mycobacterium]	99.7	99.7	3.00e-220
NZ_CP160832.1_1948|2154522|2155913|-1|ID=1_1948;partial=00;start_type=GTG;rbs_motif=GGAG/GAGG;rbs_spacer=5-10bp;gc_cont=0.680	WP_003904641.1 MULTISPECIES: DNA polymerase IV [Mycobacterium]	100	99.8	0.0
NZ_CP160832.1_1949|2156125|2159250|-1|ID=1_1949;partial=00;start_type=GTG;rbs_motif=AGGA/GGAG/GAGG;rbs_spacer=11-12bp;gc_cont=0.625	WP_010950555.1 isoleucine--tRNA ligase [Mycobacterium tuberculosis]	100	99.9	0.0
NZ_CP160832.1_1950|2159557|2159793|-1|ID=1_1950;partial=00;start_type=ATG;rbs_motif=AGGAG;rbs_spacer=5-10bp;gc_cont=0.684	WP_003407710.1 MULTISPECIES: Rv1535 family protein [Mycobacterium]	100	98.7	5.09e-47
NZ_CP160832.1_1951|2160358|2161035|-1|ID=1_1951;partial=00;start_type=GTG;rbs_motif=3Base/5BMM;rbs_spacer=13-15bp;gc_cont=0.655	WP_003407700.1 MULTISPECIES: TetR/AcrR family transcriptional regulator [Mycobacterium]	100	99.6	1.24e-147
NZ_CP160832.1_1952|2161032|2162159|-1|ID=1_1952;partial=00;start_type=ATG;rbs_motif=None;rbs_spacer=None;gc_cont=0.683	WP_003898921.1 MULTISPECIES: NAD(P)H-dependent flavin oxidoreductase [Mycobacterium]	100	99.7	9.76e-268
NZ_CP160832.1_1953|2162219|2162653|1|ID=1_1953;partial=00;start_type=ATG;rbs_motif=3Base/5BMM;rbs_spacer=13-15bp;gc_cont=0.648	WP_003407695.1 MULTISPECIES: PaaI family thioesterase [Mycobacterium]	100	99.3	1.11e-99
NZ_CP160832.1_1954|2162730|2163296|-1|ID=1_1954;partial=00;start_type=ATG;rbs_motif=GGAG/GAGG;rbs_spacer=5-10bp;gc_cont=0.623	WP_003407692.1 MULTISPECIES: carboxymuconolactone decarboxylase family protein [Mycobacterium]	100	99.5	5.48e-135
NZ_CP160832.1_1955|2163293|2164396|-1|ID=1_1955;partial=00;start_type=ATG;rbs_motif=None;rbs_spacer=None;gc_cont=0.679	WP_003407690.1 MULTISPECIES: zinc-dependent alcohol dehydrogenase [Mycobacterium]	100	99.7	1.32e-261
NZ_CP160832.1_1956|2164513|2166267|-1|ID=1_1956;partial=00;start_type=GTG;rbs_motif=AGGA/GGAG/GAGG;rbs_spacer=11-12bp;gc_cont=0.620	WP_003898920.1 MULTISPECIES: fatty-acid--AMP ligase FAAL24/FadD24 [Mycobacterium]	100	99.8	0.0
NZ_CP160832.1_1957|2167423|2173686|1|ID=1_1957;partial=00;start_type=ATG;rbs_motif=None;rbs_spacer=None;gc_cont=0.680	WP_010950554.1 sulfolipid-1 biosynthesis phthioceranic/hydroxyphthioceranic acid synthase [Mycobacterium tuberculosis]	100	100.0	0.0
NZ_CP160832.1_1958|2173709|2174989|1|ID=1_1958;partial=00;start_type=ATG;rbs_motif=GGA/GAG/AGG;rbs_spacer=5-10bp;gc_cont=0.652	WP_003407676.1 MULTISPECIES: glycosyltransferase [Mycobacterium]	100	99.8	4.31e-306
NZ_CP160832.1_1959|2174967|2175752|-1|ID=1_1959;partial=00;start_type=TTG;rbs_motif=GGAG/GAGG;rbs_spacer=5-10bp;gc_cont=0.623	WP_003407672.1 MULTISPECIES: glycosyltransferase family 2 protein [Mycobacterium]	100	99.6	6.53e-195
NZ_CP160832.1_1960|2175799|2177043|-1|ID=1_1960;partial=00;start_type=ATG;rbs_motif=None;rbs_spacer=None;gc_cont=0.653	WP_003407671.1 MULTISPECIES: glycosyltransferase [Mycobacterium]	100	99.8	2.35e-297
NZ_CP160832.1_1961|2177073|2178116|-1|ID=1_1961;partial=00;start_type=ATG;rbs_motif=GGxGG;rbs_spacer=5-10bp;gc_cont=0.639	WP_003407670.1 MULTISPECIES: phthiotriol/phenolphthiotriol dimycocerosates methyltransferase [Mycobacterium]	100	99.7	5.98e-257
NZ_CP160832.1_1962|2178157|2181480|1|ID=1_1962;partial=00;start_type=GTG;rbs_motif=None;rbs_spacer=None;gc_cont=0.616	WP_057125969.1 RND transporter MmpL12 [Mycobacterium tuberculosis]	99.4	99.3	0.0
NZ_CP160832.1_1963|2181716|2183467|-1|ID=1_1963;partial=00;start_type=ATG;rbs_motif=GGA/GAG/AGG;rbs_spacer=5-10bp;gc_cont=0.600	WP_010950552.1 MULTISPECIES: fatty-acid--AMP ligase FAAL25/FadD25 [Mycobacterium tuberculosis complex]	100	99.8	0.0
NZ_CP160832.1_1964|2183512|2183712|1|ID=1_1964;partial=00;start_type=ATG;rbs_motif=AGGA;rbs_spacer=5-10bp;gc_cont=0.587	WP_003900358.1 MULTISPECIES: hypothetical protein [Mycobacterium tuberculosis complex]	100	98.5	3.27e-40
NZ_CP160832.1_1965|2183701|2184741|-1|ID=1_1965;partial=00;start_type=GTG;rbs_motif=GGA/GAG/AGG;rbs_spacer=5-10bp;gc_cont=0.631	WP_003407657.1 MULTISPECIES: glycosyltransferase [Mycobacterium]	100	99.7	2.63e-255
NZ_CP160832.1_1966|2185166|2186125|-1|ID=1_1966;partial=00;start_type=GTG;rbs_motif=GGA/GAG/AGG;rbs_spacer=5-10bp;gc_cont=0.631	WP_010950551.1 glycosyltransferase family 2 protein [Mycobacterium tuberculosis]	100	99.7	5.55e-232
NZ_CP160832.1_1967|2186134|2186898|-1|ID=1_1967;partial=00;start_type=ATG;rbs_motif=None;rbs_spacer=None;gc_cont=0.642	WP_003407654.1 MULTISPECIES: GAP family protein [Mycobacterium]	100	99.6	2.18e-160
NZ_CP160832.1_1968|2187091|2187756|1|ID=1_1968;partial=00;start_type=ATG;rbs_motif=AGGA;rbs_spacer=5-10bp;gc_cont=0.545	WP_031673426.1 acetyltransferase [Mycobacterium tuberculosis]	99.5	99.5	1.40e-126
NZ_CP160832.1_1969|2187929|2189041|1|ID=1_1969;partial=00;start_type=ATG;rbs_motif=None;rbs_spacer=None;gc_cont=0.606	WP_003910381.1 MULTISPECIES: dTDP-4-amino-4,6-dideoxygalactose transaminase [Mycobacterium tuberculosis complex]	100	99.7	2.69e-267
NZ_CP160832.1_1970|2189214|2189633|-1|ID=1_1970;partial=00;start_type=ATG;rbs_motif=GGAGG;rbs_spacer=5-10bp;gc_cont=0.557	WP_031748020.1 hypothetical protein, partial [Mycobacterium tuberculosis]	100	99.3	4.20e-106
NZ_CP160832.1_1971|2190325|2191146|-1|ID=1_1971;partial=00;start_type=ATG;rbs_motif=3Base/5BMM;rbs_spacer=13-15bp;gc_cont=0.543	WP_003898901.1 MULTISPECIES: phytanoyl-CoA dioxygenase family protein [Mycobacterium]	100	99.6	6.03e-197
NZ_CP160832.1_1972|2191158|2192186|-1|ID=1_1972;partial=00;start_type=ATG;rbs_motif=GGA/GAG/AGG;rbs_spacer=5-10bp;gc_cont=0.549	WP_003407612.1 MULTISPECIES: glycosyltransferase LosA [Mycobacterium]	100	99.7	6.35e-245
NZ_CP160832.1_1973|2192711|2192902|1|ID=1_1973;partial=00;start_type=GTG;rbs_motif=None;rbs_spacer=None;gc_cont=0.646	WP_003407609.1 dodecin [Mycobacterium tuberculosis]	100	98.4	1.22e-36
NZ_CP160832.1_1974|2193116|2193733|1|ID=1_1974;partial=00;start_type=GTG;rbs_motif=GGA/GAG/AGG;rbs_spacer=5-10bp;gc_cont=0.586	WP_003407606.1 class I SAM-dependent methyltransferase [Mycobacterium tuberculosis]	100	99.5	4.28e-154
NZ_CP160832.1_1975|2193806|2194972|-1|ID=1_1975;partial=00;start_type=ATG;rbs_motif=GGA/GAG/AGG;rbs_spacer=11-12bp;gc_cont=0.675	WP_031739722.1 serine hydrolase domain-containing protein, partial [Mycobacterium tuberculosis]	100	99.7	3.47e-283
NZ_CP160832.1_1976|2195148|2196152|-1|ID=1_1976;partial=00;start_type=ATG;rbs_motif=None;rbs_spacer=None;gc_cont=0.678	WP_003407596.1 MULTISPECIES: methylmalonyl Co-A mutase-associated GTPase MeaB [Mycobacterium]	100	99.7	3.08e-232
NZ_CP160832.1_1977|2196149|2196466|-1|ID=1_1977;partial=00;start_type=GTG;rbs_motif=None;rbs_spacer=None;gc_cont=0.632	WP_003407593.1 MULTISPECIES: type II toxin-antitoxin system toxin endoribonuclease MazF4 [Mycobacterium]	100	99.1	5.85e-72
NZ_CP160832.1_1978|2196463|2196765|-1|ID=1_1978;partial=00;start_type=GTG;rbs_motif=GGAG/GAGG;rbs_spacer=5-10bp;gc_cont=0.640	WP_003900349.1 MULTISPECIES: type II toxin-antitoxin system antitoxin MazE4 [Mycobacterium]	100	99.0	9.26e-60
NZ_CP160832.1_1979|2196779|2199031|-1|ID=1_1979;partial=00;start_type=ATG;rbs_motif=GGxGG;rbs_spacer=5-10bp;gc_cont=0.672	WP_003407587.1 MULTISPECIES: methylmalonyl-CoA mutase [Mycobacterium]	100	99.9	0.0
NZ_CP160832.1_1980|2199032|2200879|-1|ID=1_1980;partial=00;start_type=GTG;rbs_motif=AGGAG;rbs_spacer=5-10bp;gc_cont=0.703	WP_003407585.1 MULTISPECIES: methylmalonyl-CoA mutase small subunit [Mycobacterium]	100	99.8	0.0
NZ_CP160832.1_1981|2201070|2201828|1|ID=1_1981;partial=00;start_type=GTG;rbs_motif=None;rbs_spacer=None;gc_cont=0.668	WP_003407583.1 MULTISPECIES: TVP38/TMEM64 family protein [Mycobacterium]	100	99.6	3.53e-165
NZ_CP160832.1_1982|2202407|2203714|-1|ID=1_1982;partial=00;start_type=GTG;rbs_motif=AGGAG/GGAGG;rbs_spacer=11-12bp;gc_cont=0.570	WP_003898896.1 MULTISPECIES: membrane protein [Mycobacterium]	100	99.8	1.11e-308
NZ_CP160832.1_1983|2203864|2204073|-1|ID=1_1983;partial=00;start_type=GTG;rbs_motif=GGAG/GAGG;rbs_spacer=5-10bp;gc_cont=0.686	WP_003407578.1 MULTISPECIES: methylmalonyl-CoA mutase [Mycobacterium tuberculosis complex]	98.6	98.6	2.26e-36
NZ_CP160832.1_1984|2204128|2204484|-1|ID=1_1984;partial=00;start_type=ATG;rbs_motif=GGA/GAG/AGG;rbs_spacer=5-10bp;gc_cont=0.633	WP_003900347.1 MULTISPECIES: DoxX family protein [Mycobacterium]	100	99.2	2.96e-69
NZ_CP160832.1_1985|2204494|2205639|-1|ID=1_1985;partial=00;start_type=GTG;rbs_motif=AGGA;rbs_spacer=5-10bp;gc_cont=0.668	WP_003407571.1 MULTISPECIES: SPFH domain-containing protein [Mycobacterium]	100	99.7	1.03e-210
NZ_CP160832.1_1986|2205661|2206095|-1|ID=1_1986;partial=00;start_type=ATG;rbs_motif=None;rbs_spacer=None;gc_cont=0.674	WP_003407562.1 MULTISPECIES: NfeD family protein [Mycobacterium]	100	99.3	1.50e-88
NZ_CP160832.1_1987|2206111|2207019|1|ID=1_1987;partial=00;start_type=GTG;rbs_motif=AGGA;rbs_spacer=5-10bp;gc_cont=0.659	WP_043856384.1 hypothetical protein [Mycobacterium tuberculosis]	100	95.0	4.30e-199
NZ_CP160832.1_1988|2206985|2208019|-1|ID=1_1988;partial=00;start_type=ATG;rbs_motif=None;rbs_spacer=None;gc_cont=0.661	WP_003407559.1 MULTISPECIES: ferrochelatase [Mycobacterium]	100	99.7	1.52e-253
NZ_CP160832.1_1989|2208025|2208834|-1|ID=1_1989;partial=00;start_type=ATG;rbs_motif=AGGA;rbs_spacer=5-10bp;gc_cont=0.654	WP_003407553.1 MULTISPECIES: NADH-dependent enoyl-ACP reductase InhA [Mycobacterium]	100	99.6	2.64e-189
NZ_CP160832.1_1990|2208853|2209596|-1|ID=1_1990;partial=00;start_type=GTG;rbs_motif=GGA/GAG/AGG;rbs_spacer=5-10bp;gc_cont=0.645	WP_003898892.1 MULTISPECIES: 3-oxoacyl-ACP reductase FabG1 [Mycobacterium]	100	99.6	4.15e-166
NZ_CP160832.1_1991|2209656|2210579|1|ID=1_1991;partial=00;start_type=GTG;rbs_motif=GGA/GAG/AGG;rbs_spacer=5-10bp;gc_cont=0.652	WP_003407537.1 MULTISPECIES: hypothetical protein [Mycobacterium]	100	90.9	1.81e-204
NZ_CP160832.1_1992|2210652|2211659|-1|ID=1_1992;partial=00;start_type=ATG;rbs_motif=None;rbs_spacer=None;gc_cont=0.654	WP_003407530.1 MULTISPECIES: VWA domain-containing protein [Mycobacterium]	100	99.7	5.07e-227
NZ_CP160832.1_1993|2211670|2212623|-1|ID=1_1993;partial=00;start_type=GTG;rbs_motif=GGA/GAG/AGG;rbs_spacer=5-10bp;gc_cont=0.684	WP_003407529.1 MULTISPECIES: DUF58 domain-containing protein [Mycobacterium]	100	99.7	1.99e-224
NZ_CP160832.1_1994|2212620|2213753|-1|ID=1_1994;partial=00;start_type=ATG;rbs_motif=GGAGG;rbs_spacer=5-10bp;gc_cont=0.656	WP_003407527.1 MULTISPECIES: chaperone MoxR1 [Mycobacterium]	100	99.7	8.24e-261
NZ_CP160832.1_1995|2213892|2214617|-1|ID=1_1995;partial=00;start_type=ATG;rbs_motif=GGA/GAG/AGG;rbs_spacer=5-10bp;gc_cont=0.672	WP_003407525.1 MULTISPECIES: NlpC/P60 family peptidoglycan endopeptidase RipB [Mycobacterium]	100	99.6	2.24e-167
NZ_CP160832.1_1996|2214628|2216046|-1|ID=1_1996;partial=00;start_type=ATG;rbs_motif=AGGAG/GGAGG;rbs_spacer=11-12bp;gc_cont=0.670	WP_003407523.1 MULTISPECIES: NlpC/P60 family peptidoglycan endopeptidase RipA [Mycobacterium]	100	99.8	0.0
NZ_CP160832.1_1997|2216272|2216832|-1|ID=1_1997;partial=00;start_type=ATG;rbs_motif=AGGA;rbs_spacer=5-10bp;gc_cont=0.636	WP_003407520.1 MULTISPECIES: Rv1476 family membrane protein [Mycobacterium]	100	99.5	1.63e-126
NZ_CP160832.1_1998|2216990|2219821|1|ID=1_1998;partial=00;start_type=GTG;rbs_motif=GGAG/GAGG;rbs_spacer=5-10bp;gc_cont=0.630	WP_003898889.1 MULTISPECIES: iron-regulated aconitate hydratase Acn [Mycobacterium]	100	99.9	0.0
NZ_CP160832.1_1999|2219832|2220395|1|ID=1_1999;partial=00;start_type=GTG;rbs_motif=GGA/GAG/AGG;rbs_spacer=5-10bp;gc_cont=0.665	WP_003407514.1 MULTISPECIES: TetR/AcrR family transcriptional regulator [Mycobacterium]	100	99.5	1.06e-127
NZ_CP160832.1_2000|2220464|2220655|-1|ID=1_2000;partial=00;start_type=ATG;rbs_motif=GGAGG;rbs_spacer=5-10bp;gc_cont=0.688	WP_010950547.1 helix-turn-helix domain-containing protein [Mycobacterium tuberculosis]	100	98.4	5.85e-35
NZ_CP160832.1_2001|2220752|2222380|-1|ID=1_2001;partial=00;start_type=GTG;rbs_motif=GGAG/GAGG;rbs_spacer=5-10bp;gc_cont=0.669	WP_003407507.1 MULTISPECIES: macrolide ABC transporter ATP-binding protein [Mycobacterium]	100	99.8	0.0
NZ_CP160832.1_2002|2222416|2223273|-1|ID=1_2002;partial=00;start_type=GTG;rbs_motif=GGA/GAG/AGG;rbs_spacer=5-10bp;gc_cont=0.647	WP_003407504.1 MULTISPECIES: enoyl-CoA hydratase [Mycobacterium tuberculosis complex]	100	99.7	8.84e-196
NZ_CP160832.1_2003|2223295|2223519|-1|ID=1_2003;partial=00;start_type=GTG;rbs_motif=GGA/GAG/AGG;rbs_spacer=11-12bp;gc_cont=0.640	WP_406842224.1 thioredoxin [Mycobacterium tuberculosis]	98.6	98.7	8.61e-40
NZ_CP160832.1_2004|2223681|2224055|-1|ID=1_2004;partial=00;start_type=GTG;rbs_motif=GGA/GAG/AGG;rbs_spacer=5-10bp;gc_cont=0.573	WP_003900345.1 MULTISPECIES: thioredoxin family protein [Mycobacterium]	100	99.2	5.19e-84
NZ_CP160832.1_2005|2224099|2226072|-1|ID=1_2005;partial=00;start_type=ATG;rbs_motif=GGAG/GAGG;rbs_spacer=5-10bp;gc_cont=0.668	WP_003900344.1 MULTISPECIES: cobalt-translocating P-type ATPase CtpD [Mycobacterium]	100	99.8	0.0
NZ_CP160832.1_2006|2226314|2227426|1|ID=1_2006;partial=00;start_type=ATG;rbs_motif=GGAGG;rbs_spacer=5-10bp;gc_cont=0.754	WP_142749222.1 PE family protein, partial [Mycobacterium tuberculosis]	100	76.0	1.32e-88
NZ_CP160832.1_2007|2227533|2229362|1|ID=1_2007;partial=00;start_type=TTG;rbs_motif=GGA/GAG/AGG;rbs_spacer=5-10bp;gc_cont=0.638	WP_003900343.1 MULTISPECIES: acyl-CoA dehydrogenase [Mycobacterium]	100	99.8	0.0
NZ_CP160832.1_2008|2229457|2229804|-1|ID=1_2008;partial=00;start_type=ATG;rbs_motif=AGGAG;rbs_spacer=5-10bp;gc_cont=0.658	WP_003407492.1 MULTISPECIES: metal-sulfur cluster assembly factor [Mycobacteriaceae]	100	99.1	5.59e-77
NZ_CP160832.1_2009|2229779|2230267|-1|ID=1_2009;partial=00;start_type=GTG;rbs_motif=GGA/GAG/AGG;rbs_spacer=5-10bp;gc_cont=0.640	WP_003407491.1 MULTISPECIES: Fe-S cluster assembly sulfur transfer protein SufU [Mycobacterium]	100	99.4	1.63e-112
NZ_CP160832.1_2010|2230264|2231517|-1|ID=1_2010;partial=00;start_type=ATG;rbs_motif=GGAG/GAGG;rbs_spacer=5-10bp;gc_cont=0.677	WP_031702514.1 cysteine desulfurase [Mycobacterium tuberculosis]	100	99.8	2.55e-298
NZ_CP160832.1_2011|2231519|2232319|-1|ID=1_2011;partial=00;start_type=ATG;rbs_motif=3Base/5BMM;rbs_spacer=13-15bp;gc_cont=0.650	WP_003407489.1 MULTISPECIES: Fe-S cluster assembly ATPase SufC [Mycobacterium]	100	99.6	8.52e-189
NZ_CP160832.1_2012|2232316|2233509|-1|ID=1_2012;partial=00;start_type=ATG;rbs_motif=GGAGG;rbs_spacer=5-10bp;gc_cont=0.678	WP_003407487.1 MULTISPECIES: Fe-S cluster assembly protein SufD [Mycobacterium]	100	99.7	8.33e-287
NZ_CP160832.1_2013|2233506|2236046|-1|ID=1_2013;partial=00;start_type=ATG;rbs_motif=AGGAG;rbs_spacer=5-10bp;gc_cont=0.618	WP_003407484.1 MULTISPECIES: intein-containing Fe-S cluster assembly protein SufB [Mycobacterium]	100	99.9	0.0
NZ_CP160832.1_2014|2236043|2236777|-1|ID=1_2014;partial=00;start_type=GTG;rbs_motif=None;rbs_spacer=None;gc_cont=0.712	WP_003407481.1 MULTISPECIES: suf operon transcriptional regulator SufR [Mycobacterium tuberculosis complex]	99.6	99.6	9.21e-165
NZ_CP160832.1_2015|2236897|2238672|1|ID=1_2015;partial=00;start_type=ATG;rbs_motif=GGA/GAG/AGG;rbs_spacer=5-10bp;gc_cont=0.670	WP_003407479.1 MULTISPECIES: polyprenol phosphomannose-dependent alpha 1,6 mannosyltransferase MptB [Mycobacterium]	100	99.8	0.0
NZ_CP160832.1_2016|2238775|2239716|1|ID=1_2016;partial=00;start_type=GTG;rbs_motif=AGGAGG;rbs_spacer=5-10bp;gc_cont=0.677	WP_003407477.1 MULTISPECIES: ABC transporter ATP-binding protein [Mycobacterium]	100	99.7	4.88e-223
NZ_CP160832.1_2017|2239713|2240498|1|ID=1_2017;partial=00;start_type=GTG;rbs_motif=AGGA;rbs_spacer=5-10bp;gc_cont=0.662	WP_003407475.1 MULTISPECIES: ABC transporter permease [Mycobacterium]	100	99.6	1.96e-171
NZ_CP160832.1_2018|2240610|2241542|1|ID=1_2018;partial=00;start_type=GTG;rbs_motif=None;rbs_spacer=None;gc_cont=0.687	WP_003407466.1 MULTISPECIES: COX15/CtaA family protein [Mycobacterium]	100	99.7	1.90e-198
NZ_CP160832.1_2019|2241492|2242355|-1|ID=1_2019;partial=00;start_type=ATG;rbs_motif=None;rbs_spacer=None;gc_cont=0.669	WP_003900341.1 MULTISPECIES: hypothetical protein [Mycobacterium]	100	99.7	2.05e-211
NZ_CP160832.1_2020|2242375|2243361|1|ID=1_2020;partial=00;start_type=ATG;rbs_motif=None;rbs_spacer=None;gc_cont=0.671	WP_003407462.1 MULTISPECIES: quinone oxidoreductase family protein [Mycobacterium]	100	99.7	3.21e-231
NZ_CP160832.1_2021|2243389|2244687|-1|ID=1_2021;partial=00;start_type=GTG;rbs_motif=None;rbs_spacer=None;gc_cont=0.639	WP_057128219.1 Rv1453 family transcriptional regulator [Mycobacterium tuberculosis]	99.8	99.8	1.92e-312
NZ_CP160832.1_2022|2244806|2245969|1|ID=1_2022;partial=00;start_type=ATG;rbs_motif=GGA/GAG/AGG;rbs_spacer=5-10bp;gc_cont=0.767	WP_146418676.1 PE family protein, partial [Mycobacterium tuberculosis]	100	33.2	7.58e-68
NZ_CP160832.1_2024|2247292|2248218|-1|ID=1_2024;partial=00;start_type=GTG;rbs_motif=AGGAG;rbs_spacer=5-10bp;gc_cont=0.661	WP_003422137.1 MULTISPECIES: heme o synthase [Mycobacterium tuberculosis complex]	100	99.7	3.81e-213
NZ_CP160832.1_2026|2253258|2255360|1|ID=1_2026;partial=00;start_type=GTG;rbs_motif=GGAG/GAGG;rbs_spacer=5-10bp;gc_cont=0.678	WP_003407451.1 MULTISPECIES: transketolase [Mycobacterium]	100	99.9	0.0
NZ_CP160832.1_2027|2255377|2256498|1|ID=1_2027;partial=00;start_type=ATG;rbs_motif=GGA/GAG/AGG;rbs_spacer=5-10bp;gc_cont=0.643	WP_003407447.1 MULTISPECIES: transaldolase [Mycobacterium]	100	99.7	2.11e-261
NZ_CP160832.1_2028|2256495|2258039|1|ID=1_2028;partial=00;start_type=ATG;rbs_motif=None;rbs_spacer=None;gc_cont=0.659	WP_003407443.1 MULTISPECIES: glucose-6-phosphate dehydrogenase [Mycobacterium]	100	99.8	0.0
NZ_CP160832.1_2029|2258092|2259003|1|ID=1_2029;partial=00;start_type=ATG;rbs_motif=AGGAGG;rbs_spacer=5-10bp;gc_cont=0.669	WP_003407437.1 MULTISPECIES: glucose-6-phosphate dehydrogenase assembly protein OpcA [Mycobacterium]	100	99.7	3.01e-212
NZ_CP160832.1_2030|2259000|2259743|1|ID=1_2030;partial=00;start_type=GTG;rbs_motif=AGxAGG/AGGxGG;rbs_spacer=5-10bp;gc_cont=0.679	WP_003407433.1 MULTISPECIES: 6-phosphogluconolactonase [Mycobacterium]	100	99.6	4.33e-168
NZ_CP160832.1_2031|2259760|2260170|1|ID=1_2031;partial=00;start_type=ATG;rbs_motif=GGA/GAG/AGG;rbs_spacer=5-10bp;gc_cont=0.633	WP_038435870.1 ATPase [Mycobacterium tuberculosis]	95.6	99.3	9.82e-49
NZ_CP160832.1_2032|2260220|2260333|1|ID=1_2032;partial=00;start_type=ATG;rbs_motif=GGA/GAG/AGG;rbs_spacer=5-10bp;gc_cont=0.632	WP_205852800.1 methyltransferase, partial [Mycobacterium tuberculosis]	100	97.4	1.31e-19
NZ_CP160832.1_2033|2260481|2260720|-1|ID=1_2033;partial=00;start_type=ATG;rbs_motif=GGA/GAG/AGG;rbs_spacer=5-10bp;gc_cont=0.583	WP_003407426.1 MULTISPECIES: hypothetical protein [Mycobacterium]	100	98.8	4.84e-50
NZ_CP160832.1_2034|2260817|2261281|1|ID=1_2034;partial=00;start_type=GTG;rbs_motif=GGA/GAG/AGG;rbs_spacer=11-12bp;gc_cont=0.658	WP_014584749.1 MULTISPECIES: hypothetical protein [Mycobacterium]	100	99.4	9.24e-106
NZ_CP160832.1_2035|2261397|2263697|-1|ID=1_2035;partial=00;start_type=ATG;rbs_motif=None;rbs_spacer=None;gc_cont=0.672	WP_003407419.1 MULTISPECIES: molybdopterin guanine dinucleotide-containing S/N-oxide reductase [Mycobacterium]	100	99.9	0.0
NZ_CP160832.1_2036|2263804|2265279|1|ID=1_2036;partial=00;start_type=ATG;rbs_motif=3Base/5BMM;rbs_spacer=13-15bp;gc_cont=0.760	WP_142746203.1 PE family protein, partial [Mycobacterium tuberculosis]	100	29.3	8.07e-76
NZ_CP160832.1_2037|2265418|2265651|-1|ID=1_2037;partial=00;start_type=ATG;rbs_motif=4Base/6BMM;rbs_spacer=13-15bp;gc_cont=0.594	WP_003407407.1 MULTISPECIES: preprotein translocase subunit SecG [Mycobacterium]	100	98.7	2.99e-41
NZ_CP160832.1_2039|2266108|2266527|1|ID=1_2039;partial=00;start_type=ATG;rbs_motif=GGA/GAG/AGG;rbs_spacer=5-10bp;gc_cont=0.626	WP_003407404.1 MULTISPECIES: nuclear transport factor 2 family protein [Mycobacterium]	100	99.3	1.92e-98
NZ_CP160832.1_2040|2266896|2267123|1|ID=1_2040;partial=00;start_type=ATG;rbs_motif=GGxGG;rbs_spacer=5-10bp;gc_cont=0.640	WP_151074014.1 transcriptional regulator [Mycobacterium tuberculosis]	98.7	98.7	1.33e-43
NZ_CP160832.1_2041|2267139|2267924|-1|ID=1_2041;partial=00;start_type=GTG;rbs_motif=GGAGG;rbs_spacer=5-10bp;gc_cont=0.639	WP_003407398.1 MULTISPECIES: triose-phosphate isomerase [Mycobacterium]	100	99.6	4.20e-182
NZ_CP160832.1_2042|2267921|2269159|-1|ID=1_2042;partial=00;start_type=ATG;rbs_motif=None;rbs_spacer=None;gc_cont=0.646	WP_003900339.1 MULTISPECIES: phosphoglycerate kinase [Mycobacterium]	100	99.8	4.65e-287
NZ_CP160832.1_2043|2269162|2270181|-1|ID=1_2043;partial=00;start_type=GTG;rbs_motif=AGGAG;rbs_spacer=5-10bp;gc_cont=0.630	WP_003407390.1 MULTISPECIES: type I glyceraldehyde-3-phosphate dehydrogenase [Mycobacterium]	100	99.7	3.80e-240
NZ_CP160832.1_2044|2270547|2271167|1|ID=1_2044;partial=00;start_type=ATG;rbs_motif=AGGAG/GGAGG;rbs_spacer=11-12bp;gc_cont=0.688	WP_146277588.1 hypothetical protein [Mycobacterium tuberculosis]	100	99.5	3.29e-49
NZ_CP160832.1_2045|2271116|2271253|-1|ID=1_2045;partial=00;start_type=ATG;rbs_motif=AGGA;rbs_spacer=5-10bp;gc_cont=0.732	WP_003908693.1 MULTISPECIES: hypothetical protein [Mycobacterium]	100	97.8	3.36e-22
