NZ_CP160832.1_962|1052618|1053673|1|ID=1_962;partial=00;start_type=ATG;rbs_motif=GGA/GAG/AGG;rbs_spacer=3-4bp;gc_cont=0.676	WP_003412996.1 MULTISPECIES: M24 family metallopeptidase [Mycobacterium]	100	99.7	6.33e-241
NZ_CP160832.1_963|1053683|1054246|1|ID=1_963;partial=00;start_type=GTG;rbs_motif=AGGAG;rbs_spacer=5-10bp;gc_cont=0.642	WP_003412989.1 MULTISPECIES: elongation factor P [Mycobacterium]	100	99.5	1.15e-131
NZ_CP160832.1_964|1054300|1054719|1|ID=1_964;partial=00;start_type=GTG;rbs_motif=3Base/5BMM;rbs_spacer=13-15bp;gc_cont=0.707	WP_003412985.1 MULTISPECIES: transcription antitermination factor NusB [Mycobacterium tuberculosis complex]	99.3	99.3	6.43e-89
NZ_CP160832.1_965|1054719|1055120|1|ID=1_965;partial=00;start_type=ATG;rbs_motif=GGxGG;rbs_spacer=5-10bp;gc_cont=0.679	WP_070894353.1 antitermination protein NusB [Mycobacterium tuberculosis]	99.2	99.3	4.46e-78
NZ_CP160832.1_966|1055192|1058035|1|ID=1_966;partial=00;start_type=ATG;rbs_motif=GGA/GAG/AGG;rbs_spacer=5-10bp;gc_cont=0.635	WP_003899363.1 MULTISPECIES: aminotransferase class I/II-fold pyridoxal phosphate-dependent enzyme [Mycobacterium]	100	99.9	0.0
NZ_CP160832.1_967|1058287|1058706|1|ID=1_967;partial=00;start_type=GTG;rbs_motif=GGAG/GAGG;rbs_spacer=5-10bp;gc_cont=0.629	WP_003412970.1 MULTISPECIES: type II toxin-antitoxin system VapC family toxin [Mycobacterium]	100	99.3	2.75e-93
NZ_CP160832.1_968|1058707|1059717|-1|ID=1_968;partial=00;start_type=ATG;rbs_motif=None;rbs_spacer=None;gc_cont=0.696	WP_252366577.1 ERCC4 domain-containing protein [Mycobacterium tuberculosis]	99.7	99.7	2.21e-242
NZ_CP160832.1_969|1060302|1061222|1|ID=1_969;partial=00;start_type=ATG;rbs_motif=GGA/GAG/AGG;rbs_spacer=11-12bp;gc_cont=0.637	WP_003412965.1 MULTISPECIES: restriction endonuclease [Mycobacterium]	100	99.7	9.34e-213
NZ_CP160832.1_970|1061257|1061658|-1|ID=1_970;partial=00;start_type=ATG;rbs_motif=AGxAGG/AGGxGG;rbs_spacer=5-10bp;gc_cont=0.614	WP_003412963.1 MULTISPECIES: PIN domain-containing protein [Mycobacterium]	100	99.3	7.43e-95
NZ_CP160832.1_971|1061655|1061882|-1|ID=1_971;partial=00;start_type=ATG;rbs_motif=None;rbs_spacer=None;gc_cont=0.684	WP_003412960.1 MULTISPECIES: type II toxin-antitoxin system VapB family antitoxin [Mycobacterium]	100	98.7	1.57e-33
NZ_CP160832.1_972|1062399|1063121|1|ID=1_972;partial=00;start_type=ATG;rbs_motif=None;rbs_spacer=None;gc_cont=0.658	WP_003412957.1 MULTISPECIES: DUF1906 domain-containing protein [Mycobacterium]	100	99.6	1.30e-170
NZ_CP160832.1_973|1063641|1072850|1|ID=1_973;partial=00;start_type=GTG;rbs_motif=GGAG/GAGG;rbs_spacer=5-10bp;gc_cont=0.693	WP_003901420.1 MULTISPECIES: fatty acid synthase [Mycobacterium]	100	100.0	0.0
NZ_CP160832.1_974|1073043|1073435|1|ID=1_974;partial=00;start_type=ATG;rbs_motif=None;rbs_spacer=None;gc_cont=0.687	WP_003412952.1 MULTISPECIES: holo-ACP synthase AcpS [Mycobacterium]	100	99.2	4.89e-85
NZ_CP160832.1_975|1073534|1074844|1|ID=1_975;partial=00;start_type=GTG;rbs_motif=AGGA/GGAG/GAGG;rbs_spacer=11-12bp;gc_cont=0.691	WP_072490272.1 dipeptidase, partial [Mycobacterium tuberculosis]	99.8	99.8	8.14e-312
NZ_CP160832.1_976|1074816|1075289|-1|ID=1_976;partial=00;start_type=GTG;rbs_motif=None;rbs_spacer=None;gc_cont=0.629	WP_010950733.1 thioredoxin-dependent thiol peroxidase [Mycobacterium tuberculosis]	100	99.4	1.31e-111
NZ_CP160832.1_977|1075358|1075585|1|ID=1_977;partial=00;start_type=GTG;rbs_motif=GGAGG;rbs_spacer=5-10bp;gc_cont=0.627	WP_003412942.1 MULTISPECIES: DUF3618 domain-containing protein [Mycobacterium]	100	98.7	5.24e-41
NZ_CP160832.1_978|1075710|1077188|-1|ID=1_978;partial=00;start_type=GTG;rbs_motif=GGAG/GAGG;rbs_spacer=5-10bp;gc_cont=0.651	WP_003900842.1 MULTISPECIES: PecA family PE domain-processing aspartic protease [Mycobacterium]	100	99.8	1.88e-306
NZ_CP160832.1_979|1077638|1078864|1|ID=1_979;partial=00;start_type=ATG;rbs_motif=AGGAG/GGAGG;rbs_spacer=11-12bp;gc_cont=0.652	WP_003412938.1 MULTISPECIES: L,D-transpeptidase LdtMt2 [Mycobacterium]	100	99.8	1.37e-302
NZ_CP160832.1_980|1079212|1079463|1|ID=1_980;partial=00;start_type=GTG;rbs_motif=GGAG/GAGG;rbs_spacer=5-10bp;gc_cont=0.599	WP_003412936.1 MULTISPECIES: hypothetical protein [Mycobacterium]	100	98.8	1.70e-54
NZ_CP160832.1_981|1079460|1080263|1|ID=1_981;partial=00;start_type=GTG;rbs_motif=AGGA;rbs_spacer=5-10bp;gc_cont=0.612	WP_003412932.1 MULTISPECIES: helix-turn-helix transcriptional regulator [Mycobacterium]	100	99.6	1.80e-195
NZ_CP160832.1_982|1080400|1081629|1|ID=1_982;partial=00;start_type=ATG;rbs_motif=None;rbs_spacer=None;gc_cont=0.659	WP_003412926.1 MULTISPECIES: XRE family transcriptional regulator [Mycobacterium]	100	99.8	1.57e-294
NZ_CP160832.1_983|1081635|1082096|1|ID=1_983;partial=00;start_type=GTG;rbs_motif=4Base/6BMM;rbs_spacer=13-15bp;gc_cont=0.621	WP_003899362.1 MULTISPECIES: DUF4411 family protein [Mycobacterium]	100	99.4	1.27e-107
NZ_CP160832.1_984|1082390|1082812|-1|ID=1_984;partial=00;start_type=GTG;rbs_motif=GGA/GAG/AGG;rbs_spacer=5-10bp;gc_cont=0.624	WP_003412921.1 MULTISPECIES: hypothetical protein [Mycobacterium]	100	99.3	1.16e-99
NZ_CP160832.1_985|1082834|1083019|-1|ID=1_985;partial=00;start_type=ATG;rbs_motif=GGA/GAG/AGG;rbs_spacer=5-10bp;gc_cont=0.532	WP_003412914.1 hypothetical protein [Mycobacterium tuberculosis]	100	98.4	1.34e-39
NZ_CP160832.1_986|1083170|1084417|1|ID=1_986;partial=00;start_type=ATG;rbs_motif=AGGA;rbs_spacer=5-10bp;gc_cont=0.664	WP_003904572.1 MULTISPECIES: IS256-like element IS1081 family transposase [Mycobacterium tuberculosis complex]	100	99.8	4.51e-291
NZ_CP160832.1_987|1085169|1085867|-1|ID=1_987;partial=00;start_type=TTG;rbs_motif=GGA/GAG/AGG;rbs_spacer=5-10bp;gc_cont=0.660	WP_003899361.1 MULTISPECIES: oligoribonuclease [Mycobacterium]	99.5	92.3	6.63e-147
NZ_CP160832.1_988|1085884|1087485|1|ID=1_988;partial=00;start_type=ATG;rbs_motif=None;rbs_spacer=None;gc_cont=0.663	WP_354486779.1 helicase HerA-like C-terminal domain-containing protein [Mycobacterium tuberculosis]	97.2	99.8	0.0
NZ_CP160832.1_989|1087489|1088295|-1|ID=1_989;partial=00;start_type=ATG;rbs_motif=None;rbs_spacer=None;gc_cont=0.657	WP_003412799.1 MULTISPECIES: mycolate reductase [Mycobacterium]	100	99.6	3.99e-179
NZ_CP160832.1_990|1088380|1089717|1|ID=1_990;partial=00;start_type=ATG;rbs_motif=None;rbs_spacer=None;gc_cont=0.673	WP_003412798.1 MULTISPECIES: MFS transporter [Mycobacterium]	100	99.8	2.08e-309
NZ_CP160832.1_991|1089714|1090535|-1|ID=1_991;partial=00;start_type=ATG;rbs_motif=GGAG/GAGG;rbs_spacer=5-10bp;gc_cont=0.670	WP_003412795.1 MULTISPECIES: MmpS family transport accessory protein [Mycobacterium]	100	99.6	6.13e-165
NZ_CP160832.1_992|1090614|1091261|-1|ID=1_992;partial=00;start_type=GTG;rbs_motif=GGAG/GAGG;rbs_spacer=5-10bp;gc_cont=0.670	WP_003412790.1 MULTISPECIES: SACE_7040 family transcriptional regulator [Mycobacterium]	100	99.5	8.44e-141
NZ_CP160832.1_993|1091377|1093020|1|ID=1_993;partial=00;start_type=GTG;rbs_motif=GGAGG;rbs_spacer=3-4bp;gc_cont=0.645	WP_003899357.1 MULTISPECIES: AMP-binding protein [Mycobacterium]	100	99.8	0.0
NZ_CP160832.1_994|1093103|1093849|1|ID=1_994;partial=00;start_type=ATG;rbs_motif=AGGAG;rbs_spacer=5-10bp;gc_cont=0.655	WP_003412786.1 MULTISPECIES: succinyl-CoA--3-ketoacid CoA transferase subunit A [Mycobacterium]	100	99.6	9.17e-175
NZ_CP160832.1_995|1093846|1094502|1|ID=1_995;partial=00;start_type=ATG;rbs_motif=AGGA/GGAG/GAGG;rbs_spacer=11-12bp;gc_cont=0.639	WP_003412782.1 MULTISPECIES: succinyl-CoA--3-ketoacid CoA transferase subunit B [Mycobacterium]	100	99.5	2.02e-154
NZ_CP160832.1_996|1094499|1096088|1|ID=1_996;partial=00;start_type=GTG;rbs_motif=GGA/GAG/AGG;rbs_spacer=11-12bp;gc_cont=0.657	WP_010950731.1 carboxyl transferase domain-containing protein [Mycobacterium tuberculosis]	100	99.8	0.0
NZ_CP160832.1_997|1096093|1098057|1|ID=1_997;partial=00;start_type=ATG;rbs_motif=GGA/GAG/AGG;rbs_spacer=5-10bp;gc_cont=0.676	WP_003899356.1 MULTISPECIES: acetyl/propionyl/methylcrotonyl-CoA carboxylase subunit alpha [Mycobacterium]	100	99.8	0.0
NZ_CP160832.1_998|1098062|1099246|1|ID=1_998;partial=00;start_type=ATG;rbs_motif=AGGA;rbs_spacer=5-10bp;gc_cont=0.615	WP_003412771.1 MULTISPECIES: acyl-CoA dehydrogenase family protein [Mycobacterium]	100	99.7	4.01e-272
NZ_CP160832.1_999|1099339|1099800|1|ID=1_999;partial=00;start_type=TTG;rbs_motif=4Base/6BMM;rbs_spacer=13-15bp;gc_cont=0.623	WP_129467377.1 MaoC family dehydratase [Mycobacterium tuberculosis]	99.3	99.4	3.54e-103
NZ_CP160832.1_1000|1099797|1100618|1|ID=1_1000;partial=00;start_type=ATG;rbs_motif=AGGAG;rbs_spacer=5-10bp;gc_cont=0.679	WP_003412766.1 MULTISPECIES: citrate (pro-3S)-lyase subunit beta [Mycobacterium]	100	99.6	2.33e-185
NZ_CP160832.1_1001|1100907|1101980|1|ID=1_1001;partial=00;start_type=ATG;rbs_motif=GGAGG;rbs_spacer=5-10bp;gc_cont=0.643	WP_003911907.1 pyruvate dehydrogenase (acetyl-transferring) E1 component subunit alpha [Mycobacterium tuberculosis]	100	99.7	6.29e-264
NZ_CP160832.1_1002|1101991|1103037|1|ID=1_1002;partial=00;start_type=ATG;rbs_motif=AGGAG;rbs_spacer=5-10bp;gc_cont=0.638	WP_010950730.1 3-methyl-2-oxobutanoate dehydrogenase subunit beta [Mycobacterium tuberculosis]	100	99.7	1.78e-254
NZ_CP160832.1_1003|1103034|1104215|1|ID=1_1003;partial=00;start_type=ATG;rbs_motif=None;rbs_spacer=None;gc_cont=0.654	WP_010950729.1 dihydrolipoamide acetyltransferase family protein [Mycobacterium tuberculosis]	100	99.7	4.94e-261
NZ_CP160832.1_1004|1104238|1104663|-1|ID=1_1004;partial=00;start_type=GTG;rbs_motif=GGAG/GAGG;rbs_spacer=5-10bp;gc_cont=0.662	WP_003412752.1 MULTISPECIES: type II toxin-antitoxin system VapC family toxin [Mycobacterium]	100	99.3	9.92e-97
NZ_CP160832.1_1005|1104943|1105695|-1|ID=1_1005;partial=00;start_type=ATG;rbs_motif=AGGA;rbs_spacer=5-10bp;gc_cont=0.510	WP_003901416.1 MULTISPECIES: hypothetical protein [Mycobacterium]	100	99.6	4.22e-181
NZ_CP160832.1_1006|1105685|1106308|-1|ID=1_1006;partial=00;start_type=ATG;rbs_motif=AGGAG;rbs_spacer=5-10bp;gc_cont=0.595	WP_003900858.1 MULTISPECIES: TIGR00725 family protein [Mycobacterium]	100	99.5	1.66e-143
NZ_CP160832.1_1007|1106459|1106650|1|ID=1_1007;partial=00;start_type=ATG;rbs_motif=None;rbs_spacer=None;gc_cont=0.646	WP_078442439.1 hypothetical protein [Mycobacterium tuberculosis]	100	98.4	5.72e-36
NZ_CP160832.1_1009|1112159|1115500|1|ID=1_1009;partial=00;start_type=ATG;rbs_motif=None;rbs_spacer=None;gc_cont=0.686	WP_391517290.1 LuxR C-terminal-related transcriptional regulator [Mycobacterium tuberculosis]	100	99.9	0.0
NZ_CP160832.1_1010|1115633|1116640|-1|ID=1_1010;partial=00;start_type=GTG;rbs_motif=AGxAGG/AGGxGG;rbs_spacer=5-10bp;gc_cont=0.736	WP_434737982.1 hypothetical protein, partial [Mycobacterium tuberculosis]	100	20.5	1.93e-27
NZ_CP160832.1_1012|1117845|1118615|-1|ID=1_1012;partial=00;start_type=ATG;rbs_motif=GGAGG;rbs_spacer=5-10bp;gc_cont=0.677	WP_003412728.1 MULTISPECIES: enoyl-CoA hydratase [Mycobacterium]	100	99.6	3.02e-168
NZ_CP160832.1_1013|1118977|1120242|1|ID=1_1013;partial=00;start_type=ATG;rbs_motif=4Base/6BMM;rbs_spacer=13-15bp;gc_cont=0.676	WP_003412725.1 MULTISPECIES: alpha/beta hydrolase [Mycobacterium]	100	99.8	8.70e-308
NZ_CP160832.1_1014|1120432|1121946|1|ID=1_1014;partial=00;start_type=TTG;rbs_motif=GGxGG;rbs_spacer=5-10bp;gc_cont=0.663	WP_003412717.1 MULTISPECIES: WS/DGAT/MGAT family O-acyltransferase [Mycobacterium]	100	97.2	0.0
NZ_CP160832.1_1015|1121943|1123685|1|ID=1_1015;partial=00;start_type=ATG;rbs_motif=None;rbs_spacer=None;gc_cont=0.640	WP_003412713.1 MULTISPECIES: HAD-IB family hydrolase/lysophospholipid acyltransferase family protein [Mycobacterium tuberculosis complex]	100	99.8	0.0
NZ_CP160832.1_1016|1123682|1126051|1|ID=1_1016;partial=00;start_type=GTG;rbs_motif=AGGA;rbs_spacer=5-10bp;gc_cont=0.644	WP_010950725.1 glycerol-3-phosphate 1-O-acyltransferase [Mycobacterium tuberculosis]	100	99.9	0.0
NZ_CP160832.1_1017|1126978|1127484|1|ID=1_1017;partial=00;start_type=ATG;rbs_motif=AGGA;rbs_spacer=5-10bp;gc_cont=0.653	WP_003900529.1 MULTISPECIES: single-stranded DNA-binding protein [Mycobacterium]	100	99.4	8.97e-113
NZ_CP160832.1_1018|1127565|1129241|1|ID=1_1018;partial=00;start_type=ATG;rbs_motif=GGA/GAG/AGG;rbs_spacer=11-12bp;gc_cont=0.628	WP_003412708.1 MULTISPECIES: energy-dependent translational throttle protein EttA [Mycobacterium]	100	99.8	0.0
NZ_CP160832.1_1019|1129345|1134216|1|ID=1_1019;partial=00;start_type=ATG;rbs_motif=GGAG/GAGG;rbs_spacer=5-10bp;gc_cont=0.653	WP_003910563.1 MULTISPECIES: NAD-glutamate dehydrogenase [Mycobacterium tuberculosis complex]	100	99.9	0.0
NZ_CP160832.1_1020|1134213|1134629|1|ID=1_1020;partial=00;start_type=GTG;rbs_motif=GGAG/GAGG;rbs_spacer=5-10bp;gc_cont=0.626	WP_003412703.1 MULTISPECIES: acyl-CoA thioesterase [Mycobacterium]	100	99.3	8.90e-94
NZ_CP160832.1_1021|1134635|1135288|1|ID=1_1021;partial=00;start_type=GTG;rbs_motif=GGA/GAG/AGG;rbs_spacer=5-10bp;gc_cont=0.665	WP_010950724.1 hypothetical protein [Mycobacterium tuberculosis]	100	99.5	8.88e-153
NZ_CP160832.1_1022|1135320|1135607|-1|ID=1_1022;partial=00;start_type=GTG;rbs_motif=GGA/GAG/AGG;rbs_spacer=5-10bp;gc_cont=0.653	WP_235688334.1 hypothetical protein, partial [Mycobacterium tuberculosis]	98.9	99.0	7.93e-58
NZ_CP160832.1_1023|1136400|1137962|-1|ID=1_1023;partial=00;start_type=ATG;rbs_motif=GGAG/GAGG;rbs_spacer=5-10bp;gc_cont=0.672	WP_010950723.1 glycoside hydrolase family 13 protein [Mycobacterium tuberculosis]	100	99.8	0.0
NZ_CP160832.1_1024|1138040|1138426|-1|ID=1_1024;partial=00;start_type=ATG;rbs_motif=AGGAG/GGAGG;rbs_spacer=11-12bp;gc_cont=0.625	WP_003412688.1 MULTISPECIES: group 2 truncated hemoglobin GlbO [Mycobacterium]	100	99.2	5.32e-88
NZ_CP160832.1_1025|1138569|1139237|1|ID=1_1025;partial=00;start_type=ATG;rbs_motif=GGAGG;rbs_spacer=3-4bp;gc_cont=0.683	WP_003910562.1 MULTISPECIES: HNH endonuclease [Mycobacterium tuberculosis complex]	100	99.6	1.00e-165
NZ_CP160832.1_1026|1139273|1139506|1|ID=1_1026;partial=00;start_type=ATG;rbs_motif=GGA/GAG/AGG;rbs_spacer=3-4bp;gc_cont=0.628	WP_003412671.1 MULTISPECIES: aa3-type cytochrome oxidase subunit CtaJ [Mycobacterium]	100	98.7	8.48e-50
NZ_CP160832.1_1027|1139493|1139960|1|ID=1_1027;partial=00;start_type=GTG;rbs_motif=GGAGG;rbs_spacer=5-10bp;gc_cont=0.692	WP_003904843.1 MULTISPECIES: DUF5130 domain-containing protein [Mycobacterium]	100	99.4	1.59e-102
NZ_CP160832.1_1028|1140033|1142618|-1|ID=1_1028;partial=00;start_type=GTG;rbs_motif=GGA/GAG/AGG;rbs_spacer=3-4bp;gc_cont=0.659	WP_003412666.1 MULTISPECIES: aminopeptidase N [Mycobacterium]	100	99.9	0.0
NZ_CP160832.1_1029|1142720|1143343|1|ID=1_1029;partial=00;start_type=ATG;rbs_motif=GGAG/GAGG;rbs_spacer=5-10bp;gc_cont=0.639	WP_003412664.1 MULTISPECIES: Rv2466c family mycothiol-dependent reductase [Mycobacterium]	100	99.5	5.84e-153
NZ_CP160832.1_1030|1143445|1143933|1|ID=1_1030;partial=00;start_type=ATG;rbs_motif=None;rbs_spacer=None;gc_cont=0.685	WP_003899332.1 ribose-5-phosphate isomerase [Mycobacterium tuberculosis]	100	99.4	1.40e-113
NZ_CP160832.1_1031|1143939|1144745|1|ID=1_1031;partial=00;start_type=GTG;rbs_motif=None;rbs_spacer=None;gc_cont=0.668	WP_003412657.1 MULTISPECIES: Fpg/Nei family DNA glycosylase [Mycobacterium]	100	99.6	7.99e-204
NZ_CP160832.1_1032|1144765|1145949|-1|ID=1_1032;partial=00;start_type=ATG;rbs_motif=3Base/5BMM;rbs_spacer=13-15bp;gc_cont=0.660	WP_003412656.1 MULTISPECIES: serine hydrolase domain-containing protein [Mycobacterium]	100	99.7	4.90e-298
NZ_CP160832.1_1033|1146313|1147713|1|ID=1_1033;partial=00;start_type=GTG;rbs_motif=AGGAG;rbs_spacer=5-10bp;gc_cont=0.650	WP_003412652.1 MULTISPECIES: trigger factor [Mycobacterium tuberculosis complex]	100	99.8	4.94e-314
NZ_CP160832.1_1034|1147830|1148432|1|ID=1_1034;partial=00;start_type=GTG;rbs_motif=AGxAGG/AGGxGG;rbs_spacer=5-10bp;gc_cont=0.622	WP_003412650.1 MULTISPECIES: ATP-dependent CLP protease proteolytic subunit ClpP1 [Mycobacterium]	100	99.5	2.37e-135
NZ_CP160832.1_1035|1148429|1149073|1|ID=1_1035;partial=00;start_type=GTG;rbs_motif=GGAG/GAGG;rbs_spacer=5-10bp;gc_cont=0.617	WP_003412648.1 MULTISPECIES: ATP-dependent CLP protease proteolytic subunit ClpP2 [Mycobacterium]	100	99.5	9.92e-144
NZ_CP160832.1_1036|1149224|1150840|-1|ID=1_1036;partial=00;start_type=ATG;rbs_motif=None;rbs_spacer=None;gc_cont=0.626	WP_010950722.1 multidrug efflux pump JefA [Mycobacterium tuberculosis]	100	94.2	0.0
NZ_CP160832.1_1037|1150917|1151825|-1|ID=1_1037;partial=00;start_type=GTG;rbs_motif=None;rbs_spacer=None;gc_cont=0.681	WP_003412639.1 MULTISPECIES: homocysteine S-methyltransferase [Mycobacterium]	100	99.7	3.96e-212
NZ_CP160832.1_1038|1152116|1153396|1|ID=1_1038;partial=00;start_type=ATG;rbs_motif=GGA/GAG/AGG;rbs_spacer=11-12bp;gc_cont=0.616	WP_003412634.1 MULTISPECIES: ATP-dependent Clp protease ATP-binding subunit ClpX [Mycobacterium]	100	99.8	3.39e-303
NZ_CP160832.1_1039|1153412|1154668|1|ID=1_1039;partial=00;start_type=ATG;rbs_motif=None;rbs_spacer=None;gc_cont=0.655	WP_003412631.1 MULTISPECIES: MFS transporter [Mycobacterium]	100	99.8	6.10e-286
NZ_CP160832.1_1040|1154900|1156861|1|ID=1_1040;partial=00;start_type=GTG;rbs_motif=AGxAGG/AGGxGG;rbs_spacer=3-4bp;gc_cont=0.638	WP_079096271.1 2-oxoacid:acceptor oxidoreductase subunit alpha [Mycobacterium tuberculosis]	100	99.8	0.0
NZ_CP160832.1_1041|1156858|1157979|1|ID=1_1041;partial=00;start_type=ATG;rbs_motif=GGAG/GAGG;rbs_spacer=5-10bp;gc_cont=0.641	WP_003412624.1 MULTISPECIES: 2-oxoacid:ferredoxin oxidoreductase subunit beta [Mycobacterium]	100	99.7	2.60e-271
NZ_CP160832.1_1042|1158050|1158586|1|ID=1_1042;partial=00;start_type=ATG;rbs_motif=AGGAG(G)/GGAGG;rbs_spacer=13-15bp;gc_cont=0.674	WP_368607363.1 molybdenum cofactor guanylyltransferase [Mycobacterium tuberculosis]	100	99.4	4.34e-121
NZ_CP160832.1_1043|1159376|1159942|1|ID=1_1043;partial=00;start_type=ATG;rbs_motif=None;rbs_spacer=None;gc_cont=0.702	WP_055374151.1 resuscitation-promoting factor protein RpfE [Mycobacterium tuberculosis]	99.4	91.0	1.75e-91
NZ_CP160832.1_1044|1160032|1161291|1|ID=1_1044;partial=00;start_type=GTG;rbs_motif=4Base/6BMM;rbs_spacer=13-15bp;gc_cont=0.683	WP_003412609.1 MULTISPECIES: saccharopine dehydrogenase family protein [Mycobacterium]	100	99.8	2.86e-296
NZ_CP160832.1_1045|1161379|1164009|1|ID=1_1045;partial=00;start_type=ATG;rbs_motif=None;rbs_spacer=None;gc_cont=0.658	WP_031742596.1 valine--tRNA ligase [Mycobacterium tuberculosis]	100	99.9	0.0
NZ_CP160832.1_1046|1164006|1165469|1|ID=1_1046;partial=00;start_type=ATG;rbs_motif=None;rbs_spacer=None;gc_cont=0.678	WP_003899324.1 MULTISPECIES: bifunctional tetrahydrofolate synthase/dihydrofolate synthase [Mycobacterium]	100	99.8	0.0
NZ_CP160832.1_1047|1165466|1165837|1|ID=1_1047;partial=00;start_type=ATG;rbs_motif=None;rbs_spacer=None;gc_cont=0.661	WP_003412596.1 MULTISPECIES: DUF4233 domain-containing protein [Mycobacterium]	100	99.2	5.21e-79
NZ_CP160832.1_1048|1165868|1166290|1|ID=1_1048;partial=00;start_type=GTG;rbs_motif=None;rbs_spacer=None;gc_cont=0.645	WP_003412592.1 MULTISPECIES: nucleoside-diphosphate kinase [Mycobacterium]	99.3	96.5	2.30e-87
NZ_CP160832.1_1049|1166620|1169481|1|ID=1_1049;partial=00;start_type=GTG;rbs_motif=AGGAG;rbs_spacer=5-10bp;gc_cont=0.661	WP_003899322.1 MULTISPECIES: Rne/Rng family ribonuclease [Mycobacterium]	100	99.9	0.0
NZ_CP160832.1_1050|1169420|1170895|-1|ID=1_1050;partial=00;start_type=ATG;rbs_motif=GGAGG;rbs_spacer=5-10bp;gc_cont=0.632	WP_003412582.1 MULTISPECIES: cation:dicarboxylate symporter family transporter [Mycobacterium]	100	99.8	0.0
NZ_CP160832.1_1051|1171246|1171557|1|ID=1_1051;partial=00;start_type=ATG;rbs_motif=AGGAG;rbs_spacer=5-10bp;gc_cont=0.606	WP_003412578.1 MULTISPECIES: 50S ribosomal protein L21 [Mycobacterium]	100	99.0	2.59e-63
NZ_CP160832.1_1052|1171572|1171832|1|ID=1_1052;partial=00;start_type=ATG;rbs_motif=GGAGG;rbs_spacer=5-10bp;gc_cont=0.663	WP_003412574.1 MULTISPECIES: 50S ribosomal protein L27 [Mycobacterium]	100	98.9	1.68e-51
NZ_CP160832.1_1053|1171903|1173357|1|ID=1_1053;partial=00;start_type=ATG;rbs_motif=3Base/5BMM;rbs_spacer=13-15bp;gc_cont=0.676	WP_003901405.1 MULTISPECIES: GTPase ObgE [Mycobacterium]	99.8	98.8	0.0
NZ_CP160832.1_1054|1173357|1174487|1|ID=1_1054;partial=00;start_type=ATG;rbs_motif=GGA/GAG/AGG;rbs_spacer=5-10bp;gc_cont=0.706	WP_003412568.1 MULTISPECIES: glutamate 5-kinase [Mycobacterium]	100	99.7	2.91e-249
NZ_CP160832.1_1055|1174596|1176812|1|ID=1_1055;partial=00;start_type=ATG;rbs_motif=GGA/GAG/AGG;rbs_spacer=5-10bp;gc_cont=0.640	WP_003901403.1 NAD(+) synthase [Mycobacterium tuberculosis]	100	91.9	0.0
NZ_CP160832.1_1056|1176809|1177246|-1|ID=1_1056;partial=00;start_type=GTG;rbs_motif=None;rbs_spacer=None;gc_cont=0.642	WP_003412563.1 MULTISPECIES: methyltransferase family protein [Mycobacterium]	100	94.5	1.96e-90
NZ_CP160832.1_1057|1177460|1178374|-1|ID=1_1057;partial=00;start_type=ATG;rbs_motif=None;rbs_spacer=None;gc_cont=0.689	WP_010950720.1 ribokinase RbsK [Mycobacterium tuberculosis]	100	99.7	5.54e-204
NZ_CP160832.1_1058|1178855|1181047|1|ID=1_1058;partial=00;start_type=TTG;rbs_motif=GGAG/GAGG;rbs_spacer=5-10bp;gc_cont=0.592	WP_003412557.1 MULTISPECIES: adenylate/guanylate cyclase domain-containing protein [Mycobacterium]	100	99.9	0.0
NZ_CP160832.1_1059|1181044|1182489|1|ID=1_1059;partial=00;start_type=ATG;rbs_motif=GGAG/GAGG;rbs_spacer=5-10bp;gc_cont=0.633	WP_003900521.1 MULTISPECIES: mechanosensitive ion channel domain-containing protein [Mycobacterium]	100	99.8	0.0
NZ_CP160832.1_1060|1182470|1182760|1|ID=1_1060;partial=00;start_type=GTG;rbs_motif=GGA/GAG/AGG;rbs_spacer=3-4bp;gc_cont=0.660	WP_003412553.1 MULTISPECIES: nitrate/nitrite transporter NrtS [Mycobacterium]	100	99.0	1.20e-60
NZ_CP160832.1_1061|1183338|1183637|1|ID=1_1061;partial=00;start_type=ATG;rbs_motif=GGAG/GAGG;rbs_spacer=5-10bp;gc_cont=0.603	WP_003412551.1 MULTISPECIES: PE family protein [Mycobacterium]	100	99.0	5.83e-58
NZ_CP160832.1_1062|1183684|1184268|1|ID=1_1062;partial=00;start_type=ATG;rbs_motif=3Base/5BMM;rbs_spacer=13-15bp;gc_cont=0.598	WP_003412549.1 MULTISPECIES: PPE family protein [Mycobacterium]	100	99.5	1.28e-136
NZ_CP160832.1_1063|1184265|1184798|-1|ID=1_1063;partial=00;start_type=ATG;rbs_motif=GGA/GAG/AGG;rbs_spacer=3-4bp;gc_cont=0.603	WP_003412536.1 MULTISPECIES: alkyl hydroperoxide reductase [Mycobacterium]	100	99.4	5.52e-116
NZ_CP160832.1_1064|1184824|1185411|-1|ID=1_1064;partial=00;start_type=ATG;rbs_motif=GGAG/GAGG;rbs_spacer=5-10bp;gc_cont=0.605	WP_003412529.1 MULTISPECIES: peroxiredoxin AhpC [Mycobacteriaceae]	100	99.5	4.48e-142
NZ_CP160832.1_1065|1186127|1187374|1|ID=1_1065;partial=00;start_type=ATG;rbs_motif=None;rbs_spacer=None;gc_cont=0.678	WP_003412516.1 MULTISPECIES: glutamate-5-semialdehyde dehydrogenase [Mycobacterium]	100	99.8	1.09e-282
NZ_CP160832.1_1066|1187401|1188276|1|ID=1_1066;partial=00;start_type=GTG;rbs_motif=AGGAG;rbs_spacer=5-10bp;gc_cont=0.674	WP_010950719.1 AAA family ATPase [Mycobacterium tuberculosis]	100	99.7	4.57e-201
NZ_CP160832.1_1067|1188339|1189718|1|ID=1_1067;partial=00;start_type=GTG;rbs_motif=GGA/GAG/AGG;rbs_spacer=5-10bp;gc_cont=0.662	WP_070892945.1 vWA domain-containing protein [Mycobacterium tuberculosis]	99.8	99.8	0.0
NZ_CP160832.1_1068|1190006|1190806|1|ID=1_1068;partial=00;start_type=ATG;rbs_motif=None;rbs_spacer=None;gc_cont=0.657	WP_108016176.1 transposase [Mycobacterium tuberculosis]	100	99.6	2.18e-191
NZ_CP160832.1_1069|1190939|1191985|-1|ID=1_1069;partial=00;start_type=GTG;rbs_motif=AGxAGG/AGGxGG;rbs_spacer=5-10bp;gc_cont=0.631	WP_003412408.1 MULTISPECIES: class I SAM-dependent methyltransferase [Mycobacterium]	100	99.7	1.78e-254
NZ_CP160832.1_1070|1192227|1192499|-1|ID=1_1070;partial=00;start_type=ATG;rbs_motif=None;rbs_spacer=None;gc_cont=0.681	WP_003412405.1 MULTISPECIES: hypothetical protein [Mycobacterium]	100	98.9	4.68e-53
NZ_CP160832.1_1071|1192535|1192738|1|ID=1_1071;partial=00;start_type=ATG;rbs_motif=None;rbs_spacer=None;gc_cont=0.613	WP_003412401.1 MULTISPECIES: hypothetical protein [Mycobacterium]	100	98.5	1.04e-41
NZ_CP160832.1_1072|1192774|1193409|1|ID=1_1072;partial=00;start_type=ATG;rbs_motif=None;rbs_spacer=None;gc_cont=0.646	WP_010950716.1 nicotinate-nucleotide adenylyltransferase [Mycobacterium tuberculosis]	100	99.5	6.53e-152
NZ_CP160832.1_1073|1193406|1193786|1|ID=1_1073;partial=00;start_type=ATG;rbs_motif=GGA/GAG/AGG;rbs_spacer=5-10bp;gc_cont=0.648	WP_003412394.1 MULTISPECIES: ribosome silencing factor [Mycobacterium]	100	99.2	5.79e-82
NZ_CP160832.1_1074|1193783|1194454|1|ID=1_1074;partial=00;start_type=ATG;rbs_motif=None;rbs_spacer=None;gc_cont=0.667	WP_010950715.1 glucosyl-3-phosphoglycerate phosphatase [Mycobacterium tuberculosis]	100	99.6	7.89e-159
NZ_CP160832.1_1075|1194444|1195187|1|ID=1_1075;partial=00;start_type=ATG;rbs_motif=GGA/GAG/AGG;rbs_spacer=5-10bp;gc_cont=0.622	WP_003412384.1 MULTISPECIES: diglucosylglycerate octanoyltransferase [Mycobacterium]	100	99.6	1.48e-184
NZ_CP160832.1_1076|1195268|1196110|1|ID=1_1076;partial=00;start_type=GTG;rbs_motif=GGAG/GAGG;rbs_spacer=5-10bp;gc_cont=0.692	WP_003412381.1 MULTISPECIES: DegV family protein [Mycobacterium]	100	99.6	3.66e-181
NZ_CP160832.1_1077|1196232|1197458|1|ID=1_1077;partial=00;start_type=ATG;rbs_motif=None;rbs_spacer=None;gc_cont=0.659	WP_010950714.1 enhanced intracellular survival protein Eis [Mycobacterium tuberculosis]	100	99.8	1.31e-300
NZ_CP160832.1_1078|1197798|1198691|1|ID=1_1078;partial=00;start_type=ATG;rbs_motif=None;rbs_spacer=None;gc_cont=0.686	WP_268101629.1 ComEA family DNA-binding protein [Mycobacterium tuberculosis]	100	99.7	5.14e-185
NZ_CP160832.1_1079|1198929|1200251|1|ID=1_1079;partial=00;start_type=ATG;rbs_motif=None;rbs_spacer=None;gc_cont=0.701	WP_041153734.1 ComEC/Rec2 family competence protein, partial [Mycobacterium tuberculosis]	100	99.8	1.31e-275
NZ_CP160832.1_1080|1200282|1201232|1|ID=1_1080;partial=00;start_type=TTG;rbs_motif=GGAG/GAGG;rbs_spacer=5-10bp;gc_cont=0.695	WP_003903885.1 MULTISPECIES: DNA polymerase III subunit delta [Mycobacterium]	100	99.7	4.37e-207
NZ_CP160832.1_1081|1201248|1201508|-1|ID=1_1081;partial=00;start_type=GTG;rbs_motif=GGA/GAG/AGG;rbs_spacer=5-10bp;gc_cont=0.640	WP_003899314.1 MULTISPECIES: 30S ribosomal protein S20 [Mycobacterium]	100	98.9	2.49e-44
