NZ_CP160832.1_3|8132|9640|-1|ID=1_3;partial=00;start_type=ATG;rbs_motif=None;rbs_spacer=None;gc_cont=0.664	WP_003901655.1 MULTISPECIES: long-chain-fatty-acid--CoA ligase FadD17 [Mycobacterium]	100	99.8	0.0
NZ_CP160832.1_4|9711|10832|-1|ID=1_4;partial=00;start_type=ATG;rbs_motif=GGAG/GAGG;rbs_spacer=5-10bp;gc_cont=0.681	WP_010950903.1 acyl-CoA dehydrogenase family protein [Mycobacterium tuberculosis]	100	99.7	2.99e-261
NZ_CP160832.1_5|10857|12059|-1|ID=1_5;partial=00;start_type=ATG;rbs_motif=GGAGG;rbs_spacer=5-10bp;gc_cont=0.658	WP_003418997.1 MULTISPECIES: acyl-CoA dehydrogenase [Mycobacterium]	100	99.8	6.63e-290
NZ_CP160832.1_6|12274|12465|1|ID=1_6;partial=00;start_type=GTG;rbs_motif=AGGAG;rbs_spacer=5-10bp;gc_cont=0.625	WP_003418993.1 MULTISPECIES: ferredoxin [Mycobacterium]	100	98.4	8.61e-37
NZ_CP160832.1_7|12490|13443|1|ID=1_7;partial=00;start_type=TTG;rbs_motif=GGAG/GAGG;rbs_spacer=5-10bp;gc_cont=0.674	WP_003418990.1 MULTISPECIES: 3-oxoacyl-ACP reductase [Mycobacterium]	100	99.7	7.64e-213
NZ_CP160832.1_8|13669|14433|1|ID=1_8;partial=00;start_type=TTG;rbs_motif=GGA/GAG/AGG;rbs_spacer=5-10bp;gc_cont=0.629	WP_003418986.1 MULTISPECIES: MlaE family ABC transporter permease [Mycobacterium]	100	99.6	2.04e-165
NZ_CP160832.1_9|14468|15310|1|ID=1_9;partial=00;start_type=ATG;rbs_motif=None;rbs_spacer=None;gc_cont=0.629	WP_003418983.1 MULTISPECIES: ABC transporter permease [Mycobacterium]	100	99.6	4.36e-173
NZ_CP160832.1_10|15330|16532|1|ID=1_10;partial=00;start_type=ATG;rbs_motif=GGA/GAG/AGG;rbs_spacer=3-4bp;gc_cont=0.613	WP_003418979.1 MULTISPECIES: virulence factor Mce4A [Mycobacterium]	100	99.8	2.66e-280
NZ_CP160832.1_11|16532|17584|1|ID=1_11;partial=00;start_type=ATG;rbs_motif=GGA/GAG/AGG;rbs_spacer=5-10bp;gc_cont=0.643	WP_031677508.1 virulence factor Mce family protein [Mycobacterium tuberculosis]	95.7	99.7	5.06e-230
NZ_CP160832.1_12|17574|18647|1|ID=1_12;partial=00;start_type=TTG;rbs_motif=GGAGG;rbs_spacer=5-10bp;gc_cont=0.641	WP_003418967.1 MULTISPECIES: virulence factor Mce family protein [Mycobacterium]	100	99.7	1.57e-248
NZ_CP160832.1_13|18647|19999|1|ID=1_13;partial=00;start_type=ATG;rbs_motif=None;rbs_spacer=None;gc_cont=0.662	WP_438941900.1 virulence factor Mce family protein [Mycobacterium tuberculosis]	100	99.8	2.56e-299
NZ_CP160832.1_14|19996|21150|1|ID=1_14;partial=00;start_type=ATG;rbs_motif=GGxGG;rbs_spacer=5-10bp;gc_cont=0.623	WP_003418964.1 MULTISPECIES: Mce family lipoprotein LprN [Mycobacterium]	100	99.7	1.51e-271
NZ_CP160832.1_15|21161|22855|1|ID=1_15;partial=00;start_type=ATG;rbs_motif=AGxAGG/AGGxGG;rbs_spacer=5-10bp;gc_cont=0.680	WP_010950902.1 virulence factor Mce family protein [Mycobacterium tuberculosis]	100	99.8	0.0
NZ_CP160832.1_16|22855|23583|1|ID=1_16;partial=00;start_type=GTG;rbs_motif=GGAG/GAGG;rbs_spacer=5-10bp;gc_cont=0.671	WP_003418960.1 MULTISPECIES: mammalian cell entry protein [Mycobacterium]	100	99.6	1.68e-158
NZ_CP160832.1_17|23583|24065|1|ID=1_17;partial=00;start_type=ATG;rbs_motif=GGA/GAG/AGG;rbs_spacer=11-12bp;gc_cont=0.609	WP_003418958.1 MULTISPECIES: Mce associated protein [Mycobacterium]	100	99.4	9.11e-109
NZ_CP160832.1_18|24062|24640|-1|ID=1_18;partial=00;start_type=GTG;rbs_motif=AGGAG;rbs_spacer=5-10bp;gc_cont=0.623	WP_003418954.1 MULTISPECIES: hypothetical protein [Mycobacterium]	100	99.5	1.39e-139
NZ_CP160832.1_19|24792|26294|-1|ID=1_19;partial=00;start_type=ATG;rbs_motif=GGA/GAG/AGG;rbs_spacer=5-10bp;gc_cont=0.655	WP_003418951.1 MULTISPECIES: trehalose-6-phosphate synthase [Mycobacterium]	100	99.8	0.0
NZ_CP160832.1_20|26540|26863|-1|ID=1_20;partial=00;start_type=ATG;rbs_motif=GGAG/GAGG;rbs_spacer=5-10bp;gc_cont=0.707	WP_010950901.1 MULTISPECIES: PadR family transcriptional regulator [Mycobacterium tuberculosis complex]	100	99.1	3.78e-69
NZ_CP160832.1_21|27373|28356|1|ID=1_21;partial=00;start_type=ATG;rbs_motif=3Base/5BMM;rbs_spacer=13-15bp;gc_cont=0.639	WP_192930669.1 carboxylesterase/phospholipase LipF [Mycobacterium tuberculosis]	100	99.7	1.51e-235
NZ_CP160832.1_22|28309|28704|-1|ID=1_22;partial=00;start_type=GTG;rbs_motif=GGxGG;rbs_spacer=5-10bp;gc_cont=0.646	WP_181904911.1 DoxX family protein, partial [Mycobacterium tuberculosis]	99.2	99.2	2.34e-87
NZ_CP160832.1_23|29078|29908|1|ID=1_23;partial=00;start_type=GTG;rbs_motif=GGAG/GAGG;rbs_spacer=5-10bp;gc_cont=0.653	WP_003912250.1 MULTISPECIES: SDR family oxidoreductase [Mycobacterium]	100	99.6	8.89e-196
NZ_CP160832.1_24|29914|31452|-1|ID=1_24;partial=00;start_type=ATG;rbs_motif=GGAG/GAGG;rbs_spacer=5-10bp;gc_cont=0.657	WP_003900866.1 MULTISPECIES: LCP family protein [Mycobacterium]	100	99.8	0.0
NZ_CP160832.1_25|31997|32380|1|ID=1_25;partial=00;start_type=GTG;rbs_motif=GGAG/GAGG;rbs_spacer=5-10bp;gc_cont=0.630	WP_142757475.1 LppP/LprE family lipoprotein, partial [Mycobacterium tuberculosis]	99.2	99.2	7.59e-89
NZ_CP160832.1_26|32601|33206|1|ID=1_26;partial=00;start_type=ATG;rbs_motif=4Base/6BMM;rbs_spacer=13-15bp;gc_cont=0.658	WP_193567485.1 DUF2510 domain-containing protein, partial [Mycobacterium tuberculosis]	100	99.5	8.45e-140
NZ_CP160832.1_27|33348|34037|1|ID=1_27;partial=00;start_type=ATG;rbs_motif=GGAG/GAGG;rbs_spacer=5-10bp;gc_cont=0.649	WP_003418922.1 MULTISPECIES: GAP family protein [Mycobacterium]	100	99.6	1.29e-151
NZ_CP160832.1_28|34128|35621|1|ID=1_28;partial=00;start_type=GTG;rbs_motif=AGGAG;rbs_spacer=5-10bp;gc_cont=0.643	WP_003418921.1 MULTISPECIES: WS/DGAT/MGAT family O-acyltransferase [Mycobacterium]	100	99.8	0.0
NZ_CP160832.1_29|35645|36691|-1|ID=1_29;partial=00;start_type=ATG;rbs_motif=GGA/GAG/AGG;rbs_spacer=11-12bp;gc_cont=0.647	WP_031737083.1 DUF3376 domain-containing protein, partial [Mycobacterium tuberculosis]	99.7	99.7	1.21e-246
NZ_CP160832.1_30|36696|37997|-1|ID=1_30;partial=00;start_type=ATG;rbs_motif=None;rbs_spacer=None;gc_cont=0.651	WP_151892085.1 patatin-like protein, partial [Mycobacterium tuberculosis]	100	96.3	1.05e-288
NZ_CP160832.1_31|37998|38090|-1|ID=1_31;partial=00;start_type=ATG;rbs_motif=GGAG/GAGG;rbs_spacer=5-10bp;gc_cont=0.602	WP_140034419.1 patatin-like protein, partial [Mycobacterium tuberculosis]	100	96.8	2.17e-09
NZ_CP160832.1_32|38210|39391|-1|ID=1_32;partial=00;start_type=GTG;rbs_motif=AGGA;rbs_spacer=5-10bp;gc_cont=0.685	WP_003900072.1 MULTISPECIES: PPE family protein [Mycobacterium]	100	99.7	3.96e-251
NZ_CP160832.1_33|39428|39724|-1|ID=1_33;partial=00;start_type=GTG;rbs_motif=AGGAG;rbs_spacer=5-10bp;gc_cont=0.653	WP_010950896.1 PE family protein [Mycobacterium tuberculosis]	100	99.0	5.87e-53
NZ_CP160832.1_34|40097|41446|1|ID=1_34;partial=00;start_type=ATG;rbs_motif=GGAGG;rbs_spacer=5-10bp;gc_cont=0.599	WP_003418778.1 MULTISPECIES: MFS transporter [Mycobacterium tuberculosis complex]	100	99.8	0.0
NZ_CP160832.1_35|41642|42511|1|ID=1_35;partial=00;start_type=ATG;rbs_motif=GGA/GAG/AGG;rbs_spacer=5-10bp;gc_cont=0.660	WP_015385316.1 alpha/beta fold hydrolase [Mycobacterium tuberculosis]	100	99.7	2.84e-208
NZ_CP160832.1_36|42591|43097|-1|ID=1_36;partial=00;start_type=ATG;rbs_motif=None;rbs_spacer=None;gc_cont=0.661	WP_003418774.1 MULTISPECIES: nuclear transport factor 2 family protein [Mycobacterium]	100	99.4	1.68e-117
NZ_CP160832.1_37|43262|43651|1|ID=1_37;partial=00;start_type=ATG;rbs_motif=None;rbs_spacer=None;gc_cont=0.656	WP_176729012.1 cupin domain-containing protein [Mycobacterium tuberculosis]	100	99.2	6.70e-87
NZ_CP160832.1_38|43642|45315|1|ID=1_38;partial=00;start_type=ATG;rbs_motif=None;rbs_spacer=None;gc_cont=0.658	WP_003900704.1 MULTISPECIES: thiamine pyrophosphate-binding protein [Mycobacterium]	100	98.7	0.0
NZ_CP160832.1_39|45376|46386|1|ID=1_39;partial=00;start_type=ATG;rbs_motif=None;rbs_spacer=None;gc_cont=0.632	WP_003900067.1 MULTISPECIES: 4-hydroxy-2-oxovalerate aldolase [Mycobacterium]	100	99.7	6.78e-237
NZ_CP160832.1_40|46390|47484|1|ID=1_40;partial=00;start_type=GTG;rbs_motif=GGAG/GAGG;rbs_spacer=5-10bp;gc_cont=0.661	WP_003900066.1 MULTISPECIES: NAD-dependent epimerase/dehydratase family protein [Mycobacterium]	100	99.7	5.78e-259
NZ_CP160832.1_41|47542|48501|-1|ID=1_41;partial=00;start_type=GTG;rbs_motif=None;rbs_spacer=None;gc_cont=0.676	WP_052633227.1 HNH endonuclease signature motif containing protein, partial [Mycobacterium tuberculosis]	98.1	99.7	9.55e-234
NZ_CP160832.1_42|49017|49625|-1|ID=1_42;partial=00;start_type=ATG;rbs_motif=None;rbs_spacer=None;gc_cont=0.626	WP_003418610.1 MULTISPECIES: dTDP-4-dehydrorhamnose 3,5-epimerase [Mycobacterium]	100	99.5	1.23e-147
NZ_CP160832.1_43|49627|50622|-1|ID=1_43;partial=00;start_type=ATG;rbs_motif=GGA/GAG/AGG;rbs_spacer=5-10bp;gc_cont=0.638	WP_003418607.1 MULTISPECIES: dTDP-glucose 4,6-dehydratase [Mycobacterium]	100	99.7	1.97e-247
NZ_CP160832.1_44|50695|51552|-1|ID=1_44;partial=00;start_type=ATG;rbs_motif=GGA/GAG/AGG;rbs_spacer=5-10bp;gc_cont=0.661	WP_003418604.1 MULTISPECIES: LLM class F420-dependent oxidoreductase [Mycobacterium]	100	99.7	3.12e-205
NZ_CP160832.1_45|51806|52027|1|ID=1_45;partial=00;start_type=ATG;rbs_motif=4Base/6BMM;rbs_spacer=13-15bp;gc_cont=0.622	WP_003418601.1 MULTISPECIES: translation initiation factor IF-1 [Actinomycetes]	100	98.6	8.45e-46
NZ_CP160832.1_46|52389|52763|1|ID=1_46;partial=00;start_type=ATG;rbs_motif=AGGA;rbs_spacer=5-10bp;gc_cont=0.629	WP_003418360.1 MULTISPECIES: 30S ribosomal protein S13 [Mycobacterium]	100	99.2	1.38e-79
NZ_CP160832.1_47|52767|53186|1|ID=1_47;partial=00;start_type=ATG;rbs_motif=GGA/GAG/AGG;rbs_spacer=5-10bp;gc_cont=0.679	WP_003418357.1 MULTISPECIES: 30S ribosomal protein S11 [Mycobacterium tuberculosis complex]	100	99.3	4.57e-92
NZ_CP160832.1_48|53195|53800|1|ID=1_48;partial=00;start_type=ATG;rbs_motif=AGGAG;rbs_spacer=5-10bp;gc_cont=0.635	WP_003418354.1 MULTISPECIES: 30S ribosomal protein S4 [Mycobacterium]	100	99.5	2.28e-138
NZ_CP160832.1_49|53926|54969|1|ID=1_49;partial=00;start_type=ATG;rbs_motif=AGGA/GGAG/GAGG;rbs_spacer=11-12bp;gc_cont=0.635	WP_003418351.1 MULTISPECIES: DNA-directed RNA polymerase subunit alpha [Mycobacterium]	100	99.7	8.04e-246
NZ_CP160832.1_50|55001|55543|1|ID=1_50;partial=00;start_type=ATG;rbs_motif=AGGAG;rbs_spacer=5-10bp;gc_cont=0.648	WP_116395003.1 50S ribosomal protein L17, partial [Mycobacterium tuberculosis]	100	77.9	5.45e-90
NZ_CP160832.1_51|55488|56381|1|ID=1_51;partial=00;start_type=GTG;rbs_motif=None;rbs_spacer=None;gc_cont=0.678	WP_003418344.1 MULTISPECIES: tRNA pseudouridine(38-40) synthase TruA [Mycobacterium]	100	99.7	1.69e-215
NZ_CP160832.1_52|56343|58028|-1|ID=1_52;partial=00;start_type=ATG;rbs_motif=AGGAG;rbs_spacer=5-10bp;gc_cont=0.605	WP_010950891.1 purine-cytosine permease family protein [Mycobacterium tuberculosis]	100	99.8	0.0
NZ_CP160832.1_53|58300|58980|-1|ID=1_53;partial=00;start_type=GTG;rbs_motif=GGAG/GAGG;rbs_spacer=5-10bp;gc_cont=0.686	WP_003418339.1 MULTISPECIES: cutinase Cut4 [Mycobacterium]	100	99.6	4.73e-157
NZ_CP160832.1_54|59027|59770|-1|ID=1_54;partial=00;start_type=TTG;rbs_motif=GGA/GAG/AGG;rbs_spacer=5-10bp;gc_cont=0.655	WP_031741457.1 cutinase family protein [Mycobacterium tuberculosis]	99.6	99.6	2.45e-157
NZ_CP160832.1_55|59936|61348|1|ID=1_55;partial=00;start_type=GTG;rbs_motif=GGAG/GAGG;rbs_spacer=5-10bp;gc_cont=0.702	WP_003418333.1 MULTISPECIES: type VII secretion system ESX-4 subunit EccB4 [Mycobacterium]	100	99.8	0.0
NZ_CP160832.1_56|61313|62680|-1|ID=1_56;partial=00;start_type=ATG;rbs_motif=None;rbs_spacer=None;gc_cont=0.691	WP_003418331.1 MULTISPECIES: type VII secretion system ESX-4 serine protease mycosin MycP4 [Mycobacterium]	100	99.8	4.06e-312
NZ_CP160832.1_57|62677|64080|-1|ID=1_57;partial=00;start_type=ATG;rbs_motif=GGA/GAG/AGG;rbs_spacer=5-10bp;gc_cont=0.674	WP_010950890.1 type VII secretion system ESX-4 subunit EccD4 [Mycobacterium tuberculosis]	100	99.8	2.48e-303
NZ_CP160832.1_58|64194|67904|1|ID=1_58;partial=00;start_type=ATG;rbs_motif=None;rbs_spacer=None;gc_cont=0.660	WP_003418326.1 MULTISPECIES: type VII secretion system ESX-4 FtsK/SpoIIIE family ATPase EccC4 [Mycobacterium]	100	99.9	0.0
NZ_CP160832.1_59|67901|69115|1|ID=1_59;partial=00;start_type=GTG;rbs_motif=GGAG/GAGG;rbs_spacer=5-10bp;gc_cont=0.712	WP_003418324.1 MULTISPECIES: type VII secretion-associated protein [Mycobacterium]	100	99.8	3.80e-266
NZ_CP160832.1_60|69054|69485|1|ID=1_60;partial=00;start_type=ATG;rbs_motif=GGA/GAG/AGG;rbs_spacer=11-12bp;gc_cont=0.655	WP_265327316.1 type VII secretion system ESX-4 protein EsxU [Mycobacterium tuberculosis]	98.2	77.8	6.97e-71
NZ_CP160832.1_61|69506|69808|1|ID=1_61;partial=00;start_type=ATG;rbs_motif=AGGA/GGAG/GAGG;rbs_spacer=11-12bp;gc_cont=0.650	WP_003900059.1 MULTISPECIES: WXG100 family type VII secretion target [Mycobacterium]	100	99.0	1.42e-63
NZ_CP160832.1_62|69951|70484|1|ID=1_62;partial=00;start_type=ATG;rbs_motif=GGA/GAG/AGG;rbs_spacer=5-10bp;gc_cont=0.655	WP_003418312.1 MULTISPECIES: 50S ribosomal protein L13 [Mycobacterium]	99.3	82.6	5.70e-100
NZ_CP160832.1_63|70481|70936|1|ID=1_63;partial=00;start_type=ATG;rbs_motif=AGxAGG/AGGxGG;rbs_spacer=5-10bp;gc_cont=0.671	WP_003418308.1 MULTISPECIES: 30S ribosomal protein S9 [Mycobacterium]	100	99.3	3.11e-98
NZ_CP160832.1_64|71061|72407|1|ID=1_64;partial=00;start_type=ATG;rbs_motif=GGA/GAG/AGG;rbs_spacer=5-10bp;gc_cont=0.695	WP_003418304.1 MULTISPECIES: phosphoglucosamine mutase [Mycobacterium]	100	99.8	2.20e-301
NZ_CP160832.1_65|72455|72766|1|ID=1_65;partial=00;start_type=ATG;rbs_motif=None;rbs_spacer=None;gc_cont=0.686	WP_003418301.1 MULTISPECIES: hypothetical protein [Mycobacterium]	100	99.0	2.94e-62
NZ_CP160832.1_66|72742|74172|1|ID=1_66;partial=00;start_type=GTG;rbs_motif=GGAG/GAGG;rbs_spacer=5-10bp;gc_cont=0.700	WP_031654652.1 hypothetical protein [Mycobacterium tuberculosis]	97.9	99.0	4.60e-215
NZ_CP160832.1_67|74192|75034|-1|ID=1_67;partial=00;start_type=GTG;rbs_motif=None;rbs_spacer=None;gc_cont=0.676	WP_003418298.1 MULTISPECIES: dienelactone hydrolase family protein [Mycobacterium]	100	99.6	2.97e-196
NZ_CP160832.1_68|75044|75520|-1|ID=1_68;partial=00;start_type=ATG;rbs_motif=GGA/GAG/AGG;rbs_spacer=5-10bp;gc_cont=0.654	WP_010950888.1 DUF2510 domain-containing protein [Mycobacterium tuberculosis]	100	99.4	1.30e-116
NZ_CP160832.1_69|75542|77416|1|ID=1_69;partial=00;start_type=GTG;rbs_motif=None;rbs_spacer=None;gc_cont=0.667	WP_003418289.1 MULTISPECIES: glutamine--fructose-6-phosphate transaminase (isomerizing) [Mycobacterium]	100	99.8	0.0
NZ_CP160832.1_70|77554|78492|1|ID=1_70;partial=00;start_type=GTG;rbs_motif=None;rbs_spacer=None;gc_cont=0.640	WP_003901640.1 MULTISPECIES: DUF4436 domain-containing protein [Mycobacterium]	99.6	90.7	3.49e-202
NZ_CP160832.1_71|78518|79216|1|ID=1_71;partial=00;start_type=GTG;rbs_motif=GGA/GAG/AGG;rbs_spacer=5-10bp;gc_cont=0.614	WP_003912234.1 rhomboid-like protein [Mycobacterium tuberculosis]	100	99.6	2.96e-163
NZ_CP160832.1_72|79218|80639|1|ID=1_72;partial=00;start_type=ATG;rbs_motif=4Base/6BMM;rbs_spacer=13-15bp;gc_cont=0.749	WP_003418280.1 MULTISPECIES: NAD(P)H-hydrate dehydratase [Mycobacterium]	100	99.8	6.14e-307
NZ_CP160832.1_73|80677|82059|1|ID=1_73;partial=00;start_type=GTG;rbs_motif=AGGA;rbs_spacer=5-10bp;gc_cont=0.659	WP_003418277.1 MULTISPECIES: glutamate decarboxylase [Mycobacterium]	100	99.8	0.0
NZ_CP160832.1_74|82292|83137|1|ID=1_74;partial=00;start_type=GTG;rbs_motif=None;rbs_spacer=None;gc_cont=0.647	WP_071512896.1 IS256 family transposase [Mycobacterium malmoense]	92.8	98.9	2.25e-181
NZ_CP160832.1_75|83626|84789|1|ID=1_75;partial=00;start_type=GTG;rbs_motif=GGA/GAG/AGG;rbs_spacer=5-10bp;gc_cont=0.652	WP_003418263.1 IS3 family transposase [Mycobacterium tuberculosis]	99.7	99.7	2.95e-275
NZ_CP160832.1_76|84730|85266|-1|ID=1_76;partial=00;start_type=ATG;rbs_motif=AGGAG(G)/GGAGG;rbs_spacer=13-15bp;gc_cont=0.568	WP_010950885.1 PPE family protein [Mycobacterium tuberculosis]	100	99.4	3.47e-124
NZ_CP160832.1_77|86085|87311|1|ID=1_77;partial=00;start_type=GTG;rbs_motif=GGA/GAG/AGG;rbs_spacer=5-10bp;gc_cont=0.660	WP_003418047.1 alanine racemase [Mycobacterium tuberculosis]	100	99.8	9.51e-294
NZ_CP160832.1_78|87308|87814|1|ID=1_78;partial=00;start_type=TTG;rbs_motif=GGAG/GAGG;rbs_spacer=5-10bp;gc_cont=0.686	WP_003418042.1 MULTISPECIES: tRNA (adenosine(37)-N6)-threonylcarbamoyltransferase complex ATPase subunit type 1 TsaE [Mycobacterium]	100	99.4	1.81e-112
NZ_CP160832.1_79|87811|88446|1|ID=1_79;partial=00;start_type=ATG;rbs_motif=None;rbs_spacer=None;gc_cont=0.701	WP_003418038.1 MULTISPECIES: tRNA (adenosine(37)-N6)-threonylcarbamoyltransferase complex dimerization subunit type 1 TsaB [Mycobacterium]	100	99.5	1.07e-141
NZ_CP160832.1_80|88443|88919|1|ID=1_80;partial=00;start_type=GTG;rbs_motif=GGxGG;rbs_spacer=5-10bp;gc_cont=0.690	WP_003418034.1 MULTISPECIES: ribosomal protein S18-alanine N-acetyltransferase [Mycobacterium]	100	99.4	8.15e-111
NZ_CP160832.1_81|88916|89950|1|ID=1_81;partial=00;start_type=ATG;rbs_motif=GGA/GAG/AGG;rbs_spacer=5-10bp;gc_cont=0.689	WP_003900052.1 MULTISPECIES: tRNA (adenosine(37)-N6)-threonylcarbamoyltransferase complex transferase subunit TsaD [Mycobacterium]	100	99.7	3.10e-237
NZ_CP160832.1_82|90217|90519|1|ID=1_82;partial=00;start_type=GTG;rbs_motif=GGAGG;rbs_spacer=5-10bp;gc_cont=0.634	WP_003418028.1 MULTISPECIES: co-chaperone GroES [Mycobacterium]	100	99.0	5.79e-63
NZ_CP160832.1_83|90614|92233|1|ID=1_83;partial=00;start_type=ATG;rbs_motif=GGAG/GAGG;rbs_spacer=5-10bp;gc_cont=0.651	WP_003418021.1 MULTISPECIES: chaperonin GroEL [Mycobacterium]	100	99.8	0.0
NZ_CP160832.1_84|92305|92613|-1|ID=1_84;partial=00;start_type=ATG;rbs_motif=GGAG/GAGG;rbs_spacer=5-10bp;gc_cont=0.641	WP_003418017.1 MULTISPECIES: redox-responsive transcriptional regulator WhiB3 [Mycobacterium]	100	99.0	9.46e-72
NZ_CP160832.1_85|93020|93811|1|ID=1_85;partial=00;start_type=GTG;rbs_motif=GGxGG;rbs_spacer=5-10bp;gc_cont=0.696	WP_031696617.1 hypothetical protein [Mycobacterium tuberculosis]	99.6	99.6	2.00e-177
NZ_CP160832.1_86|93892|94467|1|ID=1_86;partial=00;start_type=ATG;rbs_motif=AGGA/GGAG/GAGG;rbs_spacer=11-12bp;gc_cont=0.665	WP_003917787.1 MULTISPECIES: ECF RNA polymerase sigma factor SigD [Mycobacterium]	100	99.5	6.84e-126
NZ_CP160832.1_87|94442|95359|1|ID=1_87;partial=00;start_type=TTG;rbs_motif=AGGA;rbs_spacer=5-10bp;gc_cont=0.679	WP_349517025.1 anti-sigma D factor RsdA [Mycobacterium tuberculosis]	100	97.7	1.93e-171
NZ_CP160832.1_88|95369|95779|-1|ID=1_88;partial=00;start_type=GTG;rbs_motif=None;rbs_spacer=None;gc_cont=0.640	WP_003418008.1 MULTISPECIES: DUF5319 domain-containing protein [Mycobacterium]	100	99.3	1.01e-98
NZ_CP160832.1_89|95986|97575|1|ID=1_89;partial=00;start_type=ATG;rbs_motif=GGAGG;rbs_spacer=5-10bp;gc_cont=0.679	WP_003900682.1 MULTISPECIES: IMP dehydrogenase [Mycobacterium]	100	99.8	0.0
NZ_CP160832.1_90|97595|98722|1|ID=1_90;partial=00;start_type=ATG;rbs_motif=GGA/GAG/AGG;rbs_spacer=5-10bp;gc_cont=0.705	WP_003418005.1 MULTISPECIES: GuaB3 family IMP dehydrogenase-related protein [Mycobacterium]	100	99.7	1.94e-258
NZ_CP160832.1_91|98778|100514|1|ID=1_91;partial=00;start_type=ATG;rbs_motif=4Base/6BMM;rbs_spacer=13-15bp;gc_cont=0.667	WP_003418002.1 MULTISPECIES: cholesterol oxidase [Mycobacterium]	100	99.8	0.0
NZ_CP160832.1_92|100723|100941|-1|ID=1_92;partial=00;start_type=ATG;rbs_motif=GGA/GAG/AGG;rbs_spacer=11-12bp;gc_cont=0.635	WP_151882183.1 PIN domain-containing protein, partial [Mycobacterium tuberculosis]	100	80.8	5.31e-32
NZ_CP160832.1_93|100947|101246|-1|ID=1_93;partial=00;start_type=ATG;rbs_motif=None;rbs_spacer=None;gc_cont=0.613	WP_003417995.1 MULTISPECIES: type II toxin-antitoxin system Phd/YefM family antitoxin [Mycobacteriales]	100	99.0	3.51e-59
NZ_CP160832.1_94|101281|102168|-1|ID=1_94;partial=00;start_type=ATG;rbs_motif=GGAG/GAGG;rbs_spacer=5-10bp;gc_cont=0.659	WP_003900050.1 MULTISPECIES: alpha-ketoglutarate-dependent sulfate ester dioxygenase [Mycobacterium]	100	99.7	2.05e-215
NZ_CP160832.1_95|102230|102796|1|ID=1_95;partial=00;start_type=ATG;rbs_motif=None;rbs_spacer=None;gc_cont=0.658	WP_003417984.1 MULTISPECIES: TetR/AcrR family transcriptional regulator [Mycobacterium]	100	99.5	9.41e-127
NZ_CP160832.1_96|102914|103618|1|ID=1_96;partial=00;start_type=GTG;rbs_motif=GGxGG;rbs_spacer=5-10bp;gc_cont=0.591	WP_003417980.1 MULTISPECIES: dTDP-4-amino-4,6-dideoxyglucose formyltransferase [Mycobacterium]	100	99.6	8.21e-171
NZ_CP160832.1_97|103635|105236|1|ID=1_97;partial=00;start_type=ATG;rbs_motif=None;rbs_spacer=None;gc_cont=0.640	WP_003417969.1 MULTISPECIES: FAD/NAD(P)-binding protein [Mycobacterium]	100	99.8	0.0
NZ_CP160832.1_98|105679|106659|1|ID=1_98;partial=00;start_type=ATG;rbs_motif=GGA/GAG/AGG;rbs_spacer=5-10bp;gc_cont=0.646	WP_072473088.1 DegT/DnrJ/EryC1/StrS family aminotransferase, partial [Mycobacterium tuberculosis]	100	99.7	6.83e-236
NZ_CP160832.1_99|106838|107623|1|ID=1_99;partial=00;start_type=GTG;rbs_motif=GGAGG;rbs_spacer=5-10bp;gc_cont=0.729	WP_237079667.1 hypothetical protein, partial [Mycobacterium tuberculosis]	89.9	71.8	1.42e-108
NZ_CP160832.1_100|107448|109808|-1|ID=1_100;partial=00;start_type=ATG;rbs_motif=3Base/5BMM;rbs_spacer=13-15bp;gc_cont=0.677	WP_003900047.1 MULTISPECIES: glycoside hydrolase family 65 protein [Mycobacterium]	100	99.9	0.0
NZ_CP160832.1_101|109823|110611|-1|ID=1_101;partial=00;start_type=ATG;rbs_motif=GGA/GAG/AGG;rbs_spacer=5-10bp;gc_cont=0.676	WP_003417961.1 MULTISPECIES: beta-phosphoglucomutase family hydrolase [Mycobacterium]	100	99.6	2.73e-183
NZ_CP160832.1_102|110675|111595|-1|ID=1_102;partial=00;start_type=ATG;rbs_motif=AGGAG;rbs_spacer=5-10bp;gc_cont=0.645	WP_003912218.1 MULTISPECIES: class I SAM-dependent methyltransferase [Mycobacterium]	100	99.7	1.06e-218
NZ_CP160832.1_103|111744|112823|1|ID=1_103;partial=00;start_type=ATG;rbs_motif=None;rbs_spacer=None;gc_cont=0.651	WP_003417957.1 MULTISPECIES: (2E,6E)-farnesyl diphosphate synthase [Mycobacterium]	100	99.7	2.76e-259
NZ_CP160832.1_104|112852|113760|1|ID=1_104;partial=00;start_type=ATG;rbs_motif=GGAGG;rbs_spacer=5-10bp;gc_cont=0.628	WP_003417954.1 MULTISPECIES: presqualene diphosphate synthase HpnD [Mycobacterium]	100	99.7	1.88e-210
NZ_CP160832.1_105|113820|115349|1|ID=1_105;partial=00;start_type=GTG;rbs_motif=3Base/5BMM;rbs_spacer=13-15bp;gc_cont=0.672	WP_368626669.1 glutamine-hydrolyzing GMP synthase [Mycobacterium tuberculosis]	99.8	99.8	0.0
NZ_CP160832.1_106|115505|116215|-1|ID=1_106;partial=00;start_type=ATG;rbs_motif=GGA/GAG/AGG;rbs_spacer=5-10bp;gc_cont=0.626	WP_003900680.1 MULTISPECIES: hypothetical protein [Mycobacterium]	100	99.6	1.46e-165
NZ_CP160832.1_107|116286|116828|1|ID=1_107;partial=00;start_type=ATG;rbs_motif=None;rbs_spacer=None;gc_cont=0.711	WP_023643257.1 hypothetical protein [Mycobacterium tuberculosis]	100	99.4	9.70e-117
NZ_CP160832.1_108|116828|118408|1|ID=1_108;partial=00;start_type=ATG;rbs_motif=GGA/GAG/AGG;rbs_spacer=5-10bp;gc_cont=0.728	WP_003900042.1 MULTISPECIES: DNA polymerase Y family protein [Mycobacterium]	100	99.8	0.0
NZ_CP160832.1_109|118463|119389|-1|ID=1_109;partial=00;start_type=GTG;rbs_motif=None;rbs_spacer=None;gc_cont=0.673	WP_003417946.1 MULTISPECIES: nucleoside hydrolase IunH [Mycobacterium]	100	99.7	6.67e-223
NZ_CP160832.1_110|119413|120276|1|ID=1_110;partial=00;start_type=ATG;rbs_motif=None;rbs_spacer=None;gc_cont=0.603	WP_003417944.1 MULTISPECIES: cyclopropane mycolic acid synthase CmaA1 [Mycobacterium tuberculosis complex]	100	99.7	1.01e-211
NZ_CP160832.1_111|120277|122229|-1|ID=1_111;partial=00;start_type=ATG;rbs_motif=None;rbs_spacer=None;gc_cont=0.685	WP_003417940.1 MULTISPECIES: SDR family oxidoreductase [Mycobacterium]	100	99.8	0.0
NZ_CP160832.1_112|122275|122985|-1|ID=1_112;partial=00;start_type=ATG;rbs_motif=GGA/GAG/AGG;rbs_spacer=5-10bp;gc_cont=0.630	WP_003417932.1 MULTISPECIES: histidine phosphatase family protein [Mycobacterium]	100	99.6	7.56e-168
NZ_CP160832.1_113|123059|123931|1|ID=1_113;partial=00;start_type=ATG;rbs_motif=GGAGG;rbs_spacer=5-10bp;gc_cont=0.684	WP_010950882.1 3-hydroxyacyl-thioester dehydratase HtdY [Mycobacterium tuberculosis]	100	99.7	3.52e-209
NZ_CP160832.1_114|124002|126245|-1|ID=1_114;partial=00;start_type=ATG;rbs_motif=GGAG/GAGG;rbs_spacer=5-10bp;gc_cont=0.787	WP_391517280.1 PE family protein [Mycobacterium tuberculosis]	100	71.7	5.53e-88
NZ_CP160832.1_115|126435|127112|-1|ID=1_115;partial=00;start_type=GTG;rbs_motif=GGAG/GAGG;rbs_spacer=5-10bp;gc_cont=0.662	WP_003417923.1 ISNCY family transposase [Mycobacterium tuberculosis]	100	99.6	4.56e-159
NZ_CP160832.1_116|127102|127881|-1|ID=1_116;partial=00;start_type=TTG;rbs_motif=None;rbs_spacer=None;gc_cont=0.653	WP_003417921.1 transposase [Mycobacterium tuberculosis]	99.6	90.0	2.60e-160
NZ_CP160832.1_117|127988|128263|1|ID=1_117;partial=00;start_type=ATG;rbs_motif=None;rbs_spacer=None;gc_cont=0.721	WP_003912214.1 MULTISPECIES: type II toxin-antitoxin system Phd/YefM family antitoxin [Mycobacterium]	100	98.9	5.23e-55
NZ_CP160832.1_118|128263|128655|1|ID=1_118;partial=00;start_type=ATG;rbs_motif=GGA/GAG/AGG;rbs_spacer=5-10bp;gc_cont=0.690	WP_003417916.1 MULTISPECIES: type II toxin-antitoxin system VapC family toxin [Mycobacterium]	100	99.2	3.18e-81
NZ_CP160832.1_119|129409|130461|1|ID=1_119;partial=00;start_type=ATG;rbs_motif=GGAG/GAGG;rbs_spacer=5-10bp;gc_cont=0.613	WP_003900678.1 MULTISPECIES: geranylgeranyl diphosphate synthase IdsB [Mycobacterium]	100	99.7	6.13e-247
NZ_CP160832.1_120|130461|131450|1|ID=1_120;partial=00;start_type=ATG;rbs_motif=GGAG/GAGG;rbs_spacer=5-10bp;gc_cont=0.628	WP_003417912.1 MULTISPECIES: 4-hydroxy-3-methylbut-2-enyl diphosphate reductase [Mycobacterium]	100	99.7	1.92e-228
NZ_CP160832.1_121|131447|133285|1|ID=1_121;partial=00;start_type=ATG;rbs_motif=GGA/GAG/AGG;rbs_spacer=5-10bp;gc_cont=0.638	WP_023349617.1 1-deoxy-D-xylulose-5-phosphate synthase [Mycobacterium tuberculosis]	100	99.8	0.0
NZ_CP160832.1_122|133294|134184|1|ID=1_122;partial=00;start_type=ATG;rbs_motif=GGA/GAG/AGG;rbs_spacer=5-10bp;gc_cont=0.486	WP_003417908.1 MULTISPECIES: diterpene synthase [Mycobacterium]	100	99.7	2.06e-220
NZ_CP160832.1_123|134189|135640|1|ID=1_123;partial=00;start_type=ATG;rbs_motif=GGAGG;rbs_spacer=5-10bp;gc_cont=0.544	WP_031747698.1 type B diterpene cyclase [Mycobacterium tuberculosis]	89.9	95.2	4.82e-302
