NZ_LJHL01000233.1_1|1|105|-1|ID=1_1;partial=10;start_type=ATG;rbs_motif=GGAG/GAGG;rbs_spacer=5-10bp;gc_cont=0.600	WP_085087281.1 MULTISPECIES: cytochrome P450, partial [Mycobacterium]	100	100	1.15e-14
NZ_LJHL01000233.1_2|283|1251|-1|ID=1_2;partial=00;start_type=GTG;rbs_motif=3Base/5BMM;rbs_spacer=13-15bp;gc_cont=0.657	WP_007168397.1 MULTISPECIES: alpha/beta hydrolase [Mycobacteriaceae]	100	99.7	5.08e-225
NZ_LJHL01000233.1_3|1248|2771|-1|ID=1_3;partial=00;start_type=ATG;rbs_motif=AGxAGG/AGGxGG;rbs_spacer=5-10bp;gc_cont=0.595	WP_007168396.1 MULTISPECIES: flavin-containing monooxygenase [Mycobacteriaceae]	100	99.8	0.0
NZ_LJHL01000233.1_4|2846|4492|-1|ID=1_4;partial=00;start_type=ATG;rbs_motif=GGxGG;rbs_spacer=3-4bp;gc_cont=0.610	WP_007168395.1 MULTISPECIES: flavin-containing monooxygenase [Mycobacteriaceae]	100	99.8	0.0
NZ_LJHL01000233.1_5|4489|5412|-1|ID=1_5;partial=00;start_type=ATG;rbs_motif=AGGAGG;rbs_spacer=3-4bp;gc_cont=0.601	WP_090609924.1 reductase [Mycobacterium lentiflavum]	94.8	99.7	7.11e-213
NZ_LJHL01000233.1_6|5431|6267|-1|ID=1_6;partial=00;start_type=ATG;rbs_motif=GGA/GAG/AGG;rbs_spacer=5-10bp;gc_cont=0.638	WP_007168393.1 MULTISPECIES: SDR family NAD(P)-dependent oxidoreductase [Mycobacteriaceae]	100	99.6	1.21e-194
NZ_LJHL01000233.1_7|6402|7070|1|ID=1_7;partial=00;start_type=GTG;rbs_motif=None;rbs_spacer=None;gc_cont=0.644	WP_023900852.1 MULTISPECIES: TetR/AcrR family transcriptional regulator [Mycobacteriaceae]	100	99.6	5.53e-154
NZ_LJHL01000233.1_8|7097|7801|-1|ID=1_8;partial=00;start_type=ATG;rbs_motif=None;rbs_spacer=None;gc_cont=0.630	WP_057969459.1 MULTISPECIES: TetR/AcrR family transcriptional regulator [Mycobacteriaceae]	100	99.6	3.71e-158
NZ_LJHL01000233.1_9|7878|8747|1|ID=1_9;partial=00;start_type=ATG;rbs_motif=GGAG/GAGG;rbs_spacer=5-10bp;gc_cont=0.623	WP_033712834.1 MULTISPECIES: metal-dependent hydrolase [Mycobacteriaceae]	100	99.7	8.60e-205
NZ_LJHL01000233.1_10|8940|9956|-1|ID=1_10;partial=00;start_type=GTG;rbs_motif=GGAG/GAGG;rbs_spacer=5-10bp;gc_cont=0.658	WP_033717470.1 MULTISPECIES: LLM class flavin-dependent oxidoreductase [Mycobacteriaceae]	100	99.7	2.47e-240
NZ_LJHL01000233.1_11|10089|10280|-1|ID=1_11;partial=00;start_type=ATG;rbs_motif=GGAG/GAGG;rbs_spacer=5-10bp;gc_cont=0.583	WP_074021704.1 MULTISPECIES: ferredoxin [Mycobacteriaceae]	100	98.4	1.31e-40
NZ_LJHL01000233.1_12|10292|11593|-1|ID=1_12;partial=00;start_type=ATG;rbs_motif=AGGAG;rbs_spacer=5-10bp;gc_cont=0.598	WP_007168386.1 MULTISPECIES: cytochrome P450 [Mycobacteriaceae]	100	99.8	0.0
NZ_LJHL01000233.1_13|11681|12310|-1|ID=1_13;partial=00;start_type=ATG;rbs_motif=None;rbs_spacer=None;gc_cont=0.622	WP_054585828.1 TetR/AcrR family transcriptional regulator [Mycobacterium intracellulare]	100	93.3	3.71e-129
NZ_LJHL01000233.1_14|12602|12982|-1|ID=1_14;partial=01;start_type=Edge;rbs_motif=None;rbs_spacer=None;gc_cont=0.627	WP_225345026.1 IS3 family transposase [Mycobacterium avium]	57.1	99.2	4.18e-48
