NC_000913.3_1|337|2799|1|ID=1_1;partial=00;start_type=ATG;rbs_motif=GGAG/GAGG;rbs_spacer=5-10bp;gc_cont=0.531	WP_001264707.1 MULTISPECIES: bifunctional aspartate kinase/homoserine dehydrogenase I [Enterobacteriaceae]	100	99.9	0.0
NC_000913.3_2|2801|3733|1|ID=1_2;partial=00;start_type=ATG;rbs_motif=AGGAG;rbs_spacer=5-10bp;gc_cont=0.563	WP_000241662.1 MULTISPECIES: homoserine kinase [Enterobacteriaceae]	100	99.7	9.89e-226
NC_000913.3_3|3734|5020|1|ID=1_3;partial=00;start_type=ATG;rbs_motif=GGA/GAG/AGG;rbs_spacer=5-10bp;gc_cont=0.528	WP_000781074.1 MULTISPECIES: threonine synthase [Enterobacteriaceae]	100	99.8	3.31e-311
NC_000913.3_4|5234|5530|1|ID=1_4;partial=00;start_type=GTG;rbs_motif=AGGAG;rbs_spacer=5-10bp;gc_cont=0.539	WP_000738719.1 MULTISPECIES: DUF2502 domain-containing protein [Enterobacteriaceae]	100	99.0	1.23e-45
NC_000913.3_5|5683|6459|-1|ID=1_5;partial=00;start_type=ATG;rbs_motif=AGGA;rbs_spacer=5-10bp;gc_cont=0.495	WP_000906197.1 MULTISPECIES: peroxide stress protein YaaA [Enterobacteriaceae]	100	99.6	1.16e-182
NC_000913.3_6|6529|7959|-1|ID=1_6;partial=00;start_type=ATG;rbs_motif=GGAG/GAGG;rbs_spacer=5-10bp;gc_cont=0.534	WP_001112606.1 MULTISPECIES: alanine/glycine:cation symporter family protein [Enterobacteriaceae]	100	99.8	0.0
NC_000913.3_7|8238|9191|1|ID=1_7;partial=00;start_type=ATG;rbs_motif=GGA/GAG/AGG;rbs_spacer=5-10bp;gc_cont=0.520	WP_000130185.1 MULTISPECIES: transaldolase [Enterobacteriaceae]	100	99.7	6.66e-223
NC_000913.3_8|9306|9893|1|ID=1_8;partial=00;start_type=ATG;rbs_motif=GGA/GAG/AGG;rbs_spacer=5-10bp;gc_cont=0.544	WP_001295414.1 MULTISPECIES: molybdopterin adenylyltransferase [Enterobacteriaceae]	100	99.5	1.89e-134
NC_000913.3_9|9928|10494|-1|ID=1_9;partial=00;start_type=ATG;rbs_motif=GGA/GAG/AGG;rbs_spacer=5-10bp;gc_cont=0.529	WP_000528538.1 MULTISPECIES: acetate uptake transporter [Enterobacteriaceae]	100	99.5	9.80e-129
NC_000913.3_10|10643|11356|-1|ID=1_10;partial=00;start_type=ATG;rbs_motif=AGxAG;rbs_spacer=5-10bp;gc_cont=0.507	WP_001102367.1 MULTISPECIES: acidic protein MsyB [Pseudomonadati]	100	99.6	1.40e-159
NC_000913.3_11|11382|11786|-1|ID=1_11;partial=00;start_type=ATG;rbs_motif=GGA/GAG/AGG;rbs_spacer=5-10bp;gc_cont=0.486	WP_000843565.1 MULTISPECIES: DUF2541 family protein [Pseudomonadati]	100	99.3	4.13e-88
NC_000913.3_12|12163|14079|1|ID=1_12;partial=00;start_type=ATG;rbs_motif=GGAG/GAGG;rbs_spacer=5-10bp;gc_cont=0.511	WP_000516135.1 MULTISPECIES: molecular chaperone DnaK [Pseudomonadota]	100	99.8	0.0
NC_000913.3_13|14168|15298|1|ID=1_13;partial=00;start_type=ATG;rbs_motif=3Base/5BMM;rbs_spacer=13-15bp;gc_cont=0.552	WP_001118476.1 MULTISPECIES: molecular chaperone DnaJ [Enterobacteriaceae]	100	99.7	1.72e-241
NC_000913.3_14|15445|16557|1|ID=1_14;partial=00;start_type=ATG;rbs_motif=None;rbs_spacer=None;gc_cont=0.519	WP_001300563.1 MULTISPECIES: IS4-like element IS421 family transposase [Bacteria]	100	99.7	7.70e-267
NC_000913.3_15|16580|16720|1|ID=1_15;partial=00;start_type=ATG;rbs_motif=GGAG/GAGG;rbs_spacer=5-10bp;gc_cont=0.511	WP_315805892.1 IS4 family transposase [Escherichia coli]	100	97.9	6.38e-20
NC_000913.3_16|16751|16960|-1|ID=1_16;partial=00;start_type=ATG;rbs_motif=GGAG/GAGG;rbs_spacer=5-10bp;gc_cont=0.510	WP_000935263.1 type I toxin-antitoxin system Hok family toxin [Escherichia coli]	98.6	98.6	6.70e-39
NC_000913.3_17|17489|18655|1|ID=1_17;partial=00;start_type=GTG;rbs_motif=GGA/GAG/AGG;rbs_spacer=5-10bp;gc_cont=0.514	WP_000681354.1 MULTISPECIES: Na+/H+ antiporter NhaA [Enterobacteriaceae]	100	99.7	7.38e-265
NC_000913.3_18|18721|19620|1|ID=1_18;partial=00;start_type=ATG;rbs_motif=GGAG/GAGG;rbs_spacer=5-10bp;gc_cont=0.474	WP_001338226.1 MULTISPECIES: transcriptional activator NhaR [Enterobacteriaceae]	100	99.7	2.50e-218
NC_000913.3_19|19811|20188|-1|ID=1_19;partial=00;start_type=ATG;rbs_motif=None;rbs_spacer=None;gc_cont=0.537	WP_000344410.1 IS1 family transposase [Escherichia coli]	100	99.2	2.03e-86
NC_000913.3_20|20233|20508|-1|ID=1_20;partial=00;start_type=GTG;rbs_motif=GGAG/GAGG;rbs_spacer=5-10bp;gc_cont=0.525	WP_000179213.1 MULTISPECIES: IS1-like element transposase [Pseudomonadota]	100	98.9	1.68e-60
NC_000913.3_21|20815|21078|-1|ID=1_21;partial=00;start_type=TTG;rbs_motif=GGAG/GAGG;rbs_spacer=5-10bp;gc_cont=0.470	WP_001274021.1 MULTISPECIES: 30S ribosomal protein S20 [Gammaproteobacteria]	100	98.9	4.10e-48
NC_000913.3_22|21407|22348|1|ID=1_22;partial=00;start_type=ATG;rbs_motif=GGA/GAG/AGG;rbs_spacer=5-10bp;gc_cont=0.536	WP_000767329.1 MULTISPECIES: bifunctional riboflavin kinase/FAD synthetase [Enterobacteriaceae]	100	99.7	1.20e-223
NC_000913.3_23|22391|25207|1|ID=1_23;partial=00;start_type=ATG;rbs_motif=GGA/GAG/AGG;rbs_spacer=5-10bp;gc_cont=0.558	WP_001286857.1 MULTISPECIES: isoleucine--tRNA ligase [Enterobacteriaceae]	100	99.9	0.0
NC_000913.3_24|25207|25701|1|ID=1_24;partial=00;start_type=ATG;rbs_motif=None;rbs_spacer=None;gc_cont=0.535	WP_000083372.1 MULTISPECIES: signal peptidase II [Enterobacteriaceae]	100	99.4	9.79e-115
NC_000913.3_25|25826|26275|1|ID=1_25;partial=00;start_type=ATG;rbs_motif=GGA/GAG/AGG;rbs_spacer=5-10bp;gc_cont=0.544	WP_000004655.1 MULTISPECIES: FKBP-type peptidyl-prolyl cis-trans isomerase [Enterobacteriaceae]	100	99.3	6.84e-101
NC_000913.3_26|26277|27227|1|ID=1_26;partial=00;start_type=ATG;rbs_motif=GGAGG;rbs_spacer=5-10bp;gc_cont=0.551	WP_001166395.1 MULTISPECIES: 4-hydroxy-3-methylbut-2-enyl diphosphate reductase [Enterobacteriaceae]	100	99.7	1.51e-223
NC_000913.3_27|27293|28207|1|ID=1_27;partial=00;start_type=ATG;rbs_motif=GGAG/GAGG;rbs_spacer=5-10bp;gc_cont=0.563	WP_001239142.1 MULTISPECIES: ribonucleoside hydrolase RihC [Enterobacteriaceae]	100	99.7	1.34e-220
NC_000913.3_28|28374|29195|1|ID=1_28;partial=00;start_type=ATG;rbs_motif=GGA/GAG/AGG;rbs_spacer=5-10bp;gc_cont=0.534	WP_000543604.1 MULTISPECIES: 4-hydroxy-tetrahydrodipicolinate reductase [Enterobacteriaceae]	100	99.6	4.90e-187
NC_000913.3_29|29651|30799|1|ID=1_29;partial=00;start_type=TTG;rbs_motif=GGAGG;rbs_spacer=5-10bp;gc_cont=0.534	WP_000597260.1 MULTISPECIES: glutamine-hydrolyzing carbamoyl-phosphate synthase small subunit [Enterobacteriaceae]	100	99.7	2.27e-281
NC_000913.3_30|30817|34038|1|ID=1_30;partial=00;start_type=ATG;rbs_motif=AGGAG;rbs_spacer=5-10bp;gc_cont=0.563	WP_001126348.1 MULTISPECIES: carbamoyl-phosphate synthase large subunit [Enterobacteriaceae]	100	99.9	0.0
NC_000913.3_31|34300|34695|1|ID=1_31;partial=00;start_type=ATG;rbs_motif=GGAG/GAGG;rbs_spacer=5-10bp;gc_cont=0.460	WP_000333125.1 MULTISPECIES: carnitine metabolism transcriptional regulator CaiF [Gammaproteobacteria]	100	99.2	8.09e-89
NC_000913.3_32|34781|35371|-1|ID=1_32;partial=00;start_type=GTG;rbs_motif=AGGA/GGAG/GAGG;rbs_spacer=11-12bp;gc_cont=0.550	WP_000122871.1 MULTISPECIES: carnitine operon protein CaiE [Enterobacteriaceae]	100	99.5	5.43e-139
NC_000913.3_33|35377|36162|-1|ID=1_33;partial=00;start_type=ATG;rbs_motif=GGAG/GAGG;rbs_spacer=5-10bp;gc_cont=0.541	WP_001295419.1 MULTISPECIES: crotonobetainyl-CoA hydratase [Enterobacteriaceae]	100	99.6	3.08e-184
NC_000913.3_34|36271|37824|-1|ID=1_34;partial=00;start_type=ATG;rbs_motif=GGA/GAG/AGG;rbs_spacer=5-10bp;gc_cont=0.511	WP_001350478.1 MULTISPECIES: crotonobetaine/carnitine-CoA ligase [Escherichia]	100	99.8	0.0
NC_000913.3_35|37898|39115|-1|ID=1_35;partial=00;start_type=ATG;rbs_motif=AGGAG;rbs_spacer=5-10bp;gc_cont=0.525	WP_000349936.1 MULTISPECIES: L-carnitine CoA-transferase [Enterobacteriaceae]	100	99.8	4.99e-308
NC_000913.3_36|39244|40386|-1|ID=1_36;partial=00;start_type=ATG;rbs_motif=GGAG/GAGG;rbs_spacer=5-10bp;gc_cont=0.538	WP_000347117.1 MULTISPECIES: crotonobetainyl-CoA dehydrogenase [Gammaproteobacteria]	100	99.7	7.89e-281
NC_000913.3_37|40417|41931|-1|ID=1_37;partial=00;start_type=ATG;rbs_motif=GGA/GAG/AGG;rbs_spacer=5-10bp;gc_cont=0.519	WP_413177060.1 L-carnitine/gamma-butyrobetaine antiporter [Escherichia coli]	100	99.8	0.0
NC_000913.3_38|42403|43173|1|ID=1_38;partial=00;start_type=ATG;rbs_motif=GGAG/GAGG;rbs_spacer=5-10bp;gc_cont=0.525	WP_000692204.1 MULTISPECIES: electron transfer flavoprotein FixA [Enterobacteriaceae]	100	99.6	1.50e-168
NC_000913.3_39|43188|44129|1|ID=1_39;partial=00;start_type=ATG;rbs_motif=GGA/GAG/AGG;rbs_spacer=5-10bp;gc_cont=0.567	WP_001091499.1 MULTISPECIES: electron transfer flavoprotein subunit alpha/FixB family protein [Enterobacteriaceae]	100	99.7	3.84e-220
NC_000913.3_40|44180|45466|1|ID=1_40;partial=00;start_type=ATG;rbs_motif=GGAG/GAGG;rbs_spacer=5-10bp;gc_cont=0.549	WP_001287715.1 MULTISPECIES: FAD-dependent oxidoreductase [Enterobacteriaceae]	100	99.8	7.66e-301
NC_000913.3_41|45463|45750|1|ID=1_41;partial=00;start_type=ATG;rbs_motif=AGGAG;rbs_spacer=5-10bp;gc_cont=0.569	WP_000203741.1 MULTISPECIES: ferredoxin-like protein FixX [Gammaproteobacteria]	100	99.0	6.15e-67
NC_000913.3_42|45807|47138|1|ID=1_42;partial=00;start_type=ATG;rbs_motif=AGGA;rbs_spacer=5-10bp;gc_cont=0.533	WP_001183198.1 MULTISPECIES: MFS transporter [Enterobacteriaceae]	100	99.8	0.0
NC_000913.3_43|47246|47776|1|ID=1_43;partial=00;start_type=ATG;rbs_motif=None;rbs_spacer=None;gc_cont=0.546	WP_000600725.1 MULTISPECIES: glutathione-regulated potassium-efflux system oxidoreductase KefF [Gammaproteobacteria]	100	99.4	2.98e-133
NC_000913.3_44|47769|49631|1|ID=1_44;partial=00;start_type=ATG;rbs_motif=AGGAG;rbs_spacer=5-10bp;gc_cont=0.555	WP_000377098.1 MULTISPECIES: glutathione-regulated potassium-efflux system protein KefC [Enterobacteriaceae]	100	99.8	0.0
NC_000913.3_45|49712|50302|1|ID=1_45;partial=00;start_type=GTG;rbs_motif=GGAG/GAGG;rbs_spacer=5-10bp;gc_cont=0.509	WP_001301983.1 type 3 dihydrofolate reductase [Escherichia coli]	99.5	99.5	3.41e-142
NC_000913.3_46|50380|51222|-1|ID=1_46;partial=00;start_type=ATG;rbs_motif=None;rbs_spacer=None;gc_cont=0.556	WP_000257192.1 MULTISPECIES: bis(5'-nucleosyl)-tetraphosphatase (symmetrical) ApaH [Enterobacteriaceae]	100	99.6	4.31e-214
NC_000913.3_47|51229|51606|-1|ID=1_47;partial=00;start_type=ATG;rbs_motif=AGGAG;rbs_spacer=5-10bp;gc_cont=0.524	WP_000610901.1 MULTISPECIES: Co2+/Mg2+ efflux protein ApaG [Gammaproteobacteria]	100	99.2	4.09e-86
NC_000913.3_48|51609|52430|-1|ID=1_48;partial=00;start_type=ATG;rbs_motif=None;rbs_spacer=None;gc_cont=0.530	WP_001065381.1 MULTISPECIES: 16S rRNA (adenine(1518)-N(6)/adenine(1519)-N(6))-dimethyltransferase RsmA [Gammaproteobacteria]	100	99.6	5.55e-193
NC_000913.3_49|52427|53416|-1|ID=1_49;partial=00;start_type=ATG;rbs_motif=GGA/GAG/AGG;rbs_spacer=5-10bp;gc_cont=0.564	WP_000241277.1 MULTISPECIES: 4-hydroxythreonine-4-phosphate dehydrogenase PdxA [Enterobacteriaceae]	100	99.7	3.23e-236
NC_000913.3_50|53416|54702|-1|ID=1_50;partial=00;start_type=ATG;rbs_motif=GGA/GAG/AGG;rbs_spacer=5-10bp;gc_cont=0.538	WP_000800457.1 MULTISPECIES: peptidylprolyl isomerase SurA [Enterobacteriaceae]	100	99.8	2.10e-298
NC_000913.3_51|54755|57109|-1|ID=1_51;partial=00;start_type=ATG;rbs_motif=None;rbs_spacer=None;gc_cont=0.514	WP_000746151.1 MULTISPECIES: LPS assembly protein LptD [Gammaproteobacteria]	100	99.9	0.0
NC_000913.3_52|57364|58179|1|ID=1_52;partial=00;start_type=ATG;rbs_motif=GGA/GAG/AGG;rbs_spacer=3-4bp;gc_cont=0.527	WP_001200579.1 MULTISPECIES: co-chaperone DjlA [Gammaproteobacteria]	100	99.6	1.12e-191
NC_000913.3_53|58474|59124|1|ID=1_53;partial=00;start_type=ATG;rbs_motif=GGAG/GAGG;rbs_spacer=5-10bp;gc_cont=0.452	WP_163435340.1 T3SS effector EspY1, partial [Escherichia coli]	100	91.7	8.92e-144
NC_000913.3_54|59121|59279|1|ID=1_54;partial=00;start_type=GTG;rbs_motif=GGA/GAG/AGG;rbs_spacer=5-10bp;gc_cont=0.340	WP_001393554.1 MULTISPECIES: protein YabQ [Enterobacteriaceae]	100	98.1	5.63e-06
NC_000913.3_55|59687|60346|-1|ID=1_55;partial=00;start_type=ATG;rbs_motif=GGAG/GAGG;rbs_spacer=5-10bp;gc_cont=0.539	WP_000525176.1 MULTISPECIES: bifunctional tRNA pseudouridine(32) synthase/23S rRNA pseudouridine(746) synthase RluA [Enterobacteriaceae]	100	99.5	1.00e-159
NC_000913.3_56|60358|63264|-1|ID=1_56;partial=00;start_type=ATG;rbs_motif=GGA/GAG/AGG;rbs_spacer=5-10bp;gc_cont=0.549	WP_001117011.1 MULTISPECIES: RNA polymerase-associated protein RapA [Gammaproteobacteria]	100	99.9	0.0
NC_000913.3_57|63429|65780|-1|ID=1_57;partial=00;start_type=GTG;rbs_motif=GGA/GAG/AGG;rbs_spacer=5-10bp;gc_cont=0.554	WP_000035670.1 MULTISPECIES: DNA polymerase II [Enterobacteriaceae]	100	99.9	0.0
NC_000913.3_58|65855|66550|-1|ID=1_58;partial=00;start_type=ATG;rbs_motif=AGGAG;rbs_spacer=5-10bp;gc_cont=0.553	WP_000888666.1 MULTISPECIES: L-ribulose-5-phosphate 4-epimerase [Enterobacteriaceae]	100	99.6	1.87e-170
NC_000913.3_59|66835|68337|-1|ID=1_59;partial=00;start_type=ATG;rbs_motif=AGGA;rbs_spacer=5-10bp;gc_cont=0.554	WP_000151748.1 MULTISPECIES: L-arabinose isomerase [Enterobacteriaceae]	100	99.8	0.0
NC_000913.3_60|68348|70048|-1|ID=1_60;partial=00;start_type=ATG;rbs_motif=GGAG/GAGG;rbs_spacer=5-10bp;gc_cont=0.581	WP_000951856.1 MULTISPECIES: ribulokinase [Enterobacteriaceae]	100	99.8	0.0
NC_000913.3_61|70387|71265|1|ID=1_61;partial=00;start_type=ATG;rbs_motif=GGAG/GAGG;rbs_spacer=5-10bp;gc_cont=0.526	WP_001300811.1 MULTISPECIES: arabinose operon transcriptional regulator AraC [Bacteria]	100	99.7	5.27e-221
NC_000913.3_62|71351|72115|1|ID=1_62;partial=00;start_type=ATG;rbs_motif=GGA/GAG/AGG;rbs_spacer=5-10bp;gc_cont=0.539	WP_001148390.1 MULTISPECIES: DedA family protein [Enterobacteriaceae]	100	99.6	2.01e-181
NC_000913.3_63|72229|72927|-1|ID=1_63;partial=00;start_type=ATG;rbs_motif=None;rbs_spacer=None;gc_cont=0.569	WP_000916281.1 MULTISPECIES: thiamine ABC transporter ATP-binding protein ThiQ [Enterobacteriaceae]	100	99.6	7.81e-159
NC_000913.3_64|72911|74521|-1|ID=1_64;partial=00;start_type=ATG;rbs_motif=GGA/GAG/AGG;rbs_spacer=5-10bp;gc_cont=0.584	WP_000235721.1 MULTISPECIES: thiamine/thiamine pyrophosphate ABC transporter permease ThiP [Enterobacteriaceae]	100	99.8	0.0
NC_000913.3_65|74497|75480|-1|ID=1_65;partial=00;start_type=GTG;rbs_motif=GGAG/GAGG;rbs_spacer=5-10bp;gc_cont=0.532	WP_001301364.1 MULTISPECIES: thiamine ABC transporter substrate binding subunit [Gammaproteobacteria]	100	99.7	3.00e-240
NC_000913.3_66|75644|77299|-1|ID=1_66;partial=00;start_type=ATG;rbs_motif=AGGAG;rbs_spacer=5-10bp;gc_cont=0.548	WP_001138624.1 MULTISPECIES: DNA-binding transcriptional regulator SgrR [Enterobacteriaceae]	100	99.8	0.0
NC_000913.3_67|77388|77519|1|ID=1_67;partial=00;start_type=ATG;rbs_motif=AGxAGG/AGGxGG;rbs_spacer=5-10bp;gc_cont=0.470	WP_001248770.1 MULTISPECIES: glucose uptake inhibitor SgrT [Gammaproteobacteria]	100	97.7	5.27e-25
NC_000913.3_68|77621|78799|1|ID=1_68;partial=00;start_type=ATG;rbs_motif=GGA/GAG/AGG;rbs_spacer=5-10bp;gc_cont=0.485	WP_000637847.1 MULTISPECIES: sugar efflux transporter SetA [Enterobacteriaceae]	100	99.7	1.63e-270
NC_000913.3_69|78848|79453|-1|ID=1_69;partial=00;start_type=ATG;rbs_motif=AGGAG;rbs_spacer=5-10bp;gc_cont=0.518	WP_000818228.1 MULTISPECIES: 3-isopropylmalate dehydratase small subunit [Enterobacteriaceae]	100	99.5	6.59e-147
NC_000913.3_70|79464|80864|-1|ID=1_70;partial=00;start_type=ATG;rbs_motif=AGxAGG/AGGxGG;rbs_spacer=5-10bp;gc_cont=0.558	WP_001140652.1 MULTISPECIES: 3-isopropylmalate dehydratase large subunit [Enterobacteriaceae]	100	99.8	0.0
NC_000913.3_71|80867|81958|-1|ID=1_71;partial=00;start_type=ATG;rbs_motif=AGGA;rbs_spacer=5-10bp;gc_cont=0.555	WP_000042353.1 MULTISPECIES: 3-isopropylmalate dehydrogenase [Gammaproteobacteria]	100	99.7	2.77e-261
NC_000913.3_72|81958|83529|-1|ID=1_72;partial=00;start_type=ATG;rbs_motif=AGGA;rbs_spacer=5-10bp;gc_cont=0.531	WP_000082850.1 MULTISPECIES: 2-isopropylmalate synthase [Enterobacteriaceae]	100	99.8	0.0
NC_000913.3_73|84368|85312|1|ID=1_73;partial=00;start_type=ATG;rbs_motif=GGAG/GAGG;rbs_spacer=5-10bp;gc_cont=0.457	WP_001115472.1 MULTISPECIES: transcriptional regulator LeuO [Enterobacteriaceae]	100	99.7	1.41e-227
NC_000913.3_74|85630|87354|1|ID=1_74;partial=00;start_type=ATG;rbs_motif=GGAG/GAGG;rbs_spacer=5-10bp;gc_cont=0.529	WP_001295534.1 MULTISPECIES: acetolactate synthase 3 large subunit [Enterobacteriaceae]	100	99.8	0.0
NC_000913.3_75|87357|87848|1|ID=1_75;partial=00;start_type=ATG;rbs_motif=GGA/GAG/AGG;rbs_spacer=5-10bp;gc_cont=0.502	WP_001300383.1 MULTISPECIES: acetolactate synthase small subunit [Enterobacteriaceae]	100	99.4	1.82e-105
NC_000913.3_76|88028|89032|1|ID=1_76;partial=00;start_type=GTG;rbs_motif=GGA/GAG/AGG;rbs_spacer=5-10bp;gc_cont=0.549	WP_000762401.1 MULTISPECIES: catabolite repressor/activator [Enterobacteriaceae]	100	99.7	1.22e-238
NC_000913.3_77|89634|90092|1|ID=1_77;partial=00;start_type=ATG;rbs_motif=GGAG/GAGG;rbs_spacer=5-10bp;gc_cont=0.521	WP_001295533.1 MULTISPECIES: division/cell wall cluster transcriptional repressor MraZ [Enterobacteriaceae]	100	99.3	2.66e-104
NC_000913.3_78|90094|91035|1|ID=1_78;partial=00;start_type=ATG;rbs_motif=4Base/6BMM;rbs_spacer=13-15bp;gc_cont=0.552	WP_000970479.1 MULTISPECIES: 16S rRNA (cytosine(1402)-N(4))-methyltransferase RsmH [Enterobacteriaceae]	100	99.7	1.83e-218
NC_000913.3_79|91032|91397|1|ID=1_79;partial=00;start_type=ATG;rbs_motif=GGAG/GAGG;rbs_spacer=5-10bp;gc_cont=0.503	WP_000625658.1 MULTISPECIES: cell division protein FtsL [Enterobacteriaceae]	100	99.2	1.51e-77
NC_000913.3_80|91413|93179|1|ID=1_80;partial=00;start_type=ATG;rbs_motif=AGGA/GGAG/GAGG;rbs_spacer=11-12bp;gc_cont=0.540	WP_000642196.1 MULTISPECIES: peptidoglycan glycosyltransferase FtsI [Enterobacteriaceae]	100	99.8	0.0
NC_000913.3_81|93166|94653|1|ID=1_81;partial=00;start_type=GTG;rbs_motif=GGAG/GAGG;rbs_spacer=5-10bp;gc_cont=0.566	WP_000775093.1 MULTISPECIES: UDP-N-acetylmuramoyl-L-alanyl-D-glutamate--2,6-diaminopimelate ligase [Escherichia]	100	99.8	0.0
NC_000913.3_82|94650|96008|1|ID=1_82;partial=00;start_type=ATG;rbs_motif=GGxGG;rbs_spacer=5-10bp;gc_cont=0.551	WP_000626685.1 MULTISPECIES: UDP-N-acetylmuramoyl-tripeptide--D-alanyl-D-alanine ligase [Enterobacteriaceae]	100	99.8	2.75e-313
NC_000913.3_83|96002|97084|1|ID=1_83;partial=00;start_type=ATG;rbs_motif=AGGAG;rbs_spacer=5-10bp;gc_cont=0.534	WP_000964131.1 MULTISPECIES: phospho-N-acetylmuramoyl-pentapeptide-transferase [Enterobacteriaceae]	100	99.7	3.48e-258
NC_000913.3_84|97087|98403|1|ID=1_84;partial=00;start_type=ATG;rbs_motif=GGA/GAG/AGG;rbs_spacer=5-10bp;gc_cont=0.549	WP_000796481.1 MULTISPECIES: UDP-N-acetylmuramoyl-L-alanine--D-glutamate ligase [Enterobacteriaceae]	100	99.8	4.26e-315
NC_000913.3_85|98403|99647|1|ID=1_85;partial=00;start_type=ATG;rbs_motif=AGGAG;rbs_spacer=5-10bp;gc_cont=0.530	WP_001295532.1 MULTISPECIES: cell division protein FtsW [Enterobacteriaceae]	100	99.8	3.83e-287
NC_000913.3_86|99644|100711|1|ID=1_86;partial=00;start_type=ATG;rbs_motif=GGAG/GAGG;rbs_spacer=5-10bp;gc_cont=0.561	WP_000016560.1 MULTISPECIES: undecaprenyldiphospho-muramoylpentapeptide beta-N-acetylglucosaminyltransferase [Enterobacteriaceae]	100	99.7	3.44e-251
NC_000913.3_87|100765|102240|1|ID=1_87;partial=00;start_type=ATG;rbs_motif=3Base/5BMM;rbs_spacer=13-15bp;gc_cont=0.547	WP_001096049.1 MULTISPECIES: UDP-N-acetylmuramate--L-alanine ligase [Enterobacteriaceae]	100	99.8	0.0
NC_000913.3_88|102233|103153|1|ID=1_88;partial=00;start_type=ATG;rbs_motif=GGAGG;rbs_spacer=5-10bp;gc_cont=0.516	WP_000130056.1 MULTISPECIES: D-alanine--D-alanine ligase [Enterobacteriaceae]	100	99.7	4.83e-215
NC_000913.3_89|103155|103985|1|ID=1_89;partial=00;start_type=ATG;rbs_motif=GGA/GAG/AGG;rbs_spacer=5-10bp;gc_cont=0.533	WP_000075748.1 MULTISPECIES: cell division protein FtsQ [Enterobacteriaceae]	100	99.6	1.47e-194
NC_000913.3_90|103982|105244|1|ID=1_90;partial=00;start_type=ATG;rbs_motif=GGA/GAG/AGG;rbs_spacer=5-10bp;gc_cont=0.521	WP_000588474.1 MULTISPECIES: cell division protein FtsA [Enterobacteriaceae]	100	99.8	4.78e-300
NC_000913.3_91|105305|106456|1|ID=1_91;partial=00;start_type=ATG;rbs_motif=GGAG/GAGG;rbs_spacer=5-10bp;gc_cont=0.542	WP_000462776.1 MULTISPECIES: cell division protein FtsZ [Enterobacteriaceae]	100	99.7	1.95e-262
NC_000913.3_92|106557|107474|1|ID=1_92;partial=00;start_type=ATG;rbs_motif=GGA/GAG/AGG;rbs_spacer=5-10bp;gc_cont=0.511	WP_000595482.1 MULTISPECIES: UDP-3-O-acyl-N-acetylglucosamine deacetylase [Enterobacteriaceae]	100	99.7	5.07e-221
NC_000913.3_93|107630|108217|1|ID=1_93;partial=00;start_type=GTG;rbs_motif=None;rbs_spacer=None;gc_cont=0.524	WP_011069245.1 secA translation cis-regulator SecM [Shigella flexneri]	99.0	99.5	4.30e-140
NC_000913.3_94|108279|110984|1|ID=1_94;partial=00;start_type=ATG;rbs_motif=GGA/GAG/AGG;rbs_spacer=5-10bp;gc_cont=0.524	WP_000905789.1 MULTISPECIES: preprotein translocase subunit SecA [Enterobacteriaceae]	100	99.9	0.0
NC_000913.3_95|111044|111433|1|ID=1_95;partial=00;start_type=ATG;rbs_motif=GGA/GAG/AGG;rbs_spacer=5-10bp;gc_cont=0.492	WP_000736007.1 MULTISPECIES: 8-oxo-dGTP diphosphatase MutT [Gammaproteobacteria]	100	99.2	2.16e-92
NC_000913.3_96|111649|111846|-1|ID=1_96;partial=00;start_type=ATG;rbs_motif=AGGAG;rbs_spacer=5-10bp;gc_cont=0.510	WP_000005042.1 MULTISPECIES: DNA gyrase inhibitor YacG [Bacteria]	100	98.5	3.16e-42
NC_000913.3_97|111856|112599|-1|ID=1_97;partial=00;start_type=ATG;rbs_motif=AGGA;rbs_spacer=5-10bp;gc_cont=0.512	WP_001194734.1 MULTISPECIES: cell division protein ZapD [Gammaproteobacteria]	100	99.6	5.12e-176
NC_000913.3_98|112599|113219|-1|ID=1_98;partial=00;start_type=ATG;rbs_motif=GGA/GAG/AGG;rbs_spacer=5-10bp;gc_cont=0.523	WP_001269520.1 MULTISPECIES: dephospho-CoA kinase [Enterobacteriaceae]	100	99.5	9.59e-138
NC_000913.3_99|113444|114487|1|ID=1_99;partial=00;start_type=ATG;rbs_motif=AGGA;rbs_spacer=5-10bp;gc_cont=0.513	WP_001217338.1 MULTISPECIES: GMP reductase [Enterobacteriaceae]	100	99.7	1.24e-249
NC_000913.3_100|114522|115724|-1|ID=1_100;partial=00;start_type=ATG;rbs_motif=GGA/GAG/AGG;rbs_spacer=5-10bp;gc_cont=0.520	WP_000157266.1 MULTISPECIES: protein transport protein HofC [Enterobacteriaceae]	100	99.8	2.38e-283
NC_000913.3_101|115714|117099|-1|ID=1_101;partial=00;start_type=ATG;rbs_motif=AGGAG;rbs_spacer=5-10bp;gc_cont=0.535	WP_001025145.1 MULTISPECIES: type II secretion system protein GspE [Enterobacteriaceae]	100	99.8	0.0
NC_000913.3_102|117109|117549|-1|ID=1_102;partial=00;start_type=ATG;rbs_motif=AGGAG;rbs_spacer=5-10bp;gc_cont=0.531	WP_000360904.1 MULTISPECIES: prepilin peptidase-dependent pilin [Enterobacteriaceae]	100	99.3	3.69e-99
NC_000913.3_103|117752|118645|-1|ID=1_103;partial=00;start_type=ATG;rbs_motif=GGAG/GAGG;rbs_spacer=5-10bp;gc_cont=0.530	WP_001135174.1 MULTISPECIES: carboxylating nicotinate-nucleotide diphosphorylase [Enterobacteriaceae]	100	99.7	1.74e-208
NC_000913.3_104|118733|119284|1|ID=1_104;partial=00;start_type=ATG;rbs_motif=AGGAG;rbs_spacer=5-10bp;gc_cont=0.538	WP_000923721.1 MULTISPECIES: 1,6-anhydro-N-acetylmuramyl-L-alanine amidase AmpD [Enterobacteriaceae]	100	99.5	8.16e-139
NC_000913.3_105|119281|120135|1|ID=1_105;partial=00;start_type=ATG;rbs_motif=AGGAG;rbs_spacer=5-10bp;gc_cont=0.520	WP_000172005.1 MULTISPECIES: beta-lactamase regulator AmpE [Enterobacteriaceae]	100	99.6	3.24e-202
NC_000913.3_106|120178|121548|-1|ID=1_106;partial=00;start_type=ATG;rbs_motif=GGAG/GAGG;rbs_spacer=5-10bp;gc_cont=0.528	WP_000969915.1 MULTISPECIES: aromatic amino acid transporter AroP [Enterobacteriaceae]	100	99.8	0.0
NC_000913.3_107|122092|122856|1|ID=1_107;partial=00;start_type=ATG;rbs_motif=GGA/GAG/AGG;rbs_spacer=5-10bp;gc_cont=0.558	WP_000331776.1 MULTISPECIES: pyruvate dehydrogenase complex transcriptional repressor PdhR [Enterobacteriaceae]	100	99.6	2.70e-170
NC_000913.3_108|123017|125680|1|ID=1_108;partial=00;start_type=ATG;rbs_motif=AGGA;rbs_spacer=5-10bp;gc_cont=0.530	WP_000003820.1 MULTISPECIES: pyruvate dehydrogenase (acetyl-transferring), homodimeric type [Bacteria]	100	99.9	0.0
NC_000913.3_109|125695|127587|1|ID=1_109;partial=00;start_type=ATG;rbs_motif=GGAG/GAGG;rbs_spacer=5-10bp;gc_cont=0.547	WP_000963550.1 pyruvate dehydrogenase complex dihydrolipoyllysine-residue acetyltransferase [Escherichia coli]	99.0	99.8	0.0
NC_000913.3_110|127912|129336|1|ID=1_110;partial=00;start_type=ATG;rbs_motif=GGAG/GAGG;rbs_spacer=5-10bp;gc_cont=0.531	WP_000102485.1 MULTISPECIES: dihydrolipoyl dehydrogenase [Bacteria]	100	99.8	0.0
NC_000913.3_111|129407|131260|-1|ID=1_111;partial=00;start_type=ATG;rbs_motif=GGA/GAG/AGG;rbs_spacer=5-10bp;gc_cont=0.538	WP_000784470.1 MULTISPECIES: DUF3300 domain-containing protein [Enterobacteriaceae]	100	99.8	0.0
NC_000913.3_112|131615|134212|1|ID=1_112;partial=00;start_type=GTG;rbs_motif=AGGAG;rbs_spacer=5-10bp;gc_cont=0.559	WP_001307570.1 MULTISPECIES: bifunctional aconitate hydratase 2/2-methylisocitrate dehydratase [Enterobacteriaceae]	100	99.9	0.0
NC_000913.3_113|134388|134750|1|ID=1_113;partial=00;start_type=ATG;rbs_motif=GGAG/GAGG;rbs_spacer=5-10bp;gc_cont=0.521	WP_000384306.1 MULTISPECIES: protein YacL [Enterobacterales]	100	99.2	2.61e-82
NC_000913.3_114|134788|135582|-1|ID=1_114;partial=00;start_type=TTG;rbs_motif=AGGAG/GGAGG;rbs_spacer=11-12bp;gc_cont=0.462	WP_000734287.1 MULTISPECIES: adenosylmethionine decarboxylase [Enterobacteriaceae]	100	99.6	9.64e-194
NC_000913.3_115|135598|136464|-1|ID=1_115;partial=00;start_type=ATG;rbs_motif=AGGAG;rbs_spacer=5-10bp;gc_cont=0.507	WP_000818411.1 MULTISPECIES: polyamine aminopropyltransferase [Enterobacteriaceae]	100	99.7	4.85e-215
NC_000913.3_116|136570|136917|-1|ID=1_116;partial=00;start_type=ATG;rbs_motif=None;rbs_spacer=None;gc_cont=0.503	WP_001295568.1 MULTISPECIES: YacC family pilotin-like protein [Enterobacteriaceae]	100	99.1	2.77e-77
NC_000913.3_117|137083|138633|1|ID=1_117;partial=00;start_type=ATG;rbs_motif=AGGA;rbs_spacer=5-10bp;gc_cont=0.547	WP_001189647.1 MULTISPECIES: multicopper oxidase CueO [Enterobacteriaceae]	100	99.8	0.0
NC_000913.3_118|138835|141225|-1|ID=1_118;partial=00;start_type=ATG;rbs_motif=None;rbs_spacer=None;gc_cont=0.554	WP_001727319.1 quinoprotein glucose dehydrogenase [Escherichia coli]	98.9	99.9	0.0
NC_000913.3_119|141431|141967|1|ID=1_119;partial=00;start_type=ATG;rbs_motif=None;rbs_spacer=None;gc_cont=0.507	WP_000683335.1 MULTISPECIES: hypoxanthine phosphoribosyltransferase [Bacteria]	100	99.4	1.12e-120
