NC_000913.3_1070|1159362|1161551|-1|ID=1_1070;partial=00;start_type=ATG;rbs_motif=GGA/GAG/AGG;rbs_spacer=5-10bp;gc_cont=0.500	WP_000953441.1 MULTISPECIES: ferric-rhodotorulic acid/ferric-coprogen receptor FhuE [Enterobacteriaceae]	100	99.9	0.0
NC_000913.3_1071|1161885|1162244|1|ID=1_1071;partial=00;start_type=GTG;rbs_motif=AGGA;rbs_spacer=5-10bp;gc_cont=0.506	WP_000807125.1 MULTISPECIES: purine nucleoside phosphoramidase [Enterobacteriaceae]	100	99.2	1.92e-79
NC_000913.3_1072|1162247|1162624|1|ID=1_1072;partial=00;start_type=ATG;rbs_motif=GGA/GAG/AGG;rbs_spacer=5-10bp;gc_cont=0.495	WP_001225295.1 MULTISPECIES: YcfL family protein [Enterobacteriaceae]	100	99.2	9.66e-85
NC_000913.3_1073|1162638|1163279|1|ID=1_1073;partial=00;start_type=ATG;rbs_motif=GGA/GAG/AGG;rbs_spacer=11-12bp;gc_cont=0.564	WP_095158073.1 penicillin-binding protein activator LpoB [Escherichia coli]	99.5	99.5	6.54e-128
NC_000913.3_1074|1163260|1164084|1|ID=1_1074;partial=00;start_type=GTG;rbs_motif=GGA/GAG/AGG;rbs_spacer=5-10bp;gc_cont=0.533	WP_001116592.1 MULTISPECIES: thiamine kinase [Enterobacteriaceae]	100	99.6	5.86e-209
NC_000913.3_1075|1164095|1165120|1|ID=1_1075;partial=00;start_type=GTG;rbs_motif=AGGAG;rbs_spacer=5-10bp;gc_cont=0.530	WP_000529320.1 MULTISPECIES: beta-N-acetylhexosaminidase [Enterobacteriaceae]	100	99.7	1.68e-244
NC_000913.3_1076|1165143|1165685|1|ID=1_1076;partial=00;start_type=ATG;rbs_motif=GGAG/GAGG;rbs_spacer=5-10bp;gc_cont=0.466	WP_000587933.1 MULTISPECIES: alpha/beta hydrolase YcfP [Enterobacteriaceae]	100	99.4	8.18e-133
NC_000913.3_1077|1166085|1167389|1|ID=1_1077;partial=00;start_type=TTG;rbs_motif=AGxAGG/AGGxGG;rbs_spacer=5-10bp;gc_cont=0.530	WP_000211045.1 MULTISPECIES: NADH-quinone dehydrogenase [Enterobacteriaceae]	100	99.8	1.43e-315
NC_000913.3_1078|1167599|1168138|1|ID=1_1078;partial=00;start_type=GTG;rbs_motif=AGGAG;rbs_spacer=5-10bp;gc_cont=0.537	WP_414225485.1 glycine zipper 2TM domain-containing protein [Escherichia coli]	93.3	99.4	1.14e-109
NC_000913.3_1079|1168200|1168895|-1|ID=1_1079;partial=00;start_type=GTG;rbs_motif=GGA/GAG/AGG;rbs_spacer=5-10bp;gc_cont=0.503	WP_001362176.1 TetR family copper-responsive transcriptional repressor ComR [Escherichia coli]	99.1	99.6	1.16e-164
NC_000913.3_1080|1169073|1169330|1|ID=1_1080;partial=00;start_type=ATG;rbs_motif=GGA/GAG/AGG;rbs_spacer=5-10bp;gc_cont=0.473	WP_000800153.1 MULTISPECIES: multiple stress resistance protein BhsA [Enterobacteriaceae]	100	98.8	1.24e-48
NC_000913.3_1081|1169412|1170371|-1|ID=1_1081;partial=00;start_type=ATG;rbs_motif=GGA/GAG/AGG;rbs_spacer=5-10bp;gc_cont=0.532	WP_001350500.1 MULTISPECIES: L,D-transpeptidase LdtC [Escherichia]	100	99.7	3.20e-229
NC_000913.3_1082|1170518|1174012|-1|ID=1_1082;partial=00;start_type=ATG;rbs_motif=None;rbs_spacer=None;gc_cont=0.546	WP_115801846.1 transcription-repair coupling factor [Escherichia coli]	99.6	99.9	0.0
NC_000913.3_1083|1174092|1175165|-1|ID=1_1083;partial=00;start_type=ATG;rbs_motif=GGA/GAG/AGG;rbs_spacer=11-12bp;gc_cont=0.494	WP_000810231.1 MULTISPECIES: acyltransferase family protein [Enterobacteriaceae]	100	99.7	1.79e-238
NC_000913.3_1084|1175427|1176626|1|ID=1_1084;partial=00;start_type=ATG;rbs_motif=GGA/GAG/AGG;rbs_spacer=3-4bp;gc_cont=0.542	WP_115187543.1 MULTISPECIES: lipoprotein-releasing ABC transporter permease subunit LolC [Enterobacteriaceae]	100	99.8	8.60e-265
NC_000913.3_1085|1176619|1177320|1|ID=1_1085;partial=00;start_type=ATG;rbs_motif=GGAG/GAGG;rbs_spacer=5-10bp;gc_cont=0.551	WP_001033694.1 MULTISPECIES: lipoprotein-releasing ABC transporter ATP-binding protein LolD [Enterobacteriaceae]	100	99.6	1.77e-160
NC_000913.3_1086|1177326|1178564|1|ID=1_1086;partial=00;start_type=ATG;rbs_motif=GGAG/GAGG;rbs_spacer=5-10bp;gc_cont=0.518	WP_001251348.1 MULTISPECIES: lipoprotein-releasing ABC transporter permease subunit LolE [Enterobacteriaceae]	100	99.8	9.06e-290
NC_000913.3_1087|1178593|1179504|1|ID=1_1087;partial=00;start_type=ATG;rbs_motif=AGGAG;rbs_spacer=5-10bp;gc_cont=0.527	WP_000291270.1 MULTISPECIES: N-acetylglucosamine kinase [Enterobacteriaceae]	100	99.7	8.48e-228
NC_000913.3_1088|1179520|1180359|1|ID=1_1088;partial=00;start_type=ATG;rbs_motif=GGAG/GAGG;rbs_spacer=5-10bp;gc_cont=0.518	WP_000952737.1 MULTISPECIES: Sir2 family NAD+-dependent deacetylase [Enterobacteriaceae]	100	99.6	3.64e-201
NC_000913.3_1089|1180479|1181267|-1|ID=1_1089;partial=00;start_type=ATG;rbs_motif=GGA/GAG/AGG;rbs_spacer=5-10bp;gc_cont=0.427	WP_000713462.1 MULTISPECIES: TPM domain-containing protein [Enterobacteriaceae]	100	99.6	8.77e-180
NC_000913.3_1090|1181264|1181725|-1|ID=1_1090;partial=00;start_type=ATG;rbs_motif=AGGA;rbs_spacer=5-10bp;gc_cont=0.433	WP_000076376.1 MULTISPECIES: DUF3592 domain-containing protein [Enterobacteriaceae]	100	99.4	3.11e-108
NC_000913.3_1091|1181783|1182829|-1|ID=1_1091;partial=00;start_type=ATG;rbs_motif=GGA/GAG/AGG;rbs_spacer=5-10bp;gc_cont=0.507	WP_000759317.1 MULTISPECIES: spermidine/putrescine ABC transporter substrate-binding protein PotD [Enterobacteriaceae]	100	99.7	4.75e-259
NC_000913.3_1092|1182826|1183620|-1|ID=1_1092;partial=00;start_type=ATG;rbs_motif=AGxAGG/AGGxGG;rbs_spacer=5-10bp;gc_cont=0.503	WP_000580316.1 MULTISPECIES: spermidine/putrescine ABC transporter permease PotC [Enterobacteriaceae]	100	99.6	2.21e-174
NC_000913.3_1093|1183617|1184474|-1|ID=1_1093;partial=00;start_type=ATG;rbs_motif=AGGAG/GGAGG;rbs_spacer=11-12bp;gc_cont=0.503	WP_000799401.1 MULTISPECIES: spermidine/putrescine ABC transporter permease PotB [Enterobacteriaceae]	100	99.7	2.83e-192
NC_000913.3_1094|1184458|1185594|-1|ID=1_1094;partial=00;start_type=ATG;rbs_motif=None;rbs_spacer=None;gc_cont=0.508	WP_000531594.1 MULTISPECIES: spermidine/putrescine ABC transporter ATP-binding protein PotA [Enterobacteriaceae]	100	99.7	6.38e-270
NC_000913.3_1095|1185844|1187070|1|ID=1_1095;partial=00;start_type=ATG;rbs_motif=GGAG/GAGG;rbs_spacer=5-10bp;gc_cont=0.499	WP_000359434.1 MULTISPECIES: peptidase T [Enterobacteriaceae]	100	99.8	8.87e-299
NC_000913.3_1096|1187119|1188240|-1|ID=1_1096;partial=00;start_type=ATG;rbs_motif=GGA/GAG/AGG;rbs_spacer=5-10bp;gc_cont=0.539	WP_000456506.1 MULTISPECIES: [50S ribosomal protein L16]-arginine 3-hydroxylase [Enterobacteriaceae]	100	99.7	8.91e-288
NC_000913.3_1097|1188316|1189776|-1|ID=1_1097;partial=00;start_type=ATG;rbs_motif=None;rbs_spacer=None;gc_cont=0.514	WP_000735412.1 MULTISPECIES: two-component system sensor histidine kinase PhoQ [Enterobacteriaceae]	100	99.8	0.0
NC_000913.3_1098|1189776|1190447|-1|ID=1_1098;partial=00;start_type=ATG;rbs_motif=GGAG/GAGG;rbs_spacer=5-10bp;gc_cont=0.475	WP_001265471.1 MULTISPECIES: two-component system response regulator PhoP [Enterobacteriaceae]	100	99.6	1.21e-153
NC_000913.3_1099|1190616|1191986|-1|ID=1_1099;partial=00;start_type=ATG;rbs_motif=GGAG/GAGG;rbs_spacer=5-10bp;gc_cont=0.524	WP_000423742.1 MULTISPECIES: adenylosuccinate lyase [Enterobacteriaceae]	100	99.8	0.0
NC_000913.3_1100|1191990|1192631|-1|ID=1_1100;partial=00;start_type=GTG;rbs_motif=AGGA;rbs_spacer=5-10bp;gc_cont=0.572	WP_001297479.1 MULTISPECIES: high frequency lysogenization protein HflD [Bacteria]	100	99.5	1.85e-143
NC_000913.3_1101|1192667|1193773|-1|ID=1_1101;partial=00;start_type=ATG;rbs_motif=GGA/GAG/AGG;rbs_spacer=5-10bp;gc_cont=0.537	WP_001297484.1 MULTISPECIES: tRNA 2-thiouridine(34) synthase MnmA [Enterobacteriaceae]	100	99.7	6.40e-274
NC_000913.3_1102|1193827|1194288|-1|ID=1_1102;partial=00;start_type=ATG;rbs_motif=AGGA;rbs_spacer=5-10bp;gc_cont=0.500	WP_000476093.1 MULTISPECIES: phosphatase NudJ [Bacteria]	100	99.4	1.37e-111
NC_000913.3_1103|1194298|1194951|-1|ID=1_1103;partial=00;start_type=ATG;rbs_motif=GGA/GAG/AGG;rbs_spacer=5-10bp;gc_cont=0.512	WP_001248691.1 MULTISPECIES: 23S rRNA pseudouridine(2457) synthase RluE [Enterobacteriaceae]	100	99.5	1.31e-154
NC_000913.3_1104|1195123|1196373|1|ID=1_1104;partial=00;start_type=ATG;rbs_motif=AGGAG;rbs_spacer=5-10bp;gc_cont=0.502	WP_000444484.1 MULTISPECIES: NADP-dependent isocitrate dehydrogenase [Enterobacteriaceae]	100	99.8	1.38e-306
NC_000913.3_1105|1196867|1197532|-1|ID=1_1105;partial=00;start_type=ATG;rbs_motif=None;rbs_spacer=None;gc_cont=0.350	WP_000241967.1 MULTISPECIES: class I SAM-dependent methyltransferase [Escherichia]	100	99.5	6.49e-157
NC_000913.3_1106|1197533|1198228|-1|ID=1_1106;partial=00;start_type=ATG;rbs_motif=GGA/GAG/AGG;rbs_spacer=5-10bp;gc_cont=0.310	WP_010723094.1 MULTISPECIES: protein YmfE [Escherichia]	100	99.6	4.17e-161
NC_000913.3_1107|1198695|1199588|1|ID=1_1107;partial=00;start_type=ATG;rbs_motif=GGAG/GAGG;rbs_spacer=5-10bp;gc_cont=0.368	WP_001257372.1 MULTISPECIES: cell death peptidase Lit [Gammaproteobacteria]	100	99.7	1.24e-217
NC_000913.3_1108|1199679|1200806|-1|ID=1_1108;partial=00;start_type=ATG;rbs_motif=GGA/GAG/AGG;rbs_spacer=5-10bp;gc_cont=0.447	WP_000741310.1 MULTISPECIES: site-specific integrase [Escherichia]	100	99.7	5.04e-270
NC_000913.3_1109|1200787|1201032|-1|ID=1_1109;partial=00;start_type=ATG;rbs_motif=GGA/GAG/AGG;rbs_spacer=5-10bp;gc_cont=0.435	WP_000939945.1 MULTISPECIES: excisionase-like protein from lambdoid prophage 14 [Bacteria]	100	98.8	3.36e-51
NC_000913.3_1110|1201497|1201838|1|ID=1_1110;partial=00;start_type=ATG;rbs_motif=AGGA;rbs_spacer=5-10bp;gc_cont=0.386	WP_010723095.1 MULTISPECIES: YmfI family phage protein [Escherichia]	100	99.1	9.74e-77
NC_000913.3_1111|1201776|1202084|-1|ID=1_1111;partial=00;start_type=ATG;rbs_motif=GGAG/GAGG;rbs_spacer=5-10bp;gc_cont=0.469	WP_001005353.1 MULTISPECIES: protein YmfJ [Escherichia]	100	99.0	1.20e-65
NC_000913.3_1112|1202259|1202933|-1|ID=1_1112;partial=00;start_type=ATG;rbs_motif=3Base/5BMM;rbs_spacer=13-15bp;gc_cont=0.441	WP_000848748.1 MULTISPECIES: LexA family protein [Enterobacteriaceae]	100	99.6	2.10e-168
NC_000913.3_1113|1203024|1203224|1|ID=1_1113;partial=00;start_type=ATG;rbs_motif=GGAGG;rbs_spacer=5-10bp;gc_cont=0.428	WP_000649480.1 MULTISPECIES: YdaS family helix-turn-helix protein [Enterobacteriaceae]	100	98.5	3.96e-41
NC_000913.3_1114|1203268|1203825|1|ID=1_1114;partial=00;start_type=GTG;rbs_motif=GGAG/GAGG;rbs_spacer=5-10bp;gc_cont=0.496	WP_000515837.1 MULTISPECIES: protein YmfL [Escherichia]	100	99.5	2.24e-128
NC_000913.3_1115|1203822|1204160|1|ID=1_1115;partial=00;start_type=ATG;rbs_motif=GGAG/GAGG;rbs_spacer=5-10bp;gc_cont=0.499	WP_001087383.1 cell division inhibitor YmfM [Escherichia coli]	96.4	99.1	9.79e-72
NC_000913.3_1116|1204170|1205537|1|ID=1_1116;partial=00;start_type=ATG;rbs_motif=GGAG/GAGG;rbs_spacer=5-10bp;gc_cont=0.543	WP_285002800.1 terminase large subunit, partial [Escherichia coli]	99.7	82.9	3.62e-281
NC_000913.3_1117|1205549|1205731|1|ID=1_1117;partial=00;start_type=ATG;rbs_motif=GGAG/GAGG;rbs_spacer=5-10bp;gc_cont=0.601	WP_000605606.1 MULTISPECIES: protein YmfR [Enterobacteriaceae]	100	98.4	7.92e-34
NC_000913.3_1118|1205731|1206204|1|ID=1_1118;partial=00;start_type=GTG;rbs_motif=GGAGG;rbs_spacer=5-10bp;gc_cont=0.563	WP_334395058.1 phage portal protein, partial [Escherichia coli]	95.9	91.8	1.72e-95
NC_000913.3_1119|1206173|1206922|1|ID=1_1119;partial=00;start_type=GTG;rbs_motif=None;rbs_spacer=None;gc_cont=0.576	WP_250189088.1 baseplate J/gp47 family protein, partial [Escherichia coli]	98.8	99.6	1.34e-173
NC_000913.3_1120|1206913|1207497|1|ID=1_1120;partial=00;start_type=ATG;rbs_motif=GGA/GAG/AGG;rbs_spacer=5-10bp;gc_cont=0.573	WP_000383574.1 MULTISPECIES: YmfQ family protein [Escherichia]	100	99.5	7.46e-145
NC_000913.3_1121|1207501|1208130|1|ID=1_1121;partial=00;start_type=ATG;rbs_motif=GGAG/GAGG;rbs_spacer=5-10bp;gc_cont=0.503	WP_000554703.1 MULTISPECIES: gp53-like domain-containing protein [Escherichia]	100	99.5	7.05e-146
NC_000913.3_1122|1208171|1208545|1|ID=1_1122;partial=00;start_type=ATG;rbs_motif=None;rbs_spacer=None;gc_cont=0.437	WP_010723096.1 MULTISPECIES: tail fiber assembly protein [Enterobacteriaceae]	100	99.2	8.34e-86
NC_000913.3_1123|1208517|1209119|-1|ID=1_1123;partial=00;start_type=ATG;rbs_motif=GGAG/GAGG;rbs_spacer=5-10bp;gc_cont=0.476	WP_000548498.1 MULTISPECIES: tail fiber assembly protein [Escherichia]	100	99.5	1.81e-139
NC_000913.3_1124|1209119|1209655|-1|ID=1_1124;partial=00;start_type=ATG;rbs_motif=AGxAGG/AGGxGG;rbs_spacer=3-4bp;gc_cont=0.453	WP_001115524.1 MULTISPECIES: phage tail protein [Escherichia]	100	99.4	8.21e-132
NC_000913.3_1125|1209685|1210239|1|ID=1_1125;partial=00;start_type=ATG;rbs_motif=AGxAGG/AGGxGG;rbs_spacer=5-10bp;gc_cont=0.488	WP_000905001.1 MULTISPECIES: site-specific DNA recombinase [Escherichia]	100	99.5	3.44e-127
NC_000913.3_1126|1210346|1211179|1|ID=1_1126;partial=00;start_type=ATG;rbs_motif=None;rbs_spacer=None;gc_cont=0.384	WP_000557907.1 MULTISPECIES: 5-methylcytosine-specific endonuclease McrA [Bacteria]	100	99.6	3.38e-205
NC_000913.3_1127|1211413|1211577|1|ID=1_1127;partial=00;start_type=ATG;rbs_motif=None;rbs_spacer=None;gc_cont=0.467	WP_000943927.1 isocitrate/isopropylmalate family dehydrogenase [Escherichia coli]	100	98.2	2.95e-31
NC_000913.3_1128|1212703|1213107|-1|ID=1_1128;partial=00;start_type=ATG;rbs_motif=AGGA/GGAG/GAGG;rbs_spacer=11-12bp;gc_cont=0.368	WP_000373101.1 MULTISPECIES: DUF1398 domain-containing protein [Enterobacteriaceae]	100	99.3	4.46e-92
NC_000913.3_1129|1213328|1214059|-1|ID=1_1129;partial=00;start_type=GTG;rbs_motif=AGGAGG;rbs_spacer=3-4bp;gc_cont=0.485	WP_000332303.1 MULTISPECIES: DNA-binding transcriptional repressor BluR [Enterobacteriaceae]	100	99.6	3.91e-178
NC_000913.3_1130|1214264|1215475|-1|ID=1_1130;partial=00;start_type=ATG;rbs_motif=GGA/GAG/AGG;rbs_spacer=5-10bp;gc_cont=0.436	WP_001299269.1 MULTISPECIES: blue light-responsive regulator BluF [Enterobacteriaceae]	100	99.8	8.39e-290
NC_000913.3_1131|1215789|1216025|1|ID=1_1131;partial=00;start_type=ATG;rbs_motif=GGAG/GAGG;rbs_spacer=5-10bp;gc_cont=0.418	WP_000554140.1 MULTISPECIES: regulatory protein YcgZ [Bacteria]	100	98.7	1.52e-48
NC_000913.3_1132|1216369|1216635|1|ID=1_1132;partial=00;start_type=ATG;rbs_motif=GGAG/GAGG;rbs_spacer=5-10bp;gc_cont=0.348	WP_000888772.1 MULTISPECIES: biofilm/acid-resistance regulator AriR [Enterobacteriaceae]	100	98.9	9.58e-52
NC_000913.3_1133|1216748|1216996|1|ID=1_1133;partial=00;start_type=ATG;rbs_motif=GGAG/GAGG;rbs_spacer=5-10bp;gc_cont=0.357	WP_001065752.1 MULTISPECIES: protein YmgC [Enterobacteriaceae]	100	98.8	1.72e-49
NC_000913.3_1134|1217328|1218851|1|ID=1_1134;partial=00;start_type=ATG;rbs_motif=GGA/GAG/AGG;rbs_spacer=5-10bp;gc_cont=0.446	WP_001246499.1 MULTISPECIES: EAL domain-containing protein [Escherichia]	100	99.8	0.0
NC_000913.3_1135|1218983|1219201|1|ID=1_1135;partial=00;start_type=ATG;rbs_motif=4Base/6BMM;rbs_spacer=13-15bp;gc_cont=0.402	WP_001065861.1 MULTISPECIES: cell division-associated protein YmgF [Enterobacteriaceae]	100	98.6	2.88e-39
NC_000913.3_1136|1219601|1221121|1|ID=1_1136;partial=00;start_type=ATG;rbs_motif=GGA/GAG/AGG;rbs_spacer=5-10bp;gc_cont=0.385	WP_343105056.1 autotransporter YcgH, partial [Escherichia coli]	100	99.8	0.0
NC_000913.3_1137|1221206|1222222|1|ID=1_1137;partial=00;start_type=GTG;rbs_motif=None;rbs_spacer=None;gc_cont=0.508	WP_353051747.1 autotransporter outer membrane beta-barrel domain-containing protein [Escherichia coli]	99.7	99.7	3.73e-247
NC_000913.3_1138|1222305|1222634|-1|ID=1_1138;partial=00;start_type=ATG;rbs_motif=AGGA;rbs_spacer=5-10bp;gc_cont=0.455	WP_001295611.1 MULTISPECIES: YmgD family protein [Enterobacteriaceae]	100	99.1	8.84e-69
NC_000913.3_1139|1222644|1222928|-1|ID=1_1139;partial=00;start_type=ATG;rbs_motif=None;rbs_spacer=None;gc_cont=0.540	WP_000726970.1 MULTISPECIES: YMGG-like glycine zipper-containing protein [Shigella]	98.3	61.1	5.33e-16
NC_000913.3_1140|1224279|1224545|-1|ID=1_1140;partial=00;start_type=ATG;rbs_motif=GGAGG;rbs_spacer=5-10bp;gc_cont=0.434	WP_001185665.1 MULTISPECIES: cell division topological specificity factor MinE [Pseudomonadota]	100	98.9	1.65e-52
NC_000913.3_1141|1224549|1225361|-1|ID=1_1141;partial=00;start_type=ATG;rbs_motif=AGGA;rbs_spacer=5-10bp;gc_cont=0.499	WP_000101055.1 MULTISPECIES: septum site-determining protein MinD [Enterobacteriaceae]	100	99.6	7.51e-185
NC_000913.3_1142|1225385|1226080|-1|ID=1_1142;partial=00;start_type=ATG;rbs_motif=GGA/GAG/AGG;rbs_spacer=5-10bp;gc_cont=0.513	WP_001301105.1 MULTISPECIES: septum site-determining protein MinC [Enterobacteriaceae]	100	99.6	1.78e-159
NC_000913.3_1143|1226600|1226968|1|ID=1_1143;partial=00;start_type=ATG;rbs_motif=AGGA;rbs_spacer=5-10bp;gc_cont=0.423	WP_001056840.1 MULTISPECIES: YcgJ family protein [Pseudomonadati]	100	99.2	1.62e-86
NC_000913.3_1144|1227071|1227472|-1|ID=1_1144;partial=00;start_type=ATG;rbs_motif=AGGAG;rbs_spacer=5-10bp;gc_cont=0.430	WP_000695215.1 MULTISPECIES: g-type lysoyme inhibitor PliG [Enterobacteriaceae]	100	99.3	2.70e-88
NC_000913.3_1145|1227714|1228007|1|ID=1_1145;partial=00;start_type=ATG;rbs_motif=GGA/GAG/AGG;rbs_spacer=5-10bp;gc_cont=0.439	WP_001295992.1 MULTISPECIES: YcgL domain-containing protein [Enterobacteriaceae]	100	99.0	8.03e-64
NC_000913.3_1146|1228079|1228738|1|ID=1_1146;partial=00;start_type=ATG;rbs_motif=GGAG/GAGG;rbs_spacer=5-10bp;gc_cont=0.520	WP_000284280.1 MULTISPECIES: fumarylacetoacetate hydrolase family protein [Enterobacteriaceae]	100	99.5	1.17e-158
NC_000913.3_1147|1228830|1229276|1|ID=1_1147;partial=00;start_type=ATG;rbs_motif=GGA/GAG/AGG;rbs_spacer=5-10bp;gc_cont=0.472	WP_001306825.1 MULTISPECIES: YcgN family cysteine cluster protein [Enterobacteriaceae]	100	99.3	1.38e-113
NC_000913.3_1148|1229483|1230394|-1|ID=1_1148;partial=00;start_type=ATG;rbs_motif=GGAG/GAGG;rbs_spacer=5-10bp;gc_cont=0.410	WP_001336523.1 MULTISPECIES: hemolysin HlyE [Enterobacteriaceae]	100	99.7	3.23e-207
NC_000913.3_1149|1230767|1231186|1|ID=1_1149;partial=00;start_type=ATG;rbs_motif=GGA/GAG/AGG;rbs_spacer=5-10bp;gc_cont=0.481	WP_000897378.1 MULTISPECIES: translesion error-prone DNA polymerase V autoproteolytic subunit [Enterobacteriaceae]	100	99.3	4.57e-92
NC_000913.3_1150|1231186|1232454|1|ID=1_1150;partial=00;start_type=ATG;rbs_motif=GGA/GAG/AGG;rbs_spacer=5-10bp;gc_cont=0.510	WP_000457616.1 MULTISPECIES: DNA polymerase V catalytic protein [Enterobacteriaceae]	100	99.8	2.41e-310
NC_000913.3_1151|1232500|1233030|-1|ID=1_1151;partial=00;start_type=ATG;rbs_motif=GGA/GAG/AGG;rbs_spacer=5-10bp;gc_cont=0.524	WP_000943459.1 MULTISPECIES: disulfide bond formation protein DsbB [Enterobacteriaceae]	100	99.4	7.60e-127
NC_000913.3_1152|1233176|1234717|-1|ID=1_1152;partial=00;start_type=ATG;rbs_motif=GGA/GAG/AGG;rbs_spacer=5-10bp;gc_cont=0.529	WP_000406391.1 MULTISPECIES: Na(+)/H(+) antiporter NhaB [Enterobacteriaceae]	100	99.8	0.0
NC_000913.3_1153|1234938|1235657|1|ID=1_1153;partial=00;start_type=ATG;rbs_motif=GGA/GAG/AGG;rbs_spacer=5-10bp;gc_cont=0.512	WP_000234823.1 MULTISPECIES: fatty acid metabolism transcriptional regulator FadR [Enterobacteriaceae]	100	99.6	5.34e-174
NC_000913.3_1154|1235709|1237241|-1|ID=1_1154;partial=00;start_type=ATG;rbs_motif=GGAG/GAGG;rbs_spacer=5-10bp;gc_cont=0.498	WP_000190854.1 MULTISPECIES: SpoVR family protein [Enterobacteriaceae]	100	99.8	0.0
NC_000913.3_1155|1237571|1238869|1|ID=1_1155;partial=00;start_type=ATG;rbs_motif=GGAG/GAGG;rbs_spacer=5-10bp;gc_cont=0.563	WP_001266908.1 MULTISPECIES: D-amino acid dehydrogenase [Enterobacteriaceae]	100	99.8	0.0
NC_000913.3_1156|1238879|1239949|1|ID=1_1156;partial=00;start_type=ATG;rbs_motif=AGGA;rbs_spacer=5-10bp;gc_cont=0.580	WP_000197881.1 MULTISPECIES: catabolic alanine racemase DadX [Enterobacteriaceae]	100	99.7	1.87e-260
NC_000913.3_1157|1240052|1240201|1|ID=1_1157;partial=00;start_type=ATG;rbs_motif=GGA/GAG/AGG;rbs_spacer=5-10bp;gc_cont=0.447	WP_247167767.1 hypothetical protein, partial [Escherichia coli]	100	98.0	6.11e-26
NC_000913.3_1158|1240335|1242071|-1|ID=1_1158;partial=00;start_type=TTG;rbs_motif=AGGAG;rbs_spacer=5-10bp;gc_cont=0.524	WP_000340194.1 MULTISPECIES: potassium/proton antiporter [Enterobacteriaceae]	100	99.8	0.0
NC_000913.3_1159|1242166|1243080|-1|ID=1_1159;partial=00;start_type=ATG;rbs_motif=AGGA;rbs_spacer=5-10bp;gc_cont=0.531	WP_000051560.1 MULTISPECIES: muramoyltetrapeptide carboxypeptidase [Enterobacteriaceae]	100	99.7	2.07e-224
NC_000913.3_1160|1243180|1243791|1|ID=1_1160;partial=00;start_type=GTG;rbs_motif=AGGA;rbs_spacer=5-10bp;gc_cont=0.520	WP_001301104.1 MULTISPECIES: membrane-bound lytic murein transglycosylase EmtA [Enterobacteriaceae]	100	99.5	2.57e-145
NC_000913.3_1161|1243793|1244527|-1|ID=1_1161;partial=00;start_type=GTG;rbs_motif=AGGAG;rbs_spacer=5-10bp;gc_cont=0.509	WP_000020169.1 MULTISPECIES: flagellar brake protein YcgR [Enterobacteriaceae]	100	99.6	1.78e-170
NC_000913.3_1162|1244728|1244982|1|ID=1_1162;partial=00;start_type=ATG;rbs_motif=GGAG/GAGG;rbs_spacer=5-10bp;gc_cont=0.533	WP_001310727.1 MULTISPECIES: GlsB/YeaQ/YmgE family stress response membrane protein [Enterobacteriaceae]	100	98.8	1.40e-49
NC_000913.3_1163|1245160|1245600|1|ID=1_1163;partial=00;start_type=GTG;rbs_motif=None;rbs_spacer=None;gc_cont=0.415	WP_000615067.1 MULTISPECIES: protein YcgY [Enterobacteriaceae]	100	99.3	3.84e-101
NC_000913.3_1164|1245679|1247376|-1|ID=1_1164;partial=00;start_type=ATG;rbs_motif=AGGAG;rbs_spacer=5-10bp;gc_cont=0.523	WP_000841714.1 MULTISPECIES: alpha,alpha-trehalase [Enterobacteriaceae]	100	99.8	0.0
NC_000913.3_1165|1247696|1249114|-1|ID=1_1165;partial=00;start_type=ATG;rbs_motif=AGGA;rbs_spacer=5-10bp;gc_cont=0.502	WP_001301101.1 MULTISPECIES: dihydroxyacetone kinase phosphoryl donor subunit DhaM [Enterobacteriaceae]	100	99.8	0.0
NC_000913.3_1166|1249125|1249757|-1|ID=1_1166;partial=00;start_type=ATG;rbs_motif=AGGAG;rbs_spacer=5-10bp;gc_cont=0.536	WP_000059411.1 MULTISPECIES: dihydroxyacetone kinase subunit DhaL [Enterobacteriaceae]	100	99.5	4.93e-142
NC_000913.3_1167|1249768|1250838|-1|ID=1_1167;partial=00;start_type=ATG;rbs_motif=GGAG/GAGG;rbs_spacer=5-10bp;gc_cont=0.530	WP_000733715.1 MULTISPECIES: dihydroxyacetone kinase subunit DhaK [Enterobacteriaceae]	100	99.7	3.93e-262
NC_000913.3_1168|1251066|1252985|1|ID=1_1168;partial=00;start_type=ATG;rbs_motif=GGA/GAG/AGG;rbs_spacer=5-10bp;gc_cont=0.515	WP_001350505.1 MULTISPECIES: dihydroxyacetone kinase operon transcriptional regulator DhaR [Enterobacteriaceae]	100	99.8	0.0
NC_000913.3_1169|1253085|1255952|-1|ID=1_1169;partial=00;start_type=ATG;rbs_motif=AGGA;rbs_spacer=5-10bp;gc_cont=0.498	WP_369067798.1 autotransporter outer membrane beta-barrel domain-containing protein [Escherichia coli]	98.6	99.9	0.0
NC_000913.3_1170|1256297|1256476|1|ID=1_1170;partial=00;start_type=ATG;rbs_motif=GGA/GAG/AGG;rbs_spacer=5-10bp;gc_cont=0.344	WP_000280737.1 MULTISPECIES: hypothetical protein [Escherichia]	100	98.3	1.81e-34
NC_000913.3_1171|1256721|1257812|-1|ID=1_1171;partial=00;start_type=ATG;rbs_motif=GGA/GAG/AGG;rbs_spacer=11-12bp;gc_cont=0.510	WP_000505866.1 MULTISPECIES: redox-regulated ATPase YchF [Enterobacteriaceae]	100	99.7	1.53e-258
NC_000913.3_1172|1257929|1258513|-1|ID=1_1172;partial=00;start_type=GTG;rbs_motif=AGGA;rbs_spacer=5-10bp;gc_cont=0.499	WP_000152933.1 MULTISPECIES: aminoacyl-tRNA hydrolase [Enterobacteriaceae]	100	99.5	1.14e-139
NC_000913.3_1173|1258791|1259069|1|ID=1_1173;partial=00;start_type=ATG;rbs_motif=GGAGG;rbs_spacer=5-10bp;gc_cont=0.530	WP_000823885.1 MULTISPECIES: stress-induced protein YchH [Bacteria]	100	98.9	2.19e-61
NC_000913.3_1174|1259124|1260776|-1|ID=1_1174;partial=00;start_type=ATG;rbs_motif=None;rbs_spacer=None;gc_cont=0.551	WP_338907121.1 C4-dicarboxylic acid transporter DauA [Escherichia coli]	100	99.8	0.0
NC_000913.3_1175|1260928|1261941|-1|ID=1_1175;partial=00;start_type=ATG;rbs_motif=GGA/GAG/AGG;rbs_spacer=5-10bp;gc_cont=0.527	WP_001119392.1 ribose-phosphate diphosphokinase [Escherichia coli]	100	99.7	1.48e-236
NC_000913.3_1176|1262026|1262877|-1|ID=1_1176;partial=00;start_type=ATG;rbs_motif=GGA/GAG/AGG;rbs_spacer=5-10bp;gc_cont=0.534	WP_001260332.1 MULTISPECIES: 4-(cytidine 5'-diphospho)-2-C-methyl-D-erythritol kinase [Enterobacteriaceae]	100	99.6	1.09e-204
NC_000913.3_1177|1262877|1263500|-1|ID=1_1177;partial=00;start_type=ATG;rbs_motif=AGGA/GGAG/GAGG;rbs_spacer=11-12bp;gc_cont=0.516	WP_001130692.1 MULTISPECIES: lipoprotein insertase outer membrane protein LolB [Enterobacteriaceae]	100	99.5	3.95e-151
NC_000913.3_1178|1263714|1264970|1|ID=1_1178;partial=00;start_type=ATG;rbs_motif=None;rbs_spacer=None;gc_cont=0.543	WP_001299679.1 MULTISPECIES: glutamyl-tRNA reductase [Enterobacteriaceae]	100	99.8	1.75e-285
NC_000913.3_1179|1265012|1266094|1|ID=1_1179;partial=00;start_type=ATG;rbs_motif=3Base/5BMM;rbs_spacer=13-15bp;gc_cont=0.530	WP_000804726.1 MULTISPECIES: peptide chain release factor 1 [Enterobacteriaceae]	100	99.7	9.80e-249
NC_000913.3_1180|1266094|1266927|1|ID=1_1180;partial=00;start_type=ATG;rbs_motif=AGxAGG/AGGxGG;rbs_spacer=3-4bp;gc_cont=0.552	WP_000456467.1 MULTISPECIES: peptide chain release factor N(5)-glutamine methyltransferase [Enterobacteriaceae]	100	99.6	1.27e-200
NC_000913.3_1181|1266924|1267316|1|ID=1_1181;partial=00;start_type=ATG;rbs_motif=None;rbs_spacer=None;gc_cont=0.476	WP_000200374.1 MULTISPECIES: invasion regulator SirB2 [Gammaproteobacteria]	100	99.2	1.35e-82
NC_000913.3_1182|1267320|1268129|1|ID=1_1182;partial=00;start_type=ATG;rbs_motif=None;rbs_spacer=None;gc_cont=0.464	WP_001257044.1 MULTISPECIES: invasion regulator SirB1 [Enterobacteriaceae]	100	99.6	7.88e-191
NC_000913.3_1183|1268165|1269019|1|ID=1_1183;partial=00;start_type=ATG;rbs_motif=GGA/GAG/AGG;rbs_spacer=5-10bp;gc_cont=0.516	WP_000811065.1 MULTISPECIES: 3-deoxy-8-phosphooctulonate synthase [Enterobacteriaceae]	100	99.6	1.87e-201
NC_000913.3_1184|1269168|1269275|-1|ID=1_1184;partial=00;start_type=ATG;rbs_motif=AGxAGG/AGGxGG;rbs_spacer=3-4bp;gc_cont=0.546	WP_000170955.1 MULTISPECIES: type I toxin-antitoxin system toxin Ldr family protein [Enterobacteriaceae]	100	97.2	6.85e-18
NC_000913.3_1185|1269703|1269810|-1|ID=1_1185;partial=00;start_type=ATG;rbs_motif=AGxAGG/AGGxGG;rbs_spacer=3-4bp;gc_cont=0.574	WP_000170963.1 MULTISPECIES: type I toxin-antitoxin system toxin Ldr family protein [Gammaproteobacteria]	100	97.2	2.38e-18
