NC_000913.3_2123|2248737|2249618|-1|ID=1_2123;partial=00;start_type=ATG;rbs_motif=None;rbs_spacer=None;gc_cont=0.537	WP_000548294.1 MULTISPECIES: DNA-binding transcriptional regulator YeiE [Enterobacteriaceae]	100	99.7	7.07e-206
NC_000913.3_2124|2249717|2250766|1|ID=1_2124;partial=00;start_type=ATG;rbs_motif=AGGAG;rbs_spacer=5-10bp;gc_cont=0.530	WP_000182053.1 MULTISPECIES: YeiH family protein [Enterobacteriaceae]	100	99.7	3.60e-234
NC_000913.3_2125|2250840|2251697|1|ID=1_2125;partial=00;start_type=ATG;rbs_motif=AGGAG;rbs_spacer=5-10bp;gc_cont=0.524	WP_000873894.1 MULTISPECIES: deoxyribonuclease IV [Enterobacteriaceae]	100	99.7	1.61e-207
NC_000913.3_2126|2251700|2252788|1|ID=1_2126;partial=00;start_type=ATG;rbs_motif=None;rbs_spacer=None;gc_cont=0.518	WP_001065016.1 MULTISPECIES: sugar kinase [Enterobacteriaceae]	100	99.7	9.98e-259
NC_000913.3_2127|2252895|2254145|-1|ID=1_2127;partial=00;start_type=ATG;rbs_motif=GGA/GAG/AGG;rbs_spacer=5-10bp;gc_cont=0.504	WP_000382966.1 MULTISPECIES: NupC/NupG family nucleoside CNT transporter [Enterobacteriaceae]	100	99.8	3.67e-270
NC_000913.3_2128|2254245|2255186|-1|ID=1_2128;partial=00;start_type=ATG;rbs_motif=GGAG/GAGG;rbs_spacer=5-10bp;gc_cont=0.521	WP_000415429.1 MULTISPECIES: ribosylpyrimidine nucleosidase [Enterobacteriaceae]	100	99.7	9.96e-232
NC_000913.3_2129|2255316|2256014|1|ID=1_2129;partial=00;start_type=GTG;rbs_motif=GGA/GAG/AGG;rbs_spacer=5-10bp;gc_cont=0.443	WP_000658575.1 MULTISPECIES: transcriptional regulator YeiL [Enterobacteriaceae]	100	99.6	3.75e-166
NC_000913.3_2130|2256085|2257335|-1|ID=1_2130;partial=00;start_type=ATG;rbs_motif=GGA/GAG/AGG;rbs_spacer=5-10bp;gc_cont=0.509	WP_257247689.1 NupC/NupG family nucleoside CNT transporter [Escherichia coli]	96.4	99.8	4.77e-266
NC_000913.3_2131|2257429|2258367|-1|ID=1_2131;partial=00;start_type=ATG;rbs_motif=GGAG/GAGG;rbs_spacer=5-10bp;gc_cont=0.497	WP_001292460.1 MULTISPECIES: pseudouridine-5'-phosphate glycosidase [Escherichia]	100	99.7	3.65e-213
NC_000913.3_2132|2258355|2259296|-1|ID=1_2132;partial=00;start_type=ATG;rbs_motif=GGAG/GAGG;rbs_spacer=5-10bp;gc_cont=0.471	WP_001208118.1 MULTISPECIES: pseudouridine kinase [Enterobacteriaceae]	100	99.7	6.19e-226
NC_000913.3_2133|2259719|2261410|-1|ID=1_2133;partial=00;start_type=ATG;rbs_motif=AGGAG;rbs_spacer=5-10bp;gc_cont=0.556	WP_410235384.1 PTS fructose transporter subunit IIBC [Escherichia sp. AP1362]	100	99.8	0.0
NC_000913.3_2134|2261427|2262365|-1|ID=1_2134;partial=00;start_type=ATG;rbs_motif=GGAGG;rbs_spacer=5-10bp;gc_cont=0.534	WP_000091263.1 MULTISPECIES: 1-phosphofructokinase [Enterobacteriaceae]	100	99.7	5.49e-224
NC_000913.3_2135|2262365|2263495|-1|ID=1_2135;partial=00;start_type=ATG;rbs_motif=GGAG/GAGG;rbs_spacer=5-10bp;gc_cont=0.555	WP_000487246.1 MULTISPECIES: fused PTS fructose transporter subunit IIA/HPr protein [Enterobacteriaceae]	100	99.7	1.16e-255
NC_000913.3_2136|2263863|2265044|1|ID=1_2136;partial=00;start_type=ATG;rbs_motif=None;rbs_spacer=None;gc_cont=0.530	WP_000551980.1 MULTISPECIES: sugar efflux transporter SetB [Escherichia]	100	99.7	4.04e-276
NC_000913.3_2137|2265041|2265295|-1|ID=1_2137;partial=00;start_type=ATG;rbs_motif=GGA/GAG/AGG;rbs_spacer=5-10bp;gc_cont=0.557	WP_000389030.1 MULTISPECIES: YkgJ family cysteine cluster protein [Enterobacteriaceae]	100	98.8	3.97e-58
NC_000913.3_2138|2265450|2266022|1|ID=1_2138;partial=00;start_type=ATG;rbs_motif=AGGA;rbs_spacer=5-10bp;gc_cont=0.499	WP_001136827.1 MULTISPECIES: elongation factor P-like protein YeiP [Enterobacteriaceae]	100	99.5	6.13e-133
NC_000913.3_2139|2266245|2267711|1|ID=1_2139;partial=00;start_type=ATG;rbs_motif=None;rbs_spacer=None;gc_cont=0.520	WP_001091940.1 MULTISPECIES: mannitol dehydrogenase family protein [Enterobacteriaceae]	100	99.8	0.0
NC_000913.3_2140|2267829|2268815|1|ID=1_2140;partial=00;start_type=GTG;rbs_motif=GGAG/GAGG;rbs_spacer=5-10bp;gc_cont=0.545	WP_000198828.1 MULTISPECIES: zinc-binding GTPase YeiR [Enterobacteriaceae]	100	99.7	2.29e-240
NC_000913.3_2141|2268854|2269567|1|ID=1_2141;partial=00;start_type=ATG;rbs_motif=GGA/GAG/AGG;rbs_spacer=5-10bp;gc_cont=0.441	WP_000594599.1 MULTISPECIES: Kdo(2)-lipid A phosphotransferase [Enterobacteriaceae]	100	99.6	1.30e-164
NC_000913.3_2142|2269979|2270545|1|ID=1_2142;partial=00;start_type=ATG;rbs_motif=GGA/GAG/AGG;rbs_spacer=11-12bp;gc_cont=0.467	WP_000241011.1 MULTISPECIES: bifunctional murein DD-endopeptidase/murein LD-carboxypeptidase [Enterobacteriaceae]	100	99.5	8.39e-130
NC_000913.3_2143|2270726|2272282|1|ID=1_2143;partial=00;start_type=ATG;rbs_motif=4Base/6BMM;rbs_spacer=13-15bp;gc_cont=0.505	WP_172615796.1 cyclic di-GMP phosphodiesterase [Escherichia coli]	100	99.8	0.0
NC_000913.3_2144|2272364|2274178|1|ID=1_2144;partial=00;start_type=ATG;rbs_motif=AGGA/GGAG/GAGG;rbs_spacer=11-12bp;gc_cont=0.512	WP_000637046.1 MULTISPECIES: extracellular solute-binding protein [Enterobacteriaceae]	100	99.8	0.0
NC_000913.3_2145|2274179|2275273|1|ID=1_2145;partial=00;start_type=ATG;rbs_motif=GGAG/GAGG;rbs_spacer=5-10bp;gc_cont=0.512	WP_000501604.1 MULTISPECIES: microcin C ABC transporter permease YejB [Enterobacteriaceae]	100	99.7	3.90e-257
NC_000913.3_2146|2275273|2276298|1|ID=1_2146;partial=00;start_type=ATG;rbs_motif=GGAG/GAGG;rbs_spacer=5-10bp;gc_cont=0.527	WP_000088923.1 MULTISPECIES: ABC transporter permease [Enterobacteriaceae]	100	99.7	6.94e-253
NC_000913.3_2147|2276300|2277889|1|ID=1_2147;partial=00;start_type=ATG;rbs_motif=AGxAGG/AGGxGG;rbs_spacer=5-10bp;gc_cont=0.514	WP_109866115.1 microcin C ABC transporter ATP-binding protein YejF [Escherichia coli]	100	99.8	0.0
NC_000913.3_2148|2277893|2278237|-1|ID=1_2148;partial=00;start_type=GTG;rbs_motif=GGA/GAG/AGG;rbs_spacer=5-10bp;gc_cont=0.487	WP_000202798.1 MULTISPECIES: YejG family protein [Gammaproteobacteria]	100	99.1	3.25e-80
NC_000913.3_2149|2278570|2279760|-1|ID=1_2149;partial=00;start_type=GTG;rbs_motif=AGGAG;rbs_spacer=5-10bp;gc_cont=0.531	WP_000213361.1 MULTISPECIES: multidrug efflux MFS transporter Bcr [Enterobacteriaceae]	100	99.7	1.15e-272
NC_000913.3_2150|2279788|2280483|-1|ID=1_2150;partial=00;start_type=ATG;rbs_motif=3Base/5BMM;rbs_spacer=13-15bp;gc_cont=0.529	WP_001234850.1 MULTISPECIES: 16S rRNA pseudouridine(516) synthase RsuA [Enterobacteriaceae]	100	99.6	1.08e-169
NC_000913.3_2151|2280632|2282392|1|ID=1_2151;partial=00;start_type=ATG;rbs_motif=None;rbs_spacer=None;gc_cont=0.532	WP_000578061.1 MULTISPECIES: DEAD/DEAH box helicase [Enterobacteriaceae]	100	99.8	0.0
NC_000913.3_2152|2282517|2282801|1|ID=1_2152;partial=00;start_type=ATG;rbs_motif=GGA/GAG/AGG;rbs_spacer=5-10bp;gc_cont=0.505	WP_000494183.1 MULTISPECIES: 50S ribosomal protein L25 [Enterobacteriaceae]	100	98.9	1.03e-60
NC_000913.3_2153|2282940|2283947|-1|ID=1_2153;partial=00;start_type=ATG;rbs_motif=AGGAG;rbs_spacer=5-10bp;gc_cont=0.524	WP_000050793.1 MULTISPECIES: nucleoid-associated protein YejK [Enterobacteriaceae]	100	99.7	2.86e-233
NC_000913.3_2154|2284129|2284356|1|ID=1_2154;partial=00;start_type=ATG;rbs_motif=None;rbs_spacer=None;gc_cont=0.504	WP_001135667.1 MULTISPECIES: YejL family protein [Enterobacteriaceae]	100	98.7	7.73e-43
NC_000913.3_2155|2284376|2286136|1|ID=1_2155;partial=00;start_type=ATG;rbs_motif=3Base/5BMM;rbs_spacer=13-15bp;gc_cont=0.521	WP_000256203.1 MULTISPECIES: LPS biosynthesis-modulating metalloenzyme YejM [Enterobacteriaceae]	100	99.8	0.0
NC_000913.3_2156|2286390|2288900|-1|ID=1_2156;partial=00;start_type=TTG;rbs_motif=None;rbs_spacer=None;gc_cont=0.483	WP_053889160.1 MULTISPECIES: autotransporter YejO [Escherichia]	98.8	99.9	0.0
NC_000913.3_2157|2289065|2290045|-1|ID=1_2157;partial=00;start_type=ATG;rbs_motif=GGA/GAG/AGG;rbs_spacer=5-10bp;gc_cont=0.550	WP_000019403.1 MULTISPECIES: IS5-like element IS5 family transposase [Bacteria]	100	99.7	2.98e-235
NC_000913.3_2158|2290500|2291147|1|ID=1_2158;partial=00;start_type=ATG;rbs_motif=AGGAG;rbs_spacer=5-10bp;gc_cont=0.525	WP_001113639.1 MULTISPECIES: nitrate/nitrite response regulator protein NarP [Escherichia]	100	99.5	3.58e-142
NC_000913.3_2159|2291358|2292410|-1|ID=1_2159;partial=00;start_type=ATG;rbs_motif=AGGAG;rbs_spacer=5-10bp;gc_cont=0.541	WP_001211575.1 MULTISPECIES: cytochrome c-type biogenesis thiol:disulfide oxidoreductase CcmH [Enterobacteriaceae]	100	99.7	2.05e-245
NC_000913.3_2160|2292407|2292964|-1|ID=1_2160;partial=00;start_type=ATG;rbs_motif=GGAGG;rbs_spacer=3-4bp;gc_cont=0.547	WP_000824439.1 MULTISPECIES: thiol:disulfide interchange protein DsbE [Enterobacteriaceae]	100	99.5	1.77e-134
NC_000913.3_2161|2292961|2294904|-1|ID=1_2161;partial=00;start_type=ATG;rbs_motif=AGGA;rbs_spacer=5-10bp;gc_cont=0.572	WP_000982447.1 MULTISPECIES: cytochrome c-type biogenesis heme lyase CcmF [Enterobacteriaceae]	100	99.8	0.0
NC_000913.3_2162|2294901|2295380|-1|ID=1_2162;partial=00;start_type=ATG;rbs_motif=AGGAGG;rbs_spacer=3-4bp;gc_cont=0.537	WP_001026418.1 MULTISPECIES: cytochrome c maturation protein CcmE [Gammaproteobacteria]	100	99.4	2.42e-108
NC_000913.3_2163|2295377|2295586|-1|ID=1_2163;partial=00;start_type=ATG;rbs_motif=GGAG/GAGG;rbs_spacer=5-10bp;gc_cont=0.567	WP_000186540.1 MULTISPECIES: heme exporter protein CcmD [Gammaproteobacteria]	100	98.6	5.33e-36
NC_000913.3_2164|2295583|2296320|-1|ID=1_2164;partial=00;start_type=ATG;rbs_motif=3Base/5BMM;rbs_spacer=13-15bp;gc_cont=0.554	WP_001295447.1 MULTISPECIES: heme exporter protein CcmC [Gammaproteobacteria]	100	99.6	2.75e-179
NC_000913.3_2165|2296362|2297024|-1|ID=1_2165;partial=00;start_type=ATG;rbs_motif=GGAG/GAGG;rbs_spacer=5-10bp;gc_cont=0.563	WP_367762185.1 heme exporter protein CcmB [Escherichia coli]	100	99.5	1.08e-118
NC_000913.3_2166|2297021|2297638|-1|ID=1_2166;partial=00;start_type=ATG;rbs_motif=3Base/5BMM;rbs_spacer=13-15bp;gc_cont=0.558	WP_000888560.1 MULTISPECIES: cytochrome c biogenesis heme-transporting ATPase CcmA [Gammaproteobacteria]	100	99.5	1.49e-145
NC_000913.3_2167|2297657|2298259|-1|ID=1_2167;partial=00;start_type=ATG;rbs_motif=GGAG/GAGG;rbs_spacer=5-10bp;gc_cont=0.516	WP_000528376.1 MULTISPECIES: cytochrome c-type protein NapC [Gammaproteobacteria]	100	99.5	2.80e-152
NC_000913.3_2168|2298269|2298718|-1|ID=1_2168;partial=00;start_type=ATG;rbs_motif=GGAG/GAGG;rbs_spacer=5-10bp;gc_cont=0.558	WP_000835174.1 MULTISPECIES: nitrate reductase cytochrome c-type subunit [Enterobacteriaceae]	100	99.3	8.00e-109
NC_000913.3_2169|2298715|2299578|-1|ID=1_2169;partial=00;start_type=ATG;rbs_motif=GGAGG;rbs_spacer=5-10bp;gc_cont=0.559	WP_000013515.1 MULTISPECIES: quinol dehydrogenase ferredoxin subunit NapH [Enterobacteriaceae]	100	99.7	6.11e-213
NC_000913.3_2170|2299565|2300260|-1|ID=1_2170;partial=00;start_type=ATG;rbs_motif=GGA/GAG/AGG;rbs_spacer=11-12bp;gc_cont=0.588	WP_000091291.1 MULTISPECIES: ferredoxin-type protein NapG [Enterobacteriaceae]	100	99.6	2.97e-167
NC_000913.3_2171|2300267|2302753|-1|ID=1_2171;partial=00;start_type=ATG;rbs_motif=GGAG/GAGG;rbs_spacer=5-10bp;gc_cont=0.562	WP_000778061.1 MULTISPECIES: periplasmic nitrate reductase subunit alpha [Enterobacteriaceae]	100	99.9	0.0
NC_000913.3_2172|2302750|2303013|-1|ID=1_2172;partial=00;start_type=ATG;rbs_motif=GGAG/GAGG;rbs_spacer=5-10bp;gc_cont=0.549	WP_000557378.1 MULTISPECIES: chaperone NapD [Bacteria]	100	98.9	1.54e-52
NC_000913.3_2173|2303003|2303497|-1|ID=1_2173;partial=00;start_type=GTG;rbs_motif=GGA/GAG/AGG;rbs_spacer=5-10bp;gc_cont=0.552	WP_000686723.1 MULTISPECIES: ferredoxin-type protein NapF [Enterobacteriaceae]	100	99.4	1.45e-125
NC_000913.3_2174|2303606|2303770|1|ID=1_2174;partial=00;start_type=ATG;rbs_motif=AGGA;rbs_spacer=5-10bp;gc_cont=0.400	WP_001310984.1 MULTISPECIES: protein YojO [Enterobacteriaceae]	100	98.2	6.17e-33
NC_000913.3_2175|2303905|2304393|1|ID=1_2175;partial=00;start_type=ATG;rbs_motif=AGGA;rbs_spacer=5-10bp;gc_cont=0.495	WP_000849209.1 MULTISPECIES: serine protease inhibitor ecotin [Enterobacteriaceae]	100	99.4	3.85e-111
NC_000913.3_2176|2305108|2306754|-1|ID=1_2176;partial=00;start_type=ATG;rbs_motif=GGA/GAG/AGG;rbs_spacer=5-10bp;gc_cont=0.540	WP_166705621.1 malate dehydrogenase (quinone), partial [Escherichia coli]	100	99.8	0.0
NC_000913.3_2177|2306972|2308615|-1|ID=1_2177;partial=00;start_type=ATG;rbs_motif=None;rbs_spacer=None;gc_cont=0.535	WP_000422182.1 MULTISPECIES: microcin J25 efflux ABC transporter YojI [Enterobacteriaceae]	100	99.8	0.0
NC_000913.3_2178|2308691|2309341|-1|ID=1_2178;partial=00;start_type=ATG;rbs_motif=AGGAG;rbs_spacer=5-10bp;gc_cont=0.527	WP_000884971.1 MULTISPECIES: DNA oxidative demethylase AlkB [Enterobacteriaceae]	100	99.5	3.51e-163
NC_000913.3_2179|2309341|2310405|-1|ID=1_2179;partial=00;start_type=ATG;rbs_motif=GGAG/GAGG;rbs_spacer=5-10bp;gc_cont=0.567	WP_000710375.1 MULTISPECIES: bifunctional DNA-binding transcriptional regulator/O6-methylguanine-DNA methyltransferase Ada [Enterobacteriaceae]	100	99.7	5.12e-257
NC_000913.3_2180|2310479|2311534|-1|ID=1_2180;partial=00;start_type=ATG;rbs_motif=GGAG/GAGG;rbs_spacer=5-10bp;gc_cont=0.535	WP_000406064.1 MULTISPECIES: FAD:protein FMN transferase ApbE [Enterobacteriaceae]	100	99.7	1.30e-253
NC_000913.3_2181|2311646|2312749|-1|ID=1_2181;partial=00;start_type=ATG;rbs_motif=GGAG/GAGG;rbs_spacer=5-10bp;gc_cont=0.506	WP_000865568.1 MULTISPECIES: porin OmpC [Enterobacteriaceae]	100	99.7	8.06e-272
NC_000913.3_2182|2313488|2316160|1|ID=1_2182;partial=00;start_type=ATG;rbs_motif=GGA/GAG/AGG;rbs_spacer=11-12bp;gc_cont=0.494	WP_001249081.1 MULTISPECIES: phosphotransferase RcsD [Enterobacteriaceae]	100	99.9	0.0
NC_000913.3_2183|2316177|2316827|1|ID=1_2183;partial=00;start_type=ATG;rbs_motif=GGA/GAG/AGG;rbs_spacer=11-12bp;gc_cont=0.478	WP_001061917.1 MULTISPECIES: response regulator transcription factor RcsB [Enterobacteriaceae]	100	99.5	2.96e-146
NC_000913.3_2184|2317027|2319876|-1|ID=1_2184;partial=00;start_type=TTG;rbs_motif=GGAG/GAGG;rbs_spacer=5-10bp;gc_cont=0.509	WP_000876011.1 MULTISPECIES: two-component system sensor histidine kinase RcsC [Enterobacteriaceae]	100	99.9	0.0
NC_000913.3_2185|2320043|2321869|1|ID=1_2185;partial=00;start_type=ATG;rbs_motif=GGA/GAG/AGG;rbs_spacer=5-10bp;gc_cont=0.485	WP_000559125.1 MULTISPECIES: two-component system sensor histidine kinase AtoS [Enterobacteriaceae]	100	99.8	0.0
NC_000913.3_2186|2321866|2323251|1|ID=1_2186;partial=00;start_type=ATG;rbs_motif=GGA/GAG/AGG;rbs_spacer=11-12bp;gc_cont=0.490	WP_000125282.1 MULTISPECIES: acetoacetate metabolism transcriptional regulator AtoC [Enterobacteriaceae]	100	99.8	0.0
NC_000913.3_2187|2323447|2324109|1|ID=1_2187;partial=00;start_type=ATG;rbs_motif=GGAG/GAGG;rbs_spacer=5-10bp;gc_cont=0.538	WP_000850540.1 MULTISPECIES: acetate CoA-transferase subunit alpha [Enterobacteriaceae]	100	99.5	2.74e-153
NC_000913.3_2188|2324109|2324759|1|ID=1_2188;partial=00;start_type=ATG;rbs_motif=AGGAG;rbs_spacer=5-10bp;gc_cont=0.536	WP_000339065.1 MULTISPECIES: acetate CoA-transferase subunit beta [Enterobacteriaceae]	100	99.5	4.95e-154
NC_000913.3_2189|2324756|2326078|1|ID=1_2189;partial=00;start_type=ATG;rbs_motif=None;rbs_spacer=None;gc_cont=0.531	WP_000580275.1 MULTISPECIES: TIGR00366 family protein [Enterobacteriaceae]	100	99.8	5.97e-311
NC_000913.3_2190|2326109|2327293|1|ID=1_2190;partial=00;start_type=ATG;rbs_motif=AGGA;rbs_spacer=5-10bp;gc_cont=0.530	WP_000786547.1 MULTISPECIES: acetyl-CoA acetyltransferase [Enterobacteriaceae]	100	99.7	4.29e-267
NC_000913.3_2191|2327367|2328143|-1|ID=1_2191;partial=00;start_type=ATG;rbs_motif=GGA/GAG/AGG;rbs_spacer=5-10bp;gc_cont=0.524	WP_001225852.1 MULTISPECIES: YfaP family protein [Enterobacteriaceae]	100	99.6	4.40e-187
NC_000913.3_2192|2328148|2329797|-1|ID=1_2192;partial=00;start_type=GTG;rbs_motif=GGA/GAG/AGG;rbs_spacer=5-10bp;gc_cont=0.545	WP_001104549.1 MULTISPECIES: YfaQ family protein [Enterobacteriaceae]	100	99.8	0.0
NC_000913.3_2193|2329798|2330283|-1|ID=1_2193;partial=00;start_type=ATG;rbs_motif=GGA/GAG/AGG;rbs_spacer=5-10bp;gc_cont=0.533	WP_005046832.1 MULTISPECIES: alpha-2-macroglobulin family protein [Shigella]	99.4	98.8	3.28e-107
NC_000913.3_2194|2330299|2334192|-1|ID=1_2194;partial=00;start_type=GTG;rbs_motif=GGAG/GAGG;rbs_spacer=5-10bp;gc_cont=0.540	WP_236262400.1 alpha-2-macroglobulin family protein [Escherichia coli]	99.9	99.9	0.0
NC_000913.3_2195|2334336|2334959|-1|ID=1_2195;partial=00;start_type=ATG;rbs_motif=None;rbs_spacer=None;gc_cont=0.514	WP_001295211.1 MULTISPECIES: DUF1175 domain-containing protein [Enterobacteriaceae]	100	99.5	3.66e-156
NC_000913.3_2196|2334956|2336644|-1|ID=1_2196;partial=00;start_type=ATG;rbs_motif=AGGA;rbs_spacer=5-10bp;gc_cont=0.512	WP_000012305.1 MULTISPECIES: DUF2138 domain-containing protein [Enterobacteriaceae]	100	99.8	0.0
NC_000913.3_2197|2336793|2339420|-1|ID=1_2197;partial=00;start_type=ATG;rbs_motif=GGA/GAG/AGG;rbs_spacer=5-10bp;gc_cont=0.540	WP_410974313.1 DNA topoisomerase (ATP-hydrolyzing) subunit A [Escherichia coli]	99.9	99.9	0.0
NC_000913.3_2198|2339567|2340289|1|ID=1_2198;partial=00;start_type=ATG;rbs_motif=AGGA/GGAG/GAGG;rbs_spacer=11-12bp;gc_cont=0.542	WP_000990765.1 MULTISPECIES: bifunctional 2-polyprenyl-6-hydroxyphenol methylase/3-demethylubiquinol 3-O-methyltransferase UbiG [Enterobacteriaceae]	100	99.6	1.72e-175
NC_000913.3_2199|2340417|2344169|-1|ID=1_2199;partial=00;start_type=ATG;rbs_motif=None;rbs_spacer=None;gc_cont=0.513	WP_001220077.1 MULTISPECIES: AIDA-I family autotransporter adhesin YfaL/EhaC [Enterobacteriaceae]	100	99.9	0.0
NC_000913.3_2200|2344865|2347150|1|ID=1_2200;partial=00;start_type=ATG;rbs_motif=GGA/GAG/AGG;rbs_spacer=5-10bp;gc_cont=0.537	WP_345760922.1 class 1a ribonucleoside-diphosphate reductase subunit alpha [Escherichia coli]	99.9	99.9	0.0
NC_000913.3_2201|2347384|2348514|1|ID=1_2201;partial=00;start_type=ATG;rbs_motif=AGGA;rbs_spacer=5-10bp;gc_cont=0.506	WP_000332037.1 MULTISPECIES: class Ia ribonucleoside-diphosphate reductase subunit beta [Enterobacteriaceae]	100	99.7	7.22e-275
NC_000913.3_2202|2348514|2348768|1|ID=1_2202;partial=00;start_type=ATG;rbs_motif=3Base/5BMM;rbs_spacer=13-15bp;gc_cont=0.561	WP_000135040.1 MULTISPECIES: ferredoxin-like diferric-tyrosyl radical cofactor maintenance protein YfaE [Pseudomonadota]	100	98.8	2.30e-57
NC_000913.3_2203|2348822|2349472|-1|ID=1_2203;partial=00;start_type=ATG;rbs_motif=GGA/GAG/AGG;rbs_spacer=5-10bp;gc_cont=0.495	WP_000301050.1 MULTISPECIES: lipopolysaccharide kinase InaA [Enterobacteriaceae]	100	99.5	5.37e-158
NC_000913.3_2204|2349687|2349893|1|ID=1_2204;partial=00;start_type=ATG;rbs_motif=AGxAGG/AGGxGG;rbs_spacer=5-10bp;gc_cont=0.415	WP_250234187.1 LysR substrate-binding domain-containing protein, partial [Escherichia coli]	89.7	98.6	1.12e-34
NC_000913.3_2205|2349935|2351011|-1|ID=1_2205;partial=00;start_type=ATG;rbs_motif=GGAGG;rbs_spacer=5-10bp;gc_cont=0.457	WP_000779105.1 MULTISPECIES: glycerophosphodiester phosphodiesterase [Enterobacteriaceae]	100	99.7	1.49e-267
NC_000913.3_2206|2351016|2352374|-1|ID=1_2206;partial=00;start_type=ATG;rbs_motif=GGAGG;rbs_spacer=5-10bp;gc_cont=0.525	WP_000948731.1 MULTISPECIES: glycerol-3-phosphate transporter [Enterobacteriaceae]	99.8	99.8	0.0
NC_000913.3_2207|2352647|2354275|1|ID=1_2207;partial=00;start_type=ATG;rbs_motif=GGAG/GAGG;rbs_spacer=5-10bp;gc_cont=0.573	WP_000857257.1 MULTISPECIES: anaerobic glycerol-3-phosphate dehydrogenase subunit A [Enterobacteriaceae]	100	99.8	0.0
NC_000913.3_2208|2354265|2355524|1|ID=1_2208;partial=00;start_type=ATG;rbs_motif=AGGAG;rbs_spacer=5-10bp;gc_cont=0.559	WP_001209927.1 MULTISPECIES: glycerol-3-phosphate dehydrogenase subunit GlpB [Enterobacteriaceae]	100	99.8	4.49e-309
NC_000913.3_2209|2355521|2356711|1|ID=1_2209;partial=00;start_type=ATG;rbs_motif=AGGAG;rbs_spacer=5-10bp;gc_cont=0.540	WP_001000379.1 MULTISPECIES: anaerobic glycerol-3-phosphate dehydrogenase subunit GlpC [Enterobacteriaceae]	100	99.7	2.69e-287
NC_000913.3_2210|2356904|2357803|1|ID=1_2210;partial=00;start_type=ATG;rbs_motif=GGA/GAG/AGG;rbs_spacer=5-10bp;gc_cont=0.483	WP_000140592.1 MULTISPECIES: ISNCY family transposase [Escherichia]	100	99.7	1.39e-215
NC_000913.3_2211|2357816|2358001|1|ID=1_2211;partial=00;start_type=ATG;rbs_motif=AGGAG;rbs_spacer=5-10bp;gc_cont=0.505	WP_000150333.1 MULTISPECIES: hypothetical protein [Enterobacteriaceae]	100	98.4	5.10e-35
NC_000913.3_2212|2358042|2358845|-1|ID=1_2212;partial=00;start_type=ATG;rbs_motif=AGGA;rbs_spacer=5-10bp;gc_cont=0.539	WP_000992954.1 MULTISPECIES: 2-keto-3-deoxy-L-rhamnonate aldolase [Enterobacteriaceae]	100	99.6	2.64e-188
NC_000913.3_2213|2358863|2360152|-1|ID=1_2213;partial=00;start_type=ATG;rbs_motif=AGGAG;rbs_spacer=5-10bp;gc_cont=0.527	WP_000100890.1 MULTISPECIES: MFS transporter [Escherichia]	100	99.8	1.08e-296
NC_000913.3_2214|2360209|2361414|-1|ID=1_2214;partial=00;start_type=ATG;rbs_motif=GGAG/GAGG;rbs_spacer=5-10bp;gc_cont=0.522	WP_001319848.1 MULTISPECIES: L-rhamnonate dehydratase [Enterobacteriaceae]	100	99.8	7.35e-308
NC_000913.3_2215|2361429|2362211|-1|ID=1_2215;partial=00;start_type=ATG;rbs_motif=GGAG/GAGG;rbs_spacer=5-10bp;gc_cont=0.510	WP_000894185.1 MULTISPECIES: IclR family transcriptional regulator [Enterobacteriaceae]	100	99.6	9.94e-185
NC_000913.3_2216|2362431|2363633|-1|ID=1_2216;partial=00;start_type=ATG;rbs_motif=AGGAG;rbs_spacer=5-10bp;gc_cont=0.543	WP_000921621.1 MULTISPECIES: nicotinamide mononucleotide deamidase-related protein YfaY [Enterobacteriaceae]	100	99.8	3.83e-289
NC_000913.3_2217|2363733|2364275|-1|ID=1_2217;partial=00;start_type=ATG;rbs_motif=GGA/GAG/AGG;rbs_spacer=5-10bp;gc_cont=0.530	WP_001300392.1 MULTISPECIES: YfaZ family protein [Enterobacteriaceae]	100	99.4	8.49e-126
NC_000913.3_2218|2364554|2364979|1|ID=1_2218;partial=00;start_type=GTG;rbs_motif=AGGA;rbs_spacer=5-10bp;gc_cont=0.477	WP_001300564.1 MULTISPECIES: nucleoside triphosphatase NudI [Enterobacteriaceae]	100	99.3	1.03e-98
NC_000913.3_2219|2365018|2365620|-1|ID=1_2219;partial=00;start_type=GTG;rbs_motif=GGAG/GAGG;rbs_spacer=5-10bp;gc_cont=0.433	WP_000879112.1 MULTISPECIES: lipopolysaccharide core heptose(II)-phosphate phosphatase Ais [Enterobacteriaceae]	100	99.5	1.14e-142
NC_000913.3_2220|2365910|2367067|1|ID=1_2220;partial=00;start_type=ATG;rbs_motif=GGA/GAG/AGG;rbs_spacer=5-10bp;gc_cont=0.513	WP_001295286.1 MULTISPECIES: UDP-4-amino-4-deoxy-L-arabinose aminotransferase [Enterobacteriaceae]	100	98.2	2.74e-273
NC_000913.3_2221|2367071|2368039|1|ID=1_2221;partial=00;start_type=ATG;rbs_motif=AGGA;rbs_spacer=5-10bp;gc_cont=0.498	WP_000461657.1 MULTISPECIES: undecaprenyl-phosphate 4-deoxy-4-formamido-L-arabinose transferase [Enterobacteriaceae]	100	99.7	7.52e-227
NC_000913.3_2222|2368039|2370021|1|ID=1_2222;partial=00;start_type=ATG;rbs_motif=AGGA;rbs_spacer=5-10bp;gc_cont=0.511	WP_349769238.1 bifunctional UDP-4-amino-4-deoxy-L-arabinose formyltransferase/UDP-glucuronic acid oxidase ArnA [Escherichia coli]	100	99.8	0.0
NC_000913.3_2223|2370018|2370908|1|ID=1_2223;partial=00;start_type=ATG;rbs_motif=GGA/GAG/AGG;rbs_spacer=5-10bp;gc_cont=0.529	WP_000169728.1 MULTISPECIES: 4-deoxy-4-formamido-L-arabinose-phosphoundecaprenol deformylase [Enterobacteriaceae]	100	99.7	1.58e-224
NC_000913.3_2224|2370908|2372560|1|ID=1_2224;partial=00;start_type=ATG;rbs_motif=None;rbs_spacer=None;gc_cont=0.510	WP_407233673.1 lipid IV(A) 4-amino-4-deoxy-L-arabinosyltransferase [Escherichia coli]	97.8	99.8	0.0
NC_000913.3_2225|2372557|2372892|1|ID=1_2225;partial=00;start_type=ATG;rbs_motif=None;rbs_spacer=None;gc_cont=0.536	WP_000638031.1 MULTISPECIES: 4-amino-4-deoxy-L-arabinose-phosphoundecaprenol flippase subunit ArnE [Enterobacteriaceae]	100	99.1	6.65e-74
NC_000913.3_2226|2372892|2373278|1|ID=1_2226;partial=00;start_type=ATG;rbs_motif=GGAG/GAGG;rbs_spacer=5-10bp;gc_cont=0.486	WP_000523880.1 MULTISPECIES: 4-amino-4-deoxy-L-arabinose-phosphoundecaprenol flippase subunit ArnF [Enterobacterales]	100	99.2	2.01e-83
NC_000913.3_2227|2373272|2373538|-1|ID=1_2227;partial=00;start_type=ATG;rbs_motif=AGGA;rbs_spacer=5-10bp;gc_cont=0.468	WP_001295285.1 MULTISPECIES: signal transduction protein PmrD [Enterobacteriaceae]	100	98.9	9.15e-59
NC_000913.3_2228|2373648|2375003|-1|ID=1_2228;partial=00;start_type=ATG;rbs_motif=GGAG/GAGG;rbs_spacer=5-10bp;gc_cont=0.560	WP_000577625.1 MULTISPECIES: o-succinylbenzoate--CoA ligase [Enterobacteriaceae]	100	99.8	0.0
NC_000913.3_2229|2375000|2375962|-1|ID=1_2229;partial=00;start_type=ATG;rbs_motif=GGA/GAG/AGG;rbs_spacer=5-10bp;gc_cont=0.590	WP_001255628.1 MULTISPECIES: o-succinylbenzoate synthase [Enterobacteriaceae]	100	99.7	1.26e-233
NC_000913.3_2230|2375962|2376819|-1|ID=1_2230;partial=00;start_type=ATG;rbs_motif=AGGA;rbs_spacer=5-10bp;gc_cont=0.554	WP_000639996.1 MULTISPECIES: 1,4-dihydroxy-2-naphthoyl-CoA synthase [Enterobacteriaceae]	100	99.7	8.68e-212
NC_000913.3_2231|2376834|2377592|-1|ID=1_2231;partial=00;start_type=ATG;rbs_motif=GGA/GAG/AGG;rbs_spacer=5-10bp;gc_cont=0.560	WP_000600499.1 MULTISPECIES: 2-succinyl-6-hydroxy-2,4-cyclohexadiene-1-carboxylate synthase [Enterobacteriaceae]	100	99.6	1.53e-184
NC_000913.3_2232|2377589|2379259|-1|ID=1_2232;partial=00;start_type=ATG;rbs_motif=GGA/GAG/AGG;rbs_spacer=5-10bp;gc_cont=0.582	WP_001295284.1 MULTISPECIES: 2-succinyl-5-enolpyruvyl-6-hydroxy-3-cyclohexene-1-carboxylic-acid synthase [Enterobacteriaceae]	100	99.8	0.0
NC_000913.3_2233|2379348|2380643|-1|ID=1_2233;partial=00;start_type=GTG;rbs_motif=GGAG/GAGG;rbs_spacer=5-10bp;gc_cont=0.535	WP_072646655.1 isochorismate synthase MenF [Escherichia coli]	100	99.8	0.0
NC_000913.3_2234|2380722|2381027|-1|ID=1_2234;partial=00;start_type=ATG;rbs_motif=GGAG/GAGG;rbs_spacer=5-10bp;gc_cont=0.520	WP_000070621.1 MULTISPECIES: stress response protein ElaB [Gammaproteobacteria]	100	99.0	8.85e-63
NC_000913.3_2235|2381082|2381543|-1|ID=1_2235;partial=00;start_type=ATG;rbs_motif=AGGAG;rbs_spacer=5-10bp;gc_cont=0.474	WP_000574091.1 MULTISPECIES: GNAT family N-acetyltransferase [Enterobacteriaceae]	100	99.4	4.59e-110
NC_000913.3_2236|2381608|2382525|1|ID=1_2236;partial=00;start_type=ATG;rbs_motif=None;rbs_spacer=None;gc_cont=0.508	WP_001300687.1 MULTISPECIES: ribonuclease BN [Enterobacteriaceae]	100	99.7	1.92e-225
