NZ_CP132594.1_3255|3460874|3461383|1|ID=1_3255;partial=00;start_type=ATG;rbs_motif=None;rbs_spacer=None;gc_cont=0.561	WP_001076046.1 MULTISPECIES: type II secretion system minor pseudopilin GspH [Enterobacterales]	100	99.4	2.03e-114
NZ_CP132594.1_3256|3461380|3461757|1|ID=1_3256;partial=00;start_type=ATG;rbs_motif=GGA/GAG/AGG;rbs_spacer=5-10bp;gc_cont=0.479	WP_001041743.1 MULTISPECIES: type II secretion system minor pseudopilin GspI [Enterobacterales]	100	99.2	2.88e-77
NZ_CP132594.1_3257|3461750|3462337|1|ID=1_3257;partial=00;start_type=ATG;rbs_motif=GGA/GAG/AGG;rbs_spacer=5-10bp;gc_cont=0.503	WP_000610634.1 MULTISPECIES: type II secretion system minor pseudopilin GspJ [Enterobacterales]	100	99.5	9.27e-126
NZ_CP132594.1_3258|3462330|3463313|1|ID=1_3258;partial=00;start_type=ATG;rbs_motif=GGA/GAG/AGG;rbs_spacer=5-10bp;gc_cont=0.502	WP_001058522.1 MULTISPECIES: type II secretion system minor pseudopilin GspK [Enterobacterales]	100	99.7	2.97e-231
NZ_CP132594.1_3259|3463328|3464491|1|ID=1_3259;partial=00;start_type=ATG;rbs_motif=AGGA;rbs_spacer=5-10bp;gc_cont=0.486	WP_001115238.1 MULTISPECIES: type II secretion system protein GspL [Enterobacterales]	100	99.7	2.11e-284
NZ_CP132594.1_3260|3464488|3464949|1|ID=1_3260;partial=00;start_type=ATG;rbs_motif=AGGA;rbs_spacer=5-10bp;gc_cont=0.478	WP_001295161.1 MULTISPECIES: type II secretion system protein GspM [Enterobacterales]	100	99.4	4.24e-106
NZ_CP132594.1_3261|3464949|3465626|1|ID=1_3261;partial=00;start_type=ATG;rbs_motif=GGAG/GAGG;rbs_spacer=5-10bp;gc_cont=0.504	WP_000178154.1 MULTISPECIES: prepilin peptidase GspO [Escherichia]	100	99.6	1.73e-163
NZ_CP132594.1_3262|3465655|3466131|-1|ID=1_3262;partial=00;start_type=ATG;rbs_motif=AGGAG;rbs_spacer=5-10bp;gc_cont=0.430	WP_000675504.1 MULTISPECIES: bacterioferritin [Enterobacterales]	100	99.4	1.58e-108
NZ_CP132594.1_3263|3466203|3466397|-1|ID=1_3263;partial=00;start_type=ATG;rbs_motif=GGAG/GAGG;rbs_spacer=5-10bp;gc_cont=0.462	WP_000289085.1 MULTISPECIES: bacterioferritin-associated ferredoxin [Gammaproteobacteria]	100	98.5	8.16e-40
NZ_CP132594.1_3264|3466566|3469259|-1|ID=1_3264;partial=00;start_type=ATG;rbs_motif=GGA/GAG/AGG;rbs_spacer=5-10bp;gc_cont=0.504	WP_063073249.1 bifunctional chitinase/lysozyme [Escherichia coli]	99.1	99.9	0.0
NZ_CP132594.1_3265|3469551|3470735|-1|ID=1_3265;partial=00;start_type=GTG;rbs_motif=AGGA;rbs_spacer=5-10bp;gc_cont=0.532	WP_000031783.1 MULTISPECIES: elongation factor Tu [Pseudomonadati]	100	99.7	1.62e-287
NZ_CP132594.1_3266|3470806|3472920|-1|ID=1_3266;partial=00;start_type=ATG;rbs_motif=GGAG/GAGG;rbs_spacer=5-10bp;gc_cont=0.508	WP_000124700.1 MULTISPECIES: elongation factor G [Enterobacteriaceae]	100	99.9	0.0
NZ_CP132594.1_3267|3472948|3473487|-1|ID=1_3267;partial=00;start_type=ATG;rbs_motif=GGAG/GAGG;rbs_spacer=5-10bp;gc_cont=0.506	WP_001138043.1 MULTISPECIES: 30S ribosomal protein S7 [Gammaproteobacteria]	100	86.7	2.41e-99
NZ_CP132594.1_3268|3473584|3473958|-1|ID=1_3268;partial=00;start_type=ATG;rbs_motif=AGGAG;rbs_spacer=5-10bp;gc_cont=0.531	WP_000246815.1 MULTISPECIES: 30S ribosomal protein S12 [Bacteria]	100	99.2	4.27e-83
NZ_CP132594.1_3269|3474084|3474371|-1|ID=1_3269;partial=00;start_type=ATG;rbs_motif=GGAG/GAGG;rbs_spacer=5-10bp;gc_cont=0.497	WP_000903373.1 MULTISPECIES: sulfurtransferase complex subunit TusB [Enterobacteriaceae]	100	99.0	1.92e-61
NZ_CP132594.1_3270|3474379|3474738|-1|ID=1_3270;partial=00;start_type=ATG;rbs_motif=GGxGG;rbs_spacer=5-10bp;gc_cont=0.506	WP_000820714.1 MULTISPECIES: sulfurtransferase complex subunit TusC [Enterobacteriaceae]	100	99.2	7.82e-79
NZ_CP132594.1_3271|3474738|3475124|-1|ID=1_3271;partial=00;start_type=ATG;rbs_motif=3Base/5BMM;rbs_spacer=13-15bp;gc_cont=0.550	WP_001209680.1 MULTISPECIES: sulfurtransferase complex subunit TusD [Enterobacteriaceae]	100	99.2	1.16e-82
NZ_CP132594.1_3272|3475124|3475846|-1|ID=1_3272;partial=00;start_type=ATG;rbs_motif=AGGAG/GGAGG;rbs_spacer=11-12bp;gc_cont=0.473	WP_000091466.1 MULTISPECIES: helix-turn-helix transcriptional regulator [Gammaproteobacteria]	100	99.6	6.95e-166
NZ_CP132594.1_3273|3476013|3476825|-1|ID=1_3273;partial=00;start_type=ATG;rbs_motif=GGAG/GAGG;rbs_spacer=5-10bp;gc_cont=0.485	WP_000838250.1 MULTISPECIES: FKBP-type peptidyl-prolyl cis-trans isomerase [Enterobacteriaceae]	100	99.6	9.00e-177
NZ_CP132594.1_3274|3477046|3477264|1|ID=1_3274;partial=00;start_type=ATG;rbs_motif=GGAG/GAGG;rbs_spacer=5-10bp;gc_cont=0.530	WP_001153615.1 MULTISPECIES: protein SlyX [Gammaproteobacteria]	100	98.6	4.97e-40
NZ_CP132594.1_3275|3477313|3477903|-1|ID=1_3275;partial=00;start_type=ATG;rbs_motif=AGGAG;rbs_spacer=5-10bp;gc_cont=0.553	WP_333939756.1 peptidylprolyl isomerase [Escherichia coli]	99.5	99.5	2.32e-115
NZ_CP132594.1_3276|3477998|3478198|-1|ID=1_3276;partial=00;start_type=ATG;rbs_motif=GGAG/GAGG;rbs_spacer=5-10bp;gc_cont=0.483	WP_001007730.1 MULTISPECIES: YheV family putative zinc ribbon protein [Gammaproteobacteria]	100	98.5	4.10e-43
NZ_CP132594.1_3277|3478208|3480013|-1|ID=1_3277;partial=00;start_type=ATG;rbs_motif=AGGAG;rbs_spacer=5-10bp;gc_cont=0.548	WP_000399147.1 MULTISPECIES: glutathione-regulated potassium-efflux system protein KefB [Enterobacteriaceae]	100	99.8	0.0
NZ_CP132594.1_3278|3480013|3480564|-1|ID=1_3278;partial=00;start_type=ATG;rbs_motif=GGAGG;rbs_spacer=5-10bp;gc_cont=0.565	WP_001297514.1 MULTISPECIES: glutathione-regulated potassium-efflux system ancillary protein KefG [Enterobacteriaceae]	100	99.5	2.16e-134
NZ_CP132594.1_3279|3480695|3482608|1|ID=1_3279;partial=00;start_type=ATG;rbs_motif=None;rbs_spacer=None;gc_cont=0.553	WP_409231018.1 ABC transporter ATP-binding protein [Escherichia coli]	100	99.8	0.0
NZ_CP132594.1_3280|3482608|3483630|1|ID=1_3280;partial=00;start_type=ATG;rbs_motif=GGA/GAG/AGG;rbs_spacer=11-12bp;gc_cont=0.543	WP_000057356.1 MULTISPECIES: hydrolase [Enterobacteriaceae]	100	99.7	7.27e-259
NZ_CP132594.1_3281|3483624|3483842|1|ID=1_3281;partial=00;start_type=ATG;rbs_motif=GGAGG;rbs_spacer=5-10bp;gc_cont=0.498	WP_000907085.1 MULTISPECIES: YheU family protein [Pseudomonadota]	100	98.6	3.76e-44
NZ_CP132594.1_3282|3483896|3484765|1|ID=1_3282;partial=00;start_type=ATG;rbs_motif=GGAG/GAGG;rbs_spacer=5-10bp;gc_cont=0.532	WP_001274680.1 MULTISPECIES: phosphoribulokinase [Enterobacteriaceae]	100	99.7	8.34e-212
NZ_CP132594.1_3283|3484820|3485224|-1|ID=1_3283;partial=00;start_type=ATG;rbs_motif=GGAG/GAGG;rbs_spacer=5-10bp;gc_cont=0.511	WP_001148908.1 MULTISPECIES: OsmC family protein [Gammaproteobacteria]	100	99.3	2.90e-88
NZ_CP132594.1_3284|3485526|3486158|1|ID=1_3284;partial=00;start_type=ATG;rbs_motif=GGAG/GAGG;rbs_spacer=5-10bp;gc_cont=0.494	WP_000242755.1 MULTISPECIES: cAMP-activated global transcriptional regulator CRP [Bacteria]	100	99.5	1.60e-147
NZ_CP132594.1_3285|3486209|3488299|1|ID=1_3285;partial=00;start_type=ATG;rbs_motif=None;rbs_spacer=None;gc_cont=0.527	WP_001295162.1 MULTISPECIES: YccS/YhfK family putative transporter [Enterobacteriaceae]	100	99.9	0.0
NZ_CP132594.1_3286|3488366|3489586|-1|ID=1_3286;partial=00;start_type=ATG;rbs_motif=GGA/GAG/AGG;rbs_spacer=11-12bp;gc_cont=0.545	WP_000963792.1 MULTISPECIES: bifunctional acetylornithine/succinyldiaminopimelate transaminase [Gammaproteobacteria]	100	99.8	7.58e-299
NZ_CP132594.1_3287|3489672|3490235|-1|ID=1_3287;partial=00;start_type=ATG;rbs_motif=GGAG/GAGG;rbs_spacer=5-10bp;gc_cont=0.534	WP_000601847.1 MULTISPECIES: aminodeoxychorismate synthase component 2 [Enterobacteriaceae]	100	99.5	8.77e-136
NZ_CP132594.1_3288|3490267|3490869|-1|ID=1_3288;partial=00;start_type=ATG;rbs_motif=AGGAG;rbs_spacer=5-10bp;gc_cont=0.531	WP_001280641.1 MULTISPECIES: putative adenosine monophosphate-protein transferase Fic [Enterobacteriaceae]	100	99.5	5.86e-145
NZ_CP132594.1_3289|3490859|3491026|-1|ID=1_3289;partial=00;start_type=GTG;rbs_motif=GGAGG;rbs_spacer=5-10bp;gc_cont=0.506	WP_000736862.1 MULTISPECIES: YhfG family protein [Gammaproteobacteria]	100	98.2	1.77e-28
NZ_CP132594.1_3290|3491131|3491703|-1|ID=1_3290;partial=00;start_type=ATG;rbs_motif=AGGA;rbs_spacer=5-10bp;gc_cont=0.510	WP_000477225.1 MULTISPECIES: peptidylprolyl isomerase A [Enterobacteriaceae]	100	99.5	3.41e-130
NZ_CP132594.1_3291|3491974|3493155|1|ID=1_3291;partial=00;start_type=ATG;rbs_motif=GGA/GAG/AGG;rbs_spacer=5-10bp;gc_cont=0.519	WP_000185247.1 MULTISPECIES: MFS transporter TsgA [Enterobacteriaceae]	100	99.7	1.47e-278
NZ_CP132594.1_3292|3493417|3495960|1|ID=1_3292;partial=00;start_type=ATG;rbs_motif=GGAG/GAGG;rbs_spacer=5-10bp;gc_cont=0.543	WP_000049208.1 MULTISPECIES: NADPH-nitrite reductase large subunit [Enterobacteriaceae]	100	99.9	0.0
NZ_CP132594.1_3293|3495957|3496283|1|ID=1_3293;partial=00;start_type=ATG;rbs_motif=GGAGG;rbs_spacer=5-10bp;gc_cont=0.560	WP_000084764.1 MULTISPECIES: nitrite reductase small subunit NirD [Enterobacteriaceae]	100	99.1	3.75e-74
NZ_CP132594.1_3294|3496409|3497215|1|ID=1_3294;partial=00;start_type=ATG;rbs_motif=AGGA;rbs_spacer=5-10bp;gc_cont=0.549	WP_000493556.1 MULTISPECIES: nitrite transporter NirC [Gammaproteobacteria]	100	99.6	1.13e-194
NZ_CP132594.1_3295|3497234|3498607|1|ID=1_3295;partial=00;start_type=GTG;rbs_motif=GGA/GAG/AGG;rbs_spacer=5-10bp;gc_cont=0.547	WP_000349855.1 MULTISPECIES: siroheme synthase CysG [Enterobacteriaceae]	100	99.8	0.0
NZ_CP132594.1_3296|3498854|3499021|1|ID=1_3296;partial=00;start_type=ATG;rbs_motif=GGA/GAG/AGG;rbs_spacer=5-10bp;gc_cont=0.423	WP_001031834.1 MULTISPECIES: YhfL family protein [Gammaproteobacteria]	100	98.2	2.30e-33
NZ_CP132594.1_3297|3499316|3500653|1|ID=1_3297;partial=00;start_type=ATG;rbs_motif=GGA/GAG/AGG;rbs_spacer=5-10bp;gc_cont=0.546	WP_000535505.1 MULTISPECIES: fructoselysine/psicoselysine transporter [Enterobacteriaceae]	100	99.8	1.40e-315
NZ_CP132594.1_3298|3500674|3501696|1|ID=1_3298;partial=00;start_type=ATG;rbs_motif=GGAG/GAGG;rbs_spacer=5-10bp;gc_cont=0.544	WP_001295163.1 MULTISPECIES: fructoselysine 6-phosphate deglycase [Gammaproteobacteria]	100	99.7	1.58e-253
NZ_CP132594.1_3299|3501746|3502576|1|ID=1_3299;partial=00;start_type=ATG;rbs_motif=AGGAG;rbs_spacer=5-10bp;gc_cont=0.549	WP_000847837.1 MULTISPECIES: fructoselysine 3-epimerase [Enterobacteriaceae]	100	99.6	2.68e-206
NZ_CP132594.1_3300|3502573|3503358|1|ID=1_3300;partial=00;start_type=ATG;rbs_motif=GGAGG;rbs_spacer=5-10bp;gc_cont=0.574	WP_000853353.1 MULTISPECIES: fructoselysine 6-kinase [Enterobacteriaceae]	100	99.6	1.37e-196
NZ_CP132594.1_3301|3503458|3504189|1|ID=1_3301;partial=00;start_type=ATG;rbs_motif=GGA/GAG/AGG;rbs_spacer=5-10bp;gc_cont=0.510	WP_001276847.1 MULTISPECIES: DNA-binding transcriptional regulator FrlR [Enterobacteriaceae]	100	99.6	2.54e-174
NZ_CP132594.1_3302|3504341|3505426|-1|ID=1_3302;partial=00;start_type=ATG;rbs_motif=AGGA;rbs_spacer=5-10bp;gc_cont=0.570	WP_000847144.1 MULTISPECIES: aminotransferase class I/II-fold pyridoxal phosphate-dependent enzyme [Enterobacteriaceae]	100	99.7	1.57e-250
NZ_CP132594.1_3303|3505438|3506742|-1|ID=1_3303;partial=00;start_type=ATG;rbs_motif=GGA/GAG/AGG;rbs_spacer=5-10bp;gc_cont=0.530	WP_000366857.1 MULTISPECIES: YhfT family protein [Escherichia]	100	99.8	8.82e-294
NZ_CP132594.1_3304|3506754|3507107|-1|ID=1_3304;partial=00;start_type=ATG;rbs_motif=AGGA;rbs_spacer=5-10bp;gc_cont=0.477	WP_000719728.1 MULTISPECIES: DUF2620 domain-containing protein [Gammaproteobacteria]	100	99.2	6.49e-77
NZ_CP132594.1_3305|3507118|3507996|-1|ID=1_3305;partial=00;start_type=ATG;rbs_motif=AGGAG;rbs_spacer=5-10bp;gc_cont=0.531	WP_000007010.1 MULTISPECIES: phosphotriesterase-related protein [Enterobacteriaceae]	100	99.7	8.66e-211
NZ_CP132594.1_3306|3507993|3509219|-1|ID=1_3306;partial=00;start_type=ATG;rbs_motif=GGxGG;rbs_spacer=3-4bp;gc_cont=0.541	WP_000090644.1 MULTISPECIES: phosphopentomutase [Escherichia]	100	99.8	7.60e-300
NZ_CP132594.1_3307|3509219|3510382|-1|ID=1_3307;partial=00;start_type=ATG;rbs_motif=GGAG/GAGG;rbs_spacer=5-10bp;gc_cont=0.545	WP_000497334.1 MULTISPECIES: YhfX family PLP-dependent enzyme [Enterobacteriaceae]	100	99.7	7.06e-283
NZ_CP132594.1_3308|3510466|3510828|-1|ID=1_3308;partial=00;start_type=ATG;rbs_motif=GGA/GAG/AGG;rbs_spacer=5-10bp;gc_cont=0.515	WP_001295165.1 MULTISPECIES: PRD domain protein [Enterobacteriaceae]	100	99.2	8.75e-81
NZ_CP132594.1_3309|3510845|3511750|-1|ID=1_3309;partial=00;start_type=ATG;rbs_motif=None;rbs_spacer=None;gc_cont=0.524	WP_001254790.1 MULTISPECIES: GntR family transcriptional regulator YhfZ [Enterobacteriaceae]	100	99.7	3.27e-215
NZ_CP132594.1_3310|3512040|3513044|-1|ID=1_3310;partial=00;start_type=ATG;rbs_motif=AGGA;rbs_spacer=5-10bp;gc_cont=0.518	WP_000165552.1 MULTISPECIES: tryptophan--tRNA ligase [Enterobacteriaceae]	100	99.7	1.55e-241
NZ_CP132594.1_3311|3513037|3513795|-1|ID=1_3311;partial=00;start_type=ATG;rbs_motif=GGA/GAG/AGG;rbs_spacer=5-10bp;gc_cont=0.528	WP_001031729.1 MULTISPECIES: phosphoglycolate phosphatase [Enterobacteriaceae]	100	99.6	9.95e-181
NZ_CP132594.1_3312|3513788|3514465|-1|ID=1_3312;partial=00;start_type=ATG;rbs_motif=AGGAG;rbs_spacer=5-10bp;gc_cont=0.513	WP_000816280.1 MULTISPECIES: ribulose-phosphate 3-epimerase [Enterobacteriaceae]	100	99.6	3.08e-157
NZ_CP132594.1_3313|3514483|3515319|-1|ID=1_3313;partial=00;start_type=ATG;rbs_motif=None;rbs_spacer=None;gc_cont=0.498	WP_000742143.1 MULTISPECIES: adenine-specific DNA-methyltransferase [Enterobacteriaceae]	100	99.6	3.51e-203
NZ_CP132594.1_3314|3515426|3516712|-1|ID=1_3314;partial=00;start_type=ATG;rbs_motif=None;rbs_spacer=None;gc_cont=0.545	WP_053891464.1 cell division protein DamX [Escherichia coli]	100	99.8	2.53e-223
NZ_CP132594.1_3315|3516804|3517892|-1|ID=1_3315;partial=00;start_type=ATG;rbs_motif=AGxAGG/AGGxGG;rbs_spacer=5-10bp;gc_cont=0.540	WP_000439848.1 MULTISPECIES: 3-dehydroquinate synthase [Enterobacteriaceae]	100	99.7	4.74e-257
NZ_CP132594.1_3316|3517949|3518470|-1|ID=1_3316;partial=00;start_type=ATG;rbs_motif=AGxAG;rbs_spacer=5-10bp;gc_cont=0.490	WP_000818618.1 MULTISPECIES: shikimate kinase AroK [Enterobacteriaceae]	100	99.4	6.76e-115
NZ_CP132594.1_3317|3518871|3520079|-1|ID=1_3317;partial=00;start_type=ATG;rbs_motif=None;rbs_spacer=None;gc_cont=0.547	WP_001360202.1 DNA uptake porin HofQ [Escherichia coli]	100	99.8	1.21e-277
NZ_CP132594.1_3318|3520021|3520425|-1|ID=1_3318;partial=00;start_type=ATG;rbs_motif=GGAG/GAGG;rbs_spacer=5-10bp;gc_cont=0.526	WP_001264141.1 MULTISPECIES: DNA utilization protein HofP [Enterobacteriaceae]	100	99.3	1.68e-96
NZ_CP132594.1_3319|3520415|3520855|-1|ID=1_3319;partial=00;start_type=ATG;rbs_motif=AGGA;rbs_spacer=5-10bp;gc_cont=0.549	WP_001055759.1 MULTISPECIES: DNA utilization protein HofO [Escherichia]	100	99.3	6.13e-98
NZ_CP132594.1_3320|3520839|3521378|-1|ID=1_3320;partial=00;start_type=ATG;rbs_motif=GGA/GAG/AGG;rbs_spacer=5-10bp;gc_cont=0.556	WP_001069317.1 MULTISPECIES: DNA utilization protein HofN [Enterobacteriaceae]	95.5	99.4	1.14e-109
NZ_CP132594.1_3321|3521378|3522157|-1|ID=1_3321;partial=00;start_type=ATG;rbs_motif=AGGAG;rbs_spacer=5-10bp;gc_cont=0.577	WP_001295166.1 MULTISPECIES: DNA utilization protein HofM [Enterobacteriaceae]	100	99.6	1.66e-187
NZ_CP132594.1_3322|3522277|3524829|1|ID=1_3322;partial=00;start_type=GTG;rbs_motif=GGA/GAG/AGG;rbs_spacer=5-10bp;gc_cont=0.555	WP_001336003.1 MULTISPECIES: peptidoglycan glycosyltransferase/peptidoglycan DD-transpeptidase MrcA [Enterobacteriaceae]	100	99.9	0.0
NZ_CP132594.1_3323|3524995|3525555|-1|ID=1_3323;partial=00;start_type=ATG;rbs_motif=None;rbs_spacer=None;gc_cont=0.510	WP_000045744.1 MULTISPECIES: ADP compounds hydrolase NudE [Enterobacteriaceae]	100	99.5	2.41e-128
NZ_CP132594.1_3324|3525875|3528010|1|ID=1_3324;partial=00;start_type=ATG;rbs_motif=GGA/GAG/AGG;rbs_spacer=3-4bp;gc_cont=0.528	WP_000104533.1 MULTISPECIES: intracellular growth attenuator protein IgaA [Enterobacteriaceae]	100	99.9	0.0
NZ_CP132594.1_3325|3528075|3528743|1|ID=1_3325;partial=00;start_type=ATG;rbs_motif=GGAG/GAGG;rbs_spacer=5-10bp;gc_cont=0.516	WP_001295168.1 MULTISPECIES: GMP/IMP nucleotidase [Enterobacteriaceae]	100	99.6	1.66e-164
NZ_CP132594.1_3326|3528754|3529155|1|ID=1_3326;partial=00;start_type=ATG;rbs_motif=AGGAG;rbs_spacer=5-10bp;gc_cont=0.535	WP_000660483.1 MULTISPECIES: ribosome-associated heat shock protein Hsp15 [Enterobacteriaceae]	100	99.3	6.11e-85
NZ_CP132594.1_3327|3529180|3530058|1|ID=1_3327;partial=00;start_type=ATG;rbs_motif=GGA/GAG/AGG;rbs_spacer=5-10bp;gc_cont=0.529	WP_001135574.1 MULTISPECIES: Hsp33 family molecular chaperone HslO [Enterobacteriaceae]	100	99.7	1.28e-212
NZ_CP132594.1_3328|3530121|3531845|-1|ID=1_3328;partial=00;start_type=ATG;rbs_motif=GGA/GAG/AGG;rbs_spacer=5-10bp;gc_cont=0.501	WP_000370879.1 MULTISPECIES: DUF4153 domain-containing protein [Enterobacteriaceae]	100	99.8	0.0
NZ_CP132594.1_3329|3532224|3533846|1|ID=1_3329;partial=00;start_type=ATG;rbs_motif=AGGAG;rbs_spacer=5-10bp;gc_cont=0.536	WP_001265681.1 MULTISPECIES: phosphoenolpyruvate carboxykinase (ATP) [Enterobacteriaceae]	100	99.8	0.0
NZ_CP132594.1_3330|3533922|3535274|-1|ID=1_3330;partial=00;start_type=ATG;rbs_motif=GGA/GAG/AGG;rbs_spacer=11-12bp;gc_cont=0.571	WP_001253696.1 MULTISPECIES: two-component system sensor histidine kinase EnvZ [Enterobacteriaceae]	100	99.8	0.0
NZ_CP132594.1_3331|3535271|3535990|-1|ID=1_3331;partial=00;start_type=ATG;rbs_motif=GGAG/GAGG;rbs_spacer=5-10bp;gc_cont=0.551	WP_001157751.1 MULTISPECIES: osmolarity response regulator transcription factor OmpR [Bacteria]	100	99.6	3.32e-168
NZ_CP132594.1_3332|3536218|3536694|1|ID=1_3332;partial=00;start_type=ATG;rbs_motif=GGA/GAG/AGG;rbs_spacer=5-10bp;gc_cont=0.499	WP_000856737.1 MULTISPECIES: transcription elongation factor GreB [Enterobacteriaceae]	100	99.4	2.34e-110
NZ_CP132594.1_3333|3536791|3539112|1|ID=1_3333;partial=00;start_type=ATG;rbs_motif=None;rbs_spacer=None;gc_cont=0.568	WP_000980727.1 MULTISPECIES: Tex family protein [Escherichia]	100	99.9	0.0
NZ_CP132594.1_3334|3539569|3539796|1|ID=1_3334;partial=00;start_type=ATG;rbs_motif=AGxAGG/AGGxGG;rbs_spacer=5-10bp;gc_cont=0.487	WP_001200455.1 MULTISPECIES: ferrous iron transporter A [Bacteria]	100	98.7	4.82e-46
NZ_CP132594.1_3335|3539813|3542134|1|ID=1_3335;partial=00;start_type=ATG;rbs_motif=None;rbs_spacer=None;gc_cont=0.547	WP_000737039.1 MULTISPECIES: Fe(2+) transporter permease subunit FeoB [Enterobacteriaceae]	100	99.9	0.0
NZ_CP132594.1_3336|3542134|3542370|1|ID=1_3336;partial=00;start_type=ATG;rbs_motif=None;rbs_spacer=None;gc_cont=0.549	WP_000157586.1 MULTISPECIES: [Fe-S]-dependent transcriptional repressor FeoC [Enterobacteriaceae]	100	98.7	2.61e-49
NZ_CP132594.1_3337|3542573|3543451|1|ID=1_3337;partial=00;start_type=ATG;rbs_motif=AGGA;rbs_spacer=5-10bp;gc_cont=0.476	WP_000039062.1 MULTISPECIES: recombination-promoting nuclease RpnA [Enterobacteriaceae]	100	99.7	1.23e-210
NZ_CP132594.1_3338|3543480|3544250|-1|ID=1_3338;partial=00;start_type=ATG;rbs_motif=GGA/GAG/AGG;rbs_spacer=11-12bp;gc_cont=0.563	WP_001060070.1 MULTISPECIES: pimeloyl-ACP methyl ester esterase BioH [Enterobacteriaceae]	100	99.6	6.51e-188
NZ_CP132594.1_3339|3544288|3544971|1|ID=1_3339;partial=00;start_type=ATG;rbs_motif=AGGA;rbs_spacer=5-10bp;gc_cont=0.560	WP_001333371.1 MULTISPECIES: DNA utilization protein GntX [Enterobacteriaceae]	100	99.6	1.48e-165
NZ_CP132594.1_3340|3545030|3545605|1|ID=1_3340;partial=00;start_type=ATG;rbs_motif=GGA/GAG/AGG;rbs_spacer=5-10bp;gc_cont=0.533	WP_000619389.1 MULTISPECIES: Fe-S biogenesis protein NfuA [Enterobacteriaceae]	100	99.5	6.89e-135
NZ_CP132594.1_3341|3545965|3547281|1|ID=1_3341;partial=00;start_type=ATG;rbs_motif=GGA/GAG/AGG;rbs_spacer=5-10bp;gc_cont=0.534	WP_001131758.1 MULTISPECIES: gluconate transporter [Enterobacteriaceae]	100	99.8	1.79e-295
NZ_CP132594.1_3342|3547392|3549476|-1|ID=1_3342;partial=00;start_type=ATG;rbs_motif=AGGA;rbs_spacer=5-10bp;gc_cont=0.552	WP_000444342.1 MULTISPECIES: 4-alpha-glucanotransferase [Escherichia]	100	99.9	0.0
NZ_CP132594.1_3343|3549486|3551879|-1|ID=1_3343;partial=00;start_type=ATG;rbs_motif=GGA/GAG/AGG;rbs_spacer=5-10bp;gc_cont=0.523	WP_000081909.1 MULTISPECIES: maltodextrin phosphorylase [Enterobacteriaceae]	100	99.9	0.0
NZ_CP132594.1_3344|3552491|3555196|1|ID=1_3344;partial=00;start_type=ATG;rbs_motif=None;rbs_spacer=None;gc_cont=0.541	WP_000906961.1 MULTISPECIES: HTH-type transcriptional regulator MalT [Enterobacteriaceae]	100	99.9	0.0
NZ_CP132594.1_3345|3555239|3556255|-1|ID=1_3345;partial=00;start_type=ATG;rbs_motif=AGGA;rbs_spacer=5-10bp;gc_cont=0.598	WP_001335950.1 MULTISPECIES: RNA 3'-terminal phosphate cyclase [Enterobacteriaceae]	100	99.7	9.25e-236
NZ_CP132594.1_3346|3556259|3557485|-1|ID=1_3346;partial=00;start_type=ATG;rbs_motif=GGA/GAG/AGG;rbs_spacer=5-10bp;gc_cont=0.509	WP_001105504.1 MULTISPECIES: RNA-splicing ligase RtcB [Enterobacteriaceae]	100	99.8	3.09e-299
NZ_CP132594.1_3347|3557674|3559272|1|ID=1_3347;partial=00;start_type=ATG;rbs_motif=AGGA;rbs_spacer=5-10bp;gc_cont=0.558	WP_001232948.1 MULTISPECIES: DNA-binding transcriptional regulator RtcR [Escherichia]	100	99.8	0.0
NZ_CP132594.1_3348|3559254|3560012|-1|ID=1_3348;partial=00;start_type=ATG;rbs_motif=GGA/GAG/AGG;rbs_spacer=5-10bp;gc_cont=0.544	WP_000815099.1 MULTISPECIES: DeoR/GlpR family transcriptional regulator [Gammaproteobacteria]	100	99.6	1.30e-176
NZ_CP132594.1_3349|3560029|3560859|-1|ID=1_3349;partial=00;start_type=ATG;rbs_motif=None;rbs_spacer=None;gc_cont=0.544	WP_000928723.1 MULTISPECIES: rhomboid family intramembrane serine protease GlpG [Enterobacteriaceae]	100	99.6	2.12e-203
NZ_CP132594.1_3350|3560904|3561230|-1|ID=1_3350;partial=00;start_type=ATG;rbs_motif=GGA/GAG/AGG;rbs_spacer=5-10bp;gc_cont=0.535	WP_000371928.1 MULTISPECIES: thiosulfate sulfurtransferase GlpE [Gammaproteobacteria]	100	99.1	6.47e-75
NZ_CP132594.1_3351|3561420|3562925|1|ID=1_3351;partial=00;start_type=ATG;rbs_motif=GGAG/GAGG;rbs_spacer=5-10bp;gc_cont=0.550	WP_000448136.1 MULTISPECIES: glycerol-3-phosphate dehydrogenase [Enterobacteriaceae]	100	99.8	0.0
NZ_CP132594.1_3352|3563131|3563412|-1|ID=1_3352;partial=00;start_type=ATG;rbs_motif=GGA/GAG/AGG;rbs_spacer=5-10bp;gc_cont=0.454	WP_001181210.1 MULTISPECIES: protein YzgL [Gammaproteobacteria]	100	98.9	1.80e-56
NZ_CP132594.1_3353|3563541|3565988|-1|ID=1_3353;partial=00;start_type=ATG;rbs_motif=AGGA;rbs_spacer=5-10bp;gc_cont=0.509	WP_000993449.1 MULTISPECIES: glycogen phosphorylase [Gammaproteobacteria]	100	99.9	0.0
NZ_CP132594.1_3354|3566007|3567440|-1|ID=1_3354;partial=00;start_type=ATG;rbs_motif=AGGAG;rbs_spacer=5-10bp;gc_cont=0.550	WP_001197646.1 MULTISPECIES: glycogen synthase GlgA [Enterobacteriaceae]	100	99.8	0.0
NZ_CP132594.1_3355|3567440|3568735|-1|ID=1_3355;partial=00;start_type=ATG;rbs_motif=AGGAG;rbs_spacer=5-10bp;gc_cont=0.526	WP_000253975.1 MULTISPECIES: glucose-1-phosphate adenylyltransferase [Enterobacteriaceae]	100	99.8	0.0
NZ_CP132594.1_3356|3568753|3570726|-1|ID=1_3356;partial=00;start_type=ATG;rbs_motif=GGAGG;rbs_spacer=3-4bp;gc_cont=0.544	WP_000192523.1 MULTISPECIES: glycogen debranching protein GlgX [Enterobacteriaceae]	100	99.8	0.0
NZ_CP132594.1_3357|3570723|3572909|-1|ID=1_3357;partial=00;start_type=ATG;rbs_motif=AGGA;rbs_spacer=5-10bp;gc_cont=0.534	WP_001283723.1 MULTISPECIES: 1,4-alpha-glucan branching enzyme [Gammaproteobacteria]	100	99.9	0.0
NZ_CP132594.1_3358|3573182|3574285|-1|ID=1_3358;partial=00;start_type=ATG;rbs_motif=AGGA/GGAG/GAGG;rbs_spacer=11-12bp;gc_cont=0.540	WP_000799956.1 MULTISPECIES: aspartate-semialdehyde dehydrogenase [Gammaproteobacteria]	100	99.7	3.68e-268
NZ_CP132594.1_3359|3574478|3575071|1|ID=1_3359;partial=00;start_type=ATG;rbs_motif=GGA/GAG/AGG;rbs_spacer=5-10bp;gc_cont=0.500	WP_001002544.1 MULTISPECIES: NAAT family transporter YhgN [Gammaproteobacteria]	100	99.5	5.13e-124
NZ_CP132594.1_3360|3575128|3576468|-1|ID=1_3360;partial=00;start_type=GTG;rbs_motif=GGA/GAG/AGG;rbs_spacer=5-10bp;gc_cont=0.550	WP_000210111.1 MULTISPECIES: gluconate transporter [Gammaproteobacteria]	100	99.8	3.05e-307
NZ_CP132594.1_3361|3576472|3576999|-1|ID=1_3361;partial=00;start_type=TTG;rbs_motif=GGxGG;rbs_spacer=5-10bp;gc_cont=0.498	WP_000108330.1 MULTISPECIES: gluconokinase [Gammaproteobacteria]	100	99.4	1.31e-122
NZ_CP132594.1_3362|3577138|3578133|-1|ID=1_3362;partial=00;start_type=ATG;rbs_motif=None;rbs_spacer=None;gc_cont=0.546	WP_000730252.1 MULTISPECIES: gluconate operon transcriptional repressor GntR [Enterobacteriaceae]	100	99.7	6.26e-235
NZ_CP132594.1_3363|3578357|3579052|-1|ID=1_3363;partial=00;start_type=ATG;rbs_motif=AGxAGG/AGGxGG;rbs_spacer=5-10bp;gc_cont=0.523	WP_000639811.1 MULTISPECIES: quercetin 2,3-dioxygenase [Gammaproteobacteria]	100	99.6	9.25e-171
NZ_CP132594.1_3364|3579175|3580212|-1|ID=1_3364;partial=00;start_type=ATG;rbs_motif=AGGA;rbs_spacer=5-10bp;gc_cont=0.508	WP_000236293.1 MULTISPECIES: oxidoreductase [Gammaproteobacteria]	100	99.7	1.41e-254
NZ_CP132594.1_3365|3580545|3581033|1|ID=1_3365;partial=00;start_type=ATG;rbs_motif=GGAG/GAGG;rbs_spacer=5-10bp;gc_cont=0.517	WP_001295206.1 MULTISPECIES: N-acetyltransferase [Gammaproteobacteria]	100	99.4	7.49e-118
NZ_CP132594.1_3366|3581270|3582448|1|ID=1_3366;partial=00;start_type=ATG;rbs_motif=AGGA;rbs_spacer=5-10bp;gc_cont=0.340	WP_000065894.1 MULTISPECIES: Hcp1 family type VI secretion system effector [Enterobacteriaceae]	100	99.7	2.99e-282
NZ_CP132594.1_3367|3582445|3582861|1|ID=1_3367;partial=00;start_type=ATG;rbs_motif=GGA/GAG/AGG;rbs_spacer=5-10bp;gc_cont=0.297	WP_000988497.1 MULTISPECIES: YrhA family protein [Escherichia]	100	99.3	1.08e-94
NZ_CP132594.1_3368|3582890|3583165|1|ID=1_3368;partial=00;start_type=GTG;rbs_motif=GGAG/GAGG;rbs_spacer=5-10bp;gc_cont=0.529	WP_000179213.1 MULTISPECIES: IS1-like element transposase [Pseudomonadota]	100	98.9	1.68e-60
NZ_CP132594.1_3369|3583210|3583587|1|ID=1_3369;partial=00;start_type=ATG;rbs_motif=None;rbs_spacer=None;gc_cont=0.537	WP_000344410.1 IS1 family transposase [Escherichia coli]	100	99.2	2.03e-86
NZ_CP132594.1_3370|3584166|3584450|1|ID=1_3370;partial=00;start_type=ATG;rbs_motif=None;rbs_spacer=None;gc_cont=0.456	WP_000634159.1 MULTISPECIES: YrhB family protein [Enterobacteriaceae]	100	98.9	1.92e-65
