NZ_CP132594.1_1061|1151346|1152587|1|ID=1_1061;partial=00;start_type=GTG;rbs_motif=GGAGG;rbs_spacer=5-10bp;gc_cont=0.533	WP_000044679.1 MULTISPECIES: beta-ketoacyl-ACP synthase II [Enterobacteriaceae]	100	99.8	6.97e-294
NZ_CP132594.1_1062|1152707|1153516|1|ID=1_1062;partial=00;start_type=ATG;rbs_motif=AGGAG;rbs_spacer=5-10bp;gc_cont=0.506	WP_000478681.1 MULTISPECIES: aminodeoxychorismate lyase [Enterobacteriaceae]	100	99.6	1.00e-193
NZ_CP132594.1_1063|1153519|1154541|1|ID=1_1063;partial=00;start_type=ATG;rbs_motif=3Base/5BMM;rbs_spacer=13-15bp;gc_cont=0.507	WP_000756827.1 MULTISPECIES: cell division protein YceG [Enterobacteriaceae]	100	99.7	4.46e-244
NZ_CP132594.1_1064|1154531|1155172|1|ID=1_1064;partial=00;start_type=ATG;rbs_motif=AGGA;rbs_spacer=5-10bp;gc_cont=0.540	WP_001257000.1 MULTISPECIES: dTMP kinase [Enterobacteriaceae]	100	99.5	2.75e-145
NZ_CP132594.1_1065|1155169|1156173|1|ID=1_1065;partial=00;start_type=ATG;rbs_motif=AGGAG;rbs_spacer=5-10bp;gc_cont=0.540	WP_001267956.1 MULTISPECIES: DNA polymerase III subunit delta' [Enterobacteriaceae]	100	99.7	5.88e-246
NZ_CP132594.1_1066|1156184|1156981|1|ID=1_1066;partial=00;start_type=ATG;rbs_motif=GGA/GAG/AGG;rbs_spacer=5-10bp;gc_cont=0.509	WP_000480245.1 MULTISPECIES: metal-dependent hydrolase [Enterobacteriaceae]	100	99.6	5.78e-191
NZ_CP132594.1_1067|1157276|1158709|1|ID=1_1067;partial=00;start_type=ATG;rbs_motif=AGGAG/GGAGG;rbs_spacer=11-12bp;gc_cont=0.526	WP_000475719.1 MULTISPECIES: PTS glucose transporter subunit IIBC [Enterobacteriaceae]	100	99.8	0.0
NZ_CP132594.1_1068|1158769|1160958|-1|ID=1_1068;partial=00;start_type=ATG;rbs_motif=GGA/GAG/AGG;rbs_spacer=5-10bp;gc_cont=0.500	WP_000953441.1 MULTISPECIES: ferric-rhodotorulic acid/ferric-coprogen receptor FhuE [Enterobacteriaceae]	100	99.9	0.0
NZ_CP132594.1_1069|1161292|1161651|1|ID=1_1069;partial=00;start_type=GTG;rbs_motif=AGGA;rbs_spacer=5-10bp;gc_cont=0.506	WP_000807125.1 MULTISPECIES: purine nucleoside phosphoramidase [Enterobacteriaceae]	100	99.2	1.92e-79
NZ_CP132594.1_1070|1161654|1162031|1|ID=1_1070;partial=00;start_type=ATG;rbs_motif=GGA/GAG/AGG;rbs_spacer=5-10bp;gc_cont=0.495	WP_001225295.1 MULTISPECIES: YcfL family protein [Enterobacteriaceae]	100	99.2	9.66e-85
NZ_CP132594.1_1071|1162045|1162686|1|ID=1_1071;partial=00;start_type=ATG;rbs_motif=GGA/GAG/AGG;rbs_spacer=11-12bp;gc_cont=0.564	WP_095158073.1 penicillin-binding protein activator LpoB [Escherichia coli]	99.5	99.5	6.54e-128
NZ_CP132594.1_1072|1162667|1163491|1|ID=1_1072;partial=00;start_type=GTG;rbs_motif=GGA/GAG/AGG;rbs_spacer=5-10bp;gc_cont=0.533	WP_001116592.1 MULTISPECIES: thiamine kinase [Enterobacteriaceae]	100	99.6	5.86e-209
NZ_CP132594.1_1073|1163502|1164527|1|ID=1_1073;partial=00;start_type=GTG;rbs_motif=AGGAG;rbs_spacer=5-10bp;gc_cont=0.530	WP_000529320.1 MULTISPECIES: beta-N-acetylhexosaminidase [Enterobacteriaceae]	100	99.7	1.68e-244
NZ_CP132594.1_1074|1164550|1165092|1|ID=1_1074;partial=00;start_type=ATG;rbs_motif=GGAG/GAGG;rbs_spacer=5-10bp;gc_cont=0.466	WP_000587933.1 MULTISPECIES: alpha/beta hydrolase YcfP [Enterobacteriaceae]	100	99.4	8.18e-133
NZ_CP132594.1_1075|1165492|1166796|1|ID=1_1075;partial=00;start_type=TTG;rbs_motif=AGxAGG/AGGxGG;rbs_spacer=5-10bp;gc_cont=0.530	WP_000211045.1 MULTISPECIES: NADH-quinone dehydrogenase [Enterobacteriaceae]	100	99.8	1.43e-315
NZ_CP132594.1_1076|1167006|1167545|1|ID=1_1076;partial=00;start_type=GTG;rbs_motif=AGGAG;rbs_spacer=5-10bp;gc_cont=0.537	WP_414225485.1 glycine zipper 2TM domain-containing protein [Escherichia coli]	93.3	99.4	1.14e-109
NZ_CP132594.1_1077|1167607|1168302|-1|ID=1_1077;partial=00;start_type=GTG;rbs_motif=GGA/GAG/AGG;rbs_spacer=5-10bp;gc_cont=0.503	WP_001362176.1 TetR family copper-responsive transcriptional repressor ComR [Escherichia coli]	99.1	99.6	1.16e-164
NZ_CP132594.1_1078|1168480|1168737|1|ID=1_1078;partial=00;start_type=ATG;rbs_motif=GGA/GAG/AGG;rbs_spacer=5-10bp;gc_cont=0.473	WP_000800153.1 MULTISPECIES: multiple stress resistance protein BhsA [Enterobacteriaceae]	100	98.8	1.24e-48
NZ_CP132594.1_1079|1168819|1169778|-1|ID=1_1079;partial=00;start_type=ATG;rbs_motif=GGA/GAG/AGG;rbs_spacer=5-10bp;gc_cont=0.532	WP_001350500.1 MULTISPECIES: L,D-transpeptidase LdtC [Escherichia]	100	99.7	3.20e-229
NZ_CP132594.1_1080|1169925|1173419|-1|ID=1_1080;partial=00;start_type=ATG;rbs_motif=None;rbs_spacer=None;gc_cont=0.546	WP_115801846.1 transcription-repair coupling factor [Escherichia coli]	99.6	99.9	0.0
NZ_CP132594.1_1081|1173499|1174572|-1|ID=1_1081;partial=00;start_type=ATG;rbs_motif=GGA/GAG/AGG;rbs_spacer=11-12bp;gc_cont=0.494	WP_000810231.1 MULTISPECIES: acyltransferase family protein [Enterobacteriaceae]	100	99.7	1.79e-238
NZ_CP132594.1_1082|1174834|1176033|1|ID=1_1082;partial=00;start_type=ATG;rbs_motif=GGA/GAG/AGG;rbs_spacer=3-4bp;gc_cont=0.542	WP_115187543.1 MULTISPECIES: lipoprotein-releasing ABC transporter permease subunit LolC [Enterobacteriaceae]	100	99.8	8.60e-265
NZ_CP132594.1_1083|1176026|1176727|1|ID=1_1083;partial=00;start_type=ATG;rbs_motif=GGAG/GAGG;rbs_spacer=5-10bp;gc_cont=0.551	WP_001033694.1 MULTISPECIES: lipoprotein-releasing ABC transporter ATP-binding protein LolD [Enterobacteriaceae]	100	99.6	1.77e-160
NZ_CP132594.1_1084|1176733|1177971|1|ID=1_1084;partial=00;start_type=ATG;rbs_motif=GGAG/GAGG;rbs_spacer=5-10bp;gc_cont=0.518	WP_001251348.1 MULTISPECIES: lipoprotein-releasing ABC transporter permease subunit LolE [Enterobacteriaceae]	100	99.8	9.06e-290
NZ_CP132594.1_1085|1178000|1178911|1|ID=1_1085;partial=00;start_type=ATG;rbs_motif=AGGAG;rbs_spacer=5-10bp;gc_cont=0.527	WP_000291270.1 MULTISPECIES: N-acetylglucosamine kinase [Enterobacteriaceae]	100	99.7	8.48e-228
NZ_CP132594.1_1086|1178927|1179766|1|ID=1_1086;partial=00;start_type=ATG;rbs_motif=GGAG/GAGG;rbs_spacer=5-10bp;gc_cont=0.518	WP_000952737.1 MULTISPECIES: Sir2 family NAD+-dependent deacetylase [Enterobacteriaceae]	100	99.6	3.64e-201
NZ_CP132594.1_1087|1179886|1180674|-1|ID=1_1087;partial=00;start_type=ATG;rbs_motif=GGA/GAG/AGG;rbs_spacer=5-10bp;gc_cont=0.427	WP_000713462.1 MULTISPECIES: TPM domain-containing protein [Enterobacteriaceae]	100	99.6	8.77e-180
NZ_CP132594.1_1088|1180671|1181132|-1|ID=1_1088;partial=00;start_type=ATG;rbs_motif=AGGA;rbs_spacer=5-10bp;gc_cont=0.433	WP_000076376.1 MULTISPECIES: DUF3592 domain-containing protein [Enterobacteriaceae]	100	99.4	3.11e-108
NZ_CP132594.1_1089|1181190|1182236|-1|ID=1_1089;partial=00;start_type=ATG;rbs_motif=GGA/GAG/AGG;rbs_spacer=5-10bp;gc_cont=0.507	WP_000759317.1 MULTISPECIES: spermidine/putrescine ABC transporter substrate-binding protein PotD [Enterobacteriaceae]	100	99.7	4.75e-259
NZ_CP132594.1_1090|1182233|1183027|-1|ID=1_1090;partial=00;start_type=ATG;rbs_motif=AGxAGG/AGGxGG;rbs_spacer=5-10bp;gc_cont=0.503	WP_000580316.1 MULTISPECIES: spermidine/putrescine ABC transporter permease PotC [Enterobacteriaceae]	100	99.6	2.21e-174
NZ_CP132594.1_1091|1183024|1183881|-1|ID=1_1091;partial=00;start_type=ATG;rbs_motif=AGGAG/GGAGG;rbs_spacer=11-12bp;gc_cont=0.503	WP_000799401.1 MULTISPECIES: spermidine/putrescine ABC transporter permease PotB [Enterobacteriaceae]	100	99.7	2.83e-192
NZ_CP132594.1_1092|1183865|1185001|-1|ID=1_1092;partial=00;start_type=ATG;rbs_motif=None;rbs_spacer=None;gc_cont=0.508	WP_000531594.1 MULTISPECIES: spermidine/putrescine ABC transporter ATP-binding protein PotA [Enterobacteriaceae]	100	99.7	6.38e-270
NZ_CP132594.1_1093|1185251|1186477|1|ID=1_1093;partial=00;start_type=ATG;rbs_motif=GGAG/GAGG;rbs_spacer=5-10bp;gc_cont=0.499	WP_000359434.1 MULTISPECIES: peptidase T [Enterobacteriaceae]	100	99.8	8.87e-299
NZ_CP132594.1_1094|1186526|1187647|-1|ID=1_1094;partial=00;start_type=ATG;rbs_motif=GGA/GAG/AGG;rbs_spacer=5-10bp;gc_cont=0.539	WP_000456506.1 MULTISPECIES: [50S ribosomal protein L16]-arginine 3-hydroxylase [Enterobacteriaceae]	100	99.7	8.91e-288
NZ_CP132594.1_1095|1187723|1189183|-1|ID=1_1095;partial=00;start_type=ATG;rbs_motif=None;rbs_spacer=None;gc_cont=0.514	WP_000735412.1 MULTISPECIES: two-component system sensor histidine kinase PhoQ [Enterobacteriaceae]	100	99.8	0.0
NZ_CP132594.1_1096|1189183|1189854|-1|ID=1_1096;partial=00;start_type=ATG;rbs_motif=GGAG/GAGG;rbs_spacer=5-10bp;gc_cont=0.475	WP_001265471.1 MULTISPECIES: two-component system response regulator PhoP [Enterobacteriaceae]	100	99.6	1.21e-153
NZ_CP132594.1_1097|1190023|1191393|-1|ID=1_1097;partial=00;start_type=ATG;rbs_motif=GGAG/GAGG;rbs_spacer=5-10bp;gc_cont=0.524	WP_000423742.1 MULTISPECIES: adenylosuccinate lyase [Enterobacteriaceae]	100	99.8	0.0
NZ_CP132594.1_1098|1191397|1192038|-1|ID=1_1098;partial=00;start_type=GTG;rbs_motif=AGGA;rbs_spacer=5-10bp;gc_cont=0.572	WP_001297479.1 MULTISPECIES: high frequency lysogenization protein HflD [Bacteria]	100	99.5	1.85e-143
NZ_CP132594.1_1099|1192074|1193180|-1|ID=1_1099;partial=00;start_type=ATG;rbs_motif=GGA/GAG/AGG;rbs_spacer=5-10bp;gc_cont=0.537	WP_001297484.1 MULTISPECIES: tRNA 2-thiouridine(34) synthase MnmA [Enterobacteriaceae]	100	99.7	6.40e-274
NZ_CP132594.1_1100|1193234|1193695|-1|ID=1_1100;partial=00;start_type=ATG;rbs_motif=AGGA;rbs_spacer=5-10bp;gc_cont=0.500	WP_000476093.1 MULTISPECIES: phosphatase NudJ [Bacteria]	100	99.4	1.37e-111
NZ_CP132594.1_1101|1193705|1194358|-1|ID=1_1101;partial=00;start_type=ATG;rbs_motif=GGA/GAG/AGG;rbs_spacer=5-10bp;gc_cont=0.512	WP_001248691.1 MULTISPECIES: 23S rRNA pseudouridine(2457) synthase RluE [Enterobacteriaceae]	100	99.5	1.31e-154
NZ_CP132594.1_1102|1194530|1195780|1|ID=1_1102;partial=00;start_type=ATG;rbs_motif=AGGAG;rbs_spacer=5-10bp;gc_cont=0.502	WP_000444484.1 MULTISPECIES: NADP-dependent isocitrate dehydrogenase [Enterobacteriaceae]	100	99.8	1.38e-306
NZ_CP132594.1_1103|1196274|1196939|-1|ID=1_1103;partial=00;start_type=ATG;rbs_motif=None;rbs_spacer=None;gc_cont=0.350	WP_000241967.1 MULTISPECIES: class I SAM-dependent methyltransferase [Escherichia]	100	99.5	6.49e-157
NZ_CP132594.1_1104|1196940|1197635|-1|ID=1_1104;partial=00;start_type=ATG;rbs_motif=GGA/GAG/AGG;rbs_spacer=5-10bp;gc_cont=0.310	WP_010723094.1 MULTISPECIES: protein YmfE [Escherichia]	100	99.6	4.17e-161
NZ_CP132594.1_1105|1198102|1198995|1|ID=1_1105;partial=00;start_type=ATG;rbs_motif=GGAG/GAGG;rbs_spacer=5-10bp;gc_cont=0.368	WP_001257372.1 MULTISPECIES: cell death peptidase Lit [Gammaproteobacteria]	100	99.7	1.24e-217
NZ_CP132594.1_1106|1199086|1200213|-1|ID=1_1106;partial=00;start_type=ATG;rbs_motif=GGA/GAG/AGG;rbs_spacer=5-10bp;gc_cont=0.447	WP_000741310.1 MULTISPECIES: site-specific integrase [Escherichia]	100	99.7	5.04e-270
NZ_CP132594.1_1107|1200194|1200439|-1|ID=1_1107;partial=00;start_type=ATG;rbs_motif=GGA/GAG/AGG;rbs_spacer=5-10bp;gc_cont=0.435	WP_000939945.1 MULTISPECIES: excisionase-like protein from lambdoid prophage 14 [Bacteria]	100	98.8	3.36e-51
NZ_CP132594.1_1108|1200904|1201245|1|ID=1_1108;partial=00;start_type=ATG;rbs_motif=AGGA;rbs_spacer=5-10bp;gc_cont=0.386	WP_010723095.1 MULTISPECIES: YmfI family phage protein [Escherichia]	100	99.1	9.74e-77
NZ_CP132594.1_1109|1201183|1201491|-1|ID=1_1109;partial=00;start_type=ATG;rbs_motif=GGAG/GAGG;rbs_spacer=5-10bp;gc_cont=0.469	WP_001005353.1 MULTISPECIES: protein YmfJ [Escherichia]	100	99.0	1.20e-65
NZ_CP132594.1_1110|1201666|1202340|-1|ID=1_1110;partial=00;start_type=ATG;rbs_motif=3Base/5BMM;rbs_spacer=13-15bp;gc_cont=0.441	WP_000848748.1 MULTISPECIES: LexA family protein [Enterobacteriaceae]	100	99.6	2.10e-168
NZ_CP132594.1_1111|1202431|1202631|1|ID=1_1111;partial=00;start_type=ATG;rbs_motif=GGAGG;rbs_spacer=5-10bp;gc_cont=0.428	WP_000649480.1 MULTISPECIES: YdaS family helix-turn-helix protein [Enterobacteriaceae]	100	98.5	3.96e-41
NZ_CP132594.1_1112|1202675|1203232|1|ID=1_1112;partial=00;start_type=GTG;rbs_motif=GGAG/GAGG;rbs_spacer=5-10bp;gc_cont=0.496	WP_000515837.1 MULTISPECIES: protein YmfL [Escherichia]	100	99.5	2.24e-128
NZ_CP132594.1_1113|1203229|1203567|1|ID=1_1113;partial=00;start_type=ATG;rbs_motif=GGAG/GAGG;rbs_spacer=5-10bp;gc_cont=0.499	WP_001087383.1 cell division inhibitor YmfM [Escherichia coli]	96.4	99.1	9.79e-72
NZ_CP132594.1_1114|1203577|1204944|1|ID=1_1114;partial=00;start_type=ATG;rbs_motif=GGAG/GAGG;rbs_spacer=5-10bp;gc_cont=0.543	WP_285002800.1 terminase large subunit, partial [Escherichia coli]	99.7	82.9	3.62e-281
NZ_CP132594.1_1115|1204956|1205138|1|ID=1_1115;partial=00;start_type=ATG;rbs_motif=GGAG/GAGG;rbs_spacer=5-10bp;gc_cont=0.601	WP_000605606.1 MULTISPECIES: protein YmfR [Enterobacteriaceae]	100	98.4	7.92e-34
NZ_CP132594.1_1116|1205138|1205611|1|ID=1_1116;partial=00;start_type=GTG;rbs_motif=GGAGG;rbs_spacer=5-10bp;gc_cont=0.563	WP_334395058.1 phage portal protein, partial [Escherichia coli]	95.9	91.8	1.72e-95
NZ_CP132594.1_1117|1205580|1206329|1|ID=1_1117;partial=00;start_type=GTG;rbs_motif=None;rbs_spacer=None;gc_cont=0.576	WP_250189088.1 baseplate J/gp47 family protein, partial [Escherichia coli]	98.8	99.6	1.34e-173
NZ_CP132594.1_1118|1206320|1206904|1|ID=1_1118;partial=00;start_type=ATG;rbs_motif=GGA/GAG/AGG;rbs_spacer=5-10bp;gc_cont=0.573	WP_000383574.1 MULTISPECIES: YmfQ family protein [Escherichia]	100	99.5	7.46e-145
NZ_CP132594.1_1119|1206908|1207696|1|ID=1_1119;partial=00;start_type=ATG;rbs_motif=GGAG/GAGG;rbs_spacer=5-10bp;gc_cont=0.501	WP_410234559.1 phage tail protein [Escherichia sp. WS539]	98.1	99.6	1.26e-188
NZ_CP132594.1_1120|1207696|1208298|1|ID=1_1120;partial=00;start_type=ATG;rbs_motif=GGAG/GAGG;rbs_spacer=5-10bp;gc_cont=0.478	WP_000548498.1 MULTISPECIES: tail fiber assembly protein [Escherichia]	100	99.5	1.81e-139
NZ_CP132594.1_1121|1208270|1208902|-1|ID=1_1121;partial=00;start_type=ATG;rbs_motif=GGxGG;rbs_spacer=3-4bp;gc_cont=0.431	WP_010723096.1 MULTISPECIES: tail fiber assembly protein [Enterobacteriaceae]	100	64.9	1.37e-95
NZ_CP132594.1_1122|1209092|1209646|1|ID=1_1122;partial=00;start_type=ATG;rbs_motif=AGxAGG/AGGxGG;rbs_spacer=5-10bp;gc_cont=0.488	WP_000905001.1 MULTISPECIES: site-specific DNA recombinase [Escherichia]	100	99.5	3.44e-127
NZ_CP132594.1_1123|1209753|1210586|1|ID=1_1123;partial=00;start_type=ATG;rbs_motif=None;rbs_spacer=None;gc_cont=0.384	WP_000557907.1 MULTISPECIES: 5-methylcytosine-specific endonuclease McrA [Bacteria]	100	99.6	3.38e-205
NZ_CP132594.1_1124|1210820|1210984|1|ID=1_1124;partial=00;start_type=ATG;rbs_motif=None;rbs_spacer=None;gc_cont=0.467	WP_000943927.1 isocitrate/isopropylmalate family dehydrogenase [Escherichia coli]	100	98.2	2.95e-31
NZ_CP132594.1_1125|1212110|1212514|-1|ID=1_1125;partial=00;start_type=ATG;rbs_motif=AGGA/GGAG/GAGG;rbs_spacer=11-12bp;gc_cont=0.368	WP_000373101.1 MULTISPECIES: DUF1398 domain-containing protein [Enterobacteriaceae]	100	99.3	4.46e-92
NZ_CP132594.1_1126|1212735|1213466|-1|ID=1_1126;partial=00;start_type=GTG;rbs_motif=AGGAGG;rbs_spacer=3-4bp;gc_cont=0.485	WP_000332303.1 MULTISPECIES: DNA-binding transcriptional repressor BluR [Enterobacteriaceae]	100	99.6	3.91e-178
NZ_CP132594.1_1127|1213671|1214882|-1|ID=1_1127;partial=00;start_type=ATG;rbs_motif=GGA/GAG/AGG;rbs_spacer=5-10bp;gc_cont=0.436	WP_001299269.1 MULTISPECIES: blue light-responsive regulator BluF [Enterobacteriaceae]	100	99.8	8.39e-290
NZ_CP132594.1_1128|1215196|1215432|1|ID=1_1128;partial=00;start_type=ATG;rbs_motif=GGAG/GAGG;rbs_spacer=5-10bp;gc_cont=0.418	WP_000554140.1 MULTISPECIES: regulatory protein YcgZ [Bacteria]	100	98.7	1.52e-48
NZ_CP132594.1_1129|1215776|1216042|1|ID=1_1129;partial=00;start_type=ATG;rbs_motif=GGAG/GAGG;rbs_spacer=5-10bp;gc_cont=0.348	WP_000888772.1 MULTISPECIES: biofilm/acid-resistance regulator AriR [Enterobacteriaceae]	100	98.9	9.58e-52
NZ_CP132594.1_1130|1216155|1216403|1|ID=1_1130;partial=00;start_type=ATG;rbs_motif=GGAG/GAGG;rbs_spacer=5-10bp;gc_cont=0.357	WP_001065752.1 MULTISPECIES: protein YmgC [Enterobacteriaceae]	100	98.8	1.72e-49
NZ_CP132594.1_1131|1216735|1218258|1|ID=1_1131;partial=00;start_type=ATG;rbs_motif=GGA/GAG/AGG;rbs_spacer=5-10bp;gc_cont=0.446	WP_001246499.1 MULTISPECIES: EAL domain-containing protein [Escherichia]	100	99.8	0.0
NZ_CP132594.1_1132|1218390|1218608|1|ID=1_1132;partial=00;start_type=ATG;rbs_motif=4Base/6BMM;rbs_spacer=13-15bp;gc_cont=0.402	WP_001065861.1 MULTISPECIES: cell division-associated protein YmgF [Enterobacteriaceae]	100	98.6	2.88e-39
NZ_CP132594.1_1133|1219008|1220528|1|ID=1_1133;partial=00;start_type=ATG;rbs_motif=GGA/GAG/AGG;rbs_spacer=5-10bp;gc_cont=0.385	WP_343105056.1 autotransporter YcgH, partial [Escherichia coli]	100	99.8	0.0
NZ_CP132594.1_1134|1220613|1221629|1|ID=1_1134;partial=00;start_type=GTG;rbs_motif=None;rbs_spacer=None;gc_cont=0.508	WP_353051747.1 autotransporter outer membrane beta-barrel domain-containing protein [Escherichia coli]	99.7	99.7	3.73e-247
NZ_CP132594.1_1135|1221712|1222041|-1|ID=1_1135;partial=00;start_type=ATG;rbs_motif=AGGA;rbs_spacer=5-10bp;gc_cont=0.455	WP_001295611.1 MULTISPECIES: YmgD family protein [Enterobacteriaceae]	100	99.1	8.84e-69
NZ_CP132594.1_1136|1222051|1222335|-1|ID=1_1136;partial=00;start_type=ATG;rbs_motif=None;rbs_spacer=None;gc_cont=0.540	WP_000726970.1 MULTISPECIES: YMGG-like glycine zipper-containing protein [Shigella]	98.3	61.1	5.33e-16
NZ_CP132594.1_1137|1223686|1223952|-1|ID=1_1137;partial=00;start_type=ATG;rbs_motif=GGAGG;rbs_spacer=5-10bp;gc_cont=0.434	WP_001185665.1 MULTISPECIES: cell division topological specificity factor MinE [Pseudomonadota]	100	98.9	1.65e-52
NZ_CP132594.1_1138|1223956|1224768|-1|ID=1_1138;partial=00;start_type=ATG;rbs_motif=AGGA;rbs_spacer=5-10bp;gc_cont=0.499	WP_000101055.1 MULTISPECIES: septum site-determining protein MinD [Enterobacteriaceae]	100	99.6	7.51e-185
NZ_CP132594.1_1139|1224792|1225487|-1|ID=1_1139;partial=00;start_type=ATG;rbs_motif=GGA/GAG/AGG;rbs_spacer=5-10bp;gc_cont=0.513	WP_001301105.1 MULTISPECIES: septum site-determining protein MinC [Enterobacteriaceae]	100	99.6	1.78e-159
NZ_CP132594.1_1140|1226007|1226375|1|ID=1_1140;partial=00;start_type=ATG;rbs_motif=AGGA;rbs_spacer=5-10bp;gc_cont=0.423	WP_001056840.1 MULTISPECIES: YcgJ family protein [Pseudomonadati]	100	99.2	1.62e-86
NZ_CP132594.1_1141|1226478|1226879|-1|ID=1_1141;partial=00;start_type=ATG;rbs_motif=AGGAG;rbs_spacer=5-10bp;gc_cont=0.430	WP_000695215.1 MULTISPECIES: g-type lysoyme inhibitor PliG [Enterobacteriaceae]	100	99.3	2.70e-88
NZ_CP132594.1_1142|1227121|1227414|1|ID=1_1142;partial=00;start_type=ATG;rbs_motif=GGA/GAG/AGG;rbs_spacer=5-10bp;gc_cont=0.439	WP_001295992.1 MULTISPECIES: YcgL domain-containing protein [Enterobacteriaceae]	100	99.0	8.03e-64
NZ_CP132594.1_1143|1227486|1228145|1|ID=1_1143;partial=00;start_type=ATG;rbs_motif=GGAG/GAGG;rbs_spacer=5-10bp;gc_cont=0.520	WP_000284280.1 MULTISPECIES: fumarylacetoacetate hydrolase family protein [Enterobacteriaceae]	100	99.5	1.17e-158
NZ_CP132594.1_1144|1228237|1228683|1|ID=1_1144;partial=00;start_type=ATG;rbs_motif=GGA/GAG/AGG;rbs_spacer=5-10bp;gc_cont=0.472	WP_001306825.1 MULTISPECIES: YcgN family cysteine cluster protein [Enterobacteriaceae]	100	99.3	1.38e-113
NZ_CP132594.1_1145|1228890|1229801|-1|ID=1_1145;partial=00;start_type=ATG;rbs_motif=GGAG/GAGG;rbs_spacer=5-10bp;gc_cont=0.410	WP_001336523.1 MULTISPECIES: hemolysin HlyE [Enterobacteriaceae]	100	99.7	3.23e-207
NZ_CP132594.1_1146|1230174|1230593|1|ID=1_1146;partial=00;start_type=ATG;rbs_motif=GGA/GAG/AGG;rbs_spacer=5-10bp;gc_cont=0.481	WP_000897378.1 MULTISPECIES: translesion error-prone DNA polymerase V autoproteolytic subunit [Enterobacteriaceae]	100	99.3	4.57e-92
NZ_CP132594.1_1147|1230593|1231861|1|ID=1_1147;partial=00;start_type=ATG;rbs_motif=GGA/GAG/AGG;rbs_spacer=5-10bp;gc_cont=0.510	WP_000457616.1 MULTISPECIES: DNA polymerase V catalytic protein [Enterobacteriaceae]	100	99.8	2.41e-310
NZ_CP132594.1_1148|1231907|1232437|-1|ID=1_1148;partial=00;start_type=ATG;rbs_motif=GGA/GAG/AGG;rbs_spacer=5-10bp;gc_cont=0.524	WP_000943459.1 MULTISPECIES: disulfide bond formation protein DsbB [Enterobacteriaceae]	100	99.4	7.60e-127
NZ_CP132594.1_1149|1232583|1234124|-1|ID=1_1149;partial=00;start_type=ATG;rbs_motif=GGA/GAG/AGG;rbs_spacer=5-10bp;gc_cont=0.529	WP_000406391.1 MULTISPECIES: Na(+)/H(+) antiporter NhaB [Enterobacteriaceae]	100	99.8	0.0
NZ_CP132594.1_1150|1234345|1235064|1|ID=1_1150;partial=00;start_type=ATG;rbs_motif=GGA/GAG/AGG;rbs_spacer=5-10bp;gc_cont=0.512	WP_000234823.1 MULTISPECIES: fatty acid metabolism transcriptional regulator FadR [Enterobacteriaceae]	100	99.6	5.34e-174
NZ_CP132594.1_1151|1235116|1236648|-1|ID=1_1151;partial=00;start_type=ATG;rbs_motif=GGAG/GAGG;rbs_spacer=5-10bp;gc_cont=0.498	WP_000190854.1 MULTISPECIES: SpoVR family protein [Enterobacteriaceae]	100	99.8	0.0
NZ_CP132594.1_1152|1236978|1238276|1|ID=1_1152;partial=00;start_type=ATG;rbs_motif=GGAG/GAGG;rbs_spacer=5-10bp;gc_cont=0.563	WP_001266908.1 MULTISPECIES: D-amino acid dehydrogenase [Enterobacteriaceae]	100	99.8	0.0
NZ_CP132594.1_1153|1238286|1239356|1|ID=1_1153;partial=00;start_type=ATG;rbs_motif=AGGA;rbs_spacer=5-10bp;gc_cont=0.580	WP_000197881.1 MULTISPECIES: catabolic alanine racemase DadX [Enterobacteriaceae]	100	99.7	1.87e-260
NZ_CP132594.1_1154|1239459|1239608|1|ID=1_1154;partial=00;start_type=ATG;rbs_motif=GGA/GAG/AGG;rbs_spacer=5-10bp;gc_cont=0.447	WP_247167767.1 hypothetical protein, partial [Escherichia coli]	100	98.0	6.11e-26
NZ_CP132594.1_1155|1239742|1241478|-1|ID=1_1155;partial=00;start_type=TTG;rbs_motif=AGGAG;rbs_spacer=5-10bp;gc_cont=0.524	WP_000340194.1 MULTISPECIES: potassium/proton antiporter [Enterobacteriaceae]	100	99.8	0.0
NZ_CP132594.1_1156|1241573|1242487|-1|ID=1_1156;partial=00;start_type=ATG;rbs_motif=AGGA;rbs_spacer=5-10bp;gc_cont=0.531	WP_000051560.1 MULTISPECIES: muramoyltetrapeptide carboxypeptidase [Enterobacteriaceae]	100	99.7	2.07e-224
NZ_CP132594.1_1157|1242587|1243198|1|ID=1_1157;partial=00;start_type=GTG;rbs_motif=AGGA;rbs_spacer=5-10bp;gc_cont=0.520	WP_001301104.1 MULTISPECIES: membrane-bound lytic murein transglycosylase EmtA [Enterobacteriaceae]	100	99.5	2.57e-145
NZ_CP132594.1_1158|1243200|1243934|-1|ID=1_1158;partial=00;start_type=GTG;rbs_motif=AGGAG;rbs_spacer=5-10bp;gc_cont=0.509	WP_000020169.1 MULTISPECIES: flagellar brake protein YcgR [Enterobacteriaceae]	100	99.6	1.78e-170
NZ_CP132594.1_1159|1244135|1244389|1|ID=1_1159;partial=00;start_type=ATG;rbs_motif=GGAG/GAGG;rbs_spacer=5-10bp;gc_cont=0.533	WP_001310727.1 MULTISPECIES: GlsB/YeaQ/YmgE family stress response membrane protein [Enterobacteriaceae]	100	98.8	1.40e-49
NZ_CP132594.1_1160|1244567|1245007|1|ID=1_1160;partial=00;start_type=GTG;rbs_motif=None;rbs_spacer=None;gc_cont=0.415	WP_000615067.1 MULTISPECIES: protein YcgY [Enterobacteriaceae]	100	99.3	3.84e-101
NZ_CP132594.1_1161|1245086|1246783|-1|ID=1_1161;partial=00;start_type=ATG;rbs_motif=AGGAG;rbs_spacer=5-10bp;gc_cont=0.523	WP_000841714.1 MULTISPECIES: alpha,alpha-trehalase [Enterobacteriaceae]	100	99.8	0.0
NZ_CP132594.1_1162|1247103|1248521|-1|ID=1_1162;partial=00;start_type=ATG;rbs_motif=AGGA;rbs_spacer=5-10bp;gc_cont=0.502	WP_001301101.1 MULTISPECIES: dihydroxyacetone kinase phosphoryl donor subunit DhaM [Enterobacteriaceae]	100	99.8	0.0
NZ_CP132594.1_1163|1248532|1249164|-1|ID=1_1163;partial=00;start_type=ATG;rbs_motif=AGGAG;rbs_spacer=5-10bp;gc_cont=0.536	WP_000059411.1 MULTISPECIES: dihydroxyacetone kinase subunit DhaL [Enterobacteriaceae]	100	99.5	4.93e-142
NZ_CP132594.1_1164|1249175|1250245|-1|ID=1_1164;partial=00;start_type=ATG;rbs_motif=GGAG/GAGG;rbs_spacer=5-10bp;gc_cont=0.530	WP_000733715.1 MULTISPECIES: dihydroxyacetone kinase subunit DhaK [Enterobacteriaceae]	100	99.7	3.93e-262
NZ_CP132594.1_1165|1250473|1252392|1|ID=1_1165;partial=00;start_type=ATG;rbs_motif=GGA/GAG/AGG;rbs_spacer=5-10bp;gc_cont=0.515	WP_001350505.1 MULTISPECIES: dihydroxyacetone kinase operon transcriptional regulator DhaR [Enterobacteriaceae]	100	99.8	0.0
NZ_CP132594.1_1166|1252492|1255359|-1|ID=1_1166;partial=00;start_type=ATG;rbs_motif=AGGA;rbs_spacer=5-10bp;gc_cont=0.498	WP_369067798.1 autotransporter outer membrane beta-barrel domain-containing protein [Escherichia coli]	98.6	99.9	0.0
NZ_CP132594.1_1167|1255704|1255883|1|ID=1_1167;partial=00;start_type=ATG;rbs_motif=GGA/GAG/AGG;rbs_spacer=5-10bp;gc_cont=0.344	WP_000280737.1 MULTISPECIES: hypothetical protein [Escherichia]	100	98.3	1.81e-34
NZ_CP132594.1_1168|1256128|1257219|-1|ID=1_1168;partial=00;start_type=ATG;rbs_motif=GGA/GAG/AGG;rbs_spacer=11-12bp;gc_cont=0.510	WP_000505866.1 MULTISPECIES: redox-regulated ATPase YchF [Enterobacteriaceae]	100	99.7	1.53e-258
NZ_CP132594.1_1169|1257336|1257920|-1|ID=1_1169;partial=00;start_type=GTG;rbs_motif=AGGA;rbs_spacer=5-10bp;gc_cont=0.499	WP_000152933.1 MULTISPECIES: aminoacyl-tRNA hydrolase [Enterobacteriaceae]	100	99.5	1.14e-139
NZ_CP132594.1_1170|1258198|1258476|1|ID=1_1170;partial=00;start_type=ATG;rbs_motif=GGAGG;rbs_spacer=5-10bp;gc_cont=0.530	WP_000823885.1 MULTISPECIES: stress-induced protein YchH [Bacteria]	100	98.9	2.19e-61
NZ_CP132594.1_1171|1258531|1260183|-1|ID=1_1171;partial=00;start_type=ATG;rbs_motif=None;rbs_spacer=None;gc_cont=0.551	WP_338907121.1 C4-dicarboxylic acid transporter DauA [Escherichia coli]	100	99.8	0.0
NZ_CP132594.1_1172|1260335|1261348|-1|ID=1_1172;partial=00;start_type=ATG;rbs_motif=GGA/GAG/AGG;rbs_spacer=5-10bp;gc_cont=0.527	WP_001119392.1 ribose-phosphate diphosphokinase [Escherichia coli]	100	99.7	1.48e-236
NZ_CP132594.1_1173|1261433|1262284|-1|ID=1_1173;partial=00;start_type=ATG;rbs_motif=GGA/GAG/AGG;rbs_spacer=5-10bp;gc_cont=0.534	WP_001260332.1 MULTISPECIES: 4-(cytidine 5'-diphospho)-2-C-methyl-D-erythritol kinase [Enterobacteriaceae]	100	99.6	1.09e-204
NZ_CP132594.1_1174|1262284|1262907|-1|ID=1_1174;partial=00;start_type=ATG;rbs_motif=AGGA/GGAG/GAGG;rbs_spacer=11-12bp;gc_cont=0.516	WP_001130692.1 MULTISPECIES: lipoprotein insertase outer membrane protein LolB [Enterobacteriaceae]	100	99.5	3.95e-151
NZ_CP132594.1_1175|1263121|1264377|1|ID=1_1175;partial=00;start_type=ATG;rbs_motif=None;rbs_spacer=None;gc_cont=0.543	WP_001299679.1 MULTISPECIES: glutamyl-tRNA reductase [Enterobacteriaceae]	100	99.8	1.75e-285
