NZ_CP132594.1_2105|2231507|2232226|1|ID=1_2105;partial=00;start_type=ATG;rbs_motif=GGA/GAG/AGG;rbs_spacer=5-10bp;gc_cont=0.478	WP_000920064.1 MULTISPECIES: outer membrane permeability protein SanA [Enterobacteriaceae]	100	99.6	1.35e-167
NZ_CP132594.1_2106|2232229|2232468|1|ID=1_2106;partial=00;start_type=ATG;rbs_motif=AGGA;rbs_spacer=5-10bp;gc_cont=0.429	WP_000383096.1 MULTISPECIES: DUF2542 family protein [Enterobacteriaceae]	100	98.8	1.19e-50
NZ_CP132594.1_2107|2232662|2233900|1|ID=1_2107;partial=00;start_type=ATG;rbs_motif=AGGA;rbs_spacer=5-10bp;gc_cont=0.515	WP_001136389.1 MULTISPECIES: NAD-dependent dihydropyrimidine dehydrogenase subunit PreT [Enterobacteriaceae]	100	99.8	2.98e-299
NZ_CP132594.1_2108|2233894|2235129|1|ID=1_2108;partial=00;start_type=ATG;rbs_motif=GGAG/GAGG;rbs_spacer=5-10bp;gc_cont=0.511	WP_339994556.1 NAD-dependent dihydropyrimidine dehydrogenase subunit PreA [Escherichia coli]	99.3	99.8	3.50e-302
NZ_CP132594.1_2109|2235372|2236382|-1|ID=1_2109;partial=00;start_type=ATG;rbs_motif=GGA/GAG/AGG;rbs_spacer=5-10bp;gc_cont=0.504	WP_001275118.1 MULTISPECIES: galactose/methyl galactoside ABC transporter permease MglC [Enterobacteriaceae]	100	99.7	5.02e-223
NZ_CP132594.1_2110|2236398|2237918|-1|ID=1_2110;partial=00;start_type=ATG;rbs_motif=GGA/GAG/AGG;rbs_spacer=5-10bp;gc_cont=0.454	WP_000255039.1 MULTISPECIES: galactose/methyl galactoside ABC transporter ATP-binding protein MglA [Enterobacteriaceae]	100	99.8	0.0
NZ_CP132594.1_2111|2237979|2238977|-1|ID=1_2111;partial=00;start_type=ATG;rbs_motif=GGAG/GAGG;rbs_spacer=5-10bp;gc_cont=0.513	WP_001036964.1 MULTISPECIES: galactose/glucose ABC transporter substrate-binding protein MglB [Enterobacteriaceae]	100	99.7	5.56e-234
NZ_CP132594.1_2112|2239257|2240297|-1|ID=1_2112;partial=00;start_type=ATG;rbs_motif=GGA/GAG/AGG;rbs_spacer=5-10bp;gc_cont=0.524	WP_000628648.1 MULTISPECIES: HTH-type transcriptional regulator GalS [Enterobacteriaceae]	100	99.7	2.38e-242
NZ_CP132594.1_2113|2240439|2241596|-1|ID=1_2113;partial=00;start_type=ATG;rbs_motif=GGA/GAG/AGG;rbs_spacer=5-10bp;gc_cont=0.545	WP_000440926.1 MULTISPECIES: DUF418 domain-containing protein YeiB [Enterobacteriaceae]	100	99.7	8.22e-281
NZ_CP132594.1_2114|2241613|2242281|-1|ID=1_2114;partial=00;start_type=ATG;rbs_motif=AGGAG;rbs_spacer=5-10bp;gc_cont=0.511	WP_001139613.1 MULTISPECIES: GTP cyclohydrolase I FolE [Enterobacteriaceae]	100	99.6	1.12e-153
NZ_CP132594.1_2115|2242539|2243375|1|ID=1_2115;partial=00;start_type=ATG;rbs_motif=AGGAG;rbs_spacer=5-10bp;gc_cont=0.545	WP_000425438.1 MULTISPECIES: S-formylglutathione hydrolase [Enterobacteriaceae]	100	99.6	2.05e-211
NZ_CP132594.1_2116|2243407|2245398|-1|ID=1_2116;partial=00;start_type=ATG;rbs_motif=GGAG/GAGG;rbs_spacer=5-10bp;gc_cont=0.528	WP_000489247.1 MULTISPECIES: catecholate siderophore receptor CirA [Enterobacteriaceae]	100	99.8	0.0
NZ_CP132594.1_2117|2245692|2247161|-1|ID=1_2117;partial=00;start_type=ATG;rbs_motif=GGA/GAG/AGG;rbs_spacer=11-12bp;gc_cont=0.535	WP_192958362.1 lysine-specific permease [Escherichia coli]	100	99.8	0.0
NZ_CP132594.1_2118|2247366|2248247|-1|ID=1_2118;partial=00;start_type=ATG;rbs_motif=None;rbs_spacer=None;gc_cont=0.537	WP_000548294.1 MULTISPECIES: DNA-binding transcriptional regulator YeiE [Enterobacteriaceae]	100	99.7	7.07e-206
NZ_CP132594.1_2119|2248346|2249395|1|ID=1_2119;partial=00;start_type=ATG;rbs_motif=AGGAG;rbs_spacer=5-10bp;gc_cont=0.530	WP_000182053.1 MULTISPECIES: YeiH family protein [Enterobacteriaceae]	100	99.7	3.60e-234
NZ_CP132594.1_2120|2249469|2250326|1|ID=1_2120;partial=00;start_type=ATG;rbs_motif=AGGAG;rbs_spacer=5-10bp;gc_cont=0.524	WP_000873894.1 MULTISPECIES: deoxyribonuclease IV [Enterobacteriaceae]	100	99.7	1.61e-207
NZ_CP132594.1_2121|2250329|2251417|1|ID=1_2121;partial=00;start_type=ATG;rbs_motif=None;rbs_spacer=None;gc_cont=0.518	WP_001065016.1 MULTISPECIES: sugar kinase [Enterobacteriaceae]	100	99.7	9.98e-259
NZ_CP132594.1_2122|2251524|2252774|-1|ID=1_2122;partial=00;start_type=ATG;rbs_motif=GGA/GAG/AGG;rbs_spacer=5-10bp;gc_cont=0.504	WP_000382966.1 MULTISPECIES: NupC/NupG family nucleoside CNT transporter [Enterobacteriaceae]	100	99.8	3.67e-270
NZ_CP132594.1_2123|2252874|2253815|-1|ID=1_2123;partial=00;start_type=ATG;rbs_motif=GGAG/GAGG;rbs_spacer=5-10bp;gc_cont=0.521	WP_000415429.1 MULTISPECIES: ribosylpyrimidine nucleosidase [Enterobacteriaceae]	100	99.7	9.96e-232
NZ_CP132594.1_2124|2253945|2254643|1|ID=1_2124;partial=00;start_type=GTG;rbs_motif=GGA/GAG/AGG;rbs_spacer=5-10bp;gc_cont=0.443	WP_000658575.1 MULTISPECIES: transcriptional regulator YeiL [Enterobacteriaceae]	100	99.6	3.75e-166
NZ_CP132594.1_2125|2254714|2255964|-1|ID=1_2125;partial=00;start_type=ATG;rbs_motif=GGA/GAG/AGG;rbs_spacer=5-10bp;gc_cont=0.509	WP_257247689.1 NupC/NupG family nucleoside CNT transporter [Escherichia coli]	96.4	99.8	4.77e-266
NZ_CP132594.1_2126|2256058|2256996|-1|ID=1_2126;partial=00;start_type=ATG;rbs_motif=GGAG/GAGG;rbs_spacer=5-10bp;gc_cont=0.497	WP_001292460.1 MULTISPECIES: pseudouridine-5'-phosphate glycosidase [Escherichia]	100	99.7	3.65e-213
NZ_CP132594.1_2127|2256984|2257925|-1|ID=1_2127;partial=00;start_type=ATG;rbs_motif=GGAG/GAGG;rbs_spacer=5-10bp;gc_cont=0.471	WP_001208118.1 MULTISPECIES: pseudouridine kinase [Enterobacteriaceae]	100	99.7	6.19e-226
NZ_CP132594.1_2128|2258348|2260039|-1|ID=1_2128;partial=00;start_type=ATG;rbs_motif=AGGAG;rbs_spacer=5-10bp;gc_cont=0.556	WP_410235384.1 PTS fructose transporter subunit IIBC [Escherichia sp. AP1362]	100	99.8	0.0
NZ_CP132594.1_2129|2260056|2260994|-1|ID=1_2129;partial=00;start_type=ATG;rbs_motif=GGAGG;rbs_spacer=5-10bp;gc_cont=0.534	WP_000091263.1 MULTISPECIES: 1-phosphofructokinase [Enterobacteriaceae]	100	99.7	5.49e-224
NZ_CP132594.1_2130|2260994|2262124|-1|ID=1_2130;partial=00;start_type=ATG;rbs_motif=GGAG/GAGG;rbs_spacer=5-10bp;gc_cont=0.555	WP_000487246.1 MULTISPECIES: fused PTS fructose transporter subunit IIA/HPr protein [Enterobacteriaceae]	100	99.7	1.16e-255
NZ_CP132594.1_2131|2262492|2263673|1|ID=1_2131;partial=00;start_type=ATG;rbs_motif=None;rbs_spacer=None;gc_cont=0.530	WP_000551980.1 MULTISPECIES: sugar efflux transporter SetB [Escherichia]	100	99.7	4.04e-276
NZ_CP132594.1_2132|2263670|2263924|-1|ID=1_2132;partial=00;start_type=ATG;rbs_motif=GGA/GAG/AGG;rbs_spacer=5-10bp;gc_cont=0.557	WP_000389030.1 MULTISPECIES: YkgJ family cysteine cluster protein [Enterobacteriaceae]	100	98.8	3.97e-58
NZ_CP132594.1_2133|2264079|2264651|1|ID=1_2133;partial=00;start_type=ATG;rbs_motif=AGGA;rbs_spacer=5-10bp;gc_cont=0.499	WP_001136827.1 MULTISPECIES: elongation factor P-like protein YeiP [Enterobacteriaceae]	100	99.5	6.13e-133
NZ_CP132594.1_2134|2264874|2266340|1|ID=1_2134;partial=00;start_type=ATG;rbs_motif=None;rbs_spacer=None;gc_cont=0.520	WP_001091940.1 MULTISPECIES: mannitol dehydrogenase family protein [Enterobacteriaceae]	100	99.8	0.0
NZ_CP132594.1_2135|2266458|2267444|1|ID=1_2135;partial=00;start_type=GTG;rbs_motif=GGAG/GAGG;rbs_spacer=5-10bp;gc_cont=0.545	WP_000198828.1 MULTISPECIES: zinc-binding GTPase YeiR [Enterobacteriaceae]	100	99.7	2.29e-240
NZ_CP132594.1_2136|2267483|2268196|1|ID=1_2136;partial=00;start_type=ATG;rbs_motif=GGA/GAG/AGG;rbs_spacer=5-10bp;gc_cont=0.441	WP_000594599.1 MULTISPECIES: Kdo(2)-lipid A phosphotransferase [Enterobacteriaceae]	100	99.6	1.30e-164
NZ_CP132594.1_2137|2268608|2269174|1|ID=1_2137;partial=00;start_type=ATG;rbs_motif=GGA/GAG/AGG;rbs_spacer=11-12bp;gc_cont=0.467	WP_000241011.1 MULTISPECIES: bifunctional murein DD-endopeptidase/murein LD-carboxypeptidase [Enterobacteriaceae]	100	99.5	8.39e-130
NZ_CP132594.1_2138|2269355|2270911|1|ID=1_2138;partial=00;start_type=ATG;rbs_motif=4Base/6BMM;rbs_spacer=13-15bp;gc_cont=0.505	WP_172615796.1 cyclic di-GMP phosphodiesterase [Escherichia coli]	100	99.8	0.0
NZ_CP132594.1_2139|2270993|2272807|1|ID=1_2139;partial=00;start_type=ATG;rbs_motif=AGGA/GGAG/GAGG;rbs_spacer=11-12bp;gc_cont=0.512	WP_000637046.1 MULTISPECIES: extracellular solute-binding protein [Enterobacteriaceae]	100	99.8	0.0
NZ_CP132594.1_2140|2272808|2273902|1|ID=1_2140;partial=00;start_type=ATG;rbs_motif=GGAG/GAGG;rbs_spacer=5-10bp;gc_cont=0.512	WP_000501604.1 MULTISPECIES: microcin C ABC transporter permease YejB [Enterobacteriaceae]	100	99.7	3.90e-257
NZ_CP132594.1_2141|2273902|2274927|1|ID=1_2141;partial=00;start_type=ATG;rbs_motif=GGAG/GAGG;rbs_spacer=5-10bp;gc_cont=0.527	WP_000088923.1 MULTISPECIES: ABC transporter permease [Enterobacteriaceae]	100	99.7	6.94e-253
NZ_CP132594.1_2142|2274929|2276518|1|ID=1_2142;partial=00;start_type=ATG;rbs_motif=AGxAGG/AGGxGG;rbs_spacer=5-10bp;gc_cont=0.514	WP_109866115.1 microcin C ABC transporter ATP-binding protein YejF [Escherichia coli]	100	99.8	0.0
NZ_CP132594.1_2143|2276522|2276866|-1|ID=1_2143;partial=00;start_type=GTG;rbs_motif=GGA/GAG/AGG;rbs_spacer=5-10bp;gc_cont=0.487	WP_000202798.1 MULTISPECIES: YejG family protein [Gammaproteobacteria]	100	99.1	3.25e-80
NZ_CP132594.1_2144|2277199|2278389|-1|ID=1_2144;partial=00;start_type=GTG;rbs_motif=AGGAG;rbs_spacer=5-10bp;gc_cont=0.531	WP_000213361.1 MULTISPECIES: multidrug efflux MFS transporter Bcr [Enterobacteriaceae]	100	99.7	1.15e-272
NZ_CP132594.1_2145|2278417|2279112|-1|ID=1_2145;partial=00;start_type=ATG;rbs_motif=3Base/5BMM;rbs_spacer=13-15bp;gc_cont=0.529	WP_001234850.1 MULTISPECIES: 16S rRNA pseudouridine(516) synthase RsuA [Enterobacteriaceae]	100	99.6	1.08e-169
NZ_CP132594.1_2146|2279261|2281021|1|ID=1_2146;partial=00;start_type=ATG;rbs_motif=None;rbs_spacer=None;gc_cont=0.532	WP_000578061.1 MULTISPECIES: DEAD/DEAH box helicase [Enterobacteriaceae]	100	99.8	0.0
NZ_CP132594.1_2147|2281146|2281430|1|ID=1_2147;partial=00;start_type=ATG;rbs_motif=GGA/GAG/AGG;rbs_spacer=5-10bp;gc_cont=0.505	WP_000494183.1 MULTISPECIES: 50S ribosomal protein L25 [Enterobacteriaceae]	100	98.9	1.03e-60
NZ_CP132594.1_2148|2281569|2282576|-1|ID=1_2148;partial=00;start_type=ATG;rbs_motif=AGGAG;rbs_spacer=5-10bp;gc_cont=0.524	WP_000050793.1 MULTISPECIES: nucleoid-associated protein YejK [Enterobacteriaceae]	100	99.7	2.86e-233
NZ_CP132594.1_2149|2282758|2282985|1|ID=1_2149;partial=00;start_type=ATG;rbs_motif=None;rbs_spacer=None;gc_cont=0.504	WP_001135667.1 MULTISPECIES: YejL family protein [Enterobacteriaceae]	100	98.7	7.73e-43
NZ_CP132594.1_2150|2283005|2284765|1|ID=1_2150;partial=00;start_type=ATG;rbs_motif=3Base/5BMM;rbs_spacer=13-15bp;gc_cont=0.521	WP_000256203.1 MULTISPECIES: LPS biosynthesis-modulating metalloenzyme YejM [Enterobacteriaceae]	100	99.8	0.0
NZ_CP132594.1_2151|2285019|2287529|-1|ID=1_2151;partial=00;start_type=TTG;rbs_motif=None;rbs_spacer=None;gc_cont=0.483	WP_053889160.1 MULTISPECIES: autotransporter YejO [Escherichia]	98.8	99.9	0.0
NZ_CP132594.1_2152|2287694|2288674|-1|ID=1_2152;partial=00;start_type=ATG;rbs_motif=GGA/GAG/AGG;rbs_spacer=5-10bp;gc_cont=0.550	WP_000019403.1 MULTISPECIES: IS5-like element IS5 family transposase [Bacteria]	100	99.7	2.98e-235
NZ_CP132594.1_2153|2289129|2289776|1|ID=1_2153;partial=00;start_type=ATG;rbs_motif=AGGAG;rbs_spacer=5-10bp;gc_cont=0.525	WP_001113639.1 MULTISPECIES: nitrate/nitrite response regulator protein NarP [Escherichia]	100	99.5	3.58e-142
NZ_CP132594.1_2154|2289987|2291039|-1|ID=1_2154;partial=00;start_type=ATG;rbs_motif=AGGAG;rbs_spacer=5-10bp;gc_cont=0.541	WP_001211575.1 MULTISPECIES: cytochrome c-type biogenesis thiol:disulfide oxidoreductase CcmH [Enterobacteriaceae]	100	99.7	2.05e-245
NZ_CP132594.1_2155|2291036|2291593|-1|ID=1_2155;partial=00;start_type=ATG;rbs_motif=GGAGG;rbs_spacer=3-4bp;gc_cont=0.547	WP_000824439.1 MULTISPECIES: thiol:disulfide interchange protein DsbE [Enterobacteriaceae]	100	99.5	1.77e-134
NZ_CP132594.1_2156|2291590|2293533|-1|ID=1_2156;partial=00;start_type=ATG;rbs_motif=AGGA;rbs_spacer=5-10bp;gc_cont=0.572	WP_000982447.1 MULTISPECIES: cytochrome c-type biogenesis heme lyase CcmF [Enterobacteriaceae]	100	99.8	0.0
NZ_CP132594.1_2157|2293530|2294009|-1|ID=1_2157;partial=00;start_type=ATG;rbs_motif=AGGAGG;rbs_spacer=3-4bp;gc_cont=0.537	WP_001026418.1 MULTISPECIES: cytochrome c maturation protein CcmE [Gammaproteobacteria]	100	99.4	2.42e-108
NZ_CP132594.1_2158|2294006|2294215|-1|ID=1_2158;partial=00;start_type=ATG;rbs_motif=GGAG/GAGG;rbs_spacer=5-10bp;gc_cont=0.567	WP_000186540.1 MULTISPECIES: heme exporter protein CcmD [Gammaproteobacteria]	100	98.6	5.33e-36
NZ_CP132594.1_2159|2294212|2294949|-1|ID=1_2159;partial=00;start_type=ATG;rbs_motif=3Base/5BMM;rbs_spacer=13-15bp;gc_cont=0.554	WP_001295447.1 MULTISPECIES: heme exporter protein CcmC [Gammaproteobacteria]	100	99.6	2.75e-179
NZ_CP132594.1_2160|2294991|2295653|-1|ID=1_2160;partial=00;start_type=ATG;rbs_motif=GGAG/GAGG;rbs_spacer=5-10bp;gc_cont=0.563	WP_367762185.1 heme exporter protein CcmB [Escherichia coli]	100	99.5	1.08e-118
NZ_CP132594.1_2161|2295650|2296267|-1|ID=1_2161;partial=00;start_type=ATG;rbs_motif=3Base/5BMM;rbs_spacer=13-15bp;gc_cont=0.558	WP_000888560.1 MULTISPECIES: cytochrome c biogenesis heme-transporting ATPase CcmA [Gammaproteobacteria]	100	99.5	1.49e-145
NZ_CP132594.1_2162|2296286|2296888|-1|ID=1_2162;partial=00;start_type=ATG;rbs_motif=GGAG/GAGG;rbs_spacer=5-10bp;gc_cont=0.516	WP_000528376.1 MULTISPECIES: cytochrome c-type protein NapC [Gammaproteobacteria]	100	99.5	2.80e-152
NZ_CP132594.1_2163|2296898|2297347|-1|ID=1_2163;partial=00;start_type=ATG;rbs_motif=GGAG/GAGG;rbs_spacer=5-10bp;gc_cont=0.558	WP_000835174.1 MULTISPECIES: nitrate reductase cytochrome c-type subunit [Enterobacteriaceae]	100	99.3	8.00e-109
NZ_CP132594.1_2164|2297344|2298207|-1|ID=1_2164;partial=00;start_type=ATG;rbs_motif=GGAGG;rbs_spacer=5-10bp;gc_cont=0.559	WP_000013515.1 MULTISPECIES: quinol dehydrogenase ferredoxin subunit NapH [Enterobacteriaceae]	100	99.7	6.11e-213
NZ_CP132594.1_2165|2298194|2298889|-1|ID=1_2165;partial=00;start_type=ATG;rbs_motif=GGA/GAG/AGG;rbs_spacer=11-12bp;gc_cont=0.588	WP_000091291.1 MULTISPECIES: ferredoxin-type protein NapG [Enterobacteriaceae]	100	99.6	2.97e-167
NZ_CP132594.1_2166|2298896|2301382|-1|ID=1_2166;partial=00;start_type=ATG;rbs_motif=GGAG/GAGG;rbs_spacer=5-10bp;gc_cont=0.562	WP_000778061.1 MULTISPECIES: periplasmic nitrate reductase subunit alpha [Enterobacteriaceae]	100	99.9	0.0
NZ_CP132594.1_2167|2301379|2301642|-1|ID=1_2167;partial=00;start_type=ATG;rbs_motif=GGAG/GAGG;rbs_spacer=5-10bp;gc_cont=0.549	WP_000557378.1 MULTISPECIES: chaperone NapD [Bacteria]	100	98.9	1.54e-52
NZ_CP132594.1_2168|2301632|2302126|-1|ID=1_2168;partial=00;start_type=GTG;rbs_motif=GGA/GAG/AGG;rbs_spacer=5-10bp;gc_cont=0.552	WP_000686723.1 MULTISPECIES: ferredoxin-type protein NapF [Enterobacteriaceae]	100	99.4	1.45e-125
NZ_CP132594.1_2169|2302235|2302399|1|ID=1_2169;partial=00;start_type=ATG;rbs_motif=AGGA;rbs_spacer=5-10bp;gc_cont=0.400	WP_001310984.1 MULTISPECIES: protein YojO [Enterobacteriaceae]	100	98.2	6.17e-33
NZ_CP132594.1_2170|2302534|2303022|1|ID=1_2170;partial=00;start_type=ATG;rbs_motif=AGGA;rbs_spacer=5-10bp;gc_cont=0.495	WP_000849209.1 MULTISPECIES: serine protease inhibitor ecotin [Enterobacteriaceae]	100	99.4	3.85e-111
NZ_CP132594.1_2171|2303737|2305383|-1|ID=1_2171;partial=00;start_type=ATG;rbs_motif=GGA/GAG/AGG;rbs_spacer=5-10bp;gc_cont=0.540	WP_166705621.1 malate dehydrogenase (quinone), partial [Escherichia coli]	100	99.8	0.0
NZ_CP132594.1_2172|2305601|2307244|-1|ID=1_2172;partial=00;start_type=ATG;rbs_motif=None;rbs_spacer=None;gc_cont=0.535	WP_000422182.1 MULTISPECIES: microcin J25 efflux ABC transporter YojI [Enterobacteriaceae]	100	99.8	0.0
NZ_CP132594.1_2173|2307320|2307970|-1|ID=1_2173;partial=00;start_type=ATG;rbs_motif=AGGAG;rbs_spacer=5-10bp;gc_cont=0.527	WP_000884971.1 MULTISPECIES: DNA oxidative demethylase AlkB [Enterobacteriaceae]	100	99.5	3.51e-163
NZ_CP132594.1_2174|2307970|2309034|-1|ID=1_2174;partial=00;start_type=ATG;rbs_motif=GGAG/GAGG;rbs_spacer=5-10bp;gc_cont=0.567	WP_000710375.1 MULTISPECIES: bifunctional DNA-binding transcriptional regulator/O6-methylguanine-DNA methyltransferase Ada [Enterobacteriaceae]	100	99.7	5.12e-257
NZ_CP132594.1_2175|2309108|2310163|-1|ID=1_2175;partial=00;start_type=ATG;rbs_motif=GGAG/GAGG;rbs_spacer=5-10bp;gc_cont=0.535	WP_000406064.1 MULTISPECIES: FAD:protein FMN transferase ApbE [Enterobacteriaceae]	100	99.7	1.30e-253
NZ_CP132594.1_2176|2310275|2311378|-1|ID=1_2176;partial=00;start_type=ATG;rbs_motif=GGAG/GAGG;rbs_spacer=5-10bp;gc_cont=0.506	WP_000865568.1 MULTISPECIES: porin OmpC [Enterobacteriaceae]	100	99.7	8.06e-272
NZ_CP132594.1_2177|2312117|2314789|1|ID=1_2177;partial=00;start_type=ATG;rbs_motif=GGA/GAG/AGG;rbs_spacer=11-12bp;gc_cont=0.494	WP_001249081.1 MULTISPECIES: phosphotransferase RcsD [Enterobacteriaceae]	100	99.9	0.0
NZ_CP132594.1_2178|2314806|2315456|1|ID=1_2178;partial=00;start_type=ATG;rbs_motif=GGA/GAG/AGG;rbs_spacer=11-12bp;gc_cont=0.478	WP_001061917.1 MULTISPECIES: response regulator transcription factor RcsB [Enterobacteriaceae]	100	99.5	2.96e-146
NZ_CP132594.1_2179|2315656|2318505|-1|ID=1_2179;partial=00;start_type=TTG;rbs_motif=GGAG/GAGG;rbs_spacer=5-10bp;gc_cont=0.509	WP_000876011.1 MULTISPECIES: two-component system sensor histidine kinase RcsC [Enterobacteriaceae]	100	99.9	0.0
NZ_CP132594.1_2180|2318672|2320498|1|ID=1_2180;partial=00;start_type=ATG;rbs_motif=GGA/GAG/AGG;rbs_spacer=5-10bp;gc_cont=0.485	WP_000559125.1 MULTISPECIES: two-component system sensor histidine kinase AtoS [Enterobacteriaceae]	100	99.8	0.0
NZ_CP132594.1_2181|2320495|2321880|1|ID=1_2181;partial=00;start_type=ATG;rbs_motif=GGA/GAG/AGG;rbs_spacer=11-12bp;gc_cont=0.490	WP_000125282.1 MULTISPECIES: acetoacetate metabolism transcriptional regulator AtoC [Enterobacteriaceae]	100	99.8	0.0
NZ_CP132594.1_2182|2322076|2322738|1|ID=1_2182;partial=00;start_type=ATG;rbs_motif=GGAG/GAGG;rbs_spacer=5-10bp;gc_cont=0.538	WP_000850540.1 MULTISPECIES: acetate CoA-transferase subunit alpha [Enterobacteriaceae]	100	99.5	2.74e-153
NZ_CP132594.1_2183|2322738|2323388|1|ID=1_2183;partial=00;start_type=ATG;rbs_motif=AGGAG;rbs_spacer=5-10bp;gc_cont=0.536	WP_000339065.1 MULTISPECIES: acetate CoA-transferase subunit beta [Enterobacteriaceae]	100	99.5	4.95e-154
NZ_CP132594.1_2184|2323385|2324707|1|ID=1_2184;partial=00;start_type=ATG;rbs_motif=None;rbs_spacer=None;gc_cont=0.531	WP_000580275.1 MULTISPECIES: TIGR00366 family protein [Enterobacteriaceae]	100	99.8	5.97e-311
NZ_CP132594.1_2185|2324738|2325922|1|ID=1_2185;partial=00;start_type=ATG;rbs_motif=AGGA;rbs_spacer=5-10bp;gc_cont=0.530	WP_000786547.1 MULTISPECIES: acetyl-CoA acetyltransferase [Enterobacteriaceae]	100	99.7	4.29e-267
NZ_CP132594.1_2186|2325996|2326772|-1|ID=1_2186;partial=00;start_type=ATG;rbs_motif=GGA/GAG/AGG;rbs_spacer=5-10bp;gc_cont=0.524	WP_001225852.1 MULTISPECIES: YfaP family protein [Enterobacteriaceae]	100	99.6	4.40e-187
NZ_CP132594.1_2187|2326777|2328426|-1|ID=1_2187;partial=00;start_type=GTG;rbs_motif=GGA/GAG/AGG;rbs_spacer=5-10bp;gc_cont=0.545	WP_001104549.1 MULTISPECIES: YfaQ family protein [Enterobacteriaceae]	100	99.8	0.0
NZ_CP132594.1_2188|2328427|2328912|-1|ID=1_2188;partial=00;start_type=ATG;rbs_motif=GGA/GAG/AGG;rbs_spacer=5-10bp;gc_cont=0.533	WP_005046832.1 MULTISPECIES: alpha-2-macroglobulin family protein [Shigella]	99.4	98.8	3.28e-107
NZ_CP132594.1_2189|2328928|2332821|-1|ID=1_2189;partial=00;start_type=GTG;rbs_motif=GGAG/GAGG;rbs_spacer=5-10bp;gc_cont=0.540	WP_236262400.1 alpha-2-macroglobulin family protein [Escherichia coli]	99.9	99.9	0.0
NZ_CP132594.1_2190|2332965|2333588|-1|ID=1_2190;partial=00;start_type=ATG;rbs_motif=None;rbs_spacer=None;gc_cont=0.514	WP_001295211.1 MULTISPECIES: DUF1175 domain-containing protein [Enterobacteriaceae]	100	99.5	3.66e-156
NZ_CP132594.1_2191|2333585|2335273|-1|ID=1_2191;partial=00;start_type=ATG;rbs_motif=AGGA;rbs_spacer=5-10bp;gc_cont=0.512	WP_000012305.1 MULTISPECIES: DUF2138 domain-containing protein [Enterobacteriaceae]	100	99.8	0.0
NZ_CP132594.1_2192|2335422|2338049|-1|ID=1_2192;partial=00;start_type=ATG;rbs_motif=GGA/GAG/AGG;rbs_spacer=5-10bp;gc_cont=0.540	WP_410974313.1 DNA topoisomerase (ATP-hydrolyzing) subunit A [Escherichia coli]	99.9	99.9	0.0
NZ_CP132594.1_2193|2338196|2338918|1|ID=1_2193;partial=00;start_type=ATG;rbs_motif=AGGA/GGAG/GAGG;rbs_spacer=11-12bp;gc_cont=0.542	WP_000990765.1 MULTISPECIES: bifunctional 2-polyprenyl-6-hydroxyphenol methylase/3-demethylubiquinol 3-O-methyltransferase UbiG [Enterobacteriaceae]	100	99.6	1.72e-175
NZ_CP132594.1_2194|2339046|2342798|-1|ID=1_2194;partial=00;start_type=ATG;rbs_motif=None;rbs_spacer=None;gc_cont=0.513	WP_001220077.1 MULTISPECIES: AIDA-I family autotransporter adhesin YfaL/EhaC [Enterobacteriaceae]	100	99.9	0.0
NZ_CP132594.1_2195|2343494|2345779|1|ID=1_2195;partial=00;start_type=ATG;rbs_motif=GGA/GAG/AGG;rbs_spacer=5-10bp;gc_cont=0.537	WP_345760922.1 class 1a ribonucleoside-diphosphate reductase subunit alpha [Escherichia coli]	99.9	99.9	0.0
NZ_CP132594.1_2196|2346013|2347143|1|ID=1_2196;partial=00;start_type=ATG;rbs_motif=AGGA;rbs_spacer=5-10bp;gc_cont=0.506	WP_000332037.1 MULTISPECIES: class Ia ribonucleoside-diphosphate reductase subunit beta [Enterobacteriaceae]	100	99.7	7.22e-275
NZ_CP132594.1_2197|2347143|2347397|1|ID=1_2197;partial=00;start_type=ATG;rbs_motif=3Base/5BMM;rbs_spacer=13-15bp;gc_cont=0.561	WP_000135040.1 MULTISPECIES: ferredoxin-like diferric-tyrosyl radical cofactor maintenance protein YfaE [Pseudomonadota]	100	98.8	2.30e-57
NZ_CP132594.1_2198|2347451|2348101|-1|ID=1_2198;partial=00;start_type=ATG;rbs_motif=GGA/GAG/AGG;rbs_spacer=5-10bp;gc_cont=0.495	WP_000301050.1 MULTISPECIES: lipopolysaccharide kinase InaA [Enterobacteriaceae]	100	99.5	5.37e-158
NZ_CP132594.1_2199|2348316|2348522|1|ID=1_2199;partial=00;start_type=ATG;rbs_motif=AGxAGG/AGGxGG;rbs_spacer=5-10bp;gc_cont=0.415	WP_250234187.1 LysR substrate-binding domain-containing protein, partial [Escherichia coli]	89.7	98.6	1.12e-34
NZ_CP132594.1_2200|2348564|2349640|-1|ID=1_2200;partial=00;start_type=ATG;rbs_motif=GGAGG;rbs_spacer=5-10bp;gc_cont=0.457	WP_000779105.1 MULTISPECIES: glycerophosphodiester phosphodiesterase [Enterobacteriaceae]	100	99.7	1.49e-267
NZ_CP132594.1_2201|2349645|2351003|-1|ID=1_2201;partial=00;start_type=ATG;rbs_motif=GGAGG;rbs_spacer=5-10bp;gc_cont=0.525	WP_000948731.1 MULTISPECIES: glycerol-3-phosphate transporter [Enterobacteriaceae]	99.8	99.8	0.0
NZ_CP132594.1_2202|2351276|2352904|1|ID=1_2202;partial=00;start_type=ATG;rbs_motif=GGAG/GAGG;rbs_spacer=5-10bp;gc_cont=0.573	WP_000857257.1 MULTISPECIES: anaerobic glycerol-3-phosphate dehydrogenase subunit A [Enterobacteriaceae]	100	99.8	0.0
NZ_CP132594.1_2203|2352894|2354153|1|ID=1_2203;partial=00;start_type=ATG;rbs_motif=AGGAG;rbs_spacer=5-10bp;gc_cont=0.559	WP_001209927.1 MULTISPECIES: glycerol-3-phosphate dehydrogenase subunit GlpB [Enterobacteriaceae]	100	99.8	4.49e-309
NZ_CP132594.1_2204|2354150|2355340|1|ID=1_2204;partial=00;start_type=ATG;rbs_motif=AGGAG;rbs_spacer=5-10bp;gc_cont=0.540	WP_001000379.1 MULTISPECIES: anaerobic glycerol-3-phosphate dehydrogenase subunit GlpC [Enterobacteriaceae]	100	99.7	2.69e-287
NZ_CP132594.1_2205|2355533|2356432|1|ID=1_2205;partial=00;start_type=ATG;rbs_motif=GGA/GAG/AGG;rbs_spacer=5-10bp;gc_cont=0.483	WP_000140592.1 MULTISPECIES: ISNCY family transposase [Escherichia]	100	99.7	1.39e-215
NZ_CP132594.1_2206|2356445|2356630|1|ID=1_2206;partial=00;start_type=ATG;rbs_motif=AGGAG;rbs_spacer=5-10bp;gc_cont=0.505	WP_000150333.1 MULTISPECIES: hypothetical protein [Enterobacteriaceae]	100	98.4	5.10e-35
NZ_CP132594.1_2207|2356671|2357474|-1|ID=1_2207;partial=00;start_type=ATG;rbs_motif=AGGA;rbs_spacer=5-10bp;gc_cont=0.539	WP_000992954.1 MULTISPECIES: 2-keto-3-deoxy-L-rhamnonate aldolase [Enterobacteriaceae]	100	99.6	2.64e-188
NZ_CP132594.1_2208|2357492|2358781|-1|ID=1_2208;partial=00;start_type=ATG;rbs_motif=AGGAG;rbs_spacer=5-10bp;gc_cont=0.527	WP_000100890.1 MULTISPECIES: MFS transporter [Escherichia]	100	99.8	1.08e-296
NZ_CP132594.1_2209|2358838|2360043|-1|ID=1_2209;partial=00;start_type=ATG;rbs_motif=GGAG/GAGG;rbs_spacer=5-10bp;gc_cont=0.522	WP_001319848.1 MULTISPECIES: L-rhamnonate dehydratase [Enterobacteriaceae]	100	99.8	7.35e-308
NZ_CP132594.1_2210|2360058|2360840|-1|ID=1_2210;partial=00;start_type=ATG;rbs_motif=GGAG/GAGG;rbs_spacer=5-10bp;gc_cont=0.510	WP_000894185.1 MULTISPECIES: IclR family transcriptional regulator [Enterobacteriaceae]	100	99.6	9.94e-185
NZ_CP132594.1_2211|2361060|2362262|-1|ID=1_2211;partial=00;start_type=ATG;rbs_motif=AGGAG;rbs_spacer=5-10bp;gc_cont=0.543	WP_000921621.1 MULTISPECIES: nicotinamide mononucleotide deamidase-related protein YfaY [Enterobacteriaceae]	100	99.8	3.83e-289
NZ_CP132594.1_2212|2362362|2362904|-1|ID=1_2212;partial=00;start_type=ATG;rbs_motif=GGA/GAG/AGG;rbs_spacer=5-10bp;gc_cont=0.530	WP_001300392.1 MULTISPECIES: YfaZ family protein [Enterobacteriaceae]	100	99.4	8.49e-126
NZ_CP132594.1_2213|2363183|2363608|1|ID=1_2213;partial=00;start_type=GTG;rbs_motif=AGGA;rbs_spacer=5-10bp;gc_cont=0.477	WP_001300564.1 MULTISPECIES: nucleoside triphosphatase NudI [Enterobacteriaceae]	100	99.3	1.03e-98
NZ_CP132594.1_2214|2363647|2364249|-1|ID=1_2214;partial=00;start_type=GTG;rbs_motif=GGAG/GAGG;rbs_spacer=5-10bp;gc_cont=0.433	WP_000879112.1 MULTISPECIES: lipopolysaccharide core heptose(II)-phosphate phosphatase Ais [Enterobacteriaceae]	100	99.5	1.14e-142
NZ_CP132594.1_2215|2364539|2365696|1|ID=1_2215;partial=00;start_type=ATG;rbs_motif=GGA/GAG/AGG;rbs_spacer=5-10bp;gc_cont=0.513	WP_001295286.1 MULTISPECIES: UDP-4-amino-4-deoxy-L-arabinose aminotransferase [Enterobacteriaceae]	100	98.2	2.74e-273
NZ_CP132594.1_2216|2365700|2366668|1|ID=1_2216;partial=00;start_type=ATG;rbs_motif=AGGA;rbs_spacer=5-10bp;gc_cont=0.498	WP_000461657.1 MULTISPECIES: undecaprenyl-phosphate 4-deoxy-4-formamido-L-arabinose transferase [Enterobacteriaceae]	100	99.7	7.52e-227
NZ_CP132594.1_2217|2366668|2368650|1|ID=1_2217;partial=00;start_type=ATG;rbs_motif=AGGA;rbs_spacer=5-10bp;gc_cont=0.511	WP_349769238.1 bifunctional UDP-4-amino-4-deoxy-L-arabinose formyltransferase/UDP-glucuronic acid oxidase ArnA [Escherichia coli]	100	99.8	0.0
