CP139866.1_1961|1972591|1973163|-1|ID=1_1961;partial=00;start_type=ATG;rbs_motif=AGxAGG/AGGxGG;rbs_spacer=5-10bp;gc_cont=0.323	WP_000718946.1 3-isopropylmalate dehydratase small subunit [Staphylococcus aureus]	100	99.5	3.43e-139
CP139866.1_1962|1973164|1974534|-1|ID=1_1962;partial=00;start_type=ATG;rbs_motif=GGAG/GAGG;rbs_spacer=5-10bp;gc_cont=0.381	WP_000531828.1 MULTISPECIES: 3-isopropylmalate dehydratase large subunit [Staphylococcus]	100	99.8	0.0
CP139866.1_1963|1974548|1975594|-1|ID=1_1963;partial=00;start_type=ATG;rbs_motif=GGA/GAG/AGG;rbs_spacer=5-10bp;gc_cont=0.357	WP_000221945.1 MULTISPECIES: 3-isopropylmalate dehydrogenase [Staphylococcus]	100	99.7	4.19e-253
CP139866.1_1964|1975597|1977126|-1|ID=1_1964;partial=00;start_type=ATG;rbs_motif=AGGAG;rbs_spacer=5-10bp;gc_cont=0.363	WP_000094575.1 MULTISPECIES: 2-isopropylmalate synthase [Staphylococcus]	100	99.8	0.0
CP139866.1_1965|1977156|1978160|-1|ID=1_1965;partial=00;start_type=ATG;rbs_motif=GGAG/GAGG;rbs_spacer=5-10bp;gc_cont=0.348	WP_000214560.1 ketol-acid reductoisomerase [Staphylococcus aureus]	100	99.7	7.37e-240
CP139866.1_1966|1978297|1978551|-1|ID=1_1966;partial=00;start_type=ATG;rbs_motif=GGAG/GAGG;rbs_spacer=5-10bp;gc_cont=0.306	WP_190347842.1 ACT domain-containing protein [Staphylococcus aureus]	100	98.8	5.92e-51
CP139866.1_1967|1978551|1980320|-1|ID=1_1967;partial=00;start_type=ATG;rbs_motif=GGAG/GAGG;rbs_spacer=5-10bp;gc_cont=0.363	WP_000047822.1 biosynthetic-type acetolactate synthase large subunit [Staphylococcus aureus]	100	99.8	0.0
CP139866.1_1968|1980347|1981654|-1|ID=1_1968;partial=00;start_type=ATG;rbs_motif=None;rbs_spacer=None;gc_cont=0.401	WP_094613056.1 dihydroxy-acid dehydratase, partial [Staphylococcus aureus]	99.8	99.8	1.62e-311
CP139866.1_1969|1981651|1982034|-1|ID=1_1969;partial=00;start_type=ATG;rbs_motif=GGA/GAG/AGG;rbs_spacer=5-10bp;gc_cont=0.396	WP_271020242.1 dihydroxy-acid dehydratase domain-containing protein, partial [Staphylococcus aureus]	100	98.4	4.55e-88
CP139866.1_1970|1982512|1983006|1|ID=1_1970;partial=00;start_type=ATG;rbs_motif=GGA/GAG/AGG;rbs_spacer=11-12bp;gc_cont=0.313	WP_000590802.1 MULTISPECIES: tRNA (adenosine(37)-N6)-threonylcarbamoyltransferase complex ATPase subunit type 1 TsaE [Staphylococcus]	99.3	92.7	5.25e-103
CP139866.1_1971|1982987|1983649|1|ID=1_1971;partial=00;start_type=ATG;rbs_motif=AGGAG;rbs_spacer=5-10bp;gc_cont=0.345	WP_001086730.1 tRNA (adenosine(37)-N6)-threonylcarbamoyltransferase complex dimerization subunit type 1 TsaB [Staphylococcus aureus]	100	99.5	3.74e-151
CP139866.1_1972|1983622|1984086|1|ID=1_1972;partial=00;start_type=TTG;rbs_motif=GGAG/GAGG;rbs_spacer=5-10bp;gc_cont=0.318	WP_000372755.1 MULTISPECIES: ribosomal protein S18-alanine N-acetyltransferase [Staphylococcus]	100	99.4	9.99e-110
CP139866.1_1973|1984079|1985104|1|ID=1_1973;partial=00;start_type=ATG;rbs_motif=None;rbs_spacer=None;gc_cont=0.376	WP_000159047.1 MULTISPECIES: tRNA (adenosine(37)-N6)-threonylcarbamoyltransferase complex transferase subunit TsaD [Staphylococcus]	100	99.7	4.14e-245
CP139866.1_1974|1985421|1987031|-1|ID=1_1974;partial=00;start_type=ATG;rbs_motif=AGGAG;rbs_spacer=5-10bp;gc_cont=0.306	WP_000106315.1 MutS-related protein [Staphylococcus aureus]	100	99.8	0.0
CP139866.1_1975|1987393|1989321|-1|ID=1_1975;partial=00;start_type=ATG;rbs_motif=GGA/GAG/AGG;rbs_spacer=5-10bp;gc_cont=0.321	WP_000602063.1 ABC-F family ATP-binding cassette domain-containing protein [Staphylococcus aureus]	100	99.8	0.0
CP139866.1_1976|1989574|1990209|1|ID=1_1976;partial=00;start_type=ATG;rbs_motif=AGGAG;rbs_spacer=5-10bp;gc_cont=0.340	WP_001283612.1 MULTISPECIES: redox-sensing transcriptional repressor Rex [Staphylococcus]	100	99.5	1.86e-142
CP139866.1_1978|1990519|1991877|1|ID=1_1978;partial=00;start_type=ATG;rbs_motif=AGGA;rbs_spacer=5-10bp;gc_cont=0.361	WP_203233794.1 YeeE/YedE family protein [Staphylococcus aureus]	98.0	77.5	1.10e-241
CP139866.1_1979|1992086|1993336|1|ID=1_1979;partial=00;start_type=ATG;rbs_motif=GGAG/GAGG;rbs_spacer=5-10bp;gc_cont=0.333	WP_001052260.1 ammonium transporter [Staphylococcus aureus]	100	99.8	4.56e-296
CP139866.1_1980|1993520|1994293|1|ID=1_1980;partial=00;start_type=ATG;rbs_motif=GGA/GAG/AGG;rbs_spacer=5-10bp;gc_cont=0.318	WP_142680899.1 LacI family DNA-binding transcriptional regulator, partial [Staphylococcus aureus]	99.6	98.4	3.32e-174
CP139866.1_1981|1994290|1994469|1|ID=1_1981;partial=00;start_type=ATG;rbs_motif=None;rbs_spacer=None;gc_cont=0.350	WP_423143774.1 substrate-binding domain-containing protein, partial [Staphylococcus aureus]	100	98.3	1.20e-35
CP139866.1_1982|1994618|1996102|1|ID=1_1982;partial=00;start_type=ATG;rbs_motif=AGGAG(G)/GGAGG;rbs_spacer=13-15bp;gc_cont=0.337	WP_000141407.1 sucrose-6-phosphate hydrolase [Staphylococcus aureus]	100	99.8	0.0
CP139866.1_1983|1996099|1997058|1|ID=1_1983;partial=00;start_type=ATG;rbs_motif=AGGA;rbs_spacer=5-10bp;gc_cont=0.345	WP_001253294.1 carbohydrate kinase family protein [Staphylococcus aureus]	100	99.7	1.46e-227
CP139866.1_1984|1997432|1998148|-1|ID=1_1984;partial=00;start_type=ATG;rbs_motif=AGGA;rbs_spacer=5-10bp;gc_cont=0.311	WP_000688492.1 MULTISPECIES: quorum-sensing response regulator AgrA [Staphylococcus]	100	99.6	1.12e-170
CP139866.1_1985|1998167|1999459|-1|ID=1_1985;partial=00;start_type=GTG;rbs_motif=None;rbs_spacer=None;gc_cont=0.272	WP_001825886.1 quorum-sensing sensor histidine kinase AgrC [Staphylococcus aureus]	100	99.8	6.31e-285
CP139866.1_1986|1999484|1999624|-1|ID=1_1986;partial=00;start_type=ATG;rbs_motif=AGGAG;rbs_spacer=5-10bp;gc_cont=0.262	WP_001093929.1 MULTISPECIES: cyclic lactone autoinducer peptide AgrD [Staphylococcus]	100	97.9	1.29e-24
CP139866.1_1987|1999621|2000244|-1|ID=1_1987;partial=00;start_type=ATG;rbs_motif=GGA/GAG/AGG;rbs_spacer=5-10bp;gc_cont=0.277	WP_001105708.1 MULTISPECIES: accessory gene regulator AgrB [Staphylococcus]	99.5	90.9	2.63e-120
CP139866.1_1988|2001163|2001948|-1|ID=1_1988;partial=00;start_type=ATG;rbs_motif=AGGA;rbs_spacer=5-10bp;gc_cont=0.322	WP_000867947.1 carbon-nitrogen family hydrolase [Staphylococcus aureus]	100	99.6	4.75e-188
CP139866.1_1989|2002256|2002882|-1|ID=1_1989;partial=00;start_type=ATG;rbs_motif=AGGAG;rbs_spacer=5-10bp;gc_cont=0.309	WP_000522384.1 MULTISPECIES: nitroreductase family protein [Staphylococcus]	100	99.5	3.93e-147
CP139866.1_1990|2003079|2003816|1|ID=1_1990;partial=00;start_type=ATG;rbs_motif=AGGA/GGAG/GAGG;rbs_spacer=11-12bp;gc_cont=0.411	WP_031900897.1 SdrH family protein, partial [Staphylococcus aureus]	100	42.7	7.79e-48
CP139866.1_1991|2003819|2004322|1|ID=1_1991;partial=00;start_type=TTG;rbs_motif=None;rbs_spacer=None;gc_cont=0.313	WP_001273432.1 SdrH family protein [Staphylococcus aureus]	99.4	99.4	1.01e-113
CP139866.1_1992|2004347|2005090|-1|ID=1_1992;partial=00;start_type=ATG;rbs_motif=GGAG/GAGG;rbs_spacer=5-10bp;gc_cont=0.301	WP_000197638.1 MULTISPECIES: CPBP family intramembrane glutamic endopeptidase MroQ [Staphylococcus]	100	99.6	3.82e-162
CP139866.1_1993|2005624|2007240|1|ID=1_1993;partial=00;start_type=ATG;rbs_motif=GGAG/GAGG;rbs_spacer=5-10bp;gc_cont=0.377	WP_000240642.1 MULTISPECIES: chaperonin GroEL [Staphylococcus]	100	99.8	0.0
CP139866.1_1994|2007781|2007960|1|ID=1_1994;partial=00;start_type=ATG;rbs_motif=AGGA;rbs_spacer=5-10bp;gc_cont=0.278	WP_031838477.1 hypothetical protein [Staphylococcus aureus]	81.4	98.3	7.26e-23
CP139866.1_1995|2007957|2008583|1|ID=1_1995;partial=00;start_type=TTG;rbs_motif=AGGA/GGAG/GAGG;rbs_spacer=11-12bp;gc_cont=0.284	WP_000216896.1 hypothetical protein [Staphylococcus aureus]	100	99.5	1.72e-141
CP139866.1_1996|2008603|2008749|-1|ID=1_1996;partial=00;start_type=ATG;rbs_motif=None;rbs_spacer=None;gc_cont=0.286	WP_089535707.1 transposase, partial [Staphylococcus aureus]	100	98.0	6.69e-25
CP139866.1_1997|2009122|2009796|-1|ID=1_1997;partial=00;start_type=TTG;rbs_motif=None;rbs_spacer=None;gc_cont=0.281	WP_162676253.1 TrkH family potassium uptake protein, partial [Staphylococcus aureus]	99.6	99.6	3.62e-143
CP139866.1_1998|2009901|2010428|-1|ID=1_1998;partial=00;start_type=ATG;rbs_motif=AGGA/GGAG/GAGG;rbs_spacer=11-12bp;gc_cont=0.297	WP_310689042.1 potassium transporter TrkG, partial [Staphylococcus aureus]	98.8	98.3	1.65e-109
CP139866.1_1999|2010811|2012034|-1|ID=1_1999;partial=00;start_type=ATG;rbs_motif=GGA/GAG/AGG;rbs_spacer=5-10bp;gc_cont=0.339	WP_000206618.1 MULTISPECIES: ArgE/DapE family deacylase [Staphylococcus]	100	99.8	1.70e-291
CP139866.1_2000|2012466|2013521|1|ID=1_2000;partial=00;start_type=ATG;rbs_motif=GGA/GAG/AGG;rbs_spacer=5-10bp;gc_cont=0.308	WP_000791397.1 leukocidin family pore-forming toxin [Staphylococcus aureus]	100	99.7	8.41e-250
CP139866.1_2001|2013543|2014559|1|ID=1_2001;partial=00;start_type=ATG;rbs_motif=AGxAGG/AGGxGG;rbs_spacer=11-12bp;gc_cont=0.320	WP_000595612.1 leukocidin/hemolysin toxin family protein [Staphylococcus aureus]	100	99.7	1.19e-247
CP139866.1_2002|2014821|2015645|-1|ID=1_2002;partial=00;start_type=ATG;rbs_motif=GGA/GAG/AGG;rbs_spacer=5-10bp;gc_cont=0.336	WP_000283440.1 sphingomyelin phosphodiesterase [Staphylococcus aureus]	100	99.6	3.26e-206
CP139866.1_2003|2015702|2016739|-1|ID=1_2003;partial=00;start_type=ATG;rbs_motif=AGGAG;rbs_spacer=5-10bp;gc_cont=0.309	WP_000857185.1 tyrosine-type recombinase/integrase [Staphylococcus aureus]	99.7	99.7	3.41e-246
CP139866.1_2004|2016798|2017262|-1|ID=1_2004;partial=00;start_type=ATG;rbs_motif=AGGAG;rbs_spacer=5-10bp;gc_cont=0.331	YP_908791.1 lipoprotein [Staphylococcus phage phiNM3]	100	99.4	8.20e-54
CP139866.1_2005|2017362|2017544|-1|ID=1_2005;partial=00;start_type=ATG;rbs_motif=AGGA;rbs_spacer=5-10bp;gc_cont=0.279	WP_000705248.1 MULTISPECIES: hypothetical protein [Staphylococcus]	100	98.4	2.36e-35
CP139866.1_2006|2017748|2018089|-1|ID=1_2006;partial=00;start_type=ATG;rbs_motif=AGGA;rbs_spacer=5-10bp;gc_cont=0.257	WP_000591749.1 MULTISPECIES: hypothetical protein [Bacteria]	100	99.1	2.59e-72
CP139866.1_2007|2018095|2019027|-1|ID=1_2007;partial=00;start_type=ATG;rbs_motif=AGGAG;rbs_spacer=5-10bp;gc_cont=0.265	WP_000759682.1 MULTISPECIES: exonuclease domain-containing protein [Bacteria]	100	99.7	3.70e-221
CP139866.1_2008|2019043|2019756|-1|ID=1_2008;partial=00;start_type=ATG;rbs_motif=AGGAG;rbs_spacer=5-10bp;gc_cont=0.336	WP_001031454.1 MULTISPECIES: XRE family transcriptional regulator [Bacteria]	100	99.6	1.30e-164
CP139866.1_2009|2019889|2020152|1|ID=1_2009;partial=00;start_type=ATG;rbs_motif=GGA/GAG/AGG;rbs_spacer=5-10bp;gc_cont=0.250	WP_000854072.1 MULTISPECIES: helix-turn-helix transcriptional regulator [Bacteria]	100	98.9	9.26e-54
CP139866.1_2010|2020168|2020383|1|ID=1_2010;partial=00;start_type=ATG;rbs_motif=AGGAG;rbs_spacer=5-10bp;gc_cont=0.394	WP_001025874.1 MULTISPECIES: Thoeris anti-defense Tad2 family protein [Staphylococcus]	100	98.6	5.16e-46
CP139866.1_2011|2020372|2020701|-1|ID=1_2011;partial=00;start_type=ATG;rbs_motif=AGGAGG;rbs_spacer=5-10bp;gc_cont=0.318	WP_000128907.1 MULTISPECIES: hypothetical protein [Bacteria]	100	99.1	5.12e-68
CP139866.1_2012|2020752|2021504|1|ID=1_2012;partial=00;start_type=ATG;rbs_motif=AGGAG;rbs_spacer=5-10bp;gc_cont=0.361	WP_001148605.1 MULTISPECIES: phage antirepressor KilAC domain-containing protein [Bacteria]	100	99.6	1.65e-178
CP139866.1_2013|2021520|2021717|1|ID=1_2013;partial=00;start_type=ATG;rbs_motif=AGGAG;rbs_spacer=5-10bp;gc_cont=0.323	NP_803363.1 phi PVL orf 35-like protein [Staphylococcus phage phi 13]	100	98.5	3.83e-43
CP139866.1_2014|2021748|2021888|1|ID=1_2014;partial=00;start_type=ATG;rbs_motif=AGGAG;rbs_spacer=5-10bp;gc_cont=0.298	WP_000939496.1 MULTISPECIES: hypothetical protein [Staphylococcus]	100	97.9	7.25e-22
CP139866.1_2015|2021903|2022535|-1|ID=1_2015;partial=00;start_type=GTG;rbs_motif=AGGAG;rbs_spacer=5-10bp;gc_cont=0.280	WP_000275058.1 MULTISPECIES: hypothetical protein [Staphylococcus]	100	99.5	1.87e-146
CP139866.1_2016|2022594|2022914|1|ID=1_2016;partial=00;start_type=ATG;rbs_motif=AGGA;rbs_spacer=5-10bp;gc_cont=0.324	WP_001120197.1 MULTISPECIES: DUF771 domain-containing protein [Staphylococcus]	100	99.1	1.32e-73
CP139866.1_2017|2023167|2023493|1|ID=1_2017;partial=00;start_type=ATG;rbs_motif=GGAG/GAGG;rbs_spacer=5-10bp;gc_cont=0.333	WP_000165375.1 MULTISPECIES: DUF2482 family protein [Staphylococcus]	100	99.1	2.01e-69
CP139866.1_2018|2023474|2023734|1|ID=1_2018;partial=00;start_type=ATG;rbs_motif=AGGAG;rbs_spacer=5-10bp;gc_cont=0.330	WP_000291503.1 MULTISPECIES: DUF1108 family protein [Staphylococcus]	100	98.9	7.63e-57
CP139866.1_2019|2023743|2024006|1|ID=1_2019;partial=00;start_type=ATG;rbs_motif=GGA/GAG/AGG;rbs_spacer=5-10bp;gc_cont=0.333	WP_001205732.1 MULTISPECIES: hypothetical protein [Staphylococcus]	100	98.9	1.36e-55
CP139866.1_2020|2024015|2025958|1|ID=1_2020;partial=00;start_type=ATG;rbs_motif=GGAG/GAGG;rbs_spacer=5-10bp;gc_cont=0.305	WP_000700577.1 MULTISPECIES: AAA family ATPase [Staphylococcus]	100	99.8	0.0
CP139866.1_2021|2025960|2026880|1|ID=1_2021;partial=00;start_type=ATG;rbs_motif=GGAG/GAGG;rbs_spacer=5-10bp;gc_cont=0.336	WP_000138472.1 MULTISPECIES: recombinase RecT [Staphylococcus]	100	99.7	1.42e-207
CP139866.1_2022|2027093|2027578|1|ID=1_2022;partial=00;start_type=ATG;rbs_motif=None;rbs_spacer=None;gc_cont=0.348	WP_000123911.1 MBL fold metallo-hydrolase [Staphylococcus aureus]	100	99.4	3.57e-111
CP139866.1_2023|2027579|2028049|1|ID=1_2023;partial=00;start_type=ATG;rbs_motif=GGAG/GAGG;rbs_spacer=5-10bp;gc_cont=0.367	WP_000934764.1 MULTISPECIES: single-stranded DNA-binding protein [Staphylococcus]	100	99.4	2.53e-104
CP139866.1_2024|2028079|2028963|1|ID=1_2024;partial=00;start_type=ATG;rbs_motif=GGAG/GAGG;rbs_spacer=5-10bp;gc_cont=0.347	WP_000148316.1 MULTISPECIES: DnaD domain-containing protein [Staphylococcus]	100	99.7	9.39e-191
CP139866.1_2025|2028970|2029188|1|ID=1_2025;partial=00;start_type=ATG;rbs_motif=GGAG/GAGG;rbs_spacer=5-10bp;gc_cont=0.306	WP_000338530.1 MULTISPECIES: hypothetical protein [Bacteria]	100	98.6	1.71e-49
CP139866.1_2026|2029197|2029601|1|ID=1_2026;partial=00;start_type=ATG;rbs_motif=GGAG/GAGG;rbs_spacer=5-10bp;gc_cont=0.321	WP_000401960.1 MULTISPECIES: RusA family crossover junction endodeoxyribonuclease [Bacilli]	100	99.3	7.71e-93
CP139866.1_2027|2029614|2029982|1|ID=1_2027;partial=00;start_type=ATG;rbs_motif=GGAG/GAGG;rbs_spacer=5-10bp;gc_cont=0.390	WP_162649165.1 SA1788 family PVL leukocidin-associated protein [Staphylococcus aureus]	99.2	99.2	8.04e-78
CP139866.1_2028|2029986|2030228|1|ID=1_2028;partial=00;start_type=ATG;rbs_motif=AGxAG;rbs_spacer=5-10bp;gc_cont=0.366	WP_000131366.1 MULTISPECIES: SAV1978 family virulence-associated passenger protein [Bacteria]	100	98.8	9.31e-53
CP139866.1_2029|2030240|2030407|1|ID=1_2029;partial=00;start_type=ATG;rbs_motif=AGGAG;rbs_spacer=5-10bp;gc_cont=0.304	WP_001624242.1 MULTISPECIES: hypothetical protein [Bacteria]	100	98.2	9.38e-33
CP139866.1_2030|2030400|2030651|1|ID=1_2030;partial=00;start_type=ATG;rbs_motif=GGAG/GAGG;rbs_spacer=5-10bp;gc_cont=0.369	WP_001065091.1 MULTISPECIES: type II toxin-antitoxin system toxin HigB [Staphylococcus]	100	98.8	1.52e-48
CP139866.1_2031|2030641|2030823|1|ID=1_2031;partial=00;start_type=ATG;rbs_motif=AGGAG;rbs_spacer=5-10bp;gc_cont=0.328	WP_000028421.1 type II toxin-antitoxin system antitoxin HigA [Staphylococcus aureus]	98.3	98.4	7.92e-34
CP139866.1_2032|2030816|2031358|1|ID=1_2032;partial=00;start_type=ATG;rbs_motif=AGGAG;rbs_spacer=5-10bp;gc_cont=0.390	WP_000185660.1 MULTISPECIES: dUTP diphosphatase [Bacteria]	100	99.4	8.15e-124
CP139866.1_2033|2031395|2031601|1|ID=1_2033;partial=00;start_type=GTG;rbs_motif=AGGAGG;rbs_spacer=5-10bp;gc_cont=0.362	WP_000195803.1 MULTISPECIES: DUF1381 domain-containing protein [Bacteria]	100	98.6	1.26e-38
CP139866.1_2034|2031598|2031984|1|ID=1_2034;partial=00;start_type=ATG;rbs_motif=GGAG/GAGG;rbs_spacer=5-10bp;gc_cont=0.310	YP_008059009.1 secreted protein [Staphylococcus phage StauST398-1]	100	99.2	1.65e-82
CP139866.1_2035|2031981|2032130|1|ID=1_2035;partial=00;start_type=ATG;rbs_motif=GGA/GAG/AGG;rbs_spacer=5-10bp;gc_cont=0.373	WP_000595265.1 MULTISPECIES: transcriptional activator RinB [Bacteria]	100	98.0	4.52e-24
CP139866.1_2036|2032130|2032330|1|ID=1_2036;partial=00;start_type=ATG;rbs_motif=GGAG/GAGG;rbs_spacer=5-10bp;gc_cont=0.299	WP_000265043.1 MULTISPECIES: DUF1514 family protein [Staphylococcus]	100	98.5	3.69e-37
CP139866.1_2037|2032358|2032534|1|ID=1_2037;partial=00;start_type=ATG;rbs_motif=AGGA/GGAG/GAGG;rbs_spacer=11-12bp;gc_cont=0.373	WP_340576434.1 transcriptional regulator, partial [Staphylococcus aureus]	100	83.1	2.65e-24
CP139866.1_2038|2033005|2033304|1|ID=1_2038;partial=00;start_type=ATG;rbs_motif=GGA/GAG/AGG;rbs_spacer=5-10bp;gc_cont=0.320	WP_000988336.1 MULTISPECIES: HNH endonuclease [Bacteria]	100	99.0	4.78e-66
CP139866.1_2039|2033432|2033776|1|ID=1_2039;partial=00;start_type=ATG;rbs_motif=GGA/GAG/AGG;rbs_spacer=5-10bp;gc_cont=0.336	YP_009830104.1 terminase small subunit [Staphylococcus phage P282]	100	99.1	9.71e-73
CP139866.1_2040|2033773|2035434|1|ID=1_2040;partial=00;start_type=ATG;rbs_motif=None;rbs_spacer=None;gc_cont=0.327	WP_000625088.1 MULTISPECIES: terminase large subunit [Bacteria]	100	99.8	0.0
CP139866.1_2041|2035450|2036637|1|ID=1_2041;partial=00;start_type=ATG;rbs_motif=AGGAG;rbs_spacer=5-10bp;gc_cont=0.317	WP_000025274.1 MULTISPECIES: phage portal protein [Bacteria]	100	99.7	2.01e-277
CP139866.1_2042|2036615|2037358|1|ID=1_2042;partial=00;start_type=ATG;rbs_motif=GGA/GAG/AGG;rbs_spacer=5-10bp;gc_cont=0.363	YP_007237156.1 head maturation protease [Staphylococcus phage phi5967PVL]	100	99.6	4.85e-165
CP139866.1_2043|2037382|2038527|1|ID=1_2043;partial=00;start_type=ATG;rbs_motif=AGGAG;rbs_spacer=5-10bp;gc_cont=0.353	WP_000154559.1 MULTISPECIES: phage major capsid protein [Bacteria]	100	99.7	6.62e-269
CP139866.1_2044|2038547|2038831|1|ID=1_2044;partial=00;start_type=ATG;rbs_motif=GGAG/GAGG;rbs_spacer=5-10bp;gc_cont=0.330	YP_908832.1 Arc-like repressor [Staphylococcus phage phiNM3]	100	98.9	9.95e-59
CP139866.1_2045|2038809|2039105|1|ID=1_2045;partial=00;start_type=ATG;rbs_motif=None;rbs_spacer=None;gc_cont=0.313	YP_009196788.1 head-tail adapter protein [Staphylococcus phage 23MRA]	100	99.0	1.18e-61
CP139866.1_2046|2039089|2039451|1|ID=1_2046;partial=00;start_type=ATG;rbs_motif=GGAG/GAGG;rbs_spacer=5-10bp;gc_cont=0.309	WP_000755150.1 MULTISPECIES: phage head completion protein [Bacteria]	100	99.2	5.47e-84
CP139866.1_2047|2039448|2039852|1|ID=1_2047;partial=00;start_type=ATG;rbs_motif=GGAG/GAGG;rbs_spacer=5-10bp;gc_cont=0.336	WP_000114226.1 MULTISPECIES: HK97 gp10 family phage protein [Staphylococcus]	100	99.3	2.04e-88
CP139866.1_2048|2039849|2040256|1|ID=1_2048;partial=00;start_type=GTG;rbs_motif=AGGA/GGAG/GAGG;rbs_spacer=11-12bp;gc_cont=0.299	WP_000565496.1 hypothetical protein [Staphylococcus aureus]	100	99.3	1.18e-92
CP139866.1_2049|2040257|2040901|1|ID=1_2049;partial=00;start_type=ATG;rbs_motif=AGGAG;rbs_spacer=5-10bp;gc_cont=0.366	WP_000268741.1 MULTISPECIES: major tail protein [Staphylococcus]	100	99.5	4.96e-153
CP139866.1_2050|2041217|2041567|1|ID=1_2050;partial=00;start_type=ATG;rbs_motif=GGA/GAG/AGG;rbs_spacer=5-10bp;gc_cont=0.325	WP_001096355.1 MULTISPECIES: phage tail assembly chaperone G [Bacteria]	100	99.1	1.17e-74
CP139866.1_2051|2041618|2041755|1|ID=1_2051;partial=00;start_type=ATG;rbs_motif=GGA/GAG/AGG;rbs_spacer=5-10bp;gc_cont=0.275	WP_001549167.1 MULTISPECIES: phage tail assembly chaperone GT [Bacteria]	100	97.8	3.48e-24
CP139866.1_2052|2041812|2046341|1|ID=1_2052;partial=00;start_type=ATG;rbs_motif=AGGAG;rbs_spacer=5-10bp;gc_cont=0.365	WP_031872061.1 phage tail tape measure protein [Staphylococcus aureus]	99.9	99.9	0.0
CP139866.1_2053|2046338|2046790|1|ID=1_2053;partial=00;start_type=ATG;rbs_motif=AGGA/GGAG/GAGG;rbs_spacer=11-12bp;gc_cont=0.318	WP_216758323.1 phage tail domain-containing protein, partial [Staphylococcus aureus]	100	91.4	1.82e-98
CP139866.1_2054|2046852|2047823|1|ID=1_2054;partial=00;start_type=ATG;rbs_motif=None;rbs_spacer=None;gc_cont=0.355	WP_234105827.1 phage distal tail protein, partial [Staphylococcus aureus]	100	99.7	5.13e-244
CP139866.1_2055|2047839|2051519|1|ID=1_2055;partial=00;start_type=GTG;rbs_motif=AGGAG;rbs_spacer=5-10bp;gc_cont=0.347	WP_000582140.1 phage tail spike protein [Staphylococcus aureus]	100	99.9	0.0
CP139866.1_2056|2051506|2051658|1|ID=1_2056;partial=00;start_type=ATG;rbs_motif=AGGAG;rbs_spacer=5-10bp;gc_cont=0.307	WP_001181555.1 hypothetical protein [Staphylococcus aureus]	100	98.0	7.10e-26
CP139866.1_2057|2051705|2051992|1|ID=1_2057;partial=00;start_type=ATG;rbs_motif=AGGAGG;rbs_spacer=5-10bp;gc_cont=0.319	WP_031811591.1 phage protein [Staphylococcus aureus]	98.9	99.0	1.41e-54
CP139866.1_2058|2052050|2052346|1|ID=1_2058;partial=00;start_type=TTG;rbs_motif=None;rbs_spacer=None;gc_cont=0.343	WP_000539688.1 MULTISPECIES: DUF2951 domain-containing protein [Bacteria]	100	99.0	3.26e-59
CP139866.1_2059|2052884|2053186|1|ID=1_2059;partial=00;start_type=ATG;rbs_motif=AGGAG;rbs_spacer=5-10bp;gc_cont=0.340	WP_000387656.1 phage holin [Staphylococcus aureus]	100	99.0	9.62e-62
CP139866.1_2060|2053198|2054382|1|ID=1_2060;partial=00;start_type=ATG;rbs_motif=GGA/GAG/AGG;rbs_spacer=5-10bp;gc_cont=0.349	WP_215394908.1 N-acetylmuramoyl-L-alanine amidase, partial [Staphylococcus aureus]	100	97.0	5.24e-287
CP139866.1_2061|2054357|2054653|1|ID=1_2061;partial=00;start_type=GTG;rbs_motif=None;rbs_spacer=None;gc_cont=0.347	WP_189234560.1 SH3 domain-containing protein, partial [Staphylococcus aureus]	98.0	99.0	9.51e-64
CP139866.1_2062|2054748|2055197|-1|ID=1_2062;partial=00;start_type=ATG;rbs_motif=AGGAG(G)/GGAGG;rbs_spacer=13-15bp;gc_cont=0.280	WP_000727649.1 MULTISPECIES: chemotaxis-inhibiting protein CHIPS [Bacteria]	100	99.3	1.96e-100
CP139866.1_2063|2055882|2056232|1|ID=1_2063;partial=00;start_type=ATG;rbs_motif=AGGAG;rbs_spacer=5-10bp;gc_cont=0.291	WP_000702263.1 MULTISPECIES: complement inhibitor SCIN-A [Bacteria]	100	99.1	1.48e-68
CP139866.1_2064|2057408|2057608|-1|ID=1_2064;partial=00;start_type=ATG;rbs_motif=AGGAG;rbs_spacer=5-10bp;gc_cont=0.333	WP_000239614.1 MULTISPECIES: phospholipase [Staphylococcus]	100	97.0	5.98e-36
CP139866.1_2065|2057994|2059349|1|ID=1_2065;partial=00;start_type=ATG;rbs_motif=AGGAG;rbs_spacer=5-10bp;gc_cont=0.291	WP_031863970.1 extracellular adherence protein Eap/Map, partial [Staphylococcus aureus]	100	99.6	2.51e-308
CP139866.1_2066|2059360|2060064|1|ID=1_2066;partial=00;start_type=TTG;rbs_motif=None;rbs_spacer=None;gc_cont=0.294	WP_142255472.1 MAP domain-containing protein, partial [Staphylococcus aureus]	99.6	99.6	1.12e-156
CP139866.1_2067|2060335|2061621|-1|ID=1_2067;partial=00;start_type=ATG;rbs_motif=GGAG/GAGG;rbs_spacer=5-10bp;gc_cont=0.333	WP_001068535.1 aminotransferase class I/II-fold pyridoxal phosphate-dependent enzyme [Staphylococcus aureus]	100	99.8	1.35e-310
CP139866.1_2068|2062520|2062975|1|ID=1_2068;partial=00;start_type=ATG;rbs_motif=None;rbs_spacer=None;gc_cont=0.320	WP_218790478.1 PSM export ABC transporter transcriptional regulator PmtR, partial [Escherichia coli]	99.3	88.2	6.97e-85
CP139866.1_2069|2062972|2063868|1|ID=1_2069;partial=00;start_type=ATG;rbs_motif=AGGAG;rbs_spacer=5-10bp;gc_cont=0.314	WP_000991294.1 phenol-soluble modulin export ABC transporter ATP-binding protein PmtA [Staphylococcus aureus]	100	99.7	2.04e-212
CP139866.1_2070|2063869|2064549|1|ID=1_2070;partial=00;start_type=ATG;rbs_motif=GGA/GAG/AGG;rbs_spacer=5-10bp;gc_cont=0.270	WP_000645735.1 phenol-soluble modulin export ABC transporter permease subunit PmtB [Staphylococcus aureus]	100	99.6	1.28e-145
CP139866.1_2071|2064546|2065418|1|ID=1_2071;partial=00;start_type=ATG;rbs_motif=AGGAG;rbs_spacer=5-10bp;gc_cont=0.291	WP_000763048.1 MULTISPECIES: phenol-soluble modulin export ABC transporter ATP-binding protein PmtC [Staphylococcus]	100	99.7	1.13e-205
CP139866.1_2072|2065418|2066158|1|ID=1_2072;partial=00;start_type=ATG;rbs_motif=GGAG/GAGG;rbs_spacer=5-10bp;gc_cont=0.277	WP_001221650.1 MULTISPECIES: phenol-soluble modulin export ABC transporter permease subunit PmtD [Staphylococcus]	100	99.6	7.97e-159
CP139866.1_2073|2066222|2066785|-1|ID=1_2073;partial=00;start_type=ATG;rbs_motif=AGGAG;rbs_spacer=5-10bp;gc_cont=0.323	WP_000182842.1 MULTISPECIES: thioredoxin family protein [Staphylococcus]	100	99.5	2.94e-134
CP139866.1_2074|2066906|2067430|1|ID=1_2074;partial=00;start_type=ATG;rbs_motif=GGA/GAG/AGG;rbs_spacer=5-10bp;gc_cont=0.280	WP_000966291.1 membrane protein [Staphylococcus aureus]	100	99.4	1.66e-120
CP139866.1_2075|2067490|2068047|1|ID=1_2075;partial=00;start_type=ATG;rbs_motif=GGA/GAG/AGG;rbs_spacer=5-10bp;gc_cont=0.285	WP_001033968.1 MULTISPECIES: HAAS signaling domain-containing protein [Staphylococcus]	100	99.5	8.71e-101
CP139866.1_2076|2068044|2068886|1|ID=1_2076;partial=00;start_type=ATG;rbs_motif=AGGA/GGAG/GAGG;rbs_spacer=11-12bp;gc_cont=0.294	WP_000713062.1 DUF4097 family beta strand repeat-containing protein [Staphylococcus aureus]	100	99.6	2.92e-148
CP139866.1_2077|2068943|2070055|-1|ID=1_2077;partial=00;start_type=ATG;rbs_motif=None;rbs_spacer=None;gc_cont=0.339	WP_001188070.1 C45 family autoproteolytic acyltransferase/hydolase [Staphylococcus aureus]	100	93.3	7.87e-261
CP139866.1_2079|2070434|2070607|1|ID=1_2079;partial=00;start_type=ATG;rbs_motif=GGAG/GAGG;rbs_spacer=5-10bp;gc_cont=0.247	WP_000267034.1 MULTISPECIES: hypothetical protein [Bacteria]	100	98.3	2.98e-30
CP139866.1_2080|2070664|2071065|-1|ID=1_2080;partial=00;start_type=ATG;rbs_motif=None;rbs_spacer=None;gc_cont=0.336	WP_000205106.1 MULTISPECIES: YolD-like family protein [Staphylococcus]	100	99.3	1.19e-91
CP139866.1_2081|2071336|2072364|1|ID=1_2081;partial=00;start_type=ATG;rbs_motif=GGAG/GAGG;rbs_spacer=5-10bp;gc_cont=0.329	WP_000181321.1 6-phosphogluconolactonase [Staphylococcus aureus]	100	99.7	2.62e-253
CP139866.1_2082|2072484|2073863|-1|ID=1_2082;partial=00;start_type=ATG;rbs_motif=AGGA/GGAG/GAGG;rbs_spacer=11-12bp;gc_cont=0.335	WP_001021224.1 MULTISPECIES: aldehyde dehydrogenase [Staphylococcus]	100	99.8	0.0
