CP139866.1_1|4|951|-1|ID=1_1;partial=00;start_type=ATG;rbs_motif=AGGA;rbs_spacer=5-10bp;gc_cont=0.335	WP_000121214.1 IS30-like element ISSau1 family transposase [Staphylococcus aureus]	100	99.7	7.02e-233
CP139866.1_2|1133|1999|-1|ID=1_2;partial=00;start_type=ATG;rbs_motif=AGGAG;rbs_spacer=5-10bp;gc_cont=0.343	WP_000190146.1 2-oxoacid:ferredoxin oxidoreductase subunit beta [Staphylococcus aureus]	100	99.7	1.67e-206
CP139866.1_3|2000|2467|-1|ID=1_3;partial=00;start_type=GTG;rbs_motif=None;rbs_spacer=None;gc_cont=0.338	WP_320156986.1 transketolase C-terminal domain-containing protein, partial [Staphylococcus aureus]	99.4	99.4	3.70e-101
CP139866.1_4|2473|3759|-1|ID=1_4;partial=00;start_type=ATG;rbs_motif=AGGAG;rbs_spacer=5-10bp;gc_cont=0.359	WP_271287241.1 2-oxoacid:acceptor oxidoreductase subunit alpha, partial [Staphylococcus aureus]	99.5	98.6	3.52e-297
CP139866.1_5|3899|4696|-1|ID=1_5;partial=00;start_type=ATG;rbs_motif=AGGA;rbs_spacer=5-10bp;gc_cont=0.348	WP_001222105.1 MULTISPECIES: TIGR00282 family metallophosphoesterase [Staphylococcus]	100	99.6	4.24e-193
CP139866.1_6|4870|5085|1|ID=1_6;partial=00;start_type=ATG;rbs_motif=AGGAG(G)/GGAGG;rbs_spacer=13-15bp;gc_cont=0.269	WP_000026308.1 MULTISPECIES: hypothetical protein [Staphylococcus]	100	98.6	1.38e-41
CP139866.1_7|5381|6940|-1|ID=1_7;partial=00;start_type=GTG;rbs_motif=AGGAG;rbs_spacer=5-10bp;gc_cont=0.357	WP_001050909.1 ribonuclease Y [Staphylococcus aureus]	100	99.8	7.53e-299
CP139866.1_8|7294|8337|-1|ID=1_8;partial=00;start_type=TTG;rbs_motif=AGGAG;rbs_spacer=5-10bp;gc_cont=0.374	WP_000368166.1 MULTISPECIES: recombinase RecA [Staphylococcus]	100	99.7	7.07e-240
CP139866.1_9|8502|9653|-1|ID=1_9;partial=00;start_type=ATG;rbs_motif=GGA/GAG/AGG;rbs_spacer=5-10bp;gc_cont=0.306	WP_000020355.1 MULTISPECIES: CinA family nicotinamide mononucleotide deamidase-related protein [Staphylococcus]	100	99.7	9.83e-272
CP139866.1_10|9878|10456|-1|ID=1_10;partial=00;start_type=ATG;rbs_motif=GGAG/GAGG;rbs_spacer=5-10bp;gc_cont=0.307	WP_001025093.1 MULTISPECIES: CDP-diacylglycerol--glycerol-3-phosphate 3-phosphatidyltransferase [Staphylococcus]	100	99.5	3.36e-122
CP139866.1_11|10490|10882|-1|ID=1_11;partial=00;start_type=TTG;rbs_motif=AGGAG;rbs_spacer=5-10bp;gc_cont=0.308	WP_000859443.1 MULTISPECIES: helix-turn-helix domain-containing protein [Staphylococcus]	100	99.2	1.84e-80
CP139866.1_12|10901|11728|-1|ID=1_12;partial=00;start_type=ATG;rbs_motif=GGAG/GAGG;rbs_spacer=5-10bp;gc_cont=0.335	WP_000214890.1 MULTISPECIES: YmfK family protein [Staphylococcus]	100	99.6	1.12e-193
CP139866.1_13|11833|12537|-1|ID=1_13;partial=00;start_type=ATG;rbs_motif=AGGA/GGAG/GAGG;rbs_spacer=11-12bp;gc_cont=0.339	WP_000646222.1 MULTISPECIES: elongation factor P 5-aminopentanone reductase [Staphylococcus]	100	99.6	5.97e-164
CP139866.1_14|12537|13823|-1|ID=1_14;partial=00;start_type=ATG;rbs_motif=AGGAG;rbs_spacer=5-10bp;gc_cont=0.308	WP_000664762.1 EF-P 5-aminopentanol modification-associated protein YfmH [Staphylococcus aureus]	100	99.8	1.29e-308
CP139866.1_15|13823|14140|-1|ID=1_15;partial=00;start_type=GTG;rbs_motif=None;rbs_spacer=None;gc_cont=0.311	WP_142297659.1 M16 family metallopeptidase, partial [Staphylococcus aureus]	91.3	98.1	3.75e-54
CP139866.1_16|14088|15089|-1|ID=1_16;partial=00;start_type=TTG;rbs_motif=AGGAG;rbs_spacer=5-10bp;gc_cont=0.298	WP_095975448.1 EF-P 5-aminopentanol modification-associated protein YfmF, partial [Staphylococcus aureus]	100	98.2	5.62e-236
CP139866.1_17|15120|15833|-1|ID=1_17;partial=00;start_type=ATG;rbs_motif=GGAG/GAGG;rbs_spacer=5-10bp;gc_cont=0.312	WP_001293309.1 GntR family transcriptional regulator [Staphylococcus aureus]	100	99.6	4.72e-167
CP139866.1_18|15838|18207|-1|ID=1_18;partial=00;start_type=TTG;rbs_motif=AGGAG;rbs_spacer=5-10bp;gc_cont=0.337	WP_251926101.1 FtsK/SpoIIIE family DNA translocase [Staphylococcus aureus]	99.4	99.9	0.0
CP139866.1_19|18463|20187|-1|ID=1_19;partial=00;start_type=ATG;rbs_motif=None;rbs_spacer=None;gc_cont=0.333	WP_000052590.1 MULTISPECIES: ribonuclease J2 [Staphylococcus]	99.8	96.9	0.0
CP139866.1_21|20458|22467|-1|ID=1_21;partial=00;start_type=ATG;rbs_motif=AGGAG;rbs_spacer=5-10bp;gc_cont=0.371	WP_374749783.1 polyribonucleotide nucleotidyltransferase [Staphylococcus aureus]	97.4	99.3	0.0
CP139866.1_22|22836|23105|-1|ID=1_22;partial=00;start_type=ATG;rbs_motif=AGGAG;rbs_spacer=5-10bp;gc_cont=0.356	WP_001018328.1 MULTISPECIES: 30S ribosomal protein S15 [Bacteria]	100	98.9	7.52e-54
CP139866.1_23|23220|24191|-1|ID=1_23;partial=00;start_type=ATG;rbs_motif=AGGAG;rbs_spacer=5-10bp;gc_cont=0.330	WP_000864185.1 MULTISPECIES: riboflavin biosynthesis protein RibF [Staphylococcus]	100	99.7	3.92e-234
CP139866.1_24|24206|25123|-1|ID=1_24;partial=00;start_type=ATG;rbs_motif=GGA/GAG/AGG;rbs_spacer=5-10bp;gc_cont=0.324	WP_000282292.1 tRNA pseudouridine(55) synthase TruB [Staphylococcus aureus]	100	99.7	2.70e-216
CP139866.1_25|25293|25685|-1|ID=1_25;partial=00;start_type=ATG;rbs_motif=None;rbs_spacer=None;gc_cont=0.300	WP_000097322.1 MULTISPECIES: 30S ribosome-binding factor RbfA [Staphylococcus]	100	88.5	4.90e-73
CP139866.1_26|26029|28146|-1|ID=1_26;partial=00;start_type=ATG;rbs_motif=AGGAG;rbs_spacer=5-10bp;gc_cont=0.342	WP_000043640.1 translation initiation factor IF-2 [Staphylococcus aureus]	100	99.9	0.0
CP139866.1_27|28151|28468|-1|ID=1_27;partial=00;start_type=ATG;rbs_motif=GGA/GAG/AGG;rbs_spacer=5-10bp;gc_cont=0.318	WP_000020856.1 MULTISPECIES: YlxQ family RNA-binding protein [Staphylococcus]	100	99.1	4.63e-69
CP139866.1_28|28465|28728|-1|ID=1_28;partial=00;start_type=ATG;rbs_motif=None;rbs_spacer=None;gc_cont=0.318	WP_001224173.1 RNase P modulator RnpM [Staphylococcus aureus]	100	98.9	6.28e-52
CP139866.1_29|28771|29946|-1|ID=1_29;partial=00;start_type=GTG;rbs_motif=AGGAG;rbs_spacer=5-10bp;gc_cont=0.358	WP_000097464.1 transcription termination factor NusA [Staphylococcus aureus]	99.7	99.7	2.79e-266
CP139866.1_30|29967|30434|-1|ID=1_30;partial=00;start_type=ATG;rbs_motif=GGAG/GAGG;rbs_spacer=5-10bp;gc_cont=0.327	WP_000036631.1 MULTISPECIES: ribosome maturation factor RimP [Staphylococcus]	100	99.4	3.21e-102
CP139866.1_31|30724|31884|-1|ID=1_31;partial=00;start_type=ATG;rbs_motif=None;rbs_spacer=None;gc_cont=0.344	WP_060643234.1 helix-hairpin-helix domain-containing protein [Staphylococcus aureus]	99.7	99.7	2.18e-281
CP139866.1_32|31896|35033|-1|ID=1_32;partial=00;start_type=ATG;rbs_motif=None;rbs_spacer=None;gc_cont=0.347	WP_371504358.1 PolC-type DNA polymerase III [Staphylococcus aureus]	99.7	99.9	0.0
CP139866.1_33|35296|36999|-1|ID=1_33;partial=00;start_type=ATG;rbs_motif=AGGAGG;rbs_spacer=5-10bp;gc_cont=0.352	WP_000814088.1 proline--tRNA ligase [Staphylococcus aureus]	100	99.8	0.0
CP139866.1_34|37019|38305|-1|ID=1_34;partial=00;start_type=GTG;rbs_motif=GGAG/GAGG;rbs_spacer=5-10bp;gc_cont=0.335	WP_000121122.1 MULTISPECIES: RIP metalloprotease RseP [Staphylococcus]	100	99.8	1.32e-301
CP139866.1_35|38517|39299|-1|ID=1_35;partial=00;start_type=ATG;rbs_motif=AGGAG;rbs_spacer=5-10bp;gc_cont=0.322	WP_000868413.1 MULTISPECIES: phosphatidate cytidylyltransferase [Staphylococcus]	100	99.6	1.90e-173
CP139866.1_36|39306|40109|-1|ID=1_36;partial=00;start_type=ATG;rbs_motif=None;rbs_spacer=None;gc_cont=0.307	WP_000473705.1 MULTISPECIES: isoprenyl transferase [Staphylococcus]	100	95.5	1.62e-184
CP139866.1_37|40449|41003|-1|ID=1_37;partial=00;start_type=ATG;rbs_motif=GGAG/GAGG;rbs_spacer=5-10bp;gc_cont=0.351	WP_001280006.1 MULTISPECIES: ribosome recycling factor [Staphylococcus]	100	99.5	1.89e-115
CP139866.1_38|41022|41744|-1|ID=1_38;partial=00;start_type=ATG;rbs_motif=GGAG/GAGG;rbs_spacer=5-10bp;gc_cont=0.364	WP_000057330.1 MULTISPECIES: UMP kinase [Staphylococcus]	100	99.6	1.15e-164
CP139866.1_39|41881|42789|-1|ID=1_39;partial=00;start_type=ATG;rbs_motif=None;rbs_spacer=None;gc_cont=0.362	WP_000146715.1 translation elongation factor Ts [Staphylococcus aureus]	98.6	94.4	3.07e-191
CP139866.1_40|42947|43636|-1|ID=1_40;partial=00;start_type=ATG;rbs_motif=GGA/GAG/AGG;rbs_spacer=5-10bp;gc_cont=0.343	WP_011447007.1 30S ribosomal protein S2, partial [Staphylococcus aureus]	100	99.6	7.38e-152
CP139866.1_41|44055|44828|-1|ID=1_41;partial=00;start_type=ATG;rbs_motif=AGGAG;rbs_spacer=5-10bp;gc_cont=0.318	WP_000055337.1 MULTISPECIES: GTP-sensing pleiotropic transcriptional regulator CodY [Staphylococcus]	100	99.6	3.40e-170
CP139866.1_42|44853|46256|-1|ID=1_42;partial=00;start_type=ATG;rbs_motif=GGAG/GAGG;rbs_spacer=5-10bp;gc_cont=0.348	WP_000379054.1 MULTISPECIES: ATP-dependent protease ATPase subunit HslU [Staphylococcus]	100	99.8	0.0
CP139866.1_43|46322|46867|-1|ID=1_43;partial=00;start_type=ATG;rbs_motif=AGGAG;rbs_spacer=5-10bp;gc_cont=0.399	WP_000072681.1 MULTISPECIES: ATP-dependent protease subunit HslV [Staphylococcus]	100	99.5	6.66e-119
CP139866.1_44|46864|47418|-1|ID=1_44;partial=00;start_type=ATG;rbs_motif=None;rbs_spacer=None;gc_cont=0.350	WP_104447087.1 tyrosine recombinase XerC, partial [Staphylococcus aureus]	100	99.5	2.78e-126
CP139866.1_45|47394|47759|-1|ID=1_45;partial=00;start_type=TTG;rbs_motif=GGAG/GAGG;rbs_spacer=5-10bp;gc_cont=0.276	WP_258026997.1 site-specific integrase, partial [Staphylococcus aureus]	93.6	90.2	1.28e-65
CP139866.1_46|48176|49483|-1|ID=1_46;partial=00;start_type=ATG;rbs_motif=AGGAG;rbs_spacer=5-10bp;gc_cont=0.357	WP_085061234.1 methylenetetrahydrofolate--tRNA-(uracil(54)-C(5))-methyltransferase (FADH(2)-oxidizing) TrmFO [Staphylococcus aureus]	100	99.8	1.38e-315
CP139866.1_47|49639|51714|-1|ID=1_47;partial=00;start_type=ATG;rbs_motif=GGAG/GAGG;rbs_spacer=5-10bp;gc_cont=0.351	WP_001807811.1 type I DNA topoisomerase [Staphylococcus aureus]	100	99.9	0.0
CP139866.1_48|51888|52628|-1|ID=1_48;partial=00;start_type=GTG;rbs_motif=None;rbs_spacer=None;gc_cont=0.308	WP_001803335.1 DNA-processing protein DprA [Staphylococcus aureus]	99.6	99.6	5.30e-173
CP139866.1_49|52645|52785|-1|ID=1_49;partial=00;start_type=ATG;rbs_motif=None;rbs_spacer=None;gc_cont=0.298	WP_205347430.1 DNA-processing protein DprA, partial [Staphylococcus aureus]	94.6	78.7	3.53e-16
CP139866.1_50|52932|53162|-1|ID=1_50;partial=00;start_type=ATG;rbs_motif=None;rbs_spacer=None;gc_cont=0.286	WP_000501561.1 peptidoglycan bridge formation glycyltransferase FemA/FemB family protein [Staphylococcus aureus]	100	98.7	1.94e-50
CP139866.1_51|53166|53711|-1|ID=1_51;partial=00;start_type=GTG;rbs_motif=None;rbs_spacer=None;gc_cont=0.251	WP_412549124.1 FemA/FemB family glycyltransferase FmhC, partial [Staphylococcus aureus]	98.3	97.3	2.36e-113
CP139866.1_52|53690|54175|-1|ID=1_52;partial=00;start_type=ATG;rbs_motif=AGGA;rbs_spacer=5-10bp;gc_cont=0.263	WP_269845180.1 peptidoglycan bridge formation glycyltransferase FemA/FemB family protein [Staphylococcus aureus]	99.4	99.4	4.32e-112
CP139866.1_53|54203|54415|-1|ID=1_53;partial=00;start_type=ATG;rbs_motif=AGGA;rbs_spacer=5-10bp;gc_cont=0.277	WP_202597067.1 YSIRK-type signal peptide-containing protein, partial [Staphylococcus aureus]	100	98.6	9.11e-46
CP139866.1_54|54642|55421|-1|ID=1_54;partial=00;start_type=GTG;rbs_motif=None;rbs_spacer=None;gc_cont=0.383	WP_142298350.1 succinate--CoA ligase subunit alpha, partial [Staphylococcus aureus]	96.8	97.3	4.76e-170
CP139866.1_55|55363|55551|-1|ID=1_55;partial=00;start_type=ATG;rbs_motif=GGAG/GAGG;rbs_spacer=5-10bp;gc_cont=0.370	WP_347336190.1 CoA-binding protein, partial [Staphylococcus aureus]	98.4	96.8	1.12e-33
CP139866.1_56|55634|56740|-1|ID=1_56;partial=00;start_type=ATG;rbs_motif=AGGAG;rbs_spacer=5-10bp;gc_cont=0.354	WP_031864737.1 ADP-forming succinate--CoA ligase subunit beta [Staphylococcus aureus]	100	98.1	2.00e-250
CP139866.1_57|56849|57616|-1|ID=1_57;partial=00;start_type=ATG;rbs_motif=GGAG/GAGG;rbs_spacer=5-10bp;gc_cont=0.349	WP_000176395.1 ribonuclease HII [Staphylococcus aureus]	100	99.6	2.33e-176
CP139866.1_58|57600|58484|-1|ID=1_58;partial=00;start_type=ATG;rbs_motif=GGA/GAG/AGG;rbs_spacer=5-10bp;gc_cont=0.333	WP_000236722.1 MULTISPECIES: ribosome biogenesis GTPase YlqF [Staphylococcus]	100	99.7	4.81e-209
CP139866.1_59|58885|61491|1|ID=1_59;partial=00;start_type=GTG;rbs_motif=GGAG/GAGG;rbs_spacer=5-10bp;gc_cont=0.299	WP_000915234.1 lipoteichoic acid-specific glycosyltransferase YfhO [Staphylococcus aureus]	100	99.9	0.0
CP139866.1_60|61733|62083|-1|ID=1_60;partial=00;start_type=ATG;rbs_motif=AGGAG;rbs_spacer=5-10bp;gc_cont=0.387	WP_000181404.1 MULTISPECIES: 50S ribosomal protein L19 [Staphylococcus]	100	99.1	2.76e-73
CP139866.1_61|62186|62923|-1|ID=1_61;partial=00;start_type=ATG;rbs_motif=AGGA/GGAG/GAGG;rbs_spacer=11-12bp;gc_cont=0.352	WP_000687328.1 MULTISPECIES: tRNA (guanosine(37)-N1)-methyltransferase TrmD [Staphylococcus]	100	99.6	2.02e-181
CP139866.1_62|62923|63426|-1|ID=1_62;partial=00;start_type=ATG;rbs_motif=GGAG/GAGG;rbs_spacer=5-10bp;gc_cont=0.321	WP_001261979.1 ribosome maturation factor RimM [Staphylococcus aureus]	100	99.4	3.67e-116
CP139866.1_63|63614|63889|-1|ID=1_63;partial=00;start_type=ATG;rbs_motif=AGGAG;rbs_spacer=5-10bp;gc_cont=0.359	WP_000268754.1 MULTISPECIES: 30S ribosomal protein S16 [Staphylococcus]	100	98.9	9.37e-58
CP139866.1_64|64324|65292|-1|ID=1_64;partial=00;start_type=ATG;rbs_motif=None;rbs_spacer=None;gc_cont=0.346	WP_205406696.1 signal recognition particle protein, partial [Staphylococcus aureus]	100	99.7	1.23e-219
CP139866.1_65|65718|66050|-1|ID=1_65;partial=00;start_type=ATG;rbs_motif=AGGA;rbs_spacer=5-10bp;gc_cont=0.273	WP_000531318.1 putative DNA-binding protein [Staphylococcus aureus]	96.4	99.1	2.15e-56
CP139866.1_66|66037|66816|-1|ID=1_66;partial=00;start_type=GTG;rbs_motif=None;rbs_spacer=None;gc_cont=0.358	WP_423143359.1 signal recognition particle-docking protein FtsY, partial [Staphylococcus aureus]	98.4	98.5	6.53e-176
CP139866.1_67|66767|67288|-1|ID=1_67;partial=00;start_type=ATG;rbs_motif=AGGAG;rbs_spacer=5-10bp;gc_cont=0.331	WP_431523010.1 signal recognition particle receptor subunit alpha, partial [Staphylococcus aureus]	100	94.3	2.35e-103
CP139866.1_68|67288|70854|-1|ID=1_68;partial=00;start_type=ATG;rbs_motif=AGGAG;rbs_spacer=5-10bp;gc_cont=0.322	WP_000262716.1 chromosome segregation protein SMC [Staphylococcus aureus]	100	99.9	0.0
CP139866.1_69|71001|71732|-1|ID=1_69;partial=00;start_type=ATG;rbs_motif=AGGAG;rbs_spacer=5-10bp;gc_cont=0.342	WP_000043237.1 MULTISPECIES: ribonuclease III [Staphylococcus]	100	99.6	3.32e-170
CP139866.1_70|71848|72081|-1|ID=1_70;partial=00;start_type=GTG;rbs_motif=AGGAG;rbs_spacer=5-10bp;gc_cont=0.346	WP_000426914.1 MULTISPECIES: acyl carrier protein [Bacilli]	100	98.7	5.35e-44
CP139866.1_72|72675|73409|-1|ID=1_72;partial=00;start_type=ATG;rbs_motif=AGGA;rbs_spacer=5-10bp;gc_cont=0.363	WP_000167269.1 MULTISPECIES: 3-oxoacyl-[acyl-carrier-protein] reductase [Staphylococcus]	100	99.6	3.03e-162
CP139866.1_73|73402|74277|-1|ID=1_73;partial=00;start_type=ATG;rbs_motif=None;rbs_spacer=None;gc_cont=0.332	WP_000047357.1 ACP S-malonyltransferase [Staphylococcus aureus]	100	99.7	7.67e-204
CP139866.1_74|74320|75126|-1|ID=1_74;partial=00;start_type=ATG;rbs_motif=None;rbs_spacer=None;gc_cont=0.353	WP_031869521.1 phosphate acyltransferase PlsX, partial [Staphylococcus aureus]	100	99.6	1.00e-180
CP139866.1_75|75171|75326|-1|ID=1_75;partial=00;start_type=ATG;rbs_motif=None;rbs_spacer=None;gc_cont=0.340	WP_309459652.1 phosphate acyltransferase PlsX, partial [Bacillus thuringiensis]	97.6	80.8	1.78e-17
CP139866.1_76|75310|75882|-1|ID=1_76;partial=00;start_type=ATG;rbs_motif=GGA/GAG/AGG;rbs_spacer=5-10bp;gc_cont=0.318	WP_001548538.1 MULTISPECIES: transcription factor FapR [Staphylococcus]	100	99.5	9.38e-128
CP139866.1_77|76085|78145|-1|ID=1_77;partial=00;start_type=TTG;rbs_motif=GGA/GAG/AGG;rbs_spacer=5-10bp;gc_cont=0.337	WP_001151513.1 ATP-dependent DNA helicase RecG [Staphylococcus aureus]	100	99.9	0.0
CP139866.1_78|78335|79981|-1|ID=1_78;partial=00;start_type=ATG;rbs_motif=AGGAGG;rbs_spacer=5-10bp;gc_cont=0.339	WP_000623896.1 fatty acid kinase catalytic subunit FakA [Staphylococcus aureus]	100	99.8	0.0
CP139866.1_79|79996|80370|-1|ID=1_79;partial=00;start_type=ATG;rbs_motif=AGGAG;rbs_spacer=5-10bp;gc_cont=0.325	WP_000171418.1 MULTISPECIES: Asp23/Gls24 family envelope stress response protein [Staphylococcus]	100	99.2	1.13e-78
CP139866.1_80|80813|81001|1|ID=1_80;partial=00;start_type=ATG;rbs_motif=AGGAG;rbs_spacer=5-10bp;gc_cont=0.376	WP_000517908.1 MULTISPECIES: 50S ribosomal protein L28 [Staphylococcus]	100	98.4	1.90e-35
CP139866.1_81|81382|82023|-1|ID=1_81;partial=00;start_type=ATG;rbs_motif=GGA/GAG/AGG;rbs_spacer=5-10bp;gc_cont=0.324	WP_000547904.1 MULTISPECIES: thiamine diphosphokinase [Staphylococcus]	100	99.5	8.55e-149
CP139866.1_82|82030|82674|-1|ID=1_82;partial=00;start_type=ATG;rbs_motif=GGA/GAG/AGG;rbs_spacer=11-12bp;gc_cont=0.335	WP_000164332.1 MULTISPECIES: ribulose-phosphate 3-epimerase [Staphylococcus]	100	99.5	1.17e-151
CP139866.1_83|82675|83550|-1|ID=1_83;partial=00;start_type=TTG;rbs_motif=GGAG/GAGG;rbs_spacer=5-10bp;gc_cont=0.315	WP_000847931.1 ribosome small subunit-dependent GTPase A [Staphylococcus aureus]	100	99.7	2.91e-213
CP139866.1_84|83778|84062|-1|ID=1_84;partial=00;start_type=TTG;rbs_motif=None;rbs_spacer=None;gc_cont=0.302	WP_258027181.1 PASTA domain-containing protein, partial [Staphylococcus aureus]	97.8	94.7	9.24e-52
CP139866.1_85|84007|85773|-1|ID=1_85;partial=00;start_type=ATG;rbs_motif=GGA/GAG/AGG;rbs_spacer=5-10bp;gc_cont=0.338	WP_374748544.1 serine/threonine protein kinase Stk1 [Staphylococcus aureus]	100	98.1	0.0
CP139866.1_86|85770|86513|-1|ID=1_86;partial=00;start_type=ATG;rbs_motif=GGAG/GAGG;rbs_spacer=5-10bp;gc_cont=0.325	WP_065211496.1 protein-serine/threonine phosphatase Stp1 [Staphylococcus aureus]	94.7	99.6	2.06e-166
CP139866.1_87|86520|87614|-1|ID=1_87;partial=00;start_type=ATG;rbs_motif=AGGA;rbs_spacer=5-10bp;gc_cont=0.337	WP_000626897.1 MULTISPECIES: 23S rRNA (adenine(2503)-C(2))-methyltransferase RlmN [Staphylococcus]	100	99.7	2.87e-259
CP139866.1_88|87617|88924|-1|ID=1_88;partial=00;start_type=ATG;rbs_motif=AGxAGG/AGGxGG;rbs_spacer=11-12bp;gc_cont=0.335	WP_000572239.1 16S rRNA (cytosine(967)-C(5))-methyltransferase RsmB [Staphylococcus aureus]	100	99.8	0.0
CP139866.1_89|88921|89856|-1|ID=1_89;partial=00;start_type=ATG;rbs_motif=AGGA/GGAG/GAGG;rbs_spacer=11-12bp;gc_cont=0.350	WP_000161301.1 methionyl-tRNA formyltransferase [Staphylococcus aureus]	100	99.7	7.43e-217
CP139866.1_90|89849|90337|-1|ID=1_90;partial=00;start_type=ATG;rbs_motif=AGGAG;rbs_spacer=5-10bp;gc_cont=0.339	WP_000985287.1 MULTISPECIES: peptide deformylase [Staphylococcus]	100	99.4	2.14e-108
CP139866.1_91|90636|90839|1|ID=1_91;partial=00;start_type=ATG;rbs_motif=GGAG/GAGG;rbs_spacer=5-10bp;gc_cont=0.304	WP_001198022.1 TM2 domain-containing protein [Staphylococcus aureus]	100	98.5	1.22e-40
CP139866.1_92|90977|91948|-1|ID=1_92;partial=00;start_type=ATG;rbs_motif=AGGAG;rbs_spacer=5-10bp;gc_cont=0.317	WP_374750177.1 hypothetical protein [Staphylococcus aureus]	94.1	99.7	4.92e-196
CP139866.1_93|92451|94859|-1|ID=1_93;partial=00;start_type=ATG;rbs_motif=GGA/GAG/AGG;rbs_spacer=5-10bp;gc_cont=0.345	WP_000560853.1 primosomal protein N' [Staphylococcus aureus]	99.9	99.9	0.0
CP139866.1_94|94859|96058|-1|ID=1_94;partial=00;start_type=ATG;rbs_motif=GGAG/GAGG;rbs_spacer=5-10bp;gc_cont=0.350	WP_000722168.1 bifunctional phosphopantothenoylcysteine decarboxylase/phosphopantothenate--cysteine ligase CoaBC [Staphylococcus aureus]	100	99.8	1.17e-278
CP139866.1_95|96274|96492|-1|ID=1_95;partial=00;start_type=ATG;rbs_motif=GGAG/GAGG;rbs_spacer=5-10bp;gc_cont=0.329	WP_000933956.1 MULTISPECIES: DNA-directed RNA polymerase subunit omega [Staphylococcaceae]	100	98.6	3.76e-44
CP139866.1_96|96492|97115|-1|ID=1_96;partial=00;start_type=ATG;rbs_motif=GGAG/GAGG;rbs_spacer=5-10bp;gc_cont=0.335	WP_000368225.1 MULTISPECIES: guanylate kinase [Staphylococcus]	100	99.5	1.12e-141
CP139866.1_97|97390|99087|1|ID=1_97;partial=00;start_type=ATG;rbs_motif=GGA/GAG/AGG;rbs_spacer=5-10bp;gc_cont=0.320	WP_000312759.1 Rqc2 family fibronectin-binding protein [Staphylococcus aureus]	100	99.8	0.0
CP139866.1_98|99350|99751|-1|ID=1_98;partial=00;start_type=ATG;rbs_motif=AGGAG;rbs_spacer=5-10bp;gc_cont=0.336	WP_000354182.1 VOC family protein [Staphylococcus aureus]	100	99.3	2.91e-92
CP139866.1_99|100188|100400|-1|ID=1_99;partial=00;start_type=ATG;rbs_motif=AGGAGG;rbs_spacer=5-10bp;gc_cont=0.254	WP_000998559.1 MULTISPECIES: hypothetical protein [Staphylococcus]	100	98.6	4.48e-42
CP139866.1_100|100430|101041|-1|ID=1_100;partial=00;start_type=ATG;rbs_motif=None;rbs_spacer=None;gc_cont=0.327	WP_001040248.1 MULTISPECIES: orotate phosphoribosyltransferase [Staphylococcus]	100	99.5	2.19e-137
CP139866.1_101|101041|101736|-1|ID=1_101;partial=00;start_type=ATG;rbs_motif=GGAG/GAGG;rbs_spacer=5-10bp;gc_cont=0.343	WP_000654070.1 orotidine-5'-phosphate decarboxylase [Staphylococcus aureus]	100	99.1	1.26e-161
CP139866.1_102|101843|105016|-1|ID=1_102;partial=00;start_type=ATG;rbs_motif=AGGAG;rbs_spacer=5-10bp;gc_cont=0.357	WP_001126260.1 carbamoyl-phosphate synthase large subunit [Staphylococcus aureus]	100	99.9	0.0
CP139866.1_103|105009|106109|-1|ID=1_103;partial=00;start_type=ATG;rbs_motif=GGA/GAG/AGG;rbs_spacer=5-10bp;gc_cont=0.354	WP_001190909.1 carbamoyl phosphate synthase small subunit [Staphylococcus aureus]	100	99.7	2.05e-269
CP139866.1_104|106111|107220|-1|ID=1_104;partial=00;start_type=ATG;rbs_motif=GGA/GAG/AGG;rbs_spacer=5-10bp;gc_cont=0.365	WP_000767027.1 dihydroorotase [Staphylococcus aureus]	100	97.3	1.61e-265
CP139866.1_105|107186|107389|-1|ID=1_105;partial=00;start_type=ATG;rbs_motif=GGA/GAG/AGG;rbs_spacer=5-10bp;gc_cont=0.343	WP_031795791.1 amidohydrolase family protein, partial [Staphylococcus aureus]	100	92.6	4.78e-37
CP139866.1_106|107404|108285|-1|ID=1_106;partial=00;start_type=ATG;rbs_motif=AGGAG;rbs_spacer=5-10bp;gc_cont=0.316	WP_001016166.1 MULTISPECIES: aspartate carbamoyltransferase catalytic subunit [Staphylococcus]	100	99.7	1.89e-210
CP139866.1_107|108313|109620|-1|ID=1_107;partial=00;start_type=ATG;rbs_motif=AGGA;rbs_spacer=5-10bp;gc_cont=0.349	WP_311157312.1 uracil-xanthine permease family protein [Staphylococcus aureus]	100	99.8	1.45e-265
CP139866.1_108|109838|110365|-1|ID=1_108;partial=00;start_type=ATG;rbs_motif=GGA/GAG/AGG;rbs_spacer=5-10bp;gc_cont=0.341	WP_000003870.1 MULTISPECIES: bifunctional pyr operon transcriptional regulator/uracil phosphoribosyltransferase PyrR [Staphylococcus]	100	99.4	2.74e-115
CP139866.1_109|110766|111683|-1|ID=1_109;partial=00;start_type=ATG;rbs_motif=AGGAG;rbs_spacer=5-10bp;gc_cont=0.336	WP_000451303.1 MULTISPECIES: RluA family pseudouridine synthase [Staphylococcus]	100	99.7	1.11e-224
CP139866.1_110|111683|112174|-1|ID=1_110;partial=00;start_type=ATG;rbs_motif=GGAG/GAGG;rbs_spacer=5-10bp;gc_cont=0.268	WP_000549208.1 MULTISPECIES: signal peptidase II [Staphylococcus]	100	99.4	1.50e-104
CP139866.1_111|112467|113264|-1|ID=1_111;partial=00;start_type=ATG;rbs_motif=AGGAG;rbs_spacer=5-10bp;gc_cont=0.325	WP_000274845.1 VOC family protein [Staphylococcus aureus]	100	99.6	2.56e-194
CP139866.1_112|113553|116306|-1|ID=1_112;partial=00;start_type=ATG;rbs_motif=AGGAG;rbs_spacer=5-10bp;gc_cont=0.350	WP_000384700.1 isoleucine--tRNA ligase [Staphylococcus aureus]	100	99.9	0.0
CP139866.1_113|116527|117144|-1|ID=1_113;partial=00;start_type=ATG;rbs_motif=AGGAG;rbs_spacer=5-10bp;gc_cont=0.346	WP_001117066.1 MULTISPECIES: DivIVA domain-containing protein [Staphylococcus]	100	99.5	5.92e-127
CP139866.1_114|117168|117974|-1|ID=1_114;partial=00;start_type=ATG;rbs_motif=GGA/GAG/AGG;rbs_spacer=5-10bp;gc_cont=0.310	WP_000232497.1 MULTISPECIES: YlmH family RNA-binding protein [Staphylococcus]	99.3	99.6	3.33e-187
CP139866.1_115|118057|118347|-1|ID=1_115;partial=00;start_type=ATG;rbs_motif=AGGAG;rbs_spacer=5-10bp;gc_cont=0.271	WP_000354112.1 MULTISPECIES: YggT family protein [Staphylococcus]	100	99.0	2.72e-57
CP139866.1_116|118359|118922|-1|ID=1_116;partial=00;start_type=GTG;rbs_motif=AGGAG;rbs_spacer=5-10bp;gc_cont=0.348	WP_000018608.1 MULTISPECIES: cell division protein SepF [Staphylococcus]	100	99.5	2.21e-120
CP139866.1_117|118919|119593|-1|ID=1_117;partial=00;start_type=TTG;rbs_motif=AGGAG;rbs_spacer=5-10bp;gc_cont=0.332	WP_047425035.1 YggS family pyridoxal phosphate-dependent enzyme [Staphylococcus schweitzeri]	98.7	99.6	6.19e-152
CP139866.1_118|119611|120210|-1|ID=1_118;partial=00;start_type=TTG;rbs_motif=None;rbs_spacer=None;gc_cont=0.322	WP_000999335.1 peptidoglycan editing factor PgeF [Staphylococcus aureus]	100	97.0	4.94e-140
CP139866.1_119|120164|120403|-1|ID=1_119;partial=00;start_type=GTG;rbs_motif=None;rbs_spacer=None;gc_cont=0.304	WP_042745345.1 laccase domain-containing protein, partial [Staphylococcus aureus]	100	87.5	4.99e-45
CP139866.1_120|120663|121835|-1|ID=1_120;partial=00;start_type=ATG;rbs_motif=AGGAG;rbs_spacer=5-10bp;gc_cont=0.384	WP_000888997.1 MULTISPECIES: cell division protein FtsZ [Staphylococcus]	100	99.7	1.78e-257
CP139866.1_121|121868|123274|-1|ID=1_121;partial=00;start_type=ATG;rbs_motif=AGGAG;rbs_spacer=5-10bp;gc_cont=0.323	WP_000391032.1 MULTISPECIES: cell division protein FtsA [Staphylococcus]	100	99.8	0.0
CP139866.1_122|123379|124698|-1|ID=1_122;partial=00;start_type=ATG;rbs_motif=GGA/GAG/AGG;rbs_spacer=5-10bp;gc_cont=0.312	WP_000342201.1 cell division protein FtsQ/DivIB [Staphylococcus aureus]	100	99.8	1.46e-267
CP139866.1_123|124714|126063|-1|ID=1_123;partial=00;start_type=ATG;rbs_motif=GGAG/GAGG;rbs_spacer=5-10bp;gc_cont=0.324	WP_000935991.1 MULTISPECIES: UDP-N-acetylmuramoyl-L-alanine--D-glutamate ligase [Staphylococcus]	100	99.8	0.0
CP139866.1_124|126065|127030|-1|ID=1_124;partial=00;start_type=ATG;rbs_motif=AGGAG;rbs_spacer=5-10bp;gc_cont=0.322	WP_000578458.1 MULTISPECIES: phospho-N-acetylmuramoyl-pentapeptide-transferase [Staphylococcus]	100	99.7	2.19e-214
CP139866.1_125|127322|129556|-1|ID=1_125;partial=00;start_type=ATG;rbs_motif=GGA/GAG/AGG;rbs_spacer=11-12bp;gc_cont=0.345	WP_001118657.1 penicillin-binding protein [Staphylococcus aureus]	99.9	99.9	0.0
