CP132486.1_1|1|1362|1|ID=1_1;partial=10;start_type=Edge;rbs_motif=None;rbs_spacer=None;gc_cont=0.337	WP_315977518.1 terminase large subunit [Staphylococcus aureus]	100	99.8	0.0
CP132486.1_2|1367|2605|1|ID=1_2;partial=00;start_type=GTG;rbs_motif=None;rbs_spacer=None;gc_cont=0.325	WP_001100671.1 MULTISPECIES: phage portal protein [Bacteria]	100	99.8	7.02e-298
CP132486.1_3|2589|3362|1|ID=1_3;partial=00;start_type=ATG;rbs_motif=AGxAGG/AGGxGG;rbs_spacer=5-10bp;gc_cont=0.315	WP_000061862.1 MULTISPECIES: head maturation protease, ClpP-related [Bacteria]	100	99.6	6.14e-173
CP132486.1_4|3329|4537|1|ID=1_4;partial=00;start_type=ATG;rbs_motif=None;rbs_spacer=None;gc_cont=0.326	YP_008058803.1 major capsid protein [Staphylococcus phage StauST398-2]	99.8	99.8	5.85e-285
CP132486.1_5|4606|4884|1|ID=1_5;partial=00;start_type=ATG;rbs_motif=GGA/GAG/AGG;rbs_spacer=5-10bp;gc_cont=0.312	WP_000050973.1 MULTISPECIES: head-tail connector protein [Bacteria]	100	98.9	1.80e-60
CP132486.1_6|4896|5228|1|ID=1_6;partial=00;start_type=ATG;rbs_motif=GGA/GAG/AGG;rbs_spacer=5-10bp;gc_cont=0.276	YP_239941.1 ORF036 [Staphylococcus phage 3A]	98.2	99.1	4.35e-74
CP132486.1_7|5225|5626|1|ID=1_7;partial=00;start_type=ATG;rbs_motif=None;rbs_spacer=None;gc_cont=0.328	YP_010083318.1 minor structural protein [Staphylococcus phage LH1]	100	99.3	7.43e-86
CP132486.1_8|5627|6022|1|ID=1_8;partial=00;start_type=ATG;rbs_motif=AGGA/GGAG/GAGG;rbs_spacer=11-12bp;gc_cont=0.263	WP_001023802.1 MULTISPECIES: DUF3168 domain-containing protein [Bacteria]	100	99.2	1.29e-85
CP132486.1_9|6057|6698|1|ID=1_9;partial=00;start_type=ATG;rbs_motif=AGGAG;rbs_spacer=5-10bp;gc_cont=0.363	WP_000807541.1 MULTISPECIES: major tail protein [Bacteria]	100	99.5	3.93e-154
CP132486.1_10|6790|7245|1|ID=1_10;partial=00;start_type=ATG;rbs_motif=AGGAG;rbs_spacer=5-10bp;gc_cont=0.366	WP_000169127.1 MULTISPECIES: Ig-like domain-containing protein [Bacteria]	100	99.3	4.60e-100
CP132486.1_11|7303|7653|1|ID=1_11;partial=00;start_type=ATG;rbs_motif=AGGAG;rbs_spacer=5-10bp;gc_cont=0.311	WP_000589167.1 MULTISPECIES: phage tail assembly chaperone G [Bacteria]	100	99.1	7.62e-71
CP132486.1_12|7695|7853|1|ID=1_12;partial=00;start_type=ATG;rbs_motif=None;rbs_spacer=None;gc_cont=0.333	WP_000438833.1 MULTISPECIES: hypothetical protein [Bacteria]	100	98.1	2.41e-27
CP132486.1_13|7867|14067|1|ID=1_13;partial=00;start_type=ATG;rbs_motif=AGGAG;rbs_spacer=5-10bp;gc_cont=0.363	WP_001003426.1 phage tail tape measure protein [Staphylococcus aureus]	100	100.0	0.0
CP132486.1_14|14067|14891|1|ID=1_14;partial=00;start_type=ATG;rbs_motif=AGGA/GGAG/GAGG;rbs_spacer=11-12bp;gc_cont=0.307	WP_001190533.1 MULTISPECIES: phage tail family protein [Bacteria]	100	99.6	6.06e-202
CP132486.1_15|14900|16483|1|ID=1_15;partial=00;start_type=ATG;rbs_motif=GGA/GAG/AGG;rbs_spacer=5-10bp;gc_cont=0.305	WP_000384474.1 MULTISPECIES: prophage endopeptidase tail family protein [Bacteria]	100	99.8	0.0
CP132486.1_16|16483|16773|1|ID=1_16;partial=00;start_type=ATG;rbs_motif=AGGA/GGAG/GAGG;rbs_spacer=11-12bp;gc_cont=0.351	WP_000179858.1 MULTISPECIES: hypothetical protein [Bacteria]	100	99.0	1.24e-62
CP132486.1_17|16789|18699|1|ID=1_17;partial=00;start_type=ATG;rbs_motif=AGGA;rbs_spacer=5-10bp;gc_cont=0.357	WP_433978116.1 phage baseplate protein [Staphylococcus aureus]	100	99.8	0.0
CP132486.1_18|18666|20165|1|ID=1_18;partial=00;start_type=ATG;rbs_motif=None;rbs_spacer=None;gc_cont=0.334	YP_007005720.1 BppU family baseplate upper protein [Staphylococcus phage SMSAP5]	100	99.8	0.0
CP132486.1_19|20165|20554|1|ID=1_19;partial=00;start_type=ATG;rbs_motif=AGGAG;rbs_spacer=5-10bp;gc_cont=0.318	WP_001166599.1 MULTISPECIES: DUF2977 domain-containing protein [Bacteria]	100	99.2	1.41e-79
CP132486.1_20|20547|20711|1|ID=1_20;partial=00;start_type=ATG;rbs_motif=AGGAG;rbs_spacer=5-10bp;gc_cont=0.285	WP_000916020.1 MULTISPECIES: XkdX family protein [Bacteria]	100	98.2	4.19e-31
CP132486.1_21|20757|21056|1|ID=1_21;partial=00;start_type=ATG;rbs_motif=GGxGG;rbs_spacer=3-4bp;gc_cont=0.310	WP_061841742.1 DUF2951 family protein [Staphylococcus aureus]	93.9	99.0	1.43e-49
CP132486.1_22|21192|21494|1|ID=1_22;partial=00;start_type=ATG;rbs_motif=AGGAG;rbs_spacer=5-10bp;gc_cont=0.320	WP_000339146.1 MULTISPECIES: phage holin [Bacteria]	100	99.0	1.37e-61
CP132486.1_23|21505|22959|1|ID=1_23;partial=00;start_type=ATG;rbs_motif=GGA/GAG/AGG;rbs_spacer=5-10bp;gc_cont=0.344	WP_000909213.1 MULTISPECIES: N-acetylmuramoyl-L-alanine amidase [Bacteria]	100	99.8	0.0
CP132486.1_24|23681|23935|1|ID=1_24;partial=00;start_type=ATG;rbs_motif=None;rbs_spacer=None;gc_cont=0.365	WP_031863974.1 DUF5327 family protein [Staphylococcus aureus]	96.4	97.6	5.12e-49
CP132486.1_25|24068|24436|1|ID=1_25;partial=00;start_type=ATG;rbs_motif=AGGAG;rbs_spacer=5-10bp;gc_cont=0.333	WP_000765183.1 MULTISPECIES: DUF423 domain-containing protein [Staphylococcus]	100	99.2	1.44e-71
CP132486.1_26|24557|26041|1|ID=1_26;partial=00;start_type=ATG;rbs_motif=GGA/GAG/AGG;rbs_spacer=5-10bp;gc_cont=0.353	WP_000412518.1 MULTISPECIES: APC family permease [Staphylococcus]	100	99.8	0.0
CP132486.1_27|26183|26635|-1|ID=1_27;partial=00;start_type=ATG;rbs_motif=AGGAG;rbs_spacer=5-10bp;gc_cont=0.355	WP_000498572.1 MULTISPECIES: threonine/serine exporter family protein [Staphylococcus]	100	99.3	7.08e-99
CP132486.1_28|26648|27412|-1|ID=1_28;partial=00;start_type=ATG;rbs_motif=None;rbs_spacer=None;gc_cont=0.366	WP_000354088.1 MULTISPECIES: threonine/serine exporter family protein [Staphylococcus]	100	99.6	2.48e-166
CP132486.1_29|27961|28713|-1|ID=1_29;partial=00;start_type=ATG;rbs_motif=AGGAG;rbs_spacer=5-10bp;gc_cont=0.333	WP_000075712.1 MULTISPECIES: hydrogen peroxide-dependent heme synthase [Staphylococcus]	100	99.6	3.77e-184
CP132486.1_30|28881|29867|1|ID=1_30;partial=00;start_type=ATG;rbs_motif=AGGAG;rbs_spacer=5-10bp;gc_cont=0.366	WP_000774288.1 phosphate acetyltransferase [Staphylococcus aureus]	100	99.7	7.75e-223
CP132486.1_31|29870|30706|1|ID=1_31;partial=00;start_type=ATG;rbs_motif=None;rbs_spacer=None;gc_cont=0.344	WP_000362356.1 MULTISPECIES: lipoate--protein ligase family protein [Staphylococcus]	100	99.6	1.74e-203
CP132486.1_32|31293|32213|1|ID=1_32;partial=00;start_type=ATG;rbs_motif=GGA/GAG/AGG;rbs_spacer=5-10bp;gc_cont=0.381	WP_000197034.1 MULTISPECIES: mevalonate kinase [Staphylococcus]	100	99.7	4.32e-218
CP132486.1_33|32218|33201|1|ID=1_33;partial=00;start_type=TTG;rbs_motif=AGGAG;rbs_spacer=5-10bp;gc_cont=0.367	WP_000597323.1 diphosphomevalonate decarboxylase [Staphylococcus aureus]	100	99.7	3.77e-234
CP132486.1_34|33214|34290|1|ID=1_34;partial=00;start_type=ATG;rbs_motif=AGGA;rbs_spacer=5-10bp;gc_cont=0.333	WP_000616885.1 MULTISPECIES: phosphomevalonate kinase [Staphylococcus]	100	99.7	8.28e-265
CP132486.1_35|34467|34808|1|ID=1_35;partial=00;start_type=ATG;rbs_motif=AGxAGG/AGGxGG;rbs_spacer=5-10bp;gc_cont=0.354	WP_000798968.1 DUF1450 domain-containing protein [Staphylococcus aureus]	97.3	99.1	8.65e-62
CP132486.1_36|34860|36182|-1|ID=1_36;partial=00;start_type=ATG;rbs_motif=AGGAG;rbs_spacer=5-10bp;gc_cont=0.350	WP_000860594.1 hypothiocyanous acid reductase MerA [Staphylococcus aureus]	100	99.8	0.0
CP132486.1_37|36169|36609|-1|ID=1_37;partial=00;start_type=TTG;rbs_motif=GGAG/GAGG;rbs_spacer=5-10bp;gc_cont=0.324	WP_001047242.1 MULTISPECIES: redox-sensitive transcriptional regulator HypR [Staphylococcus]	100	99.3	4.49e-100
CP132486.1_38|37234|38640|1|ID=1_38;partial=00;start_type=ATG;rbs_motif=AGGAG;rbs_spacer=5-10bp;gc_cont=0.346	WP_000020794.1 T7SS effector LXG polymorphic toxin [Staphylococcus aureus]	100	99.8	0.0
CP132486.1_39|38644|39261|1|ID=1_39;partial=00;start_type=TTG;rbs_motif=GGAG/GAGG;rbs_spacer=5-10bp;gc_cont=0.275	WP_000882171.1 DUF443 family protein [Staphylococcus aureus]	100	99.5	2.97e-136
CP132486.1_40|39336|39971|1|ID=1_40;partial=00;start_type=GTG;rbs_motif=AGxAGG/AGGxGG;rbs_spacer=11-12bp;gc_cont=0.263	WP_000882126.1 DUF443 domain-containing protein [Staphylococcus aureus]	100	99.5	1.42e-146
CP132486.1_41|39937|40182|1|ID=1_41;partial=00;start_type=ATG;rbs_motif=None;rbs_spacer=None;gc_cont=0.317	WP_001797309.1 hypothetical protein [Staphylococcus aureus]	98.8	98.8	1.36e-51
CP132486.1_42|40206|40832|1|ID=1_42;partial=00;start_type=ATG;rbs_motif=GGAG/GAGG;rbs_spacer=5-10bp;gc_cont=0.262	WP_000923047.1 DUF443 family protein [Staphylococcus aureus]	100	99.5	2.55e-143
CP132486.1_43|41102|42040|1|ID=1_43;partial=00;start_type=ATG;rbs_motif=AGGAG;rbs_spacer=5-10bp;gc_cont=0.343	WP_000808883.1 aldo/keto reductase [Staphylococcus aureus]	100	99.7	5.27e-222
CP132486.1_44|42486|43022|1|ID=1_44;partial=00;start_type=ATG;rbs_motif=GGAG/GAGG;rbs_spacer=5-10bp;gc_cont=0.345	WP_000633790.1 flavodoxin family protein [Staphylococcus aureus]	100	99.4	4.39e-127
CP132486.1_45|43192|43668|1|ID=1_45;partial=00;start_type=ATG;rbs_motif=GGAG/GAGG;rbs_spacer=5-10bp;gc_cont=0.314	WP_000477504.1 MULTISPECIES: GNAT family N-acetyltransferase [Staphylococcus]	100	99.4	1.35e-109
CP132486.1_46|43708|45003|1|ID=1_46;partial=00;start_type=ATG;rbs_motif=AGGAG;rbs_spacer=5-10bp;gc_cont=0.327	WP_000180233.1 MULTISPECIES: HD domain-containing protein [Staphylococcus]	100	99.8	0.0
CP132486.1_47|45031|45552|1|ID=1_47;partial=00;start_type=ATG;rbs_motif=None;rbs_spacer=None;gc_cont=0.330	WP_016187113.1 YwhD family protein [Staphylococcus aureus]	100	99.4	3.37e-124
CP132486.1_48|46051|47061|1|ID=1_48;partial=00;start_type=ATG;rbs_motif=AGGAG;rbs_spacer=5-10bp;gc_cont=0.361	WP_001200750.1 alcohol dehydrogenase AdhP [Staphylococcus aureus]	100	99.7	7.91e-236
CP132486.1_49|47325|47753|1|ID=1_49;partial=00;start_type=GTG;rbs_motif=None;rbs_spacer=None;gc_cont=0.319	WP_000359090.1 DUF1934 domain-containing protein [Staphylococcus aureus]	99.3	96.5	7.10e-92
CP132486.1_50|47750|49411|1|ID=1_50;partial=00;start_type=ATG;rbs_motif=AGGAG;rbs_spacer=5-10bp;gc_cont=0.331	WP_001021133.1 arginine--tRNA ligase [Staphylococcus aureus]	100	99.8	0.0
CP132486.1_51|49896|50531|1|ID=1_51;partial=00;start_type=ATG;rbs_motif=AGGAG;rbs_spacer=5-10bp;gc_cont=0.275	WP_000901759.1 endonuclease III domain-containing protein [Staphylococcus aureus]	100	99.5	4.99e-156
CP132486.1_52|50861|51748|1|ID=1_52;partial=00;start_type=GTG;rbs_motif=AGGAG;rbs_spacer=5-10bp;gc_cont=0.316	WP_000749048.1 ABC transporter substrate-binding protein [Staphylococcus sp. EG-SA-10]	99.7	99.7	1.17e-205
CP132486.1_53|51863|52849|1|ID=1_53;partial=00;start_type=ATG;rbs_motif=None;rbs_spacer=None;gc_cont=0.311	WP_010922824.1 MULTISPECIES: FecCD family ABC transporter permease [Staphylococcus]	100	96.0	9.19e-203
CP132486.1_54|52904|53623|1|ID=1_54;partial=00;start_type=ATG;rbs_motif=GGAG/GAGG;rbs_spacer=5-10bp;gc_cont=0.307	WP_000365352.1 MULTISPECIES: HAD family hydrolase [Staphylococcus]	100	99.6	8.50e-171
CP132486.1_55|53607|54407|1|ID=1_55;partial=00;start_type=ATG;rbs_motif=AGGAG;rbs_spacer=5-10bp;gc_cont=0.317	WP_000362963.1 alpha/beta fold hydrolase [Staphylococcus aureus]	100	99.6	1.72e-188
CP132486.1_56|54543|55049|1|ID=1_56;partial=00;start_type=ATG;rbs_motif=AGGAG;rbs_spacer=5-10bp;gc_cont=0.312	WP_000735556.1 SA0570 family protein [Staphylococcus aureus]	100	99.4	1.61e-115
CP132486.1_57|55348|56520|1|ID=1_57;partial=00;start_type=ATG;rbs_motif=AGGAG;rbs_spacer=5-10bp;gc_cont=0.366	WP_000195429.1 MULTISPECIES: IS256-like element IS256 family transposase [Bacteria]	100	99.7	3.34e-278
CP132486.1_58|56615|57259|1|ID=1_58;partial=00;start_type=TTG;rbs_motif=None;rbs_spacer=None;gc_cont=0.262	WP_433978138.1 hypothetical protein [Staphylococcus aureus]	99.5	99.5	1.39e-137
CP132486.1_59|57428|58216|1|ID=1_59;partial=00;start_type=ATG;rbs_motif=GGAG/GAGG;rbs_spacer=5-10bp;gc_cont=0.302	WP_001045424.1 MULTISPECIES: alpha/beta fold hydrolase [Staphylococcus]	100	99.6	6.25e-189
CP132486.1_60|58468|58842|-1|ID=1_60;partial=00;start_type=ATG;rbs_motif=GGAG/GAGG;rbs_spacer=5-10bp;gc_cont=0.277	WP_001018677.1 MULTISPECIES: global transcriptional regulator SarA [Staphylococcus]	100	99.2	3.12e-76
CP132486.1_61|59790|60719|-1|ID=1_61;partial=00;start_type=ATG;rbs_motif=GGA/GAG/AGG;rbs_spacer=11-12bp;gc_cont=0.313	WP_021285860.1 DMT family transporter [Staphylococcus aureus]	100	99.7	3.78e-209
CP132486.1_62|60912|61136|-1|ID=1_62;partial=00;start_type=ATG;rbs_motif=AGGAG;rbs_spacer=5-10bp;gc_cont=0.320	WP_000169038.1 MULTISPECIES: DUF2922 domain-containing protein [Staphylococcus]	100	98.7	2.94e-42
CP132486.1_63|61153|61356|-1|ID=1_63;partial=00;start_type=ATG;rbs_motif=AGGAG;rbs_spacer=5-10bp;gc_cont=0.294	WP_000047744.1 sigS mRNA-stabilizing protein SroA [Staphylococcus aureus]	100	98.5	2.38e-38
CP132486.1_64|61511|62071|1|ID=1_64;partial=00;start_type=ATG;rbs_motif=AGGAG;rbs_spacer=5-10bp;gc_cont=0.305	WP_001044969.1 tyrosine-type recombinase/integrase [Staphylococcus aureus]	100	99.5	2.41e-128
CP132486.1_65|62090|64492|1|ID=1_65;partial=00;start_type=ATG;rbs_motif=AGGAG;rbs_spacer=5-10bp;gc_cont=0.331	WP_404968888.1 Na+/H+ antiporter Mnh2 subunit A [Staphylococcus aureus]	100	99.9	0.0
CP132486.1_66|64479|64904|1|ID=1_66;partial=00;start_type=ATG;rbs_motif=AGGAG;rbs_spacer=5-10bp;gc_cont=0.362	WP_000661909.1 MULTISPECIES: Na+/H+ antiporter Mnh2 subunit B [Staphylococcus]	100	99.3	6.96e-88
CP132486.1_67|64901|65245|1|ID=1_67;partial=00;start_type=ATG;rbs_motif=GGAG/GAGG;rbs_spacer=5-10bp;gc_cont=0.316	WP_001048982.1 MULTISPECIES: Na+/H+ antiporter Mnh2 subunit C [Staphylococcus]	100	99.1	1.23e-66
CP132486.1_68|65232|66731|1|ID=1_68;partial=00;start_type=ATG;rbs_motif=GGA/GAG/AGG;rbs_spacer=5-10bp;gc_cont=0.323	WP_031920342.1 Na+/H+ antiporter subunit D [Staphylococcus aureus]	100	99.8	0.0
CP132486.1_69|66732|67214|1|ID=1_69;partial=00;start_type=ATG;rbs_motif=AGGAG;rbs_spacer=5-10bp;gc_cont=0.271	WP_001071971.1 MULTISPECIES: Na+/H+ antiporter Mnh2 subunit E [Staphylococcus]	100	99.4	2.06e-105
CP132486.1_70|67211|67513|1|ID=1_70;partial=00;start_type=ATG;rbs_motif=GGAG/GAGG;rbs_spacer=5-10bp;gc_cont=0.337	WP_000616643.1 MULTISPECIES: Na+/H+ antiporter Mnh2 subunit F [Staphylococcus]	100	99.0	1.22e-55
CP132486.1_71|67479|67925|1|ID=1_71;partial=00;start_type=ATG;rbs_motif=None;rbs_spacer=None;gc_cont=0.331	WP_011446991.1 Na+/H+ antiporter Mnh2 subunit G [Staphylococcus aureus]	98.6	99.3	3.30e-88
CP132486.1_72|68264|70306|1|ID=1_72;partial=00;start_type=TTG;rbs_motif=GGAG/GAGG;rbs_spacer=5-10bp;gc_cont=0.319	WP_000402168.1 cation:proton antiporter [Staphylococcus aureus]	98.5	99.9	0.0
CP132486.1_73|71398|72327|-1|ID=1_73;partial=00;start_type=ATG;rbs_motif=GGAG/GAGG;rbs_spacer=5-10bp;gc_cont=0.319	WP_000737654.1 MULTISPECIES: manganese ABC transporter substrate-binding lipoprotein MntC [Staphylococcus]	100	99.7	8.07e-220
CP132486.1_74|72324|73160|-1|ID=1_74;partial=00;start_type=ATG;rbs_motif=AGGAG;rbs_spacer=5-10bp;gc_cont=0.320	WP_000889252.1 MULTISPECIES: metal ABC transporter permease [Staphylococcus]	100	99.6	8.80e-172
CP132486.1_75|73154|73897|-1|ID=1_75;partial=00;start_type=TTG;rbs_motif=AGGAG;rbs_spacer=5-10bp;gc_cont=0.335	WP_000894464.1 MULTISPECIES: metal ABC transporter ATP-binding protein [Staphylococcus]	100	99.6	1.58e-170
CP132486.1_76|74019|74663|1|ID=1_76;partial=00;start_type=ATG;rbs_motif=GGAG/GAGG;rbs_spacer=5-10bp;gc_cont=0.305	WP_000954654.1 MULTISPECIES: metal-dependent transcriptional regulator [Bacilli]	100	99.5	1.37e-150
CP132486.1_77|74743|75495|-1|ID=1_77;partial=00;start_type=ATG;rbs_motif=GGAG/GAGG;rbs_spacer=5-10bp;gc_cont=0.309	WP_001108545.1 MULTISPECIES: M50 family metallopeptidase [Bacteria]	100	99.6	9.84e-171
CP132486.1_78|75731|76495|1|ID=1_78;partial=00;start_type=ATG;rbs_motif=AGGAG;rbs_spacer=5-10bp;gc_cont=0.340	WP_000215383.1 MULTISPECIES: N-acetylglucosaminyldiphosphoundecaprenol N-acetyl-beta-D-mannosaminyltransferase TarA [Staphylococcus]	100	99.6	5.75e-181
CP132486.1_79|76555|77349|-1|ID=1_79;partial=00;start_type=ATG;rbs_motif=AGGA;rbs_spacer=5-10bp;gc_cont=0.338	WP_001103232.1 MULTISPECIES: teichoic acids export ABC transporter ATP-binding subunit TagH [Staphylococcus]	100	99.6	3.19e-183
CP132486.1_80|77696|78508|1|ID=1_80;partial=00;start_type=ATG;rbs_motif=None;rbs_spacer=None;gc_cont=0.314	WP_001273058.1 MULTISPECIES: teichoic acids export ABC transporter permease subunit TagG [Staphylococcus]	100	99.6	1.95e-196
CP132486.1_81|78607|79710|1|ID=1_81;partial=00;start_type=ATG;rbs_motif=None;rbs_spacer=None;gc_cont=0.322	WP_001101610.1 teichoic acid glycerol-phosphate primase TarB [Staphylococcus aureus]	100	99.7	5.84e-265
CP132486.1_82|79707|80768|1|ID=1_82;partial=00;start_type=ATG;rbs_motif=None;rbs_spacer=None;gc_cont=0.319	WP_001241202.1 glycosyltransferase family 2 protein [Staphylococcus aureus]	100	99.7	2.63e-254
CP132486.1_83|80831|81229|1|ID=1_83;partial=00;start_type=ATG;rbs_motif=AGGAG;rbs_spacer=5-10bp;gc_cont=0.321	WP_000832260.1 MULTISPECIES: glycerol-3-phosphate cytidylyltransferase [Staphylococcus]	100	99.2	1.10e-91
CP132486.1_84|81346|82641|-1|ID=1_84;partial=00;start_type=ATG;rbs_motif=None;rbs_spacer=None;gc_cont=0.346	WP_000793054.1 MULTISPECIES: penicillin-binding protein PBP4 [Staphylococcus]	100	99.8	9.44e-308
CP132486.1_85|83062|84789|1|ID=1_85;partial=00;start_type=ATG;rbs_motif=GGAG/GAGG;rbs_spacer=5-10bp;gc_cont=0.328	WP_000817954.1 MULTISPECIES: ABC transporter ATP-binding protein [Staphylococcus]	100	99.8	0.0
CP132486.1_86|85148|86377|1|ID=1_86;partial=00;start_type=ATG;rbs_motif=GGA/GAG/AGG;rbs_spacer=5-10bp;gc_cont=0.341	WP_000479274.1 NupC/NupG family nucleoside CNT transporter [Staphylococcus aureus]	100	99.8	3.61e-278
CP132486.1_87|86902|87735|1|ID=1_87;partial=00;start_type=GTG;rbs_motif=GGA/GAG/AGG;rbs_spacer=5-10bp;gc_cont=0.339	WP_001044664.1 YitT family protein [Staphylococcus aureus]	100	99.6	8.52e-174
CP132486.1_88|88017|88814|1|ID=1_88;partial=00;start_type=ATG;rbs_motif=GGA/GAG/AGG;rbs_spacer=5-10bp;gc_cont=0.350	WP_001080809.1 MULTISPECIES: ABC transporter ATP-binding protein [Staphylococcus]	100	99.6	1.66e-190
CP132486.1_89|88850|89854|1|ID=1_89;partial=00;start_type=ATG;rbs_motif=AGGA;rbs_spacer=5-10bp;gc_cont=0.358	WP_404968889.1 FecCD family ABC transporter permease [Staphylococcus aureus]	100	99.7	7.96e-219
CP132486.1_90|89851|90867|1|ID=1_90;partial=00;start_type=ATG;rbs_motif=AGGAG;rbs_spacer=5-10bp;gc_cont=0.357	WP_000625890.1 MULTISPECIES: FecCD family ABC transporter permease [Staphylococcus]	100	99.7	1.26e-233
CP132486.1_91|91101|92069|1|ID=1_91;partial=00;start_type=ATG;rbs_motif=AGGAG;rbs_spacer=5-10bp;gc_cont=0.362	WP_000976255.1 dihydroxyacetone kinase subunit DhaK [Staphylococcus aureus]	100	99.7	2.52e-225
CP132486.1_92|92111|92695|1|ID=1_92;partial=00;start_type=ATG;rbs_motif=GGAG/GAGG;rbs_spacer=5-10bp;gc_cont=0.345	WP_000867211.1 dihydroxyacetone kinase subunit DhaL [Staphylococcus aureus]	100	99.5	5.63e-131
CP132486.1_93|92688|93050|1|ID=1_93;partial=00;start_type=ATG;rbs_motif=GGAG/GAGG;rbs_spacer=5-10bp;gc_cont=0.342	WP_001124165.1 dihydroxyacetone kinase phosphoryl donor subunit DhaM [Staphylococcus aureus]	100	99.2	2.82e-77
CP132486.1_94|93166|93663|1|ID=1_94;partial=00;start_type=ATG;rbs_motif=AGGAG;rbs_spacer=5-10bp;gc_cont=0.325	WP_001164085.1 MULTISPECIES: hypothetical protein [Staphylococcus]	100	99.4	1.68e-111
CP132486.1_95|94119|95186|1|ID=1_95;partial=00;start_type=ATG;rbs_motif=AGGAG(G)/GGAGG;rbs_spacer=13-15bp;gc_cont=0.328	WP_000980142.1 MULTISPECIES: YkvI family membrane protein [Staphylococcus]	100	99.7	3.53e-244
CP132486.1_96|95337|96380|1|ID=1_96;partial=00;start_type=ATG;rbs_motif=GGAG/GAGG;rbs_spacer=5-10bp;gc_cont=0.309	WP_001030759.1 alpha/beta hydrolase [Staphylococcus aureus]	100	99.7	7.81e-253
CP132486.1_98|96752|97138|1|ID=1_98;partial=00;start_type=ATG;rbs_motif=None;rbs_spacer=None;gc_cont=0.279	WP_000198503.1 hypothetical protein [Staphylococcus aureus]	100	99.2	2.09e-88
CP132486.1_99|97346|97852|-1|ID=1_99;partial=00;start_type=ATG;rbs_motif=GGAG/GAGG;rbs_spacer=5-10bp;gc_cont=0.341	WP_000940129.1 MULTISPECIES: GNAT family N-acetyltransferase [Staphylococcus]	100	99.4	1.18e-117
CP132486.1_100|97965|98888|1|ID=1_100;partial=00;start_type=ATG;rbs_motif=AGGAG;rbs_spacer=5-10bp;gc_cont=0.316	WP_000802948.1 MULTISPECIES: auxiliary protein GraX/ApsX [Staphylococcus]	100	99.7	5.92e-221
CP132486.1_101|98904|99578|1|ID=1_101;partial=00;start_type=ATG;rbs_motif=None;rbs_spacer=None;gc_cont=0.314	WP_001166506.1 response regulator transcription factor GraR/ApsR [Staphylococcus aureus]	100	99.6	5.76e-157
CP132486.1_102|99571|100611|1|ID=1_102;partial=00;start_type=ATG;rbs_motif=AGGA;rbs_spacer=5-10bp;gc_cont=0.309	WP_001061267.1 histidine kinase GraS/ApsS [Staphylococcus aureus]	100	99.7	4.12e-243
CP132486.1_103|100758|101519|1|ID=1_103;partial=00;start_type=GTG;rbs_motif=AGGAG;rbs_spacer=5-10bp;gc_cont=0.323	WP_000153733.1 MULTISPECIES: ABC transporter ATP-binding protein VraF [Staphylococcus]	100	99.6	5.72e-176
CP132486.1_104|101509|103398|1|ID=1_104;partial=00;start_type=ATG;rbs_motif=AGxAGG/AGGxGG;rbs_spacer=5-10bp;gc_cont=0.290	WP_000009400.1 FtsX-like permease family protein [Staphylococcus aureus]	100	99.8	0.0
CP132486.1_105|104014|104631|1|ID=1_105;partial=00;start_type=ATG;rbs_motif=GGAG/GAGG;rbs_spacer=5-10bp;gc_cont=0.283	WP_000491755.1 MULTISPECIES: DUF47 domain-containing protein [Staphylococcus]	100	99.5	5.58e-141
CP132486.1_106|104647|105654|1|ID=1_106;partial=00;start_type=ATG;rbs_motif=GGAG/GAGG;rbs_spacer=5-10bp;gc_cont=0.368	WP_000120368.1 MULTISPECIES: inorganic phosphate transporter [Staphylococcus]	100	99.7	1.14e-207
CP132486.1_107|106236|107033|-1|ID=1_107;partial=00;start_type=TTG;rbs_motif=AGGAG;rbs_spacer=5-10bp;gc_cont=0.381	WP_000731644.1 MULTISPECIES: LysM peptidoglycan-binding domain-containing protein [Staphylococcus]	100	99.6	7.25e-185
CP132486.1_108|107358|108038|1|ID=1_108;partial=00;start_type=TTG;rbs_motif=None;rbs_spacer=None;gc_cont=0.294	WP_000081602.1 MULTISPECIES: Bax inhibitor-1/YccA family protein [Staphylococcus]	99.5	94.3	6.56e-143
CP132486.1_109|108735|110885|1|ID=1_109;partial=00;start_type=ATG;rbs_motif=GGAG/GAGG;rbs_spacer=5-10bp;gc_cont=0.272	WP_001129746.1 helix-turn-helix transcriptional regulator [Staphylococcus aureus]	100	99.9	0.0
CP132486.1_110|110965|111390|1|ID=1_110;partial=00;start_type=ATG;rbs_motif=GGA/GAG/AGG;rbs_spacer=5-10bp;gc_cont=0.246	WP_000818255.1 SarA family transcriptional regulator [Staphylococcus aureus]	98.6	99.3	8.47e-89
CP132486.1_111|111580|112296|1|ID=1_111;partial=00;start_type=ATG;rbs_motif=GGA/GAG/AGG;rbs_spacer=5-10bp;gc_cont=0.360	WP_000532971.1 YebC/PmpR family DNA-binding transcriptional regulator [Staphylococcus aureus]	100	99.6	7.79e-162
CP132486.1_112|112296|112769|1|ID=1_112;partial=00;start_type=ATG;rbs_motif=GGA/GAG/AGG;rbs_spacer=5-10bp;gc_cont=0.338	WP_000833486.1 MULTISPECIES: cupin domain-containing protein [Staphylococcus]	100	99.4	1.59e-112
CP132486.1_113|113121|113765|1|ID=1_113;partial=00;start_type=GTG;rbs_motif=AGGAG;rbs_spacer=5-10bp;gc_cont=0.295	WP_000865619.1 MULTISPECIES: DUF402 domain-containing protein [Staphylococcus]	100	99.5	2.17e-147
CP132486.1_114|113882|114748|1|ID=1_114;partial=00;start_type=ATG;rbs_motif=None;rbs_spacer=None;gc_cont=0.317	WP_000687413.1 MULTISPECIES: LysR family transcriptional regulator [Staphylococcus]	100	99.7	1.95e-205
CP132486.1_115|115175|116395|1|ID=1_115;partial=00;start_type=ATG;rbs_motif=AGxAG;rbs_spacer=5-10bp;gc_cont=0.325	WP_000367065.1 sugar efflux transporter [Staphylococcus aureus]	100	99.8	7.02e-279
CP132486.1_116|116392|116880|1|ID=1_116;partial=00;start_type=ATG;rbs_motif=AGGA/GGAG/GAGG;rbs_spacer=11-12bp;gc_cont=0.305	WP_000152580.1 DUF456 domain-containing protein [Staphylococcus aureus]	100	99.4	1.82e-100
CP132486.1_117|116979|117668|-1|ID=1_117;partial=00;start_type=ATG;rbs_motif=AGGAG(G)/GGAGG;rbs_spacer=13-15bp;gc_cont=0.278	WP_000842865.1 MULTISPECIES: DUF1129 family protein [Staphylococcus]	100	99.6	5.10e-158
CP132486.1_118|117795|118238|1|ID=1_118;partial=00;start_type=ATG;rbs_motif=GGAG/GAGG;rbs_spacer=5-10bp;gc_cont=0.297	WP_001259673.1 MULTISPECIES: GNAT family N-acetyltransferase [Staphylococcus]	100	99.3	2.05e-101
CP132486.1_119|118305|118688|1|ID=1_119;partial=00;start_type=ATG;rbs_motif=AGGAG;rbs_spacer=5-10bp;gc_cont=0.286	WP_000733445.1 SA0632 family lipoprotein [Staphylococcus aureus]	100	99.2	4.51e-31
CP132486.1_120|118826|119125|1|ID=1_120;partial=00;start_type=ATG;rbs_motif=AGGAG;rbs_spacer=5-10bp;gc_cont=0.320	WP_000545113.1 hypothetical protein [Staphylococcus aureus]	100	99.0	7.65e-63
CP132486.1_121|119205|119747|1|ID=1_121;partial=00;start_type=ATG;rbs_motif=AGGAG;rbs_spacer=5-10bp;gc_cont=0.337	WP_000638622.1 GNAT family N-acetyltransferase [Staphylococcus aureus]	100	99.4	3.33e-132
CP132486.1_122|119842|120408|-1|ID=1_122;partial=00;start_type=ATG;rbs_motif=AGGAG;rbs_spacer=5-10bp;gc_cont=0.363	WP_000820892.1 MULTISPECIES: LOG family protein [Staphylococcus]	100	99.5	4.51e-134
CP132486.1_123|120410|120868|-1|ID=1_123;partial=00;start_type=GTG;rbs_motif=GGAG/GAGG;rbs_spacer=5-10bp;gc_cont=0.338	WP_000148823.1 YaiI/YqxD family protein [Staphylococcus aureus]	100	99.3	5.37e-104
CP132486.1_124|120871|121554|-1|ID=1_124;partial=00;start_type=ATG;rbs_motif=GGAG/GAGG;rbs_spacer=5-10bp;gc_cont=0.311	WP_371905305.1 hypothetical protein [Staphylococcus aureus]	100	99.6	1.45e-49
CP132486.1_125|121725|122600|-1|ID=1_125;partial=00;start_type=ATG;rbs_motif=None;rbs_spacer=None;gc_cont=0.332	WP_000469884.1 undecaprenyl-diphosphate phosphatase [Staphylococcus aureus]	100	99.7	1.53e-199
CP132486.1_126|122870|124450|1|ID=1_126;partial=00;start_type=ATG;rbs_motif=None;rbs_spacer=None;gc_cont=0.320	WP_031900784.1 ABC transporter ATP-binding protein/permease [Staphylococcus aureus]	100	99.8	0.0
CP132486.1_127|124447|126120|1|ID=1_127;partial=00;start_type=ATG;rbs_motif=None;rbs_spacer=None;gc_cont=0.327	WP_000857630.1 amino acid ABC transporter ATP-binding/permease protein [Staphylococcus aureus]	100	99.8	0.0
