CP139866.1_1353|1378260|1378460|1|ID=1_1353;partial=00;start_type=ATG;rbs_motif=GGAG/GAGG;rbs_spacer=5-10bp;gc_cont=0.323	WP_000604731.1 hypothetical protein [Staphylococcus aureus]	100	98.5	1.35e-30
CP139866.1_1354|1378486|1378803|1|ID=1_1354;partial=00;start_type=ATG;rbs_motif=AGGA/GGAG/GAGG;rbs_spacer=11-12bp;gc_cont=0.305	WP_101262896.1 nisin susceptibility-associated two-component system response regulator NsaR, partial [Staphylococcus aureus]	98.9	87.7	1.43e-58
CP139866.1_1355|1378794|1379150|1|ID=1_1355;partial=00;start_type=TTG;rbs_motif=None;rbs_spacer=None;gc_cont=0.291	WP_407146044.1 nisin susceptibility-associated two-component system response regulator NsaR [Staphylococcus aureus]	99.2	99.2	2.02e-73
CP139866.1_1356|1379107|1380048|1|ID=1_1356;partial=00;start_type=ATG;rbs_motif=None;rbs_spacer=None;gc_cont=0.297	WP_000143420.1 MULTISPECIES: nisin susceptibility-associated two-component system sensor histidine kinase NsaS [Staphylococcus]	100	93.9	3.85e-202
CP139866.1_1357|1380156|1380911|1|ID=1_1357;partial=00;start_type=ATG;rbs_motif=GGAG/GAGG;rbs_spacer=5-10bp;gc_cont=0.344	WP_000923768.1 MULTISPECIES: ABC transporter ATP-binding protein [Staphylococcus]	100	99.6	1.11e-172
CP139866.1_1358|1380908|1382908|1|ID=1_1358;partial=00;start_type=ATG;rbs_motif=AGGA/GGAG/GAGG;rbs_spacer=11-12bp;gc_cont=0.312	WP_000776741.1 ABC transporter permease [Staphylococcus aureus]	100	99.9	0.0
CP139866.1_1360|1384082|1384333|1|ID=1_1360;partial=00;start_type=ATG;rbs_motif=AGGA;rbs_spacer=5-10bp;gc_cont=0.317	WP_014937088.1 hypothetical protein [Staphylococcus aureus]	100	98.8	4.57e-55
CP139866.1_1361|1384343|1384840|1|ID=1_1361;partial=00;start_type=ATG;rbs_motif=GGA/GAG/AGG;rbs_spacer=5-10bp;gc_cont=0.313	WP_001065267.1 MULTISPECIES: glutathione peroxidase [Staphylococcus]	100	99.4	9.04e-116
CP139866.1_1362|1385231|1387111|1|ID=1_1362;partial=00;start_type=TTG;rbs_motif=GGAG/GAGG;rbs_spacer=5-10bp;gc_cont=0.350	WP_000775147.1 assimilatory sulfite reductase (NADPH) flavoprotein subunit [Staphylococcus aureus]	100	99.8	0.0
CP139866.1_1363|1387177|1387785|1|ID=1_1363;partial=00;start_type=ATG;rbs_motif=AGGA/GGAG/GAGG;rbs_spacer=11-12bp;gc_cont=0.376	WP_001057046.1 NAD(P)-binding protein [Staphylococcus aureus]	100	99.5	3.50e-138
CP139866.1_1364|1388274|1389644|1|ID=1_1364;partial=00;start_type=ATG;rbs_motif=GGAG/GAGG;rbs_spacer=5-10bp;gc_cont=0.361	WP_001083496.1 CitMHS family transporter [Staphylococcus aureus]	100	99.8	5.71e-308
CP139866.1_1365|1389891|1391741|1|ID=1_1365;partial=00;start_type=ATG;rbs_motif=GGA/GAG/AGG;rbs_spacer=5-10bp;gc_cont=0.345	WP_001071718.1 anaerobic ribonucleoside-triphosphate reductase [Staphylococcus aureus]	100	99.8	0.0
CP139866.1_1366|1391738|1392274|1|ID=1_1366;partial=00;start_type=ATG;rbs_motif=None;rbs_spacer=None;gc_cont=0.324	WP_000173332.1 anaerobic ribonucleoside-triphosphate reductase activating protein [Staphylococcus aureus]	100	99.4	3.91e-130
CP139866.1_1367|1392792|1394414|1|ID=1_1367;partial=00;start_type=TTG;rbs_motif=GGAG/GAGG;rbs_spacer=5-10bp;gc_cont=0.354	WP_000711870.1 MULTISPECIES: BCCT family transporter [Staphylococcus]	100	99.8	0.0
CP139866.1_1368|1394583|1395167|-1|ID=1_1368;partial=00;start_type=ATG;rbs_motif=None;rbs_spacer=None;gc_cont=0.357	WP_000198596.1 choline uptake/conversion transcriptional regulator CudC [Staphylococcus aureus]	100	95.9	1.65e-126
CP139866.1_1369|1395399|1396889|1|ID=1_1369;partial=00;start_type=ATG;rbs_motif=GGAG/GAGG;rbs_spacer=5-10bp;gc_cont=0.370	WP_000421708.1 betaine-aldehyde dehydrogenase [Staphylococcus aureus]	100	99.8	0.0
CP139866.1_1370|1397042|1398859|1|ID=1_1370;partial=00;start_type=GTG;rbs_motif=AGGA;rbs_spacer=5-10bp;gc_cont=0.384	WP_000066527.1 choline dehydrogenase [Staphylococcus aureus]	100	93.9	0.0
CP139866.1_1371|1399137|1399349|1|ID=1_1371;partial=00;start_type=ATG;rbs_motif=AGGA;rbs_spacer=5-10bp;gc_cont=0.277	WP_000011688.1 MULTISPECIES: sterile alpha motif-like domain-containing protein [Staphylococcus]	100	98.6	1.89e-43
CP139866.1_1372|1399424|1399591|1|ID=1_1372;partial=00;start_type=ATG;rbs_motif=None;rbs_spacer=None;gc_cont=0.256	WP_072357683.1 hypothetical protein [Staphylococcus aureus]	96.4	98.2	1.54e-30
CP139866.1_1373|1399593|1400072|1|ID=1_1373;partial=00;start_type=ATG;rbs_motif=None;rbs_spacer=None;gc_cont=0.308	WP_001028774.1 antibiotic biosynthesis monooxygenase family protein [Staphylococcus aureus]	100	91.9	3.49e-103
CP139866.1_1374|1400245|1401864|1|ID=1_1374;partial=00;start_type=ATG;rbs_motif=AGGA;rbs_spacer=5-10bp;gc_cont=0.363	WP_001172340.1 MULTISPECIES: acyl-CoA synthetase MbcS [Staphylococcus]	100	98.5	0.0
CP139866.1_1375|1402551|1403882|1|ID=1_1375;partial=00;start_type=ATG;rbs_motif=GGAG/GAGG;rbs_spacer=5-10bp;gc_cont=0.372	WP_371093900.1 L-lactate dehydrogenase (quinone) [Staphylococcus aureus]	100	98.0	0.0
CP139866.1_1376|1403942|1404046|1|ID=1_1376;partial=00;start_type=ATG;rbs_motif=None;rbs_spacer=None;gc_cont=0.286	WP_417651939.1 malate:quinone oxidoreductase, partial [Klebsiella pneumoniae]	100	97.1	8.69e-15
CP139866.1_1377|1404241|1405131|-1|ID=1_1377;partial=00;start_type=ATG;rbs_motif=AGGAG;rbs_spacer=5-10bp;gc_cont=0.346	WP_001031407.1 MULTISPECIES: fructose bisphosphate aldolase [Staphylococcus]	100	99.7	2.01e-202
CP139866.1_1378|1405254|1405670|-1|ID=1_1378;partial=00;start_type=ATG;rbs_motif=GGAG/GAGG;rbs_spacer=5-10bp;gc_cont=0.290	WP_001237624.1 hypothetical protein [Staphylococcus aureus]	100	99.3	2.18e-85
CP139866.1_1379|1405828|1407261|1|ID=1_1379;partial=00;start_type=ATG;rbs_motif=None;rbs_spacer=None;gc_cont=0.379	WP_000030076.1 aspartate aminotransferase family protein [Staphylococcus aureus]	99.8	93.1	0.0
CP139866.1_1380|1407341|1408813|-1|ID=1_1380;partial=00;start_type=ATG;rbs_motif=None;rbs_spacer=None;gc_cont=0.370	WP_064136134.1 APC family permease [Staphylococcus aureus]	99.8	99.8	0.0
CP139866.1_1381|1409477|1410436|1|ID=1_1381;partial=00;start_type=ATG;rbs_motif=AGGAG;rbs_spacer=5-10bp;gc_cont=0.354	WP_000846637.1 MULTISPECIES: L-lactate dehydrogenase [Staphylococcus]	100	99.7	1.10e-222
CP139866.1_1382|1410713|1411345|1|ID=1_1382;partial=00;start_type=ATG;rbs_motif=AGGA/GGAG/GAGG;rbs_spacer=11-12bp;gc_cont=0.360	WP_031915832.1 acetolactate decarboxylase, partial [Staphylococcus aureus]	100	99.1	1.55e-148
CP139866.1_1383|1411502|1412362|-1|ID=1_1383;partial=00;start_type=ATG;rbs_motif=AGGA;rbs_spacer=5-10bp;gc_cont=0.375	WP_000953575.1 oxidoreductase [Staphylococcus aureus]	100	99.7	2.38e-205
CP139866.1_1384|1412435|1413253|1|ID=1_1384;partial=00;start_type=TTG;rbs_motif=GGAG/GAGG;rbs_spacer=5-10bp;gc_cont=0.357	WP_000860047.1 MULTISPECIES: 3-methyl-2-oxobutanoate hydroxymethyltransferase [Staphylococcus]	100	99.6	3.19e-187
CP139866.1_1385|1413246|1414097|1|ID=1_1385;partial=00;start_type=ATG;rbs_motif=GGAG/GAGG;rbs_spacer=5-10bp;gc_cont=0.360	WP_000163736.1 pantoate--beta-alanine ligase [Staphylococcus aureus]	100	99.6	7.90e-198
CP139866.1_1386|1414099|1414482|1|ID=1_1386;partial=00;start_type=GTG;rbs_motif=GGAG/GAGG;rbs_spacer=5-10bp;gc_cont=0.336	WP_000621530.1 MULTISPECIES: aspartate 1-decarboxylase [Staphylococcus]	100	99.2	4.39e-82
CP139866.1_1387|1414611|1414715|-1|ID=1_1387;partial=00;start_type=ATG;rbs_motif=None;rbs_spacer=None;gc_cont=0.333	WP_371091321.1 CocE/NonD family hydrolase C-terminal non-catalytic domain-containing protein, partial [Staphylococcus aureus]	100	97.1	4.25e-17
CP139866.1_1388|1414712|1416292|-1|ID=1_1388;partial=00;start_type=ATG;rbs_motif=GGA/GAG/AGG;rbs_spacer=5-10bp;gc_cont=0.372	WP_001071573.1 CocE/NonD family hydrolase [Staphylococcus aureus]	100	99.4	0.0
CP139866.1_1389|1416435|1417022|1|ID=1_1389;partial=00;start_type=ATG;rbs_motif=AGGA;rbs_spacer=5-10bp;gc_cont=0.306	WP_000151119.1 TetR/AcrR family transcriptional regulator [Staphylococcus aureus]	100	99.5	1.38e-136
CP139866.1_1390|1417103|1417552|-1|ID=1_1390;partial=00;start_type=ATG;rbs_motif=GGAG/GAGG;rbs_spacer=5-10bp;gc_cont=0.364	WP_000125707.1 MULTISPECIES: VOC family protein [Staphylococcus]	100	99.3	7.11e-103
CP139866.1_1391|1417906|1418628|1|ID=1_1391;partial=00;start_type=ATG;rbs_motif=GGAG/GAGG;rbs_spacer=5-10bp;gc_cont=0.328	WP_000606210.1 MULTISPECIES: epoxyqueuosine reductase QueH [Staphylococcus]	100	99.6	2.10e-176
CP139866.1_1392|1418814|1419089|-1|ID=1_1392;partial=00;start_type=ATG;rbs_motif=GGAG/GAGG;rbs_spacer=5-10bp;gc_cont=0.297	WP_001051114.1 hypothetical protein [Staphylococcus aureus]	100	98.9	1.69e-51
CP139866.1_1393|1419244|1420308|-1|ID=1_1393;partial=00;start_type=ATG;rbs_motif=AGGAG;rbs_spacer=5-10bp;gc_cont=0.357	WP_000277417.1 quinone-dependent dihydroorotate dehydrogenase [Staphylococcus aureus]	100	99.7	2.76e-261
CP139866.1_1394|1420526|1421392|1|ID=1_1394;partial=00;start_type=ATG;rbs_motif=GGA/GAG/AGG;rbs_spacer=5-10bp;gc_cont=0.381	WP_001005518.1 fructosamine kinase family protein [Staphylococcus aureus]	100	99.7	7.72e-212
CP139866.1_1395|1421733|1422011|1|ID=1_1395;partial=00;start_type=ATG;rbs_motif=GGAG/GAGG;rbs_spacer=5-10bp;gc_cont=0.323	WP_001825991.1 TIGR04197 family type VII secretion effector [Staphylococcus aureus]	100	98.9	4.45e-52
CP139866.1_1396|1422023|1422394|1|ID=1_1396;partial=00;start_type=ATG;rbs_motif=None;rbs_spacer=None;gc_cont=0.355	WP_000066365.1 hypothetical protein [Staphylococcus aureus]	100	98.4	3.28e-75
CP139866.1_1397|1422382|1422678|1|ID=1_1397;partial=00;start_type=ATG;rbs_motif=AGGAG;rbs_spacer=5-10bp;gc_cont=0.273	WP_000447707.1 MULTISPECIES: DUF4176 domain-containing protein [Staphylococcus]	100	99.0	7.11e-63
CP139866.1_1398|1423014|1424120|1|ID=1_1398;partial=00;start_type=ATG;rbs_motif=GGAG/GAGG;rbs_spacer=5-10bp;gc_cont=0.361	WP_001163753.1 NAD(P)/FAD-dependent oxidoreductase [Staphylococcus aureus]	100	99.7	4.32e-272
CP139866.1_1399|1424114|1425454|1|ID=1_1399;partial=00;start_type=ATG;rbs_motif=None;rbs_spacer=None;gc_cont=0.345	WP_000895202.1 nucleoside recognition domain-containing protein [Staphylococcus aureus]	100	99.8	5.89e-305
CP139866.1_1400|1425554|1426444|1|ID=1_1400;partial=00;start_type=ATG;rbs_motif=AGGAG;rbs_spacer=5-10bp;gc_cont=0.356	WP_000706530.1 CobW family GTP-binding protein [Staphylococcus aureus]	100	99.7	7.43e-214
CP139866.1_1401|1426591|1427421|-1|ID=1_1401;partial=00;start_type=ATG;rbs_motif=GGAG/GAGG;rbs_spacer=5-10bp;gc_cont=0.373	WP_000448915.1 alpha/beta hydrolase [Staphylococcus aureus]	100	99.6	4.27e-203
CP139866.1_1402|1427441|1428451|-1|ID=1_1402;partial=00;start_type=ATG;rbs_motif=GGAG/GAGG;rbs_spacer=5-10bp;gc_cont=0.345	WP_000836430.1 amidohydrolase family protein [Staphylococcus aureus]	100	99.7	3.04e-249
CP139866.1_1403|1428549|1429253|-1|ID=1_1403;partial=00;start_type=ATG;rbs_motif=GGAG/GAGG;rbs_spacer=5-10bp;gc_cont=0.366	WP_000161837.1 MULTISPECIES: SDR family NAD(P)-dependent oxidoreductase [Staphylococcus]	100	99.6	1.03e-164
CP139866.1_1404|1429246|1429803|-1|ID=1_1404;partial=00;start_type=ATG;rbs_motif=GGA/GAG/AGG;rbs_spacer=5-10bp;gc_cont=0.315	WP_001224193.1 TetR/AcrR family transcriptional regulator [Staphylococcus aureus]	100	99.5	5.49e-129
CP139866.1_1405|1429934|1430233|1|ID=1_1405;partial=00;start_type=ATG;rbs_motif=GGA/GAG/AGG;rbs_spacer=5-10bp;gc_cont=0.313	WP_000055858.1 DUF2316 family protein [Staphylococcus aureus]	100	99.0	1.60e-64
CP139866.1_1406|1430252|1431073|1|ID=1_1406;partial=00;start_type=ATG;rbs_motif=GGAG/GAGG;rbs_spacer=5-10bp;gc_cont=0.330	WP_000651843.1 NmrA/HSCARG family protein [Staphylococcus aureus]	100	99.6	8.83e-190
CP139866.1_1407|1431039|1431467|1|ID=1_1407;partial=00;start_type=GTG;rbs_motif=None;rbs_spacer=None;gc_cont=0.347	WP_000616230.1 VOC family protein [Staphylococcus aureus]	100	87.4	1.94e-84
CP139866.1_1408|1431825|1432055|-1|ID=1_1408;partial=00;start_type=ATG;rbs_motif=AGGAGG;rbs_spacer=5-10bp;gc_cont=0.329	WP_000697134.1 MULTISPECIES: DUF896 domain-containing protein [Bacteria]	100	98.7	2.11e-45
CP139866.1_1409|1432275|1432595|-1|ID=1_1409;partial=00;start_type=GTG;rbs_motif=AGGAG;rbs_spacer=5-10bp;gc_cont=0.352	WP_172404605.1 hypothetical protein, partial [Staphylococcus aureus]	99.1	99.1	4.77e-69
CP139866.1_1410|1432973|1433560|-1|ID=1_1410;partial=00;start_type=ATG;rbs_motif=None;rbs_spacer=None;gc_cont=0.332	WP_000901514.1 TetR/AcrR family transcriptional regulator [Staphylococcus aureus]	99.5	99.5	5.20e-132
CP139866.1_1411|1433603|1433806|-1|ID=1_1411;partial=00;start_type=ATG;rbs_motif=None;rbs_spacer=None;gc_cont=0.240	WP_262538786.1 hypothetical protein [Staphylococcus aureus]	96.1	75.0	1.08e-25
CP139866.1_1412|1433952|1435007|1|ID=1_1412;partial=00;start_type=ATG;rbs_motif=AGGA;rbs_spacer=5-10bp;gc_cont=0.366	WP_044291183.1 PTS transporter subunit IIC [Staphylococcus aureus]	98.6	99.7	1.18e-224
CP139866.1_1413|1435614|1436315|1|ID=1_1413;partial=00;start_type=ATG;rbs_motif=GGAG/GAGG;rbs_spacer=5-10bp;gc_cont=0.417	WP_000751273.1 lytic transglycosylase IsaA [Staphylococcus aureus]	100	99.6	5.74e-141
CP139866.1_1414|1436990|1438801|1|ID=1_1414;partial=00;start_type=ATG;rbs_motif=None;rbs_spacer=None;gc_cont=0.336	WP_000379829.1 acyltransferase family protein [Staphylococcus aureus]	100	99.8	0.0
CP139866.1_1415|1439163|1439930|1|ID=1_1415;partial=00;start_type=ATG;rbs_motif=GGAG/GAGG;rbs_spacer=5-10bp;gc_cont=0.370	WP_000725229.1 CHAP domain-containing protein [Staphylococcus aureus]	100	99.6	8.77e-156
CP139866.1_1416|1440141|1440593|1|ID=1_1416;partial=00;start_type=ATG;rbs_motif=None;rbs_spacer=None;gc_cont=0.307	WP_074347713.1 glycosyl-4,4'-diaponeurosporenoate acyltransferase [Staphylococcus aureus]	100	99.3	2.00e-103
CP139866.1_1417|1440586|1442079|1|ID=1_1417;partial=00;start_type=ATG;rbs_motif=GGAG/GAGG;rbs_spacer=5-10bp;gc_cont=0.354	WP_000160462.1 phytoene desaturase family protein [Staphylococcus aureus]	100	99.8	0.0
CP139866.1_1418|1442085|1443212|1|ID=1_1418;partial=00;start_type=ATG;rbs_motif=AGGA;rbs_spacer=5-10bp;gc_cont=0.364	WP_000871735.1 4,4'-diaponeurosporenoate glycosyltransferase [Staphylococcus aureus]	100	99.7	4.70e-275
CP139866.1_1419|1443249|1444112|1|ID=1_1419;partial=00;start_type=ATG;rbs_motif=AGGAG;rbs_spacer=5-10bp;gc_cont=0.317	WP_000178300.1 4,4'-diapophytoene synthase CrtM [Staphylococcus aureus]	100	99.7	4.44e-206
CP139866.1_1420|1444124|1445632|1|ID=1_1420;partial=00;start_type=ATG;rbs_motif=GGA/GAG/AGG;rbs_spacer=5-10bp;gc_cont=0.353	WP_000686183.1 phytoene desaturase family protein [Staphylococcus aureus]	100	99.8	0.0
CP139866.1_1421|1446059|1447213|1|ID=1_1421;partial=00;start_type=ATG;rbs_motif=AGGAG;rbs_spacer=5-10bp;gc_cont=0.362	WP_000625073.1 aminotransferase class I/II-fold pyridoxal phosphate-dependent enzyme [Staphylococcus aureus]	100	99.7	1.43e-285
CP139866.1_1422|1447236|1448234|1|ID=1_1422;partial=00;start_type=ATG;rbs_motif=GGA/GAG/AGG;rbs_spacer=11-12bp;gc_cont=0.365	WP_000161374.1 D-lactate dehydrogenase [Staphylococcus aureus]	100	99.7	3.50e-237
CP139866.1_1423|1448324|1448530|-1|ID=1_1423;partial=00;start_type=ATG;rbs_motif=AGGAG;rbs_spacer=5-10bp;gc_cont=0.357	WP_000076662.1 MULTISPECIES: copper chaperone CopZ [Staphylococcus]	100	98.6	2.55e-38
CP139866.1_1424|1449028|1451436|-1|ID=1_1424;partial=00;start_type=GTG;rbs_motif=GGAG/GAGG;rbs_spacer=5-10bp;gc_cont=0.377	WP_000024131.1 heavy metal translocating P-type ATPase [Staphylococcus aureus]	100	99.9	0.0
CP139866.1_1425|1451674|1451865|-1|ID=1_1425;partial=00;start_type=ATG;rbs_motif=AGGAG;rbs_spacer=5-10bp;gc_cont=0.323	WP_001221404.1 MULTISPECIES: cell wall inhibition responsive protein CwrA [Bacilli]	100	98.4	2.04e-35
CP139866.1_1426|1452104|1452703|1|ID=1_1426;partial=00;start_type=ATG;rbs_motif=AGGA/GGAG/GAGG;rbs_spacer=11-12bp;gc_cont=0.357	WP_000136482.1 MULTISPECIES: sugar O-acetyltransferase [Staphylococcus]	100	99.5	5.18e-134
CP139866.1_1428|1452893|1454437|1|ID=1_1428;partial=00;start_type=ATG;rbs_motif=AGxAGG/AGGxGG;rbs_spacer=5-10bp;gc_cont=0.362	WP_000259701.1 L-glutamate gamma-semialdehyde dehydrogenase [Staphylococcus aureus]	100	99.8	0.0
CP139866.1_1429|1454855|1455343|-1|ID=1_1429;partial=00;start_type=ATG;rbs_motif=AGGAG;rbs_spacer=5-10bp;gc_cont=0.313	WP_000665229.1 fatty acid efflux pump transcriptional regulator FarR [Staphylococcus aureus]	100	98.8	1.05e-108
CP139866.1_1430|1455488|1457977|1|ID=1_1430;partial=00;start_type=TTG;rbs_motif=AGGAG;rbs_spacer=5-10bp;gc_cont=0.335	WP_001051445.1 fatty acid efflux MMPL transporter FarE [Staphylococcus aureus]	100	99.9	0.0
CP139866.1_1431|1458193|1458420|1|ID=1_1431;partial=00;start_type=ATG;rbs_motif=GGA/GAG/AGG;rbs_spacer=5-10bp;gc_cont=0.307	WP_000932073.1 MULTISPECIES: FeoA family protein [Staphylococcus]	100	98.7	8.31e-47
CP139866.1_1432|1458432|1460426|1|ID=1_1432;partial=00;start_type=ATG;rbs_motif=AGGAG;rbs_spacer=5-10bp;gc_cont=0.347	WP_000432889.1 ferrous iron transport protein B [Staphylococcus aureus]	99.8	99.8	0.0
CP139866.1_1433|1460676|1462784|-1|ID=1_1433;partial=00;start_type=ATG;rbs_motif=GGAG/GAGG;rbs_spacer=5-10bp;gc_cont=0.352	WP_001058986.1 ATP-dependent Clp protease ATP-binding subunit ClpL [Staphylococcus aureus]	100	99.9	0.0
CP139866.1_1434|1463193|1463714|1|ID=1_1434;partial=00;start_type=ATG;rbs_motif=GGA/GAG/AGG;rbs_spacer=5-10bp;gc_cont=0.395	WP_000384652.1 methylated-DNA--[protein]-cysteine S-methyltransferase [Staphylococcus aureus]	100	99.4	3.37e-124
CP139866.1_1435|1463885|1465051|-1|ID=1_1435;partial=00;start_type=ATG;rbs_motif=AGGA/GGAG/GAGG;rbs_spacer=11-12bp;gc_cont=0.370	WP_000151980.1 MULTISPECIES: hydroxymethylglutaryl-CoA synthase [Staphylococcus]	100	99.7	1.48e-280
CP139866.1_1436|1465306|1466586|1|ID=1_1436;partial=00;start_type=ATG;rbs_motif=AGGAG;rbs_spacer=5-10bp;gc_cont=0.390	WP_001191004.1 hydroxymethylglutaryl-CoA reductase, degradative [Staphylococcus aureus]	100	99.8	2.15e-290
CP139866.1_1437|1466726|1467157|-1|ID=1_1437;partial=00;start_type=ATG;rbs_motif=GGAG/GAGG;rbs_spacer=5-10bp;gc_cont=0.347	WP_000875614.1 MULTISPECIES: CHAP domain-containing protein [Staphylococcus]	100	99.3	1.77e-100
CP139866.1_1438|1467546|1467746|-1|ID=1_1438;partial=00;start_type=ATG;rbs_motif=None;rbs_spacer=None;gc_cont=0.358	WP_001190458.1 sterile alpha motif-like domain-containing protein [Staphylococcus aureus]	100	98.5	1.38e-41
CP139866.1_1439|1467925|1468809|1|ID=1_1439;partial=00;start_type=ATG;rbs_motif=None;rbs_spacer=None;gc_cont=0.331	WP_000351761.1 MULTISPECIES: cidABC operon transcriptional activator CidR [Bacillales]	99.7	99.0	2.31e-211
CP139866.1_1440|1469022|1469417|1|ID=1_1440;partial=00;start_type=ATG;rbs_motif=GGA/GAG/AGG;rbs_spacer=5-10bp;gc_cont=0.318	WP_000549735.1 MULTISPECIES: holin-like murein hydrolase modulator CidA [Staphylococcus]	100	99.2	1.70e-81
CP139866.1_1441|1469404|1470099|1|ID=1_1441;partial=00;start_type=ATG;rbs_motif=GGA/GAG/AGG;rbs_spacer=5-10bp;gc_cont=0.342	WP_001001016.1 LrgB family protein [Staphylococcus aureus]	100	98.7	1.90e-149
CP139866.1_1442|1470139|1471878|1|ID=1_1442;partial=00;start_type=ATG;rbs_motif=AGGA/GGAG/GAGG;rbs_spacer=11-12bp;gc_cont=0.344	WP_001062665.1 pyruvate oxidase [Staphylococcus aureus]	100	99.8	0.0
CP139866.1_1443|1472127|1474244|1|ID=1_1443;partial=00;start_type=ATG;rbs_motif=None;rbs_spacer=None;gc_cont=0.365	WP_000473690.1 glucose-specific PTS transporter subunit IIBC [Staphylococcus aureus]	99.9	97.5	0.0
CP139866.1_1444|1474618|1475028|1|ID=1_1444;partial=00;start_type=ATG;rbs_motif=AGGAG;rbs_spacer=5-10bp;gc_cont=0.370	WP_000206033.1 MULTISPECIES: acyl-CoA thioesterase [Staphylococcus]	100	99.3	3.79e-94
CP139866.1_1445|1475069|1475413|1|ID=1_1445;partial=00;start_type=ATG;rbs_motif=GGA/GAG/AGG;rbs_spacer=5-10bp;gc_cont=0.365	WP_000240666.1 thioredoxin family protein [Staphylococcus aureus]	100	99.1	8.63e-76
CP139866.1_1446|1475546|1476514|1|ID=1_1446;partial=00;start_type=ATG;rbs_motif=AGGAG;rbs_spacer=5-10bp;gc_cont=0.376	WP_001228160.1 alpha/beta hydrolase fold domain-containing protein [Staphylococcus aureus]	100	99.7	1.04e-233
CP139866.1_1447|1476596|1477558|-1|ID=1_1447;partial=00;start_type=ATG;rbs_motif=None;rbs_spacer=None;gc_cont=0.347	WP_190285099.1 DMT family transporter [Staphylococcus aureus]	98.8	99.7	7.08e-215
CP139866.1_1448|1477714|1477917|-1|ID=1_1448;partial=00;start_type=ATG;rbs_motif=GGAG/GAGG;rbs_spacer=5-10bp;gc_cont=0.324	WP_001177186.1 MULTISPECIES: hypothetical protein [Staphylococcus]	100	98.5	2.30e-36
CP139866.1_1449|1478466|1479509|1|ID=1_1449;partial=00;start_type=ATG;rbs_motif=GGAG/GAGG;rbs_spacer=5-10bp;gc_cont=0.372	WP_000353634.1 MULTISPECIES: PTS fructose transporter subunit IIC [Staphylococcus]	100	99.7	1.34e-228
CP139866.1_1450|1479512|1480192|1|ID=1_1450;partial=00;start_type=ATG;rbs_motif=GGA/GAG/AGG;rbs_spacer=5-10bp;gc_cont=0.325	WP_001140234.1 MULTISPECIES: L-serine ammonia-lyase, iron-sulfur-dependent subunit beta [Staphylococcus]	100	99.6	6.99e-159
CP139866.1_1451|1480206|1481105|1|ID=1_1451;partial=00;start_type=ATG;rbs_motif=GGAG/GAGG;rbs_spacer=5-10bp;gc_cont=0.412	WP_000460421.1 MULTISPECIES: L-serine ammonia-lyase, iron-sulfur-dependent, subunit alpha [Staphylococcus]	100	99.7	7.28e-202
CP139866.1_1452|1481598|1482089|-1|ID=1_1452;partial=00;start_type=ATG;rbs_motif=GGA/GAG/AGG;rbs_spacer=5-10bp;gc_cont=0.348	WP_000617346.1 GNAT family N-acetyltransferase [Staphylococcus aureus]	100	99.4	7.77e-116
CP139866.1_1453|1482283|1482903|1|ID=1_1453;partial=00;start_type=ATG;rbs_motif=AGGAG;rbs_spacer=5-10bp;gc_cont=0.329	WP_000759368.1 class A sortase SrtA [Staphylococcus aureus]	100	99.5	1.27e-142
CP139866.1_1454|1483134|1483934|1|ID=1_1454;partial=00;start_type=ATG;rbs_motif=AGGAG;rbs_spacer=5-10bp;gc_cont=0.345	WP_000237536.1 Cof-type HAD-IIB family hydrolase [Staphylococcus aureus]	100	99.6	1.65e-186
CP139866.1_1455|1484179|1485171|-1|ID=1_1455;partial=00;start_type=ATG;rbs_motif=GGAG/GAGG;rbs_spacer=5-10bp;gc_cont=0.344	WP_000161548.1 D-lactate dehydrogenase [Staphylococcus aureus]	100	99.7	8.22e-235
CP139866.1_1456|1485441|1486112|1|ID=1_1456;partial=00;start_type=ATG;rbs_motif=GGAG/GAGG;rbs_spacer=5-10bp;gc_cont=0.375	WP_000069098.1 MULTISPECIES: NAD(P)H-dependent oxidoreductase [Staphylococcus]	100	99.6	9.59e-160
CP139866.1_1457|1486233|1487039|-1|ID=1_1457;partial=00;start_type=ATG;rbs_motif=GGAG/GAGG;rbs_spacer=5-10bp;gc_cont=0.379	WP_000863962.1 VOC family protein [Staphylococcus aureus]	100	99.6	5.18e-200
CP139866.1_1458|1487214|1487498|-1|ID=1_1458;partial=00;start_type=ATG;rbs_motif=AGGAG;rbs_spacer=5-10bp;gc_cont=0.323	WP_000067112.1 MULTISPECIES: GNAT family N-acetyltransferase [Staphylococcus]	100	98.9	6.21e-62
CP139866.1_1459|1487725|1488159|1|ID=1_1459;partial=00;start_type=ATG;rbs_motif=None;rbs_spacer=None;gc_cont=0.356	WP_000376243.1 MarR family transcriptional regulator MhqR [Staphylococcus aureus]	100	99.3	7.20e-96
CP139866.1_1460|1488237|1489205|1|ID=1_1460;partial=00;start_type=ATG;rbs_motif=GGAG/GAGG;rbs_spacer=5-10bp;gc_cont=0.359	WP_000183731.1 ring-cleaving dioxygenase MhqE [Staphylococcus aureus]	100	99.7	6.80e-239
CP139866.1_1461|1489227|1489820|1|ID=1_1461;partial=00;start_type=ATG;rbs_motif=GGAG/GAGG;rbs_spacer=5-10bp;gc_cont=0.355	WP_000400015.1 methylhydroquinone degradation carboxylesterase MhqD [Staphylococcus aureus]	100	99.5	6.85e-138
CP139866.1_1462|1489925|1491004|-1|ID=1_1462;partial=00;start_type=ATG;rbs_motif=GGA/GAG/AGG;rbs_spacer=11-12bp;gc_cont=0.360	WP_001621912.1 MULTISPECIES: YkvI family membrane protein [Staphylococcus]	100	99.7	1.13e-242
CP139866.1_1463|1491349|1493313|-1|ID=1_1463;partial=00;start_type=ATG;rbs_motif=AGGAG;rbs_spacer=5-10bp;gc_cont=0.344	WP_000192177.1 MULTISPECIES: fructose-1,6-bisphosphatase [Staphylococcus]	100	99.8	0.0
CP139866.1_1464|1493687|1493833|-1|ID=1_1464;partial=00;start_type=ATG;rbs_motif=GGA/GAG/AGG;rbs_spacer=11-12bp;gc_cont=0.238	WP_308890220.1 ABC transporter permease subunit, partial [Staphylococcus aureus]	100	98.0	7.92e-21
CP139866.1_1465|1493835|1494458|-1|ID=1_1465;partial=00;start_type=ATG;rbs_motif=AGGA/GGAG/GAGG;rbs_spacer=11-12bp;gc_cont=0.272	WP_049306149.1 ABC transporter permease, partial [Staphylococcus aureus]	100	95.2	2.48e-122
CP139866.1_1466|1494460|1495155|-1|ID=1_1466;partial=00;start_type=ATG;rbs_motif=AGGAG;rbs_spacer=5-10bp;gc_cont=0.305	WP_000382905.1 ABC transporter ATP-binding protein [Staphylococcus aureus]	100	99.6	2.71e-154
CP139866.1_1467|1495595|1496056|1|ID=1_1467;partial=00;start_type=ATG;rbs_motif=AGGA/GGAG/GAGG;rbs_spacer=11-12bp;gc_cont=0.251	WP_016187295.1 MarR family winged helix-turn-helix transcriptional regulator [Staphylococcus aureus]	100	99.4	4.05e-95
CP139866.1_1468|1496049|1497212|1|ID=1_1468;partial=00;start_type=ATG;rbs_motif=AGxAG;rbs_spacer=5-10bp;gc_cont=0.289	WP_000167481.1 MFS transporter [Staphylococcus aureus]	100	99.7	3.46e-258
CP139866.1_1469|1497310|1497921|-1|ID=1_1469;partial=00;start_type=ATG;rbs_motif=AGGAG(G)/GGAGG;rbs_spacer=13-15bp;gc_cont=0.325	WP_000435044.1 MULTISPECIES: DedA family protein [Staphylococcus]	100	99.5	2.74e-131
CP139866.1_1470|1498468|1499745|1|ID=1_1470;partial=00;start_type=ATG;rbs_motif=AGGA;rbs_spacer=5-10bp;gc_cont=0.361	WP_000660709.1 MULTISPECIES: MFS transporter [Staphylococcus]	100	99.8	1.49e-301
CP139866.1_1471|1500657|1502480|1|ID=1_1471;partial=00;start_type=ATG;rbs_motif=AGGA;rbs_spacer=5-10bp;gc_cont=0.338	WP_000586373.1 FUSC family protein [Staphylococcus aureus]	100	99.8	0.0
CP139866.1_1472|1502619|1503035|1|ID=1_1472;partial=00;start_type=ATG;rbs_motif=GGAG/GAGG;rbs_spacer=5-10bp;gc_cont=0.360	WP_001117057.1 DUF2188 domain-containing protein [Staphylococcus aureus]	100	99.3	2.45e-91
CP139866.1_1473|1503266|1503958|1|ID=1_1473;partial=00;start_type=ATG;rbs_motif=AGGA/GGAG/GAGG;rbs_spacer=11-12bp;gc_cont=0.320	WP_000289136.1 MULTISPECIES: GTP pyrophosphokinase [Staphylococcus]	100	99.6	3.32e-159
CP139866.1_1474|1504123|1504887|1|ID=1_1474;partial=00;start_type=ATG;rbs_motif=AGGAG;rbs_spacer=5-10bp;gc_cont=0.342	WP_000074000.1 MerR family transcriptional regulator [Staphylococcus aureus]	100	99.6	8.17e-181
