CP132486.1_1968|2068644|2069366|-1|ID=1_1968;partial=00;start_type=ATG;rbs_motif=GGAG/GAGG;rbs_spacer=5-10bp;gc_cont=0.329	WP_000606210.1 MULTISPECIES: epoxyqueuosine reductase QueH [Staphylococcus]	100	99.6	2.10e-176
CP132486.1_1969|2069720|2070160|1|ID=1_1969;partial=00;start_type=ATG;rbs_motif=GGAG/GAGG;rbs_spacer=5-10bp;gc_cont=0.361	WP_433978091.1 VOC family protein [Staphylococcus aureus]	100	99.3	3.84e-101
CP132486.1_1970|2070241|2070828|-1|ID=1_1970;partial=00;start_type=ATG;rbs_motif=AGGA;rbs_spacer=5-10bp;gc_cont=0.306	WP_000151119.1 TetR/AcrR family transcriptional regulator [Staphylococcus aureus]	100	99.5	1.38e-136
CP132486.1_1971|2070971|2072653|1|ID=1_1971;partial=00;start_type=ATG;rbs_motif=GGA/GAG/AGG;rbs_spacer=5-10bp;gc_cont=0.369	WP_001071573.1 CocE/NonD family hydrolase [Staphylococcus aureus]	100	99.8	0.0
CP132486.1_1972|2072782|2073165|-1|ID=1_1972;partial=00;start_type=GTG;rbs_motif=GGAG/GAGG;rbs_spacer=5-10bp;gc_cont=0.336	WP_000621530.1 MULTISPECIES: aspartate 1-decarboxylase [Staphylococcus]	100	99.2	4.39e-82
CP132486.1_1973|2073167|2074018|-1|ID=1_1973;partial=00;start_type=ATG;rbs_motif=GGAG/GAGG;rbs_spacer=5-10bp;gc_cont=0.362	WP_000163736.1 pantoate--beta-alanine ligase [Staphylococcus aureus]	100	99.6	7.90e-198
CP132486.1_1974|2074011|2074829|-1|ID=1_1974;partial=00;start_type=TTG;rbs_motif=GGAG/GAGG;rbs_spacer=5-10bp;gc_cont=0.357	WP_000860047.1 MULTISPECIES: 3-methyl-2-oxobutanoate hydroxymethyltransferase [Staphylococcus]	100	99.6	3.19e-187
CP132486.1_1975|2074902|2075762|1|ID=1_1975;partial=00;start_type=ATG;rbs_motif=AGGA;rbs_spacer=5-10bp;gc_cont=0.375	WP_000953575.1 oxidoreductase [Staphylococcus aureus]	100	99.7	2.38e-205
CP132486.1_1976|2075848|2076552|-1|ID=1_1976;partial=00;start_type=ATG;rbs_motif=AGGA/GGAG/GAGG;rbs_spacer=11-12bp;gc_cont=0.362	WP_000186114.1 acetolactate decarboxylase [Staphylococcus aureus]	100	99.6	1.07e-166
CP132486.1_1977|2076829|2077788|-1|ID=1_1977;partial=00;start_type=ATG;rbs_motif=AGGAG;rbs_spacer=5-10bp;gc_cont=0.353	WP_000846637.1 MULTISPECIES: L-lactate dehydrogenase [Staphylococcus]	100	99.7	1.10e-222
CP132486.1_1978|2078475|2079923|1|ID=1_1978;partial=00;start_type=ATG;rbs_motif=GGAG/GAGG;rbs_spacer=5-10bp;gc_cont=0.371	WP_000534420.1 APC family permease [Staphylococcus aureus]	100	99.8	0.0
CP132486.1_1979|2080003|2081436|-1|ID=1_1979;partial=00;start_type=ATG;rbs_motif=None;rbs_spacer=None;gc_cont=0.379	WP_000030076.1 aspartate aminotransferase family protein [Staphylococcus aureus]	100	93.1	0.0
CP132486.1_1980|2081594|2082010|1|ID=1_1980;partial=00;start_type=ATG;rbs_motif=GGAG/GAGG;rbs_spacer=5-10bp;gc_cont=0.288	WP_001237624.1 hypothetical protein [Staphylococcus aureus]	100	99.3	2.18e-85
CP132486.1_1981|2082133|2083023|1|ID=1_1981;partial=00;start_type=ATG;rbs_motif=AGGAG;rbs_spacer=5-10bp;gc_cont=0.346	WP_001031407.1 MULTISPECIES: fructose bisphosphate aldolase [Staphylococcus]	100	99.7	2.01e-202
CP132486.1_1982|2083218|2084714|-1|ID=1_1982;partial=00;start_type=ATG;rbs_motif=GGAG/GAGG;rbs_spacer=5-10bp;gc_cont=0.365	WP_001130051.1 MULTISPECIES: L-lactate dehydrogenase (quinone) [Staphylococcus]	100	99.8	0.0
CP132486.1_1983|2085401|2087020|-1|ID=1_1983;partial=00;start_type=ATG;rbs_motif=AGGA;rbs_spacer=5-10bp;gc_cont=0.364	WP_001172340.1 MULTISPECIES: acyl-CoA synthetase MbcS [Staphylococcus]	100	98.5	0.0
CP132486.1_1984|2087193|2087672|-1|ID=1_1984;partial=00;start_type=ATG;rbs_motif=None;rbs_spacer=None;gc_cont=0.306	WP_001028774.1 antibiotic biosynthesis monooxygenase family protein [Staphylococcus aureus]	100	91.9	3.49e-103
CP132486.1_1985|2087674|2087841|-1|ID=1_1985;partial=00;start_type=ATG;rbs_motif=None;rbs_spacer=None;gc_cont=0.250	WP_072357683.1 hypothetical protein [Staphylococcus aureus]	96.4	98.2	1.54e-30
CP132486.1_1986|2087916|2088128|-1|ID=1_1986;partial=00;start_type=ATG;rbs_motif=AGGA;rbs_spacer=5-10bp;gc_cont=0.272	WP_000011688.1 MULTISPECIES: sterile alpha motif-like domain-containing protein [Staphylococcus]	100	98.6	1.89e-43
CP132486.1_1987|2088406|2090223|-1|ID=1_1987;partial=00;start_type=GTG;rbs_motif=AGGA;rbs_spacer=5-10bp;gc_cont=0.385	WP_000066527.1 choline dehydrogenase [Staphylococcus aureus]	100	93.9	0.0
CP132486.1_1988|2090376|2091866|-1|ID=1_1988;partial=00;start_type=ATG;rbs_motif=GGAG/GAGG;rbs_spacer=5-10bp;gc_cont=0.370	WP_000421708.1 betaine-aldehyde dehydrogenase [Staphylococcus aureus]	100	99.8	0.0
CP132486.1_1989|2092098|2092682|1|ID=1_1989;partial=00;start_type=ATG;rbs_motif=None;rbs_spacer=None;gc_cont=0.357	WP_000198596.1 choline uptake/conversion transcriptional regulator CudC [Staphylococcus aureus]	100	95.9	1.65e-126
CP132486.1_1990|2092851|2094473|-1|ID=1_1990;partial=00;start_type=TTG;rbs_motif=GGAG/GAGG;rbs_spacer=5-10bp;gc_cont=0.354	WP_000711870.1 MULTISPECIES: BCCT family transporter [Staphylococcus]	100	99.8	0.0
CP132486.1_1991|2094991|2095527|-1|ID=1_1991;partial=00;start_type=ATG;rbs_motif=None;rbs_spacer=None;gc_cont=0.324	WP_000173332.1 anaerobic ribonucleoside-triphosphate reductase activating protein [Staphylococcus aureus]	100	99.4	3.91e-130
CP132486.1_1992|2095524|2097374|-1|ID=1_1992;partial=00;start_type=ATG;rbs_motif=GGA/GAG/AGG;rbs_spacer=5-10bp;gc_cont=0.345	WP_001071718.1 anaerobic ribonucleoside-triphosphate reductase [Staphylococcus aureus]	100	99.8	0.0
CP132486.1_1993|2097621|2098991|-1|ID=1_1993;partial=00;start_type=ATG;rbs_motif=GGAG/GAGG;rbs_spacer=5-10bp;gc_cont=0.361	WP_001083496.1 CitMHS family transporter [Staphylococcus aureus]	100	99.8	5.71e-308
CP132486.1_1994|2099480|2100088|-1|ID=1_1994;partial=00;start_type=ATG;rbs_motif=AGGA/GGAG/GAGG;rbs_spacer=11-12bp;gc_cont=0.376	WP_001057046.1 NAD(P)-binding protein [Staphylococcus aureus]	100	99.5	3.50e-138
CP132486.1_1995|2100154|2102034|-1|ID=1_1995;partial=00;start_type=TTG;rbs_motif=GGAG/GAGG;rbs_spacer=5-10bp;gc_cont=0.350	WP_000775147.1 assimilatory sulfite reductase (NADPH) flavoprotein subunit [Staphylococcus aureus]	100	99.8	0.0
CP132486.1_1996|2102425|2102922|-1|ID=1_1996;partial=00;start_type=ATG;rbs_motif=GGA/GAG/AGG;rbs_spacer=5-10bp;gc_cont=0.311	WP_001065267.1 MULTISPECIES: glutathione peroxidase [Staphylococcus]	100	99.4	9.04e-116
CP132486.1_1997|2102932|2103183|-1|ID=1_1997;partial=00;start_type=ATG;rbs_motif=AGGA;rbs_spacer=5-10bp;gc_cont=0.313	WP_014937088.1 hypothetical protein [Staphylococcus aureus]	100	98.8	4.57e-55
CP132486.1_1999|2104356|2106356|-1|ID=1_1999;partial=00;start_type=ATG;rbs_motif=AGGA/GGAG/GAGG;rbs_spacer=11-12bp;gc_cont=0.312	WP_000776741.1 ABC transporter permease [Staphylococcus aureus]	100	99.9	0.0
CP132486.1_2000|2106353|2107108|-1|ID=1_2000;partial=00;start_type=ATG;rbs_motif=GGAG/GAGG;rbs_spacer=5-10bp;gc_cont=0.347	WP_000923768.1 MULTISPECIES: ABC transporter ATP-binding protein [Staphylococcus]	100	99.6	1.11e-172
CP132486.1_2001|2107216|2107809|-1|ID=1_2001;partial=00;start_type=ATG;rbs_motif=None;rbs_spacer=None;gc_cont=0.316	WP_312590501.1 nisin susceptibility-associated two-component system sensor histidine kinase NsaS, partial [Staphylococcus aureus]	100	99.5	1.39e-137
CP132486.1_2002|2107831|2108157|-1|ID=1_2002;partial=00;start_type=ATG;rbs_motif=None;rbs_spacer=None;gc_cont=0.254	WP_423143435.1 nisin susceptibility-associated two-component system sensor histidine kinase NsaS, partial [Staphylococcus aureus]	100	82.6	2.54e-45
CP132486.1_2003|2108114|2108779|-1|ID=1_2003;partial=00;start_type=ATG;rbs_motif=AGGA/GGAG/GAGG;rbs_spacer=11-12bp;gc_cont=0.302	WP_000697873.1 nisin susceptibility-associated two-component system response regulator NsaR [Staphylococcus aureus]	100	99.5	1.03e-153
CP132486.1_2004|2108805|2109005|-1|ID=1_2004;partial=00;start_type=ATG;rbs_motif=GGAG/GAGG;rbs_spacer=5-10bp;gc_cont=0.318	WP_000604731.1 hypothetical protein [Staphylococcus aureus]	100	98.5	1.35e-30
CP132486.1_2005|2109203|2110627|1|ID=1_2005;partial=00;start_type=ATG;rbs_motif=AGGAG;rbs_spacer=5-10bp;gc_cont=0.351	WP_000953736.1 alkaline phosphatase [Staphylococcus aureus]	100	99.8	0.0
CP132486.1_2006|2110687|2110791|-1|ID=1_2006;partial=00;start_type=ATG;rbs_motif=AGGAG;rbs_spacer=5-10bp;gc_cont=0.305	WP_000731972.1 MULTISPECIES: SE2200 family small protein [Staphylococcaceae]	100	94.3	5.07e-15
CP132486.1_2007|2110910|2111365|-1|ID=1_2007;partial=00;start_type=ATG;rbs_motif=AGGAG;rbs_spacer=5-10bp;gc_cont=0.320	WP_000106185.1 MULTISPECIES: MarR family winged helix-turn-helix transcriptional regulator [Staphylococcus]	100	99.3	1.67e-102
CP132486.1_2008|2111609|2112370|-1|ID=1_2008;partial=00;start_type=ATG;rbs_motif=GGA/GAG/AGG;rbs_spacer=11-12bp;gc_cont=0.336	WP_000323448.1 MULTISPECIES: alpha/beta hydrolase [Staphylococcus]	100	99.6	8.91e-189
CP132486.1_2009|2112486|2115365|-1|ID=1_2009;partial=00;start_type=TTG;rbs_motif=GGAG/GAGG;rbs_spacer=5-10bp;gc_cont=0.404	WP_433978092.1 MSCRAMM family adhesin clumping factor ClfB [Staphylococcus aureus]	100	99.9	0.0
CP132486.1_2010|2115715|2116419|-1|ID=1_2010;partial=00;start_type=ATG;rbs_motif=AGGAG;rbs_spacer=5-10bp;gc_cont=0.298	WP_000138218.1 MULTISPECIES: Crp/Fnr family transcriptional regulator [Staphylococcus]	100	99.6	4.95e-172
CP132486.1_2011|2116518|2117459|-1|ID=1_2011;partial=00;start_type=ATG;rbs_motif=AGGAG;rbs_spacer=5-10bp;gc_cont=0.372	WP_000660026.1 MULTISPECIES: carbamate kinase [Staphylococcus]	100	99.7	9.44e-221
CP132486.1_2012|2117476|2118906|-1|ID=1_2012;partial=00;start_type=ATG;rbs_motif=AGGAG;rbs_spacer=5-10bp;gc_cont=0.352	WP_001005833.1 MULTISPECIES: arginine-ornithine antiporter [Staphylococcus]	100	99.8	0.0
CP132486.1_2013|2118997|2120007|-1|ID=1_2013;partial=00;start_type=ATG;rbs_motif=GGAG/GAGG;rbs_spacer=5-10bp;gc_cont=0.328	WP_000136166.1 MULTISPECIES: ornithine carbamoyltransferase [Staphylococcus]	100	99.7	4.64e-244
CP132486.1_2014|2120040|2121275|-1|ID=1_2014;partial=00;start_type=ATG;rbs_motif=AGGAG;rbs_spacer=5-10bp;gc_cont=0.342	WP_000129414.1 arginine deiminase [Staphylococcus aureus]	100	99.8	1.66e-300
CP132486.1_2015|2121624|2122073|-1|ID=1_2015;partial=00;start_type=ATG;rbs_motif=AGGAG;rbs_spacer=5-10bp;gc_cont=0.287	WP_000748757.1 arginine repressor [Staphylococcus aureus]	100	99.3	2.79e-100
CP132486.1_2016|2122441|2123970|-1|ID=1_2016;partial=00;start_type=GTG;rbs_motif=AGGAG;rbs_spacer=5-10bp;gc_cont=0.363	WP_001225015.1 zinc metalloproteinase aureolysin [Staphylococcus aureus]	100	99.8	0.0
CP132486.1_2017|2124384|2124911|-1|ID=1_2017;partial=00;start_type=ATG;rbs_motif=GGA/GAG/AGG;rbs_spacer=5-10bp;gc_cont=0.312	WP_001077096.1 MULTISPECIES: immunodominant staphylococcal antigen IsaB [Staphylococcus]	100	99.4	2.09e-119
CP132486.1_2018|2125166|2125609|1|ID=1_2018;partial=00;start_type=TTG;rbs_motif=GGAG/GAGG;rbs_spacer=5-10bp;gc_cont=0.338	WP_000713988.1 hypothetical protein [Staphylococcus aureus]	100	99.3	4.32e-55
CP132486.1_2019|2125849|2127723|1|ID=1_2019;partial=00;start_type=ATG;rbs_motif=AGGAGG;rbs_spacer=5-10bp;gc_cont=0.311	WP_000887001.1 BglG family transcription antiterminator [Staphylococcus aureus]	100	99.8	0.0
CP132486.1_2020|2127800|2129752|1|ID=1_2020;partial=00;start_type=ATG;rbs_motif=AGGAG;rbs_spacer=5-10bp;gc_cont=0.392	WP_000706127.1 fructose-specific PTS transporter subunit EIIC [Staphylococcus aureus]	100	99.8	0.0
CP132486.1_2021|2129766|2130704|1|ID=1_2021;partial=00;start_type=ATG;rbs_motif=AGGAG;rbs_spacer=5-10bp;gc_cont=0.358	WP_001173204.1 mannose-6-phosphate isomerase, class I [Staphylococcus aureus]	100	99.7	3.63e-238
CP132486.1_2022|2130816|2133797|-1|ID=1_2022;partial=00;start_type=ATG;rbs_motif=AGGAG;rbs_spacer=5-10bp;gc_cont=0.351	WP_158191008.1 YhgE/Pip domain-containing protein [Staphylococcus aureus]	100	99.9	0.0
CP132486.1_2023|2134008|2135867|1|ID=1_2023;partial=00;start_type=ATG;rbs_motif=GGAG/GAGG;rbs_spacer=5-10bp;gc_cont=0.327	WP_001125633.1 amidase domain-containing protein [Staphylococcus aureus]	100	99.8	0.0
CP132486.1_2024|2136134|2136694|-1|ID=1_2024;partial=00;start_type=ATG;rbs_motif=AGGAG;rbs_spacer=5-10bp;gc_cont=0.353	WP_000088195.1 MULTISPECIES: isochorismatase family cysteine hydrolase [Staphylococcus]	100	99.5	7.44e-123
CP132486.1_2025|2136862|2138757|-1|ID=1_2025;partial=00;start_type=ATG;rbs_motif=AGGAG;rbs_spacer=5-10bp;gc_cont=0.323	WP_433978093.1 cell-wall-anchored protein SasF [Staphylococcus aureus]	100	99.8	0.0
CP132486.1_2026|2138999|2140357|-1|ID=1_2026;partial=00;start_type=ATG;rbs_motif=GGAG/GAGG;rbs_spacer=5-10bp;gc_cont=0.332	WP_000593166.1 MULTISPECIES: accessory Sec system glycosylation chaperone GtfB [Staphylococcus]	100	99.8	0.0
CP132486.1_2027|2140350|2141858|-1|ID=1_2027;partial=00;start_type=ATG;rbs_motif=GGA/GAG/AGG;rbs_spacer=5-10bp;gc_cont=0.348	WP_000158410.1 accessory Sec system glycosyltransferase GtfA [Staphylococcus aureus]	100	99.8	0.0
CP132486.1_2028|2141876|2144266|-1|ID=1_2028;partial=00;start_type=ATG;rbs_motif=GGA/GAG/AGG;rbs_spacer=5-10bp;gc_cont=0.338	WP_181279902.1 accessory Sec system translocase SecA2 [Staphylococcus aureus]	100	99.9	0.0
CP132486.1_2029|2144256|2145215|-1|ID=1_2029;partial=00;start_type=ATG;rbs_motif=GGAG/GAGG;rbs_spacer=5-10bp;gc_cont=0.327	WP_000916740.1 MULTISPECIES: accessory Sec system protein Asp3 [Staphylococcus]	100	99.7	1.22e-235
CP132486.1_2030|2145193|2146764|-1|ID=1_2030;partial=00;start_type=ATG;rbs_motif=GGA/GAG/AGG;rbs_spacer=5-10bp;gc_cont=0.360	WP_001137466.1 accessory Sec system protein Asp2 [Staphylococcus aureus]	100	99.6	0.0
CP132486.1_2031|2146751|2148304|-1|ID=1_2031;partial=00;start_type=ATG;rbs_motif=AGGAG;rbs_spacer=5-10bp;gc_cont=0.338	WP_000873215.1 accessory Sec system protein Asp1 [Staphylococcus aureus]	100	99.8	0.0
CP132486.1_2032|2148315|2149526|-1|ID=1_2032;partial=00;start_type=ATG;rbs_motif=GGAG/GAGG;rbs_spacer=5-10bp;gc_cont=0.288	WP_000916107.1 MULTISPECIES: accessory Sec system protein translocase subunit SecY2 [Staphylococcus]	100	99.8	1.03e-274
CP132486.1_2033|2149655|2156494|-1|ID=1_2033;partial=00;start_type=ATG;rbs_motif=AGGAG;rbs_spacer=5-10bp;gc_cont=0.387	WP_374232587.1 serine-rich repeat glycoprotein adhesin SasA [Staphylococcus aureus]	100	34.6	0.0
CP132486.1_2034|2157041|2157733|-1|ID=1_2034;partial=00;start_type=ATG;rbs_motif=GGAG/GAGG;rbs_spacer=5-10bp;gc_cont=0.382	WP_001109864.1 flavin reductase family protein [Staphylococcus aureus]	100	99.6	1.17e-168
CP132486.1_2035|2158059|2158982|1|ID=1_2035;partial=00;start_type=ATG;rbs_motif=GGA/GAG/AGG;rbs_spacer=5-10bp;gc_cont=0.311	WP_001166430.1 hypothetical protein [Staphylococcus aureus]	100	99.7	1.10e-216
CP132486.1_2036|2159169|2160113|1|ID=1_2036;partial=00;start_type=ATG;rbs_motif=AGGAG;rbs_spacer=5-10bp;gc_cont=0.311	WP_014937090.1 hypothetical protein [Staphylococcus aureus]	100	99.7	7.27e-230
CP132486.1_2037|2160064|2162004|1|ID=1_2037;partial=00;start_type=ATG;rbs_motif=None;rbs_spacer=None;gc_cont=0.321	WP_257305887.1 hypothetical protein [Staphylococcus aureus]	99.8	94.0	0.0
CP132486.1_2038|2161959|2162123|1|ID=1_2038;partial=00;start_type=ATG;rbs_motif=None;rbs_spacer=None;gc_cont=0.345	WP_407819797.1 hypothetical protein [Staphylococcus aureus]	100	98.2	3.04e-28
CP132486.1_2039|2162252|2162701|1|ID=1_2039;partial=00;start_type=ATG;rbs_motif=None;rbs_spacer=None;gc_cont=0.322	WP_000603496.1 MULTISPECIES: hypothetical protein [Staphylococcaceae]	100	79.3	1.41e-73
CP132486.1_2040|2162786|2163397|-1|ID=1_2040;partial=00;start_type=ATG;rbs_motif=GGAG/GAGG;rbs_spacer=5-10bp;gc_cont=0.343	WP_000556743.1 flavin reductase family protein [Staphylococcus aureus]	100	99.5	1.18e-141
CP132486.1_2041|2163476|2163952|-1|ID=1_2041;partial=00;start_type=ATG;rbs_motif=GGAG/GAGG;rbs_spacer=5-10bp;gc_cont=0.348	WP_000301929.1 peptide-methionine (S)-S-oxide reductase [Staphylococcus aureus]	100	99.4	2.53e-114
CP132486.1_2042|2163955|2164455|-1|ID=1_2042;partial=00;start_type=ATG;rbs_motif=AGGA;rbs_spacer=5-10bp;gc_cont=0.327	WP_000244264.1 GNAT family N-acetyltransferase [Staphylococcus aureus]	100	99.4	5.87e-117
CP132486.1_2043|2164690|2165457|-1|ID=1_2043;partial=00;start_type=ATG;rbs_motif=GGA/GAG/AGG;rbs_spacer=5-10bp;gc_cont=0.329	WP_000565312.1 MULTISPECIES: tyrosine-protein phosphatase [Staphylococcus]	100	99.6	1.31e-182
CP132486.1_2044|2165454|2166146|-1|ID=1_2044;partial=00;start_type=ATG;rbs_motif=GGAG/GAGG;rbs_spacer=5-10bp;gc_cont=0.355	WP_000185861.1 MULTISPECIES: polysaccharide biosynthesis tyrosine autokinase [Staphylococcus]	100	99.6	1.58e-157
CP132486.1_2045|2166163|2166858|-1|ID=1_2045;partial=00;start_type=ATG;rbs_motif=None;rbs_spacer=None;gc_cont=0.286	WP_134413407.1 Wzz/FepE/Etk N-terminal domain-containing protein [Staphylococcus aureus]	99.6	98.3	4.43e-141
CP132486.1_2046|2167672|2168232|-1|ID=1_2046;partial=00;start_type=TTG;rbs_motif=AGxAGG/AGGxGG;rbs_spacer=5-10bp;gc_cont=0.278	WP_000653261.1 MULTISPECIES: ica operon transcriptional regulator IcaR [Staphylococcus]	100	99.5	4.00e-127
CP132486.1_2047|2168396|2169634|1|ID=1_2047;partial=00;start_type=TTG;rbs_motif=GGA/GAG/AGG;rbs_spacer=5-10bp;gc_cont=0.338	WP_001159433.1 poly-beta-1,6 N-acetyl-D-glucosamine synthase IcaA [Staphylococcus aureus]	100	99.8	7.55e-277
CP132486.1_2048|2169598|2169903|1|ID=1_2048;partial=00;start_type=ATG;rbs_motif=AGxAGG/AGGxGG;rbs_spacer=5-10bp;gc_cont=0.320	WP_000240580.1 MULTISPECIES: intracellular adhesion protein IcaD [Staphylococcus]	100	99.0	1.03e-61
CP132486.1_2049|2169879|2170772|1|ID=1_2049;partial=00;start_type=ATG;rbs_motif=None;rbs_spacer=None;gc_cont=0.295	WP_000877364.1 MULTISPECIES: intercellular adhesin biosynthesis polysaccharide N-deacetylase [Staphylococcus]	100	97.0	3.16e-207
CP132486.1_2050|2170759|2171811|1|ID=1_2050;partial=00;start_type=ATG;rbs_motif=GGA/GAG/AGG;rbs_spacer=5-10bp;gc_cont=0.275	WP_000723845.1 polysaccharide intercellular adhesin biosynthesis/export protein IcaC [Staphylococcus aureus]	100	99.7	1.27e-239
CP132486.1_2051|2172259|2174304|-1|ID=1_2051;partial=00;start_type=ATG;rbs_motif=GGAG/GAGG;rbs_spacer=5-10bp;gc_cont=0.345	WP_072435013.1 YSIRK domain-containing triacylglycerol lipase Lip1 [Staphylococcus aureus]	100	99.7	0.0
CP132486.1_2052|2175392|2176024|-1|ID=1_2052;partial=00;start_type=ATG;rbs_motif=AGxAGG/AGGxGG;rbs_spacer=11-12bp;gc_cont=0.344	WP_000186284.1 bifunctional phosphoribosyl-AMP cyclohydrolase/phosphoribosyl-ATP diphosphatase HisIE [Staphylococcus aureus]	100	99.5	2.76e-148
CP132486.1_2053|2176021|2176779|-1|ID=1_2053;partial=00;start_type=ATG;rbs_motif=GGAG/GAGG;rbs_spacer=5-10bp;gc_cont=0.372	WP_000592596.1 imidazole glycerol phosphate synthase subunit HisF [Staphylococcus aureus]	99.2	99.6	9.55e-179
CP132486.1_2054|2176776|2177480|-1|ID=1_2054;partial=00;start_type=ATG;rbs_motif=GGA/GAG/AGG;rbs_spacer=5-10bp;gc_cont=0.391	WP_000571740.1 1-(5-phosphoribosyl)-5-((5-phosphoribosylamino)methylideneamino)imidazole-4-carboxamide isomerase [Staphylococcus aureus]	100	99.6	1.07e-166
CP132486.1_2055|2177473|2178051|-1|ID=1_2055;partial=00;start_type=ATG;rbs_motif=GGA/GAG/AGG;rbs_spacer=5-10bp;gc_cont=0.368	WP_000635611.1 imidazole glycerol phosphate synthase subunit HisH [Staphylococcus aureus]	100	99.5	6.63e-138
CP132486.1_2056|2178048|2178626|-1|ID=1_2056;partial=00;start_type=ATG;rbs_motif=GGAG/GAGG;rbs_spacer=5-10bp;gc_cont=0.363	WP_000640266.1 MULTISPECIES: imidazoleglycerol-phosphate dehydratase HisB [Staphylococcus]	100	99.5	1.68e-131
CP132486.1_2057|2178595|2179608|-1|ID=1_2057;partial=00;start_type=ATG;rbs_motif=GGAG/GAGG;rbs_spacer=5-10bp;gc_cont=0.342	WP_000639193.1 pyridoxal phosphate-dependent aminotransferase [Staphylococcus aureus]	100	99.7	3.95e-241
CP132486.1_2058|2179624|2180874|-1|ID=1_2058;partial=00;start_type=ATG;rbs_motif=AGGA/GGAG/GAGG;rbs_spacer=11-12bp;gc_cont=0.357	WP_433978134.1 histidinol dehydrogenase [Staphylococcus aureus]	100	99.8	2.16e-294
CP132486.1_2059|2180867|2181481|-1|ID=1_2059;partial=00;start_type=ATG;rbs_motif=GGAG/GAGG;rbs_spacer=5-10bp;gc_cont=0.340	WP_000944149.1 MULTISPECIES: ATP phosphoribosyltransferase [Staphylococcus]	100	99.5	4.76e-137
CP132486.1_2060|2181499|2182356|-1|ID=1_2060;partial=00;start_type=GTG;rbs_motif=GGA/GAG/AGG;rbs_spacer=5-10bp;gc_cont=0.351	WP_001065579.1 ATP phosphoribosyltransferase regulatory subunit [Staphylococcus aureus]	99.6	95.1	1.91e-196
CP132486.1_2061|2182622|2183746|-1|ID=1_2061;partial=00;start_type=ATG;rbs_motif=GGAG/GAGG;rbs_spacer=5-10bp;gc_cont=0.324	WP_433978094.1 polysaccharide deacetylase family protein [Staphylococcus aureus]	100	99.7	1.41e-280
CP132486.1_2062|2184159|2184674|1|ID=1_2062;partial=00;start_type=ATG;rbs_motif=GGAG/GAGG;rbs_spacer=5-10bp;gc_cont=0.328	WP_000181127.1 MULTISPECIES: YceI family protein [Staphylococcus]	100	99.4	3.23e-112
CP132486.1_2063|2184820|2185818|-1|ID=1_2063;partial=00;start_type=ATG;rbs_motif=None;rbs_spacer=None;gc_cont=0.351	WP_000193662.1 SMP-30/gluconolactonase/LRE family protein [Staphylococcus aureus]	100	97.0	3.85e-241
CP132486.1_2064|2186039|2186995|1|ID=1_2064;partial=00;start_type=ATG;rbs_motif=AGGAG;rbs_spacer=5-10bp;gc_cont=0.358	WP_001109294.1 MULTISPECIES: oxygen-dependent tRNA uridine(34) hydroxylase TrhO [Staphylococcus]	100	99.7	1.09e-242
CP132486.1_2065|2187149|2187787|1|ID=1_2065;partial=00;start_type=ATG;rbs_motif=None;rbs_spacer=None;gc_cont=0.365	WP_000547823.1 pyroglutamyl-peptidase I [Staphylococcus aureus]	100	99.5	7.91e-149
CP132486.1_2066|2187906|2188673|-1|ID=1_2066;partial=00;start_type=ATG;rbs_motif=GGAG/GAGG;rbs_spacer=5-10bp;gc_cont=0.281	WP_000949565.1 membrane protein [Staphylococcus aureus]	100	99.6	8.21e-161
CP132486.1_2067|2188663|2189001|-1|ID=1_2067;partial=00;start_type=ATG;rbs_motif=GGA/GAG/AGG;rbs_spacer=5-10bp;gc_cont=0.351	WP_000116415.1 PadR family transcriptional regulator [Staphylococcus aureus]	100	99.1	1.24e-74
CP132486.1_2068|2189150|2189632|1|ID=1_2068;partial=00;start_type=ATG;rbs_motif=None;rbs_spacer=None;gc_cont=0.325	WP_304379177.1 bacillithiol transferase BstA [Staphylococcus aureus]	100	95.7	2.12e-108
CP132486.1_2069|2189793|2193905|-1|ID=1_2069;partial=00;start_type=ATG;rbs_motif=AGGAG;rbs_spacer=5-10bp;gc_cont=0.341	WP_247925222.1 Cna B-type domain-containing protein [Staphylococcus aureus]	100	99.9	0.0
CP132486.1_2070|2194283|2195701|1|ID=1_2070;partial=00;start_type=ATG;rbs_motif=AGGA;rbs_spacer=5-10bp;gc_cont=0.378	WP_000799703.1 anion permease [Staphylococcus aureus]	100	99.8	0.0
CP132486.1_2071|2196251|2197159|-1|ID=1_2071;partial=00;start_type=GTG;rbs_motif=AGGAG;rbs_spacer=5-10bp;gc_cont=0.331	WP_001091183.1 EamA family transporter RarD [Staphylococcus aureus]	100	99.7	1.00e-205
CP132486.1_2072|2197381|2197956|1|ID=1_2072;partial=00;start_type=ATG;rbs_motif=AGGA;rbs_spacer=5-10bp;gc_cont=0.342	WP_435752770.1 DNA-binding protein [Staphylococcus aureus]	99.5	99.5	1.63e-133
CP132486.1_2073|2198079|2199131|1|ID=1_2073;partial=00;start_type=ATG;rbs_motif=None;rbs_spacer=None;gc_cont=0.343	WP_000215636.1 HoxN/HupN/NixA family nickel/cobalt transporter [Staphylococcus aureus]	99.7	96.3	5.01e-234
CP132486.1_2074|2199371|2200171|1|ID=1_2074;partial=00;start_type=ATG;rbs_motif=AGGAGG;rbs_spacer=5-10bp;gc_cont=0.328	WP_001017408.1 arylamine N-acetyltransferase family protein [Staphylococcus aureus]	100	99.6	9.64e-195
CP132486.1_2075|2200474|2200986|-1|ID=1_2075;partial=00;start_type=ATG;rbs_motif=AGGA;rbs_spacer=5-10bp;gc_cont=0.300	WP_000410770.1 MULTISPECIES: HdeD family acid-resistance protein [Staphylococcus]	100	99.4	3.46e-102
CP132486.1_2076|2201276|2202034|1|ID=1_2076;partial=00;start_type=ATG;rbs_motif=AGGAG;rbs_spacer=5-10bp;gc_cont=0.362	WP_000154162.1 MULTISPECIES: peptide resistance ABC transporter ATP-binding subunit VraD [Staphylococcus]	100	99.6	8.79e-175
CP132486.1_2077|2202024|2203904|1|ID=1_2077;partial=00;start_type=ATG;rbs_motif=AGxAGG/AGGxGG;rbs_spacer=5-10bp;gc_cont=0.312	WP_000143678.1 peptide resistance ABC transporter permease subunit VraE [Staphylococcus aureus]	100	99.8	0.0
CP132486.1_2078|2203996|2204187|1|ID=1_2078;partial=00;start_type=ATG;rbs_motif=AGGAG;rbs_spacer=5-10bp;gc_cont=0.328	WP_000672026.1 peptide resistance ABC transporter activity modulator VraH [Staphylococcus aureus]	100	98.4	4.12e-35
CP132486.1_2079|2204579|2204779|1|ID=1_2079;partial=00;start_type=ATG;rbs_motif=GGAG/GAGG;rbs_spacer=5-10bp;gc_cont=0.383	WP_001059079.1 MULTISPECIES: cold-shock protein [Staphylococcus]	100	98.5	1.96e-41
CP132486.1_2080|2204897|2205466|-1|ID=1_2080;partial=00;start_type=TTG;rbs_motif=GGAG/GAGG;rbs_spacer=5-10bp;gc_cont=0.323	WP_001054114.1 helix-turn-helix transcriptional regulator [Staphylococcus aureus]	100	99.5	5.03e-127
CP132486.1_2081|2205726|2206121|-1|ID=1_2081;partial=00;start_type=ATG;rbs_motif=GGAG/GAGG;rbs_spacer=5-10bp;gc_cont=0.348	WP_000779134.1 MULTISPECIES: DUF3147 family protein [Bacteria]	100	99.2	1.51e-84
CP132486.1_2082|2206189|2206542|-1|ID=1_2082;partial=00;start_type=ATG;rbs_motif=GGA/GAG/AGG;rbs_spacer=5-10bp;gc_cont=0.376	WP_000491382.1 MULTISPECIES: DUF3147 family protein [Staphylococcus]	100	99.2	4.06e-71
CP132486.1_2083|2206859|2207698|-1|ID=1_2083;partial=00;start_type=ATG;rbs_motif=AGGAG;rbs_spacer=5-10bp;gc_cont=0.357	WP_000742845.1 nucleoid occlusion protein [Staphylococcus aureus]	100	99.6	1.23e-183
CP132486.1_2084|2207741|2208460|-1|ID=1_2084;partial=00;start_type=ATG;rbs_motif=GGA/GAG/AGG;rbs_spacer=5-10bp;gc_cont=0.338	WP_000215582.1 16S rRNA (guanine(527)-N(7))-methyltransferase RsmG [Staphylococcus aureus]	100	99.6	2.34e-168
CP132486.1_2085|2208460|2210337|-1|ID=1_2085;partial=00;start_type=GTG;rbs_motif=AGGAG;rbs_spacer=5-10bp;gc_cont=0.352	WP_000249667.1 tRNA uridine-5-carboxymethylaminomethyl(34) synthesis enzyme MnmG [Staphylococcus aureus]	100	99.8	0.0
CP132486.1_2086|2210404|2211783|-1|ID=1_2086;partial=00;start_type=ATG;rbs_motif=GGA/GAG/AGG;rbs_spacer=5-10bp;gc_cont=0.340	WP_000362509.1 MULTISPECIES: tRNA uridine-5-carboxymethylaminomethyl(34) synthesis GTPase MnmE [Staphylococcus]	100	99.8	0.0
CP132486.1_2087|2211927|2212280|-1|ID=1_2087;partial=00;start_type=ATG;rbs_motif=None;rbs_spacer=None;gc_cont=0.291	WP_001789343.1 MULTISPECIES: ribonuclease P protein component [Staphylococcus]	100	99.2	1.47e-73
