CP159281.1_635|682466|683065|-1|ID=1_635;partial=00;start_type=ATG;rbs_motif=AGGA;rbs_spacer=5-10bp;gc_cont=0.355	WP_003132120.1 MULTISPECIES: niacin ECF transporter S component NiaX [Lactococcus]	100	99.5	4.38e-126
CP159281.1_636|683319|684209|-1|ID=1_636;partial=00;start_type=ATG;rbs_motif=GGA/GAG/AGG;rbs_spacer=5-10bp;gc_cont=0.354	WP_003132119.1 MULTISPECIES: homoserine kinase [Lactococcus]	100	99.7	4.24e-204
CP159281.1_637|684214|685500|-1|ID=1_637;partial=00;start_type=ATG;rbs_motif=AGGAG;rbs_spacer=5-10bp;gc_cont=0.364	WP_003132116.1 MULTISPECIES: homoserine dehydrogenase [Lactococcus]	100	99.8	1.27e-299
CP159281.1_638|685677|686315|-1|ID=1_638;partial=00;start_type=TTG;rbs_motif=AGGA;rbs_spacer=5-10bp;gc_cont=0.322	WP_003132114.1 deoxynucleoside kinase [Lactococcus lactis]	100	99.5	1.12e-148
CP159281.1_639|686445|687728|-1|ID=1_639;partial=00;start_type=ATG;rbs_motif=GGA/GAG/AGG;rbs_spacer=5-10bp;gc_cont=0.364	WP_003132113.1 MULTISPECIES: bifunctional folylpolyglutamate synthase/dihydrofolate synthase [Lactococcus]	100	99.8	3.92e-298
CP159281.1_640|687747|688244|-1|ID=1_640;partial=00;start_type=ATG;rbs_motif=AGGA;rbs_spacer=5-10bp;gc_cont=0.327	WP_003132112.1 MULTISPECIES: NUDIX domain-containing protein [Lactococcus]	100	99.4	3.40e-111
CP159281.1_641|688247|689320|-1|ID=1_641;partial=00;start_type=ATG;rbs_motif=None;rbs_spacer=None;gc_cont=0.332	WP_003132109.1 MULTISPECIES: dihydropteroate synthase [Lactococcus]	100	99.7	4.02e-251
CP159281.1_642|689317|690366|-1|ID=1_642;partial=00;start_type=ATG;rbs_motif=GGAG/GAGG;rbs_spacer=5-10bp;gc_cont=0.321	WP_014570583.1 MULTISPECIES: GTP cyclohydrolase I FolE [Lactococcus]	100	99.7	1.69e-248
CP159281.1_643|690446|690796|-1|ID=1_643;partial=00;start_type=ATG;rbs_motif=GGA/GAG/AGG;rbs_spacer=5-10bp;gc_cont=0.319	WP_003132106.1 MULTISPECIES: dihydroneopterin aldolase [Lactococcus]	100	99.1	3.23e-72
CP159281.1_644|690850|691437|-1|ID=1_644;partial=00;start_type=ATG;rbs_motif=GGAG/GAGG;rbs_spacer=5-10bp;gc_cont=0.335	WP_023164083.1 ribosome biogenesis GTP-binding protein YihA/YsxC [Lactococcus lactis]	100	99.5	5.87e-138
CP159281.1_645|691434|692669|-1|ID=1_645;partial=00;start_type=ATG;rbs_motif=AGGA/GGAG/GAGG;rbs_spacer=11-12bp;gc_cont=0.336	WP_014570582.1 MULTISPECIES: ATP-dependent Clp protease ATP-binding subunit ClpX [Lactococcus]	100	99.8	1.01e-285
CP159281.1_646|692913|693419|-1|ID=1_646;partial=00;start_type=ATG;rbs_motif=GGAG/GAGG;rbs_spacer=5-10bp;gc_cont=0.333	WP_010905786.1 MULTISPECIES: dihydrofolate reductase [Lactococcus]	100	99.4	1.75e-119
CP159281.1_647|693818|694327|1|ID=1_647;partial=00;start_type=ATG;rbs_motif=None;rbs_spacer=None;gc_cont=0.331	WP_010905785.1 MULTISPECIES: tRNA (cytidine(34)-2'-O)-methyltransferase [Lactococcus]	100	99.4	6.08e-125
CP159281.1_648|694447|694860|1|ID=1_648;partial=00;start_type=ATG;rbs_motif=AGGAG;rbs_spacer=5-10bp;gc_cont=0.379	WP_003132097.1 MULTISPECIES: hypothetical protein [Lactococcus]	100	99.3	1.00e-94
CP159281.1_649|694889|696193|-1|ID=1_649;partial=00;start_type=ATG;rbs_motif=AGGA;rbs_spacer=5-10bp;gc_cont=0.351	WP_003132095.1 MULTISPECIES: nucleobase:cation symporter-2 family protein [Lactococcus]	100	99.8	2.42e-291
CP159281.1_650|696242|696835|-1|ID=1_650;partial=00;start_type=ATG;rbs_motif=AGGAG;rbs_spacer=5-10bp;gc_cont=0.364	WP_003132093.1 MULTISPECIES: xanthine phosphoribosyltransferase [Lactococcus]	100	99.5	1.22e-131
CP159281.1_651|697107|698096|-1|ID=1_651;partial=00;start_type=ATG;rbs_motif=AGGAG;rbs_spacer=5-10bp;gc_cont=0.388	WP_010905784.1 MULTISPECIES: GMP reductase [Lactococcus]	100	99.7	1.26e-233
CP159281.1_652|698355|698972|-1|ID=1_652;partial=00;start_type=ATG;rbs_motif=GGAG/GAGG;rbs_spacer=5-10bp;gc_cont=0.314	WP_003132091.1 MULTISPECIES: TIGR01906 family membrane protein [Lactococcus]	100	99.5	3.23e-140
CP159281.1_653|699075|699848|-1|ID=1_653;partial=00;start_type=ATG;rbs_motif=GGA/GAG/AGG;rbs_spacer=5-10bp;gc_cont=0.380	WP_010905782.1 TIGR01457 family HAD-type hydrolase [Lactococcus lactis]	100	99.6	4.38e-182
CP159281.1_654|699898|700626|-1|ID=1_654;partial=00;start_type=ATG;rbs_motif=GGAG/GAGG;rbs_spacer=5-10bp;gc_cont=0.320	WP_003132089.1 MULTISPECIES: acyl-[acyl-carrier-protein] thioesterase [Lactococcus]	100	99.6	1.26e-178
CP159281.1_655|700723|701163|-1|ID=1_655;partial=00;start_type=ATG;rbs_motif=AGGAG;rbs_spacer=5-10bp;gc_cont=0.374	WP_021721810.1 MULTISPECIES: deoxycytidylate deaminase [Lactococcus]	100	99.3	3.28e-102
CP159281.1_656|701269|702084|-1|ID=1_656;partial=00;start_type=ATG;rbs_motif=None;rbs_spacer=None;gc_cont=0.375	WP_014570581.1 MULTISPECIES: glycoside hydrolase family 25 protein [Lactococcus]	100	98.2	8.63e-195
CP159281.1_657|702131|703270|-1|ID=1_657;partial=00;start_type=ATG;rbs_motif=GGA/GAG/AGG;rbs_spacer=5-10bp;gc_cont=0.327	WP_003132086.1 MULTISPECIES: radical SAM family heme chaperone HemW [Lactococcus]	100	99.7	3.72e-274
CP159281.1_658|703450|703977|-1|ID=1_658;partial=00;start_type=ATG;rbs_motif=AGGAGG;rbs_spacer=5-10bp;gc_cont=0.375	WP_003132085.1 MULTISPECIES: IbrB-like domain-containing protein [Lactococcus]	100	99.4	1.12e-123
CP159281.1_659|703959|705296|-1|ID=1_659;partial=00;start_type=ATG;rbs_motif=None;rbs_spacer=None;gc_cont=0.349	WP_010905779.1 phosphoadenosine phosphosulfate reductase [Lactococcus lactis]	99.8	99.8	0.0
CP159281.1_660|705511|706098|-1|ID=1_660;partial=00;start_type=ATG;rbs_motif=AGGAG;rbs_spacer=5-10bp;gc_cont=0.342	WP_023164080.1 hypothetical protein [Lactococcus lactis]	100	99.5	8.99e-133
CP159281.1_661|706147|707118|-1|ID=1_661;partial=00;start_type=ATG;rbs_motif=GGA/GAG/AGG;rbs_spacer=5-10bp;gc_cont=0.367	WP_003132079.1 MULTISPECIES: choloylglycine hydrolase family protein [Lactococcus]	100	99.7	5.56e-234
CP159281.1_662|707281|708039|-1|ID=1_662;partial=00;start_type=ATG;rbs_motif=AGGAG;rbs_spacer=5-10bp;gc_cont=0.411	WP_003132078.1 MULTISPECIES: triose-phosphate isomerase [Lactococcus]	100	99.6	7.53e-176
CP159281.1_663|708170|709021|-1|ID=1_663;partial=00;start_type=ATG;rbs_motif=GGAG/GAGG;rbs_spacer=5-10bp;gc_cont=0.350	WP_003132077.1 MULTISPECIES: MurR/RpiR family transcriptional regulator [Lactococcus]	100	99.6	6.67e-190
CP159281.1_664|709083|711035|-1|ID=1_664;partial=00;start_type=ATG;rbs_motif=AGGAG;rbs_spacer=5-10bp;gc_cont=0.388	WP_023164079.1 glucose PTS transporter subunit IIA [Lactococcus lactis]	100	99.8	0.0
CP159281.1_665|711070|711963|-1|ID=1_665;partial=00;start_type=ATG;rbs_motif=GGA/GAG/AGG;rbs_spacer=5-10bp;gc_cont=0.367	WP_003132073.1 MULTISPECIES: N-acetylmuramic acid 6-phosphate etherase [Lactococcus]	100	99.7	1.26e-185
CP159281.1_666|711956|713017|-1|ID=1_666;partial=00;start_type=ATG;rbs_motif=AGGA;rbs_spacer=5-10bp;gc_cont=0.350	WP_021214538.1 MULTISPECIES: DUF871 domain-containing protein [Lactococcus]	100	99.7	1.85e-254
CP159281.1_667|713176|714147|-1|ID=1_667;partial=00;start_type=ATG;rbs_motif=None;rbs_spacer=None;gc_cont=0.372	WP_003132070.1 MULTISPECIES: L-lactate dehydrogenase [Lactococcus]	100	99.7	6.68e-226
CP159281.1_668|714245|715147|-1|ID=1_668;partial=00;start_type=ATG;rbs_motif=None;rbs_spacer=None;gc_cont=0.343	WP_003132069.1 MULTISPECIES: bifunctional riboflavin kinase/FAD synthetase [Lactococcus]	100	99.7	1.06e-215
CP159281.1_669|715178|716167|-1|ID=1_669;partial=00;start_type=ATG;rbs_motif=None;rbs_spacer=None;gc_cont=0.381	WP_003132067.1 MULTISPECIES: tRNA pseudouridine(55) synthase TruB [Lactococcus]	100	99.7	1.41e-230
CP159281.1_670|716308|717000|-1|ID=1_670;partial=00;start_type=ATG;rbs_motif=AGGAG;rbs_spacer=5-10bp;gc_cont=0.377	WP_012897733.1 hypothetical protein [Lactococcus lactis]	100	99.6	1.66e-127
CP159281.1_671|717171|718679|-1|ID=1_671;partial=00;start_type=ATG;rbs_motif=AGGAG;rbs_spacer=5-10bp;gc_cont=0.376	WP_003132064.1 MULTISPECIES: flavocytochrome c [Lactococcus]	100	99.8	0.0
CP159281.1_672|718844|719302|-1|ID=1_672;partial=00;start_type=ATG;rbs_motif=AGGAG;rbs_spacer=5-10bp;gc_cont=0.370	WP_003132063.1 MULTISPECIES: VOC family protein [Lactococcus]	100	99.3	3.37e-107
CP159281.1_673|719380|719952|-1|ID=1_673;partial=00;start_type=ATG;rbs_motif=GGAG/GAGG;rbs_spacer=5-10bp;gc_cont=0.307	WP_023164076.1 DNA-3-methyladenine glycosylase I [Lactococcus lactis]	100	99.5	1.34e-136
CP159281.1_674|719998|720465|-1|ID=1_674;partial=00;start_type=ATG;rbs_motif=AGxAG;rbs_spacer=5-10bp;gc_cont=0.335	WP_353727507.1 8-oxo-dGTP diphosphatase [Lactococcus lactis]	100	99.4	6.75e-113
CP159281.1_675|720485|722761|-1|ID=1_675;partial=00;start_type=ATG;rbs_motif=AGGAG;rbs_spacer=5-10bp;gc_cont=0.368	WP_023164075.1 DNA helicase PcrA [Lactococcus lactis]	100	99.9	0.0
CP159281.1_676|722918|723694|1|ID=1_676;partial=00;start_type=ATG;rbs_motif=AGGA;rbs_spacer=5-10bp;gc_cont=0.356	WP_010905769.1 MULTISPECIES: rhomboid-like protein [Lactococcus]	100	99.6	5.29e-179
CP159281.1_677|723639|724268|-1|ID=1_677;partial=00;start_type=ATG;rbs_motif=AGGA/GGAG/GAGG;rbs_spacer=11-12bp;gc_cont=0.351	WP_010905768.1 MULTISPECIES: DUF998 domain-containing protein [Lactococcus]	100	99.5	2.76e-143
CP159281.1_678|724255|727020|-1|ID=1_678;partial=00;start_type=ATG;rbs_motif=GGA/GAG/AGG;rbs_spacer=5-10bp;gc_cont=0.368	WP_003132058.1 MULTISPECIES: phosphatidylglycerol lysyltransferase domain-containing protein [Lactococcus]	100	99.9	0.0
CP159281.1_679|727142|728386|-1|ID=1_679;partial=00;start_type=ATG;rbs_motif=GGA/GAG/AGG;rbs_spacer=5-10bp;gc_cont=0.340	WP_353727509.1 XcbB/CpsF family capsular polysaccharide biosynthesis protein [Lactococcus lactis]	100	99.8	2.22e-311
CP159281.1_680|728406|728687|-1|ID=1_680;partial=00;start_type=TTG;rbs_motif=None;rbs_spacer=None;gc_cont=0.358	WP_428815535.1 transglutaminase domain-containing protein [Lactococcus lactis]	98.9	98.9	1.24e-55
CP159281.1_681|728702|730141|-1|ID=1_681;partial=00;start_type=ATG;rbs_motif=AGGA;rbs_spacer=5-10bp;gc_cont=0.340	WP_353727510.1 transglutaminase-like domain-containing protein [Lactococcus lactis]	100	99.8	0.0
CP159281.1_682|730253|731116|-1|ID=1_682;partial=00;start_type=TTG;rbs_motif=None;rbs_spacer=None;gc_cont=0.309	WP_023164071.1 class A sortase [Lactococcus lactis]	100	86.1	5.99e-172
CP159281.1_683|731117|732202|-1|ID=1_683;partial=00;start_type=ATG;rbs_motif=None;rbs_spacer=None;gc_cont=0.331	WP_353727512.1 FAD:protein FMN transferase [Lactococcus lactis]	100	99.7	3.76e-258
CP159281.1_684|732286|734775|-1|ID=1_684;partial=00;start_type=ATG;rbs_motif=GGA/GAG/AGG;rbs_spacer=5-10bp;gc_cont=0.401	WP_153986465.1 DNA gyrase subunit A [Lactococcus lactis]	100	99.9	0.0
CP159281.1_685|735021|736487|-1|ID=1_685;partial=00;start_type=ATG;rbs_motif=AGGAG;rbs_spacer=3-4bp;gc_cont=0.380	WP_023164068.1 APC family permease [Lactococcus lactis]	100	99.8	0.0
CP159281.1_686|736661|737296|-1|ID=1_686;partial=00;start_type=ATG;rbs_motif=GGAG/GAGG;rbs_spacer=5-10bp;gc_cont=0.344	WP_010905761.1 MULTISPECIES: SDR family oxidoreductase [Lactococcus]	100	99.5	9.59e-145
CP159281.1_687|737363|739186|-1|ID=1_687;partial=00;start_type=ATG;rbs_motif=AGGA;rbs_spacer=5-10bp;gc_cont=0.398	WP_003132048.1 MULTISPECIES: translation elongation factor 4 [Lactococcus]	100	99.8	0.0
CP159281.1_688|739473|740138|-1|ID=1_688;partial=00;start_type=ATG;rbs_motif=None;rbs_spacer=None;gc_cont=0.378	WP_003132047.1 MULTISPECIES: acetolactate decarboxylase [Lactococcus]	100	99.5	6.49e-157
CP159281.1_689|740249|741598|1|ID=1_689;partial=00;start_type=ATG;rbs_motif=None;rbs_spacer=None;gc_cont=0.353	WP_003132046.1 MULTISPECIES: lipid II isoglutaminyl synthase subunit MurT [Lactococcus]	100	99.8	0.0
CP159281.1_690|741599|742384|1|ID=1_690;partial=00;start_type=ATG;rbs_motif=AGGA;rbs_spacer=5-10bp;gc_cont=0.356	WP_010905760.1 MULTISPECIES: lipid II isoglutaminyl synthase subunit GatD [Lactococcus]	100	99.6	3.48e-190
CP159281.1_691|742460|745141|-1|ID=1_691;partial=00;start_type=ATG;rbs_motif=GGA/GAG/AGG;rbs_spacer=5-10bp;gc_cont=0.337	WP_014570573.1 MULTISPECIES: FtsX-like permease family protein [Lactococcus]	100	99.9	0.0
CP159281.1_692|745145|745846|-1|ID=1_692;partial=00;start_type=ATG;rbs_motif=AGGAG;rbs_spacer=5-10bp;gc_cont=0.356	WP_010905758.1 MULTISPECIES: ABC transporter ATP-binding protein [Lactococcus]	100	99.6	3.58e-160
CP159281.1_693|745974|746798|-1|ID=1_693;partial=00;start_type=ATG;rbs_motif=AGGA;rbs_spacer=5-10bp;gc_cont=0.393	WP_004255352.1 MULTISPECIES: ammonia-dependent NAD(+) synthetase [Lactococcus]	100	99.6	1.79e-194
CP159281.1_694|746859|747347|-1|ID=1_694;partial=00;start_type=ATG;rbs_motif=GGA/GAG/AGG;rbs_spacer=5-10bp;gc_cont=0.364	WP_010905757.1 MULTISPECIES: GNAT family N-acetyltransferase [Lactococcus]	100	99.4	1.15e-112
CP159281.1_695|747344|748816|-1|ID=1_695;partial=00;start_type=ATG;rbs_motif=GGAG/GAGG;rbs_spacer=5-10bp;gc_cont=0.373	WP_347120609.1 nicotinate phosphoribosyltransferase [Lactococcus lactis]	96.3	99.8	0.0
CP159281.1_696|749040|749225|1|ID=1_696;partial=00;start_type=ATG;rbs_motif=AGGAG;rbs_spacer=5-10bp;gc_cont=0.323	WP_021722510.1 hypothetical protein [Lactococcus lactis]	98.4	98.4	2.52e-35
CP159281.1_697|749356|749943|1|ID=1_697;partial=00;start_type=ATG;rbs_motif=AGGA/GGAG/GAGG;rbs_spacer=11-12bp;gc_cont=0.345	WP_004255345.1 MULTISPECIES: nicotinate-nucleotide adenylyltransferase [Lactococcus]	100	99.5	4.14e-138
CP159281.1_698|749966|751177|-1|ID=1_698;partial=00;start_type=ATG;rbs_motif=AGGAG;rbs_spacer=5-10bp;gc_cont=0.361	WP_015426309.1 MULTISPECIES: voltage-gated chloride channel family protein [Lactococcus]	100	99.8	1.25e-275
CP159281.1_699|751388|751630|-1|ID=1_699;partial=00;start_type=ATG;rbs_motif=AGGA;rbs_spacer=5-10bp;gc_cont=0.374	WP_004255340.1 MULTISPECIES: DUF896 domain-containing protein [Lactococcus]	100	98.8	1.90e-43
CP159281.1_700|751741|753762|-1|ID=1_700;partial=00;start_type=ATG;rbs_motif=AGGAG;rbs_spacer=5-10bp;gc_cont=0.346	WP_003130669.1 MULTISPECIES: glycine--tRNA ligase subunit beta [Lactococcus]	100	99.9	0.0
CP159281.1_701|753762|754715|-1|ID=1_701;partial=00;start_type=ATG;rbs_motif=GGAG/GAGG;rbs_spacer=5-10bp;gc_cont=0.385	WP_003130667.1 MULTISPECIES: glycine--tRNA ligase subunit alpha [Lactococcus]	100	99.7	3.34e-232
CP159281.1_702|755000|755752|-1|ID=1_702;partial=00;start_type=ATG;rbs_motif=GGA/GAG/AGG;rbs_spacer=5-10bp;gc_cont=0.283	WP_010905753.1 MULTISPECIES: bifunctional metallophosphatase/5'-nucleotidase [Lactococcus]	100	99.6	8.79e-174
CP159281.1_703|755862|756881|-1|ID=1_703;partial=00;start_type=ATG;rbs_motif=AGGAG;rbs_spacer=3-4bp;gc_cont=0.365	WP_023164065.1 DUF475 domain-containing protein [Lactococcus lactis]	100	99.7	2.81e-226
CP159281.1_704|756929|757426|-1|ID=1_704;partial=00;start_type=ATG;rbs_motif=AGGAG;rbs_spacer=3-4bp;gc_cont=0.313	WP_003130662.1 MULTISPECIES: VanZ family protein [Lactococcus]	100	99.4	3.23e-100
CP159281.1_705|757560|758189|-1|ID=1_705;partial=00;start_type=ATG;rbs_motif=None;rbs_spacer=None;gc_cont=0.351	WP_003130660.1 MULTISPECIES: YigZ family protein [Lactococcus]	100	99.5	5.56e-143
CP159281.1_706|758246|760213|1|ID=1_706;partial=00;start_type=ATG;rbs_motif=None;rbs_spacer=None;gc_cont=0.332	WP_058221332.1 MULTISPECIES: DEAD/DEAH box helicase [Lactococcus]	97.2	65.4	1.39e-295
CP159281.1_707|760247|760825|-1|ID=1_707;partial=00;start_type=ATG;rbs_motif=GGAG/GAGG;rbs_spacer=5-10bp;gc_cont=0.301	WP_003130655.1 MULTISPECIES: nucleotidyltransferase family protein [Lactococcus]	100	99.5	3.29e-138
CP159281.1_708|760839|761294|-1|ID=1_708;partial=00;start_type=ATG;rbs_motif=AGGAG(G)/GGAGG;rbs_spacer=13-15bp;gc_cont=0.349	WP_003130653.1 MULTISPECIES: diacylglycerol kinase family protein [Lactococcus]	100	99.3	5.38e-99
CP159281.1_709|761278|761766|-1|ID=1_709;partial=00;start_type=ATG;rbs_motif=AGGA;rbs_spacer=5-10bp;gc_cont=0.362	WP_003130652.1 MULTISPECIES: rRNA maturation RNase YbeY [Lactococcus]	100	99.4	7.77e-111
CP159281.1_710|761918|762397|-1|ID=1_710;partial=00;start_type=ATG;rbs_motif=AGGA;rbs_spacer=5-10bp;gc_cont=0.373	WP_353727517.1 NUDIX hydrolase [Lactococcus lactis]	100	99.4	3.88e-114
CP159281.1_711|762455|763423|-1|ID=1_711;partial=00;start_type=ATG;rbs_motif=None;rbs_spacer=None;gc_cont=0.368	WP_003130649.1 MULTISPECIES: PhoH family protein [Lactococcus]	100	99.7	1.39e-222
CP159281.1_712|763525|765057|-1|ID=1_712;partial=00;start_type=ATG;rbs_motif=AGGAG;rbs_spacer=5-10bp;gc_cont=0.359	WP_003130647.1 Nramp family divalent metal transporter [Lactococcus lactis]	100	99.8	0.0
CP159281.1_713|765333|765617|-1|ID=1_713;partial=00;start_type=ATG;rbs_motif=GGAG/GAGG;rbs_spacer=5-10bp;gc_cont=0.449	WP_003130646.1 MULTISPECIES: 50S ribosomal protein L27 [Lactococcus]	100	98.9	2.96e-60
CP159281.1_714|765619|765954|-1|ID=1_714;partial=00;start_type=ATG;rbs_motif=None;rbs_spacer=None;gc_cont=0.387	WP_003130645.1 MULTISPECIES: ribosomal-processing cysteine protease Prp [Lactococcus]	100	99.1	2.71e-73
CP159281.1_715|765957|766271|-1|ID=1_715;partial=00;start_type=ATG;rbs_motif=AGGAG;rbs_spacer=5-10bp;gc_cont=0.381	WP_003130644.1 MULTISPECIES: 50S ribosomal protein L21 [Bacteria]	100	99.0	3.99e-65
CP159281.1_716|766441|767634|-1|ID=1_716;partial=00;start_type=ATG;rbs_motif=GGAG/GAGG;rbs_spacer=5-10bp;gc_cont=0.327	WP_023164062.1 AbrB/MazE/SpoVT family DNA-binding domain-containing protein [Lactococcus lactis]	100	98.2	2.50e-266
CP159281.1_717|767609|768016|-1|ID=1_717;partial=00;start_type=ATG;rbs_motif=None;rbs_spacer=None;gc_cont=0.326	WP_014570571.1 MULTISPECIES: DUF1934 domain-containing protein [Lactococcus]	100	99.3	1.55e-88
CP159281.1_718|768185|769546|1|ID=1_718;partial=00;start_type=TTG;rbs_motif=GGAG/GAGG;rbs_spacer=5-10bp;gc_cont=0.347	WP_023164061.1 HD domain-containing protein [Lactococcus lactis]	100	99.8	0.0
CP159281.1_719|769593|770408|1|ID=1_719;partial=00;start_type=ATG;rbs_motif=GGA/GAG/AGG;rbs_spacer=5-10bp;gc_cont=0.379	WP_023164060.1 sugar-phosphatase [Lactococcus lactis]	100	99.6	1.03e-187
CP159281.1_720|770530|770895|1|ID=1_720;partial=00;start_type=ATG;rbs_motif=GGAG/GAGG;rbs_spacer=5-10bp;gc_cont=0.333	WP_003130630.1 MULTISPECIES: iron-sulfur cluster biosynthesis family protein [Lactococcus]	100	99.2	1.90e-80
CP159281.1_721|770934|771707|-1|ID=1_721;partial=00;start_type=ATG;rbs_motif=GGAG/GAGG;rbs_spacer=5-10bp;gc_cont=0.366	WP_010905742.1 MULTISPECIES: Nif3-like dinuclear metal center hexameric protein [Lactococcus]	100	99.6	1.07e-182
CP159281.1_722|771704|772396|-1|ID=1_722;partial=00;start_type=ATG;rbs_motif=None;rbs_spacer=None;gc_cont=0.345	WP_023164059.1 tRNA (adenine(22)-N(1))-methyltransferase [Lactococcus lactis]	100	99.6	6.16e-155
CP159281.1_723|772389|773045|-1|ID=1_723;partial=00;start_type=ATG;rbs_motif=GGA/GAG/AGG;rbs_spacer=5-10bp;gc_cont=0.385	WP_003130627.1 MULTISPECIES: endonuclease III [Lactococcus]	100	99.5	2.45e-155
CP159281.1_724|773067|773735|-1|ID=1_724;partial=00;start_type=ATG;rbs_motif=None;rbs_spacer=None;gc_cont=0.357	WP_003130626.1 MULTISPECIES: DnaD domain-containing protein [Lactococcus]	100	99.6	3.33e-155
CP159281.1_725|773967|774083|1|ID=1_725;partial=00;start_type=ATG;rbs_motif=AGGA;rbs_spacer=5-10bp;gc_cont=0.256	WP_408886365.1 hypothetical protein [Lactococcus lactis]	100	94.9	1.30e-15
CP159281.1_726|774141|775412|-1|ID=1_726;partial=00;start_type=ATG;rbs_motif=AGGA;rbs_spacer=5-10bp;gc_cont=0.387	WP_021722527.1 MULTISPECIES: dihydroorotase [Lactococcus]	100	99.8	1.27e-301
CP159281.1_727|775567|776196|-1|ID=1_727;partial=00;start_type=ATG;rbs_motif=AGGAG;rbs_spacer=5-10bp;gc_cont=0.367	WP_003132758.1 MULTISPECIES: orotate phosphoribosyltransferase [Lactococcus]	100	99.5	3.60e-139
CP159281.1_728|776539|776718|-1|ID=1_728;partial=00;start_type=ATG;rbs_motif=GGAG/GAGG;rbs_spacer=5-10bp;gc_cont=0.256	WP_023164056.1 hypothetical protein [Lactococcus lactis]	100	98.3	8.97e-35
CP159281.1_729|776778|776939|-1|ID=1_729;partial=00;start_type=ATG;rbs_motif=GGAG/GAGG;rbs_spacer=5-10bp;gc_cont=0.259	WP_021214547.1 MULTISPECIES: hypothetical protein [Lactococcus]	100	98.1	7.15e-25
CP159281.1_730|777004|777192|-1|ID=1_730;partial=00;start_type=ATG;rbs_motif=AGGAG(G)/GGAGG;rbs_spacer=13-15bp;gc_cont=0.275	WP_017864422.1 MULTISPECIES: hypothetical protein [Lactococcus]	100	98.4	1.20e-29
CP159281.1_731|777226|777405|-1|ID=1_731;partial=00;start_type=ATG;rbs_motif=AGGAG;rbs_spacer=5-10bp;gc_cont=0.289	WP_012897690.1 MULTISPECIES: hypothetical protein [Lactococcus]	100	98.3	1.23e-32
CP159281.1_732|777418|778149|-1|ID=1_732;partial=00;start_type=ATG;rbs_motif=AGGAG;rbs_spacer=5-10bp;gc_cont=0.343	WP_003132752.1 MULTISPECIES: hypothetical protein [Lactococcus]	100	99.6	4.04e-171
CP159281.1_733|778396|779253|-1|ID=1_733;partial=00;start_type=ATG;rbs_motif=GGA/GAG/AGG;rbs_spacer=5-10bp;gc_cont=0.300	WP_010905739.1 MULTISPECIES: XRE/MutR family transcriptional regulator [Lactococcus]	100	99.7	5.56e-199
CP159281.1_734|779428|779556|-1|ID=1_734;partial=00;start_type=ATG;rbs_motif=None;rbs_spacer=None;gc_cont=0.310	WP_153915084.1 hypothetical protein [Lactococcus lactis]	100	97.7	1.28e-18
CP159281.1_735|780129|780494|-1|ID=1_735;partial=00;start_type=ATG;rbs_motif=GGA/GAG/AGG;rbs_spacer=11-12bp;gc_cont=0.423	WP_003132744.1 hypothetical protein [Lactococcus lactis]	100	99.2	2.92e-75
CP159281.1_736|780496|781296|-1|ID=1_736;partial=00;start_type=ATG;rbs_motif=AGGAG;rbs_spacer=5-10bp;gc_cont=0.385	WP_023164054.1 hypothetical protein [Lactococcus lactis]	100	99.6	2.93e-180
CP159281.1_737|781485|783392|-1|ID=1_737;partial=00;start_type=ATG;rbs_motif=GGAG/GAGG;rbs_spacer=5-10bp;gc_cont=0.368	WP_003132741.1 MULTISPECIES: ABC-F family ATP-binding cassette domain-containing protein [Lactococcus]	100	99.8	0.0
CP159281.1_738|783570|783962|-1|ID=1_738;partial=00;start_type=ATG;rbs_motif=GGAG/GAGG;rbs_spacer=5-10bp;gc_cont=0.300	WP_003132739.1 MULTISPECIES: Spx/MgsR family RNA polymerase-binding regulatory protein [Lactococcus]	100	99.2	6.18e-88
CP159281.1_739|784187|784837|1|ID=1_739;partial=00;start_type=ATG;rbs_motif=GGAG/GAGG;rbs_spacer=5-10bp;gc_cont=0.387	WP_021464703.1 MULTISPECIES: redox-sensing transcriptional repressor Rex [Lactococcus]	100	99.5	8.84e-148
CP159281.1_740|784925|785605|-1|ID=1_740;partial=00;start_type=ATG;rbs_motif=None;rbs_spacer=None;gc_cont=0.351	WP_003131898.1 MULTISPECIES: RadC family protein [Lactococcus]	100	99.6	7.84e-156
CP159281.1_741|785736|787553|-1|ID=1_741;partial=00;start_type=ATG;rbs_motif=GGAG/GAGG;rbs_spacer=5-10bp;gc_cont=0.372	WP_010905678.1 MULTISPECIES: glutamine--fructose-6-phosphate transaminase (isomerizing) [Lactococcus]	100	99.8	0.0
CP159281.1_742|787734|788390|-1|ID=1_742;partial=00;start_type=ATG;rbs_motif=None;rbs_spacer=None;gc_cont=0.314	WP_023164053.1 phosphatase PAP2 family protein [Lactococcus lactis]	100	99.5	8.83e-149
CP159281.1_743|788397|789722|-1|ID=1_743;partial=00;start_type=ATG;rbs_motif=None;rbs_spacer=None;gc_cont=0.327	WP_003131891.1 MULTISPECIES: sensor histidine kinase [Lactococcus]	100	99.8	1.00e-298
CP159281.1_744|789726|790241|-1|ID=1_744;partial=00;start_type=ATG;rbs_motif=GGAG/GAGG;rbs_spacer=5-10bp;gc_cont=0.314	WP_353727524.1 DUF2127 domain-containing protein [Lactococcus lactis]	100	99.4	2.85e-106
CP159281.1_745|790261|790947|-1|ID=1_745;partial=00;start_type=ATG;rbs_motif=GGAG/GAGG;rbs_spacer=5-10bp;gc_cont=0.370	WP_023164051.1 MULTISPECIES: response regulator transcription factor [Lactococcus]	100	99.6	3.46e-160
CP159281.1_746|791073|792029|-1|ID=1_746;partial=00;start_type=ATG;rbs_motif=AGGAG;rbs_spacer=5-10bp;gc_cont=0.356	WP_023164050.1 glycosyltransferase family 2 protein [Lactococcus lactis]	100	99.7	2.73e-227
CP159281.1_747|792032|793654|-1|ID=1_747;partial=00;start_type=ATG;rbs_motif=None;rbs_spacer=None;gc_cont=0.342	WP_353727526.1 glycosyltransferase family 39 protein [Lactococcus lactis]	100	99.8	0.0
CP159281.1_748|793795|794238|-1|ID=1_748;partial=00;start_type=ATG;rbs_motif=AGGAG;rbs_spacer=5-10bp;gc_cont=0.340	WP_003130996.1 MULTISPECIES: divergent PAP2 family protein [Lactococcus]	100	99.3	7.12e-93
CP159281.1_749|794385|795290|-1|ID=1_749;partial=00;start_type=TTG;rbs_motif=AGGA;rbs_spacer=5-10bp;gc_cont=0.377	WP_003130995.1 MULTISPECIES: RluA family pseudouridine synthase [Lactococcus]	100	99.7	5.21e-212
CP159281.1_750|795351|795803|-1|ID=1_750;partial=00;start_type=ATG;rbs_motif=None;rbs_spacer=None;gc_cont=0.311	WP_003130994.1 MULTISPECIES: signal peptidase II [Lactococcus]	100	99.3	2.47e-99
CP159281.1_751|795906|796370|-1|ID=1_751;partial=00;start_type=ATG;rbs_motif=AGGA;rbs_spacer=5-10bp;gc_cont=0.348	WP_353727528.1 6,7-dimethyl-8-ribityllumazine synthase [Lactococcus lactis]	100	99.4	2.18e-104
CP159281.1_752|796398|797594|-1|ID=1_752;partial=00;start_type=ATG;rbs_motif=AGGAG;rbs_spacer=5-10bp;gc_cont=0.361	WP_353727530.1 bifunctional 3,4-dihydroxy-2-butanone-4-phosphate synthase/GTP cyclohydrolase II [Lactococcus lactis]	100	99.7	1.05e-285
CP159281.1_753|797603|798253|-1|ID=1_753;partial=00;start_type=ATG;rbs_motif=GGA/GAG/AGG;rbs_spacer=5-10bp;gc_cont=0.350	WP_003130990.1 MULTISPECIES: riboflavin synthase [Lactococcus]	100	99.5	3.60e-147
CP159281.1_754|798253|799341|-1|ID=1_754;partial=00;start_type=ATG;rbs_motif=AGGA;rbs_spacer=5-10bp;gc_cont=0.376	WP_023164046.1 bifunctional diaminohydroxyphosphoribosylaminopyrimidine deaminase/5-amino-6-(5-phosphoribosylamino)uracil reductase RibD [Lactococcus lactis]	100	99.7	3.11e-262
CP159281.1_755|799874|800299|-1|ID=1_755;partial=00;start_type=ATG;rbs_motif=AGGA;rbs_spacer=5-10bp;gc_cont=0.312	WP_010905671.1 hypothetical protein [Lactococcus lactis]	100	99.3	3.89e-94
CP159281.1_756|800315|800992|-1|ID=1_756;partial=00;start_type=ATG;rbs_motif=GGAG/GAGG;rbs_spacer=5-10bp;gc_cont=0.285	WP_003130987.1 MULTISPECIES: hypothetical protein [Lactococcus]	100	99.6	7.56e-158
CP159281.1_757|801649|802092|-1|ID=1_757;partial=00;start_type=GTG;rbs_motif=None;rbs_spacer=None;gc_cont=0.300	WP_023164045.1 hypothetical protein [Lactococcus lactis]	100	99.3	2.13e-103
CP159281.1_758|802055|802312|-1|ID=1_758;partial=00;start_type=ATG;rbs_motif=None;rbs_spacer=None;gc_cont=0.322	WP_289421424.1 hypothetical protein [Lactococcus lactis]	93.7	91.9	1.26e-41
