CP159281.1_1261|1316128|1317471|-1|ID=1_1261;partial=00;start_type=TTG;rbs_motif=AGGAG;rbs_spacer=5-10bp;gc_cont=0.380	WP_003130829.1 MULTISPECIES: RNA polymerase sigma factor RpoD [Lactococcus]	100	99.8	3.16e-305
CP159281.1_1262|1317548|1319461|-1|ID=1_1262;partial=00;start_type=ATG;rbs_motif=GGA/GAG/AGG;rbs_spacer=5-10bp;gc_cont=0.338	WP_023163815.1 DNA primase [Lactococcus lactis]	100	99.8	0.0
CP159281.1_1263|1326321|1327604|-1|ID=1_1263;partial=00;start_type=ATG;rbs_motif=AGGAG;rbs_spacer=5-10bp;gc_cont=0.364	WP_003131738.1 MULTISPECIES: trigger factor [Lactococcus]	100	99.8	4.19e-254
CP159281.1_1264|1327761|1327952|-1|ID=1_1264;partial=00;start_type=ATG;rbs_motif=GGAG/GAGG;rbs_spacer=5-10bp;gc_cont=0.323	WP_003131739.1 MULTISPECIES: DNA-directed RNA polymerase subunit beta [Lactococcus]	100	98.4	3.39e-34
CP159281.1_1265|1327952|1329235|-1|ID=1_1265;partial=00;start_type=ATG;rbs_motif=AGGA;rbs_spacer=5-10bp;gc_cont=0.394	WP_043994559.1 UDP-N-acetylglucosamine 1-carboxyvinyltransferase [Lactococcus lactis]	100	99.5	4.41e-297
CP159281.1_1266|1329326|1330105|-1|ID=1_1266;partial=00;start_type=GTG;rbs_motif=AGGAG;rbs_spacer=5-10bp;gc_cont=0.363	WP_017864167.1 MULTISPECIES: inositol monophosphatase family protein [Lactococcus]	100	99.6	1.36e-186
CP159281.1_1267|1330071|1330352|-1|ID=1_1267;partial=00;start_type=ATG;rbs_motif=AGGAG;rbs_spacer=3-4bp;gc_cont=0.333	WP_003131743.1 MULTISPECIES: UPF0223 family protein [Lactococcus]	100	98.9	1.87e-58
CP159281.1_1268|1330444|1330845|-1|ID=1_1268;partial=00;start_type=ATG;rbs_motif=None;rbs_spacer=None;gc_cont=0.371	WP_010905435.1 MULTISPECIES: transcriptional regulator Spx [Lactococcus]	99.2	95.5	6.29e-86
CP159281.1_1269|1330990|1331514|-1|ID=1_1269;partial=00;start_type=ATG;rbs_motif=GGA/GAG/AGG;rbs_spacer=5-10bp;gc_cont=0.297	WP_010905434.1 MULTISPECIES: DUF1273 domain-containing protein [Lactococcus]	100	99.4	3.49e-122
CP159281.1_1270|1331595|1332236|1|ID=1_1270;partial=00;start_type=ATG;rbs_motif=GGA/GAG/AGG;rbs_spacer=11-12bp;gc_cont=0.369	WP_003131746.1 MULTISPECIES: Holliday junction resolvase RecU [Lactococcus]	100	99.5	2.55e-150
CP159281.1_1271|1332223|1334298|1|ID=1_1271;partial=00;start_type=GTG;rbs_motif=None;rbs_spacer=None;gc_cont=0.382	WP_375136956.1 transglycosylase domain-containing protein [Lactococcus lactis]	99.7	99.9	0.0
CP159281.1_1272|1334299|1334931|1|ID=1_1272;partial=00;start_type=ATG;rbs_motif=None;rbs_spacer=None;gc_cont=0.351	WP_003131748.1 MULTISPECIES: MBL fold metallo-hydrolase [Lactococcus]	100	99.5	1.00e-150
CP159281.1_1273|1334970|1336055|-1|ID=1_1273;partial=00;start_type=ATG;rbs_motif=AGGAG;rbs_spacer=5-10bp;gc_cont=0.382	WP_023163811.1 LysM peptidoglycan-binding domain-containing protein [Lactococcus lactis]	100	99.7	2.18e-195
CP159281.1_1274|1336272|1337204|1|ID=1_1274;partial=00;start_type=ATG;rbs_motif=AGGAG;rbs_spacer=5-10bp;gc_cont=0.418	WP_003131750.1 MULTISPECIES: cysteine synthase A [Lactococcus]	100	99.7	5.41e-214
CP159281.1_1275|1337415|1339064|1|ID=1_1275;partial=00;start_type=ATG;rbs_motif=AGGA/GGAG/GAGG;rbs_spacer=11-12bp;gc_cont=0.355	WP_095345856.1 peptide ABC transporter substrate-binding protein [Lactococcus lactis]	100	99.8	0.0
CP159281.1_1276|1339121|1339999|-1|ID=1_1276;partial=00;start_type=ATG;rbs_motif=None;rbs_spacer=None;gc_cont=0.361	WP_260313332.1 C40 family peptidase [Lactococcus lactis]	100	99.7	1.16e-167
CP159281.1_1277|1340106|1341251|-1|ID=1_1277;partial=00;start_type=ATG;rbs_motif=AGGA;rbs_spacer=5-10bp;gc_cont=0.379	WP_003131754.1 MULTISPECIES: cysteine desulfurase family protein [Lactococcus]	100	99.7	1.10e-267
CP159281.1_1278|1341365|1341742|-1|ID=1_1278;partial=00;start_type=ATG;rbs_motif=AGGAG;rbs_spacer=5-10bp;gc_cont=0.333	WP_003131755.1 MULTISPECIES: hypothetical protein [Lactococcus]	100	99.2	1.04e-79
CP159281.1_1279|1341739|1342224|-1|ID=1_1279;partial=00;start_type=GTG;rbs_motif=None;rbs_spacer=None;gc_cont=0.294	WP_023163808.1 LytTR family DNA-binding domain-containing protein [Lactococcus lactis]	99.3	93.8	2.50e-100
CP159281.1_1280|1342260|1342985|-1|ID=1_1280;partial=00;start_type=ATG;rbs_motif=GGAG/GAGG;rbs_spacer=5-10bp;gc_cont=0.298	WP_023163807.1 MULTISPECIES: ABC transporter permease [Lactococcus]	100	99.6	8.63e-156
CP159281.1_1281|1342982|1343791|-1|ID=1_1281;partial=00;start_type=ATG;rbs_motif=None;rbs_spacer=None;gc_cont=0.289	WP_023163806.1 ABC transporter ATP-binding protein [Lactococcus lactis]	100	99.6	1.29e-180
CP159281.1_1282|1343885|1344445|-1|ID=1_1282;partial=00;start_type=TTG;rbs_motif=GGAG/GAGG;rbs_spacer=5-10bp;gc_cont=0.342	WP_003131759.1 MULTISPECIES: bifunctional transcriptional activator/DNA repair enzyme AdaA [Lactococcus]	100	99.5	3.87e-134
CP159281.1_1283|1344459|1344968|-1|ID=1_1283;partial=00;start_type=ATG;rbs_motif=AGGAG;rbs_spacer=5-10bp;gc_cont=0.333	WP_095345862.1 methylated-DNA--[protein]-cysteine S-methyltransferase [Lactococcus lactis]	100	99.4	1.81e-117
CP159281.1_1284|1345115|1345612|1|ID=1_1284;partial=00;start_type=ATG;rbs_motif=GGA/GAG/AGG;rbs_spacer=5-10bp;gc_cont=0.325	WP_353726808.1 GNAT family N-acetyltransferase [Lactococcus lactis]	100	99.4	2.70e-117
CP159281.1_1285|1345704|1345979|-1|ID=1_1285;partial=00;start_type=ATG;rbs_motif=AGGA;rbs_spacer=5-10bp;gc_cont=0.395	WP_010905402.1 MULTISPECIES: HU family DNA-binding protein [Lactococcus]	100	98.9	6.12e-54
CP159281.1_1286|1346084|1346740|-1|ID=1_1286;partial=00;start_type=ATG;rbs_motif=GGA/GAG/AGG;rbs_spacer=5-10bp;gc_cont=0.324	WP_010905401.1 MULTISPECIES: YpmS family protein [Lactococcus]	100	99.5	6.40e-142
CP159281.1_1287|1346750|1347961|-1|ID=1_1287;partial=00;start_type=ATG;rbs_motif=AGGAGG;rbs_spacer=5-10bp;gc_cont=0.384	WP_003131498.1 MULTISPECIES: glycoside hydrolase family 3 N-terminal domain-containing protein [Lactococcus]	100	99.8	1.12e-278
CP159281.1_1288|1347958|1348818|-1|ID=1_1288;partial=00;start_type=ATG;rbs_motif=None;rbs_spacer=None;gc_cont=0.359	WP_003131499.1 MULTISPECIES: SGNH/GDSL hydrolase family protein [Lactococcus]	100	99.7	4.23e-199
CP159281.1_1289|1348811|1349677|-1|ID=1_1289;partial=00;start_type=ATG;rbs_motif=None;rbs_spacer=None;gc_cont=0.368	WP_014570388.1 MULTISPECIES: DegV family protein [Lactococcus]	100	96.2	2.37e-190
CP159281.1_1290|1349849|1350502|1|ID=1_1290;partial=00;start_type=ATG;rbs_motif=GGAG/GAGG;rbs_spacer=5-10bp;gc_cont=0.379	WP_003131502.1 MULTISPECIES: PAQR family membrane homeostasis protein TrhA [Lactococcus]	100	99.5	1.30e-145
CP159281.1_1291|1350533|1353715|-1|ID=1_1291;partial=00;start_type=ATG;rbs_motif=AGGAG;rbs_spacer=5-10bp;gc_cont=0.355	WP_003131504.1 MULTISPECIES: DNA polymerase III subunit alpha [Lactococcus]	100	99.9	0.0
CP159281.1_1292|1354195|1354848|1|ID=1_1292;partial=00;start_type=ATG;rbs_motif=GGA/GAG/AGG;rbs_spacer=5-10bp;gc_cont=0.313	WP_003131506.1 MULTISPECIES: deoxynucleoside kinase [Lactococcus]	100	99.5	2.01e-149
CP159281.1_1293|1354848|1355402|1|ID=1_1293;partial=00;start_type=ATG;rbs_motif=AGGAG;rbs_spacer=5-10bp;gc_cont=0.382	WP_003131507.1 MULTISPECIES: LOG family protein [Lactococcus]	100	99.5	2.71e-124
CP159281.1_1294|1355386|1355865|1|ID=1_1294;partial=00;start_type=TTG;rbs_motif=AGGAG;rbs_spacer=5-10bp;gc_cont=0.350	WP_010905396.1 MULTISPECIES: nucleoside 2-deoxyribosyltransferase [Lactococcus]	100	99.4	5.95e-109
CP159281.1_1295|1355963|1356163|1|ID=1_1295;partial=00;start_type=ATG;rbs_motif=GGA/GAG/AGG;rbs_spacer=5-10bp;gc_cont=0.398	WP_012897261.1 MULTISPECIES: YjzD family protein [Lactococcus]	100	98.5	2.60e-37
CP159281.1_1296|1356511|1357383|1|ID=1_1296;partial=00;start_type=ATG;rbs_motif=None;rbs_spacer=None;gc_cont=0.378	WP_003131512.1 MULTISPECIES: DUF1003 domain-containing protein [Lactococcus]	100	99.7	2.52e-177
CP159281.1_1297|1357415|1357780|-1|ID=1_1297;partial=00;start_type=TTG;rbs_motif=None;rbs_spacer=None;gc_cont=0.358	WP_081213390.1 MULTISPECIES: lactate/malate family dehydrogenase [Lactococcus]	100	93.4	1.66e-69
CP159281.1_1298|1357744|1357956|-1|ID=1_1298;partial=00;start_type=GTG;rbs_motif=None;rbs_spacer=None;gc_cont=0.385	WP_260307339.1 lactate/malate family dehydrogenase [Lactococcus lactis]	98.6	98.6	1.16e-39
CP159281.1_1299|1358032|1358328|-1|ID=1_1299;partial=00;start_type=ATG;rbs_motif=GGA/GAG/AGG;rbs_spacer=5-10bp;gc_cont=0.377	WP_064973480.1 lactate/malate family dehydrogenase [Lactococcus lactis]	99.0	99.0	4.04e-58
CP159281.1_1300|1358467|1360074|-1|ID=1_1300;partial=00;start_type=ATG;rbs_motif=AGGAG;rbs_spacer=5-10bp;gc_cont=0.402	WP_003131516.1 MULTISPECIES: CTP synthase [Lactococcus]	100	99.8	0.0
CP159281.1_1301|1360309|1361445|-1|ID=1_1301;partial=00;start_type=ATG;rbs_motif=GGAG/GAGG;rbs_spacer=5-10bp;gc_cont=0.366	WP_003131519.1 MULTISPECIES: pyridoxal-phosphate-dependent aminotransferase family protein [Lactococcus]	100	99.7	1.15e-272
CP159281.1_1302|1361446|1361988|-1|ID=1_1302;partial=00;start_type=ATG;rbs_motif=GGA/GAG/AGG;rbs_spacer=5-10bp;gc_cont=0.407	WP_010905395.1 MULTISPECIES: TIGR01440 family protein [Streptococcaceae]	100	99.4	9.14e-121
CP159281.1_1303|1361969|1362460|-1|ID=1_1303;partial=00;start_type=ATG;rbs_motif=AGGAG;rbs_spacer=5-10bp;gc_cont=0.396	WP_251915776.1 ECF transporter S component [Lactococcus lactis]	100	99.4	2.28e-111
CP159281.1_1304|1362509|1363297|-1|ID=1_1304;partial=00;start_type=ATG;rbs_motif=GGAG/GAGG;rbs_spacer=5-10bp;gc_cont=0.365	WP_015425873.1 MULTISPECIES: bifunctional hydroxymethylpyrimidine kinase/phosphomethylpyrimidine kinase [Lactococcus]	100	99.6	1.11e-182
CP159281.1_1305|1363330|1364091|-1|ID=1_1305;partial=00;start_type=ATG;rbs_motif=None;rbs_spacer=None;gc_cont=0.358	WP_003131523.1 MULTISPECIES: tRNA pseudouridine(38-40) synthase TruA [Bacillati]	100	99.6	1.59e-182
CP159281.1_1306|1364392|1365777|-1|ID=1_1306;partial=00;start_type=ATG;rbs_motif=None;rbs_spacer=None;gc_cont=0.372	WP_023163783.1 LCP family protein [Lactococcus lactis]	99.8	99.8	1.81e-302
CP159281.1_1307|1365882|1366400|-1|ID=1_1307;partial=00;start_type=ATG;rbs_motif=AGGAG(G)/GGAGG;rbs_spacer=13-15bp;gc_cont=0.351	WP_003131525.1 MULTISPECIES: GNAT family N-acetyltransferase [Lactococcus]	100	99.4	1.37e-118
CP159281.1_1308|1366397|1366861|-1|ID=1_1308;partial=00;start_type=ATG;rbs_motif=None;rbs_spacer=None;gc_cont=0.361	WP_286365428.1 MULTISPECIES: tRNA (adenosine(37)-N6)-threonylcarbamoyltransferase complex ATPase subunit type 1 TsaE [unclassified Lactococcus]	99.4	99.4	3.22e-106
CP159281.1_1309|1366909|1367109|-1|ID=1_1309;partial=00;start_type=ATG;rbs_motif=None;rbs_spacer=None;gc_cont=0.284	WP_033900492.1 hypothetical protein [Lactococcus lactis]	98.5	98.5	1.89e-39
CP159281.1_1310|1367051|1367746|-1|ID=1_1310;partial=00;start_type=ATG;rbs_motif=None;rbs_spacer=None;gc_cont=0.372	WP_010905333.1 MULTISPECIES: ATPase [Lactococcus]	100	99.6	1.34e-82
CP159281.1_1311|1367858|1368625|1|ID=1_1311;partial=00;start_type=ATG;rbs_motif=None;rbs_spacer=None;gc_cont=0.378	WP_003131528.1 MULTISPECIES: alpha/beta hydrolase [Lactococcus]	100	99.6	1.09e-199
CP159281.1_1312|1368684|1369349|-1|ID=1_1312;partial=00;start_type=ATG;rbs_motif=GGA/GAG/AGG;rbs_spacer=5-10bp;gc_cont=0.372	WP_023163781.1 beta-phosphoglucomutase [Lactococcus lactis]	100	99.5	2.24e-148
CP159281.1_1313|1369495|1371804|-1|ID=1_1313;partial=00;start_type=ATG;rbs_motif=GGAG/GAGG;rbs_spacer=5-10bp;gc_cont=0.370	WP_003131533.1 MULTISPECIES: glycoside hydrolase family 65 protein [Lactococcus]	100	99.9	0.0
CP159281.1_1314|1371872|1373476|-1|ID=1_1314;partial=00;start_type=ATG;rbs_motif=None;rbs_spacer=None;gc_cont=0.393	WP_021214847.1 MULTISPECIES: PTS transporter subunit EIIC [Lactococcus]	100	97.4	0.0
CP159281.1_1315|1373574|1374059|-1|ID=1_1315;partial=00;start_type=ATG;rbs_motif=AGGAG;rbs_spacer=5-10bp;gc_cont=0.352	WP_003131536.1 MULTISPECIES: PTS sugar transporter subunit IIA [Lactococcus]	100	99.4	4.87e-109
CP159281.1_1316|1374170|1374886|1|ID=1_1316;partial=00;start_type=ATG;rbs_motif=None;rbs_spacer=None;gc_cont=0.363	WP_003131538.1 MULTISPECIES: trehalose operon repressor [Lactococcus]	100	99.6	1.03e-166
CP159281.1_1317|1374962|1376320|-1|ID=1_1317;partial=00;start_type=ATG;rbs_motif=GGAG/GAGG;rbs_spacer=5-10bp;gc_cont=0.391	WP_003131539.1 MULTISPECIES: phosphoglucosamine mutase [Lactococcus]	100	99.8	0.0
CP159281.1_1318|1376366|1377325|-1|ID=1_1318;partial=00;start_type=ATG;rbs_motif=AGGAG;rbs_spacer=5-10bp;gc_cont=0.344	WP_012897245.1 MULTISPECIES: CdaR family protein [Lactococcus]	100	99.7	5.16e-212
CP159281.1_1319|1377315|1378193|-1|ID=1_1319;partial=00;start_type=TTG;rbs_motif=AGGAG;rbs_spacer=5-10bp;gc_cont=0.361	WP_023163779.1 diadenylate cyclase CdaA [Lactococcus lactis]	100	99.7	2.62e-196
CP159281.1_1320|1378401|1382072|-1|ID=1_1320;partial=00;start_type=ATG;rbs_motif=GGA/GAG/AGG;rbs_spacer=5-10bp;gc_cont=0.383	WP_353726810.1 pyruvate:ferredoxin (flavodoxin) oxidoreductase [Lactococcus lactis]	100	99.9	0.0
CP159281.1_1321|1382380|1383516|-1|ID=1_1321;partial=00;start_type=ATG;rbs_motif=AGGAG;rbs_spacer=5-10bp;gc_cont=0.383	WP_023163778.1 ABC transporter ATP-binding protein [Lactococcus lactis]	100	99.7	1.50e-268
CP159281.1_1322|1383733|1384758|-1|ID=1_1322;partial=00;start_type=ATG;rbs_motif=GGAG/GAGG;rbs_spacer=5-10bp;gc_cont=0.370	WP_023163777.1 diacylglycerol kinase family lipid kinase [Lactococcus lactis]	100	99.7	1.41e-234
CP159281.1_1323|1384914|1386878|-1|ID=1_1323;partial=00;start_type=ATG;rbs_motif=None;rbs_spacer=None;gc_cont=0.392	WP_003131547.1 MULTISPECIES: NAD-dependent DNA ligase LigA [Lactococcus]	100	99.8	0.0
CP159281.1_1324|1387240|1387521|-1|ID=1_1324;partial=00;start_type=ATG;rbs_motif=GGA/GAG/AGG;rbs_spacer=5-10bp;gc_cont=0.348	WP_003131548.1 MULTISPECIES: hypothetical protein [Lactococcus]	100	98.9	1.72e-63
CP159281.1_1325|1387807|1389243|-1|ID=1_1325;partial=00;start_type=ATG;rbs_motif=AGGAG;rbs_spacer=5-10bp;gc_cont=0.364	WP_023163775.1 6-phospho-beta-glucosidase [Lactococcus lactis]	100	99.8	0.0
CP159281.1_1326|1389325|1390662|-1|ID=1_1326;partial=00;start_type=ATG;rbs_motif=AGGA/GGAG/GAGG;rbs_spacer=11-12bp;gc_cont=0.400	WP_003131550.1 MULTISPECIES: PTS sugar transporter subunit IIC [Lactococcus]	100	99.8	0.0
CP159281.1_1327|1390954|1391682|-1|ID=1_1327;partial=00;start_type=ATG;rbs_motif=AGGAG;rbs_spacer=5-10bp;gc_cont=0.333	WP_021721899.1 MurR/RpiR family transcriptional regulator [Lactococcus lactis]	100	99.6	3.59e-169
CP159281.1_1328|1391776|1392126|-1|ID=1_1328;partial=00;start_type=ATG;rbs_motif=GGA/GAG/AGG;rbs_spacer=5-10bp;gc_cont=0.410	WP_003131552.1 MULTISPECIES: PTS lactose/cellobiose transporter subunit IIA [Lactococcus]	100	99.1	2.76e-73
CP159281.1_1329|1392211|1392537|-1|ID=1_1329;partial=00;start_type=ATG;rbs_motif=AGGAG;rbs_spacer=5-10bp;gc_cont=0.410	WP_003131553.1 MULTISPECIES: PTS sugar transporter subunit IIB [Lactococcus]	100	99.1	4.75e-68
CP159281.1_1330|1392779|1393525|-1|ID=1_1330;partial=00;start_type=ATG;rbs_motif=GGAG/GAGG;rbs_spacer=5-10bp;gc_cont=0.345	WP_353726811.1 MurR/RpiR family transcriptional regulator [Lactococcus lactis]	100	99.6	3.58e-172
CP159281.1_1331|1393681|1394265|-1|ID=1_1331;partial=00;start_type=ATG;rbs_motif=None;rbs_spacer=None;gc_cont=0.357	WP_010905322.1 MULTISPECIES: YdcF family protein [Lactococcus]	100	99.5	2.29e-130
CP159281.1_1332|1394269|1395609|-1|ID=1_1332;partial=00;start_type=ATG;rbs_motif=None;rbs_spacer=None;gc_cont=0.358	WP_353726812.1 DEAD/DEAH box helicase [Lactococcus lactis]	100	99.8	1.54e-314
CP159281.1_1333|1395911|1398265|-1|ID=1_1333;partial=00;start_type=ATG;rbs_motif=AGGA;rbs_spacer=5-10bp;gc_cont=0.390	WP_003131559.1 MULTISPECIES: carbon starvation CstA family protein [Lactococcus]	100	99.9	0.0
CP159281.1_1334|1398514|1399134|-1|ID=1_1334;partial=00;start_type=ATG;rbs_motif=AGGAG;rbs_spacer=5-10bp;gc_cont=0.380	WP_003131560.1 MULTISPECIES: superoxide dismutase [Lactococcus]	100	99.5	8.98e-152
CP159281.1_1335|1399292|1400335|-1|ID=1_1335;partial=00;start_type=ATG;rbs_motif=GGA/GAG/AGG;rbs_spacer=5-10bp;gc_cont=0.354	WP_003131561.1 MULTISPECIES: type 2 isopentenyl-diphosphate Delta-isomerase [Lactococcus]	100	99.7	1.81e-242
CP159281.1_1336|1400388|1401377|-1|ID=1_1336;partial=00;start_type=ATG;rbs_motif=None;rbs_spacer=None;gc_cont=0.333	WP_003131562.1 MULTISPECIES: mevalonate kinase family protein [Lactococcus]	100	99.7	3.05e-225
CP159281.1_1337|1401364|1402320|-1|ID=1_1337;partial=00;start_type=ATG;rbs_motif=None;rbs_spacer=None;gc_cont=0.385	WP_010905319.1 MULTISPECIES: diphosphomevalonate decarboxylase [Lactococcus]	100	99.7	4.46e-217
CP159281.1_1338|1402626|1403558|1|ID=1_1338;partial=00;start_type=ATG;rbs_motif=AGGA/GGAG/GAGG;rbs_spacer=11-12bp;gc_cont=0.361	WP_003131564.1 MULTISPECIES: mevalonate kinase [Lactococcus]	100	99.7	1.02e-218
CP159281.1_1339|1403653|1404852|-1|ID=1_1339;partial=00;start_type=ATG;rbs_motif=AGxAG;rbs_spacer=5-10bp;gc_cont=0.384	WP_095345217.1 tyrosine-type recombinase/integrase [Lactococcus lactis]	100	99.8	8.00e-286
CP159281.1_1340|1404919|1405449|-1|ID=1_1340;partial=00;start_type=ATG;rbs_motif=AGGAG;rbs_spacer=5-10bp;gc_cont=0.282	WP_023163772.1 helix-turn-helix domain-containing protein [Lactococcus lactis]	99.4	99.4	2.24e-110
CP159281.1_1341|1405596|1405790|1|ID=1_1341;partial=00;start_type=ATG;rbs_motif=AGGAG;rbs_spacer=5-10bp;gc_cont=0.410	WP_023163771.1 transcriptional regulator [Lactococcus lactis]	100	98.5	4.57e-37
CP159281.1_1342|1405753|1406091|1|ID=1_1342;partial=00;start_type=ATG;rbs_motif=None;rbs_spacer=None;gc_cont=0.381	WP_241781118.1 hypothetical protein [Lactococcus lactis]	100	99.1	7.07e-69
CP159281.1_1343|1406218|1406412|1|ID=1_1343;partial=00;start_type=ATG;rbs_motif=GGAG/GAGG;rbs_spacer=5-10bp;gc_cont=0.338	WP_023163769.1 MULTISPECIES: DUF1655 domain-containing protein [Lactococcus]	100	98.5	7.88e-38
CP159281.1_1344|1406417|1406935|1|ID=1_1344;partial=00;start_type=ATG;rbs_motif=GGA/GAG/AGG;rbs_spacer=5-10bp;gc_cont=0.356	WP_023163768.1 hypothetical protein [Lactococcus lactis]	100	99.4	7.93e-118
CP159281.1_1345|1406932|1407201|1|ID=1_1345;partial=00;start_type=ATG;rbs_motif=GGAG/GAGG;rbs_spacer=5-10bp;gc_cont=0.370	WP_023163767.1 MULTISPECIES: hypothetical protein [Lactococcus]	100	98.9	2.00e-49
CP159281.1_1346|1407240|1407482|1|ID=1_1346;partial=00;start_type=ATG;rbs_motif=AGGAG;rbs_spacer=5-10bp;gc_cont=0.333	WP_353726813.1 hypothetical protein [Lactococcus lactis]	100	98.8	1.88e-52
CP159281.1_1347|1407492|1407737|1|ID=1_1347;partial=00;start_type=ATG;rbs_motif=GGAG/GAGG;rbs_spacer=5-10bp;gc_cont=0.390	WP_023163765.1 hypothetical protein [Lactococcus lactis]	100	98.8	1.21e-53
CP159281.1_1348|1407734|1407997|1|ID=1_1348;partial=00;start_type=ATG;rbs_motif=GGAG/GAGG;rbs_spacer=5-10bp;gc_cont=0.398	WP_054247181.1 hypothetical protein [Lactococcus lactis]	100	98.9	9.96e-58
CP159281.1_1349|1407984|1408310|1|ID=1_1349;partial=00;start_type=ATG;rbs_motif=AGGA;rbs_spacer=5-10bp;gc_cont=0.373	WP_023163763.1 MULTISPECIES: HTH domain-containing protein [Lactococcus]	100	99.1	9.98e-70
CP159281.1_1350|1408321|1409034|1|ID=1_1350;partial=00;start_type=ATG;rbs_motif=GGA/GAG/AGG;rbs_spacer=5-10bp;gc_cont=0.294	WP_353726814.1 phage replisome organizer protein [Lactococcus lactis]	100	99.6	6.36e-156
CP159281.1_1351|1409027|1409767|1|ID=1_1351;partial=00;start_type=ATG;rbs_motif=AGGAG;rbs_spacer=5-10bp;gc_cont=0.337	WP_023163761.1 MULTISPECIES: hypothetical protein [Lactococcus]	100	99.6	1.20e-169
CP159281.1_1352|1410062|1410376|1|ID=1_1352;partial=00;start_type=ATG;rbs_motif=AGGA;rbs_spacer=5-10bp;gc_cont=0.362	WP_023163759.1 MULTISPECIES: hypothetical protein [Lactococcus]	100	99.0	1.34e-63
CP159281.1_1353|1410390|1410962|1|ID=1_1353;partial=00;start_type=ATG;rbs_motif=AGGAG;rbs_spacer=5-10bp;gc_cont=0.358	WP_023163758.1 MULTISPECIES: hypothetical protein [Lactococcus]	100	99.5	3.01e-124
CP159281.1_1354|1411522|1411854|1|ID=1_1354;partial=00;start_type=ATG;rbs_motif=AGGA;rbs_spacer=5-10bp;gc_cont=0.357	WP_023163756.1 MULTISPECIES: hypothetical protein [Lactococcus]	100	99.1	9.88e-71
CP159281.1_1355|1412898|1413089|1|ID=1_1355;partial=00;start_type=ATG;rbs_motif=AGGA;rbs_spacer=5-10bp;gc_cont=0.318	WP_003131566.1 MULTISPECIES: hypothetical protein [Bacteria]	100	98.4	1.04e-37
CP159281.1_1356|1413166|1414041|-1|ID=1_1356;partial=00;start_type=ATG;rbs_motif=None;rbs_spacer=None;gc_cont=0.358	WP_010905318.1 MULTISPECIES: 16S rRNA (cytidine(1402)-2'-O)-methyltransferase [Lactococcus]	100	99.7	1.60e-201
CP159281.1_1357|1414041|1414367|-1|ID=1_1357;partial=00;start_type=ATG;rbs_motif=GGAG/GAGG;rbs_spacer=5-10bp;gc_cont=0.361	WP_003131570.1 MULTISPECIES: DNA replication initiation control protein YabA [Lactococcus]	100	99.1	4.22e-71
CP159281.1_1358|1414360|1415142|-1|ID=1_1358;partial=00;start_type=ATG;rbs_motif=AGGAG;rbs_spacer=5-10bp;gc_cont=0.347	WP_010905316.1 MULTISPECIES: PSP1 domain-containing protein [Lactococcus]	100	99.6	1.35e-182
CP159281.1_1359|1415194|1416054|-1|ID=1_1359;partial=00;start_type=GTG;rbs_motif=GGA/GAG/AGG;rbs_spacer=5-10bp;gc_cont=0.328	WP_003131573.1 MULTISPECIES: DNA polymerase III subunit delta' [Lactococcus]	100	99.7	6.01e-199
CP159281.1_1360|1416187|1416822|-1|ID=1_1360;partial=00;start_type=ATG;rbs_motif=None;rbs_spacer=None;gc_cont=0.396	WP_012897230.1 MULTISPECIES: dTMP kinase [Lactococcus]	100	99.5	5.33e-142
CP159281.1_1361|1417000|1417701|1|ID=1_1361;partial=00;start_type=ATG;rbs_motif=AGGA;rbs_spacer=5-10bp;gc_cont=0.386	WP_003131580.1 MULTISPECIES: response regulator YycF [Lactococcus]	100	99.6	2.74e-164
CP159281.1_1362|1417694|1419136|1|ID=1_1362;partial=00;start_type=ATG;rbs_motif=GGA/GAG/AGG;rbs_spacer=5-10bp;gc_cont=0.346	WP_010905315.1 MULTISPECIES: sensor histidine kinase [Lactococcus]	100	99.8	0.0
CP159281.1_1363|1419307|1420119|1|ID=1_1363;partial=00;start_type=ATG;rbs_motif=None;rbs_spacer=None;gc_cont=0.357	WP_003131583.1 MULTISPECIES: MBL fold metallo-hydrolase [Lactococcus]	100	99.6	2.27e-195
CP159281.1_1364|1420165|1421793|-1|ID=1_1364;partial=00;start_type=ATG;rbs_motif=AGGAG;rbs_spacer=5-10bp;gc_cont=0.390	WP_003131585.1 MULTISPECIES: chaperonin GroEL [Lactococcus]	100	99.8	0.0
CP159281.1_1365|1421881|1422165|-1|ID=1_1365;partial=00;start_type=ATG;rbs_motif=GGAG/GAGG;rbs_spacer=5-10bp;gc_cont=0.379	WP_003131589.1 MULTISPECIES: co-chaperone GroES [Lactococcus]	100	98.9	1.36e-56
CP159281.1_1366|1422285|1422674|-1|ID=1_1366;partial=00;start_type=ATG;rbs_motif=AGGAG;rbs_spacer=5-10bp;gc_cont=0.338	WP_023163755.1 single-stranded DNA-binding protein [Lactococcus lactis]	100	99.2	1.46e-81
CP159281.1_1367|1422764|1424104|-1|ID=1_1367;partial=00;start_type=ATG;rbs_motif=AGGAG;rbs_spacer=5-10bp;gc_cont=0.357	WP_023163754.1 H2O-forming NADH oxidase [Lactococcus lactis]	100	99.8	0.0
CP159281.1_1368|1424267|1424893|-1|ID=1_1368;partial=00;start_type=ATG;rbs_motif=GGA/GAG/AGG;rbs_spacer=11-12bp;gc_cont=0.389	WP_031559372.1 YtpR family tRNA-binding protein [Lactococcus lactis]	100	99.5	7.62e-145
CP159281.1_1369|1424979|1425296|-1|ID=1_1369;partial=00;start_type=ATG;rbs_motif=AGGAG;rbs_spacer=5-10bp;gc_cont=0.349	WP_353726815.1 thioredoxin family protein [Lactococcus lactis]	100	99.1	9.72e-71
CP159281.1_1370|1425338|1425622|-1|ID=1_1370;partial=00;start_type=ATG;rbs_motif=None;rbs_spacer=None;gc_cont=0.347	WP_003131596.1 MULTISPECIES: hypothetical protein [Lactococcus]	100	98.9	1.47e-60
CP159281.1_1371|1425725|1426792|1|ID=1_1371;partial=00;start_type=ATG;rbs_motif=AGGAG;rbs_spacer=3-4bp;gc_cont=0.391	WP_014570380.1 MULTISPECIES: glutamyl aminopeptidase [Lactococcus]	100	99.7	9.18e-256
CP159281.1_1372|1426850|1429255|-1|ID=1_1372;partial=00;start_type=ATG;rbs_motif=None;rbs_spacer=None;gc_cont=0.369	WP_003131598.1 transglycosylase domain-containing protein [Lactococcus lactis]	100	99.9	0.0
CP159281.1_1373|1429400|1430659|1|ID=1_1373;partial=00;start_type=ATG;rbs_motif=AGGA;rbs_spacer=5-10bp;gc_cont=0.364	WP_003131599.1 MULTISPECIES: tyrosine--tRNA ligase [Lactococcus]	100	99.8	1.32e-301
CP159281.1_1374|1430764|1431252|1|ID=1_1374;partial=00;start_type=ATG;rbs_motif=None;rbs_spacer=None;gc_cont=0.303	WP_010905310.1 MULTISPECIES: hypothetical protein [Lactococcus]	100	95.7	9.19e-95
CP159281.1_1375|1431343|1433385|1|ID=1_1375;partial=00;start_type=ATG;rbs_motif=GGA/GAG/AGG;rbs_spacer=5-10bp;gc_cont=0.353	WP_023163750.1 cation:proton antiporter [Lactococcus lactis]	100	99.9	0.0
CP159281.1_1376|1433421|1433855|-1|ID=1_1376;partial=00;start_type=ATG;rbs_motif=AGGA;rbs_spacer=5-10bp;gc_cont=0.361	WP_353726816.1 OsmC family protein [Lactococcus lactis]	100	99.3	8.75e-97
CP159281.1_1377|1433951|1434556|-1|ID=1_1377;partial=00;start_type=ATG;rbs_motif=AGGA;rbs_spacer=5-10bp;gc_cont=0.365	WP_015425833.1 MULTISPECIES: FMN-dependent NADH-azoreductase [Lactococcus]	100	99.5	1.88e-137
CP159281.1_1378|1434717|1436120|-1|ID=1_1378;partial=00;start_type=ATG;rbs_motif=AGGA;rbs_spacer=5-10bp;gc_cont=0.372	WP_003131604.1 MULTISPECIES: MFS transporter [Lactococcus]	100	99.8	0.0
CP159281.1_1379|1436334|1437554|-1|ID=1_1379;partial=00;start_type=ATG;rbs_motif=AGGAG;rbs_spacer=5-10bp;gc_cont=0.370	WP_023163749.1 tRNA uracil 4-sulfurtransferase ThiI [Lactococcus lactis]	100	99.8	4.32e-289
CP159281.1_1380|1437843|1438817|-1|ID=1_1380;partial=00;start_type=ATG;rbs_motif=GGA/GAG/AGG;rbs_spacer=5-10bp;gc_cont=0.322	WP_003131606.1 MULTISPECIES: TDT family transporter [Lactococcus]	100	99.7	1.86e-212
CP159281.1_1381|1438972|1439793|1|ID=1_1381;partial=00;start_type=ATG;rbs_motif=GGAG/GAGG;rbs_spacer=5-10bp;gc_cont=0.316	WP_023163748.1 LysR family transcriptional regulator [Lactococcus lactis]	100	99.6	4.37e-190
CP159281.1_1382|1440088|1441032|1|ID=1_1382;partial=00;start_type=ATG;rbs_motif=AGGAG;rbs_spacer=5-10bp;gc_cont=0.351	WP_003131609.1 MULTISPECIES: L-lactate dehydrogenase [Lactococcus]	100	99.7	1.14e-217
CP159281.1_1383|1441245|1442285|-1|ID=1_1383;partial=00;start_type=ATG;rbs_motif=AGGA/GGAG/GAGG;rbs_spacer=11-12bp;gc_cont=0.333	WP_259754846.1 YeiH family protein [Lactococcus lactis]	99.4	99.7	1.02e-227
CP159281.1_1384|1442404|1443222|1|ID=1_1384;partial=00;start_type=ATG;rbs_motif=AGGA;rbs_spacer=5-10bp;gc_cont=0.326	WP_003131611.1 MULTISPECIES: LysR family transcriptional regulator [Lactococcus]	100	99.6	2.34e-189
