CP159281.1_1|1|1389|1|ID=1_1;partial=10;start_type=Edge;rbs_motif=None;rbs_spacer=None;gc_cont=0.398	WP_058225955.1 phage terminase large subunit [Lactococcus lactis]	100	99.8	0.0
CP159281.1_2|1390|2769|1|ID=1_2;partial=00;start_type=TTG;rbs_motif=AGGAG;rbs_spacer=5-10bp;gc_cont=0.352	WP_353727292.1 phage portal protein [Lactococcus lactis]	100	99.8	0.0
CP159281.1_3|2756|2944|1|ID=1_3;partial=00;start_type=ATG;rbs_motif=AGGAG;rbs_spacer=5-10bp;gc_cont=0.296	WP_285141260.1 hypothetical protein [Lactococcus petauri]	96.8	98.4	2.23e-34
CP159281.1_4|2948|3997|1|ID=1_4;partial=00;start_type=ATG;rbs_motif=AGGAG;rbs_spacer=5-10bp;gc_cont=0.371	WP_353727293.1 minor capsid protein [Lactococcus lactis]	100	99.7	3.99e-247
CP159281.1_5|3994|4224|1|ID=1_5;partial=00;start_type=ATG;rbs_motif=AGGA;rbs_spacer=5-10bp;gc_cont=0.260	WP_260356146.1 MULTISPECIES: hypothetical protein [Lactococcus]	100	98.7	1.48e-45
CP159281.1_6|4273|4473|1|ID=1_6;partial=00;start_type=ATG;rbs_motif=GGA/GAG/AGG;rbs_spacer=5-10bp;gc_cont=0.378	WP_353727295.1 hypothetical protein [Lactococcus lactis]	100	88.1	2.01e-33
CP159281.1_7|4596|5192|1|ID=1_7;partial=00;start_type=ATG;rbs_motif=AGGAG;rbs_spacer=5-10bp;gc_cont=0.379	WP_353727297.1 capsid assembly scaffolding protein Gp46 family protein [Lactococcus lactis]	100	99.5	4.83e-102
CP159281.1_8|5210|6073|1|ID=1_8;partial=00;start_type=ATG;rbs_motif=AGGAG;rbs_spacer=5-10bp;gc_cont=0.365	WP_347120696.1 capsid protein [Lactococcus lactis]	100	99.7	6.49e-199
CP159281.1_9|6139|6330|1|ID=1_9;partial=00;start_type=TTG;rbs_motif=None;rbs_spacer=None;gc_cont=0.370	WP_353727694.1 Ig-like domain-containing protein [Lactococcus lactis]	98.4	98.4	3.63e-33
CP159281.1_10|6344|6676|1|ID=1_10;partial=00;start_type=ATG;rbs_motif=AGGAG;rbs_spacer=5-10bp;gc_cont=0.396	WP_003131944.1 MULTISPECIES: phage head-tail connector protein [Lactobacillales]	100	99.1	6.69e-69
CP159281.1_11|6673|6984|1|ID=1_11;partial=00;start_type=TTG;rbs_motif=AGGA/GGAG/GAGG;rbs_spacer=11-12bp;gc_cont=0.378	WP_353727298.1 hypothetical protein [Lactococcus lactis]	100	99.0	1.45e-71
CP159281.1_12|6981|7307|1|ID=1_12;partial=00;start_type=ATG;rbs_motif=AGGAG;rbs_spacer=5-10bp;gc_cont=0.388	WP_031558853.1 HK97-gp10 family putative phage morphogenesis protein [Lactococcus lactis]	100	99.1	1.42e-69
CP159281.1_13|7304|7699|1|ID=1_13;partial=00;start_type=ATG;rbs_motif=GGA/GAG/AGG;rbs_spacer=5-10bp;gc_cont=0.341	WP_129300509.1 phage capsid protein [Lactococcus lactis]	98.5	99.2	2.23e-86
CP159281.1_14|7710|8207|1|ID=1_14;partial=00;start_type=ATG;rbs_motif=AGGAG;rbs_spacer=5-10bp;gc_cont=0.386	WP_015966828.1 MULTISPECIES: phage major tail protein, TP901-1 family [Lactococcus]	100	99.4	3.40e-111
CP159281.1_15|8323|8673|1|ID=1_15;partial=00;start_type=ATG;rbs_motif=AGGAG;rbs_spacer=5-10bp;gc_cont=0.345	WP_353727299.1 tail assembly chaperone [Lactococcus lactis]	100	99.1	1.66e-74
CP159281.1_16|8715|9026|1|ID=1_16;partial=00;start_type=TTG;rbs_motif=None;rbs_spacer=None;gc_cont=0.333	YP_010663550.1 tail assembly chaperone [Streptococcus phage SW16]	97.1	99.0	2.94e-62
CP159281.1_17|9042|11666|1|ID=1_17;partial=00;start_type=ATG;rbs_motif=AGGAG;rbs_spacer=5-10bp;gc_cont=0.379	WP_127094034.1 tape measure protein [Lactococcus lactis]	100	99.9	0.0
CP159281.1_18|11680|12441|1|ID=1_18;partial=00;start_type=ATG;rbs_motif=GGAG/GAGG;rbs_spacer=5-10bp;gc_cont=0.366	WP_353727300.1 distal tail protein Dit [Lactococcus lactis]	100	99.6	4.38e-180
CP159281.1_19|12441|15284|1|ID=1_19;partial=00;start_type=GTG;rbs_motif=GGA/GAG/AGG;rbs_spacer=5-10bp;gc_cont=0.396	WP_353727302.1 phage tail spike protein [Lactococcus lactis]	100	99.9	0.0
CP159281.1_20|15297|16265|1|ID=1_20;partial=00;start_type=ATG;rbs_motif=GGA/GAG/AGG;rbs_spacer=5-10bp;gc_cont=0.368	WP_353727303.1 BppU family phage baseplate upper protein [Lactococcus lactis]	100	99.7	2.66e-236
CP159281.1_21|16216|17013|1|ID=1_21;partial=00;start_type=ATG;rbs_motif=None;rbs_spacer=None;gc_cont=0.390	WP_353727304.1 fibronectin type III domain-containing protein [Lactococcus lactis]	99.6	97.4	1.95e-183
CP159281.1_22|17032|17517|1|ID=1_22;partial=00;start_type=ATG;rbs_motif=AGGAG;rbs_spacer=5-10bp;gc_cont=0.418	WP_353727305.1 hypothetical protein [Lactococcus lactis]	100	99.4	1.34e-106
CP159281.1_23|17562|17912|1|ID=1_23;partial=00;start_type=TTG;rbs_motif=AGGA;rbs_spacer=5-10bp;gc_cont=0.328	WP_374788214.1 holin [Lactococcus lactis]	99.1	99.1	1.48e-77
CP159281.1_24|17909|19198|1|ID=1_24;partial=00;start_type=ATG;rbs_motif=GGAG/GAGG;rbs_spacer=5-10bp;gc_cont=0.395	WP_353727307.1 LysM peptidoglycan-binding domain-containing protein [Lactococcus lactis]	100	99.8	2.63e-313
CP159281.1_25|19312|19941|1|ID=1_25;partial=00;start_type=TTG;rbs_motif=GGAG/GAGG;rbs_spacer=5-10bp;gc_cont=0.275	WP_129300181.1 hypothetical protein [Lactococcus lactis]	100	92.4	2.24e-125
CP159281.1_26|19956|20108|1|ID=1_26;partial=00;start_type=ATG;rbs_motif=AGGAG;rbs_spacer=5-10bp;gc_cont=0.320	WP_164976570.1 hypothetical protein [Lactococcus lactis]	100	98.0	2.04e-25
CP159281.1_27|20098|20244|1|ID=1_27;partial=00;start_type=ATG;rbs_motif=AGGA;rbs_spacer=5-10bp;gc_cont=0.320	WP_164976571.1 hypothetical protein [Lactococcus lactis]	100	98.0	3.08e-26
CP159281.1_28|20562|21407|-1|ID=1_28;partial=00;start_type=ATG;rbs_motif=GGA/GAG/AGG;rbs_spacer=5-10bp;gc_cont=0.358	WP_010906138.1 MULTISPECIES: NAD(P)H-dependent flavin oxidoreductase [Lactococcus]	100	99.6	6.49e-196
CP159281.1_29|21430|22176|-1|ID=1_29;partial=00;start_type=ATG;rbs_motif=AGGAG;rbs_spacer=5-10bp;gc_cont=0.357	WP_010906137.1 MULTISPECIES: SDR family NAD(P)-dependent oxidoreductase [Lactococcus]	100	99.6	4.18e-171
CP159281.1_30|22173|22466|-1|ID=1_30;partial=00;start_type=ATG;rbs_motif=GGAG/GAGG;rbs_spacer=5-10bp;gc_cont=0.276	WP_004255215.1 MULTISPECIES: hypothetical protein [Lactococcus]	100	99.0	3.40e-65
CP159281.1_31|22441|22803|-1|ID=1_31;partial=00;start_type=ATG;rbs_motif=GGA/GAG/AGG;rbs_spacer=5-10bp;gc_cont=0.287	WP_010906136.1 MULTISPECIES: hypothetical protein [Lactococcus]	100	99.2	8.42e-79
CP159281.1_32|22788|23936|-1|ID=1_32;partial=00;start_type=ATG;rbs_motif=GGAG/GAGG;rbs_spacer=5-10bp;gc_cont=0.364	WP_010906135.1 MULTISPECIES: acetyl-CoA C-acyltransferase [Lactococcus]	100	99.7	3.31e-274
CP159281.1_33|23926|25167|-1|ID=1_33;partial=00;start_type=ATG;rbs_motif=AGGA;rbs_spacer=5-10bp;gc_cont=0.320	WP_353727310.1 AMP-binding protein [Lactococcus lactis]	100	99.8	5.81e-302
CP159281.1_34|25312|25881|1|ID=1_34;partial=00;start_type=ATG;rbs_motif=AGGAG;rbs_spacer=5-10bp;gc_cont=0.354	WP_004255224.1 MULTISPECIES: biotin transporter BioY [Lactococcus]	100	99.5	8.35e-126
CP159281.1_35|25887|26858|1|ID=1_35;partial=00;start_type=ATG;rbs_motif=None;rbs_spacer=None;gc_cont=0.341	WP_023164474.1 biotin--[acetyl-CoA-carboxylase] ligase [Lactococcus lactis]	100	99.7	1.03e-229
CP159281.1_36|27216|27872|1|ID=1_36;partial=00;start_type=ATG;rbs_motif=AGGA;rbs_spacer=5-10bp;gc_cont=0.356	WP_004255229.1 MULTISPECIES: thiaminase II [Lactococcus]	100	99.5	2.75e-152
CP159281.1_37|28253|29431|1|ID=1_37;partial=00;start_type=GTG;rbs_motif=AGGAG;rbs_spacer=5-10bp;gc_cont=0.353	WP_012898345.1 MULTISPECIES: SLC13 family permease [Lactococcus]	100	99.7	9.23e-261
CP159281.1_38|29604|30167|1|ID=1_38;partial=00;start_type=ATG;rbs_motif=AGGAG;rbs_spacer=5-10bp;gc_cont=0.351	WP_004255233.1 MULTISPECIES: GNAT family N-acetyltransferase [Lactococcus]	100	99.5	5.47e-130
CP159281.1_39|30271|30669|1|ID=1_39;partial=00;start_type=ATG;rbs_motif=AGGA;rbs_spacer=5-10bp;gc_cont=0.363	WP_004255236.1 MULTISPECIES: hypothetical protein [Lactococcus]	100	99.2	1.02e-87
CP159281.1_40|30774|31706|1|ID=1_40;partial=00;start_type=ATG;rbs_motif=AGGA;rbs_spacer=5-10bp;gc_cont=0.383	WP_004255238.1 MULTISPECIES: ABC transporter ATP-binding protein [Lactococcus]	100	99.7	3.41e-217
CP159281.1_41|31703|33064|1|ID=1_41;partial=00;start_type=ATG;rbs_motif=GGAG/GAGG;rbs_spacer=5-10bp;gc_cont=0.375	WP_023164473.1 ABC transporter permease [Lactococcus lactis]	100	99.8	6.27e-299
CP159281.1_42|33124|33771|1|ID=1_42;partial=00;start_type=ATG;rbs_motif=None;rbs_spacer=None;gc_cont=0.332	WP_010906131.1 MULTISPECIES: ComEA family DNA-binding protein [Lactococcus]	100	99.5	1.99e-139
CP159281.1_43|33752|35962|1|ID=1_43;partial=00;start_type=ATG;rbs_motif=None;rbs_spacer=None;gc_cont=0.301	WP_353727314.1 DNA internalization-related competence protein ComEC/Rec2 [Lactococcus lactis]	100	99.9	0.0
CP159281.1_44|36247|37023|1|ID=1_44;partial=00;start_type=ATG;rbs_motif=AGGAG;rbs_spacer=5-10bp;gc_cont=0.351	WP_004255244.1 MULTISPECIES: alpha/beta hydrolase [Lactococcus]	100	99.6	6.04e-194
CP159281.1_45|37208|37423|1|ID=1_45;partial=00;start_type=ATG;rbs_motif=GGAG/GAGG;rbs_spacer=5-10bp;gc_cont=0.477	WP_004255250.1 MULTISPECIES: F0F1 ATP synthase subunit C [Lactococcus]	100	98.6	5.23e-37
CP159281.1_46|37468|38181|1|ID=1_46;partial=00;start_type=ATG;rbs_motif=AGGA;rbs_spacer=5-10bp;gc_cont=0.408	WP_004255255.1 MULTISPECIES: F0F1 ATP synthase subunit A [Lactococcus]	100	99.6	2.41e-160
CP159281.1_47|38196|38702|1|ID=1_47;partial=00;start_type=TTG;rbs_motif=AGGAG;rbs_spacer=5-10bp;gc_cont=0.393	WP_023164471.1 F0F1 ATP synthase subunit B [Lactococcus lactis]	100	99.4	3.56e-94
CP159281.1_48|38704|39231|1|ID=1_48;partial=00;start_type=ATG;rbs_motif=AGGAG;rbs_spacer=5-10bp;gc_cont=0.333	WP_004255262.1 MULTISPECIES: F0F1 ATP synthase subunit delta [Lactococcus]	100	99.4	4.02e-108
CP159281.1_49|39418|40920|1|ID=1_49;partial=00;start_type=TTG;rbs_motif=GGAG/GAGG;rbs_spacer=5-10bp;gc_cont=0.415	WP_004255265.1 MULTISPECIES: F0F1 ATP synthase subunit alpha [Lactococcus]	100	99.8	0.0
CP159281.1_50|40936|41805|1|ID=1_50;partial=00;start_type=ATG;rbs_motif=AGGAG;rbs_spacer=5-10bp;gc_cont=0.374	WP_004255268.1 MULTISPECIES: F0F1 ATP synthase subunit gamma [Lactococcus]	100	99.7	1.91e-192
CP159281.1_51|41938|43347|1|ID=1_51;partial=00;start_type=TTG;rbs_motif=AGGAG;rbs_spacer=5-10bp;gc_cont=0.428	WP_010906126.1 MULTISPECIES: F0F1 ATP synthase subunit beta [Lactococcus]	100	99.8	0.0
CP159281.1_52|43532|43957|1|ID=1_52;partial=00;start_type=ATG;rbs_motif=GGAG/GAGG;rbs_spacer=5-10bp;gc_cont=0.380	WP_004255278.1 MULTISPECIES: F0F1 ATP synthase subunit epsilon [Lactococcus]	100	99.3	5.96e-89
CP159281.1_53|44073|44714|1|ID=1_53;partial=00;start_type=GTG;rbs_motif=GGAG/GAGG;rbs_spacer=5-10bp;gc_cont=0.326	WP_004255282.1 MULTISPECIES: hypothetical protein [Lactococcus]	99.5	99.5	2.53e-141
CP159281.1_54|44736|46655|1|ID=1_54;partial=00;start_type=TTG;rbs_motif=AGGA;rbs_spacer=5-10bp;gc_cont=0.342	WP_095348233.1 lectin-like domain-containing protein [Lactococcus lactis]	100	99.8	0.0
CP159281.1_55|46764|47507|-1|ID=1_55;partial=00;start_type=ATG;rbs_motif=AGGA/GGAG/GAGG;rbs_spacer=11-12bp;gc_cont=0.376	WP_003132766.1 MULTISPECIES: amino acid ABC transporter ATP-binding protein [Lactococcus]	100	99.6	4.71e-172
CP159281.1_56|47523|49667|-1|ID=1_56;partial=00;start_type=ATG;rbs_motif=AGGAG;rbs_spacer=5-10bp;gc_cont=0.375	WP_047686005.1 amino acid ABC transporter substrate-binding protein/permease [Lactococcus lactis]	100	99.9	0.0
CP159281.1_57|50048|50704|1|ID=1_57;partial=00;start_type=ATG;rbs_motif=AGGA;rbs_spacer=5-10bp;gc_cont=0.362	WP_003132768.1 MULTISPECIES: VTT domain-containing protein [Lactococcus]	100	99.5	1.12e-151
CP159281.1_58|50872|51732|1|ID=1_58;partial=00;start_type=ATG;rbs_motif=GGAG/GAGG;rbs_spacer=5-10bp;gc_cont=0.369	WP_010906122.1 MULTISPECIES: shikimate dehydrogenase [Lactococcus]	100	99.7	2.87e-181
CP159281.1_59|51729|52799|1|ID=1_59;partial=00;start_type=ATG;rbs_motif=GGAG/GAGG;rbs_spacer=5-10bp;gc_cont=0.383	WP_003132771.1 MULTISPECIES: 3-dehydroquinate synthase [Lactococcus]	100	99.7	1.26e-258
CP159281.1_60|52910|53833|1|ID=1_60;partial=00;start_type=ATG;rbs_motif=AGGAG;rbs_spacer=5-10bp;gc_cont=0.377	WP_003132772.1 MULTISPECIES: DMT family transporter [Lactococcus]	100	99.7	2.12e-214
CP159281.1_61|53945|54544|1|ID=1_61;partial=00;start_type=ATG;rbs_motif=None;rbs_spacer=None;gc_cont=0.347	WP_003132773.1 MULTISPECIES: DUF1054 domain-containing protein [Lactococcus]	100	99.5	3.25e-137
CP159281.1_62|54549|55145|1|ID=1_62;partial=00;start_type=ATG;rbs_motif=GGAG/GAGG;rbs_spacer=5-10bp;gc_cont=0.300	WP_023164467.1 HAD family hydrolase [Lactococcus lactis]	100	99.5	5.42e-140
CP159281.1_63|55176|56342|1|ID=1_63;partial=00;start_type=ATG;rbs_motif=GGAG/GAGG;rbs_spacer=5-10bp;gc_cont=0.411	WP_023164466.1 MULTISPECIES: chorismate synthase [Lactococcus]	100	99.7	1.36e-276
CP159281.1_64|56461|56820|1|ID=1_64;partial=00;start_type=ATG;rbs_motif=AGGAG;rbs_spacer=5-10bp;gc_cont=0.328	WP_010906119.1 MULTISPECIES: YxeA family protein [Lactococcus]	100	99.2	4.36e-76
CP159281.1_65|57009|57788|1|ID=1_65;partial=00;start_type=ATG;rbs_motif=AGGAG;rbs_spacer=5-10bp;gc_cont=0.358	WP_012898329.1 MULTISPECIES: ABC transporter ATP-binding protein [Lactococcus]	100	99.6	4.32e-174
CP159281.1_66|57781|59784|1|ID=1_66;partial=00;start_type=ATG;rbs_motif=AGGAG;rbs_spacer=5-10bp;gc_cont=0.323	WP_023164465.1 ABC transporter permease [Lactococcus lactis]	100	99.9	0.0
CP159281.1_67|59965|61029|1|ID=1_67;partial=00;start_type=ATG;rbs_motif=GGA/GAG/AGG;rbs_spacer=5-10bp;gc_cont=0.310	WP_003132781.1 MULTISPECIES: VanZ family protein [Lactococcus]	100	99.7	1.73e-239
CP159281.1_68|61032|61703|1|ID=1_68;partial=00;start_type=ATG;rbs_motif=AGGAG;rbs_spacer=5-10bp;gc_cont=0.310	WP_003132782.1 MULTISPECIES: response regulator transcription factor [Lactococcus]	100	99.6	3.87e-150
CP159281.1_69|61690|62565|1|ID=1_69;partial=00;start_type=ATG;rbs_motif=GGAG/GAGG;rbs_spacer=5-10bp;gc_cont=0.323	WP_003132784.1 MULTISPECIES: sensor histidine kinase [Lactococcus]	100	99.7	1.08e-199
CP159281.1_70|62568|63632|1|ID=1_70;partial=00;start_type=ATG;rbs_motif=None;rbs_spacer=None;gc_cont=0.335	WP_010906116.1 MULTISPECIES: prephenate dehydrogenase [Lactococcus]	100	99.7	3.26e-244
CP159281.1_71|63753|65045|1|ID=1_71;partial=00;start_type=ATG;rbs_motif=AGGA;rbs_spacer=5-10bp;gc_cont=0.379	WP_003132786.1 MULTISPECIES: 3-phosphoshikimate 1-carboxyvinyltransferase [Lactococcus]	100	99.8	1.07e-292
CP159281.1_72|65069|65557|1|ID=1_72;partial=00;start_type=ATG;rbs_motif=GGA/GAG/AGG;rbs_spacer=5-10bp;gc_cont=0.346	WP_003132788.1 MULTISPECIES: shikimate kinase [Lactococcus]	100	99.4	1.45e-106
CP159281.1_73|65559|66398|1|ID=1_73;partial=00;start_type=ATG;rbs_motif=GGA/GAG/AGG;rbs_spacer=5-10bp;gc_cont=0.352	WP_014570689.1 MULTISPECIES: prephenate dehydratase [Lactococcus]	100	99.6	3.35e-197
CP159281.1_74|66401|66994|1|ID=1_74;partial=00;start_type=GTG;rbs_motif=GGAG/GAGG;rbs_spacer=5-10bp;gc_cont=0.391	WP_010906114.1 MULTISPECIES: histidine phosphatase family protein [Lactococcus]	100	99.5	1.68e-138
CP159281.1_75|66991|69495|1|ID=1_75;partial=00;start_type=ATG;rbs_motif=GGA/GAG/AGG;rbs_spacer=5-10bp;gc_cont=0.373	WP_047685994.1 SF1B family DNA helicase RecD2 [Lactococcus lactis]	100	99.9	0.0
CP159281.1_76|69589|69822|-1|ID=1_76;partial=00;start_type=ATG;rbs_motif=AGGAG;rbs_spacer=5-10bp;gc_cont=0.372	WP_353727327.1 30S ribosomal protein S20 [Lactococcus lactis]	100	98.7	4.09e-39
CP159281.1_77|70155|70667|1|ID=1_77;partial=00;start_type=ATG;rbs_motif=None;rbs_spacer=None;gc_cont=0.388	WP_003132795.1 MULTISPECIES: HD domain-containing protein [Lactococcus]	100	99.4	5.40e-124
CP159281.1_78|70824|71738|1|ID=1_78;partial=00;start_type=ATG;rbs_motif=AGGAG;rbs_spacer=5-10bp;gc_cont=0.320	WP_095345351.1 diacylglycerol/lipid kinase family protein [Lactococcus lactis]	100	99.7	9.74e-214
CP159281.1_79|71865|73070|-1|ID=1_79;partial=00;start_type=ATG;rbs_motif=AGGAG;rbs_spacer=5-10bp;gc_cont=0.333	WP_260313402.1 tyrosine-type recombinase/integrase [Lactococcus lactis]	100	99.8	2.80e-287
CP159281.1_80|73121|73669|-1|ID=1_80;partial=00;start_type=ATG;rbs_motif=GGAG/GAGG;rbs_spacer=5-10bp;gc_cont=0.344	WP_052484080.1 MULTISPECIES: helix-turn-helix domain-containing protein [Lactococcus]	100	99.5	1.64e-124
CP159281.1_81|73808|73999|1|ID=1_81;partial=00;start_type=ATG;rbs_motif=GGA/GAG/AGG;rbs_spacer=5-10bp;gc_cont=0.292	WP_353727329.1 helix-turn-helix domain-containing protein [Lactococcus lactis]	100	98.4	2.90e-35
CP159281.1_82|74112|74798|1|ID=1_82;partial=00;start_type=ATG;rbs_motif=None;rbs_spacer=None;gc_cont=0.357	WP_063283272.1 MULTISPECIES: Rha family transcriptional regulator [Lactococcus]	100	99.6	3.88e-157
CP159281.1_83|74869|75039|1|ID=1_83;partial=00;start_type=ATG;rbs_motif=AGGAG;rbs_spacer=5-10bp;gc_cont=0.386	WP_011675324.1 MULTISPECIES: DUF1655 domain-containing protein [Lactococcus]	100	98.2	2.88e-32
CP159281.1_84|75011|75295|1|ID=1_84;partial=00;start_type=ATG;rbs_motif=None;rbs_spacer=None;gc_cont=0.284	WP_353727330.1 hypothetical protein [Lactococcus lactis]	100	98.9	8.51e-60
CP159281.1_85|75292|75444|1|ID=1_85;partial=00;start_type=ATG;rbs_motif=GGA/GAG/AGG;rbs_spacer=5-10bp;gc_cont=0.314	WP_061778265.1 MULTISPECIES: hypothetical protein [Lactococcus]	100	98.0	7.10e-26
CP159281.1_86|75441|75710|1|ID=1_86;partial=00;start_type=ATG;rbs_motif=AGGAG;rbs_spacer=5-10bp;gc_cont=0.356	WP_003132804.1 MULTISPECIES: hypothetical protein [Lactococcus]	100	98.9	1.25e-52
CP159281.1_87|75720|77417|1|ID=1_87;partial=00;start_type=GTG;rbs_motif=GGA/GAG/AGG;rbs_spacer=5-10bp;gc_cont=0.351	WP_353727332.1 hypothetical protein [Lactococcus lactis]	100	99.8	0.0
CP159281.1_88|77778|77960|1|ID=1_88;partial=00;start_type=ATG;rbs_motif=GGAG/GAGG;rbs_spacer=5-10bp;gc_cont=0.268	WP_010906213.1 MULTISPECIES: hypothetical protein [Lactococcus]	100	98.4	2.01e-36
CP159281.1_89|77979|78185|1|ID=1_89;partial=00;start_type=ATG;rbs_motif=GGAG/GAGG;rbs_spacer=5-10bp;gc_cont=0.382	WP_010906212.1 MULTISPECIES: hypothetical protein [Lactococcus]	100	98.6	5.53e-42
CP159281.1_90|78347|78919|1|ID=1_90;partial=00;start_type=ATG;rbs_motif=AGGAG;rbs_spacer=5-10bp;gc_cont=0.360	WP_353727334.1 hypothetical protein [Lactococcus lactis]	100	99.5	1.82e-125
CP159281.1_91|78936|79298|1|ID=1_91;partial=00;start_type=ATG;rbs_motif=GGA/GAG/AGG;rbs_spacer=5-10bp;gc_cont=0.408	WP_353727335.1 hypothetical protein [Lactococcus lactis]	100	99.2	1.06e-72
CP159281.1_92|79812|80318|1|ID=1_92;partial=00;start_type=ATG;rbs_motif=None;rbs_spacer=None;gc_cont=0.300	WP_353727337.1 GNAT family N-acetyltransferase [Lactococcus lactis]	100	99.4	9.34e-115
CP159281.1_93|80949|82448|1|ID=1_93;partial=00;start_type=ATG;rbs_motif=GGA/GAG/AGG;rbs_spacer=5-10bp;gc_cont=0.287	WP_353727339.1 P-loop ATPase, Sll1717 family [Lactococcus lactis]	100	99.8	0.0
CP159281.1_94|83303|83503|1|ID=1_94;partial=00;start_type=ATG;rbs_motif=AGGA;rbs_spacer=5-10bp;gc_cont=0.363	WP_063283138.1 MULTISPECIES: cold-shock protein [Bacteria]	98.5	98.5	2.69e-39
CP159281.1_95|83835|84500|1|ID=1_95;partial=00;start_type=ATG;rbs_motif=GGAG/GAGG;rbs_spacer=5-10bp;gc_cont=0.290	WP_353727341.1 DUF1643 domain-containing protein [Lactococcus lactis]	100	99.5	2.73e-149
CP159281.1_96|84806|85519|1|ID=1_96;partial=00;start_type=ATG;rbs_motif=GGAG/GAGG;rbs_spacer=5-10bp;gc_cont=0.364	WP_003130397.1 MULTISPECIES: Bax inhibitor-1/YccA family protein [Lactococcus]	100	99.6	9.03e-156
CP159281.1_97|85594|86277|-1|ID=1_97;partial=00;start_type=ATG;rbs_motif=GGA/GAG/AGG;rbs_spacer=5-10bp;gc_cont=0.374	WP_003130398.1 MULTISPECIES: LutC/YkgG family protein [Bacilli]	100	99.6	7.55e-159
CP159281.1_98|86280|87752|-1|ID=1_98;partial=00;start_type=ATG;rbs_motif=GGA/GAG/AGG;rbs_spacer=5-10bp;gc_cont=0.401	WP_003130400.1 MULTISPECIES: LutB/LldF family L-lactate oxidation iron-sulfur protein [Lactococcus]	100	99.8	0.0
CP159281.1_99|87762|88532|-1|ID=1_99;partial=00;start_type=ATG;rbs_motif=AGGAG;rbs_spacer=5-10bp;gc_cont=0.364	WP_010906112.1 MULTISPECIES: (Fe-S)-binding protein [Bacilli]	100	99.6	2.97e-184
CP159281.1_100|88713|89549|-1|ID=1_100;partial=00;start_type=ATG;rbs_motif=GGAG/GAGG;rbs_spacer=5-10bp;gc_cont=0.369	WP_003130402.1 MULTISPECIES: Cof-type HAD-IIB family hydrolase [Bacilli]	100	99.6	2.89e-202
CP159281.1_101|89856|91277|1|ID=1_101;partial=00;start_type=GTG;rbs_motif=AGGAG;rbs_spacer=5-10bp;gc_cont=0.381	WP_003130403.1 MULTISPECIES: NCS2 family permease [Bacilli]	100	99.8	0.0
CP159281.1_102|91491|92315|1|ID=1_102;partial=00;start_type=GTG;rbs_motif=None;rbs_spacer=None;gc_cont=0.356	WP_023164441.1 MULTISPECIES: alpha/beta hydrolase [Lactococcus]	100	99.6	4.78e-199
CP159281.1_103|92477|93562|1|ID=1_103;partial=00;start_type=ATG;rbs_motif=GGA/GAG/AGG;rbs_spacer=11-12bp;gc_cont=0.345	WP_023164440.1 YdcF family protein [Lactococcus lactis]	100	99.7	1.29e-249
CP159281.1_104|93636|94625|1|ID=1_104;partial=00;start_type=ATG;rbs_motif=None;rbs_spacer=None;gc_cont=0.308	WP_353727344.1 competence protein CoiA [Lactococcus lactis]	100	99.7	4.46e-243
CP159281.1_105|94688|96493|1|ID=1_105;partial=00;start_type=ATG;rbs_motif=AGGAG;rbs_spacer=5-10bp;gc_cont=0.339	WP_277812453.1 oligoendopeptidase F [Lactococcus lactis]	100	99.8	0.0
CP159281.1_106|96496|97179|1|ID=1_106;partial=00;start_type=ATG;rbs_motif=AGGAG(G)/GGAGG;rbs_spacer=13-15bp;gc_cont=0.363	WP_023164438.1 O-methyltransferase [Lactococcus lactis]	100	99.6	5.96e-156
CP159281.1_107|97360|98259|1|ID=1_107;partial=00;start_type=ATG;rbs_motif=GGA/GAG/AGG;rbs_spacer=5-10bp;gc_cont=0.346	WP_010906107.1 MULTISPECIES: peptidyl-prolyl cis-trans isomerase [Bacilli]	100	99.7	3.87e-190
CP159281.1_108|98525|101143|1|ID=1_108;partial=00;start_type=ATG;rbs_motif=AGGAG;rbs_spacer=5-10bp;gc_cont=0.385	WP_095345370.1 alanine--tRNA ligase [Lactococcus lactis]	100	99.9	0.0
CP159281.1_109|101248|101724|1|ID=1_109;partial=00;start_type=ATG;rbs_motif=GGA/GAG/AGG;rbs_spacer=5-10bp;gc_cont=0.331	WP_032947796.1 esterase [Lactococcus lactis]	100	99.4	9.15e-108
CP159281.1_110|101756|102223|1|ID=1_110;partial=00;start_type=ATG;rbs_motif=None;rbs_spacer=None;gc_cont=0.344	WP_023164435.1 SsrA-binding protein SmpB [Lactococcus lactis]	100	99.4	9.57e-104
CP159281.1_111|102501|103397|1|ID=1_111;partial=00;start_type=ATG;rbs_motif=GGAG/GAGG;rbs_spacer=5-10bp;gc_cont=0.385	WP_003130880.1 MULTISPECIES: phosphate ABC transporter substrate-binding protein [Lactococcus]	100	99.7	2.52e-197
CP159281.1_112|103771|104595|1|ID=1_112;partial=00;start_type=ATG;rbs_motif=None;rbs_spacer=None;gc_cont=0.382	WP_017864882.1 MULTISPECIES: phosphate ABC transporter substrate-binding protein [Lactococcus]	100	99.6	3.81e-189
CP159281.1_113|104716|105639|1|ID=1_113;partial=00;start_type=ATG;rbs_motif=GGA/GAG/AGG;rbs_spacer=5-10bp;gc_cont=0.394	WP_021722156.1 MULTISPECIES: phosphate ABC transporter permease subunit PstC [Lactococcus]	100	99.7	1.41e-203
CP159281.1_114|105639|106532|1|ID=1_114;partial=00;start_type=ATG;rbs_motif=AGGA/GGAG/GAGG;rbs_spacer=11-12bp;gc_cont=0.411	WP_003130884.1 MULTISPECIES: phosphate ABC transporter permease PstA [Lactococcus]	100	99.7	1.15e-197
CP159281.1_115|106566|107375|1|ID=1_115;partial=00;start_type=ATG;rbs_motif=GGA/GAG/AGG;rbs_spacer=11-12bp;gc_cont=0.377	WP_003130885.1 MULTISPECIES: phosphate ABC transporter ATP-binding protein PstB [Lactococcus]	100	99.6	3.21e-190
CP159281.1_116|107541|108302|1|ID=1_116;partial=00;start_type=ATG;rbs_motif=GGA/GAG/AGG;rbs_spacer=5-10bp;gc_cont=0.362	WP_003130886.1 MULTISPECIES: phosphate ABC transporter ATP-binding protein PstB [Lactococcus]	100	99.6	3.45e-177
CP159281.1_117|108465|109118|1|ID=1_117;partial=00;start_type=ATG;rbs_motif=GGAG/GAGG;rbs_spacer=5-10bp;gc_cont=0.364	WP_003130887.1 MULTISPECIES: phosphate signaling complex protein PhoU [Lactococcus]	100	99.5	1.07e-144
CP159281.1_118|109213|109782|-1|ID=1_118;partial=00;start_type=ATG;rbs_motif=AGGAG;rbs_spacer=5-10bp;gc_cont=0.351	WP_023164434.1 histidine phosphatase family protein [Lactococcus lactis]	100	99.5	2.82e-133
CP159281.1_119|109804|110778|-1|ID=1_119;partial=00;start_type=ATG;rbs_motif=GGAG/GAGG;rbs_spacer=5-10bp;gc_cont=0.367	WP_012898305.1 S66 family peptidase [Lactococcus lactis]	100	99.7	2.48e-242
CP159281.1_120|110966|112237|-1|ID=1_120;partial=00;start_type=ATG;rbs_motif=AGGAG;rbs_spacer=5-10bp;gc_cont=0.388	WP_023164433.1 serine--tRNA ligase [Lactococcus lactis]	100	99.8	1.09e-302
CP159281.1_121|112621|112992|-1|ID=1_121;partial=00;start_type=ATG;rbs_motif=GGA/GAG/AGG;rbs_spacer=11-12bp;gc_cont=0.344	WP_033899361.1 MULTISPECIES: DUF956 family protein [unclassified Lactococcus]	99.2	99.2	1.28e-79
CP159281.1_122|113142|113837|1|ID=1_122;partial=00;start_type=ATG;rbs_motif=AGGAG;rbs_spacer=5-10bp;gc_cont=0.375	WP_023164432.1 YitT family protein [Lactococcus lactis]	100	99.6	1.50e-151
CP159281.1_123|113862|114245|-1|ID=1_123;partial=00;start_type=GTG;rbs_motif=GGAG/GAGG;rbs_spacer=5-10bp;gc_cont=0.344	WP_003130895.1 MULTISPECIES: DUF956 family protein [Lactococcus]	100	99.2	2.75e-85
CP159281.1_124|114388|115311|-1|ID=1_124;partial=00;start_type=ATG;rbs_motif=AGGAG;rbs_spacer=5-10bp;gc_cont=0.413	WP_023164431.1 PTS system mannose/fructose/sorbose family transporter subunit IID [Lactococcus lactis]	100	99.7	2.31e-218
CP159281.1_125|115330|116142|-1|ID=1_125;partial=00;start_type=ATG;rbs_motif=AGGA/GGAG/GAGG;rbs_spacer=11-12bp;gc_cont=0.464	WP_015426886.1 MULTISPECIES: PTS mannose/fructose/sorbose transporter subunit IIC [Lactococcus]	100	99.6	1.49e-175
CP159281.1_126|116221|117210|-1|ID=1_126;partial=00;start_type=TTG;rbs_motif=AGGAG;rbs_spacer=5-10bp;gc_cont=0.429	WP_023164430.1 PTS sugar transporter subunit IIB [Lactococcus lactis]	100	99.7	1.84e-226
CP159281.1_127|117479|117682|-1|ID=1_127;partial=00;start_type=ATG;rbs_motif=None;rbs_spacer=None;gc_cont=0.338	WP_010906103.1 MULTISPECIES: ferredoxin [Lactococcus]	100	98.5	6.26e-43
CP159281.1_128|117729|118244|1|ID=1_128;partial=00;start_type=GTG;rbs_motif=AGGA;rbs_spacer=5-10bp;gc_cont=0.393	WP_023164429.1 MULTISPECIES: SAG1386/EF1546 family surface-associated protein [Lactococcus]	100	99.4	6.05e-92
CP159281.1_129|118327|118989|1|ID=1_129;partial=00;start_type=ATG;rbs_motif=GGA/GAG/AGG;rbs_spacer=5-10bp;gc_cont=0.336	WP_003130902.1 MULTISPECIES: (d)CMP kinase [Lactococcus]	100	99.5	6.66e-145
