CP192215.1_1949|2077280|2077684|-1|ID=1_1949;partial=00;start_type=ATG;rbs_motif=GGAG/GAGG;rbs_spacer=5-10bp;gc_cont=0.368	WP_000401966.1 RusA family crossover junction endodeoxyribonuclease [Staphylococcus aureus]	100	99.3	7.71e-93
CP192215.1_1950|2077693|2077911|-1|ID=1_1950;partial=00;start_type=ATG;rbs_motif=GGAG/GAGG;rbs_spacer=5-10bp;gc_cont=0.297	WP_000338528.1 MULTISPECIES: hypothetical protein [Bacteria]	100	98.6	1.71e-49
CP192215.1_1951|2077918|2078835|-1|ID=1_1951;partial=00;start_type=ATG;rbs_motif=GGAG/GAGG;rbs_spacer=5-10bp;gc_cont=0.347	WP_041497902.1 DnaD domain-containing protein [Staphylococcus aureus]	100	99.7	1.68e-194
CP192215.1_1952|2078865|2079335|-1|ID=1_1952;partial=00;start_type=ATG;rbs_motif=GGAG/GAGG;rbs_spacer=5-10bp;gc_cont=0.352	WP_000610647.1 MULTISPECIES: single-stranded DNA-binding protein [Staphylococcus]	100	99.4	1.78e-104
CP192215.1_1953|2079336|2079821|-1|ID=1_1953;partial=00;start_type=ATG;rbs_motif=None;rbs_spacer=None;gc_cont=0.348	WP_000123912.1 MBL fold metallo-hydrolase [Staphylococcus aureus]	100	99.4	3.57e-111
CP192215.1_1954|2080034|2080954|-1|ID=1_1954;partial=00;start_type=ATG;rbs_motif=GGAG/GAGG;rbs_spacer=5-10bp;gc_cont=0.339	WP_000138481.1 MULTISPECIES: recombinase RecT [Bacteria]	100	99.7	8.58e-209
CP192215.1_1955|2080956|2082899|-1|ID=1_1955;partial=00;start_type=ATG;rbs_motif=GGAG/GAGG;rbs_spacer=5-10bp;gc_cont=0.305	WP_000700571.1 MULTISPECIES: AAA family ATPase [Staphylococcus]	100	99.8	0.0
CP192215.1_1956|2082908|2083171|-1|ID=1_1956;partial=00;start_type=ATG;rbs_motif=GGA/GAG/AGG;rbs_spacer=5-10bp;gc_cont=0.326	WP_001205732.1 MULTISPECIES: hypothetical protein [Staphylococcus]	100	98.9	1.36e-55
CP192215.1_1957|2083180|2083440|-1|ID=1_1957;partial=00;start_type=ATG;rbs_motif=AGGA;rbs_spacer=5-10bp;gc_cont=0.303	WP_000291488.1 MULTISPECIES: DUF1108 family protein [Bacteria]	100	98.9	2.19e-56
CP192215.1_1958|2083691|2084011|-1|ID=1_1958;partial=00;start_type=ATG;rbs_motif=AGGA;rbs_spacer=5-10bp;gc_cont=0.340	WP_001120936.1 MULTISPECIES: DUF771 domain-containing protein [Bacteria]	100	99.1	2.19e-72
CP192215.1_1959|2084087|2084224|-1|ID=1_1959;partial=00;start_type=ATG;rbs_motif=AGGAG;rbs_spacer=5-10bp;gc_cont=0.348	YP_918899.1 transcriptional regulator [Staphylococcus phage phiPVL108]	97.8	97.8	1.37e-21
CP192215.1_1960|2084244|2084504|-1|ID=1_1960;partial=00;start_type=ATG;rbs_motif=AGGAG;rbs_spacer=5-10bp;gc_cont=0.303	WP_216813234.1 transcriptional regulator [Staphylococcus aureus]	98.8	98.9	2.38e-51
CP192215.1_1961|2084517|2085266|-1|ID=1_1961;partial=00;start_type=ATG;rbs_motif=AGGAG;rbs_spacer=5-10bp;gc_cont=0.339	WP_001148590.1 MULTISPECIES: phage antirepressor KilAC domain-containing protein [Staphylococcus]	100	99.6	4.03e-174
CP192215.1_1962|2085323|2085532|1|ID=1_1962;partial=00;start_type=ATG;rbs_motif=AGGAG;rbs_spacer=5-10bp;gc_cont=0.329	NP_958632.1 77ORF066 [Staphylococcus phage 77]	100	98.6	4.03e-40
CP192215.1_1963|2085525|2085665|-1|ID=1_1963;partial=00;start_type=ATG;rbs_motif=AGGAG;rbs_spacer=5-10bp;gc_cont=0.298	NP_958631.1 77ORF117 [Staphylococcus phage 77]	100	97.9	7.25e-22
CP192215.1_1964|2085680|2086126|-1|ID=1_1964;partial=00;start_type=ATG;rbs_motif=AGGAG;rbs_spacer=5-10bp;gc_cont=0.320	YP_003169638.1 anti-repressor Ant [Staphylococcus phage P954]	100	99.3	5.22e-100
CP192215.1_1965|2086139|2086381|-1|ID=1_1965;partial=00;start_type=ATG;rbs_motif=GGAG/GAGG;rbs_spacer=5-10bp;gc_cont=0.305	WP_000639923.1 MULTISPECIES: DUF739 family protein [Bacteria]	100	98.8	3.13e-51
CP192215.1_1966|2086545|2087261|1|ID=1_1966;partial=00;start_type=ATG;rbs_motif=AGGA/GGAG/GAGG;rbs_spacer=11-12bp;gc_cont=0.318	WP_001083975.1 MULTISPECIES: LexA family transcriptional regulator [Bacteria]	100	99.6	1.40e-164
CP192215.1_1967|2087273|2088127|1|ID=1_1967;partial=00;start_type=ATG;rbs_motif=AGGAG;rbs_spacer=5-10bp;gc_cont=0.287	WP_001557601.1 MULTISPECIES: HIRAN domain-containing protein [Bacteria]	100	99.6	1.67e-204
CP192215.1_1968|2088201|2088347|1|ID=1_1968;partial=00;start_type=ATG;rbs_motif=AGGAG;rbs_spacer=5-10bp;gc_cont=0.320	WP_000345949.1 MULTISPECIES: hypothetical protein [Bacteria]	100	98.0	7.29e-25
CP192215.1_1969|2088344|2088529|1|ID=1_1969;partial=00;start_type=ATG;rbs_motif=AGGAG;rbs_spacer=5-10bp;gc_cont=0.317	WP_000109189.1 MULTISPECIES: hypothetical protein [Staphylococcus]	100	98.4	4.92e-33
CP192215.1_1970|2088600|2088782|1|ID=1_1970;partial=00;start_type=ATG;rbs_motif=AGGA;rbs_spacer=5-10bp;gc_cont=0.262	WP_000705236.1 hypothetical protein [Staphylococcus aureus]	100	98.4	1.41e-36
CP192215.1_1971|2088818|2089573|1|ID=1_1971;partial=00;start_type=TTG;rbs_motif=None;rbs_spacer=None;gc_cont=0.250	YP_003169632.1 antitoxin mazE-like [Staphylococcus phage P954]	99.6	97.2	4.06e-169
CP192215.1_1972|2089764|2090801|1|ID=1_1972;partial=00;start_type=ATG;rbs_motif=AGGAG;rbs_spacer=5-10bp;gc_cont=0.306	WP_000857198.1 MULTISPECIES: tyrosine-type recombinase/integrase [Staphylococcus]	100	99.7	2.92e-247
CP192215.1_1973|2090858|2091682|1|ID=1_1973;partial=00;start_type=ATG;rbs_motif=GGA/GAG/AGG;rbs_spacer=5-10bp;gc_cont=0.337	WP_000283440.1 sphingomyelin phosphodiesterase [Staphylococcus aureus]	100	99.6	3.26e-206
CP192215.1_1974|2091920|2092936|-1|ID=1_1974;partial=00;start_type=ATG;rbs_motif=AGGA;rbs_spacer=5-10bp;gc_cont=0.301	WP_000595402.1 MULTISPECIES: bi-component leukocidin LukGH subunit G [Staphylococcus]	100	99.7	7.18e-249
CP192215.1_1975|2092958|2094010|-1|ID=1_1975;partial=00;start_type=ATG;rbs_motif=GGA/GAG/AGG;rbs_spacer=5-10bp;gc_cont=0.300	WP_000791416.1 MULTISPECIES: bi-component leukocidin LukGH subunit H [Staphylococcus]	100	99.7	8.70e-247
CP192215.1_1976|2094382|2095668|1|ID=1_1976;partial=00;start_type=ATG;rbs_motif=None;rbs_spacer=None;gc_cont=0.331	WP_258390286.1 ArgE/DapE family deacylase [Staphylococcus aureus]	97.4	99.8	8.93e-300
CP192215.1_1977|2096040|2096885|-1|ID=1_1977;partial=00;start_type=ATG;rbs_motif=AGGAG;rbs_spacer=5-10bp;gc_cont=0.268	WP_000812008.1 MULTISPECIES: class I SAM-dependent methyltransferase [Bacilli]	100	99.6	5.17e-202
CP192215.1_1978|2096947|2097858|-1|ID=1_1978;partial=00;start_type=ATG;rbs_motif=AGGA;rbs_spacer=5-10bp;gc_cont=0.277	WP_000825510.1 MULTISPECIES: iron-hydroxamate ABC transporter substrate-binding protein [Bacilli]	100	99.7	1.98e-217
CP192215.1_1979|2098019|2099326|1|ID=1_1979;partial=00;start_type=ATG;rbs_motif=AGGA/GGAG/GAGG;rbs_spacer=11-12bp;gc_cont=0.286	WP_001045063.1 MULTISPECIES: TrkH family potassium uptake protein [Staphylococcus]	100	99.8	3.31e-278
CP192215.1_1980|2100169|2100612|-1|ID=1_1980;partial=00;start_type=ATG;rbs_motif=GGA/GAG/AGG;rbs_spacer=5-10bp;gc_cont=0.268	WP_000022887.1 MULTISPECIES: GNAT family N-acetyltransferase [Staphylococcus]	100	99.3	1.69e-100
CP192215.1_1981|2100718|2101236|-1|ID=1_1981;partial=00;start_type=ATG;rbs_motif=GGA/GAG/AGG;rbs_spacer=5-10bp;gc_cont=0.252	WP_075583719.1 hypothetical protein [Staphylococcus aureus]	99.3	83.8	1.15e-79
CP192215.1_1982|2101472|2102062|-1|ID=1_1982;partial=00;start_type=ATG;rbs_motif=None;rbs_spacer=None;gc_cont=0.345	WP_001293059.1 MULTISPECIES: terminase small subunit [Staphylococcus]	100	99.5	4.29e-136
CP192215.1_1983|2102059|2102271|-1|ID=1_1983;partial=00;start_type=ATG;rbs_motif=None;rbs_spacer=None;gc_cont=0.305	WP_000128898.1 MULTISPECIES: LuxR C-terminal-related transcriptional regulator [Staphylococcus]	100	98.6	4.48e-42
CP192215.1_1984|2102612|2102878|1|ID=1_1984;partial=00;start_type=ATG;rbs_motif=None;rbs_spacer=None;gc_cont=0.345	WP_271287712.1 tyrosine-type recombinase/integrase [Staphylococcus aureus]	100	98.9	9.66e-51
CP192215.1_1985|2102973|2104589|-1|ID=1_1985;partial=00;start_type=ATG;rbs_motif=GGAG/GAGG;rbs_spacer=5-10bp;gc_cont=0.375	WP_000240649.1 MULTISPECIES: chaperonin GroEL [Staphylococcus]	100	99.8	0.0
CP192215.1_1986|2104665|2104949|-1|ID=1_1986;partial=00;start_type=ATG;rbs_motif=AGGAG;rbs_spacer=5-10bp;gc_cont=0.347	WP_000917289.1 MULTISPECIES: co-chaperone GroES [Bacteria]	100	98.9	1.36e-56
CP192215.1_1987|2105126|2105869|1|ID=1_1987;partial=00;start_type=ATG;rbs_motif=GGAG/GAGG;rbs_spacer=5-10bp;gc_cont=0.298	WP_000197645.1 MULTISPECIES: CPBP family intramembrane glutamic endopeptidase MroQ [Staphylococcus]	100	99.6	1.97e-164
CP192215.1_1988|2105893|2107140|-1|ID=1_1988;partial=00;start_type=ATG;rbs_motif=AGGA/GGAG/GAGG;rbs_spacer=11-12bp;gc_cont=0.358	WP_052997535.1 SdrH family protein [Staphylococcus aureus]	100	99.8	9.12e-189
CP192215.1_1989|2107337|2107963|1|ID=1_1989;partial=00;start_type=ATG;rbs_motif=AGGAG;rbs_spacer=5-10bp;gc_cont=0.309	WP_000522384.1 MULTISPECIES: nitroreductase family protein [Staphylococcus]	100	99.5	3.93e-147
CP192215.1_1990|2108233|2109018|1|ID=1_1990;partial=00;start_type=ATG;rbs_motif=AGGA;rbs_spacer=5-10bp;gc_cont=0.316	WP_000867943.1 MULTISPECIES: carbon-nitrogen family hydrolase [Staphylococcus]	100	99.6	1.94e-187
CP192215.1_1991|2109617|2109751|-1|ID=1_1991;partial=00;start_type=ATG;rbs_motif=GGA/GAG/AGG;rbs_spacer=5-10bp;gc_cont=0.281	WP_000046022.1 MULTISPECIES: delta-hemolysin [Bacteria]	100	57.8	6.54e-09
CP192215.1_1992|2109933|2110556|1|ID=1_1992;partial=00;start_type=ATG;rbs_motif=GGA/GAG/AGG;rbs_spacer=5-10bp;gc_cont=0.282	WP_001105713.1 MULTISPECIES: accessory gene regulator AgrB [Staphylococcus]	99.5	90.9	7.54e-120
CP192215.1_1993|2110553|2110693|1|ID=1_1993;partial=00;start_type=ATG;rbs_motif=AGGAG;rbs_spacer=5-10bp;gc_cont=0.262	WP_001093929.1 MULTISPECIES: cyclic lactone autoinducer peptide AgrD [Staphylococcus]	100	97.9	1.29e-24
CP192215.1_1994|2110718|2112010|1|ID=1_1994;partial=00;start_type=GTG;rbs_motif=None;rbs_spacer=None;gc_cont=0.274	WP_001670396.1 MULTISPECIES: quorum-sensing sensor histidine kinase AgrC [Staphylococcus]	100	99.8	1.05e-283
CP192215.1_1995|2112029|2112424|1|ID=1_1995;partial=00;start_type=ATG;rbs_motif=AGGA;rbs_spacer=5-10bp;gc_cont=0.321	WP_031869389.1 response regulator, partial [Staphylococcus aureus]	100	99.2	1.71e-89
CP192215.1_1996|2112425|2112745|1|ID=1_1996;partial=00;start_type=TTG;rbs_motif=None;rbs_spacer=None;gc_cont=0.302	WP_031891615.1 LytTR family DNA-binding domain-containing protein, partial [Staphylococcus aureus]	99.1	99.1	1.59e-70
CP192215.1_1997|2113113|2114072|-1|ID=1_1997;partial=00;start_type=ATG;rbs_motif=AGGA;rbs_spacer=5-10bp;gc_cont=0.348	WP_001253301.1 MULTISPECIES: carbohydrate kinase family protein [Staphylococcus]	100	99.7	3.59e-228
CP192215.1_1998|2114069|2115553|-1|ID=1_1998;partial=00;start_type=ATG;rbs_motif=AGGAG(G)/GGAGG;rbs_spacer=13-15bp;gc_cont=0.336	WP_000141410.1 MULTISPECIES: sucrose-6-phosphate hydrolase [Staphylococcus]	100	99.8	0.0
CP192215.1_1999|2115702|2116652|-1|ID=1_1999;partial=00;start_type=ATG;rbs_motif=GGA/GAG/AGG;rbs_spacer=5-10bp;gc_cont=0.323	WP_000790322.1 MULTISPECIES: LacI family DNA-binding transcriptional regulator [Staphylococcus]	100	99.7	8.75e-223
CP192215.1_2000|2116835|2118085|-1|ID=1_2000;partial=00;start_type=ATG;rbs_motif=GGAG/GAGG;rbs_spacer=5-10bp;gc_cont=0.339	WP_001052258.1 MULTISPECIES: ammonium transporter [Staphylococcus]	100	99.8	2.64e-295
CP192215.1_2001|2118293|2118517|-1|ID=1_2001;partial=00;start_type=ATG;rbs_motif=AGGAG;rbs_spacer=5-10bp;gc_cont=0.347	WP_000581077.1 MULTISPECIES: sulfurtransferase TusA family protein [Staphylococcus]	100	98.7	5.65e-49
CP192215.1_2002|2118582|2119649|-1|ID=1_2002;partial=00;start_type=ATG;rbs_motif=AGGA;rbs_spacer=5-10bp;gc_cont=0.364	WP_172409317.1 YeeE/YedE family protein [Staphylococcus aureus]	98.0	98.0	5.84e-243
CP192215.1_2003|2119959|2120594|-1|ID=1_2003;partial=00;start_type=ATG;rbs_motif=AGGAG;rbs_spacer=5-10bp;gc_cont=0.340	WP_001283612.1 MULTISPECIES: redox-sensing transcriptional repressor Rex [Staphylococcus]	100	99.5	1.86e-142
CP192215.1_2004|2120847|2122775|1|ID=1_2004;partial=00;start_type=ATG;rbs_motif=GGA/GAG/AGG;rbs_spacer=5-10bp;gc_cont=0.322	WP_000602064.1 MULTISPECIES: ABC-F family ATP-binding cassette domain-containing protein [Staphylococcus]	100	99.8	0.0
CP192215.1_2005|2123360|2123656|1|ID=1_2005;partial=00;start_type=ATG;rbs_motif=GGAG/GAGG;rbs_spacer=5-10bp;gc_cont=0.310	WP_078162612.1 transposase, partial [Staphylococcus aureus]	100	94.9	1.80e-62
CP192215.1_2006|2123671|2125281|1|ID=1_2006;partial=00;start_type=ATG;rbs_motif=AGGAG;rbs_spacer=5-10bp;gc_cont=0.305	WP_430738922.1 MutS family DNA mismatch repair protein [Staphylococcus aureus]	100	99.8	0.0
CP192215.1_2007|2125383|2126408|-1|ID=1_2007;partial=00;start_type=ATG;rbs_motif=None;rbs_spacer=None;gc_cont=0.374	WP_000159044.1 MULTISPECIES: tRNA (adenosine(37)-N6)-threonylcarbamoyltransferase complex transferase subunit TsaD [Staphylococcus]	100	99.7	1.19e-244
CP192215.1_2008|2126401|2126865|-1|ID=1_2008;partial=00;start_type=TTG;rbs_motif=GGAG/GAGG;rbs_spacer=5-10bp;gc_cont=0.316	WP_000372755.1 MULTISPECIES: ribosomal protein S18-alanine N-acetyltransferase [Staphylococcus]	100	99.4	9.99e-110
CP192215.1_2009|2126838|2127500|-1|ID=1_2009;partial=00;start_type=ATG;rbs_motif=AGGAG;rbs_spacer=5-10bp;gc_cont=0.356	WP_001086739.1 MULTISPECIES: tRNA (adenosine(37)-N6)-threonylcarbamoyltransferase complex dimerization subunit type 1 TsaB [Staphylococcus]	100	99.5	1.30e-151
CP192215.1_2010|2127481|2127975|-1|ID=1_2010;partial=00;start_type=ATG;rbs_motif=GGA/GAG/AGG;rbs_spacer=11-12bp;gc_cont=0.307	WP_000590806.1 MULTISPECIES: tRNA (adenosine(37)-N6)-threonylcarbamoyltransferase complex ATPase subunit type 1 TsaE [Staphylococcus]	99.3	92.7	3.70e-103
CP192215.1_2011|2128453|2130141|1|ID=1_2011;partial=00;start_type=ATG;rbs_motif=GGA/GAG/AGG;rbs_spacer=5-10bp;gc_cont=0.402	WP_001255780.1 MULTISPECIES: dihydroxy-acid dehydratase [Staphylococcus]	100	99.8	0.0
CP192215.1_2012|2130169|2131938|1|ID=1_2012;partial=00;start_type=ATG;rbs_motif=GGAG/GAGG;rbs_spacer=5-10bp;gc_cont=0.368	WP_000047817.1 MULTISPECIES: biosynthetic-type acetolactate synthase large subunit [Staphylococcus]	100	99.8	0.0
CP192215.1_2013|2131938|2132192|1|ID=1_2013;partial=00;start_type=ATG;rbs_motif=GGAG/GAGG;rbs_spacer=5-10bp;gc_cont=0.310	WP_000196911.1 MULTISPECIES: ACT domain-containing protein [Staphylococcus]	100	98.8	5.92e-51
CP192215.1_2014|2132330|2133334|1|ID=1_2014;partial=00;start_type=ATG;rbs_motif=GGAG/GAGG;rbs_spacer=5-10bp;gc_cont=0.349	WP_000214559.1 MULTISPECIES: ketol-acid reductoisomerase [Staphylococcus]	100	99.7	4.26e-239
CP192215.1_2015|2133364|2134893|1|ID=1_2015;partial=00;start_type=ATG;rbs_motif=AGGAG;rbs_spacer=5-10bp;gc_cont=0.361	WP_000094586.1 MULTISPECIES: 2-isopropylmalate synthase [Staphylococcus]	100	99.8	0.0
CP192215.1_2016|2134896|2135942|1|ID=1_2016;partial=00;start_type=ATG;rbs_motif=GGA/GAG/AGG;rbs_spacer=5-10bp;gc_cont=0.356	WP_000221934.1 3-isopropylmalate dehydrogenase [Staphylococcus aureus]	100	99.7	4.19e-253
CP192215.1_2017|2135956|2137326|1|ID=1_2017;partial=00;start_type=ATG;rbs_motif=GGAG/GAGG;rbs_spacer=5-10bp;gc_cont=0.381	WP_000531823.1 MULTISPECIES: 3-isopropylmalate dehydratase large subunit [Staphylococcus]	100	99.8	0.0
CP192215.1_2018|2137327|2137899|1|ID=1_2018;partial=00;start_type=ATG;rbs_motif=AGxAGG/AGGxGG;rbs_spacer=5-10bp;gc_cont=0.325	WP_000718949.1 MULTISPECIES: 3-isopropylmalate dehydratase small subunit [Staphylococcus]	100	99.5	3.43e-139
CP192215.1_2019|2137914|2139182|1|ID=1_2019;partial=00;start_type=ATG;rbs_motif=GGAG/GAGG;rbs_spacer=5-10bp;gc_cont=0.321	WP_000216849.1 MULTISPECIES: threonine ammonia-lyase IlvA [Staphylococcus]	100	99.8	8.65e-304
CP192215.1_2020|2139383|2140675|1|ID=1_2020;partial=00;start_type=ATG;rbs_motif=GGAG/GAGG;rbs_spacer=5-10bp;gc_cont=0.316	WP_000777469.1 IS21 family transposase [Staphylococcus aureus]	100	99.8	9.99e-314
CP192215.1_2021|2140665|2141429|1|ID=1_2021;partial=00;start_type=ATG;rbs_motif=GGAG/GAGG;rbs_spacer=5-10bp;gc_cont=0.289	WP_001066125.1 MULTISPECIES: IS21-like element helper ATPase IstB [Staphylococcus]	100	99.2	2.64e-179
CP192215.1_2022|2147867|2148322|-1|ID=1_2022;partial=00;start_type=ATG;rbs_motif=None;rbs_spacer=None;gc_cont=0.344	WP_001058105.1 MULTISPECIES: SprT family protein [Staphylococcus]	100	99.3	3.79e-108
CP192215.1_2023|2148315|2150465|-1|ID=1_2023;partial=00;start_type=ATG;rbs_motif=None;rbs_spacer=None;gc_cont=0.335	WP_000370135.1 MULTISPECIES: Tex family protein [Staphylococcus]	100	99.9	0.0
CP192215.1_2024|2150900|2151670|-1|ID=1_2024;partial=00;start_type=ATG;rbs_motif=GGA/GAG/AGG;rbs_spacer=5-10bp;gc_cont=0.348	WP_001041107.1 MULTISPECIES: RNA polymerase sigma factor SigB [Staphylococcus]	100	99.6	1.15e-172
CP192215.1_2025|2151645|2152124|-1|ID=1_2025;partial=00;start_type=ATG;rbs_motif=GGAG/GAGG;rbs_spacer=5-10bp;gc_cont=0.325	WP_001190825.1 MULTISPECIES: anti-sigma B factor RsbW [Staphylococcus]	100	99.4	2.24e-104
CP192215.1_2026|2152126|2152452|-1|ID=1_2026;partial=00;start_type=ATG;rbs_motif=AGGAG;rbs_spacer=5-10bp;gc_cont=0.318	WP_001052491.1 MULTISPECIES: anti-sigma factor antagonist [Staphylococcus]	100	99.1	8.53e-71
CP192215.1_2027|2152572|2153573|-1|ID=1_2027;partial=00;start_type=GTG;rbs_motif=AGGAG;rbs_spacer=5-10bp;gc_cont=0.313	WP_000390829.1 MULTISPECIES: SpoIIE family protein phosphatase [Staphylococcus]	100	99.7	1.61e-238
CP192215.1_2028|2153922|2154284|-1|ID=1_2028;partial=00;start_type=ATG;rbs_motif=None;rbs_spacer=None;gc_cont=0.333	WP_430738923.1 type II toxin-antitoxin system PemK/MazF family toxin [Staphylococcus aureus]	100	99.2	1.35e-75
CP192215.1_2029|2154281|2154451|-1|ID=1_2029;partial=00;start_type=ATG;rbs_motif=GGAG/GAGG;rbs_spacer=5-10bp;gc_cont=0.333	WP_000948330.1 MULTISPECIES: type II toxin-antitoxin system antitoxin MazE [Staphylococcus]	100	98.2	1.38e-30
CP192215.1_2030|2154536|2155684|-1|ID=1_2030;partial=00;start_type=ATG;rbs_motif=AGGAG;rbs_spacer=5-10bp;gc_cont=0.359	WP_001281141.1 MULTISPECIES: alanine racemase [Staphylococcus]	100	99.7	5.12e-278
CP192215.1_2031|2155750|2156109|-1|ID=1_2031;partial=00;start_type=ATG;rbs_motif=GGAG/GAGG;rbs_spacer=5-10bp;gc_cont=0.356	WP_000581193.1 MULTISPECIES: holo-ACP synthase [Staphylococcus]	100	99.2	1.15e-80
CP192215.1_2032|2156113|2156607|-1|ID=1_2032;partial=00;start_type=ATG;rbs_motif=GGAG/GAGG;rbs_spacer=5-10bp;gc_cont=0.331	WP_001205918.1 MULTISPECIES: PH domain-containing protein [Staphylococcus]	100	98.8	3.99e-107
CP192215.1_2033|2156591|2158174|-1|ID=1_2033;partial=00;start_type=ATG;rbs_motif=AGGA/GGAG/GAGG;rbs_spacer=11-12bp;gc_cont=0.318	WP_001294624.1 MULTISPECIES: PH domain-containing protein [Staphylococcus]	100	99.8	0.0
CP192215.1_2034|2158167|2158646|-1|ID=1_2034;partial=00;start_type=ATG;rbs_motif=GGAG/GAGG;rbs_spacer=5-10bp;gc_cont=0.308	WP_001287080.1 MULTISPECIES: PH domain-containing protein [Staphylococcus]	100	99.4	8.12e-107
CP192215.1_2035|2158855|2159415|-1|ID=1_2035;partial=00;start_type=ATG;rbs_motif=AGGAG;rbs_spacer=5-10bp;gc_cont=0.344	WP_001092400.1 MULTISPECIES: K(+)-transporting ATPase subunit C [Staphylococcus]	100	99.5	2.93e-129
CP192215.1_2036|2159435|2161462|-1|ID=1_2036;partial=00;start_type=ATG;rbs_motif=GGA/GAG/AGG;rbs_spacer=5-10bp;gc_cont=0.349	WP_000546595.1 MULTISPECIES: potassium-transporting ATPase subunit KdpB [Staphylococcus]	100	99.9	0.0
CP192215.1_2037|2161481|2163157|-1|ID=1_2037;partial=00;start_type=ATG;rbs_motif=GGAG/GAGG;rbs_spacer=5-10bp;gc_cont=0.330	WP_000402661.1 MULTISPECIES: potassium-transporting ATPase subunit KdpA [Staphylococcus]	100	99.8	0.0
CP192215.1_2038|2163357|2166086|1|ID=1_2038;partial=00;start_type=GTG;rbs_motif=None;rbs_spacer=None;gc_cont=0.319	WP_000072270.1 MULTISPECIES: sensor histidine kinase [Staphylococcus]	100	97.3	0.0
CP192215.1_2039|2166086|2166781|1|ID=1_2039;partial=00;start_type=ATG;rbs_motif=AGGAG;rbs_spacer=5-10bp;gc_cont=0.325	WP_001190841.1 MULTISPECIES: response regulator transcription factor [Staphylococcus]	100	99.6	9.56e-164
CP192215.1_2040|2167150|2168670|-1|ID=1_2040;partial=00;start_type=TTG;rbs_motif=AGGAG;rbs_spacer=5-10bp;gc_cont=0.366	WP_001178942.1 MULTISPECIES: degradosome RNA helicase CshA [Staphylococcus]	100	99.8	0.0
CP192215.1_2041|2169186|2170544|-1|ID=1_2041;partial=00;start_type=ATG;rbs_motif=GGAG/GAGG;rbs_spacer=5-10bp;gc_cont=0.333	WP_000611469.1 MULTISPECIES: UDP-N-acetylmuramoyl-tripeptide--D-alanyl-D-alanine ligase [Staphylococcus]	100	99.8	0.0
CP192215.1_2042|2170559|2171740|-1|ID=1_2042;partial=00;start_type=GTG;rbs_motif=None;rbs_spacer=None;gc_cont=0.328	WP_000159632.1 MULTISPECIES: D-alanine--D-alanine ligase [Staphylococcus]	100	90.4	1.31e-256
CP192215.1_2043|2171947|2173149|1|ID=1_2043;partial=00;start_type=ATG;rbs_motif=AGGAG;rbs_spacer=5-10bp;gc_cont=0.327	WP_001109944.1 MULTISPECIES: FtsW/RodA/SpoVE family cell cycle protein [Staphylococcus]	100	99.8	3.10e-279
CP192215.1_2044|2173413|2173550|-1|ID=1_2044;partial=00;start_type=ATG;rbs_motif=GGAG/GAGG;rbs_spacer=5-10bp;gc_cont=0.268	WP_000828354.1 MULTISPECIES: Lmo0850 family protein [Bacilli]	100	97.8	3.94e-21
CP192215.1_2045|2173678|2173887|-1|ID=1_2045;partial=00;start_type=ATG;rbs_motif=AGGAG;rbs_spacer=5-10bp;gc_cont=0.310	WP_000581792.1 MULTISPECIES: putative copper chaperone CsoZ [Staphylococcus]	100	98.6	2.42e-41
CP192215.1_2046|2173899|2174237|-1|ID=1_2046;partial=00;start_type=ATG;rbs_motif=None;rbs_spacer=None;gc_cont=0.333	WP_000138928.1 MULTISPECIES: copper-sensing transcriptional repressor CsoR [Staphylococcus]	100	85.8	1.38e-59
CP192215.1_2047|2174358|2175842|1|ID=1_2047;partial=00;start_type=ATG;rbs_motif=GGAG/GAGG;rbs_spacer=5-10bp;gc_cont=0.325	WP_000571551.1 MULTISPECIES: cardiolipin synthase [Staphylococcus]	100	99.8	0.0
CP192215.1_2048|2175852|2176517|1|ID=1_2048;partial=00;start_type=ATG;rbs_motif=None;rbs_spacer=None;gc_cont=0.341	WP_001187617.1 MULTISPECIES: HD domain-containing protein [Staphylococcus]	100	96.8	5.62e-152
CP192215.1_2049|2176995|2177867|-1|ID=1_2049;partial=00;start_type=ATG;rbs_motif=GGAG/GAGG;rbs_spacer=5-10bp;gc_cont=0.338	WP_000725802.1 MULTISPECIES: membrane protein insertase YidC [Staphylococcus]	100	99.7	1.21e-200
CP192215.1_2050|2177953|2178594|-1|ID=1_2050;partial=00;start_type=ATG;rbs_motif=GGAG/GAGG;rbs_spacer=5-10bp;gc_cont=0.355	WP_000483153.1 MULTISPECIES: thiamine phosphate synthase [Staphylococcus]	100	99.5	2.10e-149
CP192215.1_2051|2178596|2179387|-1|ID=1_2051;partial=00;start_type=ATG;rbs_motif=GGAG/GAGG;rbs_spacer=5-10bp;gc_cont=0.355	WP_001108482.1 MULTISPECIES: hydroxyethylthiazole kinase [Staphylococcus]	100	99.6	1.35e-179
CP192215.1_2052|2179371|2180201|-1|ID=1_2052;partial=00;start_type=ATG;rbs_motif=GGAG/GAGG;rbs_spacer=5-10bp;gc_cont=0.360	WP_000594959.1 MULTISPECIES: bifunctional hydroxymethylpyrimidine kinase/phosphomethylpyrimidine kinase [Staphylococcus]	100	99.6	4.10e-201
CP192215.1_2053|2180194|2180883|-1|ID=1_2053;partial=00;start_type=ATG;rbs_motif=GGAG/GAGG;rbs_spacer=5-10bp;gc_cont=0.325	WP_000396069.1 MULTISPECIES: thiaminase II [Staphylococcus]	100	99.6	1.16e-163
CP192215.1_2054|2180983|2181108|-1|ID=1_2054;partial=00;start_type=ATG;rbs_motif=None;rbs_spacer=None;gc_cont=0.365	WP_001791546.1 hypothetical protein [Staphylococcus aureus]	100	97.6	2.31e-23
CP192215.1_2055|2181270|2181965|-1|ID=1_2055;partial=00;start_type=ATG;rbs_motif=AGGA;rbs_spacer=5-10bp;gc_cont=0.391	WP_000752002.1 MULTISPECIES: lytic transglycosylase SceD [Staphylococcus]	100	99.6	1.06e-151
CP192215.1_2056|2182354|2182749|-1|ID=1_2056;partial=00;start_type=ATG;rbs_motif=None;rbs_spacer=None;gc_cont=0.306	WP_000932694.1 MULTISPECIES: single-stranded DNA-binding protein [Staphylococcus]	100	99.2	5.70e-89
CP192215.1_2057|2182880|2183383|1|ID=1_2057;partial=00;start_type=ATG;rbs_motif=None;rbs_spacer=None;gc_cont=0.300	WP_001789631.1 YwpF-like family protein [Staphylococcus aureus]	99.4	99.4	1.96e-111
CP192215.1_2058|2183441|2183881|-1|ID=1_2058;partial=00;start_type=ATG;rbs_motif=GGAG/GAGG;rbs_spacer=5-10bp;gc_cont=0.340	WP_000447678.1 MULTISPECIES: 3-hydroxyacyl-ACP dehydratase FabZ [Staphylococcus]	100	99.3	3.84e-101
CP192215.1_2059|2183915|2185180|-1|ID=1_2059;partial=00;start_type=ATG;rbs_motif=GGAG/GAGG;rbs_spacer=5-10bp;gc_cont=0.361	WP_000358006.1 MULTISPECIES: UDP-N-acetylglucosamine 1-carboxyvinyltransferase [Staphylococcus]	100	99.8	2.25e-294
CP192215.1_2060|2185291|2185524|-1|ID=1_2060;partial=00;start_type=ATG;rbs_motif=GGAG/GAGG;rbs_spacer=5-10bp;gc_cont=0.291	WP_000384523.1 MULTISPECIES: DUF1146 family protein [Staphylococcus]	100	98.7	2.26e-45
CP192215.1_2061|2186200|2186604|-1|ID=1_2061;partial=00;start_type=ATG;rbs_motif=AGGAG;rbs_spacer=5-10bp;gc_cont=0.365	WP_001094394.1 MULTISPECIES: F0F1 ATP synthase subunit epsilon [Staphylococcus]	100	99.3	1.89e-84
CP192215.1_2062|2186624|2188036|-1|ID=1_2062;partial=00;start_type=ATG;rbs_motif=AGGAG;rbs_spacer=5-10bp;gc_cont=0.387	WP_000511135.1 MULTISPECIES: F0F1 ATP synthase subunit beta [Staphylococcus]	100	99.8	0.0
CP192215.1_2063|2188058|2188924|-1|ID=1_2063;partial=00;start_type=GTG;rbs_motif=GGA/GAG/AGG;rbs_spacer=5-10bp;gc_cont=0.348	WP_000157603.1 MULTISPECIES: ATP synthase F1 subunit gamma [Staphylococcus]	100	99.7	3.89e-196
CP192215.1_2064|2188955|2190463|-1|ID=1_2064;partial=00;start_type=ATG;rbs_motif=AGGAG;rbs_spacer=5-10bp;gc_cont=0.368	WP_000974881.1 MULTISPECIES: F0F1 ATP synthase subunit alpha [Staphylococcus]	100	99.8	0.0
CP192215.1_2065|2190485|2191024|-1|ID=1_2065;partial=00;start_type=ATG;rbs_motif=GGA/GAG/AGG;rbs_spacer=5-10bp;gc_cont=0.296	WP_000241353.1 MULTISPECIES: F0F1 ATP synthase subunit delta [Staphylococcus]	100	99.4	6.97e-120
CP192215.1_2066|2191024|2191545|-1|ID=1_2066;partial=00;start_type=GTG;rbs_motif=AGGA/GGAG/GAGG;rbs_spacer=11-12bp;gc_cont=0.364	WP_052996769.1 F0F1 ATP synthase subunit B [Staphylococcus aureus]	85.5	99.4	8.71e-86
CP192215.1_2067|2191743|2191955|-1|ID=1_2067;partial=00;start_type=ATG;rbs_motif=AGGAGG;rbs_spacer=5-10bp;gc_cont=0.399	WP_001048816.1 MULTISPECIES: F0F1 ATP synthase subunit C [Staphylococcus]	100	98.6	8.12e-36
CP192215.1_2068|2191999|2192727|-1|ID=1_2068;partial=00;start_type=ATG;rbs_motif=GGAG/GAGG;rbs_spacer=5-10bp;gc_cont=0.353	WP_000349655.1 MULTISPECIES: F0F1 ATP synthase subunit A [Staphylococcus]	100	99.6	7.54e-171
