CP192215.1_1|1|1035|1|ID=1_1;partial=10;start_type=Edge;rbs_motif=None;rbs_spacer=None;gc_cont=0.330	WP_111151734.1 chromosomal replication initiator protein DnaA, partial [Staphylococcus aureus]	100	99.7	1.74e-245
CP192215.1_2|1313|2446|1|ID=1_2;partial=00;start_type=ATG;rbs_motif=AGGAG;rbs_spacer=5-10bp;gc_cont=0.328	WP_000969810.1 MULTISPECIES: DNA polymerase III subunit beta [Staphylococcus]	100	99.7	9.37e-267
CP192215.1_3|2836|3072|1|ID=1_3;partial=00;start_type=TTG;rbs_motif=GGAG/GAGG;rbs_spacer=5-10bp;gc_cont=0.359	WP_000249647.1 S4 domain-containing protein YaaA [Staphylococcus aureus]	100	98.7	2.61e-49
CP192215.1_4|3069|4181|1|ID=1_4;partial=00;start_type=ATG;rbs_motif=GGA/GAG/AGG;rbs_spacer=5-10bp;gc_cont=0.337	WP_000775113.1 MULTISPECIES: DNA replication/repair protein RecF [Staphylococcus]	100	99.7	9.64e-261
CP192215.1_5|4191|6125|1|ID=1_5;partial=00;start_type=ATG;rbs_motif=None;rbs_spacer=None;gc_cont=0.368	WP_000255586.1 MULTISPECIES: DNA topoisomerase (ATP-hydrolyzing) subunit B [Staphylococcus]	100	99.8	0.0
CP192215.1_6|6162|8831|1|ID=1_6;partial=00;start_type=ATG;rbs_motif=AGGAG;rbs_spacer=5-10bp;gc_cont=0.367	WP_000819064.1 DNA gyrase subunit A [Staphylococcus aureus]	100	99.9	0.0
CP192215.1_7|8919|9749|-1|ID=1_7;partial=00;start_type=ATG;rbs_motif=GGA/GAG/AGG;rbs_spacer=5-10bp;gc_cont=0.368	WP_000449219.1 MULTISPECIES: NAD(P)H-hydrate dehydratase [Staphylococcus]	100	97.5	1.88e-191
CP192215.1_8|10057|11571|1|ID=1_8;partial=00;start_type=ATG;rbs_motif=AGxAGG/AGGxGG;rbs_spacer=5-10bp;gc_cont=0.371	WP_000177458.1 MULTISPECIES: histidine ammonia-lyase [Staphylococcus]	100	99.8	0.0
CP192215.1_9|11950|13236|1|ID=1_9;partial=00;start_type=ATG;rbs_motif=AGGA;rbs_spacer=5-10bp;gc_cont=0.346	WP_000884334.1 MULTISPECIES: serine--tRNA ligase [Staphylococcus]	100	99.8	1.11e-309
CP192215.1_10|13887|14582|1|ID=1_10;partial=00;start_type=ATG;rbs_motif=AGGAG;rbs_spacer=5-10bp;gc_cont=0.371	WP_000190724.1 AzlC family ABC transporter permease [Staphylococcus aureus]	93.5	99.6	1.27e-143
CP192215.1_11|14579|14908|1|ID=1_11;partial=00;start_type=ATG;rbs_motif=AGGAG(G)/GGAGG;rbs_spacer=13-15bp;gc_cont=0.345	WP_000628050.1 MULTISPECIES: AzlD domain-containing protein [Bacillales]	100	99.1	4.37e-60
CP192215.1_12|15272|16240|1|ID=1_12;partial=00;start_type=ATG;rbs_motif=AGGAG;rbs_spacer=5-10bp;gc_cont=0.354	WP_000186492.1 MULTISPECIES: homoserine O-acetyltransferase MetX [Staphylococcus]	100	99.7	1.09e-244
CP192215.1_13|16535|17473|1|ID=1_13;partial=00;start_type=ATG;rbs_motif=None;rbs_spacer=None;gc_cont=0.327	WP_044166034.1 YybS family protein [Staphylococcus aureus]	100	99.7	3.14e-198
CP192215.1_14|17488|19455|1|ID=1_14;partial=00;start_type=ATG;rbs_motif=GGAG/GAGG;rbs_spacer=5-10bp;gc_cont=0.353	WP_001081643.1 MULTISPECIES: cyclic-di-AMP phosphodiesterase GdpP [Staphylococcus]	100	99.8	0.0
CP192215.1_15|19452|19898|1|ID=1_15;partial=00;start_type=ATG;rbs_motif=AGGAG;rbs_spacer=5-10bp;gc_cont=0.320	WP_000864307.1 MULTISPECIES: 50S ribosomal protein L9 [Staphylococcus]	100	99.3	1.38e-95
CP192215.1_16|19930|21330|1|ID=1_16;partial=00;start_type=ATG;rbs_motif=AGGA/GGAG/GAGG;rbs_spacer=11-12bp;gc_cont=0.382	WP_000375644.1 MULTISPECIES: replicative DNA helicase [Staphylococcus]	100	99.8	0.0
CP192215.1_17|21608|22891|1|ID=1_17;partial=00;start_type=ATG;rbs_motif=GGAG/GAGG;rbs_spacer=5-10bp;gc_cont=0.363	WP_000095334.1 adenylosuccinate synthase [Staphylococcus aureus]	100	99.8	2.92e-315
CP192215.1_18|24094|24795|1|ID=1_18;partial=00;start_type=ATG;rbs_motif=GGAG/GAGG;rbs_spacer=5-10bp;gc_cont=0.368	WP_000101976.1 MULTISPECIES: response regulator YycF [Staphylococcus]	100	99.6	6.25e-170
CP192215.1_19|24808|26634|1|ID=1_19;partial=00;start_type=ATG;rbs_motif=GGAG/GAGG;rbs_spacer=5-10bp;gc_cont=0.347	WP_000871607.1 MULTISPECIES: cell wall metabolism sensor histidine kinase WalK [Staphylococcus]	100	99.8	0.0
CP192215.1_20|26678|27961|1|ID=1_20;partial=00;start_type=ATG;rbs_motif=None;rbs_spacer=None;gc_cont=0.353	WP_015445686.1 two-component system activity regulator YycH [Staphylococcus aureus]	100	99.8	5.29e-312
CP192215.1_21|27962|28750|1|ID=1_21;partial=00;start_type=ATG;rbs_motif=GGAG/GAGG;rbs_spacer=5-10bp;gc_cont=0.321	WP_001104176.1 MULTISPECIES: two-component system regulatory protein YycI [Staphylococcus]	100	99.6	6.62e-175
CP192215.1_22|29164|29946|1|ID=1_22;partial=00;start_type=ATG;rbs_motif=None;rbs_spacer=None;gc_cont=0.351	WP_000114395.1 MBL fold metallo-hydrolase [Staphylococcus aureus]	100	99.6	2.18e-188
CP192215.1_23|30130|32490|1|ID=1_23;partial=00;start_type=ATG;rbs_motif=None;rbs_spacer=None;gc_cont=0.384	WP_000645763.1 MULTISPECIES: LPXTG-anchored adenosine synthase AdsA [Staphylococcus]	100	98.1	0.0
CP192215.1_24|32858|33337|1|ID=1_24;partial=00;start_type=ATG;rbs_motif=GGAG/GAGG;rbs_spacer=5-10bp;gc_cont=0.392	WP_000704775.1 MULTISPECIES: 23S rRNA (pseudouridine(1915)-N(3))-methyltransferase RlmH [Staphylococcus]	100	99.4	1.29e-103
CP192215.1_25|33659|34819|1|ID=1_25;partial=00;start_type=ATG;rbs_motif=AGGAG;rbs_spacer=5-10bp;gc_cont=0.287	WP_103246360.1 MrcB family domain-containing protein [Staphylococcus aureus]	100	99.7	8.23e-261
CP192215.1_27|35234|35473|1|ID=1_27;partial=00;start_type=ATG;rbs_motif=GGA/GAG/AGG;rbs_spacer=5-10bp;gc_cont=0.246	WP_001282728.1 MULTISPECIES: hypothetical protein [Staphylococcaceae]	100	98.8	6.40e-46
CP192215.1_28|35505|36179|-1|ID=1_28;partial=00;start_type=ATG;rbs_motif=AGGAG;rbs_spacer=5-10bp;gc_cont=0.344	WP_001106057.1 MULTISPECIES: IS6-like element IS257 family transposase [Bacteria]	100	99.6	9.24e-163
CP192215.1_29|36437|36604|1|ID=1_29;partial=00;start_type=ATG;rbs_motif=GGA/GAG/AGG;rbs_spacer=11-12bp;gc_cont=0.292	WP_000894158.1 MULTISPECIES: hypothetical protein [Staphylococcus]	100	98.2	6.38e-31
CP192215.1_30|36702|36932|1|ID=1_30;partial=00;start_type=ATG;rbs_motif=None;rbs_spacer=None;gc_cont=0.351	WP_225261247.1 hypothetical protein, partial [Staphylococcus aureus]	98.7	97.4	4.86e-38
CP192215.1_31|37481|38224|1|ID=1_31;partial=00;start_type=ATG;rbs_motif=AGGAG;rbs_spacer=5-10bp;gc_cont=0.335	WP_000958858.1 MULTISPECIES: glycerophosphoryl diester phosphodiesterase [Bacillota]	100	99.6	5.12e-176
CP192215.1_32|38321|38749|1|ID=1_32;partial=00;start_type=ATG;rbs_motif=GGA/GAG/AGG;rbs_spacer=5-10bp;gc_cont=0.291	WP_000872606.1 MULTISPECIES: MaoC family dehydratase [Bacillota]	100	99.3	4.36e-96
CP192215.1_33|38795|40801|-1|ID=1_33;partial=00;start_type=ATG;rbs_motif=AGGAG;rbs_spacer=5-10bp;gc_cont=0.305	WP_057521704.1 ceftaroline-resistant PBP2a family peptidoglycan transpeptidase MecA [Staphylococcus aureus]	100	99.9	0.0
CP192215.1_34|40901|41887|1|ID=1_34;partial=00;start_type=GTG;rbs_motif=GGAG/GAGG;rbs_spacer=5-10bp;gc_cont=0.293	WP_001549960.1 MULTISPECIES: beta-lactam sensor/signal transducer MecR1 [Staphylococcus]	100	99.7	4.68e-224
CP192215.1_35|41847|42119|1|ID=1_35;partial=00;start_type=TTG;rbs_motif=None;rbs_spacer=None;gc_cont=0.370	WP_320159820.1 type I restriction enzyme endonuclease domain-containing protein, partial [Staphylococcus aureus]	98.9	98.9	7.30e-53
CP192215.1_36|42110|43633|-1|ID=1_36;partial=00;start_type=ATG;rbs_motif=None;rbs_spacer=None;gc_cont=0.281	WP_371383177.1 IS1182 family transposase, partial [Staphylococcus aureus]	100	99.8	0.0
CP192215.1_37|43769|44275|-1|ID=1_37;partial=00;start_type=ATG;rbs_motif=AGGA;rbs_spacer=5-10bp;gc_cont=0.369	WP_001092188.1 MULTISPECIES: DUF1643 domain-containing protein [Staphylococcus]	100	99.4	9.72e-117
CP192215.1_38|44290|44601|-1|ID=1_38;partial=00;start_type=ATG;rbs_motif=GGAG/GAGG;rbs_spacer=5-10bp;gc_cont=0.324	WP_000700851.1 MULTISPECIES: DUF960 family protein [Bacillota]	100	99.0	1.39e-69
CP192215.1_39|44688|45038|-1|ID=1_39;partial=00;start_type=ATG;rbs_motif=AGGAG;rbs_spacer=5-10bp;gc_cont=0.365	WP_000849672.1 MULTISPECIES: SAUGI family uracil-DNA glycosylase inhibitor [Bacteria]	100	99.1	6.26e-79
CP192215.1_40|45560|47188|-1|ID=1_40;partial=00;start_type=ATG;rbs_motif=AGGA;rbs_spacer=5-10bp;gc_cont=0.349	WP_001186608.1 MULTISPECIES: cassette chromosome recombinase CcrB [Bacillota]	100	99.8	0.0
CP192215.1_41|47210|48559|-1|ID=1_41;partial=00;start_type=ATG;rbs_motif=AGGAG;rbs_spacer=5-10bp;gc_cont=0.347	WP_000815638.1 MULTISPECIES: cassette chromosome recombinase CcrA [Staphylococcus]	100	99.8	0.0
CP192215.1_42|48793|50586|-1|ID=1_42;partial=00;start_type=ATG;rbs_motif=AGGAG;rbs_spacer=5-10bp;gc_cont=0.343	WP_000195099.1 MULTISPECIES: cassette chromosome replicative helicase [Staphylococcus]	100	99.8	0.0
CP192215.1_43|50586|50882|-1|ID=1_43;partial=00;start_type=ATG;rbs_motif=GGAG/GAGG;rbs_spacer=5-10bp;gc_cont=0.357	WP_000221966.1 MULTISPECIES: cassette chromosome ssDNA-binding protein [Staphylococcus]	100	99.0	2.28e-68
CP192215.1_44|51054|52637|1|ID=1_44;partial=00;start_type=GTG;rbs_motif=GGAG/GAGG;rbs_spacer=5-10bp;gc_cont=0.252	WP_061738127.1 hypothetical protein [Staphylococcus aureus]	100	99.8	0.0
CP192215.1_45|52709|53641|1|ID=1_45;partial=00;start_type=ATG;rbs_motif=GGA/GAG/AGG;rbs_spacer=5-10bp;gc_cont=0.230	WP_000364405.1 MULTISPECIES: hypothetical protein [Staphylococcus]	100	99.7	1.29e-221
CP192215.1_46|54067|54444|1|ID=1_46;partial=00;start_type=GTG;rbs_motif=None;rbs_spacer=None;gc_cont=0.235	WP_000687965.1 MULTISPECIES: hypothetical protein [Staphylococcus]	100	99.2	9.66e-85
CP192215.1_47|54913|55410|1|ID=1_47;partial=00;start_type=ATG;rbs_motif=GGAG/GAGG;rbs_spacer=5-10bp;gc_cont=0.275	WP_000051479.1 MULTISPECIES: hypothetical protein [Staphylococcus]	100	99.4	2.24e-91
CP192215.1_48|55606|56877|1|ID=1_48;partial=00;start_type=ATG;rbs_motif=GGAG/GAGG;rbs_spacer=5-10bp;gc_cont=0.277	WP_000368661.1 Pycsar phage resistance system cytidylate cyclase PycC [Staphylococcus aureus]	100	99.8	1.29e-310
CP192215.1_49|56883|57359|1|ID=1_49;partial=00;start_type=GTG;rbs_motif=GGAG/GAGG;rbs_spacer=5-10bp;gc_cont=0.243	WP_001670222.1 MULTISPECIES: Pycsar system effector family protein [Staphylococcus]	100	99.4	1.64e-101
CP192215.1_50|57398|58912|1|ID=1_50;partial=00;start_type=ATG;rbs_motif=AGGA/GGAG/GAGG;rbs_spacer=11-12bp;gc_cont=0.339	WP_000190897.1 MULTISPECIES: class I SAM-dependent DNA methyltransferase [Staphylococcus]	100	99.8	0.0
CP192215.1_51|58902|60134|1|ID=1_51;partial=00;start_type=ATG;rbs_motif=GGAG/GAGG;rbs_spacer=5-10bp;gc_cont=0.274	WP_000394002.1 MULTISPECIES: restriction endonuclease subunit S [Staphylococcus]	100	99.8	4.15e-289
CP192215.1_52|60118|63246|1|ID=1_52;partial=00;start_type=ATG;rbs_motif=GGAG/GAGG;rbs_spacer=5-10bp;gc_cont=0.337	WP_000577171.1 MULTISPECIES: type I restriction endonuclease subunit R [Staphylococcus]	100	99.9	0.0
CP192215.1_53|63359|64066|1|ID=1_53;partial=00;start_type=ATG;rbs_motif=AGGAG;rbs_spacer=5-10bp;gc_cont=0.258	WP_000667078.1 MULTISPECIES: hypothetical protein [Staphylococcus]	100	99.6	4.29e-153
CP192215.1_54|64059|64526|1|ID=1_54;partial=00;start_type=ATG;rbs_motif=AGGA;rbs_spacer=5-10bp;gc_cont=0.209	WP_000575287.1 MULTISPECIES: hypothetical protein [Staphylococcus]	100	99.4	1.79e-108
CP192215.1_55|64789|65346|-1|ID=1_55;partial=00;start_type=ATG;rbs_motif=GGAG/GAGG;rbs_spacer=5-10bp;gc_cont=0.292	WP_000633422.1 MULTISPECIES: DUF4811 domain-containing protein [Staphylococcus]	100	99.5	6.15e-126
CP192215.1_56|65348|66865|-1|ID=1_56;partial=00;start_type=ATG;rbs_motif=AGGAG;rbs_spacer=5-10bp;gc_cont=0.337	WP_000107170.1 MULTISPECIES: MDR family MFS transporter [Staphylococcus]	100	99.8	0.0
CP192215.1_57|67013|67585|1|ID=1_57;partial=00;start_type=ATG;rbs_motif=AGGAG;rbs_spacer=5-10bp;gc_cont=0.281	WP_000540837.1 MULTISPECIES: TetR/AcrR family transcriptional regulator [Staphylococcus]	100	99.5	5.66e-129
CP192215.1_58|67652|68638|-1|ID=1_58;partial=00;start_type=ATG;rbs_motif=None;rbs_spacer=None;gc_cont=0.387	WP_000662036.1 MULTISPECIES: tRNA dihydrouridine synthase [Staphylococcus]	100	99.7	1.88e-239
CP192215.1_59|68947|69150|1|ID=1_59;partial=00;start_type=ATG;rbs_motif=GGA/GAG/AGG;rbs_spacer=5-10bp;gc_cont=0.275	WP_000389764.1 MULTISPECIES: DUF6007 family protein [Staphylococcus]	100	98.5	6.83e-38
CP192215.1_60|69199|69495|1|ID=1_60;partial=00;start_type=ATG;rbs_motif=AGGAG;rbs_spacer=5-10bp;gc_cont=0.327	WP_000201639.1 MULTISPECIES: TfoX/Sxy family protein [Staphylococcus]	100	99.0	8.64e-64
CP192215.1_61|69559|70779|-1|ID=1_61;partial=00;start_type=ATG;rbs_motif=GGA/GAG/AGG;rbs_spacer=5-10bp;gc_cont=0.292	WP_000130758.1 MULTISPECIES: MFS transporter [Staphylococcus]	100	99.8	1.24e-272
CP192215.1_62|70772|71323|-1|ID=1_62;partial=00;start_type=ATG;rbs_motif=AGGAG;rbs_spacer=5-10bp;gc_cont=0.310	WP_000627029.1 MULTISPECIES: flavodoxin family protein [Staphylococcus]	100	99.5	9.51e-129
CP192215.1_63|71412|72296|1|ID=1_63;partial=00;start_type=GTG;rbs_motif=AGGA;rbs_spacer=5-10bp;gc_cont=0.286	WP_031926405.1 LysR family transcriptional regulator [Staphylococcus aureus]	98.6	99.3	1.71e-198
CP192215.1_64|72650|73183|-1|ID=1_64;partial=00;start_type=ATG;rbs_motif=AGxAGG/AGGxGG;rbs_spacer=5-10bp;gc_cont=0.262	WP_000543162.1 MULTISPECIES: DUF4865 family protein [Staphylococcus]	100	99.4	2.35e-126
CP192215.1_65|73274|74017|1|ID=1_65;partial=00;start_type=GTG;rbs_motif=None;rbs_spacer=None;gc_cont=0.263	WP_014667668.1 LysR family transcriptional regulator [Staphylococcus aureus]	100	99.6	8.74e-168
CP192215.1_66|74248|74667|-1|ID=1_66;partial=00;start_type=ATG;rbs_motif=GGAG/GAGG;rbs_spacer=5-10bp;gc_cont=0.312	WP_000039763.1 MULTISPECIES: DUF1433 domain-containing protein [Staphylococcus]	100	99.3	3.61e-89
CP192215.1_67|75211|75813|1|ID=1_67;partial=00;start_type=ATG;rbs_motif=GGA/GAG/AGG;rbs_spacer=5-10bp;gc_cont=0.299	WP_000908952.1 MULTISPECIES: hypothetical protein [Staphylococcus]	100	99.5	1.26e-130
CP192215.1_68|76080|79232|1|ID=1_68;partial=00;start_type=ATG;rbs_motif=GGA/GAG/AGG;rbs_spacer=5-10bp;gc_cont=0.314	WP_000080558.1 MULTISPECIES: DEAD/DEAH box helicase [Staphylococcus]	100	99.9	0.0
CP192215.1_69|79307|79789|1|ID=1_69;partial=00;start_type=ATG;rbs_motif=AGGA/GGAG/GAGG;rbs_spacer=11-12bp;gc_cont=0.315	WP_000714379.1 MULTISPECIES: hypothetical protein [Staphylococcus]	100	99.4	3.29e-102
CP192215.1_70|79996|81192|1|ID=1_70;partial=00;start_type=ATG;rbs_motif=AGGAG(G)/GGAGG;rbs_spacer=13-15bp;gc_cont=0.297	WP_142386501.1 IS21 family transposase [Staphylococcus aureus]	100	99.7	1.24e-293
CP192215.1_71|81204|81971|1|ID=1_71;partial=00;start_type=ATG;rbs_motif=AGGAG;rbs_spacer=5-10bp;gc_cont=0.266	WP_001095317.1 MULTISPECIES: IS21-like element helper ATPase IstB [Bacilli]	100	99.6	4.03e-177
CP192215.1_72|82174|83160|1|ID=1_72;partial=00;start_type=ATG;rbs_motif=AGxAG;rbs_spacer=5-10bp;gc_cont=0.334	WP_000710558.1 MULTISPECIES: phosphatidylinositol-specific phospholipase C [Staphylococcus]	100	99.7	1.27e-237
CP192215.1_73|83380|84150|1|ID=1_73;partial=00;start_type=ATG;rbs_motif=GGA/GAG/AGG;rbs_spacer=5-10bp;gc_cont=0.307	WP_000977806.1 MULTISPECIES: tandem-type lipoprotein [Staphylococcus]	100	99.6	1.93e-180
CP192215.1_74|84218|84985|1|ID=1_74;partial=00;start_type=ATG;rbs_motif=GGA/GAG/AGG;rbs_spacer=5-10bp;gc_cont=0.307	WP_000977793.1 MULTISPECIES: tandem-type lipoprotein [Staphylococcus]	100	99.6	7.85e-182
CP192215.1_75|85083|87320|1|ID=1_75;partial=00;start_type=ATG;rbs_motif=GGAG/GAGG;rbs_spacer=5-10bp;gc_cont=0.338	WP_001188482.1 MULTISPECIES: transcriptional regulator AryK [Staphylococcus]	100	99.9	0.0
CP192215.1_76|87471|88649|1|ID=1_76;partial=00;start_type=ATG;rbs_motif=AGGAG;rbs_spacer=5-10bp;gc_cont=0.375	WP_001075821.1 MULTISPECIES: M20 family metallopeptidase [Staphylococcus]	100	99.7	1.61e-286
CP192215.1_77|88651|90039|1|ID=1_77;partial=00;start_type=ATG;rbs_motif=AGGAG;rbs_spacer=5-10bp;gc_cont=0.371	WP_001006425.1 MULTISPECIES: multidrug efflux MFS transporter NorC [Staphylococcus]	100	99.8	4.05e-311
CP192215.1_78|90526|92193|-1|ID=1_78;partial=00;start_type=ATG;rbs_motif=GGAG/GAGG;rbs_spacer=5-10bp;gc_cont=0.360	WP_001791319.1 MULTISPECIES: Na/Pi cotransporter family protein [Staphylococcus]	100	99.5	0.0
CP192215.1_79|92514|94289|-1|ID=1_79;partial=00;start_type=ATG;rbs_motif=AGGA;rbs_spacer=5-10bp;gc_cont=0.354	WP_001670226.1 MULTISPECIES: oleate hydratase [Staphylococcus]	100	99.8	0.0
CP192215.1_80|94640|95113|1|ID=1_80;partial=00;start_type=ATG;rbs_motif=GGAG/GAGG;rbs_spacer=5-10bp;gc_cont=0.300	WP_000036335.1 MULTISPECIES: DUF1648 domain-containing protein [Staphylococcus]	100	99.4	7.26e-109
CP192215.1_81|95375|96967|1|ID=1_81;partial=00;start_type=ATG;rbs_motif=GGAG/GAGG;rbs_spacer=5-10bp;gc_cont=0.345	WP_248313609.1 L-lactate permease [Staphylococcus aureus]	100	99.8	0.0
CP192215.1_82|97296|99002|-1|ID=1_82;partial=00;start_type=ATG;rbs_motif=None;rbs_spacer=None;gc_cont=0.387	WP_047230654.1 staphylococcal protein A [Staphylococcus aureus]	100	99.8	3.34e-273
CP192215.1_83|99387|100139|-1|ID=1_83;partial=00;start_type=ATG;rbs_motif=AGGAG;rbs_spacer=5-10bp;gc_cont=0.275	WP_000876756.1 MULTISPECIES: HTH-type transcriptional regulator SarS [Staphylococcus]	100	99.6	3.84e-168
CP192215.1_84|100507|101505|-1|ID=1_84;partial=00;start_type=ATG;rbs_motif=AGGA/GGAG/GAGG;rbs_spacer=11-12bp;gc_cont=0.367	WP_000136638.1 MULTISPECIES: staphyloferrin B ABC transporter permease subunit SirC [Staphylococcus]	100	99.7	4.91e-212
CP192215.1_85|101502|102497|-1|ID=1_85;partial=00;start_type=ATG;rbs_motif=AGGAG;rbs_spacer=5-10bp;gc_cont=0.396	WP_000924999.1 MULTISPECIES: staphyloferrin B ABC transporter permease subunit SirB [Staphylococcus]	100	99.7	1.77e-209
CP192215.1_86|102513|103505|-1|ID=1_86;partial=00;start_type=ATG;rbs_motif=AGGA/GGAG/GAGG;rbs_spacer=11-12bp;gc_cont=0.324	WP_001045111.1 MULTISPECIES: staphyloferrin B ABC transporter substrate-binding protein SirA [Staphylococcus]	100	99.7	1.25e-229
CP192215.1_87|103736|104716|1|ID=1_87;partial=00;start_type=TTG;rbs_motif=AGGAG;rbs_spacer=5-10bp;gc_cont=0.368	WP_000570808.1 MULTISPECIES: 2,3-diaminopropionate biosynthesis protein SbnA [Staphylococcus]	100	99.7	1.27e-236
CP192215.1_88|104713|105723|1|ID=1_88;partial=00;start_type=ATG;rbs_motif=AGGAG;rbs_spacer=5-10bp;gc_cont=0.375	WP_001078456.1 MULTISPECIES: N-[(2S)-2-amino-2-carboxyethyl]-L-glutamate dehydrogenase SbnB [Staphylococcus]	100	99.7	9.37e-244
CP192215.1_89|105744|107498|1|ID=1_89;partial=00;start_type=TTG;rbs_motif=GGAG/GAGG;rbs_spacer=5-10bp;gc_cont=0.354	WP_001179389.1 MULTISPECIES: staphyloferrin B biosynthesis protein SbnC [Staphylococcus]	100	99.8	0.0
CP192215.1_90|107491|108747|1|ID=1_90;partial=00;start_type=ATG;rbs_motif=None;rbs_spacer=None;gc_cont=0.388	WP_000610056.1 MULTISPECIES: staphyloferrin B export MFS transporter [Staphylococcus]	100	99.8	5.01e-285
CP192215.1_91|108737|110473|1|ID=1_91;partial=00;start_type=GTG;rbs_motif=None;rbs_spacer=None;gc_cont=0.362	WP_001179873.1 MULTISPECIES: L-2,3-diaminopropanoate--citrate ligase SbnE [Staphylococcus]	100	99.8	0.0
CP192215.1_92|110454|112232|1|ID=1_92;partial=00;start_type=GTG;rbs_motif=AGGAG;rbs_spacer=5-10bp;gc_cont=0.358	WP_084990243.1 3-(L-alanin-3-ylcarbamoyl)-2-[(2-aminoethylcarbamoyl)methyl]-2-hydroxypropanoate synthase SbnF [Staphylococcus aureus]	100	99.7	0.0
CP192215.1_93|112204|112983|1|ID=1_93;partial=00;start_type=ATG;rbs_motif=AGGAG;rbs_spacer=5-10bp;gc_cont=0.400	WP_001186801.1 MULTISPECIES: staphyloferrin B biosynthesis citrate synthase SbnG [Staphylococcus]	100	99.2	9.53e-180
CP192215.1_94|112983|114185|1|ID=1_94;partial=00;start_type=ATG;rbs_motif=GGA/GAG/AGG;rbs_spacer=5-10bp;gc_cont=0.366	WP_001223706.1 MULTISPECIES: staphyloferrin B biosynthesis decarboxylase SbnH [Staphylococcus]	100	99.8	2.97e-302
CP192215.1_95|114189|114953|1|ID=1_95;partial=00;start_type=TTG;rbs_motif=AGGA;rbs_spacer=5-10bp;gc_cont=0.374	WP_001015553.1 bifunctional transcriptional regulator/O-phospho-L-serine synthase SbnI [Staphylococcus aureus]	100	99.6	8.58e-192
CP192215.1_96|115149|115556|1|ID=1_96;partial=00;start_type=ATG;rbs_motif=GGA/GAG/AGG;rbs_spacer=5-10bp;gc_cont=0.301	WP_000094900.1 MULTISPECIES: hypothetical protein [Staphylococcus]	100	99.3	5.60e-82
CP192215.1_97|115606|116232|1|ID=1_97;partial=00;start_type=ATG;rbs_motif=GGA/GAG/AGG;rbs_spacer=5-10bp;gc_cont=0.317	WP_000414630.1 MULTISPECIES: MFS transporter [Staphylococcus]	100	99.5	7.43e-127
CP192215.1_98|116443|117219|1|ID=1_98;partial=00;start_type=ATG;rbs_motif=AGGAG;rbs_spacer=5-10bp;gc_cont=0.407	WP_117179539.1 (S)-acetoin forming diacetyl reductase [Staphylococcus aureus]	99.6	99.6	1.31e-163
CP192215.1_99|117564|118541|1|ID=1_99;partial=00;start_type=TTG;rbs_motif=GGAG/GAGG;rbs_spacer=5-10bp;gc_cont=0.315	WP_075583741.1 MULTISPECIES: NAD-dependent epimerase/dehydratase family protein [Staphylococcus]	99.7	99.7	1.03e-233
CP192215.1_100|118498|119190|1|ID=1_100;partial=00;start_type=TTG;rbs_motif=GGAG/GAGG;rbs_spacer=5-10bp;gc_cont=0.339	WP_000736081.1 MULTISPECIES: sugar transferase [Staphylococcus]	100	99.6	5.74e-160
CP192215.1_101|119400|120566|1|ID=1_101;partial=00;start_type=TTG;rbs_motif=GGA/GAG/AGG;rbs_spacer=11-12bp;gc_cont=0.339	WP_000692506.1 MULTISPECIES: glycosyltransferase family 4 protein [Staphylococcus]	100	99.7	1.21e-279
CP192215.1_102|120547|121785|1|ID=1_102;partial=00;start_type=ATG;rbs_motif=GGA/GAG/AGG;rbs_spacer=11-12bp;gc_cont=0.302	WP_000431248.1 MULTISPECIES: O-antigen ligase family protein [Staphylococcus]	100	99.8	2.07e-274
CP192215.1_103|121775|123205|1|ID=1_103;partial=00;start_type=ATG;rbs_motif=GGA/GAG/AGG;rbs_spacer=5-10bp;gc_cont=0.317	WP_000834099.1 MULTISPECIES: oligosaccharide flippase family protein [Staphylococcus]	100	99.8	1.31e-314
CP192215.1_104|123473|124072|1|ID=1_104;partial=00;start_type=ATG;rbs_motif=AGGAG;rbs_spacer=5-10bp;gc_cont=0.353	WP_000874681.1 MULTISPECIES: superoxide dismutase [Staphylococcus]	100	99.5	2.49e-150
CP192215.1_105|124415|125170|-1|ID=1_105;partial=00;start_type=ATG;rbs_motif=None;rbs_spacer=None;gc_cont=0.357	WP_001793808.1 MULTISPECIES: GntR family transcriptional regulator [Staphylococcus]	100	99.6	1.66e-183
CP192215.1_106|125406|126113|1|ID=1_106;partial=00;start_type=ATG;rbs_motif=GGAG/GAGG;rbs_spacer=5-10bp;gc_cont=0.380	WP_000843292.1 MULTISPECIES: purine-nucleoside phosphorylase [Staphylococcus]	100	99.6	5.75e-167
CP192215.1_107|126114|127472|1|ID=1_107;partial=00;start_type=ATG;rbs_motif=None;rbs_spacer=None;gc_cont=0.316	WP_001100293.1 MULTISPECIES: tetracycline efflux MFS transporter Tet(38) [Staphylococcus]	100	99.3	2.84e-294
CP192215.1_108|127553|128215|1|ID=1_108;partial=00;start_type=ATG;rbs_motif=AGGAG;rbs_spacer=5-10bp;gc_cont=0.397	WP_000667293.1 deoxyribose-phosphate aldolase [Staphylococcus aureus]	100	99.5	1.20e-147
CP192215.1_109|128243|129421|1|ID=1_109;partial=00;start_type=ATG;rbs_motif=GGAG/GAGG;rbs_spacer=5-10bp;gc_cont=0.370	WP_000197806.1 MULTISPECIES: phosphopentomutase [Staphylococcus]	100	99.7	4.49e-293
CP192215.1_110|129552|130367|-1|ID=1_110;partial=00;start_type=ATG;rbs_motif=AGGA/GGAG/GAGG;rbs_spacer=11-12bp;gc_cont=0.369	WP_000191092.1 MULTISPECIES: phosphonate ABC transporter, permease protein PhnE [Staphylococcus]	100	99.6	8.33e-178
CP192215.1_111|130364|131164|-1|ID=1_111;partial=00;start_type=ATG;rbs_motif=AGGAG;rbs_spacer=5-10bp;gc_cont=0.342	WP_103246361.1 phosphonate ABC transporter, permease protein PhnE [Staphylococcus aureus]	100	99.6	3.99e-178
CP192215.1_112|131166|131939|-1|ID=1_112;partial=00;start_type=ATG;rbs_motif=GGA/GAG/AGG;rbs_spacer=5-10bp;gc_cont=0.351	WP_000078092.1 MULTISPECIES: phosphonate ABC transporter ATP-binding protein [Staphylococcus]	100	99.6	6.96e-179
CP192215.1_113|132153|133109|-1|ID=1_113;partial=00;start_type=ATG;rbs_motif=GGA/GAG/AGG;rbs_spacer=5-10bp;gc_cont=0.307	WP_000787672.1 MULTISPECIES: phosphate/phosphite/phosphonate ABC transporter substrate-binding protein [Staphylococcus]	100	99.7	7.39e-216
CP192215.1_114|133338|134882|1|ID=1_114;partial=00;start_type=ATG;rbs_motif=AGGAG;rbs_spacer=5-10bp;gc_cont=0.371	WP_279750509.1 DNA-binding protein [Staphylococcus aureus]	99.8	99.8	0.0
CP192215.1_115|134933|136468|1|ID=1_115;partial=00;start_type=ATG;rbs_motif=AGGAG;rbs_spacer=5-10bp;gc_cont=0.366	WP_000065047.1 MULTISPECIES: bifunctional metallophosphatase/5'-nucleotidase [Staphylococcus]	100	99.8	0.0
CP192215.1_116|136649|137134|1|ID=1_116;partial=00;start_type=ATG;rbs_motif=AGGAG;rbs_spacer=5-10bp;gc_cont=0.298	WP_000093392.1 MULTISPECIES: IS200/IS605 family transposase [Bacilli]	100	99.4	2.72e-115
CP192215.1_117|137303|137497|1|ID=1_117;partial=00;start_type=ATG;rbs_motif=None;rbs_spacer=None;gc_cont=0.221	WP_031904760.1 ImmA/IrrE family metallo-endopeptidase, partial [Staphylococcus aureus]	100	98.5	4.39e-36
CP192215.1_118|137883|140492|1|ID=1_118;partial=00;start_type=ATG;rbs_motif=AGGAG;rbs_spacer=5-10bp;gc_cont=0.361	WP_000955775.1 MULTISPECIES: bifunctional acetaldehyde-CoA/alcohol dehydrogenase [Staphylococcus]	100	99.9	0.0
CP192215.1_119|140759|141244|1|ID=1_119;partial=00;start_type=ATG;rbs_motif=AGGAG;rbs_spacer=5-10bp;gc_cont=0.296	WP_000093387.1 IS200/IS605 family transposase [Staphylococcus aureus]	100	99.4	7.80e-115
CP192215.1_120|141565|142233|1|ID=1_120;partial=00;start_type=ATG;rbs_motif=GGAG/GAGG;rbs_spacer=5-10bp;gc_cont=0.296	WP_041495544.1 capsular polysaccharide type 5/8 biosynthesis protein CapA [Staphylococcus aureus]	100	99.6	1.68e-139
CP192215.1_121|142249|142935|1|ID=1_121;partial=00;start_type=ATG;rbs_motif=AGGA/GGAG/GAGG;rbs_spacer=11-12bp;gc_cont=0.325	WP_000037319.1 MULTISPECIES: type 8 capsular polysaccharide synthesis protein Cap8B [Staphylococcus]	100	99.6	3.57e-153
CP192215.1_122|142938|143702|1|ID=1_122;partial=00;start_type=ATG;rbs_motif=GGAG/GAGG;rbs_spacer=5-10bp;gc_cont=0.318	WP_000565293.1 MULTISPECIES: type 8 capsular polysaccharide synthesis protein Cap8C [Staphylococcus]	100	99.6	7.29e-184
CP192215.1_123|143722|145545|1|ID=1_123;partial=00;start_type=ATG;rbs_motif=GGAG/GAGG;rbs_spacer=5-10bp;gc_cont=0.350	WP_000940774.1 MULTISPECIES: type 8 capsular polysaccharide synthesis protein Cap8D [Staphylococcus]	100	99.8	0.0
