CP192215.1_735|821053|821286|1|ID=1_735;partial=00;start_type=ATG;rbs_motif=GGAG/GAGG;rbs_spacer=5-10bp;gc_cont=0.303	WP_000556760.1 MULTISPECIES: preprotein translocase subunit SecG [Staphylococcus]	100	98.7	2.46e-40
CP192215.1_736|821402|822142|1|ID=1_736;partial=00;start_type=ATG;rbs_motif=GGAG/GAGG;rbs_spacer=5-10bp;gc_cont=0.337	WP_001165969.1 MULTISPECIES: alpha/beta hydrolase [Staphylococcus]	100	99.6	4.93e-178
CP192215.1_737|822176|824548|1|ID=1_737;partial=00;start_type=ATG;rbs_motif=AGGAG;rbs_spacer=5-10bp;gc_cont=0.343	WP_001050044.1 MULTISPECIES: ribonuclease R [Staphylococcus]	100	99.9	0.0
CP192215.1_738|824570|825034|1|ID=1_738;partial=00;start_type=ATG;rbs_motif=GGAG/GAGG;rbs_spacer=5-10bp;gc_cont=0.363	WP_001085185.1 MULTISPECIES: SsrA-binding protein SmpB [Staphylococcus]	100	99.4	1.53e-104
CP192215.1_739|825963|826691|-1|ID=1_739;partial=00;start_type=ATG;rbs_motif=AGGAG;rbs_spacer=5-10bp;gc_cont=0.272	WP_000757405.1 DUF5067 domain-containing protein [Staphylococcus aureus]	100	99.6	5.89e-143
CP192215.1_740|827289|827810|1|ID=1_740;partial=00;start_type=ATG;rbs_motif=GGA/GAG/AGG;rbs_spacer=11-12bp;gc_cont=0.282	WP_000608186.1 MULTISPECIES: hypothetical protein [Staphylococcus]	100	99.4	3.49e-117
CP192215.1_741|827949|828479|1|ID=1_741;partial=00;start_type=ATG;rbs_motif=AGGAG;rbs_spacer=5-10bp;gc_cont=0.347	WP_001167158.1 MULTISPECIES: GNAT family N-acetyltransferase [Staphylococcus]	100	99.4	3.34e-121
CP192215.1_742|828742|831555|1|ID=1_742;partial=00;start_type=ATG;rbs_motif=GGAG/GAGG;rbs_spacer=5-10bp;gc_cont=0.394	WP_430738929.1 MSCRAMM family adhesin clumping factor ClfA [Staphylococcus aureus]	100	99.9	0.0
CP192215.1_743|831776|833284|1|ID=1_743;partial=00;start_type=TTG;rbs_motif=AGGAG;rbs_spacer=5-10bp;gc_cont=0.307	WP_000791703.1 MULTISPECIES: von Willebrand factor binding protein Vwb [Staphylococcus]	100	99.8	0.0
CP192215.1_744|833637|834659|1|ID=1_744;partial=00;start_type=ATG;rbs_motif=AGGAG;rbs_spacer=5-10bp;gc_cont=0.318	WP_000728058.1 MULTISPECIES: extracellular matrix protein-binding adhesin Emp [Staphylococcus]	100	99.7	1.87e-236
CP192215.1_745|834989|835510|1|ID=1_745;partial=00;start_type=ATG;rbs_motif=AGGAG;rbs_spacer=5-10bp;gc_cont=0.312	WP_000824488.1 MULTISPECIES: hypothetical protein [Staphylococcus]	100	99.4	8.22e-116
CP192215.1_746|835851|836537|1|ID=1_746;partial=00;start_type=ATG;rbs_motif=GGAG/GAGG;rbs_spacer=5-10bp;gc_cont=0.341	WP_001670297.1 MULTISPECIES: thermonuclease family protein [Staphylococcus]	100	99.6	3.42e-151
CP192215.1_747|836894|837094|1|ID=1_747;partial=00;start_type=ATG;rbs_motif=GGAG/GAGG;rbs_spacer=5-10bp;gc_cont=0.398	WP_001059082.1 MULTISPECIES: cold-shock protein [Staphylococcus]	100	98.5	5.63e-41
CP192215.1_748|837590|837808|-1|ID=1_748;partial=00;start_type=ATG;rbs_motif=AGGA/GGAG/GAGG;rbs_spacer=11-12bp;gc_cont=0.320	WP_000005876.1 MULTISPECIES: hypothetical protein [Staphylococcus]	100	98.6	4.40e-43
CP192215.1_749|837870|838154|-1|ID=1_749;partial=00;start_type=TTG;rbs_motif=AGGAG;rbs_spacer=5-10bp;gc_cont=0.277	WP_001004395.1 MULTISPECIES: hypothetical protein [Staphylococcus]	100	98.9	1.07e-62
CP192215.1_750|838242|838811|-1|ID=1_750;partial=00;start_type=GTG;rbs_motif=AGGAG;rbs_spacer=5-10bp;gc_cont=0.311	WP_001106646.1 MULTISPECIES: lipoprotein N-acylation protein LnsA [Staphylococcus]	100	99.5	2.51e-136
CP192215.1_751|838999|839187|-1|ID=1_751;partial=00;start_type=ATG;rbs_motif=AGGAG;rbs_spacer=5-10bp;gc_cont=0.286	WP_000052076.1 MULTISPECIES: type II toxin-antitoxin system toxin TsaT [Staphylococcus]	100	98.4	8.47e-30
CP192215.1_752|839216|839476|-1|ID=1_752;partial=00;start_type=ATG;rbs_motif=GGA/GAG/AGG;rbs_spacer=5-10bp;gc_cont=0.249	WP_001059690.1 MULTISPECIES: type II toxin-antitoxin system antitoxin TsaA [Staphylococcaceae]	100	98.9	1.14e-49
CP192215.1_753|839798|840019|1|ID=1_753;partial=00;start_type=ATG;rbs_motif=None;rbs_spacer=None;gc_cont=0.333	WP_000145163.1 MULTISPECIES: sterile alpha motif-like domain-containing protein [Staphylococcus]	100	90.5	1.34e-41
CP192215.1_754|840016|840252|-1|ID=1_754;partial=00;start_type=ATG;rbs_motif=AGGAG;rbs_spacer=5-10bp;gc_cont=0.270	WP_000368687.1 MULTISPECIES: hypothetical protein [Staphylococcus]	100	98.7	4.14e-55
CP192215.1_755|840474|841058|1|ID=1_755;partial=00;start_type=TTG;rbs_motif=GGAG/GAGG;rbs_spacer=5-10bp;gc_cont=0.349	WP_001140696.1 MULTISPECIES: histidine phosphatase family protein [Staphylococcus]	99.5	99.0	3.16e-139
CP192215.1_756|841131|841748|-1|ID=1_756;partial=00;start_type=ATG;rbs_motif=None;rbs_spacer=None;gc_cont=0.307	WP_000255559.1 MULTISPECIES: LysE/ArgO family amino acid transporter [Staphylococcus]	100	99.5	2.06e-127
CP192215.1_757|841902|842396|-1|ID=1_757;partial=00;start_type=ATG;rbs_motif=AGGAG;rbs_spacer=5-10bp;gc_cont=0.293	WP_000590539.1 MULTISPECIES: GNAT family N-acetyltransferase [Staphylococcus]	100	99.4	2.31e-113
CP192215.1_758|842795|843217|-1|ID=1_758;partial=00;start_type=ATG;rbs_motif=AGGAG;rbs_spacer=5-10bp;gc_cont=0.364	WP_000974455.1 MULTISPECIES: organic hydroperoxide resistance protein [Staphylococcus]	100	99.3	1.53e-95
CP192215.1_759|843365|844081|1|ID=1_759;partial=00;start_type=ATG;rbs_motif=GGAG/GAGG;rbs_spacer=5-10bp;gc_cont=0.328	WP_000150015.1 MULTISPECIES: type I 3-dehydroquinate dehydratase [Staphylococcus]	100	99.6	1.15e-163
CP192215.1_760|844164|844703|1|ID=1_760;partial=00;start_type=ATG;rbs_motif=AGGAG;rbs_spacer=5-10bp;gc_cont=0.328	WP_000422908.1 MULTISPECIES: nitroreductase family protein [Staphylococcus]	100	99.4	4.93e-129
CP192215.1_761|844853|845173|-1|ID=1_761;partial=00;start_type=ATG;rbs_motif=AGGAG;rbs_spacer=5-10bp;gc_cont=0.343	WP_001147955.1 MULTISPECIES: thioredoxin family protein [Staphylococcus]	100	99.1	9.28e-74
CP192215.1_762|845317|845673|1|ID=1_762;partial=00;start_type=ATG;rbs_motif=AGGAGG;rbs_spacer=5-10bp;gc_cont=0.300	WP_000589552.1 MULTISPECIES: arsenate reductase family protein [Staphylococcus]	100	99.2	6.21e-80
CP192215.1_763|845831|846211|1|ID=1_763;partial=00;start_type=TTG;rbs_motif=AGGAG;rbs_spacer=5-10bp;gc_cont=0.341	WP_000290491.1 MULTISPECIES: glycine cleavage system protein GcvH [Staphylococcus]	100	99.2	1.37e-80
CP192215.1_764|846390|847268|1|ID=1_764;partial=00;start_type=ATG;rbs_motif=GGA/GAG/AGG;rbs_spacer=5-10bp;gc_cont=0.333	WP_000932209.1 MULTISPECIES: YwqG family protein [Staphylococcus]	100	99.7	9.40e-215
CP192215.1_765|847743|848129|1|ID=1_765;partial=00;start_type=ATG;rbs_motif=GGA/GAG/AGG;rbs_spacer=5-10bp;gc_cont=0.305	WP_001018962.1 MULTISPECIES: toprim domain-containing protein [Staphylococcus]	100	99.2	3.08e-87
CP192215.1_766|848122|848418|1|ID=1_766;partial=00;start_type=ATG;rbs_motif=None;rbs_spacer=None;gc_cont=0.279	WP_001065801.1 MULTISPECIES: thioredoxin family protein [Staphylococcus]	100	99.0	5.19e-65
CP192215.1_767|848669|849694|1|ID=1_767;partial=00;start_type=GTG;rbs_motif=GGAG/GAGG;rbs_spacer=5-10bp;gc_cont=0.347	WP_000571218.1 MULTISPECIES: methionine ABC transporter ATP-binding protein [Staphylococcus]	100	99.7	2.87e-236
CP192215.1_768|849687|850382|1|ID=1_768;partial=00;start_type=ATG;rbs_motif=GGAG/GAGG;rbs_spacer=5-10bp;gc_cont=0.351	WP_428701096.1 methionine ABC transporter permease [Staphylococcus aureus]	99.6	99.6	5.36e-129
CP192215.1_769|850400|851221|1|ID=1_769;partial=00;start_type=ATG;rbs_motif=None;rbs_spacer=None;gc_cont=0.300	WP_000732328.1 MULTISPECIES: MetQ/NlpA family ABC transporter substrate-binding protein [Staphylococcus]	100	99.6	3.59e-189
CP192215.1_770|851572|851766|1|ID=1_770;partial=00;start_type=ATG;rbs_motif=AGGAG;rbs_spacer=5-10bp;gc_cont=0.303	WP_000752917.1 MULTISPECIES: CsbD family protein [Bacillati]	100	98.5	3.63e-34
CP192215.1_771|852000|852851|-1|ID=1_771;partial=00;start_type=ATG;rbs_motif=AGGAG;rbs_spacer=5-10bp;gc_cont=0.333	WP_001183854.1 MULTISPECIES: DUF368 domain-containing protein [Staphylococcus]	100	99.6	7.63e-180
CP192215.1_772|853179|853940|1|ID=1_772;partial=00;start_type=ATG;rbs_motif=GGAG/GAGG;rbs_spacer=5-10bp;gc_cont=0.336	WP_103246363.1 Fe-S cluster assembly ATPase SufC [Staphylococcus aureus]	100	99.6	5.72e-176
CP192215.1_773|854038|855345|1|ID=1_773;partial=00;start_type=ATG;rbs_motif=AGGAG;rbs_spacer=5-10bp;gc_cont=0.345	WP_000205572.1 MULTISPECIES: Fe-S cluster assembly protein SufD [Staphylococcus]	100	99.8	1.06e-306
CP192215.1_774|855460|856701|1|ID=1_774;partial=00;start_type=GTG;rbs_motif=GGA/GAG/AGG;rbs_spacer=11-12bp;gc_cont=0.373	WP_435748666.1 cysteine desulfurase [Staphylococcus aureus]	96.6	99.8	4.32e-291
CP192215.1_775|856691|857155|1|ID=1_775;partial=00;start_type=ATG;rbs_motif=AGGAG;rbs_spacer=5-10bp;gc_cont=0.361	WP_001010508.1 MULTISPECIES: Fe-S cluster assembly sulfur transfer protein SufU [Staphylococcus]	100	99.4	1.26e-103
CP192215.1_776|857306|858703|1|ID=1_776;partial=00;start_type=ATG;rbs_motif=AGGAG;rbs_spacer=5-10bp;gc_cont=0.348	WP_001074405.1 MULTISPECIES: Fe-S cluster assembly protein SufB [Staphylococcus]	100	99.8	0.0
CP192215.1_777|859034|859156|-1|ID=1_777;partial=00;start_type=ATG;rbs_motif=None;rbs_spacer=None;gc_cont=0.252	WP_108631346.1 hypothetical protein, partial [Staphylococcus aureus]	100	97.6	8.01e-17
CP192215.1_778|859217|859348|-1|ID=1_778;partial=00;start_type=ATG;rbs_motif=AGGA;rbs_spacer=5-10bp;gc_cont=0.288	WP_102785951.1 hypothetical protein, partial [Staphylococcus aureus]	97.7	97.7	4.51e-19
CP192215.1_779|859714|860754|1|ID=1_779;partial=00;start_type=GTG;rbs_motif=AGGAG;rbs_spacer=5-10bp;gc_cont=0.327	WP_061842353.1 hemolysin family protein [Staphylococcus aureus]	97.4	99.7	9.33e-224
CP192215.1_780|860768|861835|1|ID=1_780;partial=00;start_type=ATG;rbs_motif=AGGAG;rbs_spacer=5-10bp;gc_cont=0.374	WP_000267252.1 MULTISPECIES: NAD(P)H-dependent flavin oxidoreductase [Staphylococcus]	100	99.7	4.68e-249
CP192215.1_781|862202|863068|1|ID=1_781;partial=00;start_type=ATG;rbs_motif=None;rbs_spacer=None;gc_cont=0.331	WP_000608129.1 MULTISPECIES: DUF72 domain-containing protein [Staphylococcus]	100	97.6	7.21e-211
CP192215.1_782|863081|863908|1|ID=1_782;partial=00;start_type=ATG;rbs_motif=GGAG/GAGG;rbs_spacer=5-10bp;gc_cont=0.318	WP_000927633.1 MULTISPECIES: sulfite exporter TauE/SafE family protein [Staphylococcus]	100	99.6	1.38e-178
CP192215.1_783|863935|865254|1|ID=1_783;partial=00;start_type=TTG;rbs_motif=AGGAG;rbs_spacer=5-10bp;gc_cont=0.336	WP_001241214.1 MULTISPECIES: bifunctional metallophosphatase/5'-nucleotidase [Staphylococcus]	100	99.8	0.0
CP192215.1_784|865284|866255|1|ID=1_784;partial=00;start_type=ATG;rbs_motif=GGA/GAG/AGG;rbs_spacer=11-12bp;gc_cont=0.358	WP_000201875.1 MULTISPECIES: lipoyl synthase [Staphylococcus]	100	94.1	1.67e-217
CP192215.1_785|866376|866768|1|ID=1_785;partial=00;start_type=GTG;rbs_motif=None;rbs_spacer=None;gc_cont=0.277	WP_000598445.1 MULTISPECIES: YutD family protein [Staphylococcus]	99.2	96.9	9.65e-89
CP192215.1_786|866847|867113|-1|ID=1_786;partial=00;start_type=ATG;rbs_motif=AGGAG;rbs_spacer=5-10bp;gc_cont=0.318	WP_000566649.1 MULTISPECIES: DUF3055 domain-containing protein [Staphylococcus]	100	98.9	1.52e-57
CP192215.1_787|867211|867645|1|ID=1_787;partial=00;start_type=ATG;rbs_motif=GGAG/GAGG;rbs_spacer=5-10bp;gc_cont=0.301	WP_000273979.1 MULTISPECIES: DUF86 domain-containing protein [Staphylococcus]	100	99.3	9.10e-99
CP192215.1_788|867645|868430|1|ID=1_788;partial=00;start_type=ATG;rbs_motif=AGGAG;rbs_spacer=5-10bp;gc_cont=0.350	WP_000816183.1 MULTISPECIES: TIGR01457 family HAD-type hydrolase [Staphylococcus]	100	99.6	3.59e-183
CP192215.1_789|868457|869416|1|ID=1_789;partial=00;start_type=TTG;rbs_motif=GGA/GAG/AGG;rbs_spacer=5-10bp;gc_cont=0.342	WP_052997536.1 2-hydroxyacid dehydrogenase [Staphylococcus aureus]	100	99.7	1.07e-229
CP192215.1_790|869829|869981|1|ID=1_790;partial=00;start_type=ATG;rbs_motif=GGAG/GAGG;rbs_spacer=5-10bp;gc_cont=0.261	WP_000837752.1 MULTISPECIES: teichoic acid D-Ala incorporation-associated protein DltX [Staphylococcus]	100	98.0	1.80e-28
CP192215.1_791|869997|871454|1|ID=1_791;partial=00;start_type=ATG;rbs_motif=GGAG/GAGG;rbs_spacer=5-10bp;gc_cont=0.341	WP_000129647.1 MULTISPECIES: D-alanine--poly(phosphoribitol) ligase subunit DltA [Staphylococcus]	100	99.8	0.0
CP192215.1_792|871451|872665|1|ID=1_792;partial=00;start_type=ATG;rbs_motif=GGAG/GAGG;rbs_spacer=5-10bp;gc_cont=0.303	WP_000613541.1 MULTISPECIES: PG:teichoic acid D-alanyltransferase DltB [Staphylococcus]	100	99.8	7.77e-291
CP192215.1_793|872683|872919|1|ID=1_793;partial=00;start_type=ATG;rbs_motif=AGGAG;rbs_spacer=5-10bp;gc_cont=0.295	WP_000395692.1 MULTISPECIES: D-alanine--poly(phosphoribitol) ligase subunit 2 [Staphylococcus]	100	98.7	4.19e-46
CP192215.1_794|872916|874091|1|ID=1_794;partial=00;start_type=ATG;rbs_motif=GGA/GAG/AGG;rbs_spacer=5-10bp;gc_cont=0.321	WP_000769423.1 MULTISPECIES: D-alanyl-lipoteichoic acid biosynthesis protein DltD [Staphylococcus]	100	99.7	8.27e-284
CP192215.1_795|874349|874591|-1|ID=1_795;partial=00;start_type=ATG;rbs_motif=AGGAG;rbs_spacer=5-10bp;gc_cont=0.399	WP_001141883.1 MULTISPECIES: NifU family protein [Staphylococcus]	100	98.8	3.13e-51
CP192215.1_796|874692|875015|1|ID=1_796;partial=00;start_type=ATG;rbs_motif=GGA/GAG/AGG;rbs_spacer=5-10bp;gc_cont=0.309	WP_000401414.1 MULTISPECIES: YuzD family protein [Staphylococcus]	100	99.1	1.17e-72
CP192215.1_797|875074|876138|-1|ID=1_797;partial=00;start_type=ATG;rbs_motif=GGA/GAG/AGG;rbs_spacer=11-12bp;gc_cont=0.365	WP_000794020.1 MULTISPECIES: NAD(P)/FAD-dependent oxidoreductase [Staphylococcus]	100	99.7	1.17e-262
CP192215.1_798|876454|876690|1|ID=1_798;partial=00;start_type=ATG;rbs_motif=GGA/GAG/AGG;rbs_spacer=5-10bp;gc_cont=0.350	WP_001068337.1 MULTISPECIES: YuzB family protein [Staphylococcus]	100	98.7	4.85e-54
CP192215.1_799|876703|877062|1|ID=1_799;partial=00;start_type=ATG;rbs_motif=AGGAG;rbs_spacer=5-10bp;gc_cont=0.372	WP_001143493.1 MULTISPECIES: HesB/IscA family protein [Staphylococcus]	100	99.2	4.89e-82
CP192215.1_800|877516|878724|1|ID=1_800;partial=00;start_type=ATG;rbs_motif=GGA/GAG/AGG;rbs_spacer=5-10bp;gc_cont=0.357	WP_000046076.1 MULTISPECIES: NAD(P)/FAD-dependent oxidoreductase [Staphylococcus]	100	99.8	1.10e-289
CP192215.1_801|878855|880330|1|ID=1_801;partial=00;start_type=ATG;rbs_motif=AGGAG;rbs_spacer=5-10bp;gc_cont=0.339	WP_001009688.1 MULTISPECIES: M17 family metallopeptidase [Staphylococcus]	100	99.8	0.0
CP192215.1_802|880741|882057|1|ID=1_802;partial=00;start_type=ATG;rbs_motif=AGGA;rbs_spacer=5-10bp;gc_cont=0.330	WP_000606335.1 MULTISPECIES: Na+/H+ antiporter family protein [Staphylococcus]	100	99.8	1.47e-294
CP192215.1_803|882076|882450|1|ID=1_803;partial=00;start_type=ATG;rbs_motif=GGAG/GAGG;rbs_spacer=5-10bp;gc_cont=0.331	WP_000149294.1 MULTISPECIES: PaaI family thioesterase [Staphylococcus]	100	99.2	1.81e-84
CP192215.1_804|882506|883660|-1|ID=1_804;partial=00;start_type=ATG;rbs_motif=GGAG/GAGG;rbs_spacer=5-10bp;gc_cont=0.344	WP_000558757.1 MULTISPECIES: FAD/NAD(P)-binding protein [Staphylococcus]	100	99.7	2.57e-288
CP192215.1_805|883909|884265|-1|ID=1_805;partial=00;start_type=ATG;rbs_motif=GGA/GAG/AGG;rbs_spacer=5-10bp;gc_cont=0.325	WP_000590451.1 MULTISPECIES: Na+/H+ antiporter Mnh1 subunit G [Staphylococcus]	100	99.2	1.35e-65
CP192215.1_806|884243|884536|-1|ID=1_806;partial=00;start_type=ATG;rbs_motif=AGxAGG/AGGxGG;rbs_spacer=5-10bp;gc_cont=0.320	WP_001016306.1 MULTISPECIES: Na+/H+ antiporter Mnh1 subunit F [Staphylococcus]	100	99.0	1.24e-49
CP192215.1_807|884536|885015|-1|ID=1_807;partial=00;start_type=ATG;rbs_motif=AGGAG;rbs_spacer=5-10bp;gc_cont=0.296	WP_000290674.1 MULTISPECIES: Na+/H+ antiporter Mnh1 subunit E [Staphylococcus]	100	99.4	1.02e-100
CP192215.1_808|885017|886513|-1|ID=1_808;partial=00;start_type=ATG;rbs_motif=AGGAG;rbs_spacer=5-10bp;gc_cont=0.337	WP_000573077.1 MULTISPECIES: Na+/H+ antiporter Mnh1 subunit D [Staphylococcus]	100	99.8	0.0
CP192215.1_809|886506|886835|-1|ID=1_809;partial=00;start_type=ATG;rbs_motif=GGA/GAG/AGG;rbs_spacer=5-10bp;gc_cont=0.348	WP_011443624.1 Na+/H+ antiporter Mnh1 subunit C [Staphylococcus aureus]	100	99.1	1.16e-64
CP192215.1_810|886847|887275|-1|ID=1_810;partial=00;start_type=ATG;rbs_motif=GGAG/GAGG;rbs_spacer=5-10bp;gc_cont=0.343	WP_001081626.1 MULTISPECIES: Na+/H+ antiporter Mnh1 subunit B [Staphylococcus]	100	99.3	4.90e-93
CP192215.1_811|887268|889673|-1|ID=1_811;partial=00;start_type=GTG;rbs_motif=AGGAG;rbs_spacer=5-10bp;gc_cont=0.334	WP_000054604.1 MULTISPECIES: Na+/H+ antiporter Mnh1 subunit A [Staphylococcus]	100	99.9	0.0
CP192215.1_812|889804|890187|-1|ID=1_812;partial=00;start_type=ATG;rbs_motif=GGAG/GAGG;rbs_spacer=5-10bp;gc_cont=0.341	WP_000781162.1 MULTISPECIES: kinase-associated lipoprotein B [Staphylococcus]	100	99.2	1.53e-82
CP192215.1_813|890251|890844|1|ID=1_813;partial=00;start_type=ATG;rbs_motif=GGAG/GAGG;rbs_spacer=5-10bp;gc_cont=0.350	WP_000035058.1 MULTISPECIES: peptidylprolyl isomerase [Staphylococcus]	100	99.5	3.15e-143
CP192215.1_814|891293|891637|1|ID=1_814;partial=00;start_type=GTG;rbs_motif=None;rbs_spacer=None;gc_cont=0.328	WP_001788532.1 S1 domain-containing post-transcriptional regulator Ygs [Staphylococcus aureus]	99.1	99.1	2.89e-74
CP192215.1_815|891999|893126|1|ID=1_815;partial=00;start_type=ATG;rbs_motif=AGGAG;rbs_spacer=5-10bp;gc_cont=0.371	WP_000838036.1 MULTISPECIES: NADH-dependent flavin oxidoreductase [Staphylococcus]	100	99.7	6.68e-275
CP192215.1_816|893434|894624|1|ID=1_816;partial=00;start_type=ATG;rbs_motif=GGAG/GAGG;rbs_spacer=5-10bp;gc_cont=0.358	WP_000167314.1 MULTISPECIES: ornithine--oxo-acid transaminase [Staphylococcus]	100	99.7	4.33e-293
CP192215.1_817|894733|895977|1|ID=1_817;partial=00;start_type=ATG;rbs_motif=AGGA/GGAG/GAGG;rbs_spacer=11-12bp;gc_cont=0.368	WP_000138487.1 MULTISPECIES: Glu/Leu/Phe/Val family dehydrogenase [Staphylococcus]	100	99.8	1.04e-300
CP192215.1_818|896259|897188|-1|ID=1_818;partial=00;start_type=ATG;rbs_motif=AGGA;rbs_spacer=5-10bp;gc_cont=0.331	WP_000185319.1 MULTISPECIES: glycerophosphodiester phosphodiesterase [Staphylococcus]	100	99.7	7.84e-227
CP192215.1_819|897430|898809|-1|ID=1_819;partial=00;start_type=ATG;rbs_motif=GGAG/GAGG;rbs_spacer=5-10bp;gc_cont=0.343	WP_000066061.1 MULTISPECIES: argininosuccinate lyase [Staphylococcus]	100	99.8	0.0
CP192215.1_820|898799|900004|-1|ID=1_820;partial=00;start_type=ATG;rbs_motif=GGAG/GAGG;rbs_spacer=5-10bp;gc_cont=0.350	WP_000660047.1 MULTISPECIES: argininosuccinate synthase [Staphylococcus]	100	99.8	2.00e-296
CP192215.1_821|900355|901686|1|ID=1_821;partial=00;start_type=ATG;rbs_motif=AGGAG;rbs_spacer=5-10bp;gc_cont=0.331	WP_000148851.1 MULTISPECIES: glucose-6-phosphate isomerase [Staphylococcus]	100	99.8	0.0
CP192215.1_822|902011|902586|1|ID=1_822;partial=00;start_type=TTG;rbs_motif=GGA/GAG/AGG;rbs_spacer=5-10bp;gc_cont=0.311	WP_000007970.1 MULTISPECIES: TVP38/TMEM64 family protein [Staphylococcus]	100	99.5	1.23e-128
CP192215.1_823|902591|903115|1|ID=1_823;partial=00;start_type=GTG;rbs_motif=AGGAG;rbs_spacer=5-10bp;gc_cont=0.310	WP_000758216.1 MULTISPECIES: signal peptidase I [Staphylococcus]	100	99.4	1.60e-118
CP192215.1_824|903131|903706|1|ID=1_824;partial=00;start_type=TTG;rbs_motif=GGAG/GAGG;rbs_spacer=5-10bp;gc_cont=0.306	WP_000711894.1 MULTISPECIES: signal peptidase I [Staphylococcus]	100	99.5	2.50e-137
CP192215.1_825|903866|907342|1|ID=1_825;partial=00;start_type=ATG;rbs_motif=GGAG/GAGG;rbs_spacer=5-10bp;gc_cont=0.322	WP_000172374.1 MULTISPECIES: helicase-exonuclease AddAB subunit AddB [Staphylococcus]	100	99.9	0.0
CP192215.1_826|907343|910996|1|ID=1_826;partial=00;start_type=ATG;rbs_motif=GGA/GAG/AGG;rbs_spacer=5-10bp;gc_cont=0.333	WP_000154918.1 MULTISPECIES: helicase-exonuclease AddAB subunit AddA [Staphylococcus]	100	99.9	0.0
CP192215.1_827|911160|912062|1|ID=1_827;partial=00;start_type=ATG;rbs_motif=AGGAG;rbs_spacer=5-10bp;gc_cont=0.331	WP_000670755.1 MULTISPECIES: fumarylacetoacetate hydrolase family protein [Staphylococcus]	100	99.7	1.90e-218
CP192215.1_828|912387|912776|1|ID=1_828;partial=00;start_type=ATG;rbs_motif=GGA/GAG/AGG;rbs_spacer=5-10bp;gc_cont=0.331	WP_000902807.1 MULTISPECIES: YisL family protein [Staphylococcus]	100	99.2	5.10e-82
CP192215.1_829|912947|914263|-1|ID=1_829;partial=00;start_type=ATG;rbs_motif=AGGAG;rbs_spacer=5-10bp;gc_cont=0.358	WP_001124516.1 MULTISPECIES: CoA-disulfide reductase [Staphylococcus]	100	99.8	0.0
CP192215.1_830|914315|915139|-1|ID=1_830;partial=00;start_type=ATG;rbs_motif=AGGAG;rbs_spacer=5-10bp;gc_cont=0.313	WP_001182436.1 MULTISPECIES: Cof-type HAD-IIB family hydrolase [Staphylococcus]	100	99.6	1.01e-200
CP192215.1_831|915253|915561|1|ID=1_831;partial=00;start_type=ATG;rbs_motif=GGAG/GAGG;rbs_spacer=5-10bp;gc_cont=0.359	WP_000390575.1 MULTISPECIES: metal-sulfur cluster assembly factor [Bacilli]	100	99.0	2.07e-66
CP192215.1_832|915536|915757|-1|ID=1_832;partial=00;start_type=ATG;rbs_motif=GGAG/GAGG;rbs_spacer=5-10bp;gc_cont=0.419	WP_218089180.1 hypothetical protein, partial [Staphylococcus aureus]	85.7	56.8	2.13e-17
CP192215.1_833|916216|918030|1|ID=1_833;partial=00;start_type=ATG;rbs_motif=GGA/GAG/AGG;rbs_spacer=11-12bp;gc_cont=0.305	WP_001044227.1 MULTISPECIES: acyltransferase family protein [Staphylococcus]	100	99.8	0.0
CP192215.1_834|918234|920843|1|ID=1_834;partial=00;start_type=ATG;rbs_motif=GGAG/GAGG;rbs_spacer=5-10bp;gc_cont=0.338	WP_001670298.1 ATP-dependent chaperone ClpB [Staphylococcus aureus]	100	99.9	0.0
CP192215.1_835|920902|921771|-1|ID=1_835;partial=00;start_type=ATG;rbs_motif=GGAG/GAGG;rbs_spacer=5-10bp;gc_cont=0.280	WP_001047062.1 MULTISPECIES: LysR family transcriptional regulator [Staphylococcus]	100	99.7	3.00e-205
CP192215.1_836|921881|923026|1|ID=1_836;partial=00;start_type=ATG;rbs_motif=AGGA/GGAG/GAGG;rbs_spacer=11-12bp;gc_cont=0.271	WP_000619353.1 MULTISPECIES: LeuA family protein [Staphylococcus]	100	99.7	2.41e-271
CP192215.1_837|923010|923651|1|ID=1_837;partial=00;start_type=ATG;rbs_motif=AGGAG;rbs_spacer=5-10bp;gc_cont=0.268	WP_000404426.1 L-threonylcarbamoyladenylate synthase [Staphylococcus aureus]	100	99.5	1.72e-148
CP192215.1_838|923644|924765|1|ID=1_838;partial=00;start_type=ATG;rbs_motif=GGA/GAG/AGG;rbs_spacer=5-10bp;gc_cont=0.241	WP_001037456.1 MULTISPECIES: MFS transporter [Staphylococcus]	100	99.7	7.20e-237
CP192215.1_839|924743|925258|1|ID=1_839;partial=00;start_type=ATG;rbs_motif=AGGAG;rbs_spacer=5-10bp;gc_cont=0.312	WP_000700883.1 MULTISPECIES: YbhB/YbcL family Raf kinase inhibitor-like protein [Staphylococcus]	100	99.4	2.89e-124
CP192215.1_840|925569|926003|1|ID=1_840;partial=00;start_type=ATG;rbs_motif=AGGAG;rbs_spacer=5-10bp;gc_cont=0.322	WP_000769692.1 MULTISPECIES: MAP domain-containing protein [Staphylococcus]	100	99.3	2.23e-90
CP192215.1_841|926260|926445|-1|ID=1_841;partial=00;start_type=ATG;rbs_motif=GGAG/GAGG;rbs_spacer=5-10bp;gc_cont=0.344	WP_000682088.1 MULTISPECIES: YjzD family protein [Staphylococcus]	100	98.4	6.99e-33
CP192215.1_842|926740|927681|1|ID=1_842;partial=00;start_type=ATG;rbs_motif=GGA/GAG/AGG;rbs_spacer=5-10bp;gc_cont=0.355	WP_001100526.1 MULTISPECIES: beta-ketoacyl-ACP synthase III [Staphylococcus]	100	99.7	6.93e-223
CP192215.1_843|927693|928937|1|ID=1_843;partial=00;start_type=ATG;rbs_motif=AGGAG;rbs_spacer=5-10bp;gc_cont=0.390	WP_000081233.1 MULTISPECIES: beta-ketoacyl-ACP synthase II [Staphylococcus]	100	99.8	1.93e-296
CP192215.1_844|928992|929363|-1|ID=1_844;partial=00;start_type=ATG;rbs_motif=GGAG/GAGG;rbs_spacer=5-10bp;gc_cont=0.272	WP_000915157.1 MULTISPECIES: DUF3899 domain-containing protein [Staphylococcus]	100	99.2	6.58e-73
CP192215.1_845|929606|930532|1|ID=1_845;partial=00;start_type=ATG;rbs_motif=AGGAG;rbs_spacer=5-10bp;gc_cont=0.327	WP_000521535.1 MULTISPECIES: oligopeptide ABC transporter permease [Staphylococcus]	100	99.7	2.75e-206
CP192215.1_846|930532|931602|1|ID=1_846;partial=00;start_type=ATG;rbs_motif=AGGAG;rbs_spacer=5-10bp;gc_cont=0.336	WP_000829647.1 MULTISPECIES: oligopeptide ABC transporter permease [Staphylococcus]	100	99.7	9.36e-245
CP192215.1_847|931618|932700|1|ID=1_847;partial=00;start_type=ATG;rbs_motif=AGxAGG/AGGxGG;rbs_spacer=5-10bp;gc_cont=0.353	WP_000140044.1 MULTISPECIES: ABC transporter ATP-binding protein [Staphylococcus]	100	99.7	1.42e-257
CP192215.1_848|932690|933631|1|ID=1_848;partial=00;start_type=ATG;rbs_motif=GGA/GAG/AGG;rbs_spacer=5-10bp;gc_cont=0.328	WP_001670300.1 ABC transporter ATP-binding protein [Staphylococcus aureus]	100	99.7	1.56e-219
CP192215.1_849|933649|935304|1|ID=1_849;partial=00;start_type=ATG;rbs_motif=GGA/GAG/AGG;rbs_spacer=5-10bp;gc_cont=0.325	WP_000197013.1 MULTISPECIES: peptide ABC transporter substrate-binding protein [Staphylococcus]	100	99.8	0.0
CP192215.1_850|935515|937230|1|ID=1_850;partial=00;start_type=ATG;rbs_motif=AGGAG;rbs_spacer=5-10bp;gc_cont=0.321	WP_000517164.1 MULTISPECIES: oligopeptide ABC transporter substrate-binding protein [Staphylococcus]	100	99.8	0.0
CP192215.1_851|937281|938267|1|ID=1_851;partial=00;start_type=ATG;rbs_motif=None;rbs_spacer=None;gc_cont=0.301	WP_001067051.1 ABC transporter ATP-binding protein [Staphylococcus aureus]	100	99.7	8.81e-229
CP192215.1_852|938270|939250|1|ID=1_852;partial=00;start_type=ATG;rbs_motif=AGGAG;rbs_spacer=5-10bp;gc_cont=0.305	WP_000427769.1 MULTISPECIES: ABC transporter ATP-binding protein [Staphylococcus]	100	99.7	6.02e-235
CP192215.1_853|939243|940205|1|ID=1_853;partial=00;start_type=ATG;rbs_motif=GGA/GAG/AGG;rbs_spacer=5-10bp;gc_cont=0.279	WP_000239820.1 MULTISPECIES: oligopeptide ABC transporter permease [Staphylococcus]	100	99.7	4.46e-218
CP192215.1_854|940217|941098|1|ID=1_854;partial=00;start_type=ATG;rbs_motif=GGA/GAG/AGG;rbs_spacer=5-10bp;gc_cont=0.313	WP_001180267.1 MULTISPECIES: oligopeptide ABC transporter permease [Staphylococcus]	100	99.7	2.72e-194
CP192215.1_855|941502|942074|1|ID=1_855;partial=00;start_type=ATG;rbs_motif=GGAG/GAGG;rbs_spacer=5-10bp;gc_cont=0.300	WP_275718319.1 transposase, partial [Staphylococcus aureus]	100	99.5	5.59e-137
CP192215.1_856|942100|943089|-1|ID=1_856;partial=00;start_type=ATG;rbs_motif=GGA/GAG/AGG;rbs_spacer=5-10bp;gc_cont=0.344	WP_000448941.1 MULTISPECIES: tryptophan--tRNA ligase [Staphylococcus]	100	99.7	3.23e-236
