CP192215.1_1339|1474970|1478410|-1|ID=1_1339;partial=00;start_type=ATG;rbs_motif=GGA/GAG/AGG;rbs_spacer=5-10bp;gc_cont=0.308	WP_000608535.1 MULTISPECIES: dynamin family protein [Staphylococcus]	100	99.9	0.0
CP192215.1_1340|1478714|1480054|1|ID=1_1340;partial=00;start_type=ATG;rbs_motif=GGAG/GAGG;rbs_spacer=5-10bp;gc_cont=0.327	WP_000799007.1 MULTISPECIES: PepSY-associated TM helix domain-containing protein [Staphylococcus]	100	99.8	0.0
CP192215.1_1341|1480263|1480595|-1|ID=1_1341;partial=00;start_type=ATG;rbs_motif=AGGAG;rbs_spacer=5-10bp;gc_cont=0.303	WP_000516801.1 MULTISPECIES: DUF4889 domain-containing protein [Staphylococcus]	100	99.1	1.40e-70
CP192215.1_1342|1480679|1481824|-1|ID=1_1342;partial=00;start_type=ATG;rbs_motif=AGGAG;rbs_spacer=5-10bp;gc_cont=0.358	WP_000487150.1 MULTISPECIES: THUMP domain-containing class I SAM-dependent RNA methyltransferase [Staphylococcus]	100	99.7	1.36e-277
CP192215.1_1344|1482475|1482867|-1|ID=1_1344;partial=00;start_type=ATG;rbs_motif=None;rbs_spacer=None;gc_cont=0.285	WP_001286320.1 MULTISPECIES: cell division regulator GpsB [Bacteria]	100	87.0	1.65e-66
CP192215.1_1345|1482833|1483396|-1|ID=1_1345;partial=00;start_type=ATG;rbs_motif=GGAG/GAGG;rbs_spacer=5-10bp;gc_cont=0.323	WP_000241302.1 MULTISPECIES: DUF1273 domain-containing protein [Staphylococcus]	100	99.5	1.25e-135
CP192215.1_1346|1483389|1483790|-1|ID=1_1346;partial=00;start_type=ATG;rbs_motif=GGA/GAG/AGG;rbs_spacer=5-10bp;gc_cont=0.299	WP_001000805.1 MULTISPECIES: YppE family protein [Staphylococcus]	100	86.6	2.85e-75
CP192215.1_1347|1484227|1484904|1|ID=1_1347;partial=00;start_type=ATG;rbs_motif=None;rbs_spacer=None;gc_cont=0.319	WP_001795446.1 Holliday junction resolvase RecU [Staphylococcus aureus]	99.1	99.6	7.32e-165
CP192215.1_1348|1484901|1487084|1|ID=1_1348;partial=00;start_type=ATG;rbs_motif=GGAG/GAGG;rbs_spacer=5-10bp;gc_cont=0.356	WP_000138345.1 MULTISPECIES: transglycosylase domain-containing protein [Staphylococcus]	100	99.9	0.0
CP192215.1_1349|1487602|1487943|-1|ID=1_1349;partial=00;start_type=ATG;rbs_motif=AGxAG;rbs_spacer=5-10bp;gc_cont=0.272	WP_000182028.1 MULTISPECIES: YpoC family protein [Staphylococcus]	100	99.1	2.30e-75
CP192215.1_1350|1487948|1488607|-1|ID=1_1350;partial=00;start_type=ATG;rbs_motif=GGAG/GAGG;rbs_spacer=5-10bp;gc_cont=0.344	WP_000253765.1 MULTISPECIES: endonuclease III [Staphylococcus]	100	99.5	4.08e-159
CP192215.1_1351|1488597|1489283|-1|ID=1_1351;partial=00;start_type=ATG;rbs_motif=GGA/GAG/AGG;rbs_spacer=5-10bp;gc_cont=0.306	WP_000362222.1 MULTISPECIES: DnaD domain-containing protein [Staphylococcus]	100	99.6	3.88e-157
CP192215.1_1352|1489611|1490903|-1|ID=1_1352;partial=00;start_type=ATG;rbs_motif=AGGAG;rbs_spacer=5-10bp;gc_cont=0.353	WP_000858795.1 MULTISPECIES: asparagine--tRNA ligase [Staphylococcus]	100	99.8	0.0
CP192215.1_1353|1491225|1493918|-1|ID=1_1353;partial=00;start_type=ATG;rbs_motif=AGGAG;rbs_spacer=5-10bp;gc_cont=0.299	WP_000525063.1 MULTISPECIES: ATP-dependent DNA helicase DinG [Staphylococcus]	100	99.9	0.0
CP192215.1_1354|1493942|1494913|-1|ID=1_1354;partial=00;start_type=ATG;rbs_motif=GGA/GAG/AGG;rbs_spacer=5-10bp;gc_cont=0.305	WP_000049913.1 MULTISPECIES: biotin--[acetyl-CoA-carboxylase] ligase [Staphylococcus]	100	99.7	1.86e-232
CP192215.1_1355|1494900|1496102|-1|ID=1_1355;partial=00;start_type=ATG;rbs_motif=GGA/GAG/AGG;rbs_spacer=5-10bp;gc_cont=0.318	WP_000361546.1 MULTISPECIES: CCA tRNA nucleotidyltransferase [Staphylococcus]	100	99.8	3.83e-289
CP192215.1_1356|1496107|1497249|-1|ID=1_1356;partial=00;start_type=ATG;rbs_motif=AGGA/GGAG/GAGG;rbs_spacer=11-12bp;gc_cont=0.331	WP_000690025.1 MULTISPECIES: N-acetyl-alpha-D-glucosaminyl L-malate synthase BshA [Staphylococcus]	100	99.7	5.71e-274
CP192215.1_1357|1497487|1497804|-1|ID=1_1357;partial=00;start_type=ATG;rbs_motif=AGGAG;rbs_spacer=5-10bp;gc_cont=0.311	WP_000839926.1 MULTISPECIES: nucleotide pyrophosphohydrolase [Staphylococcus]	100	99.1	6.34e-67
CP192215.1_1358|1498141|1498839|-1|ID=1_1358;partial=00;start_type=TTG;rbs_motif=AGGAG;rbs_spacer=5-10bp;gc_cont=0.366	WP_181427572.1 zinc metallopeptidase [Staphylococcus aureus]	99.6	99.6	3.27e-151
CP192215.1_1359|1498893|1499480|-1|ID=1_1359;partial=00;start_type=ATG;rbs_motif=GGAG/GAGG;rbs_spacer=5-10bp;gc_cont=0.289	WP_000154682.1 MULTISPECIES: DUF1405 domain-containing protein [Staphylococcus]	100	99.5	8.35e-138
CP192215.1_1360|1499470|1500057|-1|ID=1_1360;partial=00;start_type=ATG;rbs_motif=None;rbs_spacer=None;gc_cont=0.308	WP_000005215.1 YpiB family protein [Staphylococcus aureus]	100	97.4	4.51e-132
CP192215.1_1361|1500059|1501303|-1|ID=1_1361;partial=00;start_type=ATG;rbs_motif=GGA/GAG/AGG;rbs_spacer=5-10bp;gc_cont=0.307	WP_000389524.1 MULTISPECIES: tetratricopeptide repeat protein [Staphylococcus]	100	99.8	1.93e-296
CP192215.1_1362|1501310|1502608|-1|ID=1_1362;partial=00;start_type=ATG;rbs_motif=GGA/GAG/AGG;rbs_spacer=5-10bp;gc_cont=0.363	WP_000245908.1 MULTISPECIES: 3-phosphoshikimate 1-carboxyvinyltransferase [Staphylococcus]	100	99.8	3.41e-306
CP192215.1_1363|1502618|1503682|-1|ID=1_1363;partial=00;start_type=ATG;rbs_motif=GGAG/GAGG;rbs_spacer=5-10bp;gc_cont=0.320	WP_000776316.1 MULTISPECIES: 3-dehydroquinate synthase [Staphylococcus]	100	99.7	1.31e-259
CP192215.1_1364|1503708|1504874|-1|ID=1_1364;partial=00;start_type=ATG;rbs_motif=AGGAG;rbs_spacer=5-10bp;gc_cont=0.365	WP_001269918.1 chorismate synthase [Staphylococcus aureus]	100	99.7	1.65e-277
CP192215.1_1365|1505261|1505461|-1|ID=1_1365;partial=00;start_type=ATG;rbs_motif=GGA/GAG/AGG;rbs_spacer=5-10bp;gc_cont=0.204	WP_000789525.1 MULTISPECIES: hypothetical protein [Staphylococcus]	100	98.5	5.93e-34
CP192215.1_1366|1505671|1506120|-1|ID=1_1366;partial=00;start_type=GTG;rbs_motif=GGA/GAG/AGG;rbs_spacer=5-10bp;gc_cont=0.338	WP_000442480.1 MULTISPECIES: nucleoside-diphosphate kinase [Staphylococcus]	100	99.3	7.11e-103
CP192215.1_1367|1506212|1507156|-1|ID=1_1367;partial=00;start_type=ATG;rbs_motif=None;rbs_spacer=None;gc_cont=0.342	WP_001096484.1 MULTISPECIES: polyprenyl synthetase family protein [Staphylococcus]	100	99.7	1.26e-213
CP192215.1_1368|1507173|1507898|-1|ID=1_1368;partial=00;start_type=ATG;rbs_motif=GGAG/GAGG;rbs_spacer=5-10bp;gc_cont=0.347	WP_000774675.1 demethylmenaquinone methyltransferase [Staphylococcus aureus]	100	99.6	1.79e-173
CP192215.1_1369|1507901|1508473|-1|ID=1_1369;partial=00;start_type=ATG;rbs_motif=GGAG/GAGG;rbs_spacer=5-10bp;gc_cont=0.279	WP_000450555.1 MULTISPECIES: heptaprenyl diphosphate synthase component 1 [Staphylococcus]	100	99.5	3.41e-130
CP192215.1_1370|1508904|1509176|-1|ID=1_1370;partial=00;start_type=ATG;rbs_motif=AGGAGG;rbs_spacer=5-10bp;gc_cont=0.366	WP_001043863.1 MULTISPECIES: HU family DNA-binding protein [Staphylococcus]	100	98.9	6.91e-55
CP192215.1_1371|1509347|1510345|-1|ID=1_1371;partial=00;start_type=ATG;rbs_motif=GGA/GAG/AGG;rbs_spacer=5-10bp;gc_cont=0.345	WP_000161746.1 MULTISPECIES: NAD(P)H-dependent glycerol-3-phosphate dehydrogenase [Staphylococcus]	100	99.7	4.57e-233
CP192215.1_1372|1510362|1511672|-1|ID=1_1372;partial=00;start_type=ATG;rbs_motif=GGAG/GAGG;rbs_spacer=5-10bp;gc_cont=0.354	WP_000165530.1 MULTISPECIES: ribosome biogenesis GTPase Der [Staphylococcus]	100	99.8	1.46e-309
CP192215.1_1373|1511894|1513069|-1|ID=1_1373;partial=00;start_type=ATG;rbs_motif=AGGAG;rbs_spacer=5-10bp;gc_cont=0.336	WP_000133951.1 MULTISPECIES: 30S ribosomal protein S1 [Staphylococcus]	100	99.7	1.84e-271
CP192215.1_1374|1513326|1513517|-1|ID=1_1374;partial=00;start_type=ATG;rbs_motif=None;rbs_spacer=None;gc_cont=0.260	WP_031789482.1 MULTISPECIES: hypothetical protein [Staphylococcus]	100	98.4	1.74e-36
CP192215.1_1375|1513781|1514440|-1|ID=1_1375;partial=00;start_type=ATG;rbs_motif=GGA/GAG/AGG;rbs_spacer=5-10bp;gc_cont=0.348	WP_000644390.1 MULTISPECIES: (d)CMP kinase [Staphylococcus]	100	99.5	1.07e-145
CP192215.1_1376|1514517|1515485|1|ID=1_1376;partial=00;start_type=ATG;rbs_motif=AGGAG;rbs_spacer=5-10bp;gc_cont=0.347	WP_000681755.1 asparaginase [Staphylococcus aureus]	100	99.7	3.33e-230
CP192215.1_1377|1515618|1516586|-1|ID=1_1377;partial=00;start_type=ATG;rbs_motif=AGGAG;rbs_spacer=5-10bp;gc_cont=0.333	WP_001174259.1 bacillithiol disulfide reductase YpdA [Staphylococcus aureus]	100	99.7	2.55e-234
CP192215.1_1378|1516989|1518440|-1|ID=1_1378;partial=00;start_type=ATG;rbs_motif=AGGA;rbs_spacer=5-10bp;gc_cont=0.362	WP_061394227.1 elastin-binding protein EbpS [Staphylococcus aureus]	98.1	99.8	4.58e-235
CP192215.1_1379|1518593|1519972|-1|ID=1_1379;partial=00;start_type=ATG;rbs_motif=GGAG/GAGG;rbs_spacer=5-10bp;gc_cont=0.336	WP_000902100.1 MULTISPECIES: RecQ family ATP-dependent DNA helicase [Staphylococcus]	100	99.8	0.0
CP192215.1_1380|1519962|1520915|-1|ID=1_1380;partial=00;start_type=TTG;rbs_motif=GGAG/GAGG;rbs_spacer=5-10bp;gc_cont=0.280	WP_001163816.1 MULTISPECIES: helix-turn-helix domain-containing protein [Staphylococcus]	100	99.7	9.86e-225
CP192215.1_1381|1521023|1521271|1|ID=1_1381;partial=00;start_type=TTG;rbs_motif=AGGAG;rbs_spacer=5-10bp;gc_cont=0.390	WP_001151997.1 MULTISPECIES: ferredoxin [Staphylococcus]	100	98.8	3.74e-53
CP192215.1_1382|1521377|1521922|-1|ID=1_1382;partial=00;start_type=ATG;rbs_motif=AGGAG;rbs_spacer=5-10bp;gc_cont=0.315	WP_001186912.1 MULTISPECIES: ECF transporter S component [Staphylococcus]	100	99.5	1.14e-110
CP192215.1_1383|1522324|1523268|-1|ID=1_1383;partial=00;start_type=ATG;rbs_motif=None;rbs_spacer=None;gc_cont=0.291	WP_001805730.1 MULTISPECIES: DUF1672 domain-containing protein [Staphylococcus]	100	99.7	1.14e-217
CP192215.1_1384|1523723|1524631|-1|ID=1_1384;partial=00;start_type=ATG;rbs_motif=None;rbs_spacer=None;gc_cont=0.311	WP_001805732.1 MULTISPECIES: DUF1672 domain-containing protein [Staphylococcus]	100	99.7	1.27e-208
CP192215.1_1385|1524706|1524852|-1|ID=1_1385;partial=00;start_type=ATG;rbs_motif=GGAG/GAGG;rbs_spacer=5-10bp;gc_cont=0.252	WP_256125286.1 hypothetical protein, partial [Staphylococcus aureus]	100	89.8	2.64e-22
CP192215.1_1386|1524836|1525711|-1|ID=1_1386;partial=00;start_type=ATG;rbs_motif=AGGA;rbs_spacer=5-10bp;gc_cont=0.303	WP_084930846.1 DUF1672 domain-containing protein, partial [Staphylococcus aureus]	100	99.7	4.72e-202
CP192215.1_1387|1525862|1526113|-1|ID=1_1387;partial=00;start_type=ATG;rbs_motif=None;rbs_spacer=None;gc_cont=0.325	WP_000464818.1 hypothetical protein [Staphylococcus aureus]	100	98.8	2.98e-50
CP192215.1_1388|1526256|1527266|-1|ID=1_1388;partial=00;start_type=ATG;rbs_motif=GGA/GAG/AGG;rbs_spacer=11-12bp;gc_cont=0.292	WP_000777019.1 restriction endonuclease subunit S [Staphylococcus aureus]	100	99.7	1.28e-241
CP192215.1_1389|1527253|1529157|-1|ID=1_1389;partial=00;start_type=ATG;rbs_motif=GGAG/GAGG;rbs_spacer=5-10bp;gc_cont=0.319	WP_001003363.1 HsdM family class I SAM-dependent methyltransferase [Staphylococcus aureus]	100	99.8	0.0
CP192215.1_1390|1529518|1530273|-1|ID=1_1390;partial=00;start_type=ATG;rbs_motif=AGGAG;rbs_spacer=5-10bp;gc_cont=0.349	WP_000861038.1 MULTISPECIES: CHAP domain-containing protein [Bacteria]	100	99.6	4.10e-193
CP192215.1_1391|1530285|1530539|-1|ID=1_1391;partial=00;start_type=ATG;rbs_motif=AGGAG;rbs_spacer=5-10bp;gc_cont=0.322	WP_000611512.1 MULTISPECIES: phage holin [Bacteria]	100	98.8	2.14e-53
CP192215.1_1392|1531080|1531379|-1|ID=1_1392;partial=00;start_type=ATG;rbs_motif=GGxGG;rbs_spacer=3-4bp;gc_cont=0.310	WP_061841742.1 DUF2951 family protein [Staphylococcus aureus]	93.9	99.0	1.43e-49
CP192215.1_1393|1531425|1531589|-1|ID=1_1393;partial=00;start_type=ATG;rbs_motif=AGGAG;rbs_spacer=5-10bp;gc_cont=0.279	WP_000916020.1 MULTISPECIES: XkdX family protein [Bacteria]	100	98.2	4.19e-31
CP192215.1_1394|1531582|1531971|-1|ID=1_1394;partial=00;start_type=ATG;rbs_motif=AGGAG;rbs_spacer=5-10bp;gc_cont=0.318	WP_001166596.1 DUF2977 domain-containing protein [Staphylococcus aureus]	100	99.2	3.45e-80
CP192215.1_1395|1531971|1533470|-1|ID=1_1395;partial=00;start_type=ATG;rbs_motif=None;rbs_spacer=None;gc_cont=0.335	YP_007005720.1 BppU family baseplate upper protein [Staphylococcus phage SMSAP5]	100	99.8	0.0
CP192215.1_1396|1533437|1535347|-1|ID=1_1396;partial=00;start_type=ATG;rbs_motif=AGGA;rbs_spacer=5-10bp;gc_cont=0.356	WP_000429558.1 MULTISPECIES: phage baseplate protein [Bacteria]	100	99.8	0.0
CP192215.1_1397|1535363|1535653|-1|ID=1_1397;partial=00;start_type=ATG;rbs_motif=AGGA/GGAG/GAGG;rbs_spacer=11-12bp;gc_cont=0.351	WP_000179858.1 MULTISPECIES: hypothetical protein [Bacteria]	100	99.0	1.24e-62
CP192215.1_1398|1535653|1537236|-1|ID=1_1398;partial=00;start_type=ATG;rbs_motif=GGA/GAG/AGG;rbs_spacer=5-10bp;gc_cont=0.305	WP_000384475.1 prophage endopeptidase tail family protein [Staphylococcus aureus]	100	99.8	0.0
CP192215.1_1399|1537245|1538069|-1|ID=1_1399;partial=00;start_type=ATG;rbs_motif=AGGA/GGAG/GAGG;rbs_spacer=11-12bp;gc_cont=0.303	WP_001190527.1 MULTISPECIES: phage tail family protein [Staphylococcus]	100	99.6	2.47e-201
CP192215.1_1400|1538069|1544269|-1|ID=1_1400;partial=00;start_type=ATG;rbs_motif=AGGAG;rbs_spacer=5-10bp;gc_cont=0.363	WP_430738919.1 phage tail tape measure protein [Staphylococcus aureus]	100	100.0	0.0
CP192215.1_1401|1544283|1544441|-1|ID=1_1401;partial=00;start_type=ATG;rbs_motif=None;rbs_spacer=None;gc_cont=0.327	WP_000438833.1 MULTISPECIES: hypothetical protein [Bacteria]	100	98.1	2.41e-27
CP192215.1_1402|1544483|1544833|-1|ID=1_1402;partial=00;start_type=ATG;rbs_motif=AGGAG;rbs_spacer=5-10bp;gc_cont=0.313	WP_000589167.1 MULTISPECIES: phage tail assembly chaperone G [Bacteria]	100	99.1	7.62e-71
CP192215.1_1403|1544891|1545346|-1|ID=1_1403;partial=00;start_type=ATG;rbs_motif=AGGAG;rbs_spacer=5-10bp;gc_cont=0.364	WP_000169127.1 MULTISPECIES: Ig-like domain-containing protein [Bacteria]	100	99.3	4.60e-100
CP192215.1_1404|1545438|1546079|-1|ID=1_1404;partial=00;start_type=ATG;rbs_motif=AGGAG;rbs_spacer=5-10bp;gc_cont=0.363	WP_000807536.1 MULTISPECIES: major tail protein [Bacteria]	100	99.5	2.77e-154
CP192215.1_1405|1546114|1546509|-1|ID=1_1405;partial=00;start_type=ATG;rbs_motif=AGGA/GGAG/GAGG;rbs_spacer=11-12bp;gc_cont=0.285	WP_001023806.1 MULTISPECIES: DUF3168 domain-containing protein [Staphylococcus]	100	99.2	1.57e-86
CP192215.1_1406|1546510|1546911|-1|ID=1_1406;partial=00;start_type=ATG;rbs_motif=None;rbs_spacer=None;gc_cont=0.338	YP_007005730.1 putative DNA-binding protein [Staphylococcus phage SMSAP5]	100	99.3	7.43e-86
CP192215.1_1407|1546908|1547240|-1|ID=1_1407;partial=00;start_type=ATG;rbs_motif=GGA/GAG/AGG;rbs_spacer=5-10bp;gc_cont=0.273	WP_000395498.1 MULTISPECIES: hypothetical protein [Bacteria]	100	99.1	2.15e-74
CP192215.1_1408|1547252|1547530|-1|ID=1_1408;partial=00;start_type=ATG;rbs_motif=GGA/GAG/AGG;rbs_spacer=5-10bp;gc_cont=0.305	WP_000050973.1 MULTISPECIES: head-tail connector protein [Bacteria]	100	98.9	1.80e-60
CP192215.1_1409|1547599|1548807|-1|ID=1_1409;partial=00;start_type=ATG;rbs_motif=None;rbs_spacer=None;gc_cont=0.326	YP_002268008.1 major capsid protein [Staphylococcus phage phi2958PVL]	99.8	99.8	4.12e-285
CP192215.1_1410|1548774|1549547|-1|ID=1_1410;partial=00;start_type=ATG;rbs_motif=AGxAGG/AGGxGG;rbs_spacer=5-10bp;gc_cont=0.311	WP_000061866.1 MULTISPECIES: head maturation protease, ClpP-related [Bacillati]	100	99.6	1.06e-173
CP192215.1_1411|1549531|1550769|-1|ID=1_1411;partial=00;start_type=GTG;rbs_motif=None;rbs_spacer=None;gc_cont=0.326	WP_001100664.1 MULTISPECIES: phage portal protein [Staphylococcus]	100	99.8	9.96e-298
CP192215.1_1412|1550774|1552465|-1|ID=1_1412;partial=00;start_type=GTG;rbs_motif=GGA/GAG/AGG;rbs_spacer=5-10bp;gc_cont=0.336	WP_000153554.1 MULTISPECIES: terminase large subunit [Staphylococcus]	100	99.8	0.0
CP192215.1_1413|1552455|1552760|-1|ID=1_1413;partial=00;start_type=ATG;rbs_motif=GGA/GAG/AGG;rbs_spacer=5-10bp;gc_cont=0.284	WP_000778932.1 MULTISPECIES: P27 family phage terminase small subunit [Bacteria]	100	99.0	9.19e-65
CP192215.1_1414|1552872|1553186|-1|ID=1_1414;partial=00;start_type=ATG;rbs_motif=GGAG/GAGG;rbs_spacer=5-10bp;gc_cont=0.283	WP_000160689.1 MULTISPECIES: HNH endonuclease [Bacteria]	100	99.0	2.69e-72
CP192215.1_1415|1553343|1553780|-1|ID=1_1415;partial=00;start_type=ATG;rbs_motif=GGAG/GAGG;rbs_spacer=5-10bp;gc_cont=0.333	WP_000513699.1 MULTISPECIES: transcriptional regulator [Bacteria]	100	99.3	1.15e-97
CP192215.1_1416|1553793|1555160|-1|ID=1_1416;partial=00;start_type=GTG;rbs_motif=None;rbs_spacer=None;gc_cont=0.327	WP_075583730.1 SNF2-related protein [Staphylococcus aureus]	100	99.8	0.0
CP192215.1_1417|1555141|1555431|-1|ID=1_1417;partial=00;start_type=ATG;rbs_motif=GGA/GAG/AGG;rbs_spacer=5-10bp;gc_cont=0.306	WP_000665203.1 MULTISPECIES: VRR-NUC domain-containing protein [Bacteria]	100	99.0	6.38e-65
CP192215.1_1418|1555772|1558219|-1|ID=1_1418;partial=00;start_type=ATG;rbs_motif=AGGAG;rbs_spacer=5-10bp;gc_cont=0.350	WP_000884844.1 MULTISPECIES: virulence-associated E family protein [Staphylococcus]	100	99.9	0.0
CP192215.1_1419|1558271|1558471|-1|ID=1_1419;partial=00;start_type=ATG;rbs_motif=GGAG/GAGG;rbs_spacer=5-10bp;gc_cont=0.254	WP_000265258.1 MULTISPECIES: DUF1514 family protein [Bacteria]	100	98.5	8.43e-34
CP192215.1_1420|1558539|1558694|-1|ID=1_1420;partial=00;start_type=ATG;rbs_motif=GGA/GAG/AGG;rbs_spacer=5-10bp;gc_cont=0.295	WP_024937088.1 transcriptional activator RinB [Staphylococcus aureus]	100	96.2	4.30e-25
CP192215.1_1421|1558691|1559077|-1|ID=1_1421;partial=00;start_type=ATG;rbs_motif=AGGAG;rbs_spacer=5-10bp;gc_cont=0.318	WP_001623479.1 MULTISPECIES: hypothetical protein [Staphylococcus]	100	99.2	4.73e-82
CP192215.1_1422|1559067|1559303|-1|ID=1_1422;partial=00;start_type=ATG;rbs_motif=GGAG/GAGG;rbs_spacer=5-10bp;gc_cont=0.325	WP_000483477.1 MULTISPECIES: DUF7366 family protein [Bacillati]	100	98.7	1.25e-47
CP192215.1_1423|1559328|1559564|-1|ID=1_1423;partial=00;start_type=GTG;rbs_motif=AGGAGG;rbs_spacer=5-10bp;gc_cont=0.333	WP_000195806.1 DUF1381 domain-containing protein [Staphylococcus aureus]	100	98.7	5.96e-46
CP192215.1_1424|1559601|1560128|-1|ID=1_1424;partial=00;start_type=ATG;rbs_motif=AGGAG;rbs_spacer=5-10bp;gc_cont=0.369	WP_000185638.1 MULTISPECIES: dUTP diphosphatase [Staphylococcus]	100	99.4	1.53e-121
CP192215.1_1425|1560121|1560372|-1|ID=1_1425;partial=00;start_type=ATG;rbs_motif=AGGAG;rbs_spacer=5-10bp;gc_cont=0.369	WP_001065075.1 MULTISPECIES: type II toxin-antitoxin system toxin HigB [Bacteria]	100	97.6	8.57e-48
CP192215.1_1426|1560384|1560626|-1|ID=1_1426;partial=00;start_type=ATG;rbs_motif=AGGAG;rbs_spacer=5-10bp;gc_cont=0.387	WP_000132191.1 SAV1978 family virulence-associated passenger protein [Staphylococcus aureus]	100	98.8	3.80e-52
CP192215.1_1427|1560641|1560841|-1|ID=1_1427;partial=00;start_type=ATG;rbs_motif=GGAG/GAGG;rbs_spacer=5-10bp;gc_cont=0.353	WP_000235324.1 MULTISPECIES: hypothetical protein [Staphylococcus]	100	98.5	5.44e-39
CP192215.1_1428|1560844|1561101|-1|ID=1_1428;partial=00;start_type=ATG;rbs_motif=GGAG/GAGG;rbs_spacer=5-10bp;gc_cont=0.376	WP_000022728.1 MULTISPECIES: DUF3310 domain-containing protein [Bacteria]	100	98.8	8.31e-56
CP192215.1_1429|1561101|1561502|-1|ID=1_1429;partial=00;start_type=ATG;rbs_motif=GGAG/GAGG;rbs_spacer=5-10bp;gc_cont=0.341	WP_000113975.1 SA1788 family PVL leukocidin-associated protein [Staphylococcus aureus]	100	99.3	2.22e-87
CP192215.1_1430|1561502|1561687|-1|ID=1_1430;partial=00;start_type=ATG;rbs_motif=AGGAG;rbs_spacer=5-10bp;gc_cont=0.296	WP_001164629.1 MULTISPECIES: DUF3113 family protein [Bacteria]	100	98.4	1.46e-34
CP192215.1_1431|1561700|1563652|-1|ID=1_1431;partial=00;start_type=ATG;rbs_motif=None;rbs_spacer=None;gc_cont=0.350	WP_075583731.1 DNA polymerase [Staphylococcus aureus]	100	99.8	0.0
CP192215.1_1432|1563721|1564275|-1|ID=1_1432;partial=00;start_type=ATG;rbs_motif=AGGA/GGAG/GAGG;rbs_spacer=11-12bp;gc_cont=0.368	WP_000647288.1 MULTISPECIES: DUF2815 family protein [Bacteria]	100	99.5	1.15e-125
CP192215.1_1433|1564301|1565467|-1|ID=1_1433;partial=00;start_type=ATG;rbs_motif=GGA/GAG/AGG;rbs_spacer=5-10bp;gc_cont=0.353	WP_000762534.1 DUF2800 domain-containing protein [Staphylococcus aureus]	100	99.7	2.35e-277
CP192215.1_1434|1565464|1565826|-1|ID=1_1434;partial=00;start_type=ATG;rbs_motif=AGGAG;rbs_spacer=5-10bp;gc_cont=0.298	YP_239978.1 ORF033 [Staphylococcus phage 3A]	100	99.2	2.51e-71
CP192215.1_1435|1565841|1566164|-1|ID=1_1435;partial=00;start_type=ATG;rbs_motif=AGGAG;rbs_spacer=5-10bp;gc_cont=0.330	YP_007392373.1 transcriptional regulator [Staphylococcus phage phi7401PVL]	100	99.1	6.28e-68
CP192215.1_1436|1566417|1566680|-1|ID=1_1436;partial=00;start_type=ATG;rbs_motif=AGGAG;rbs_spacer=5-10bp;gc_cont=0.311	WP_001124160.1 MULTISPECIES: helix-turn-helix domain-containing protein [Bacteria]	100	98.9	1.21e-58
CP192215.1_1437|1566705|1566920|-1|ID=1_1437;partial=00;start_type=ATG;rbs_motif=AGGAG;rbs_spacer=5-10bp;gc_cont=0.343	WP_001097552.1 MULTISPECIES: hypothetical protein [Bacteria]	100	98.6	9.70e-42
CP192215.1_1438|1566975|1567340|1|ID=1_1438;partial=00;start_type=ATG;rbs_motif=AGGAG;rbs_spacer=5-10bp;gc_cont=0.290	WP_001128433.1 MULTISPECIES: hypothetical protein [Bacillati]	100	99.2	1.39e-82
CP192215.1_1439|1567309|1567554|-1|ID=1_1439;partial=00;start_type=ATG;rbs_motif=AGGAG;rbs_spacer=5-10bp;gc_cont=0.354	WP_001025401.1 MULTISPECIES: DUF2829 domain-containing protein [Bacteria]	100	98.8	2.45e-53
CP192215.1_1440|1567621|1568001|1|ID=1_1440;partial=00;start_type=ATG;rbs_motif=GGAG/GAGG;rbs_spacer=5-10bp;gc_cont=0.302	WP_000773059.1 MULTISPECIES: DUF2513 domain-containing protein [Bacteria]	100	99.2	4.58e-88
CP192215.1_1441|1567988|1568185|-1|ID=1_1441;partial=00;start_type=ATG;rbs_motif=AGGAG;rbs_spacer=5-10bp;gc_cont=0.323	YP_239970.1 ORF077 [Staphylococcus phage 3A]	100	98.5	1.02e-38
CP192215.1_1442|1568255|1568467|1|ID=1_1442;partial=00;start_type=ATG;rbs_motif=AGGAG;rbs_spacer=5-10bp;gc_cont=0.357	YP_239969.1 ORF063 [Staphylococcus phage 3A]	100	98.6	3.15e-42
CP192215.1_1443|1568508|1568657|-1|ID=1_1443;partial=00;start_type=ATG;rbs_motif=AGGAG;rbs_spacer=5-10bp;gc_cont=0.280	YP_239968.1 ORF088 [Staphylococcus phage 3A]	100	98.0	1.97e-27
CP192215.1_1444|1568672|1569115|-1|ID=1_1444;partial=00;start_type=ATG;rbs_motif=AGGAG;rbs_spacer=5-10bp;gc_cont=0.311	YP_001429902.1 anti-repressor Ant [Staphylococcus phage tp310-2]	100	99.3	1.56e-96
CP192215.1_1445|1569163|1569375|-1|ID=1_1445;partial=00;start_type=ATG;rbs_motif=AGGAG;rbs_spacer=5-10bp;gc_cont=0.282	WP_000213811.1 MULTISPECIES: helix-turn-helix transcriptional regulator [Bacteria]	100	98.6	8.73e-40
CP192215.1_1446|1569527|1570258|1|ID=1_1446;partial=00;start_type=ATG;rbs_motif=AGGAG;rbs_spacer=5-10bp;gc_cont=0.322	WP_000511090.1 MULTISPECIES: XRE family transcriptional regulator [Bacteria]	100	99.6	3.18e-168
CP192215.1_1447|1570329|1570511|1|ID=1_1447;partial=00;start_type=ATG;rbs_motif=AGGA;rbs_spacer=5-10bp;gc_cont=0.262	WP_000705240.1 MULTISPECIES: hypothetical protein [Bacteria]	100	98.4	8.20e-36
CP192215.1_1448|1570569|1570694|1|ID=1_1448;partial=00;start_type=ATG;rbs_motif=GGA/GAG/AGG;rbs_spacer=5-10bp;gc_cont=0.302	WP_000227849.1 MULTISPECIES: hypothetical protein [Bacteria]	100	97.6	1.37e-15
CP192215.1_1449|1570691|1571305|-1|ID=1_1449;partial=00;start_type=ATG;rbs_motif=GGA/GAG/AGG;rbs_spacer=5-10bp;gc_cont=0.259	WP_094656370.1 ATPase [Staphylococcus aureus]	99.5	99.5	1.31e-134
CP192215.1_1450|1571431|1572636|1|ID=1_1450;partial=00;start_type=ATG;rbs_motif=AGGAG;rbs_spacer=5-10bp;gc_cont=0.298	WP_000264751.1 MULTISPECIES: tyrosine-type recombinase/integrase [Bacteria]	100	99.8	6.05e-282
CP192215.1_1451|1572679|1574715|-1|ID=1_1451;partial=00;start_type=ATG;rbs_motif=GGAG/GAGG;rbs_spacer=5-10bp;gc_cont=0.282	WP_001816962.1 hypothetical protein [Staphylococcus aureus]	100	99.9	0.0
CP192215.1_1452|1574718|1574966|-1|ID=1_1452;partial=00;start_type=ATG;rbs_motif=None;rbs_spacer=None;gc_cont=0.297	WP_142359804.1 DUF1672 family protein, partial [Staphylococcus aureus]	100	98.8	4.45e-48
CP192215.1_1453|1574981|1575634|-1|ID=1_1453;partial=00;start_type=ATG;rbs_motif=GGAG/GAGG;rbs_spacer=5-10bp;gc_cont=0.327	WP_101289452.1 DUF1672 family protein, partial [Staphylococcus aureus]	100	98.6	3.10e-147
CP192215.1_1454|1575886|1577637|-1|ID=1_1454;partial=00;start_type=ATG;rbs_motif=GGAG/GAGG;rbs_spacer=5-10bp;gc_cont=0.329	WP_000987779.1 two-component system sensor histidine kinase SrrB [Staphylococcus aureus]	100	99.8	0.0
CP192215.1_1455|1577618|1578343|-1|ID=1_1455;partial=00;start_type=ATG;rbs_motif=GGAG/GAGG;rbs_spacer=5-10bp;gc_cont=0.347	WP_000064078.1 MULTISPECIES: two-component system response regulator SrrA [Staphylococcus]	100	99.6	6.98e-171
CP192215.1_1456|1578476|1579213|-1|ID=1_1456;partial=00;start_type=ATG;rbs_motif=AGGAG;rbs_spacer=5-10bp;gc_cont=0.339	WP_000159577.1 MULTISPECIES: pseudouridine synthase [Staphylococcus]	100	99.6	8.75e-167
CP192215.1_1457|1579206|1579748|-1|ID=1_1457;partial=00;start_type=TTG;rbs_motif=AGGA/GGAG/GAGG;rbs_spacer=11-12bp;gc_cont=0.319	WP_000368656.1 MULTISPECIES: SMC-Scp complex subunit ScpB [Staphylococcus]	100	99.4	1.46e-117
CP192215.1_1458|1579741|1580496|-1|ID=1_1458;partial=00;start_type=ATG;rbs_motif=GGA/GAG/AGG;rbs_spacer=11-12bp;gc_cont=0.303	WP_000273371.1 MULTISPECIES: segregation and condensation protein A [Staphylococcus]	100	96.4	2.65e-169
CP192215.1_1459|1580564|1581070|1|ID=1_1459;partial=00;start_type=ATG;rbs_motif=None;rbs_spacer=None;gc_cont=0.331	WP_001183429.1 MULTISPECIES: DUF309 domain-containing protein [Staphylococcus]	100	99.4	9.72e-117
CP192215.1_1460|1581148|1582035|-1|ID=1_1460;partial=00;start_type=ATG;rbs_motif=GGAG/GAGG;rbs_spacer=5-10bp;gc_cont=0.337	WP_000447732.1 MULTISPECIES: site-specific tyrosine recombinase XerD [Staphylococcus]	100	99.7	1.89e-211
CP192215.1_1461|1582084|1582533|-1|ID=1_1461;partial=00;start_type=TTG;rbs_motif=GGAG/GAGG;rbs_spacer=5-10bp;gc_cont=0.362	WP_000392691.1 MULTISPECIES: ferric iron uptake transcriptional regulator [Staphylococcus]	100	99.3	1.68e-101
CP192215.1_1462|1582638|1583180|-1|ID=1_1462;partial=00;start_type=ATG;rbs_motif=AGGA/GGAG/GAGG;rbs_spacer=11-12bp;gc_cont=0.319	WP_000365246.1 MULTISPECIES: NUDIX hydrolase [Staphylococcus]	100	99.4	5.51e-122
