NZ_LQOO01000070.1_1|1|1929|-1|ID=1_1;partial=10;start_type=ATG;rbs_motif=GGA/GAG/AGG;rbs_spacer=5-10bp;gc_cont=0.694	WP_036458335.1 MMPL family transporter [Mycobacterium intracellulare]	100	100	0.0
NZ_LQOO01000070.1_2|2221|2364|1|ID=1_2;partial=00;start_type=GTG;rbs_motif=None;rbs_spacer=None;gc_cont=0.611	WP_003875438.1 hypothetical protein [Mycobacterium avium]	97.9	97.9	5.76e-24
NZ_LQOO01000070.1_3|2504|3268|-1|ID=1_3;partial=00;start_type=ATG;rbs_motif=AGGA;rbs_spacer=5-10bp;gc_cont=0.701	WP_042910963.1 3-hydroxyacyl-CoA dehydrogenase [Mycobacterium intracellulare]	100	99.6	2.31e-171
NZ_LQOO01000070.1_4|3318|4400|-1|ID=1_4;partial=00;start_type=ATG;rbs_motif=GGA/GAG/AGG;rbs_spacer=5-10bp;gc_cont=0.705	WP_042911080.1 CaiB/BaiF CoA transferase family protein [Mycobacterium intracellulare]	100	99.7	1.50e-268
NZ_LQOO01000070.1_5|4521|5333|1|ID=1_5;partial=00;start_type=ATG;rbs_motif=None;rbs_spacer=None;gc_cont=0.699	WP_014379411.1 MULTISPECIES: enoyl-CoA hydratase [Mycobacterium]	100	99.6	2.69e-178
NZ_LQOO01000070.1_6|5427|6785|1|ID=1_6;partial=00;start_type=ATG;rbs_motif=GGAG/GAGG;rbs_spacer=5-10bp;gc_cont=0.720	WP_042910962.1 DUF2867 domain-containing protein [Mycobacterium intracellulare]	100	99.8	0.0
NZ_LQOO01000070.1_7|6787|7509|-1|ID=1_7;partial=00;start_type=ATG;rbs_motif=GGA/GAG/AGG;rbs_spacer=5-10bp;gc_cont=0.707	WP_008254455.1 MULTISPECIES: CPBP family intramembrane glutamic endopeptidase [Mycobacterium]	100	99.6	6.67e-164
NZ_LQOO01000070.1_8|7506|8654|-1|ID=1_8;partial=00;start_type=ATG;rbs_motif=GGA/GAG/AGG;rbs_spacer=5-10bp;gc_cont=0.723	WP_042910961.1 NAD(P)H-binding protein [Mycobacterium intracellulare]	100	99.7	8.13e-275
NZ_LQOO01000070.1_9|8746|9828|1|ID=1_9;partial=00;start_type=ATG;rbs_motif=None;rbs_spacer=None;gc_cont=0.698	WP_051445845.1 type III polyketide synthase [Mycobacterium intracellulare]	100	99.7	1.72e-258
NZ_LQOO01000070.1_10|9849|10349|1|ID=1_10;partial=00;start_type=ATG;rbs_motif=None;rbs_spacer=None;gc_cont=0.679	WP_014379405.1 MULTISPECIES: isoprenylcysteine carboxyl methyltransferase family protein [Mycobacterium]	100	99.4	4.30e-119
NZ_LQOO01000070.1_11|10346|11362|1|ID=1_11;partial=00;start_type=ATG;rbs_motif=None;rbs_spacer=None;gc_cont=0.753	WP_042910958.1 NAD(P)/FAD-dependent oxidoreductase [Mycobacterium intracellulare]	100	99.7	4.27e-241
NZ_LQOO01000070.1_12|11472|12263|-1|ID=1_12;partial=00;start_type=GTG;rbs_motif=GGA/GAG/AGG;rbs_spacer=5-10bp;gc_cont=0.705	WP_042910957.1 crotonase/enoyl-CoA hydratase family protein [Mycobacterium intracellulare]	100	99.6	2.83e-181
NZ_LQOO01000070.1_13|12260|13408|-1|ID=1_13;partial=00;start_type=ATG;rbs_motif=AGGAG;rbs_spacer=5-10bp;gc_cont=0.681	WP_008254449.1 MULTISPECIES: thiolase family protein [Mycobacterium]	100	99.7	7.80e-273
NZ_LQOO01000070.1_14|13634|15118|-1|ID=1_14;partial=00;start_type=ATG;rbs_motif=GGA/GAG/AGG;rbs_spacer=5-10bp;gc_cont=0.659	WP_042910956.1 aldehyde dehydrogenase family protein [Mycobacterium intracellulare]	100	99.8	0.0
NZ_LQOO01000070.1_15|15210|16424|-1|ID=1_15;partial=00;start_type=ATG;rbs_motif=GGAG/GAGG;rbs_spacer=5-10bp;gc_cont=0.673	WP_042910955.1 cytochrome P450 [Mycobacterium intracellulare]	100	99.8	2.83e-293
NZ_LQOO01000070.1_16|16424|17413|-1|ID=1_16;partial=00;start_type=ATG;rbs_motif=GGA/GAG/AGG;rbs_spacer=5-10bp;gc_cont=0.702	WP_042910954.1 SDR family oxidoreductase [Mycobacterium intracellulare]	100	99.7	1.11e-227
NZ_LQOO01000070.1_17|17406|18554|-1|ID=1_17;partial=00;start_type=ATG;rbs_motif=GGA/GAG/AGG;rbs_spacer=5-10bp;gc_cont=0.653	WP_042910953.1 spirocyclase AveC family protein [Mycobacterium intracellulare]	100	99.7	3.65e-287
NZ_LQOO01000070.1_18|18560|19678|-1|ID=1_18;partial=00;start_type=ATG;rbs_motif=GGAGG;rbs_spacer=3-4bp;gc_cont=0.653	WP_008254441.1 MULTISPECIES: ABC transporter substrate-binding protein [Mycobacterium]	100	99.7	1.51e-274
NZ_LQOO01000070.1_19|19769|20626|-1|ID=1_19;partial=00;start_type=ATG;rbs_motif=GGA/GAG/AGG;rbs_spacer=5-10bp;gc_cont=0.692	WP_042910952.1 CbbQ/NirQ/NorQ/GpvN family protein [Mycobacterium intracellulare]	100	99.7	6.77e-200
NZ_LQOO01000070.1_20|20682|22439|-1|ID=1_20;partial=00;start_type=GTG;rbs_motif=GGAGG;rbs_spacer=5-10bp;gc_cont=0.722	WP_225336788.1 nitric oxide reductase activation protein NorD [Mycobacterium intracellulare]	100	97.4	0.0
NZ_LQOO01000070.1_21|22677|23861|1|ID=1_21;partial=00;start_type=ATG;rbs_motif=3Base/5BMM;rbs_spacer=13-15bp;gc_cont=0.680	WP_172417494.1 acyl-CoA dehydrogenase family protein [Mycobacterium intracellulare]	100	99.7	6.58e-287
NZ_LQOO01000070.1_22|23858|24970|1|ID=1_22;partial=00;start_type=ATG;rbs_motif=None;rbs_spacer=None;gc_cont=0.710	WP_042910949.1 acyl-CoA dehydrogenase family protein [Mycobacterium intracellulare]	100	99.7	3.22e-259
NZ_LQOO01000070.1_23|24970|25617|1|ID=1_23;partial=00;start_type=ATG;rbs_motif=GGAG/GAGG;rbs_spacer=5-10bp;gc_cont=0.679	WP_042910948.1 nitroreductase family protein [Mycobacterium intracellulare]	100	99.5	1.17e-156
NZ_LQOO01000070.1_24|25755|27035|1|ID=1_24;partial=00;start_type=ATG;rbs_motif=None;rbs_spacer=None;gc_cont=0.670	WP_008254431.1 MULTISPECIES: TetR/AcrR family transcriptional regulator [Mycobacterium]	100	99.8	4.42e-299
NZ_LQOO01000070.1_25|27132|27974|1|ID=1_25;partial=00;start_type=ATG;rbs_motif=AGxAGG/AGGxGG;rbs_spacer=5-10bp;gc_cont=0.664	WP_008254428.1 MULTISPECIES: SDR family oxidoreductase [Mycobacterium]	100	99.6	6.53e-200
NZ_LQOO01000070.1_26|28061|28702|1|ID=1_26;partial=00;start_type=ATG;rbs_motif=AGxAG;rbs_spacer=5-10bp;gc_cont=0.718	WP_042910947.1 SDR family oxidoreductase [Mycobacterium intracellulare]	100	99.5	2.16e-142
NZ_LQOO01000070.1_27|29148|31418|1|ID=1_27;partial=00;start_type=GTG;rbs_motif=AGGA;rbs_spacer=5-10bp;gc_cont=0.690	WP_042910946.1 5-methyltetrahydropteroyltriglutamate--homocysteine S-methyltransferase [Mycobacterium intracellulare]	100	99.9	0.0
NZ_LQOO01000070.1_28|31485|33209|-1|ID=1_28;partial=00;start_type=ATG;rbs_motif=None;rbs_spacer=None;gc_cont=0.657	WP_042910944.1 DUF3556 domain-containing protein [Mycobacterium intracellulare]	100	99.8	0.0
NZ_LQOO01000070.1_29|33262|33984|-1|ID=1_29;partial=00;start_type=GTG;rbs_motif=AGGAG;rbs_spacer=5-10bp;gc_cont=0.689	WP_042910943.1 potassium channel family protein [Mycobacterium intracellulare]	100	99.6	7.46e-161
NZ_LQOO01000070.1_30|34097|35602|1|ID=1_30;partial=00;start_type=ATG;rbs_motif=None;rbs_spacer=None;gc_cont=0.683	WP_026071435.1 MULTISPECIES: potassium/proton antiporter [Mycobacterium]	100	99.2	0.0
NZ_LQOO01000070.1_31|36706|38085|1|ID=1_31;partial=00;start_type=ATG;rbs_motif=AGGAG;rbs_spacer=5-10bp;gc_cont=0.711	WP_051445850.1 flavin monoamine oxidase family protein [Mycobacterium intracellulare]	100	99.8	0.0
NZ_LQOO01000070.1_32|38147|38668|-1|ID=1_32;partial=00;start_type=ATG;rbs_motif=GGA/GAG/AGG;rbs_spacer=5-10bp;gc_cont=0.657	WP_008254413.1 MULTISPECIES: DoxX family protein [Mycobacterium]	100	99.4	5.59e-123
NZ_LQOO01000070.1_33|38882|40459|1|ID=1_33;partial=00;start_type=GTG;rbs_motif=GGA/GAG/AGG;rbs_spacer=5-10bp;gc_cont=0.704	WP_042910940.1 pyruvate, phosphate dikinase [Mycobacterium intracellulare]	100	99.8	0.0
NZ_LQOO01000070.1_34|40456|41070|1|ID=1_34;partial=00;start_type=ATG;rbs_motif=GGxGG;rbs_spacer=5-10bp;gc_cont=0.698	WP_372420464.1 MarR family transcriptional regulator [Mycobacterium intracellulare]	98.0	99.5	1.31e-134
NZ_LQOO01000070.1_35|41071|42297|-1|ID=1_35;partial=00;start_type=ATG;rbs_motif=None;rbs_spacer=None;gc_cont=0.733	WP_042910937.1 WS/DGAT domain-containing protein [Mycobacterium intracellulare]	100	99.8	1.34e-292
NZ_LQOO01000070.1_36|42317|43219|-1|ID=1_36;partial=00;start_type=ATG;rbs_motif=GGA/GAG/AGG;rbs_spacer=5-10bp;gc_cont=0.702	WP_008254405.1 MULTISPECIES: alpha/beta fold hydrolase [Mycobacterium]	100	99.7	1.92e-227
NZ_LQOO01000070.1_37|43363|43851|-1|ID=1_37;partial=00;start_type=ATG;rbs_motif=AGGAG;rbs_spacer=5-10bp;gc_cont=0.669	WP_036429154.1 MULTISPECIES: VOC family protein [Mycobacterium]	100	99.4	5.27e-118
NZ_LQOO01000070.1_38|43972|44835|1|ID=1_38;partial=00;start_type=ATG;rbs_motif=None;rbs_spacer=None;gc_cont=0.685	WP_008254400.1 MULTISPECIES: alpha/beta fold hydrolase [Mycobacterium]	100	99.7	3.26e-208
NZ_LQOO01000070.1_39|44845|45867|-1|ID=1_39;partial=00;start_type=ATG;rbs_motif=AGGAG/GGAGG;rbs_spacer=11-12bp;gc_cont=0.674	WP_009953426.1 MULTISPECIES: phosphogluconate dehydrogenase (NAD(+)-dependent, decarboxylating) [Mycobacterium]	100	99.7	1.33e-245
NZ_LQOO01000070.1_40|45884|47293|-1|ID=1_40;partial=00;start_type=TTG;rbs_motif=GGAGG;rbs_spacer=5-10bp;gc_cont=0.665	WP_042910936.1 glucose-6-phosphate dehydrogenase [Mycobacterium intracellulare]	100	99.8	0.0
NZ_LQOO01000070.1_41|47425|48249|1|ID=1_41;partial=00;start_type=ATG;rbs_motif=AGGA;rbs_spacer=5-10bp;gc_cont=0.678	WP_036428593.1 MULTISPECIES: adenylate/guanylate cyclase domain-containing protein [Mycobacterium]	100	99.6	1.51e-189
NZ_LQOO01000070.1_42|48201|48410|-1|ID=1_42;partial=00;start_type=ATG;rbs_motif=None;rbs_spacer=None;gc_cont=0.695	WP_072501223.1 MULTISPECIES: hypothetical protein [Mycobacterium]	100	98.6	1.40e-40
NZ_LQOO01000070.1_43|48422|49240|1|ID=1_43;partial=00;start_type=ATG;rbs_motif=GGA/GAG/AGG;rbs_spacer=5-10bp;gc_cont=0.665	WP_089152381.1 guanylate cyclase [Mycobacterium intracellulare]	99.1	83.2	5.48e-166
NZ_LQOO01000070.1_44|49254|50108|1|ID=1_44;partial=00;start_type=GTG;rbs_motif=GGxGG;rbs_spacer=5-10bp;gc_cont=0.648	WP_308011518.1 SAM-dependent methyltransferase [Mycobacterium intracellulare]	100	99.6	4.65e-211
NZ_LQOO01000070.1_45|50146|50469|-1|ID=1_45;partial=00;start_type=ATG;rbs_motif=AGxAGG/AGGxGG;rbs_spacer=5-10bp;gc_cont=0.617	WP_036454806.1 MULTISPECIES: putative quinol monooxygenase [Mycobacterium]	100	99.1	1.21e-74
NZ_LQOO01000070.1_46|50832|51227|-1|ID=1_46;partial=00;start_type=TTG;rbs_motif=AGxAG;rbs_spacer=5-10bp;gc_cont=0.760	WP_369798894.1 MULTISPECIES: peptidoglycan endopeptidase [Mycobacterium]	99.2	99.2	9.02e-52
NZ_LQOO01000070.1_47|51619|51963|1|ID=1_47;partial=00;start_type=TTG;rbs_motif=None;rbs_spacer=None;gc_cont=0.710	WP_225330724.1 hypothetical protein [Mycobacterium intracellulare]	92.1	99.1	7.22e-50
NZ_LQOO01000070.1_48|52037|52378|-1|ID=1_48;partial=00;start_type=ATG;rbs_motif=GGAG/GAGG;rbs_spacer=5-10bp;gc_cont=0.725	WP_051445844.1 hypothetical protein [Mycobacterium intracellulare]	100	99.1	2.46e-82
NZ_LQOO01000070.1_49|52561|52929|-1|ID=1_49;partial=00;start_type=ATG;rbs_motif=None;rbs_spacer=None;gc_cont=0.615	WP_036454801.1 MULTISPECIES: type II toxin-antitoxin system VapC family toxin [Mycobacterium]	100	99.2	1.90e-76
NZ_LQOO01000070.1_50|52926|53123|-1|ID=1_50;partial=00;start_type=ATG;rbs_motif=GGAGG;rbs_spacer=5-10bp;gc_cont=0.692	WP_036455532.1 MULTISPECIES: type II toxin-antitoxin system VapB family antitoxin [Mycobacterium]	100	98.5	1.31e-32
NZ_LQOO01000070.1_51|53218|53616|-1|ID=1_51;partial=00;start_type=ATG;rbs_motif=AGGAG;rbs_spacer=5-10bp;gc_cont=0.667	WP_036454800.1 MULTISPECIES: VOC family protein [Mycobacterium]	100	99.2	1.02e-87
NZ_LQOO01000070.1_52|53695|54246|-1|ID=1_52;partial=00;start_type=ATG;rbs_motif=AGGAGG;rbs_spacer=3-4bp;gc_cont=0.611	WP_036454798.1 MULTISPECIES: VOC family protein [Mycobacterium]	100	99.5	7.84e-137
NZ_LQOO01000070.1_53|54282|54545|-1|ID=1_53;partial=00;start_type=GTG;rbs_motif=None;rbs_spacer=None;gc_cont=0.633	WP_065501123.1 type II toxin-antitoxin system RelE family toxin [Mycobacterium intracellulare]	97.7	98.9	1.60e-54
NZ_LQOO01000070.1_54|54542|54826|-1|ID=1_54;partial=00;start_type=ATG;rbs_motif=None;rbs_spacer=None;gc_cont=0.628	WP_020821851.1 MULTISPECIES: type II toxin-antitoxin system Phd/YefM family antitoxin [Mycobacterium]	100	98.9	9.23e-55
NZ_LQOO01000070.1_55|54914|55639|-1|ID=1_55;partial=00;start_type=GTG;rbs_motif=GGAG/GAGG;rbs_spacer=5-10bp;gc_cont=0.636	WP_051445843.1 aminoglycoside 3'-phosphotransferase [Mycobacterium intracellulare]	100	99.6	2.56e-182
NZ_LQOO01000070.1_56|55671|56744|-1|ID=1_56;partial=00;start_type=GTG;rbs_motif=None;rbs_spacer=None;gc_cont=0.657	WP_042910932.1 redox-regulated ATPase YchF [Mycobacterium intracellulare]	100	99.7	3.95e-242
NZ_LQOO01000070.1_57|56901|58019|1|ID=1_57;partial=00;start_type=GTG;rbs_motif=None;rbs_spacer=None;gc_cont=0.717	WP_179945068.1 MULTISPECIES: DUF6542 domain-containing protein [Mycobacterium]	99.7	99.7	5.38e-206
NZ_LQOO01000070.1_58|58065|59090|-1|ID=1_58;partial=00;start_type=GTG;rbs_motif=GGA/GAG/AGG;rbs_spacer=11-12bp;gc_cont=0.693	WP_042910931.1 4-hydroxy-3-methylbut-2-enyl diphosphate reductase [Mycobacterium intracellulare]	100	97.1	9.73e-235
NZ_LQOO01000070.1_59|59153|59752|1|ID=1_59;partial=00;start_type=ATG;rbs_motif=3Base/5BMM;rbs_spacer=13-15bp;gc_cont=0.672	WP_009953444.1 MULTISPECIES: lipid droplet-associated protein [Mycobacterium]	100	99.5	2.26e-128
NZ_LQOO01000070.1_60|59749|60996|1|ID=1_60;partial=00;start_type=GTG;rbs_motif=None;rbs_spacer=None;gc_cont=0.706	WP_009953445.1 MULTISPECIES: exodeoxyribonuclease VII large subunit [Mycobacterium]	100	99.8	5.63e-285
NZ_LQOO01000070.1_61|60986|61255|1|ID=1_61;partial=00;start_type=ATG;rbs_motif=GGAG/GAGG;rbs_spacer=5-10bp;gc_cont=0.663	WP_008254374.1 MULTISPECIES: exodeoxyribonuclease VII small subunit [Mycobacterium]	100	98.9	4.52e-55
NZ_LQOO01000070.1_62|61317|62417|1|ID=1_62;partial=00;start_type=ATG;rbs_motif=3Base/5BMM;rbs_spacer=13-15bp;gc_cont=0.649	WP_038535270.1 3-beta-hydroxysteroid dehydrogenase [Mycobacterium intracellulare]	100	99.7	1.14e-266
NZ_LQOO01000070.1_63|62414|63958|-1|ID=1_63;partial=00;start_type=ATG;rbs_motif=3Base/5BMM;rbs_spacer=13-15bp;gc_cont=0.693	WP_042910930.1 MULTISPECIES: carboxylesterase/lipase family protein [Mycobacterium avium complex (MAC)]	100	99.8	0.0
NZ_LQOO01000070.1_64|64017|67298|-1|ID=1_64;partial=00;start_type=ATG;rbs_motif=None;rbs_spacer=None;gc_cont=0.679	WP_101930836.1 non-ribosomal peptide synthetase [Mycobacterium intracellulare]	100	99.9	0.0
NZ_LQOO01000070.1_65|67549|68730|1|ID=1_65;partial=00;start_type=GTG;rbs_motif=GGAG/GAGG;rbs_spacer=5-10bp;gc_cont=0.649	WP_014381969.1 MULTISPECIES: glycosyltransferase [Mycobacterium]	99.7	99.7	5.56e-279
NZ_LQOO01000070.1_66|68738|69535|-1|ID=1_66;partial=00;start_type=ATG;rbs_motif=AGxAGG/AGGxGG;rbs_spacer=5-10bp;gc_cont=0.688	WP_042910928.1 dienelactone hydrolase family protein [Mycobacterium intracellulare]	100	99.6	6.48e-188
NZ_LQOO01000070.1_67|69548|70249|-1|ID=1_67;partial=00;start_type=ATG;rbs_motif=GGA/GAG/AGG;rbs_spacer=5-10bp;gc_cont=0.707	WP_008254364.1 MULTISPECIES: DUF4245 domain-containing protein [Mycobacterium]	100	99.6	1.85e-162
NZ_LQOO01000070.1_68|70431|71384|1|ID=1_68;partial=00;start_type=ATG;rbs_motif=GGAG/GAGG;rbs_spacer=5-10bp;gc_cont=0.679	WP_026071430.1 MULTISPECIES: class II fructose-bisphosphatase [Mycobacterium]	100	99.7	2.23e-222
NZ_LQOO01000070.1_69|71419|72825|1|ID=1_69;partial=00;start_type=ATG;rbs_motif=AGGA/GGAG/GAGG;rbs_spacer=11-12bp;gc_cont=0.685	WP_008254358.1 MULTISPECIES: class II fumarate hydratase [Mycobacterium]	100	99.8	0.0
NZ_LQOO01000070.1_70|72877|73863|1|ID=1_70;partial=00;start_type=ATG;rbs_motif=GGxGG;rbs_spacer=5-10bp;gc_cont=0.692	WP_014379382.1 MULTISPECIES: hypothetical protein [Mycobacterium]	100	99.7	3.84e-184
NZ_LQOO01000070.1_71|73877|75331|-1|ID=1_71;partial=00;start_type=ATG;rbs_motif=None;rbs_spacer=None;gc_cont=0.689	WP_008254355.1 MULTISPECIES: adenylate/guanylate cyclase domain-containing protein [Mycobacterium]	100	99.8	0.0
NZ_LQOO01000070.1_72|75381|76256|-1|ID=1_72;partial=00;start_type=GTG;rbs_motif=GGA/GAG/AGG;rbs_spacer=11-12bp;gc_cont=0.661	WP_008254353.1 MULTISPECIES: polysaccharide deacetylase family protein [Mycobacterium]	100	99.7	3.40e-212
NZ_LQOO01000070.1_73|76345|77646|-1|ID=1_73;partial=00;start_type=GTG;rbs_motif=AGGAG;rbs_spacer=5-10bp;gc_cont=0.681	WP_008254341.1 MULTISPECIES: PhoH family protein [Mycobacterium]	100	99.8	1.64e-309
NZ_LQOO01000070.1_74|77891|78718|-1|ID=1_74;partial=00;start_type=ATG;rbs_motif=None;rbs_spacer=None;gc_cont=0.664	WP_042911078.1 acyl-ACP desaturase [Mycobacterium intracellulare]	100	99.6	4.61e-202
NZ_LQOO01000070.1_75|78813|80141|-1|ID=1_75;partial=00;start_type=GTG;rbs_motif=GGA/GAG/AGG;rbs_spacer=11-12bp;gc_cont=0.706	WP_042910926.1 serine hydroxymethyltransferase [Mycobacterium intracellulare]	100	96.8	3.07e-304
NZ_LQOO01000070.1_76|80284|81156|1|ID=1_76;partial=00;start_type=ATG;rbs_motif=None;rbs_spacer=None;gc_cont=0.652	WP_008254336.1 MULTISPECIES: type I pantothenate kinase [Mycobacterium]	100	99.7	8.91e-206
NZ_LQOO01000070.1_77|81163|81588|-1|ID=1_77;partial=00;start_type=ATG;rbs_motif=AGGAG;rbs_spacer=5-10bp;gc_cont=0.664	WP_042910925.1 hypothetical protein [Mycobacterium intracellulare]	100	99.3	1.92e-85
NZ_LQOO01000070.1_78|81737|82531|-1|ID=1_78;partial=00;start_type=GTG;rbs_motif=AGxAGG/AGGxGG;rbs_spacer=3-4bp;gc_cont=0.674	WP_008254334.1 MULTISPECIES: (2Z,6E)-farnesyl diphosphate synthase [Mycobacterium]	99.6	98.9	3.92e-188
NZ_LQOO01000070.1_79|82707|83480|1|ID=1_79;partial=00;start_type=ATG;rbs_motif=None;rbs_spacer=None;gc_cont=0.673	WP_008254333.1 MULTISPECIES: PAQR family membrane homeostasis protein TrhA [Mycobacterium]	100	99.6	6.48e-184
NZ_LQOO01000070.1_80|83489|83872|-1|ID=1_80;partial=00;start_type=ATG;rbs_motif=None;rbs_spacer=None;gc_cont=0.656	WP_008254332.1 MULTISPECIES: nuclear transport factor 2 family protein [Mycobacterium]	100	99.2	1.36e-85
NZ_LQOO01000070.1_81|84020|86035|-1|ID=1_81;partial=00;start_type=ATG;rbs_motif=GGA/GAG/AGG;rbs_spacer=5-10bp;gc_cont=0.725	WP_020821831.1 MULTISPECIES: thioredoxin domain-containing protein [Mycobacterium]	100	99.9	0.0
NZ_LQOO01000070.1_82|86022|86339|-1|ID=1_82;partial=00;start_type=GTG;rbs_motif=GGA/GAG/AGG;rbs_spacer=5-10bp;gc_cont=0.708	WP_008254329.1 MULTISPECIES: hypothetical protein [Mycobacterium]	100	99.1	6.34e-67
NZ_LQOO01000070.1_83|86336|87208|-1|ID=1_83;partial=00;start_type=GTG;rbs_motif=GGA/GAG/AGG;rbs_spacer=5-10bp;gc_cont=0.690	WP_008254328.1 MULTISPECIES: mycothiol conjugate amidase Mca [Mycobacterium]	100	99.7	2.23e-221
NZ_LQOO01000070.1_84|87321|87755|1|ID=1_84;partial=00;start_type=ATG;rbs_motif=GGA/GAG/AGG;rbs_spacer=11-12bp;gc_cont=0.715	WP_036454762.1 MULTISPECIES: DUF4307 domain-containing protein [Mycobacterium]	100	99.3	8.41e-95
NZ_LQOO01000070.1_85|87975|88469|1|ID=1_85;partial=00;start_type=ATG;rbs_motif=AGGAG;rbs_spacer=5-10bp;gc_cont=0.665	WP_007168983.1 MULTISPECIES: transcription elongation factor GreA [Mycobacterium]	100	99.4	9.04e-111
NZ_LQOO01000070.1_86|88556|89734|-1|ID=1_86;partial=00;start_type=ATG;rbs_motif=GGA/GAG/AGG;rbs_spacer=5-10bp;gc_cont=0.702	WP_020821829.1 MULTISPECIES: cystathionine gamma-synthase [Mycobacterium]	100	99.7	4.55e-277
NZ_LQOO01000070.1_87|89746|90480|-1|ID=1_87;partial=00;start_type=ATG;rbs_motif=GGA/GAG/AGG;rbs_spacer=5-10bp;gc_cont=0.694	WP_042910924.1 RDD family protein [Mycobacterium intracellulare]	100	70.6	2.25e-118
NZ_LQOO01000070.1_88|90592|91998|-1|ID=1_88;partial=00;start_type=ATG;rbs_motif=GGA/GAG/AGG;rbs_spacer=11-12bp;gc_cont=0.704	WP_020821827.1 MULTISPECIES: cystathionine beta-synthase [Mycobacterium]	100	99.8	0.0
NZ_LQOO01000070.1_89|92034|93101|-1|ID=1_89;partial=00;start_type=ATG;rbs_motif=AGGA;rbs_spacer=5-10bp;gc_cont=0.703	WP_042910923.1 alpha/beta hydrolase [Mycobacterium intracellulare]	100	99.7	4.88e-251
NZ_LQOO01000070.1_90|93347|94309|1|ID=1_90;partial=00;start_type=GTG;rbs_motif=3Base/5BMM;rbs_spacer=13-15bp;gc_cont=0.745	WP_087139827.1 MULTISPECIES: SGNH/GDSL hydrolase family protein [Mycobacterium]	100	99.7	4.17e-223
NZ_LQOO01000070.1_91|94403|95620|1|ID=1_91;partial=00;start_type=ATG;rbs_motif=GGA/GAG/AGG;rbs_spacer=5-10bp;gc_cont=0.688	WP_008254309.1 MULTISPECIES: acetyl-CoA C-acetyltransferase [Mycobacterium]	100	99.8	1.90e-287
NZ_LQOO01000070.1_92|95818|96669|-1|ID=1_92;partial=00;start_type=GTG;rbs_motif=GGAG/GAGG;rbs_spacer=5-10bp;gc_cont=0.676	WP_026071427.1 MULTISPECIES: Bax inhibitor-1/YccA family protein [Mycobacterium]	100	99.6	3.39e-183
NZ_LQOO01000070.1_93|96906|97943|1|ID=1_93;partial=00;start_type=GTG;rbs_motif=GGAGG;rbs_spacer=5-10bp;gc_cont=0.679	WP_020821823.1 MULTISPECIES: enoyl-CoA hydratase/isomerase family protein [Mycobacterium]	100	99.7	3.81e-243
NZ_LQOO01000070.1_94|97957|98739|1|ID=1_94;partial=00;start_type=ATG;rbs_motif=AGxAGG/AGGxGG;rbs_spacer=5-10bp;gc_cont=0.678	WP_020821822.1 MULTISPECIES: enoyl-CoA hydratase [Mycobacterium]	100	99.6	2.31e-174
NZ_LQOO01000070.1_95|98748|100520|1|ID=1_95;partial=00;start_type=ATG;rbs_motif=AGGA;rbs_spacer=5-10bp;gc_cont=0.689	WP_009957777.1 MULTISPECIES: alpha/beta hydrolase [Mycobacterium]	100	99.8	0.0
NZ_LQOO01000070.1_96|100693|101178|1|ID=1_96;partial=00;start_type=ATG;rbs_motif=GGA/GAG/AGG;rbs_spacer=11-12bp;gc_cont=0.677	WP_020821821.1 MULTISPECIES: TetR/AcrR family transcriptional regulator [Mycobacterium]	100	99.4	1.14e-106
NZ_LQOO01000070.1_97|101375|101812|-1|ID=1_97;partial=00;start_type=GTG;rbs_motif=AGGA;rbs_spacer=5-10bp;gc_cont=0.744	WP_020821820.1 MULTISPECIES: rhodanese-like domain-containing protein [Mycobacterium]	100	99.3	3.16e-95
NZ_LQOO01000070.1_98|101809|102423|-1|ID=1_98;partial=00;start_type=ATG;rbs_motif=GGAG/GAGG;rbs_spacer=5-10bp;gc_cont=0.722	WP_225336874.1 MULTISPECIES: cysteine dioxygenase [Mycobacterium]	100	99.5	3.66e-150
NZ_LQOO01000070.1_99|102575|102994|1|ID=1_99;partial=00;start_type=GTG;rbs_motif=GGxGG;rbs_spacer=5-10bp;gc_cont=0.752	WP_020821818.1 MULTISPECIES: lipoprotein LpqV [Mycobacterium]	100	99.3	6.24e-90
NZ_LQOO01000070.1_100|103135|104166|1|ID=1_100;partial=00;start_type=GTG;rbs_motif=None;rbs_spacer=None;gc_cont=0.727	WP_172417491.1 MULTISPECIES: patatin-like phospholipase family protein [Mycobacterium]	99.7	99.7	2.47e-232
NZ_LQOO01000070.1_101|104192|105061|-1|ID=1_101;partial=00;start_type=GTG;rbs_motif=GGA/GAG/AGG;rbs_spacer=5-10bp;gc_cont=0.729	WP_054585067.1 patatin-like phospholipase family protein [Mycobacterium intracellulare]	100	99.7	3.31e-193
NZ_LQOO01000070.1_102|105086|105976|-1|ID=1_102;partial=00;start_type=ATG;rbs_motif=None;rbs_spacer=None;gc_cont=0.690	WP_042910920.1 class II glutamine amidotransferase [Mycobacterium intracellulare]	100	99.7	1.15e-217
NZ_LQOO01000070.1_103|106004|106477|-1|ID=1_103;partial=00;start_type=GTG;rbs_motif=GGA/GAG/AGG;rbs_spacer=5-10bp;gc_cont=0.694	WP_042910919.1 SRPBCC family protein [Mycobacterium intracellulare]	100	99.4	5.53e-113
NZ_LQOO01000070.1_104|106496|107554|-1|ID=1_104;partial=00;start_type=ATG;rbs_motif=AGxAGG/AGGxGG;rbs_spacer=5-10bp;gc_cont=0.684	WP_087139663.1 NAD(P)H-dependent amine dehydrogenase family protein [Mycobacterium intracellulare]	100	99.7	7.83e-256
NZ_LQOO01000070.1_105|107585|109216|-1|ID=1_105;partial=00;start_type=ATG;rbs_motif=AGxAGG/AGGxGG;rbs_spacer=5-10bp;gc_cont=0.681	WP_042910918.1 long-chain fatty acid--CoA ligase [Mycobacterium intracellulare]	100	99.8	0.0
NZ_LQOO01000070.1_106|109503|110600|-1|ID=1_106;partial=00;start_type=GTG;rbs_motif=AGxAGG/AGGxGG;rbs_spacer=5-10bp;gc_cont=0.701	WP_225336875.1 WD40 repeat domain-containing protein [Mycobacterium intracellulare]	100	99.7	9.97e-240
NZ_LQOO01000070.1_107|110998|111759|-1|ID=1_107;partial=00;start_type=ATG;rbs_motif=AGxAGG/AGGxGG;rbs_spacer=5-10bp;gc_cont=0.639	WP_042910917.1 DUF427 domain-containing protein [Mycobacterium intracellulare]	100	99.6	1.13e-191
NZ_LQOO01000070.1_108|111767|112039|-1|ID=1_108;partial=00;start_type=ATG;rbs_motif=GGA/GAG/AGG;rbs_spacer=5-10bp;gc_cont=0.696	WP_042910916.1 DUF6295 family protein [Mycobacterium intracellulare]	100	98.9	4.31e-58
NZ_LQOO01000070.1_109|112049|112804|-1|ID=1_109;partial=00;start_type=ATG;rbs_motif=AGGAG;rbs_spacer=5-10bp;gc_cont=0.718	WP_042910915.1 dienelactone hydrolase family protein [Mycobacterium intracellulare]	100	99.6	1.66e-183
NZ_LQOO01000070.1_110|112825|113622|-1|ID=1_110;partial=00;start_type=ATG;rbs_motif=None;rbs_spacer=None;gc_cont=0.675	WP_042910914.1 hypothetical protein [Mycobacterium intracellulare]	100	99.6	1.64e-181
NZ_LQOO01000070.1_111|113736|114956|-1|ID=1_111;partial=00;start_type=GTG;rbs_motif=AGGAG/GGAGG;rbs_spacer=11-12bp;gc_cont=0.677	WP_042910913.1 class I SAM-dependent methyltransferase [Mycobacterium intracellulare]	100	99.8	1.22e-304
